,hotel,review,stars
0, Abi Bali Resort & Villa,"Menyenangkan, tenang dan tempat yang magikal, sangat baik dan servis yang baik. Kami tinggal di vila dengan ruang keluarga yang indah seluar skira-kira 30 m2 di udara terbuka dan memiliki kolam renang sendiri. untuk mencapai laut butuh 10-15 menit, mereka menawarkan kendaraan shuttle jika kita memintanya.   Ada tempat jualan makan dekat dan dapur yang lengkap dengan semua fasilitasnya sehingga anda bisa memasak sendiri disini",5
1, Abi Bali Resort & Villa,"Kami tinggal di kamar bukan vila.  Tarifnya hampir $100 US sehingga saya mengharapkan resor yang bagus tetapi ternyata sangat buruk.  Letaknya jauh dari mana-mana sehingga Anda dipaksa untuk memakai bis antar jemput ke pantai.  Seluruh tempat ini tidak ada suasana khusus hanya beton dimana-mana.  Sarapan pagi merupakan usaha yang buruk untuk menyajikan makanan gaya barat alih-alih makanan Indonesia.  Ada resor lebih baik dengan harga separuhnya di dekat sana...oh, saya hampir lupa tentang suara bising air terjun buatan yang sangat mengganggu dan membuat putus asa sampai mereka mematikannya pada jam 6 sore.",1
2, Abi Bali Resort & Villa,"shhhhh! ada harga orang indonesia    ^ ^  pilihan menu breakfastnya banyak sekali..... very nice, rasa dan bobotnya juga memuaskan. dekat sekali dgn Muaya beach, Jimbaran.  ranjang besarrrr, cable channel cukup banyak, very nice bathroom (like it****)  good service!",4
3, Abi Bali Resort & Villa,"* Kebahagiaan Murni *  Memesan properti villa yang indah ini melalui Escapes Club dan saya harus mengakui itu tidak mengecewakan saya! ! Sebagai orang India, sangat menyambut untuk melihat idola tuan Ganesha tepat di pintu masuk dan kamar mereka juga dinamai dengan mengambil beberapa kata dan elemen bahasa Hindi / Sansekerta. Kolam renang sangat besar dan memiliki ruang yang baik untuk balita muda yang suka menikmati di kolam renang. Ukuran kamarnya besar karena masing-masing villa! Saya percaya mereka memiliki bak mandi pribadi di setiap villa atau suite yang luar biasa! Mereka memelihara kolam kecil dengan ikan-ikan di dekat spa mereka dan ikan-ikan itu besar dan berwarna-warni dan memberikan pemandangan yang menenangkan bagi semua orang dan khususnya bagi anak-anak yang…",4
4, Abi Bali Resort & Villa,"Sudah termasuk makan malam gratis di restoran hotel pada hari Senin kualitas sangat buruk. Mencoba lagi pada Sabtu malam dan kami masih memiliki voucher makanan gratis tetapi karena makanan gratis pertama sangat buruk kami memutuskan untuk membayar dan memilih dari menu, kali ini makanan yang lebih buruk. Saya tidak akan merekomendasikan siapa pun untuk makan di sini. Sangat sangat kecewa.",1
5, Abi Bali Resort & Villa,"Setelah menghabiskan seminggu di Ubud sibuk yang gila, tempat ini indah dan menakjubkan. Itu murah mengingat betapa indahnya vila-vila itu. Kami tinggal di satu kamar tidur villa (marma 5) dan menyukainya, itu sangat bersih dan rapi. Staf sangat ramah dan membantu. Sarapannya enak. Saya pikir itu jauh lebih jauh ke pantai itu adalah 10 - 15 menit berjalan kaki tetapi jalan cukup sibuk sehingga kami baik menggunakan transfer hotel ke pantai atau mendapatkan taksi taksi adalah 30, 000 - 50, 000 IDR yaitu sekitar 2/3 Akan sangat merekomendasikan. Terima kasih atas kunjungan kami yang luar biasa!",5
6, Abi Bali Resort & Villa,"Saya dan mitra saya tinggal di Abi Bali selama sepuluh hari dan pengalaman itu, dari waktu transfer inklusif kami dari bandara ke hotel dan kembali ke sana setelah kami tinggal, luar biasa. Kami berada di Bali untuk menghadiri pernikahan keluarga dan saya mengakui keengganan, pada awalnya, untuk kembali ke Indonesia karena beberapa pengalaman masa lalu yang sangat tidak menyenangkan di bagian lain negara ini. Terus terang, saya lebih suka menghabiskan dana perjalanan kami di tujuan lain. Kami telah memesan suite dan, pada saat kedatangan menemukan bahwa akomodasi sangat sesuai dengan kebutuhan dan harapan kami - namun, karena kondisi fisik serius yang diderita oleh pasangan saya, akses menjadi sangat sulit karena tangga yang panjang. Seorang anggota manajemen segera memindahkan…",4
7, Abi Bali Resort & Villa,"Sayangnya saya tinggal di sini dengan pacar saya hanya satu malam tapi kami jatuh cinta dengan struktur ini dan pantai Jimbaran di mana antara lain kami makan dengan sangat baik.  Benar-benar direkomendasikan, jangan ragu untuk memilih hotel ini! ! ! ! Kolam renang dan dijamin santai.",5
8, Abi Bali Resort & Villa,"Kami senang datang ke resor Abi Bali pada bulan Juli. Ada pertanyaan dan tolong bantu. Saya datang ke sini dengan anak-anak. Dan saya khawatir tentang kolam renang. Apakah semua pintu terbuka segera ke kolam renang? Ada pintu geser dari ruang cinta, mungkinkah kita mengunci pintu dengan kunci? Jika kamu punya satu? Terima kasih Suzan",5
9, Abi Bali Resort & Villa,"Kami telah tinggal di hotel ini selama 3 malam, kamar dan kamar mandi bagus, hanya perbaikan terakhir dibuat mungkin 15 tahun yang lalu. Kamar mandi memiliki atap terbuka sehingga selalu ada beberapa kadal di dalamnya. Stafnya ramah. Sarapan bisa lebih baik. Kami menggunakan layanan untuk menyewa skuter dari hotel ini yang sangat buruk, tanpa rem dan speedometer rusak, seorang pria dari resepsionis tidak sangat senang ketika saya melaporkan tentang masalah ini dan tidak ada yang lain untuk menawarkan sehingga kami harus memesan yang lain tempat yang berbeda.",3
10, Abi Bali Resort & Villa,"Saya setuju dengan semua ulasan positif lainnya dan tidak setuju dengan yang negatif. Stafnya luar biasa dan kebanyakan berbicara bahasa Inggris. Satu-satunya kekecewaan saya akan dengan menu makan malam. Ini sangat terbatas dan tidak menarik sama sekali. Kami hanya menginap 3 malam, makan malam dua yang pertama dan pergi ke Jimbaran malam ini ke restoran (Cuca) yang direkomendasikan oleh Abi Bali, itu luar biasa.",5
11, Abi Bali Resort & Villa,"Di mana saya memulai. Segala sesuatu tentang Abi Bali resort dan Villa sempurna. Kami tinggal di villa dengan kolam renang pribadi yang sempurna setelah hari yang panjang di bawah terik matahari! Sangat bersih dan sangat nyaman. Mereka semua melakukan pekerjaan hebat membersihkan vila setiap pagi. Kami menyukai lokasi seperti itu bagus dan tenang tapi tidak terlalu jauh dari pantai dan begitu banyak tempat yang bagus untuk makan! Makanan di hotel juga bagus dan harga yang luar biasa. Spa adalah brilian dan mampu memiliki sebelum atau setelah hari kegiatan Anda sempurna. Jika Anda ingin perawatan spa setelah spa ditutup, mereka akan datang ke kamar Anda dan melakukannya di sana. - luar biasa! Aku bisa terus dan terus tentang betapa hebatnya tempat ini. Tetapi hal terbaik tentang…",5
12, Abi Bali Resort & Villa,"Layanan yang baik, staf yang ramah, baik dilindungi dari kebisingan di luar, kamar yang bagus dengan lebih dari cukup ruang dalam kasus alteady Deluxe. Seluruh fasilitas sangat bersih! Benar-benar bernilai uang untuk tinggal.",5
13, Abi Bali Resort & Villa,"Keluarga kami dari empat tinggal di villa yang sangat luas dan bagus (Tresna X) termasuk kolam renang besar dan taman. Secara keseluruhan kami sangat menikmati menginap kami di sini. Ada banyak ruang di vila dan daerah, sehingga liburan yang santai.   Satu-satunya hal yang tidak sampai ke standar yang tinggi dalam pendapat kami adalah dapur. Layanan saat makan malam sangat lambat (1 . 30 h! ) meskipun ada hanya 4 orang di restoran dan kualitas biasa-biasa saja di terbaik.   Ketika pemesanan resor ini harus menyadari bahwa mobil yang diperlukan untuk mendapatkan di mana saja (layanan antar jemput disediakan oleh hotel untuk e. g. Jimbaran Bay beberapa kali per hari).",4
14, Abi Bali Resort & Villa,"Hotel itu sendiri adalah sangat bagus. Harga bagus untuk kualitas itu. Kamar yang besar dengan kamar mandi yang besar, besar tempat tidur yang sangat nyaman, TV, semua sangat bagus terlepas dari warna dan tekanan air di wastafel dan toilet. Bahkan ketika kami melaporkan bahwa mereka tidak melakukan apa-apa dengan itu. Sarapan yang lezat di restoran.  Itu pasti nilai untuk uang.",4
15, Abi Bali Resort & Villa,"Kami tinggal di Villa 1 Kamar tidur ini Marma 2. luar biasa termasuk kolam renang pribadi, kamar mandi luar ruangan besar dengan bak mandi dan shower. Besar dan nyaman tempat tidur di kamar besar dengan dua pintu yang mengarah ke kolam renang. Anda dapat benar-benar keluar dari tempat tidur dan melompat ke kolam renang. Ruang Tamu yang besar dan terbuka dengan dapur. Ada juga taman kecil yang indah. villa yang sangat bersih. Staf sangat ramah, fasilitas yang bagus. Perawatan pijat yang tersedia.  Beberapa Tips - microwave tidak bekerja, sistem suara perlu perangkat yang terhubung dengan tali - tidak terhubung dengan baik. Membawa Anda sendiri tali yang terhubung ke perangkat suara anda. Salah satu transportasi gratis - Kami pergi ke Jimbaran Bay untuk seafood pesta di mana Anda…",5
16, Abi Bali Resort & Villa,"12 keluarga, tinggal 5 malam pada bulan Juni.  Villa yang luas dan dilengkapi dengan baik, dengan mandi/kamar mandi semi terbuka.  Selain kolam renang di setiap villa keluarga kami juga memiliki akses ke dua kolam renang utama.  Vila ini perlu beberapa perabot untuk luar ruangan atau. Kacang tas, karena pilihan hanya dua kursi untuk berjemur atau restoran.   Sudah termasuk sarapan yang agak rata-rata oleh standar Barat, Holandaise saus yang mengerikan.  Namun pilihan makanan Indonesia yang sangat baik.  Ada diisi dengan baik mini - supermarket di sebelah kompleks, yang memiliki buah segar dll Jika anda membutuhkannya.  Kami menyewa skuter untuk mendapatkan sekitar, karena area ini tidak cocok untuk berjalan jarak jauh.  Sangat merekomendasikan 'opium' hanya 1 km di jalan menuju…",5
17, Abi Bali Resort & Villa,"Semuanya sangat bagus! Staf sangat baik dan mereka membantu anda dengan segala sesuatu! Ada shuttle ke pantai. Area kolam renang sangat bagus dan romantis! Ada beberapa kolam renang, sehingga Anda selalu memiliki tempat yang cukup! Tidak ada yang kami tidak suka!",5
18, Abi Bali Resort & Villa,"Sangat direkomendasikan untuk perjalanan bisnis dengan kesenangan. Staf yang sopan, rapi dan bersih, kamar sangat luas, tempat tidur yang nyaman. Dalam ringkasan tempat yang sangat bagus untuk tinggal. Pasti akan menginap lagi di kunjungan saya berikutnya.",4
19, Abi Bali Resort & Villa,"Untuk pelancong yang berpengalaman, menghabiskan $100 Australia malam untuk tempat tidur ganda yang besar, nyaman dan bergaya, dengan kolam renang pribadi dan sarapannya sudah termasuk murah. Baik ini adalah apa yang Anda dapatkan di ABI Bali. Terletak 20 'di selatan bandara, 20' barat Nusa Dua dan 20' sebelah utara Pura Uluwatu. Orang-orang luar biasa, sangat membantu dan ramah, layanan yang sempurna. Tidak diragukan lagi beberapa lukisan segar dalam pesanan. Satu-satunya kekurangan adalah makanan (bukan orang) di restoran. Koki yang lebih baik akan membuat perbedaan besar. Itu tidak dapat diandalkan untuk bahkan mencoba itu tetapi tentu saja tidak memberikan nilai tambah ke perusahaan.  Secara Keseluruhan. Saya pasti akan merekomendasikan tempat ini untuk semua orang.  Besar…",4
20, Abi Bali Resort & Villa,"Resor ini sangat besar dan ada area vila berdiri sendiri dengan lokasi splited setiap orang lain.  Gaya modern dan tradisional yang dipadukan menjadi sebuah resor yang indah.  Kolam renang pribadi untuk setiap villa tersedia.  Kamar sangat besar, kamar mandi yang indah, nyaman dan bertingkah. Direkomendasikan untuk pasangan dan juga keluarga",4
21, Abi Bali Resort & Villa,"Indah tempat yang tenang untuk beristirahat dan bersantai, kami tinggal 2 malam di sebuah kamar besar dengan kamar mandi luar ruangan yang lebih besar lagi - kamar mandi terbesar yang pernah saya lihat.   Lebih besar tempat tidur ukuran raja adalah perusahaan tapi nyaman dengan banyak bantal.   Kamar memiliki bau apak tetapi ini tidak mengganggu.   Staf yang ramah, taman yang indah dan tempat ini pasti memberikan damai dan tenang setelah kami.   Kami memiliki satu masalah - meskipun kecil, kami tidak memiliki masalah dengan itu semut gula kecil di dalam kamar. Kami memesan layanan kamar dua kali selama kami tinggal dan layanan kamar permintaan kami meninggalkan piring di luar pintu kami dan menelepon untuk memberitahu mereka siap untuk koleksi, ini dengan cepat menjadi oleh…",4
22, Abi Bali Resort & Villa,Jika Anda mencari untuk menghabiskan sedikit ekstra dan mendapatkan diri Anda dengan villa ini adalah tempat yang tepat. Staf terbaik yang memenuhi semua kebutuhan anda kapan saja. Hanya kejatuhan adalah tidak dalam kondisi terbaik linen tetapi tempat ini indah hanya dari Jalan utama jadi tidak terlalu banyak lalu lintas tetapi di tempat yang ideal di Legian. Sarapan setiap hari dengan kembali ke villa anda memperlakukan di sore hari. Pasti akan kembali. sangat manis!,4
23, Abi Bali Resort & Villa,"Pertama kali ke Jimbaran dan kami memutuskan untuk menginap di ABI Bali karena semua ulasan yang baik.   Kami tinggal di kamar suite yang memiliki kamar mandi di luar dan benar-benar menikmati kami tinggal. Staf indah, kamar bersih dan sarapan besar setiap pagi.   Kami akan senang untuk tinggal lagi.   Salam",5
24, Abi Bali Resort & Villa,"Kami tinggal di sini dan memiliki waktu yang hebat. Staf sangat baik dan ramah, pelayanan yang baik, makanan yang baik juga. Di pagi hari bangun di sini beberapa roosted seperti di desa, yang sangat jauh dari turis mulai dari Kuta.",5
25, Abi Bali Resort & Villa,"Saya dan keluarga saya memesan 2 kamar tidur untuk 3 malam dengan Abi Bali Resort & Villa di bulan Januari tahun ini. Villa 2 kamar tidur ini adalah mungkin yang paling cocok dengan tipe villa yang saya mencari di bagian selatan Bali.   Pertama, di 2 kamar tidur vila memiliki area umum yang cukup membantu mencegah kita dari mendapatkan gigitan nyamuk dan tidak perlu takut hujan lebat karena musim hujan. Dan selama pencarian saya untuk akomodasi. Saya menyadari bahwa hanya ada beberapa vila menawarkan area umum di dalam ruangan. Selain itu, hotel ini sangat bersih dan tidak penuh sesak dengan banyak tanaman sehingga dekat dengan nyamuk gratis. Dan Villa sangat luas.   Kedua, Villa memiliki kolam renang pribadi ukuran yang ideal. Saya telah melihat beberapa villa dengan kolam…",4
26, Abi Bali Resort & Villa,"Kami tinggal 3 malam di ABI Bali, untuk mengakhiri 3 minggu liburan di Indonesia. Dan apa pilihan yang baik itu!  Kamar Deluxe sangat besar, dan tempat tidur adalah besar, dan sangat nyaman! Kamar mandi adalah sangat menyenangkan. Bak mandi dan wastafel memiliki atap, tapi kamar mandi di luar. (Hanya perlu untuk menutup pintu, jadi tokek tidak akan bisa pergi.) sangat menyenangkan untuk mandi di bawah skyes setiap pagi. Sarapan adalah benar-benar besar dan kami merasa dimanjakan oleh banyaknya pilihan. Dari Continental, Amerika, Inggris, Vegetarian. Pasti mengatur kami untuk hari libur. Kolam renang yang sangat bersih, dan ada banyak sunbeds yang tersedia. Pantai Jimbaran adalah dekat, dan ada layanan antar-jemput gratis yang pergi ke sana, di taksi tidak mahal.  Staf yang…",5
27, Abi Bali Resort & Villa,"Kami berada di sini untuk bulan madu kami, tempat yang bagus untuk menginap, bagus dan tenang, dengan hampir ""pribadi"" kolam renang per villa dan kamar besar. Staf sangat ramah dan restoran hotel juga bagus! Dekat pantai Jimbaray famouse restoran.",5
28, Abi Bali Resort & Villa,"Kami tidak memesan villa, tapi di kamar deluxe. Kamar sangat bersih dan luas, tempat tidur besar dan kamar mandi adalah sesuatu untuk pengalaman dengan luar ruangan mandi dan bak mandi.  Ada dua kolam renang besar, gym kecil dan sarapan adalah benar-benar bagus dan anda dapat memilih antara banyak makanan yang berbeda. Staf sangat membantu dan anda dapat memesan sepeda motor dengan mereka, menikmati gratis ke pantai atau kegiatan lainnya. Saya merekomendasikan tempat ini karena itu adalah tempat yang bagus untuk mengunjungi di selatan kuta dengan sepeda motor.",5
29, Abi Bali Resort & Villa,"Aku tinggal di sana untuk hanya satu malam hanya dalam perjalanan kembali ke australia tapi berharap aku bisa tinggal lebih lama.  Vila ini berlokasi di selatan kuta di daerah jimbaran, lokasi yang sempurna untuk siapa saja yang suka damai dan tenang dan ingin menjauh dari kebisingan dari dari kuta, tapi ada masih dekat dengan beberapa baik luar ruangan tempat makan dan pantai (kurang dari 10 menit berkendara skuter).  Check-in sangat mudah dan cepat, staf menyambut kami dengan minuman segar handuk dan kemudian pergi ke villa kami. Kamar sangat besar dan tempat tidur dan kamar mandi.   Tidak ada atap di kamar mandi sehingga anda dapat melihat bintang-bintang sementara mandi, bak mandi adalah cukup besar dibandingkan dengan beberapa tempat yang pernah saya telah di masa lalu,…",5
30, Abi Bali Resort & Villa,"Kami tinggal di dua kamar tidur vila dengan kolam renang pribadi. Hotel ini sangat bagus! Kolam renang pribadi adalah cukup besar bahwa kita bahkan tidak perlu untuk pergi ke semua kolam renang resor.   Sarapan adalah tidak sangat baik, tapi itu penuh kami sampai makan siang.",4
31, Abi Bali Resort & Villa,"Menginap selama 2 malam di abi bali di perjalanan kami di sekitar pulau. Tempat yang sangat baik untuk memulai liburan kami yang sangat nyaman & bersih comforble makanan yang sangat menyenangkan, & staf yang sangat ramah. Memiliki kolam renang untuk diri kita sendiri selama kami tinggal gratis kesopanan bus ke desa adalah bonus meskipun hanya satu cara apa lagi yang bisa anda meminta... ",5
32, Abi Bali Resort & Villa,Kami tinggal di sini selama 2 malam di kamar deluxe. Kamar sangat besar dan banyak kamar. Kamar mandinya bagus dengan shower luar ruangan. Kami memiliki kolam renang untuk diri kita sendiri untuk hari kedua kami berada di sana. Makanan yang sangat baik dan sangat lezat.,5
33, Abi Bali Resort & Villa,"Kami tinggal di 2 untuk 2 hari kemudian Marma Marma 5 untuk sisa liburan dan menikmati layanan dan staf yang sangat ramah dan menyenangkan.   Pak bagus dari pemesanan tim sangat membantu dan menampung ketika kita diminta untuk mengubah ke villa karena vila pertama kami tidak bisa mendapatkan yang baik untuk berjemur karena pohon yang menghalangi sinar matahari dan tidak bisa bergerak di kursi. Juga memastikan untuk membuat kami tinggal kenangan dengan bunga untuk kedua kalinya villa di tempat tidur dan bak mandi.   Hotel ini memiliki pilihan yang baik dari makanan di menu mereka namun alkohol ini sangat terbatas dan tidak koktail, tapi itu masih bagus karena memiliki dapur kecil kami dapat membeli dari luar dan hanya diperlukan untuk meminta es dari layanan kamar. Memesan…",4
34, Abi Bali Resort & Villa,"Menginap 10 hari di salah satu satu kamar tidur vila kolam renang. Mencintai tempat ini. Meskipun saya tidak berpikir saya akan menikmati itu lebih jika aku harus tinggal di salah satu kamar dengan kolam renang umum. Udara terbuka kamar mandi memerlukan sedikit waktu untuk mendapatkan digunakan untuk, tapi aku datang untuk mencintai tempat ini. Pasti perlu untuk membersihkan setiap hari. Saya menjelaskan tempat untuk seorang teman (hanya setengah bercanda) bahwa abi bali adalah seperti sebuah oasis di tengah dari pembuangan sampah. Di dalam dinding senyawa anda dihapus dari squaler daerah sekitarnya. Sulit untuk berjalan di mana saja, bahkan saya tidak akan merekomendasikan hotel ini, itu terlalu berbahaya dengan tidak ada jalan setapak. Taksi sangat mudah didapat dan murah.…",5
35, Abi Bali Resort & Villa,"Kami telah tinggal di banyak vila di bali, dan yang satu ini harganya sangat baik. Vilanya sedikit jauh dari pusat perbelanjaan dan pantai. Ada shuttle ke pantai jimbaran/2 jam setiap toko. Kolam renang terutama mengesankan. Ini adalah setidaknya 12 stroke yang lama. Masalah adalah tempat tidur berjemur di salah satu ujung dan langkah ke kolam lainnya. Ruang adalah baik dilengkapi dengan sistem suara yang bagus tapi dengan beberapa peralatan memasak dan makan. Hotel ini terletak tinggi dan mendapat beberapa angin, menghadap ke kolam renang.",4
36, Abi Bali Resort & Villa,"Menghabiskan beberapa malam di sini dan menikmati kami tinggal. Kamar di lantai pertama adalah sangat bagus, dengan tempat tidur besar dan kamar mandi. Kamar mandi adalah agak aneh set, udara terbuka kamar mandi besar tetapi ketika hujan turun toilet akan mendapatkan basah. Lampu taman di sepanjang malam dan tirai kayu dapat digunakan terlalu banyak cahaya. Itu tidak ada tempat untuk menggantung pakaian basah di mana saja di kamar. Tidak ada balkon atau teras di kamar tidur satu kamar, untuk duduk di luar. Makanan di restoran sangat baik, makanan yang masuk akal dan ukuran yang baik. Bir adalah terlalu panas untuk minum. Restoran perlu juga beberapa langit-langit atau alas penggemar, karena terbuka dan sangat panas. Staf di restoran sangat ramah dan penuh perhatian. Sarapan a la…",4
37, Abi Bali Resort & Villa,"Saya dan istri saya tinggal satu malam di abi bali resort & villa. Kami berencana untuk tinggal di hotel ini sejak peralihan kami tiba di malam hari, ternyata hotel ini jauh melebihi harapan kita.   Lokasi tidak sangat baik. Hotel ini tidak dekat dengan pantai. Toko serba ada terdekat adalah 10 menit dengan berjalan kaki, anda harus naik taksi,   Makanan di kantin hanya di permukaan saja. Istri saya memesan satu nasi goreng lokal, yang cukup bagus. Sementara pizza saya pesan adalah terlalu keras.   Kamar yang indah, sangat besar, terlihat bersih dan rapi. Namun, ada beberapa masalah dengan sistem air panas di malam hari kami tinggal. Kami menelepon untuk membantu, tetapi diberitahu untuk menunggu untuk satu jam untuk air panas. Itu sangat terlambat di malam hari, kami merasa…",4
38, Abi Bali Resort & Villa,"Bagus...  Villa kami tinggal di adalah sangat luas dan memiliki suasana yang bagus. Tempat ini dilengkapi dengan teater rumah kecil di kamar tidur dan sistem suara di ruang makan. Tempat tidur adalah dua matras tunggal (besar) dan itu sangat luas.   Beberapa staf yang sangat ramah dan menyediakan kami dengan informasi tentang villa.   Properti ini sangat tenang dan hanya 5 menit berkendara ke rock bar. Non-makanan sarapan cukup baik dan harga terjangkau. Tempat tidur dan linen yang bersih dan sebagian besar dari villa kami.   Menyukai kamar mandi semi outdoor.   Pada umumnya kami menyukai tempat ini, tapi itu membutuhkan beberapa perbaikan untuk fasilitas dan layanan.  Yang buruk...  Freezer di kulkas tidak bekerja. Kami memesan es batu dan untuk pertama kalinya dalam pengalaman…",4
39, Abi Bali Resort & Villa,"Hotel yang cukup bagus - bersih dan rapi. Namun, terlalu jauh dari apa pun (kami memesan tidak cukup tahu apa yang ini berarti - waktu perjalanan tambahan, biaya tambahan) Ruang makan adalah tidak pengalaman yang baik - memasak makanan yang cukup sering dingin. Tidak ada tambahan di kamar - hanya dasar-dasar. Kebanyakan staf cukup ramah.",3
40, Abi Bali Resort & Villa,"Kami tinggal di sini di semua kejujuran villa sangat baik, jika kami bisa tidur dengan nyenyak. Ekor kucing yang ada di kamar mandi untuk pertama 3 malam kami tinggal mereka menangis semua malam yang tersembunyi di belakang toilet sehingga kami tidak bisa mendapatkan mereka keluar. Pada kedatangan kami kami diberitahu bahwa sarapan akan diantar ke vila di pagi hari, kami mengira bahwa ruang makan itu penuh jadi setuju, sarapan pagi pertama tiba dan dingin kami menelepon layanan meja butuh lebih dari setengah jam bagi mereka untuk kembali dan menghapus it. lain setengah jam mereka kembali dengan 4 lain yang tidak bisa dimakan sebagai sarapan tidak hangat dan memiliki rambut di telur yang besar. Ketika kita mengeluh kami diberitahu bahwa itu adalah karena mereka harus…",1
41, Abi Bali Resort & Villa,"Abi bali memiliki kamar bersih & staf yang ramah dan membantu. Sedikit keluar dari jalan jadi perlu transportasi untuk pantai dan toko-toko - bus gratis yang tersedia tapi lucunya akan menurunkan tetapi tidak mengangkat. Anda dapat berjalan kaki ke pantai, tetapi jika anda perlu untuk kembali ke atas bukit di resor membuat jalan kembali kurang menarik. Kamar luas, dengan segala sesuatu yang anda butuhkan.  Tidak ada akses untuk kursi roda atau cacat - semua kamar memiliki tangga untuk bernegosiasi. Wifi gratis - cukup baik sebagian besar waktu.  Daerah yang tenang. Layanan spa tersedia tetapi lebih mahal daripada toko bawah di jimbaran corner. Ketel dan lemari es yang disediakan sehingga anda dapat membuat anda sendiri teh dan kopi. Ac bekerja dengan baik.",4
42, Abi Bali Resort & Villa,"Mendapatkan jauh dari itu semua di sini. Kami memesan 2 tempat tidur yang memiliki kolam renang pribadi di luar ruang makan/dapur. Superior kamar tidur dan ruang tamu dengan tv. Sarapan memiliki beragam pilihan segar. Layanan antar jemput gratis ke pantai, kota tapi akan membayar untuk perjalanan pulang yang sekitar £1,50 taksi cukup murah jadi itu. wisata ke daerah lain tidak menjadi masalah. Waktu perjalanan berbeda tergantung pada lalu lintas, 25 - 45 menit dan £5 - 6.",4
43, Abi Bali Resort & Villa,"Kami menginap 2 malam di satu kamar tidur vila dan secara keseluruhan kami puas dengan hotel ini indah, sangat besar dan nyaman tempat tidur, kamar mandi adalah bersih dan besar, kolam renang yang bersih juga. Sarapan adalah besar dan staf hotel adalah sangat sopan. Kami memiliki hanya satu pengalaman buruk ketika mereka lupa untuk membuat kamar kami bahkan kami memberitahu mereka sebelum kami pergi di luar dan meninggalkan kunci, saat kami kembali dan memberitahu resepsionis bahwa mereka lupa untuk membersihkan kamar, layanan kamar segera datang dan membersihkan kamar kami. Nah ini hanya masalah kecil kami dan kami akan pasti datang kembali ke sini ketika kami mengunjungi bali lagi.  Bagi para wisatawan yang baru pertama kali mengunjungi bali, vila ini dekat sehingga tidak…",4
