,hotel,review,stars
87, Abi Bali Resort & Villa,"Kami memesan 3 villas di sini untuk liburan keluarga kami. Terletak di jimbaran. Dekat dengan kuta dan ubud. Mereka merencanakan untuk menghabiskan waktu mengunjungi objek wisata menarik yang di ubud dan jimbaran dapat mempertimbangkan tinggal di sini untuk menghindari kepadatan lalu lintas di kuta.   Vila itu sendiri adalah sebuah properti besar. Baik terus, bersih dan bagus tapi dibandingkan villa de daun di legian, yang ini terasa kurang mewah. Aku lupa untuk membawa saya pencukur dan saya terkejut mereka tidak memiliki apapun pencukur paket untuk pelanggan.   Sebagian besar karyawan ramah tetapi beberapa kasar dan tidak membantu. Kami sangat disayangkan untuk disambut oleh resepsionis yang tidak tahu apa senyum ini. Menyambut minuman dan handuk dingin yang besar.  Keluarga…",4
88, Abi Bali Resort & Villa,"Saya bekerja dengan resor untuk dijemput di bandara dan itu sangat nyaman dan mudah. Pengemudi yang sangat ramah dan baik, dan saya merasa aman dengan mengemudi, meskipun gila mengemudi yang terjadi di sekitar kita.   Setelah tiba di resort, saya disambut oleh staf yang sangat ramah untuk check-in dan kemudian ditunjukkan ke kamar saya. Saya tidak memilih salah satu kamar yang memiliki kolam renang sendiri, jadi saya memiliki 2 berdampingan kolam renang yang dipakai bersama dengan beberapa kamar. Saya benar-benar menikmati ini karena saya bepergian sendirian dan tidak merasa begitu terisolir cara ini. Kolam renang, tempat berjemur (hanya di atas kolam renang di platform) dan properti secara keseluruhan adalah indah, dengan subur, pemandangan tropis dan bagus dan tenang.   Kamar…",5
89, Abi Bali Resort & Villa,"Meskipun liburan saya adalah hanya untuk 3 hari, tinggal di abi bali adalah salah satu yang saya tidak akan pernah lupa. Privasi kami sendiri suite dengan kolam renang pribadi adalah hanya apa yang keluarga saya cari... damai dan tenang. Keramahan diperpanjang oleh staf adalah dihargai, dan mereka sangat ramah dan rendah hati. Kamarnya bersih dan kami memiliki perasaan berada di rumah kami yang sangat, penuh kehangatan dan pusing. Benar-benar layak pengalaman dan saya memiliki kesempatan untuk pergi kembali selama liburan yang berkesan dengan abi bali.",5
90, Abi Bali Resort & Villa,"Tempat itu indah dan sangat bersih, sejuk dan dilengkapi dengan baik. Kolam renang hebat juga menakjubkan udara terbuka kamar mandi, tapi sangat bersih. Staf yang sangat baik dan membantu terutama ketika saya meninggalkan sarung di belakang di lemari. Saya tidak dapat memikirkan banyak tempat lain dari bali yang akan memiliki kebijakan menjaga meninggalkan barang mereka dengan hati-hati untuk tamu dan abu bali adalah sebagai baik karena itu bisa. Terima kasih semua. Saya telah tidak ada masalah di merekomendasikan anda sangat!",5
91, Abi Bali Resort & Villa,Kolam vila adalah liburan yang sempurna. Mereka menawarkan lebih dari anda dapat mengharapkan. Fasilitasnya bagus. Makanan mungkin memerlukan sedikit upgrade meskipun. Tinggal di sana selama beberapa hari dan memiliki yang terbaik dari waktu saya. Kolam renangnya bersih dan dikelilingi oleh taman yang indah. Kamar mandi adalah dunia yang terpisah dan indah dihiasi... ,5
92, Abi Bali Resort & Villa,"Abi bali adalah terakhir kami berhenti untuk perjalanan kami di bali dan cara yang menyenangkan untuk melakukannya.  Kami tinggal di satu kamar tidur vila dan itu fantastis, itu sangat besar dengan kolam renang besar dan sangat pribadi. Tempat ini memiliki merasa santai yang bagus.  Hanya dua hal yang saya bisa kesalahan adalah kualitas makanan, itu hanya tidak besar dan ruangan berbau kelabang! Mungkin tidak masalah bagi sebagian besar tapi saya tidak suka bau. Hanya mengambil beberapa dupa (sholat tongkat) dan anda pasti akan tertawa.  Tidak mampu untuk mengunci pintu kamar mandi dari dalam kamar adalah terlalu sedikit menyeramkan.  Selain itu, ini pengalaman menginap yang sangat bagus.  Secara Keseluruhan. Saya akan merekomendasikan abi bali, hotel ini memiliki layanan…",4
93, Abi Bali Resort & Villa,"Menginap selama 2 hari, awal februari. Memesan terpisah villa dengan kolam renang pribadi. Vilanya bagus dan memberikan anda pribadi yang indah merasa. Tempat ini nyaman dan layanan baik. Mereka memiliki spa yang bagus dengan staf yang sopan. Tempat adalah 20 menit berjalan kaki dari pantai jimbaran.",4
94, Abi Bali Resort & Villa,"Pasangan saya & saya tinggal di sini selama beberapa malam sebagai kaki terakhir dari perjalanan hanya untuk bersantai sebelum kami menuju rumah... Dan bahwa kami lakukan di sini ruangan itu indah, mandi luar (mandi terbaik kami memiliki semua perjalanan) adalah awesome, nyaman tidur besar dan sangat tenang. Dengan perawatan spa terletak hanya turun tangga dengan staf yang ramah bersedia untuk membantu setiap kali, hanya tidak bisa pergi salah.",5
95, Abi Bali Resort & Villa,"Ini adalah perjalanan solo pertama saya dan saya menyesal tidak setelah melakukan ini sebelumnya. Lebih jadi karena tempat ini adalah jadi ramah dan mereka hanya memperlakukan pool villas! Terletak 10 menit dari pantai jimbaran, resor ini adalah seperti di rumah dan nyaman. Spa mereka juga sangat bagus! Mungkin sedikit mahal di 161 USD per malam termasuk pajak, tapi kolam renang pribadi dan area makan tertutup semuanya. Jika anda ingin beberapa tenang dan belum dekat dengan kegilaan, ini adalah pilihan utama!",4
96, Abi Bali Resort & Villa,"Saya dan 3 teman saya menghabiskan 3 malam di abi bali. sangat pribadi dan salah satu yang bagus.  2 kamar tidur pool villa: - Alasan utama saya memesan kamar ini adalah bahwa ada dapur. Kami meraih beberapa udang, ikan dan kepiting dari jimbaran pasar ikan dan dimasak di dapur kami. Namun, ada sangat sedikit sayuran toko di pasar ikan, ada 2 seperti yang saya ingat. jadi saya akan menyarankan anda untuk pergi ke supermarket terdekat Carrefore jika anda ingin mendapatkan beberapa sayuran atau barang-barang lainnya.   Sorot lain adalah bahwa atas atap pribadi kami villa terbuat dari rumput yang bersantai anda banyak terutama saat angin bertiup dari luar untuk ruang duduk (udara con adalah di atas), jadi saya dan teman saya sedang mudah tertidur ketika anda sedang mengobrol dan…",4
97, Abi Bali Resort & Villa,"sejauh ini, ini mungkin adalah tempat paling menyenangkan kami telah tinggal. Kamar sangat segar dan bersih, di luar mandi ensuite pribadi dengan shower hujan dan kamar mandi yang sangat baik. staf yang semua tersenyum dan ramah dan tidak bisa lebih ramah atau membantu. junior suite kami tinggal di adalah besar dan kolam renang tepat di luar pintu kami membuat anda merasa seperti anda yang terpencil dari segala sesuatu. Arsitektur bangunan yang sangat indah untuk melihat dengan semua ukiran dan patung. yang pasti harus tinggal ketika di bali",5
98, Abi Bali Resort & Villa,"Keluarga saya dan saya menghabiskan minggu natal di abi bali villa. Villa yang bagus, sangat pribadi. Makan di sana mungkin tidak itu forte tapi ini tempat yang bagus untuk tinggal dan memiliki waktu bersama keluarga. Ukuran kolam renang sangat bagus. Tepat waktu dan layanan kamar. Lokasi dekat untuk outlet makanan. Mungkin tidak sangat mudah diakses oleh kaki, tapi transportasi melalui taksi publik dan antar jemput disediakan oleh abi bali adalah mudah tersedia. Istri saya dan anak-anak benar-benar menikmati kami tinggal di sana.",4
99, Abi Bali Resort & Villa,"Saya akan bepergian dengan anak-anak 3 saya, acara hanya untuk satu malam untuk merayakan ulang tahun saya, kami benar-benar menikmati. Anak-anak menyukai kolam renang, awal pagi ketika saya terbangun dengan suami saya, mereka sudah berenang. kami mencintai liburan kami dan pasti akan kembali lagi",4
100, Abi Bali Resort & Villa,"Kamar kami sangat luas dan memiliki tempat tidur besar! Kami disambut dengan handuk dingin dan minuman gratis, staf membawa tas kami ke kamar kami dan menunjukkan kepada kita di sekitar ruangan. Kami memiliki shower terbuka yang sentuhan yang hebat! Dan kolam renang hanya beberapa langkah dari pintu depan kami (bersama dengan 3 kamar lain) staf sangat bagus dan cepat untuk membawa sesuatu yang kami butuhkan. Sarapan sangat baik dan lezat, dengan berbagai hal-hal untuk memilih dari. Tempat ini adalah sedikit jauh dari apa-apa dan harus mengandalkan taksi atau angkutan hotel. Selain itu tidak bisa kesalahan itu.",4
101, Abi Bali Resort & Villa,"Setelah enam jam penerbangan ini sangat bagus untuk memeriksa ke abi bali villas. Kami upgrade ke dua kamar tidur pool villa yang sangat besar! Kolam renang adalah ukuran yang layak, tempat tidur sangat nyaman dan staf sangat membantu dan bagus. Sekitar 10min berjalan kaki ke pantai, tetapi saya akan menunggu untuk antar-jemput gratis mereka memiliki karena jalan tidak memiliki cara berjalan yang tepat. ",5
102, Abi Bali Resort & Villa,Hotel ini luar biasa! Kamar sangat bagus dan kami memiliki kolam renang kami sendiri. Sarapan adalah sangat mewah dan layanan besar. Hotel ini tidak jauh dari pantai/toko yang membuatnya bahkan lebih baik. Bagian terbaik dari ruangan ini adalah kamar mandi. Hotel ini memiliki besar mandi dan yang indah di luar bak mandi. MENGAGUMKAN!,5
103, Abi Bali Resort & Villa,Kami tinggal di sini minggu lalu dan pasti akan kembali! Ini adalah nilai yang sangat baik untuk uang dan villa kami adalah hanya menakjubkan. Kami menyukai area dapur luar ruangan dan kolam renang. Bus antar-jemput gratis ke pantai jimbaran adalah sentuhan yang bagus. Saya juga akan sangat merekomendasikan koi spa yang mereka memiliki di situs - salah satu pijat terbaik yang pernah saya alami. Staf yang ramah dan penuh perhatian. Satu-satunya komentar yang saya miliki adalah bahwa makanan kami memesan melalui layanan kamar tidak besar di masa mendatang kami akan makan keluar. Dekat dengan rock bar yang merupakan sebuah bonus!,5
104, Abi Bali Resort & Villa,"Untuk hanya £35 per malam 3 dari kita memiliki dua kamar tidur vila untuk 2 malam dengan kolam renang kami sendiri! Itu indah, besar, sangat bersih dan hanya menakjubkan...  Tempat tidur yang cukup besar untuk tidur 6 dan kamar mandi yang besar dan indah. Saya hanya berharap kami tinggal lebih lama.  Layanan kamar adalah benar-benar baik. Saya suka fakta mereka mengantarkan sarapan ke villa setiap pagi!  Anda juga harus memiliki pijat dilakukan di tempat ini. Saya mendapatkan pijat swedia dan ini adalah yang terbaik yang pernah saya makan!",5
105, Abi Bali Resort & Villa,"Kamar bersih dan rapi, sangat dekat ke pantai jimbaran. Hotel ini sangat indah, di sana ada kolam hanya berlawanan kamar kami. Hotel staf mengirim rose untuk bulan madu kami, yang sangat manis. Malam pertama ketika kami tiba ke hotel, kami sangat lapar, jadi resepsionis direkomendasikan sopir untuk menjemput kami ke pantai jimbaran untuk barbekyu. Bbq terasa benar-benar baik, pemandangan dan seluruh lingkungan yang baik, tetapi bbq harga sangat mahal. Hotel yang berlokasi di atas bukit, hanya satu toko di dekatnya, itu mungkin mengambil sepuluh menit untuk mendapatkan di sana.",4
106, Abi Bali Resort & Villa,"Terasa seperti rumah sendiri, semua stafnya sangat ramah! Kamar sangat terawat dengan baik dan kamar mandi mereka sangat bagus. Makanan adalah begitu baik. Terasa seperti rumah sendiri, semua stafnya sangat ramah! Kamar sangat terawat dengan baik dan kamar mandi mereka sangat bagus. Makanan adalah begitu baik.  ",5
107, Abi Bali Resort & Villa,"Saya memesan kamar melalui agoda dengan harga yang terjangkau. Lingkungan itu bagus. Kamarnya luas.  Namun, staf tidak ramah seperti yang dijelaskan, terutama mereka yang bekerja di giliran malam. Dan jika lebih banyak efek di memelihara kebersihan kamarnya, tamu akan senang untuk tinggal lebih lama di.",3
108, Abi Bali Resort & Villa,"Abi bali terletak di atas bukit di jimbaran, tenang, penuh diisi dengan banyak pohon. Kamar memiliki pribadi atau semi-taman pribadi dan kolam renang. Anda dapat menikmati waktu anda sendiri. Harga sangat wajar untuk villa jenis. Sarapan tidak cantik, adalah cukup bagus tapi di sekitar 9:00 sibuk, anda tidak dapat mendapatkan baik bertahan di sibuk kali. Lokasi hotel ini tidak nyaman untuk belanja dan restoran, tetapi mereka memiliki layanan bus antar-jemput untuk pantai dan pusat perbelanjaan setiap 2 jam. Saya merekomendasikan layanan kamar untuk makan siang dan makan malam, jika anda ingin bersantai sepanjang hari dengan pasangan anda, anda akan menikmati makanan di luar atau sofa di sisi kolam renang tidak hanya di kamar anda. Juga anda dapat menemukan restoran yang bagus…",4
109, Abi Bali Resort & Villa,"Jangan salah paham. Ini adalah hotel besar, luas kamar yang tertata dengan baik, tv, pilihan baik dari tv kabel, sistem suara & dvd player, dan nilai yang sangat baik untuk uang. Sarapannya luar biasa. itu hanya naik taksi singkat ke kuta jadi jika anda mencari sesuatu yang sedikit lebih tenang ini adalah tempat untuk tinggal.  Setelah membaca banyak ulasan ya - jika anda lampu tidur anjing lebih dari jalan dan daftar di pagi hari mungkin bangun anda... tapi itu adalah apa yang membuat indonesia sangat menarik.  jadi saran kecil untuk membuatnya istimewa? Restoran memiliki menu terbatas dan bahkan lebih murah pilihan minuman beralkohol. Mereka memiliki bir tapi tidak banyak yang lain. jadi mungkin dengan daftar koktail.  Juga restoran tidak memiliki suasana apapun, dan mungkin…",4
110, Abi Bali Resort & Villa,"Resor ini dengan baik desain dan kamarnya luas dengan tempat tidur besar. Parsial jendela yang terbuka di kamar mandi dan sebagian atap terbuka mandi adalah kredit untuk desainer karena memungkinkan udara segar ke dalam kamar mandi. Istri saya utarakan kepadanya mengeluhkan keamanan di keterbukaan namun berada di lantai atas. Saya kira itu tidak masalah. Stafnya ramah. Sarapan disajikan di banyak berbagai pilihan seperti continental, american, dan sebagainya yang dapat memilih. Jika saya kembali ke jimbaran. Saya tidak ragu untuk menginap di sini lagi. ",4
111, Abi Bali Resort & Villa,"Kami tinggal 4 malam di the abi bali. hotel yang sangat bagus, staf super ramah. Secara keseluruhan ofvthe satu tempat yang lebih baik untuk menginap dan mutlak nilai untuk uang. Akan mendapat sebuah 'baik' jika itu akan telah berada di tempat yang lebih baik di jimbaran. ",4
112, Abi Bali Resort & Villa,"Hanya tinggal selama satu malam sebelum menuju rumah, itu indah lokasi tenang, kamar yang bagus dan kolam renang yang bagus! Staf benar-benar membantu di sepanjang waktu.  Kami punya tetangga berisik di atas kamar kami meskipun, bahwa mendapat kembali terlambat, menarik perabot dan retak kaca di beberapa panggung di...  Sarapan adalah indah dan banyak! Tidak perlu makan sampai makan malam! ",5
113, Abi Bali Resort & Villa,"Abu bali resort adalah menanjak, sekitar 1 km dari pantai jimbaran. Setiap 2 jam, gratis daun shuttlebus untuk membawa tamu dari di pantai. Resor terlihat sangat romantis. Kamar bersih dan besar dan ada beberapa cukup kolam renang. Staf sangat ramah. Ada spa di resort. Saya mendapatkan pijat yang sangat benar-benar bagus dan tidak terlalu mahal (terutama sejak kami menerima 15 menit secara gratis sebagai sikap menyambut). Restoran ini menyajikan makanan yang baik, untuk sarapan kami bisa memilih dari berbagai makanan barat dan indonesia. Untuk makan malam kami merekomendasikan makan di pantai karena restoran di resort tidak merasa sangat nyaman dan tidak memiliki suasana yang besar. Banyak restoran di pantai ini menawarkan gratis drop off di hotel anda meskipun jadi makan di…",4
114, Abi Bali Resort & Villa,"Pacar saya dan saya tinggal di sini hanya minggu lalu, atau 2 malam dan kami sangat terkesan.   Kami memesan untuk 2 malam terakhir kami di bali, setelah menghabiskan hampir 3 minggu di sana. Kami memilih daerah ini karena sangat dekat ke bandara dan kami ingin santai beberapa malam terakhir dan kami pasti tidak kecewa. Tempat ini sangat mewah! Kami disambut dengan jus buah yang indah dan senyum dari resepsionis, kami diberi voucher untuk pijat 15 menit gratis yang pasti bonus selamat datang dan kemudian kami diantar ke kamar kami. Dan apa kamar itu! Nya dan miliknya tenggelam, bak mandi dan pancuran yang sebagian di luar! Tempat tidur adalah tentang 7 ft lebar dan kami terkesan di setiap sudut!   Staf yang sangat ramah dan membantu, dan itu indah bahwa ada layanan mobil untuk…",5
115, Abi Bali Resort & Villa,"Saudara perempuan saya dan saya tinggal di abi bali untuk menjadi dekat dengan adikku dan keluarganya yang tinggal di four seasons. Kami tidak menghabiskan banyak waktu di abi bali, tapi ketika kami berada di sana kami menemukan ini untuk menjadi benar-benar baik. Staf sangat ramah dan selalu menyapa. Kamar kami sangat luas dan kamar mandinya sangat besar. Ya, tekanan air adalah naik dan turun tapi hal-hal seperti ini di bali tidak mengganggu saya... setelah semua, saya di bali. Satu-satunya hidangan kami makan sarapan ada. Saya mencoba banyak hal pada menu sarapan a la carte dan menikmati semua dari mereka. Itu tidak dekat dengan apa yang kami berharap untuk pantai (di mana four seasons adalah) tapi itu mudah untuk mendapatkan taksi atau hotel shuttle (RP30, 000). Kami tidak…",4
116, Abi Bali Resort & Villa,"... anda mencari tempat untuk melakukan apa-apa dan anda upgrade ke villa pribadi dengan kolam renang pribadi. Saya akan mencoba untuk menjelaskan.   Kami tinggal di sini selama 3 malam sebagai bagian dari kami perjalanan sekitar 6 bulan asia tenggara. Kami memesan setelah membaca ulasan di ta dan saya pikir kami memiliki harapan yang terletak cukup tinggi.   Staf Mereka semua fantastis. Dari check-in staf untuk pembersih, mereka semua berhenti dan menyapa dan meminta jika anda baik atau perlu apa-apa. Anda tidak bisa meminta lebih.   Kamar Ada pilihan yang berbeda untuk memilih dari. Sebagian besar muncul untuk menjadi terletak di blok sekitar 8 kamar dengan kolam renang untuk setiap blok. Yang indah jika anda mencari untuk privasi. Kamarnya sendiri (termasuk the villas) ok,…",3
117, Abi Bali Resort & Villa,"Tempat ini sangat menakjubkan dan staf sangat hangat dan ramah. Saya sangat menyukainya! Kami punya kamar untuk satu malam (sebagai villa tidak tersedia) dan kemudian pindah ke 1 bed villa hari berikutnya dan itu benar-benar hebat! Hanya kekurangannya adalah bahwa itu serikat itu 800 meter ke pantai, tapi ini adalah 2 km dan berjalan sepanjang jalan bukan untuk yang lemah hati. Meskipun mereka memiliki shuttle bus atau anda dapat naik taksi yang sangat murah... sekitar 1, 50 euro. Kami makan di sana satu malam tapi itu adalah bencana karena koki baru tapi itu tidak merusak liburan kami. Jimbaran adalah sangat tenang dengan semua yang ditutup oleh 10pmish. Sempurna untuk bersantai tapi akan menyukai sedikit bar untuk bersantai setelah makan malam. Ini adalah salah satu pertama…",4
118, Abi Bali Resort & Villa,"Tinggal di salah satu kamar villa selama tiga malam, staf baik dan baik... semua permintaan yang dilakukan sempurna. Kamar dan kolam renang pribadi adalah bersih dan privasi. Ada hanya beberapa nyamuk. Hanya dua hal, sarapan adalah mengerikan dan air adalah dingin, kami perlu mengambil cepat mandi.",4
119, Abi Bali Resort & Villa,"Abi bali resort dan villa menawarkan villa terbaik di bali sesuai pengalaman saya. terletak di sangat tenang daerah bali. Jauh dari keramaian kota, dan memberikan banyak diperlukan relaksasi yang satu kebutuhan di liburan. Ini adalah tempat yang bagus untuk tinggal untuk pasangan yang berbulan madu seperti yang memberikan banyak privasi. Villa sangat terawat dengan baik. Kolam renang privat di vila ini sangat bersih. The resort menyajikan makanan besar dan dinning inroom sangat baik. Sarapan adalah benar-benar bagus dan salah satu memiliki pilihan untuk memilih dari menu yang luas. Resor ini memiliki spa yang bagus, dan layanan transportasi. staf di sini sangat hangat dan freindly.  Pengalaman menginap yang sempurna! ",4
120, Abi Bali Resort & Villa,"Kami punya 4 malam di sini pada akhir September dan tidak bisa kesalahan itu sedikit pun. Kami ingin menjadi sedikit dari hal-hal, jadi lokasi yang sempurna, dan angkutan gratis ke Jimbaran Beach atau belanja strip diberikan setiap kali diperlukan. Semua staf yang fantastis - ramah, efisien dan ramah.  Kami tinggal di Junior Suite dengan kamar mandi luar yang menakjubkan dan tidur terbesar yang pernah saya lihat! Senang kita tidak menghabiskan tambahan untuk kolam renang pribadi - kita tidak harus berbagi dua kolam renang dengan tamu lain sepanjang waktu kami berada di sana!  Makanan yang sangat baik, orang lain telah disebutkan bahwa sarapan tidak prasmanan, tapi jika kita ingin lebih kami hanya meminta dan itu diberikan bahagia. Aku pengobatan di Koi Spa dan walaupun lebih…",5
121, Abi Bali Resort & Villa,"Kami tinggal di di Ahimsa ruang untuk dua malam, telah luar kamar mandi yang dingin. Tempat tidur yang sangat besar, kami memiliki kolam renang di sisi kiri. Ada internet gratis di resepsi. Hotel ini bersih, gaya dan bertemu semua harapan kita. Sarapan adalah baik, tetapi tidak sarapan prasmanan. Staf yang membantu. Tapi hotel ini terlalu jauh untuk berjalan ke pantai Jimbaran atau tempat-tempat menarik lain - tetapi hotel akan menjatuhkan Anda di sana gratis dan Anda bisa menggunakan taksi kembali ke hotel. Harga kecil untuk membayar untuk sebuah hotel yang indah.",4
122, Abi Bali Resort & Villa,"Abi Bali adalah tempat yang nyaman/tenang untuk tetap.... baik, bersih, airconditioned kamar, menarik luar kamar mandi. Tapi kami sangat KECEWA bahwa air di kamar mandi berbau kuat dari klorin (berpikir: kolam renang umum). Staf hotel menjelaskan mereka memiliki istirahat di salah satu fasilitas persedian air mereka jadi mungkin ini hanya masalah sementara. Tapi kita tidak merasa nyaman menyikat gigi kami dengan air atau mengambil mandi panjang! Aku akan memeriksa tentang kualitas air sebelum pemesanan tempat ini lagi. Satu negatif adalah hotel lokasi--seperti resensi lain menunjukkan - hotel terserah bukit dari pantai. Ini adalah 30 menit berjalan. Jadi tidak ada pantai dilihat. Kami berusaha berjalan tapi itu menantang dan Anda akan perlu senter pada malam dan menonton untuk…",3
123, Abi Bali Resort & Villa,"Jika Anda perlu untuk melarikan diri untuk liburan dingin keluar ini adalah tempat yang akan. Kami memiliki satu kamar tidur dengan kolam renang pribadi, banyak ruang dan hanya begitu mudah untuk bersantai. Fasilitas dan staf yang sangat baik. Mudah untuk mengambil taksi untuk utama daerah perbelanjaan pantai.",5
124, Abi Bali Resort & Villa,"Sayangnya saya hanya tinggal di sini selama satu malam. Tetapi pengalaman yang tinggal di hotel ini sangat baik.  Ketika aku berada di sana pada November tahun 2011, hotel ini baru dibuka.  Ruangan itu sangat bagus dan bersih. Staf yang ramah dan baik. Mereka menyediakan layanan antar-jemput dari hotel ke pantai Jimbaran.  Titik hanya negatif bagi saya adalah bahwa hotel tidak memiliki pandangan langsung ke pantai. Pada malam hari, itu sangat gelap di luar dan mustahil bagi saya untuk berjalan di sekitar hotel.  Sarapan yang baik.",5
125, Abi Bali Resort & Villa,"Kami baru saja pulang dari 6 malam menginap di Abi Bali resort dan kami tertiup pergi oleh standar. Mengikat perhatian terhadap staf indah, dan alasan dan kualitas dari kamar yang disediakan yang luar biasa. Kami tinggal di kompleks Sriya kamar adalah begitu besar dan kita mencintai outdoor shower. Kamar kami tanpa cela yang dibersihkan setiap hari, dan staf melakukan segala kemungkinan untuk memastikan kami menikmati waktu kami di sana. Itu bagus untuk kembali, setelah hari-hari panjang tur Bali Resort di mana staf tahu nama Anda, menanyakan tentang hari Anda, dan memberikan tips tentang apa yang harus melihat dan bagaimana menuju ke sana. Disebutkan secara khusus untuk Suki - dia indah dan dari hari pertama kami berada di sana dia membantu kami buku wisata dan memastikan kami…",5
126, Abi Bali Resort & Villa,"Kami tinggal di kamar tidur ganda. harganya sekitar 75 GBP dan saya pasti berpikir kami mendapat nilai untuk uang di sini. Ada 2 kolam renang untuk penggunaan bersama, tetapi pada dasarnya saya dan suami saya memiliki kolam renang untuk diri kita sendiri. itu tepat di luar ruangan sehingga membuat mengambil handuk, dll yang mudah.   Kamar: Tempat tidur adalah besar dan nyaman. kamar mandi adalah benar-benar baik dengan outdoor shower. Ruangan itu baik secara keseluruhan. banyak saluran tv dan theres sebuah dvd player - Anda dapat menggunakan usb stick di dvd player.   Makanan: Itu baik-baik saja. tidak menakjubkan, tidak mengerikan. Saya telah menemukan bahwa memesan makan malam untuk ruang harga yang seperti akan keluar dan sekitar restoran di bali - kecuali Anda makan di…",4
127, Abi Bali Resort & Villa,"Ini adalah bagian terbaik dari kunjungan kami ke Jimbaran Bay - outdoor shower, tempat tidur besar, kolam renang pribadi (tidak ada orang lain menggunakannya) dan kebersihan resor sangat mengesankan. Sarapan adalah tidak begitu baik, tapi tidak lebih buruk daripada sebagian besar hotel di Bali. Wi-fi di ruang adalah tidak dapat diandalkan dan lambat (jika itu bekerja).",4
128, Abi Bali Resort & Villa,"Jika aku pernah datang kembali untuk Jimbaran, saya pasti yang tinggal di sini. Ini adalah tempat yang fantastis untuk tinggal dan saya akan merekomendasikan hal ini kepada siapa pun yang tertarik pada ini bagian dari Bali. Baik ruangan, baik restoran, baik renang, staf yang ramah, wifi gratis, fasilitas yang layak",5
