,hotel,review,stars
44, Abi Bali Resort & Villa,"Kami berada di abi bali resort untuk hanya satu malam, fasilitasnya cukup bagus, bagus kamar dengan kamar mandi besar yang meliputi shower sangat confortant eksterior. Masalah utama, tidak ada wifi, itu rusak karena kami datang di. Masalah dengan antena berusaha untuk tetap hampir dua hari... Tidak baik.  Hotel ini memiliki layanan antar-jemput yang aneh, tetes anda di tempat ini dekat dengan pantai jimbaran, tetapi jika anda meminta mereka untuk menjemput anda untuk mengembalikan, mereka mengatakan layanan ini tidak tersedia, apakah itu normal? Saya tidak berpikir begitu. Meja resepsionis tidak begitu ramah staf hotel yang orang-orang yang kita telah bertemu di sepanjang perjalanan kami di bali.   Sarapan... jadi jadi,   jadi, mungkin untuk tinggal satu malam di hotel ini, jika…",3
45, Abi Bali Resort & Villa,Kami telah luar biasa. Staf sangat ramah dan membantu. Lokasi hotel adalah sangat terawat dengan baik. Kamar-kamarnya luar biasa. Bagus dan tenang dan pribadi. Tidak akan ragu-ragu untuk memesan hotel ini lagi. Lebih baik dari yang diharapkan. ,5
46, Abi Bali Resort & Villa,"Abi bali adalah sebuah permata di jimbaran. ini adalah harta karun tersembunyi di jimbaran dengan harga yang murah. Kamar luas dan bersih dengan mandi udara terbuka yang unik. pilihan yang bagus di kolam renang serta, A la carte sarapan adalah cocok untuk sebuah hotel kecil.",5
47, Abi Bali Resort & Villa,"Pacar saya dan saya tinggal di hotel untuk 7 malam, abi bali dan saya tidak memiliki satu hal buruk untuk mengatakan tentang tempat. Kamarnya besar, jauh lebih besar daripada yang kami harapkan, kamar mandi adalah menakjubkan dan bersih. Paulus adalah sangat banyak bintang-bintang di malam hari. Sarapan termasuk dan itu selalu matang dan tidak besar, mereka menawarkan layanan kamar untuk sebagai sedikit sebagai hanya rp 18000. Itu adalah sedikit jauh dari toko-toko dan restoran tapi kami baru saja taksi setiap hari penyakit sekitar rp 12000 - 20000 (sekitar 75p yang £1,00) sangat murah! Staf hotel sangat ramah dan sangat baik, selalu tersenyum dan membantu dengan apa pun yang kita diperlukan. 100% akan kembali ke hotel ini. Mungkin lain kali kita akan mendapatkan villa seperti…",5
48, Abi Bali Resort & Villa,"Musim hujan sekarang jadi ada banyak serangga, bug di sekitar di luar ruangan & kamar mandi. Hotel ini baik-baik saja dengan kamar mandi luar ruangan tapi tidak dapat berdiri serangg & serangga.  Jika anda ingin tinggal yang sangat tenang ini adalah 1 dari tempat menginap. Namun perlu diketahui tempat ini cukup seluded & tidak ada di dekatnya kecuali jika u hanya ingin tempat untuk pergi adalah rock bar yang dekat dengan villa ini.",3
49, Abi Bali Resort & Villa,"Aku sangat terkesan dengan hotel ini sebagai harapan saya cukup rendah ketika aku melihat deskripsi dan foto di internet. Namun, setelah masuk ke dalam kamar. Saya terkesan! Itu lebih luas daripada yang diharapkan, dan kamar mandi luar biasa! Ruangan yang luas, dengan bak mandi, cuci ganda dan udara terbuka, shower air hujan! Fasilitasnya bagus, jubah mandi dan sandal juga disediakan!  Sementara jimbaran tidak akan menjadi pilihan saya untuk bali, jika aku pernah diperlukan untuk berada di daerah ini, saya akan memilih hotel ini lagi.",5
50, Abi Bali Resort & Villa,"Untuk aud $60 pn di sana benar-benar ada apa-apa untuk mengeluh tentang jadi komentar saya lebih selera pribadi.  Kamar yang tidak biasa dengan tempat tidur king size. Kamar ini sangat besar dan karena itu hanya untuk diriku sendiri, bahkan lebih besar nampaknye  Kamar cukup bersih, meskipun seprai dan handuk tidak bersih sepenuhnya mengerih pada saya sebagai ada beberapa jam di sini dan di sana tapi aku berhasil. Kamar ber-ac bekerja baik-baik saja tapi teman saya menginap di kamar bawah telah tertutup sehingga saya menduga, tidak semua kamar yang sama dan bisa menjadi lebih baik  Kamar mandi adalah satu-satunya bagian yang bukan yang terbaik, itu adalah semi luar ruangan dengan kotak mandi tidak memiliki menutupi. Itu besar tapi itu benar-benar panas, 2 dunia yang berbeda…",4
51, Abi Bali Resort & Villa,"Kami tinggal di sini selama dua malam sebelum meninggalkan, semua staf di abi bali dekat. Kami memiliki penerbangan akhir pada hari terakhir kami dan meskipun kami tidak dapat untuk mendapatkan berbumbu karena motel ini sebagai penuh dipesan malam berikutnya, mereka disimpan tas kami aman untuk hari itu untuk kami, membiarkan kami menggunakan kolam & wifi mereka sepanjang hari & mereka memungkinkan kami untuk mandi sebelum kami berangkat di gym. Layanan pelanggan yang baik. Lokasi diperbarui & taksi cukup mahal di jimbaran",4
52, Abi Bali Resort & Villa,"Kami memesan 6 malam di sunway lagoon di jimbaran bali dan karena ada pipa air pindah ke sini untuk malam pertama, kamar kami yang sangat besar dan vila ini, makanan yang baik dan tetap bagus resor. Sedikit di tengah tempat dan banyak lebih jauh dari 900m dari pantai uluwatu dan namun dekat dengan rock bar jika anda berencana untuk berkunjung ke sana.",4
53, Abi Bali Resort & Villa,"Kami tinggal selama 3 malam di junior suite, harga yang sangat wajar dengan ukuran sebesar itu. Namun kamar mandi terbuka yang membuat istri saya tidak terlalu nyaman. Bagian tertentu dari hari minggu dan dapat cukup keras waktu check out. Ini adalah pertama kalinya kami memiliki kamar mandi luar ruangan, mungkin kita tidak mencobanya lagi.   Secara keseluruhan resor ini bagus, keramahan yang sangat bagus...   Kami akan memberikan tiga bintang jika tidak untuk layanan kamar! Hal! Kami mencoba sekitar 7 makanan yang berbeda dan hidangan penutup, semua sangat lezat...   Namun sarapan mereka disediakan adalah indah...   Dan satu hal lagi, kami belum pernah melihat tempat tidur yang besar! ",4
54, Abi Bali Resort & Villa,"Tinggal di kamar deluxe yang sangat bersih (kecuali untuk bak mandi). Toilet dan tempat tidur adalah besar dan harga adalah nilai untuk uang. Tidak hanya memberikan ini bintang tiga (akan ada lima) karena aku berbohong untuk oleh staf hotel. Setelah check-in. Saya telah diberitahu hotel staf yang cantik ladah dengan komponen logam berkarat dan saya diminta untuk mengubah kamar. Namun, staf hotel berbohong bahwa tidak ada kamar yang tersedia karena hotel ini sudah terpesan semua. Dia kemudian mengatakan kepada saya bahwa tidak ada dia bisa melakukan (aku tidak memeriksa dan menemukan bahwa memang ada kamar tersedia untuk pemesanan) dan banyak. Titik kecil: aku tiba di sini di 2pm kamar tidak siap; karena itu saya harus menunggu selama setengah jam. Manajemen harus memastikan…",3
55, Abi Bali Resort & Villa,"Ini adalah properti di mana anda bisa mendapatkan nilai untuk uang. Harga adalah terjangkau untuk liburan yang sangat nyaman (jika tidak mewah) merewang. Vila-vila besar dengan kolam mandi (menampilkan favorit saya) dan semi-swasta kolam renang. Properti ini bersih dan staf yang ramah. Satu-satunya minus titik adalah bahwa hal itu sangat sulit untuk mendapatkan sekitar, kecuali jika anda memiliki mobil atau sepeda motor pribadi, tapi hei, jika anda di bali untuk ketenangan dan relaksasi, ini adalah tempat yang sempurna.   Oh, dan antar-jemput gratis ke pantai jimbaran... apa lagi yang bisa saya katakan?",5
56, Abi Bali Resort & Villa,"Resor ini nilai untuk uang sebagai harga adalah murah dicocokkannya untuk villa lain di wilayah yang sama yang baik, kamar mandi adalah di luar ruangan cuaca yang berangin di mandi yang merasa dekat dengan alam dan tempat tidur adalah sangat besar juga. Satu-satunya kekecewaan adalah sarapan mereka tentang resor ini yang datang dari menu yang dipesan dan hanya dapat memesan salah satu menu untuk setiap orang. Saya tidak jebah di semua, akan lebih baik serta prasmanan.",4
57, Abi Bali Resort & Villa,"Hotel ini adalah besar untuk tempat yang tenang untuk kami tinggal dua minggu dan meskipun hotel penuh kita tidak memiliki apapun kebisingan atau gangguan. Hotel ini bersih dan baik terus kamar dan area umum. Staf semua menyenangkan dan sangat membantu dan tidak bisa melakukan cukup bagi kita. Lokasi adalah jauh dari kota dan pantai, tidak ada apa-apa di dekatnya yang mengharuskan penggunaan bus antar-jemput hotel ke kota atau taksi sana dan kembali. Fasilitas kamar bahkan di kamar deluxe yang apa yang anda harapkan dari hotel bintang empat dan menyediakan untuk hidup nyaman. Hanya sebentar lagi dan tidak ada brankas dalam kamar (meskipun ini tersedia gratis di kamar di belakang meja resepsionis). Ada wifi gratis tersedia tetapi pada kesempatan ini ketika hotel ini penuh, itu…",5
58, Abi Bali Resort & Villa,"Ini adalah perjalanan pertama kita ke bali dan kami tinggal di sini sangat. Itu adalah sedikit untuk jauh dari kota tapi stafnya selalu bersedia untuk mengatur taksi untuk kita. Itu adalah sedikit keras tapi sangat besar. Kami tinggal di junior suite yang sangat nyaman. Makanan yang indah dan harga yang baik. Pengering rambut hanya satu 400w, jadi membawa anda sendiri jika anda memerlukan sesuatu yang lebih kuat. Kolam itu bagus dan stafnya ramah dan sangat membantu.",4
59, Abi Bali Resort & Villa,"Hotel ini adalah persis seperti yang diiklankan, jika tidak lebih baik. Makanan adalah luar biasa. Kami mencoba sarapan, makan siang, dan makan malam. Itu tidak sibuk tapi kami suka itu. Staf tidak bisa melakukan cukup bagi anda. Mereka memesan kami ke perahu untuk sore kami dengan harga terjangkau. Kami mencintai luar kamar mandi dan kolam renang. Sedikit keluar dari jalan, tapi pastikan anda menelepon taksi blue bird",5
60, Abi Bali Resort & Villa,"Kami sangat menyukai pengalaman menginap di abi bali! Kami memiliki satu kamar tidur vila yang luas, bersih dengan kolam renang yang besar dan ruangan yang indah dan ruang. Stafnya sangat ramah dan restorannya bagus tapi bagus & harga (rumput lemon ayam yang membungai). Di sisi kontra - itu sangat terpencil, anda perlu untuk taksi di mana-mana - atau jika anda berani menyewa skuter. Restoran populer di setiap malam, jadi jika anda 10pm seperti tinggal larut malam makan sebelum anda datang kembali. Itu sangat tenang, jadi mungkin resor terbaik untuk keluarga atau pasangan yang menginginkan liburan yang tenang dan santai. Tidak ada yang kurang aku berharap untuk di bali - tetapi banyak bintang! Semua dalam semua yang indah, tenang tempat untuk tinggal.",4
61, Abi Bali Resort & Villa,"Hotel ini cocok bagi mereka yang menyukai privasi. Terletak di daerah terpencil, masuk dan keluar adalah sangat bahagia jika anda ingin berjalan kaki. Namun, ada antar-jemput gratis ke pantai jimbaran area setiap dua jam. Jika tidak, hotel bisa menelepon taksi dan itu akan biaya tidak lebih dari 30 000 baterainya.   Ruangan itu sangat luas. Kami punya kamar deluxe yang termurah dari semua kategori kamar dan itu sangat besar! Kamar, tempat tidur, kamar mandi begitu besar! Ditambah kolam renang adalah terletak tepat di luar pintu kami. Itu seperti sebuah kolam renang pribadi. Hotel ini memiliki tingkat hunian tinggi ketika kami berada di sana sebagai banyak waktu selama sarapan di restoran, tapi kami tidak pernah berbagi kolam renang 3 kali kami digunakan di tempat ini pada sore…",5
62, Abi Bali Resort & Villa,"Akhir review seperti yang aku kaial di oktober 2014, saya pikir ini layak ulasan yang besar, fantastis layanan dan kamar besar, bersih, air panas di kamar mandi yang tidak pernah berlari keluar dan ac bekerja keajaiban. Tentu saja untuk tempat ini adalah lokasi, karena ini adalah berkendara ke pantai jimbaran dan kuta, tapi kalau itu tidak menjadi masalah bagi anda! Nikmati masa menginap anda! Saya yakin tidak! ^_^",4
63, Abi Bali Resort & Villa,"Aku mencintai abi bali! Staf sangat mengagumkan, layanan kamar juga tersedia larut malam dan semua orang sopan dan sangat membantu. Kami tinggal di kamar deluxe dan kemudian mereka! Anda bisa muat 2 orang dewasa dan 2 anak-anak kecil. Tempat Tidur Yang Besar! Kamar yang bersih... semuanya, ac adalah suhu yang sempurna, kamar memiliki wifi gratis, lemari es, tv kabel, dan shower terbuka iove atap yang terpisah bak mandi, mandi besar. Kolam renangnya juga menyenangkan tetapi kami pergi ke pantai setiap hari. Kini, bali adalah bukan untuk jalan-jalan pantai demes... jika menginap di abi bali, sewalah sepeda motor untuk $7/hari. Sepeda motor ini akan membuat berkeliling kota accesible dibandingkan lebih cepat dan lebih baik untuk mengambil taksi. Pantai jimbaran adalah 20 menit…",4
64, Abi Bali Resort & Villa,"Semua 5 bintang untuk yang satu ini, benar-benar menakjubkan, indah, agak jauh dari pantai, tetapi segala sesuatu yang lain ketika datang ke layanan dan kebersihan adalah 5 bintang, dan makanan. Baik nilai untuk uang kemudian Ayana. Hotel ini tidak benar-benar berorientasi keluarga lebih jadi jika anda mencari untuk beberapa damai dan cukup di kamar luxurios silakan pergi untuk yang satu ini.",5
65, Abi Bali Resort & Villa,"Staf adalah menyenangkan dan bermanfaat. Makanan baik jika anda seperti indonesia (yang saya lakukan) dan harga yang sangat wajar untuk sebuah hotel. Hotel yang bagus dan kami memiliki junior suite yang besar kamar. Meskipun ruangan itu sedikit dingin dan tidak cukup untuk membuat masa menginap anda berjemur dan bersantai di tepi kolam renang. Aku tidak bahagia dengan kamar pelayan kamar yang tidak bersih tapi cukup untuk membuat anda berpikir anda berada di sebuah hotel. Tempat tidur dibuat tapi toilet tidak dibersihkan. sepertinya mereka hanya mengatur perlengkapan kami, tidak ada air gelas, kopi/teh meskipun kamar kami tidak menghanyuntukan dan sulit di mana seharusnya dan mereka tidak mengisi ulang botol air gratis kami. hal ini tidak bahwa ini adalah masalah besar, karena…",3
66, Abi Bali Resort & Villa,"Tempat tidur dan kamar mandi yang besar. Staf yang ramah dan makanan yang baik. Lokasi sedikit di luar dari jimbaran. Hotel menawarkan layanan antar-jemput ke jimbaran, tapi anda harus membuat anda sendiri cara kembali (naik bukit di jalan yang sibuk).",3
67, Abi Bali Resort & Villa,"Aku menghabiskan satu malam hanya di hotel dan itu sangat bagus. aku ada di sana dengan sekelompok orang dan kita semua menikmati kami tinggal. Kamar sangat besar dan tempat tidur, salah satu yang terbesar yang pernah saya lihat. Kamar mandi itu besar dengan mandi udara terbuka. Kami memiliki kolam renang pribadi yang kecil.",4
68, Abi Bali Resort & Villa,"Layanan sangat baik dari staf yang sangat membantu, kamar yang bersih dan sangat besar, kolam renang indah dan tatanan dan dekat ke pantai, taksi murah, tapi pastikan anda di gambar burungnya dan argo adalah berlar dari awal atau anda dapat menyewa skuter kami dipindahkan dari hotel $6 hari! ",5
69, Abi Bali Resort & Villa,"Kita tidak bisa percaya ukuran ruangan, atau fakta bahwa kamar telah dilengkapi pancuran di luar ruangan. Stafnya ramah, dengan bahasa inggris yang terbatas. Resor ini sangat tenang, terletak di bukit di atas jimbaran. Ini adalah di ujung skala besar kami telah di resor di bali, dan walaupun tidak sarapan prasmanan, makanan yang terus datang! Akan menjadi tempat yang sempurna untuk kelompok besar, dengan rencana yang tidak ingin menghabiskan terlalu banyak waktu di kamar hotel mereka. Setelah mengatakan bahwa, kami melihat beberapa di vila dan mereka tampak menakjubkan di dalam. Pijat yang kami punya dari gadis-gadis di spa adalah teh terbaik yang kami punya di bali. Pastikan anda pergi keluar dari ikan koi di kolam di spa - yang terbesar yang pernah saya lihat!",4
70, Abi Bali Resort & Villa,"Ini adalah kami tinggal di ini indah estate 4th. Pertama kalinya kami tinggal di sini sekitar 5 tahun yang lalu dan sangat terkesan dengan kondisi kamar. Itu adalah sebuah deluxe room. Kamar besar dan sangat baik dan memiliki kolam renang yang bagus.   Kedua kalinya kami berada di sini, kami tinggal di villa 1 kamar pribadi. Ini adalah luar biasa. Hotel ini memiliki gazebo, kolam renang pribadi dan dapur kecil. Hotel ini sangat bersih dan seperti di rumah. Staf sangat ramah dan siap membantu kami. Kami mencoba di koi spa untuk dua dan itu layak melakukan.  Ketiga kalinya kami di sini, kami datang dengan anak-anak, dan orang tua. Menyewa dua kamar deluxe. Mereka adalah begitu begitu besar tempat kingside, 240 cm x 240 cm, jadi kami punya banyak ruang bahkan dengan anak-anak kita,…",5
71, Abi Bali Resort & Villa,"Kami hanya tinggal satu malam di jalan untuk abi bali di lombok, tapi itu indah. Tenang taman dan sangat ramah staf. Kamar mandi adalah besar dengan pancuran luar ruangan bagus dan kemudian mereka! Saya tidak berpikir aku pernah melihat tempat yang begitu besar! Makanan di restoran juga sangat baik. Semua dalam semua hotel ini adalah nilai yang besar untuk uang jika anda tidak ingin menghabiskan sejumlah besar tapi masih ingin lingkungan yang indah. Itu bukan 5 bintang, tetapi masih bagus sekali!",4
72, Abi Bali Resort & Villa,"Vila pribadi dirancang dan didekorasi dengan indah dengan besar tempat tidur, kamar mandi dan area ruang keluarga luar ruangan, kolam renang dan tempat berjemur besar. Liburan yang sempurna untuk pasangan. Staf sangat ramah dan membantu. Makanannya cukup baik tetapi lebih baik makanan lokal khas warung dalam gaya yang tidak cukup cocok dengan akomodasi mewah. Mereka besar dan dispenser air, sistem stereo luar ruangan, dalam ruangan bioskop dan surround sound.   Restoran di daerah adalah dangkal dan biasanya tinggal sehingga anda lebih baik makan di villa atau pergi ke jimbaran untuk hidangan laut barbekyu pantai.   Sarapan termasuk dan disajikan di vila anda adalah sentuhan yang bagus. Lagi-lagi, gaya itu bagus, seseorang cara untuk memulai hari.   Tempat ini populer dengan…",4
73, Abi Bali Resort & Villa,"Jimbaran merupakan kawasan yang sibuk, tapi abi bali resort adalah seperti kita di dunia kita sendiri! Itu tenang dan damai dan kamar yang indah.  Kolam renang di bagian itu menyegarkan untuk berenang di, dan di pagi hari!  Sarapan adalah layak dan staf sangat membantu. Pasti akan pergi kembali ke sini.",4
74, Abi Bali Resort & Villa,"Layanan yang luar biasa! Ini adalah pertama kalinya kami di bali dan resor ini indah! Begitu bermanfaat penise. Makanannya luar biasa! Pasti akan kembali! Di area hijau terdapat resor yang terawat baik. Ruangan itu besar dan kamar mandi dan shower luar ruangan membuat perjalanan ini luar biasa. Hotel ini jauh dari kesibukan dan keramaian, tapi masih dekat dengan tindakan. Dekat dengan pantai.",5
75, Abi Bali Resort & Villa,"Reaksi pertama saya ketika aku memasuki kamar saya, wow. Tempat tidur itu begitu besar bahwa itu bisa tidur 3 untuk 4 dewasa comfortablely. Kamar, kamar mandi yang sangat luas. Mereka juga pergi untuk pijat bali, pijat sudah siap baik hanya bahwa itu agak kurang dari 1 jam sebelumnya (sekitar 50mins) yang saya sudah dibayar untuk.  Saya terutama seperti layanan yang disediakan oleh salah satu jongkos, baru. Ia selalu berusaha untuk memulai percakapan dan ini membuat orang merasa di rumah.",4
76, Abi Bali Resort & Villa,"Saya empat malam tidak mulai baik seperti itu tidak bekerja di kamar saya ketika saya tiba terlambat pada malam pertama. Untuk kredit mereka mereka upgrade saya ke sebuah villa kolam renang yang sensasional, tetapi juga memiliki sangat buruk sehingga tidur saya itu tidak besar. Mereka pindah kami lagi keesokan harinya (sayangnya kembali ke junior suite aku memesan) dan itu benar-benar bekerja minimal. Tempat yang besar. Kamar mandi luar ruangan yang indah dan memiliki kolam renang di luar pintu. ",4
77, Abi Bali Resort & Villa,"Mencintai setiap menit dari kami tinggal di sini dan berharap kami telah memilih untuk tinggal di sini lagi. Kami memiliki sebuah villa dengan kolam renang pribadi dan kami kagum dengan ukuran villa dan kami memiliki kolam renang untuk diri kita sendiri. Stafnya luar biasa. Selalu sopan dan bermanfaat, dan selalu siap untuk ngobrol dengan anda atau menawarkan menasihat pada berjalan-jalan ketika ditanya. Itu adalah hari ulang tahun saya ketika kami berada di sana dan aku terkejut dengan makanan gratis dan happy birthday... perlakuan khusus yang tidak akan terlupakan.  Kami makan di sana beberapa kali dan makanan selalu luar biasa dan harganya sangat terjangkau. Layanan antar-jemput gratis yang sangat berguna. Kami mengambil ini ke supermarket lokal di hari pertama kami berada di…",5
78, Abi Bali Resort & Villa,"Layanan sangat baik dan staf, sangat penuh perhatian dan bermanfaat. Kamar sangat bersih dan dilengkapi dengan pancuran dalam dan luar ruangan. Kolam itu juga bersih dan telah matahari sebagian besar hari. Kami makan di sini dua kali dan kedua kali, sarapan dan makan malam makanan itu disajikan dengan baik dan sangat lezat. Hanya turun jatuh tetapi membayar untuk taksi untuk berkeliling seperti tidak banyak dalam jarak berjalan kaki. ",4
79, Abi Bali Resort & Villa,"Kami tinggal di sini selama empat malam dan telah perawatan spa yang benar-benar baik untuk pasangan. Layanan yang baik, staf yang ramah, tetapi bisa telah lebih penuh perhatian dan restoran ini disajikan dengan harga yang layak dan makanan lezat. Satu-satunya masalah yang kita punya adalah dengan layanan wifi. Kadang-kadang bekerja, kadang-kadang tidak begitu banyak.  Secara keseluruhan, ini pengalaman menginap yang sangat nyaman: ) ",4
80, Abi Bali Resort & Villa,"Vila ini sangat indah dan manfaat dari memiliki kolam renang mereka sendiri. Ini adalah nilai yang baik dan hotel ini sangat bagus juga.  Kami harus memindahkan beberapa kali, namun karena kelembaban/kelembapa di kamar dan sarapan dan makanan di resor ini meninggalkan banyak yang harus diinginkan. Bahan-bahan segar atau makanan kualitas yang lebih baik akan pergi jauh terutama karena untuk fakta bahwa hotel ini sangat terisolasi dari kota utama atau toko. ",3
81, Abi Bali Resort & Villa,"Layanan Yang Luar Biasa Tenang Santai Bersih Nilai untuk uang penawaran Staf adalah sangat membantu Menu restoran/makanan persiapan yang baik, tetapi dapat memiliki masakan yang berbeda & variety Secara keseluruhan... hotel ini adalah sangat menyenangkan untuk bermain... ",5
82, Abi Bali Resort & Villa,"Tidak ada cara anda bisa mengeluh tentang kualitas, atau standar kamar. Kamar besar, kamar mandi luar, berpendidikan di kamar mandi, kamarnya standar di bali yang lebih baik.   Staf yang penuh perhatian, tulus dan bersemangat untuk menyenangkan. Semua kamar memiliki komputer dan standar mereka pelatihan sangat tinggi. Tempat ini menyenangkan.  Tapi ini... Dan ini sudah disebutkan sebelumnya dalam ulasan ini adalah wifi. Olok-Olok. Lumpur dan sangat lambat.   Aku mengambil kesepakatan' misteri ' di agoda, anda memesan hotel ini tidak tahu hotel mana anda telah memesan. Ketika aku menyadari. Aku pergi untuk membatalkan, tapi tidak bisa melakukannya. wi-fi adalah sangat penting bagi saya ketika saya bepergian, untuk tetap berhubungan dengan keluarga dan ibu saya dalam hukum yang…",3
83, Abi Bali Resort & Villa,Benar-benar mencintai hotel ini. Ini sempurna untuk hanya mendekat berapat-di bawah selimut dan menonton tv sepanjang hari dan memesan layanan kamar! Layanan bagus - menyenangkan dan sangat cepat!  Kamar yang mewah dan nyaman. Makan di sini. Kamar mandi besar.   Menu restoran adalah cukup murah dan makanan benar-benar baik.   Hanya 20 menit berjalan kaki atau naik taksi singkat ke pantai umum dan laut kafe. Terletak hanya dekat rumah yang muncul di rock bar - tempat yang sempurna untuk mengunjungi untuk matahari terbenam!  Kamar memiliki dvd player sehingga mengambil beberapa film dan pergi. Tersedia juga gimnasium berfasilitas lengkap dan spa.,5
84, Abi Bali Resort & Villa,"Resor ini melebihi semua harapan. Layanan pelanggan adalah kedudukan tertinggi, makanan yang besar dan kamar mandi baik dilengkapi dan sangat sangat baik.  Mereka mungkin berdiri beberapa kejenisan catatan dengan layanan kamar juga tanggapan kali! Secara keseluruhan, sebuah pengalaman kelas atas. Pasti akan tinggal di sini lagi.",5
85, Abi Bali Resort & Villa,"Suami saya dan saya menghabiskan 5 malam di hotel ini menakjubkan villa dengan kolam renang pribadi. Saya berenang di pagi hari untuk memulai setiap hari adalah hanya menakjubkan. Jimbaran merupakan kawasan yang relatif kecil dan tenang di seminyak dan kuta yang sangat baik, tapi hal yang baik adalah tidak ada banyak lalu lintas, terdapat berbagai restoran hidangan laut di pantai jimbaran (yang sangat indah dengan 2 pantai) yang merupakan 5 menit ditambah beberapa seperti lima minggu restoran dan bar di dekat lokasi. misalnya batu bar dan intercontinental resort juga sangat baik tempat untuk bersantai. Saya akan merekomendasikan untuk orang-orang yang lebih suka jimbaran beberapa waktu tenang. Abi bali menyediakan antar-jemput gratis dan transfer dari/ke bandara. Cukup beragam…",4
86, Abi Bali Resort & Villa,"Saya tinggal di resort selama 4 malam abi bali. Saya telah memesan 5 tapi pesawat kami dibatalkan untuk sepanjang hari. Saya tidak dikenakan biaya untuk malam saya tidak membuatnya, untuk yang saya bernama berterima kasih. Kamar saya memiliki pandangan di atas kolam renang.  Staf sangat membantu dan ramah. Menu sarapan pagi sangat bervariasi dan baik nilai.  Saran saya akan bahwa kolam renang diperlukan sedikit lebih pembersihan, mungkin dengan sikat karena sangat licin di beberapa tempat.  Tidak mengambil shuttle bus di mana saja jadi saya tidak tahu bagaimana yang berlari... Itu tidak yang dekat berjalan kaki ke cafe atau pijat, transportasi jadi akan diperlukan... tapi ini adalah mudah untuk mengatur sebagai per biasa cara bali   Saya akan senang menginap di sana lagi",4
