,hotel,review,stars
129, Abi Bali Resort & Villa,"Hotel yang bagus. Nilai untuk uang.  Sarapan adalah sangat baik dan mengisi. Ada berbagai untuk memilih dari bahkan vegetarian.  Kamar yang bersih dan baik mainitained (hotel dibangun tahun 2010 sehingga semua perabot dan perlengkapan baru). Toilet berkilau bersih dan sangat luas (mungkin sebagai besar sebagai kamar tidur!) Ada terbuka mandi dan bak mandi. Kelemahan: kadal di kamar kecil tapi ok coz mereka pergi bersembunyi segera setelah mereka melihat manusia!  Diberi sebuah gratis 20 menit pijat voucher hotel spa tapi bisa tidak menggunakan itu yang seperti sedang berada di kota sampai terlambat. Kolam outide hanya kamarku.rasanya! Kelemahan: Hotel terletak di bukit dan dibutuhkan hanya 20 menit untuk sampai ke Kuta. Namun, salah satu harus memesan taksi setiap kali. DONOT…",5
130, Abi Bali Resort & Villa,"Menyukainya. Kamar deluxe kami adalah besar. Besar. Memiliki kebun, mandi udara terbuka dan bak mandi. Kolam renang yang sangat pribadi adalah 5 kaki dari pintu kamar kami. Layak USD100 kita dibayar per malam seperti itu seperti sebuah vila kepada diri kita sendiri! Sangat pribadi dan tenang. Kami memiliki cabanas dengan diri kita sendiri. Hotel menyediakan antar-jemput gratis ke mana saja di Jimbaran sehingga kami mengunjungi pantai yang bersama dengan empat musim hotel. Mengunjungi Rock Bar sebelah di Ayana Resort. Makan dua kali makanan laut di pantai Jimbaran. Kami menyukainya. Hanya hal itu sejak yang begitu tenang dan dekat dengan alam dan aku takut creepy crawlies, aku panik pergi ke kamar mandi setelah gelap dan setelah melihat kadal beberapa di pagi hari dekat kamar…",5
131, Abi Bali Resort & Villa,"Kami (saya, istri saya dan bayi 9 bulan kami) tinggal di sini 4 malam di kamar Deluxe. Ketika kami memasuki ruang untuk pertama kalinya kami terkejut semua gembira sebagai ruang besar, bersih dan modern dan kamar mandi dengan mandi udara terbuka besar juga! Tempat tidur itu pasti yang terbesar pernah kulihat.  Olahraga dan ruang permainan adalah sedikit lelucon. Aku punya min. 45 kaki pijat di spa hotel itu pengalaman menyenangkan dan tidak terlalu mahal. Restoran adalah sebelah parkir dan tidak dilihat paling menarik. Sarapan adalah baik-baik saja dan Anda dapat memilih dari beberapa jenis sarapan. Kami telah makan siang dan makan malam beberapa kali ada dan makanan yang cukup baik dan harga terjangkau.  Staf (pada penerimaan dan restoran dan pembersih) yang sangat ramah,…",3
132, Abi Bali Resort & Villa,"Hotel ini indah tapi lokasi tidak sangat baik.Tinggi di bukit dari pantai Jimbaran berarti menggunakan hotel shuttle, taksi atau menyewa mobil untuk pergi ke mana pun. Kamar indah dan kenyamanan tingkat tinggi. Staf menyenangkan dan bermanfaat. Restoran bisa berbuat lebih baik.Sarapan adalah Ok tapi ketika kami turun di ke malam dan benar-benar harus menggunakan restoran makanan dan suasana yang disapointing.",5
133, Abi Bali Resort & Villa,"My hubby & saya baru-baru ini tinggal 2 malam di villa 1 kamar. Kolam renang pribadi baik dan ramah. Tempat ini nyaman dan baik bagi mereka yang hanya pilihan tempat yang cukup untuk menganggur dan berbaring kembali untuk beberapa hari.  Masalahnya hanya agnoying kami mengalami adalah tikus! Entah bagaimana pada malam 2 setelah lampu pergi sebelum aku tertidur, terdengar suara dan kami menemukan itu tikus yang mencoba untuk keluar dari ruangan! Kami harus mendapatkan staf untuk bantuan dan pergi bersembunyi setelah kami pada cahaya tapi untungnya staf mengelola untuk menangkap makhluk kecil. Meskipun bukan makhluk besar, itu agak menempatkan kami dan berterima kasih itu tertangkap. Kemudian, setelah 2 jam, hubby dibangunkan oleh suara beberapa lagi, dan dalam kegelapan, ia…",3
134, Abi Bali Resort & Villa,"Kami menyukai kami tinggal di sini baru-baru ini. Hotel ini hanya 5 bulan dan sangat bersih dan terawat dengan baik. Kami memesan online dan diperhatikan di sekitar $ 100/malam.   Kolam itu hangat dan bersih. Kamar mandi luar ruangan besar dan kita mengambil banyak foto sehingga kita bisa meniru ini di rumah kita sendiri! Batu-batu itu dengan hati-hati disusun, mandi tampak sangat menarik juga.  Sarapan adalah wajar tapi tidak fantastis, meskipun kopi yang dibuat untuk itu. Kami memesan beberapa di ruang makan - tuna di daun bananna dan sezchuan sapi berdasarkan rekomendasi staf dan itu lezat, dan murah di sekitar 30-40 k per piring. Ada tidak ada koktail di hotel yang mengecewakan, tapi mereka memiliki kapur kacau minum pada menu sehingga kami menambahkan vodka kita sendiri dan…",5
135, Abi Bali Resort & Villa,"Tinggal di sini selama 2 malam pada akhir perjalanan 4 minggu kami bepergian Bali.  Pro: - harga adalah benar-benar masuk akal untuk sebuah hotel bintang 5, semua hotel di kategori ini di daerah jauh lebih mahal. -Desain indah, indah mebel dan bangunan terbuka yang indah dengan banyak tanaman mekar dan bunga-bunga sekitar - ruangan itu luas dan benar-benar bersih dengan tempat tidur besar - kamar mandi adalah AMAZING! Mencintai aspek udara terbuka dan mandi. -Pilihan 2 kolam renang, telah mereka untuk diri kita sendiri semua hari, benar-benar nyaman sunloungers - lokasi yang sangat baik untuk bandara (yang adalah mengapa kami memesan) hanya 15mins drive dan gratis transfer jika Anda tinggal 2 malam - ramah staf kontra:-makanan hanya ok, Sarapan adalah mengerikan. Restoran…",4
136, Abi Bali Resort & Villa,"Saya pikir wisatawan sesama Perancis di bawah ini adalah sedikit tidak seimbang dan mungkin terlalu keras. Aku Villa pribadi (Marma 3) untuk satu malam.  Pro:-Villa fantastis: besar furniture, desain dan gaya (termasuk terkemuka Toto mandi alat), dapur, renang indah, pohon, ukuran super kingbed, besar layar datar tv, minibar gratis. -Lokasi sangat tenang, jauh dari restoran, Bar, klub dan jalan-jalan besar trafficated. -Excellent makanan, kedua Barat dan Indonesia - staf yang ramah - layak SPA yang berdekatan - antar-jemput gratis ke Jimbaran beach setiap jam Contras: - agak jauh dari pantai Jimbaran, baik 15 menit berjalan lereng diperlukan - staf sedikit unexperienced dan mungkin terlalu muda untuk sebuah komplek villa mewah, meskipun sangat ramah dan menampung. -Internet…",5
137, Abi Bali Resort & Villa,"Orang-orang Excellent, mereka membantu kami dengan segala sesuatu. Tempat merek baru dan kamar yang luar biasa, fantastis sarapan, Excellent dalam setiap aspek. Hampir diperlukan untuk menyewa mobil untuk bergerak di sekitar Bali, tetapi biaya adalah sekitar 120 dolars seminggu.",5
138, Abi Bali Resort & Villa,"Kami tinggal selama 4 hari dan berharap sudah lama, Abi Bali telah baru-baru ini membuka dan baru seperti yang Anda dapatkan, mereka terletak di bukit di atas Jimbaran bay tentang 1klm masa lalu empat musim hotel, tinjauan tidak benar-benar ada tetapi vila-vila menebus kerugian, staf yang wonderfull dan bermanfaat, mereka memiliki sebuah restoran kecil yang melayani makanan yang sangat baik, kami tinggal di Junior suite, tempat tidur ekstra besar kingsize, 42 ""baru plasma, + DVD, daerah Lounge kecil dan inside\outside kamar mandi dengan bak mandi besar, baik dingin AC, immpeccably bersih. Resor ini memiliki layanan antar-jemput gratis ke Jimbaran atau ke Kuta, hanya buku 1 jam di muka atau taksi ke Kuta sekitar 50, 000Rp. 2 kolam renang yang bagus untuk Villa tanpa kolam renang…",5
