,hotel,review,stars
0, Adila Bali,"Yah, pertama ini bukan hotel. Anda perlu menyesuaikan harapan Anda. Tetapi percayalah bahwa Anda akan merasa seperti di rumah. Saya memiliki kunjungan singkat dengan suami saya tetapi kami menghargai setiap menit yang kami habiskan di sini. Itu sangat tenang (selain dari suara mobil atau truk yang lewat) dan angin, banyak angin. Kami menghabiskan hari pertama kami hanya dengan berbaring di tempat tidur, menikmati angin (kami mendapat kamar di lantai dua, kami membuka jendela kamar mandi dan pintu balkon kami, dan voila!), Dan kemudian suami saya mendapat pijatan dan saya memutuskan untuk pergi ke lantai dasar, memilih matress dan hanya berbaring di sana, berterima kasih atas hidupku, haha.  Jadi Anda mendapatkan ide tentang tempat ini kan?  Ruangan itu besar (kamar no 2), kamar…",5
1, Adila Bali,"Hotel itu sendiri dirancang dengan sangat indah, memiliki banyak ruang yang nyaman dan terbuka. Anda dapat mengambil jus atau kopi, buku yang bagus dan bersantai di area terbuka hotel. Ini memiliki banyak detail yang bagus dan sudut-sudut yang dirancang dengan indah. Kamar sangat luas, bersih dan memiliki pandangan yang baik (orang-orang yang berada di lantai atas). Kami tinggal di hotel ini setelah perjalanan satu minggu yang aktif di Bali dan Gili T, oleh karena itu suasana santai ini sangat baik untuk kami dan pada waktu yang tepat :) Sarapan juga luar biasa. Hotel hanya menyediakan makanan vegetarian, tapi kualitasnya sangat bagus. Rumah dibuat mangga, pepaya, selai buah naga. Semoga Anda membayangkan warna-warna di atas roti panggang? ! :) Granola juga luar biasa!…",5
2, Adila Bali,Adila hotel adalah rumah yang jauh dari rumah. Anda langsung merasa seperti tamu yang disambut dan tidak menawarkan apa pun kecuali bantuan. Hotel ini menawarkan makanan dan minuman yang sangat baik dari staf yang ramah. Kamar memiliki pandangan yang sangat baik dan indah. Kelas yoga yang ditawarkan layak biaya dan studio terletak di tingkat yang lebih rendah menawarkan pemandangan yang sangat baik juga. Jujur saja tidak ada yang salah dengan tempat ini.,5
3, Adila Bali,"Adila Bali adalah tempat yang indah dan damai untuk menenangkan diri dan bersantai. Pacar saya dan saya menghabiskan tiga malam di sana dan kami benar-benar kagum dengan ""hotel"" ini yang terasa lebih seperti rumah. Dari sudut pandang kami, ini adalah yang terbaik dari semua hotel yang kami kunjungi dalam 3, 5 minggu di Indonesia. Atmosfer super dingin, makanan (terutama sarapan) mendapat 10/10; Saya makan terlalu banyak karena semua rumah baru dibuat dan sangat lezat. Kamar sangat indah, luas dan bersih, begitu juga kamar mandi dan seluruh sisa properti. Anda juga berkesempatan untuk melakukan Yoga yang sangat menyenangkan. Harga - kualitas - rasio sangat baik. Saskia selalu untuk sedikit mengobrol, membantu dan prihatin tentang para tamu, kami merasa sangat disambut dan akan…",5
4, Adila Bali,"Kami menghabiskan dua malam di Adila dan kami harus mengatakan; itu hebat. Villa indah dan Saskia adalah tuan rumah yang luar biasa. Dia sangat ramah dan hebat dalam merekomendasikan pantai terpencil dan tempat makan. Ruangan itu bersih, baik dilengkapi dan umumnya bagus! Skuter yang kami sewa dari rumah memberikan banyak kebebasan untuk berkeliaran di daerah Uluwatu. Semua dalam semua tempat yang bagus dengan tuan rumah yang hebat!",5
5, Adila Bali,"Setelah berada di rumah selama seminggu ( 2 minggu setelah mengunjungi Adila) , saya telah menemukan cara untuk menggambarkan pengalaman kami menginap di Villa Adila hangat, Ungasan. Kami disambut dengan kehangatan dan keramahan seperti yang kita tahu itu akan menjadi tempat menginap yang luar biasa. Setelah memasuki kamar, yang dipandu oleh Saskia, kami menyaksikan kebersihan dan perawatan yang telah dimasukkan ke dalam kamar oleh para staf. Air dari keran bisa diminum karena mereka mempersempit air mereka sendiri! Tempat ini cukup tenang dengan pantai rahasia yang indah sekitar 5 - 10 menit dengan skuter. Jika diperlukan, Anda dapat mencapai lebih sibuk dalam 15 menit! Dari Adila sangat mudah untuk mencapai pantai Balangan atau Bingin. Mereka memiliki semua opsi dituliskan…",5
6, Adila Bali,"Ketenangan dan pemandangan hijau yang subur di sekitar properti ; suasana , interior - semuanya menenangkan jiwa dan memberikan Anda kedamaian . Tetapi pemesanan saya dan komunikasi lebih lanjut dengan properti happenened melalui pemesanan. com sepenuhnya. Menurut Adila Bali website mereka (yang saya tidak lihat sebelumnya ). Kamar saya di lantai bawah di properti ini (bernama Lima) , tetapi sementara untuk mereka oleh taliking mail mereka menginformasikan saya ada di lantai dua. Tetapi, pada kenyataannya, di lantai bawah dan memiliki pemandangan laut yang minimal yang di bawah standar atau tidak sesuai dengan harga yang ditetapkan oleh pemesanan. com . itulah yang mengecewakan! Pemiliknya juga cukup judgmental dari awal sampai akhir tentang tamu, saya merasa mual semua 3 hari…",3
7, Adila Bali,"Kamar kami besar, pemandangan yang bagus, balkon yang bagus dan penyejuk udara. Kaskia dan staf sangat luar biasa dan tidak bisa lebih ramah dan membantu. Pantai yang bagus di sekitar tetapi juga kolam renang yang indah di hotel untuk bersantai. Pasti akan kembali",5
8, Adila Bali,Saya dan saudara saya sangat menyukai pengalaman menginap kami di Adila! Sarapannya lezat dan meskipun dapurnya sudah tutup ketika kami tiba mereka membantu kami memesan makanan dari luar. Kamar kami bersih dan nyaman dan memiliki sentuhan hangat di rumah. Kolam renangnya memiliki pemandangan yang menakjubkan dari lanskap! Mereka memberikan kami rekomendasi untuk melihat pemandangan dan restoran untuk makan di - cara ini kami berakhir di restoran vegetarian kunyit yang paling lezat. Area ini indah dan pantai yang berbeda dari bagian lain dari Bali. Sangat menantikan untuk datang kembali ke sini lagi!,5
9, Adila Bali,"Adila Bali adalah tempat yang indah. Hotel terbaik yang pernah saya telah memesan selama perjalanan saya di Bali! Manajer hotel dan staf membuatnya sangat mudah untuk merasa nyaman dan menikmati tinggal. Saya pasti akan datang kembali.  Kamarnya sebanding untuk standar Eropa: besar, sangat bersih, ditata dengan baik, kamar mandi besar, bersih, dengan suasana seperti spa. Air di hotel ini disaring dan dapat digunakan untuk/ mabuk menggosok gigi anda.  Staf sangat membantu dan sangat ramah. Mereka membantu anda mengatur skuter, transfer dari bandara atau taksi untuk sebuah perjalanan. Sebuah wanita pijat dapat memesan ke hotel untuk harga yang wajar dari 100 ribu rupiah untuk 60 menit pijat. Ada peralatan yoga yang tersedia dan guru yoga yang datang ke hotel ini dua kali seminggu…",5
10, Adila Bali,"Kami menghabiskan hari terakhir kami di Bali di sini dan berharap kami bisa tinggal lebih lama. Villa, bagian dalamnya dan lingkungan sekitarnya luar biasa! Tapi apa yang membuat tinggal di sini sangat bagus dan pemilik dan staf. Mereka punya saran terbaik dan pilihan restoran di daerah, lebih penting lagi mereka membuat Anda merasa seperti di rumah sendiri! Sarapan adalah sehat dan sangat lezat dan juga makan Siang/Makan Malam. Menurut kami porsinya sangat mirip dengan apa yang kita biasanya mendapatkan di Bali dan Lombok. Di Adila kami mengalami apa yang membuat orang datang kembali ke Bali lagi.",5
11, Adila Bali,"Kami tinggal di sini selama 2 malam dan berharap sudah lama. Pemilik sangat bagus dan bahkan lebih bagus dalam email dari orang, semua staf yang sangat ramah dan membantu. Kami tiba terlambat dan mereka membantu mengatur sarapan dibawa dan meninggalkan lebih awal dari waktu tapi staf yang datang di awal untuk makan kami! Mendapat upgrade gratis di kamar yang menghadap bukit dan laut. Kamar sangat besar, selesai untuk standar yang tinggi dengan kamar mandi yang modern juga. Kolam renang luar biasa dan kami akan menggunakan tempat ini lagi! Villa ini terletak di daerah yang tenang tapi wilayah ini tampak tersebar. Mereka membantu kami mengatur menyewa skuter Jadi Kami mendesing di sekitar itu. Pemilik tahu daerah baik dan akan membantu Anda memilih pantai terbaik untuk pergi ke…",5
12, Adila Bali,"Ini adalah tempat favorit kami untuk tinggal selama 2 minggu liburan kami di Indonesia untuk alasan berikut: staf yang sangat ramah, pemilik membuat Anda merasa di rumah dan sangat ramah dan menyambut, tempat yang ideal untuk menginap bagi mereka yang seperti hotel butik daripada resor besar, sangat baik dan bervariasi sarapan dan makan siang (setiap hari ada spesial juga biasanya menawarkan), vila ini didekorasi dengan rasa yang sangat baik, kamar yang sangat besar (terbesar kami telah begitu jauh di Bali) dengan kamar mandi yang indah, hotel ini menawarkan pemandangan yang indah dari Uluwatu dan terletak di daerah yang tenang, Anda dapat menyewa sepeda motor untuk pergi ke pantai atau melakukan wisata Uluwatu/pergi ke Jimbaran untuk beberapa makanan laut",5
13, Adila Bali,"Kami tinggal selama 3 malam di Adila dan kami memiliki waktu yang besar.  Kamar dan kamar mandi termasuk teras yang sangat luas dan bersih. Dekorasi yang indah dalam kamar dan area umum. Staf di Adila sangat membantu mengatur pemesanan makan malam/rekomendasi dan naik.   Apa yang kami menghargai sangat banyak yang tidak sarapan pagi. Hotel ini sangat baik dengan rumah dibuat selai, roti dan buah segar. Anda juga dapat memilih dari tiga hidangan dari menu (e. g. telur, pancake Granola dan) tapi porsi yang sangat kecil dan ketika meminta untuk membantu kedua, kami diberitahu bahwa kami bisa kemudian hanya dengan satu telur omelet karena kami telah memesan satu porsi. Tidak bagus untuk sebuah hotel dengan sarapan prasmanan.  Juga caesar salad yang kami terima untuk makan siang…",4
14, Adila Bali,"Kami tinggal di sini selama 10 hari Minggu lalu. Segala sesuatu tentang tempat ini luar biasa. Tuan rumah yang fantastis dan ramah, terutama Sab, terima kasih banyak untuk semua yang Anda lakukan bagi kita.  Sarapan sangat sehat dan berlimpah. Segar membuat jus setiap hari, seperti sentuhan, orang-orang ini benar-benar tampak untuk memahami bahwa hal-hal kecil yang membuat perbedaan besar.  Kamar kami adalah besar, dan sangat bersih, dengan kamar mandi yang proporsional dan toilet. Kami memiliki taman kecil kita sendiri pribadi teras yang sangat damai dan sangat bagus untuk menikmati kopi di pagi hari.  Kolam renang sangat bagus, dan tempat yang sempurna untuk bersantai setelah hari yang panjang di pantai. Ada banyak restoran di daerah, saya akan merekomendasikan mendapatkan…",5
15, Adila Bali,"Apa yang mulai perjalanan kami yang khusus. Kamar dan balkon yang sangat luas dan bersih. Tempat tidur dan bantal yang saya ingin di rumah! Sarah dan Oscar dan Julia, terima kasih untuk membuat kita merasa di rumah. Makanan yang luar biasa dan sangat enak. Setiap makanan yang mengejutkan. Staf memberi kami tumpangan ke dekat ogoh-ogoh. Nyepi dan hari berikutnya. Bagi kami yang tinggal di dan mencerminkan. Setelah percakapan yang menarik dengan tamu lain dan menikmati pemandangan, makanan dan kolam renang sangat bersih dan menyegarkan. Sebelum makan malam renungan oleh Julia, hanya membiarkan semuanya pergi. Untuk merasakan kecerdasan dari bintang dan tanpa polusi cahaya. Kami tidak bisa meminta tempat yang lebih baik untuk tinggal.",5
16, Adila Bali,"Saya mendapat kesempatan untuk tinggal di sini selama dua malam. Menginap di sini sangat menyenangkan. Makanan yang disiapkan di sini adalah menakjubkan yang dibuat dari awal dan sangat sehat dan sangat murah. Jika Anda ingin makan di luar Anda memiliki pilihan itu juga tetapi bagi mereka yang merasa seperti tinggal di, makan di rumah adalah selalu pilihan yang luar biasa untuk kualitas makanan. Rumah itu sendiri adalah cukup banyak yang indah dengan pemandangan menakjubkan dan bagus untuk bersantai. Staf adalah juga sangat ramah dan menyambut dan menginap di Adila House adalah lebih seperti tinggal dengan teman-teman. Staf adalah bahkan jenis cukup untuk membawa saya ke pasar sehingga saya dapat melihat pasar seperti. Semua orang di sana adalah sangat bagus dan sangat menarik…",5
17, Adila Bali,"Hal yang baik tentang tempat ini adalah staf yang ramah yang membantu kami dengan (untuk exemple) menyewa skuter. Mereka menawarkan pijat di atap dan juga yoga. Kamar kami adalah benar-benar baik - sangat segar. Sayangnya mereka drillning sebelah, jadi itu berisik. Kolam renangnya juga OK, cukup sederhana. Kami melewatkan Yang Baik secangkir kopi di sini. Mereka memiliki kopi, tetapi tidak banyak rasa. Cukup gila ada gempa bumi hari terakhir kami di sana, jadi mungkin hingga saya dari tempat ini adalah sedikit dipengaruhi oleh itu.",3
18, Adila Bali,Pengelola yang luar biasa! Pemandangan yang luar biasa. 5 bintang dan sarapan di pagi hari.   Komunikasi mereka adalah tepat setiap kali. Kelompok kami menghabiskan 2 hari di villa ini dan itu sangat menakjubkan! Kolam renang pribadi adalah luar biasa dan besar untuk berenang Lap.   Tempat tidur yang sangat nyaman dan tempat tidur yang barat.   AC membuat villa bagus dan sejuk meskipun panas di luar.,5
19, Adila Bali,"Seperti tempat yang indah untuk tinggal di Bali. Indah kolam renang yang menghadap ke laut, sempurna ruang yoga, dan dapur cocok untuk chef. Hanya 20 menit berjalan kaki ke Semi - pantai pribadi, dan cepat naik mobil untuk minggu di Beach Club.   Sempurna untuk beberapa pasangan yang ingin tinggal di lokasi yang sama dan menikmati hidup bersama atau ruang untuk Yoga/retret hidup sehat.   Saya berharap untuk kembali suatu hari di sini di perjalanan berikutnya ke Bali.",5
20, Adila Bali,"sangat ramah, suasana umum yang sangat baik dengan pemilik yang sangat ramah dan membantu host yang fantastis. Sarapan yang lezat, kamar yang bersih, nyaman, indah dan nilai yang fantastis! Panorama yang bagus (jauh) pemandangan laut dari kamar lantai atas. Sangat direkomendasikan!",5
21, Adila Bali,"Kami menikmati pemandangan yang indah dari kamar tidur kami. Itu tampak ke laut melewati lembah yang indah. Kamar yang luas dan kamar mandi. Setelah disaring air adalah perubahan yang menyenangkan dari vila lain kami tinggal di, tidak ada yang harus menggosok gigi dengan botol air sangat bagus. Kolam renang yang indah dan staf sangat bersedia untuk menunjukkan tempat menarik. Pasti akan datang lagi.",5
22, Adila Bali,"Ini adalah kunjungan pertama kami dan bulan madu di Bali juga. Kami memesan kamar di Villa di muka dan awaitig perjalanan.  Untuk mengatakan kebenaran Adila melebihi semua harapan kami! Tempat yang tenang, pemandangan yang indah, dengan kamar yang bersih dan interior yang sangat baik. jadi anda dapat menyambut fajar di balkon atau bahkan di tempat tidur, staf yang ramah, sarapan yang lezat dan juga sehat. sangat menyukai jus segar di sana.  Untuk lebih santai ada kelas yoga dan pijat.  Hotel ini juga memiliki lokasi yang baik di tebing jadi bahkan dalam cuaca sangat panas Anda akan merasa nyaman karena angin sepoi sepoi.  Untuk laut. Butuh waktu 7 menit dengan mobil untuk sampai ke pantai Pandawa (ini adalah salah satu terbersih di Bali) dan 20 menit ke Nusa Dua (keren surfing) …",5
23, Adila Bali,"Kami tinggal di sana selama 4 malam. Pemandangan yang luar biasa. sangat santai, damai. Dan makanan yang baik dan sehat. Saya tidak akan pernah lupa kue pisang dan alpukat dengan roti panggang sangat lezat. Ketika kami kembali ke Jakarta, kami harus pindah dari 1 bulan untuk liburan kami. Keunikan yang tinggal di sana, dan kami ingin kembali segera. adila bak untuk dua. ",5
24, Adila Bali,"Tempat yang sempurna~tidak ramai dan dikelilingi oleh suasana yang menyegarkan.  Kamar sangat luas, bersih dan nyaman, ohya mereka melayani sarapan sehat.   Duduk di balkon menghirup udara, disertai oleh suara burung",5
25, Adila Bali,"Kami tinggal 6 malam yang santai untuk memulai petualangan kami di Bali. Adila dan sempurna pada setiap tingkat. Modern, desain kolam renang yang terbuka siang hari dan ruang yang membuatnya sangat mudah untuk chatting dengan tamu lain atau anda sendiri ruang tenang - mana yang Anda suka. Kami punya kamar terbaik di vila dengan pemandangan laut yang menakjubkan - dan hembusan angin laut, namun semua kamar dirancang secara individual dan memiliki gaya yang unik.  Bersih, nyaman dan staf yang ramah - selalu tersenyum.  Lokasi sangat ideal untuk menjelajahi banyak pantai tersembunyi di bagian selatan Bali, tetapi Anda perlu baik skuter atau taksi untuk mencapai mereka. Mereka tidak berada dalam jarak berjalan kaki. Ini benar-benar tidak masalah di Bali - taksi sangat murah dan…",5
26, Adila Bali,"Sambil mencari informasi tentang di mana untuk menginap malam 3 kami di Bali, kami datang di Adila di Airbnb. Pemilik, Sandra (dari Belanda) dan merupakan (dari Singapura) sangat sangat membantu dengan rekomendasi lokal, termasuk sopir/Panduan pribadi yang membuat kami tinggal yang tak terlupakan di Bali. Reservasi asli kami untuk malam hanya 2, tapi kami menyukainya begitu banyak, kami tinggal di sana untuk malam 3 Rd.   Properti ini sangat baru dengan aman akses dari jalan yang tenang, yang membuatnya merasa lebih aman daripada tempat kecil; kamar yang sangat bersih, baik aliran udara, efektif AC, dan dilengkapi dengan kipas angin. Jendela dibuka lebar terbuka dan memungkinkan banyak cahaya matahari dan angin seperti yang Anda inginkan. Tempat tidur yang sangat nyaman, dan…",5
27, Adila Bali,"ENG: Adila adalah yang terbaik yang kami temukan di seluruh perjalanan kami di Bali selama 2 minggu. Kamarnya sangat luas, sangat bersih dan sangat nyaman. Staf luar biasa, Sandra sangat sangat sangat membantu dan ramah, kami merasa benar-benar diurus. TERIMA KASIH! PS! Pantai terbaik yang kami temukan di bali dekat Adila, mudah dijangkau dengan sepeda motor.   EST: Adila oli parim Koht, Mille Balilt leidsime oma saya 2 dan dalase reisi jooksul. Kodok di V GA avarad, puhtad, mugavad. T. Tajad bralikud supers. Sandra, kes di selle Villa - hotelli omanik, di v v v ga ga ga abivalmis ja k lalislahke ning T Esti tundsime hoituna akhir Seal. PS! Bali parimad rannad di Adilale v ga L hedal, lihtsasti rolleriga ligip. Setavad",5
28, Adila Bali,"Orang yang paling menakjubkan saya bertemu di sana, pemilik, staf, dan orang-orang yang tinggal di sana! Hotel terbaik yang pernah saya lihat. Kamar dan kamar mandi adalah sangat besar juga, sempurna! Terima kasih Sandra, Adila dan terutama Bali!",5
29, Adila Bali,Kami memiliki tinggal yang indah di Villa Adila. Sandra dan staf membuat kami merasa sangat welcome. Terutama di dapur dan meja besar membuat ini merasa seperti di rumah sendiri. Kolam renang yang indah dan memiliki pemandangan yang bagus dan bersantai. Sangat direkomendasikan! Kami pasti akan kembali!,5
30, Adila Bali,"Kami tinggal 3 malam. Malam pertama di lantai bawah, lainnya di lantai 2 nd 2 malam dengan pemandangan yang menakjubkan (dua kamar). Sandra adalah tuan rumah yang sangat membantu dan menyambut. Dia mengatur kami sopir Berbahasa Inggris - kami akhirnya menggunakan driver yang sama untuk seluruh 3 hari. Sarapan adalah sehat dan baik untuk perut Anda bepergian. Dengan beberapa jam Anda dapat memiliki kolam renang untuk diri Anda sendiri di rumah. Kamar bersih dan spaceful. Anda memiliki perasaan rumah baru. Punya tips yang baik untuk restoran. Walaupun tempat ini agak terpencil tidak masalah dengan taksi. Jika Anda berharap untuk lingkungan yang indah dan tips yang baik untuk memulai perjalanan Anda di Bali dan ini adalah pilihan yang baik untuk Anda. Hannu dari Finlandia dan - here",5
31, Adila Bali,"Memang kenyataannya jarang melebihi harapan saya didasarkan pada gambar.  Apakah anda mencari ketenangan atau kegiatan, ini adalah tempat untuk tinggal.  Kehangatan dan menolong host yang luar biasa. Desain dan lokasi villa tidak ingin untuk meninggalkan.  Jempol semua cara!",5
32, Adila Bali,"Adila bali adalah properti indah dan anda mendapatkan ini segera merasa di rumah saat anda langkah di dalam! !  Kamar luar biasa, luas, bersih dan pemandangan dari properti adalah hanya indah di mana-mana anda melihat.  Mereka memiliki kolam renang yang indah dengan loungers matahari sangat nyaman di sekitar dan tempat yang bagus untuk bersantai dan bersantai! !  Kunjungan kami adalah untuk memiliki liburan pendek santai dan hanya mengambil beberapa menit dari tiba di Adila bali, saya merasa dibawa ke sebuah dunia yang berbeda dan hanya mencintai damai ke mode liburan segera! !  Sarapan yang disajikan sangat luar biasa dan sandra "" s akses wifi adalah sooo lezat! ! !  Pasti tempat saya akan kembali untuk lebih dan lebih dari lagi! ! !",5
33, Adila Bali,"Ini tujuan adalah untuk menyediakan tempat yang tenang untuk tamu untuk bercengkrama dan bagian dari alam. Melihat pemandangan, sejuk dan kamar yang bersih. Berteriak khusus ke Madi yang selalu menyambut kami dengan senyum!",4
34, Adila Bali,"Teman saya dan saya tinggal di villa selama dua minggu Adila. Ini adalah sempurna. Kami segera menjadi bagian dari keluarga dan menikmati kami tinggal untuk santai. Sandra dan gula merupakan hanya dua menakjubkan host dan tidak bisa melakukan lebih baik! Juga staf di rumah adalah sangat ramah dan membantu.  Rumah itu sendiri adalah hanya sempurna: sangat baik dirancang, terbuka, modern dan selalu bersih. Kami menyukainya, untuk mengenal orang baru dari seluruh dunia dan duduk bersama-sama dan tertawa.  Kami sangat merekomendasikan villa Adila. Tempat yang luar biasa! ",5
35, Adila Bali,"Vila dan kolam renang yang sangat bagus. Pemandangan laut menakjubkan. Sandra dan merupakan sangat hangat, ramah dan sangat membantu. Kami pasti akan kembali ke tempat yang indah ini. Kami sangat merekomendasikan tempat ini untuk liburan. Banyak salam, Steffen & karsten",5
36, Adila Bali,"Tempat yang luar biasa, budaya, spiritual dan sedikit desain modern dengan indah host yang membuat tempat ini luar biasa. Kamar, besar, sarapan yang lezat dan host yang ada untuk membantu membuat pengalaman menginap anda menjadi pengalaman terbaik, dan berbagi dengan anda beberapa ide apa yang harus melihat di daerah",5
37, Adila Bali,"Merupakan & sandra segera membuat kami merasa diterima, kami tiba di jam awal pagi hari karena penerbangan kami tapi ini tidak masalah. Kami diberi yang indah dan sarapan ringan setiap pagi dan diberi banyak nasihat dan tips tentang tempat untuk mengunjungi di kami tinggal, ada kolam renang yang besar dan pemandangan yang menakjubkan dari daerah teras di luar kamar kami. Sangat direkomendasikan untuk kunjungan kami, terima kasih. ",5
38, Adila Bali,Rumah indah Hotel Yang Ramah Sandra dan sala sangat cerdas dan lembut Sarapan adalah hanya sempurna Kolam renang dan pemandangannya sangat beautiul Pantai dekat Momen yang hebat! Saya merekomendasikan tempat ini! ,5
39, Adila Bali,"Anda hanya harus membaca ulasan untuk melihat seberapa baik tempat ini. Saya tidak bisa terima mereka cukup untuk merupakan dan sandra keramahan yang hangat ketika saya menginap di sini, mereka benar-benar membuat saya merasa seperti bagian dari keluarga.   Aku tinggal di sini selama dua minggu dengan seorang teman sementara berselancar di bali, ini adalah di lokasi yang bagus untuk bersantai jauh dari keramaian dan hiruk pikuk kuta dan dikelilingi oleh pantai dan restoran. Hotel ini indah sepanjang, tapi apa yang membuat tempat ini adalah pemilik dan sandra yang merupakan benar-benar membuat anda merasa selamat datang, cuaca itu merekomendasikan pantai atau restoran, penyewaan sepeda motor, meminjamkan mereka tabir surya pribadi, dengan mengatur sarapan indah, bahkan pergi ke…",5
40, Adila Bali,"Saya dan mitra saya tinggal di sini selama beberapa hari pertama perjalanan kami di bali, tempat yang indah, ramah, tempat yang bersih, dan pemilik tidak bisa lagi sangat membantu dan ramah. sangat santai tinggal dan berharap untuk datang kembali! :) ",5
41, Adila Bali,"Tempat ini luar biasa. Pemandangan indah, sarapan besar, super bersih, dengan sangat ramah pemilik. Kami disambut di bandara dan dibawa ke rumah mereka di mana tampaknya paling hibiscus teh menunggu. Hotel ini bagus dan tenang, dan kolam renang yang sangat bagus untuk bersantai. Tanpa wifi, dan kamar mandi yang sangat bagus. Itu adalah sekitar 20 menit dengan berjalan kaki ke pantai terdekat, tapi anda akan memerlukan transportasi anda sendiri yang sandra akan dengan senang hati untuk mengatur untuk anda. Tidak sabar untuk kembali!",5
42, Adila Bali,"Pernahkah anda bermimpi memiliki sebuah villa mewah oleh sisi laut? Kemudian Adila adalah tempat untuk anda, hanya lebih baik. Rasanya seperti rumah, hanya anda bebas dari pekerjaan rumah. Semuanya adalah diurus, mulai dari penjemputan di bandara, untuk makanan dan sesi pijat pribadi dari staf yang terbaik dari daerah, yoga dengan pemandangan, penyewaan sepeda (atau mungkin anda ingin sopir pribadi untuk menjelajahi area ini? Hanya meminta!). Ini adalah yang terbaik di pulau ini terletak dekat dengan pantai, tergantung pada preferensi anda: surfing, snorkeling, atau cukup berenang. Atau, jika anda merasa seperti tinggal di, Adila memiliki kolam renang indah dengan air jernih yang menyegarkan. Kami tidak akan sama jika kita akan tinggal di tempat lain. Orang-orang kami bertemu,…",5
43, Adila Bali,"Kami tinggal di Adila bali sangat mengagumkan dan pasti terlalu singkat. Kami akan senang untuk tinggal lebih lama dan menikmati indah, spiritual, suasana rumah. Sandra dan merupakan sangat membantu dan ramah, bahkan ketika kami tiba sangat larut malam dan mereka menyambut kami sangat hangat. Tempat ini dihias dengan cantik, dengan pemandangan yang menakjubkan di laut dan memiliki banyak tempat yang bagus untuk bersantai. Kamar kami bagus dan bersih, sarapan lezat dengan jus segar, rumah dibuat muesli dan telur orak. Ini adalah tempat di mana anda ingin untuk kembali lagi! Saya harap kami akan tahun depan :) ",5
