,hotel,review,stars
44, Adila Bali,"Jika anda dapat percaya, Adila bali adalah bahkan lebih indah daripada gambar orang di dalam! Ini benar-benar sebuah tempat magis. Tempat yang indah untuk mengambil mudah dan mengisi kembali untuk beberapa hari. Bangunan yang spektakuler - bagi mereka dengan penghargaan untuk arsitektur - anda pasti akan kagum dengan desainnya. Rumah ini juga tanpa cela dihiasi; setiap detail memikirkan dan terakhir untuk diperhitungkan. Sarapan adalah segala sesuatu yang anda berharap untuk, dan banyak lagi. Sehat, lezat dan indah siap! Sandra dan merupakan meskipun... mereka benar-benar hal terbaik tentang rumah. Dua orang yang paling baik yang pernah saya temui. Rumah memiliki begitu banyak tempat yang indah, menarik tamu sementara aku berada di sana, juga! Saya berharap untuk datang kembali…",5
45, Adila Bali,"Segera setelah anda tiba ke tempat ini indah, anda merasa benar-benar santai dan nyaman. Bagian yang berbeda dari rumah memberikan nuansa yang unik, sehingga tempat ini sangat menarik untuk bergerak di sekitar. Sarapan adalah luar biasa, disajikan di tepi kolam renang, dan dengan berbagai macam buah-buahan segar dan sehat, organik roti dan selai. Kamar memiliki karakter dan menyediakan benar-benar nyaman, dengan baik udara dan cahaya yang datang. Dan sandra adalah tuan rumah yang merupakan sebuah kebahagiaan untuk membuat anda merasa seperti teman lama, dapat membantu dengan penerbangan, transportasi dan tips di tempat terbaik untuk makan dan menjelajahi bagian bali yang kurang berhasil. Aku akan mengatakan bahwa jika anda tidak tinggal di sini, anda tidak ada pengalaman yang…",5
46, Adila Bali,"Segala sesuatu tentang Adila bagus, sandra dan merupakan adalah tuan rumah yang fantastis dan akan melakukan yang terbaik yang mereka bisa untuk mengakomodasi setiap kebutuhan anda, dan staf sangat membantu. Kamarnya berdekorasi penuh cita rasa, dan bersih dan 5 dari 6 kamar memiliki pemandangan indah ke arah laut. Adila adalah tempat yang sempurna untuk menikmati keindahan sejati bali dan bersantai jauh dari toko, dalam jarak berjalan kaki ke pantai Greenbowl. Sarapan sehat di Adila adalah segar dan lezat, disajikan di meja panjang komunal terbuka, samping kolam renang melihat keindahan alam dapat menawarkan. Disarankan untuk mengatur beberapa transportasi untuk mendapatkan keluar dan sekitar, tapi lagi sandra dan akan membantu dengan saran untuk merupakan detil atau sopir…",5
47, Adila Bali,"Saya tidak suka dengan Adila rumah luar biasa ini. Saya sangat menyukai ruang terbuka, arsitektur materi, warna dan semua rincian seperti meja, sofa dan suara air yang indah. sangat bagus dan baik dilengkapi kamar dengan tempat saya bisa berlatih yoga saya dengan pemandangan laut. Saya sangat menyukai kamar saya. sangat nyaman dan layanan yang ramah - para staf. Aku merasa seperti keluarga dengan sandra dan sarah. Terima kasih banyak! Juga sarapan di pagi hari adalah benar-benar lezat. Kami mencintai buah dan granola muesli! Salah satu yang terbaik yang kami pernah makan muslis! Kami pasti akan kembali ke tempat yang indah di bali! Tempat yang sempurna untuk menemukan/uluwatu ungasan dan sekitarnya!  Saya akan kembali! Valerie Yang.",5
48, Adila Bali,"Adila benar-benar adalah tempat yang terasa seperti rumah sendiri di bali. Ketika saya pertama kali tiba aku merasa angin yang begitu sulit untuk menemukan di bali dan saya hanya merasakan cinta dengan tempat ini segera. Rumah ini dirancang dengan sangat baik, dan pemilik, sandra dan merupakan sangat bagus dan membantu selalu berinteraksi dengan para tamu dan membuat suasana rumah sangat ramah dan hangat. Saya yang sempurna hari di Adila dimulai dengan membuat dan wayan & lezat sarapan sehat, kemudian berenang di kolam renang atau di laut di pantai mangkuk hijau dan akan berakhir dengan tidur malam yang menyenangkan dengan angin laut yang bagus! Saya pasti akan merekomendasikan tinggal di sini jika anda ingin tempat yang sangat indah di sekitar alam untuk bersantai di bagian…",5
