,hotel,review,stars
38, Anapuri Villas,"Kami tinggal di 4 kamar tidur puri Awani untuk awal perjalanan kami sementara kami menunggu untuk teman-teman perjalanan dari bagian yang berbeda dari kami untuk tiba di bali. Saya memilih antara Anapuri dan mulia sebagai pemberhentian pertama tetapi tidak ingin berada di sekitar kelompok besar orang. Properti ini adalah apa yang akhirnya meyakinkan saya bahwa saya perlu untuk mulai menulis ulasan lokasi wisata kami! Saya telah ke properti yang luar biasa di seluruh dunia dan ini telah menetapkan bar baru untuk harapan di setiap tingkat. Kolam renangnya besar, villa adalah yang terhubung baik oleh tablet, dan staf yang selalu di sana untuk apa pun yang diperlukan. Saya tidak bisa mengatakan cukup tentang bagaimana baik terus properti ini adalah. Anda menyadari anda telah…",5
39, Anapuri Villas,"Salah satu vila terbaik yang saya dan suami saya pernah menginap di bali. Kami menikmati semua fasilitas yang ada. Makanan yang menakjubkan dan staf yang sangat terlatih - bintang lima! Hotel ini memiliki sangat besar ruang untuk 1 kamar tidur vila. Taman yang indah, pemandangan indah, semuanya melampaui harapan kami. Saka, manajer villa adalah sangat ramah dan profesional. Itu benar-benar pengalaman yang luar biasa untuk tinggal di puri Kamadewa. Kami menikmati setiap menit dan kami berharap bahwa kami bisa tinggal lebih lama. Kami akan kembali untuk yakin. Dan kami sangat merekomendasikan anda untuk tinggal di villa yang menakjubkan ini - Anapuri Villas.",5
40, Anapuri Villas,"Tanpa diragukan lagi salah satu yang paling spektakuler villas dan pengalaman pernah. Membuat semua yang lebih menyenangkan dengan staf yang indah, terutama Saka, manajer vila. Selain dari villa dan semua itu's glory, pastikan anda mendapatkan tur dari taman di belakang.",5
41, Anapuri Villas,"Kami diadakan pernikahan kami di Anapuri dan itu adalah tempat yang sempurna. Staf yang indah dan selalu siap untuk membantu. Kami mendapat banyak tamu dengan pantangan dan koki mampu mengakomodasi semua dari mereka (mereka membuat gandum gratis kue-kue untuk sarapan). Vilanya sendiri adalah surga, fasilitas berada dalam kondisi besar dan semua kamar sangat nyaman. Pemandangannya menakjubkan (terutama sunrise) dan kompleks secara keseluruhan adalah sempurna untuk rendam seluruh hal di. Anapuri saya pasti akan merekomendasikan untuk orang yang mencari tempat pernikahan di bali.",5
42, Anapuri Villas,"Sekelompok 30 teman-teman bepergian ke Anapuri untuk pernikahan yang paling indah! Staf yang benar-benar menakjubkan dan sangat melayani. Tim di Anapuri pergi di atas dan di luar, benar-benar, untuk membantu dengan cara apapun mungkin secara fisik. Mereka membuat hari khusus mereka benar-benar sempurna dan magis!  Terima kasih Anapuri untuk pengalaman menginap yang menakjubkan! Kami tidak dapat menunggu untuk dapat kembali lagi! ",5
43, Anapuri Villas,"Kami mengunjungi selama natal dan senang dengan masa menginap kami di sini! Staf adalah menakjubkan, sangat membantu, dan selalu tersenyum. Setelah sopir dan mobil untuk membawa kami ke mana pun kami ingin pergi sangat indah dan membuat hidup mudah (terutama bepergian dengan balita). Makanannya enak, pemandangannya indah, dan ruangan itu menakjubkan. Kami ingin untuk apa-apa! Saya cukup yakin bahwa kami telah merusak untuk semua perjalanan berikutnya. Itu benar-benar pengalaman yang luar biasa dan seperti liburan yang menyenangkan. Satu-satunya keluhan adalah bahwa kami tidak bisa tinggal lebih lama!",5
44, Anapuri Villas,"Pergi untuk seorang teman pernikahan, merasa seperti aku telah meninggal dan pergi ke surga. Anapuri adalah menakjubkan, pertama kalinya kami berjalan menaiki tangga kami kami takjub - pemandangan itu! Kamar dan fasilitas adalah kelas pertama dan staf - apa yang bisa saya katakan! Mereka begitu hangat dan ramah dan membantu melampaui kata-kata! Sebagai seorang istri dan ibu dari 3 seringkali terjadi akan pergi untuk liburan tetapi masih melakukan segala sesuatu. Saya harus mengatakan bahwa menjadi di Anapuri merasa seperti liburan nyata pertama pernah untuk saya - Saya mencintai setiap menit dan mudah-mudahan suatu hari dapat kembali.",5
45, Anapuri Villas,"Kami telah tinggal beberapa kali dan ini adalah kedua kami liburan tahun baru. Lokasi menakjubkan dan jauh dari kerumunan besar dan bar barat bali, fantastis staf dan fasilitas besar. Perhatian terhadap detail dan membuat liburan kami merasa spesial setiap kali akan pasti melihat kami melanjutkan untuk kembali ke Anapuri.",5
46, Anapuri Villas,"Saya merayakan saya 50-an dengan teman-teman keluarga.  Konsep adalah diprivatisasi resort dengan 6 suites sendiri dan penuh staf yang berdedikasi.  Pengalaman kami unik. Full luxury suite dan layanan yang sangat baik.  Anak-anak menikmati itu penuh baik di ruang bermain, ruang multi media, di kolam renang, atau menikmati berbagai aktivitas.  Ini adalah tempat jika anda ingin memiliki privasi penuh dengan teman dan keluarga.",5
47, Anapuri Villas,"Jika anda ingin sepotong surga di mana anda dapat pergi dan kemudian tidak harus perlu khawatir, Anapuri villas adalah hanya bahwa! Arsitektur dan dekorasi adalah sangat indah dan fasilitas yang membuat anda ingin untuk nol! Dari waktu mereka menjemput kami di bandara sampai kami sayangnya harus meninggalkan... koki pribadi anda, pelayan dan supir akan mengurus semua keinginan anda... benar-benar! Staf sangat efisien, hangat, berpengetahuan dan selalu tersenyum. Mereka mengatur segala sesuatu bagi kita dari penukaran uang, perawatan spa, dan peralatan. Koki disiapkan sarapan yang lezat untuk kami setiap pagi. Saya memberi mereka resepnya ke favorit saya green jus dan lihatlah. Saya telah ini pagi berikutnya! Kami juga meminta koki untuk menyiapkan makan malam indonesia yang…",5
48, Anapuri Villas,"Puri Kamadewa - sempurna untuk villa 2 untuk acara-acara khusus. Menakjubkan pribadi di villa tepi laut yang baik di pantai pasir hitam dengan beberapa sampah. Kamar tidur yang indah dengan heavenly king bed, sangat ac, kamar mandi besar dengan mandi dan tubuh hutan hujan kepala pancuran, bak rendam yang luar biasa, kolam renang infinity, spa, hari tempat tidur dan kursi untuk bermalas-malas di sekitar.  Staf yang selalu tersenyum, sopan, penuh perhatian dan memastikan bahwa kami tinggal adalah aman dan nyaman 24 jam sehari. Bali's hospitality di itu yang terbaik. Sopir kami, Gustu selalu di siap untuk membawa kami di suatu tempat. Mobil terus rapi bersih setiap hari. Tak terbatas botol air tersedia sepanjang hari. Karena lokasinya yang terpencil, di mana saja kami ingin pergi…",5
49, Anapuri Villas,"Perjalanan ke bali kami akan pernah telah sama jika tidak untuk residence. Setelah kedatangan kami disambut oleh hangat dan ramah driver yang bawa koper kami dan menyambut kami dengan berseri-seri tersenyum serta penuh kami di di fakta menarik tentang bali dalam perjalanan ke villa. Dan saat tiba di vila, kami diberikan kejutan yang menyenangkan dari kecil mereka upacara menyambut, dengan doning kuning kalung bunga dan musik. Kami merasa seperti selebriti yang-daftar! Haha! Acaranya termasuk sebuah pengenalan staf (misalnya. villa manajer, koki, pelayan dan supir dll), dan kemudian tur besar vila. Kami tinggal di 6 kamar vila yang terbesar dari semua empat vilas tersedia. Fasilitas termasuk perpustakaan/ruang baca, ruang permainan dengan x-box dan meja biliar kinetik sebagai…",5
50, Anapuri Villas,"Jika anda ingin mengambil liburan/pernikahan anda ke tingkat berikutnya kemudian Anapuri villas adalah tempat untuk pergi! Saya dan istri saya baru-baru ini menikah di Anapuri, kami memesan 3 dari 4 villas untuk teman-teman dan keluarga untuk 5 malam. Kami tinggal di puri Salila yang merupakan 6 villa kamar tidur. Segera setelah anda berjalan di tempat ini benar-benar memukau anda. Kamar-kamarnya indah, luas dan sepenuhnya ber-ac dengan pemandangan laut. Infinity kolam dengan berenang up bar kolam renang adalah jelas merupakan penemuan besar. Ruang permainan dan ruang teater adalah cherry di atas anak-anak menyukainya. Saka dan timnya pergi di atas dan melampaui apa yang kita harapkan untuk membuat hari khusus kami menakjubkan, Saka bahkan menyanyikan lagu untuk kami dengan band…",5
51, Anapuri Villas,"Saya karena saya memiliki ulang tahun pesta di salah satu vila, menghasilkan dengan lebih dari $3000 dan mengatur di panjang dengan villa pihak hotel. Mereka yang besar dalam mendiskusikan berbagai pilihan yang tersedia untuk saya dan e-mail selalu menanggapi segera dan profesional.   Menyesal. Saya tidak dapat pergi ke depan dengan pemesanan saya dan saya harus membatalkan beberapa bulan kemudian (sebelum tenggat waktu pembatalan). Dalam waktu 24 jam yang menyediakan informasi kawat bank saya. Saya dipindahkan kembali ke deposit $3000 akun saya tanpa kerumitan atau keberatan.  Sementara saya tidak dapat berbicara dari properti itu sendiri. Saya dapat mengkonfirmasi melakukan manajemen adalah kelas pertama.",5
52, Anapuri Villas,"Kelompok kami menginap di the Salila villa di Anapuri. Kamarnya luas dan bagus, kami yang berdedikasi daerah outdoor adalah hanya menakjubkan. Tidak ada yang lebih menyenangkan daripada renang kami sendiri infinity kolam menghadap Pabean beach.  Beach bar kami mendapat latihan yang baik dan makanan kami disajikan di bawah bintang-bintang dengan suara ombak di bawah ini. Setiap hari kami disajikan sarapan yang sangat baik dengan kue-kue jadi lembut dan lembut untuk mati untuk.  Tresna Saka dan melakukan pekerjaan yang baik dalam memastikan bahwa kami tidak pernah ingin untuk apa-apa dan bersama indah staf memastikan kami mendapatkan kunjungan yang luar biasa. Anapuri kami driver membawa kami di mana kami ingin ketika pernah kami ingin itu dan tidak ada yang terlalu keras...…",5
53, Anapuri Villas,"Kembar saya dan saya hanya diadakan kami 40th bersama ulang tahun 40 kami di sana dengan teman dan keluarga terdekat.   Kami memiliki semua 4 villas dan tidur 32 antara banyak kamar double dengan kamar mandi dalam.   Staf yang menakjubkan, fasilitas top end gaya bali, pemandangan yang indah dari kolam renang dan banyak daerah yang berbeda baik untuk menggantung diam atau campuran dengan kelompok besar kami.   Sangat dianjurkan.",5
54, Anapuri Villas,"Saya dan istri saya baru-baru ini memiliki pernikahan kami di bali di Anapuri kompleks vila di Pabean beach, sanur. Setelah berbulan-bulan berkeliling bali untuk mencari sebuah kompleks vila yang lebih besar yang cukup untuk menyimpan 50 tamu kami ingin menghadiri pernikahan kami menemukan Anapuri melalui trip advisor online. Kompleks ini memiliki 4 terpisah villa's bersebelahan dengan setiap lain tepat di pantai di utara sanur. Kami memesan seluruh villa untuk menginap kami di sana selama 7 malam dan juga bayu gita residence sebelah untuk beberapa ekstra teman-teman. Dari saat staf yang luar biasa menyambut kami di bandara sampai waktu semua tamu berjalan melalui pintu ke ini kompleks incredable kami tidak bisa menghapus senyum's dari diri kita sendiri atau semua tamu. Kami…",5
55, Anapuri Villas,"Jika anda sedang duduk di meja anda setelah ""saya perlu liburan di surga"" impian, kemudian Anapuri adalah tempat yang bagus untuk anda. Tidak ada yang lebih santai atau lebih indah dari resort ini - apa dengan lokasi sempurna, pemandangan dan pantai, staf yang indah dan layanan, dan akses ke semua yang ditawarkan bali. Ini adalah tempat saya akan kembali ke waktu dan lagi!",5
56, Anapuri Villas,Terima kasih terima kasih  Anapuri Villas. Itu serius liburan terbaik yang pernah kami alami. Terima kasih khusus untuk Augustino yang manja kami dan membuat kami merasa sangat welcome. Layanan yang luar biasa. terima kasih khusus untuk Saka terlalu. Xx,5
57, Anapuri Villas,Saya menginap di anapuri untuk teman pernikahan dan dari saat saya tiba itu adalah seperti tempat yang indah. Staf yang menyenangkan ramah dan sangat membantu. Makanannya lezat dan fasilitasnya juga bagus. Saya merasa santai dari awal. Saya berharap untuk kembali suatu hari. Pernikahan di anapuri adalah hanya magis dan pengaturan ini hanya tampak seperti sesuatu yang keluar dari film,5
58, Anapuri Villas,"Suami saya, putri berusia 21 tahun dan saya bertemu di bali untuk pernikahan, kompleks villa sudah disediakan oleh kamar pengantin pria dan wanitanya, dengan kami dan menawarkan 3 kamar tidur vila puri Saanti. Pada saat kedatangan, yang sangat kasar mencari jalan masuk (belum dikembangkan berdasarkan) kami segera diangkut ke sangat terbaik dari keramahan bali! Kue tidak ada check-in, paspor disalin dan itu saja! Kami tahu ini akan menjadi minggu untuk ingat, dan pokoknya! 24 jam selalu lebih (tidak benar-benar diperlukan untuk menjadi jujur, tapi bagus untuk mendapatkan g&t di 11pm!) dan selalu wajah tersenyum untuk menyambut anda pulang! Orang-orang yang menyenangkan, benar-benar indah, benar-benar mendapat hal yang saya adalah indah kami, agus (vila kami pria utama) sms putri…",4
59, Anapuri Villas,"tempat ini adalah surga di bumi.  Layanan sempurna. Staf tahu setiap tamu nama, dan menunggu di setiap kebutuhan kami. makanan yang lezat. Kami menikah di sini. Semuanya sempurna dan lebih baik daripada mungkin bisa bayangkan. Mahal tapi layak setiap sen dan saya tidak dapat cukup tinggi merekomendasikannya. Saka, anda adalah legend!",5
60, Anapuri Villas,"Apa yang benar-benar indah tempat untuk dikunjungi! Suami saya dan saya beruntung cukup untuk diundang ke Anapuri villas untuk pernikahan bulan lalu dan dari saat kami berjalan menaiki tangga dan ke ruang kamar kami hanya kagum! Pemandangannya sangat menawan luar biasa! Ini adalah oleh jauh yang paling indah yang pernah saya menghadiri pernikahan, staf yang menakjubkan, dan mereka bertemu setiap kebutuhan kami dengan senyuman. Kami pasti akan kembali untuk tinggal di perjalanan berikutnya kami dan saya akan sangat merekomendasikan Anapuri villas untuk semua orang :) ",5
61, Anapuri Villas,"Wow adalah hal pertama yang saya butuhkan untuk tinggal, dari menit Sakaria mengambil saya dan calon suami saya pada tur sampai akhir perjalanan ke bandara Sakaria dan timnya di Anapuri villas bertemu semua kebutuhan saya.   Saya cukup beruntung cukup untuk menahan pernikahan impian dengan 50 tamu di puri Salila dan itu sempurna dalam setiap cara. Suami saya dan saya terpesona oleh bagaimana benar-benar sempurna semuanya ternyata.   Kami menghabiskan 5 malam di Salila dengan tamu di Awani dan Saanti juga dan setiap orang adalah tersenyum dari telinga ke telinga di semua kali.  Permintaan tidak terlalu keras untuk pengemudi, satu bahkan mengantar saya ke bandara untuk mengucapkan selamat tinggal keluarga dan kemudian menjatuhkan saya di tujuan berikutnya setelah check out.  …",5
62, Anapuri Villas,"Dari kedua anda melangkah ke lobi/masuk dan melihat pemandangan keluar di seberang kolam ke pantai pasir hitam anda akan berada di cinta dengan tempat ini. Kolam renang ukuran besar, kamar yang fantastis, baik proporsional, kamar makan, dapur, kayu api pizza oven, jacuzzi dan bar adalah semua di sini ditambah lebih. Tapi apa yang benar-benar membuat tempat ini terpisah dari yang lain adalah staf. Cemerlang yang dipimpin oleh Saka kami jatuh cinta dengan mereka semua, tidak ada yang terlalu banyak kesulitan dan mereka tahu semua nama dalam beberapa jam pertama. Makanan adalah sensasional, dimasak di dapur dengan membeli produk segar setiap hari, dengan porsi yang sangat baik, dan sarapan adalah kue-kue dipanggang setiap hari! Saya sekarang dan istri saya memiliki pernikahan kami…",5
63, Anapuri Villas,Kami menghabiskan 4 hari di sini dan belum melangkah di luar gerbang. Ini adalah indah ditunjuk villa bali dengan staf yang hebat dan ramah. Berbaring di tepi kolam renang setiap hari dengan tidak peduli di dunia.  Makanan adalah produk lokal yang segar dan dimasak di rumah gaya memasak.,5
64, Anapuri Villas,"Setelah baru saja kembali dari 8 malam menginap di Anapuri villas saya sangat ingin informasikan ini sewa liburan yang benar-benar luar biasa dengan tim staf yang sangat indah untuk kita dan cucu kami. Saya dan suami saya bepergian secara ekstensif dan kami setuju bahwa di Anapuri villas kami telah mengalami salah satu yang terbaik akomodasi dan layanan.   Rombongan kami yang beranggotakan 6 orang dewasa dan empat cucu-cucu kecil menginap di beachfront 4BR puri Awani (20M dengan kolam renang). Villa dan ini jauh melebihi harapan kita, dan pemandangan spektakuler dari samudera hindia, vulkanik pasir hitam dari Pabean beach, dan spektakuler sunrise adalah ""nikmati"" untuk mata. Sementara kami berada di puri Awani, pemilik yang berlibur dengan keluarganya meluangkan mengundang cucu…",5
65, Anapuri Villas,"Saya dan keluarga saya tinggal di villa untuk 2 malam Saanti puri juni lalu dan itu benar-benar menakjubkan. Ini dirancang dengan indah villa dengan tersenyum dan terlatih staf melebihi harapan kami. Infinity kolam renang yang menghadap samudra adalah semua apa yang kami cari untuk jadi kami santai dan menikmati setiap detik. Makanan yang sangat baik. Media ruang saver itu terus kedua anak saya terhibur dan manajer villa dikelola pengasuh untuk bayi kami gadis, dia sangat ramah dan perhatian wanita, jadi, itu seperti madu kedua semuanya dimulai dengan pemandangan dan suara ombak, layanan dan makanan yang mewah untuk pijat saya dan suami saya menikmati (kami beruntung untuk memiliki a mild essue listrik menyebabkan tidak ada lampu di kamar tidur utama untuk hanya setengah jam…",5
66, Anapuri Villas,"Kami tinggal di Anapuri untuk beberapa hari dan menduduki semua vila untuk kami pra-perayaan pernikahan.   Saya telah mengatur untuk sekitar 35 orang untuk tinggal di resor indah ini dan saya harus mengatakan semua tamu benar-benar menyukainya. Kami masih positif tentang layanan, lokasi, makanan dan pengalaman yang indah kami memiliki di Anapuri  Layanan ini luar biasa... semua staf kami sangat ramah dan membantu. Mereka sangat profesional, cepat dan sangat sopan. Kita harus tahu staf selama beberapa hari dan merasa dekat dengan Anapuri staf. Mereka memperlakukan kami seperti keluarga selama seluruh tinggal.  Tempat ini adalah jauh melampaui harapan kami. Suami saya dan saya memiliki hanya melihat foto-foto online dan membaca ulasan. Kami sedikit skeptis dan khawatir pada…",5
67, Anapuri Villas,"Anapuri villas adalah destinasi sempurna untuk liburan yang menyenangkan, tidak semata-mata hanya karena kelembutan dari atau daerah sekitarnya menakjubkan restoran kualitas makanan tetapi karena pelayanan yang jempolan. Dari menit anda tiba anda diperlakukan seperti bangsawan dan tidak ada yang terlalu sulit untuk staf yang indah ini. Mereka melakukan yang terbaik untuk melayani apa saja dan segala sesuatu yang anda inginkan. Di Anapuri anda benar-benar merasa seperti mereka ingin terlihat setelah anda dan mereka melakukannya sangat baik. Saka dan timnya adalah sangat profesional tetapi pada saat yang sama adalah benar-benar ramah dan membuat anda merasa diterima. Ketika memesan akomodasi online resiko terbesar adalah memilih dari foto atau keterangan dan kemudian tiba ke…",5
68, Anapuri Villas,"Tempat yang menakjubkan untuk tinggal dan bersantai dengan keluarga dan teman-teman. Ada sesuatu untuk semua orang. Hanya ingin bersantai oleh kolam - mudah. Perlu untuk tetap menjaga anda terhibur permainan, - ruang permainan adalah sempurna. Menonton film di teater kamar - selesai! Mendengarkan musik yang mengagumkan, spa, salon, gym, anda perlu itu, itu ada. Tidak tersandung satu sama lain. Tidak perlu meninggalkan yang pernah ada! Pilihan makanan dan daftar minuman - menakjubkan. Layanan - tulus dan hangat. Akan sangat merekomendasikan tempat ini untuk keluarga atau kelompok teman-teman yang ingin seluruh tempat dan merayakan hanya menjadi bersama-sama atau acara khusus.",5
