,hotel,review,stars
0, Anapuri Villas,"Kami memesan villa terkecil, Puri Kamadewa. Semuanya luar biasa dari saat mereka menjemput kami dari bandara dan saat kami meninggalkan mobil kembali di bandara. Staf hebat - setiap orang - sangat penuh perhatian, sopan dan membantu - sangat menakjubkan. Properti bagus. Kami memiliki liburan yang tenang dan menyenangkan. Akan merekomendasikan mereka untuk semua orang - tempat yang tepat untuk dikunjungi.",5
1, Anapuri Villas,"Waktu berlalu dan setelah tepat satu tahun, saya menemukan diri saya kembali di Anapuri lagi! Seperti kata pepatah, jika tidak rusak, dun memperbaikinya. Lokasi yang sangat baik, cuaca sempurna dan hal terbaik tentang tempat ini adalah staf super dan layanan yang mereka berikan. Kami tinggal di bedder 4 kali ini (Puri Awani). Dengan samudera yang berdetak melawan dinding penahan dalam ritme, kami terus-menerus ditarik ke pingsan yang damai dalam waktu singkat. Ini ditambah dengan staf yang luar biasa dipimpin oleh Hendra selalu membuat ini benar-benar jauh dari rumah. Disebutkan secara khusus untuk koki Sudi. Kami benar-benar menantangnya kali ini dan dia tidak pernah goyah dalam memperkenalkan keanehan kuliner baru yang kami tidak akan pernah berpikir untuk makan. Saya tidak…",5
2, Anapuri Villas,Kami memiliki reuni keluarga yang sangat besar di sini selama liburan dan pada dasarnya mengambil alih setengah dari villa. Bahkan dengan kelompok besar seperti Saka dan staf lainnya sangat membantu. Mereka mengatur beberapa kunjungan setiap hari untuk menyesuaikan kegiatan dengan berbagai kelompok umur dan minat. Properti dan pemandangannya luar biasa! Makanan dan minumannya enak. Saya tidak akan segera melupakan kolam. . . aaah kolam!,5
3, Anapuri Villas,"Bayangkan sebuah reuni keluarga dengan 40 orang. Semua ada di satu tempat. Saya harus mengatakan, itu sangat menyenangkan. Kami tinggal di vila dan semua orang memiliki cukup ruang untuk bersama dan tidak bersama. . tergantung pada apa yang ingin mereka lakukan. Sebagian besar dari kita hanya duduk di kolam, yang sempurna. Kolam renang yang dangkal, dengan air mengalir ke kolam yang lebih dalam di mana kami bermain hiu dan ikan kecil dan nongkrong di atas floaties, dengan minuman dan makanan yang sepertinya tak ada habisnya. Kami melanjutkan perjalanan belanja dan hiking. Kami pergi berselancar. Kami belajar menari, gaya Bali. Kami melakukan karaoke. Kami segalanya dan tidak ada sama sekali. Saya tidak sabar untuk kembali. . dan mengadakan reuni keluarga lagi. Mungkin saat ini,…",5
4, Anapuri Villas,"Saya cukup beruntung untuk menghabiskan minggu yang luar biasa di Anapuri Villas di Bali. Orang-orang yang benar-benar luar biasa bekerja di sini dan membantu membuat pertemuan keluarga kami sangat istimewa dan menakjubkan. Mengorganisir 40 + orang bukanlah masalah bagi staf yang terampil dan ramah - orang yang datang dan pergi pada tanggal yang berbeda, semua jenis kegiatan lokal yang menyenangkan, makanan lezat yang dimasak, makanan ringan dan minuman yang disajikan, pijat yang disediakan dan hiburan yang dinikmati! Orang-orang ini sungguh luar biasa. Lokasi luar biasa dengan pemandangan pantai yang indah. Saya benar-benar tidak bisa meminta pengalaman yang lebih baik! Terima kasih atas segalanya Anapuri, Anda membantu kami membuat kenangan keluarga yang akan bertahan seumur…",5
5, Anapuri Villas,"Benar-benar fenomenal tinggal @ Anapuri Villas. . . Villa kami bahkan lebih baik daripada foto - - pemandangan laut yang indah dari ruang tamu, kamar yang luas, dan, 24 x 7 pada layanan permintaan! Saka dan timnya (Lia, Hendra, dll) sangat luar biasa selama kunjungan keluarga kami - - mereka bahkan memastikan untuk membuat pengaturan khusus bagi kami karena pembatasan makanan kami. Jika Anda ingin dimanjakan dengan koki pribadi, pelayan pribadi, sopir pribadi, fasilitas spa, dan pasangan yang dengan tampilan kartu pos yang memukau di tujuan terpencil namun tidak jauh dari 'tindakan', Anapuri harus ada di daftar Anda! ! ! Mereka juga memiliki beberapa pilihan vila yang berbeda; kami mengambil ruang yang lebih besar karena kami memiliki total 9 orang - tetapi mereka memiliki…",5
6, Anapuri Villas,"Seluruh resor dipesan untuk pernikahan dan kami tidak dapat berbicara sangat cukup tentang fasilitas dan staf. Ada tiga kelompok makanan yang tersedia; Menu harian yang dapat Anda pilih dari sesaat sebelum setiap makan, buku menu depan untuk makan hari berikutnya dan buku ke depan untuk makan acara khusus. Sarapan panas dan dingin berkualitas baik tersedia setiap hari. Tidak ada lobi atau resepsi hotel dan Anda memiliki staf menunggu pribadi Anda dari pagi hingga larut malam. Ini benar-benar bekerja dengan sangat baik. Tidak ada fasilitas kopi atau kulkas di kamar. Namun, ada kulkas komunal yang dialokasikan untuk kelompok vila. Vila hotel dibagi menjadi setidaknya empat bagian yang berbeda, satu bagian dirancang untuk pasangan pengantin dan keluarga mereka. Bagian kami…",5
7, Anapuri Villas,"Anapuri Bali untuk kami. Kali ini aku pergi di Mei untuk perjalanan saya sendiri dengan teman-teman dan keluarga dan juga menghadiri pernikahan pada bulan Juli. Semuanya luar biasa di Puri Salila.   Untuk perjalanan pribadi saya sendiri, walaupun saya telah tinggal di Anapuri beberapa kali. Saya tidak pernah kehabisan hal yang harus dilakukan. Mulai dari yang hanya menghabiskan waktu dengan semua orang di Villa, untuk dekorasi rumah pusat perbelanjaan di dekat hotel, untuk sore hari di Seminyak, kami juga meminta supir untuk membawa kami ke pasar makanan laut untuk membeli makanan kami sendiri. dan mereka memberitahu kami sendiri BBQ. Koki berdiri langsung di sebelah Pit, memberi kami tips untuk ketika untuk membalik ikan. Hahahhaha, Staf akhirnya membantu kami setelah kami…",5
8, Anapuri Villas,"Saya menginap di sini untuk pernikahan dan tinggal di satu kamar tidur vila, layanan luar biasa, makanan yang luar biasa dan fasilitas. Semua staf yang sangat ramah, mereka selalu bersih terutama taman di sekitarnya membuat tempat ini bersih dan indah untuk kami. Saya akan kembali lagi dan tinggal lebih malam untuk menikmati Villa! Sangat direkomendasikan. Belum lagi pemandangan yang indah dan kamar mandi untuk mati bagi. Saya menginap di sana selama jam dan mereka melayani kopi yang baik dan sarapan",5
9, Anapuri Villas,"Apa yang saya tulis di sini hanya mengulang apa yang ulasan lain telah mengatakan sebelum saya, tapi itu layak dikatakan lagi. Kami berada di Anapuri untuk seorang teman pernikahan di Barat/India selama 4 malam. Seluruh waktu kami berada di sana yang fantastis dan pernikahan adalah hari yang menakjubkan! Lokasi adalah besar dan staf akan melakukan apa pun yang mereka bisa untuk membuat kunjungan Anda sebagai menyenangkan sebagai mungkin.   Pada satu hari setelah pernikahan keluarga saya mengambil keuntungan dari gratis layanan sopir dan pergi ke Ubud untuk hari, yang layak sebelum kami berangkat ke Lombok. Sopir sangat membantu dan penuh dengan informasi yang berguna di kehidupan/budaya di Bali. Semua staf yang saya berbicara dengan di Anapuri setidaknya baik (jika tidak sangat…",5
10, Anapuri Villas,"Kami diselenggarakan pernikahan kami dengan putri kami di sini di KM 9 Juli dan kami mendapat yang tepat, tempat ini sangat cocok untuk tempat pernikahan. Ini adalah kompleks besar yang memiliki 4 vila terpisah yang bisa juga menghubung, kami memiliki 6 kamar tidur, yang memiliki ruang permainan, ruang teater dan perpustakaan yang terdiri dari vila lain, 1, 3, & 4 kamar tidur dengan beberapa belajar. Pernikahan diadakan di villa kami, kami memiliki 70 tamu dan dua kambing (tapi itu cerita lain). Staf tidak bisa disalahkan dan pergi di atas dan di luar, baik dilakukan untuk Gunther dan timnya. Kami makan di sini banyak atau pergi ke Sanur yang hanya mudah 20 menit, makanan di sini adalah luar biasa segar dan siap dan mereka berhasil memberi makan dengan kelompok besar di kali.…",5
11, Anapuri Villas,Kami tinggal di villa 3 dari 4 Villa di kompleks dan layanan luar biasa. Staf tersedia 24/7 dan berbicara bahasa Inggris. Keamanan tidak hanya berbicara bahasa Inggris yang baik tapi itulah hal yang dapat ditingkatkan. Juga ada pijat enak :),5
12, Anapuri Villas,"Kami memesan di sini untuk putri kami pernikahan pada bulan Juli jadi kami pergi keluar untuk pemeriksaan dan mencicipi makanan. Baik tempat ini adalah tempat yang luar biasa, vila-vila luas dan baik dilengkapi dan mereka atas melihat pantai. Teater besar sebagai adalah kamar di area permainan. Pernikahan makan coba sangat bagus, dengan semua yang mencari makanan dan anggur yang luar biasa. Membawa pada pernikahan!",5
13, Anapuri Villas,"Dari proses pemesanan, untuk menginap di bandara & terakhir sangat luar biasa. Setiap anggota staf adalah luar biasa, kami memiliki Villa Manager berhasil Neni Hindu yang ketat persyaratan diet vegetarian kami sangat baik. Proses check in yang menonjol, seperti tiba di rumah Anda sendiri. Luar Biasa. Vila-vila selalu bersih dan baik dilengkapi dengan semua fasilitas modern. Masing-masing villa yang terpencil dan meskipun vila lain yang kami memesan kami tidak pernah merasa seperti ada orang yang tinggal di sekitar kita. Pasti akan kembali lagi, pengalaman yang sangat baik tidak satu kesalahan atau keluhan. Terima kasih tim untuk membuat bulan madu kami sempurna Anapuri.",5
14, Anapuri Villas,"Kami baru-baru ini tinggal di Villa untuk ketiga kalinya Anapuri dan tidak ada yang berubah. Saya bersama dengan keluarga dan teman-teman lainnya 23 memutuskan untuk menghabiskan satu minggu di Bali selama periode tahun baru. Kami tinggal di Puri Salila (6 + 2 kamar) dan puri (4 kamar) Awani kami usia yang berkisar dari pertengahan umur enam puluhan hingga delapan bulan tua, dan semua orang punya waktu yang indah. Staf yang dipimpin oleh Tresna Saka dan semua sangat penuh perhatian dan profesional, tetapi masih membuat Anda merasa seperti Anda adalah bagian dari keluarga. Semua vila yang indah, dan area di sekitar vila luas dan terawat dengan baik. Tersedia mobil dan sopir untuk transportasi ke pusat belanja, atau perjalanan wisata di Bali. Supir yang sangat luas dan dapat…",5
15, Anapuri Villas,"Kami tidak bisa mengunjungi Anapuri Villas tahun ini, tapi kami melewatkan tempat ini begitu buruk. Semua hal terbaik dari pemandangan yang indah, arsitektur yang luar biasa, makanan yang sangat baik, koki dan staf yang sangat baik, semua orang yang hanya benar-benar ramah. Dan terima kasih untuk Mr saka selalu membantu saya membuat kejutan untuk keluarga saya. Ini adalah villa terbaik yang kami pernah!",5
16, Anapuri Villas,"Jika Anda mencari untuk wisata, belanja dan hiburan ini bukan tempat untuk Anda tetapi jika anda ingin melarikan diri dari keramaian dan menikmati layanan yang luar biasa, kenyamanan, makanan besar dan suasana yang indah ini pasti jawabannya. Kelompok kami terdiri dari 5 orang tua dengan anak kami yang banyak. Kami memiliki 6 tempat tidur dengan semua fasilitas resor berbintang 5, semua untuk diri kita.  Kami memiliki akses yang mudah ke Seminyak, Nusa Dua dan Ubud dan lebih nyaman jam berkendara dengan sopir pribadi kami dan setiap hari kami bisa kembali untuk perdamaian dan ketenangan dari Anapuri.  Sebagian besar dari kami mengambil keuntungan dari spa di lokasi yang fantastis setelah hari yang keluar dan ruang kebugaran kecil tapi semua yang diperlukan.  Terima kasih untuk…",5
17, Anapuri Villas,"4 Keluarga Saya, termasuk anak laki-laki berusia 15 dan 13, baru saja kembali dari seminggu panjang tinggal di Villa Anapuri. Kami tinggal di 3 kamar tidur vila dengan 4 kamar mandi penuh. Resor ini hanya memiliki 4 Villa dikelompokkan bersama-sama dan tinggi dinding dengan tanaman hijau yang subur dan setiap vila terpisah untuk privasi lengkap. Spa kecil dengan kamar untuk perawatan wajah, pijat, dan perawatan kecantikan yang penuh gaya dengan area gym selesai di resort.   Saya sedang mengirim email dengan resor beberapa kali sebelum kedatangan dan menemukan Gunthur Kristy dan sangat responsif dan sangat membantu menjawab semua pertanyaan saya! Saya dijadwalkan perawatan wajah dan pijat sebelum kedatangan kami dan dengan cepat mereka mengirim saya faktur dan informasi lainnya…",5
18, Anapuri Villas,"Kami sangat beruntung untuk menikmati Anapuri vila untuk pernikahan kami di bulan juli. Lokasi adalah sempurna, dan saka dan timnya melakukan segala yang mereka bisa untuk membuat hari yang sangat istimewa. Keluarga kami juga bergabung dengan kami, dan tidak ada detail yang (kami memiliki 2 anak kecil di partai kami) itu belum dilayani, bahkan setelah kami meninggalkan villa mereka masih mengurus dan merawat dari kami!  Hari pernikahan itu sendiri yang fantastis, mungkin karena untuk membuat tim yang luar biasa bekerja di sana. Kami akan sangat merekomendasikan Anapuri dan tim yang luar biasa untuk liburan pernikahan atau khusus. ",5
19, Anapuri Villas,Sedikit keluar dari jalan dan tidak dekat dengan apa pun di kaki. TAPI - yang jadi persoalan bagi kami karena kami tidak suka keramaian dan hiruk pikuk.   jadi ketika kami tiba kami disambut dengan koktail buah yang lezat dan indah staf yang memberitahu kami bahwa kami telah menerima upgrade! Villa kami adalah indah. 4 kamar tidur semua dengan kamar mandi penuh. Pondok makan dengan koki sendiri. Kolam renang daerah/meja permainan. Dalam kamar dilengkapi dengan ac dan tv. Ukuran yang bagus dan kolam renang pribadi.   Mereka melayani untuk setiap makan pusing - meskipun ada menu untuk memilih dari. Jika anda memberi mereka cukup pemberitahuan mereka akan melakukan yang terbaik. Ada juga fasilitas spa dan pijat dan wajah kami dimanjakan dan pedis/manis. Semua bagus.   Pantai ini…,5
20, Anapuri Villas,"Di sana untuk seorang teman pernikahan, dan cukup beruntung untuk memiliki tempat ini untuk diri kita sendiri.  Ini adalah hanya luar biasa. Orang-orang yang bekerja ada sangat ramah dan menyenangkan, makanan sangat baik, BBQ untuk makan malam pernikahan di depan luar biasa.  Ini adalah hanya sepotong surga di bumi.",5
21, Anapuri Villas,"Kami tinggal untuk 4 malam dan kami sangat baik tampak setelah oleh staf yang indah. Tidak ada yang terlalu banyak kesulitan dan mereka pergi keluar dari jalan mereka untuk menyenangkan. 1 bedroom villa yang sangat indah, seperti lingkungan yang santai dengan pemandangan dan suara ombak. Fasilitas yang sangat baik, gym sangat bagus dan kami berdua memiliki wonderful pijat di spa.   Kami diantar di mana-mana kita ingin pergi di waktu oleh pengemudi di dalam, satu hari dia bahkan mengantar kami untuk hari tur kuil dan gunung batur yang sangat indah, dan sangat bagus untuk berbicara untuk beberapa info lokal!   Jika anda ingin pergi ke suatu tempat yang benar-benar nyaman dan tidak terlalu turis maka ini adalah tempat yang akan. Kami sangat merekomendasikan. ",5
22, Anapuri Villas,"Kami datang kembali ke sini lagi untuk waktu 2nd.   Seperti yang kami harapkan, layanan dari awal sampai akhir kami tinggal adalah luar biasa. Saya dapat mengatakan bahwa itu tinggal yang sempurna :)   Desain villa ini sendiri (puri Kamadewa) adalah luar biasa, kami bisa mendengar suara laut sepanjang hari, cukup dan damai, bersih dan rapi, dan informasi itu nyamuk dan serangga gratis: d   Ini seperti sebuah permata yang sempurna di tengah-tengah antah berantah. Tempat yang sempurna untuk liburan romantis. ",5
23, Anapuri Villas,"Tinggal 3 malam di villa 1 kamar tidur untuk bersantai selama ulang tahun saya. Murni mewah 1 kamar tidur villa cocok untuk pasangan yang berbulan madu dan pasangan dengan anak muda. Villa 1 kamar tidur sangat besar untuk ukuran yang sama ke 4 kamar tidur vila di bali. Ini adalah waktu di bali 5th dan tinggal di villa lain tapi ini adalah yang terbesar dan paling mewah 1 kamar tidur kami pernah tinggal. Tidak diragukan lagi harga di sisi yang tinggi untuk 1 kamar tidur, tapi itu pasti layak. Di compund adalah sangat bersih dan memiliki taman yang indah di luar dari villa. Desain yang api dengan api di sekitar kolam renang dan air terjun mangkuk. Villa memiliki jacuzzi yang berbeda 2 di setiap lantai shower dan sisi jet dan shower di kamar mandi. Teknologi tinggi dengan tablet…",5
24, Anapuri Villas,"Seluruh kompleks vila yang diambil untuk pesta pribadi. Layanan sangat baik, makanan yang sangat baik. Saka dan staf pergi keluar dari jalan mereka untuk membuat acara yang benar-benar mengesankan. Sangat direkomendasikan. Pasti akan mengadakan pertemuan lain di Anapuri lagi!",5
25, Anapuri Villas,"Apa tempat yang spektakuler. Anapuri villa adalah satu jam berkendara dari Seminiyak.  Kami berada di sini untuk ulang tahun teman yang telah memesan seluruh properti untuk sekelompok 40. Indah, estetis dirancang vila air tubuh mereka sendiri. Masing-masing dari mereka menawarkan pemandangan laut yang indah. Anda dapat menikmati berjemur di lapangan rumput hijau, tempat tidur yang nyaman dan pada beberapa langkah di kolam renang atau  jacuzzi. Yang tepat di sebelah laut - kami menyeruput vodka dan gin dan tonik untuk suara gelombang karena mereka jatuh ke dinding villa.  Staf ramah, makanan yang baik rumahan dan spa yang membuat kami tinggal bahkan lebih menyenangkan. Aku akan pasti datang kembali ke sini. Ini adalah pengalaman yang tak terlupakan! ",5
26, Anapuri Villas,Ini adalah tempat yang bagus untuk tinggal dengan layanan yang sangat baik. Itu sangat berguna untuk memiliki mobil dan sopir yang tersedia selama kami tinggal seperti itu memberi kami bebas untuk melihat sekitar bali seperti yang kami harapkan. Makanan yang sangat lezat yang disiapkan oleh koki pribadi kami. Benar-benar menikmati liburan kami di hotel ini luas dan dilengkapi dengan baik villa. Saya sangat menyukai suara ombak meskipun shakes seluruh villa di kali! Hanya saja harga makanan dan minuman yang sedikit curam. Lantai juga menjadi sangat licin ketika basah terutama bagian bercat abu-abu. Anak saya jatuh beberapa kali. Selain itu sangat bagus dan saya sangat merekomendasikan hal ini. Kami pasti kembali!,5
27, Anapuri Villas,"Villa kolam dengan sampul, yang sangat terlatih dan sangat bersemangat untuk membantu (atau memberi anda privasi anda) staf, rose pancalan mandi, mandi di bawah cahaya lilin di atas pantai... Kami diharapkan untuk isi hati kita... Bisa memikirkan tidak ada tempat yang lebih baik untuk menghabiskan bulan madu... Sekali dalam seumur hidup pengalaman, layak akomodasi di salah satu juta. Bernilai setiap sen! Saya dan istri saya telah pernah melakukan hal ini sebelumnya di liburan mewah, namun kami meninggalkan berpikir ini adalah salah satu tempat yang terbaik untuk menginap sedolar sedolar kehidupan kita, meskipun benar-benar keputusan yang tepat. ",5
28, Anapuri Villas,"Kata-kata hanya dapat menarik begitu banyak...   Seluruh tinggal kami seluruh empat dari kami untuk merayakan pernikahan kami Anapuri adalah benar-benar menakjubkan! Tidak hanya ada pemandangan spektakuler (terutama saat tiba di puri Salila) dan akomodasi sangat nyaman bagi semua tamu, kita semua sepakat bahwa saka (peranakan) dan timnya adalah yang paling profesional, antusias dan sangat membantu orang di bali. Layanan mereka sepanjang waktu dan perhatian terhadap detail ada duanya. Makanan, keramahan dan komitmen yang ditampilkan oleh seluruh tim kami tinggal benar-benar menunjukkan bahwa mereka benar-benar adalah yang terbaik pada apa yang mereka lakukan. Hari pernikahan kami tidak bisa telah halus apapun iari dan itu adalah karena selalu Anapuri tim koordinasi serta…",5
29, Anapuri Villas,"Kami tinggal di puri salila, 6 + 2 kamar tidur untuk 4 malam untuk villa, dan itu menjadi liburan yang mengagumkan   Villa adalah menakjubkan, dengan pemandangan di mana-mana anda melihat. Setiap kamar memiliki pemandangan samudera, dengan suara ombak yang indah. Di kolam renang tanpa batas yang indah, terutama setelah matahari terbenam mereka menyalakan lampu di. anehnya, kolam renang adalah suam-suam kuku, jadi itu sangat menyenangkan untuk berenang di malam hari.   Permainan kamar dan rumah adalah menakjubkan, teater. Dengan banyak variasi pilihan film, seperti beberapa permainan papan monopoli atau poker, dan meja biliar yang membuat sebagian besar dari kami tinggal malam lewat tengah malam setiap malam. Keponakan saya membawa saya ps4, teater dan bermain di layar raksasa.…",5
30, Anapuri Villas,Aku kembali ke villa Anapuri setelah mengunjungi 2 tahun yang lalu yang lebih kecil. Aku punya liburan menakjubkan terakhir kali. Aku senang melihat bahwa memiliki Anapuri terus membaik. Kami memiliki tiga dan ada tim yang benar-benar menakjubkan pentransformasi membetah di properti dengan lokasi tepi pantai yang spektakuler untuk sebuah malam untuk mengingat. Fasilitas yang fantastis dan lokasi di tepi pantai sangat mengagumkan tapi apa yang benar-benar membuat tempat ini adalah staf. Mereka adalah sangat penuh perhatian dan tidak ada adalah untuk banyak masalah bagi mereka. Mereka tersedia sepanjang waktu dan ingat tidak hanya nama anda tapi juga kesukaan anda sehingga anda memiliki pengalaman yang sangat personal. Tidak peduli apa usia atau apa yang ingin kami lakukan kami…,5
31, Anapuri Villas,"Istri saya & saya tinggal di villa 4 kamar tidur. Benar-benar kemewahan. Kolam renang pribadi yang menghadap ke laut, gazebo, palms, game, koki pribadi. Kamarnya sangat bersih, dengan semua perabotan, staf sangat profesional & ramah, makanan sangat sangat lezat & harga wajar, daftar anggur yang baik juga. Tersedia mobil dengan pengemudi untuk perjalanan sehari. Sangat santai & menyenangkan, sekarang impian kami steak.",5
32, Anapuri Villas,"Untuk menggambarkan nyata, sihir, dan keseluruhan layanan adalah besar dalam beberapa kata. Tempat menarik, anda akan melihat luar 4 vila berperabot cantik. Setelah tinjauan singkat dari spa, gym, dan vila anda, sebuah ketenangan yang membawa setiap villa.   Suami saya dan saya awalnya merencanakan untuk menghabiskan 2 malam di ini hanya villa bali, tapi mereka dengan cepat layanan, lokasi, makanan, dan suasana santai, kita disebut delta... penerbangan kami berubah, dan dipesan 3 malam lagi! Itu layak. Staf pergi di atas dan di luar untuk setiap permintaan. Kamar kami yang sempurna, makanan yang segar (kami bahkan mengantar kami satu jam lebih untuk mendapatkan kita lobster dan ikan kami diminta!), lihat dan suasana sangat mengagumkan. Kami menghabiskan waktu di dan keluar dari…",5
33, Anapuri Villas,"Ini salah satu resor terbaik yang pernah saya tinggal di - jika tidak, yang terbaik! Layanan sangat baik dari staf terutama baru, hendra dan saki. Akan merekomendasikan siapa pun yang ingin mengunjungi bali untuk tinggal di sini. Staf akan pergi keluar dari jalan mereka untuk merawat anda dan resor ini benar-benar menakjubkan.",5
34, Anapuri Villas,"ini bereaksi anehkelihatannya itu tepat di sebelah pantai dan semua vila memiliki kolam dan privet masage adalah menakjubkan. Juga villa menakjubkan aku mencintai bangun untuk ombak dan ikan, dari kolam ikan",5
35, Anapuri Villas,"Vila ini menakjubkan benar-! Jika anda menginginkan pengalaman bali lengkap dengan layanan bintang 5 dengan harga Anapuri villas. Tidak ada masalah, bahkan jika salah satu tamu anda ingin 3am kentan di panas di pagi hari. Kami disambut dengan senyuman hangat dan setiap hari saya dan pergi tidur karena kami berada di tangan besar. Terima kasih banyak untuk layanan yang luar biasa, makanan lezat, suasana santai, liburan keluarga berselancar yang diusahakan yang terus semua anak laki-laki terlalu sibuk untuk membantu kami dan membuat pernikahan sepanjang tahun. Ini akan selalu menjadi yang terbaik untuk kami karena itu adalah milik kita. Terima kasih banyak. Banyak cinta untuk anda dan staf yang luar biasa.",5
36, Anapuri Villas,"Menghabiskan 3 hari yang menakjubkan dengan keluarga dan teman-teman untuk merayakan anak-anak kita pernikahan di ana puri. Resor ini adalah dipesan oleh teman, keluarga & merasa nyaman. Kami bertemu pada saat kedatangan oleh tinggal di sini staf yang ditugaskan untuk villa kami. Mulai saat ini seterusnya kita semua tahu kami berada di untuk memperlakukan 6 bintang. Kata-kata tidak bisa menjelaskan kemewahan setiap villa dan taman lingkungan, sempurna! Kami tinggal di villa 1 kamar tidur 'puri Kamadewa', satu kata mengagumkan! Kami memiliki 3 staf 24 jam sehari, staf, koki yang sangat baik & yang kami butuhkan terpenuhi. Saka manejernya adalah luar biasa bagi kami semua. Pernikahan itu benar-benar indah, suasananya sempurna, layanan yang fantastis. Terima kasih semua orang di…",5
37, Anapuri Villas,"Pada oktober 2014. Aku pergi dengan 24 pax, yang terbesar kami tidur 6 dan 4 kamar tidur. Ada sebuah pintu penghubung sehingga semua teman-teman kita bisa berbagi segala sesuatu bersama-sama!   Semua 24 dari kami, tapi mersmerised. Villa saya adalah berburu untuk pernikahan saya dan saya telah ke 12 vila mewah di bali, dan aku tahu itu satu-satunya pilihan setelah Anapuri aku melihat itu. Tidak ada yang bisa mengalahkan itu. Namun, baru yang lain hanya hari libur besar, karena ketika kita melihat villa, kami memutuskan kami hanya ingin menikmati setiap hari dengan Anapuri di teman-teman dan keluarga kami terdekat. jadi kami akhirnya memiliki pernikahan sederhana di singapura dan sudah menghamburkan uang pada semua orang untuk terbang Anapuri untuk liburan kami setelah…",5
