,hotel,review,stars
87, Arma Museum & Resort,"Setelah banyak pencarian ubud direkomendasikan untuk menginap di arma resort dan dapat menjamin itu adalah salah satu pengalaman terbaik di bali. Indah properti menyediakan pengalaman total di bawah satu atap. Kaya elegan, memiliki lokasi yang strategis dan staf yang sangat sopan. Bali budaya dan seni termasuk ramayana masyarakat pendahulu dipamerkan dalam sanggraloka ini dan dan kami sangat beruntung telah membuatnya titik awal kami mengunjungi bali. Sangat dianjurkan.",5
88, Arma Museum & Resort,"Kami menghabiskan 4 malam di properti ini fantastis. Lingkungan sekitarnya sangat besar dan memiliki segala sesuatu dari kolam, sawah, indah kamar, kolam renang, ruang keluarga, dan sebuah museum yang tidak boleh dilewatkan. Ada sebuah restoran italia dan thai yang terletak di lapangan. Staf dan manajemen selalu memeriksa untuk memastikan kemanapun kami, yang kami telah apa-apa yang kami butuhkan. Kamarnya yang sangat besar dan memiliki lantai marmer dan kamar mandi besar. Banyak banyak tempat untuk karyawan untuk membuat persembahan yang ditemukan di seluruh properti. Patung ini berlokasi di properti semua memiliki arti keagamaan dan persembahan dibuat setiap hari sementara kami berada di sana. Ada aliran yang berkelok-kelok di seluruh properti dan kolam yang dipenuhi ikan…",5
89, Arma Museum & Resort,"Saya menginap di arma selama seminggu dan menikmati setiap menitnya. Terletak di antara keramaian dan hiruk pikuk ubud, arma terasa seperti surga. Resor ini memiliki taman yang indah dan suasana begitu damai anda merasa seperti jika itu dapat mengistirahatkan jiwa anda. Rasanya jadi bali - hakikat bali. Ada akses mudah ke ubud setiap kali anda inginkan itu. tempat ini juga tempat yang bagus untuk memulai tur dari. Anda tidak harus bangun terlalu awal. Layanan ini tidak mengganggu dan staf sangat ramah. Mereka akan pergi keluar dari jalan mereka untuk membuat kunjungan anda sempurna. Kamar nyaman dan sangat bersih. Restoran di resort sangat baik. Makanan sangat indah, yang dibuat dari awal. Meskipun biaya resor ini adalah sedikit lebih dari saya akan biasanya membayar. Saya pasti…",5
90, Arma Museum & Resort,"Tempat ini luar biasa! Ini tidak akan memberikan perasaan seperti anda di hotel atau resort. Tempat ini adalah seperti sebuah mahakarya, di mana-mana anda berjalan dan melihat, selalu ada sepotong seni di sekitar anda. Untuk mereka yang ke orchid, anda akan menemukan beberapa orchid di sekitar area dengan penjelasan singkat, mengingatkan saya dari mini botanic garden. Areanya besar termasuk sungai kecil dan sawah yang merupakan bagian dari hotel.  Banyak lukisan di museum, makanan di restoran adalah keluar dari dunia ini, dan spanya luar biasa.  Kami bertemu dengan humble mr. agung rai (pemilik) yang mencintai dan bangga dengan arma resort, dan museum sangat banyak dan akan seperti untuk berbagi dengan semua orang.   Satu-satunya penyesalan kami adalah kami hanya menginap di…",5
91, Arma Museum & Resort,"Saya sangat menyukai tempat ini. Taman dan lingkungan yang luar biasa. itu tenang dan suara aliran air dari sungai dan air mancur thr menyejukkan jiwa. Makanannya luar biasa, tetapi daftar anggur adalah sangat kecil. Dimiliki oleh seorang pria bali yang sangat tangan di dan bergairah tentang budaya, dan memberikan kembali kepada masyarakat. Saya akan kembali.",5
92, Arma Museum & Resort,"Alasan yang indah, staf yang ramah dan membantu. Makanan yang lezat di restoran dan untuk sarapan.  Kami menginap di kamar deluxe - yang sangat indah dan luas.  Jauh lebih dari sekadar sebuah hotel, itu bagian jika masyarakat dengan banyak untuk melihat dan melakukan, plus lokasi adalah luar biasa.  Golden jam tur adalah wawasan besar ke dalam hidup orang-orang bali dan budaya - pengalaman yang hebat. Akan tinggal di sini lagi.",5
93, Arma Museum & Resort,"Kami tinggal selama satu minggu dan mendapat 2 kamar superior, satu untuk saya dan suami saya dan satu untuk kami 2 remaja putri. Vila ini tampak indah tapi terlalu mahal untuk kami, dan kami berencana untuk pergi mahal juga. Taman dan museum adalah menyorot dari tempat ini. Saya tertarik pada seni, museum ini adalah jadi bagian dari alasan kami memilih arma dan saya sangat terkesan dengan collection. Tradisional bagian memiliki keterangan baik dari tradisional cerita bahwa pekerjaan digambarkan dan bagian kontemporer juga standar yang tinggi. Museum ini lebih besar daripada yang saya harapkan. Banyak orang yang telah ditulis tentang taman yang indah, dan saya setuju dengan mereka.  Staf sangat membantu, dan ramah, terutama dengan 2 gadis-gadis cantik di meja depan yang nama…",4
94, Arma Museum & Resort,"Kami benar-benar menikmati kami menginap di arma museum & resort. Sanggraloka ini memiliki taman yang indah, sawah, kolam teratai, kolam renang indah yang, restoran thailand, museum, dan banyak lagi.  Nilai yang ditambahkan ke kami tinggal termasuk sarapan yang baik, gratis teh sore hari, kopi dan kue, gratis masuk ke dalam museum dan malam pertunjukan (yang kami sayangnya terlalu sibuk untuk menghadiri) serta antar jemput ke pusat ubud. Staf yang benar-benar menakjubkan. Itu sangat menyegarkan untuk berurusan dengan para pengambil keputusan di meja depan. Housekeepingnya juga indah. Suami saya meninggalkan ipad di kolam renang untuk seluruh pagi di mana itu ditemukan oleh staf dan segera kembali kepada kami. Kami merayakan ulang tahun putri kami di sekitar hotel. Ini merupakan…",5
95, Arma Museum & Resort,"Ini adalah ulasan tentang museum, tidak resor ini!  Tempat yang bagus dengan staf yang sangat ramah! Orang di pintu masuk adalah sangat layanan berpikiran ingin sarapan dan menjawab semua pertanyaan kami tentang hal-hal yang berbeda. Seni menarik, dan beberapa memiliki cerita menarik yang diposting pada tanda-tanda dalam bahasa inggris.  Merekomendasikan untuk pergi pagi hari atau di sore hari karena tidak ada ac.",4
96, Arma Museum & Resort,"Memesan ruang modern! Taman begitu indah, begitu damai. Sarapan adalah bagus. Staf menakjubkan. Besar kolam renang. Suasana luar biasa. Saya menginap di kamar tradisional. Datang untuk yoga di yoga barn. 10 menit berjalan kaki. Ditambah resort dapat mengatur alift. Kamar mandi di kamar saya adalah tidak sesuai standar, thats satu-satunya kesalahan saya harus mengatakan. segala sesuatu yang lain adalah kesempurnaan. Akan tinggal lagi hanya permintaan kamar modern.",4
97, Arma Museum & Resort,"Ini adalah kunjungan kedua saya setelah lebih dari 10 tahun. Kami sedang dalam perjalanan ke sekolah hijau dan saya ingin hanya mengunjungi taman karena kami memiliki hanya sekitar satu jam untuk cadangan. Namun, kami masih harus membayar 60 000 rupiah masing-masing untuk masuk di arma cafe entrance; jadi kami pergi ke galeri utama seni tradisional bali. Mr. Agung rai sendiri menyambut kami di pintu, meskipun saya tidak menyadari yang dia pada waktu itu (teman saya melihat kemiripannya dengan gambar-gambar di buku panduan museum).  sangat komprehensif dan koleksi dari berbagai sekolah/gaya lukisan bali. Namun. Saya bertanya-tanya di mana semua sangat walter mata asli lukisan di dinding kamarnya reproduksi...  Berjalan menyusuri langkah-langkah melalui resort dan di hijaunya…",4
98, Arma Museum & Resort,Kami menyewa mobil dan pengemudi yang hanya sekitar $45 untuk setengah hari dan dia membawa kami di sana dan menunggu kami dengan tidak ada masalah. Taman-taman indah dan itu bagus untuk berkeliaran di sekitar dan mengambil gambar. Anda mendapatkan minuman gratis di cafe dan kami juga mendapatkan sesuatu untuk makan yang lezat. Karya seni sangat terperinci dan indah. Itu bagus untuk keluar dari keramaian dan hiruk pikuk jalan-jalan penuh wisata seminyak untuk beberapa jam. Hari besar. ,4
99, Arma Museum & Resort,"Jika anda perlu tempat indah dan ketenangan untuk mengisi hidup anda dan pengalaman ketenangan yang dikelilingi oleh keindahan maka ini adalah tempat untuk anda. Taman yang indah dan setiap hari membawa new memanjakan semua indra. Vila ini sempurna dan stafnya sangat ramah dan hospitible dari check-in sampai akhir tinggal.  Saya belum pernah ke bali untuk beberapa tahun karena saya menemukan behavious dari tousist banyak orang di bagian dari bali yang tercela. Arma ditawarkan santury dikelilingi oleh seni dan keindahan dalam bentuk taman, dan museum seni. Kami sangat sibuk untuk kami tinggal 6 hari dan melihat kembali kami actully melakukan sangat sedikit kecuali bersantai dan menikmati keramahan tradisional orang bali.  Mqany terima kasih untuk mr Argung rai, yudi dan semua…",5
100, Arma Museum & Resort,"Setelah membaca semua ulasan saya sangat bersemangat untuk pergi ke hotel ini...... Pertama, ada banyak, banyak tangga untuk pergi di mana-mana (saya bepergian dengan wanita yang lebih tua... jadi itu adalah perhatian) kamar kami lebih pada gaya normal, tapi kamarnya yang bergaya bali (yang kami tidak memesan... upgrade gratis) kamar mandi kami sudah tua, kotor, berjamur, ac tidak banyak kebisingan dan tidak ada tv...... Saya tidak ada untuk mendengarkan tv tapi di pagi hari saya suka untuk memiliki beberapa berita. Kamar adalah menjijikkan.... jenis kamar mandi luar tapi tidak sangat.... kolam renang adalah sangat kecil, dingin dan sebagai hanya 6 kursi. Anda juga harus mempertimbangkan fakta bahwa anda berada jauh dari monkey forest street sangat semua toko-toko dan restoran…",3
101, Arma Museum & Resort,"Arma resort adalah cukup menakjubkan. Secara pribadi saya tidak menyadari betapa indah itu sampai kami meninggalkan daerah ubud dan menuju ke kuta dan legian. Kami menginap di sebuah kamar tepat di luar segar mengalir sungai mengalir melalui resort. Itu benar-benar tenang. Saya tidak tahu tentang kamar lain tetapi kamar kami telah tidak ada tv, dan jujur, itu seperti perubahan yang menyegarkan! Fasilitas yang bersih dan dapat digunakan. Mereka mungkin tidak terbaru atau flashest, tapi itu semua menambah pesona dan nuansa arma. Ya, restoran ini tidak yang terbaik, terutama ketika anda memiliki ubud township sangat dekat, tapi kami menerima gratis sarapan harian dengan pemesanan kami, dan kami merasa seperti kami makan seperti bangsawan. Jika anda ingin menjadi bagian dari…",5
102, Arma Museum & Resort,"Arma adalah benar-benar yang paling indah tempat yang damai untuk tinggal di bali. Lingkungan sekitarnya sangat besar dan memberi anda pengalaman bali yang sebenarnya. Kamarnya bergaya tradisional dan hanya dapat digambarkan sebagai mewah. Kami menghabiskan banyak waktu hanya untuk berjalan-jalan melalui resor yang sangat cukup, tempat ini dilengkapi dengan segala sesuatu dari sendiri river untuk lily pad kolam yang penuh ikan koi dan kuil/patung. Serius menakjubkan, akan merekomendasikan kepada siapa pun jika anda ingin mengalami bali. Ubud adalah juga menakjubkan, jauh lebih baik kemudian kuta dan daerah sekitarnya. Banyak yang harus dilakukan dan melihat, dan orang-orang yang jauh lebih ramah. Dalam jarak berjalan kaki ke pusat ubud sekitar 10 menit dari restoran 5 menit .,…",5
103, Arma Museum & Resort,"Enam hari di apa adalah sebuah resor yang adalah nilai yang sangat baik untuk uang. Taman-taman indah dengan banyak kehidupan, termasuk keragaman jika tanaman yang banyak anggrek.   Staf sangat ramah dan penuh perhatian. Ketenangan adalah sebuah kata yang springs ke pikiran ketika bersantai di superior kami villa dengan kolam renang pribadi, bale, kamar mandi luar ruangan dll. hanya indah.   Hanya cukup jauh dari pusat kota yang berada jauh dari sebagian besar kebisingan.   Dengan ini menjadi perjalanan ke bali dengan tujuh saya sebelumnya tetap berpusat di kuta, seminyak, legian, dan lainnya, ini adalah daerah terbaik dan akomodasi begitu jauh.  ",5
104, Arma Museum & Resort,"Setelah kedatangan kami disambut dengan handuk dingin dan minuman. Kamar kami yang luas adalah terletak penerbangan dari langkah-langkah di atas kolam. Hotel ini memiliki segala sesuatu yang kita inginkan: lemari es, air ketel dengan gratis teh dan kopi, tempat tidur ukuran king, tempat duduk yang nyaman di dalam dan di luar, cukup kait dan handuk rak di kamar mandi, kondisi udara. Kelambu yang hilang tapi ada hampir tidak ada moskitoes di ubud. Seseorang membawa keranjang buah untuk kamar kami, ketika kami berada disana. Setiap hari di 4 pm teh dan kopi gratis disajikan di bar kolam renang. Setiap hari itu ditemani oleh jenis kue/bali yang manis. Kami beruntung bahwa terlepas dari kami ada hampir tidak ada tamu lain di hotel. Kolam renangnya cukup besar untuk berenang beberapa…",5
105, Arma Museum & Resort,"Memesan 3 malam menginap di Arma, Ubud, sebagai sisa baik diterima pada akhir perjalanan Indonesia sibuk 20 hari. Kami ingin sepotong, tenang dan mewah. Arma disampaikan!! Villa adalah pribadi (dengan taman itu sendiri, penghiasan/teras dan kolam renang) sangat luas, sangat nyaman dan bersih. Daerah komunal yang ditetapkan di taman yang paling indah, dengan perairan, kuil dll dan tentara staf yang sangat ramah untuk memenuhi setiap kebutuhan Anda. Sarapan made to order dan bisa dikirim ke suite Anda jika diperlukan. Saya juga merekomendasikan mereka spa - jaringan dalam pijat di salon menghadap sekitarnya sawah, diakhiri dengan teh jahe adalah memperlakukan nyata. Arma tidak merasa seperti hotel lain yang pernah saya tinggal di. Cobalah dan lihat sendiri.",5
106, Arma Museum & Resort,"Jika Anda mampu untuk berbelanja secara Royal pada Villa, Anda akan menikmati tempat ini. Jika Anda tidak mampu vila-vila, Anda kemungkinan akan dissapointed. Kami menghabiskan 3 malam di Villa dan mencintai segala sesuatu tentang kami tinggal. Dengan alasan indah, vila-vila besar, nyaman, chique dan pribadi. Satu-satunya keluhan dengan vila-vila sarapan, itu terbatas dalam pilihan dan tidak sangat lezat, kue-kue yang terburuk pernah. Tapi setelah sarapan di Villa menyiapkan hampir membuat untuk itu. Kami pindah ke kamar hotel tadi malam dan tidak bisa percaya ini resor sama. Kamar hotel yang gelap, usang furnitur, lembar kotor, kamar mandi yang suram, tidak berpikir mereka telah menyentuh karena mereka dibangun di 80 's. Senang kita upgrade ke Villa. Resor ini cukup…",4
107, Arma Museum & Resort,"Arma hotel adalah apa yang klaim harus - unik kompleks bangunan tradisional di sekitar taman-taman indah yang ditetapkan di lapangan dekat museum yang menampilkan semua jenis budaya lokal. Kamar atau suite yang dilengkapi dengan barang-barang antik, taman rimbun dan terawat dengan baik dan staf yang ramah. Pemilik jelas mencintai apa yang dia telah menciptakan dan berniat mempertahankan itu. Kami menyukai tempat. Kelemahan adalah: 1) agak jauh dari pusat kota, 2) layanan ini ramah tetapi tidak selalu responsif. Secara keseluruhan bagus bagi kita sebagai pasangan tua yang tertarik pada budaya lokal.",4
108, Arma Museum & Resort,"Kami tinggal di sebuah vila dua kamar. Jadi, saya tidak menulis tentang kamar hotel. Tapi berbicara tentang villa, ini adalah tempat yang ideal Anda pernah bermimpi tentang Bali. Kamar dihiasi dengan manis, dua kamar mandi, satu di dalam satu luar, kolam renang pribadi, dan aku berarti kolam yang besar, untuk kedua kamar. Layanan sarapan di villa Anda dengan tidak ada biaya tambahan, disajikan sebelah kolam renang. Staf sangat penuh perhatian dan selalu siap untuk membantu. Lokasi terletak sekitar 2 km dari pusat Ubud (sangat umum di Ubud Hotel), tapi mudah berjalan atau dapat menggunakan antar-jemput gratis hotel. Satu-satunya hal yang salah yang bisa saya katakan tentang tempat ini adalah bahwa ada internet hanya di sebelah kolam renang utama (gratis) dan tidak di kamar atau…",5
109, Arma Museum & Resort,"Sekali atau dua kali setahun aku datang ke Bali baik untuk bisnis atau kesenangan. Ya, ada banyak beutiful tempat untuk tinggal di Bali terutama di Ubud. Tapi ARMA Resort adalah sangat istimewa bagi saya. Misi dan visi mereka berada di luar sebuah hotel untuk mengambil uang tunai Anda.  Saya telah bertemu dengan pemilik Mr & Mrs Agung Rai, keluarga dan manajer Zanzan. Hotel bisnis mereka tidak hanya untuk menyediakan pekerjaan lokal, tetapi juga untuk mendanai seni dan pelestarian budaya melalui anak-anak dengan menyediakan gratis sekolah tari dan seni diajarkan oleh master penari.  Kamar hotel dan bungalow yang nesstled antara hutan. Hal ini sangat pribadi dan damai. Ada museum seni besar dalam properti. Anda dapat melihat performences Bali klasik oleh perempuan dan anak-anak…",5
110, Arma Museum & Resort,"Aku menghabiskan saya tiga malam pertama di Ubud di hotel ini. Standar kamar yang muncul indah pada awalnya, tetapi setelah tidur di ruang tampaknya dank dan gelap. Aku mencintai dengan alasan dari hotel, tapi layanan ini biasa-biasa saja di terbaik. Butuh mereka dua hari untuk menyediakan penggemar saya diminta untuk menambah AC. Aman yang rusak. Mereka benar-benar tidak fleksibel tentang mengubah tanggal Anda menginap: Meskipun saya menunjukkan untuk dua hari pertama dari tiga hari tinggal, mereka tidak akan membiarkan saya membatalkan tadi malam. Ini tidak terjadi di mana saja lain perjalanan saya. Lokasi hotel tidak besar - perjalanan ke kota ini di jalan dengan banyak lalu lintas dan taxies terlalu mahal di Ubud. Jadwal pesawat mereka tidak berpegang dan Anda biasanya harus…",3
111, Arma Museum & Resort,"Arma Resort diatur dalam beberapa alasan besar dan tampak indah! Kamar yang baik - nyaman, banyak ruang. Mandi tidak meskipun!! Kami memiliki kolam renang antara 4 villa's / kamar yang ment kolam itu pretty much kami untuk hari! Sarapan yang baik, dan staf ramah beberapa hal: segala sesuatu yang 'ekstra' di hotel mahal! -yaitu: dapat Anda lakukan Yofa untuk $50! atau kelas memasak untuk $50! Kami melakukan kelas memasak di jalan selama setengah harga dan itu hebat! PS: Yang baik berjalan ke kota Ubud (15minutes pada jalur tidak lengkap)",3
112, Arma Museum & Resort,Alasan adalah GORGEOUS! It's garden hutan yang menakjubkan dengan semua gaya Bali yang pelancong cinta. Semacam sebuah kuil Indiana Jones memenuhi Taman Eden. Saya menggunakan kombinasi dari United Airlines frequent flyer mil dan uang tunai untuk prabayar villa kami untuk 2 malam. Ini jauh lebih baik daripada gambar-gambar pada situs web mereka. Benar-benar ajaib. Villa adalah seperti Candi dengan langkah-langkah yang cascading ke kolam renang pribadi dengan air mancur Bali. Pagoda meditasi / ruang makan juga sentuhan yang bagus untuk villa pribadi senyawa. Indoor / Outdoor kamar mandi tepat dari desain majalah dengan bak perendaman besar dan koi pond dengan batu loncatan untuk mengakses Anda outdoor shower. Kami seperti ARMA alasan sangat banyak. Saya dan istri saya adalah seni…,5
113, Arma Museum & Resort,"Arma adalah tempat paling indah untuk tetap - dekat pusat Ubud, berjalan kaki dari hutan monyet, seni toko-toko dan restoran dan dengan pemandangan sawah. Staf yang ramah dan membantu untuk sebagian besar - pada beberapa kesempatan kita harus mengejar atas permintaan tetapi untuk sebagian besar mereka yang indah. Kami awalnya kamar standar, yang baik terletak dengan melihat taman - itu agak buruk dan tidak pristinely bersih tapi sangat nyaman dengan hari tempat tidur dan Beranda daerah. Kami kemudian pindah ke sebuah villa yang unggul, namun, dan ini indah - tak bernoda, dihias dengan baik dan nyaman, dengan daerah makan yang terpisah, kolam renang pribadi dan dinding untuk privasi. Semua dalam semua, tempat yang tepat untuk tinggal di Ubud.",4
114, Arma Museum & Resort,"Kami tinggal selama 6 malam di salah satu Villa Superior, dan itu benar-benar menakjubkan. Dalam - luar kamar mandi yang hanya fantastis dan kami memiliki kolam renang pribadi dan taman kita sendiri. Kami pergi ke tidur setiap malam untuk katak-katak yang bernyanyi dan semua suara indah hutan lainnya. Serivce benar-benar hebat dan mereka mengatur perjalanan, pick-up layanan - sarapan di kamar Anda dan semua yang Anda butuhkan untuk menjelajahi Ubud.   Ini adalah 15 menit berjalan-jalan di luar Ubud yang benar-benar bagus, dan taman dan museum adalah benar-benar layak mengeksplorasi.  Kami pasti akan merekomendasikan hotel ini. Tapi menyadari bahwa ada perbedaan besar dalam standar antara kamar biasa dan vila-vila. Kami menyarankan Anda pergi untuk Villa.",5
115, Arma Museum & Resort,"Arma resort adalah sebuah resor yang indah untuk tinggal di, terutama jika Anda memilih salah satu Villa dengan kolam renang sendiri (No 103 adalah yang terbaik - sangat pribadi dan dengan sebuah taman besar). Taman sekitarnya, seperti pengulas lain telah menunjukkan, hanya mengesankan dengan sungai, air terjun, kolam lily, beberapa jembatan, beras fiels lengkap dengan Bebek, patung-patung mistik di mana-mana dan Museum Arma menarik. Layanan sangat baik (sebagian besar staf berbicara bahasa Inggris baik) dan sarapan (Aku memerintahkan bananpancakes, cheeseomelette dan cokelat dengan buah-buahan yang indah) di mana mati untuk - tidak perlu untuk makan siang... Lokasi baik, namun saya menggunakan pesawat yang sangat baik, terutama sopir - Kadek-yang adalah seorang pria lembut,…",5
116, Arma Museum & Resort,"Hotel ini memiliki paling indah & terus-menerus terpelihara dengan baik & terawat kebun, yang besar: Teater terbuka & pertunjukan yang luar biasa! Ada juga berbagai lokakarya lokal / budaya & kelas yang ditawarkan (seperti ukiran kayu atau membuat persembahan), yang sangat bagus untuk memberikan satu lebih langsung wawasan beberapa praktek Bali. Selain itu, hotel terletak sangat baik untuk berjalan-jalan ke & sekitar Ubud. Untuk sarapan, menu yang disediakan, & satu dapat memesan makanan mereka dari sana. Sarapan baik. Staf menyenangkan & ramah.  Namun, di sisi negatif, superior room yang aku tinggal di itu tidak sampai ke standar sama sekali dalam hal kebersihan. Aku benar-benar tidak berpikir bahwa-sprei dan handuk well-laundered. Kamar mandi di dalam bak mandi sangat rendah…",3
117, Arma Museum & Resort,"Saya sudah punya Booking prabayar untuk Arma Resort pada 13 Maret-pemesanan melalui AAVacations.com untuk $125 (menggunakan AA km). Situasi yang tidak dapat dihindari, saya tidak bisa melakukan perjalanan ke Indonesia sebagai awalnya direncanakan minggu ini. Aku menelepon Arma Resort untuk mengubah reservasi tanggal 21 Maret. Staf di kantor penjualan tidak begitu akomodatif.   Mr Darma Putra, penjualan eksekutif, telah menolak untuk mengubah tanggal reservasi bahkan dengan biaya. Ia menawarkan saya untuk membayar penuh untuk reservasi baru--USD 95 ++. Saya menghubungi agen perjalanan saya yang mereka tidak bisa berbuat apa-apa. Hotel-hotel lain aku punya keberatan dengan tidak memiliki masalah perubahan tanggal pemesanan untuk saya (meminta biaya $30). Saya merasa sulit untuk…",1
118, Arma Museum & Resort,"Kami menikmati kami menginap di Arma. Dengan alasan yang indah, staf sangat ramah, dan sarapan yang dinikmati oleh orang dewasa dan anak-anak. Shuttle bus adalah nyaman. Kami sangat menikmati ekstra kecil seperti gratis kopi dan teh oleh kolam setiap sore dan penerimaan untuk mengunjungi museum di lapangan.   Standar kamar yang Oke, tidak ada yang mewah atau mewah, tetapi cukup dan nyaman. Daerah luar ruangan yang indah.",4
119, Arma Museum & Resort,"Kami menyewa dua kamar dan vila di resor ARMA untuk keluarga saya selama liburan Natal 2010. Kami menemukan alasan untuk menjadi spektakuler. Resensi lain menggambarkan mereka sebagai tampak seperti set dari film Indiana Jones, yang tampaknya tempat di. Jungle subur meluap patung-patung dan seni. Alasan indah benar-benar adalah bagian terbaik dari resor. Ini adalah sangat bagus melarikan diri dari keramaian pusat Ubud, yang berada dalam jarak berjalan kaki dari resor.  Kesan saya dari kamar kami menyewa adalah karena mereka baik ditunjuk tapi tidak spektakuler. Daybed di beranda luar ruang kami di tepi kolam renang, meskipun, adalah tempat yang indah untuk sore hari bersantai dan tidur. Villa yang kami menyewa adalah cerita lain sama sekali. Itu spektakuler. Besar, nyaman dan…",4
120, Arma Museum & Resort,"Saya hamil dan istri saya pergi pada liburan di luar negeri terakhir kami sebelum kami bayi pertama lahir. Kita tidak terus kembali satu ini dan memutuskan ARMA resor sebagai pilihan kami akomodasi. Kami merencanakan untuk tinggal di sana selama 5 malam.  Resor ini menawarkan mandi udara terbuka di dalam kamar. Kami tidak benar-benar santai mengetahui privasi kami adalah suci karena mandi udara terbuka ini dikelilingi oleh dinding yang sangat tinggi.  Istri saya mendapatkan diganti di wilayah mandi dan merasa seseorang memandangnya. Dia mendongak dan tersentak oleh seorang laki-laki lokal mengintip di atas dinding padanya. Aku, juga, adalah telanjang ketika istri saya menjerit dan aku bergegas untuk meraih handuk dan berlari di luar untuk memberikan chase. Oleh tahap itu ada…",1
121, Arma Museum & Resort,"Kami tinggal di sebuah villa di ARMA dan harus katakan, wow... apa sepotong surga. Villa diabaikan paddy beras bekerja, dikelilingi oleh taman yang rimbun dan kolam itu sendiri dan kamar mandi udara terbuka.  Sarapan besar, siang teh/kopi disajikan kolam renang setiap hari dan kedua on-site restoran besar, meskipun agak mahal. Lokasi sangat ideal di Ubud Selatan, dekat dengan banyak restoran, spa dan Galeri/museum seni. Sepenuhnya direkomendasikan untuk liburan romantis. Tidak dianjurkan untuk orang tua. Banyak langkah-langkah.",5
