,hotel,review,stars
0, Arma Museum & Resort,"Area penerimaan tamu ke resortnya tidak begitu dekat, namun pekarangannya sangat mengagumkan. Sangatlah damai, jauh dari hingar bingar di Ubud. Di sisi manapun di tamannya adalah kehidupan yang hening dan indah dengan patung-patung, air mancur, alam yang mekar dan lainnya dan museum dengan pertunjukkan dan pelajaran menari setiap hari. Pengalaman yang menyenangkan. Kamarnya OK kecuali pintu yang bersuara dan tidak menutup dengan benar. Restoran Thai di sebelah area penerimaan tamu sangatlah buruk. Saya tentunya tidak merekomendasikan Anda untuk pergi ke sana. Selain itu, ini adalah pengalaman menginap yang menyenangkan dan patut direkomendasikan. Ada mobil pengantar secara gratis yang membawa tamu ke pusat Ubud karena letak resort yang di luar pusat kota.",4
1, Arma Museum & Resort,"Di luar waktu sibuk, saya membayar sekitar $85-95 untuk kamar unggulan, yang mana merupakan pembelian bagus menurut saya. Kawasannya benar-benar menawan dengan detail pesona khas Bali yang tak terkira indahnya. Kolamnya juga hebat. Saya sangat senang sekali dengan #808 dan tidak ada masalah yang muncul. Tidak semua tempat dekat dengan pusat kota Ubud tapi di sana ada transportasi antar-jemput gratis. Museum di sebelahnya layak untuk dikunjungi saat pelajaran musikal harian dan anda bisa menontonnya selama ada latihan. Saya makan di Thai Restaurant di lantai dasar hotel (satu menu makanan terhitung sebagai bonus) dan saya pikir ini sudah bagus. Belum pernah mencoba layanan spanya --namun tampak tidak murah.",4
2, Arma Museum & Resort,"Saya melakukan perjalanan bersama istri kemudian singgah di vila unggulan yang memiliki pavilyun dan kolam renang pribadi, kamarnya luas, tidak ada TV dalam ruangan dan saya berterimakasih untuk itu mengingat kami hanya ingin menikmati suasana ketimbang menonton TV.  Ada sungai kecil di sepanjang resor yang saya pikir menarik karena mereka membiarkannya mengalir tanpa harus membuat konstruksi untuk membentuk aliran air. Sebagian besar properti di resor ini dipenuhi dengan lumut dan ganggang sehingga tampak sangat khas Bali secara alami, kerja yang bagus untuk itu!  Sarapan pagi tidak bagus tapi pegawai membalasnya dengan senyum dan layanan yang memuaskan. Dan yah, mereka memiliki pemandangan sawah tepat berada di belakang vila kami mengingat kita membicarakan tentang Ubud di…",4
3, Arma Museum & Resort,"Tempat yang luar biasa! Resor ini sangat indah. Ini telah dirancang sehingga di mana pun Anda melihat, Anda mendapati diri Anda berpikir ‘Wow! ’ Kamarnya luar biasa. Alasan sangat baik disimpan. Restoran-restorannya luar biasa. Staf sangat ramah dan membantu. Ada tiga museum seni di dalam hotel. Anda dapat melihat tarian tradisional Bali di tempat beberapa malam dalam seminggu. Anda dapat mengambil kelas seni di tempat dan menonton juga artis di tempat kerja. Pengalaman yang luar biasa untuk menjelajahi lahan dan menemukan seniman yang bekerja - yang sangat senang menunjukkan dan menjelaskan karya mereka. Tempat yang luar biasa santai - surga sejati di tengah hiruk pikuk Ubud. Saya sangat senang telah menemukan tempat yang indah ini.",5
4, Arma Museum & Resort,"Kami tinggal di sini sebagai kelompok kecil selama beberapa malam. Kamar, resor, layanan & makanan yang fantastis. Saya akan kembali & tinggal di sini dalam sekejap. Kami hampir tidak ingin meninggalkan resor karena kami sangat melayani & makanan saat sarapan, kafe & makan siang & makan malam sangat fantastis. Itu sangat santai, staf yang sangat indah & saya sangat merekomendasikannya jika Anda mencari tenang & santai. Lingkungan luar biasa & pilihan kolam renang untuk bersantai.",5
5, Arma Museum & Resort,"Tinggal di sini selama 7 malam setelah seminggu yang sibuk dengan perjalanan dan kegiatan di sekitar Bali. Alasan yang indah, kamar, orang-orang dan makanan dan layanan yang sangat baik. Jika Anda ingin berlindung dari Ubud, ini adalah tempatnya. Dekat dengan pusat Ubud tetapi cukup jauh untuk merasa seperti Anda berada di dunia yang berbeda.",5
6, Arma Museum & Resort,"ARMA Resort luar biasa.  Adik perempuan saya, keponakan, suami dan saya menghabiskan sepuluh hari di ARMA (20 - 30 September 2019), dan kami merasa beruntung telah membuat pilihan ini dari banyak akomodasi yang terdengar bagus di Ubud.  Lahan ARMA luar biasa: luas (7, 5 hektar) dengan masing-masing vila yang indah, sawah, sungai, taman yang dirancang indah dengan banyak lusinan ukiran batu yang indah, dan banyak paviliun & tempat-tempat lain untuk duduk menikmati lingkungan sekitar. Begitu Anda memasuki pekarangan, Anda menghela napas lega, telah meninggalkan lalu lintas, kebisingan & keramaian Ubud jauh di belakang.  Apa yang benar-benar membedakan ARMA Resort adalah keberadaan tiga museum besar dan penting yang didedikasikan untuk sejarah lukisan Balanese selama 90 tahun…",5
7, Arma Museum & Resort,"Resor ARMA adalah pencapaian yang luar biasa, perumahan museum di area resor sangat menyenangkan. Anda dapat menikmati seni, kebun, dan lingkungan secara umum. Terakhir kali kami tinggal adalah tahun 1996 telah banyak berubah secara visual dan arsitektur tetapi jiwa dan semangat resor ini tetap sama. Pengalaman yang benar-benar menyenangkan. Sangat direkomendasikan.",4
8, Arma Museum & Resort,"Semua rekomendasi untuk Anda dapat ditemukan di raisain suivantes. Saya tidak merekomendasikan untuk menginap di hotel ini karena alasan berikut:  - bahkan jika taman dan lingkungan dengan museum benar-benar indah dan damai, kamar-kamarnya sangat tua, dengan aroma kelembaban yang kuat, bintik-bintik pada seprai dan tirai. Sangat membutuhkan renovasi  - Kasur kamar tidur dan bantal sudah sangat tua dan kotor dan tidak berkualitas baik,  - pendingin ruangan tidak berfungsi dengan benar yang artinya tidak mungkin untuk menyesuaikan suhu di dalam ruangan  - bahkan jika kami berbagi umpan balik terutama pada bantal yang benar-benar tidak nyaman dan pendingin udara, tidak ada solusi yang diajukan kepada kami oleh hotel  - Kami memesan 1 villa keluarga dengan 2 kamar untuk kami dan…",1
9, Arma Museum & Resort,"Wilayah yang indah dengan sawah, taman, kolam teratai, patung-patung sempurna, museum menarik, restoran dan hotel asli Thailand  Kami datang ke museum, taman, dan makanan yammy. Ditemukan semuanya di satu tempat.  Koleksi museum dengan sempurna mewakili seni Bali yang mengesankan dari masa lalu hingga zaman modern.  Taman ini memiliki jutaan tempat yang bagus untuk pemotretan.  Layanan bagus dan makanan enak yang kami terima di restoran Thailand yang dialokasikan di wilayah tersebut.",5
10, Arma Museum & Resort,"Dasar resor dan museum ARMA luas dan begitu indah, penuh dengan patung berlumut, kolam teratai, air mancur, anggrek, dan pohon-pohon besar. Situs ini sangat sepi dan namun hanya 10 menit layanan antar-jemput gratis ke restoran dan toko-toko di pusat Ubud. Vila-vila kolam renang pribadi adalah nilai yang sangat baik dengan kebun mereka sendiri dan beberapa dengan pemandangan sawah. Staf menawan dan penuh perhatian. Entri Museum gratis untuk tamu dan layak dikunjungi dengan berbagai karya lokal tradisional dan modern. Bapak Agung Rai juga mendukung sekolah untuk tarian dan musik tradisional Bali dengan pertunjukan di halaman. Retret delightfu, otentik.",5
11, Arma Museum & Resort,"Saya tidak bisa membayangkan tempat yang lebih otentik, tetapi sementara itu juga mewah untuk tinggal di Ubud, hanya 10 menit dari pusat. Hotel ini memiliki taman dan taman terindah yang pernah saya lihat. Di setiap sudut ada karya seni memberkati mata Anda. Air mancur kecil, sungai kecil dengan jembatan lucu, bunga, patung-patung Bali, sawah, tempat peristirahatan. . sangat damai! Kamar tempat tidur twin kami selalu sangat bersih, tempat tidur sangat nyaman. Staf sangat membantu, ramah selalu ada di sana! Staf yang ramah, saya harap mereka dihargai oleh manajemen. :) Sekali lagi terima kasih untuk menjamu kami di resor yang indah ini!",5
12, Arma Museum & Resort,"Arma luar biasa. Ini adalah resor besar dengan banyak area berbeda untuk dijelajahi. Saya belum pernah melihat yang seperti ini. Beberapa bangunan musuem, sungai, banyak tingkat accomadation. Bahkan ada sawah dan tempat-tempat bagus untuk duduk menghadap mereka.",5
13, Arma Museum & Resort,"Kami telah memesan untuk tinggal di kolam renang Villa tetapi setelah memeriksa itu memutuskan bahwa itu tidak cocok untuk keluarga kami. Villa itu sendiri sangat tradisional, itu indah untuk melihat tetapi memiliki bau yang sangat berdebu dan berjamur di seluruh. Ada pancuran terbuka di tengah Villa yang berarti air yang tidak aktif akan menarik serangga dan nyamuk dan pintu dan jendela tidak terlihat tertutup sepenuhnya. Kolam renang vila tampak bagus meskipun itu akan terlalu dingin untuk bayi saya untuk berenang. Sisa keluarga saya tinggal di kamar superior dan kami menyukai tampilan kamar mereka sehingga kami downgrad. Staf penerimaan sangat ramah dan profesional dan itu mudah untuk memindahkan kamar. Kami memesan melalui Agoda tetapi mendapatkan uang kami kembali…",3
14, Arma Museum & Resort,"Arma Museum & Resort adalah, bagi kami, pengalaman yang sangat berbeda vis - a - vis resort lain yang kami tempati.  Resor ini terletak di lingkungan yang sangat alami, dan hal pertama yang mengejutkan kami tentang tempat itu adalah tanaman hijau. Namun resor tampaknya telah melakukan pekerjaan yang sangat baik mempertahankan tempat - meskipun lingkungan alam, kami tidak memiliki masalah dengan nyamuk / serangga (saya mengerti bahwa ini tidak selalu terjadi dengan tempat lain di Ubud). Tempat ini juga dihiasi dengan sejumlah patung yang meningkatkan suasana resor.  Hotel ini menyenangkan Anda dalam sejumlah cara - yang terkenal di antaranya adalah pijat kaki atau punggung kaki gratis selama 15 menit yang ditawarkan kepada setiap tamu. Dalam kasus kami, ini mengakibatkan kita…",4
15, Arma Museum & Resort,"Resor ini telah mengejutkan saya dengan suasana alam, patung-patung artistik, air terjun mini dan keramahan. Jenisnya tempat meditasi. Sarapan sangat baik dengan banyak barang. Coba sup Tahu. Mereka menyediakan bus shuttle yang sangat membantu. Ada 3 kolam renang dan saya sudah mencoba semuanya. Itu layak menghabiskan dan saya akan senang untuk tinggal lagi.",5
16, Arma Museum & Resort,"Saya memesan hotel ini seminggu sebelum perjalanan saya, dan sangat senang bahwa itu dekat dengan villa lain yang saya mentransfer dari. Karena dengan apa yang telah di katakan oleh orang lain, hotel ini sangat menyenangkan. Tamannya Penuh dengan arsitektur Bali dan sekeliling, di tengah-tengah kebun tropis yang tenang, suasana pasti oasis untuk kembali ke dari keramaian dan hiruk pikuk pusat Ubud.  Saya menginap di sudut kamar yang besar, yang sudah tua, dan benar-benar salah satu kamar yang di bawah rata-rata, saya telah menginap di beberapa saat. Kamar mencerminkan umur hotel yang sebenarnya, karena yang bisa juga dapat dilihat dari dengan cara hidup di alam atau kawasan yang terlihat.  Air panas hilang satu malam dan kami pergi dengan air dingin untuk mandi. Untungnya ini…",3
17, Arma Museum & Resort,"Kami menginap di salah satu kamar suite selama kami tinggal di Ubud. Lokasi hotel ini sangat dekat dengan Bale Udang Ubud (5 menit berkendara) , dan dekat kaki ke kios bensin dan beberapa warung setempat. Arsitektur bangunan suite dan benar-benar membuka mata, dengan orang-orang Bali dan detail pada tempat kerajinan. Kamarnya luas, lingkungan resort adalah jenis hutan hujan tropis dengan sungai dan air terjun seperti efek di mana anda dapat mendengar suara itu.  Namun, kami mendapat pengalaman buruk di sini karena kamar dan lingkungan resort ini tidak terawat dengan baik. Terutama untuk membuat layanan kamar adalah dari semua resort terjelek yang saya pernah menginap. Menggunakan handuk, sendok garpu dan dll tidak berubah sama sekali. Hal yang paling kesal adalah make up room…",2
18, Arma Museum & Resort,Kolam renang sangat bagus villa. Kamar yang besar dengan kolam renang yang terletak di tengah taman sendiri  lebih luas yang terletak di tengah resort sawah yang indah di pinggir Ubud  Restoran lumayan (masakan Thai yang sedikit aneh) dengan kafe yang menyajikan makanan lokal yang lebih sederhana)  museum besar dan sorot adalah pertunjukkan pertunjukan lokal setel di bawah bintang  secara keseluruhan tempat yang bagus untuk menginap jika anda ingin berada di dekat dengan Ubud (10 menit berjalan kaki ke Monkey Forest dan 15 menit ke Istana Ubud),4
19, Arma Museum & Resort,"Walaupun resort besar tidak terasa seperti itu karena pemandangan yang indah! ! ! Resor ini sudah 5 bintang kecuali sarapan yang sangat buruk. Tempat yang sebenarnya adalah menakjubkan. Semuanya sangat bersih, staf yang luar biasa (tidak ada yang menjadi masalah dan mereka selalu bekerja ekstra) & lingkungan sekitarnya sangat indah. Tempat yang sempurna untuk menginap di ubud. Sarapan sangat buruk setiap hari, hari pertama kami pergi ke sarapan di 10 (sarapan berakhir pada 10 . 30 ) dan semuanya kosong. Hari berikutnya kami tiba di sana pada pukul 7 . 30 (saat sarapan mulai) dan semuanya penuh tetapi dingin. Selebihnya dari minggu mengikuti pola yang sama dingin atau kosong. Ada 4 pilihan makanan panas biasanya, kue-kue, roti panggang, sereal, selai dan buah segar. Pilihan…",4
20, Arma Museum & Resort,"Tempat ini luar biasa - akomodasi - kami mendapat villa dengan dua kamar tidur! - yang persis berapa yang anda bayangkan! Shower, bak mandi yang menakjubkan, dll. Sarapan benar-benar tidak bagus - jadi akan melewatkan itu. Tetapi dekorasi, lokasi, dan akomodasi yang benar-benar menakjubkan!",5
21, Arma Museum & Resort,"Tempat ini adalah sesuatu yang lain. Ukuran hotel ini cukup besar (dengan beberapa langkah dan sepanjang elevations) . Ruang yang didedikasikan untuk memenuhi pemiliknya yang terjadi filosofi artis. Seperti yang anda akan menemukan sebuah sungai yang mengalir melalui pusat, museum nasional, yang layak pengakuan dalam jumlah yang belum pernah terbayangkan sebelumnya, patung-patung yang tertutup oleh lumut kuno dan dikelilingi oleh tanaman, pepohonan, kolam ikan dan bunga-bunga yang membuat anda merasa seperti Anda berada di sebuah hotel dan setengah setengah di dalam hutan! Cukup anehnya anda akan berpikir akan ada banyak nyamuk tapi tidak begitu. Banyak tokek dan katak dan bukannya! Anda benar-benar merasa seperti Anda memiliki alam di depan pintu anda. Kedua kamar kami menginap…",5
22, Arma Museum & Resort,"Benar-benar pengalaman yang berbeda di Bali. Seperti modern art gallery di mana saja. Sangat dekat dengan pusat Bali, mudah, 10 menit berjalan kaki maks. Tidak mendapatkan taksi, yang akan membawa anda lebih lama untuk sampai ke sana dari berjalan kaki.  Sangat menarik dan lokasi yang indah. Seni  Pasti layak check out jika Anda seorang pecinta seni.",5
23, Arma Museum & Resort,"Jika anda mencari tempat yang steril di mana semuanya adalah lingkungan dipoles ini bukan tempat untuk anda. Jika anda ingin merasakan Ubud dan budaya Bali, dan memungkinkan semua indera Anda untuk mendapatkan pengalaman yang istimewa tentang Bali dan warisan budaya, ini adalah salah satu juta pengalaman budaya. Ada suara air - yang berbeda dering, katak kecil saya bisa menonton karena saya mandi dengan tekanan air yang terbaik di mana saja di pulau ini, selalu ada semacam acara budaya karena tarian, wayang, lukisan lokakarya atau membuat anda makan siang untuk anda suami. Terima kasih untuk kelas memasak. Terdapat museum, yang menarik yang membawa banyak budaya ke Ubud dan kemudian tujuh hektar taman, sawah, dan favorit saya adalah kolam teratai. Anda akan merasakan artis di…",5
24, Arma Museum & Resort,"Resor ini yang menyerupai hutan yang terlihat bagus pada pandangan pertama. Ada banyak tempat duduk yang nyaman, sebuah kolam renang, restoran besar dan di sisi lain dari bangunan museum dan kafe. Patung membantu untuk menciptakan suasana Indiana Jones ini. Staf sangat ramah walaupun tidak selalu sama termotivasi. Kamar besar dengan AC. Restoran adalah benar-benar kosong di malam hari karena kurangnya suasana. Mereka melayani terutama makanan Thai dari kualitas yang hebat. Cafe yang sangat nyaman. Ada pekerjaan konstruksi yang terjadi. Kolam renang dan bak mandi tampak seperti itu kami bisa menggunakan beberapa perbaikan. Terapis pijat datang ke kamar kami karena mereka juga sedang dalam perbaikan gedung. Kami tinggal di sini meninggalkan beberapa komentar positif dengan suasana…",4
25, Arma Museum & Resort,"Tinggal di sini di akhir Agustus sebagai bagian dari Ibu - dua Putri - minggu perjalanan kami ke Bali. Setelah tinggal di sini beberapa hari selama minggu pertama, kami menyukainya begitu banyak kami kembali kedua kalinya seminggu sehingga kami bisa dekat dengan keluar perjalanan kami di sini. Segala sesuatu yang luar biasa, dari staf yang ramah dan membantu, indah, baik - terus, subur taman pekarangan dengan patung (dan bahkan sebuah sungai yang mengalir melalui itu). Saya juga menikmati Museum di sore hari ketika putri saya hanya ingin Lounge di kamar. Seni memberikan wawasan tentang budaya dan agama dari negara yang indah ini. Malam pertunjukan budaya yang juga luar biasa, dan fakta bahwa Arma memberikan gratis musik dan tari pelajaran untuk anak-anak adalah warisan yang luar…",5
26, Arma Museum & Resort,"Kami menginap di Arma Resort selama empat hari awal bulan ini dan menikmati kami tinggal. Lahan resor sangat spektakuler; subur dan rohani. Setelah Anda langkah di luar jalan yang sibuk Ubud, Anda telah memasuki tempat hijau yang terasa sangat berbeda dari seluruh kota yang mengelilingi tempat ini. Kami mampu untuk menyewa pemandu (w/mobil) untuk membawa kami di sekitar dan dia - (namanya Chok - de) adalah luar biasa.   Secara visual, Arma Resort adalah menakjubkan. Ada anggrek yang menggantung dari pohon, katak dan kadal yang berkeliaran di sekitar, dan ukuran piring salad laba-laba yang tergantung di pohon-pohon di atas (jangan khawatir, tidak di dalam kamar). Saya menyebutkan ini karena wisatawan harus tahu bahwa itu tidak merasa seperti Anda berada di hutan, jadi jika Anda…",4
27, Arma Museum & Resort,Kami menghabiskan beberapa hari di Arma Resort dengan orang tua saya dan mereka sangat menyukainya! Ia hotel dan resort adalah indah dan semua staf super baik dan bermanfaat. Kami memiliki waktu yang besar di sana. Terima Kasih!,5
28, Arma Museum & Resort,"Resor ini mengagumkan, dikelilingi oleh sawah.  Pertunjukan yang bagus di Bali.  Sarapan yang baik tetapi akan lebih baik jika itu prasmanan.  Staf adalah sangat membantu.   Namun, berhati-hatilah jika anda memesan villa keluarga. Kolam renang air hijau (maksud saya gelap hijau! )! Kami melihat hotel ini dua kali di meja resepsionis. Pertama kali mereka mengatakan kepada kami bahwa itu adalah ""normal"". Kami bersikeras dan ketika salah satu karyawan melihat dia mengatakan bahwa sebenarnya ada masalah dengan kolam renang. jadi, hari terakhir mereka mengirim petugas kolam untuk menempatkan beberapa bahan kimia di dalam air. Tapi mereka melarang kami untuk berenang selama 24 jam di hotel ini. jadi, kami dibayar untuk villa kolam renang tapi kami hanya menggunakan setelah hari…",3
29, Arma Museum & Resort,"kami memiliki indah menginap di Arma Resort di akhir Juni 2017. anak saya sangat suka pemandangan yang mereka dapat berjalan di sekitar dan melihat sawah, kolam ikan, burung dan banyak hal. Ini adalah waktu yang tepat untuk melarikan diri dari kehidupan kota dan hanya menikmati suasana alam yang damai. Sarapan yang baik tetapi tidak yang khusus. Kamarnya luas dan nyaman untuk 5 dari kami, tetapi hotel ini perlu upgrade di kamar mandi dan menambah pasokan mandi",4
30, Arma Museum & Resort,"Indah indah, sekitar 5 hektar taman untuk menjelajahi sepanjang dengan galeri seni. Kamar yang menakjubkan juga. Tempat ini memiliki gambar tidak melakukan keadilan karena itu adalah terdiri dari banyak daerah terpencil. Staf memperlakukan Anda seperti raja. Hanya 1 Jalan kami menginap di sini tapi saya sudah tahu ini adalah tempat terbaik yang pernah saya kunjungi! ",5
31, Arma Museum & Resort,"Arma museum yang menampilkan seni dan budaya Bali. Hotel ini memiliki galeri lukisan Bali tradisional dan kontemporer, paviliun untuk praktek mahasiswa lokal asli dari tarian dan musik, demonstrasi oleh pengrajin, dan acara khusus lainnya. Minuman gratis yang disertakan dengan biaya masuk. Harus lihat untuk semua pengunjung. Arma Resort dekat dengan museum.",5
32, Arma Museum & Resort,Properti Bali yang menakjubkan.  Kamar nyaman dan menarik.  Saya menginap di Superior Villa tampak menakjubkan.  Dengan alasan luar biasa yang tersebar di seluruh sudut untuk privasi dan kontemplasi  Layanan sempurna dan staf ramah dan membantu.  Sebuah oase tersembunyi di tengah dari pusat kota Ubud.,5
33, Arma Museum & Resort,"Terlepas dari salah satu tempat terbaik yang pernah saya tinggal di, Arma adalah tempat yang menakjubkan untuk menginap karena letaknya juga 'Museum Hidup' di keuntungan dari hotel untuk membantu mendukung pendidikan budaya lokal dengan anak-anak. Museum mendidik dan terus tari budaya dan seni. Mereka mendukung muncul seniman lokal. Kelestarian budaya terletak di jantung resor/kebijakan museum ini. Hotel ini tidak di Ubud atau cheapes yang paling mahal tapi yang dikelola oleh orang Bali lokal yang tertarik untuk berbagi pengetahuan dan filsafat. Saya merasa bahwa dengan menginap di sini kami memberikan kembali kebudayaan yang membawa kami di sini di tempat pertama. Kami telah tinggal di sini beberapa kali dan akan tinggal lagi.",5
34, Arma Museum & Resort,"Kami menghabiskan seminggu di sini dengan kami dua anak-anak. Ini adalah indah, gratis teh sore yang sangat baik, dan restoran Thailand membuat makanan yang lezat. Hal terbaik tentang hotel ini adalah taman. Itu adalah suatu kehormatan untuk menjadi seperti taman yang indah. Itu juga sangat bagus untuk mengunjungi museum saat ini yang kami suka. Kami benar-benar menikmati tempat ini.",4
35, Arma Museum & Resort,"Kami berjalan melalui malam Ar museum dan taman yang layak melihat. Obor, kostum anak perempuan. Kami disambut Bu pemiliknya. Kami memiliki makan malam sangat baik sambil menonton pertunjukan Bali dengan musisi, tarian Barong.",4
36, Arma Museum & Resort,Arma Museum terletak di taman yang indah seperti pengaturan. Koleksi seni yang menakjubkan namun tidak menjawab dan pengrajin ukiran kayu dan lukisan yang ada untuk dijual. Kami makan siang di restoran yang berada di resor yang sangat baik dan harga terjangkau.,5
37, Arma Museum & Resort,Teman saya dan saya telah berbelanja dan memiliki beberapa minuman sebelum keluar untuk mencari tempat yang sempurna untuk makan malam. Kami ingin makanan lokal daripada Meksiko atau Italia atau jepang atau apa pun dan tempat santai yang bagus di luar ruang makan. jadi kami berjalan oleh beberapa tempat kemudian berhenti di sudut untuk mendapatkan bantalan kami ketika kami melihat pelayan di sisi lain dari jalan dan tersenyum melambaikan tangan pada kami dari luar dengan restoran. Sekarang senyum ramah di tempat asing selalu menyambut kami hangat dan berbicara dengan dia.   Dia menunjukkan kita menu. Meyakinkan kami bahwa makanan yang sangat baik dan daftar anggur yang sangat baik (jika Anda peminum anggur di Bali yang dapat menantang. Anggur yang sangat asing pajak dan tidak…,5
38, Arma Museum & Resort,"Kami telah membaca ulasan dan jadi kami pikir kami tahu apa yang diharapkan dari Arma, menyenangkan dan tenang tinggal. Pada saat kedatangan untuk 4 malam kami diberitahu bahwa ada 'semangat' festival berlangsung di lapangan dan bahwa akan ada musik di resort dekat kamar kami dan jika kami ingin menghadiri festival ini akan biaya US $30! Kami diberitahu itu untuk 2 malam dan kemudian pindah ke bagian atas area. Ini adalah untuk pergi pada 2300 sampai kami mengatakan kami bisa hidup dengan. Kami tidak berharap untuk menjadi musik di siang hari atau untuk memiliki privasi kami selalu diserang oleh penonton festival dan kembali ke hotel dan menemukan keamanan kami duduk di teras di kursi lembut, tidak bergerak ketika ditanya oleh wanita di pesta, sehingga ketika kami hanya…",1
39, Arma Museum & Resort,Mengunjungi museum ini dengan keluarga. Koleksi di museum pasifika ini bagus tapi di Nusa Dua adalah jauh lebih baik.  Tidak ada AC jadi dingin air dan bersiaplah untuk keringat. Anda perlu 2 jam maksimum di sini dan harus mengunjungi bagian Lotus.,4
40, Arma Museum & Resort,Kedua kalinya tinggal di sana dan hanya sebagai bagus meskipun sepi karena bukan musim liburan. Restoran Thailand yang sangat baik pada situs web. Kamar terawat dengan baik dan nyaman dan wifi sekarang diperluas untuk menutupi kamar dengan baik. Semua staf sangat ramah dan membantu.,4
41, Arma Museum & Resort,"Ada banyak kegiatan untuk menikmati hari dan malam di Arma bahwa kami memutuskan untuk menghabiskan malam di 2 kamar tidur vila. Ini adalah pilihan yang baik untuk pasangan 2. Setelah makan pagi dan check in yang cepat di luar - house, kami dikawal ke penginapan kami. Perjalanan melewati lanskap yang indah dengan pohon-pohon yang menjulang tinggi, tanaman berbunga, jembatan, patung-patung batu, air dan cahaya yang tersebar. Ini adalah lukisan tua Ubud yang kami lihat di museum hidup. Berjalan kaki ke villa kami yang tenang.   Lanskap tropis sampai ke villa, yang berisi 2 rumah pribadi yang berbagi kolam renang umum. Ini adalah bagian tempat suci Tua di Ubud, dengan besar dan nyaman tempat tidur, fasilitas yang mewah, kamar mandi di luar dan pancuran mandi, dan layanan kamar.…",4
42, Arma Museum & Resort,Taman indah dan begitu adalah koleksi. Terima kasih untuk interpretasi yang canggih. Teh yang bagus juga. Saya menikmati tinggal di sini dengan kualitas di museum dan taman yang tenang. Terima kasih untuk pengalaman yang luar biasa.,4
