,hotel,review,stars
122, Arma Museum & Resort,"Kami tinggal di Arma Resort adalah cara ideal untuk untuk memulai liburan kami Bali - menawarkan staf yang ramah, seni dan kinerja, malam tenang dan dua restoran yang sangat baik semua dalam taman luas dan indah. Unwinding itu mudah dan dengan semua keramaian, warna dan rasa pusat Ubud dalam mudah mencapai (cukup walkable, tapi mungkin antar-jemput gratis atau taksi pilihan yang lebih baik).  Bukan sebuah resor mewah dan ada tidak berenang bar atau klub malam, tetapi kamar besar dan bersih dan teh dan kue dilayani setiap sore kolam renang.   Bersama dengan museum seni, resor ini adalah bagian dari sebuah kompleks yang didedikasikan untuk melestarikan dan mempromosikan Bali seni, budaya dan sejarah dan tamu didorong untuk berpartisipasi - kami tidak cukup beruntung untuk berada…",4
123, Arma Museum & Resort,"Museum Arma & Resort terletak di taman yang sangat bagus yang dihiasi dengan tokoh-tokoh Indonesia dan hanya 10-15 menit berjalan kaki dari Ubud (transfer antar-jemput gratis ke pusat Ubud ditawarkan). Staf sangat bagus, dibantu dalam mengatur perjalanan dan selalu up untuk chatting cepat. Ruang namun sangat tua dan gelap dan tidak memenuhi harapan kita. Lemari sangat kotor, tetapi kamar mandi terburuk. Fasilitas kamar mandi lama, bak mandi tanpa tirai mandi, rendah menggantung kepala pancuran dan staf memberitahu kami bahwa air kebutuhan untuk menjalankan selama hingga 5 menit sampai ternyata hangat. Yang membuat Anda berpikir tentang menyimpan air di Indonesia.",3
124, Arma Museum & Resort,"Aku benar-benar ingin mengatakan hal-hal baik tentang tempat ini tapi aku hanya tidak bisa. Kebun bagus, Mr Agung Rai kepribadian yang nyata dan Golden jam Tour dan seni kelas mengesankan. Tetapi dalam pengertian resor itu sendiri, hari yang lebih baik yang baik dan benar-benar di balik itu. Tempat ini lelah dan fading cepat. Perabotan kayu (yang ada banyak di kamar delux) telah pindah dari engsel mereka dan telah menyesatkan, towells hampir kertas tipis dan dinding mulai retak dan discolour. Ruangan ini tampak seperti mereka tidak melihat skerrick pemeliharaan sejak saat Soeharto. Tempat kebutuhan makeover jika ingin untuk bersaing dengan yang lebih oppulent dan pesaing modern. Sarapan adalah dissapointing dengan hanya pilihan ramping ditawarkan. Juga terletak di jalan utama…",3
125, Arma Museum & Resort,Taman dan daerah sekitarnya ARMA resor yang indah dan tenang. Sungai dan air terjun berjalan melalui lapangan dan daerah di luar sekitarnya oleh sawah. Resor ini juga di lokasi dalam jarak berjalan kaki Jalan Hanoman dan Jalan hutan monyet meskipun resor menjalankan sebuah bus shuttle ke kota jika diperlukan.  Staf yang sopan dan menyenangkan tapi tidak pernah sangat meyakinkan dalam tanggapan mereka akan memberikan dan pada beberapa kesempatan kita perlu meminta lebih dari sekali untuk mendapatkan sesuatu. Kami tinggal termasuk catatan ke museum ARMA yang sangat baik dan pasti patut dikunjungi.  Kekecewaan utama tentang kami tinggal adalah kamar hotel. Sementara itu besar dan mudah dipasang 3 orang (meskipun salah satu harus tidur di tempat tidur hari di jendela) kamar mandi…,3
126, Arma Museum & Resort,"Tinggal tiga malam di kamar hotel standar. Kamar yang sangat luas dan dihiasi dengan manis. Dasar pada Arma luar biasa indah, kelihatannya seperti film dari film Indiana Jones. Staf yang benar-benar baik dan sarapan made by order dengan buah segar minuman. Salah satu hotel paling menyenangkan yang pernah tinggal.",5
127, Arma Museum & Resort,Aku tinggal di resor ramah Arma di Ubud di tengah dari taman air yang luar biasa. Kamar dari $70 dan villa sekitar $200. Sarapan sangat ramah dan besar. Salah satu tempat terbaik untuk menonton pertunjukan tari Bali. Staf indah.,5
128, Arma Museum & Resort,"Mencintai tempat ini. Pertama waktu di sana dan itu greated. Handuk dingin dan minuman menyegarkan ketika kami tiba. Kami upgrade ke ruang yang lebih unggul, mengejutkan baik. Taman-taman yang indah, sangat tradisional bergaya Bali. Kamar yang luas, ramah dan membantu staf. Museum seni adalah pasti karya berjalan melalui juga. Sarapan adalah ok, dan makanan lain agak mahal. Satu-satunya hal yang aku rindu tidak memiliki teh dan kopi membuat fasilitas di ruang. Pasti akan ada lagi. Hanya besar merasa ada.",5
129, Arma Museum & Resort,"Kami menginap di Arma adalah yang terbaik yang kita alami selama waktu kita di Bali! Disambut dengan minuman selamat datang sebagai kami check in, kami mengikuti staf melalui kebun dan atas sungai untuk kita sendiri villa yang kami telah diupgrade ke. Ini adalah hanya salah satu dari banyak ""baik-baik saja sentuhan yang"" yang membuat kami tinggal begitu mudah diingat! Staf benar-benar pergi keluar dari jalan mereka untuk membuat kita tetap yang terbaik yang bisa, termasuk salam kami dengan nama.Kamar kami adalah besar, efisien ber-AC, dengan tempat tidur ukuran Raja sangat nyaman. Teras menawari kami pemandangan sawah, dan meja dan nyamuk jaring hari tempat tidur untuk bersantai dan membaca.   Sarapan disajikan di udara terbuka restoran. Ada banyak pilihan, termasuk hidangan…",5
130, Arma Museum & Resort,"Kami memesan 1 standar kamar dan 1 kamar deluxe melalui asiarooms.com - jauh lebih murah daripada harga dan instan pemesanan hotel website. Deluxe room adalah luar biasa - besar kamar dan mandi adalah tentang ukuran yang sama. Kamar mandi adalah terutama batu dan telah sangat besar mandi, shower etc yang terpisah. Baik aircon, tempat tidur nyaman yang besar dan tempat duduk yang baik di luar. Ruangan standar itu sangat baik tetapi jauh lebih kecil. Masih bagus aircon dan tempat tidur nyaman yang besar. Ruang lantai atas dan kamar mandi yang sedikit aneh seperti yang Anda harus berjalan ke balkon pribadi dan turun beberapa langkah batu. Itu baik-baik saja tapi tempat dekat sebagai mengesankan seperti mewah dan air panas hanya hangat tidak panas. Balkon besar sangat bagus dan…",4
131, Arma Museum & Resort,Kami tinggal selama seminggu di sebuah villa di ARMA. Ini adalah tempat yang indah - baik taman dan Villa yang sangat baik. Staf adalah besar dan bermanfaat. Semuanya bekerja baik bagi kami. Lokasi yang baik di Bali jika Anda tidak terlalu khusus tentang pantai. Kami pergi ke pantai beberapa kali selama perjalanan hari kami. Itu cukup baik bagi kita. Tetapi berada di Ubud memberi Anda gambaran yang berbeda Bali daripada menjadi di Kuta.  Resor ini memiliki museum itu sendiri. Memperhatikan lanskap. Itu sendiri adalah sebuah museum.  Kami mengambil pagi jam Golden tur dengan Augung Rai - pemilik resor. Kami menikmati karena kami mampu untuk melihat ke dalam Bali dari perspektif yang berbeda. Untuk itu pagi-pagi. Sangat dianjurkan. Seandainya aku punya kesempatan untuk pergi pada…,5
132, Arma Museum & Resort,"Kami tinggal itu sangat santai - nilai yang besar untuk uang dan nyaman. Ada banyak staf yang hadir dan semua pasien, sangat membantu dan mahir.   Alasan subur, besar yang kadang-kadang merasa seolah-olah mereka kita sendiri kebun pribadi. Juga rasanya seolah-olah seharusnya ada lebih banyak tamu per staf. Bagus untuk duduk di tepi kolam renang untuk teman minum teh saat membaca (tapi tidak ada banyak tamu lain di sekitar - yang tidak apa-apa jika Anda lebih suka seperti itu) dan sarapan sederhana tetapi sangat lezat. Tidak bisa mencoba kafe atau restoran tapi Ubud memiliki terlalu banyak tempat yang bagus untuk makan (baik rekomendasi oleh hotel driver - coba Cafe Wayan atau yaitu Pundi yaitu Pundi) museum adalah kejutan yang menyenangkan - keren, luas dan mencakup sebagian…",4
133, Arma Museum & Resort,"Kami memesan kamar standar di ARMA (melalui Asia kamar) tetapi beruntung ditingkatkan ke ruang unggul pada saat kedatangan. Setelah minuman dingin dan handuk dingin di check-in kami menunjukkan ke kamar: besar, bergaya dan modern dengan teras yang menghadap ke kolam renang, taman dan beras PADI luar.   Staf telah ramah, ramah dan efisien.  Hotel ini benar-benar koleksi Villa yang ditetapkan dalam besar, dewasa kebun tropis yang benar-benar indah. Set di dasar adalah galeri ARMA (gratis untuk tamu), kafe dan restoran Thailand. Di malam hari ada sangat baik Bali-pertunjukan musik dan tari yang (diskon untuk tamu).  Hotel ini hanya berjalan-jalan pendek dari pusat Ubud's tetapi hotel menyediakan pesawat ulang-alik yang akan juga menjemput Anda dari mana saja di kota, jika Anda…",5
134, Arma Museum & Resort,"Saya dan pacar saya tinggal di resor ini sangat baik selama 1 minggu kami tinggal di Bali. Ya kita tahu Ubud daerah akan memiliki matahari yang diharapkan, tetapi akomodasi di sini adalah begitu napas mengambil bahwa kita tidak melihat cuaca. Untuk nilai yang besar, kami punya pintu tertutup yang mengagumkan kamar pribadi, menjatuhkan rahang kamar. Villa telah gazebo sendiri untuk sarapan, kolam renang pribadi, besar dan lembut tempat tidur lembut, 2 orang bak mandi, dan 2 kamar mandi (1 dekat bak mandi dan lain sebelah kolam ikan di kamar Anda! Staf di sini adalah sangat informatif, cepat untuk memenuhi kebutuhan dan permintaan, dan hanya memberikan kesan bahwa kita akan kehilangan ketika kami meninggalkan. Anda tidak akan menyesal tinggal di sini, kami pasti berencana untuk…",5
135, Arma Museum & Resort,"Tinggal di Ubud selama tiga hari bulan ini di Arma. Itu fantastis - alasan, setengah-hotel, setengah-museum, cantik. Jembatan, air terjun, sungai, patung-patung, koi kolam - itu indah. Aku tinggal di dalam ruangan harga terendah ($ 60/malam), dan sementara ruangan itu sendiri tidak banyak untuk melihat, itu bersih, dan kamar mandi adalah besar dan juga bersih. Tetapi bagian terbaik adalah teras - di luar setiap kamar ada teras besar yang terlihat di atas dasar sekejap sculptured. Teras rapi, dengan sarapan tabel, kursi dan sofa empuk untuk membaca buku. Teman saya dan saya melewatkan perjalanan ke kota untuk hanya menikmati ruang. Untuk harga yang lebih tinggi, Anda bisa mendapatkan banyak kamar yang lebih bagus atau bahkan villa pribadi dengan kolam renang pribadi dan…",5
136, Arma Museum & Resort,"Kita menghabiskan 3 bulan di Ubud, Bali setiap tahun, biasanya Oktober sampai Desember. Pada tahun 2007, kami memilih ARMA sebagai hotel kami untuk tahun 2008. Anda dapat mengetahui banyak tentang tempat ketika Anda berada di sana untuk jangka panjang. ARMA sangat baik dalam hal semua (kecuali makanan di restoran bisa lebih menarik). Dengan alasan yang indah, akses ke ""nyata"" Bali budaya dan staf yang ramah membuat ARMA khusus. Suite kami adalah lapang, sangat bersih, mewah dan nilai yang baik. Pemilik lokal adalah terutama ramah dan membantu. Kami sangat bangga untuk menganggap mereka ""teman"" sekarang. Ada kitty sangat ramah yang menggantung di sekitar meja resepsionis. Kitty ditambahkan ke kegembiraan kami tinggal. Jika Anda pergi, hewan peliharaan kucing dan mengambil tur…",5
