,hotel,review,stars
43, Arma Museum & Resort,ada AR dapat memuaskan di bumi ini yang tidak seperti ini tapi ini adalah layanan yang luar biasa  makanan semua dari seniman yang wow kami daging banyak cara menunjukkan ada karya seni di sana memiliki kelas seni dan seni Tay tharapy dengan dengan seniman yang luar biasa kami memiliki waktu terbaik terima kasih kepada semua sana,5
44, Arma Museum & Resort,"Agen perjalanan kami merekomendasikan hotel ini dan itu sangat mengagumkan. Kamar kami adalah salah satu dari tiga besar dengan beranda yang menghadap ke kolam renang yang sederhana. Ruangan itu indah dan memiliki kamar mandi yang besar. Tempatnya indah, terawat dengan baik dan dipikirkan dengan baik. Ada jembatan, kuil, teater terbuka, sawah, tanaman tropis, anggrek, katak, patung. Layak berjalan-jalan! Ada juga museum seni. Kami menyukainya! Kami satu-satunya masalah datang ketika kami meninggalkan. Kami tidak ingin!",5
45, Arma Museum & Resort,"Suami saya dan saya tidak akan mempertimbangkan tinggal di tempat lain sementara di Bali.  Kamar indah, yang dirancang dengan gaya Bali otentik (mempertimbangkan Royal di salah satu villa ini karena harga yang sangat wajar) dan museum seni terbaik di pulau di sini! Selain itu, pertunjukan tari terbaik dan budaya peluang yang tersedia. Staf sangat menyenangkan dan bertujuan untuk menyenangkan para tamu. Perusahaan kendaraan yang selalu di tangan untuk membawa kami ke kota. Apa lagi yang bisa meminta untuk wisata?",5
46, Arma Museum & Resort,"Semua orang mengatakan bahwa Anda harus menghabiskan beberapa waktu di Ubud saat di Bali.   Memang, kota ini jauh dari pantai dan orang gila.   Arma adalah unik dalam bahwa ini adalah gagasan dari pak Agung Rai yang terkemuka dan pedagang pengumpul seni dan Arma adalah dongeng yang Eksotis di Taman yang berbatasan dengan persawahan dengan sungai yang mengalir melalui itu sendiri.   Berjalan di sekitar taman yang indah dan ada pemandangan di setiap arah.   Ini benar-benar Oasis dan layak untuk pergi ke Ubud.   Kamarnya di atas memadai tetapi suasana luar adalah alasan utama untuk tinggal di sana.",5
47, Arma Museum & Resort,"Tinggal di sana dengan istri dan anak-anak, kamar bersih, makanan dan anggur yang sangat luar biasa dengan beragam pilihan minuman anggur merah dan anggur putih untuk pecinta seperti saya. Staf juga ramah, knowledgable, dan khusus terima kasih kepada Mr Nyoman ditu Wilsner di penjualan dan pemasaran untuk mengatur sebuah liburan yang indah untuk keluarga saya dan i. akan merekomendasikan 5/5, meskipun lobi terlihat sedikit kotor ",4
48, Arma Museum & Resort,"Tempatnya indah dan museum sangat menarik. Masing-masing vila yang indah dengan itu sendiri dibuat setiap laguna dan air mancur. Rasanya seperti yang kompleks dengan sendiri gerbang dan tumbuhan hijau yang subur. Vila-vila ber-AC di kamar tidur dan mengubah daerah. Kamar mandi, bak mandi dan toilet yang sebagian keluar dari pintu sehingga tidak ada udara. Ada serangga dan menjatuhkan di sekitar toilet. Teman-teman saya Villa sangat berjamur saya tidak bisa berjalan masuk ke villa tanpa tersedak. Ini adalah jamur yang serius.  Ketika kami check in kami masih tidak tahu apa yang dia lakukan.  Kami sarapan di luar itu adalah masalah dengan semut jadi kami makan di dalam setelah makan di luar.  Mereka menawarkan layanan antar dan jemput gratis di posting kali untuk pergi ke pusat…",3
49, Arma Museum & Resort,"Saya hanya menginap 3 malam di resort di salah satu villa mereka. Cek Di itu bermasalah karena resepsionis masih.  Jalan ke villa yang dipenuhi dengan bahan bangunan, sehingga tidak membuat kesan pertama yang baik.  Lokasinya yang indah tapi di perbatasan Jalur yaitu batu dan semen yang bersih-bersih. Banyak lumut yang tumbuh di atas permukaan.  Vila yang sangat bersih namun, ada masalah serangga yang sunset dinner. Kamar mandi luar menciptakan banyak serangga. Juga, dayung penggemar akan menjadi plus nyata dengan tidak ada AC di area kamar mandi.  Outlet listrik perlu memperbarui untuk pengisian perangkat.  Tempat makan tidak memiliki dayung penggemar. Karena mereka tidak memiliki AC anda menjadi cukup panas sambil makan. Ada juga, masalah serangga yang.  Makanan yang baik.…",3
50, Arma Museum & Resort,"Dari saat Anda berjalan melalui pintu gerbang yang menjulang dan berlumut, anda tahu Arma adalah tempat yang akan persis apa yang Anda butuhkan. Karena Anda membuat jalan Anda melalui indah taman yang tertata rapi, lengkap dengan info tanda di pohon, Anda akan mulai untuk bercengkrama dengan alam kuno dan bersantai. Hal berikutnya yang akan menyerang Anda adalah karya seni yang indah yang seluruh lantai. Ceria yang membentuk akhlak penjaga patung hewan sepanjang jalan, dengan staf yang menempatkan bunga segar di belakang telinga mereka setiap pagi.   Kami menginap di Vila superior. Tempat ini sangat menakjubkan. Kolam renang pribadi yang indah dan bisa makan di luar ruangan. Yang terbaik adalah kolam ikan besar di kamar mandi. Anda melangkah batu di kolam luar ruangan untuk…",5
51, Arma Museum & Resort,. Sangat direkomendasikan sebagai otentik dan unik pengalaman Bali yang sebenarnya. Ulasan di atas bahkan majalah. Mereka mendapatkan 100% dari uang untuk villa terbaik. Namun kamar yang disediakan di bawah standar. Restraunt adalah di sisi jalan tol. Tidak ada yang damai. Bangun untuk suara moped skuter dan truk. Sampah yang mengapung di sungai. Kolam renang yang air. Banyak proyek pembangunan yang tidak menyenangkan dan tak sedap dipandang. Layanan mengerikan dan perhotelan. Mengancam staf ketika Anda menyebutkan sesuatu yang salah. Palsu dan tidak melakukan dengan baik. 17 jam terbang dan mengemudi adalah 3 jam dari bandara. Segala sesuatu tentang hotel ini berbau kurangnya pemeliharaan. AC tidak bekerja. Dikelilingi oleh sawah dan cuaca sangat tidak profesional dan tidak…,2
52, Arma Museum & Resort,"Arma Resort adalah indah, damai Surga di Ubud. Hijau, indah patung, sembahyang dan pemberian suara menenangkan air yang luar biasa. Yang terbaik adalah jika Anda tertarik pada seni, melangkah ke Museum Arma kapan saja (gratis untuk penduduk) dan mengambil waktu Anda mengagumi karya seni. Setelah Anda berada di sana Anda menyadari betapa banyak cinta dan gairah telah dituangkan ke dalam proyek ini. Para pendiri Mr Agung rai adalah orang yang berpengetahuan luas. Dia adalah tangan di dan kami bertemu dengan Dia setiap hari merawat tanaman, merawat untuk hal atau hanya bersantai di luar museum. Itu adalah pleaure untuk berbicara dengan Dia dan mendengarkan Dia wawasan tentang agama dan budaya Bali. Kami punya waktu yang indah. Sarapan lezat adalah lapisan gula pada kue!",5
53, Arma Museum & Resort,Arma Museum dan resor ini memiliki tanah yang luas yang sangat indah dengan ukiran batu yang fantastis dan kolam renang yang bagus. Ini juga memiliki sangat baik layanan kamar dan staf yang indah dan layanan bus antar jemput dan tempat tidur yang nyaman. Saya diminta dan diberikan pemandangan sungai dari kamar Deluxe dan itu sangat santai. Saya suka karena bisa menghabiskan waktu di museum. Itu bagus untuk melihat anak-anak berlatih gamelan dan orang-orang yang melukis di sore hari.   Saya memesan untuk menginap di Arma karena pada kunjungan sebelumnya ke Ubud saya telah ke acara tari yang indah di sana dan menyukai lokasi. Saya pikir itu akan menjadi indah untuk hanya bersantai dan dapat berjalan di sekitar lingkungan dan pergi untuk melihat tarian di malam hari tanpa harus…,4
54, Arma Museum & Resort,Menyukai gaya Bali seni. Banyak karya yang bagus. Alasan yang indah. Sedikit mahal untuk 80 k rupiah di Bali. Termasuk teh atau kopi di Cafe. Jangan pergi mencari tempat untuk mengalahkan panas karena tidak ada AC.,5
55, Arma Museum & Resort,Tempat peristirahatan yang luar biasa lebih dari 7 hektar. Merasa nyata tradisional Bali di pusat Ubud. Museum ini adalah perjalanan melalui sejarah seni Bali & Ubud bekerja dengan luar biasa. Anda harus hati-hati cenderung menikmati sarapan yang menghadap ke sawah. Sangat direkomendasikan. Pastikan untuk bergabung dengan tur jam emas - itu layak bangun untuk 6 pagi untuk situs yang akan mengagetkan anda.,5
56, Arma Museum & Resort,"Ini adalah tempat yang besar, baik properti - taman yang indah, arsitektur tradisional, patung, kolam renang, kolam ikan, dan sawah. Sangat menyenangkan untuk berjalan di sekitar, dan sangat damai dan tenang. Staf sangat ramah dan membantu. Kami jarang melihat tamu di luar dari sarapan, yang a la carte, tapi prasmanan yang tak terbatas. Tempat ini sangat nyaman untuk memiliki tiket masuk gratis ke museum, kami melihat sedikit demi sedikit lebih dari beberapa hari. Restoran di properti yang sangat bagus, dan itu adalah berjalan kaki untuk banyak restoran dan toko-toko. Mereka memiliki angkutan gratis ke mana saja di kota jika anda tidak merasa seperti berjalan. Satu hal yang kami sangat kecewa dengan adalah program budaya di bali yang ditawarkan melalui museum. Terlalu mahal,…",4
57, Arma Museum & Resort,"Kami hanya menghabiskan 3 hari di suite villa. Bagus, namun hanya untuk 2 orang ini villa adalah terlalu besar. Mudah 5 orang bisa tidur di sana! Sarapan adalah sangat baik, staf sangat ramah dan membantu. Ada tidak ada tv!Restoran thailand tidak begitu baik, tetapi di sisi lain dari jalan adalah restoran: Urbana. Anda akan menyukai tempat ini!",4
58, Arma Museum & Resort,Apa yang indah tempat yang tenang Kami tinggal di villa pribadi dengan kolam renang pribadi. Kami tidak pernah harus meninggalkan Mereka tidak memiliki tv yang tidak masalah bagi kami tapi tempat tidur ganda 2 singel bergabung jadi lupa menyendok! - tidak begitu nyaman pada hari pernikahan anda  Itu hanya alasan untuk 4 bintang.  Selain itu saya akan tinggal di sini lagi di jantung berdetak Ps di luar adalah brilian berdarah ,4
59, Arma Museum & Resort,"Tinggal di salah satu villa selama seminggu dan benar-benar menikmatinya. Hanya luar biasa. Layanan di restoran, spa dan tur wth agung rai, hanya luar biasa. Villa ini memberi anda perasaan pribadi dari hidup di bali. Di dalam ruang ini sekitar arma adalah seperti kecil di bali, dengan patung, sungai, museum, teater terbuka.  Akan selalu datang kembali ke arma.",5
60, Arma Museum & Resort,"Salah satu hotel terbaik yang pernah saya tinggal di. Saya dan istri saya pergi pada bulan madu kami dan memesan di untuk satu malam, tinggal selama seminggu. Kamarnya luar biasa luas dan dihiasi dengan indah. Rasanya lebih seperti sebuah kuil dari hotel dan staf sangat membantu, memiliki sikap yang luar biasa dan suasana di sana sangat menggembirakan. Ini adalah layak mengambil beberapa waktu untuk menjelajahi taman, museum dan thai restoran yang menyajikan makanan berkualitas tinggi pada harga yang sangat wajar. Kolam renang indah dan dengan beberapa kamar di area yang luas seperti itu, tidak pernah ramai. Arma adalah dekat dengan pusat kota ubud, dan memberikan sopir tur ke sebagian besar atraksi di pusat kota bali. Sebuah permata yang nyata, terima kasih untuk semua staf…",5
61, Arma Museum & Resort,Kami menghabiskan akhir pekan yang panjang di ubud dan menginap di arma museum dan resort. Ini adalah hotel yang fantastis dengan harga yang sangat terjangkau di ubud dengan kemampuan untuk berjalan ke kota di jalan utama dan tentu saja monkey forest. Kami menyukai tempat ini.  Staf semua menawan. Tidak ada yang terlalu banyak kesulitan. Restoran thailand yang fantastis yang duduk di meja di bali yang kami merasa seperti bangsawan.  Taman yang luar biasa. Hanya yang terbaik.  Dua galeri gambar menarik dan mengambil satu jam atau jadi.  Ada pertunjukan tarian bali yang biasa juga.  Kenapa murah? Kamarnya tidak diberi karpet dengan ubin dan mungkin sederhana dengan tidak ada tv (saya tidak melewatkan itu) dan wifi hanya bekerja sekali-sekali. Tapi siapa yang peduli!  Tempat yang…,5
62, Arma Museum & Resort,"Kami menghabiskan beberapa jam di sini termasuk thai yang lezat makan siang. Kami mencintai taman yang tenang, dan fitur air dan melihat dua bagian seni. Benar-benar layak dikunjungi. Ubud adalah tempat yang sangat sibuk, tapi setelah di dalam ini tempat yang tenang sulit untuk percaya anda saat jauh dari jalan yang sibuk.",5
63, Arma Museum & Resort,"Ini adalah tempat yang indah dan cukup istimewa dengan karya seni, serta seni tradisional dan modern, yang tersebar beberapa bangunan. Buku kecil yang anda dapatkan di pintu masuk sejumlah historie dan adalah tambahan yang bagus. Anda dapat berjalan-jalan melalui taman yang sangat bagus, melihat di bungalow yang mahal (itu juga sebuah resor) dan memiliki gratis kopi atau teh sambil menghadap ricepaddy ini. Hanya hal yang mengganggu adalah bahwa tepat di awal salah satu museumemployees tidak akan meninggalkan anda sendirian mencoba untuk menjual anda tur pribadi di luar ubud. ",3
64, Arma Museum & Resort,"Menghubungi arma resort paradise adalah meremehkan. Kami kagum dari awal. Kami tinggal di pertengahan juli 2016.  Jika anda mencari tenang, swasta, dan zen surga untuk tujuan wisata anda berikutnya. Saya akan sangat merekomendasikan arma! Villa kami tinggal di adalah hanya cantik mbak iin, kami merasa seperti kami tinggal di istana cocok untuk keluarga! Hotel ini memiliki kolam renang pribadi, gazebo pribadi, kamar yang luas, sangat bersih dan eksotis. Vila ini memiliki indah semi terbuka-ac dengan kamar mandi dengan pancuran dan bak mandi yang besar, dua yang disediakan bak mandi yang menenangkan pada akhir hari. Hotel kolam renang sangat mempesona, sempurna untuk berenang untuk berolahraga atau hanya menggantung di sekitar untuk menikmati sekitarnya. Arma ini dikelilingi oleh…",5
65, Arma Museum & Resort,"Sanggar lukis pencarian google untuk membawa kami untuk menemukan permata ini dari sebuah resor yang luar biasa! Terletak di dekat jl. Hanoman dan pusat ubud yang anda memiliki akses ke semua objek wisata yang ubud tawarkan dan kemudian beberapa. Terletak di subur hijau dikelilingi oleh sawah dan suasana dengan anggrek di taman bali, ini ideal bagi pengalaman bali! Meditasi di suara gemericik sungai adalah konstan dan segera menenangkan. Kamar yang luas dan nyaman. Perlu diketahui ada tidak ada tv di kamar dan wifi-nya agak tersendat. Wifi tersedia namun dekat di sisi kolam renang dan area umum. Tamu mendapat akses gratis ke resor arma museum dan 10% off f&b outlet di dan semua kegiatan di museum. Arma thai restoran merupakan salah satu restoran tercantik yang kami temui dan…",5
66, Arma Museum & Resort,"Saya telah tinggal di sini seluruh liburan jika saya bisa melakukannya. Tempat ini memiliki faktor wow. Vila yang indah di lanskap yang dikelilingi oleh lembah, sungai, sawah, anggrek yang tumbuh di pohon, seni patung, dll. Saya pasti akan merekomendasikan vila dengan kolam, perbedaan harga mobil perbedaan dalam nilai yang tidak bisa dipercaya!",5
67, Arma Museum & Resort,Saya telah di arma resort di april 2016. Hotel ini sangat besar tapi luar biasa. Staf di penerimaan adalah selalu ramah dan sangat membantu. Kamar sangat nyaman dan bersih. Area kolam adalah benar-benar indah. Restoran thailand juga sangat baik. Saya sangat merekomendasikan hotel ini!,5
68, Arma Museum & Resort,"Aku datang untuk sebuah acara musik yang luar biasa, tempat yang indah, dan saya akhirnya tinggal 3 hari. Bali adalah seperti itu. Ini adalah salah satu tempat di mana anda semangat meraih. Ini adalah tempat yang benar-benar penuh seni, bunga, dengan senyuman dan cinta. Aku bisa tinggal selamanya.",5
69, Arma Museum & Resort,"Kami menyukai tempat ini! Hal ini tidak 5 - bintang, tapi itu bagian dari pesona (kamar mandi sedikit berlari ke bawah dan handuk disediakan adalah abu-abu bukan putih!).  Dibangun di tengah-tengah museum ini sangat damai di sini dan wifi gratis di sekitar kolam renang. Staf yang ramah dan sangat membantu.  Def akan kembali",4
70, Arma Museum & Resort,"Kembali ke bali lagi? Ketiga kali, kedua kalinya untuk arma. Satu-satunya tempat yang aku akan tinggal di ubud, arma resort adalah permata. Komunitas ini merupakan pusat pendidikan dengan jiwa seni budaya tradisional, sementara memberikan layanan yang sangat baik dan untitled. Staf adalah benar-benar membantu dan tertarik (dan menarik). Kami tiba oleh layanan taksi pribadi armas dan disambut dengan hangat. Kamar bersih tapi tempat tidur. Mereka mengubah kamar kami segera (tempat tidur itu merek baru terutama bagi orang-orang dengan masalah kembali). Aku selalu terkesan dengan resor ini. Coba hotel ini. Juga melakukan beberapa kegiatan. Mereka juga adalah layak.",5
71, Arma Museum & Resort,"Tempat ini di ubud adalah benar-benar layak dikunjungi. Agung rai telah melakukan pekerjaan besar yang membagi ruang ini. Kebun kami yang indah, & koleksi museum ini memiliki luar biasa. Jika anda berada di sana untuk tahun baru eve anda akan mendapatkan untuk melihat benar-benar pukta musik tradisional & tarian dari yayasan Polosseni ",5
72, Arma Museum & Resort,"tempat ini layak harga, tempat ini luar biasa, segala sesuatu tentang hal itu membuat anda ingin tinggal selamanya. Staf super ramah, sebuah museum, berbagai pilihan restoran, kedai kopi dan area kolam renang yang mengagumkan untuk bersantai. itu benar-benar ramah keluarga dan di waktu yang sama sesuai kebutuhan untuk mencari pasangan yang sedang jatuh cinta romantis di lingkungan yang tenang :) ",4
73, Arma Museum & Resort,"Banyak dari jalan-jalan sempit yang sibuk kota ubud ke ketenangan tenang arma resort hotel adalah langkah ke esensi bali. Staf yang ramah mengantarkan kami melalui sebuah gerbang batu yang besar, dari kantor ke taman pintu kayu dengan ukiran yang rumit yang indah yang membuka ke kamar hotel. Pagi yang tenang berjalan kaki melintasi jembatan membawa lebih dari resor, dengan bunga teretai penuh kolam, air mancur dan patung-patung menarik. Sarapan pagi di teras restoran adalah pilihan dari menu dan termasuk buah-buahan segar yang paling lezat, pisang pancake, croissant, kopi dan kayu manis mengadukkan... Setelah menjelajahi terabasan melalui taman untuk pop keluar di arma cafe, di jalan utama ke kota ubud, itu membuat jalan ke kota dapat diakses dengan mudah dan nyaman. Suatu sore…",5
74, Arma Museum & Resort,"Meskipun sedikit lebih mahal daripada restoran lainnya di daerah, arma cafe adalah tempat perlindungan dari sinar matahari dan lalu lintas di tempat yang indah. Angin sepoi-sepoi yang menyenangkan dan lezat makanan membuat untuk liburan yang santai. Para staf yang penuh senyum dan sangat manis.",5
75, Arma Museum & Resort,"Arma museum berada di antara taman yang indah dan sawah. Hotel ini memiliki beberapa sangat menarik karya seni bali oleh seniman lokal dan internasional. Terdapat restoran terbaik di hotel serta kafe yang indah, menghadap ke sawah.",5
76, Arma Museum & Resort,"Aku tinggal di arma selama beberapa hari dan hotel ini adalah sempurna. Itu bukan langsung di kota utama/belanja daerah, tapi bersih yang dipimpin langsung ke jalan itu, jadi itu mudah untuk berjalan-jalan dan berbelanja. Museum ini memiliki karya seni yang indah, dan kamar kami tinggal di adalah nyaman dan bersih. Hotel itu sendiri dibangun tepat di sebelah sawah, dan suasana luar biasa. Favorit saya bagian dari hotel ini sedang uolden jam tur bersama pemilik, agung rai. Ini hal pertama di pagi hari, dan kami mengunjungi kuil (kami berada di sana sebelum wisatawan, jadi kita punya situs semua untuk diri kita sendiri) dan harus melihat desa lokal dan berjalan-jalan di daerah pedesaan. Itu fantastis. Aku akan pasti merekomendasikan hotel ini!",5
77, Arma Museum & Resort,"Kami baru saja menyelesaikan tiga hari menginap di arma resort. Saat memasuki tempat ini, satu ini dibungkus dengan budaya bali - seperti patung, tanaman, jembatan, pematang sawah, dan bangunan. Ini adalah pengalaman menyenangkan bagi seluruh keluarga. Staf adalah penuh perhatian dan kami diperlakukan seperti bangsawan. Makanan di restoran yang sangat lezat dan berkualitas prima. Kami bahkan memiliki kesempatan untuk sarapan yang disajikan di gazebo - di dalam lahan keluarga villa. Itu adalah pengalaman yang luar biasa. Kami menghargai antar-jemput gratis ke ubud dan restoran bagus rekomendasi dari staf. Tiket masuk gratis ke museum arma resort untuk semua tamu. Lokasi ini merupakan tempat yang harus dikunjungi bagi siapapun yang ingin mengalami budaya ubud dan bali.",5
78, Arma Museum & Resort,"Hotel ini merupakan perpaduan antara seni murni, alam dan ketenangan. Kami berjalan di taman dan resor, menikmati bunga dan pohon-pohon, semak-semak, banyak di pohon anggrek (masing-masing iabelled), air mancur dan air terjun batu... ahhh begitu damai. Kami tidak terkejut dengan galeri seni yang menggambarkan kebudayaan indonesia dan pemandangan - oleh artis indonesia paling, tapi banyak dari negara-negara lain yang jelas telah menghabiskan waktu di kawasan ini. Kami berharap kami telah dikenal tentang resor ini sebelumnya - kamar-kamar dan vila yang cantik dan anda tidak bisa menemukan tempat yang lebih sempurna.",5
79, Arma Museum & Resort,"Berlokasi di pusat dan terpencil pada waktu yang sama, resor ini adalah insider tip. Bali sesungguhnya orang-orang memberikan keramahan bali yang sesungguhnya dan memberi anda memperlakukan anda akan pernah fortget. Kemewahan dan kenyamanan di lingkungan yang bagus dengan harga yang sangat terjangkau. Anda akan datang kembali!",5
80, Arma Museum & Resort,"Ini adalah hotel paling khusus yang pernah saya tinggal di. Kamar kami adalah seperti sebuah museum, dengan motif kayu yang diukir indah, dari batu kamar mandi yang besar, dan teras yang menghadap ke sungai yang indah dan taman. Itu tidak murah (dan jika anda mulai menambahkan ranjang tambahan untuk anak-anak di bali, yang dapat menjadi benar-benar mahal), tapi itu begitu unik bahwa itu bernilai setiap sen. Juga, semua keuntungan dari hotel pergi menuju mendukung museum di kompleks (yang dapat anda kunjungi selama berada di sana) yang penuh dengan karya seni lokal indonesia. Rupanya pemilik wisata berkeliling eropa dan membeli kesenian indonesia dan membawa kembali ke negara ini. Hotel ini dekat dengan hutan monyet, dan meskipun tidak tepat di kota ubud, ada antar-jemput gratis…",5
81, Arma Museum & Resort,"Ubud adalah seperti indian hillstation tapi tidak keren. Museum arma resort adalah kompleks indah dan unik kamar, taman di dalam museum. dan angin laut yang lembut gelagak brroks adalah geleser Kamar-kamarnya modern dan kadang-kadang beberapa sangat tradisional. Saya tinggal di kamar tradisional dengan 4 poster yang besar dan beberapa benar-benar menakjubkan dan mereka menuju ke kamar mandi. Jika anda tinggal selama beberapa hari, itu baik untuk menginap sebentar, tetapi jika anda akan perlu peta untuk menemukan kamar anda! Bali kuno pesona adalah benar-benar bagus dan perabotan tampak tua dan perabotan yang indah. Staf adalah sangat sopan dan sarapan adalah lezat arma cafe.",4
82, Arma Museum & Resort,Aku tidak pernah tinggal di sebuah hotel seperti ini sebelumnya. Direkomendasikan oleh seorang teman dekat saya. Ini benar-benar adalah sebuah museum dengan hotel dalam jarak. Kami tinggal di sebuah villa yang memiliki kolam renang pribadi. Buah segar dan bunga dikirim ke kamar kami setiap hari. Museum ini sangat menarik. Hampir setiap malam ada pertunjukan budaya. Staf adalah bermanfaat dan penuh perhatian. Termasuk dalam kunjungan kami dengan jam pijat. Apa menginap,4
83, Arma Museum & Resort,"Dari saat anda tiba anda tahu tempat ini adalah sesuatu yang khusus dan berbeda. Kamarnya luas dan nyaman dengan khulki bergaya lama lagi, tapi tempat ini adalah hiburan. Tempat ini adalah tempat yang sangat rindang, hijau dan tenang, itu adalah kesenangan untuk berjalan-jalan dan menikmati semuanya dan, ketika anda ingin melakukan itu, anda dapat menjelajahi museum di sebelahnya! Layanan ini luar biasa dan makanan di restoran yang luar biasa - tidak ada sarapan prasmanan di sini, itu penuh, layanan bagus! Lokasi adalah di tepi ubud tapi itu tidak masalah untuk berjalan-jalan ke pusat kota, dan mereka juga memiliki antar-jemput reguler, walaupun aku tidak pernah diperlukan untuk menggunakannya.",5
84, Arma Museum & Resort,"Jauh dari kebisingan hiruk pikuk kota ubud untuk kedamaian di tempat ini. Tidak keberatan dengan karya seni seperti pemilik serikat kompleks ini adalah semua karya seni, baik itu dicatkan atau alam yang terhubung bersama-sama. Tidak mengharapkan pengalaman spiritual tapi pasti punya satu. Wajib dikunjungi jika anda ingin melihat lukisan bali yang juga memberi sebuah wawasan tentang kehidupan bali tradisional dan dianggap sebagai. ",5
85, Arma Museum & Resort,Menghabiskan 4 malam di berkesan arma resort adalah salah satu highlights dari kehidupan dewasa saya. Segala sesuatu menakjubkan dari staf untuk makanan dan persediaan udara. Kami sangat baik tampak setelah dan merasa benar-benar santai sepanjang waktu. Sangat merekomendasikan.,5
86, Arma Museum & Resort,"4 teman-teman dan saya tinggal di sini selama 5 malam. Kami telah menginap di sini untuk beberapa 20 + tahun dengan hotel setelah dua nama kali ini lebih dari perubahan.  Sebagai selalu dijemput di bandara oleh sopir ramah arma dan disambut dengan tangan terbuka oleh staf penerimaan pada kedatangan kami di ubud.  Kebanyakan staf di sini adalah dan selalu ingat nama kami. Salah satu highlights kami setiap kunjungan adalah bertemu dengan membuat yang terlihat setelah kain di resor. Membuat telah bekerja di sini sejak kami kunjungi.   Sanggraloka ini memiliki berbagai tingkat akomodasi yang sesuai dengan semua tamu, namun kami selalu meminta kamar standar di kolam renang yang telah direnovasi selama bertahun-tahun. Satu hal yang besar tentang arma adalah tidak ada tv, hanya yang…",5
