,hotel,review,stars
114, Inang Ubud Villa,"Benar-benar menakjubkan tempat untuk tinggal, dengan pelayanan dan perhatian terhadap detail. Staf sangat terlatih, ramah, dan penuh perhatian. Meskipun 10 menit dengan berkendara dari pusat kota ubud di antara desa, pemandangan villa setibanya membuat semuanya berharga.  Kamarnya super bersih, nyaman dan bersahaja. Anda akan benar-benar menikmati kolam renang yang bagus di dekat hotel dan benar-benar menyenangkan dari awal di pagi hari. Kamar-kamarnya memiliki pemandangan laut seperti itu di luar, anda akan kehilangan fakta bahwa ada tidak ada tv di dalam!  Wi-fi cepat, sarapan sangat lezat, jika minuman, itu seperti surga!  Manajer, putu menyambut kami dengan hangat setelah kedatangan kami dan sangat membantu dalam membuat kami merasa di rumah. Dia bahkan membantu kami…",5
115, Inang Ubud Villa,"Tempat ini merek baru, dibuka hanya beberapa bulan yang lalu. Orang-orang di sana sangat ramah dan berkomitmen untuk memberikan kualitas terbaik. Di mana mereka berhasil.  Ketika aku sampai di sana saya pikir saya datang ke surga. Tempat ini adalah tempat yang sangat indah dan menawan. Hotel ini terletak 15 menit berkendara dari pusat ubud, tetapi mereka akan membawa anda ke sana kapan saja anda inginkan dan menjemput kami. Sarapan lezat dan jadi adalah makan siang dan makan malam. Sangat direkomendasikan untuk makan setidaknya sekali di rumah!  Kamar-kamar dalam hal apapun. Untuk sarapan di tepi kolam renang yang indah. Kamar hotel ini memiliki ac tetapi tidak membutuhkannya. Aku terus jendela dan pintu terbuka di malam hari dan tidak ada yang panas. Air panas, kamar mandi yang…",5
116, Inang Ubud Villa,"Seperti ulasan lainnya, kami menginap di dewi begitu sempurna!  Tepat di sebelah sawah, kunang-kunang-kunang-kunang di malam hari mereka, uber bersih kolam renang, luas dan kamar bersih super, sangat sangat ramah staf, layanan antar-jemput gratis dua cara bolak-balik pusat ubud, sarapan benar-benar baik, udara sejuk segar... Pertama-tama, dewi (villa di biaya) sangat efisien dalam menjawab email yang sudah kesan yang sangat bagus untuk saya. Timnya adalah sangat terlatih dan selalu menyambut kami dengan senyum hangat. Komunikasi adalah tidak ada masalah.  Semua kamar yang tersedia pada dewi villa sangat luas dan baru, mereka terbuka 4 bulan yang lalu. Setiap malam aku selalu terkejut oleh kreativitas staf menyedekapkan andukku tentang hewan di tempat tidur kami super manis.…",5
117, Inang Ubud Villa,"kami menginap di villa adalah lebih dari luar biasa! Jadi di tempat antara rumah dan kolam renang indah! Pernah bertemu seperti baik dan ramah tuan rumah sebelumnya! Aku benar-benar merekomendasikan tempat ini!  kami punya banyak membantu setiap kali kita membutuhkan sesuatu, misalnya taxiservice, informasi dan mereka bahkan melayani makanan lezat! ",5
118, Inang Ubud Villa,"Villa ini terletak berdampingan dengan sawah besar yang menawarkan pemandangan indah. Meskipun agak jauh dari pasar ubud dibandingkan dengan vila lain, berkendara adalah layak dikunjungi! arsitektur dirancang sangat baik, sarapan yang baik, staf yang ramah dan bersih! Tempat-tempat yang bagus & saya akan merekomendasikan di ubud, bali.",5
119, Inang Ubud Villa,"BENAR-BENAR. Itu adalah cinta pada situs pertama. Saya memasuki villa indah ini di luar dunia liburan singkat tinggal... dan menemukan surga. Staf menyapa saya dengan minuman selamat datang dan buah organik dijus membasahkuyupi... Kemudian, kejutan yang pijat kaki gratis. Dan kesenangan tidak tidur di tempat tidur saya harapkan dengan yang terbaik yang pernah saya temui. Pilihan untuk sarapan di pagi hari di lobi di udara terbuka. Aku bertanya jika aku bisa tanpa perlawanan untuk jahe teh dan makan di sini. Dalam saat-saat keduanya berbeda dari kebun organik mereka! Mereka dapat diandalkan wi-fi adalah lebih daripada yang lain, kamarnya sangat luas dan sejuk dan cahaya. Ini adalah kadang-kadang masalah di bali... tapi di sini mudah untuk membaca di malam hari dan waktu.…",5
120, Inang Ubud Villa,"Tempat yang sempurna untuk tinggal dan menikmati kedamaian dan harmoni. Dengan kolam renang, pijat, staf yang ramah, gratis parkir, wifi, makanan dan sebagian besar dari semua terjangkau. sangat romantis tempat dengan pemandangan yang indah, sempurna untuk bersantai di malam hari di tepi kolam renang. Hanya sempurna",5
121, Inang Ubud Villa,"itu adalah pengalaman yang luar biasa. Kami disambut dengan baik dari pemilik, kami punya pijat kaki gratis dan minuman dingin eksotis. Keesokan harinya pagi-pagi pemilik membawa kami trekking untuk 1.5h di sawah dan sekitarnya, yang sangat mengagumkan. Pengalaman terbaik kami Howerver pada makan malam. Mereka mengorganisasi bbq di tepi kolam bagi kita. Ini sangat luar biasa. Pada malam terakhir mereka juga memperlakukan kami dengan hidangan khas bali. The bebek betutu adalah salah satu hidangan kami mencoba bebek. Secara keseluruhan, ini adalah pengalaman menginap yang tidak terlupakan.",5
