,hotel,review,stars
0, Inang Ubud Villa,"Suami saya dan saya memiliki pengalaman menginap yang menyenangkan di Ingang Villa Ubud. Saya tidak ingin menganggap semua orang mendapat peningkatan, tetapi kami menerima peningkatan kamar gratis. Kami juga menikmati sarapan dan pijat gratis selama 30 menit. Saya akan merekomendasikan villa ini kepada semua orang.",5
1, Inang Ubud Villa,"Lokasi sempurna jauh dari banjir turis di pusat kota Ubud. Staf luar biasa, penuh perhatian dan selalu tersenyum. Hotel ini adalah permata di tengah-tengah lingkungan yang indah. Meskipun agak jauh dari pusat kota, mereka menawarkan antar-jemput gratis dan bahkan memberi Anda telepon untuk dijemput. Perhatian kecil yang indah seperti menyiapkan tempat tidur Anda di malam hari, camilan sore dan teh, dll. Sarapan, dan dalam hal ini, semua makanan yang disajikan di restoran sangat baik. Jika Anda tidak ingin keluar, Anda bisa makan enak di properti. Kolam renang sangat bersih dan sekitarnya terawat. Jika Anda membutuhkannya, mereka dapat menjemput Anda di bandara dengan biaya yang sangat masuk akal (hindari taksi bandara dengan segala cara!). Mereka menawarkan tur pribadi juga.  P.…",5
2, Inang Ubud Villa,"Kami menyukai kami menginap di Inang Villa! Kami tinggal di suite keluarga yang sangat luas dan sangat nyaman yang memiliki pemandangan sawah dan kolam renang - surga. Mencintai para manajer dan staf - sangat ramah dan tidak ada terlalu banyak masalah, suasana keluarga yang nyata. Benar-benar menghargai sentuhan pribadi - teh di tepi kolam renang setiap sore, handuk yang dibuat menjadi binatang gila, pijat gratis, telepon seluler untuk meminta penjemputan dari Ubud dll. Anak-anak akan memberi makan ikan setiap pagi yang menyenangkan atau mereka dan di sana juga dua kelinci melompat-lompat untuk dilihat anak-anak. Memuja jalan sawah ke Ubud yang dimulai lima menit. Makanannya enak dan ada beberapa restoran enak di dekatnya. Semua itu adalah surga nyata dari tempat di luar pusat…",5
3, Inang Ubud Villa,"Kami tinggal di Inang Villa selama empat malam tetapi bisa tinggal lebih lama. Pemilik Putu dan istrinya Kadek dan staf sangat ramah dan membantu. Vila ini terletak di sebuah desa, sekitar 15 menit dari Ubud dengan antar-jemput gratis dari vila. Anda akan diberi telepon kecil untuk menelepon mereka jika Anda ingin dijemput. Kamarnya bersih dan menyenangkan. Kolam itu tidak sebesar itu, tapi itu sudah cukup. Sarapan termasuk disajikan di luar di taman dan ada beberapa pilihan yang dapat Anda buat. Pada malam hari sangat hening dan seseorang bangun mendengar ayam jantan dan burung. Kami berharap kami akan kembali suatu hari nanti.",5
4, Inang Ubud Villa,"Kami (keluarga dewasa 4) baru saja selesai tinggal 5 hari, dan sangat sedih untuk pergi! Ini adalah tempat yang indah untuk bersantai di samping sawah di desa; kami sangat senang bisa keluar dari kegilaan dan kebisingan di pusat Ubud. Setelah seharian seharian berbelanja dan jalan-jalan, bersantai di tepi kolam renang dengan es teh atau bir sore hari dan gorengan pisang TERBAIK menjadi sangat santai. Sarapan lengkap yang dibuat untuk memesan lezat dan mereka melayani makan malam jika Anda suka. Villa milik keluarga ini berada di luar Ubud, tetapi mereka selalu memiliki SUV yang siap mengantar Anda ke kota dan menjemput Anda, menelepon dengan ponsel yang mereka sediakan untuk kami menginap. Kami juga memiliki pemilik memberi kami tur pribadi di sekitar untuk semua pemandangan…",5
5, Inang Ubud Villa,"Apa yang bisa kukatakan. . . Kami sebelumnya tinggal di Koi Room selama 3 malam kemudian pergi untuk menginap di sebuah resort di Kuta selama 2 hari dan kemudian memesan 3 malam terakhir kami di Jimbaran / Nusa Dua. Saya dan istri saya tidak bisa menghilangkan kesan pertama yang tersisa bersama kami dari Kadek, Putu dan mereka yang luar biasa (Situs web yang disembunyikan oleh Airbnb) kami kembali. . . . kali ini pemesanan ke Kamar Lotus yang lebih besar. The Lotus Room berada di tingkat utama dan di sudut bawah villa di sebelah sawah. WOW! ! ! ! ! Pandangan Anda adalah sawah indah yang di malam hari kami beruntung menyaksikan kunang-kunang anggun terbang di antara tanaman padi. Ruangan itu sendiri sangat besar dengan dia dan tempat duduknya, kulkas ukuran normal, dapur, kamar…",5
6, Inang Ubud Villa,"Saya suka hotel ini! Dijalankan oleh keluarga yang pergi di atas dan di luar untuk membuat Anda tetap luar biasa. Itu terletak tepat di sebelah sawah, Anda dapat melakukan berjalan kaki singkat atau mereka akan mendorong Anda 5 menit di jalan untuk berjalan-jalan bagus ke kota - sangat dianjurkan! Kamar-kamarnya bagus dan dihiasi dengan bunga-bunga segar setiap hari. Ada shuttle yang akan membawa Anda ke kota, kue dan teh yang disediakan di sore hari, sarapan yang luar biasa! Semuanya disajikan dengan detail dan staf semua sangat membantu dan ramah. Salah satu tempat terbaik yang pernah saya tinggali!",5
7, Inang Ubud Villa,"Segera setelah kami memutuskan untuk pergi ke Ubud, menginap di Inang adalah prioritas utama. Ini adalah kedua kalinya kami menginap di sini, dan saya tidak sabar untuk kembali lagi. Tempat ini benar-benar tempat yang indah yang dijalankan oleh orang-orang yang hebat. Kadek dan Putu membuat anda merasa seperti keluarga di villa. Mereka Vila ini terletak sekitar 15 menit di luar Ubud di Tagalalang wilayah tersebut. Kamar kami didukung pada ke negara tetangga paddie nasi. Driver adalah di punggung anda untuk berkendara ke dalam dan menjemput anda dari Ubud ketika anda ingin. Makanannya enak dan perhatian pada detail yang sempurna. Hal terbaik bagi kami adalah cara kami dibuat merasa oleh tuan rumah yang luar biasa ini. Tidak banyak kali atau tempat di mana anda benar-benar dibuat…",5
8, Inang Ubud Villa,"Pelayanan yang sangat baik. Kamar dibersihkan 2 atau 3 kali sehari. Pijat gratis, antar jemput gratis ke pusat Ubud. Lokasi yang sempurna untuk keluar dari pusat keramaian Ubud.  Pemiliknya membantu kami dengan mengatur kegiatan dan berjalan tur.",5
9, Inang Ubud Villa,"Menginap dengan istri dan anak-anak ( 7 tahun dan 2 tahun) selama 4 hari di suite 2 kamar keluarga dan itu sangat baik . Sangat besar, disajikan dengan baik, dengan banyak ruang kamar dan wifi yang bagus. Kolam renang dan sekelilingnya juga sangat bagus adalah area dimana sarapan disajikan. Pelayanannya sangat bagus dan pada - antar jemput ke Ubud srevice permintaan (sekitar 10 menit berkendara) dan sekelilingnya sangat berguna dan nyaman. Kadek dan Putu sangat ramah dan murah hati semesta alam dan saya akan merekomendasikan kepada semua orang. Vila Inang",5
10, Inang Ubud Villa,"Saya dan pacar saya memiliki 8 hari dan 7 malam kami menginap di Villa, Inang dan tidak ada yang luar biasa. Tuan rumah, Kadek dan Putu, serta staf mereka, semuanya sangat baik, perhatian, dan perhatian. Ia benar-benar merasa seperti kami menginap dengan keluarga. Mereka bahkan membuat saya terkejut dengan bunga-bunga dan kue untuk ulang tahun saya! Vila itu sendiri terletak di luar Ubud, sedikit (gratis) Naik shuttle, terletak di tengah sawah dan tanaman hijau yang subur. Vila yang disediakan sebuah ponsel untuk antar jemput, payung mudah permintaan, dan cuaca hujan, teh sore gratis dan lezat lainnya memperlakukan. Kamar yang sejuk dan terang, seprai yang sangat rapi, dan handuk hewan selain itu senang dan gembira dengan dekorasi kamar yang simpel dan bersih. Villa lantainya…",5
11, Inang Ubud Villa,"Inang vila ini menakjubkan. Ini adalah tempat yang harus menginap ketika mengunjungi Ubud. Kadek dan Putu adalah tuan rumah yang sangat baik dan staf yang sama-sama menakjubkan. Mereka pergi di atas dan di luar untuk membantu saya dan memastikan saya mendapatkan penginapan yang hebat. Ada terlalu banyak tambahan untuk menyebutkan dan mudah adalah tempat terbaik saya tinggal 2 bulan bepergian. Hotel ini sedikit di luar kota, jadi ini adalah tempat yang bagus dan tenang untuk mendapatkan tidur malam yang baik dan pemandangan indah. Berjalan ke kota ini tidak ideal tapi layanan antar-jemput yang mereka tawarkan adalah sempurna dan selalu tersedia ( 10 - 15 menit perjalanan). Kolam renang dan tamannya indah. Vila Semuanya bersih setiap hari dan makanannya enak. Saya menginap selama…",5
12, Inang Ubud Villa,"Permata tersembunyi yang indah, 13 menit naik sepeda motor dari jantung Ubud. Harga yang bagus. Staf yang luar biasa. Bangun dikelilingi oleh sawah dan ayam jago bernyanyi. Benar-benar luar biasa Ya, ini adalah bersantai. Tempat yang bagus untuk pasangan atau satu orang mencari tempat bersantai. Cukup dekat dengan kehidupan malam tapi tidak di tengah-tengah.",5
13, Inang Ubud Villa,"Ini adalah pertama kalinya kami di Bali, dan saya senang kami memutuskan untuk menghabiskan sebagian besar waktu di Villa Ubud Inang. Kamarnya besar dan nyaman dengan WiFi yang layak dan penyejuk udara, sarapan yang lezat, dan kolam renang yang sangat bagus. Tempat ini tidak tepat di tengah-tengah pusat kota, dan itu adalah nilai tambah bagi kami. Mereka akan mengantarkan anda secara gratis ke tengah kota kapanpun anda ingin, atau ke restoran terdekat.  Kami sangat beruntung memiliki perjalanan satu hari dengan pemiliknya, yang menyorot ke Ubud, untuk perjalanan kami yakin. Sangat direkomendasikan. Berbicara tentang pemiliknya, mereka berdua tidak bisa lebih baik dan membantu. Benar-benar merasa seperti itu; tinggal bersama teman-teman. Saya sedih meninggalkan di sana dan…",5
14, Inang Ubud Villa,"Saya dan istri hanya menyimpulkan 2 . 5 bulan perjalanan sepanjang Asia Tenggara. Kami menginap di Villa untuk Inang hampir seminggu dan itu adalah 1 hal yang menarik dari seluruh perjalanan. Setelah tiba, kami berdua benar-benar terkesima dengan cara yang indah, kamar yang bagus, dll yang untuk jumlah yang kami bayar. Nilai yang luar biasa. Pasangan yang menjalankan resor ini benar-benar luar biasa. Jadi baik dan murah hati. Kami merasa seperti keluarga sepanjang waktu. Resor ini adalah 7 menit berkendara atau jadi dari pusat Ubud yang sejujurnya ini cukup padat meskipun semua pesonanya. Mereka menyediakan shuttle gratis ke dan dari kota sehingga mendapatkan ke dalam tindakan yang tidak menjadi masalah. Kami menginap di kota untuk 2 hari sebelum dan itu benar-benar luar biasa…",5
15, Inang Ubud Villa,"Saya membaca banyak ulasan dan memutuskan untuk memberikan tempat ini mencoba karena itu adalah kunjungan pertama kami ke pulau. Dengan sedikit reservasi saya sebelum saya tiba, tidak hanya saya tidak kecewa; Saya sangat senang dan kagum dengan seluruh pengalaman saya. Saya tidak dapat berhenti memikirkan inang untuk sisa perjalanan. Ada tidak ada perbandingan. Sejauh ini adalah tempat terbaik yang saya pernah menginap, tidak hanya di Ubud atau Bali, tetapi banyak tahun perjalanan pengalaman.   Saya menawarkan + untuk tempat dan untuk teman-teman saya - Kadek & Putu (pemilik), orang yang menjalankan villa dengan seluruh hati. Ini adalah benar-benar tempat yang indah untuk menginap di Ubud. Saya merasa sangat beruntung untuk menemukan tempat ini. Mereka membuat kami merasa…",5
16, Inang Ubud Villa,"Ulasan di setiap lingkaran inang yang benar. Kedek dan Putu dan staf yang hangat, ramah, penuh perhatian tanpa mengganggu. Kami butuh istirahat, dan inang yang menjadi tempat peristirahatan kami 8 hari.  Kami belajar, kita bisa tidak memilih tempat yang lebih baik untuk tinggal.  Terima kasih.",5
17, Inang Ubud Villa,"Kadek adalah tuan rumah yang luar biasa. Meskipun pemilik tidak memiliki latar belakang di hospitality, mereka menjalankan hotel dengan perhatian yang tulus untuk tamu mereka dan itu menunjukkan dalam rincian yang kecil. Kamar sangat bersih, sarapan sangat baik, dan staf yang sangat ramah dan membantu. Saya di sana sebagai Solo wisatawan setelah perjalanan bisnis ke Bali, dan sedikit khawatir pada awalnya untuk tinggal sedikit lebih jauh dari pusat Ubud pada perjalanan pertama saya ke Bali, namun saya kadek merasa di rumah sangat cepat dan memberi kami banyak rekomendasi di mana untuk makan/pergi. Fleksibel jadwal bus antar jemput juga besar plus (dibandingkan dengan hotel lainnya di sekitar di mana Anda harus tetap untuk tetap jadwal bus antar jemput setiap hari). Terima kasih…",5
18, Inang Ubud Villa,Menghabiskan 2 malam di sini dengan pacar saya dan ini adalah tempat yang sangat santai untuk menjadi. Hanya apa yang kami butuhkan. Staf sangat ramah dan hangat. Itu adalah keluarga yang menjalankan bisnis dan Anda merasa bahwa Anda berada di sana. Benar-benar mencoba untuk membuat Anda merasa di rumah.  Kamar yang indah. Area kolam adalah indah dan berada di tengah sawah. Sarapan yang baik dan hari kedua kami mendapat sesuatu buatan sendiri sebagai tambahan. Dan layanan antar-jemput sangat baik. ini adalah berjalan kaki ke pusat Ubud S. Mereka memiliki layanan di mana mereka membawa Anda ke sana dan menjemput Anda ketika pernah anda suka. Anda mendapatkan e telepon sehingga Anda dapat menelepon mereka. Saya bekerja untuk kami dan kami berarti bahwa kita tidak harus…,5
19, Inang Ubud Villa,"Saya jarang menulis ulasan, hanya jika tempat yang layak. Saya bepergian dengan teman Italia yang lain, kami memiliki pengalaman menginap yang menakjubkan di sini! Pelayanannya bagus, stafnya sangat baik dan terbuka untuk menampung semua permintaan Anda. Mereka benar-benar memanjakan kami, mereka memberi kami minuman gratis dan permen di sore hari dan mereka bahkan meninggalkan kotak dengan cokelat di tempat tidur. Aku merasa seperti Princess. Sarapan yang lezat dan kamar yang di depan kolam renang yang indah. Aku tidak akan pergi di tempat lain, tempat ini adalah yang terbaik.",5
20, Inang Ubud Villa,"Saya dan suami saya tinggal di Villa Ubud inang dari 1 - 4 juli tahun ini. Kami sedikit khawatir ketika kami memesan tempat ini, tapi ternyata luar biasa!    1) akomodasi: Kami diberi inang Lily yang sangat luas, dengan kamar mandi yang juga luas yang memiliki bak mandi serta mandi. Setiap kamar memiliki balkon kecil yang menghadap ke kolam renang di luar atau di satu sisi. Tempat yang sangat baik terus, kamar yang dibersihkan setiap hari, tempat tidur dibuat setiap hari, dengan tirai kelambu kanopi gaya. Itu memiliki kulkas kecil serta alat pembuat teh/kopi.    2) lokasi: Sekitar 5 - 8 menit berkendara skuter ke jalan utama di Ubud. Dengan peta offline, Anda tidak bisa kehilangan Anda. Mereka menawarkan antar jemput dari Istana Ubud dari 9 pagi sampai jam 10 malam. Anda perlu…",5
21, Inang Ubud Villa,"Terima kasih banyak untuk semuanya Kaded. Kami memiliki waktu yang hebat di Villa di Ubud. Semua orang termasuk anda staf luar biasa dan hangat untuk merasa baik untuk tinggal di inang. Selalu siap untuk membantu.   Properti ini juga terawat dengan baik dan indah dihiasi. Bangun dengan pemandangan sawah di satu sisi dan pemandangan desa lainnya. Malam hari sangat tenang dan tenang, merasa begitu santai.   Pijat adalah lapisan es di atas.   Saya masih ingin kembali ke tempat ini dan selalu tetap hidup dalam pikiran kami ketika kami pikir dari Bali. Saya pasti akan merekomendasikan vila ini ke semua teman-teman saya inang yang bepergian ke Bali.",5
22, Inang Ubud Villa,"Pengalaman menginap yang fantastis.  Kamar - 10/10. Sangat bersih dan nyaman. Baik AC dan mandi terbaik yang saya telah di Bali. Kamar yang dibersihkan dan tempat tidur dibuat setiap hari dan terus.  Fasilitas - 10/10. Bagus, tempat yang tenang dengan kolam renang yang besar dan tempat tidur berjemur untuk bersantai. Anda juga dapat menikmati pijat di Situs Web terlalu - meskipun sedikit mahal  Makanan - 8/10. Menu kecil dan semua makanan yang dimasak segar untuk memesan. Sarapan cukup dan memuaskan dan ayam paprika adalah favorit pribadi saya yang utama. Nasi goreng juga baik. Buah segar yang cukup meskipun tidak matang yang agak mengecewakan.  Lokasi Strategis - 8/10. Sekitar 4/5 km di luar pusat kota Ubud tetapi mereka menawarkan layanan antar-jemput gratis yang sangat bagus.…",5
23, Inang Ubud Villa,"Saya menginap di sini bersama dengan istri saya dan kami sangat menyukai tempat ini sangat banyak. Ubud dapat cukup sibuk dan inang yang menawarkan suasana yang sangat santai dan menyenangkan. Staf sangat ramah, kamar indah, dan sarapan adalah yang terbaik yang kami memiliki selama perjalanan kami. Layanan antar-jemput adalah besar.",5
24, Inang Ubud Villa,"Hai,   Ini adalah yang terbaik yang pernah saya tinggal di mana saja. Tuan rumah sangat membantu dan keras - bekerja. Dan akan membantu Anda untuk menikmati hari Anda dengan cara yang Anda inginkan atau lebih. Anda bisa mendapatkan bantuan untuk memilih paket yang terbaik untuk trekking, olah raga air, wisata dll. Kami juga bisa menyewa sepeda/mobil siap untuk harga terbaik. Mengejutkan kami memiliki pijat kaki gratis, sarapan besar, gratis Cokelat dll dan banyak waktu yang tak terlupakan.  Terima kasih untuk waktu yang indah dan Kadek.",5
25, Inang Ubud Villa,"Aku bisa menulis panjang tentang betapa indah Villa Ubud inang tetapi memiliki semua pengulas sebelumnya telah mengatakan itu!  Ini benar-benar adalah tempat paling menakjubkan yang kami telah tinggal di 3 bulan perjalanan kami sejauh ini. Kadek, Putu dan semua staf yang begitu luar biasa membantu dan ramah. Mereka benar-benar membuat kami tinggal di Ubud yang luar biasa. Jika anda mengunjungi daerah Ubud memperlakukan diri untuk tinggal di sini, Anda tidak akan kecewa ",5
26, Inang Ubud Villa,"Saya berharap ada cara untuk memberikan beberapa inang Villa raja peringkat hebat. Pacar saya dan saya bepergian di seluruh dunia. Tahun ini saja kami telah seluruh Karibia, Eropa, Meksiko dan sekarang sedang di Asia (hanya JUNI.). Kami tinggal di AIRBNB dan berbagai macam hotel. Inang Villa adalah yang paling luar biasa, serta nyaman/tempat yang santai, kami telah tinggal di. Terlepas dari ini, kebaikan dan keramahan yang Anda akan menerima dari Kadek, suaminya dan staf mereka yang hangat akan Putu hati Anda dan membuat Anda merasa seperti di rumah. Saya tidak dapat menjelaskan dalam kata-kata bagaimana luar biasa saya merasa tentang tempat ini atau bagaimana komitmen yang tulus untuk membuat setiap tamu seperti keluarga telah menyentuh saya.   Hanya untuk contoh. Saya memiliki…",5
27, Inang Ubud Villa,"Saya tahu apa yang Anda lakukan sekarang, jika Anda di semua jenis Hotel, membaca ulasan, cek harga, mencoba untuk menemukan tempat yang sempurna. Selamat Anda menemukan  Pekarangannya indah, suasananya sangat santai/tenang/santai, kamar rapi, staf adalah luar biasa ramah dan pergi keluar dari cara yang ada untuk membuat Anda merasa di rumah, ini adalah tanpa pertanyaan yang tinggal bintang lima (lima bintang tanpa membayar)    1. makanan. sarapan adalah termasuk dan dapat dibawa ke kamar Anda atau disajikan di teras luar ruangan yang indah untuk makan lebih mencari sawah (ini adalah sangat baik membuat kursus multi). ada juga waktu teh sore (es teh dingin w/a snack). jika anda ingin memesan makan malam itu juga sangat cukup harga yang baik (di sisi murah)    2. lokasi. 10 - 15…",5
28, Inang Ubud Villa,"Inang Villa adalah sebuah hotel yang sangat bagus!  Kami menikmati perjalanan kami :)  Putu dan Kadek adalah sangat ramah, membantu dan lucu.  Villa dikelilingi oleh sawah, ladang padi yang ada jalur ke Ubud ca 1, 5 - 2 stunden.  Makan pagi, makan malam yang sangat lezat dan afternoontee!  Kamar sangat bersih yang indah, kolam renang luar biasa!  Sangat merekomendasikan tempat ini!  Terima kasih Kadek Putu & :)",5
29, Inang Ubud Villa,"Pemilik yang sangat manis dengan hati. Kami terdampar di tengah Ubud karena perahu lain - perusahaan carter, pemilik dan mereka segera mengirim mobil untuk menjemput kami, dengan tidak ada biaya. Setelah kami berada di sana, semua orang sangat baik dan ramah. Ia juga bersikeras bahwa putri kami menggunakan Dia sepeda motor untuk berkeliling (lebih baik daripada menyewa tempat lain daya kuda). Kami menyukai tinggal di sana dan beruntung untuk bertemu orang-orang hebat di Villa inang. Tinggal dengan inang yang sangat dianjurkan. Juga, tempat dingin (suhu bijaksana), bersih, dan besar. Lokasi sangat nyaman jika anda naik sepeda motor",4
30, Inang Ubud Villa,"Saya telah melakukan perjalanan secara ekstensif (48 negara) dan tinggal di semua jenis akomodasi dari resor mewah untuk backpacker hostel. Saya atas - mencari informasi tentang segala hal, dan dapat mengatakan tanpa keraguan ini adalah salah satu saya yang paling berkesan tetap, tidak ada bar.   Hotel ini terletak di lokasi yang tenang, penggembala pengaturan di antara sawah yang hanya di luar kota dengan gratis di - telepon dan layanan antar jemput ke pusat. Kolam & alasan yang fantastis, kamar yang sangat baik - lengkap. Ada juga sebuah retret Yoga 5 Menit Turun Jalan, dan Ahli Pijat tersedia di hotel.   Apa yang benar-benar memisahkan hotel ini dari inang Putu dan Kadek, yang benar-benar menyediakan di atas - dan - lebih dari 5 - bintang layanan. Mulai dari mengatur semua…",5
31, Inang Ubud Villa,"apa tempat yang indah, dan pemilik Kadek adalah sangat membantu juga. Satu-satunya downside adalah perjalanan ke sana di mana kami menemukan beberapa blok dari jalan di malam hari terutama disebabkan oleh upacara. jadi jika Anda mencari ketenangan dan staf yang sangat membantu jadi tidak perlu melihat lebih lanjut, ini adalah tempat.",4
32, Inang Ubud Villa,"Suami saya dan saya akhirnya tinggal di sini selama satu bulan dan setengah setelah mengunjungi selama beberapa hari. Tempat ini hanya menakjubkan. Pemilik Kadek dan Putu sangat ramah itu tidak merasa seperti sebuah hotel, lebih seperti rumah. Mereka membantu kami keluar begitu banyak dan membuat segala sesuatu tentang kami tinggal yang fantastis. Kami masih merindukan tempat ini.   Area hotel ini indah dan begitu juga kamar dan kolam renang. Ada tidak ada sarapan di teras yang menghadap sawah di pagi hari. Anda dapat menemukan banyak bagus Yoga Studio di daerah ini mulai dari yang murah ke yang mahal.   Ini adalah jauh dari pusat Ubud tapi mereka menawarkan layanan antar-jemput adalah 5/5 kami menemukan daerah ini. jauh lebih menarik daripada pusat juga. Ada sawah yang indah…",5
33, Inang Ubud Villa,"Pemilik Kadek dan Putu dan staf yang ramah yang pergi pada panjang untuk membuat Anda tetap menyenangkan dan mengesankan. Makanan, dan layanan antar jemput ke pusat Ubud dan pijat gratis tersedia tapi beberapa contoh keramahan yang sangat baik dan layanan mereka.   Kepribadian mereka hangat hati dan lokasi yang tenang yang telah membuat persinggahan kami tak terlupakan dan kami pasti berharap untuk waktu berikutnya!",5
34, Inang Ubud Villa,"Indah, kamar yang bersih, sarapan yang enak, pemandangan sawah padi di lingkungan yang tenang cukup jauh dari pusat Ubud untuk merasakan lingkungan desa. Kadek dan Putu yang memesona dan hangat host yang membuat kami 3 hari tinggal hanya sempurna. Taman yang indah dan kolam renang serta layanan van ke kota yang diperlukan. Sangat direkomendasikan, memang benar! Oh, apakah saya menyebutkan dua ikan koi dan kelinci hewan peliharaan?",5
35, Inang Ubud Villa,"Sangat sangat merekomendasikan tempat ini. Kadek dan Putu yang luar biasa. Indah, sangat bersih, tempat yang indah. Lokasi yang besar, taman yang indah. Layanan antar jemput gratis ke kota. Makanan yang lezat, kolam renang yang indah.  Dan kelinci! Menginap yang luar biasa.",5
36, Inang Ubud Villa,"Hotel ini adalah yang termurah yang kami memesan di Bali, sesuai harapan kami. Yang berubah. Jika Anda ingin melihat lebih lokal di Bali, ini adalah tempat. Sedikit Pearl 10 menit berkendara dari pusat Ubud (antar-jemput gratis setiap hari). Staf yang indah, kamar bersih dan luas, sarapan lezat, dan makanan yang sangat lezat dan murah! Aku cinta yang kecil dan intim hotel di mana kita harus tahu staf dan tamu lain yang sedikit lebih baik. Pemandangan sawah yang indah. Kami punya sangat bagus ranjang bayi untuk bayi kami karena wellm. Akan senang untuk tinggal di sini lagi.",5
37, Inang Ubud Villa,"Kami tinggal di sini selama 3 malam, setiap hari mereka membersihkan kamar kami di ujung atas kondisi. Pemilik Putu super ramah dan Kadek. Mereka akan menjawab semua pertanyaan anda dan keraguan. Saat saya mengalami demam, mereka bahkan membantu untuk mendapatkan beberapa kelapa dari desa terdekat, sangat terima kasih untuk itu. Kami pasti akan kembali jika kita kembali ke Ubud satu hari.",5
38, Inang Ubud Villa,"Villa adalah inang yang sesungguhnya. Dari area hotel yang terpelihara dengan baik dan indah untuk staf yang ramah dan penuh perhatian.  Saya menikmati setiap menit saya tinggal di sana. Dimulai dengan sarapan (pilihan kecil tapi lezat), bersantai di sekitar kolam renang, gratis teh di sore hari.  Staf adalah sangat membantu dalam mengatur perjalanan wisata atau memberikan tips tentang apa yang harus dilakukan atau ke mana harus pergi di Ubud. Layanan antar jemput gratis yang bekerja sangat baik, meskipun hotel adalah tentang 15 menit berkendara di luar dari Ubud itu tidak ada masalah sama sekali mendapatkan sana dan kembali setiap saat sepanjang hari.  Terima kasih banyak untuk membuat tinggal kenangan dan benar-benar menyenangkan!",5
39, Inang Ubud Villa,"Kami memilih villa ini didasarkan pada ulasan di TripAdvisor ini menerima. Saya pikir itu rata-rata 4.8. Saya tidak dapat membayangkan bagaimana mereka menurunkan 0.2 ini adalah tangan bawah yang terbaik yang kami tinggal sementara di Bali. Sopir kami memiliki waktu sulit menemukan itu tapi kami kemudian menemukan bahwa menggunakan Google Maps akan membuatnya mudah, itu adalah sekitar sepuluh menit dari kota di bukit yang menghadap ke sawah. Lokasi dan pemandangan yang kami tahu bahwa prasangka diremajakan Bali adalah surga tropis yang sedikit letih setelah tinggal di akomodasi kurang di tempat lain. Kamarnya sangat bersih, dilengkapi dengan baik dan sangat cukup murah. Makanan lezat dan lagi harga masuk akal. sejauh ini pasti di atas 5/5. anda akan mendapatkan minuman selamat…",5
