,hotel,review,stars
77, Inang Ubud Villa,"Ini adalah permata yang tersembunyi di antara sawah dan dekat dengan pusat kota ubud meskipun sangat tenang dan santai. Anda merasa diterima di sini - keluarga adalah inang yang sangat baik dan membantu dengan segala sesuatu. Mereka mengatur seorang supir untuk pusat dan kembali, membuat anda sarapan yang lezat atau makanan ringan di sore hari dan jika anda beruntung anda bahkan bisa mendapatkan pijat kaki gratis dan luar biasa. Properti ini baru dan memiliki banyak charme - ini adalah bali asli. Suasana yang sangat santai dan memiliki suasana yang baik. Kami benar-benar menyukainya dan ingin kembali lagi! Kamar tidur juga sangat luas dengan kasur yang bagus dan semuanya sempurna bersih. Juga kolam renang yang bagus! Ini adalah salah satu destinasi favorit di bali!",5
78, Inang Ubud Villa,"Kami memesan villa untuk 4 malam awalnya inang, tetapi memutuskan untuk memperpanjang untuk malam lebih lanjut setelah kami telah tiba, kami sangat senang dengan itu. Akomodasi adalah disajikan dengan indah, dengan bunga-bunga segar, dan fitur yang indah.  Koneksi wifi yang sangat baik.  A/c di kamar yang kuat dan kelambu disediakan.  Kadek dan staf yang sangat ramah dan selalu senang untuk membantu.   Sarapan adalah lezat dan berlimpah. Minuman selamat datang pada saat kedatangan dan minum teh sore oleh kolam renang adalah sentuhan tambahan yang indah. Kadek bahkan tampak setelah saya ketika saya sakit (tidak dari inang villa), yang menawarkan saya teh herbal, sup dan obat dan membawa saya ke klinik.  Antar-jemput gratis ke ubud sangat berguna - anda dapat pergi kapan saja anda…",5
79, Inang Ubud Villa,"Inang villa adalah sebuah permata! Kadek tidak bisa menjadi lebih cantik rumah dan villa indah. Kamar terang dan lapang, kolam renang dan alasan yang indah, dan suasana adalah bahwa dari ""rumah yang jauh dari rumah ."" Menyewa salah satu sepeda dan menjelajahi sawah sawah...",5
80, Inang Ubud Villa,"Aku tinggal di sini selama 4 malam dengan saya putra berusia 9 tahun dan kami berdua menyukainya, staf sangat membantu, ramah dan menyambut. Kamarnya nyaman, dan bersih. Lokasi sangat tenang dan santai, tempat yang bagus untuk bersantai di luar dari ubud sibuk, tapi ada layanan shuttle gratis ke ubud sehingga kami bisa pergi ke kota setiap kali kami ingin. Kolam renang indah dan sarapan yang baik juga. Jika aku pernah kembali ke ubud saya pasti akan menginap di sini dan akan merekomendasikan tempat ini kepada teman-teman. Jika anda memesan langsung dengan villa anda akan mendapatkan kesepakatan yang lebih baik daripada agen pemesanan dan ini juga membantu para pemilik jika pemesanan langsung melalui hotel. Terima kasih inang villa ",5
81, Inang Ubud Villa,"Kami menghabiskan 3 malam di villa ubud inang dan menikmati diri kita sendiri. Villa dan lahannya sangat bersih dan kolam renang sangat indah! Hotel ini terletak 5 km dari pusat kota ubud, tetapi hotel menawarkan transportasi gratis ke dan dari atas sampai 10pm. Staf yang sangat berpengetahuan tentang situs, dan biaya masuk dan waktu terbaik untuk melakukan perjalanan wisata. Kami memiliki penerbangan larut malam dari ubud dan mereka memungkinkan kami banyak kemudian check out yang sangat membantu. Ada sebuah restoran di situs dan masuk akal. ",5
82, Inang Ubud Villa,"Kadek, Puttu dan ceria staf untuk menginap di guest house ini dan nyaman di luar ubud 15 menit. Para tamu juga berada dan kenikmatan yang terpenting dan kami minta maaf untuk meninggalkan. Ada pemandangan indah di atas kolam renang dan sawah dari guest house, jalan ke sawah dan dekat dengan restoran lokal dan dengan sekolah memasak. Sarapan dan teh di sore hari juga selalu baik dan sederhana hidangan nasi atau mie dapat dipesan. Antar-jemput selalu tersedia ketika kami membutuhkan itu. Kami menikmati ubud dengan lebih dari yang kami harapkan dapat meninggalkan dan kembali ke jalan yang sibuk ubud villa inang untuk mengisi ulang.",5
83, Inang Ubud Villa,"Kami memiliki waktu yang hebat di ubud villa inang. Kami tinggal di salah satu sisi kamar family suite. Itu sangat besar, nyaman dan bersih.  Inang untuk sebuah vila yang terletak agak jauh dari pusat ubud yang sangat tenang dan pemandangan indah di seluruh sawah. Sopir vila untuk gratis yang membawa anda ke pusat ubud sampai 22:00 Kami mendapat telepon seluler di rumah ketika kami ingin kembali ke villa kami bisa berkendara dan dia akan menjemput kami. Layanan yang sangat baik.  Staf sangat ramah dan villa inang yang mengatur kami untuk bergabung dengan tur lintas alam. Setelah kami mendaki clothers kami kotor jadi kami digunakan binatu menyajikan harga yang sangat murah.  ",5
84, Inang Ubud Villa,"Suami saya dan saya tinggal di villa selama 10 malam dan inang kemudian lagi 5 malam ketika kita kembali ke ubud setelah mengunjungi lombok. Seperti orang lain telah mencatat, lokasi sangat dekat dengan pusat kota tapi tidak membiarkan hal itu menghalangi anda. Mudah untuk masuk ke ubud (anda dapat bahkan berjalan di sana melalui sawah) dan itu indah untuk kembali ke pengaturan yang menakjubkan yang menghadap ke ladang padi dan setelah hari yang panas di kota. Kadek dan putu yang tuan rumah yang sempurna dan tampaknya tidak ada terlalu banyak kesulitan. Sarapan yang lezat dan kami menikmati makanan juga kadang-kadang kemudian di hari ketika kita hanya ingin bersantai di hotel. Area kolam adalah indah karena kami di lantai, yang sangat cermat dipelihara oleh putu's ayah di masa…",5
85, Inang Ubud Villa,"Kami tinggal 3 malam di sini dan itu benar-benar vey sedih untuk meninggalkan... Devi puttu kepada tuan rumah dan adalah yang terbaik yang kami punya untuk seluruh perjalanan kami di bali. Lokasi yang baik, baik kolam renang, dan menjemput layanan gratis, sarapan yang baik... Apa yang anda dapatkan adalah jauh melampaui apa yang anda akan membayar. Aku tidak mengetuk tempat ini untuk yang ingin lokasi yang tenang dan jauh dari wisatawan untuk waktu yang indah. Keluarga kami akan datang kembali.",5
86, Inang Ubud Villa,"sangat romantis!  Semua tempat di daerah ini dari bali dan ini telah menjadi yang paling dari semua tempat yang romantis! sangat dekat dengan kota! sangat dekat dengan indah persawahan di arah berlawanan! Indah ramah membantu orang, di dekat desa!",5
87, Inang Ubud Villa,"Keluarga saya (dengan 2 anak-anak) tinggal di sini selama 4 malam dan kami punya waktu yang indah di sini! Interior telah membantu kita untuk mengatur banyak dari apa yang kita diperlukan untuk beberapa hari kami berada di sini, termasuk transportasi (yang kami telah digunakan cukup sedikit untuk mendapatkan kami sekitar) dan bahkan telah membantu kita untuk membuat pemesanan untuk membantu!  Kami menyukai bahwa hotel ini di luar dari pusat kota karena mengizinkan kami mengamati cara hidup di desa ini - melihat para petani bekerja di sawah padi sekitar (di mana anda juga dapat melihat kunang-kunang-kunang-kunang di malam hari!), desa perempuan mencuci pakaian mereka di sungai, yang keanekawarnaan liar dan hewan domestikasi tertua... Suasana yang bersahaja membuatnya merasa jauh…",5
88, Inang Ubud Villa,"Makan pagi setiap hari di restoran villa's pavilion, melihat keluar ke arah sawah dan desa sekitarnya rumah dan melihat laki-laki dan perempuan di tempat kerja, itu adalah pengalaman yang surealis. Entah Bagaimana. Aku merasa di rumah di lingkungan yang asing ini. Aku hanya bisa mengatakan bahwa untuk mendapatkan kehangatan tulus dan sangat baik dari hotel ini dan staf mereka, yang besar dengan tenang dan ketenangan taman, bangunan dan kolam renang.  Itu adalah kesenangan besar untuk tinggal empat malam di sini dengan pasangan saya. Kamar yang luas dan merasa agak mewah. Sarapan yang lezat. Ponsel lokal disediakan untuk dengan mudah mengatur transportasi. Shanghai new & berkualitas tinggi (dan sangat menyenangkan). Internet adalah lambat di kali, staf (meskipun pasangan saya…",5
89, Inang Ubud Villa,Ini adalah tidak sulit: tinggal di sini. Anda mendapatkan pelayanan yang baik di tempat ini dan anda akan diperlakukan seperti keluarga meminta. Hanya ada 6 kamar di seluruh villa sehingga anda pasti tidak akan tersingkir. Tempat ini merupakan contoh nyata bali: berada di antara sawah dengan negara puncak gunung berapi di latar belakang - jauh dari hiruk pikuk pusat kota ubud. Jika anda ingin merasakan kekacaua ramah dan staf kami akan memberikan anda dengan driver yang akan antar-jemput anda di dalam/luar kota. Fasilitas yang besar dan kolam renang adalah menakjubkan dan yang sangat indah. Ini adalah tempat terbaik yang aku sudah pernah tinggal di lagi. Manjakan diri anda: menginap di villa dewi. ,5
90, Inang Ubud Villa,"Kami tinggal di ubud villa adalah dewi yang surealis. Saya telah memesan tiga malam di sini dengan seorang teman melalui expedia, dan kita berakhir pengeluaran hanya satu malam, seperti yang kita tidak benar-benar bahagia dengan kamar kami dan juga ingin menjadi lebih dekat ke pusat tindakan. Saat kami mengambil koper kami dan meminta untuk diantar ke ubud di sore hari kedua, kekacauan pun terjadi. Interior, istri dari pemilik (putu), merasa sedih bahwa kami pergi lebih cepat dari yang direncanakan, setelah membayar untuk tiga malam menginap. Dia mengatakan itu tidak pernah terjadi sebelum dan tidak dapat memahami mengapa kami tidak memberitahu kami tidak senang dengan kamar kami. Titik yang adil, tapi kami tidak ingin untuk membuat masalah, dan untuk ini kami memutuskan untuk…",4
91, Inang Ubud Villa,"Kami tinggal di villa untuk 4 malam dan telah dewi pengalaman menginap yang luar biasa. Kami disambut dengan minuman dan sangat sopan dan ramah staf yang membantu kami keluar di setiap masalah. Kamarnya cantik dan benar-benar bersih super. Semua fasilitas ini sempurna dan seperti yang ditampilkan di gambar. Yang termasuk sarapan dan layanan teh adalah benar-benar bagus dan anda bahkan mendapatkan layanan antar-jemput ke pusat kota ubud. Saya dapat merekomendasikan villa ini kepada siapa pun. Hotel ini terletak di luar ubud sebingkah, yang membuat tempat yang benar-benar tenang dan suasana tenang dan jika anda ingin pergi ke pusat kota, antar jemput yang akan membawa anda di sana dalam waktu. Aku akan datang kembali setiap saat!  Terima kasih banyak untuk tinggal yang nyaman dan…",5
92, Inang Ubud Villa,"Kamar yang sangat bagus, staf yang ramah dan sedikit sentuhan yang membuat anda merasa istimewa. Setelah kekuatan dengan kamar yang bersih. Handuk yang dibuat seperti gajah. Baru dan bersih. Antar-jemput gratis ke kota. Letaknya yang berada di ketinggian pukta.",5
93, Inang Ubud Villa,"Dewi villa terletak di sawah sekitar 10 menit berkendara dari ubud. Villa ini begitu indah dan diurus dengan baik. Kamar saya telah bersih dan didekorasi dengan indah. Aku benar-benar tidak bisa mengatakan cukup tentang betapa senangnya saya dengan saya tinggal. Harus dinilai sebagai hotel bintang 5. Harga fantastis, makanan yang luar biasa, dan layanannya tanpa cela. Terima kasih kepada, putu dan stafnya! Aku suka segala sesuatu tentang vila anda. ",5
94, Inang Ubud Villa,"Ini adalah villa dengan 5 bintang tuan rumah dan staf yang luar biasa. Kami diperlakukan seperti keluarga di antara tuan rumah, putu dan kamar, dan staf.  Vila ini terletak tidak jauh dari kota, tetapi anda berada di pedesaan damai yang indah dengan sawah di sekitar anda. Tempat ini begitu santai dan mendengarkan suara alam -- benar-benar, suara jangkrik, kodok, burung-burung, kadal, dll. Villa ini adalah sempurna. Putu dan kamar tersedia untuk memastikan liburan anda adalah sempurna! Anda dapat mengakses ke ubud demi kenyamanan anda dan kembali oleh 10 pm. Tidak ada masalah berkomunikasi baik untuk anda kembali, karena anda telah menggunakan handphonean! _AOMARKBLANKAO_  Duduk-duduk di malam hari itu sangat sopan dan sopan, dan dia akan bermain musik di bali jika mobil…",5
95, Inang Ubud Villa,Saya merekomendasikan semua orang untuk tinggal di villa dewi. kota ini terletak di luar dari ubud yang bagus. itu benar-benar tenang dan santai. Namun jika anda pergi ke ubud wanne anda dapat menggunakan layanan antar-jemput gratis. Kamarnya sangat bersih. Sarapan adalah benar-benar baik dan ada sangat baik restoran dan teh di sore hari. Tapi alasan utama anda harus tinggal di sini dan tuan rumah dan staf. Mereka sangat menyenangkan dan bermanfaat dan selalu sekitar. Anda akan belajar banyak tentang orang-orang dan budaya jika anda inginkan. Saya juga merekomendasikan perjalanan sehari di villa. Aku bisa memilih apa yang saya inginkan untuk melihat dan menjawab semua pertanyaan saya putu. Ia adalah great panduan. Tinggal di sana adalah seperti pengalaman yang menyenangkan. Aku…,5
96, Inang Ubud Villa,"Luar biasa dikelola oleh sejumlah villa baru ""tim dewi"" menggiring oleh interior & sarapan yang memperlakukan anda seperti keluarga bali. Kamar luas, sejuk, benar-benar bersih. Segala sesuatu dilakukan dengan senyum untuk standar kualitas yang tinggi. Masakan rumahan yang lezat dimasak sesuai pesanan indonesia yang klasik, sarapan besar, teh sore gratis dan kue, kolam yang indah, pijat di kamar, dan ""paviliun bersantai"", ... apa adalah untuk tidak suka dengan harga ini! Sewalah Vario dari honda untuk tipe 50k per hari dan ubud yang semarak berjarak 10 menit minuman upifting melalui mengimpi iandscape. Tetapi tantric iari Omham di sesi yoga retreat, 5 menit berjalan kaki dengan 1/2 km. Hanya tinggal di sana... Tempat ini tampaknya Hujan restoran terbaik di ubud - tempat ini…",5
97, Inang Ubud Villa,"Villa indah ini terletak di atas bukit seperti sebuah kastil, dikelilingi oleh pemandangan sawah dan kehidupan desa. Interior hotel tampak setelah tamu seperti keluarga. Family suite adalah besar, teh sore yang lezat dan kolam renang adalah besar setelah hari yang panas di kota. Villa ini cukup jauh dari ubud untuk memaksimalkan anda damai dan tenang, tapi antar-jemput gratis ke kota dan kembali setiap hari membuatnya mudah untuk menghindari jika anda ingin ketenangan. Hotel ini sangat bagus. Nilai yang besar untuk uang, pasti tempat kita akan kembali ke.",5
98, Inang Ubud Villa,"Dewi ubud villa adalah tempat terbaik yang pernah saya tinggal. Interior, kipas, dan sisanya dari staf yang luar biasa-jauh menonjol melebihi hotel lainnya yang saya telah mengalami. Mereka layanan pelanggan adalah di luar pukta dan moto mereka untuk memperlakukan tamu seperti keluarga ini. Untuk menjadi begitu jauh dari rumah saya jublek dibandingkan dengan santai dan aku merasa seperti di rumah.   Hari kami memeriksa untuk pacar saya ulang tahun. Semua harus saya lakukan adalah menyebutkan itu untuk tipe dan ia langsung berkongkalikong. Kita berakhir dengan perayaan ulang tahun kejutan yang sempurna, lengkap dengan kue dan bunga, semua bisa diatur oleh interior. Semua staf menghadiri untuk merayakan, yang menghasilkan indah merasa karena dikelilingi oleh teman-teman baru, atau…",5
99, Inang Ubud Villa,"Aku tinggal di tempat yang menakjubkan ini dengan seorang teman pada musim panas di bulan januari dan datang kembali. :-)  Ini adalah seperti sebuah tempat di mana anda memiliki untuk datang kembali.  Mencari tempat yang tenang dan indah di samping sawah di ubud? Apa yang anda suka alam dan berjalan melalui sawah, bersantai di kolam renang yang tenang dan menikmati makanan dan jus segar menu bali? YA?  Saya yakin anda akan jatuh cinta pada villa ini dan seluruh staf dan jika anda datang kembali ke bali saya yakin anda akan kembali lagi menginap di villa dewi.",5
100, Inang Ubud Villa,"Jika anda mencari tempat yang tenang di pedesaan yang damai, jauh dari kebisingan dan asap dari pusat kota ubud, ini adalah tempat untuk anda. Villa adalah persis seperti yang ditampilkan di gambar yang tersedia, dan seperti apa yang banyak orang lain telah disebutkan, interior dan timnya menunjukkan kita keramahan yang luar biasa selama kami tinggal pendek di ubud. Mereka menyediakan layanan dengan cepat berkendara ke pusat kota biaya tambahan, tentang 15 menit dari villa, anda dan memberi anda sebuah ponsel untuk menghubungi mereka setelah anda selesai sehingga mereka dapat menjemput anda. Sementara untuk menginap, ini adalah benar-benar menakjubkan, tidak kepada sebagian ijtu dan menabrak kami ke ruang keluarga sebagai itu kosong dan kita adalah, yah, sebuah keluarga.…",5
101, Inang Ubud Villa,"Kami tinggal di villa Ingung untuk tiga malam dan itu luar biasa... Vila terletak di seperti 10min dari pusat ubud. Anda tidak perlu khawatir bahwa itu jauh, karena anda memiliki transportasi harian ke pusat dan sudah kembali di harga. Dan ketika anda menghabiskan sepanjang hari di ubud jalan bebas hambatan anda akan sangat bahagia, bahwa anda datang ke vila ini terletak di lokasi yang tenang baik...  Ruangan itu bersih dan sangat baik. Dipersiapkan dengan baik dengan semua yang anda butuhkan.  Interior, suaminya dan juga staf lainnya sangat ramah dan membantu. Apa pun yang anda butuhkan hanya memberitahu mereka.  Sarapan adalah benar-benar lezat dan cukup besar... Anda harus mencoba jaffels, anda akan lebih dari puas... ",5
102, Inang Ubud Villa,"Terakhir memapan tentang untuk penerbangan ke bali, kami menerima email dari pemilik villa dekat dengan ubud, kami telah dipesan untuk seminggu untuk keluarga kami, memberitahu kami bahwa mereka telah membatalkan reservasi kami karena untuk konstruksi penundaan. Untung anak kami sudah di ubud dan dijelajahi di perbukitan dekat kota di sepeda motor, sampai ia datang di permata ini dari tempat untuk tinggal. Tidak seperti beberapa vila di pulau, dan dewi ini dimiliki oleh keluarga dari bali, dan ini adalah tempat terbaik yang kita telah tinggal di bali selama perjalanan kami dua ada. Kami berbagi 2 dengan tempat tidur lantai atas, 2 kamar mandi suite dengan putri kami dan suaminya, dan putra kami telah terpisah kamar di lantai bawah yang menghadap ke kolam renang yang indah.…",5
103, Inang Ubud Villa,"Villa ini adalah tempat yang luar dewi untuk menghabiskan liburan keluarga. Kami tinggal selama seminggu dengan keluarga kami termasuk dua anak-anak dewasa, dua anak remaja dan orang tua dan memiliki seluruh properti untuk diri kita sendiri yang memungkinkan kita semua untuk memiliki beberapa ruang pribadi ketika dan jika kita merasa seperti itu, serta memiliki area umum yang besar untuk berbagi makanan dan minuman. Sarapan (termasuk) adalah sangat lezat dan hidangan lainnya tidak tersedia plombiran dan jika anda ingin makan di waktu lain untuk harga yang sangat wajar. Dan kamar saya benar-benar tidak putu dan tidak bisa telah lebih membantu dalam mengatur pagi bali menyenangkan (sepeda motor, arung jeram dll) dan kami dengan senang hati kami antar-jemput dari dan ke ubud,…",5
104, Inang Ubud Villa,"Aku bahkan tidak tahu di mana untuk memulai. Tempat ini adalah segala sesuatu yang anda inginkan dalam liburan santai di ubud. Hotel ini sangat cantik dan terpelihara dengan baik. Kolam renang adalah begitu menyegarkan dan bed cover (tidak menginap cukup sejuk meskipun panggeng memperhangat). Pemandangannya mengagumkan -- kota ini terletak tepat di depan sawah. Kamar-kamarnya bagus. Semilir, bersih, dan dilengkapi dengan perlengkapan yang bagus. Staf adalah benar-benar bagian terbaik. Aku sedang solo wisatawan, dan orang yang tidak melayani sarapan. Kadang-kadang ini muncul sebagai dingin tapi benar-benar aku hanya suka mengamati dan mengambil hal-hal dalam. Mereka semua penduduknya yang tapi masih memperlakukan saya sangat hangat dan aku merasa sangat nyaman dengan semua dari…",5
105, Inang Ubud Villa,"Ini adalah tempat yang paling menakjubkan yang pernah saya tinggal dan saya telah ke bali 5 kali.   Layanan adalah luar biasa, kami telah setiap pagi dan malam. Staf yang ramah dan membantu tapi paling tidak bisa masuk.   Kota ini terletak di antara sawah dan anda dapat merasakan pengalaman ""nyata"" sisi bali, tanpa toko dan lalu lintas dan wisatawan.  Taman yang menakjubkan dan kolam renang adalah sempurna  Makanan adalah lezat dan benar-benar baik harga ",5
106, Inang Ubud Villa,"Pacar saya dan saya tinggal di sini selama 4 malam di kamar koi. Kamar, kolam renang dan taman yang indah, baru, bersih dan perbaikan besar. Pengaturan di sawah yang subur adalah menakjubkan dan menonton matahari terbenam di hutan sambil berenang di kolam renang mereka sangat sulit untuk mengalahkan. Apa yang benar-benar membuat tempat ini khusus adalah staf. Interior, putu dan semua orang lain untuk pergi mil ekstra untuk membuat anda merasa seperti anda adalah bagian dari keluarga. Ini adalah kedua kalinya ditawarkan dengan harga terjangkau. Pijat kaki gratis yang sangat menyambut. Gratis antar-jemput ke kota membuat tempat ini menjadi favorit untuk mengunjungi semua atraksi wisata. Jika anda pergi ke ubud saya sangat, sangat menyarankan anda tinggal di sini - hotel ini jauh…",5
107, Inang Ubud Villa,"Kami memiliki yang indah menginap di villa dewi. Semuanya sempurna. Super ramah dan bagus dan bersih, bagus dan kamar bersih, baik sarapan, layanan antar-jemput gratis dll. Aku bisa sangat merekomendasikan tempat ini jadi pergi saat berada di ubud!",5
108, Inang Ubud Villa,"Aku tidak bisa kesalahan kami tinggal di villa dewi - staf pergi keluar dari jalan mereka untuk membantu kami dan membuat kami tinggal begitu nyaman. Anda mendapatkan pijat kaki gratis selama anda tinggal yang kami membuat penggunaan setelah kami mendaki gunung batur (itu adalah benar-benar hebat pijat!) antar-jemput gratis ke ubud dan dapat menjadi sedikit hal yang ditawarkan, kami digunakan setiap hari! Mereka bahkan memberikan ponsel untuk menelepon ketika anda ingin dijemput.   Mereka diatur perjalanan ke area persawahan, perkebunan kopi, dan lintas alam batur yang adalah nilai yang besar untuk uang! Sarapan adalah indah dan begitu adalah minuman selamat datang. Ini adalah tempat saya mencoba tebersih, wifi cepat dan ada dapur di setiap kamar. Kolam renang adalah indah dan…",5
109, Inang Ubud Villa,"Kami tinggal di villa dewi di september 2015. Staf dan hotel itu sendiri adalah hanya fantastis! Dewi villa adalah hanya di luar ubud. Dengan layanan antar-jemput gratis atau skuter kami membutuhkan sekitar 10 menit ke istana ubud. Kami memiliki kamar dengan pemandangan yang indah dari persawahan dan menikmati kami seluruh tinggal. Kamar hotel ini sangat baru, kamar yang luas dan kasur yang berkualitas tinggi. Staf selalu ramah dan membantu. Selain itu, ada pijat gratis. Kami dapat merekomendasikan properti ini tanpa batasan dan pasti akan datang kembali ke sini lagi dan lagi.  Putu dan kamar: Terima kasih untuk hari besar dengan anda di villa dewi!  & Matthias kebengongan",5
110, Inang Ubud Villa,"Kami telah tinggal di tempat-tempat melalui 30 dengan minuman di indonesia dan di malaysia dan vila ini yang terbaik! Kami tinggal di ruang keluarga, yang adalah seluruh lantai atas villa, dengan dua anak berusia 4 dan kami memiliki dua kamar tidur 7 ., dua kamar mandi dan ruang tamu. Hangat selamat datang, ramah dan membantu saran, layanan antar-jemput gratis ke ubud dua hari, teh sore, gratis pijat kaki, kolam renang besar dan pemandangan luar biasa di sawah sedarun membuat pengalaman menginap kami tak terlupakan! Layanan antar-jemput yang tidak berada di tempat tapi makanan miskin untuk menetapkan kapan pun anda ingin menjelajah kota yang anda inginkan di ubud. Putu dan kamar sangat ramah dan baik orang. Sarapan adalah dibuat segar setiap hari dan bagus. Mereka bahkan belajar…",5
111, Inang Ubud Villa,"Kami tinggal di villa dewi untuk 3 malam (9 - 12 september 2015). Dibutuhkan sedikit waktu untuk menemukan hotel ini, tapi di pertengahan kota jadi ada adalah beberapa indah. Dan dengan skuter hanya 10 menit berkendara dari ubud. Di hotel ini ada Bikerides santai dan menakjubkan.  Pemilik villa adalah benar-benar ramah dan kami juga mendapat tambahan footmassages. Kita membaca beberapa orang nggak jadi, meskipun kami tidak mendapatkan pengalaman itu.  Pemilik juga menjadi pembunuh dan mendapatkan jaffles, mereka adalah untuk mati untuk!  Kami tinggal di belakang hotel (yang kita harus memiliki dikenal karena harga yang berbeda). Kalau saya adalah pemilik. Aku tidak akan mempersewakan ini keluar. Itu tidak memenuhi harapan ini hingga saat anda melihat gambar dari vila ini. Dan…",4
112, Inang Ubud Villa,"Aku hanya bisa mengatakan bahwa kami tinggal di villa dewi adalah paprika merah. Orang-orang sangat ramah, layanan ini benar-benar hebat dan harga adalah lebih dari cukup baik. Lokasi ini juga sangat baik karena tempat ini bukan hanya di tengah-tengah lanskap yang indah dengan pohon palem dan sawah, namun juga dapat ditempuh dengan cara dari ubud, yang tidak memiliki banyak atraksi wisata seperti kuil dan toko-toko. Juga, makanan yang disajikan sangat segar dan didekorasi dengan indah. Aku memberikan peringkat seldomly sempurna untuk apa-apa, tapi tempat ini layak untuk itu! Hotel top! :) memiliki liburan yang indah di villa dewi; )",5
113, Inang Ubud Villa,"Kami tinggal di villa dewi di dalam kamar! Setelah melakukan perjalanan di bali kami memiliki waktu terbaik di sini di perjalanan kami. Akomodasi yang sempurna dan sangat luas. Apartemen kami adalah tepat di sebelah kolam renang dengan pemandangan yang indah ke sawah. Kami merasa sangat nyaman di kamar kami yang indah dirancang, tapi kami adalah tim personawi membungai villa dewi. Mereka sangat membantu dan melakukan segala sesuatu untuk membuat kami tinggal yang sempurna untuk satu. Saat menginap kami benar-benar tidak merasa seperti tamu tetapi lebih seperti bagian dari keluarga! Kita bisa menyewa sepeda motor atau meminta bantuan tentang ubud, kami selalu dipercaya membantu dan layanan yang berharga. Semua dalam satu, di sini membuat kami merasa seperti di rumah di bali! ",5
