,hotel,review,stars
40, Inang Ubud Villa,"Kami memiliki pengalaman yang indah di sini, dari kedua staf menjemput kami di bandara (ketika pacar saya jatuh sakit, dan staf pergi keluar dari jalan mereka untuk memastikan bahwa dia adalah diurus dengan baik, bahkan membawa kita teh jahe segar! ). Kamar yang indah, dan sarapan yang luar biasa. Antar-jemput ke dan dari pusat kota sangat nyaman. Bahkan inang ini menyediakan Anda dengan ponsel untuk memanggil mereka untuk Shuttle pick up! Tidak untuk menyebutkan anda dapat berjalan melalui sawah di sekitarnya yang indah dan dengan mudah mencapai pusat kota Jalan. Aku bisa pergi pada dan di, tapi singkatnya, inang Ubud Villa sangat jauh dan tempat terbaik yang pernah saya tinggal.",5
41, Inang Ubud Villa,"Kami tinggal di sini selama 4 hari. Ini adalah yang menyenangkan dan berkesan untuk kami. Kanan dari waktu kami check in - kami check-in - seluruh tim di luar inang Villa sangat ramah dan membantu. Mereka memiliki menu yang sangat sederhana dan sarapan yang lezat. Meskipun tempat ini agak jauh dari pusat Ubud, kami selalu dapat mengaksesnya dengan mobil jemputan dan drop yang disediakan oleh mereka. Delapan tahun anak saya memiliki waktu yang tepat di kolam renang dan bermain dengan kelinci di sana :). Lebih dari semua kami memiliki waktu yang besar",4
42, Inang Ubud Villa,"Pergi di sini ketika mengunjungi Ubud. Ini adalah permata kecil. Hanya di luar Ubud, terletak di sebuah desa kecil dan dikelilingi oleh sawah, villa kecil anda akan menemukan inang. Hanya beberapa kamar, tempat yang sangat tenang yang berarti. Di malam hari Anda bisa mendengar musik santai dari kuil lokal di dekatnya. Kamarnya bagus, area kolam renang sangat menakjubkan. Setiap sore mereka akan membawa teh gratis pada sore hari: keren minuman dengan makanan lezat buatan sendiri di Indonesia. Ada layanan antar-jemput gratis: kapan saja Anda ingin pergi di kota, mereka akan membawa anda untuk gratis (10 menit berkendara) dan mereka akan memberikan Anda sebuah ponsel untuk menelepon kemudian ketika Anda ingin dijemput. Bekerja dengan sempurna.  Tapi yang terbaik adalah staf vila…",5
43, Inang Ubud Villa,"Luar biasa.   Saya dan pacar saya Victoria benar-benar jatuh cinta dengan tempat ini. Aku bahkan akan pergi sebagai jauh untuk mengatakan ini adalah tempat terbaik yang pernah kami tinggal. Staf yang luar biasa, kamar yang menakjubkan, awesome makanan & minuman, layanan yang luar biasa, luar biasa fasilitas, pengaturan yang luar biasa. Saya pikir Anda mendapatkan titik.   Jika kita pernah mendapatkan kesempatan untuk kembali, kami akan melakukannya di tempat ini.   Terima kasih untuk pengalaman menginap yang menyenangkan untuk semua orang di Villa Ubud inang.   Jon & Victoria",5
44, Inang Ubud Villa,"Pemilik, Putu dan kedek, Des Moines di langsung dengan kehangatan dan keramahan yang cocok dengan desain taman yang indah dan keluarga ini - villa mewah yang dimiliki. Menghadap ke air, dengan kolam ikan koi, dan tumpukan penduduk, kami mampu untuk melihat matahari terbit dari teras sawah di salah satu suite yang indah, dan matahari terbenam di sisi lain. Sering kali, dapat sarapan gratis di hotel yang biasa, tetapi di sini, makanan sangat segar, baik - siap, dan lezat dengan rasa yang menggoda. Saya sangat tersentuh oleh perhatian tulus Putu mengambil untuk menjelaskan simbolisme dan pokok kepercayaan Hindu Candi yang kami kunjungi. Tidak ada detail yang kurang mereka untuk membuat kami tinggal kenangan dan menyenangkan.",5
45, Inang Ubud Villa,"Ini adalah kedua ulasan untuk inang Ubud Villa. Sentimen sama saya. Saya suka tinggal di sini, staf dan pemilik yang sangat baik, layanan ini tanpa cela. Sebuah mobil antar-jemput Anda ke Ubud setiap kali Anda silakan. Lingkungan yang indah, sangat damai dan romantis. Silakan pergi keluar untuk diri. Untuk Harga ini Anda tidak akan kecewa! ",5
46, Inang Ubud Villa,"Dari 4 - tinggal di Villa inang bagian terbaik dari liburan kami. Beberapa dari Highlights termasuk:   1. jauh dari keramaian Ubud. Tempat yang tenang di tengah sawah  2. sempurna dan penuh perhatian host yang pergi sepanjang jalan untuk membuat Anda nyaman  3. skuter tersedia untuk sewa, tersedia antar jemput gratis, jadi tidak ada masalah di kaki dari tempat wisata utama  4. dapat mengatur semua wisata dengan mereka, Anda perlu untuk membiarkan mereka tahu apa yang ingin Anda lakukan  5. kolam renang dan taman yang indah dan terawat dengan baik seluruh daerah (menambahkan beberapa foto di sini). Kami menghabiskan hampir seluruh hari hanya menikmati suasana dengan hujan gerimis.   Pada makanan, pisang pancake untuk sarapan adalah cukup baik. Kami tidak punya makan siang atau…",5
47, Inang Ubud Villa,"Teman saya dan saya tinggal di sana minggu lalu dan kami menyukainya! Hotel ini jauh dari pusat kota Ubud jadi itu sangat tenang dan santai. Hotel ini menawarkan layanan antar jemput gratis dari dan ke Ubud sepanjang hari sampai 10 PM. Sarapan sangat baik dan nasi goreng juga enak (kami hanya makan di sana). Ini adalah keluarga yang menjalankan bisnis dan mereka semua sangat profesional dan sangat baik, penerimaan adalah sangat efisien dan benar-benar baik di merekomendasikan tempat untuk melihat dan mengunjungi di daerah. Akan benar-benar merekomendasikan jika Anda tinggal di Ubud!",5
48, Inang Ubud Villa,Kami tinggal selama seminggu di Villa inang dan kami benar-benar menyukai tempat ini! Kami pikir kami akan melakukan lebih banyak aktivitas Tapi area kolam adalah luar biasa dan kami menghabiskan sebagian besar hari-hari kami dengan tempat ini. Mereka mengambil perawatan yang sempurna dari bangunan dan taman. Makanan yang sangat baik. Kami makan banyak makanan di sana dan kami telah hilang sarapan. Pancake dan waffles adalah Soo baik. Mereka juga memiliki sore snack dan minuman yang adalah hanya bonus lain. Staf yang begitu indah dan baik. Ini adalah sebuah nilai tambah karena lebih jauh keluar dari kota itu banyak lebih tenang dan pemandangan yang sangat indah. Tempat ini sangat bagus dan mereka menyediakan layanan antar jemput gratis ke dan dari kota untuk ketika Anda tidak…,5
49, Inang Ubud Villa,Kami tinggal di sini selama 3 malam dan tuan rumah sangat baik dan perhatian terhadap kebutuhan kita. Tempat ini tenang dan tenang dengan pemandangan persawahan dan kolam renang yang indah. Kami menikmati Gratis 30 Menit pijat di pilihan kami tepat di depan kolam renang. Menghargai bagaimana mereka menyiapkan sarapan di tas untuk kami malam sebelumnya sehingga kami bisa makan ketika kami bangun untuk Matahari terbit di Gunung Batur trekking tour 2 jam.   Sangat direkomendasikan!,5
50, Inang Ubud Villa,"Kita tidak bisa merekomendasikan tempat ini cukup. Jika Anda mencari tempat yang tenang di luar dari Ubud dengan pemandangan sawah, tidak perlu mencari yang lain. Putu kedek adalah tuan rumah yang menakjubkan dan membuat kami merasa sangat di rumah di vila yang indah. Kami menginap di vila keluarga yang terdiri dari dua kamar tidur besar, dua kamar mandi, ruang tamu, dapur dan balkon besar yang menghadap ke kolam renang dan sawah yang indah. Tempat itu bersih, tempat tidur yang sangat nyaman, dan semua staf yang sangat ramah dan membantu.   Sementara lokasi 15 menit di luar dari Pusat Kota mungkin terlalu jauh untuk beberapa, antar jemput gratis membuat mendapatkan masuk dan keluar dari kota dengan mudah. Kami benar-benar menikmati berada jauh dari keramaian dan hiruk pikuk dari…",5
51, Inang Ubud Villa,"Saya dan istri saya tinggal di sini pada bulan juli selama perjalanan kami ke bali dan ini adalah salah satu tempat terbaik yang pernah kami tinggali!  Vila ini dikelola oleh keluarga dan mereka membuat anda merasa di rumah dari kedua anda tiba. Villa dikelilingi oleh sawah sehingga anda selalu memiliki pemandangan yang luar biasa. Sarapan adalah besar, dan termasuk dalam tinggal.  Villa adalah sekitar 10 menit ke arah utara dari ubud, tetapi mereka menyediakan anda dengan ponsel dan anda dapat memilih setiap kali anda membutuhkannya (sebelum 10pm) jika setelah 10 juga terdapat banyak taksi.  Istri saya dan saya harus pergi lebih awal pada hari terakhir kami untuk gili meno dan mereka bahkan membuat sarapan dini bagi kita untuk mengambil dengan kami!  Satu-satunya penyesalan…",5
52, Inang Ubud Villa,"Kami benar-benar tidak bisa menyalahkan hotel ini!  Tiba untuk wajah ramah, kami diberi semua informasi yang kami diperlukan saat check in dan minuman gratis! Semua kasus kami dibawa ke kamar kami dan menawarkan gratis kembali atau pijat kaki dan teh sore setiap hari yang brilian!  Kamar: Benar-benar menakjubkan. Kami pikir kami telah tiba di surga! Terawat dengan baik dan bersih. Staf akan datang sepanjang hari untuk menyesuaikan dengan kelambu di sekitar tempat tidur dan menyapu lantai.  Sarapan: Kami memakan pancake pisang, piring buah dan pisang jaffles. Favorit saya mutlak di jaffle nya! Kami pergi lebih awal di pagi hari terakhir untuk naik perahu ke gili t, kami memberitahu manajemen dan mereka malam sebelumnya untuk kamar kami dengan bekal makan siang untuk kita untuk…",5
53, Inang Ubud Villa,"Tempat ini adalah menakjubkan, staf sangat ramah dan lokasi yang sempurna bagi saya, sedikit jauh dari pusat ubud, di jantung pedesaan dan sawah. Dengan 10 menit perjalanan dengan sepeda atau penjemputan gratis dari villa. Magic :) ",5
54, Inang Ubud Villa,Kami mencintai kami menginap di villa inang! Suasana yang sangat ramah dan kamar rapi bersih dan persis seperti yang ditampilkan di gambar-gambar secara online. Kami memiliki keluarga suite dan pemandangan sawah yang indah. Bahkan ada kunang-kunang di malam hari! Semua makanan yang kami makan di inang yang sangat baik dan villa memiliki makanan kami dibawa ke kamar anak-anak saat kami pergi keluar berjalan sangat baik. Kami merasa sangat aman dengan staf di villa kami (lebih tua) untuk meninggalkan anak-anak selama satu jam atau lebih pada satu waktu.  Lokasi adalah luar biasa. Hanya berjalan kaki singkat membawa anda ke arah desa setempat dan melihat kehidupan bali di luar lokasi turis. Putu adalah benar-benar luar biasa! Dia mengantar kami beberapa tempat dan menjawab semua…,5
55, Inang Ubud Villa,"Bagus  - vila yang indah, didekorasi dengan citarasa seni  kolam renang - luar biasa  - di antara sawah, ideal jika Anda ingin berada jauh dari keramaian pusat Ubud  pemilik/manajer - bagus, sangat membantu  Buruk  - layanan kamar adalah sebuah kehilangan - handuk tidak diganti (harus meminta), sampah tidak dikosongkan setidaknya lebih dari sekali.   - banyak serangga di sekitar (dimengerti) tapi tidak berharap laba-laba di kamar  - tidak pernah mendapatkan ' gratis' pijat kaki yang kita diminta untuk memiliki sebelum meninggalkan   Jelek  - kami memesan minuman di Villa pada hari kedua terakhir yang memberi saya dan istri saya membuat perut sakit. Untungnya anak saya tidak minum itu. Saya mengerti bahwa ini bukanlah kesalahan mereka tapi ini tidak merusak liburan saya di daerah.",3
56, Inang Ubud Villa,"Kami mengatur jemputan dari bandara yang sangat efisien. Kamar anak saya dan saya tinggal di indah tapi sudut ruangan (standar) thst teman saya tinggal di adalah kecil, gelap dan agak lembab.  Villa memiliki staf yang menyenangkan dan itu adalah urusan keluarga. Pemilik membawa kami untuk hari dengan harga yang dapat diterima di surroundung untuk mengunjungi pedesaan dan keluarganya.  Selain itu mereka disediakan (setelah hari) gratis tramsport ke kota mereka juga direkomendasikan restoran.  Sentuhan indah seperti teh sore. Kamar mandi perlu diperbaiki tapi area umum misalnya taman makan daerah dan kolam renang sangat terawat dengan baik. Jika mereka membuat beberapa perbaikan tempat ini mencapai 5 bintang wouod   ",4
57, Inang Ubud Villa,"Kami memesan tiga malam di sini. Kami memesan kamar standar, mendapat kamar.  Di desa kecil ini tidak secara langsung di ubud, butuh waktu 10-15min berkendara dengan layanan antar-jemput gratis ke pusat ubud.  Supir yang membawa anda ke sana kapan saja anda inginkan. (Anda bisa telepon dan menelepon mereka, ketika anda berada di ubud dan ingin dijemput.)  Orang yang menjalankan bisnis keluarga kecil yang melakukan segala sesuatu untuk membuat kami tinggal sempurna. Mereka adalah orang-orang yang sangat baik. Anda dapat menemui mereka di setiap waktu dan mereka akan membantu anda. Mereka adalah selalu sekitar tanpa mengganggu.   Hotel ini memiliki kolam renang yang bagus dan anda berada di tengah-tengah 'hutan', dan dapat melihat nasi teras yang indah.   Ubud adalah tempat yang…",5
58, Inang Ubud Villa,"Kami tinggal selama 3 malam di villa dengan putu dan kadek inang dan tidak bisa merekomendasikan tempat cukup bagi mereka yang ingin menjelajahi ubud, tapi memiliki tempat yang santai untuk beristirahat ketika anda menginginkan ketenangan. Ruangan itu indah dan diatur untuk kami saat kami tiba dan dibersihkan setiap hari, sarapan adalah indah dan pemandangan ke sawah yang sangat luar biasa.   Area kolam adalah indah, sangat santai dan tenang. Ada layanan shuttle gratis yang berjalan ke dan dari ubud dan antara 10am 10pm dan mereka memberi anda telepon untuk menghubungi mereka ketika anda siap untuk mengumpulkan. Seperti perhatian terhadap detail membuat untuk tinggal yang tak terlupakan. Kami memiliki pijat kaki gratis oleh kolam renang dan kadek membantu kami untuk memesan…",5
59, Inang Ubud Villa,"Dari bertemu di bandara oleh pemilik dan diberikan ke bali selama jam perjalanan panjang untuk dikendarai oleh dia ke hotel berikutnya pada akhir saya tinggal, segala sesuatu tentang kunjungan saya adalah sempurna! Villa ini indah dan sangat santai. Kamar saya adalah besar dan bersih dan menghadap ke kolam renang yang sangat menarik. Sarapan adalah lezat dan disajikan menghadap ke petani yang bekerja di sawah. Saya bisa melihat wanita banyak nasi di matahari dan putu, pemilik adalah senang untuk menjawab pertanyaan saya banyak tumbuh di sawah. Istrinya kadek menurunkan saya di sawah dan kemudian mendapatkan saya, yang saya pikir itu sangat baik. Ini adalah jauh lebih baik untuk tinggal di sini daripada di ubud, yang mana sangat sibuk pada bulan juli. Mereka juga menyediakan…",5
60, Inang Ubud Villa,"Saya dan anak saya menginap 4 malam dengan kadek dan putu villa pada inang. Apa yang bisa saya katakan? Ini sangat indah. Kadek, putu dan staf mereka adalah beberapa orang yang paling hangat kami memiliki kesenangan bertemu selama perjalanan kami. Akomodasi bergaya, bersih dan kami memiliki pribadi kita sendiri gazebo dan kolam ikan koi. Kolam renang luar biasa, makanan lezat, segala sesuatu yang baik tentang tempat ini. Ada layanan antar jemput yang akan membawa anda ke kota untuk keramaian dan hiruk pikuk dan anda akan mendapatkan nomor telepon untuk menelepon dan dijemput saat anda selesai. Semuanya mudah dan dilakukan dengan senyum. Tidak dapat merekomendasikan sangat cukup.",5
61, Inang Ubud Villa,"Wow. Aku tidak bisa merekomendasikan villa inang yang cukup. Itu adalah pengalaman yang luar biasa, tempat yang indah untuk tinggal dan keluarga yang sangat baik dan melakukan segala yang mereka mungkin bisa untuk membuat yakin bahwa anda menikmati masa tinggal anda!   Ketika kami tiba kami disambut dengan minuman dingin es dan keluarga menyediakan kami dengan semua informasi yang kami butuhkan untuk benar-benar menjelajahi ubud. Kami kemudian dibawa ke kamar yang membuka ke kolam renang kamar lily. Kami mendapat gratis upgrade ke ruangan ini dan itu indah. sangat luas dan bersih! Kolam renang dan pemandangan sekitarnya benar-benar mengambil napas pergi. Di hari kedua kami ingin menjelajahi dan membuat hotel ini sangat mudah dengan menawarkan kami tumpangan ke pusat kota setiap…",5
62, Inang Ubud Villa,"Kami tinggal telah luar biasa. Staf sangat ramah dan taman yang indah. Mereka adalah sangat penuh perhatian, dan bahkan membuat tempat tidur anda di malam hari jika anda memiliki tidur siang! Saya pasti akan merekomendasikan hal ini. Kami mencintai gratis transportasi ke dan dari kota juga. Satu-satunya negatif bagi saya adalah bahwa tempat tidur sedikit keras. ",4
63, Inang Ubud Villa,"Dari mana saya harus memulai? Itu dimulai dengan pemesanan mudah dengan inang. Mereka bahkan menawarkan saya kamar yang indah dengan ikan koi yang anda rasa ini -- kolam ikan koi yang luar biasa tepat di luar pintu. Putu dan kadek, yang hangat, indah, baik dan pasangan yang sendiri dan menjalankan bali inang yang luar biasa. Tangan ke bawah ini adalah tempat terbaik aku tinggal di selama dua minggu saya di sana. Highlights tercantum di bawah ini: - mengenal kadek di bandara kami naik kembali ke ubud Putu - mengenal dengan baik, tur informatif 1:1, berdasarkan apa yang saya inginkan untuk melihat dan melakukan di sekitar daerah. Aku ingin membenamkan di pengalaman budaya, dan dia itu.  - tenang, tenang, tenang - staf yang peduli - gratis di kamar (atau anda dapat memilih, oleh…",5
64, Inang Ubud Villa,"Wow, apa tempat yang fantastis, santai tinggal kami. Staf di sini sangat ramah dan membantu, dan selalu ingin untuk memastikan anda menikmati masa tinggal anda. Ketika kami pertama kali tiba kami diberi lezat minuman selamat datang dan camilan kecil, kemudian menunjukkan ke kamar kami yang sangat bersih dan indah! Kolam renang indah dan menyegarkan setelah hari yang panas menjelajahi. Kami diberi pijat kaki gratis yang sangat baik sikap, dan juga gratis teh sore setiap hari dengan membuat makanan yang lezat!  Itu adalah sebuah perjalanan singkat dari pusat ubud yang sangat kami sukai karena itu memungkinkan kita untuk berjalan di sekitar daerah setempat dan melihat penduduk setempat hidup untuk kehidupan sehari-hari mereka, dengan berjalan kaki di sepanjang sungai di sebelah…",5
65, Inang Ubud Villa,"Kami tinggal di empat tempat yang berbeda selama perjalanan kami ke bali dan inang yang sangat baik, dan yang paling favorit kami. Pemandangan sawah, lokasi yang sempurna untuk mengalami bali lokal. Kami menyewa skuter dan sepeda dari kadek untuk mendapatkan sekitar, tapi juga membuat penggunaan layanan antar jemput yang mereka bahagia untuk membawa anda ke ubud atau ke restoran lokal di sepanjang hari. Mereka bahkan menyediakan anda dengan ponsel sehingga anda dapat menelepon ketika anda perlu mengambil. Layanan dari seluruh tim di inang yang fantastis, teh sore adalah termasuk, kami sangat jarang kembali dalam waktu untuk ini dan menemukan itu ketika kami kembali mereka membuat segar buah karena mereka khawatir kami ketinggalan. Biaya tambahan seperti makanan, menyewa sepeda…",5
66, Inang Ubud Villa,"Hotel ini sangat istimewa! Staf sangat ramah, makanan yang luar biasa, layanan adalah yang terbaik yang kita mengalami di bali! Tempat ini akan melebihi harapan anda! Ini datang sangat direkomendasikan!",5
67, Inang Ubud Villa,"Lakukan kebaikan untuk diri anda: menginap di sini!   Dalam 5 minggu di bali ini adalah tanpa keraguan yang terbaik, paling baik dan paling istimewa di tempat kami tinggal. Sebenarnya, yang membuat bahwa salah satu tempat terbaik yang kami pernah tinggal di, di mana saja.   Kami tidak tahu di mana untuk memulai: daerah di sekitar villa di luar di ubud yang tenang dan sangat indah, villa taman yang dirancang tanpa cela dan terawat - anda dapat melihat dan merasakan cinta dan perhatian terhadap detail di setiap sudut. Kamarnya dirancang dengan indah dan sangat terawat, bersih dan segar setiap hari oleh staf sangat penuh perhatian dan sopan. Kualitas dari kamar adalah standar yang sangat tinggi tidak hanya ditemukan di tempat yang banyak kali lebih mahal. Di kolam renang ini,…",5
68, Inang Ubud Villa,"Kami menghabiskan 5 malam di inang dan menyenangkan. Semua orang sangat ramah dan membuat kami merasa di rumah dari hari.   Kamar kami adalah indah - cerah, bersih, ac yang bagus dan banyak ruang. Kami menyukai duduk di luar di teras oleh kolam renang, terutama untuk teh sore. Sarapan yang menghadap ke ladang padi.   Antar jemput gratis ke dan dari pusat yang sangat bagus, terutama dengan telepon seluler yang disediakan selama kami tinggal. Anda juga dapat dilakukan dengan jalan kaki melalui ladang padi untuk mendapatkan ke kota, atau saya pikir bahkan yang terlihat di dalam.   Tempat yang sangat damai untuk tinggal, sangat dianjurkan.",5
69, Inang Ubud Villa,"Tempat ini adalah benar-benar luar biasa dan jujur adalah yang terbaik 3 hari 2 minggu kami tinggal di bali. Mungkin karena itu bukan langsung di sebagian besar wilayah turis, staf sangat baik dan mereka melakukan segala sesuatu untuk membuat anda merasa baik. Jika kita tidak sudah memesan untuk menginap di tempat lain, kami mungkin akan bersambung di inang villa.    Semuanya bagus - minuman selamat datang, sarapan, tempat tidur, wi-fi, layanan antar-jemput gratis ke pusat ubud, kami menyewa skuter mereka...  Setelah di sana, pastikan anda mengatur pijat badan dan menikmatinya dengan kolam renang - terbaik santai pernah.  Terima kasih!",5
70, Inang Ubud Villa,"Kami memiliki fantastis tinggal di sini 4 malam dan berharap kita bisa tinggal lebih lama! Saya hanya bisa setuju dengan ulasan mengoceh lain jika saya ceritakan tentang lokasi, lokasi, dan pelayanan jadi aku akan terus ini singkat dan berfokus pada barang lainnya.  Wifi: sangat cepat, dapat diandalkan, dan ada - yang merupakan hal yang langka di bali penginapan. Hal ini tentu saja akan membuat saya tinggal di sini lagi.  Kolam renang: bersih, terawat baik, dan pemandangan indah dari sawah. Tidak ada kolam renang dayung dan dapat mengejutkan dalam, yang cukup menyenangkan untuk duduk di dan benar-benar berenang. Ini adalah cara yang bagus untuk mendinginkan pada siang hari yang panas di ubud dan kami benar-benar menghabiskan lebih banyak waktu di sana daripada kita telah…",5
71, Inang Ubud Villa,"Stafnya luar biasa, mereka selalu pergi keluar dari jalan mereka untuk membuat kami merasa senang, bahkan bangun di 6am membuat kami sarapan pada hari terakhir kami.  Ini adalah tempat yang sangat kecil, tempat yang tenang dengan 6 atau jadi kamar, kolam renang yang indah meskipun itu menjadi setengah tertutup 2pm.  Bus antar jemput gratis ke pusat kota membuat untuk itu menjadi sedikit keluar dari jalan. Tidak banyak sopir taksi tahu di mana itu terletak jadi pastikan anda memiliki alamat berguna!   Hanya kekurangan dari tempat ini adalah serangga seperti itu sebelah sawah ubud tapi harus seperti ini, dan saya tidak bisa menangani gangguan! Tempat tidur yang juga sangat keras dan juga kurangnya pilihan pada menu   Tetapi untuk harga anda tidak bisa mengeluh ",5
72, Inang Ubud Villa,"Hotel bintang 5 di menikmati perawatan inang villa, minuman selamat datang, suasana yang baik, kamar yang sangat bersih, pijat kaki gratis, gratis sarapan, gratis merienda, mereka akan membersihkan kamar anda setiap hari dan membuat tempat tidur dan kelambu nyamuk setiap malam, dan ketika anda meninggalkan ada hadiah kecil ""cokelat"" untuk mengucapkan selamat tinggal! Oh ya ampun, kami tidak ingin pergi, kami merasa seperti di rumah sendiri, jadi jika anda akan tinggal di ubud. Saya akan sangat merekomendasikan hotel ini",5
73, Inang Ubud Villa,"Sementara tidak di ubud dekat. sekitar 15 - 20 menit berkendara ini dengan menyediakan layanan antar jemput. Mereka akan memberikan anda sebuah ponsel untuk menelepon ketika anda ingin dijemput. Kami digunakan hotel ini dan layanan adalah sempurna. Kami juga menyewa sepeda motor dari mereka untuk 50k per hari untuk berkeliling candi di kawasan ini.  Ketika kami check in kami disambut dengan minuman selamat datang dan menawarkan pijat kaki gratis.   Sarapan sangat baik.   Kamar luas dan tetap dingin. Kolam renang sangat bagus dan bersih.  Secara keseluruhan, ini adalah pengalaman menginap yang menyenangkan dan saya tidak akan ragu untuk merekomendasikan tempat ini kepada orang lain.   Satu-satunya kekurangan adalah hotel ini agak jauh dengan pusat kota ubud jika itu yang anda…",5
74, Inang Ubud Villa,"Suami saya dan saya menginap selama 3 malam di villa yang indah ini, dan akan tinggal lagi jika kita tidak sudah memesan hotel kami untuk gili tepat setelah. Lokasi sangat bagus - ubud sangat ramai jadi itu bagus untuk menjadi jauh dari itu dan dengan antar-jemput gratis setiap saat antara 9am - 10pm untuk masuk dan keluar adalah tidak ada masalah.   Sarapan adalah lezat, banyak untuk memilih dari di pagoda yang cukup kecil yang menghadap sawah. Pijat kaki selamat datang kembali juga termasuk juga teh siang hari setiap hari.   Kadek & semua staf yang sangat penuh perhatian dan membantu - akan pasti tinggal di sana lagi jika kita kembali ke ubud! ",5
75, Inang Ubud Villa,"Apa tempat yang menakjubkan untuk tinggal dengan host besar kadek & putu! Indah 20 menit berkendara dari tentang pusat ubud tetapi antar-jemput gratis ke ubud palace, . Mereka menyediakan anda dengan ponsel untuk memanggil mereka setiap kali anda ingin mereka untuk menjemput anda dekat istana ubud. kamar sangat luas, dapur, kamar mandi, kolam renang yang indah dengan sarapan besar ini adalah tempat yang bagus untuk bersantai!Ac adalah sangat efektif juga. Mereka menyediakan pijat kaki gratis 1/2 jam per kunjungan, yang sangat bagus!orang-orang sangat ramah dan mereka lebih dari bersedia untuk membimbing mengenai spa rekomendasi dll. Atas semua nilai untuk uang. Selama mereka menyediakan shuttle gratis ke ubud saya pasti akan tinggal setiap kali saya di ubud! ",5
76, Inang Ubud Villa,"Kami tinggal selama 3 malam di kamar keluarga dengan keluarga 4 (anak-anak 8 dan 5) dan nenek. Pengaturan yang indah di utara ubud. Dataran tinggi dengan pemandangan yang menghadap sawah. Ruangan itu luas, bersih dan nyaman. Kolam renang yang indah dan taman dan area makan. Pemilik yang sangat ramah, membantu dan fleksibel. Ini adalah 20 menit berkendara dari ubud - mereka akan mengatur transportasi masuk dan keluar dari ubud untuk gratis. Ada sentuhan indah seperti teh sore harian, pijat kaki gratis. Pasti akan merekomendasikan jika anda ingin menjadi jauh dari kebisingan dan lalu lintas dari pusat ubud.",5
