,hotel,review,stars
43, Kamil Villas,"Tata letak indah 1 bedroom villa dengan banyak perhatian terhadap detail. Ruang keluarga/ruang makan sangat luas terutama ketika anda membuka pintu geser yang pergi ke kolam renang. Di luar, kolam renang adalah cantik dan pribadi. Bagus untuk berenang atau hanya untuk duduk. Di dalam kamar mandi ada dua meja rias dengan dua kamar mandi dan toilet di luar. Hotel ini memiliki suasana yang besar duduk di luar. Kamar tidur adalah sangat, sangat bagus. Mengambang di tempat tidur besar dan nyaman dengan bantal bambu sangat nyaman! pengaturan secara keseluruhan bagus dan segala sesuatu tampak baru. Seperti yang saya katakan, kami sangat terkesan dengan villa.  Hal negatif untuk ulasan ini harus dilakukan dengan internet. Aku tahu ini baru villa sehingga anda mengharapkan beberapa…",4
44, Kamil Villas,"Saya memesan saya tinggal melalui agoda untuk 3 malam dari 24th - 27 mei dan sangat bersemangat untuk tinggal di sini. NAMUN. Saya terkejut ketika tiba di 20:30, tidak satu jiwa adalah sekitar untuk melayani tamu! Check in di kantor ditutup! Sebagai hasilnya. Saya tidak bisa cek in! Saya bertanya di seberang villa jika mereka tahu di mana villa staf dan mereka mengatakan kepada saya, biasanya ada tidak ada yang di sekitar di malam hari! Saya terus terang terkejut dan berpikir bagaimana masuk akal itu. Aku harus membuat panggilan internasional ke agoda dan mereka bahkan tidak menjawab telepon saya! Dan karena tidak ada tempat lain untuk saya, terima kasih untuk orang-orang di Kamil villas. Saya tidak memiliki pilihan tetapi untuk membuat pemesanan menit terakhir di tempat lain…",1
45, Kamil Villas,Wow! Saya benar-benar terkesima oleh bagaimana luar biasa saya menginap di Kamil villas di seminyak. Saya tidak punya negatif apapun tentang saya tinggal. Vila-vila benar-benar luar biasa dan harga yang sangat wajar untuk apa yang anda dapatkan! Staf yang luar biasa juga. sangat menyenangkan! Saya sangat merekomendasikan tinggal di sini. Pasti akan kembali lagi! ,5
46, Kamil Villas,"Jika anda mencari tempat yang tenang, bersih dan lokasi yang dekat dengan ""tindakan"", lihat tidak lebih lanjut. Sopan dan membantu staf, akomodasi yang baik dan banyak layanan, lokasi ini membuat perjalanan yang jauh lebih mudah. Sangat direkomendasikan.",5
47, Kamil Villas,"Baru-baru ini tinggal di salah satu vila yang indah ini dibangun, yang selesai dengan standar tertinggi. sangat senang ketika aku tiba untuk melihat termasuk juga tinggi sebagai rencana saya adalah tidak benar-benar cukup jauh dari villa kflau di liburan saya... belum lagi gaya kopi espresso! Saya tidak bisa memulai hari tanpa kopi saya! Staf yang bekerja di villa saya, ada duanya dan tidak ada yang terlalu banyak untuk mereka. sangat membantu dan ramah. Menghabiskan lima hari di hotel hanya bersantai dan menikmati kolam renang pribadi, gimnasium dan berlarian di jacuzzi. Liburan yang sempurna tidak diperlukan, yang saya akan sangat merekomendasikan vila ini ke semua indah. Tidak bisa menunggu untuk kembali lagi segera.",5
48, Kamil Villas,"Saya ingin mengucapkan terima kasih kepada semua staf di villa tempat yang sempurna untuk kamil santai dan indah pengalaman liburan terutama sebagai pertama kalinya kami ke bali. mendarat di negara yang aneh, tidak tahu siapa atau ke mana harus pergi dan mengambil saya di ruangan supirmu di bandara begitu mengagumkan. Villa kami memiliki segala sesuatu ada di ambang pintu kami, terutama pribadi kolam renang dan spa yang benar-benar! begitu dekat dengan segala sesuatu, kita juga ingin mengatakan terima kasih khusus untuk sangat besar jenny manajer anda membuat pengalaman menginap kami begitu hangat dan ramah dan kita tidak bisa menunggu untuk kembali dan tinggal dengan anda lagi segera. Kami pasti akan memberitahu semua teman-teman kita tentang anda   Terima kasih sekali lagi …",5
