,hotel,review,stars
0, Kamil Villas,"Setelah bepergian ke Bali selama bertahun-tahun Anda mulai tinggal di tempat yang Anda tahu dan tidak keluar dari zona nyaman Anda. Perjalanan ini dengan pasangan saya, kami memutuskan untuk mencoba beberapa villa yang berbeda. Saya kecewa karena saya tidak memesan lebih lama untuk menginap di sini karena ini sangat indah. Segala sesuatu yang dijelaskan adalah benar. Bersih, modern, cukup, dan sangat ramah. Kami pasti akan kembali dan lebih lama. Villa dan staf kamil terima kasih.",5
1, Kamil Villas,"Vila-vila ini bahkan lebih indah dalam kehidupan nyata. Mereka luas dan modern dan bersih dan memiliki segala yang Anda inginkan. Seorang teman dan saya memesan menit terakhir karena kami tidak senang dengan akomodasi yang kami miliki di Legian dan kami sangat terkesan. Mereka nilai uang yang besar dan staf indah dan membuat kami merasa sangat welcome.  Kami tidak memiliki hal buruk untuk dikatakan, villa menakjubkan:)  Kami akan kembali, pasti!",5
2, Kamil Villas,"Aku tinggal di Villa Kamil tahun lalu selama 4 malam.  Proses check-in mudah. Kami dikumpulkan dari bandara oleh sopir Villa. Kami tidak dapat check-in karena kami masih terlalu dini, namun, kami dapat menyimpan tas kami saat kami pergi makan siang.  Villa itu sempurna. Itu sangat bersih. Itu besar - dengan dapur, lounge, dan kamar tidur. Kamar tidur sangat bagus - sangat gelap dengan tirai dan banyak ruang.  Ruangan itu dibuat setiap hari dengan handuk segar dll.  Lokasi baik - tidak terlalu jauh untuk berjalan ke jalan-jalan utama atau dapat memesan mobil / Uber untuk menjemput Anda.  Akan menginap lagi di bulan Agustus tahun ini!",5
3, Kamil Villas,"Kami dijemput di bandara seperti yang dijanjikan, ketika Anda keluar dari bandara Anda akan melihat staf telekomunikasi menjual kartu sim untuk kebutuhan internet Anda, Anda dapat membeli sebelum Anda keluar dari bandara!  Naik mobil itu ok, banyak ruang untuk 2 orang dewasa dan 2 bagasi besar. Setelah sampai di villa, kami diminta untuk melakukan check in formalitas, seperti membayar sisa 6 malam dari pemesanan kami. Salinan paspor kami juga diambil oleh resepsionis.  Setelah check-in kami diantar ke villa kami, yang hanya sepelemparan batu dari penerimaan, mereka melakukan gerakan yang bagus untuk menghias kamar dan jacuzzi dengan bunga saat kami merayakan ulang tahun ke 12 tahun kami. Ini adalah vila yang cukup besar, sangat luas, seperti yang kami lihat di Instagram mereka.…",5
4, Kamil Villas,"Vila modern dan luas. Jauh lebih besar dari yang diharapkan. Kolam renang terjun fantastis, dengan daerah rendah melengkung di satu ujung untuk berbaring di air. Mandi di luar mengambil beberapa mandi untuk digunakan juga tetapi pada akhirnya tidak mengganggu kami. Tempat tidur sangat baik - besar & super nyaman (gadis yang kita sukai). Ubin melalui sangat mewah. Fasilitas dapur lengkap tetapi kami tidak pernah menggunakannya. Kami merasa aman. Kami menikmati privasi sebuah villa dan juga berjalan kaki singkat 4 menit ke Eat street. Tempat favorit kami untuk makan adalah Batik, Tiger Palm & Job Italia. Pasti akan tinggal lagi jika anggaran memungkinkan.",5
5, Kamil Villas,"Kami tinggal di Villa Kamil dari 4 Januari hingga 7 Januari 2019. Semuanya sempurna. Itu di lokasi yang sempurna, dekat dengan pantai, dan tepat di sebelah kota. Ada banyak yang harus dilakukan.  Bersantai di kolam renang, atau sekadar bersantai di jacuzzi dengan Bintang di malam hari adalah cara yang sempurna untuk mengakhiri hari.  Ini juga memiliki dua televisi besar, walk-in closet, tempat tidur ukuran raja, dan dapur modern. Itu bagus untuk bisa memasak sarapan di pagi hari, karena kami telah pindah dari hotel ke hotel, ini adalah perubahan kecepatan menyambut.  Stafnya sangat membantu. Pada checkout kami menyimpan tas-tas kami di kantor, dan menjalani hari kami.  Mereka mengatur transfer bandara untuk kami tanpa biaya, karena penerbangan kami hanya pada tengah malam, kami…",5
6, Kamil Villas,"Kami tinggal di villa 1 kamar tidur dan mereka luar biasa, super modern dan nyaman. Tempat tidur sangat nyaman dan mini bar itu benar-benar adalah yang terbaik yang kami miliki. Kolam renangnya indah dan berjemur di siang hari. Hanya 3 menit berjalan kaki ke jalan makan, kami pasti akan tinggal di sini lagi. Terima kasih Kamil Villas untuk kunjungan yang indah",5
7, Kamil Villas,"Saya tidak bisa meminta lebih. Pasti  Malam kedua saya di Seminyak setelah 1 street pengalaman buruk. Tiba, saya disambut oleh salah satu anggota keluarga (permintaan maaf, tidak ingat namanya) . Saya melakukan check in dengan dia dan dia memandu saya ke villa saya. Dia selalu sangat sopan dan baik, menunjukkan semua fitur.  Villa yang indah. Hotel baru, dan bahan-bahan yang baik konstruksi. Sangat bersih dan rapi. Saya benar-benar tidak ada point. Kolam renang di luar sangat bagus, hotel ini juga memiliki jacuzzi tetapi saya tidak menggunakan untuk kurangnya waktu.  Mereka bahkan memiliki mesin expresso kapsul dengan. :) semua peralatan makan yang diperlukan untuk memasak dapur dan anda dapat menikmati makanan di rumah.  Sayangnya saya hanya menghabiskan satu malam di sini,…",5
8, Kamil Villas,"Menginap di sini selama 11 malam. Vila yang luar biasa, kolam renang yang indah dan bak mandi air panas, luas dan bersih. Transfer gratis dari bandara, Villa dibersihkan setiap hari, botol air setiap hari, mesin pembuat kopi, mini bar, ac, kamar mandi luar ruangan dan toilet, tv dengan kabel gratis dan banyak film didownload. Staf sangat membantu dan tidak ada masalah dari es untuk saran lokal. Berjalan kaki sebentar ke pusat perbelanjaan yang luar biasa dan bar dan restoran lokal. Pasti akan merekomendasikan.",5
9, Kamil Villas,"Kami menginap di Vila Kamil selama 11 hari dan meninggalkan yang ingin kami telah memesan liburan panjang. Vila ini benar-benar modern dan luas dan memiliki fasilitas yang bagus. Semua staf sangat ramah dan membantu dengan semua permintaan kami segera merasakannya. Lokasinya sempurna untuk kami karena cukup dekat untuk berjalan kaki ke tempat-tempat terbaik untuk makan dan berbelanja, tetapi cukup jauh untuk melarikan diri dari keramaian dan hiruk pikuk. Akan senang untuk kembali lagi ke sana suatu hari nanti.",5
10, Kamil Villas,"Luar biasa! ! Luas, bersih & cukup. Interior modern, tv yang besar dengan film, suara & nyaman bluetooth sytem sofa. Suka dapur & kamar. Berjalan kaki ke toko-toko seminyak & restoran. Hanya tempat tidurnya terlalu kecil jika anda membawa anak-anak. Akan kembali lagi untuk menginap di liburan berikutnya",5
11, Kamil Villas,Vila yang bagus di jantung Seminyak. Sangat bersih dan luas. Hanya tidak ada sarapan tapi masih akomodasi yang luar biasa! Staf sangat membantu saat dibutuhkan friendlly dan. Gym juga tidak terlalu buruk. Kami menginap selama 4 hari dan benar-benar menyukainya!,5
12, Kamil Villas,"Villa yang sangat indah! Saya pertama kali benar-benar ragu tentang toilet dan shower di luar, tapi itu adalah sentuhan yang sempurna. Villa yang sangat luas dan indah di lokasi pusat, yang paling saya pasti akan tinggal di sana lagi. Satu-satunya komentar negatif saya akan membuat adalah tempat tidurnya yang benar-benar tidak nyaman yang sangat disayangkan. Mereka benar-benar memerlukan kasur yang baru karena ada dua tiang berhala pada setiap sisi dari orang-orang yang tidur di dalam mereka, kami tidak mendapatkan tidur nyenyak di malam hari.",5
13, Kamil Villas,"Yang bisa saya katakan. Kamil vila yang indah. Tersembunyi jauh dari Seminyak Square. Kamar yang besar, dengan air terjun dalam kolam renang 2.3. Spa, bak besar di lounge dan kamar tidur. Tersedia lemari es, dinding yang tinggi untuk daerah yang terpencil. Bluetooth sehingga Anda dapat mengelilingi pompa keluar musik Anda sendiri. Banyak saluran TV, tapi jika Anda tidak menyukai mereka, smart tv film keras mobil penuh. Dekat dengan segala sesuatu. Harga yang sangat baik. Standar dan shower hujan. Saya bisa terus mengoceh di, tapi lebih baik saran untuk mencoba sendiri. Suka suka suka suka kami tinggal di sini. Oh, dan semua pintu dari dapur ke kamar tidur lipat bar sehingga Anda di lengkapi ruang terbuka. LUAR BIASA",5
14, Kamil Villas,"Luar biasa dan sangat indah! Tinggal selama 5 hari dan wow ini adalah tempat yang paling santai yang pernah ada! Mereka bahkan membantu dengan transfer ke dan dari bandara kedua Villa yang luar biasa :)   Anda mendapatkan kolam renang pribadi, villa dengan perabotan indah dan dekat dengan fasilitas baru! TV di ruang adalah seperti salah satu lg smart tv 60 inch (besar) dan kemudian Anda dapat membuka pintu bagi Anda sementara Anda menikmati berenang yang menyegarkan di kolam renang!   Banyak ruang dan sangat dekat ke Seminyak melalui jalan kembali. Jalan Kembali mungkin mengambil beberapa untuk menyesuaikan diri - tapi setelah beberapa saat Anda terbiasa untuk itu. Ada juga supermarket sekitar 5 menit - yang luar biasa seperti Anda dapat menyimpan makanan/minuman Anda di lemari…",5
15, Kamil Villas,"Tinggal selama 9 hari dan memiliki waktu yang menakjubkan! Penjemputan di bandara, stafnya sangat ramah dan membantu hotel ini adalah di lokasi yang sempurna dekat dengan daerah restoran. Villa sangat bersih! Tempat tidur yang nyaman dan bersih sangat menyukainya! Kami akan tinggal di sana setiap kali kembali visist",5
16, Kamil Villas,"Kami menginap di vila ini selama 9 hari dan saya harus mengatakan kami menikmati setiap hari. Jika saya punya satu keluhan akan bahwa lemari es tidak memiliki lemari es untuk es krim dll. Staf yang sangat ramah dan tidak mengganggu kami kelas atas di rumah - tangga.  Lokasi sangat bagus meskipun bisa lakukan dengan beberapa perbaikan jalur, berjalan di batu ini tidak nyaman bagi wanita.  Kami sedang mencari maju ke stayinh di sini lagi di masa depan sangat dekat.",4
17, Kamil Villas,"Kami menghabiskan Natal di sini dan menyukai tempat ini vila dengan kolam renang pribadi, tempat tidur yang sangat nyaman dengan dapur dan ruang tamu yang luas   Kolam renang ukuran ini cukup untuk mendinginkan dan baik jacuzzi   Terima kasih kepada Jenny & Sugi juga untuk layanan yang sangat baik dan mereka sangat membantu,   Senang untuk mundur lagi XOXO",5
18, Kamil Villas,"Pada awalnya, semua itu baik. Kami bertemu di bandara untuk Transfer Kami dan dibawa ke vila yang benar-benar benar-benar indah. Kami menikmati lokasi dan fasilitas dari Villa dan kami senang dengan kemudahan.  Kami menemukan itu agak aneh bahwa setelah membayar setengah biaya kami untuk deposit, mereka ingin lain pada saat kedatangan, daripada di akhir kunjungan. Mereka juga menyatakan mereka memiliki kantor jam 7 - 7 tapi ada nomor darurat yang tersedia.  Di hari sebelum keberangkatan kami (1 malam di), kami diberitahu bahwa orang di kantor yang kami berencana untuk meninggalkan pagi berikutnya di 4:30 pagi untuk menangkap penerbangan kami pukul 7 dan diperlukan transfer bandara dan check out pada saat itu.  Kantor orang tidak menyebutkan bahwa ini tidak mungkin, dan…",3
19, Kamil Villas,Sekali lagi kami memiliki tinggal yang sangat menyenangkan di Villa Kamil. Salah satu tidak bisa mengatakan cukup tentang kualitas akomodasi dan staf di hotel yang profesional. Kami akan kembali secepat mungkin. Shane dan Dee.,5
20, Kamil Villas,"Saya menemukan Villa ini di Agoda dan benar-benar diambil oleh model terlihat menarik dan harga di Hari Valentine. Ini adalah kunjungan pertama kami ke Bali dan kami sangat baik terutama yang dimiliki oleh Jenny yang menjalankan Villa. Mulai dari mengatur transfer bandara kami untuk pendaftaran untuk memberikan saran tentang Berwisata di Bali. Selama 3 hari kami berada di sana, kami menyadari bahwa dia juga membersihkan villa dan menyiapkan tempat untuk pasangan lain dengan lilin dan kelopak bunga mawar. Ini sangat indah.   Villa adalah tetap sangat bersih, ada gratis kopi dan teh (semangat Dolce), air minum dan bahkan termasuk botol air mineral untuk menggosok gigi anda karena Jenny mengatakan Air Bali hanya cocok untuk mandi. Tingkat perawatan dan detail yang mengagumkan.…",4
21, Kamil Villas,"Setelah banyak pertimbangan saya memutuskan untuk memesan vila Kamil karena ulasan positif di situs ini tapi kami sedikit kecewa dengan layanan secara keseluruhan dan berpikir ada banyak ruang untuk perbaikan. Pertama, resepsionis yang tidak begitu jelas kantor dengan dua sepeda motor yang diparkir di depan pintu sepanjang waktu yang berarti Anda pada dasarnya dapat akses ke resepsionis. Sepeda motor harus parkir di tempat lain dan seluruh check - proses harus menjadi lebih ramah tamu. Kami menyadari bahwa hotel ini kekurangan staf yang terlatih sebagai resepsionis dua dunia.  Villa ini baru, cerah dan besar tapi kami pikir mereka memiliki beberapa rancangan kecelakaan, satu utama menjadi toilet di luar, yang berarti yang pada dasarnya tidak ada pintu dan jika hujan atau…",3
22, Kamil Villas,"Kami tidak bisa lebih bahagia dengan villa ini. Segala sesuatu baru, Modern dan sangat bersih. Staf yang semua sangat ramah dan membantu. Villa adalah menakjubkan dan sangat tertata dengan baik! Kolam renang adalah sangat dalam yang sangat kami perhatikan. Sangat dekat dengan jalan utama di mana Anda dapat menemukan segala sesuatu tetapi masih belum cukup dekat bahwa Anda mendengar semua suara. Kami menyukai air filter sehingga kita tidak harus membeli air dalam kemasan botol. begitu banyak berjalan di jubah di ruang, kami tidak tinggal keluar dari koper yang luar biasa! Pendingin udara di rumah dan mereka bekerja dengan baik! Kami tidak dapat menemukan kesalahan serius!",5
23, Kamil Villas,"Ini adalah villa yang luar biasa tepat di jantung Seminyak, tapi bagus dan tenang. Mereka sangat baik dan kolam renang adalah hanya surga. Tuan rumah selalu sekitar jika Anda memerlukan sesuatu dan secara teratur datang setiap hari untuk menyegarkan diri dengan Villa.  Satu-satunya bagian dari pengalaman adalah gelap dan berlumpur jalan kembali ke jalan utama, tapi ini adalah tidak salah Kamil. Vilanya sendiri sangat sempurna.",5
24, Kamil Villas,"Saya memiliki waktu yang sangat bagus di sana selama 4 hari, tenang, bagus, terawat dengan baik tentu saja saya akan kembali di sana, dan staf yang sangat membantu, mereka memberikan satu titik buruk check out terbaru di jam maks 1, kami harus diperpanjang untuk hari lain hanya untuk 3 jam sebelum kami terbang sehingga kami tidak menunggu di dalam cuaca yang panas.",5
25, Kamil Villas,Saya tinggal di Villa untuk 4 malam di Kamil 16 November. Saya bepergian sendirian dan tidak bisa telah memilih lebih baik untuk Villa pribadi dan mewah.  Daerah besar dengan hanya 5 menit berjalan kaki dari berbagai butik dan restoran Villa adalah tenang dan saya merasa 100% aman dengan pribadi di pintu gerbang yang terkunci.  Merekomendasikan untuk pasangan dan lajang yang mencari tempat yang tenang dan damai Liburan,5
26, Kamil Villas,"Villa ini luar biasa! sangat luas untuk 1 kamar tidur. Lokasi yang sempurna, hanya beberapa menit berjalan kaki ke jalan untuk makan. Segala sesuatu yang sangat modern dan sangat bersih. Staf yang sangat bagus dan mudah dihubungi. Sangat bagus untuk berbicara dengan Jenny pada hari terakhir kami. Fasilitas di Villa sempurna untuk apa yang kami butuhkan terutama film yang dimuat di TV dan speaker Bluetooth untuk musik.  Semua perlengkapan mandi/handuk dll yang diisi ulang setiap hari.  Luar biasa, sangat menyukainya! Bisa tidak kesalahan apa pun!",5
27, Kamil Villas,"Setelah pergi ke Bali banyak kali. Saya akhirnya mendapatkan suami saya ke sebuah villa dan kami tidak akan pernah menginap di hotel ini lagi. Meskipun kantor buka dari pukul 7 pagi sampai 7, Jenny untuk mengatur penjemputan dari bandara di 9 . 30 jam dengan tidak ada drama sama sekali. Pada saat kedatangan, kami sangat terkesan dengan vila modern yang indah ini. Pintu aman dengan tembok yang tinggi, memberikan banyak privasi. Kolam Renang & spa sangat bersih & mengundang. Dingin AC Pengendalian Sentral untuk kedua kamar tidur dan ruang duduk, dua lemari es dengan fasilitas dapur lengkap. Kami membawa makanan dari supermarket hanya beberapa menit berjalan kaki di seberang jalan untuk sarapan dan makan siang & makan malam. Villa itu dibersihkan setiap hari dengan sprei baru jika…",5
28, Kamil Villas,"Kami benar-benar menikmati kami menginap di Villa Kamil. Tempat yang sempurna di mana hanya berjalan kaki ke toko-toko, kafe dan bar berada, tetapi sekali Anda berada di dalam gang dan pintu halaman damai dan mewah.",5
29, Kamil Villas,"Kami baru saja mengunjungi Bali untuk satu minggu di bulan Oktober dan ini adalah ketiga kami liburan ke Bali karena beberapa bulan. Keluar dari semua tiga perjalanan, kami menemukan Villa Kamil berada di puncak daftar akomodasi.   Jenny sangat baik, ramah dan sangat membantu, bahkan bersikeras bahwa dia menemui kami di jam 2 pagi hari kedatangan kami, yang melampaui harapan kami.   Kamil Villa berada di lokasi yang bagus, hanya 200 - 300 meter atau 30 kedua berjalan kaki naik skuter untuk restoran utama strip di Seminyak.   Sementara di dekat kondisi baru apartemen, kami hanya Kritik kecil, (untuk 'rapi aneh' bahwa saya), akan kebersihan Villa. Ada beberapa tempat yang benar-benar diabaikan yang termasuk laba-laba, bintik kecil jamur (tidak ada yang sedikit pemutih tidak dapat…",5
30, Kamil Villas,Kamil vilas adalah kelompok kecil dari 4 yang tenang hanya satu jalan dari toko-toko dan restoran. Vilanya sangat lengkap dan baik dibangun. Raja ukuran tempat tidur adalah sulit tetapi tidur indah pertama kali mencoba. Yang tenang yang besar televisi di ruang tamu dan lain di dalam kamar tidur. Semua jendela dan pintu terbuka dengan melipat ke kolam renang pribadi anda dengan kursi dan bangku bangku di bawah dapur servery. Kamar tidur adalah besar dengan berjalan di jubah mandi dan wastafel mencuci lengkap di kamar tidur. Kamar mandi adalah di luar kamar tidur seperti toilet yang agak menghadapi karena tidak ada pintu (tapi masih pribadi).  Staf sangat baik dan ruang staf yang sangat efisien dan hormat.  Benar-benar merekomendasikan Kamil vilas,4
31, Kamil Villas,"Saya menginap selama 8 hari di Kamil dengan pasangan saya. Aku benar-benar mencintai tempat dan staf yang sangat membantu. Ada 4 vila kecil yang menjalankan sebuah lorong dari jalan utama. Cara tercepat untuk mendapatkan makan yang 2 menit berjalan kaki ke jalan gang, yang pada malam hari oleh diri anda sebagai wanita bisa sedikit menakutkan tapi benar-benar baik dengan pasangan.  Itu beruntung bagi kita bahwa selama beberapa hari kami tinggal ada kontraktor yang bekerja di atap sebelah, sehingga mereka bisa melihat ke halaman kolam renang. Setelah kami mengatakan kepada staf bahwa mereka melakukan yang terbaik untuk memperbaiki situasi ini. Secara keseluruhan kami memiliki tinggal yang menakjubkan dan akan pasti tinggal di sana lagi.",5
32, Kamil Villas,"Saya menginap selama seminggu dan villa sangat bagus  di atas semua. Untuk harga yang anda bayar itu yang terbaik di luar sana. Saya meminta check-in, dan tidak ada masalah. Aku bahkan mendapat terlambat penerbangan saya ditunda, sopir masih menunggu dan untuk menjemput saya dari bandara. Jenny dan staf sangat luar biasa.   Saya sangat merekomendasikan hotel ini.",5
33, Kamil Villas,"Dalam satu kata - fantastis! Hanya beberapa dari highlights di sini dan ada lebih banyak. Lokasi yang sangat baik - berjalan kaki singkat ke apa yang disebut ""jalan"" bahasa sehari-hari dengan banyak toko-toko dan supermarket kecil dengan atm di dalamnya. Staf, andy dan jenny sangat membantu. Tampak sangat baru dengan banyak kenyamanan modern. Kamar ukuran murah hati, tempat tidur yang sangat nyaman. Ada bluetooth melalui sistem suara di ruang sendiri sehingga dapat bermain musik dari iphone dll. Kedua kamar tidur dan ruang tamu/ruang makan/dapur area ber ac. sangat pribadi kolam renang daerah/halaman kecuali semi terbuka kamar mandi dan toilet di ujung taman yang mungkin mengambil beberapa mendapatkan digunakan untuk. Oleh karena itu mungkin sangat cocok untuk pasangan. Mungkin…",5
34, Kamil Villas,"Baru-baru ini kami menginap di villa Kamil. Villa sempurna dan tata letak yang sangat pribadi dan bersih. Lokasi yang baik untuk restoran dan toko-toko, staf sangat penuh perhatian dan ramah. Saya pasti akan merekomendasikan villa ini untuk liburan pasangan",5
35, Kamil Villas,"Kami meminta untuk check-in awal karena kedatangan kami di bali sangat awal di pagi hari. Ketika tiba di villa Kamil, jenny sangat bagus untuk membiarkan kami beristirahat di ruang sementara ia dan staf lain bergegas dengan pekerjaan rumah tangga. Kamar kami sudah siap dengan 12pm! Resepsionis tutup pada jam 7pm, tapi aku merasa itu tidak masalah. Di malam pertama, kami salah kunci villa kami sambil makan malam. Karena itu jauh melampaui 7pm, kami menghubungi nomor yang tertera pada kartu nama mereka. Jenny datang oleh tangan kami villa yang baru kunci. Sekali lagi, kami mohon maaf untuk masalah! Staf laki-laki pada shift sore juga sangat ramah, dan dapat diandalkan. Secara keseluruhan, para staf di vila yang semua super bagus Kamil! Villa adalah besar dan sangat bersih, dengan…",5
36, Kamil Villas,"Villa berada di lokasi yang sempurna untuk kita, persis di mana kami ingin. Ini adalah persis seperti yang terlihat dalam foto - sangat indah dan benar-benar lebih besar daripada yang saya harapkan.   Ada terpisah ruang ganti dengan banyak penyimpanan, meja rias di kamar tidur utama berada. Tempat tidur adalah indah, namun seprai tidak berubah untuk seluruh Minggu kami berada di sana. Kamar mandi (dan toilet) adalah di luar yang kami suka. Lounge dan dapur lengkap, meskipun kami tidak pernah menggunakan dapur untuk memasak. TV besar dan dilengkapi dengan puluhan film pra - yang dimuat, yang kita tidak tahu sampai malam terakhir kami.   Daerah luar ruangan yang indah, kolam renang indah. Seluruh tempat adalah mempersiapkan dan itu bagus untuk memiliki bahkan kecil area taman. Ada…",4
37, Kamil Villas,"sangat bersih dan kamar yang luas. Namun, akan lebih baik jika mereka telah memasang tirai di ruang tamunya. Ruangan itu begitu panas bahwa saya pikir pendingin udara yang tidak bekerja.   Karena ada tidak ada sarapan, ada lemari es untuk penyimpanan yang layak makanan.  Namun. Saya sangat menikmati vilanya. Dekat dengan makan street. Staf yang ramah dan sangat cepat untuk permintaan kami. Tempat tidur adalah begitu baik bahwa pacar saya ingin membeli kembali! ",4
38, Kamil Villas,"Tinggal di villa 3 dengan suami saya minggu lalu selama tujuh malam. Komunikasi dengan vila ini tidak bisa disalahkan, kami menyarankan kita mungkin akhir (yaitu melewati resepsionis pada jam 7pm) harus penerbangan kami ditunda dan mereka tidak ragu-ragu untuk menyarankan mereka akan terus penerimaan terbuka yang menunggu kedatangan kami.  Pemuda yang menyambut kami adalah indah dan memiliki baik inggris.  Pertama saya (sangat kecil) hanya masalah adalah bahwa kami diminta untuk membayar deposit rp 500K setelah kedatangan kami. Kami telah memesan dan dibayar untuk akomodasi kami dan meminta kami untuk uang tunai, yang dapat digunakan untuk membuktikan akan mendapati persyaratan untuk deposit. Saya punya uang tunai, jadi tidak ada masalah, tapi itu akan lebih baik disarankan…",4
39, Kamil Villas,"Villa yang luar biasa di jantung seminyak! Tidak bisa meminta untuk lokasi yang lebih baik. Sangat bersih, memiliki segala yang kami butuhkan, staf yang sangat membantu dan ramah. Berharap untuk kembali lagi segera. Satu-satunya penyesalan adalah bahwa kami tidak memesan untuk tinggal lebih lama lagi! ",5
40, Kamil Villas,"Villa dengan satu kamar tidur empat Kamil vila mewah. Kami sangat terkesan dengan villa ini, tata letak, dekorasi, fantastis kolam renang dan spa luar ruangan. Tv besar di ruang cip atau keping antirusak dengan ratusan film yang fantastis. Ada juga pusat kebugaran di hotel yang kita gunakan. Lokasi sempurna, hanya 3 menit berjalan kaki ke kecil jalan. Staf yang selalu membantu dan penuh perhatian. Kami menyediakan antar jemput bandara gratis. Kami memesan rumah kami siap antar 21:00 tapi penerbangan kami telah dibatalkan sebelum kami karena meninggalkan vila. Terima kasih kepada staf di villa mereka Kamil transfer kami dijadwal ulang untuk 4:30 pagi berikutnya. Kami telah tinggal di berbagai villa di seminyak beberapa kali dan ini adalah pasti salah satu favorit saya.",5
41, Kamil Villas,"Staf yang sangat membantu. Jenny manajer benar-benar berusaha keras untuk membantu dengan segala sesuatu. Modern, luas dan mewah dengan kolam renang dan spa. Tidak strategis untuk mengambil taksi dan dapat sedikit menakutkan di malam hari oleh diri sendiri, tetapi sangat mudah untuk makan.",5
42, Kamil Villas,"Villa ini sangat mengagumkan - dilengkapi dengan kolam renang pribadi, jacuzzi, dapur, ruang tamu dan kamar mandi luar ruangan. Ada banyak fasilitas yang tersedia untuk kita, seperti mesin nescafe dolce gusto dan smart tv sudah terisi 100 film dengan kenikmatan kami.   Terletak hanya singkat berjalan kaki dari 3-4mins di jalan utama yang dipenuhi dengan makanan dan toko-toko, ini adalah surga yang mudah diakses di sebagian kecil dari biaya seperti yang anda akan membayar untuk sebuah vila yang mewah. Manajer - Jenny, adalah sangat membantu dan ramah juga. Dia benar-benar membuat kami merasa di rumah dan nyaman selama kami menginap.  Kami hanya punya 2 jelek tentang tempat - lantai di area dalam ruangan cukup berdebu dan kami harus memakai sandal jepit kami di dalam ruangan. Jika…",5
