,hotel,review,stars
0, Kima Surf Camp,Saya ada di sana selama 1 minggu sebagai solo traveler di bulan Februari. Asrama bersih dan kamar mandi juga karena mereka dibersihkan setiap hari. Instruktur selancar - banyak - sangat baik dan membesarkan hati. Saya berhasil mengenal beberapa dari mereka selama pelajaran saya. Ada layanan hebat dan termasuk. sarapan - berbagai pilihan - hebat dan layak harga. Staf memberikan suasana yang hebat dan membuat kami semua menikmati waktu di sana - mungkin karena sikap peduli dan suasana hati mereka yang baik sepanjang waktu. Saya mengenal banyak orang dan merasa selalu disambut di sana. Pengalaman di sana benar-benar bernilai uang.,4
1, Kima Surf Camp,"Jika Anda tidak memiliki pengalaman berselancar, saya sangat merekomendasikan untuk melakukan sekolah selancar. Instrukturnya hebat dan mereka menjelaskan semuanya dengan terperinci dan mudah dimengerti. Jika Anda sudah memiliki pengalaman dan ingin meningkatkan Anda dapat bergabung dengan level yang berbeda dan itu luar biasa bahwa akan selalu menjadi panduan di sekitar Anda. Sesi video sangat membantu untuk melihat apa yang dapat Anda tingkatkan.",5
2, Kima Surf Camp,"Kamar bersih, staf ramah dan menyambut, surflessons besar, makanan benar-benar enak, itu adalah suasana yang sangat nyaman, selalu ada sesuatu, mereka menghibur Anda, kamp diatur dengan baik, mereka memilih Anda naik dan turunkan Anda di bandara tanpa masalah, mereka menginstruksikan Anda untuk kehidupan sehari-hari di kamp sehingga Anda tiba di camplife dengan cepat, saya meningkat banyak dalam selancar saya, surfsessions terorganisir dengan baik dan Anda selalu dapat meminta umpan balik, untuk meningkatkan, pelajarannya fleksibel dan Anda selalu dapat berbicara dengan staf jika Anda membutuhkan sesuatu, mereka fleksibel dan banyak membantu Anda! Saya sangat menikmati masa tinggal saya di sini!",5
3, Kima Surf Camp,"Teman saya menyarankan surf camp ini untuk saya dan saya tidak bisa lebih bahagia. Saya pemula peselancar, dan hanya ingin mencobanya. Panduan membuat saya merasa aman dan mengajari saya begitu banyak. Yang paling saya kagumi adalah organisasi dan manajemen. Tidak ada masalah, dan setiap permintaan dan pertanyaan diselesaikan dengan segera. Saya benar-benar menikmati makanan, ada sedikit segalanya untuk siapa pun. BBQ mingguan juga merupakan sentuhan yang luar biasa, dan cara yang luar biasa untuk berkumpul dan bertemu semua orang. Tolong, tolong jika di Bali, kunjungi, Anda tidak akan menyesal!",5
4, Kima Surf Camp,Tempat ini adalah surga. Kami menghabiskan waktu yang indah di sini bersama istri saya. Staf sangat ramah dan membantu. Sekolah selancar sangat cocok untuk pemula seperti kita. Kami pasti akan kembali suatu hari untuk liburan besar lainnya. . .,5
5, Kima Surf Camp,Saya hanya tinggal selama seminggu tapi minggu apa itu! ! ! Hotel ini menakjubkan dan staf sangat membantu dan ramah. Terutama Nela. Dia tidak bisa membuat kami tinggal lebih baik! ! Akan sangat merekomendasikan kepada siapa pun yang mengunjungi Bali.,5
6, Kima Surf Camp,"Saya berpikir untuk beberapa waktu apakah ada sesuatu yang saya tidak suka selama saya tinggal di sini, tetapi tidak ada! Tempat bagus dan bersih, gegar. Staf dan Orang-orang benar-benar ramah, selalu tersenyum dan membantu dan ketika mereka bertanya apakah Anda menyukai makan malam Anda atau bagaimana sesi selancar hari ini, mereka bersungguh-sungguh dan tentu saja saya menyukainya dan itu hebat:) dan pemandu selancar? sekelompok orang menyenangkan tapi masih profesional. Pasti akan segera kembali!",5
7, Kima Surf Camp,Staf yang sangat baik dan ramah yang akan merawat Anda dengan baik. Akomodasi sangat stilish dan bersih. Lokasi ini juga sangat bagus sehingga saya tidak bisa menahan saya dari menyarankan tempat ini untuk semua orang yang mencari kamp selancar yang sempurna,5
8, Kima Surf Camp,"Saya memiliki 3 hari terakhir saya di Bali jadi saya memilih untuk mencoba berselancar. Menemukan tempat ini online dan menyukainya! Aku tinggal di kamar bersama 6 tempat tidur, karena aku seorang musafir solo, ini adalah keputusan yang bagus untuk bertemu orang baru. Shout - out untuk surfer pemandu, energi besar dan hal - hal indah di kamp. Orang-orang ini selalu tersenyum. Benar-benar tempat yang bagus, pasti kembali!",5
9, Kima Surf Camp,"Halo semua, Saya telah mengunjungi banyak kamp selancar dalam Hidup saya (Portugal, Marokko, Spanyol, Bali, Sri Lanka). Dan saya bisa jamin, KIMA adalah salah satu yang terbaik.  Saya telah 10 kali ke Bali dan pergi 9 kali ke KIMA Seminyak. Tentu saja saya mencoba kamp-kamp lain di Bali, tetapi saya selalu kembali. Beberapa kamp lain saya tinggalkan setelah beberapa hari karena sesi surfing yang buruk.   - Surfsession: Sangat terorganisir (Anda bisa berselancar SETIAP HARI DUA KALI), pemandu selancar menjelajahi pulau lubang hanya untuk menemukan ombak yang bisa berselancar untuk Anda!  - Akomodasi: Kamar bersih dan sangat menyenangkan (AC)  - Makanan: Berbagai makanan segar yang sangat baik, dapur yang sangat bersih, sarapan enak.  - Staf: Staf yang sangat ramah. Selalu…",5
10, Kima Surf Camp,"Baru-baru ini tinggal di sini bersama pasangan saya dan memiliki pengalaman yang luar biasa. Staf sangat ramah, ramah dan kamarnya bersih, rapi dan dalam kondisi sangat baik. Staf benar-benar membuat seluruh pengalaman dari mempelajari nama Anda saat sarapan, untuk bernyanyi di sekeliling kolam dengan gitar atau benar-benar membuat pengalaman Anda berharga dengan lelucon dan tawa tak berujung. Tidak bisa cukup berterima kasih pada semua orang! !",5
11, Kima Surf Camp,"Saya sudah dua kali di Kima surfing dan saya menyukainya! Kamar dan sarapan selalu sempurna! Surfguiding luar biasa, saya banyak berkembang selama saya tinggal di sana. Semua staf dan surfguides sangat ramah dan membantu. Sangat bagus bahwa Anda dapat masuk untuk waktu dan tingkat sesi yang Anda inginkan. Aku akan segera kembali! ??",5
12, Kima Surf Camp,"Saya terus datang kembali. Tempat terbaik untuk tinggal Staf yang ramah, makanan yang luar biasa, kamar super bersih dan dilengkapi dengan baik, perasaan tropis dan lokasi super sentral. Tempat yang akan menjadi jika Anda ingin tinggal di Bali.",5
13, Kima Surf Camp,"Ia menambahkan 3 tempat untuk surfing di Kima (Green Room Seminyak) dan tengok untuk semua orang yang direkomendasikan dan direkomendasikan, termasuk, Bali Digali dengan Bali Sin Kima, tanpa es Bali.  Semua orang tahu bahwa mereka tidak dapat diatasi, tanpa relasi dengan apa pun, informasi lebih lanjut, informasi lebih lanjut, lebih lanjut tentang profesional, bersama dengan anak-anak simpel, siempre sonriendo, dan tidak ada satu sama lain a hacer surf en menos de lo que podr sebagai imaginar, so que que quantan durante todo el da por el camp para ayudarte en la piscina con diferentes t cnicas y amenizando las noches con la guitarra mientras estamos de chill en los sof s, cantando con todos los hu spedes memberikan informasi aktual.  Jika Anda menyukai ini, Anda akan menemukan…",5
14, Kima Surf Camp,"Kima Surf bukan hanya sekedar kamp selancar lainnya. Itu adalah keluarga. Berada di sana untuk ketiga kalinya, saya tidak memiliki apa-apa selain hal-hal baik untuk dikatakan tentang tempat itu. Pemandu selancar, tulang punggung kamp, adalah yang terbaik. Sangat menyenangkan mengikuti pelajaran selancar bersama mereka, mereka berpengetahuan luas dalam hal membaca ombak dan serius dalam hal keselamatan tamu. Yang terpenting, mereka ingin kita bersenang-senang. Tetapi ketika mereka berada di kamp, mereka adalah musisi yang luar biasa dan orang-orang lucu. Staf di kamp ramah super duper, hanya tersenyum di wajah mereka! Akan selalu ada di sana saat Anda membutuhkan. Jika Anda mencari tempat untuk meningkatkan selancar Anda dan memiliki layanan dan akomodasi yang hebat maka ini…",5
15, Kima Surf Camp,"Tahun ini saya mendapat kunjungan kedua ke Kima Surf @ Green Room Seminyak dan sekali lagi mereka berhasil melampaui harapan saya. Segala sesuatunya sempurna. Dari perjalanan berselancar setiap hari ke makanan, kebersihan, staf yang membantu. . . . Ketika Anda tinggal di sana Anda benar-benar dapat menikmati liburan Anda. Seperti teman saya yang datang dengan saya berkata ""mereka bahkan memotong buah Anda untuk sarapan"" Anda tidak perlu memikirkan apa pun. Mungkin untuk menggambarkan orang-orang yang bekerja di sana adalah dengan menceritakan apa yang terjadi selama kami tinggal. Teman saya kehilangan banyak uang di kamp. Itu terasa dari sakunya. Jumlah penduduk lokal sama dengan gaji bulanan. Hari berikutnya kami pergi ke resepsi dan uang sedang menunggu di sana. . . Salah satu…",5
16, Kima Surf Camp,"Saya biasanya tidak membuat ulasan tetapi setelah menghabiskan lebih dari seminggu di kamp dan memiliki waktu yang paling menakjubkan, saya merasa berkewajiban.  Pertama kamp itu sendiri: Kamp itu terasa lebih seperti sebuah resor kecil bagi saya. Semua staf sangat membantu dalam segala hal dan sangat ramah dan menyenangkan berada di sekitar. Makanannya luar biasa! (dan sangat murah) Kami tinggal di asrama 6 kamar tidur dan itu sangat bersih dan persis apa yang kita cari Kolam renang yang menakjubkan dan sempurna untuk bersantai di antara sesi Bar kolam renang adalah bagian favorit saya dari kamp karena setiap malam para tamu dan pemandu semua duduk di sekitarnya bermain gitar, minum bintang dan bersantai (kami bahkan menyelenggarakan turnamen bir pong satu malam)  Selancar…",5
17, Kima Surf Camp,"Ini bukan hanya sebuah sekolah - Ini adalah rumah bagi para peselancar dan untuk para pemula. Tempat dengan suasana baik saja. Naing, Komang, terima kasih teman anda untuk Ahmad pelajaran - anda super keren guru! Kamar dan makanannya juga mengagumkan! Saya sangat senang bahwa saya memilih tempat ini untuk memulai! Terima kasih untuk membantu saya membuat saya mimpi!",5
18, Kima Surf Camp,"Dari saat pertama ketika supir sangat menjemput saya di bandara, saya merasa sangat diterima di sini. Surf Camp mendapat suasana yang super keren dan kamar/fasilitas sangat bersih dan terawat dengan baik. Tempat yang luar biasa untuk bersantai setelah berselancar di sepanjang hari. Staf sangat ramah dan membantu. Instruktur selancar yang profesional, menyenangkan dan dapat tahan mata pada semua orang. Pengalaman yang sangat bagus dan tempat yang luar biasa!",5
19, Kima Surf Camp,"Saya suka tempat ini! Instruktur selancar yang sangat pro dan juga menyenangkan! Tempat ini cantik, bersih dan nyaman. Suasana yang sangat bagus dan suasana bersantai! Dan sarapannya enak. Terima kasih untuk masa-masa yang baik!",5
20, Kima Surf Camp,"Dari saat saya masuk dan bertemu Wendy dan Satiya, saya tahu bahwa saya telah memilih tempat yang tepat. Mereka hangat, ramah dan profesional. Ini berterusan dengan semua orang-orang yang bekerja di sana, dari Dao pemandu selancar dan untuk staf dapur untuk jasa kustodian staf. Kamar yang bersih, fasilitas yang menyenangkan - 2 kolam renang, film malam, bar, dll. makanannya juga lezat. Saya harap oleh semua orang, dan kesabaran untuk menjawab keinginan semua pertanyaan saya, membantu dengan semua kebutuhan saya, di dalam dan di luar hotel, dan secara umum yang hadir di setiap orang yang bekerja ceria di sana. Saya akan merekomendasikan Kima Surf Penginapan ini untuk siapa saja yang ingin memiliki liburan yang berorientasi berselancar, tidak peduli bagaimana santai atau giat.",5
21, Kima Surf Camp,"Sejak pertama kali saya menginap di Kima sekitar 3 tahun yang lalu, jenis ini terasa seperti rumah kedua saya. Tempat perkemahan dan seluruh tim yang sangat indah yang saya selalu berakhir dengan datang kembali.  Fasilitas yang luar biasa dan organisasi. . . ada banyak tambahan termasuk dalam biaya menginap per malam, seperti perjalanan berselancar, dll.  agak sedikit mahal untuk Bali, tapi pasti sepadan bila anda termasuk segala tambahan yang dilemparkan ke dalam.",5
22, Kima Surf Camp,"Surf Camp cukup terorganisir dengan baik, kamar-kamarnya benar-benar bagus dan stafnya sangat ramah. Saya pernah ke beberapa kamp di seluruh dunia, dan menemukan tempat ini adalah salah satu yang terbaik dari segi organisasi dan berselancar membimbing.  Dandy adalah salah satu yang terbaik yang pernah saya temui. Pemandu Ia mendorong saya ke ombak yang terbaik yang pernah saya dan saya tidak pernah merasa ada risiko mengetahui dia dekat. Di sini benar-benar pemandu tampak peduli tentang kemajuan anda di berselancar, menganalisa video selama sesi dan di lain waktu di tempat perkemahan. Untuk memastikan bahwa saya kembali di sana sangat segera!",5
23, Kima Surf Camp,"Saya suka tempat ini. Setiap kali saya tiba di kamar hijau Seminyak terasa seperti saya pulang ke rumah. Semua staf mengingat nama anda dan saya suka bahwa ada begitu banyak tamu yang datang kembali setiap tahun. Saya dapat merekomendasikan kacang mete ayam dari menu. Hotel ini bagus yang ada staf yang selalu ramah dan pemandu selancar di sekitar. Saya sudah mencoba semua koktail baru dari bar yang bagus, ada di jam senang juga!",5
24, Kima Surf Camp,"Menginap 2 minggu di tempat ini dan saya hanya bisa mengatakan itu adalah tempat terbaik untuk berselancar perkemahan (Kima menjelajah) yang pernah saya kunjungi. Lubang tempat ini dikelola dengan sempurna. Dari jadwal, makanan, berselancar, perjalanan staf. . . seluruh interior perkemahan. 2 kali per hari anda memiliki sesi berselancar dan anda hanya memesan tempat di mana anda ingin pergi dan mereka akan membawa anda ke sana dengan pemandu selancar 2 menit . Bahkan jika anda tidak bisa berselancar. Tempat ini adalah sempurna untuk bersantai. Terletak hanya 5 menit berjalan kaki dari pantai dan anda memiliki banyak toko, spa, tempat makan di sekitar sudut tapi yang terbaik adalah tempat perkemahan itu sendiri! Sangat merekomendasikan dan pasti akan datang kembali!",5
25, Kima Surf Camp,"Saya menginap di sini selama 2 minggu di Surf Camp 17 Juni - perjalanan yang sempurna! Pasti lebih kecil daripada market lokasi surfing tapi ideal ini biasa, tempat tidur yang bersih, handuk, kamar dll. dilakukan setiap hari.   Orang-orang yang bekerja di sana sangat bagus baik di restoran atau memang surfing instruktur.   Saya akan benar-benar kembali ke kima dan telah direkomendasikan untuk teman-teman.   Aku akan Echo sebelumnya bahwa ini tampaknya bertarget pada wisatawan yang berbahasa Jerman.",5
26, Kima Surf Camp,"Aku tinggal di asrama 6 tempat tidur yang di Seminyak untuk 5 malam dan berikut rincian dalam setiap aspek dari camp:    1. Akomodasi & fasilitas: Secara keseluruhan kamar dan toilet yang sangat bersih sepanjang waktu. Banyak ruang umum di mana Anda dapat duduk dan bersantai atau bersosialisasi dengan orang lain. Satu kelemahan adalah bahwa selimut mereka memberi kami di asrama ini cukup banyak tempat tidur, jadi ini tidak nyaman seperti selimut yang tepat. Wifi adalah hanya baik di sekitar di ruang umum. Saya hampir tidak bisa menggunakannya di kamar saya, tidak yakin tentang kamar lain.    2. Layanan: Mereka bisa membersihkan kamar Anda setiap hari, dan mengubah Handuk 2 kali per minggu saya rasa (tidak yakin seberapa sering mereka mengubah) mereka juga memiliki layanan…",5
27, Kima Surf Camp,sarapan yang luar biasa. Bagus dan tertarik surfguides. Kualitas makanan baik. Kadang-kadang musik itu terlalu lama dan terlalu bising sampai 1 di pagi hari.  semua dalam semua tinggal yang hebat dengan orang-orang 1 minggu. terlalu singkat untuk selera saya,4
28, Kima Surf Camp,"Perkemahan yang sangat baik! Ada surfsessions berbeda ditawarkan setiap hari. Jika Anda seorang surfer maju pemandu wisata dan bahkan membawa Anda ke berbagai tempat surfing di Bali dengan mobil. Akomodasi adalah luar biasa. Ada sebuah restoran kecil, kolam renang dan chilloutzone. Rool yang indah und dilengkapi dengan baik. Itu hanya Anda ingin bersantai setelah surfsession yang baik. Di atas bahwa Hotel menawarkan sarapan gratis. Ada pilihan yang berbeda dan pasti ada sesuatu di sana untuk setiap selera. Anda juga dapat memiliki makan siang dan makan malam di restoran hotel, tetapi saya menyarankan Anda untuk makan di luar. Perkemahan adalah benar-benar di pusat. Ada banyak toko yang berbeda dan hotel di jalan yang sama. Restoran ini lebih murah daripada restoran di kamp. Apa…",5
29, Kima Surf Camp,"Menghabiskan hampir 3 minggu di kima surfcamp di seminyak. Lokasinya bagus, dekat dengan segala sesuatu yang anda butuhkan. Mereka memiliki kamar yang berbeda untuk setiap anggaran dan area bersantai dengan kolam renang adalah bagus. Juga makanan yang disajikan di restoran ini sangat lezat. Hal terbaik untuk saya adalah surfguides di camp - orang besar yang suka semangat mereka untuk mengajar orang - bagaimana untuk berselancar. Anda bisa merasa bahwa mereka benar-benar menyukai pekerjaan mereka - selalu ramah dan bekerja dengan senyum. Saya sangat merekomendasikan ini surfcamp! Setelah 6 bulan perjalanan tempat ini dan orang-orang di sini menjadi homebase kedua saya - terima kasih untuk waktu yang menyenangkan! ",5
30, Kima Surf Camp,"Aku tinggal di ruang hijau di kima di seminyak untuk 10 hari dan itu sempurna untuk saya tinggal. Tempat ini adalah tempat yang indah dengan kamar yang bersih dan luas, kolam renang yang bagus, dan restoran yang chilloutzone. Restoran yang menawarkan sarapan, makan siang dan makan malam dan setiap kali makan saya memilih sangat lezat! Staf (penerimaan, restoran, membersihkan tim) adalah selalu ramah dan membantu. Ini adalah benar-benar terorganisasi dengan baik dan surflessons yang anda dapat memilih dari berbagai pilihan tempat anda ingin pergi tentang kemampuan surfing anda dan tempat favorit. Sangat ramah dan membantu di surfguides dan memberikan umpan balik yang baik setelah setiap sesi. Di videoanalysis dua kali seminggu adalah baik untuk meningkatkan kemampuan surfing…",5
31, Kima Surf Camp,Kamar hotel terletak di pusat kota hijau di seminyak menawarkan semua yang anda inginkan. Staf adalah sangat ramah dan membantu! Aku punya waktu terbaik di Kimasurfari surfcamp tempat yang bisa membawa anda ke tempat yang berbeda surfguides di bali menurut surflevel anda. Saya tidak pernah berselancar lebih baik saya selama saya tinggal di kamar hotel yang hijau! Terima kasih banyak orang yang saya benar-benar menikmati waktu saya di sana!,5
32, Kima Surf Camp,"Ruang hijau ini adalah menginap yang sempurna di seminyak, untuk aktif dan para penggemar laut. Para pemandu dan seluruh tim yang menyediakan pengalaman yang unik berselanca. Staf hotel sangat ramah dan mereka bahkan tahu nama anda setelah beberapa hari pertama. aku ada di sana dua kali dalam waktu yang pendek dan mempunyai waktu hidup saya. aku benar-benar membuat teman-teman dengan banyak orang dari seluruh dunia. aku hanya bisa berharap semua orang dapat pergi dan mengunjungi ruang hijau sekali dalam hidup mereka. Mereka memberi anda pengalaman liburan yang benar-benar hijau, sebagai mereka tidak menggunakan perangkat plastik, botol atau hal-hal seperti itu di rumah. Di tempat-tempat yang dipilih surfs dan panduan menyediakan paling sempurna pengalaman berselancar setiap…",5
33, Kima Surf Camp,"hanya yang terbaik pernah saya miliki expierience! Semuanya sempurna, bersih dan nyaman. Staf adalah menakjubkan dan apa pun yang anda inginkan atau butuhkan, mereka akan membantu anda. Ini adalah tempat yang sempurna untuk tinggal untuk berselancar, bersantai, berbelanja dan menikmati pulau yang mengagumkan ini! Aku akan kembali sesegera mungkin! :-) ",5
34, Kima Surf Camp,"Aku pernah ke beberapa lokasi surfing di bali dan saya pikir ruang hijau seminyak yang terbaik dari mereka semua perencanaan fasilitas berselanca - mereka memiliki sebuah situs web anda dapat log on ke pilihan anda mendaftar untuk hari senin (yang menunjukkan tingkat masakat, tipe bertany, instruktur untuk kelas, kaus kaki/tidak dll). Ini adalah benar-benar bermanfaat daripada mencoba untuk menemukan tempat yang sensasional/waktu untuk pergi malam sebelumnya.  Sebagian besar kelas saya adalah dengan membuat - dan dia adalah seorang instruktur yang benar-benar memberi anda beberapa nasihat yang baik.  Kamar, makanan, orang, kolam renang, dan layanan semua sangat baik.  Hanya hal aku benar-benar tidak menikmati adalah musik keras yang berlangsung sampai sekitar 1130pm setiap…",4
35, Kima Surf Camp,"Lokasi yang sempurna di jantung kota seminyak. Anda berada di antara tempat ini dengan bar dan restoran dan hanya 5 menit dari pantai tapi hotel ini sedikit oasis perlindunganny, anda dapat bermalas-malasan di sekitar kolam renang dan itu sangat tenang dan santai.  Hotel ini dirancang dengan indah dan kolam renang. Aku punya kamar deluxe yang sangat nyaman dan bergaya, menu restoran adalah sederhana tapi bagus. Staf sangat ramah dan membantu. Surf membimbing adalah luar biasa, sangat baik diatur, yang indah dan baik dan panduan yang brilian.  Best surf camp aku pernah ke, bersama dengan adik Canguu camp.  Dapat menjadi sangat berisik di malam hari untuk tamu yang tidak pergi ke kota (tidak pernah memahami bahwa) tetapi staf benar-benar memanggil waktu sekitar 2300.   sangat…",5
36, Kima Surf Camp,Aku benar-benar menikmati saya tinggal di ruang hijau! Benar-benar baik. Perjalanan adalah benar-benar bersenang-senang berselancar! Sarapan adalah benar-benar baik dan cukup untuk memulai hari. Hotel ini juga benar-benar baik dan tidak mahal jadi aku makan malam saya biasanya mengambil dari sana. Aku akan benar-benar merekomendasikan ruang hijau dan aku berharap aku bisa pergi kembali ke sana lagi satu hari.,5
37, Kima Surf Camp,"Tinggal di sana selama 1 minggu.  - Camp-merasa sejuk (anda dapat bergabung dalam kelompok atau tidak, terserah anda). - Makanan yang sangat baik dan tidak mahal.  - Sarapan sangat lezat (coba sarapan deluxe). - Surf-panduan profesional dan kompeten. Ombak besar untuk greenhornes - tapi nyaman. Saya sangat merekomendasikan kampnya ",5
38, Kima Surf Camp,"Memiliki waktu yang besar tinggal di kima surf camp yang indah! Kamar itu sempurna dan aku mencintai mandi luar/dalam ruangan! Staf adalah di luar membantu dan pelayanan, anda harus mencoba pancake dan kelapa risotto. Tidak bisa menunggu untuk mengunjungi lagi segera!",5
39, Kima Surf Camp,"Aku tidak tahu di mana untuk memulai untuk mengungkapkan apa yang aku punya waktu yang hebat di ruang hijau. Aku akan memulai dengan mengatakan bahwa akomodasi yang luar biasa. Ranjangnya sangat nyaman, kamar mandinya selalu bersih, ac selalu tenang dan sarapan sangat mengagumkan.  Jika itu semua yang telah untuk menawarkan ruang hijau, aku akan mengatakan itu adalah nilai yang besar untuk sebuah hotel yang bagus dengan lokasi yang baik. Anda tambahkan di panduan berselanca dan staf hotel dan saya bersedia membayar mendobelkan!   Kami datang dengan sekelompok 10 orang dan oleh hari kedua, semua staf ingat nama kami. Ombak yang gila dan menyenangkan panduan kelompok orang yang memastikan anda bersenang-senang di air dan meningkatkan surfing anda, tidak peduli apa yang anda adalah…",5
40, Kima Surf Camp,Itu adalah tempat yang sangat bagus untuk ruang hijau seminyak. Selancar di kamp ini sangat bersih dan staf adalah sangat membantu dan ramah. Mereka ingat setiap nama tamu dari awal. Menakjubkan. Makanan di restoran adalah lezat (aku cinta geyuk gajus: d)  Ini adalah suasana yang akrab dan aku akan kembali tahun depan - untuk yakin.  Anak-anak dan teman-teman: jangan pernah berhenti menjadi pengelola yang luar biasa!  ,5
41, Kima Surf Camp,"Ramai, sibuk hostel. Hostel staf yang ramah dan lebih gila dan menyenangkan panduan berselanca. Aku datang di saya sendiri, tetapi dibuat untuk merasa selamat datang. Waktu berikutnya aku datang kembali untuk berselancar. Aku akan pasti tinggal di sini lagi.",4
42, Kima Surf Camp,"Selancar di kamp yang baik, bersih, baik harga nilai hubungan dan makanannya sangat enak! Bahkan untuk sarapan ada banyak pilihan yang lezat, sehat yang lezat! Kamar mandi agak kecil tapi dilengkapi dengan baik. sangat berisik dan keras di pagi hari di sekitar kemah sehingga tidak baik untuk tidur di akhir :) staf yang sangat ramah.",3
43, Kima Surf Camp,"Kimasurf yang nyaman, mudah tempat dekat ke pantai. Staf yang ramah dan sesama surfers. Suasana santai, dengan makanan yang baik dan suasana! Pemandu selancar sangat membantu dan antusias. Sangat merekomendasikan :) ",5
44, Kima Surf Camp,"sangat baik dan ramah kru. Interior indah dan peralatan yang baik. Makanan yang baik, sarapan besar dan harga murah di suasana yang indah. 10 menit dari pantai, yang merupakan tempat yang sangat baik untuk matahari terbenam. Sayangnya gado gado adalah penuh rubish, tapi anda selalu dapat membantu penduduk lokal untuk membersihkan pantai :-) ",4
45, Kima Surf Camp,"Tempat sempurna jika anda berniat untuk belajar berselancar/meningkatkan berselancar/menjelajah bali. Staf sangat membantu, perkemahan adalah di lokasi yang besar, pemandu selancar membawa anda ke berbagai tempat setiap hari kerja dan anda kemungkinan untuk bertemu seperti hati orang. Akan pergi ke sana lagi!",5
46, Kima Surf Camp,"Saya menginap di green kamar untuk 3 minggu dan memiliki waktu yang menyenangkan! Semua staf werde benar-benar baik dan membantu, kamar bagus dan bersih dan werde makanannya menakjubkan. Saya juga bertemu banyak orang-orang yang bergabung dengan kima camp! Pasti akan datang kembali!",5
47, Kima Surf Camp,"Tempat yang bagus untuk tinggal dengan orang-orang yang luar biasa! Pasti akan kembali lagi. Makanan juga sangat baik dan pelayanannya juga sangat ramah. Kamar sangat luas & nyaman. Melakukan perjalanan ke mt batur diselenggarakan oleh camp, yang sangat terorganisasi dengan baik juga. Kegiatan lain juga dapat dipesan melalui resepsionis di kima surf.",5
