,hotel,review,stars
48, Kima Surf Camp,"Saya tinggal selama 3 minggu dan memiliki tinggal yang luar biasa. Ini adalah kunjungan kedua saya ke perkemahan, tapi pertama saya sendiri di kamar.  Perkemahan terletak di ujung jalan yang tenang, memberikan kedamaian dan ketenangan, tetapi detik adalah jalan utama dengan toko-toko, restoran, pijat dan pantai hanya beberapa menit berjalan kaki. Kolam renang, kamar dibersihkan setiap hari dan sangat nyaman. Semua staf yang sangat membantu, dari hotel dan restoran staf, untuk pemandu selancar.  Makanan dari restoran juga sangat cukup harga, jika lelah dari hari yang melelahkan di surf, anda tidak perlu untuk pergi keluar.  Surf adalah perjalanan baik teratur, menawarkan beberapa destinasi untuk berbagai tingkat peselancar, dan pilihan single sesi atau hari perjalanan.  Saya…",5
49, Kima Surf Camp,"Saya sudah kedua kalinya di sini sekarang.  Itu masih yang terbaik surf camp yang saya tahu. Orang-orang baik (surfer, camp tim) di kaki ke kota pesta kuta.  Suasana dingin selama hari lubang. Ada dua poin. Anda dapat melihat bahwa perkemahan bisa perlu beberapa renovasi + di beberapa kamar itu cukup bising karena anjing dan ayam jantan pada malam hari. Tapi ini tidak berhenti untuk kembali lagi!  Bersantai!",4
50, Kima Surf Camp,"Saya menginap di the green kamarnya mengagumkan! Tinggal di sini selama dua minggu dan waktu. Staf adalah benar-benar membantu dan baik. Makanan baik dan cukup dan tentunya berselancar di mana saya datang untuk sangat baik! Saya melakukan kursus pemula di Ripgirl tapi saya belajar jauh lebih dari pemandu di camp! Saya belajar begitu baik dari mereka bahwa saya membeli saya sendiri dan bergabung dengan papan untuk sesi bintang di akhir! Jika anda ingin belajar selancar, berada di tempat yang bagus di bali, dan bertemu banyak orang baik anda harus pasti pergi ke green room!   Quintus (Belanda)",5
51, Kima Surf Camp,"Kami tiba di green kamar dengan 3 teman-teman oleh kebetulan. Kami mencari akomodasi dan tidak tahu itu adalah bagian dari kima surf camp, tapi yang mengejutkan adalah sangat memuaskan bagi kami. Staf di green room adalah benar-benar membantu dan memberitahu kami menyewa papan untuk satu hari dan berpartisipasi dalam kelas mereka. Surfing instruktur yang sangat bagus! Saya telah berselancar sebelum, tapi aku punya satu untuk satu kelas dari seseorang yang bisa benar-benar menunjukkan beberapa hal ""aku selalu salah"" dan ini membuat saya muka banyak dalam satu hari. Fasilitas di ruang hijau yang indah. Mereka memiliki kolam renang dan jaccuzi centric dan kamarnya tersebar di antara itu. Karena ini adalah surfer tempat dan orang-orang bangun pada pukul 5 pagi untuk kelas ada juga…",5
52, Kima Surf Camp,"Menghabiskan 2, 5 minggu di kamp. Kami memiliki waktu yang fantastis. Orang-orang hebat, layanan yang sangat baik, fantastis surf, awesome makanan dan suasana! Tidak sabar untuk kembali! Staf sangat ramah dan menyambut. Perkemahan adalah 5-menit berjalan kaki dari pantai (dengan bar besar dan tempat surfing). Kami tinggal di 4 kamar tidur - tempat tidur. Satu-satunya kelemahan adalah kecil kecil kamar kami menjadi agak tua dan berisik. Selain itu, semuanya fantastis!",5
53, Kima Surf Camp,"Tempat ini di sisi jalan kecil, jadi jika anda adalah masih di tengah-tengah seminyak tapi witout kebisingan... Orang-orang sangat bagus, dengan baik surf membimbing... Restoran sangat baik... Porsi cukup besar untuk seorang peselancar nafsu makan,",5
54, Kima Surf Camp,"Adalah kesenangan untuk tinggal di sini! Ramah dan orang yang menyenangkan. sangat bersih, kamar yang bagus, makanan yang baik, suasana dingin di camp! Perkemahan adalah begitu dekat ke pantai untuk berselancar atau untuk pergi keluar di malam hari, melihat matahari terbenam dan pergi untuk makan. Dan semua impian kami menjadi kenyataan karena tim yang super! :) Saya ingin kembali!",5
55, Kima Surf Camp,"Saya telah menginap di sini dua kali dan akan terus datang kembali. Setelah mencoba di tempat yang berbeda di bali dan di sebuah misi untuk meningkatkan berselancar, ini adalah yang terbaik terbaik untuk banyak surf membimbing pilihan, makanan besar dan staf besar. Berbagai akomodasi dari budget hingga sedang sehingga anda dapat memilih apa yang terbaik untuk anda. Lokasi ini mungkin tampak sedikit ramai tapi itu super central. Saya telah tinggal dengan teman-teman dan solo dan bekerja baik karena mudah untuk bertemu orang-orang dan berbaur.",5
56, Kima Surf Camp,"Berkutu di semua kotak. Baik teratur, otentik bali gaya akomodasi dan makanan yang sangat baik. Banyak fleksibilitas ketika datang ke mengatur perjalanan, pemesanan di pemberitahuan singkat atau hal lain. Suasana dan lokasi yang fantastis. Benar-benar surf-fokus. Telah beberapa kali dan akan pasti kembali.",5
57, Kima Surf Camp,"Ruangan itu nyaman dan bersih. Suasana di kamp adalah bagian terbaik meskipun. Ada area umum, di mana kolam renang adalah, di mana anda bertemu dengan semua lain surfers dan juga instruktur. Semua orang adalah super santai dan ramah, anda berakhir menggantung keluar dengan semua orang, kedua tamu dan staf! Manajer selalu mengendalikan semuanya baik-baik saja dan membantu anda dengan apa pun yang mungkin anda butuhkan, dari pemesanan taksi, orient anda dengan harga lokal, bepergian rekomendasi, dll.  Akhirnya, makanan! Itu benar-benar baik. Dimasak dengan hati-hati dan menggunakan produk lokal, yang diantar setiap hari sebelum sarapan, baru dibawa dari pasar; )",4
58, Kima Surf Camp,"Kami sangat terkejut oleh nuansa perkemahan. Ini adalah tidak hanya tentang berselancar tetapi untuk berbagi seluruh pengalaman dengan orang-orang di sana, para pemula, lebih muka surfers, instruktur yang... semua bersama-sama menikmati kedua ombak dan indah bali. Juga, makanan yang disajikan di camp sangat hebat, dan kami benar-benar mencoba segala sesuatu di sekitar; ) Yang harus.",5
59, Kima Surf Camp,"Mengagumkan! Itu saja! Saya sangat menikmati tinggal di perkemahan. Staf super membantu dan makanan adalah benar-benar benar-benar baik, saya telah makan sepanjang waktu di camp :-) orgenized semuanya sangat baik, dari penjemputan di bandara ke surfsessions ke drop off di bandara. Saya menikmati setiap detik, terima kasih untuk waktu yang menyenangkan di bali. Berharap untuk kembali lagi segera! Menggantung longgar",5
60, Kima Surf Camp,"surfcamp sangat bagus, terorganisasi dengan baik dan pengaturan yang bagus. Banyak orang jerman, austria dan swiss. Perkemahan adalah di tengah-tengah seminyak, jadi juga kesempatan untuk pesta di malam hari :-)  5 menit berjalan ke pantai.  Semua dalam semua. Saya sangat puas!",5
61, Kima Surf Camp,"Tinggal di sini selama satu malam di ujung 3 minggu perjalanan dan berharap kami telah menghabiskan lebih banyak waktu di penginapan ini dan daerah. Terletak di dekat pantai dan tempat-tempat lain seperti spa ini adalah ideal untuk kami. Indah, staf yang ramah di penerimaan dan di restoran. Akan merekomendasikan makanannya! ",5
62, Kima Surf Camp,"Saya hanya datang kembali dari 3 minggu di bali di mana saya menginap satu minggu di green room di seminyak sebagai bagian dari sebuah kamp selancar. Meskipun saya tidak seperti seminyak, saya senang saya menginap di green room. Tempat yang indah, sangat tenang dan dingin di mana semua orang bergaul oleh kolam dan mengobrol sambil mendengarkan musik besar. Staf, tanpa pengecualian, sangat baik dan ramah. Pelayanannya selalu dilakukan dengan senyum baik orang-orang di meja depan atau staf di restoran atau manajer lars dan pemandu selancar. Makanan sangat baik (mereka juga membuat jus yang sangat baik!). Mereka pergi ke panjang besar untuk memastikan masa menginap anda nyaman. Saya juga menyukai kenyataan bahwa pemandu selancar hang out di sana sepanjang waktu dan berbaur dengan…",4
63, Kima Surf Camp,"Kami tinggal di ruang hijau untuk seminggu tetapi berharap kami telah memesan untuk lebih lama. Kami tinggal di salah satu kamar ganda yang standar tapi nyaman dan sangat bersih. Tur surfing benar-benar baik teratur, cocok untuk semua tingkatan, dan instruksi yang sangat baik di seluruh. Stafnya membuat suasana benar-benar menyambut dan sangat ramah tempat untuk tinggal. Makanan (terutama sarapan) adalah benar-benar lezat dan nilai yang besar. itu adalah berjalan kaki singkat ke pantai dan tidak terlalu jauh ke seminyak/kuta tapi cukup jauh untuk menjadi sedikit lebih tenang yang adalah apa yang kami inginkan - Saya akan pasti memesan di sini lagi!",5
64, Kima Surf Camp,"Saya menginap di sana selama 10 hari dan itu sangat menyenangkan! Tentu saja ini juga tergantung pada orang-orang yang tinggal di sana tapi staf sangat bagus, mereka melakukan segala yang mereka bisa untuk membantu anda. Kamar tersebut dibersihkan setiap hari dan itu selalu bersih di sekitar kolam renang. Saya sangat menyukai bagaimana kami semua tinggal bersama-sama di daerah di sekitar kolam renang, mendengarkan musik dan hanya dingin di matahari. Sangat menyenangkan! ",4
65, Kima Surf Camp,"Tinggal selama seminggu di sini. Benar-benar menyukainya. Kamarnya bagus. Makanannya enak. Staf dan sangat bagus. Saya akan tinggal lebih lama jika hotel tidak sepenuhnya dipesan. Yang paling penting, suasana, dan orang-orang sangat luar biasa. ",5
66, Kima Surf Camp,"Fab seminggu panjang perjalanan di green room dengan pacar saya, dan diperlakukan oleh beberapa pemandu selancar besar (terutama staf bernama putu!) ke tempat surfing yang berbeda setiap hari. Pengalaman hebat yang akan diulang. Akomodasi murah yang bagus, getaran yang ramah dan menu lezat di restoran di dalam hotel. Jika anda pergi, memperlakukan diri anda untuk makanan di sarung dan potato head, dan pastikan anda melakukan perjalanan gunung berapi (tetapi anda akan ingin melakukan ini sekali!). Cheers untuk lars dan tim nya untuk minggu yang hebat...",5
67, Kima Surf Camp,"Saya menghabiskan 3 minggu di kima Surfari 2014 di bulan juni dan sangat menikmatinya. Staf adalah sangat ramah dan membantu dan kamar sangat bagus dan bersih! Saya menghabiskan 4 malam di 4 tidur (dengan ac) sebelum pindah ke 2 tempat tidur-kamar (dengan tidak ada ac/kipas angin) dan saya harus mengatakan bahwa keduanya sangat bagus...  Semua surfguides ini sangat menyenangkan untuk berada di sekitar dan getaran secara keseluruhan awesome :) Banyak menyenangkan orang-orang kebanyakan dari swiss dan jerman tetapi juga beberapa belanda, inggris dan australia orang-orang hanya memiliki waktu yang baik. Berharap untuk pergi kembali ke sana musim panas mendatang! ",5
68, Kima Surf Camp,"Surf camp adalah sangat dekat ke pantai, jalan-jalan belanja dan juga dekat dengan pilihan restoran yang bagus. The suasana di kamp adalah luar biasa. Anda mendapatkan terhubung dengan banyak pelancong, peselancar dan juga dengan hal-hal dari perkemahan. Perkemahan restoran sendiri adalah sangat baik dan murah dan sarapan adalah yang terbaik yang saya miliki di seluruh perjalanan bali saya. Saya dapat sangat merekomendasikan the green kamar sebagai surf camp di bali dan dapat menjamin bahwa anda akan memiliki waktu yang menakjubkan, sementara anda tinggal di ruang hijau.",5
69, Kima Surf Camp,"Kami tinggal di green room untuk 2 minggu dan itu adalah total mengagumkan. Staffnya sangat ramah, kamarnya dibersihkan setiap hari, makanan yang luar biasa (coba kelapa risotto dan mete ayam!) orang-orang yang kami temui ada benar-benar di bali surf-hidup. Melihat anda tahun depan green kamar! ",5
70, Kima Surf Camp,"Kami tinggal di ruang hijau seminyak untuk hanya 5 hari, tetapi memiliki waktu yang mengagumkan di sana! Staf adalah benar-benar ramah dan membantu anda dengan semua yang anda butuhkan. Area kolam renang dengan restoran, foosball, soundsystem dll. sangat bagus dan itu adalah tempat pertemuan bagi semua orang. Suasana, dan orang-orang di sana sangat bagus dan ini sempurna untuk pelancong muda yang ingin berselancar di bali. (Aku hanya selesai 3 hari ripcurl surfschool karena saya tidak memiliki lebih banyak waktu di sana, tapi saya sudah mendengar dari semua orang bahwa panduan perjalanan dan benar-benar bagus)",5
71, Kima Surf Camp,"organiced sempurna kamar yang bersih staf sangat ramah dan membantu (membantu saya dengan memposting, obat dan pertanyaan lain) Surfguides sangat lucu tamu satu keluarga besar saya pasti akan kembali! ",5
72, Kima Surf Camp,"Saya memiliki waktu yang menyenangkan di green room dan kima surf camp, dan tidak sabar untuk kembali lagi! Akomodasi yang bagus, kamar dibersihkan setiap hari, dan begitu juga tempat tidur seprai dan handuk. Staf sangat ramah dan membantu dengan setiap sedikit masalah, jika ada masalah atau pertanyaan muncul. Makanan adalah benar-benar baik, ada berbagai pilihan harga yang baik. The surfguiding besar, panduan yang mengagumkan dan banyak menyenangkan untuk hang out dengan! Saya datang kembali ke perkemahan selama liburan saya dan travelings, dan rasanya seperti datang rumah! Tahun depan saya akan kembali lagi! :) ",4
73, Kima Surf Camp,"Saya menginap di green kamar untuk 10 hari dan itu benar-benar tempat yang bagus, terutama staf adalah benar-benar ramah dan membantu. Kebanyakan saya menikmati kaki yang baik. Penting untuk mengetahui adalah jika anda ingin memiliki nyata tenang anda harus meminta sebuah kamar di belakang.   jadi: Menikmatinya!   Jürgen",5
