,hotel,review,stars
44, Man's Cottages & Spa,"Saya telah memesan 2 suite de luxe senang untuk 8 orang (4 orang dewasa dan 4 anak anak) dari 13th untuk juli 18th.  Resor itu sendiri adalah tidak ada yang didorong oleh perusahaan besar, tetapi kecil dengan beberapa bagus dan kamar yang besar, semuanya adalah benar-benar bersih, taman yang bagus dan kolam renang adalah benar.  Ada tidak ada akses langsung ke pantai, 5 menit berjalan kaki yang, dan jalan dapat berbahaya seperti ada banyak kemacetan lalu lintas. Sanggraloka ini terletak dekat dengan masjid. Ketika kami berada di sana di akhir ramadhan, muazin menghabiskan malam besar yang melakukan di sepanjang malam dan itu telah sulit bagi kita untuk tidur.  Pemilik melakukan mereka yang terbaik dan benar-benar baik dan bermanfaat, tapi kadang-kadang ketika mereka pergi,…",4
45, Man's Cottages & Spa,"Tempat ini adalah tempat yang hebat! Bagus sekali! Yang terbaik adalah taman didekorasi dengan baik, itu cocok hanya tentang sempurna al sembabat dari bunga dan pepohonan. Lalu ada staf yang melayani dengan senyum besar! Mereka melakukan segalanya untuk membuat anda merasa sangat mewah! Kamar-kamarnya juga sangat romantis dengan mata untuk setiap detail kecil. Satu-satunya hal yang kecil hanya hanya anda harus tahu adalah bahwa ada sebuah masjid di dekatnya, kadang-kadang anda akan mendengar para pembayar. Tapi sekali lagi, anda berada di negara dan budaya yang berbeda, dan itu adalah apa yang membuat perjalanan semua berharrga!",5
46, Man's Cottages & Spa,"Teman-teman saya dan saya tinggal di sini diatur untuk kami 3 hari menyelam di pulau menjangan. Apa yang bisa saya katakan tentang tempat ini sebagai per lain review, ya 1 - anda akan sangat merasa disambut oleh staf dan pemilik; 2 - peringkat sangat tinggi di harga sangat rendah; 3 - nyaman dan banyak-banyak lebih untuk mengharapkan.  Tempat ini sangat nyaman dan staf sangat ramah. Mereka akan memperlakukan anda seperti anda adalah raja atau ratu (bagi kita). Kami berada di sana awal tahun ini pada bulan april, saat musim tidak hanya tentang untuk sibuk. jadi, beruntung bagi kami, tempat itu tidak penuh, namun... seperti yang saya ingat, pada waktu itu, kami hanya menebak. Dari saat kami tiba sampai kami meninggalkan man's cottage, ada tidak satu hal saya ingin mengeluh.  Saya…",4
47, Man's Cottages & Spa,"Ini adalah pertama kalinya kami telah memberikan peringkat bintang lima dan hotel ini benar-benar nikmat. Jika anda membuat adalah sejauh itu masalah di pemuteran bali kuno. Tidak ada kerumunan dan tidak ada vendor mendesakkannya. Terletak di jalan utama yang harus beribut, tetapi cottage yang terletak turun jalan beton segar panjang dan anda berakhir di sebuah oasis tropis. Kolam renang yang menjadi pusat dengan cottages yang berada di sekitarnya. Semua dari mereka luas dan baru. Terdapat dua restoran dengan pertama oleh jalan dan yang kedua (terbuka di nite) dekat pondok. Kolam renang yang sangat bagus. Hotel ini benar-benar baru. Duduk-duduk di beranda anda anda akan merasa seperti di sebuah villa pribadi dengan harga yang jauh lebih mahal hotel.   Yang buruk. Hotel ini tidak…",5
48, Man's Cottages & Spa,"Apa tempat yang luar biasa. Hal ini tidak begitu banyak homestay merupakan sebuah sanggraloka kecil! Dengan 2 restoran, sebuah bar taman, taman yang menawan dan kolam renang itu benar-benar adalah kredit untuk herman dan mia, pemilik. Pada saat kedatangan kami memiliki sedikit masalah dengan pekerja di sekitarnya yang mampu melihat langsung ke kamar mandi kami namun mia magun yang langsung dengan meng-upgrade kita untuk kamar superior. Bagus!  Staf sangat ramah, terutama harry, yang tampaknya di mana-mana dan begitu bersemangat untuk membantu! Jika kita punya kritik akan bahwa atmosfer sedikit formal bagi kita - Saya tekankan bahwa ini adalah hanya hal pribadi, dari sudut pandang kami, kami benar-benar lebih suka sangat santai, bergaya rumah jenis akomodasi dan itu adalah jelas…",5
49, Man's Cottages & Spa,"Kami tinggal di pondok dan spa untuk pria 18 malam. Fasilitas, kebun dan kolam renang sangat baik terus dan mengundang anda untuk menyambalewakan. Hotel ini sangat bersih dan luas dengan kamar mandi luar ruangan yang indah. Staf adalah sangat ramah dan membantu. Anda merasa langsung selamat datang sebagai teman. Ini adalah hidangan yang sangat direkomendasikan di dua restoran.",5
50, Man's Cottages & Spa,Mencintai tempat ini... Herman dan tuan rumah dan istrinya adalah luar biasa baik dan ramah... Bagian terbaik tentang tempat ini adalah makanan... Makanan khas bali - lezat dan sangat baik disajikan... Pergi ke sana dengan keluarga dan benar-benar menikmati!,4
51, Man's Cottages & Spa,"Hotel terbaik yang pernah kami rasakan di indonesia! Mutlak surga staf sangat ramah, hingga spa adalah fantastis, dan makanan adalah lebih baik daripada banyak 5 - bintang restoran di inggris (mencoba ayam kari yang anda tidak akan kecewa) ruangan itu indah dan sentuhan-sentuhan kecil seperti meletakkan bunga di tempat tidur dan setiap malam hanya mendupai kemewahan murni. Ruangan ini sangat bersih, dan staf sangat membantu. Saya akan merekomendasikan ini kepada siapa pun dan akan retuning dengan keluarga saya tahun depan! Kami berada sangat sedih untuk meninggalkan, menakjubkan nilai untuk uang dan standar ",5
52, Man's Cottages & Spa,"Kami telah tinggal 5 malam di man's untuk menjelajahi bali utara. Ini telah menjadi pengalaman herman dan istrinya memiliki tim yang bekerja di sini yang sangat profesional. Semua orang sangat membantu dan pergi keluar dari jalan mereka untuk melayani mereka yang meyakinkan. Herman diatur perjalanan yang baik dan pengemudi mengandakkan ke kuil buddha dan mata air panas suci. Kamar tidur, sederhana dan indah dibersihkan setiap hari, sangat nyaman tempat tidur. Sarapannya bagus dan termasuk dalam harga. Dua restoran, kedua di depan dan baines tradisional di taman di belakang. Kamar besar seperti karya seni.",5
53, Man's Cottages & Spa,"7 lokasi yang kami tinggal di di bali, man's adalah yang terbaik. Pemandangan, makanan, semua staf yang terbaik. Makan di restoran dan indonesia yang masih arak tempuhan di bar. Mereka adalah benar-benar luar biasa dan benar-benar membuat kami merasa istimewa. Tinggal di sini. Anda tidak akan menyesal! ",5
54, Man's Cottages & Spa,"Saya menginap 4 malam di man's cottages & spa selama perjalanan saya ke bali utara. Kamarnya bagus dan bersih. Sarapan sangat bagus. Tidak begitu jauh dari tempat menyelam terkenal seperti puri jati, pemuteran, menjangan & secret bay.  Spa layanan besar, terutama setelah sangat melelahkan kegiatan selama perjalanan.",4
55, Man's Cottages & Spa,"Man's cottages & spa adalah kami tinggal terbaik di bali. Telah di sini selama 3 malam. Kamarnya bagus dan bersih, ac bekerja dengan sempurna, tempat tidurnya bagus. Pelayanannya sangat sempurna. Pemilik dan staf berbicara bahasa inggris baik dan telah besar saran tentang apa yang harus dilakukan di barat laut bali. Menyelam sangat menakjubkan, taman nasional sangat mengesankan.  Makanan di restoran sangat baik juga, menu besar. Saya akan pasti tinggal di sini lagi.",5
56, Man's Cottages & Spa,Tempat ini adalah pasti salah satu yang paling menakjubkan tempat kami tinggal di bali. Kami memiliki sambutan yang sangat hangat dan staf sangat ramah dan membantu. Jangan lupa untuk pergi scuba menyelam di pulau menjangan. Itu adalah salah satu hal yang paling mengesankan saya telah melakukan jauh. Pasti tempat yang sempurna untuk tinggal di bali!,5
57, Man's Cottages & Spa,"Menginap di hermans selama tiga malam dan itu sangat menakjubkan! Tinggal adalah sangat baik, tempat tidur yang baik makanan lezat dan perjalanan yang kami memesan di hermans yang sangat baik dan tidak mahal sama sekali! Mereka juga sangat membantu dengan semua hal-hal dan hal yang kami butuhkan, itu adalah def rumah yang jauh dari rumah dan akan def pergi kembali satu hari!",5
58, Man's Cottages & Spa,Mia & herman hanya besar - ramah & membantu. Mereka beres perjalanan bagi kita dan selalu tersedia untuk membantu kami dengan apa pun dan segala sesuatu. Sarapan yang baik dan restoran disajikan makanan kelas tinggi. Bungalow kami (101) adalah benar-benar bagus dan hanya beberapa meter dari kolam renang di taman yang indah. Itu cocok kita dengan sempurna.  Jangan lewatkan hot springs dan biara budha dekat banjar.,5
59, Man's Cottages & Spa,"Mencintai layanan dan tempat ini adalah karena dekat ke pantai dan memiliki semua yang anda butuhkan di depan pintu anda. Makanannya luar biasa, dan jika anda ingin bersantai di sekitar kolam itu tenang dan santai dan mudah untuk beristirahat hanya duduk di sekitar.",5
60, Man's Cottages & Spa,"Tempat ini adalah benar-benar menakjubkan! Herman dan staf yang sangat akomodatif dan saya tidak akan berpikir dua kali tentang memilih tempat ini untuk tinggal lagi di masa depan. Semua kamar sangat luar biasa, kolam renangnya fantastis dan sarapan yang disediakan sangat mengagumkan! Terima kasih untuk memiliki kita herman! WC",5
61, Man's Cottages & Spa,"Jika anda sedang mencari tempat untuk menginap, baik untuk beristirahat kaki anda ke atas, atau waktu romantis, bahkan menjatuhkan di dalam perjalanan ke tempat lain, anda tidak bisa mendapatkan tempat yang lebih baik! Ini adalah tempat yang luar biasa dengan nuansa seperti di rumah. Karyawan, pemilik dan bahkan ada tamu jadi menyenangkan dan membuat setiap saat layak waktu anda. Saya sangat merekomendasikan tinggal di sini, makanan yang sensasional dan menyediakan berbagai pilihan untuk mengakomodasi kebutuhan pribadi atau untuk memberikan makanan yang lebih budaya. Saya pasti akan kembali di sini jika saya menemukan perjalanan saya saya kembali ke pemuteran! ",5
62, Man's Cottages & Spa,"Akomodasi di sini adalah menakjubkan semua kamar yang fantastis mereka yang bersih dan terawat dengan baik, pancuran mandi luar ruangan adalah sentuhan yang bagus juga. Kami tinggal di sini selama beberapa hari dan mencintai setiap satu. Semua staf yang indah dan sangat membantu dengan segala sesuatu termasuk hal-hal di luar akomodasi. Saya pasti akan merekomendasikan untuk orang yang mencari tempat di area ini! ",5
63, Man's Cottages & Spa,"Kontra:  Masjid hanya beberapa pintu bawah. Ini adalah con besar. Ini membangunkan kami di 4:30  Kasar lembar Tidak ada air panas, dan tidak ada pancuran membesuntukan, lebih seperti sebuah rumah membesuntukan di kamar mandi kamar mandi luar ruangan, pada awalnya saya pikir ini akan menjadi romantis, tetapi kebanyakan saya menghindari serangga Saya merasa tirai bisa memberikan lebih banyak privasi  Pro: Indah, baik staf Kolam renang yang bagus Tidak terlalu jauh dari pantai Toilet barat tempat tidur besar baik ukuran kamar wifi gratis jus dengan sarapan sangat baik  Juga: the reef seen hotel/toko menyelam adalah beberapa pintu di jalan (atau pantai tergantung pada bagaimana anda berjalan). Proyek penyu di reef seen adalah layak melihat. Biayanya 25 000IDR/orang untuk melihat…",3
64, Man's Cottages & Spa,"Saya menginap di sini selama 6 malam yang agak terlalu lama untuk pemuteran. Saya suka baik terus taman, pemandangan gunung dari kolam renang, yang saya menerima upgrade kamar untuk tinggal begitu lama, sarapan yang melimpah, baik standar layanan oleh staf (terutama ketika mereka menyalakan obat nyamuk di kamar anda di malam hari), keramahan pemilik, pijat dan beberapa makan malam makanan misalnya. barakuda dengan chilli dan santan. Apa yang saya merasa dapat ditingkatkan adalah sarapan. Saya melihat bahwa setiap hari sesuatu yang hilang dari sarapan saya misalnya. tidak ada keju satu hari, tidak ada croissant hari berikutnya dll. Setelah 3 hari. Saya mengatakan kepada pelayan dan dia meminta maaf dan membawa saya item. Saya juga berpikir bahwa situs web mereka tidak sepenuhnya…",5
65, Man's Cottages & Spa,"Saya hanya memiliki 2 malam yang menakjubkan yang tinggal di sebuah bungalow di man's homestay di permuteran, yang adalah jauh terlalu pendek! Lantainya indah, staf selalu tersenyum dan sangat membantu, makanannya hebat, dan kamar saya fantastis. Mereka telah benar-benar berpikir melalui semua rincian dan pergi mil ekstra untuk membuat tempat ini khusus dan damai. Jangan takut oleh istilah ""homestay"" - Man's begitu banyak lagi! Itu agak merasa butik, tapi dengan rasa lokal. Shower/kamar mandi luar ruangan yang dikelilingi bunga itu hebat, dan dekorasi di kamar agak bali.  Hotel juga membantu saya mengatur hari yang fantastis dari permuteran diving dengan dive center, di mana saya memiliki pemandu menyelam pribadi saya sendiri dan membayar 30% kurang dari apa yang saya dikutip…",5
66, Man's Cottages & Spa,"Kami menghabiskan 4 malam di homestay pria dan itu adalah salah satu favorit kami akomodasi di bali! Tamannya indah, kamarnya benar-benar bersih, dan staf adalah indah! Kolam pooll adalah benar-benar menyenangkan dan makanan adalah benar-benar baik; Pasti kita akan datang kembali untuk perjalanan kami berikutnya di bali! Hanya hal adalah jalan utama yang melewati hanya di depan meja depan, tetapi anda dapat makan di taman dan kamarnya cukup jauh untuk tidak diganggu di semua",5
67, Man's Cottages & Spa,"Tinggal di sini dengan keluarga saya selama beberapa hari di juli 2014 dan secara keseluruhan kami benar-benar menikmatinya. Saat anda memasuki homestay anda disambut dengan restoran dan area resepsionis. Untuk mendapatkan ke kamar dan vila, anda juga tidak sedikit yang diarsir jalur menuju taman yang indah dan kolam renang yang luas di belakang. Di sini anda akan menemukan serangkaian bungalo jerami yang cerah sekitar, layak ukuran kolam renang lengkap dengan air-mata patung dan luar ruangan tempat duduk.  Kami menginap di bungalow di kembali dan mencintai mereka. Masing-masing memiliki daerah dek teduh di depan dengan kursi yang sempurna untuk membaca dan bersantai di. Di dalam, anda bertemu dengan besar ruang tengah pemukiman double atau twin serta tempat tidur tunggal meja…",5
68, Man's Cottages & Spa,"Saya dan pacar saya tinggal di sini di akhir agustus, kami memutuskan untuk keluar dari seminyak dan mengunjungi bagian yang berbeda dari pulau ini, karena kami memiliki sudah dibayar untuk akomodasi di seminyak kami mencari tempat untuk menginap yang tidak pergi untuk istirahat anggaran kami. Setelah jam baik dari apa yang kami datang di tempat ini dan kami sangat senang kami lakukan.  Kami tiba pertengahan sore untuk resepsionis yang hangat dan minuman selamat datang, check-in lancar dan kami disarankan tentang semua aktivitas di daerah ini. Kami ditunjukkan kamar kami turun panjang jalan taman yang dikemas dengan indah bunga pink. Ruangan itu indah, mereka bahkan memiliki kelopak bunga di tempat tidur dan nama kami ditulis tropis leaf yang adalah sentuhan yang bagus.  Tidak…",5
69, Man's Cottages & Spa,"Dalam satu kata: menginaplah di sini! (Ok, itu 2 kata: )) Kamar yang sangat baik, makanan besar dan staf yang sangat baik! Pastikan untuk memesan perjalanan menyelamnya dan untuk memesan ruang atas untuk melihat bulan purnama di atas gunung yang! Juga besar untuk perjalanan menyelam. Strategis dekat restoran dan toko-toko. Kolam renang yang bagus juga. ",5
70, Man's Cottages & Spa,Positif poin: 1) lokasi yang tidak jauh dari pantai dan tempat snorkeling yang bagus  2) kamar yang bersih 3) kamar terletak jauh dari sibuk dan bising road 4) kolam renang yang indah dan taman 5) makanan yang baik di restoran 6) staf yang ramah  Yang kurang positif: 1) hotel terletak dekat ke beberapa masjid dan kebisingan shalat (lebih dari pengeras suara!) mulai pukul 5 ayam di pagi hari dan juga memori yang panjang di malam hari. Ini membuatnya sangat sulit untuk bersantai atau tidur. 2) restoran adalah terletak di sebelah jalan berisik. Pemilik adalah namun bangunan restoran jauh dari hebat. 3) hanya ada air dingin di kamar mandi (mandi air panas sehingga tidak mungkin) 4) handuk di kamar mandi tidak diganti kecuali satu yang secara eksplisit meminta untuk itu. the buang…,3
71, Man's Cottages & Spa,"Indah bungalows terletak di taman tropis yang indah! Awalnya kami diberi kamar yang sangat besar di garden oleh itu sendiri, cukup jauh dari orang lain dan kolam renang. Kami diberitahu bahwa kamar lain sudah penuh, tapi saya sebenarnya telah membuat pemesanan saya bulan yang lalu, dan itu pasti bukan terakhir kamar. Kamar penuh dengan nyamuk, tapi kami meminta untuk dipindahkan, dan diberi banyak ruang yang lebih baik keesokan harinya.  Kamar baru indah, hanya ukuran yang tepat, dengan indah direnovasi kamar mandi dan sangat dekat ke kolam renang. Itu sangat bersih dan sarapan lebih dari cukup. Kritik kecil, anda harus berjalan melalui restoran untuk sampai ke kamar anda dan kami merasa sedikit bersalah, karena kami tidak biasanya makan di mana kami tidur karena kami ingin…",4
72, Man's Cottages & Spa,"Kami memesan di sebuah bungalow selama seminggu di mans homestay. Kami pergi ke sana untuk bulan madu kami dan kami ingin tempat pribadi yang bagus dengan gaya tradisional bali. Kami benar-benar menyukainya. Tempat itu indah, kamar bersih, kamar mandi luar ruangan yang indah hanya membuat kami merasa seperti di surga. staf hotel membersihkan kamar setiap hari, kami tidak pernah mendapat terganggu karena mereka pergi untuk membersihkan kamar kami ketika mereka melihat kami pergi untuk sarapan atau keluar. mereka benar-benar membayar perhatian ke detail-detail kecil yang kami sangat menghargai. kami memiliki sarapan dan makan malam setiap hari di homestay dan setiap kali itu hanya lezat. kami memesan beberapa perjalanan dengan hotel terlalu, organisasi ini adalah sempurna, mereka…",5
73, Man's Cottages & Spa,"Saat tiba di kami dibuat selamat datang yang mans homestay segera. Lokasi di jalan utama sepanjang pantai utara dari lovina. Ada beberapa hotel dan indekos untuk memilih dari tetapi kami telah memesan sebelum kedatangan. Kamar kami sangat bersih, disajikan dengan baik dan nyaman. Untuk pertama kalinya, semuanya bekerja dan bahkan ada tempat untuk menggantung pakaian kami. Kami host membuat dirinya tersedia untuk setiap pertanyaan dan sangat membantu.  Ada renang indah dengan shower, taman yang indah, sebuah restoran yang indah, walaupun sedikit lebih mahal daripada lain warung lokal dan spa. Kami mempunyai pemandangan yang indah dari taman dan pegunungan. Pantai adalah pendek sepuluh menit berjalan kaki, dengan beberapa toko-toko dan berjalan ke atas bukit. Ada layanan bus…",5
74, Man's Cottages & Spa,"Laki-laki Homestay adalah tempat terbaik yang kami tinggal di Bali. Segala sesuatu baru, kami sangat menikmati kamar mandi luar. Mengambil mandi di bawah langit berbintang sempurna bersih setelah lama mengemudi hanya menakjubkan. Bungalow memiliki tempat tidur ukuran Raja dan kami menemukan pengaturan yang bagus dengan bunga-bunga segar di atasnya. Kami memiliki tidur yang sempurna di seprai segar, bersih dan AC diam dihidupkan. Pemilik Herman dan Mia sangat ramah dan membantu, mereka direkomendasikan kami restoran yang bagus untuk mengambil makan malam. Hari berikutnya di teras kami memiliki sarapan dengan pisang pancake (lezat!), susu dan buah-buahan segar yang mengagumi pegunungan dan garden in front of us. Herman diatur menyelam di Menjangan island, ia bahkan mendapat diskon…",5
75, Man's Cottages & Spa,"Saya mengunjungi Homestay laki-laki akhir pekan ini. Ini adalah cukup lama berjalan dari jalan ke jalan, untuk taman besar dan bagus dengan dua Bungalow asli dan yang baru. Luar kamar mandi besar. air panas, yang homestay biasanya tinggal di Pemuteran tidak memiliki. Semua sangat bersih dan baru. Meskipun saya menemukan kamar tidur sedikit kecil, terutama jika ada 2 orang.  Tidak yakin mengapa hal itu disebut homestay benar-benar, karena tidak dekat akomodasi keluarga, meskipun Anda lewat di jalan. Akan menjadi indah jika ada trek ke pantai dari sana, tapi Anda harus pergi ke jalan dan kembali lagi.  Pemuteran tidak daerah yang murah, dan bungalo adalah 350 k malam, low season, yang cukup sedikit lebih daripada umum Bali 'homestay' harga. Mia mengatakan itu adalah 500 k tinggi…",4
76, Man's Cottages & Spa,"Kami tinggal 5 malam di Pemuteran yang indah dan Guesthouse pria ramah dengan ceria dan lucu Indonesia pemilik Herman dan Mia. Mereka memiliki 2 bungalow yang indah, baru. Bungalow yang sangat pribadi, di taman yang cantik. Mereka berencana untuk membangun sebuah bungalow ketiga tahun ini. Bungalo memiliki tempat tidur ukuran Raja fantastis dengan segar linnen dan bantal mewah dan mandi luar ruangan besar dengan mandi dengan panas dan air dingin. Ada juga AC. Dekorasi bungalo itu benar-benar indah. Mereka yang begitu baik: kami memiliki bunga di kamar kami setiap hari! Anda memiliki teras pribadi besar di mana Anda dapat memiliki Anda sarapan disajikan. Anda harus mencoba pisang pancake!! Mereka dapat mengatur perjalanan menyelam dan snorkeling di Palau Menjangan. Herman sendiri…",5
