,hotel,review,stars
0, Man's Cottages & Spa,Wisma yang sangat baik dengan banyak kegiatan di sekitar. Pemiliknya sangat baik dan dia benar-benar ingin menjaga para pengunjung. Makanan sempurna dan juga koktail pondok mans! ! ! Kami mengatur perjalanan ke pulau kecil bersamanya dan semuanya sempurna bahkan lebih dari yang diharapkan! ! ! Kami pasti akan kembali lagi! !,5
1, Man's Cottages & Spa,"Senang kami tinggal di sini. Staf adalah luar biasa, sangat ramah dan sangat membantu. Fasilitasnya bagus dan bersih dengan banyak restoran dan kolam renang. Akan sangat merekomendasikan menginap di Man's Cottage and Spa. Terima kasih sudah menerima kami?",5
2, Man's Cottages & Spa,"Setelah 2016 kami kembali tinggal di Herman dan Miya selama sepuluh hari dan itu luar biasa lagi: resor ini sangat tenang, terawat dengan baik dan hijau yang indah. Anda merasa seperti berada di surga. Kamar kami modern & rapi dan dibersihkan setiap hari. Kami selalu sangat senang dengan figur handuk yang kreatif. Semuanya sempurna untuk liburan super santai: makanan (internasional atau Bali) setiap kali lezat, staf selalu dengan senyum ramah di wajah dan khawatir tentang kesejahteraan kita! Apakah menyelam (terima kasih kepada Firman, pemandu hebat kami), kelas memasak atau tur di luar - tidak ada lagi yang diinginkan. Malam hari dengan musik dan tarian sangat menakjubkan. Semuanya diatur dengan sempurna oleh Herman. Kami hanya dapat mengatakan: Terima kasih untuk semua dan…",5
3, Man's Cottages & Spa,"Itu adalah tempat yang nyaman dan menyenangkan. Kami berada di sana pada waktu sibuk dan kamarnya bagus meskipun nyamuknya terlalu banyak. Herman, pemilik sangat akomodatif setiap kali kami memiliki umpan balik baik itu positif atau negatif. Sayangnya kamar mandi tidak panas (hanya sekarang dan kemudian) dan untuk makan malam restoran tidak memiliki banyak stok dari apa yang ada di menu, jadi kami melewatkannya setelah 1 jalan coba. Sarapan sederhana dan enak dengan jus segar. Internet berfungsi dengan baik tetapi tv tidak begitu banyak ketika hujan. (Kemudian lagi kami tidak ada di sana untuk menonton tv). Perjalanan menyelam dan perjalanan menonton lumba-lumba yang diselenggarakan oleh hotel bernilai uang dan kami memiliki staf yang sangat baik yang melayani kami.",4
4, Man's Cottages & Spa,"Saya dan sahabat saya tinggal di sini selama 3 hari untuk melihat barat Bali, hotel jika sangat bagus dan pribadi sangat ramah!  Makanannya juga enak, makanan internasional atau makanan Bali!",5
5, Man's Cottages & Spa,Cottage dan restoran mereka hanya dari jalan utama tetapi kamarnya di belakang di taman yang indah dan jauh dari keramaian dan hiruk pikuk. Stafnya sangat ramah dan kamar yang datang dengan kamar mandi terbuka yang sangat bersih. Kami memiliki kamar keluarga dengan double dan tempat tidur single. Sarapan sudah termasuk dalam harga dan diberikan pilihan makanan Barat dan Indonesia. Kami menikmati restoran yang menawarkan berbagai pilihan makanan. Di malam hari ada beberapa pilihan daging dengan barbekyu dan beberapa ikan tangkapan. Kolam renangnya bagus tapi hanya ada sejumlah terbatas tempat berjemur. Ketahuilah bahwa ada sebuah masjid di dekat hotel dan anda dapat mendengar panggilan muadzin dalam interval yang teratur. Resor ini juga tidak langsung di pantai. Secara…,4
6, Man's Cottages & Spa,"Hotel ini berada di jalan di sebuah taman yang indah dengan kolam renang di tengah dan restoran. Untuk mencapai pantai sekitar 10 menit berjalan kaki, 15 menit ke tempat terbaik untuk snorkeling.  Bungalow memiliki kelambu nyamuk (sangat berguna! ) dan sebuah kamar mandi di belakang, yang merupakan setengah terbuka ke langit, tetapi dengan tembok yang tinggi di sekitar tempat ini. Stafnya sangat baik dan sangat cermat dalam membersihkan kamar.  Di sana juga ada restoran di-an tempat, yang menyajikan makanan yang sangat lezat dan memiliki pilihan vegetarian dan vegan (anak-anak saya sangat menyukai Nasi Goreng Sayur) .  Beberapa hari, kami terbangun oleh matahari terbit doa panggilan dari dekat - oleh masjid, tetapi anda akan terbiasa dan kami berhasil tidur melalui sisa waktu. …",5
7, Man's Cottages & Spa,"Tempat peristirahatan yang luar biasa di sebuah desa di Indonesia yang berorientasi menyelam. Ini adalah jenis tempat, saya agak komunitas yang saya merasa milik. Mungkin saya sedikit bias karena saya seorang fanatik penyelam scuba tapi hey, ini adalah pendapat saya Pemuteran dan daerah disekitarnya. Pemiliknya adalah seorang penyelam sendiri dan dapat menampung kebutuhan saya, diberi petunjuk selama saya tinggal di seluruh Pemuteran, dan membuat saya merasa disambut dengan baik. . . banyak terima kasih Pak Herman, anda adalah yang terbaik! !",5
8, Man's Cottages & Spa,"Tempat yang bagus, makanan yang baik, kolam renang. Semuanya hanya sebagian kecil dari harga di tempat tujuan wisata seperti Ubud atau Nusa Dua. Sangat menyenangkan makanan di restoran 5 . Jika anda dari tempat-tempat yang penuh sesak membosankan adalah pilihan yang bagus untuk bersantai. Direkomendasikan",4
9, Man's Cottages & Spa,"Wah, tempat impian! Begitu banyak kualitas - anda pasti tahu anda menginap di surga tropis. Makanannya enak (cobalah mahi mahi! ), lantai yang sempurna, staf yang selalu ramah dan tersenyum. Pemiliknya datang untuk berbicara kepada kami untuk memastikan kami mengalami waktu yang baik. Penuh dengan ide-ide hebat dan saran. Ia bahkan menawarkan kami pizza dengan sambal kecap. Saya tidak pernah berpikir bahwa itu sangat luar biasa!! - Anda dapat memberitahu mereka telah bekerja keras untuk memudahkan anda untuk bersantai. Salah satu yang paling cantik yang pernah kami 'cottages' menginap di di Asia. Saya dapat memberikan sebuah 11 dari 10? ! Pergi saja - tidak mungkin akan kecewa!",5
10, Man's Cottages & Spa,Tersembunyi jauh di jalan utama - kami menemukan sedikit surga. Cottage yang sangat bersih dan sederhana tapi kami benar-benar menikmati kami tinggal di sana. Taman yang indah dan kolam renang bersih. Staf yang ramah dan membantu   Bagi mereka yang memiliki anggaran terbatas dan ingin nilai untuk uang - ini adalah,5
11, Man's Cottages & Spa,"Di mana saya harus memulai? Ini adalah benar-benar fantastis. Sekarang stafnya teman di Facebook, mereka tidak bisa berbuat lebih banyak untuk membuat kita merasa diterima dan kami tinggal lebih menyenangkan. Mereka sangat membantu melampaui kata-kata dengan tidak ada ahli waris untuk diri mereka sendiri.   Makanan yang luar biasa (berharap kami akan telah bereksperimen lebih dari menu yang luas).   Kami tinggal di ""Angel"" cottage, terletak di ujung yang lebih tenang daripada yang lain.   Taman indah, hampir merasa seperti kami tinggal di tempat ini. Kolam renang bagus dan tidak pernah terlalu sibuk. Pantai adalah 5 menit berjalan kaki.   Spa adalah sangat santai dan dengan harga yang sangat wajar.   Semua dalam semua sempurna untuk kami dan kami memiliki setiap niat untuk…",5
12, Man's Cottages & Spa,"Berencana untuk tinggal di sini 4 malam yang benar-benar indah bagian dari Bali. Kami punya kamar yang paling murah dengan air dingin pada awalnya tapi ini dengan juga air panas! Bagus!  Taman sangat terawat dengan baik dan indah, staf yang sangat ramah dan kolam renang yang sangat baik. Kamar mandinya bagus! jadi harga murah: OK!   Dua hal yang saya pribadi tidak suka tempat ukuran lokasi (agak kecil) dan banyak nyamuk di kamar kami dan mereka terus datang. Dan tidak ada internet.  jadi malam pertama kami digigit beberapa kali. Saya complainted untuk pemilik. Ia menjelaskan bahwa ia telah bulan terakhir telah ditingkatkan kamar ini (kami melihat) dan memutuskan untuk tidak berinvestasi dalam kelambu.  Hal yang menarik: dia berjanji untuk mengatur jaring. Dan dia melakukannya!…",4
13, Man's Cottages & Spa,"Indah dan tenang serine properti. Staf sangat bagus dan makanan yang disiapkan oleh koki pribadi yang cemerlang. Kamar di bungalow dan sangat cukup dan tempat tidur yang terlalu nyaman. Dekat dengan terbaik memancing, menyelam dan snorkeling. Benar-benar berharga dan tempat. Semuanya adalah dekat. Menawarkan sekolah memasak, spa dan pijat, menyelam, memancing dan wisata trekking. Kolam renang yang dingin dan bar koktail yang luar biasa. Manjakanlah diri Anda sendiri, memesan di sini! ",5
14, Man's Cottages & Spa,"Secara keseluruhan kami tinggal dua malam adalah damai dan kita mencintai kolam renang - terima kasih kepada staf yang tampak setelah kami. Ada beberapa hal yang perlu ditingkatkan di sini meskipun di masa depan untuk membuat ini hotel berkualitas tinggi.   Positif:   - staf yang sangat ramah  - taman Indah dengan capung, kelelawar dan katak yang mengunjungi setiap sekarang dan kemudian  - kolam renang yang kami punya untuk diri kita sendiri semua tiga hari kami tinggal seperti itu tampaknya rendah musim (pertengahan April)   - damai dan tenang, set kembali dari jalan  - bunga yang di kamar dan minuman selamat datang yang sangat baik  - di luar kamar mandi dan toilet bersih dan bagus dan terang dan itu cukup panas sehingga tidak masalah untuk tidak memiliki air panas  Poin untuk…",3
15, Man's Cottages & Spa,"Menginap di Adi Assri Resor, kami makan malam di restoran "" Manusia "" beberapa 100 meter turun ke jalan utama. Tidak mudah untuk menemukan tetapi sekali anda berada di dalamnya terlihat sangat bagus. Namun kekurangan makanan rasa dan aroma dan tidak seperti yang diharapkan. Staf sangat bagus (seperti hampir di mana-mana di Bali! ).",3
16, Man's Cottages & Spa,"Kami memiliki waktu terbaik di Pemuteran di pondok orang. Terima kasih untuk sambutan yang hangat dan ramah. Staf selalu sangat penuh perhatian, sopan dan ramah. Sangat menyenangkan bertemu dengan Anda semua!  Akomodasi terbaik - yang terbaik. Terutama kamar mandi di luar kamar. (jadi Anda mendengar tokek dan burung sementara Mandi.)  Terakhir tetapi tidak paling tidak kami harus memuji makanan yang disajikan di pondok orang. Mereka menawarkan banyak hidangan yang beragam dan enak. Anda dapat memilih antara makanan Bali dan Eropa. Dan kami harus mengakui bahwa pria ini Carbonara rasanya seperti versi Italia ini.  Terima kasih untuk segalanya dan sampai waktu berikutnya!",5
17, Man's Cottages & Spa,Kami menikmati makanan yang baik dan baik diatur dengan banyak pilihan bagi saya sebagai seorang vegetarian.  Ini adalah jauh dari kebisingan jalan utama  Staf sangat baik dan membuat Anda merasa Wellcome. Kami kembali dan memiliki semua makanan kami selama kami tinggal 6 hari di Pemuteran di Januari 2017 Dan Tinggal lain dengan granchild di Oktober 2016,5
18, Man's Cottages & Spa,"Selain dari staf, hotel ini tidak apa yang kami harapkan. Memiliki tata letak yang indah dari kamar, tidak menyatakan bahwa standar kamar tidak memiliki air panas. Ketika Anda mandi toilet menjadi basah karena seluruh di luar kamar. Kamar pertama, toilet tersumbat, kedua kamar mandi dan rambut di tersumbat, tidak bisa berurusan dengan ini dan ditingkatkan untuk kamar dengan air panas. Diperlukan untuk tidur untuk malam dan bangun tidur dengan mata merah dan bengkak kiri saya, saya pikir tidak ada yang sampai malam berikutnya yang saya dan kedua mata saya mengalami reaksi alergi yang saya menebak pihak kelambu di kamar yang bau dan berdebu. Jika Anda tidak siap untuk mendapatkan digigit oleh nyamuk sementara di luar menggunakan shower atau meletakkan di makeup dan kodok juga…",2
19, Man's Cottages & Spa,"Saya cukup beruntung untuk tinggal di pondok orang untuk empat malam. Layak perjalanan dari Candidasa dan Pemuteran. Mencintai Santai - kembali gaya desa ini. Kami disambut seperti teman lama! Kamar kami adalah bersih, jadi itu kamar mandi udara terbuka. Area kolam renang yang sangat bagus. Taman adalah rapi. Anggota staf yang sangat ramah! Restoran disajikan makanan yang menakjubkan! Memiliki tinggal yang sangat menyenangkan. Sangat direkomendasikan! Foto-foto di situs web mereka - tidak melakukan keadilan tempat ini. ",5
20, Man's Cottages & Spa,Kamar besar dengan AC (diperlukan) dan sangat nyaman. Indah yang disajikan. Menghadap ke taman kecil yang rapi. Kolam renang besar (sedikit kecil). Ada dua restoran - satu di belakang oleh kolam renang dan kamar dan memiliki sebuah bar yang menyajikan makanan Indonesia - lokasi Terbaik Oleh jauh.  Seperti banyak dari Bali dan staf yang sangat ramah dan membantu. Sangat merekomendasikan,5
21, Man's Cottages & Spa,Kami tinggal selama 5 malam di Mans yang indah bersih dan nyaman di lantai atas villa dengan pemandangan yang luar biasa dari pegunungan. Layanan kamar dan staf yang sangat baik dan Herman dan keluarganya pergi keluar dari jalan mereka untuk membuat kunjungan kami menyenangkan. Kami akan senang untuk kembali dan tinggal di mans meskipun itu adalah perjalanan panjang dari bandara Denpasar.,5
22, Man's Cottages & Spa,Tempat ini sangat menakjubkan! Saya tidak pernah menulis ulasan tapi saya harus di hotel ini. Ini adalah menyenangkan. Lokasi sangat bagus dan makanan yang sangat baik. Sekolah menyelam yang bagus dengan kami mulai hari berikutnya,5
23, Man's Cottages & Spa,"Mr. Herman itu bagus untuk melihat orang @ cottage.. cottage yang sangat bagus dan staf yang ramah.. rasanya seperti di rumah untuk kita sebagai banyak perkebunan yang hijau membuat kami merasa sejuk & segar udara gunung yang terasa seperti rumah sendiri di Bandung.. Kami tinggal di kamar deluxe, proses check in di malam hari. Kamar adalah cahaya redup, toilet pencahayaan agak gelap. Selain itu hotel ini sangat bagus untuk menyelam di sekitar Pulau Menjangan @ dengan Pak Yitno instruktur menyelam dan kami tinggal di pondok yang sempurna orang menjauhlah...  Tips: bawalah lotion anti nyamuk jika beberapa serangga/nyamuk.",5
24, Man's Cottages & Spa,"hotel yang sangat bagus, restoran yang bagus dengan dapur, kemungkinan untuk menyediakan pijat di spa. Sarapan adalah sangat bagus, anda dapat memilih antara 3 berbeda menu.  Kamar-kamar di vila di taman. Kamar sangat bersih, dengan kamar mandi terbuka, tetapi kamar tidak menyediakan air panas. Ada tidak ada akses langsung ke pantai. Kolam renang sangat bagus.",5
25, Man's Cottages & Spa,"Hotel ini adalah sebuah permata. Besar nilai untuk uang, kami memutuskan untuk tinggal di sini sehingga kami bisa memberikan sebuah bungalow deluxe + kursus menyelam + banyak perjalanan ke spa dan restoran yang bagus, dan ini adalah sempurna akhir liburan kami. Stafnya sangat ramah dan pemiliknya juga - dia adalah seorang dive master yang secara pribadi membawa kami untuk perkenalan kami kursus menyelam dan sangat sabar dan menyenangkan - kami memiliki pengalaman yang menyenangkan! Kami pasti akan merekomendasikan tinggal di sini dan membuat penggunaan fasilitas - restoran yang indah, fantastis spa dengan pijat, dan pusat menyelam profesional dan sangat sabar jika anda baru untuk hal-hal seperti kami. Kami datang di awal bulan september dan rencana - beberapa kali kami memiliki…",5
26, Man's Cottages & Spa,"Kami tiba ke hotel ini sangat baik dan mereka memiliki area check in dan kami disambut oleh staf yang baik. Kami disambut dengan minuman, dan staf membawa koper kami ke kamar kami yang sangat bersih dan baik disiapkan untuk kita.  Kami memiliki beberapa makanan di hotel, yang sangat mahal dan tidak ada yang menunggu waktu. Jus jeruk - serius yang terbaik yang saya telah dalam hidup saya. Tapi secara keseluruhan sangat baik hotel dan spa yang bagus. Mereka juga memiliki sebuah pusat menyelam yang terhubung ke hotel dengan manajer yang merupakan salah satu yang pertama untuk mendirikan pusat di daerah. jadi jangan khawatir anda berada di tangan yang tepat. Mereka staf akan memandu anda ke arah yang sempurna untuk menyelam, di mana keselamatan dan pengalaman menyelam yang sangat…",5
27, Man's Cottages & Spa,"Pria ini adalah tempat yang sempurna untuk tinggal di pemuteran. Staf sangat ramah dan pemilik khususnya sangat membantu dan informatif - dia menjawab semua pertanyaan kami tentang berbagai aktivitas dan membuat semua pemesanan kami, termasuk kelas perjalanan snorkeling untuk harga yang jauh lebih murah daripada di toko-toko menyelam di sekitarnya. Ini adalah hanya lima menit berjalan kaki dari pantai dan kolam renang adalah tempat yang sangat tenang untuk melarikan diri ke. Kami sangat terkejut oleh makanan - sedikit mahal dibandingkan dengan tempat lain di bali (tapi tidak dibandingkan dengan hotel lain di pemuteran) dan benar-benar lezat. Akan merekomendasikan tempat ini. ",4
28, Man's Cottages & Spa,"Ini adalah hotel yang terjangkau di lokasi yang baik. Kami awalnya memesan ke bungalow deluxe tapi tiba menemukan ion ini berdebu, memiliki pencahayaan yang buruk - tidak ada lampu di langit-langit hanya 6 lantai atau lampu meja yang anda harus menyalakan semua lampu di untuk rata-rata. Kamar juga memiliki kesenjangan antara dinding dan atap dan oleh karena itu ada sekitar 30 nyamuk di sana ketika kami tiba. Kami membunuh sekitar 15 sebelum kami sudah cukup. Kami diminta untuk mengubah hari itu tapi tidak ada yang tersedia sehingga kami memiliki kamar yang cocok untuk tinggal di ruang satu malam dan di hari berikutnya. Untuk menjadi adil, manajer hanya dikenakan biaya kami untuk setengah biaya tambahan untuk upgrade kamar. Deluxe bungalow sebelah yang harus di peternakan kecil.…",4
29, Man's Cottages & Spa,"Staf adalah sangat baik dan penuh perhatian, fasilitas yang indah dan kamar yang sangat nyaman. Makanan di hotel sangat baik dan seluruh tempat sangat dekat dengan pantai. Anda bisa sampai di sana hanya 5 menit dengan berjalan kaki. bisa memesan langsung di hotel banyak aktivitas seperti diving, trekking, menonton lumba-lumba, dll dan anda juga dapat memesan layanan transportasi pribadi ke tempat lain di bali.  hotel ini terletak dengan baik di permuteran dan mudah untuk menemukan.",4
30, Man's Cottages & Spa,"ini adalah sebuah hotel butik dengan kamar di bagian belakang setelah berjalan melalui sebuah lorong panjang. Kami tinggal hanya selama 12 jam, tetapi merasa nyaman. Hotel ini bersih dan juga memiliki 2 kolam renang, dan restoran. Kami memiliki makan malam di restoran bali. Terdapat sebuah panti pijat yang terpasang ke hotel ini juga. Karena kami harus check out di 4,30 di pagi hari, mereka menyediakan paket sarapan pagi. Mereka juga menyediakan wifi gratis",4
31, Man's Cottages & Spa,"Ini adalah hotel butik yang indah, sangat santai. Tidak terlalu ramai. Bagus selamat datang dengan minuman selamat datang dan sangat ramah orang untuk melayani anda. Harga adalah adil. Kamar memiliki ac paling standar, tapi tidak ada air hangat, namun untuk 250k Rupia (€13) anda juga memiliki lebih banyak kamar dengan air panas. Properti adalah dalam kondisi baik, sebagian besar kamar memiliki pemandangan kolam renang. Kami juga memiliki pijat di spa. Baik gadis bali yang dapat memberikan pijat bali yang menenangkan. Istri saya menikmati perawatan termasuk melati. Semak belukar yang 90 menit untuk. Luar Biasa",4
32, Man's Cottages & Spa,"Hotel ini sangat bagus dan bersih. Pada pandangan pertama itu seema dekat jalan, tapi setelah anda check-in kamarnya locat3d di belakang di daerah yang tenang yang bagus... banyak hijau yang bagus. Kami memiliki sebuah bungalow untuk diri kita sendiri yang bagus dengan luar ruangan mandi. Wifi gratis juga sangat baik dan cepat. Kolam renang sangat bagus dan area yang bagus untuk anak-anak perempuan kami yang hanya 2yrs tua. Staf sangat membantu.  Mereka memiliki 2 restoran... 1 di depan dekat jalan dan lain di dalam yang disajikan makanan bali. Sarapan termasuk dalam harga dan ada 3 pilihan paket sarapan.  Ada tidak ada akses langsung ke pantai, tetapi mereka memberikan peta dan arah untuk pergi ke pantai yang hanya beberapa menit berjalan kaki di sepanjang jalan.  Staf yang…",5
33, Man's Cottages & Spa,"Kami tinggal 3 malam (awalnya 2), tetapi jika anda tahu anda ingin memperpanjang pemilik :-)  Karena juga kombinasi dengan permulaan pengalaman menyelam  Hotel ini sangat lucu - kolam renang yang luar biasa dengan pemandangan pegunungan  Kamar dengan kamar mandi luar - lingkungan asli  Terima kasih herman, miya dan tim menyelam yang gila untuk pengalaman yang indah ini ",5
34, Man's Cottages & Spa,Kami telah tinggal di sini yang indah. Staf adalah sangat menyenangkan dan snorkeling di pemuteran adalah benar-benar fantastis. Anak-anak mencintai kolam renang dan keluar lagi untuk memesan makanan barat dan asia di restoran adalah pilihan yang baik untuk bepergian dengan anak-anak. Hotel diatur kami transportasi ke feri ke pulau jawa. Taman ini juga sangat indah.,5
35, Man's Cottages & Spa,Teman saya dan saya tinggal di pondok ini dan itu. Ini adalah kedua kalinya saya telah tinggal di sini saya menikmatinya begitu banyak. Aku benar-benar menyukai suasana taman yang tenang dan baik makanan indonesia dan eropa yang baik dan kamar yang nyaman.  Saya harus mengatakan bahwa kamarnya tidak cukup bukti. Saya mengerti ini adalah fungsi dari daerah tropis. Setiap malam aku diperlukan memfumigasi di kamar saya dengan semprotan dan kelambu di atas tempat tidur memiliki lubang atau dua di tempat bekerja sama it. staf mengerikan hotel di setiap sore.  Sarapan yang benar-benar baik tempat untuk tinggal dan pasti akan kembali dan merekomendasikan kepada orang lain.  Terima Kasih Mr Mann.  ,4
36, Man's Cottages & Spa,"Kami menghabiskan dua malam di man's cottage, tapi aku berharap kita bisa tinggal lebih lama. Jangan biarkan restoran pinggir jalan harganya, hotel berada di belakang jalan, taman itu begitu indah dan suasananya damai dan cukup.  Aku menghabiskan sore di kolam renang setelah menyelam di pagi hari. Layanan sangat baik dan makanan. Satu-satunya kekecewaan adalah spa. Hotel ini tepat di sebelah jalan dan sedikit bising, tetapi semua dan semua tempat yang bagus untuk tinggal dan bersantai.  Kami telah besar kamar pergi dan benar-benar menyukai shower luar ruangan.",5
37, Man's Cottages & Spa,"Man's adalah tempat yang bagus untuk tinggal. Taman, dan area kolam adalah benar-benar indah. Kamar hotel ini bersih dan memiliki semua yang anda butuhkan termasuk ac. Ini adalah layak. Orang-orang yang bekerja ada benar-benar membantu dan ramah. Herman adalah sangat informatif dan ramah juga. Hotel ini berada di dekat pantai, di ujung pantai kotor namun jika berjalan kaki ke arah timur resor di pantai lebih menyenangkan. Anda dapat menyewa kursi dari taman sari atau resor lainnya untuk 50 000.",4
38, Man's Cottages & Spa,"Kami menghabiskan satu malam di laki-laki's. tempat ini adalah tempat yang bagus dan kamar yang bersih. Sarapan adalah sangat lengkap, ideal sebelum pergi menyelam di pulau menjangan. Kami mendapat pijat fantastis. Itu bukan titik terbaik kami. Makanan tidak benar-benar terlibat. Hanya baik-baik saja. ",4
39, Man's Cottages & Spa,"Kami bermaksud untuk tinggal hanya untuk dua malam - kami menginap beberapa kali dan berkepanjangan. Man's cottages adalah berkilau! Staf sangat ramah, dan bungalo, indead, seluruh tempat, indah dan anda dapat merasakan cinta untuk detail ke mana pun anda ingin: flower dekoras di ranjang, sarapan lezat yang hujan, dll. Tapi aset terbesar adalah super ramah, hangat, ramah, membantu pemilik dan lucu. Dia telah menciptakan rumah yang jauh dari rumah.",5
40, Man's Cottages & Spa,"Sebelum kami mengunjungi minangkabau pertama, kami memesan tempat ini untuk dua malam, dan setelah malam pertama kami tinggal kami lama untuk makan malam lagi. Kamar bersih dengan kamar mandi dan shower luar ruangan yang segar, dan kita sangat dimanjakan oleh staf. Kamar yang dibersihkan setiap hari, dan setiap malam stafnya datang dengan kelambu untuk ranjang. Sarapan adalah sangat murah hati dengan beberapa pilihan, dan segala sesuatu yang segar dan dibuat di order. Baik menghabiskan hari di tepi kolam renang, atau dapat membantu mengatur perjalanan berkeliling, hari ini adalah hari untuk ingat.",5
41, Man's Cottages & Spa,"Kami memiliki kesenangan menginap di man's homestay dan menikmati setiap detik! Miya dan herman adalah indah dan sangat membantu, yang juga bernilai kunjungan lagi! Kamarnya sangat nyaman dan bersih, makanan lezat dan seluruh daerah ini adalah tempat sempurna untuk bersantai dan menikmati pemuteran. Terima kasih miya dan herman!",5
42, Man's Cottages & Spa,"Kami telah benar-benar bahagia dengan tinggal kami. Akomodasi, layanan dan makanan adalah luar biasa. Benar-benar peduli untuk para tamu untuk memastikan bahwa mereka memiliki waktu yang besar. Perjalanan, taksi dll dapat dengan mudah diaturkan oleh staf yang ramah dan membantu. Kebun dan kolam renang yang indah dan kami akan diperhatikan. Kami akan merekomendasikan kepada siapa pun yang mengunjungi orang minangkabau.",5
43, Man's Cottages & Spa,"Man's cottages & spa merupakan tempat menginap yang sangat sayang sekali jika anda membuat jalan anda ke pemuteran. staf dan pemilik yang sangat ramah, mereka pergi keluar dari jalan mereka untuk memastikan masa tinggal anda di sini adalah salah satu yang terbaik. Kolam renang yang indah, kita bisa menghabiskan berjam-jam yang hanya oleh atau di hotel ini (mereka menyediakan handuk). Dekorasi yang indah taman dengan pemandangan pegunungan di latar belakang yang membuatnya sedikit rasa surga. 2 restoran (eropa/asia dan asli bali) Benar-benar dasar dan yang terbaik di bali. Sarapan setiap pagi adalah benar-benar sempurna. Cantik kamar dengan shower luar hanya membuat anda merasa anda pada liburan yang anda ambil. Pengalaman luar biasa dan saya pasti akan merekomendasikan tempat…",5
