,hotel,review,stars
38, Naya Gawana Resort & Spa,"Kami tinggal di sini selama 3 malam. Pemandangan pertama adalah kolam renang yang besar menghadap ke teluk penuh perahu dengan pegunungan dan hutan di belakang. Kamar lumbung 10 sangat jauh lebih banyak daripada kamar. Hotel ini memiliki teras besar, ruang tamu, kamar mandi dengan bak mandi dan kamar tidur yang indah di lantai atas. Meskipun seperti tempat yang indah untuk menjadi, kami sangat sibuk. Semua hari perjalanan mengamati burung (ditinjau secara terpisah dan memesan kamar secara online di inggris) dan lumba-lumba di lovina yang menakjubkan (di mana kita melihat banyak lumba-lumba) yang diatur oleh hotel kami tidak sangat sibuk. Namun staf yang sangat baik - ramah dan membantu, makanan yang sangat baik dan kolam renang dan pemandangan luar biasa. Kamar kami adalah indah…",5
39, Naya Gawana Resort & Spa,"Saya dan suami saya telah di sebelumnya dilakukan oleh naya dibangun di 2012, dan kami kembali untuk liburan kami, rasanya hebat. Kami memilih suite karena kami memiliki banyak waktu santai di sini sebelum mengalami, suite ini memiliki kolam renang air panas pribadi, sehingga kami dapat menikmati kolam kapan saja kita inginkan, kami pikir resor ini masih memberi kami pemandangan teluk, pegunungan, biru-hijau, luar biasa! ",5
40, Naya Gawana Resort & Spa,"Kami menghabiskan empat hari bersantai di atap dan spa di juli 2014 - benar-benar tempat yang damai.   Yang tenang di jantung kota national park di area yang memiliki kecantikan alam yang memesona.   Kolam renang adalah besar dan makan yang istimewa, tepat di ujung teluk. Sarapan prasmanan adalah benar-benar lezat, bervariasi, segar dan banyak pilihan. Makanan favorit kami di bali dihabiskan di sini menghadap ke hutan bakau dan pulau menjangan.  Kami memilih untuk salah satu dari mereka ""kamar"" sederhana, tapi nyaman dan ditata, tapi kami telah melihat mereka bungalow yang lebih mewah dan layak uang tambahan jika anda dapat berbelanja secara royal.   Salah tinggal di sini - sangat direkomendasikan.",5
41, Naya Gawana Resort & Spa,"Perlu sedikit perbaikan tapi untuk apa sangat baik. Negatif utama adalah layanan spa. Mereka sangat mahal dan tidak ada diskon yang ditawarkan. Karena tidak ada pantai di hotel, anda tidak dapat menemukan makanan lokal untuk memberikan pijat. Aku tidak ingin berada di sana lebih dari 2 hari tanpa opsi tersebut. Juga berbelanja di bandung terkait tidak sangat baik. Kami melanjutkan perjalanan ke pulau tapi ada komunikasi yang buruk dan mereka tidak sangat baik. Tidak esky untuk minuman dingin dan sedikit buah untuk aud $65. Mereka hanya ingin membawa kami untuk perjalanan pulau di dua tempat meskipun mereka mengatakan mereka akan pergi ke belakang. Mereka menawarkan tidak ada saran dan tidak memberitahu kita apa yang harus di lakukan adalah yang terbaik. Beruntung kami telah…",4
42, Naya Gawana Resort & Spa,"Suami saya dan saya benar-benar menikmati kami tinggal di sini. Kasurnya sedikit bagian dari saat ini orang di resepsionis, tapi para staf di semua area lain sangat ramah, terutama karena kami harus tahu mereka. Kami tinggal di bay view suite, itu bersih dan sempurna untuk kebutuhan kita. Kami menyukai kamar mandi luar ruangan, yang mana, dan taman yang indah indah. Kami tidak punya masalah dengan nyamuk. Linen yang berbau segar dan bersih, tempat tidur perusahaan tapi nyaman. Saya harus menelepon resepsionis, seperti ber-ac tampaknya tidak penyejukan dan pemeliharaan tiba dengan cepat. Kami memiliki pijat setiap, yang telah kami sebagai nilai 6/10, jahe teh setelah itu lebih baik daripada pijat! Makanannya luar biasa, kami telah terutama indonesia, barat aithough cukup…",5
43, Naya Gawana Resort & Spa,Ini adalah tempat yang bagus untuk tinggal ketika bepergian ke barat laut menjangan bali untuk menyelam. Sebagian besar dari kapal untuk pergi ke pulau menjangan mulai hanya 5 menit berkendaraan dari sanggraloka itu. Kami tinggal hanya satu malam tapi aku 3 malam yang akan baik-baik saja. Ini adalah hotel yang indah tetapi tidak sangat pribadi. Hotel ini hanya antara lobi dan restoran. Semua adalah baik dan sangat baik standar.,4
44, Naya Gawana Resort & Spa,kami pergi ke sana khusus untuk menyelam pulau menjangan. Pemandangan dari kolam renang dan dermaga adalah menakjubkan. Kami mempunyai lumbung dan tidak ada keluhan selain tidak ada tv.  Tapi secara keseluruhan kami benar-benar menikmati kami tinggal di sini... kembali ke alam...,4
45, Naya Gawana Resort & Spa,"Saya dan istri saya tinggal di sini selama lima malam di bulan oktober. Hotel ini merupakan sanggraloka tepi pantai di teluk kecil pemuteran di sebelah barat. Hotel ini di ujung jalan yang berakhir di the bertonjol area resepsionis dengan berjalan kaki singkat ke kolam renang yang indah yang menghadap ke teluk. Kami berada di sebuah lumbung suite, model di tradisional 'rumah besar'. Sangat nyaman kamar berdinding kayu dengan kamar tidur mezzanine level, lantai dasar dan area duduk, kamar mandi besar dengan bak mandi. Tidak ada tv adalah bonus, wifi lambat tapi memadai, privasi adalah banyak. Pada air panas dari air panas lokal, banyak sekali dan tidak ada gas dingin, jadi bersiaplah untuk salah satu suhu shower. Taman di sekelilingnya adalah sangat baik, pagi hari banyak burung,…",5
46, Naya Gawana Resort & Spa,"Aktivitas dan diselenggarakan perjalanan ke taman nasional itu cara terlalu mahal. Restoran itu cukup mahal dan tidak ada yang terlalu besar. Tidak ada layanan antar-jemput gratis ke taman yang kami temukan tidak masuk akal karena tidak ada apa-apa di sekitar dan hotel adalah di daerah yang sangat terpencil. Mereka akan mengantar anda ke taman seperti yang anda menyewa pengemudi akan biaya untuk 5 jam berkendara berkeliling bali, dan 15 menit onlye. Lingkungan yang indah meskipun dan kabin sangat sangat bagus.  Tempat itu kosong sehingga kita tidak seharusnya seperti harga tinggi. ",3
47, Naya Gawana Resort & Spa,"Hotel ini dan sekitarnya adalah indah tapi sangat kotor mencari setelah anda mendapatkan di sini. Kami diperlakukan untuk makanan, dirusak, dan pijat, dan memutuskan untuk tur setelah kami melihat harga -- $50 - $100 per orang, double atau lebih yang kita telah melihat di tempat lain di bali.   Karena itu, kami akan merekomendasikan hotel ini untuk tetap 1 - 2 malam untuk mengambil keuntungan dari national geographic dengan kualitas makanan (dan kita dengar menyelam) hanya berjarak 30 menit naik perahu. Terumbu karang yang cantik dan mereka menyelam dan snorkeling center adalah profesional dan kompeten.  Pro lainnya: - Indah, kolam renang besar, terbaik kami telah melihat di 4 tempat kami pernah menginap di bali, seperti bak mandi air panas yang besar; dapat memesan minuman ke…",3
48, Naya Gawana Resort & Spa,"Pemandangan dari hotel menakjubkan dan sangat tenang... tempat ini cocok untuk bersantai.   Staf sangat ramah dan akan melayani anda dengan tulus  Hotel ini terletak berdampingan dengan pelabuhan banyuwedang, sehingga anda dapat pergi sana dengan berjalan kaki jika anda ingin mengambil perjalanan snorkeling atau menyelam.  Tidak banyak pilihan untuk menu sarapan, tapi anda dapat meminta renang jika anda ingin membandingkan untuk sarapan anda.  Berharap suatu hari nanti bisa mengunjungi pulau menjangan dan tinggal di sini lagi",4
49, Naya Gawana Resort & Spa,"Tinggal di sini selama 3 malam dengan keluarga dari tiga.  Hotel pertama adalah sangat membantu saat mereka re-dikonfirmasi pemesanan kami setelah kami dibatalkan pemesanan yang dapat dikembalikan. Staf yang umumnya sangat ramah dan mencoba untuk melakukan yang terbaik. Tapi karena ini penting untuk tujuan anda, berikut adalah pro dan kontra.  Pro: Bay view - (yang dalam dirinya sendiri adalah menyenangkan mata) vila sangat bagus karena mereka memiliki banyak kamar di lantai 7 dengan beranda yang menghadap halaman belakang 7 bunga. Ini adalah ide yang bagus. - Kamar yang luas dan kasur yang baik. Semuanya terbuat dari kayu. Tidak ada tv dan itu adalah baik untuk kita juga. Banyak botol air minum disediakan setiap hari.  - Kolam renang tanpa batas hanya menakjubkan. Hotel ini…",3
50, Naya Gawana Resort & Spa,"Kami mencintai kami tinggal (5 malam) di lumbung suite yang baik di resor ini. Kolam renang adalah menakjubkan. Pemandangan luar biasa di bakau. sangat baik menginap di sanggraloka pulau menjangan dengan staf. Tingkat layanan adalah jauh di atas rata-rata dan restoran. Kami memiliki makan malam ""romantis"", hanya dua dari kami, disajikan di dermaga, itu adalah luar biasa.  Ada pantai berpasir putih yang indah dalam jarak berjalan kaki (2 kms) dari resor dengan warung kecil di mana anda bisa mendapatkan makanan yang layak.  Kami akan kembali untuk dilakukan oleh naya lainnya di agustus dengan anak-anak dan cucu-cucu",4
51, Naya Gawana Resort & Spa,Yang sangat terjangkau alternatif ke dua yang menawarkan resor tetangga meskipun ke jalan. Tenang dan sangat baik snorkeling peluang dan dekat dengan aktivitas di pulau menjangan. Tempat favorit di barat laut bali,4
52, Naya Gawana Resort & Spa,"Jika anda ingin bersih dan tenang surga dengan air dari mata air dari keran. Namun, sarapan (berbagai dan selera) dan tingkat layanan (baik pendengar, lebih baik pelatihan) bisa lakukan dengan beberapa perbaikan. Terapis spa yang begitu-begitu...    ",4
53, Naya Gawana Resort & Spa,"3 malam terakhir kami hari perjalanan di bali an18 lainnya dilakukan oleh naya. Apa cara yang indah untuk mengakhiri liburan yang luar biasa. Jangan biarkan pinggir jalan tanah ke pintu masuk meletakkanmu dari, anda akan menyukai ini setelah anda tiba. Saya telah memesan kamar standar, tapi kami yang ditingkatkan ke suite ikan pada saat kedatangan (berpikir mereka tidak sangat penuh). Sementara tidak ada pemandangan teluk yang indah, kamarnya luas dan ditata dengan indah. Kelambu di sekitar tempat tidur, lelah, dan bisa dibayangkan semua tersedia. (Ya, dilakukan oleh naya lainnya adalah di taman nasional bali barat di hutan bakau - banyak nyamuk). Efisien ac, kulkas kecil/mini bar, lampu baca keletak di jalan (satu-satunya waktu kami tinggal kami dapat benar-benar membaca buku…",4
54, Naya Gawana Resort & Spa,"Kami menghabiskan dua hari di sini. Anda masukkan hotel dengan pemandangan yang indah di kolam renang dan bay di mana hotel terletak. Mereka sangat ramah, meskipun sedikit terorganisir di resepsi. Check-in mengambil cukup lama, mereka tak tahu agen perjalanan kami telah memesan snorkeling perjalanan untuk kami dan memberi kami tidak ada informasi tentang perjalanan snorkeling ini. Ruangan itu benar-benar baik, dengan mata untuk rincian, seperti wisatawan yang lelah, tempat lilin, lampu baca yang anda tempat di sebuah buku, gratis air dll... Kamar mandi itu indah dan terletak di luar ruangan. Sarapan prasmanan adalah campuran yang baik makanan lokal dan barat yang lezat, semua dengan pilihan yang cukup. Anda dapat memiliki sarapan dengan pemandangan di air, yang sangat…",5
55, Naya Gawana Resort & Spa,"Sarapan yang terbaik dan sangat baik resort, puas hanya mengandalkan baik snorkeling dan menyelam pengalaman lokal. 'Pemandangan' secara keliru tidak pemandangan teluk. Elemen desain bali yang luar biasa yang biasanya adalah beranta. Upgrade sederhana, hanya beberapa dan bahkan bararig unsur kuno dan kotor seperti furnitur, akan membantu...  Di area publik sangat kotor. Kami telah tikus di ruang, dan sebelah itu tanpa gangguan pada makanan yang disiapkan.   Di (sangat menyenangkan) dan meyakinkan kami ditujukan hanya krupukan, sangat miskin layanan menukiknya di restoran dan tidak malu-malu.  ini adalah rasa malu untuk melihat potensi sia-sia sebagai staf dan fasilitas yang baik-baik saja, hanya denganmengenaskan dilalimkan. Untuk mengantisipasi masalah yang tak berminat kami…",2
56, Naya Gawana Resort & Spa,Tinggal di sini selama satu malam setelah mengambil feri atas dari jawa. Baik berhenti titik sebagai kurang dari satu jam berkendara dari pelabuhan feri. Hotel ini indah. Kami menginap di lumbung suite yang juga memiliki ruang duduk dan kamar tidur di lantai atas yang baik serta kolam dek dengan pemandangan taman. Sebenarnya cukup - sebenarnya air terjun dengan pancuran air panas yang beruap. Luar Biasa.  Makanan di restoran yang indah.  Akan sangat merekomendasikan hotel ini dan berharap saya telah tinggal lebih lama. ,5
57, Naya Gawana Resort & Spa,"Saya sendiri selama bertahun-tahun dengan pariwisata - memiliki dua rumah dengan semua inklusif formula berselanca. Aku tahu di mana mereka bisa merekomendasikan perusahaan ini dan juga tahu bagaimana anda dapat melayani sederhana namun berkualitas baik.  sudah jelas bahwa ini adalah keseimbangan besar harga dan kualitas mereka memadan memperlepas tentang terutama untuk makanan. Dengan pengetahuan bahwa anda bisa mendapatkan bisa di di bali untuk 1/3 dari harga yang terlalu tinggi, ini gagal di area yang besar. Restoran harga yang terlalu tinggi atau terlalu rendah kualitas makanan untuk harga mereka biaya, ini adalah cara yang baik dan tidak begitu baik, itu adalah rata-rata, makanan Supermarkt, tidak segar atau dibuat produk-produk berkualitas rendah. Jika produk yang mereka…",2
58, Naya Gawana Resort & Spa,"Tenang dan damai. Menghabiskan 3 malam, akan tinggal satu minggu waktu berikutnya. Layanan besar, makanan dan indah villa dengan taman bertembok terbaik, kursi dan mandi udara terbuka. Lemari es di kamar, dan air gratis yang besar, tempat tidur yang nyaman. Kolam renang yang indah dengan pemandangan air luar biasa. Indah santai kolam renang dengan spa mata air panas alami di bawah kolam renang utama. Perawatan di spa yang sangat bagus, tapi yakin tidak. Datang untuk menyelam di pulau Menjagnen mencempung digunakan di luar perusahaan, mimpi laut yang telah muncul sebagai jawaban terbaik dari mereka. Kehidupan terumbu karang dan itu luar biasa. Kegiatan menyelam atau snorkelling jika anda datang ke sini.",5
59, Naya Gawana Resort & Spa,"Kami berada di sini untuk foto & video pengantenan dltembak dari klien kami dari jerman. Sanggraloka ini memiliki dermaga yang tidak jauh lebih baik bahwa pernikahan di dermaga dan bintang lima resort di jimbaran. Lokasi dan pemandangan yang fantastis, staf hotel yang menakjubkan. sangat direkomendasikan untuk pernikahan dan bulan madu",5
60, Naya Gawana Resort & Spa,"aku tinggal di sini di 27 - 29 juni. Perlu untuk berkendara dari jimbaran 5 jam untuk sampai ke sini. ini seperti menemukan surga kecil. Jika anda datang di lobi anda dapat melihat pemandangan yang sangat menakjubkan. Tidak besar tetapi mereka memiliki segala sesuatu yang besar, kamar bersih, kamar mandi luar ruangan dengan fasilitas lengkap, kolam renang dengan pemandangan menakjubkan, jacuzzi, dermaga dan dll. Karena kami sedang berbulan madu ini adalah tempat yang sangat bagus untuk menghabiskan waktu dan melarikan diri dari rutinitas. Staf ramah dan sangat warmfull. Ketika saya membuat reservasi saya menempatkan permintaan khusus untuk merayakan mitra saya ulang tahun pada 29. Kemudian, ketika waktu sarapan mereka bernyanyi selamat ulang tahun untuk saya dan memberi sebuah…",5
61, Naya Gawana Resort & Spa,"Ini adalah tempat terbaik untuk tinggal jika anda berencana untuk mengunjungi pulau manjaran. Ini adalah tujuan terdekat. Kami tiba di bayview kabin yang sangat bagus dan bersih, tapi aku tidak bisa digunakan untuk memiliki toilet luar ruangan meskipun pancuran luar ruangan yang indah. Mereka memiliki besar sarapan prasmanan di restoran tetapi makanan adalah sangat mahal sehingga australia oleh bali standar.   Jika anda menginap di sini dan ingin melihat pemandangan saya membuat panggilan atau email sulastra 081337457866 grayer di @ mratining ymail. com secara langsung. Jauh lebih murah daripada pemesanan langsung melalui hotel. Dia mobil bersih, sangat informatif dan sangat aman driver. Ia dapat menunjukkan kepada anda semua tempat wisata atau transfer anda ke tujuan anda…",4
62, Naya Gawana Resort & Spa,"Pengalaman yang luar biasa, mulai dari saat pertama pemesanan dan email, melalui 3 malam kami tinggal. Bernilai perjalanan ke pojok barat laut bali yang indah untuk bersantai di hotel mewah yang lengkap. Bak mandi air panas di spa, kolam renang tanpa-batas yang hangat, untuk kemewahan dan body scrub di spa kompleks, untuk diving dengan dive center yang ada di dalam... itu adalah kebahagiaan murni. Kamar (benar-benar baik, kami berdiri sendiri bay view villa... menakjubkan - melihat keluar untuk ' khusus' kami mendapatkannya dengan harga murah), dengan kita sendiri di halaman belakang untuk tur yang lebih tan dengan senang hari ini, shower dan fasilitas kamar mandi... untuk kenyamanan seperti berangkat dengan tempat tidur yang nyaman... untuk teras depan dengan 'pencinta swing'.…",5
63, Naya Gawana Resort & Spa,"Kami tinggal di sana dua malam saat kami pergi untuk snorkeling ke pulau menjangan. Kamarnya sederhana tapi bersih dan kamar mandi luar sangat cantik vut kadang-kadang tidak yang paling nyaman. Namun sisa hotel sangat baik: kolam renang adalah cukup besar untuk berenang di depan teluk dan gunung berapi, anda dapat menikmati sarapan di luar di depan pemandangan indah, wifi bekerja dengan baik, dan staf adalah sangat ramah.",5
64, Naya Gawana Resort & Spa,"Ini adalah kedua kami menginap di properti ini indah. Semua kamarnya luas dan indah seperti pemandangan teluk baru, lumbung suite dan suite hutan bakau. Kami tinggal di sebuah suite lagi mangrove yang memiliki bak jacuzzi dengan air hangat yang mengalir dari mata air panas lokal.  Tempat tidur dan linen yang nyaman dan indah kamar yang luas dengan area duduk.   Makanan tersedia di sini, tapi ini adalah benar-benar berkualitas prima dan segar dimasak untuk memesan. Hotel ini dibangun dengan indah seprai berkualitas baik dan makanan yang disajikan di cina putih panjang dengan peralatan berkualitas baik.  Ada besar kolam renang tanpa batas yang menghadap ke sungai dan terdapat taman yang luas.  Tania manajer itu bersedia meluangkan waktu setiap malam pergi ke tamu membuat ini…",4
65, Naya Gawana Resort & Spa,"Apa tempat untuk menginap hal yang mengecewakan adalah bahwa kami hanya pergi untuk menginap untuk 1 hari, sebuah permata tersembunyi di taman nasional bali barat.  KAMAR. Kami punya bay view villa saat kami melangkah melalui pintu, saya kira saya berada di kahyangan memang benar-benar indah. Dua langkah tingkat villa dengan teras depan dengan bangku ayun, tempat tidur ukuran raja dengan dapur kecil daerah yang aman di lemari dan kemudian membuka pintu geser ke belakang taman. Kamar mandi luar sangat indah, kami tidak ingin meninggalkan lagi hanya 1 hari dihabiskan di sini lebih lama lebih baik.  MAKANAN. Secara keseluruhan makanan adalah awesome, lezat, disajikan dengan baik dan tampak indah. Selamat kepada koki.  STAF. Bahkan engkau itu cukup periode pelayanan yang kami…",5
66, Naya Gawana Resort & Spa,"Sebuah resor yang sangat bagus untuk tiba ke, setelah perjalanan yang sangat panjang dari bali selatan. Kami menginap di lumbung suite, sangat luas di dalam, dan pemandangan yang bagus untuk lingkungan sekitar. Pondok tidak terlalu dekat satu sama lain, sehingga privasi terjamin. Kamar sangat bersih, itu siap untuk kedatangan kami. Kamar mandi adalah sangat besar, bagus untuk menyebar semua tas kami dan gigi.  Sarapan pagi terasa sangat baik, dan banyak itu, terlalu. Kami tidak mencoba makan siang, tetapi makan malam juga sangat berkualitas baik. Menyukainya bahwa kami juga dapat duduk di luar di dek menghadap air untuk setiap makanan.  Menakjubkan dasar tanaman di sekitar dengan baik, area kolam renang bagus, dan bagus untuk berendam di kolam sumber air panas menghadap ke bay!…",4
67, Naya Gawana Resort & Spa,"Kami menikmati ketenangan area ini off season. Snorkeling adalah luar biasa, jauh lebih ramai dan hidup reef dari di mana saja saya telah, termasuk thailand, meksiko, dan jamaika. Ada banyak kegiatan jika anda ingin melihat taman nasional dan satwa liar atau menjelajahi wilayah oleh air. Kami menyewa sopir untuk kami di sana dan kembali yang memungkinkan kita untuk tur pulau lebih dalam perjalanan dan melihat situs kami akan melewatkan seperti singaraja. Kami tinggal 3 malam dan keduanya setuju bahwa 4 malam akan menjadi ideal. Staf sangat ramah dan responsif. Makanan besar. Spa adalah indah dan kami dijadwalkan yang 2nd pijat setelah benar-benar menikmati pertama (termasuk jahe teh dan biskuit sementara anda menikmati pemandangan setelah itu).",5
68, Naya Gawana Resort & Spa,"Naya gawana adalah tempat untuk menjadi jika anda menikmati tempat yang tenang dan jauh dari peradaban. Kami menginap di lumbung suite untuk 2 malam yang indah, staf sangat profesional, membantu dan ramah selama kami menginap disana.  Resor ini terletak di west bali, dan tidak seperti yang lain terletak di seminyak/daerah turis lainnya, tidak terdapat banyak pilihan makanan (misalnya. restoran) di sekitar sini. Tapi takut tidak seperti resor menawarkan makanan yang layak di harga yang terjangkau. Sarapan gratis juga sangat baik.  Kami melakukan beberapa trekking pagi berikutnya (tur). Ada juga aktivitas luar ruangan lainnya yang tersedia, jadi cek dengan staf mereka!  Saya akan suka untuk mengunjungi naya gawana lagi untuk perjalanan saya berikutnya.   * * Perhatikan bahwa…",5
69, Naya Gawana Resort & Spa,"setelah kami memutuskan untuk pergi menyelam di pulau menjangan, itu tidak mengambil lama bagi saya untuk memutuskan untuk menginap di naya gawana, terletak di sangat tenang bay sangat dekat pulau menjangan. Hotel ini sangat mudah untuk menemukan ketika anda melaju sendirian jalan utama dari lovina ke menjangan. Hotel ini sangat bagus diatur di samping laut. kamar sangat stylish dan yang baik, pengaturan ini, ini adalah sorot inifitive renang di pusat resor, ketika matahari bersinar di atasnya, tempat ini hanya indah. Dan tidak seperti kebanyakan hotel butik ini, kolam ini sangat besar dan cocok untuk latihan di sana.   Dan sorot lain adalah pusat menyelam yang dikelola oleh jerman, robert mayer. Dia memiliki sangat baik pengalaman instruksi pada menyelam, sangat sabar, dan…",5
70, Naya Gawana Resort & Spa,"Sanggraloka ini menawarkan tenang kesendirian, layanan tingkat pertama, villa yang indah, baik, bersahaja makanan-semua tanpa ""oh, melihat saya, saya bekerja di 5 star resort-tidak anda beruntung untuk berada di sini"" sikap yang sayangnya adalah ditemukan di begitu banyak bali resorts hari ini. Staf yang sangat terlatih dan dikelola, efisien, tulus dan ramah. Jika anda perlu tempat untuk bersantai di tengah alam, kemudian mencoba naya gawana. Anda tidak akan kecewa.",5
71, Naya Gawana Resort & Spa,"Satu dari sedikit resor di yang relatif belum tersentuh dan tidak diketahui daerah bali, taman nasional bali barat.  Sarapan prasmanan, teh sore dan sesekali pijat oleh kolam semuanya gratis!  Pemandangan luar biasa dan sangat tenang.  Snorkeling, menyelam, berlayar, dan kayak, semua yang tersedia dari sanggraloka ini dengan harga yang terjangkau. Snorkeling adalah kelas dunia - Saya melakukan review terpisah untuk aktivitas ini, silakan baca jika anda tertarik. SOROT - Makan malam prasmanan bbq di tepi kolam, dengan band! Babi guling, ikan bbq dan pilihan yang bagus dari sisi... semua tamu dan staf (termasuk pemiliknya) hanging out bersama-sama, sangat bagus :-) ",5
72, Naya Gawana Resort & Spa,"Jalan menuju resor adalah buruk, tapi resort adalah fantastis! Tidak termurah yang kami tinggal, tapi yang terbaik dari semua! Harga/kualitas baik. Fasilitas spa/pijat yang baik, staf yang sangat ramah. Manajer tidak menunjukkan kami setiap lodge ini adalah semua sempurna. kolam sangat bagus, restoran yang bagus. Banyak travel kesempatan's, bahkan di jawa.",5
73, Naya Gawana Resort & Spa,"Kami tinggal di sini dua malam di bay view 1. Benar-benar menyukai ini sedikit surga, dengan beranda di depan, benar-benar menakjubkan kamar mandi terbuka di dek menghadap sangat cukup sedikit taman pribadi. Staf yang ramah, besar pijat di spa yang indah dari gadis-gadis yang diikuti oleh teh jahe dan biskuit. Menu di restoran baik, tidak ada tempat lain untuk makan di dekatnya. Benar-benar indah kolam renang, tapi banyak lalat dan serangga di sekitar ketika kami berada di sini.",4
74, Naya Gawana Resort & Spa,"Pertama tentang Banyuwedang, ini adalah sebuah desa kecil yang terletak di perbatasan taman nasional bali barat, an 3, 5 setengah jam berkendara dari kuta. Tempat ini sempurna, laknat untuk keramaian dan hiruk pikuk bali selatan, oleh karena itu tidak akan pernah berharap untuk melakukan tipikal bersama aktivitas seperti berbelanja dan bersantap. acitivities utama di sini adalah aktivitas luar ruang, dari menyelam - yang adalah pulau menjangan merupakan pusat dari hotel ini - untuk lintas alam dan mengamati burung hutan, di mana bali atau beo Jalak bali adalah ratu taman nasional ini. Kamar tempat kami menginap (kamar lumbung) adalah besar, sejuk dan terawat dengan baik. ini adalah membangun dari kayu yang dibangun kokoh dengan atap jerami yang sangat nyaman, dan dilengkapi…",5
75, Naya Gawana Resort & Spa,"Resor ini adalah surga, lengkap dengan semua alasan yang indah, makanan dan pelayanan yang anda inginkan, di harga menengah. Bayview kami kamar indah, tempat tidur yang nyaman, teras yang indah dengan pemandangan (meskipun hanya sekilas dari bay) dan ayunan, ditambah halaman belakang pribadi yang mewah termasuk kamar mandi luar ruangan. Kami menginap lima malam di sini dan beberapa luka-luka karena kecelakaan skuter terbaru. Staf jadi ramah mengatur untuk pijat ahli yang sering oleh permainan untuk memeriksa kami. Banyak makanan mereka mengantar ke kamar kami. Ketika kami pergi ke restoran staf selalu jadi khawatir untuk bertanya bagaimana kami lakukan. Koko mudah ditampung kami kebutuhan sayuran dan membuat lezat makanan untuk kami. Infinity kolam adalah besar dan dalam, dan…",5
