,hotel,review,stars
76, Naya Gawana Resort & Spa,"Tempat yang bagus, staf dan lokasi.  Pro: -Staf, sebagai informasi, kami tinggal di seminyak dan ubud, dan ini adalah tangan bawah yang terbaik yang kami punya pasangan pijat - suasana, dan pijat (dibandingkan dengan prana dan tempat lain di seminyak). -Staf restoran, sangat bagus, dan percakapan besar! -Restoran memiliki pilihan makanan yang bagus -Besar staf dan dive center.  Kontra: -Lebih tentang Penmuteran, ini adalah sedikit jauh, jadi anda mungkin hanya ingin untuk menginap 2 malam (kami mendengar salah satu pasangan mencoba dan memandakkan tinggal mereka); tapi itu lebih banyak tentang lokasi, tidak tempat ini -Ac di siang hari adalah tidak efektif karena pondok tidak memiliki banyak insulasi -Toiletnya sulit untuk mendapatkan untuk di tengah malam karena itu di halaman…",4
77, Naya Gawana Resort & Spa,"Bepergian dengan pasangan. The vista yang menyambut anda ketika anda tiba di lokasi adalah hanya napas mengambil. Memesan bayview kamar untuk malam pertama dan mangrove suite untuk malam ketiga dan 2nd karena kami ingin menikmati fasilitas. Pada akhirnya kami lebih memilih kamar bayview dan mereka setuju untuk memindahkan kami kembali ke bayview pada hari terakhir tanpa ada keluhan, dan dengan senyum yang menyenangkan! Layanan ini sangat baik dan pribadi di seluruh, dan mereka membuat kami merasa di rumah.  Infinity kolam cukup besar, dan marah adalah sekitar 2m. Kami mencoba kolam mata air panas di bawah dek kolam renang dan itu bagus. Ini adalah sedikit lebih besar dari kamar mandi pribadi di kamar mangrove.  Menu pilihan di restoran bisa menjadi lebih baik, karena anda akan…",5
78, Naya Gawana Resort & Spa,"saya dan teman-teman pergi untuk menyelam di pulau menjangan, dan menemukan hotel ini dari agoda. Hotel ini memiliki pandangan yang fantastis! Saya pikir naya gawana adalah hotel terbaik di sekitar... dengan baik nilai uang. Pemandangan matahari terbenam dari dermaga adalah menakjubkan, tapi angin kadang-kadang benar-benar kuat. Pemandangan dari restoran juga besar... sangat santai hanya tinggal di sana memiliki percakapan yang bagus dengan teman-teman dan menikmati minuman anda. Berhati-hati untuk tidak memberi makan monyet yang hang out di sekitar sana. Kami memiliki standar kamar, tidak benar-benar terkesan kami, tapi itu ok. Selalu ingat untuk menjaga anda menutup pintu setelah 5 pm, atau anda tidak akan mendapatkan tidur karena nyamuk. Tidak ada tv di kamar, tetapi mereka…",4
79, Naya Gawana Resort & Spa,"Stafsf sangat membantu, pemandangan menakjubkan, kamar bersih. Mereka tidak tampaknya memiliki air dingin meskipun, setelah kembali dari hari yang panas snorkeling, anda berharap untuk mencuci itu dengan hanya air panas tetapi air dingin. Makanan baik tetapi sangat dasar, dan tidak pilihan yang baik anggur. Tapi itu kecil dibandingkan dengan fasilitas lainnya. Pasti akan datang kembali.",4
80, Naya Gawana Resort & Spa,"Staf yang sangat membantu dan berbicara bahasa inggris dengan baik. Kamar tidak besar tetapi sangat bersih dan nyaman. Lokasi baik, pemandangan yang menakjubkan. Saya merekomendasikan sebagai salah satu top 2 lokasi di daerah ini. (Dan saya telah ke beberapa!)",5
81, Naya Gawana Resort & Spa,"Hotel ini adalah sangat menyenangkan. Kami memiliki ""hanya"" kamar standar, tapi itu benar-benar indah dan saya tidak pernah menginginkan sesuatu yang lain untuk kamar. Saya sangat menyukai kamar mandi luar ruangan. The canopy bed dengan kelambu yang sangat nyaman (meskipun itu pasti memiliki menyediakan kebutuhan standar guna mengingat bahwa ada nyamuk, yang kami diperingatkan tentang oleh staf.) Staf adalah ramah, dan sarapan termasuk lezat dan banyak (buah-buahan, sereal, yoghurt, telur, pancake/wafel station, nasi goreng, kentang, dll)  The kolam renang dan lounge kursi yang bagus dan santai. Mereka juga memiliki bak mandi air panas yang dipicu oleh mata air panas. Satu item untuk dicatat adalah bahwa daerah ini sedikit kompak (yaitu kursi, kolam renang, dan restoran terletak…",4
82, Naya Gawana Resort & Spa,"Kami menemukan lokasi untuk menjadi hal terbaik tentang resor ini. Sangat tempat menawan; tepat di mangrove pohon harbour dan tenang dan masih di malam hari. Ini adalah sangat hotel populer bagi para pelancong eropa, terutama pasangan. The 2nd floor ocean view bungalow kami tinggal di adalah luas dan berdekorasi pas. Meminta untuk bungalow ini (salah satu dari hanya 2 lantai atas) untuk pemandangan terbaik, jika anda tidak keberatan berbagi teras luar ruangan dengan ruangan lain. Saya terkejut oleh sarapan prasmanan setelah membaca ulasan di situs ini menunjukkan itu sangat kurus. Sebagai seorang vegetarian saya untuk melayani di restoran, di mana staf semua bulat muda dan ceria. Tiba lebih awal untuk makan malam untuk prima meja luar dengan pemandangan memukau. Pikiran bahwa…",5
83, Naya Gawana Resort & Spa,"Kami tinggal 4 malam di naya gawana. bungalow mereka yang benar-benar baik (kamar kami adalah Lunbung satu), sempurna untuk bulan madu.  Kolam renang yang bagus (kami memiliki pijat gratis satu hari oleh kolam renang) dengan pemandangan teluk. restoran yang sangat bagus dengan harga yang adil (kami melakukan total 5 hotel) Lokasi adalah satu-satunya kekurangan dari hotel ini: 20min berkendara ke pemuteran di mana ada lebih banyak restoran dan pijat. Tapi jika anda berencana untuk tinggal di naya gawana semua hari, ini adalah tempat yang sempurna",4
84, Naya Gawana Resort & Spa,"Lumbung sangat fantastis, dan spesial yang berbeda, sangat luas. Resor ini sangat bagus, semua orang sangat membantu. Snorkeling adalah menakjubkan di Menjangen! Layak untuk itu. Restoran menu yang agak terbatas jika anda tinggal lebih dari beberapa hari. Dan kami tidak mendapatkan kami yang gratis sebotol anggur...",4
85, Naya Gawana Resort & Spa,Hotel ini sangat ideal untuk snorkeling dan menyelam lokal aktivitas di tengah-tengah hutan bakau. Kolam renang yang menakjubkan dengan restoran besar. Saya menginap di lumbung suite (bukan sisi teluk view seperti yang diiklankan tapi pemandangan taman yang indah) yang cukup besar dan diisi dengan acara bernuansa tradisional. The hotel organises besar snorkeling dan menyelam tur dengan pemandu dan menyediakan pengusir nyamuk lotion yang dapat sangat berguna! Namun hotel tidak mudah untuk menemukan dan jauh sekali untuk kota sehingga satu atau dua malam menginap adalah cukup.,4
86, Naya Gawana Resort & Spa,Saya menghabiskan dua hari di sana dengan istri saya. Itu adalah pengalaman yang luar biasa. Semua yang sangat bagus. Staf sangat baik dan bersedia untuk membantu. Saya tinggal di bay view bungalow. Kamarnya fantastis. Restoran adalah menarik dan makanan adalah benar. Sudah pasti tempat yang baik untuk tinggal.,5
87, Naya Gawana Resort & Spa,"Jika anda pergi ke taman nasional bali barat, naya gawana adalah tempat yang bagus untuk tinggal. Ini adalah vila yang indah dan bagus dan bersih. Kolam renangnya sangat besar, tapi sebagian besar tempat ini adalah penyiapan point untuk menikmati taman nasional. Snorkeling adalah fantastis dan hanya sangat singkat hop ke di mana anda mengisi. Trekking di taman ini juga yang bagus petualangan. Sarapan yang baik dan pelayanan yang baik. Makan malam adalah hanya rata-rata dan anda tidak memiliki banyak pilihan karena anda adalah relatif terpencil.",4
88, Naya Gawana Resort & Spa,"Pasti salah satu highlights dari perjalanan kami ke bali. Semuanya bagus - lokasi, kamar, pelayanan, dll.  Dan kami hanya mencoba 'rendah' bungalow dan tidak suite...  Satu-satunya kelemahan adalah bahwa semua aktivitas yang menambah harga keseluruhan tapi saya kira luxury dilengkapi dengan biaya. ",5
89, Naya Gawana Resort & Spa,Ini adalah oleh jauh yang terbaik hotel kami tinggal di di bali. Kami tinggal di bayview bungalow dan itu sangat menakjubkan! Ruangan itu indah dan terbuka ke luar ruangan mandi dan halaman. Seperti sebuah tempat yang damai untuk tinggal. Areanya cantik dan kolam renangnya indah. Staf yang ramah dan membantu dan makanan di restoran sangat enak. Tidak bisa mengatakan cukup hal-hal baik tentang tempat ini. Hanya berharap kami telah merencanakan untuk tinggal lebih lama dari satu malam.,5
90, Naya Gawana Resort & Spa,"tempat yang sangat bagus untuk tinggal dengan pemandangan fantastis. Staf besar, baik renang tanpa batas, dan jacuzzi hangat. Luar ruangan dengan pemandangan teluk, fantastis sarapan atau makan malam. Pasti akan kembali lagi untuk naya gawana resort...",5
91, Naya Gawana Resort & Spa,"A tempat yang bagus untuk melarikan diri dari kota. 2 lantai villa dengan natural look, pemandangan yang luar biasa di restoran. But resor ini terletak sangat jauh dari Bali center, jalan di luar resort adalah bergelombang yang harus diperbaiki. Muslim berdoa dimulai sekitar pukul 5:30, itu adalah sedikit mengganggu.",4
92, Naya Gawana Resort & Spa,Ada pemandangan yang indah dari kolam renang dan restoran. ini adalah sebuah tempat tenang. Ideal untuk pergi snorkeling di sekitar menjangan sebagai port adalah 3 menit berjalan kaki dari hotel.  Spa Yang Bagus. Sarapan besar. Staf sangat membantu dan ramah. ,5
93, Naya Gawana Resort & Spa,"Gps membawa kami ke naya gawana dengan cara lelah tapi itu adalah membayar off oleh menakjubkan ketenangan dari tempat ini. Sebenarnya pulau menjangan merupakan alasan mengapa kami berada di sini. Kami memiliki yang baik waktu snorkeling di menjangan. Hotel juga ini menyediakan program snorkeling mereka sendiri dan sendiri dermaga. (tp sy ikut snorkeling diluar htl krn hrg lbh mrh yi lwt wonderfulmenjangan. com). Dalam perjalanan kembali ke ubud kami pergi melalui cara singaraja dan menemukan bahwa cara ini adalah lebih baik. Pilihan sarapan adalah terbatas tapi rasanya lezat, kami memiliki makan malam di hotel.",5
94, Naya Gawana Resort & Spa,"Tinggal di sana selama 2 malam di bali kami perjalanan pulang. Dan itu masa menginap yang menyenangkan.  1st dari semua saya ingin mengomentari beberapa pengulas lain komentar tentang makanan: kami menemukan makanan harus lezat dan juga pilihan yang memuaskan. Saya benar-benar selalu senang jika menu tidak menawarkan segala sesuatu dari di mana-mana. Bahwa umumnya memastikan bahwa makanan yang tersedia untuk pilihan akan benar-benar siap.  Juga di hotel dengan standar seperti ini, saya tidak mengharapkan untuk mendapatkan makanan untuk warung pinggir jalan.  Pilihan kamar adalah layak untuk check out. Kami menginap di bayview cottage. Mereka adalah tambahan terbaru dari pilihan akomodasi. Pembangunan banyak kayu dan memberikan suasana yang nyaman, meskipun tidak yang desain…",4
95, Naya Gawana Resort & Spa,"Ini adalah sebuah resor yang indah di tengah-tengah alam park di het barat laut bali. Hotel ini berada di bay. infinty kolam renang yang sangat bagus dengan taman-taman indah dengan bunga-bunga indah kamar mandi dalam. Kamar memiliki kamar mandi luar, sangat istimewa!  Karena resor ini terisolasi harga yang sedikit lebih tinggi dari normal di bali. Dan ada tidak ada restoran di area ini, jadi anda harus makan di resort, di mana menu adalah sedikit miskin. Tidak ada taksi di area jadi anda selalu perlu untuk menyewa mobil.",4
96, Naya Gawana Resort & Spa,"Hotel ini terdiri dari serangkaian bagus Bungalow kayu yang tersebar di sebuah taman di perbatasan hutan bakau yang memberikan di cove di utara bagian barat dari Pulau Bali. Teluk digunakan sebagai pelabuhan perikanan ""tua"" dan sekarang titik awal untuk menyelam/snorkeling kunjungan di sekitar pulau Menjangan.(Bagian ini dari Bali apalagi manja dibandingkan di selatan dan belum mudah dicapai dari Jawa dengan feri.) Layanan ini sangat ramah dan membantu, tapi tidak terlalu mengganggu. Infinity kolam sangat indah dan berfungsi sebagai titik sentral hotel. Kami memiliki itu hampir untuk diri kita sendiri ketika kita datang. Restoran sangat baik dan posisinya di dek atas Teluk membuatnya ideal untuk makan malam romantis. Kami menghabiskan tiga indah hari di sana.",5
97, Naya Gawana Resort & Spa,"Sebuah hotel yang menyenangkan di sisi barat laut jarang dikunjungi Bali. Itu adalah lima jam perjalanan dari Denpassar masa lalu beberapa pedesaan yang indah serta beberapa kota kecil yang sangat sibuk. Kamar yang luar biasa ditunjuk. Bungalow kami memiliki kolam renang air mineral alami makan yang manja kami. Staf, seperti dengan paling kelas atas Bali Hotel adalah ramah dan menampung. Restoran hebat dengan berbagai pilihan lokal, Cina dan barat persembahan pada menu. Terletak tepat di air, di tepi taman nasional dan dengan armada kapal menyelam merupakan tujuan yang sangat baik untuk penyelam dan snorkelers. Akses internet gratis tapi eratic.",4
98, Naya Gawana Resort & Spa,"Kami tinggal di hotel ini indah selama perjalanan baru ke Bali. Vila-vila indah dan air hangat berasal dari alam musim semi termal yang indah untuk mandi dan mandi. Hotel ini terisolasi jadi jika Anda ingin untuk dapat pergi berbelanja atau untuk lain restoran untuk makan malam kemudian tempat ini mungkin tidak untuk Anda. Namun, jika Anda mencari lokasi yang indah dan damai dengan kamar besar, kolam renang luar biasa dan sekolah menyelam yang masih menyediakan layanan pribadi maka ini adalah tempat untuk Anda. Anda juga dapat melakukan perjalanan menunggang kuda di taman nasional dan melihat rusa. Jika Anda adalah lampu tidur kemudian diperingatkan bahwa masjid lokal tidak pagi ""panggilan untuk doa""",5
99, Naya Gawana Resort & Spa,"Menghabiskan 4 hari dengan pasangan saya di sini. Tidak mengharapkan banyak tapi ternyata menjadi awesome istirahat dari bekerja! Transfer dengan mobil dari Denpasar bandara ini lama walaupun kira-kira 3 dan setengah jam tapi pemandangan pemandangan (pada satu tahap kami adalah 1.400 m di atas permukaan laut) dan pandangan WOW! Saya telah ke Bali setiap tahun selama 15 tahun terakhir ini adalah bagian dari Bali saya belum melihat dan itu menawan!  Resor ini secara alami pemandangan yang duduk di dalam Taman Nasional Bali Barat. Hanya 16 Suite. Kami tinggal di Lumbungan Suite. Hanya masalahnya tidak ada TV atau WIFI. Namun, seperti kita, kita ingin melarikan diri dari dunia teknologi! Ruangan itu besar dan kenyamanan dan kamar mandi bisa muat 2 kingsize tidur dan terbaik dari…",4
100, Naya Gawana Resort & Spa,"Don't get me wrong, hotel beautifull. Kamar menakjubkan, dan kolam renang dan divecenter (juga sebagai menyelam) yang besar. Tetapi ketika Anda telah melakukan perjalanan di sekitar Bali dan Anda mendapatkan di sini Anda akan memperhatikan harga tinggi extremly. Lokasi tenang, yang merupakan choise. Namun Anda lebih terikat untuk hotel dan restoran di pemandangan. Unfortunally mereka biaya dua kali harga untuk makanan dan minuman di tempat lain di Bali. Ini adalah seperti pitty.  Hal lain adalah bahwa kita memiliki ruang dekat untuk tempel. Dan minggu yang kami berada di sana mereka punya semacam perayaan terjadi. Unfotunally dengan banyak enoying musik dari 6 sampai 11 pm.... Rasa malu....",2
101, Naya Gawana Resort & Spa,"Taman Nasional Bali Barat adalah wilayah besar jauh dari keramaian selatan Bali. Resor ini adalah di depan pintu itu. Kota ini terletak di tepi Teluk yang dikelilingi oleh hutan bakau. Itu adalah sekitar 30 - 40 menit dengan perahu ke pulau Menjangan untuk menyelam atau snorkeling, di mana karang tetap dalam kondisi sangat baik. Kami tinggal di mangrove villa. Datang dengan air panas alam jacuzzi bak mandi di tertutup, diperpanjang kamar mandi luar, di mana kita benar-benar menikmati berendam setiap hari.  Ada lanai wajah yang hutan bakau, sehingga pandangan agak dekat, tapi itu bagus untuk memiliki pengaturan yang alami. Staf yang indah.  Kami bisa duduk di dermaga di Teluk dan menyaksikan matahari terbenam di belakang gunung berapi timur pulau Jawa, yang cukup spektakuler.…",4
102, Naya Gawana Resort & Spa,"Saya agen perjalanan dan melakukan banyak penelitian sebelum pemesanan di sini.  Aku punya teman yang adalah perwakilan penjualan untuk Garuda Indonesia Airlines dan dia melakukan memperingatkan saya itu jauh untuk pergi. Namun, perwakilan Novus Gawana menyarankan saya itu hanya 2.5hrs. Baik itu mengambil minimum 3hours dan sekitar setengah jalan, jalan ini sangat berangin ke titik itu memuakkan. It's off jalur dan masih pengalaman yang fantastis.  Jika saya adalah pemesanan hotel ini tidak pada kesepakatan yaitu tetap membayar kesepakatan tinggal 3 membayar 2 saya tidak akan tinggal di sini. Saya benar-benar tidak berpikir itu bernilai uang. Apa yang Anda bayar adalah lokasi itu tertanam di Taman Nasional Bali Barat. Aku tidak menemukan hotel atau daerah khusus cukup atau…",3
103, Naya Gawana Resort & Spa,"Indah taman properti di relatif jauh bagian barat laut dari pulau (Taman Nasional Bali Barat). Apalagi turis daripada Lovina, dan jelas bukan tempat untuk pesta atau surfing seperti Kuta dan tidak ada gaya resor besar yang kompleks seperti Nusa Dua atau Jimbaran. Jika Anda suka alam yang terbaik, dikelilingi oleh ketenangan, menghadap Teluk tenang, kesempatan untuk baris dan menyelam, dalam pengaturan intim jauh dari peradaban modern, tetapi masih disertai dengan penuh perhatian, berpengetahuan staf yang menghormati privasi, maka ini adalah tempat untuk Anda. Tidak ada televisi di kamar. CD player untuk musik hanya.   Sulit untuk menemukan jika Anda mengemudi, kecuali jika Anda berjiwa petualang. Menakjubkan adaptasi dari arsitektur, dan sangat gurih penggabungan fasilitas…",5
104, Naya Gawana Resort & Spa,"Ini adalah hotel yang sangat bagus dengan alasan yang indah. Sangat dekat dengan dermaga ke pulau Menjangan menyelam. Makanan yang sangat baik. Kolam bagus menghadap Samudera. Satu-satunya hotel yang diperlukan adalah sebuah pantai, tapi dekat dengan banyak kuil. Mereka memiliki staf yang terbaik.",4
105, Naya Gawana Resort & Spa,"Istri saya memesan hotel ini, salah satu dari empat kita tinggal di Bali perjalanan kami. It's 4,5 jam dari bandara - jika Anda bepergian di malam hari, Anda kehilangan kesempatan untuk mengunjungi beberapa situs di bawah mengunjungi dan menarik di jalan. It's cara di North West of Bali di taman nasional - besar untuk satwa liar, pantai dan air. Resor diatur terjangkau transfer dengan sopir berpengetahuan. Ini damai dan indah. Kami tinggal di salah satu dari dua Suite dengan taman-taman luar pribadi dan itu besar risiko kolam/jacuzzi diberi makan oleh air hangat vulkanik yang alami adalah memperlakukan nyata. Ada dua tamu lain di resort ketika kami berada di sana. Staf ramah, lembut dan membantu. Kolam renang memiliki pandangan untuk mati bagi. Itu pilihan yang bagus bagi kita…",5
106, Naya Gawana Resort & Spa,"Excellent lokasi di teluk kecil dekat pulau Menjangan dan Taman Nasional Bali Barat di utara Bali semua kamar yang besar ""gawana"" Balines Cottage tradisional. 2 Toko besar konstruksi sepenuhnya air conditioning dan dengan balkon besar. Tempat yang benar-benar romantis. Kolam renang Excellent. Spa dan internasional menyelam pusat. Jauh dari setiap facilitie lain kecuali Mimpi resort. Anda akan membutuhkan sebuah mobil jika Anda ingin pergi keluar. Staf yang ramah. Dalam pendapat saya baik nilai untuk harga ",5
107, Naya Gawana Resort & Spa,"Saya dan suami saya pergi ke Gawana untuk bulan madu kami pada Januari 2007 dan benar-benar mencintai it...one tempat terbaik yang kami pernah tinggal di...  Tenang, romantis tempat yang indah, pikiran bertiup pandangan, layanan besar, orang-orang yang sangat baik, membantu dan sopan. dan besar makanan. Seperti itu musim ramping, kami adalah salah satu dari 5-10 orang di sana pada waktu itu tapi itu tidak ada masalah sama sekali.  Satu-satunya masalah dengan tempat ini terjadi jarak dari bandara (sekitar 4 jam dengan mobil) atau tempat lain seperti Bali kota utama.  Idealnya aku akan merekomendasikan tiga sampai empat hari tinggal di sini clubbed dengan tiga sampai empat hari lagi lebih dekat ke kota utama. Juga sangat merekomendasikan snorkeling. Anda juga dapat mencicipi…",5
