,hotel,review,stars
77, Okawati Boutique Bungalows,"Saya akan memesan Okawati dan membaca ulasan tentang renovasi dan memutuskan untuk mencari di tempat lain. Kemudian saya mendapat sibuk, salah meletakkan catatan dan memesan Okawati. (Ini termasuk di daftar tempat-tempat yang bagus untuk menginap di the guardian yang saya temukan di line). Saya sangat senang bahwa saya memory gagal saya karena kami mencintai hotel dan akan pergi ke sana lagi. Kami berada di kamar 8B dan kami senang berada di lantai dasar karena tidak satu pun dari kita merasa seperti liburan indah. Ya, kamarnya gelap jika jendela ditutup tetapi tidak jika mereka terbuka di siang hari. Sarapan disajikan pada beranda pribadi yang sangat baik. Tempat tidurnya sangat nyaman dan kamarnya bersih. Ya, wastafel di kamar mandi mungkin mungkin datang dari dinding jika…",5
78, Okawati Boutique Bungalows,"Kami datang ke bali sering dan saya luka tidak tinggal di tempat lain di ubud.  Ya, konstruksi berjalan dengan banyak upgrade, tapi pekerjaan yang sedang dilakukan tidak mempengaruhi anda tinggal di lagi. Wifi adalah yang paling konsisten kami alami di perjalanan ke bali ini.  Staf adalah luar biasa dan akan membantu menemukan apa pun yang anda mungkin mencari di ubud. Jika anda memiliki masalah atau masalah staf adalah cepat untuk alamat hotel ini... apa lagi yang bisa anda minta?  Bangunan lebih tua tapi itu memberikan seluruh properti memiliki sebuah ""tua"" bali merasa yang kami benar-benar menghargai.  Dan untuk mencoba buatan sendiri sarapan yoghurt dengan madu yang sangat mengagumkan.",5
79, Okawati Boutique Bungalows,"Gusti di Okawati akan mengetuk anda keluar dengan sweet peduli. Ia adalah begitu baik untuk kita, mengatur dijemput, sopir untuk tur dan masih banyak lagi. Dia bahkan memesan kami perahu ke gili dan menurunkan di hotel lain di Sanir setelah kami kembali dari gili. mhe menelepon saya di 6 di pagi hari di namun hotel lain untuk mengingatkan saya penjemputan saya akan berada di sana segera. Hotel ini tenang dan tempat pertemuan di bali. Bersih dan nyaman. Sarapan besar dan kolam renang dan untuk harga ($45 sehari) superp.",5
80, Okawati Boutique Bungalows,"Kami menginap di the Okawati beberapa kali & selalu menemukan staf sangat manis & membantu. Kali ini namun, ada renovasi terjadi di yang kami tidak diberitahu tentang. Kami memesan 7 malam di buddha kamar, yang adalah yang paling mahal, dengan udara con & adalah tepat di sebelah renovasi. Air panas tidak bekerja baik. Kami hampir pindah, tapi madame Okawati memberi kami diskon & menempatkan dalam sistem air panas baru jadi kami tinggal. Kamar mandi adalah membutuhkan perbaikan. Saya akan berpikir kembali mengenai kerikil di bawah mandi dasar. Ini adalah tempat yang bagus untuk kuman & tidak nyaman di kaki. Sarapan adalah selalu bagus & meskipun renovasi yang mengganggu saya masih akan kembali mudah-mudahan, saat pekerjaan selesai setelah maret. Ini adalah lokasi yang besar,…",3
81, Okawati Boutique Bungalows,"Kami telah ke Okawati sebelum dan kembali karena kami menyukai suasana bali otentik dan lokasi pusat di ubud. Kami tahu itu adalah tanpa embel-embel hotel tapi itu membuat untuk itu dengan cara lain. Namun kami tidak diberitahu bahwa renovasi mengambil tempat cukup luas, pembangunan untuk kamar baru dan restoran secara harfiah meter dari kolam renang. Sangat tidak mungkin untuk mengabaikan karena sebagian besar kamar menghadap kolam dan kebisingan konstruksi dimulai awal di pagi hari dan pergi sepanjang hari. Beberapa kamar lebih buruk daripada yang lain dan kita menyadari satu tamu yang telah memesan untuk tujuh malam pemesanan keluar segera ketika ditampilkan kamar. Sebagai selalu staf yang baik namun mereka bisa tidak menebus ketidaknyamanan dan tidak ada permintaan maaf yang…",3
82, Okawati Boutique Bungalows,"Saya membaca ulasan dan memesan untuk 4 malam melalui pemesanan. com. Tempat ini adalah saat ini setelah sangat diperlukan renovasi saya percaya. Penerimaan adalah meja di garasi area penuh dengan sepeda motor. Pertama-tama tidak ada catatan saya setelah memesan di semua, untungnya aku punya tangkapan layar faktur saya. Setelah banyak pertimbangan dan diskusi antara dua staf kami dibawa ke kamar kami. Kamarnya sangat bau dan tidak ada penerimaan wifi di semua. Tidak ada tv baik... Ketika saya bertanya tentang penerimaan wifi saya diberitahu untuk duduk di samping kolam renang. Saya tidak mengatakan bahwa situs web menyatakan wifi yang sangat baik, tampaknya karena membangun karya hanya ada wifi di sebelah kolam renang, atau di restoran HAHAHA . Restoran adalah meja dengan 6…",1
83, Okawati Boutique Bungalows,"Kami tinggal selama 3 malam dan itu sedikit surga jauh dari semua kebisingan dan lalu lintas dari ubud. kamar yang sangat bagus dan tempat tidur yang nyaman. Kami menikmati sarapan di balkon kami setiap pagi dengan buah dan yoghurt terbaik yang pernah saya makan. sangat ramah dan menampung staf, mereka mengatur sopir untuk kami beberapa kali. Okawati dekat dengan segala sesuatu, jalan monkey forest, pasar dan banyak restoran. Kolam renang adalah plus tambahan. Mereka tidak menawarkan makan malam di balkon tapi kami pergi keluar setiap malam. sangat tenang di malam hari dengan hanya jangkrik dan kicau burung.",4
84, Okawati Boutique Bungalows,"Kami menginap 4 malam di sini (hanya) tapi itu adalah pengalaman yang sangat baik dan kami akan kembali kapan saja! Hotel ini sangat tenang dan dikelilingi oleh alam, itu adalah di tengah-tengah ubud, sehingga anda dapat berjalan di sekitar kota tanpa menggunakan transportasi. Hotel ini memiliki kolam renang yang sangat bagus juga. Saya juga dapat merekomendasikan makanan mereka mempersiapkan di hotel. Staf adalah sangat ramah dan membantu. Kami pasti merekomendasikan tinggal di sini!",5
85, Okawati Boutique Bungalows,"Kami tinggal 5 malam di agustus 2014 di ubud dengan keluarga kami lima. Okawati adalah sempurna mundur (namun strategis) setelah jam tindakan di kota atau lingkungan ini. Staf ramah dan membantu dan akan mendukung anda dengan hanya tentang apa pun yang anda butuhkan. Hotel kolam renang adalah yang pasti plus, air yang baik.",5
86, Okawati Boutique Bungalows,"Tenang namun dekat ke objek wisata utama, Okawati adalah tempat sempurna untuk pertama-timer bali seperti tunangan saya dan saya. Sarapannya enak dan stafnya ramah. Kamar mandi telah melihat hari yang lebih baik tapi kemudian, ini bukan hotel bintang lima. ",5
87, Okawati Boutique Bungalows,"Kami menghabiskan 7 malam di Okawati hotel, dan menikmatinya banyak. Semua staf yang sangat menyenangkan dan membantu. Area kolam renangnya terasa seperti anda sendiri sepotong kecil surga. Sarapan kami sangat lezat, dan saya menikmati bisa mengisi memesan malam sebelumnya. Mereka benar-benar di tengah perombakan restoran mereka, yang mudah-mudahan akan selesai segera. The Okawati adalah hanya beberapa menit berjalan kaki dari monyet rd ., salah satu jalan utama di ubud. Ini adalah perjalanan pertama kami ke bali, dan itu bagus untuk menghabiskan begitu banyak waktu di kota seperti ubud yang memiliki begitu banyak yang ditawarkan dalam hal penampilan tarian, seni visual, restoran, dan hiking di dekatnya.",5
88, Okawati Boutique Bungalows,"Kami punya pengalaman menginap yang indah di lokasi ini. Memiliki beberapa awesome makanan dengan harga murah. Sarapan di kamar anda, yang menakjubkan. Kolam renang adalah besar dan selalu dibersihkan. Staf yang sangat membantu dan benar-benar ramah. Kamarnya indah dan bersih.",5
89, Okawati Boutique Bungalows,"Kami memesan hotel ini berdasarkan rekomendasi lonely planet. ini benar-benar baik nilai untuk uang. Yang sedikit pedesaan dan diperlukan beberapa touch-up di kamar. Mandi sedikit lemah, tidak ada tv di kamar tapi itu seharusnya damai. Ac adalah sedikit lemah tapi lagi karena kamarnya memiliki celings tinggi. Taman yang bagus dengan kolam renang kecil. Saya rasa mereka sedang membangun lain blok sebelah resepsionis. Sarapan agak dasar dan kualitas bisa lebih baik. Dalam ringkasan tempat yang bagus dengan karakter besar tapi kenyamanan adalah rata-rata.",3
90, Okawati Boutique Bungalows,"The Okawati hotel, jika anda memiliki anggaran, adalah salah satu yang terbaik di ubud. Dekat pasar, namun, terletak di tenang, tenang dan damai lokasi dari jalan utama. Mendapatkan ke Okawati hotel agak mengkhawatirkan, sebagai tanda memimpin kita turun beberapa lorong-lorong; tapi ini menambah pesona setelah anda mendapatkan di sana.   Fasilitasnya bagus namun, karena saya menginap dengan teman-teman, kami menemukan kualitas dari kamar tidak bervariasi cukup sedikit. Saya yang beberapa teman-teman saya dan saya menempati kamar 1A dan b, yang sangat baik, tapi, teman yang lain menemukan kamar untuk menjadi kualitas yang jauh lebih murah daripada kita.   Sarapan adalah tidak secangkir teh (maafkan pun-nya) tapi teman-teman saya tampak menikmatinya. Layanan hebat dan sangat…",4
91, Okawati Boutique Bungalows,Hotel ini adalah sempurna untuk siapapun yang ingin kemampuan untuk berjalan ke semua tempat di ubud tapi bersantai di peristirahatan yang tenang. Staf sangat ramah dan membantu. Ms Okawati lebih besar kita sendiri. Kolam renangnya bagus dan kamar memberi anda merasa intim untuk budaya lokal. Sarapan disajikan tepat di luar kamar kami.,5
92, Okawati Boutique Bungalows,"Telah menginap di sana untuk 2 malam. Kamarnya indah siap, dengan tempat tidur yang nyaman, bekerja ac dan ruang hidup yang baik. Daerah hotel adalah hanya indah, bersih, baik taman dengan bunga dan tanaman semua di sekitar, kolam renang yang bagus dengan air jernih, cukup dalam... Sarapan sangat baik dengan jus buah segar dan pancake besar.  Staf sangat baik dan membantu. Saya akan merekomendasikan hotel ini kepada siapa pun bersedia untuk tidur di suasana tradisional indonesia.",5
93, Okawati Boutique Bungalows,Kami telah mencapai 4 malam menginap di Okawati. Hal ini di lokasi yang besar - hanya dari jalan hutan monyet di ujung istana. (Tip: ada sisi jalan kecil di ujung lapangan sepak bola yang Anda perlukan untuk kepala ke bawah sebelum berbelok ke kanan). Ada tidak ada lalu lintas suara meskipun banyak burung dan beasties lain membuat untuk itu!  Pisang pancake untuk sarapan yang benar-benar lezat dan Anda dapat melihat atas sawah sebelah sambil mengunyah.  Kamar yang bersih dan dalam urutan yang baik dengan semua dasar-dasar yang diambil dari perawatan (ada hanya satu pengering rambut dibagi antara semua kamar meskipun sehingga akan merekomendasikan Anda membawa Anda sendiri).  Kami hanya keluhan adalah bahwa proses pemesanan e-mail yang meninggalkan semua orang sedikit bingung…,4
94, Okawati Boutique Bungalows,"Kami tiba cukup setelah hari mengeksplorasi dan itu agak sulit untuk menemukan, ada beberapa cara gang yang Anda butuhkan untuk usaha turun (pada kaki) tetapi jika Anda mengikuti tanda-tanda Anda akan baik-baik saja. Penerimaan apa-apa tapi grand tapi beyond beautful kebun, pencahayaan dan kolam renang tampak hebat. Kami punya kamar deluxe dan itu besar! indah poster empat besar tempat tidur dan ukiran batu di dinding, kita telah windows yang melihat ke kolam renang dan kemudian balkon pribadi besar yang tampak atas sawah. Kita bisa melihat pembangunan sebelah tapi tidak terpengaruh oleh kebisingan. Kamar dan kamar mandi bersih tetapi mandi tekanan tidak besar dibandingkan dengan di tempat lain kami tinggal. Sarapan adalah ilahi dan besar dan memiliki pilihan untuk memilih…",4
95, Okawati Boutique Bungalows,"Kami telah bepergian dengan dua pasangan untuk dua setengah minggu di bali. Ubud adalah kedua kami tinggal dan kita mencintai hotel untuk lokasi bagus dari jalan-jalan sibuk, dengan pemandangan sawah pedesaan. Ruangan yang ok, kamar mandi agak ketinggalan jaman. Kami hanya makan pagi di hotel, yang sangat baik dengan pelayanan yang baik. Untuk restoran kami mengunjungi beberapa restoran di jalan-jalan dekat dengan hotel, yang menawarkan makanan Bali yang sangat baik. ",4
96, Okawati Boutique Bungalows,"Kami baru-baru ini tinggal di Okawati Hotel selama 9 hari. Sedikit kebingungan ketika kami pertama kali tiba sebagai kamar tepat berikutnya ke situs bangunan (yang dekat selesai!), sehingga mereka dapat menggerakkan kita ke ruangan lain (lebih rendah standar tetapi kita harus membayar harga yang sama?) Kamar yang ukuran yang baik tetapi kamar mandi tidak terlalu bersih yang saya mempertanyakan mereka tentang... mereka sudah mencoba mereka yang paling sulit untuk membersihkannya. Hotel itu sendiri adalah sangat tradisional Bali yang lama, yang kita inginkan, daripada modern! Daerah hotel ini sangat tenang, surga nyata dari jalan yang sibuk dan lokasi yang benar-benar baik. Area kolam indah dan santai. Sarapan adalah bagus... mereka membawanya ke kamar Anda setiap pagi. Aku hanya…",3
97, Okawati Boutique Bungalows,"Kami meninggalkan kami pemesanan untuk Ubud cukup terlambat dan seperti itu sangat sibuk kami harus menetap di akomodasi apa pun yang tersedia. Kami memilih Okwati pada wisatawan ulasan berpikir itu akan nyaman tetapi tidak ada yang istimewa. Apa kejutan! Tempat ini adalah sebuah oase tersembunyi sisi Gang.   Kami mengambil ruang Buddah diperbaharui baru dan itu benar-benar mengejutkan kami. Besar Kingsize Bed, LCD TV (kami pikir tidak ada), dilengkapi ruang ruang tunggu, lemari es yang besar, kamar mandi/Toilet luar dan lorong menuju teras belakang besar yang diabaikan kolam renang. Semua bergaya Bali dan tidak modern ""sama sama"" akomodasi.  Dengan alasan tidak besar tapi taman indah dan ada juga sebuah restoran luar dekat kolam renang. Melempar bebas Wi Fi dan sarapan dikirim…",5
98, Okawati Boutique Bungalows,"Terima kasih untuk perencanaan awal miskin di musim yang tinggi, kita melompat ke tiga hotel yang berbeda selama kami tinggal minggu di Ubud. Okawati adalah favorit pasti, meskipun dengan beberapa peringatan. Okawati adalah sepenuhnya memesan selama kami tinggal di sana, jadi malam pertama kami telah memesan salah satu dari mereka ""murah"" kamar Superior. Pada $65, ini adalah kekecewaan besar - balkon indah, tapi sangat lama perabot termasuk kamar mandi yang ketinggalan jaman. Saya harus mengatakan bahwa saya $20 Ubud Bungalow kamar adalah jauh lebih baik daripada ini. Dua malam itu di kamar deluxe, yang $ 10 lebih itu pasti berharga tambahan biaya. Kamar ini adalah malam dan siang---ruangan ini adalah benar-benar direnovasi dan benar-benar cantik dan baru, dengan bak mandi…",4
99, Okawati Boutique Bungalows,"Tinggal di Bungalow Okawati itu menyenangkan dan salah satu pengalaman kami di Ubud, Bali. Kami tinggal di sana tujuh malam dan menikmati sarapan lezat, dan staf yang sopan dan ramah. Okawati dirinya itu sangat ramah dan membantu. Bungalow kami adalah bersih dan tenang, dan hanya 10 menit berjalan kaki ke Dewan Pariwisata di pusat kota. Setelah tinggal di sana beberapa malam, rasanya seperti di rumah. Kita kehilangan berada di sana",4
100, Okawati Boutique Bungalows,Itu adalah sekitar 500 mtrs dalam dari jalan utama tetapi hotel bagus dengan restoran keturunan. Itu adalah berjalan kaki dari hutan monyet Suci dan sangat dekat dengan pusat pasar dan informasi.,4
101, Okawati Boutique Bungalows,"Kami hanya tinggal selama satu malam di hotel ini (setelah menghabiskan malam sebelumnya di kakak mereka homestay ""Ubud Dream"".) Segera setelah kami masuk ke hotel kami tahu telah membuat pilihan yang tepat untuk tinggal - kolam renang adalah soo mengundang, dan kami menghabiskan beberapa jam santai oleh kolam renang (hanya dibatasi oleh kurangnya matahari!) Kamar kami adalah indah dan unik, dengan tempat tidur 4 poster. Mereka melayani teh sore di teras (yang kita asumsikan itu indah, walaupun tidak mendapatkan bulat untuk menikmatinya!)  Kamar mandi adalah bersih, jika sedikit tanggal, dengan tirai yang baik bisa menyembunyikan Anda di toilet atau di kamar mandi, tapi tidak keduanya!!  Kita tidak bisa menikmati sarapan, seperti mereka lupa untuk memberikan itu, seperti yang…",4
102, Okawati Boutique Bungalows,"Aku hanya tinggal di hotel ini satu malam, tapi itu begitu damai, aku punya besar malam tidur di sini. Aku mengambil satu ini karena memilih di lonely planet dan Anda dapat melihat mengapa. Kamar dihiasi fantastis. Lokasi sangat bagus untuk pusat Ubud, meskipun sebagian besar tempat di daerah ini menutup di 11. Staf yang sangat besar dan bahkan mengatur tiket bagi saya untuk acara malam di menit terakhir Ubud. Pagi sarapan disajikan di balkon rasanya jadi yang lezat pisang pancake. Tidak ada TV tapi wifi tersedia tetapi siapa yang butuh itu ketika Anda bisa bersantai, dan menonton kelinci di taman.",4
103, Okawati Boutique Bungalows,"Okawati adalah tempat yang bagus untuk tinggal, pada awalnya ketika Anda drivertells taksi yang Anda tidak dapat diakses oleh mobil Anda mungkin regreting membawa Anda raksasa koper beroda tetapi sekali Anda berada di sini tenang dan indah!  Anda tepat di tengah segala sesuatu dan dekat dengan amamzing restoran, berbelanja dan Museum, tetapi Anda adalah tersimpan sehingga Anda tidak mendapatkan suara dari semua itu!  Staf Soo ramah dan baik dan bahagia untuk menjawab pertanyaan dan chit chat untuk sedikit, layanan terbaik kami sudah dan kami tinggal di hotel-hotel yang lebih menarik di sini. Makanan sangat baik kami memiliki sarapan dan makan malam di sini dan cukup murah.  Kamar yang gelap sedikit tetapi mereka besar dan indah, tempat tidur nyaman dan bersih! Kamar mandi senang…",5
104, Okawati Boutique Bungalows,"Saya dan pacar saya mencintai Okawati Hotel. Kami tinggal di sana dua kali sementara perjalanan di Bali pada bulan November-Desember 2010. Staf yang benar-benar ramah dan membantu, dan saya pikir Okawati dirinya itu indah. Dia adalah selalu benar-benar ramah, tertarik pada apa yang telah kita lakukan, dan baik untuk kita.   Kamar yang indah dihiasi, seperti kebanyakan hal di Bali, dengan dinding batu ukiran dan ukiran kayu tempat tidur. Kamar mandi tidak begitu mewah tapi aku tidak peduli sama sekali. Makan pagi dan sore yang besar. Aku mencintai scarmbled telur dia melakukan (resep dengan sedikit potongan tomat dan rasa lain). Berharap aku punya resep!   Kolam renang benar-benar bagus, dan aku mencintai betapa damai dan cukup alasan itu. Semua di sekitar kolam renang adalah…",4
105, Okawati Boutique Bungalows,"Kami mencintai segala sesuatu tentang Okawati. Kami adalah keluarga dengan anak-anak 3, 2 dewasa muda dan 9 tahun. Mereka semua menyukainya. Hal ini terletak di lepas jalan hutan monyet di bawah beberapa utnuk sehingga sangat dekat dengan segala sesuatu tetapi sangat tenang. Pada malam hari Anda dapat dia katak-katak.  Kami dijemput di bandara, tidak ada masalah. Kami menggunakan driver yang sama beberapa kali selama kami tinggal. Ia adalah ramah, menampung dan dapat diandalkan.   Staf yang begitu indah, membantu dan ramah. Mereka benar-benar hebat dengan anak muda kami, benar-benar membuatnya merasa di rumah.  Kami memiliki 2 kamar, ruang keluarga dan ruang sebelah di lantai dasar. Mereka adalah bersih, rapi, baik terus dan nyaman. Ruang keluarga adalah ukuran besar, banyak…",5
106, Okawati Boutique Bungalows,"Kami menyukai hotel ini, staf sangat membantu dalam setiap aspek, kami tinggal di lantai paling atas dan ruangan itu benar-benar hebat, pindah ke ruang ekstra deluxe untuk 1 malam itu kamar mandi luar dan banyak lebih baik tidur juga sangat baik, sarapan di geladak setiap pagi, seperti orang-orang baik yang bekerja di sana dan pemilik adalah indah, benar-benar menikmati sesama muda di meja Komang ia membantu kita banyak dengan pemandangan untuk melihat, tetapi dengan begitu tenang sehingga dekat dengan pusat kota dan hal-hal yang Anda butuhkan untuk mendapatkan dan merasa aman di mana-mana, membawa cahaya untuk gang kecil di malam hari dan juga untuk jalan-jalan di ubud, trotoar gila tidak merata, terima kasih lagi patti dan sandy",5
107, Okawati Boutique Bungalows,"Kami menghabiskan dua malam di Okawati Hotel di Ubud. Aku datang di sebuah rekomendasi tentang hotel di travel blog. Aku menghubungi pihak hotel melalui situs web mereka dan mendapatkan respons hari berikutnya. Mereka juga mengatur Bandar Udara memilih untuk kita. Jika Anda memiliki suitecases besar dan ingin mereka untuk menjemput Anda membiarkan mereka tahu Anda membutuhkan sebuah mobil yang besar...   Ruangan keluarga itu sangat luas. Itu tempat tidur ganda yang besar, Ratu tempat tidur dan tempat tidur tunggal. Mereka arraged ketika menggunakan ranjang bayi untuk balita saya juga. Ruangan itu sangat bersih. Terpisah bak mandi dan mandi di kamar mandi. Satu-satunya sisi adalah kamar mandi tidak memiliki sebuah pintu dan langkah-langkah kamar tidak memiliki rails. Jadi…",4
108, Okawati Boutique Bungalows,"Kami memiliki waktu yang baik di sini kita memperluas kami tinggal. Berhati-hatilah itu mendapat memesan di muka dan jadi membayar untuk mendapatkan terorganisir sebelumnya atau Anda mungkin harus memindahkan kamar beberapa kali seperti yang kita lakukan!  Jika Anda mampu membelinya memilih ruang delux. Mereka jauh lebih ramah, sangat luas dan memiliki kamar mandi yang indah.  Area kolam indah dan santai, dan bahkan ketika hotel ini penuh itu tidak merasa dengan cara apapun atas ramai.  Memiliki pilihan untuk memiliki sarapan yang dikirim ke balkon Anda adalah sentuhan yang indah. Anda dapat menentukan waktu yang Anda akan menyukainya dan pisang pancake lezat!  Staf sangat ramah, dan tidak cukup untuk membantu. Saya pasti akan merekomendasikan hotel ini dan Ubud adalah harus…",4
109, Okawati Boutique Bungalows,"Kami tinggal selama dua malam dan akan senang untuk memperpanjang jika kita tidak punya rencana sebelumnya. Saya suka lokasi dan Anda dapat bersantai dan tidur dengan benar. Tidak ada TV dan telepon di ruang tapi mereka akan mencoba untuk mengurus semua kebutuhan Anda. Aku harus mengatur penerbangan dan staf yang disebut maskapai bagi saya segera. Saya sangat merekomendasikan, harga yang wajar untuk tinggal di Ubud.",4
110, Okawati Boutique Bungalows,"Ruangan kami awalnya seharusnya tetap itu desaster: di lantai dasar, sangat gelap dan sangat bau (berpikir ftom kamar mandi). Kami mampu mengubah kamar lebih baik yang juga lebih mahal. Bahkan untuk Indonesia standar staf adalah lemah. Hal itu membawa mereka hampir tiga hari untuk memperbaiki TV. Mengeluh dan permintaan semua ditangani dengan ketidakpedulian.",2
111, Okawati Boutique Bungalows,"Kami bepergian dengan sekelompok 7. Kami menemukan hotel menjadi cukup menyenangkan, bersih, tenang, dan sarapan besar. Kami berada di ruangan 2B(upper). Teman kita berada di 1B - sehingga kita berbagi balkon dan memiliki waktu yang menyenangkan. Kamar ini baru atau sepenuhnya diperbaharui. Besar, indah kamar mandi dengan bak mandi dan shower terpisah, frig, balkon besar. Yang mengatakan, sisanya kelompok kami berada di gedung tua. Itu cukup perbedaan - salah satu khususnya sangat bahagia. Saya pikir itu sebabnya Anda melihat ulasan yang beragam. Oka Ouati adalah wanita cantik dan tuan rumah ramah. Staf penuh perhatian dan ramah. Jika Anda pergi keluar dan tidak akan kembali sebelum gelap, pastikan untuk mengambil senter. Gang ke hotel ini sangat gelap setelah 21:30 - meskipun…",4
112, Okawati Boutique Bungalows,"Saya setuju dengan semua sebelumnya tinjauan positif hotel ini--itu benar-benar sebuah ""oasis"" di Ubud.  Aku tidak mengerti bagaimana seseorang bisa memanggil kamar kotor atau gelap--mereka adalah sangat bersih dan hampir karya seni (kami tinggal di 2 kamar yang berbeda). Kolam itu bersih, tenang dan indah.  Saya hanya ""citicism"" akan bahwa isperhaps hotel agak pricy (mereka meminta IR 650 k dan kami membayar IR550k)--mengingat bahwa ada sebenarnya beberapa sangat bagus hotel segera di sekitar hotel ini meminta harga yang lebih rendah--mungkin ini datang dengan menjadi ""memilih"" dari Lonely Planet?  Namun demikian, Oka Wati hotel yang bagus dan staf yang besar!",4
113, Okawati Boutique Bungalows,"Indah tenang hotel kecil dekat dengan jalan utama. Kami memesan untuk 4 malam dan akhirnya diperpanjang hingga 10 malam. Ada banyak yang harus dilakukan di Ubud... dan kita benar-benar menyukai hotel.  Semua kamar memiliki Beranda di mana Anda dapat memiliki Anda sarapan di pagi hari (sangat bagus pisang pancake!). Kamar bersih, tempat tidur baik. Kolam renang sangat bagus, dikelilingi oleh taman tropis. Juga pandangan baik atas sawah.  Sangat dianjurkan untuk tinggal di Ubud.",5
114, Okawati Boutique Bungalows,"Aku bisa sangat merekomendasikan Okawati's untuk keluarga bepergian, dan untuk orang lain. Cobalah untuk memesan kamar keluarga mereka, dengan tempat tidur ukuran Raja dan dua single, menarik diatur, jika Anda membutuhkannya. Tempat ini bersih, sangat santai, luar biasa tenang dan dalam berjalan jarak pendek ke segala sesuatu. Ibu Okawati dan stafnya bekerja ekstra untuk memastikan kebahagiaan tamunya. Tiga tahun kami jatuh sakit selama kami tinggal. Sebuah perjalanan singkat ke meja depan untuk meminta nomor telepon dari sebuah klinik dan dalam tiga puluh menit, seorang dokter dan perawat yang berada di depan rumah kami di hotel, terima kasih kepada Ibu yang mengatur segala sesuatu. Kolam renang besar, dan ada banyak restoran di sudut. Ditambah sarapan, bertugas di beranda Anda…",5
