,hotel,review,stars
0, Okawati Boutique Bungalows,"Bagi mereka yang ingin merasakan Ubud di masa-masa awal, dengan arsitektur tradisional, termasuk ukiran kayu dan batu, dan lukisan lokal oleh seniman Bali, dalam suasana tenang yang tenang, dekat dengan pusat kota, Anda tidak perlu pergi jauh-jauh dari Oka Wati Hotel . Oka sendiri, seorang veteran dari masa-masa awal pariwisata, adalah nyonya rumah yang ramah, memimpin staf yang ramah dan efisien yang melihat setiap kenyamanan Anda. Paviliun yoga lantai tiga menawarkan pemandangan menakjubkan ke arah 3/4, dan pada hari yang cerah dari semua gunung berapi suci di Bali. Pagi hari sangat menyenangkan dengan banyak pengunjung sarapan lagu bernyanyi, menghadap ke kolam renang yang mengundang. Ada spa di tempat, di mana saya memiliki pedikur terbaik yang pernah saya alami di mana saja…",5
1, Okawati Boutique Bungalows,"Tidak ada yang lebih baik daripada bisa bersantai di tempat teduh di antara taman yang indah dan berenang di kolam renang setelah hari yang panas dan sibuk di Ubud. Hotel ini terletak tepat di tengah, tetapi Anda bahkan tidak dapat mendengar lalu lintas, hanya burung-burung di sekitarnya. Staf hebat dengan saran ke mana harus pergi, Oka wati adalah wanita yang baik dan lucu yang dapat benar-benar bangga dengan apa yang telah dia capai di sini! Sarapan di taman adalah cara yang sangat menyenangkan untuk memulai hari Anda. Kamar sangat bagus, satu-satunya downside adalah bahwa kelambu tidak menutup lebih dari tempat tidur (tempat tidur terlalu besar untuk itu, saya kira).",5
2, Okawati Boutique Bungalows,"Positif: Lokasi yang sangat baik, alasan yang indah dan kolam renang yang bagus. Staf umumnya sopan dan Oka Wati sendiri sangat menyenangkan. Kamar yang sangat megah (deluxe double) dengan tempat tidur 4 tiang dan balkon yang menghadap taman berhutan. Tempat tidur nyaman dan obat nyamuk elektronik disediakan.  Negatif: Kami menerima sambutan dingin dari anggota staf pada penerimaan ketika kami tiba. Kami sangat tidak disarankan untuk meminta sarapan di balkon kami - ini adalah salah satu alasan kami memilih hotel ini dari pilihan yang sama. Mereka mencoba untuk memberitahu kami untuk memilikinya di restoran pada hari pertama, dan kemudian menempelkan opsi untuk memilih sarapan balkon di formulir permintaan setelah itu. Jika layanan ini telah dihentikan, harap perjelas hal ini di…",3
3, Okawati Boutique Bungalows,Tempat yang bagus dan kamar yang terjangkau. Terletak tepat di tengah-tengah Ubud dan dekat dengan banyak toko dan tempat makan. Memiliki semua yang Anda butuhkan dan menjadi titik awal yang baik untuk kuil dan air terjun. .,5
4, Okawati Boutique Bungalows,"Ini adalah saya ""home away from home"" di Ubud. Kamar-kamar dengan karakter, staf fantastis, termasuk sarapan.  Ini bukan hotel AS yang steril, tapi properti kuno dengan banyak pesona Bali! Itu bukan properti bintang 5, tetapi Anda tidak membayar untuk itu baik.  Lokasi. . . itu tidak menjadi lebih baik! Langsung dari jalan Monkey Forrest, tetapi jauh dari keramaian, hiruk pikuk, dan kebisingan lalu lintas.  Setelah Anda tinggal di sini, Anda menjadi salah satu keluarga Okawati! Itu adalah sentuhan pribadi yang selalu saya cari. . . dan membuatku kembali!",5
5, Okawati Boutique Bungalows,"Memesan online x 4 nts di kamar termurah karena saya tidak perlu tempat tidur kembar / tempat tidur ekstra besar di kisaran harga yang lebih tinggi @ ingin lokasi entral dekat salon terbaik, Beji. Penerimaan tidak ramah tidak muncul untuk memiliki pemesanan saya. Ruangan itu di belakang tanpa balkon, kecil, panas, @ lama. Membayar ekstra untuk kamar yang saya tawar dengan balkon yang menghadap ke kolam renang dengan tempat tidur ekstra besar yang mengambil semua ruang! Kekurangan lain adalah kebisingan dari orang-orang di kolam renang yang dibawa jadi itu bahkan lebih keras @ semua suara dari tetangga bisa didengar.  Kamar mandi dasar @ ada lemari es.  Untungnya sarapannya menyenangkan seperti Ibu Okawati @ staf wanita lain. Pancake Bali untuk arvie camilan dari menu adalah…",1
6, Okawati Boutique Bungalows,"Menghabiskan 3 malam di hotel ini sementara berkeliling Bali. Sejauh ini salah satu tempat terbaik yang kami tinggal dan untuk harga terbaik. Hotel diatur kembali dari Main Street seperti pelarian yang bagus dari hiruk pikuknya. Mudah berjalan ke hutan monyet. Staf sangat membantu mereka mengatur perjalanan Gunung Batur bagi kami dan juga membantu kami mengatur perjalanan wisata kami. Mereka menyarankan kita ke mana harus pergi dan berapa lama untuk tinggal dan layanan perahu mereka memberi kami sangat bagus. Teh tampaknya muncul di balkon kami setiap sore dan meskipun kami tidak pernah sekitar untuk sarapan karena untuk perjalanan kami, kami mendengar itu hebat! Pasti merekomendasikan tempat ini!",5
7, Okawati Boutique Bungalows,"Saya menginap selama dua malam di Hotel Oka di Ubud di pertengahan Wati - Juli. Kamarnya benar-benar baik dengan ukuran tempat tidur yang nyaman. Dengan balkon pribadi di mana mereka menyajikan sarapan yang mengesankan. Hotel berada tidak jauh dari Monkey Forest, namun sangat tenang, walaupun masih dekat dengan benar-benar semuanya. Para staf sangat membantu, terutama saat saya turun melalui transfer bandara di hampir tengah malam di malam hari saya tiba!",4
8, Okawati Boutique Bungalows,"Hotel yang menarik di ujung gang dari jalan utama. Sangat tenang dan santai. Kami menginap di bagian yang lebih tua di dalam kamar 5. Tempat tidur ukiran indah dan relief di dinding. Kamarnya luas, bersih dan nyaman. Kamar memiliki kabinet untuk digunakan dan kulkas kecil. Kamar mandinya besar dan agak sedikit diperbarui dengan toilet bergaya barat. Staf super ramah dan kolam renang yang menyegarkan. Sarapan dibawa ke atas setiap hari ke balkon pribadi dan mereka meninggalkan teh di sore hari. Panekuk pisangnya lezat. Pijat yang cukup memesan jadi memutuskan untuk melakukannya di Retreat Centre di ujung gang. Sangat senang kami karena pengalaman yang indah.",4
9, Okawati Boutique Bungalows,"Dan setelah mengatakan bahwa, seperti staf yang ramah. Bukan kunjungan pertama kami ke Okawati dan semoga bukan yang terakhir. Lokasi yang bagus. Sempurna, di bagian atas di Jalan Monkey Forest ketiga terletak. Dekat dengan semuanya. Istana dan pasar di atas jalan, Monkey Forest, 6 menit berjalan kaki di jalan, restoran yang bagus hanya di seberang jalan. Namun, menyusuri belok ke kanan, berjalan ke ujung dan Anda terlihat di dunia yang berbeda, Bali 1980 . Ibu Okawati masih ada, perempuan yang menakjubkan dengan cerita yang luar biasa. Tamannya indah, damai. Kami adalah keluarga dengan 4 orang jadi selalu memesan kamar bersebelahan dengan sebuah balkon pribadi bergabung. Lupa mengatakan, ada kolam yang bagus untuk bersantai.",4
10, Okawati Boutique Bungalows,"Ya, ini adalah seperti terlihat dari gambar. Saya mencintai saya tinggal 4 malam di sini. Staf sangat ramah dan membantu dari mengatur - sarapan gratis telur dan driver ke sawah/kuil-kuil untuk menyediakan teh di sore hari. Taman yang indah hanya halamannya adalah kolam renangnya bagus. Saya suka balkon pribadi saya untuk menunggu di luar rainstorms. Saya pikir beberapa kamar lebih daripada yang lain. dekoratif. Saya menginap di sisi polos, tetapi sangat bersih dan nyaman. Pancuran air yang baik dan AC. Lokasinya juga sempurna, agak jauh dari jalan utama dengan habisnya restoran, toko, dan kafe, tapi cukup dekat ke sawah untuk mendengarkan chorus katak di malam hari. Saya yakin ada banyak tempat yang bagus di Ubud, tapi ini adalah menawan, ramah, nyaman, dan sangat terjangkau.…",5
11, Okawati Boutique Bungalows,"Ini adalah sebuah bangunan tua set disetel dalam taman yang rimbun di sekitar kolam renang yang menakjubkan. Kamar-kamarnya ditata dengan barang-barang antik, tempat tidur besar, tapi dengan kamar mandi modern yang bagus (saya menginap di kamar deluxe) . Semua memiliki teras atau balkon. Ini adalah menyusuri jalan kecil yang telah anda untuk berjalan kaki ke (tidak ada mobil) tapi yang berarti bahwa tempat ini sangat dekat dengan aksi tetapi juga tenang dan teduh. Jalur dimatikan Monkey Forest Road, sekitar 5 - 6 menit dari istana, Galeri Nasional, dll, dan sekitar 10 - 15 menit dari suaka alam monyet ujung jalan. Lokasi Hebat - banyak restoran dan kafe yang indah, berbagai toko - lokasi yang jauh lebih baik daripada yang ramai bagian dari Ubud bagi saya. Cukup dekat ke sawah…",4
12, Okawati Boutique Bungalows,"Saya menginap di sini 10 tahun yang lalu dan tidak kecewa untuk berada di sini sekali lagi. Berada tepat di lapangan sepak bola di Ubud - mudah untuk berjalan di mana-mana anda ingin pergi. Hotel ini bersih, otentik, cukup kecil untuk menjadi sebuah hotel butik, lengkap dengan kolam renang dan sarapan di beranda anda setiap pagi. Okawai dirinya selalu tersedia dan check in pada sesuatu. dia senang duduk di tepi kolam renang dan berbicara kepada anda tentang aktivitas Anda dan senang untuk membantu dengan seorang pemandu atau sang pramupijat. Hebatnya dia masih mengingat kami dari sepuluh tahun yang lalu.",5
13, Okawati Boutique Bungalows,"Judul mengatakan itu semua. Nilai yang baik, kamar yang luas dan nyaman dengan besar yang mempunyai beranda. Tidak ada yang omong kosong, tetapi apa yang mereka lakukan, mereka bekerja dengan baik, staf yang ramah dan membantu, pemiliknya yang terlibat secara aktif dan menyenangkan untuk bertemu. Central. Sarapan terbaik yang kami punya di 2 pancake minggu di Bali.",4
14, Okawati Boutique Bungalows,"Kami tinggal di keluarga bungalow yang memiliki 1 raja dan ratu 1 tempat tidur. Kamar yang sangat bersih. Namun, kamar mandi adalah masalah. Itu adalah cara untuk panas atau untuk dingin. Saya menyukai sarapan dan teh gratis. Lokasinya bagus karena berada di tengah-tengah pusat kota Ubud. Namun, hotel ini terletak jauh di dalam di sudut jadi anda tidak bisa memarkir mobil Anda atau memuat/membongkar barang-barang Anda dengan mudah.",4
15, Okawati Boutique Bungalows,Kualitas yang bagus. Tenang dan menawan tempat di pusat Ubud. Taman yang indah dan kolam renang. sangat cocok untuk keluarga kami sarapan di beranda 4. dari ruang keluarga. Mrs. Okwati dan stafnya memberikan tempat sentuhan pribadi.,4
16, Okawati Boutique Bungalows,"Hotel bergaya Bali yang indah dengan banyak karakter. Ini adalah gaya pedesaan kami bagian dari daya tarik tempat ini. Ini adalah tidak Holiday Inn.  Kamar memiliki balkon dengan meja dan kursi menghadap taman dan termos di balkon ditambahkan semakin dengan teh.  Kamarnya besar tapi tidak ada TV. Berjalan di kamar mandi dan toilet.  Staf yang sangat baik dan lokasi tepat di persimpangan utama adalah besar terutama karena ada sedikit jalan kebisingan.  Kolam renang ini memiliki area makan dan Anda memesan makanan atau minuman dari resepsionis sampai ke area kolam atau di kamar Anda.  Kami menyewa skuter (, hanya Rp 60 ribu per hari) dan pergi untuk melihat ribuan bangau bersarang di Petalulu Kami tinggal 4 malam dan menikmati kedamaian dan ketenangan.",5
17, Okawati Boutique Bungalows,"Kami tinggal di sini selama empat hari, ini adalah tempat kecil yang indah tapi itu bersih bahkan tho itu bisa lakukan dengan Dalam bersih yang besar, tapi selain dari bahwa itu indah, semua staf sangat ramah dan membantu, itu indah untuk duduk di teras dan makan pagi yang disajikan ke kami setiap pagi, tempat ini sangat tenang dan santai.",3
18, Okawati Boutique Bungalows,"Ini adalah 2 kami tinggal di indah nd Okawati hotel dan saya telah merekomendasikan hotel ini ke teman-teman yang juga menyukainya. Ini adalah properti yang lebih tua gaya Bali yang terletak ke arah tempat dari jalan Monkey Forest. Terletak di pusat segalanya tapi masih sangat tenang karena lokasinya. Kamarnya bersih dan nyaman dengan tempat tidur besar, lemari es, kamar mandi diperbarui dan pendingin udara. Sarapan adalah termasuk yang dapat disajikan di balkon Anda atau di tepi kolam renang.  Kami memesan melalui hotel untuk membawa babi panggang dan disajikan di gazebo oleh kolam renang dan itu sangat lezat.  Ada sebuah bar dengan live musik di lorong yang mengarah ke hotel yang sangat bagus untuk menikmati minuman di dalam rumah.  Berjalan ke ujung jalan dan keluar di taman…",5
19, Okawati Boutique Bungalows,"Sangat mudah untuk pusat Ubud, namun terselip jauh dari jalan utama (Monkey Forest rd .) yang lama di tempat kecil ini menarik. Staf dan pemilik yang sangat membantu dan selalu tersenyum. Kamar cukup besar, dengan balkon yang menyenangkan. Wifi yang baik. Sarapan disajikan di ruang (atau di luar jika Anda lebih suka). Salah satu highlights adalah makanan khas bebek asap, ini memakan waktu sehari untuk mempersiapkan, dan disajikan di luar di udara terbuka paviliun. Semua Ubud bisa merokok Bebek, ini adalah oleh Jauh Yang Terbaik Dan Termurah. Makanan dan hotel yang sangat direkomendasikan.",5
20, Okawati Boutique Bungalows,tidak dapat mengeluh tentang lokasi hotel ini. Itu adalah tepat di jalan utama tetapi hanya satu blok di tuked jadi sangat tenang dan rasanya seperti Anda lebih jauh dihapus dari apa yang Anda benar-benar ada.   Sarapan w/teh atau kopi sangat bagus dan dikirim ke kamar Anda saat Anda diminta. Staf meja depan adalah sangat ramah dan membantu.   Kamar yang nyaman dan bersih - mereka adalah kamar bergaya Bali dengan balkon yang mencari ke kolam renang/pohon.,4
21, Okawati Boutique Bungalows,"Oka Wati Kebersihan - 5  Staf - 5  Lokasi Strategis - 5  Kelebihan lainnya - tempat ini memiliki pesona tertentu tentang hal itu. Duduk di kolam renang dan melihat sekeliling terasa seperti sesuatu yang keluar dari film Indiana Jones yang dan kami menyukainya.   Kamar dasar, tapi baik-baik saja. Sarapan yang baik dan sarapan dibawa ke kamar yang indah.   Kami juga pergi di musim rendah sehingga Anda bisa mendapatkan kesepakatan yang baik.  Negatif lain - jacuzzi tidak bekerja dan udara con unit yang lambat untuk mendapatkan pergi.  Penilaian secara keseluruhan/nilai untuk uang - 4  Apakah Saya Akan Menginap Lagi? Ya   (1=buruk, 2=buruk, 3=rata-rata, 4=baik, 5=luar biasa)",4
22, Okawati Boutique Bungalows,"Teman saya dan saya tinggal di hotel untuk 2 malam di Okawati di akhir bulan November. Saya tidak dapat kesalahan lokasi, ini adalah Bang di tengah dari Ubud dan adalah berjalan kaki singkat dari bar, restoran, pasar. Alasan dan kolam renang yang indah. Kamar kami yang bergaya tradisional Bali dan dihias dengan baik. Kamar mandi itu sangat ketinggalan jaman dan ada bau konstan dari. Saya tidak terkesan dengan kebersihan kamar semuanya, hanya tampak sedikit kotor. Sarapan adalah rata-rata di terbaik tetapi itu adalah sentuhan yang bagus bahwa Anda dapat memesan dan mereka membawa kami ke kamar. Ketika kami pertama kali tiba di Ubud dan kami tinggal di hotel lain beberapa pintu bawah dan sarapan adalah jauh lebih baik. Secara keseluruhan saya tidak terkesan dan tidak akan tinggal…",3
23, Okawati Boutique Bungalows,Staf yang fantastis dan kamar yang benar-benar cantik! Lokasi yang sempurna - tepat di jantung dari segala sesuatu. Saya sangat menyukai tempat ini dan akan merekomendasikan tinggal di sini kepada siapa pun. Satu-satunya hal yang dapat ditingkatkan. Ada tidak ada TV di kamar.,5
24, Okawati Boutique Bungalows,"Kami memiliki yang indah yang tinggal di sini. Ini adalah jalan kecil dan agak jauh dari jalan yang sibuk yang sangat bagus.   Itu agak tua di sekitar kolam renang, dan kamar tidak terbesar. Tapi setelah mengatakan bahwa hotel ini sangat bagus, ruangan itu bersih dan sarapan adalah sedikit di atas rata-rata untuk jenis hotel Bali.   Lokasi yang sangat baik.",4
25, Okawati Boutique Bungalows,"Kami memiliki tinggal yang menyenangkan di lingkungan yang bagus di Okawati hotel di Ubud. Hotel ini bersih, layanan baik, kolam renang sangat bagus dan kami memiliki balkon untuk duduk di dan sarapan. Satu-satunya hal adalah bahwa ada tidak ada akses ke air minum, jadi anda harus membeli air minum kemasan botol - bahkan dengan sarapan. Sebagian besar akomodasi di Ubud memiliki dispenser air minum segar yang tersedia, jadi itu mengecewakan ketika setiap upaya yang harus dilakukan untuk menjaga Bali yang indah.",3
26, Okawati Boutique Bungalows,"Positif: Lokasi yang sangat baik - hanya off monkey forest road. Kamar bersih dan nyaman (tapi kecil), membuat setiap hari, dengan balkon yang menghadap ke area kolam renang yang bagus dan banyak tanaman tropis. Banyak air panas di kamar mandi. Semua staf berbahasa inggris dan sangat ramah dan membantu. Pijat dan pedikur di area atas atap yang sangat baik. Sarapan yang baik dengan pilihan roti bakar, pancake, omelet (antara dua potong roti bakar?), yoghurt, buah-buahan, teh dan kopi. Akan melayani di kamar anda.  Negatif: Ada sebuah kursi di kamar kami yang tidak dilengkapi dan sangat canggung untuk mendapatkan sekitar. Ada sebuah dek yang besar lemari es yang lebih kecil, dan dapat dipasang di bawah meja hal barang. Ini akan membuat ruang untuk lemari kecil dengan tempat untuk…",3
27, Okawati Boutique Bungalows,"Waktu pertama kunjungan ke ubud. Tidak bisa percaya bagaimana sibuk tempat ini. Lalu lintas dan wisatawan di mana-mana. Untungnya, ini adalah sebuah oasis di Okawati semua kegilaan.  Rahmat dan pesona tua bergaya bali. Kami tinggal di kamar menghadap ke halaman dan meja kolam renang dari 2nd di lantai yang terpisah dari sisa dari kamar tempat yang luar biasa ini. Dengan gaya bali tradisional, semi terpisah dan beranda yang luas, kamar mandi semi luar ruangan (ish). Tempat ini terletak menyusuri jalan dari gang yang menghubungkan ke monkey forest rd di bagian tersibuk ubud (dan dekat dengan banyak restoran dan toko-toko). Lagi... sebuah oase untuk bersantai di. Menginap untuk 4 malam dan harga yang tepat. Ramah, staf yang sangat ramah. Sarapan dibawa ke beranda saya setiap pagi…",5
28, Okawati Boutique Bungalows,"Di Okawati hotel dan staf adalah tenang oasis yang menyenangkan di kota yang sibuk di ubud. Kami menyukai keramaian dan hiruk pikuk ubud, restoran besar, belanja dan spa, tapi, datang ""rumah"" untuk Okawati pada akhir hari yang sempurna. Hotel ini berada di antara pohon-pohon dan tanaman yang indah, kolam renang yang keren dan mengundang setelah hari yang panas menjelajahi dan kamar yang elegan dan nyaman. Sarapan disediakan di beranda anda setiap pagi dan semua aktivitas yang ingin anda tambahkan ke perjalanan anda, dapat diatur oleh staf sangat membantu di meja depan. Kami tidak pernah kecewa di kami banyak perjalanan ke ubud, kami terus kembali ke Okawati hotel. Terima kasih, nyonya. Okawati, untuk terus membuat hotel rumah jauh dari rumah.",5
29, Okawati Boutique Bungalows,"Ini adalah ""rumah yang jauh dari rumah"" di ubud. Kamar dengan karakter, staf yang fantastis, sarapan termasuk.  Ini adalah hotel kami tidak steril, tapi properti unik dengan banyak daya tarik bali! Ini bukan properti bintang 5, tetapi anda tidak membayar untuk itu baik.  Lokasi... itu tidak bisa lebih baik! Tepat monkey forest road, tetapi jauh dari keramaian, kesibukan, kebisingan dan lalu lintas.  Setelah anda tinggal di sini anda menjadi salah satu keluarga Okawati! Ini adalah sentuhan pribadi yang saya selalu mencari keluar.",5
30, Okawati Boutique Bungalows,"Aku benar-benar ingin suka hotel ini. Harga wajar, lokasi yang nyaman dan kolam renang & taman yang sangat indah. Sayangnya kondisi kamar tidak sangat mengesankan. Ada cukup banyak debu dan kotor, dan dinding yang tampak seperti mereka bisa menggunakan lapisan cat. Kami memiliki kamar mandi semi terbuka yang keren tapi sayang bak mandi itu tidak bersih cukup bagi saya untuk menggunakan ini. Balkon memiliki kursi/ruang yang akan lebih bagus jika bukan karena sebagian besar diselenggarakan bersama-sama dengan lakban.   Di sisi positif, hotel ini memiliki kolam renang yang indah, dan area taman yang indah untuk duduk di dan bersantai. Jika kamar sendiri diberi tambahan melayani saya dengan senang hati akan merekomendasikan tempat ini tetapi sampai mereka mungkin ada banyak pilihan…",3
31, Okawati Boutique Bungalows,"Putri saya dan saya tinggal di sini selama 9 malam di bulan juli. Ini adalah hotel kecil yang tersembunyi dari kekacauan ubud - sebuah oasis dari 15 kamar dengan taman yang indah dan kolam renang. Lokasi adalah dalam jarak berjalan kaki dari hutan monyet, banyak restoran, sawah, pusat perbelanjaan. Malam pertama kami kami makan makan malam (makanan yang disajikan di teras anda atau di pinggir kolam renang) di ruang dekat kolam renang selama badai hujan besar. Kami tahu bahwa kami berada di surga!   Kamar kami di lantai 2nd dengan teras yang menghadap properti - sangat pribadi dan tenang. Hotel ini tidak baru tapi menarik - kamar mandi adalah ""pedesaan"" tapi nyaman. Sarapan (termasuk dalam harga kamar) yang diantarkan setiap pagi. Telur goreng, roti panggang, buah, kopi. Pastikan…",5
32, Okawati Boutique Bungalows,Kami memiliki empat sangat menyenangkan tinggal di oka wati hotel dan dapat merekomendasikan hal ini. Ini adalah keluarga kecil yang dimiliki hotel sangat dekat dengan monkey forest dan pusat kota ubud. Turun ke sebuah jalan kecil tenang dan ada sebuah taman yang indah dengan kolam renang yang layak. Ms wati oka dan sisanya dari staf yang sangat ramah dan membantu dan sarapan di teras di depan kamar adalah murni mewah.,5
33, Okawati Boutique Bungalows,"Keluarga kami (dengan 2 anak-anak usia 7 dan 10) baru saja kembali dari 10 hari di pagi hari yang indah di indah kamar keluarga Okawati hotel. Ibu Okawati (pemilik) dan stafnya adalah sangat baik dan bermanfaat dan menyenangkan. Keseimbangan yang tepat membantu ketika anda membutuhkannya, tetapi memberi anda ruang ketika anda perlu yang terlalu. Hotel adalah mudah berjalan kaki ke tempat di mana anda bisa melihat tarian (anak-anak kami menyukai pertunjukkan tari kecak terbaik), monkey forest, tempat untuk berjalan (di Campuhan jalan lokal dan indah) atau makan (sangat indah sekali, laba laba cafe mencoba). Kami menemukan tempat yang bagus untuk naik sepeda (bali budaya tours), dan staf hotel yang senang untuk mengatur itu bagi kita. Atau pada hari ketika kami hanya diperlukan…",5
34, Okawati Boutique Bungalows,"Saya hanya memiliki dua malam di ubud dan saya senang saya menginap di Okawati mereka. Membuat mendapatkan sekitar dan menjelajahi ubud dengan mudah. ok, menyeret tas saya di mana taksi menjatuhkan saya ke hotel adalah sedikit kerumitan - tapi senang itu adalah lebih dari jalan dari sisa perjalanan untuk tingkat kebisingan - tempat ini sangat tenang di Okawati. Saya menginap di kamar sang buddha - Saya percaya mereka yang paling mahal. Sangat indah - nyaman - nice patio - kamar mandi w/bak mandi - baik linen.   Sementara tidak pengalaman bintang 5 resor, tempat ini bukan untuk harga yang baik. Saya akan merekomendasikan.",5
35, Okawati Boutique Bungalows,"Hotel ini sangat cantik dan menawan dengan pemandangan yang sangat bagus dan kolam renang. Hotel ini berada di pusat ubud yang begitu mudah untuk mendapatkan sekitar, tetapi itu adalah jauh dari kebisingan jalan. Sarapan yang luar biasa - buah segar, kopi, jus, pancake pisang. Harga bagus dan hotel yang bagus. ",5
36, Okawati Boutique Bungalows,"Kami menghabiskan 5 malam di sini di suite buddha (bulan madu suite). Itu adalah tempat yang indah untuk tinggal tepat di jantung kota ubud, hanya berjalan kaki singkat ke monkey forest, pasar, toko-toko, dan orkestra gamelan di lapangan bola tempat kami menonton penduduk setempat yang bermain footy cocok. Hotel itu sendiri memiliki pemandangan sawah dan turun gang terpencil jalan jadi itu sangat tenang.  Hotel ini dijalankan oleh menyenangkan Okawati. Keramahannya luar biasa. Setelah kedatangan kami menawarkan minuman manis dan diantarkan ke kamar kami, tas yang dibawa menaiki tangga oleh seorang pria muda yang tegap dan ramah khas bali.   Ruangan itu sendiri adalah bersih dan menawarkan kenyamanan modern dari penyejuk udara dan tv, tidak bahwa kami digunakan di tv. Itu adalah…",5
37, Okawati Boutique Bungalows,"Mungkin harapan kami adalah sedikit lebih tinggi untuk hotel ini sangat dinilai di sini saat bepergian selama musim rendah pada bulan juni dan itu adalah sulit untuk membandingkan tempat ini dengan orang lain; tapi di sini adalah pengalaman kami secara keseluruhan dari tempat ini: -   Lokasi: Luar Biasa - Terletak di lokasi yang damai, tenang daerah; tidak jauh dari jalan utama dan monkey forest tempat suci. Berjalan jarak ke banyak restoran, pasar pagi dan ke istana.  Pelayanan: Baik kita beruntung bisa bertemu dengan ibu Okawati; yang sangat ramah; mereka juga menyarankan beberapa tempat yang bagus untuk makan!  Layanan dari staf adalah rata-rata, karena mereka selalu tampak sibuk!  Harga: Rata-Rata - Saya menemukan harga sedikit agak mahal, compered hotel serupa lainnya di…",4
38, Okawati Boutique Bungalows,"Kami hanya tinggal di sini selama satu malam, tetapi dengan mudah bisa menikmati lebih banyak. Hotel ini turun jalan yang tenang jauh dari hiruk pikuk jalan monkey forest. Ada beberapa bangunan di multi-story bangunan, sebagian besar termasuk Balinesian tradisional dekorasi dan desain. Kamar kami adalah desain yang lebih modern, tapi bersih, tenang, dan memiliki pemandangan indah di atas kolam renang dan sawah tetangga. Kolam renang indah dengan taman yang rimbun di sekitarnya.  Hanya satu keluhan saya memiliki sedikit masalah dengan hotel itu sendiri, tapi dengan staf meja depan yang meyakinkan saya untuk mengatur sebuah perahu untuk kembali saya berikutnya tinggal di gili t. ternyata kecil seperti yang diharapkan dengan perjalanan yang dan aku merasa sedikit ditipu pada harga,…",5
