,hotel,review,stars
115, Okawati Boutique Bungalows,"Kami menyarankan dari Okawati oleh seorang teman yang juga pernah tidak tinggal di sini. Kami kemudian memiliki tampilan pada Tripadvisor untuk melihat apa yang orang lain berpikir & akan oleh orang tinjauan kami memutuskan untuk memesan segera. Kami tinggal di sini selama 9 malam, ini adalah keluar 3, & Okawati & stafnya hidup sampai dengan harapan. Pada penampilan pertama walaupun kami agak ragu-ragu tentang kami tinggal tetapi sekali Anda menetap di Anda menyadari betapa baik tempat ini. Lokasi fantastis, dekat dengan pusat kota, pasar & semua restoran. Hotel ini memiliki kamar besar dengan besar bathroooms, a/C, lemari es ukuran baik & balkon besar untuk bersantai di. Kolam renang adalah ukuran yang baik dengan spa yang terpasang (meskipun itu tampaknya tidak bekerja pada…",5
116, Okawati Boutique Bungalows,"Kami menikmati 4 hari di indah kecil milik lokal hotel ini, hanya berjalan kaki singkat ke gang off jalan hutan monyet dan hanya beberapa menit berjalan kaki dari pasar, istana dan banyak restoran dan toko-toko. Staf yang semua sangat membantu dan ramah, termasuk Wati Oka indah dirinya sendiri. Kamar kami adalah lantai atas dengan pandangan dari atas sawah, tenang dan dengan balkon di mana kami melayani setiap pagi sarapan lezat. Fasilitas yang bersih, luas dan penuh Bali karakter dan pesona dan harga sangat terjangkau.",5
117, Okawati Boutique Bungalows,"Hotel memiliki locatin besar dan tenang, itu benar. Tapi harga ini Anda mendapatkan tempat-tempat yang jauh lebih banyak cinta untuk detail dan kamar mandi di ruangan saya diberi adalah kotor dan lama! Dan sisanya dari ruang tidak bersih baik. Spiderwebs, debu....Benar-benar tidak ada nilai untuk uang. Wanita dan staf yang bagus, kolam renang ok.",2
118, Okawati Boutique Bungalows,"Hotel yang sangat bagus pada harga yang wajar dekat dengan pusat Ubud. Indah pemandangan sawah setiap pagi di teras menunggu kami termos teh panas. Kamar didekorasi dengan gaya Bali, sangat luas, nyaman ranjang, sangat tenang di malam hari. Lezat sarapan. Merekomendasikan pancake dengan nanas dan kelapa.",4
119, Okawati Boutique Bungalows,"Kami tidak khawatir bahwa Okawati mungkin telah kehilangan pesona sejak itu telah ditambahkan ke Lonely Planet. Ada tidak perlu sama sekali khawatir. Apa ditemukan menyenangkan!  Hotel ini terletak di ujung atas lapangan sepak bola ke gang kecil tapi baik menyalakan cara. Rasanya begitu dekat dengan segala sesuatu yang kami butuhkan dan belum jauh cukup jauh dari taksi dan tari menunjukkan calo.   Kami tinggal di ruang Bhudda mewah baru dan itu tidak pendek romantis. Luar bathtub dan shower begitu menyenangkan tetapi bagian terbaik balkon yang menghadap ke kolam renang dan sawah jauh.   Kami memilih untuk sarapan yang disampaikan kepada kami di balkon kami setiap pagi, banana pancake adalah suatu KEHARUSAN!  Kami mencintai anggrek di tempat tidur, origmai handuk, bagus sabun dan…",5
120, Okawati Boutique Bungalows,"Staf sangat ramah dan membantu, mereka memberi kita banyak informasi tentang Ubud dan upacara kremasi besar mendatang, membantu kami untuk memesan hotel berikutnya menyediakan akses internet dan menempatkan beberapa panggilan telepon gratis. Berbicara dengan mereka adalah menyenangkan. Kami memesan kamar deluxe dan merencanakan untuk tinggal 2 malam (kemudian tetap kami menjadi selama 3 malam karena upacara kremasi). Kamar kami adalah dekat dengan kolam dan dengan pemandangan sawah. Sarapan disajikan di balkon dan sangat baik. Kamar mandi saya percaya telah diperbarui baru-baru ini karena cukup baru dengan mandi dan mandi. Segala sesuatu yang bersih. Lokasi sempurna karena di pusat kota, tetapi dalam posisi yang tenang. Kita tidak bisa mengatakan apa-apa tentang restoran karena…",5
121, Okawati Boutique Bungalows,"Kami telah dipilih Okawati Hotel karena Review di Tripadvisor dan kami tidak kecewa. Situasi di Ubud sempurna dan hotel menarik.  Kami melakukan perjalanan dua pasangan bersama-sama dan telah memesan dua kamar deluxe. Tapi hotel telah membuat kesalahan dan hanya membuat reservasi satu ruangan bagi kita. Jadi teman-teman kita tinggal di sebuah ruangan yang mewah dan saya dan suami saya memutuskan untuk tinggal di The Budha kamar, ruang terbaru dan paling mahal di hotel.  Ada perbedaan besar baik dalam harga dan kualitas antara kamar deluxe dan kamar Budha. Ruang Budha sangat luas dengan kamar mandi udara terbuka yang sayangnya mendapat basah ketika hujan - dan cukup banyak hujan sementara kami tinggal di Okawati. Deluxe room luas bisa membutuhkan pemulihan beberapa tapi tidak…",4
122, Okawati Boutique Bungalows,"Kami tidak sedikit tidak yakin apa yang diharapkan ketika kita akan membaca seperti campuran ulasan tentang tempat ini. Kami terkejut sangat meskipun dan sangat banyak menikmati kami tinggal. Karena Okawati sangat sibuk kami akhirnya bergerak kamar beberapa kali sehingga kami memiliki pengalaman family room, deluxe room dan superior room. Semua kamar kami yang sangat senang dengan. Kamar deluxe & keluarga telah diperbaharui dan saya pikir layak menghabiskan sedikit tambahan. Perbedaan utama adalah di kamar mandi. Kamar mandi di ruang unggul cukup lelah di perbandingan dan suite kamar mandi hitam. Saya tidak meragukan itu bersih tapi ada sesuatu yang tidak menyenangkan tentang melangkah ke mandi hitam! Hotel adalah meletakkan gang kecil tenang hanya melemparkan batu dari pusat…",4
123, Okawati Boutique Bungalows,"Akomodasi indah di jantung kota Ubud, lepas Monkey Forest Road. Ada gang pendek jalan ke bawah tetapi itu baik menyala dan kita tidak memiliki masalah atau kekhawatiran tentang keselamatan.  Kamar melihat hanya seperti dalam foto, indah kolam renang yang diperlukan setelah berjalan-jalan di panas, pilihan makanan saat sarapan, dan bar / restoran yang tidak besar makanan.  Sangat dianjurkan untuk tinggal di Ubud.",5
124, Okawati Boutique Bungalows,"memesan di sini dari ulasan dan availablity....... klasik Bali losman upgrade ke kamar yang lebih bagus.........Saya akan membayangkan tempat ini adalah 8 dolar per malam 20 thn yang lalu....... kami memiliki ruang lebih rendah yang ditunjuk dalam gaya Bali dengan posting 4 tempat tidur dan perabot dasar dan lanai bagus. kamar mandi tampaknya telah direnovasi dan dimodernisasi sedikit dan fungsional..... lapangan indah dan sangat damai, baik sedikit kolam renang dan restoran overlooing kecil nasi patti......... hal ini geng kecil dari hutan monyet jalan dan yang tenang, banyak tempat yang baik untuk memakannya di sangat dekat dengan berjalan kaki........ mengingatkan saya dari tempat-tempat kecil yang aku dulu tinggal di kuta 22 tahun yang lalu ketika saya pertama kali mulai…",3
125, Okawati Boutique Bungalows,"Okawati Hotel adalah sebuah permata yang nyata. Pemilik adalah seorang wanita luar biasa, ramah dan hangat. Staf nya yang luar biasa akomodatif. Hotel ini indah! Setiap di mana aku melihat itu hanya lebih dan lebih indah. Teman-teman saya dan saya tinggal di tiga kamar yang berbeda dan walaupun mereka semua berbeda, masing-masing yang mempesona dengan caranya sendiri. Views dari balkon bervariasi, ke kota atau atas sawah. Dengan alasan yang indah, kolam renang Jadi, Selamat datang setelah berjalan tentang kota di panas. Aku pasti akan kembali!",5
126, Okawati Boutique Bungalows,"Lokasi bagus dan nyaman. Kamar tua (Rupanya beberapa telah direnovasi!). Hotel tampak seolah-olah sudah sangat bagus 20 tahun yang lalu tapi sekarang sedikit usang. Kamar mandi di ruang menyedihkan dan tampak terlalu tua, tidak menyenangkan sama sekali. Kamar memiliki bau yang kuat untuk kelembaban bahwa itu sangat tidak nyaman. Jadi, jika Anda pergi, mencoba untuk buku salah satu kamar yang bagus, jika tidak, Anda tidak akan tinggal di rumah.",3
127, Okawati Boutique Bungalows,"Kami tinggal di tempat ini adalah salah satu highlights dari perjalanan kami ke Bali dan Lombok. Berjalan kaki untuk segala sesuatu di sekitar Ubud - pagi pasar, hutan monyet, galeri dan toko-toko di kota dan berjalan melalui sawah - itu adalah tempat yang indah untuk tinggal. Kamar kami yang besar, bersih, dingin dan bersama-sama dengan menyambut buah dan harian termos teh kiri pada teras kami - apa lebih bisa kita inginkan? Enam dari kita menikmati sarapan indah yang bertugas di kebun, di tepi kolam renang atau di beranda kami - tidak ada terlalu banyak usaha untuk staf membantu dan informatif. Makan malam khusus Donal Bebek-merokok itu sangat menyenangkan. Itu adalah berjalan kaki ke sekolah memasak di Casa Luna - Sorot lain. Sebuah harta karun dengan spa indah di ujung…",5
128, Okawati Boutique Bungalows,"Ini adalah permata kecil keluarga hotel di lokasi yang sempurna, hanya kembali turun jalan hutan monyet utama di Ubud. Mrs o dan stafnya tidak bisa lebih membantu. Jika Anda adalah seorang Amerika dan ingin pengalaman Marriott penuh Anda mungkin marah bahwa air tidak selalu sangat panas dan kamar mandi tidak abad ke-21, tetapi kamar yang indah, dalam gaya Bali dan seluruh pengalaman menyenangkan. Buku langsung - saya tidak berpikir setiap agen yang melakukannya. Aku tidak memberikan 5/5 untuk kualitas tidur karena meskipun tempat tidur yang sangat nyaman, fajar paduan suara mengagumkan keras dari burung-burung di sawah sebelah! Dan satu hal yang besar bagi saya adalah bahwa Apakah Anda mengambil sarapan di balkon menakjubkan ruangan Anda atau di restoran, tidak ada piped musik.…",5
129, Okawati Boutique Bungalows,"Pada Okawati kami mendapat suite baru yang dihiasi selera, sangat nyaman, modern (menghormati lokal esthetics) dan menarik. Fasilitas hotel sangat baik, dan staf sangat membantu dan akan melakukan apa pun di tangan mereka untuk membantu (awal doggy kotak sarapan, pemesanan tiket adalah contoh saja).",5
130, Okawati Boutique Bungalows,"Tidak benar-benar salah buruk di sini. Tenang (terakhir sedikit hanya dapat dicapai dengan berjalan kaki), dikelola dengan baik, menyenangkan kolam renang, sangat dekat dengan kota, Sarapan cahaya yang bagus dan top-up buah dan teh disajikan melalui hari. Nyonya rumah, Oki Wati, adalah sejenis sangat layak dan akan terlihat setelah Anda secara pribadi dan peduli. Kamar tidak desain trendi, seperti beberapa segi Ubud baru, tetapi cukup nyaman dan menyenangkan dan ukuran yang adil. Mendapatkan ruang atas jika Anda tinggal di sini, terutama di dekat sisi Saphira alur, di mana Anda dapat menonton tupai melakukan olahraga mereka di malam hari.",4
131, Okawati Boutique Bungalows,"Aku tidak akan pergi sebagai jauh sebagai dikatakan tinggal jauh dari hotel ini, tapi untuk harga, itu 100% tidak layak di kunjungi. Aku Hasten untuk menambahkan kami tinggal selama 1 jam dan memeriksa untuk tinggal di hotel lain (D'omah Villa) yang 1000 lebih bagus untuk harga yang sama, tidak berlebihan.  Terjebak jalan kecil yang sangat jalan sibuk di Ubud, Anda akan memiliki untuk membawa tas dan diri dalam panas ke kecil sangat Bali gaya penerimaan. Dijalankan oleh orang dewasa muda / anak-anak mereka yang sopan, tetapi tidak memiliki pengalaman.  Ruang besar, besar poster empat tempat tidur dan memiliki banyak touchs bagus, terlepas dari kenyataan banyak pekerjaan bangunan sedang berlangsung dan ada angin masih terkena blok di ruang.  Untuk $60 per malam, berjalan satu mil…",1
132, Okawati Boutique Bungalows,"Kami tinggal di Okawati hotel untuk 4 malam dengan anak kami berumur 6 tahun. Semuanya adalah seperti itu muncul di website - bagus cukup ruang, bunga di kebun, kecil sawah dekat oleh--tapi dibandingkan dengan apa yang tersedia di sudut, saya setuju dengan beberapa pengulas lain yang Okawati tidak luar biasa tempat untuk tinggal. Tidaklah sangat baik - dengan alasan agak kumuh sekarang, dan kolam renang tidak bersih--dan tidak layak untuk menjadi 30% lebih mahal daripada semua tetangganya, tapi tentu saja dalam semua buku-buku panduan sekarang, dan perintah premi untuk itu.   Hotel ini adalah nyaman untuk melihat pertunjukan malam di istana dan dekat kuil, yang merupakan puncak waktu saya di Ubud. Tapi itu begitu hangat di hari yang benar-benar ingin di hotel atau kolam renang…",3
133, Okawati Boutique Bungalows,"Suami saya dan saya baru saja kembali dari Bali setelah tinggal dari pertengahan April hingga pertengahan Mei. Perjalanan yang fantastis. Kami tinggal 20 hari di Okawati Hotel di Ubud. Yah, kita awalnya reserved hanya 3 hari, tapi setelah melihat ruang besar kami fantastis, windows menghadap hutan tropis, teras pribadi kami, kami tidur ukiran kayu, dan paling baik staf dan alasan, kami hanya tidak ingin meninggalkan! Kami memiliki ruang delux. Kami memutuskan untuk tinggal di Ubud dan mengambil hari perjalanan (Mrs Okawati anak adalah sopir kami indah), dan kami tinggal yang indah di hotel menjadi bagian dari pengalaman kami secara keseluruhan. Kamar yang besar, besar kolam renang, tempat pribadi yang indah dari Monkey Forest Road. Dari hotel kami mampu melakukan menakjubkan 5…",5
134, Okawati Boutique Bungalows,"Ini adalah tempat yang layak untuk tinggal. Properti ini cukup bagus melihat, jika sedikit berjalan dari jalan utama.  Masalah utama adalah bahwa hal ini hanya tidak layak harga, yang telah mungkin telah meningkat sejak mereka disebutkan dalam lonely planet. Sarapan kecil. WiFi biaya tambahan. Kamar yang tidak ada yang spektakuler. Saya berbau sedikit berjamur.  Untuk apa yang Anda membayar Anda pasti bisa menemukan sesuatu yang lebih baik.",2
135, Okawati Boutique Bungalows,"Ini adalah tempat yang benar-benar sangat baik. Staf yang tentang teh ramah di mana saja yang pernah saya tinggal, tidak hanya membantu dan curteous (mana mereka), tapi benar-benar ramah. Mereka adalah particulalry membantu dalam mengorganisir kegiatan.Saya menemukan Wisma harus baik ditempatkan (langsung dari hutan monyet jalan, tapi masih dengan pemandangan sawah). Kolam renang adalah manfaat tambahan besar juga. Dan, oh ya... mereka membawa sarapan ke Beranda ruangan Anda tanpa biaya tambahan. sangat damai.",5
136, Okawati Boutique Bungalows,"Kami tinggal di Oka Wati Hotel Ubud selama 2 hari. Buruk kesalahan kami harus tinggal 2 minggu. Bersih, nyaman benar-benar membantu staf. Tak terduga damai dan tenang di kota yang sangat kacau dan dinamis. Agak sulit untuk menemukan, tetapi patut berburu. Hal ini juga diketahui untuk taksi lokal. Mereka memiliki besar driver/panduan - meminta Wayan atau Koman. Bahasa Inggris mereka sangat baik dan menjawab semua pertanyaan saya dengan jelas dan ahli - signifikan prestasi dalam dirinya sendiri!",5
137, Okawati Boutique Bungalows,"Sayangnya tempat ini telah benar-benar kehilangan. Masalahnya tampaknya manajemen. Ada cowok yang indah kecil di kantor, tapi dia tidak manajemen. Saya memesan sebuah ruangan dan hal ini telah berubah ketika saya tiba. Saya diminta untuk pergi ke hotel lain di dekatnya. Aku kecewa, aku punya kamar saya tapi itu tidak begitu baik. Dibutuhkan yang baik bersih.",1
