,hotel,review,stars
44, Pemedal Beach Resort,"Lokasi yang bagus  Kamar yang luas dan bersih Staf yang luar biasa Ac dan wifi baik Kolam renang di tepi pantai Tepat di depan ombak selancar dengan perahu di depan Makanan yang baik, tetapi anda harus pergi ke sereh di jalan dengan makanan yang luar biasa  Hanya negatif sarapan bisa menjadi lebih baik  Saya akan tinggal di sini lagi",5
45, Pemedal Beach Resort,"Kami pertama kali mengunjungi nusa lembongan, dan kami didasarkan pada lokasi Pemedal perjalanan advisor ulasan.  Di ujung utara pantai utama, kami terdorong oleh perusahaan kapal van ke kabin kami. Jangan menunda oleh kecil, sempit yang mengarah ke jalur Pemedal, akan jauh lebih baik di depan! Pada saat kedatangan, kami membawa tas kami ke kamar di mana saya berada, dan memeriksa di. Staf ramah, tetapi tidak sangat fasih dalam bahasa inggris.  Kami dibawa ke bungalo deluxe dan terkesan dengan ukuran ini datang.  Sebenarnya kamar - bagus dan bersih, good sized, ac adalah luar biasa. Di Sini - kamar aman akan baik, dan beberapa informasi/brosur Pemedal tentang lembongan dan akan kembali. Kita tidak tahu berapa banyak item yang berada di mini bar, atau saran untuk tempat untuk…",4
46, Pemedal Beach Resort," Aku tinggal di sini dari 29 - 31, kami pesan kamar superior untuk 3, hal ini sangat mengejutkan saya ketika saya membuka pintu, terbang adalah setiap tempat, ruangan adalah sangat kotor dan tua, mati bug di lantai, tapi ketika saya mengunjungi teman-teman saya kamar ini lebih baik daripada aku, ini baru dan bersih, jadi saya meminta ruangan yang sama dengan resepsionis, tapi mereka menolak karena biaya gedung baru dan itu sudah penuh dipesan, tapi bila aku ingin mengubah kamar mereka dengan kamar lain biaya untuk deluxe menatarkan, tapi aku tidak ingin itu. Aku hanya ingin ruang bersih di sini, itu baik-baik saja untuk mengubah dengan pilihan kamar superior, tertua iady di resepsionis adalah sangat kasar dan tidak sopan, sikap mengetawai pada saya jika aku bodoh yang aku tidak…",1
47, Pemedal Beach Resort,Tempat yang sempurna untuk bersantai. Kolam renang yang bagus. Tepat di pantai. Akses yang mudah dengan berjalan kaki ke resor dan restoran lain. Kami mampu untuk menyewa sepeda dari pemilik motor. Penawaran. Mereka juga membantu mengatur kami perjalanan menyelam. Favorit waktu hari menikmati matahari terbenam dan bintang setiap malam sebelum kami memutuskan tempat makan. Terpelihara dengan baik. Layanan yang baik. Saya berbagi dengan penduduk setempat di pantai setiap malam. Kami menikmati pijat yang kita dapat dengan mudah mengatur melalui staf hotel. Kami akan kembali dalam sekejap.,5
48, Pemedal Beach Resort,Kesan pertama saat turun dari perahu yang sangat tua! Kami tidak kecewa baik di atas laut laut merumputi (tidak begitu menarik) Kami tidak bergegas terlalu terbuka dilengkapi dengan kain & van Saya pergi ke hotel itu termasuk dalam harga tiket.  Kesan pertama dari hotel adalah hotel paling kotor yang masuk ke rel  kami tiba di bungalo pantai Pemedel. Setelah berjalan melalui gelap di pintu masuk kita punya bungalo pandangan jelas  & sangat senang!  Meskipun pantai tidak benar-benar sebuah pantai di rendah pasang & tampak lebih seperti sebuah labirin & licin. High tide iooks sedikit lebih menarik - kolam renang di hotel ini merupakan komoditas paling luar biasa. Kamar mandi bersih & telah ac yang mewah saja bersama dengan lemari es yang sangat diperlukan. Ada tidak ada tv tapi…,5
49, Pemedal Beach Resort,"4 bintang-bintang rating sebagai saya bertemu dengan harapan untuk pindah kamar, kolam renang, dan pantai tapi lebih jauh keluar dari kota dan anda tidak jadi-jadi untuk apa pun selain sarapan makanan. Saya akan tinggal di sini lagi dan akan merekomendasikan hotel ini jika anda ingin berada di kota dan memiliki pantai yang cukup bagus tapi saya pikir ada lebih baik hotel lebih dekat ke kota, aku akan tinggal di waktu berikutnya.  Staf yang luar biasa walaupun dan kamarnya sangat nyaman dengan teras besar, baik ac.  Saya akan meminta sebuah ruangan dekat kolam renang untuk kemudahan dan sedikit kurang jago/anjing kehirukpirukan.",4
50, Pemedal Beach Resort,"Aku tinggal di selama dua minggu Pemedal. Tidak seharusnya, tapi diperpanjang tinggal karena ada benar-benar baik. sangat ramah, membantu, dan sangat penting staf dan dengan lokasi yang tenang dan tepat di sebelah sangat dianjurkan blue corner dive.",4
51, Pemedal Beach Resort,"Kami menghabiskan 6 malam di bungalo pantai Pemedal dengan istri saya. Secara keseluruhan, kami memiliki pengalaman menginap yang luar biasa di sana: Tempat ini adalah tempat yang sangat tenang, pantai fantastis dan bungalo adalah baru, bersih dan di pantai litteraly. Dan kami dibayar untuk itu dengan harga yang sangat wajar. Pada sisi negatifnya, makanan di restoran yang sangat rata-rata dan masih ada banyak pekerjaan yang harus dilakukan untuk membuat tempat yang sangat ramah. Tapi kami pasti akan merekomendasikan hotel ini sebagai tempat sempurna untuk menjelajahi nusa lembongan!",4
52, Pemedal Beach Resort,"Kami tinggal di 3 malam untuk Pemedal, secara keseluruhan saya pikir untuk harga yang anda bayar adalah baik nilai untuk uang, namun, saya telah jauh lebih baik (dan lebih mahal) semua tempat di bali. Lokasi adalah luar biasa, tepat di pantai dan kolam renang adalah sangat berguna seperti itu anda tidak bisa benar-benar berenang terlalu banyak dan pasir ini penuh dengan batu karang sehingga sedikit menyakitkan untuk kaki.  Kamar luas dan bersih, hal ini tidak tercantik, tapi hei selama jam kerja saya dengan gembira. Ada banyak tempat benar-benar sebelah sehingga perlu diketahui mereka akan membangunkan anda. Aku tidak keberatan itu tetapi tidur di sampai 11 bukanlah pilihan.  Sarapan adalah baik-baik saja, jika itu benar-benar benar-benar baik dan saya menyesal tidak memiliki…",3
53, Pemedal Beach Resort,"Pergi di sini dengan keluarga saya 3 orang dewasa dan 2 anak-anak tidur (2 dan 6). Mendapat 2 kamar dan mereka sangat terjangkau. Hotel ini sangat bagus, dua bantal dan guling disediakan. Mereka juga menyediakan adaptor. Sangat baik dikelola dan shower air panas bagus. Namun kamar mandi memiliki bau yang tidak menyenangkan, mungkin perlu lebih banyak. Ini tampak seperti sebuah hotel cukup baru. Aku mencintai balkon, sangat luas dan santai dan memiliki pandangan yang baik dari pantai. Kolam renang adalah sangat mengundang. Anak-anak saya menghabiskan sebagian besar waktu hanya nongkrong di kolam renang hotel.  Sarapan adalah sangat dasar - Roti bakar, telur, mentega dan selai, jus dan kopi/teh atau buah segar.  Mereka memiliki sebuah restoran tetapi kita tidak pernah makan di…",3
54, Pemedal Beach Resort,"Aku tinggal di pantai untuk satu malam dengan Pemedal 5 teman. Kami memesan 3 kamar, dan semua kamar bersih, rapi dan luas. Hotel ini sangat tenang. Staf yang sangat membantu. Kolam renang dan view yang bagus. Sarapan adalah bagus. Kami suka menginap di sini. Satu hal yang mereka harus mempertimbangkan adalah waktu check out di 10 besar. Tidak memberi kami cukup waktu untuk menikmati hotel ini. ",5
55, Pemedal Beach Resort,"Hanya dengan perjalanan singkat dengan perahu dari bali lembongan. Kami tinggal di pantai di daun palem Pemedal hanya dari pantai. Hotel ini bersih, staf yang ramah dan tepat di pantai. Kolam renang adalah besar dengan pemandangan laut. Hotel ini hanya... Pulau ini adalah tempat yang menarik untuk bersantai dan untuk snorkeling dll. ",4
56, Pemedal Beach Resort,"Kami menyukai kami tinggal. Kami pasti akan datang di sini lagi di jantung berdetak. Staf indah & ramah, makanan murah & mereka hanya buat tab untuk anda, kolam renang adalah menakjubkan, yang menakjubkan matahari terbenam, hanya dibangun pada 2014 jadi itu bagus dan baru, kami pergi snorkeling (yang anda membayar dengan makanan anda tab di akhir) dan itu sangat menakjubkan! Yang benar-benar dapat menjengkelkan jika anda tidak digunakan untuk mereka, tapi kami pergi tidur lebih awal tetapi bangun pagi tidak repot-repot kami. Hal ketika anda pertama kali tiba di sana, mengemudi di jalan tanah dengan ""beach bungalows pemedal"" tangan ditulis di papan tapi kemudian anda berjalan melalui dan menyadari kau di surga! Tidak ada tv di kamar yang sebenarnya adalah baik sehingga anda…",5
57, Pemedal Beach Resort,"Kami menginap di bungalo pantai Pemedal pada bulan juni. Kompleks ini cukup baru dan dibangun dalam gaya tradisional indonesia. Bungalo ini nampaknya iarge dengan perabotan dasar tapi memadai. Ada kipas angin dan tidur dan keduanya bekerja sangat baik. Hotel ini memiliki kamar mandi yang besar dan bergaya modern minimalis, tapi pasti tidak besar. Lokasi tepat di pantai di depan kapal berselanca renjis adalah sempurna. Hotel ini memiliki pemandangan laut yang terhalang dari kolam renang yang besar, area bersantap dan paling besar beranda. Sanggraloka ini hanya berjarak dekat dengan berjalan kaki di sepanjang pantai dari banyak restoran dan tempat-tempat hiburan dan ini membantu menjaga suara bawah di ujung pantai. Cermat operkan wifi tersedia di sekitar resor namun memiliki…",4
58, Pemedal Beach Resort,"Ini benar-benar Pemedal tempat yang luar biasa untuk menginap! Kami akan sangat merekomendasikan tempat ini jika anda mengunjungi nusa lembongan! Hotel plusses dan minus: + lokasi yang indah, tepat di sebelah pantai + kolam renang yang indah + kamar bersih besar dengan keringat dan air panas + staf yang ramah + kemungkinan untuk menyewa skuter, pijat dan yang mengatur untuk mencuci laundry + tetangga (blue ocean mencempung) memiliki bagus' pesta pantai ' pada jumat (sampai 23:00) dengan musik + baik restoran terdekat - wifi dengan kata sandi dan kebutuhan aman air terjun yang indah Menikmati saat-saat menginap anda Pemedal!",5
59, Pemedal Beach Resort,"bungalo ini baru dan sangat luas. Hampir bisa terlalu besar! Kamar mandi di dalam. Bagian terbaik tentang tempat ini adalah besar, tepat di pantai! Kolam renang adalah baik-baik saja, mereka memberikan kursi pantai. Kami diperpanjang kami tinggal. Staf sangat ramah dan menampung. Pergi snorkeling dengan hotel ini untuk harga yang baik. Sangat merekomendasikan.",5
60, Pemedal Beach Resort,"kamar ini bersih, luas, lengkap, dan murah! kurang dari 500k kautembak: minuman selamat datang, gratis wifi, baik kamar, pantai, sunset view, sarapan, kolam renang besar dan sangat membantu & ramah.   hotel ini sulit untuk mendapatkan sebuah bungalow dengan view sunset beach dengan harga ini. Ini terlalu bagus untuk menjadi kenyataan. Lokasinya sempurna bagi kami karena kami tidak ingin untuk keluar dari kehidupan kota dan kamar mandi.  staf: mereka benar-benar membantu, baik dan ramah. aku sudah membaca beberapa komentar tentang resepsionis benar-benar buruk, tapi percayalah, ia hanya iooks kasar tapi sebenarnya tidak. Ini adalah hanya cara dia berbicara yang membuatnya terlihat cantik.  layanan: mereka akan memberi anda minuman selamat datang! Kami tinggal di mangrove dan…",5
61, Pemedal Beach Resort,"Tapi ketika kami tinggal di baru relativley Pemedal beach bungalow. Kamarnya sangat bagus dengan banyak ruang dan membersihkan setiap hari. Sarapan adalah besar dengan pemandangan indah di atas laut. Satu telur dengan roti dan beberapa buah-buahan. Pacar saya telah tinggal di hotel yang lebih besar namun... Wifi bisa ditingkatkan kualitas absoutly. Perjalanan bisa menerncanakan jika anda inginkan. Laki-laki yang memancing dan untuk membawa anda untuk melihat memancing yang lucu. Tempat yang aku akan datang kembali, staf yang bagus! Kadang-kadang karena kendala bahasa Missunderstandings tetapi tidak serius :)  Juga dimiliki oleh penduduk setempat yang saya ingin mendukung!",4
62, Pemedal Beach Resort,"Kami tinggal di sini selama 9 malam dan benar-benar mencintai hotel ini, kami sedikit khawatir ketika kami berhenti karena sebuah bangunan situs, beberapa beton blok dengan memoleskan pemedal di tumpukan beton blok, tapi kekhawatiran kita segera terlupakan, kami akan menginap di hotel yang fantastis, pemandangan kolam renang dan laut, di lokasi terpencil sepotong kecil dari surga.  Kamar dasar (tidak ada tv) tapi bersih dengan tempat tidur yang sangat besar, dan ac, apa lagi yang bisa anda minta? Tempat untuk binatukan musik, luar dan dalam, tidak ada suara yang nyata bangunan, kami yang hanya sedikit negatif adalah sarapan yang sangat terbatas, tapi tidak buruk! Semua staf yang brilian.  Aku benar-benar akan merekomendasikan tempat ini, lokasi besar, harga besar, satu-satunya…",5
63, Pemedal Beach Resort,"Kami menghabiskan 4 malam di sini dan meskipun tidak di kamar dan pantai yang indah, kita akan pernah tinggal di sini lagi karena dari kebisingan pesta yang hadir dari dive center di sebelahnya. Kami mencintai lembongan, tapi waktu berikutnya akan tinggal jauh dari lokasi ini. Jika anda menikmati tidur malam yang baik saya sarankan anda tinggal di tempat lain",3
64, Pemedal Beach Resort,"Beberapa saran - jangan berharap melalui agoda atau priceline, tampaknya untuk menaikkan harga sedikit. Kami membayar 450, dasar 000Rp/malam untuk kamar dengan kipas, kipas angin bekerja buruk dan bagus, kamar panas dan gelap, dan tidak ada air panas di pancuran, meja personil. Ya - lokasi dan kolam renang yang fantastis, terutama karena kami tidak menyelam dengan sudut biru luar (mereka adalah luar biasa, dengan cara). Namun, kami memiliki penerimaan yang sangat kasar ketika kita muncul.   Kami memesan dan prabayar untuk 2 kamar dengan kipas di penuh melalui priceline, dan ketika kami tiba mereka memberitahu kami mereka tidak memiliki kamar yang tersedia 2 kipas angin dan bahwa kita harus membayar ekstra untuk ac kamar. Mereka mengakui kesalahan mereka ini, tetapi kita tidak…",2
65, Pemedal Beach Resort,"Ini adalah hotel murah dan memiliki pandangan untuk matahari terbenam yang menakjubkan, kamar yang bagus dan tempat yang sangat damai untuk menikmati liburan dan staf adalah sangat ramah. Hotel bersih dan memiliki pelayanan yang baik. anda harus mengunjungi dan tinggal di sini. nikmati liburan dengan staf di pulau lembongan-bali.  Xoxo",4
66, Pemedal Beach Resort,"Yang benar-benar tempat yang bagus untuk tinggal di lembongan. Aku awalnya tinggal di puri kirana yang hanya di seberang jalan, tetapi tempat ini adalah jauh lebih baik. Terletak tepat di pantai, di ujung strip, jadi itu benar-benar dingin dan santai, tetapi masih dekat dengan restoran. Jika anda ingin melihat pulau ini kemudian anda akan perlu sepeda motor saya... Atau anda dapat hanya nongkrong di daerah ini kota.   Ini adalah tempat yang sempurna untuk tinggal jika anda menyelam dengan sudut biru (secara harfiah sebelah)... Yang merupakan benar-benar baik dengan suasana yang besar, tempat yang sama (saya terjun dengan tempat lain juga - Ikan Besar - blue corner dan adalah yang terbaik).   Satu-satunya hal untuk memeka di masa depan untuk akomodasi ini adalah bahwa mereka…",4
67, Pemedal Beach Resort,"Sebagai bagian dari liburan bodyboarding kami cukup beruntung untuk memiliki lima hari di nusa lembongan. Setelah lima hari yang sangat sibuk dan agak mengecewakan di canggu, kami tiba di hotel dan itu benar-benar merasa lelah Pemedal bersama hotel dan kamar/bungalo kami yang cantik. Aku akan Pemedal terletak strategis dan baik untuk menjelajahi pulau atau melupakan dunia.  Restoran ini dapat menyerang anda sebagai sangat dasar tapi makanan yang disajikan adalah fantastis dan sangat baik nilai untuk uang.   Salah satu bagian dari nasihat adalah bahwa mereka membangun lebih banyak bahwa, jika anda ingin merasakan suasana akrab pilih saya segera pergi!",5
68, Pemedal Beach Resort,"Kamar csimple tapi bersih, dengan ac dan co. Lokasi tenang, terjangkau dan dekat dengan pantai kolam renang view bungalow di pantai. Sarapan yang baik. Anda dapat dengan mudah menyewa sepeda motor melalui cna hotel Jika anda membayar dengan kartu kredit, membiarkan mereka tahu di muka ketika kami memeriksa pribadi tidak tahu bagaimana untuk membuatnya bekerja...",4
69, Pemedal Beach Resort,"Nilai yang sangat baik untuk uang di pantai Pemedal. Dari foto-foto tidak melakukannya keadilan, tapi itu adalah lokasi yang menakjubkan untuk bersantai di dan biarkan dunia berlalu. Seluruh pulau adalah menyambut perubahan dari daratan bali. Kolam renangnya fantastis, dengan pemandangan yang luar biasa, tempat tidur yang sangat nyaman dan vila ini dilengkapi dengan ac kuat, dan kamar mandi yang baik. Orang-orang benar itu adalah dengan berjalan kaki sebentar dari pusat desa, tapi anda dapat menyewa sepeda atau berjalan kaki, itu 15-20 menit! Beberapa orang telah disebutkan sarapan, ya tidak ada yang minta untuk berbagai pilihan untuk sarapan tidak dibebankan dan kemudian sangat nyaman dan besar menu.  Nilai yang luar biasa untuk uang Pemedal dan direkomendasikan! ketika aku…",5
70, Pemedal Beach Resort,Kolam renang adalah di pantai makanan baik makanan indonesia dan beberapa western di campuran. Sarapan adalah dasar kamar bersih dan besar. Lokasi adalah benar-benar jauh tapi masih sangat bagus. Wifi adalah plus dan yhe staf sangat ramah dan membantu dengan apa pun yang kami butuhkan. Mereka mengatur sebuah perahu dan sopir bagi kita untuk pergi menyelam dan menombak ikan di.,4
71, Pemedal Beach Resort,"Segala sesuatu tentang hotel ini sangat menakjubkan. Lokasi adalah menjelang akhir jadi anda harus menyewa skuter untuk bergerak di sekitar, atau berjalan kaki tapi keuntungan adalah bahwa anda mendapatkan damai dan tenang. Ketika anda langkah pertama ke hotel, anda akan takjub dengan pemandangannya. Ada kolam renang di mana anda dapat hanya berbaring di sementara yang menghadap pantai. Itu benar-benar surga di bumi.   Staf di sana yang sangat ramah dan selalu ada untuk membantu anda. Untuk saya, hotel ini setidaknya shld diberi peringkat 4 bintang.   Kamar bersih dan besar. hotel yang sangat baru. Lingkungan bersih. hotel ini bagus dan titik plus adalah bahwa pantai adalah di depan pintu anda langkah. jadi tidak terlihat lebih jauh. Memesan hotel ini.",5
72, Pemedal Beach Resort,"Saya dan istri saya menghabiskan seminggu di sini. Kamarnya baru dan mereka membangun lebih 9. Kamar besar, udara con dan kamar mandi yang bagus. Makanannya ok. Tapi ada beberapa makanan besar pilihan dekat, termasuk trip adivsor Bamboa #2. Pantai ini tidak diperuntukkan untuk berenang. Ada benar-benar hanya dua pantai renang dan mereka adalah mushroom bay dan dream beach. Dan itu tidak ada yang menulis tentang rumah. Anda dekat untuk fantastis snorkeling di hutan bakau. Dinding pergeseran snorkeling adalah salah satu yang terbaik anda akan menemukan di dunia. Dan semua bahwa pertanian rumput laut. Menarik. Seorang pria di hotel, kadek, adalah bekas petani rumput laut, dan akan membawa anda pada tur dan menjelaskan seluruh kesepakatan. Ini adalah menarik. Tempat di sebelahnya…",4
73, Pemedal Beach Resort,"Benar-benar menikmati kami tinggal, pulau ini indah dan orang-orang sangat bagus. Itu sangat tenang dan sempurna dibandingkan dengan daratan bali. Anda harus menyewa sepeda motor jika anda ingin tinggal di sini meskipun (tidak sulit untuk beroperasi atau cari di semua) dan mengambil feri ke.",5
74, Pemedal Beach Resort,"Pemedal untuk menginap di 2 malam, kami memiliki dua kamar, baik luas kamar tidur biru yang saya sangat khawatir tentang seperti jumat malam adalah malam semua orang pergi ke blue corner - meskipun apa yang orang lain mengatakan ini tidak terlalu keras di semua dan mereka berhenti musik di 10, yang saya pikir sangat wajar.  Staf di hotel yang brilian dan membantu kami keluar dengan semua permintaan kami. Saya punya cucu berusia 3 tahun dengan saya yang mencintai ketut pisang yang dimainkan dengan dia dan bercakap-cakap dengan dia sepanjang waktu.  Terima kasih Pemedal untuk yang besar tinggal kami akan segera kembali :) ",5
75, Pemedal Beach Resort,"Tinggal di pemedal beach bungalows untuk 5 malam dan sebagian besar tinggal adalah fantastis.   Ketika kami pertama kali tiba kami mengalami sedikit kesulitan karena kamar kami tinggal di memiliki semut di mana-mana dan jendela tidak akan menutup. Dengan cepat kami memberitahukan staf yang memperbaiki jendela tapi kami di mana masih di senang tentang semut sehingga kami dipindahkan ke kamar lain.  Kami awalnya dibayar untuk kamar dengan kipas angin, tetapi menemukan itu terlalu hangat jadi berubah ke kamar dengan ac.   Kolam renangnya fantastis dan hanya apa yang kami butuhkan untuk malas hari (ver y bersih).  Sarapan adalah 6/10 tidak banyak variasi pada menu terutama tinggal di sana untuk begitu lama kami akan lebih suka sesuatu yang lain selain hanya telur (meskipun mereka…",4
76, Pemedal Beach Resort,"Saya benar-benar seperti Pemedal hotel, jika saya pernah datang kembali lagi. Saya pasti akan tinggal di sini tanpa ragu-ragu. Itu hampir terlalu bagus untuk menjadi kenyataan. Bagus, bersih kamar modern. staf yang sangat ramah dan kolam renang adalah yang terbaik di daerah ini. Semuanya bekerja di hotel ini sempurna, wifi, ac, air panas. Saya sangat sangat puas dengan tempat ini.  Anda dapat menyewa sebuah motor untuk 5usd sehari. Jika tidak, itu cukup sulit untuk pergi ke mana pun. Lembongan adalah kota yang tenang dan ada tidak banyak kehidupan malam. Saya datang ke sini untuk menyelam dan saya mengelola untuk melihat ikan pari manta dan mola mola di 2 hari berturut-turut. Saya sangat senang.   Pikiran anda, blue corner dive shop dan hotel bisa berisik pada malam hari karena…",5
77, Pemedal Beach Resort,"Kami menginap 2 malam di sana.  Hotel ini terletak di ujung jalan utama di nusa penida, di daerah yang tenang dan bulat dengan perahu nelayan.  Kami menghargai: - akomodasi yang bersih, nyaman dan dengan kamar mandi yang baik orang-orang benar-benar bagus - hotel  - pemandangan yang menakjubkan dari kolam renang!  Bungalownya 50m jauh dari panti pasir putih yang indah. Anda akan pasti seperti matahari terbenam dengan view di bali.   Untuk penyelam. Anda dekat dengan blue corner diving center! Mereka serius dan penyelaman yang menakjubkan di penida. Jangan lewatkan jumat pesta pada hari jumat.",5
78, Pemedal Beach Resort,"Kami tinggal di sini selama seminggu di september 2014. Menakjubkan lokasi, renang tampak tepat di atas air, sehingga anda dapat berenang dan menyaksikan petani rumput laut. Bungalo yang baru dan bersih. Mandi adalah yang terbaik yang kami telah pernah ditemukan di indonesia. Indah menampung staf dan sarapan yang baik. Dekat dengan baik restoran dan toko-toko menyelam. Akan tinggal di sini lagi.",5
79, Pemedal Beach Resort,"Tidak banyak untuk mengatakan tentang hotel ini selain itu harga (kami membayar 40 $+ / malam di agustus untuk kamar ac)  Terletak di ujung pantai ke utara, itu tidak menarik bungalo (relatif) bersih.  Tempat ini seharusnya baru dan masih tampak agak setengah selesai (beberapa bangunan masih dalam konstruksi di sekitar), tapi perlengkapan kamar mandi telah berkarat di tempat dan kebersihan dapat ditingkatkan.  Sekarang bagian terburuk: hotel ini terletak di sebelah bar udara terbuka/club malam... Dan karena kamar kami memiliki jendela kayu di satu tempat, semua di sepanjang kaca jendela, tidak ada suara isolasi apapun... kami merasa seperti musik itu di kamar kami... Tak perlu dikatakan kami tidak tidur sangat baik! Kami berada di sana jumat malam, jadi tidak memeriksa sisa…",2
