,hotel,review,stars
127, PinkCoco Uluwatu - for Cool Adults Only,"Aku punya pengalaman yang menyenangkan sementara tinggal di hotel ini untuk 3 malam. Ini sangat menawan dan memiliki daya tarik pedesaan namun nyaman ini menyenangkan. Stafnya ramah namun tidak mengganggu. Seluruh tempat memberi saya perspektif baru di liburan dengan menambahkan elemen ini ditambahkan ke petualangan lembut. Semua teman-teman saya dan saya punya waktu yang indah dan kami telah merencanakan untuk mengunjungi properti mereka yang lain. Aku ragu-ragu di pertama tentang tinggal di hotel independen, tapi setelah pengalaman ini, ini telah berubah pikiran saya. Harga yang terjangkau. Tidak murah jika anda membandingkannya dengan hotel lainnya lebih dikenal berdiri sendiri akomodasi di pulau tapi itu layak. ",4
128, PinkCoco Uluwatu - for Cool Adults Only,Ini adalah kedua kalinya kami telah tinggal di hotel ini dan kita tidak bisa lebih senang dengan layanan mereka. Resepsionis adalah sangat ramah dan membantu seluruh tinggal kami. Makanan yang menakjubkan dan dengan nilai luar biasa! Ruangan itu bersih dan tempat tidur sangat nyaman. Aku benar-benar menikmati spa di hotel sementara suami saya berselancar secara harfiah dua menit ke jalan di padang padang beach. Kami mencintai kami tinggal dan tidak mungkin kami akan kembali lagi! Kami mungkin akan menginap di gili serta PinkCoco :) suasana santai yang hebat dan staf yang ramah!,5
129, PinkCoco Uluwatu - for Cool Adults Only,"Hotel ini cukup baik, dengan indah restoran dan kolam film yang ditawarkan. Kolam renang juga indah. Namun, kamar-kamarnya sedikit aneh. Mengerikan kepam bau dan tampak sedikit telanjang - merasa seperti anda sedang tidur di luar! Tidak benar-benar apa yang anda harapkan untuk harga. ",3
130, PinkCoco Uluwatu - for Cool Adults Only,"Kami menghabiskan hanya satu malam di uluwatu dan kami sangat senang kami memesan pink coco untuk malam itu.   Kamar di lantai dasar adalah 10 langkah dari kolam, suhu yang sempurna untuk cuaca! Ruangan itu nyaman dan kamar mandi adalah keluar dari mimpi!   Makanan di restoran yang sangat buruk. Meskipun di malam hari ada banyak suasana, makanan yang di bawah rata-rata. sehingga anda dapat memulai hari anda dengan menikmati minuman di tempat dan kemudian menjelajahi tempat-tempat lainnya. Sarapan adalah benar-benar baik tempat sebelah juga! Dapatkan yang terbaik jika anda ingin menghindari pink coco sarapan.   Kami berada dalam jarak berjalan kaki dari pantai padang padang yang bernilai satu mengunjungi untuk yakin.   Juga terdapat sebuah warung dekat oleh (yang baik segera…",4
131, PinkCoco Uluwatu - for Cool Adults Only,"hotel yang sangat bagus, 3 menit berjalan kaki ke pantai padang padang. Kamar yang cantik, memiliki bagus dan luas kamar mandi setengah terbuka. Tempat tidur yang nyaman dan besar. Kolam renang menyenangkan, selalu suasana santai di sini. Banyak peselancar atau bepergian dengan pasangan. Kami tinggal terbaik di bali!",5
132, PinkCoco Uluwatu - for Cool Adults Only,"Kami berhenti di pink coco untuk satu malam, kami ingin mencapai pemandangan pantai yang menakjubkan di uluwatu sangat cepat, sebelum menuju kembali ke seminyak untuk festival musik.   Kamar kami sangat memuaskan secara estetika, dengan desain dasar, namun sangat luas dan fungsional. Pink coco telah mandi terbaik kami 12 hari perjalanan ke bali. Di lokasi yang sangat baik - itu hanya 10 langkah ke kolam renang dari tempat tidur kami, ya aku menghitung.  Sementara restoran di properti ini memiliki reputasi sebagai - menghindari tempat ini, jika anda makanan asli asli menggalilah. Seperti sebagian besar tempat di bali island, tempat ini memiliki makanan spiceless hambar, makanan kaukasia ifwaal lidah.   Hanya di jalan adalah Hebboh! Saya mendorong anda untuk mengunjungi tempat…",4
133, PinkCoco Uluwatu - for Cool Adults Only,Pertama dua malam di 3 minggu tur di bali dan lombok telah dihabiskan di sini dan kami menyukainya!  Makanan di restoran sangat lezat! Kamar cukup dan nyaman! Kolam renang indah untuk berenang di sore hari! Saya suka kamar mandi semi luar keluar dari semua yang kami kunjungi! Benar-benar tidak ada keluhan atau area untuk peningkatan!,5
134, PinkCoco Uluwatu - for Cool Adults Only,"Sangat menyenangkan dan tempat yang tenang tepat di padang padang. Anda dapat berjalan kaki ke pantai padang padang untuk 3 menit. Jika benar-benar makan, 5 stars untuk tini. Ia adalah luar biasa dan nyaman. Pink coco, anda sangat beruntung memiliki dia. Dia bahkan membiarkan saya mengambil mandi dan berubah bahkan setelah memeriksa keluar dari tempat. Aku akan datang kembali setiap kali aku bahkan berselancar di padang padang",4
135, PinkCoco Uluwatu - for Cool Adults Only,"Benar-benar menikmati nilai untuk harga di pink coco dan lokasinya ideal juga. setiap hari aku akan periksa berselanca di bingin, padang padang, lalu Ulus, mendapatkan merobek di pink coco dan datang kembali untuk bersantai di kolam sambil menikmati pizza dan beberapa bintang yang ramai di malam hari. Spa/salon pijat di belakang adalah benar-benar baik dan itu hanya apa yang diperintahkan docta setelah beberapa hari irisan yang doggin. Saya pasti akan kembali! Ruang!",4
136, PinkCoco Uluwatu - for Cool Adults Only,"Aku benar-benar bahagia aku dapatkan jauh dari kuta/seminyak ramai dan tinggal selama 3 malam di the PinkCoco di uluwatu. Pantai-pantainya jauh lebih indah dan asli, dan suasana tidak hampir sebagai ramai. Ini bisa menjadi PinkCoco-rumah yang sempurna untuk eksplorasi semua pantai di daerah serta kuil. Kamar saya sangat luas dan tidak ada ac dan wifi yang sempurna. Kolam renangnya sangat menenangkan dan sangat bagus! Satu-satunya keluhan saya akan adalah luar biasa. Itu ruang kartu seberapa keras mereka selama siang hari. Tidak mengambil pada pertengahan hari istirahat dengan bunyi di telinga anda, tapi untungnya mereka tenang di malam hari.",4
137, PinkCoco Uluwatu - for Cool Adults Only,"Hotel ini adalah sempurna untuk teman saya & gadis saya. Setelah dusunan/trendi dengan suasana spanyol gaya. Dua kolam renang, pemandangan laut, layanan yang ramah, restoran yang mengagumkan dan spa yang menyegarkan di belakang. Apa lagi yang anda butuhkan? Hotel ini tengah dan dekat dari pantai Pedang Pedang dan berkendara sebentar ke apa watu berselanca & sirip tunggal. Itu tidak bintang 5 pengalaman dengan harga seperti beberapa tempat di daerah, tapi itu di mana kelas & hemat. Dianjurkan dalam buku-buku saya. ",5
138, PinkCoco Uluwatu - for Cool Adults Only,"Kami tinggal di sini di juli untuk 4 malam di kamar menghadap laut. Hotel ini memiliki suasana yang santai dan sangat baik jika anda mencari untuk liburan pantai yang santai. Aset terbesar untuk hotel ini adalah lokasi, yang terletak di seberang mini mart dan dalam jarak berjalan kaki ke pantai padang padang ini sangat berangin. Aset besar hotel ini adalah staf yang sangat ramah, dan bahkan ketika itu akan tersedia bagi kita pada saat kedatangan kami sebagai per permintaan pemesanan.   Ruangan itu besar dan pemandangan laut itu bagus, tidak ada yang spektakuler. Ini meliputi beberapa daerah yang baik untuk menempatkan barang-barang anda sendiri jika anda ingin. Tersedia tv satelit, kita tidak melihat ini tapi itu tampak seperti itu bagus dan ukuran yang tepat. Kamar mandi adalah…",4
139, PinkCoco Uluwatu - for Cool Adults Only,"Ini adalah kunjungan kami yang ke 2nd PinkCoco dan kami menyukainya! Kami tinggal di tingkat atas yang indah dan pribadi, sebelumnya kami tinggal di penthouse yang memiliki pemandangan indah dan balkon besar yang bagus. Berada di lokasi yang bagus PinkCoco di uluwatu yang adalah mengapa kami kembali, kita cinta benar-benar PadangPadang pantai dan toko-toko dan restoran di sekitar hotel ini. Staf yang indah dan selalu kamera. Mudah untuk berjalan berkeliling dan juga untuk menyewa sepeda untuk pergi ke pantai lain :) kami akan kemungkinan besar akan kembali lagi di masa mendatang!",5
140, PinkCoco Uluwatu - for Cool Adults Only,"Aku datang untuk pink coco dengan rekomendasi dari seorang teman yang tinggal di sini di 2013, dan juga membaca ulasan anda yang luar biasa. Aku tinggal 7 malam di pertama kalinya dalam mungkin dan 7 malam di bulan juni-juli. Tempat ini adalah pilihan terbaik di padang padang!  Lokasi adalah mengejuntukan - 5min berjalan kembali ke pantai, dekat dengan beberapa restoran dengan berjalan kaki juga, dekat dengan mini market, atm, dan memiliki bagus restoran italia di hotel jika anda berada di sebuah mode mudaperlakuan dan ingin menginap di lokasi.  Jojo, ika dan seluruh staf itu begitu hangat dan ramah membuat saya merasa ""di rumah"" ada benar-benar saya 2 yang lama. Mereka menyediakan saya dengan layanan terbaik dan perhatian pada setiap permintaan - mobil, antar jemput, penyewaan…",5
141, PinkCoco Uluwatu - for Cool Adults Only,"Kami tinggal di sini di juli 2015 karena kami ingin tinggal di suatu tempat di dekat pantai untuk berselancar. Kami memesan kamar secara online dan membuat kesalahan dengan pemesanan satu tanpa ac. Kami kemudian harus membayar hampir dua kali untuk mendapatkan sebuah kamar dengan ac (dan tidak ada telepon yang aneh tapi nvm) dan cukup tentang seluruh tempat itu benar-benar dihancurkan. Kami tinggal di beberapa benar-benar baik hotel dan kami juga gabas ini kadang-kadang dan tempat ini aneh. Harga dan ulasan membuat kami berpikir itu akan menjadi cukup menakjubkan - dan harus jujur itu baik-baik saja. Ruangan itu besar... hotel ini sangat bersih. Wastafel kamar mandi bocor tapi itu hidup dan bukan masalah besar. Saya kira untuk apa itu, itu mahal - dan mereka bisa lolos dengan…",3
142, PinkCoco Uluwatu - for Cool Adults Only,"Saya dan mitra saya menghabiskan sangat baik 3 malam di pink coco bali. Kami tinggal di kamar penthouse yang adalah surga. Empat tiang, air terjun mandi dan pemandangan anda akan membayar satu juta untuk. Stafnya sangat ramah dan membantu dari nelayan setempat yang menyambut kami di sana jam dan membantu kami untuk kamar kami ke depan rumah staf. Hotel terpelihara dengan baik dan restoran itu bagus untuk sarapan. Karena kami hanya di daerah untuk berhenti lebih dari 72 jam di pernikahan kami tidak memiliki makan malam di restoran tapi itu tampak hebat. Kolam renang adalah berkilau dan lapangan terpelihara dengan baik. Ini adalah tempat yang bagus untuk tinggal dan nilai besar jauh dari hiruk-pikuk.",4
143, PinkCoco Uluwatu - for Cool Adults Only,"Ketika suami saya dan aku memeriksa ke dalam hotel kami diberitahu kami benar-benar telah memesan kamar ""deluxe balkon"", tapi itu jelas tidak deluxe dan ini tidak memiliki balkon. Kamar kami diberi yang menghadap halaman yang tampaknya lebih cocok untuk tinggal (tersedia setiap hari di area dapur ini) atau pesta, atau tempat untuk membunuh waktu selama musim hujan. Seluruh tempat memberikan dari sebuah ""youth hostel"" suasana, ditambah pandangan sesama tamu kami. Halaman makan sangat sedikit cahaya dan tidak memiliki view ke luar. Kamar di satu jendela iooks di ke petak rumput dan dinding beton. Kamar di lantai adalah beton mengingsut dengan lantai mosaik, dan ""perabotan"" terdiri dari lukisan, dibangun di blok beton, simpan untuk satu pouff dan ranjang, yang sangat nyaman dan…",3
144, PinkCoco Uluwatu - for Cool Adults Only,Kami memulai liburan kami dengan 2 malam menginap di hotel ini. Ruangan itu bagus dan dasar. Selanjutnya kolam renang adalah indah dan baik terus.  Restoran italia ini menyajikan makanan berkualitas dan stafnya sangat ramah dan siap untuk membantu.,4
145, PinkCoco Uluwatu - for Cool Adults Only,"Hotel terbaik yang pernah saya kunjungi di bali. Indah dan dekorasi bergaya. Aku tinggal di murah 14 di lantai dasar, dengan kamar mandi terbuka yang besar - tidak ada pilihan ac, atau tv, tapi tidak bisa. Kecil dan bagus balkon yang menghadap ke kolam renang. Jumat dan sabtu malam film di taman hotel. Staf resepsionis - Ika dan tini - lain ditambah titik, yang membuat kami merasa seperti di rumah. Sarapan tidak termasuk dalam tarif kamar saya, tapi aku bisa makan di trattoria italia yang terletak di depan hotel, dengan pilihan yang sangat baik. Saya akan tinggal di sini lagi.  Saran untuk perbaikan lebih lanjut: cermin besar di kamar. Dan hotel ini tidak memiliki perjanjian dengan restoran untuk membiarkan para tamu yang membayar semua hidangan di lihat",5
146, PinkCoco Uluwatu - for Cool Adults Only,"Kami baru-baru ini tinggal di hotel untuk 3 malam Pinkcoco. Kami tinggal di ruangan merah yang sangat nyaman kamar, satu-satunya minus karena tidak ada telepon di kamar. Ini berarti bahwa jika kita memerlukan sesuatu, atau mencor kubersit dll, kami harus berjalan dgn lesu untuk penerimaan untuk berbicara dengan seseorang. Kamar mandi luar biasa - saya suka terlalu seperti sireman di bawah air terjun. Kamar mandi itu sangat panas karena dari lokasi yang sangat baik, tetapi ketika anda tidak menghabiskan banyak waktu di sana, itu tidak mengganggu kita.  Lingkungan yang sangat menyenangkan dan ada sangat rendah di paviliun dua kali seminggu. Restoran ini memiliki area dalam ruangan dan luar ruangan 2 area. Buatlah salah satu area ini bebas-rokok. Suami saya mendapat asma dan kami…",3
147, PinkCoco Uluwatu - for Cool Adults Only,"Tidak ada yang salah dengan hotel ini besar, tetapi ada jauh lebih baik di tempat lain.  Kami tinggal di lima hotel yang berbeda selama perjalanan kami dan ini adalah oleh jauh yang terburuk.  Dimulai dengan positif, itu adalah baik-baik saja dan kolam renang adalah cukup bagus. Tidak ada keluhan di sana.  Namun, saya tidak yakin jika saya telah mengangkat standar terlalu tinggi dari tempat-tempat lain, tetapi di sini adalah layanan pelanggan itu dihidupkan kembali beralasan dari tingkat lain, pilihan.  Pada saat kedatangan (baik dimulai setelah check-in) kami harus menunggu lima belas menit untuk mencapai kamar kami. Ketika saya masih ada tamu sebelumnya kemubasiran dari di dalam kamar mandi.  Kami meminta taksi blue bird untuk perjalanan, tetapi butuh lebih dari satu jam dan…",2
148, PinkCoco Uluwatu - for Cool Adults Only,"Kami berada di sini panggeng agung, kami menyukainya. Ini adalah hotel yang nyaman, tapi pasti tidak pretencious. Kamarnya bagus, beberapa dari mereka dengan mandi luar, yang indah. Sebagian besar kamarnya dekat dengan kolam dan sejak hotel tidak mengambil terlalu banyak orang, sehingga tidak pernah terlalu ramai, anda dapat beristirahat di tepi kolam renang dan bersantai. Restoran ini memiliki besar makanan italia, dan sarapan sangat baik. hotel ini lokasinya sangat strategis jika anda adalah surfer, ini adalah 15 menit berjalan kaki dari padang-padang. Anda juga dapat menyewa vespa dan itu dekat dengan segala sesuatu - cara termudah untuk berjalan-jalan di bali. Pagi-pagi.",5
149, PinkCoco Uluwatu - for Cool Adults Only,"Pacar saya dan saya tinggal di sini selama 5 malam. Kami berada di kamar 12, yang adalah tepat di sebelah kolam renang! Kamarnya sempurna untuk apa yang kita yang setelah, meskipun kami hanya memiliki kipas angin, kami tidur cukup baik. Ini membantu untuk menjaga pintu dan jendela terbuka untuk mendinginkan ruangan di malam hari. Mereka juga memiliki sebuah alat kecil untuk menjaga mozzi keluar dari kamar anda dan untuk saya! Tempat tidur nyaman dan itu adalah satu-satunya tempat yang kita telah tinggal di bali yang telah memberi kita dua bantal, yang saya suka! Kamar mandi indah, mandi pergi dari panas ke dingin, panas ke dingin untuk bunga-bunga indah mereka, bukan masalah besar. Air gratis disediakan setiap hari, tetapi juga membersihkan kamar setiap hari dan tempat tidur…",4
150, PinkCoco Uluwatu - for Cool Adults Only,"Tunangan saya dan aku menyukai menginap di pink coco! Tempat ini sangat bagus dan dua kolam renang menjadi tempat yang sempurna untuk bersantai setelah seharian menjelajahi pulau. Staf sangat membantu ketika kami meminta tapi tidak pernah mengganggu kami. Kamar yang selalu bersih. Kami makan sarapan di restoran trattoria, setiap hari dan setiap kali itu, segar, dan lezat. Kami juga makan makan malam di sana beberapa kali dan kami bahkan lebih terkesan dengan cara yang semuanya - pasta buatan sendiri dan kamar sebelah untuk win! Nilai yang sangat baik untuk harga, tidak untuk menyebutkan ini adalah 5 menit berjalan kaki ke pantai padang padang!  Rincian foto dan ulasan saya dapat ditemukan di: kamarnya relatif luas. saucesandsuitcases. Com",5
151, PinkCoco Uluwatu - for Cool Adults Only,"Ini adalah, menurut pendapat saya, salah satu tempat terbaik untuk tinggal di area ini! Kami mencoba pilihan lain tetapi tidak benar-benar pink coco! Nilai yang besar untuk uang anda. Dekat estetika day spa (sangat bagus spa juga!) trattoria restoran (besar). Jika anda ingin berbelanja secara royal di penthouse queen perawatan! Benar-benar layak!",5
152, PinkCoco Uluwatu - for Cool Adults Only,"Permata kecil di pecatu. Kami memesan sea vista kamar, sangat luas, ac yang bagus, dan balkon yang menghadap ke kolam renang. Lingkungan sejuk, dekorasi dan cukup harga hanya $80USD termasuk sarapan. Seperti perubahan yang menyenangkan untuk ramai seminyak. ",5
153, PinkCoco Uluwatu - for Cool Adults Only,"kami tinggal di penthouse. Kamarnya luas dan pemandangan sangat fantastis! Nilai adalah jauh melebihi harga yang kami bayar!  dalam hal fasilitas, kami benar-benar menikmati spa dan kolam renang!   kurang dari 500m ke padang padang beach dan dekat ke restoran dan toko. Kami benar-benar menikmati kami tinggal.",5
154, PinkCoco Uluwatu - for Cool Adults Only,"Ini adalah 'putri ibu bonding' liburan. Putri saya tidak bisa telah menemukan sebuah hotel yang lebih sempurna. Pinkcoco adalah hanya berjalan kaki singkat dari pantai, tidak pantai terpencil, tapi tidak terlalu ramai dan air adalah ideal bagi peselancar. Kami berada di unit 13, benar-benar tidak beruntung tentang itu. Ini adalah kamar yang besar dengan tempat tidur ukuran king besar di satu sisi dan area duduk di sisi lain. Kamar mandi besar juga. Juga memiliki sebuah teras terbuka yang menghadap ke kolam renang. Bisa dengan mudah menampung keluarga empat! Jempol untuk makanan & minuman yang disajikan di the hotel's trattoria. Kami juga menikmati sesi pijat di spa estetika. Para staf yang sangat ramah & membantu - memesan taksi, direkomendasikan tempat menarik, dll. Kami…",5
155, PinkCoco Uluwatu - for Cool Adults Only,"Kami memesan ke pink coco setelah pindah dari resor lain di dekatnya dan kami sangat lega. Tidak seperti resort lain, yang jauh lebih mahal yang kami punya kamar bersih, staf yang ramah dan gegar.  Kami menikmati perasaan terbuka tempat dan berjalan ke pantai adalah pendek kemudian kami harapkan. Ada banyak toko-toko semua di sekitar yang baik.  Kami telah diperpanjang kami tinggal di sini setelah mencari di tempat lain di sekitar bali mengapa membayar dua kali atau tiga kali untuk menginap di sanggraloka besar di mana anda merasa seperti terkurung! Di sini mudah, damai dan santai.",4
156, PinkCoco Uluwatu - for Cool Adults Only,"Tempat terbaik untuk tinggal di di uluwatu dengan harga terjangkau. Kamar yang luas, bersih, udara con, kolam renang yang bagus, staf yang membantu. Sewa skuter oleh hanya bertanya meja depan. Hari besar spa hanya di belakang pink coco, menakjubkan! Ramah anak. Banyak tempat makanan sangat dekat, dan blue point naik skuter 5 menit hanya di jalan, dan pandang pandang beach 1 menit naik/5 menit berjalan kaki.  menantang merekomendasikan 20 keluar 10 :)  Terima kasih untuk pengalaman yang menyenangkan setiap kali. ",5
157, PinkCoco Uluwatu - for Cool Adults Only,"tempat yang indah... staf sangat manis dan membantu, resepsionis adalah selalu bersedia untuk pergi sedikit tambahan, kolam renang cukup ketuhanan, akses mudah ke pantai... restoran makanan yang sangat baik. Tempat yang bagus untuk keluarga yang lebih tua, banyak peluang untuk hal-hal untuk melakukan dan melihat.",4
158, PinkCoco Uluwatu - for Cool Adults Only,Hotel ini sangat lucu dan di lokasi yang bagus. Anda dapat dengan mudah menyewa skuter untuk mengakses semua pantai yang berbeda di sekitar. Spa dan restoran yang terhubung ke hotel sangat bagus juga.   Satu-satunya turun-sisi itu tidak terletak tepat di pantai (5 menit berjalan kaki) tapi beberapa kamar memiliki pemandangan laut. Juga karena ada begitu banyak pantai di area ini merupakan tempat yang sangat menyenangkan menjelajahi lebih dari hanya pantai yang paling dekat dengan anda.   Saya pasti akan tinggal di sini lagi.,4
159, PinkCoco Uluwatu - for Cool Adults Only,"Hotel ini menggemaskan! Itu mengingatkan saya pada beberapa jenis klasik 50-an hotel di florida. tempat ini bagus dan 2 menit dari pantai. ini adalah campuran dari keluarga dan pasangan dan lajang dan kelompok, yang saya akan lebih suka terutama satu atau dua kategori. Kamarnya yang unik, dengan lantai batu dan fasilitas yang besar. Tidak ada jaring nyamuk di kamar standar, tetapi mereka menyediakan semprotan, obat nyamuk bakar, dan colokan di - yang cukup pintar.  Kamar mandi udara terbukanya sangat indah dan menyukai hujan pancuran air, wastafel besar yang indah, dan handuk - wow. Paling baik handuk di bali lebih baik daripada 4 atau 5 stars - beragam, super lembut, dan bau seperti cairan pelembut.   Tempat tidur yang sangat nyaman, spreinya an off white - putih - tidak ada…",4
160, PinkCoco Uluwatu - for Cool Adults Only,"Kami telah melakukan perjalanan melalui asia tenggara selama beberapa minggu sekarang dan tempat ini adalah yang terbaik, kamar kami adalah sepenuhnya ac bersama dengan jaring nyamuk menutupi tempat tidur dan kamar mandi besar. Bersantai di kolam renang atau berjalan turun terlalu padang padang beach, dekat terlalu kuil dan restoran lain ",5
161, PinkCoco Uluwatu - for Cool Adults Only,"Kami hanya menginap selama satu malam yang pink coco dan kami pikir tempat ini sangat menyenangkan. Kamarnya cukup luas dengan kamar mandi luar ruangan besar, yang merupakan besar plus. Dekorasi kamarnya sederhana dengan semua yang anda butuhkan. Satu-satunya kelemahan adalah fakta bahwa ruangan itu cukup gelap karena yang diarsir area duduk di depan. Area kolam renang bagus untuk bersantai, meskipun circular kolam renang tampak lebih dekoratif dari fungsional. Staf yang sangat ramah dan membantu yang sangat penting untuk tinggal. Kami hanya keluhan adalah bahwa restoran terlampir bukan bagian dari hotel jadi anda tidak dapat mendapatkan makanan atau minuman diantar ke kamar anda. Secara keseluruhan, nilai yang sesuai dengan harganya!",4
162, PinkCoco Uluwatu - for Cool Adults Only,"lokasi yang besar, sangat terlatih staf, kamar yang bersih - dekorasi bagus 2 kolam renang yang indah dan sangat indah. dekat daerah selancar! Anda tidak akan kecewa! Makanan italia sangat baik. Semua kami menikmati masa menginap kami!",5
163, PinkCoco Uluwatu - for Cool Adults Only,"Saya memiliki 2 malam di sini. Ini adalah 2 menit dari Pedang Pedang beach, berkendara sebentar dari ulu Watu temple dan memiliki restoran di situs. Kamarnya indah dan berbeda dengan kamar mandi yang terbuka dan bertingkat, shower. Saya memiliki tempat tidur yang nyaman di luar kamar saya di bawah naungan. Satu kaki keluar dan saya pertama. Lewati lain lebih lanjut dan saya di sebelah kolam renang. Daerah yang sangat tenang dengan perjalanan panjang dari kuta. Itu bagus untuk mengisi ulang baterai saya ",5
164, PinkCoco Uluwatu - for Cool Adults Only,"Kami di pink coco 3 malam, dan 1 malam adalah sekitar 900 000 rupiah dan itu terlalu banyak untuk sebuah hotel atau kamar seperti itu. Tidak ada tidak ada yang istimewa yang akan berdebat, jadi harga tinggi. Kamarnya ok, tapi usang. Pathroom sangat aneh dan permainan air hujan di dalam kamar. Kamarnya sangat berisik, tidak mudah untuk tidur. Spa-nya oke. Para staf sangat baik. Sarapannya ok.",2
165, PinkCoco Uluwatu - for Cool Adults Only,"Kami punya kamar di lantai dua yang sangat bagus, pemandangan laut dari kamar (sangat luas) balkon dengan pemandangan matahari terbenam yang baik.   Kamar mandi adalah besar bahkan dengan tidak adanya bak mandi. Pancuran air terjun adalah benar-benar menakjubkan, sangat santai dan baik suhu!  Kamarnya sendiri bagus, luas, baik tempat tidur dan karena anda dapat membuka jendela di bagian depan dan belakang terasa lebih luas.  Sarapan bisa memilih dari set, yang cukup terbatas dan harga tidak yang terbaik (dapat dengan mudah mendapatkan lebih baik sarapan di sekitar)   Lokasi sangat bagus untuk padang padang beach, meskipun pantai sangat kecil dan ramai, bagus tempat surfing dan pantai berpasir yang baik!",4
166, PinkCoco Uluwatu - for Cool Adults Only,"Hanya tidak pergi ke mana pun lain, pink coco adalah tempat terbaik di bukit peninsula!  Charmful & design hotel, bagus & santai suasana, lokasi yang baik, layanan besar dan orang-orang luar biasa menjamu anda! Spa adalah mengagumkan. Super kualitas/harga.  Saya bepergian ke bali dua kali, akan ada ketiga kali tahun depan, dan akan ada tidak ada tempat lain di mana saya akan pergi pertama! Rasanya begitu baik di sini, itu adalah saya ""bali home sweet home"".  jadi ragu-ragu, memesan pink coco sekarang!",5
167, PinkCoco Uluwatu - for Cool Adults Only,"Staf di sini indah, terutama daisy yang membantu saya saat saya membuat sebuah inventaris telepon pada kedatangan di bandara, di mana ada tidak ada transportasi sebagai diatur dan di mana garuda telah kehilangan koper saya! Pink coco terbentuk untuk segalanya, dari teh jahe dan dingin handuk muka pada saat kedatangan, yang indah, besar, lantai atas kamar dengan udara con dan sedikit pandang di laut. Kemudian ketika ada masalah dengan udara con gagal. Saya cepat ditawarkan pilihan kamar sementara itu tetap. Menakjubkan makanan di trattoria... the rocket dan pear salad adalah menakjubkan. Mencintai kolam renang, yang tersenyum menyambut dari semua orang setiap hari; sebelum saya meninggalkan bali, saya kembali, sudah memesan lagi.",5
