,hotel,review,stars
85, PinkCoco Uluwatu - for Cool Adults Only,"Kami tinggal di hotel untuk dua malam di PinkCoco November 2016. Ini adalah perhentian terakhir kami dua minggu liburan dan seperti kami memutuskan untuk memanjakan diri kita sendiri dan mengambil ""360 atap"" alias kamar penthouse yang hanya ada satu. Itu tidak mengecewakan. Indah pemandangan laut adalah sensasional dan anda berdiri di atas semua hotel yang menawarkan privasi total. Kamar luas dengan tempat tidur king size, ruang tamu dengan tv kabel, kulkas kecil dan teh dan kopi membuat fasilitas. Kamar mandi adalah yang terbaik yang kita lihat di Bali, bersih, besar dan terbuka.   Kolam renang yang sangat bagus dan memiliki lounge matahari dan payung kedua di di matahari sepanjang hari. Hotel ini terletak 5 menit dari Pedang Pedang terkenal di pantai, banyak restoran dan kafe…",4
86, PinkCoco Uluwatu - for Cool Adults Only,"Tinggal selama 3 malam dan minta maaf untuk meninggalkan. Arsitektur benar-benar berdiri keluar dengan tempat tidur, rak counter dan dibuat dari batu. Kamar mandi adalah hampir sebagai besar sebagai kamar tidur kami di lantai ""Teras Ruang"" dengan sofa yang sejuk di bawah naungan di luar pintu. Staf sangat membantu, mengatur moped di menit dan sangat baik dengan arah. Lokasi sangat ideal juga dalam jarak berjalan kaki dari pantai dan setengah jalan antara Pedang Pedang Bingin, Dreamland dan Pantai Blue Point. Ada restoran Italia yang lezat di sini dan beberapa orang lain dalam jarak berjalan kaki. Pastikan untuk mengunjungi bukit Cafe di ujung jalan untuk makan siang.",5
87, PinkCoco Uluwatu - for Cool Adults Only,"Teman saya dan saya benar-benar menyukai pink coco.   Kolam renang fantastis (ada 3) dengan kolam renang untuk orang dewasa hanya kolam renang yang besar. Kami tidak pernah merasa ramai dan selalu ada tempat untuk bersantai. Lantai dasarnya terjaga dengan indah, dan kamar cukup besar dengan dekorasi yang indah. Kamar mandi yang fantastis, beberapa luar ruangan merasa dan kami sangat menyukai shower gel terbuat dari minyak esensial lokal, begitu banyak sehingga kami ingin membeli! Tempat tidur yang sangat nyaman dan tambahan kecil seperti semprotan serangga, obor, sabun yang indah dan fantastis balkon membuat kami merasa seperti di rumah. Saya akan merekomendasikan tempat ini ke teman-teman dan tinggal di sini lagi. Staf sangat ramah dan ada spa yang sangat bagus dan restoran di…",5
88, PinkCoco Uluwatu - for Cool Adults Only,"Hotel ini benar-benar baik taman dan tidak merasa penuh sesak karena ada beberapa kolam. Kami punya kamar di lantai paling atas dengan pemandangan yang sangat bagus. Apa yang baik adalah bahwa semua kamar memiliki beberapa semi - daerah luar ruangan pribadi dengan kursi yang nyaman untuk bersantai. Kami memiliki masalah dengan toilet (tidak ada air) pada malam kedua, yang tidak bisa memecahkan masalah karena bagian yang rusak di kamar, dan tamu lain kami sudah tertidur. Kami meminta ember sebagai gantinya, yang adalah baik untuk kita. Staf secara umum yang sangat membantu, tetapi dengan sedikit bahasa inggris, yang menyebabkan sedikit kesalahpahaman.  Restoran italia, jadi tidak ada makanan lokal (yang kita akan lebih suka) dan sarapan tidak sangat menarik, tapi ok.  Secara…",4
89, PinkCoco Uluwatu - for Cool Adults Only,"Apa hotel yang indah! Hanya melihat itu sudah luar biasa. Bagi kami itu cukup jelas bahwa kamar sempurna, mandi air panas dan kamar mandi yang indah juga. Kami benar-benar terkejut bahwa makanan yang disajikan di lobi di malam hari, sangat bagus! Sesuatu yang sangat bagus! Hotel ini sangat dekat dengan pantai. Terima kasih banyak Pinkcoco",5
90, PinkCoco Uluwatu - for Cool Adults Only,"PinkCoco adalah hotel yang indah dengan besar, suasana dingin. Ada 3 kolam renang dan 1 italia sushi/restoran di situs ada banyak fasilitas. Staf yang sangat ramah dan membantu.  Top tip: jika anda memesan langsung dengan hotel website anda mendapatkan sarapan termasuk. Berharap kita akan tahu ini.   Lokasi sangat dekat dengan pantai padang padang yang sangat kecil, sangat ramai di pantai. Kami menghabiskan waktu kami di pantai lain di dekatnya, tetapi mereka adalah sekitar 25 menit berjalan kaki. Anda perlu untuk mendapatkan taksi ke/dari pantai blue point uluwatu utama, ini adalah di mana single fin ini - dengan bar populer yang memiliki pihak pada rabu dan minggu malam.  ",4
91, PinkCoco Uluwatu - for Cool Adults Only,"Permata kecil yang besar untuk melarikan diri kegilaan kuta. Lucu kamar, dengan luar ruangan mandi. Hotel ini memiliki fasilitas yang bagus seperti kolam renang dan spa yang sangat bagus. Bukit cafe adalah hanya di ujung jalan, bersama dengan apa yang tidak mungkin. Staf membuat saya merasa selamat datang, aman dan nyaman karena saya bepergian sendiri.   ",4
92, PinkCoco Uluwatu - for Cool Adults Only,Pengalaman menginap yang sempurna! Suami saya dan saya menemukan hotel ini indah di perjalanan penasihat. Tinggal di pantai adalah super santai dengan merasa kelas tinggi. Kamarnya indah dengan pemandangan balkon dan sofa di luar ruangan. Tempat tidur adalah super nyaman juga. Kamar mandi yang sangat bersih dan memiliki segala sesuatu yang eksotis seperti ini cukup terbuka.   Di restoran ini juga luar biasa PinkCoco. Ini adalah harus makan di restoran (dan memiliki terbaik nasi goreng yang saya makan di bali secara keseluruhan).   Saya sangat merekomendasikan tempat ini untuk siapa pun yang ingin tinggal yang santai dan menyenangkan di uluwatu. Staf sangat ramah dan selalu menyambut. PinkCoco sangat pusat segala sesuatu dan hanya berjalan kaki ke pantai penang penang.   Kami…,5
93, PinkCoco Uluwatu - for Cool Adults Only,"Pink coco adalah hotel yang indah - sesuatu yang sangat unik dengan gaya ini. Mengagumkan dan kamar-kamarnya dirancang dengan sangat baik dan luas. Kami mengambil kamar taman bale baru - kami menyukai teras dan kami menyukai kamar mandi besar! Masalah bagi kami karena kami tidak mengerti adalah lokasi. Tidak ada yang bisa dilakukan di sana mudah dijangkau dari hotel, kecuali jika anda memiliki transportasi. Pantai padang padang lokal (yang adalah sekitar 10 menit berjalan kaki di jalan yang berisik tidak menyenangkan) adalah sangat kecil dan dipadati orang. Kekecewaan lain bagi kami adalah restoran di hotel. Sepertinya tempat ini tidak dikelola oleh hotel dan saya menemukan kualitas tidak sama dengan kualitas tinggi hotel. Secara pribadi saya tidak akan kembali hanya karena…",4
94, PinkCoco Uluwatu - for Cool Adults Only,"Kami tinggal selama beberapa malam di awal bulan ini (juli). Kami punya kamar standar yang sangat bagus, tempat tidur nyaman, a/c bekerja dengan baik, internet ok. Kami memiliki makan malam di sushi tempat yang tidak dimiliki oleh hotel ini sangat baik, tapi makanan mengambil selamanya untuk membanting dan. Aku makan pizza di sana, sushi... yah lumayan.  Kolam renang yang sangat bagus untuk memiliki untuk berendam setelah berada di air asin sepanjang hari. Saya akan merekomendasikan tinggal di sini.",5
95, PinkCoco Uluwatu - for Cool Adults Only,Tinggal di sini selama 3 malam sementara berselancar dan menyukainya! Kamar sangat bersih dan nyaman. Staf sangat membantu dengan pertanyaan dan berbaris dengan skuter. Restoran yang sangat baik dan banyak lain makan yang baik dekat oleh.,5
96, PinkCoco Uluwatu - for Cool Adults Only,"Staf terutama Meiki dan ika yang sangat membantu dengan setiap kebutuhan kami. Kami mengubah tanggal pemesanan kami dan mereka sangat akomodatif. Hotel ini memiliki kamar yang bagus dan bersih. Mereka menawarkan payung ketika hujan, handuk ekstra untuk pergi ke pantai, menawarkan untuk membantu dengan taksi, dll. Dan semuanya dilakukan dengan senyum. Kami pasti akan kembali. Terima kasih banyak. Anda adalah tim yang hebat dan hotel yang indah. ",5
97, PinkCoco Uluwatu - for Cool Adults Only,"Akomodasi yang nyaman di lokasi yang baik dengan restoran (sushi dan makanan jepang). sangat bersih dan tenang dengan staf yang ramah dan membantu. Dapat menyewa moped, tetapi tidak membawa papan selancar namun ada banyak tempat lain di daerah untuk melakukan hal ini. ",5
98, PinkCoco Uluwatu - for Cool Adults Only,"Jika anda tinggal di kamar tua, itu biasa. Jika anda tinggal di kamar yang baru, yang bagus. Cara baik, kedua pilihan yang sangat mahal. Anda dapat menemukan pilihan yang lebih baik di daerah untuk harga yang sama.  Kelebihan: spa di brasil - baik lokasi restoran italia yang bagus - lokasi - sangat dekat dengan padang padang - pelayanan yang baik  Kekurangan: - kamar sangat mahal miskin sarapan - terlalu mahal dan tidak baik sama sekali penerimaan tutup pukul 11 pm -",3
99, PinkCoco Uluwatu - for Cool Adults Only,"Kami telah tinggal di 3 PinkCoco dan kembali pada bulan agustus. Tempat yang bagus untuk bersantai, staf yang sangat baik dan kolam renang yang indah dan taman yang terawat. Cukup dekat ke pantai padang-padang, dengan restoran yang bagus di sekitar. Garden view kamar yang sederhana dan nyaman dengan tempat tidur yang besar, dan kamar mandi luar/dalam ruangan yang luas. Jika anda mendapatkan kesempatan pergi dan memiliki pijat di spa di hotel.",5
100, PinkCoco Uluwatu - for Cool Adults Only,"Kami memiliki sedikit kesulitan mencari seperti itu adalah pertama kalinya kami ke uluwatu, dan google maps yang ada di hotel sekitar 400m dari tempat ini yang sebenarnya. Kamar adalah sedikit menunda waktu, namun staf yang sangat membantu.  Secara keseluruhan kamar, sementara cukup mendasar adalah nyaman dan memiliki segala yang kami butuhkan. Titik untuk dicatat adalah tidak ada tv. Penerimaan wifi yang cukup baik, dan bekerja dengan baik di kamar dan di sekitar kolam renang. Hotel ini terletak di tempat yang bagus dan hanya berjalan kaki singkat ke pantai padang padang dan beberapa tempat yang baik untuk makan. Secara keseluruhan, itu adalah tempat yang baik dan harga yang baik.",4
101, PinkCoco Uluwatu - for Cool Adults Only,"Lokasi strategis, 200 meter dari pantai padang padang surfing, hotel ini sedikit jalan kembali dari rumah yang masing-masing memiliki balkon dan kamar mandi. Kolam renang yang dipakai bersama dengan jumlah kecil kamar dan sangat baik melalui taman. Layanan yang baik dan terbaik restoran italia, naik skuter dari keramaian uluwatu.  Sangat dianjurkan untuk pasangan atau kelompok teman-teman! ",5
102, PinkCoco Uluwatu - for Cool Adults Only,"Hotel yang sangat keren. Arsitektur yang indah. Ada sebuah restoran yang akan melayani anda makanan yang lezat. sangat bagus tempat tidur, seprai dan handuk. lokasi yang sangat nyaman. Spa di belakang sangat nyaman dengan harga yang terjangkau. Staf adalah bagus tapi sedikit bingung. Tapi itu saja! Tii... Mungkin mereka bisa meningkatkan layanan rumah tangga. Tapi yang pasti saya merekomendasikan tempat ini... Tidak ada keraguan. hotel yang sangat bagus memang. Mengambil suite di daerah baru atau kamar di kolam renang dengan ac (kamar mandi yang menakjubkan). Saya menginap di semua kamar. Saya percaya! ; - )",5
103, PinkCoco Uluwatu - for Cool Adults Only,"Hotel yang bagus dengan staf yang indah dan layanan yang indah dengan kamar dan tidak untuk menyebutkan kolam renang. Hotel ini memiliki total jenis keaslian bangunan, kamar dan kolam renang terutama menyenangkan. Benar-benar merekomendasikan hotel ini untuk menginap santai yang indah di uluwatu dan bali.",5
104, PinkCoco Uluwatu - for Cool Adults Only,"Benar-benar mencintai tempat ini. Apa-apa untuk mengeluh tentang. Kolam renangnya sangat baik dan bersih. Ada banyak restoran di dekatnya. Kami hanya punya saran untuk pemilik, berikan tamu dengan cara untuk mengisi ulang air minum untuk menghindari banyak sampah plastik.",4
105, PinkCoco Uluwatu - for Cool Adults Only,Aku tidak bisa meninjau hotel sejak kami tinggal di tempat lain tapi di restoran adalah besar. Mereka memiliki salah satu pizza terbaik di asia tenggara. Staf sangat mengagumkan juga. Satu-satunya negatif adalah bahwa mereka tidak memiliki bintang di botol hanya memilisikan yang tidak begitu baik. koktail yang sangat baik juga.,5
106, PinkCoco Uluwatu - for Cool Adults Only,"Menyukai Pinkcoco! Kolam renang besar, indah kamar dan sarapan besar. Anda tidak dapat mengalahkan lokasi baik. Staf adalah sangat ramah dan kita benci untuk meninggalkan. Akan kembali pada apa sisi dan akan kembali. Nilai yang baik dan nyaman. Tiga tahun kami segera mengambil air di kolam renang untuk anak-anak terbaik, tak ternilai!",5
107, PinkCoco Uluwatu - for Cool Adults Only,"Menghabiskan 3 malam di sebuah kamar bagus - indah ruangan besar dan kamar mandi mewah dengan sandal unik berbau sabun mandi dan sampo yang indah!  Manajer dan staf yang ramah, jojo - jadi ramah dan jadi seluruh tinggal kami seluruh tinggal. Itu sangat jelas bahwa mereka mengambil banyak kebanggaan di tempat dan sangat tertarik untuk memastikan bahwa tamu mereka mencintai mereka menginap. Pasti akan merujuk teman-teman untuk tinggal di untuk PinkCoco uluwatu dan juga akan berusaha keras untuk mencoba baru dibuka tahun depan PinkCoco di gili trawangan dan gili air di",5
108, PinkCoco Uluwatu - for Cool Adults Only,"Kami tinggal di sini selama 4 malam sementara ditunda karena abu awan. Aku akan mengatakan bahwa itu bisa menjadi sedikit hit dan miss, tapi pengalaman kami benar-benar mendapat lebih baik lagi kami tinggal di. Resor itu sendiri memiliki merasa benar-benar baik, kami benar-benar menyukai desain tempat ini. Kami tinggal di 3 kamar yang berbeda dan semua sangat luas dan bersih. Kamar yang pertama - ocean view - paling mahal - adalah yang terkecil dan ac tidak bekerja dan itu gila panas karena berada di lantai atas dan memiliki dinding yang menghadap barat. Kami melaporkan hal ini ke resepsionis dan saya dipindahkan ke kamar lain malam berikutnya di mana aman hancur. Kami melaporkan hal ini ke resepsionis yang sama dan tidak ada yang dilakukan.  Hari berikutnya, manajer mengatakan…",4
109, PinkCoco Uluwatu - for Cool Adults Only,"anjing di kamar yang tersisa untuk 2 dengan pemandangan laut dan sangat bahagia untuk terlihat bangunan hotel, staf yang ramah dan, oh dan juga tangan dingin handuk ketika mereka memberikan waktu check-in, jasmine aromaku dari handuk sangat baru-baru ini. Ukuran kamar juga sangat besar dan duduk di luar sangat baik.  kota ini terletak sangat dekat dari pantai padang padang dan bingin beach (: aku mendengar masih begitu banyak pantai yang indah di sekitar sana (: terima kasih banyak pink coco tim",5
110, PinkCoco Uluwatu - for Cool Adults Only,"kami mengharapkan sesuatu yang lain! sangat mahal untuk bali, 50 euro untuk satu malam, kami mendapat lebih baik untuk 10 euro. Tapi kita membayar untuk itu karena itu adalah malam terakhir kami di bali! Hotel tampak bagus, kami berada di sana di musim rendah sehingga tidak tempat yang tenang! Untuk kamar, mereka bersih tetapi sangat sangat gelap, terpaksa tutup mengelepakkan karena kamar terbuka ke ruang tamu! Satu hal lagi, jangan t ke spa, pijat tidak baik. Aku kesakitan. Aku mengatakan itu tapi mereka tidak berbicara bahasa inggris dan ketika saya membuka mata saya, itu bukan orang yang sama! Terkejut! Dan tentang pedikurnya. Aku bertanya memperbahasakan dan mereka membuat saya membayar untuk estetika dan don t ingin mengerti permintaan saya, dia adalah kasar, sementara aku…",3
111, PinkCoco Uluwatu - for Cool Adults Only,"Kami benar-benar menyukai Pinkcoco, anda berada dekat dengan restoran di dekatnya dan terakhir adalah tepat di hotel ini (terakhir tapi kita benar-benar menikmatinya) dan pantai ini juga berjalan kaki singkat ke jalan. Kami menyewa skuter dari lokasi di sekitar dan dijelajahi di uluwatu, selama sarapan baik ziarah ke kuil, yang benar-benar keren untuk melihat, anda juga dapat dijangkau dengan singkat dengan skuter naik dari pantai lainnya dan klub pantai. Kami punya kamar besar, luas, bersih dan menyenangkan, kami benar-benar menyukai hotel ini dan kami akan menginap di sini lagi.",5
112, PinkCoco Uluwatu - for Cool Adults Only,"Saya telah memesan hanya satu malam di pink coco sebagai liburan kejutan untuk suami saya ulang tahun selama kami tinggal di bali. Menit-menit terakhir pemesanan diterima dan telah sangat baik ditampung oleh staf hotel dan telah kami bahkan ditingkatkan! Tempat ini indah dan itu adalah lokasi yang sempurna untuk berselanca pecinta. Ada banyak pilihan tempat makan di sekitar, termasuk restoran di-lokasi, runned oleh terakhir. Tambahan perhatian ke kamar ' pembersihan tidak akan ide yang buruk.",4
113, PinkCoco Uluwatu - for Cool Adults Only,"Kami tinggal di penthouse, layanan sempurna dan lokasi dengan sangat bersih dan kamar dengan tv, wifi gratis dan tempat tidur yang nyaman. Kami menyukai keterbukaan dari ruangan ini yang memungkinkan banyak udara ganda memesan, jadi kita tidak perlu menggunakan ac dan lokasi yang sempurna seperti itu dekat dengan restoran yang baik snd pantai. Staf resepsionis sangat membantu dan kami merasa sangat menyambut dan tampak setelah. Wifi gratis di penthouse tidak ada koneksi yang stabil.",5
114, PinkCoco Uluwatu - for Cool Adults Only,"Kami benar-benar menyukai kamar kami, 3 langkah untuk kolam renang, tenang dan luas. lokasi sangat bagus dan staf yang sangat ramah. Internet tidak bekerja di kamar kami. Kami tidak punya sarapan di sana tapi ini makan malam di restoran italia, diusahakan tidak bernilai uang... Pasti akan merekomendasikan tinggal di sini karena itu mudah berjalan kaki ke restoran yang indah dan pantai padang padang! ",5
115, PinkCoco Uluwatu - for Cool Adults Only,"saya sangat suka di sini, kamarnya besar dengan tempat tidur yang sangat besar dikelilingi oleh kelambu sebenarnya cukup romantis. Kamar mandi adalah benar-benar bagus dan besar juga, kami juga memiliki balkon besar daerah luar ruangan yang indah. Hotel ini sangat besar, seperti juga dirancang hotel, tema adalah menakjubkan, anda merasa seperti anda berada di surga tropis villa. Staf adalah luar biasa, sangat indah dan sangat sangat membantu!  hotel ini memiliki wifi yang bagus juga! ",5
116, PinkCoco Uluwatu - for Cool Adults Only,"Hotel Pinkcoco terletak dekat padang padang pantai (5mins berjalan). Staf menakjubkan, semuanya tidak masalah. Hotel mengatur transportasi ke pura uluwatu dengan harga bagus di sana. Ada dua terbuka 24h pasar dekat hotel. Juga ada beberapa bar dan restoran. Kamar itu indah, dengan pancuran seperti air terjun. Ranjang memiliki jaring serangga. Sempurna menginap di sana.",5
117, PinkCoco Uluwatu - for Cool Adults Only,"Bali adalah PinkCoco anda menginap, nilai yang besar untuk apa yang anda dapatkan. Kamar luas dan nyaman, tempat tidur yang besar! Kamar-kamar ber-ac dengan tempat tidur cukup seperti itu benar-benar panas/lembab dan beberapa nyamuk di kota tapi itu terjadi saat anda berada di pulau.  Dua kolam renang yang sangat bagus, tepat di ambang pintu, sempurna jika anda ingin bersantai. Berjalan kaki singkat ke pantai padang padang. Restoran adalah terlalu besar. Staf membantu kami menyewa motor, jika mereka memberitahu anda bahwa anda baik-baik saja tanpa mengenakan helm, tidak mendengarkan mereka, baik ini! Kami telah ditangkap karena kami tidak punya helm rebewes dan, meskipun kami hanya ingin uang benar-benar...",4
118, PinkCoco Uluwatu - for Cool Adults Only,"Anda tidak dapat menyebut ini menjiijikkan den hotel. Orang yang lembab, bau, tidak berkabut, ya hell-hole. Ada alasan mengapa mereka membuat anda membayar untuk kamar anda di sini. sangat indah! Ini adalah backpackers dalam penyamaran, dan anda dapat hampir tidak menyebutnya begitu.  Tidak ada yang baik untuk mengatakan tentang tempat ini.  Kamar mandi telah dinding/jendela yang tidak menuju ke sebuah gang garden, dan membiarkan semua nyamuk di... parahnya, pintu di dindingnya, sehingga nyamuk hanya terbang melalui ke kamar anda untuk menghancurkan semua harapan saya tidur. Staf tidak ingin berurusan dengan anda, dan benar-benar diabaikan dan berjalan pergi ketika kita meminta mereka untuk memanggil taksi. Tempat tidur itu indah, dan tidak ada ruang duduk (hanya raksasa…",1
119, PinkCoco Uluwatu - for Cool Adults Only,"Tinggal di sini dengan pacar saya pada september 2015 untuk beberapa malam. Hotel pilihan di dekat uluwatu agak terbatas, setelah mencari di sekitar sedikit area, kita tersandung pada pink coco.  Ini adalah nilai yang besar untuk lokasi cukup. Sebagai surfer, lokasi ini sempurna. Anda dapat berjalan kaki ke padang atau turun untuk apa yang tidak mungkin. Jika anda memiliki penghargaan ini adalah 2 menit berkendara atau 5 menit ke bingin ke uluwatu. Juga terdapat banyak pilihan makanan dalam jarak berjalan kaki dan toko kecil juga. Kolam renang adalah benar-benar baik dan tempat yang bagus untuk bersantai setelah hari yang panjang. Restoran italia kecil di hotel ini benar-benar mengagumkan, sangat merekomendasikan hotel ini. Kami makan di sana beberapa kali dan menyukainya. …",5
120, PinkCoco Uluwatu - for Cool Adults Only,"Setelah menginap di beberapa hotel dengan 100 + kamar merantaikan di mana anda diperlakukan seperti ternak, itu adalah seperti lega untuk tinggal di ramah, kamar 20, hotel bergaya vila keyek PinkCoco. Tempat ini adalah begitu sejuk. Kamar termasuk kamar mandi yang besar dan bergaya spanyol yang hangat. Tamu-tamu lain yang tenang untuk pasangan yang ada untuk bersantai atau berenang di salah satu dari banyak pantai terdekat (pantai padang padang ini dapat diakses melalui sebuah terowongan alam sepanjang tebing - kepiting adalah bahwa). Staf adalah seperti teman-teman anda, terutama manajer jojo yang tahu semua tempat yang tersembunyi dan dapat memberikan anda tips yang baik dalam buku panduan. Tempat terbaik untuk mengisi ulang dari kehidupan malam di kuta.  p: nama PinkCoco…",5
121, PinkCoco Uluwatu - for Cool Adults Only,"Tinggal di sini dengan keluarga saya. Kami mengambil dua kamar. Kami menyukai gaya hotel - baik di dalam dan luar. Staf tidak bisa lebih ramah atau lebih bermanfaat telah. Kolam renangnya juga bagus.   kota ini terletak sangat dekat dengan pantai dan terdapat Pedang Pedang beberapa restoran besar di dekatnya. Saya merekomendasikan mango tree - tepat di sebelahnya.  Di hotel ini juga dengan reastaurant sangat baik - Makanan italia.  Saya dan istri saya tinggal di penthouse selama satu malam (itu hanya tersedia untuk satu malam) dan kami menikmati tempat yang mewah, kamar besar, besar, pemandangan laut dan masakan meksiko.",5
122, PinkCoco Uluwatu - for Cool Adults Only,"Kamar mandi yang besar, lokasi dekat pantai padang padang. Kamar tidur adalah memadai, tapi tidak nyaman seperti tempat-tempat lain kami tinggal untuk kisaran harga yang sama. Tidak ada ac, tapi itu baik-baik saja - kipas angin sudah cukup sebagai kamar tetap sejuk. Jangan pergi ke mango tree TERRUBLE untuk sarapan yang tidak enak! Restoran yang jauh lebih baik untuk Pinkcoco sarapan. Kolam renang tampak bagus dan mereka memiliki film malam, tapi kami tidak memanfaatkan itu.",3
123, PinkCoco Uluwatu - for Cool Adults Only,"Didesain dengan baik, kamar yang bagus, arsitektur yang menarik. Tempat tidur tidak sangat nyaman, 2 double tempat tidur yang mendorong bersama-sama, tetapi usang keluar, meninggalkan kami tinggal sangat baik. Air panas, wifi yang bagus, (puji tuhan) tidak ada toilet bau. Peduli pertengahan rentang hotel, dengan besar pizza di restoran dan lokasi pusat. Staf yang ramah dan profesional, baik pilihan jika anda ingin jenis kenyamanan tingkat barat. Besar koktail tidak tersedia dan tidak dapat biaya minuman ke kamar.",4
124, PinkCoco Uluwatu - for Cool Adults Only,"Ini adalah hotel favorit kami Pinkcoco hotel kita tinggal di selama 18 hari perjalanan kami ke bali! Kolam renangnya sangat fantastis dan indah, kamar mandi besar dengan beberapa kursi malas (salah satu tepat di luar pintu kami dan satu di kamar mandi), dan kamar mandi terbuka dengan lantai batu sebagai konsep untuk hotel ini! Hebat! Staf adalah hebat dan sangat membantu dengan pertanyaan apapun yang kami punya. Tidak ada tv di kamar tetapi mereka memiliki film malam setiap malam di layar besar jika anda benar-benar merasa seperti sesuatu yang besar. Lokasi adalah sempurna-hanya cepat berjalan kaki ke pantai padang padang dan uluwatu yang cepat naik ke sepeda motor. Setiap kali kita melakukan perjalanan kembali ke kawasan pecatu, kami akan pasti akan merekomendasikan hotel ini…",5
125, PinkCoco Uluwatu - for Cool Adults Only,"Hotel bali Jauh dari semua lokasi wisata komersial. 45 min bludas tentang kuta Hotel yang indah dengan staf yang sangat ramah. Tempat yang baik untuk berlatih kuda itu akan aman arlogi vars nyetekin di bukit.  Positif   Kamar besar, kolam renang, penyewaan skuter, restoran. berjalan kaki ke pantai lokal 5min. Dekat dengan temple.   Negatif  Tidak banyak toko di sekitar  Jika anda tidak dapat naik skuter anda harus mendapatkan taksi untuk everwhere. Kadang-kadang staf akan segera jika mengejamkan  IG: evieletyourhairhangdown ",4
126, PinkCoco Uluwatu - for Cool Adults Only,"Telah pendek tinggal (4 - hari) di bali untuk pernikahan yang begitu ingin sesuatu yang mudah dan sambungan. Saya biasanya memilih AirBnb pribadi rumah seperti aku suka privasi, tapi itu benar-benar kecil dengan PinkCoco di taman dan layanan pelanggan. Ada sedikit kesalahan atau alahpahaman ketika saya tiba di hotel ini saya telah memesan, tapi unfortuante karena sudah tengah malam ketika penerbangan saya punya itu dan hanya penjaga keamanan yang selalu siap dengan terbatas inggris. Staf adalah luar biasa pagi berikutnya memilah masalah ini, hal pertama, setelah troliku bergerak untuk saya dan bahkan melemparkan dalam perjalanan saya, dan sangat baik untuk menurunkan buah kamar baru saya. Itu kecil, web, tetapi bagaimana membuat extablishment untuk kesalahan yang selalu berkata…",4
