,hotel,review,stars
0, PinkCoco Uluwatu - for Cool Adults Only,"Berkunjung ke Uluwatu bersama teman-teman lain untuk berselancar, itu sebabnya saya menginginkan tempat yang terjangkau, nyaman, murah, dan ada kolam renangnya! Saya sangat terkejut saat pertama kali sampai di hotel ini. Tidak seperti resor pada umumnya di Bali, lebih menyerupai vila Spanyol yang nyentrik. Ada banyak tanaman, sangat bersih, restorannya bagus, dan hanya 3 menit berjalan kaki ke Pantai Padang Padang! Kami ditanya apakah kami ingin menaikkan kamar ke level penthouse dengan menambah $10 per malam, kenapa tidak! Naik ke kelas penthouse, kami takjub dengan pemandangan 360 derajat di apartemen mini yang kami huni! Dengan pemandangan yang terlalu indah ditinggalkan, kami menanyakan kepada restoran apakan mereka bisa mengirim makan malam kami ke kamar dan mereka bilang…",5
1, PinkCoco Uluwatu - for Cool Adults Only,"Kami sampai di Pink Coco tanpa indikasi apapun dan memesan Pink Coco setelah mengevaluasinya lewat Trip Advisor. TEMPAT INI LUAR BIASA, sesuai dengan kebutuhan kami. Kami memesan kamar untuk 17 malam dan rasanya luar biasa. Orang-orangnya baik, restoran di depan luar biasa, pantai indah, semuanya seperti sulap! Kami menyukainya. Kalau kami kembali lagi, kami pasti menginap di sana.",5
2, PinkCoco Uluwatu - for Cool Adults Only,"Tempat ini sempurna, terutama jika Anda ingin menghindari kawasan semrawut di Kuta. Areanya sangat pedesaan, tidak banyak hotel/resor tersebar di Pantai Padang-Padang yang menyenangkan.  Area kolamnya bagus, banyak tempat duduk untuk berjemur, dan mereka juga punya koneksi WiFi yang baik. Kamarnya sangat bagus dan luas (yang mengecewakan hanya saat kami terbangun akibat sepasang wisatawan Belanda di kamar sebelah bercinta dengan suara keras dan bisa terdengar samai ke Holland!)  Nilai jualnya adalah barnya yang indah/area restoran dengan tempat duduk besar dan makanan enak. Stafnya ramah dan membantu.",4
3, PinkCoco Uluwatu - for Cool Adults Only,"Kami berjalan di sepanjang jalan, mulai dari pulau Bali saat kami tiba di Pink Coco dan kami sangat bersyukur bisa melihat bangunan yang berwarna pink yang di bangun sepanjang jalan yang berdebu! Pada saat kami tiba, gerombolan peselancar terlihat melewati penerima tamu lengkap dengan papan selancarnya. Penerima tamunya cukup baik dan memproses pesanan kamar kami dengan cepat dan ada seorang pria yang cukup kecil membawa koper kami melintasi jalanan dari batu yang mana itu sangat membantu kami! kami memesan kamar dengan fasilitas kipas angin namun memilih untuk mengganti kamar yang lebih baik pada keesokan harinya karena terlalu panas dan daerah kamar mandi yang terbuka menjadi jalan masuk bagi nyamuk. Lokasinya cukup bagus untuk Pantai Panang Panang dan kamu akan memerlukan…",5
4, PinkCoco Uluwatu - for Cool Adults Only,"Tempat ini adalah tempat yang kuharapkan dari hotel nomor satu. Saya dan istri saya menginap di kamar yang sangat bagus selama 4 malam. Saya pikir kami akan baik-baik saja dengan kamar tipe apapun. Pancuran air terjunnya menakjubkan! Pemandangannya yang indah dan staf yang membantu. Mereka punya skuter untuk disewa seharga $7US per hari.  Hanya memastikan jika semuanya berjalan baik, tanda pengukur bensin kami tidak berfungsi dan kami kehabisan bensin di dekat area Dreamland. Lokasinya bagus, hanya berjalan menuju Padang-Padang, dan dekat dengan naik mobil menuju Dreamland dan Candi Uluwatu. Dekat dengan restoran yang menyajikan makanan lezat, saya dan isteri saya menyukai  Buddha Soul. Air kolam renang bertemperatur pas dan menyegarkan. Dipastikan saya akan menginap di sini…",5
5, PinkCoco Uluwatu - for Cool Adults Only,"Anda dapat melihat mengapa ini memiliki skor ulasan yang tinggi ketika Anda mengalami masa menginap di pink coco! Saya mencari banyak hotel di sekitar daerah dan akan memesan beberapa yang lebih mahal tetapi terus kembali ke coco merah muda. Saya senang saya melakukannya. Arsitek telah melakukan pekerjaan yang sangat baik, seluruh tempat seperti Santorini hanya dicat merah muda, bukan putih. Setibanya portir membantu dengan tas saya dan saya diberi minuman lemon yang lezat, handuk yang menyegarkan dan air mawar untuk disemprotkan ke wajah saya. Sentuhan yang bagus. Kemudian gelang untuk diskon di spa. Tinggal di kamar 15 kamar dengan pemandangan kolam renang. Anda dapat duduk di teras dengan kipas angin luar ruangan dan sofa. Ada tiga kolam renang, dua yang melingkar di pintu…",5
6, PinkCoco Uluwatu - for Cool Adults Only,Hotel yang sangat bagus - staf yang sangat bagus - kamar yang indah - sangat dekat dengan pantai dan restoran! Saya akan merekomendasikannya? Gaya Meksiko / Spanyol dan saya sangat suka warna dan desain kamar,5
7, PinkCoco Uluwatu - for Cool Adults Only,"Kami tinggal di PinkCoco selama 2 malam. Kamar bersih dan dengan alasan selalu dijaga tetap bersih, dengan pemeliharaan mengurus hal-hal setiap hari. Kami menyukai bahwa ada tabir surya, pilihan majalah (meskipun tidak ada dalam bahasa Inggris!) Dan air tersedia di samping setiap kolam. Tempat tidur siang di sekitar halaman adalah sentuhan yang bagus jika Anda ingin meringkuk & membaca buku atau menikmati sinar matahari terakhir di malam hari. Ketika kami tiba kami diberitahu akan ada musik live keras dari tempat sebelah, ini terjadi 3 kali seminggu, kami pergi dan menonton, memiliki beberapa minuman & suami saya mengobrol dengan drummer (nice guy!), Sementara kami bisa mendengarnya dari kamar kami itu tidak utama. Satu-satunya perbaikan adalah kamar mandi, ada bau yang tidak…",4
8, PinkCoco Uluwatu - for Cool Adults Only,"Kami tinggal di Pinkcoco selama 6 hari terakhir bulan madu kami. Hotel ini sangat cantik dan kamarnya sempurna. Area kolam indah dan sangat bersih. Mereka benar-benar memikirkan setiap detail kecil. Ada beberapa restoran / kafe yang indah di dekatnya tetapi jika Anda ingin pergi lebih jauh staf lebih dari senang untuk mengatur transportasi. Restoran Italia di hotel sangat bagus, kami makan siang di sini hampir setiap hari! Ini juga tempat para tamu hotel sarapan tetapi kami tidak pernah sarapan di sini, kami memilih untuk pergi ke salah satu kafe lokal. Tapi itu semua terlihat sangat bagus! Pantai Padang Padang berjarak 5 - 10 menit berjalan kaki dan kami menghabiskan sebagian besar malam di pantai menyaksikan matahari terbenam. Staf sangat penuh perhatian, selalu memeriksa Anda…",5
9, PinkCoco Uluwatu - for Cool Adults Only,"Kami menghabiskan 3 - malam di Pink Coco Resort di Uluwatu, Bali.  Resor ini memiliki semua yang diperlukan dan mempertahankan getaran dingin di Uluwatu. Staf sangat penuh perhatian & ramah dengan segala kebutuhan & lokasi hotel adalah pusat. Kami berada dalam jarak berjalan kaki singkat dari Pantai Padang Padang & perbelanjaan terdekat dengan banyak restoran. Selanjutnya - pintu memiliki musik live beberapa malam juga. Resor ini sangat bersih dan terawat dengan baik & spa sangat bagus (kami pergi 2 kali)! Kami memang membutuhkan sopir untuk menjelajahi wilayah selatan Bali karena banyak bagian ini tersebar seperti Teluk Jimbaran, Pura Uluwatu, GWK, kelas Yoga, pantai lain, tempat lokal & klub harian, yang kami lewati dari perjalanan ini (Omnia, Pantai Minggu, 180 atap). Jika…",5
10, PinkCoco Uluwatu - for Cool Adults Only,"Tinggal di Pinkcoco selama tiga malam setelah penerbangan panjang kami. Merupakan tempat yang indah untuk beristirahat dan memulihkan diri. Hotel ini indah dengan 3 kolam renang, kamar bergaya, dan staf yang ramah.  Lokasi sangat bagus dengan pantai Padang Padang yang hanya berjarak 5 menit berjalan kaki yang sangat indah tetapi tidak bagus untuk berenang. Juga sangat mudah untuk mendapatkan taksi ke Pura Uluwatu atau salah satu pantai terdekat lainnya dan staf hotel dapat memesan taksi dan menambahkannya ke tagihan Anda.  Benar-benar menikmati masa menginap kami dan pasti akan merekomendasikan!",5
11, PinkCoco Uluwatu - for Cool Adults Only,"PinkCoco membuat pengalaman Bali saya! Lokasi itu sempurna hanya 10 menit berjalan kaki dari dermaga di Gili Air. Untuk seluruh waktu kami di sana, staf kami sangat ramah dan membantu dan tidak bisa melakukan cukup bagi kami. Pramutamu beroperasi melalui Whatsapp dan selalu siap untuk apa pun yang Anda butuhkan. Kamar-kamar dibersihkan dua kali sehari dan dilengkapi dengan sentuhan untuk membuat masa menginap Anda sangat nyaman seperti soket pengisi daya Inggris dan air mineral segar berdasarkan permintaan. Bagian terbaik dari ruangan bagi saya adalah pancuran air terjun yang datang dengan campuran sampo PinkCoco dan pembersih tubuh yang mencakup minyak esensial dan membuat kulit Anda terasa seperti satu juta dolar! ! Saya ingin meminta bahan-bahannya tetapi saya memutuskan…",5
12, PinkCoco Uluwatu - for Cool Adults Only,"Tempat indah, orang-orang cantik.  Tinggal selama ulang tahun ke-30 saya dan mereka upgrade kami (ke kamar 30!!!) Dan menghiasi kamar untuk kedatangan kami. Sangat romantis.  Sangat suka bahwa mereka memiliki nomor WhatsApp untuk pertanyaan atau masalah - mereka sangat membantu dengan saran tentang ke mana harus pergi. Benar-benar; mereka tidak bisa berbuat cukup untuk membuat Anda merasa diterima.  Kami tinggal untuk Nyepi jadi jelas tidak bisa meninggalkan hotel; baik-baik saja dengan kami karena hotel itu indah dan tenang dan dibuang dengan hujan! Sangat santai.  Hotel tidak memiliki restoran tetapi ada satu di tempat yang bagus. Staf restoran agak lambat, memberkati mereka, tapi makanannya oke. Ada banyak tempat di daerah ini untuk makan jika Anda suka sesuatu yang berbeda;…",4
13, PinkCoco Uluwatu - for Cool Adults Only,"Tempat ini adalah apa yang kami inginkan. . . dekat dengan pantai, kamar sangat bagus, sangat bersih & nyaman. Staf sangat baik dan tidak ada banyak masalah. Restoran di sebelahnya sempurna bagi kami, tetapi ada juga di ujung jalan yang kami punya beberapa makanan yang fantastis di. . . sarapan yang luar biasa. Saya pasti akan merekomendasikan tempat ini.",5
14, PinkCoco Uluwatu - for Cool Adults Only,"Kami benar-benar menyukai kami menginap di PinkCoco. Kamar-kamarnya berukuran besar, dengan tempat tidur besar. Mandi yang indah sejauh ini merupakan bagian terbesar dari ruangan, dan kolam renang serta area berbagi yang indah.  Sentuhan-sentuhan kecil benar-benar membuat kami tinggal - air kelapa segar pada saat kedatangan, gelang selamat datang dan layanan menolak di malam hari. Setiap malam, seseorang datang ke kamar, untuk melepaskan kanopi jaring besar di atas tempat tidur dan menyalakan lilin anti nyamuk.  Restoran terlampir (meskipun bukan bagian dari hotel) adalah lezat dan sangat terjangkau.  Kami akan kembali ?  Maddie & Maddie ??",5
15, PinkCoco Uluwatu - for Cool Adults Only,"PinkCoco benar-benar di atas standar, staf yang cantik dari tukang kebun Zulu untuk memesan kembali Tini. Sarapannya lezat dengan 5 pilihan. Seperti yang Anda punya 2 kolam dan tempat untuk membuat yoga, membaca tempat di mana-mana. Akan kembali.",5
16, PinkCoco Uluwatu - for Cool Adults Only,"Hotel yang bagus dan akan 100% menginap lagi. Anakku dan aku memesan kamar taman, tetapi ditingkatkan ke kanan di sebelah kolam renang anak-anak, yang sempurna karena hampir tidak ada anak di resor dan memiliki kolam renang untuk diri kita sendiri sepanjang waktu! Mencintai tempat tidur siang hari dan pancuran air terjun outdoor, dan layanan merapikan tempat tidur pada malam hari adalah tambahan. Restoran Italia juga memiliki makanan yang luar biasa. Kami tidak mencobanya untuk sarapan alih-alih berjalan kaki 6 menit menuruni bukit ke Bukit cafe yang memiliki makanan segar yang indah dan penawaran kafe gaya barat yang lezat. Tidak banyak yang bisa dilakukan di Uluwatu jika Anda tidak berselancar, jadi kami menghabiskan banyak waktu bersantai di tepi kolam renang dan menyukainya.",5
17, PinkCoco Uluwatu - for Cool Adults Only,"Kami menginap untuk kedua kalinya di Ayo, Pinkcoco untuk 5 malam dan itu seperti yang sempurna seperti pertama kali! Staf yang menyenangkan, kamar yang luar biasa, dan fasilitas yang memukau. Sangat dekat ke pantai Padang Padang dan tempat makan, sebuah oasis, dan hanya membuat santai jadi mudah. Terima kasih untuk tim khusus yang super di sana, kami tidak sabar untuk kembali lagi segera setelah kami dapat! ! ! ! !",5
18, PinkCoco Uluwatu - for Cool Adults Only,"Kami datang kembali ke sini setiap tahun lagi. Kamarnya besar, bersih, dan memiliki gaya yang sangat bagus. Anda memiliki dua kolam renang untuk hang out setelah hari yang luar biasa untuk berselancar. Padang - Padang dan beberapa tempat-tempat untuk berselancar, cukup berjalan kaki. Juga cocok untuk keluarga dengan anak-anak. Hotel ini membuat saya dan Jericho seluruh kru membuat liburan anda dengan mudah. Terima kasih untuk tini, Daysi Zulu, Putu, dan staf. Kalian hebat. Melihat anda lagi tahun depan : - )",5
19, PinkCoco Uluwatu - for Cool Adults Only,"Terima kasih khusus ke tangan untuk menarik saya beruntung sebagai pemenang dan kipas pink terima kasih khusus untuk memiliki saya sebagai Ayo, Pinkcoco tamu berulang-ulang, dan selalu membuat liburan saya yang istimewa. Saya pasti akan datang lagi dan saya pasti akan menginap pink kipas angin!  Untuk saya menginap di selalu dimiliki Ayo, Pinkcoco perjalanan saya ke Indonesia. Saya benar-benar menyukai tempat ini karena ini tempat yang sempurna untuk bersantai dan menikmati Bali ciri khasnya! Seluruh paket yang sempurna - staf yang baik dan indah, kamar yang luas dan area kolam renang! bersantai mutlak  Saya benar-benar kewalahan memenangkan menarik sebagai pink kipas angin! Terima kasih kepada seluruh tim Ayo, Pinkcoco!",5
20, PinkCoco Uluwatu - for Cool Adults Only,"Kami menginap di Pink Coco dengan pasangan lain dan benar-benar menikmati tinggal di sini! Kamar sangat bagus dan dibersihkan setiap hari. Kebanyakan malam kami mengambil keuntungan dari menyaksikan matahari terbenam dari balkon kami! Dekat dengan restoran-restoran yang bagus, spa Airports dan Pedang Pedang pantai. Menikmati bersantai di kolam renang untuk orang dewasa. Kami akan menginap di sini lagi dan merekomendasikan hotel ini ke teman-teman dan keluarga kami.",5
21, PinkCoco Uluwatu - for Cool Adults Only,"Lokasi yang bagus dan kamar yang menyenangkan dengan desain modern dan dekorasinya. Kamar mandi luar biasa yang luar biasa tempat tidur ukuran king yang nyaman dan staf yang brilian untuk nilai yang bagus. Untuk Pak sugar besar Zulu, yang setiap hari membuat yakin kamar saya sangat sempurna.",5
22, PinkCoco Uluwatu - for Cool Adults Only,"Kamarnya sangat luas untuk harga yang dibayar, bersih, saya suka setiap potongan-potongan itu. Kamar mandinya juga sangat luas dan bersih. Terasa seperti di sebuah resor. mini Berjalan kaki ke Padang - Pantai Padang. Staf sangat ramah dan memberikan pelayanan yang baik untuk tamu. Saya tidak akan ragu untuk menginap di sini lagi di masa mendatang jika saya datang ke Bali lagi, dan orang-orang yang berencana untuk menginap di Uluwatu, Harus memesan hotel ini setidaknya sekali. Tepuk tangan!!",5
23, PinkCoco Uluwatu - for Cool Adults Only,"Hotel ini yang terletak hanya beberapa menit dari Pantai Padang Padang yang terkenal, sangat luar biasa. Ini adalah tempat yang sempurna untuk menikmati liburan yang santai di surga.  Pink Coco menyediakan lebih dari yang diharapkan dan akan selalu menjadi tempat favorit saya di pulau ini.",5
24, PinkCoco Uluwatu - for Cool Adults Only,"Saya sangat senang! Semuanya bagus! Kami memiliki cuaca yang bagus, orang-orang yang sangat baik, pelayanannya magnific!  Tentu saja cara terbaik untuk menghabiskan liburan yang baik dengan keluarga dan teman-teman! !",5
25, PinkCoco Uluwatu - for Cool Adults Only,"Kami menginap di sini selama 3 malam saat saya di Bali untuk bekerja. Saya tidak menghabiskan banyak waktu di dalam kamar bekerja tapi apa yang saya lakukan adalah pengalaman hebat. Stafnya sangat ramah dan bersedia untuk membantu dengan apa pun. Saya tiba setelah 3 jam berkendara dan mereka benar-benar baik, bersihnya untuk menawarkan minuman dan air haha ada sebuah restoran Italia yang terpasang dan walaupun bukan bagian dari hotel sehingga harus membayar di akhir setiap makanan. Harganya cukup terjangkau dan makanan yang enak.  Kami diberikan kamar terburuk yang mungkin mereka karena terletak di sudut sebuah halaman sehingga sangat suram tapi itu masih benar-benar baik. Ada 2 kolam renang, 1 yang hanya orang dewasa dan selalu benar-benar damai, suami saya menghabiskan…",5
26, PinkCoco Uluwatu - for Cool Adults Only,"Terletak di Bukit Peninsula tempat ini sangat bersih, staf yang luar biasa dan mereka bangga dengan fasilitas. Saya menemukan dari wanita yang memiliki dapat bersantai Warung di sebelah yang hanya spot Ayo, Pinkcoco di kota ini selama bertahun-tahun. Masyarakat yang tumbuh di sekitar dan yang cocok dengan Ayo, Pinkcoco tempat juga stafnya akan berusaha untuk membuat anda merasa seperti di rumah sendiri. Kami benar-benar menghargai kebaikan mereka, dan kesediaan untuk asli membantu kami dengan segala sesuatu yang kita butuhkan. Hanya dengan berjalan kaki singkat ke Padang Padang dan sehat 1 . 5 mil trek ke Uluwatu. Saya melakukannya setiap pagi dengan board di tangan, usia 47 tak perlu dikatakan saya menghangat untuk berselancar saya ketika saya tiba. Mereka juga tidak tahu kami…",5
27, PinkCoco Uluwatu - for Cool Adults Only,"Saya sangat menyukai tempat ini. Saya di sana hanya untuk 3 malam, tapi saya berharap itu lagi. Ayo, Pinkcoco benar-benar dapat menangkap esensi dari Uluwatu, dengan sentuhan kemewahan. Ada beberapa hotel bintang 5 resor di dekatnya, jika itu yang anda suka. Tetapi saya lebih suka tempat yang banyak memungkinkan anda merasakan suasana unik dari lokasi, tanpa harus mengorbankan kenyamanan makhluk :)",5
28, PinkCoco Uluwatu - for Cool Adults Only,"Saya menginap di salah satu kamar deluxe, yang memiliki teras tempat tidur yang besar dan nyaman, kamar mandi yang luas dengan banyak tanaman dan banyak tempat penyimpanan untuk menaruh semua ekstra dan bobs bit saya. Ada juga kulkas, brankas keyless modern, AC, kipas angin, obor untuk berkeliling di luar di malam hari dan paket krim berdasarkan pengusir serangga. Kamarnya bersih. Dua kolam renang yang terawat dengan baik. Saya dilayani dengan baik oleh Daisy dan Teenie yang sangat ramah dan mampu menjawab pertanyaan saya tentang daerah makanan dan pantai. Mereka selalu menyambut saya dengan nama setiap kali mereka melihat saya, yang merupakan sentuhan pribadi yang indah. Terima kasih kepada mereka untuk saya kehangatan dan keramahan! Saya mendapat sambutan yang menyenangkan di…",5
29, PinkCoco Uluwatu - for Cool Adults Only,"Ini adalah ketiga kalinya dalam 7 tahun terakhir ini, saya sudah pernah menginap di Pink Coco dan akan terus datang kembali! Saya pernah menginap di sana solo dan juga withmy istri dan anak-anak. Hotel dan staf yang luar biasa, fasilitas restoran pasta dan pizza yang lezat, dan kamar/lantainya unik, rapi, dan sangat damai. Banyak pilihan restoran lain yang bisa dicapai dengan berjalan kaki. Sangat bagus dan pantai hanya di ujung jalan, dan banyak tempat berselancar terbaik di dunia hanya beberapa menit. Beberapa hari di sana dan saya merasa keseimbangan dipulihkan dalam hidup saya. Tidak sabar untuk kembali lagi segera!",5
30, PinkCoco Uluwatu - for Cool Adults Only,"Saya dan teman saya menginap selama dua malam. Kami berada di kamar di lantai atas, saya sangat menyukai kamar dan ac. Setelah bepergian itu adalah tempat yang indah untuk kita. Istirahat Santai Restoran ini mungkin lebih mahal dari yang kami harapkan, tapi biaya layanan meja. Secara keseluruhan saya pasti akan membawa keluarga atau teman-teman saya kembali untuk dikunjungi. Nilai yang bagus untuk uang.",4
31, PinkCoco Uluwatu - for Cool Adults Only,"Segala sesuatu tentang hotel ini adalah tempat yang sempurna. Pertama-tama staf benar-benar luar biasa, sangat membantu dan tidak ada yang terlalu banyak kesulitan, mereka benar-benar membuat hotel ini sesuatu yang lain. Hotel itu sendiri adalah benar-benar bagus, sangat bersih dan dua area kolam renang sangat bagus, banyak ruang untuk lounge di sekitar dan cukup besar untuk sedikit berenang. Kamar kami sangat bagus, bersih, luas dan tempat tidurnya nyaman. Kamar mandinya juga besar dan pancuran yang indah. Pasti akan datang kembali. Restoran yang ada di hotel ini tidak dikelola oleh jadi saya tidak memiliki Ayo, Pinkcoco tercermin restoran di saya memiliki rating yang diberikan sebagai restoran makanan sangat biasa dan terlalu mahal untuk apa yang pasti, tapi ada banyak…",5
32, PinkCoco Uluwatu - for Cool Adults Only,"Saya tidak pernah menulis review sebelum tetapi tempat ini benar-benar membuat kesan pada kami. Kami memesan kamar untuk 3 malam tapi tidak menyadari betapa jauh kamar kami jauh dari kolam renang. Kami pikir kami telah memesan sebuah kamar di pinggir kolam renang kesalahan kami.  Dalam menjelaskan situasi untuk staf yang luar biasa terutama dua gadis resepsionis ( batu permata yang mutlak) , benar-benar mereka melakukan semua yang mereka bisa untuk mendapatkan kamar kami yang kami inginkan karena hotel ini benar-benar penuh dan cukup yakin mereka berhasil untuk bekerja di sana magic. Tidak ada banyak masalah suasana dan ketenangan tempat ini hanya di surga. 3 kolam renang dan hanya hal-hal kecil seperti menyediakan air dingin di kolam renang benar-benar membuat tempat ini…",5
33, PinkCoco Uluwatu - for Cool Adults Only,"Ini adalah tempat yang paling nyaman kami menginap di bulan perjalanan panjang kami ke Bali. Kami sangat menyukai bahwa kami berubah rencana kami di sekitar untuk bisa menginap lebih lama. Kami pasti akan menginap di sini lagi lain kali kami kunjungi. Lokasinya sempurna untuk makanan yang baik dan bagus berselancar. Kamarnya bersih, nyaman, dan privat. Sepertinya benar-benar nilai yang baik. Bukan yang termurah, tapi tidak terlalu mahal akomodasi dan layak untuk setiap Rupiah. Staf adalah yang terbaik! Mereka sangat ramah dan membantu dan benar-benar terlihat tulus untuk membuat kunjungan kami istimewa.",5
34, PinkCoco Uluwatu - for Cool Adults Only,"Ayo, Pinkcoco adalah tempat yang ajaib di surga kecil. Kami menginap selama 3 malam di sini dan dapat dengan mudah diperpanjang. Diposisikan dengan sempurna, jauh dari jalan utama dan di samping semua pantai populer dan restoran/bar. Kami mendapatkan kamar 19, tepat di sebelah salah satu kolam renang, kamar mandi luar ruangan yang indah yang terpasang, mereka memiliki sampai mereka foto tidak benar-benar melakukannya keadilan. Kami menyewa skuter yang hotel diatur, proses yang mulus. Secara keseluruhan tempat ini sangat. Sangat direkomendasikan.",5
35, PinkCoco Uluwatu - for Cool Adults Only,"Terawat dengan baik kamar yang luas dengan fasilitas kamar mandi yang layak. Staf yang sangat membantu dan sopan, dan kolam renang yang indah. Secara keseluruhan itu adalah sebuah hotel yang indah.   Ketika memesan hotel melalui kegiatan ini adalah layak memiliki di pikiran bahwa mereka mencoba untuk mendapatkan banyak uang dari Anda mungkin (yang tidak). Resepsionis juga bisa meminjam adaptor yang kecil dengan deposit.   Lokasi adalah rata-rata dan anda harus gunakan taksi untuk menjelajahi. Hotel ini terletak dekat dengan jalan yang ramai tapi di sisi positifnya Anda berada dalam jarak berjalan kaki ke pantai. Makanan bijaksana ada banyak restoran di daerah dengan berbagai macam pilihan.   Saya akan tinggal di hotel lagi jika saya pergi ke suatu tempat untuk bersantai, namun…",4
36, PinkCoco Uluwatu - for Cool Adults Only,"Tempat yang sangat bagus untuk beberapa hari dan kami benar-benar menikmati kami tinggal. Saya sangat menikmati kenyataan bahwa mereka mengadakan kontes fotografi, yang selain sangat indah dan itu sangat menyenangkan. Saya pasti akan merencanakan perjalanan gadis lain tahun depan!",5
37, PinkCoco Uluwatu - for Cool Adults Only,Kami memiliki yang indah beberapa hari di pink Coco. Staf sangat ramah dan selalu membantu. Fasilitas hotel dan kamar sangat bagus.  Kami akan kembali lagi. Mudah-mudahan di tidak terlalu jauh masa depan.,5
38, PinkCoco Uluwatu - for Cool Adults Only,"Pengalaman menginap yang luar biasa. sangat baik staf yang selalu siap dan sangat ramah. Suasana yang luar biasa. sangat bersih dan sangat baik instalasi. Beberapa hal kecil adalah bahwa tempat parkir di luar tetapi tidak masalah dan hati-hati dengan kolam renang dengan anak-anak, tapi mereka menaruh peringatan pesan dan mereka memiliki kolam renang khusus untuk mereka. Saya merekomendasikan",5
39, PinkCoco Uluwatu - for Cool Adults Only,Kita tidak bisa lebih bahagia dengan pilihan kami dari hotel. Staf adalah luar biasa dan begitu banyak sehingga kami merasa seperti kami tinggal dengan keluarga. Mereka sangat membantu dan akan melakukan apa saja untuk membantu membuat perjalanan kami ke Bali sukses. Lokasinya strategis dengan jarak yang dekat ke pantai dengan banyak restoran dan mini market penukaran uang dan dalam jarak berjalan kaki. Kami sangat merekomendasikan PickCoCo dan berencana akan kembali segera setelah kami dapat.,5
40, PinkCoco Uluwatu - for Cool Adults Only,Kuda di Gili T dan menggantung untuk kopi. Ini adalah tempat duduk di air mendapatkan secangkir kopi dan menikmati pemandangan yang lebih daripada yang mungkin Anda sendiri ok pergi dan tenang. Stafnya baik dan ramah. Pemandangan yang bagus.,4
41, PinkCoco Uluwatu - for Cool Adults Only,"Lokasi yang besar, dekat dengan banyak restoran dan pantai. Skuter ini direkomendasikan untuk mendapatkan sekitar meskipun. Kamar bersih dan sederhana tapi dihias dengan baik dan juga banyak tempat di dalam hotel untuk bersantai di luar. Restoran juga baik (Italia). Tempat tidurnya sangat nyaman. AC - aC bekerja dengan baik, kamar kami juga datang dengan kipas angin di langit-langit. Hal terbaik tentang hotel adalah staf. Terima kasih khusus untuk resepsionis dan jojo Tini dari manajer hotel. Mereka membuat kita merasa sangat nyaman dan kami menikmati kami tinggal sangat jauh.",5
