,hotel,review,stars
42, PinkCoco Uluwatu - for Cool Adults Only,Saya sangat menyukai kamar tapi hotel secara keseluruhan dalam area kecil. Saya sangat menyukai dekorasi di dalam tetapi tidak ada interkom atau whatsapp tidak ada fasilitas layanan kamar. Dan sebagian besar. Saya merasa agak ramai selama saya tinggal mungkin karena terlalu banyak hujan. Tapi staf yang sangat baik dan baik berperilaku.,3
43, PinkCoco Uluwatu - for Cool Adults Only,"Kami tinggal di pink Coco Bali untuk 3 malam dan benar-benar menikmati kami tinggal.   Hotel ini di lokasi yang sempurna, terletak di antara menakjubkan pantai yang terletak dekat dengan restoran/bar dan kuil.   Hotel ini sangat unik dan kamarnya didekorasi dengan baik meskipun tidak ada banyak untuk mereka, hanya dicat beton! Hotel ini masih memiliki tampilan sederhana yang bagus.   Staf sangat membantu dan lebih dari bersedia untuk membantu kami dengan setiap permintaan. Satu-satunya hal yang aku bisa mengeluh tentang adalah harga taksi. Harga taksi hotel mahal jadi kami hanya dipuji taksi yang datang mengantar oleh hotel, kami menemukan ini untuk menjadi jauh lebih murah.   Kolam renang sangat bagus dan bersih yang kami digunakan secara teratur.   Ada juga sebuah spa dan…",5
44, PinkCoco Uluwatu - for Cool Adults Only,Pink Coco adalah tempat terbaik untuk tinggal di Bali. Dekat dengan tempat selancar terbaik di dunia seperti padang - padang atau Uluwatu. Hanya 5 menit juga. Berjalan kaki ke Pantai Padang yang bagus. Staf adalah hanya luar biasa dan sangat sopan. Kamar indah dan sangat bersih.  makanan di restoran adalah luar biasa. Saya datang ke sini setiap tahun sejak 2012.,5
45, PinkCoco Uluwatu - for Cool Adults Only,"Pink Coco adalah salah satu tempat favorit kami untuk tinggal keluar dari 2 minggu kami di Bali. Keramahan yang luar biasa, yang terbaik yang pernah kami alami. Kamar kami telah menakjubkan seni di dinding dan tempat tidur yang sangat nyaman. Tidur terbaik yang kami telah. THR lokasi yang sangat baik, sangat dekat dengan pantai Padang Padang dan single fin. Kami mengatur skuter melalui Pink Coco dan kami memiliki waktu yang besar mengunjungi Uluwatu. Kami akan pasti tinggal di sini lagi ketika kita kembali. ",5
46, PinkCoco Uluwatu - for Cool Adults Only,"Staf sangat membantu, fasilitas yang besar (kamar yang indah dan kolam renang), dan di - situs Web restoran yang lumayan tinggi - kualitas dan harga yang baik. Menyukai detail kecil seperti Hotel arah ke kamar sebelum malam hari dengan penerangan lilin dan menempatkan bunga!",5
47, PinkCoco Uluwatu - for Cool Adults Only,"Ini adalah pasti salah satu tetap terbaik dari perjalanan kami minggu 6! Pink Coco adalah seimbang; mereka melakukan apa yang seharusnya untuk sangat baik (pembicara yang sempurna tinggal dalam suasana santai di lokasi pusat dengan sangat bersih, nyaman dan kamar yang luas di sebuah resor terawat dengan baik). Berpikir tentang setiap detail kecil dan indah dan pro - staf yang tidak ada usaha aktif terlalu banyak! Contoh: Tini dari resepsionis sangat membantu ketika kami tidak bisa membeli tiket secara online, ia melakukan ini untuk memberi waktu privat dan dari rekening bank sendiri untuk memastikan kami di waktu! Tidak ada layanan itu! Sekali lagi terima kasih dan Tini PinkCoco! Kami akan senang untuk kembali lagi di lain waktu!",5
48, PinkCoco Uluwatu - for Cool Adults Only,"Staf yang sangat baik. Kolam renang indah, matahari tempat tidur yang sangat baik. Sarapan sangat baik. Kamar yang sangat dasar tetapi dapat diterima. Hotel tepat di pantai. Bisa menyewa sepeda. Lambat untuk check in. Akan tinggal di sini lagi.",4
49, PinkCoco Uluwatu - for Cool Adults Only,"Saya tidak bisa merekomendasikan hotel ini cukup. Semua fasilitas yang indah, kamar yang luar biasa. Saya juga mendapat gratis upgrade yang saya sangat berterima kasih untuk ini. Jujur. Saya akan merekomendasikan hotel yang indah ini untuk siapa pun, sangat terjangkau juga. Staf pergi keluar dari jalan mereka untuk mengakomodasi semua kebutuhan. Saya ingin kembali! Hanya komentar adalah bahwa saya berharap bahwa restoran sebelah memiliki banyak pilihan makanan Indonesia.",5
50, PinkCoco Uluwatu - for Cool Adults Only,Saya menginap di pink Coco selama seminggu dan benar-benar menikmati saya tinggal.   Dekorasi adalah sejuk dan kolam renang yang terpelihara dengan baik. Saya ingin terutama terima kasih kepada seluruh staf untuk pergi di atas dan di luar untuk membuat Anda tetap tak terlupakan.   Mereka yang indah dan perhatian terhadap detail setiap kodrat membuat kami merasa nyaman di setiap saat. Saya akan kembali lagi.,5
51, PinkCoco Uluwatu - for Cool Adults Only,"Kami tinggal selama 5 malam di pink Coco dan kami sangat senang dengan: Kolam renang yang indah, staf yang sangat baik - hati, kamar yang nyaman dan sesuai dengan harganya. Di dekat Padang Padang Beach dan beberapa tempat yang bagus untuk makan.   Di siang hari, sangat tenang. Namun, ada musik keras setiap malam dari salah satu atau dua dari restoran di dekatnya, termasuk di restoran yang tidak hanya sekedar bagian dari sebuah hotel. Ini karena terlambat karena kadang-kadang berjalan di 11:30, dan pergi langsung ke kamar Anda karena ada hampir tidak ada peredam suara. Kami harus beralih kamar sekali karena terlalu dekat dengan restoran.   Juga, layanan dry cleaning mereka menghancurkan beberapa barang kami dengan klorin noda, yang kita tidak menyadari sampai setelah kami…",2
52, PinkCoco Uluwatu - for Cool Adults Only,"Pacar saya dan saya tinggal di sana untuk beberapa hari di perjalanan kami ke Bali dan hotel ini adalah pasti salah satu yang terbaik yang kami pernah tinggal di. staf yang sangat ramah dan membantu dan tulus, senang untuk membantu dengan cara apapun. sangat bersih, indah kamar dan hotel secara keseluruhan. Kami menginap di kamar penthouse - sangat merekomendasikan untuk pemandangan dan matahari terbenam yang luar biasa. Restoran di pinkcoco juga sangat bagus.   100% saya akan menginap di sini lagi.",5
53, PinkCoco Uluwatu - for Cool Adults Only,"Segala sesuatu tentang pink Coco adalah luar biasa. Kamar sangat bersih dan indah, kolam renang yang luar biasa, lokasi yang bagus, staf pergi keluar dari jalan mereka untuk membuat Anda senang!   Baru-baru ini pergi ke Bali pada bulan madu kami dan kami tinggal di semua jenis tempat indah, kami memutuskan untuk menghemat uang dan memesan sesuatu yang lebih murah untuk Uluwatu dan tempat ini adalah favorit kami!   Nilai yang luar biasa untuk harga. Pesan",5
54, PinkCoco Uluwatu - for Cool Adults Only,"Kunjungan kami sangat terinspirasi oleh GiliT PinkCoco kunjungi. Saya sangat merekomendasikan baik hotel. PinkCoco Bali adalah fasilitas berada dalam kondisi sangat baik, sangat baik dilayani setiap hari. Pelayanannya sangat bagus dan pribadi. Lokasi sangat bagus, Padang - 3 menit berjalan adalah Padang. Restoran Italia yang sangat baik. Jika Anda ingin pilihan yang lebih murah, Anda bisa mencoba salah satu dari 5 - 10 pilihan restoran dalam 2 menit berjalan kaki. Dengan skuter (diatur oleh komputer untuk 65 k - 100 k per hari) Anda dapat mencapai Bingin dan Dreamland di 10 di 5 menit.",5
55, PinkCoco Uluwatu - for Cool Adults Only,"Saya tidak menginap di pink Coco tapi saya memiliki pengalaman yang luar biasa dengan staf mereka.  Saya dirampok di Bali dan pergi dengan tidak ada uang tunai, ponsel, paspor, kartu kredit dll.  Saya pergi ke Pink Coco dan diminta untuk menggunakan wifi mereka, meskipun saya tidak punya uang untuk membeli apapun. Staf di sini sangat luar biasa. Mereka membiarkan saya menggunakan wifi, membawa air, buah dan membiarkan saya menggunakan telepon mereka. Mereka memesan Transportasi saya dan selalu memeriksa untuk melihat apakah saya baik-baik saja.  Mengingat saya tidak tinggal di hotel ini, mereka pergi di atas dan di luar untuk membantu saya keluar.  Setelah saya menyalakan uang tunai. Kembali ke Pink Coco untuk sarapan. Setiap anggota staf yang datang untuk bertanya bagaimana…",5
56, PinkCoco Uluwatu - for Cool Adults Only,"Menginap 2 malam bersama keluarga saya (termasuk bayi). Kamar dan hotel ini sebagai baik atau lebih baik daripada foto online. Kamar dan kamar mandi yang indah dan luas. Itu baik untuk memiliki kelambu di sekitar tempat tidur. 3 kolam renang yang sangat bagus. staf yang sangat ramah - Putu dan Tiwi sangat ramah dan tampak setelah kami baik - dengan saran dan memanggil sopir kami yang kami akan mengatur sendiri tapi sudah larut malam. Lokasi sangat bagus untuk pantai Padang Padang, Bukit dan dapat merekomendasikan pergi ke kafe di dekatnya yang memiliki pantai kecil dengan Thomas turis.",5
57, PinkCoco Uluwatu - for Cool Adults Only,"Layanan di sini adalah luar biasa. Kita harus tahu staf cukup cepat, mereka bersedia untuk pergi ke luar kapal untuk memastikan Anda memiliki waktu yang besar. Kamar yang indah, kolam renang yang indah dan tempat yang tenang. Berjalan kaki ke pantai padang padang, spa dan Bukit Cafe!  Hal ini tidak partai tempat, Anda harus naik taksi di tempat lain tapi hotel ini sangat bagus di kan mengatur sopir.",5
58, PinkCoco Uluwatu - for Cool Adults Only,"Saya senang saya menginap di PinkCoco.  Dari saat saya tiba saya begitu bersemangat untuk menghabiskan beberapa hari di sini.  Putu menyambut saya untuk properti dan sangat ramah. Tini juga bagus! Staf semua sangat ramah dan menyambut.   Tempatnya benar-benar indah. sangat rimbun dan berwarna warni, arsitektur yang luar biasa dan kolam renangnya luar biasa! Ada kolam renang dewasa dan satu lagi yang sangat ramah keluarga. Saya hanya menggunakan satu, dan itu selalu bersih dan baik menyala di malam hari.   Saya sangat puas dengan kamar saya. Itu cerah, baik dihiasi dan pendingin udara (yang sangat diperlukan! ) bekerja dengan baik. Saya menyukai desain kamar mandi. mandi hujan dan jendela yang membuka ke pemandangan taman. Semua fasilitas kamar mandi alami yang sangat bagus. Saya…",5
59, PinkCoco Uluwatu - for Cool Adults Only,"Tempat ini sangat baik. Mudah akses ke makanan, berjalan kaki ke pantai, kolam renang yang bagus. Ini adalah indah seperti yang terlihat di foto. Saya merekomendasikan makan di om burger jika Anda seperti California gaya makanan seperti saya. Dan sate ayam di pantai membuat makanan yang luar biasa.",5
60, PinkCoco Uluwatu - for Cool Adults Only,"Saya dan pacar saya pergi ke sana untuk beberapa malam. Suasana yang bagus, sangat orang-orang baik dan layanan. Excelente makanan lezat dan lokasi yang baik. Kamar yang bersih dan lucu. Swimingpool dengan sofa yang nyaman. Kami pasti akan kembali",5
61, PinkCoco Uluwatu - for Cool Adults Only,"Kami telah sekarang tinggal dua kali di pink Coco dan kedua kali telah benar-benar baik. Staf benar-benar ada untuk memastikan anda menikmati masa tinggal Anda. Pada desain asli dan setiap kamar penuh dengan begitu banyak karakter. Istri saya memiliki desain interior dan ini adalah hotel favorit. Kolam renang hotel ini sangat indah dan santai. Tini, Putu Dessy dan pergi keluar dari jalan mereka untuk membuat kami merasa senang. Saya mengatakan kepada mereka bagaimana banyak aku suka bau dupa di mereka dan mereka pergi dan membeli saya setelah beberapa jam! Kami perjalanan sering, dan kadang-kadang sangat tinggi akhir Hotel dan yang satu ini adalah jauh favorit kami! Kami berharap untuk datang kembali setiap tahun. Terima kasih! ",5
62, PinkCoco Uluwatu - for Cool Adults Only,"Saya menyukai segala sesuatu tentang pink Coco. Saya akan mulai dengan staf - yang sangat baik dan membantu. Asisten manajer adalah indah dan sangat profesional. Mereka semua berbicara sangat baik dalam bahasa Inggris. Kami tinggal di suite ""pent House"" yang sangat indah dan kami memiliki pemandangan laut yang luar biasa. Dekorasi adalah sangat cerdas dan berpikir - Saya sangat terkesan. Kolam renangnya sangat indah dan hangat, kami duduk di pinggir kolam renang cukup sering membaca. Hotel ini sangat dekat dengan segala sesuatu dengan skuter dan sangat mudah untuk menemukan dari jalan utama. Hotel ini menawarkan Baik sushi dan Italia :)   Staf di pink Coco membuat kami merasa sangat selamat datang - benar-benar seperti rumah yang jauh dari rumah.",5
63, PinkCoco Uluwatu - for Cool Adults Only,"Ini adalah tanpa diragukan lagi terbaik tinggal selama perjalanan kami ke Bali. Staf sangat membantu dan menyenangkan! Ruangan itu menakjubkan, dengan tempat tidur yang nyaman, mandi yang menakjubkan ""Air Terjun"", dan AC. Hotel ini juga memiliki dua kolam renang, yang keduanya luar biasa. Selama kami tinggal kami juga mencoba spa di hotel, yang pasti layak kunjungan (dengan harga yang masuk akal, dan hasil perfekt).",5
64, PinkCoco Uluwatu - for Cool Adults Only,"Makanan di pink Coco adalah terutama Italia terinspirasi, kami memiliki pizza, cumi dan kentang goreng. Layanan yang baik dan suasana itu sangat menyenangkan, cukup parkir dan sepeda motor naik dari pantai selancar. Ini sangat layak untuk dikunjungi jika Anda berada di Uluwatu.",4
65, PinkCoco Uluwatu - for Cool Adults Only,"Tinggal di biaya sekitar $60 Pink Coco AUD per malam. staf yang sangat ramah dan membantu. Saya mendapat kamar yang besar dengan TV kulkas dan aman, tepat di sebelah kolam renang dan mereka mengatur skuter untuk saya. Wifi adalah agak lambat dan restoran di depan terlalu mahal! Anda bisa mendapatkan makanan yang sangat dekat dengan selama setengah biaya.",4
66, PinkCoco Uluwatu - for Cool Adults Only,"Dekorasi yang indah, kolam yang bagus - hanya untuk orang dewasa - restoran Italia yang bagus, bagus spa, tapi yang terbaik adalah staf yang sangat penuh perhatian.  Putu, Tini, Deisy, semua orang sangat bagus.  PinkCoco Bali dan dari, ke PinkCoco Gili Trawangan.  Kerja bagus Bung!  Pink Terima Kasih!  :)",5
67, PinkCoco Uluwatu - for Cool Adults Only,"kami pergi sebagai pasangan untuk bulan madu kami di bulan Maret - semua staf menyambut kami dengan nama kami pada kedatangan kami. Itu luar biasa. Kami mengambil kamar pent House - sangat luas dengan teras yang indah dengan pemandangan laut. Gambar yang dikirim ke kamar kami seperti kamar yang 100% staf membawa kita Menyegarkan. buah naga, hadiah kecil yang baik untuk pantai dan diatur sepeda motor bagi kita. lokasi tidak bisa lebih baik - padang Padang, Pantai binging, Uluwatu semua sangat dekat. restoran Italia di Hotel tampaknya selalu penuh. Kami memesan pizza - sangat bagus. Kami meminta layanan kamar untuk kopi - sementara mereka manis cukup untuk mengakomodasi permintaan kami - saya pasti tidak akan merekomendasikan layanan kamar. Kolam renang tepat di depan pintu masuk…",5
68, PinkCoco Uluwatu - for Cool Adults Only,"Pada menit terakhir kami memutuskan untuk mengakhiri perjalanan kami ke Bali di Uluwatu dan di Pinkcoco. Keputusan yang sangat baik. Kamar kami adalah indah dan luas. Kamar mandi memiliki pancuran air yang unik. Jendela besar dan menawarkan pemandangan dan udara segar (harus anda sebenarnya tidak memerlukan pendingin udara, yang bekerja dengan baik). Ada 2 kolam renang. Trattoria restoran di situs hebat dan ada juga sebuah spa di - situs web yang menyediakan pesan yang bagus. Staf yang semua sangat ramah. Tidak bisa menunggu untuk kembali.",5
69, PinkCoco Uluwatu - for Cool Adults Only,"Saya menginap di Pinkcoco untuk satu malam tapi aku berharap bahwa aku bisa tinggal lebih lama. Ruangan itu indah dan luas, kolam renang adalah menyegarkan dan pantai adalah berjalan kaki singkat (dan beberapa anak) pergi. Staf sangat membantu dan sopan. Juga restoran di area ini. Restoran Italia di hotel yang sangat bagus. Pastikan untuk meminta lantai atas meja dan duduk atau berbaring di bantal Anda dengan koktail. Pasti akan tinggal di sini lagi. Besar nilai untuk uang.",4
70, PinkCoco Uluwatu - for Cool Adults Only,"Hotel ini adalah sempurna. itu cukup, staf yang luar biasa, kolam renang yang (3) sangat bagus. Ketika kami tiba kami mendapat gratis upgrade ke kamar penthouse. Pemandangan yang menakjubkan! Malam terakhir kami di Bali tidak bisa lebih baik. Jika kita pernah kembali ke Uluwatu, kami pasti akan kembali ke PinkCoco Hotel. Terima kasih staf untuk waktu yang menakjubkan!",5
71, PinkCoco Uluwatu - for Cool Adults Only,"Saya dan teman saya tinggal lima malam di pink Coco Bali dan itu benar-benar fantastis. Staf adalah sangat ramah dan sopan. Kami merasa disambut pertama saat kami tiba. Sementara memeriksa - kami mendapat di wajah dingin kain dengan minuman yang menyegarkan. Putu menjelaskan segala sesuatu kepada kami, memberi kami beberapa kegiatan yang bisa kita lakukan dekat oleh dan menunjukkan kepada kita kamar kami. Meskipun pemesanan kami diberitahu bahwa sarapan tidak termasuk kami menerima sarapan voucher dari pink Coco untuk seluruh tinggal kami! Kami bisa memilih antara Barat (telur, daging dll), sehat (buah, yoghurt, dll) dan Indonesia (Nasi Goreng) sarapan. Semua termasuk secangkir kopi dan segelas air. Sarapan adalah benar-benar benar-benar lezat. Memasuki kamar kami lalu kami…",5
72, PinkCoco Uluwatu - for Cool Adults Only,"Mencintai kami menginap di Pinkcoco. Kami mendapat upgrade kamar karena terkunci keluar dari kamar kami yang asli karena kunci yang rusak. Kami menyukai kamar yang baru. Hotel ini sangat bergaya Spanyol, segala sesuatu di dalam kamar terbuat dari beton, termasuk tempat tidur, meja samping tempat tidur, lemari pakaian. Kamar kami adalah besar, dengan tempat tidur yang nyaman untuk bersantai di. Juga memiliki balkon besar menghadap ke kolam renang. Hotel ini dalam jarak berjalan kaki dari pantai & beberapa restoran. Sayangnya restoran Italia yang terhubung ke hotel ini ditutup untuk renovasi. Saya mendengar dari teman-teman bahwa mereka memiliki makanan yang hebat. Kami menemukan bahwa saudara Villa ini memiliki restoran besar dengan makanan besar Z & sangat murah dibandingkan…",4
73, PinkCoco Uluwatu - for Cool Adults Only,Apa tempat yang menakjubkan untuk menginap! Dari saat aku berjalan di sampai saat aku meninggalkan saya disambut dengan pelukan hangat. Staf semua sangat ramah dan siap untuk membantu dengan apa pun yang Anda butuhkan. Harus tinggal sementara di Uluwatu dengan pantai yang 5 menit berjalan kaki dari hotel. Terima kasih kepada staf di pink Coco untuk masa menginap yang tak terlupakan.,5
74, PinkCoco Uluwatu - for Cool Adults Only,"Suami saya dan saya menginap di pink Coco selama beberapa hari pada akhir perjalanan panjang kami melalui Bali selama satu minggu, itu benar-benar menakjubkan. Kami tinggal di penthouse dengan 360. Pemandangan dan pengalaman bersantap yang sempurna, dan begitu pribadi. Seperti tempat yang bagus untuk tinggal untuk beristirahat dan pemulihan. Hotel ini di lokasi yang besar dalam jarak berjalan kaki ke beberapa restoran, Mango Tree di malam hari ini memiliki suasana yang besar dengan musik live. Kecantikan dan salon Pijat di dalam hotel yang sangat bagus untuk pijat dan kuku. Pasti akan merekomendasikan hotel ini ke teman.",5
75, PinkCoco Uluwatu - for Cool Adults Only,"Saya dan suami saya tinggal di sini selama 3 malam dan menikmati setiap menitnya.  Lokasi adalah sempurna dan staf luar biasa. Satu-satunya hal yang dapat saya katakan harus berubah adalah bahwa mereka harus termasuk sarapan.   Kami tidak mencoba restoran di hotel tapi itu sangat baik, kami sangat suka dengan Mango tempat sebelah dan toko di dekatnya.   Secara keseluruhan itu adalah tempat yang bagus untuk tinggal dan nyaman. Saya akan merekomendasikan untuk orang yang mencari TTO saya bisa berjalan kaki ke banyak tempat.   Tips saya yang lain adalah untuk menyewa motor untuk berkeliling menjelajahi area :)",4
76, PinkCoco Uluwatu - for Cool Adults Only,Pink Coco dekat dengan pantai Padang Padang dan berguna untuk toko-toko dan restoran. Kami punya kamar di lantai atas dengan pemandangan laut dan itu sangat nyaman. Ada dua kolam renang - orang dewasa hanya kolam renang yang terpisah dan sebuah kolam renang. Staf di sini sangat membantu. Kami tidak memiliki sarapan di sini karena itu bukan bagian dari paket kami tetapi disajikan di restoran. Kami mencoba tiga warung lokal dan mereka semua sangat baik.   Kami akan dengan senang hati tinggal di sini lagi dan merekomendasikan tempat ini kepada orang lain.,4
77, PinkCoco Uluwatu - for Cool Adults Only,"Hotel ini sangat cantik dan unik, hotel ini memiliki merasa jelek dan menjalankan seperti sebuah kapal mabuk. Saya diberikan hingga tiba ke kamar saya sedikit merah tas dan sarung yang sangat menyenangkan untuk dilakukan. Saya menginap di salah satu kamar dengan pemandangan laut di lantai atas yang sangat sesuai dengan uang tambahan karena pemandangan yang luar biasa dan itu bagus dan pribadi dengan Teras/balkon pribadi Anda sendiri dengan tempat tidur untuk bersantai menonton matahari terbenam. hotel ini sangat bersih dan mereka memiliki layanan kedua di malam hari ketika mereka menutup kelambu nyamuk, cahaya lilin, colokan listrik di pengusir nyamuk colokan dan meninggalkan sedikit kejutan memperlakukan seperti kacang atau permen yang adalah sentuhan yang bagus. Ini adalah 5…",5
78, PinkCoco Uluwatu - for Cool Adults Only,"Pertama kelas diri dari mele di Kuta dan Denpasar. Pantai memukau, ombak kelas dunia, makanan lezat dan perusahaan besar. Pinkcoco telah menjadi nilai terbaik untuk uang dengan bijaksana di sekitar kolam renang, di spa, restoran dan bar dan keuntungan Byo.",5
79, PinkCoco Uluwatu - for Cool Adults Only,"Suami saya dan saya telah kami satu bulan perjalanan ke Bali dengan 4 malam menginap di PinkCoco. Hotel ini memiliki segala sesuatu yang kami cari - - terjangkau, aman, kolam renang yang bagus, staf yang ramah dan membantu (Deasy, Tini, Putu dan sangat bagus! ), dekat ke restoran (beberapa dalam jarak berjalan kaki), dan mudah terjangkau dan skuter.   Kami mengunjungi sejumlah pantai yang ada - favorit kami adalah Nusa dusa pantai (mengiat Beach) yang adalah sekitar setengah jam naik motor. Pantai Bingin yang cukup bagus tapi sangat kecil. Saya akan merekomendasikan melompat-lompat Padang Padang Becah. Keluar di malam hari ketika itu ditutup. Restoran favorit kami adalah Cafe favorit adalah bukit dan Nyoman warung makanan lokal.   Terima kasih untuk kunjungan yang besar di…",5
80, PinkCoco Uluwatu - for Cool Adults Only,"- Sangat keras bar tepat di sebelah kamar, mustahil untuk tidur (atau bahkan membaca, bersantai.) sampai mereka menutup. Wanita di resepsi sangat bagus tapi tidak bisa berbuat apa-apa untuk mengubah karena bar ini bukan merupakan bagian dari hotel.   - Penjemputan di bandara diandalkan & berbahaya: memesan 4:30 pagi untuk penjemputan di bandara, yang kami telah dikonfirmasi 2 kali dengan staf. Tidak ada mobil yang datang di pagi hari. Kami harus membangunkan penjaga dan dia membuat panggilan darurat di supir sehingga dia akan menjemput kami. Sopir melaju terlalu berbahaya. Kami butuh 20 menit untuk pergi ke bandara dari 40 menit dan dia hampir jatuh ke 2 sepeda motor di beberapa titik.   - Tidak ada wifi di setiap bagian dari hotel untuk panjang kami tinggal  - Tidak ada…",2
81, PinkCoco Uluwatu - for Cool Adults Only,"Segera setelah saya melihat foto di internet PinkCoco saya tahu bahwa saya ingin tinggal di sini. Saya membuat kesalahan dengan agak kacau reservasi saya tapi ini diselesaikan tanpa masalah dan tanpa biaya tambahan. Kamar Deluxe (dengan AC dan pemandangan taman) tidak benar-benar memenuhi harapan saya. Interior dan fasilitasnya sangat cukup dan nyaman bahwa saya akhirnya dua hari lagi. Seperti disebutkan dalam komentar lain di kolam renang yang hebat, restoran dan spa di tempat nyaman, lokasinya yang dekat dengan pantai Padang Padang dan berbagai restoran yang sangat baik. jadi jika saya ingin sesuatu itu mungkin untuk mengubah saluran TV; sebagian besar wisatawan yang tertarik bahkan tidak tersedia jadi anda harus membunuh tanpa henti untuk menemukan sesuatu untuk menonton.…",5
82, PinkCoco Uluwatu - for Cool Adults Only,"Kami tinggal di hotel kecil yang unik ini sangat memadai dengan peralatan yang ramah, membantu dan menampung staf. Lokasi yang baik untuk pantai pedang pedang. Kami diberi keterlambatan check out dengan tidak ada biaya sampai 6 jam. Merekomendasikan ini hotel murah dengan kolam renang yang indah. Tidak akan merekomendasikan sarapan, pilihan yang lebih baik untuk tidak harus pergi ke bukit ini termasuk kafe atau jiwa kedua kaki patung Buddha untuk makan siang.",4
83, PinkCoco Uluwatu - for Cool Adults Only,"Saya memiliki paling menakjubkan menginap di PinkCoco di Gili T - dan sangat senang bisa check in di PinkCoco di Uluwatu.   Tiba di check-in, staf sangat ramah & membantu. Kamar yang saya telah memesan, lembab & ada semut seluruh tempat tidur - Tapi staf yang luar biasa! Itu segera mengatur bagi saya untuk mengubah kamar & mereka yang indah tentang tempat ini! Bagi saya, ini adalah pelayanan yang luar biasa!   Ada 3 kolam renang & banyak sinar matahari loungers & restoran Italia di situs (saya tidak makan di sini karena ada tidak ada pilihan vegetarian, tapi mendengar cukup baik! ). Secara keseluruhan, fasilitas yang sangat baik.   Harus saya akui, setelah menginap di PinkCoco di Gili T pertama (yang menakjubkan). uluwatu Hotel tampak sedikit lebih tua. Gili T adalah patokan…",4
84, PinkCoco Uluwatu - for Cool Adults Only,"Saya tinggal di sini hanya 1 malam dan sayangnya saya sangat sakit. Staf tidak bisa telah lebih baik, hingga check out saya dan membawakan saya kelapa untuk perut saya. Hotel itu sendiri membutuhkan dari sedikit TLC, tidak cukup standar yang sama sebagai satu di Gili T. saya selamanya berterima kasih kepada staf yang tampak setelah saya.",5
