,hotel,review,stars
0, Puri Dajuma Cottages,"Saya Yoga Efendi, seorang Traveler dari Yogyakarta - Indonesia. Saya mendapat perjalanan bisnis yang panjang dari Jawa ke Bali dengan tamu saya dari Edinburgh (Skotlandia).  Java Trip sangat lelah tetapi luar biasa. Itu sebabnya di Bali membutuhkan tempat untuk bersantai dengan keramahan yang luar biasa dan masakan yang luar biasa. Puri Dajuma adalah yang terbaik untuk itu karena hotel ini menawarkan suasana yang cukup.  Untuk makan siang, kami memesan hal-hal khusus. Tamu saya tidak makan makanan laut dan telur. Jadi, saya saya sudah mengirim SMS melalui WhatsApp ke teman saya di Puri Dajuma, I Putu Gede Hendra Ardiana. Kemudian, Dia dan timnya yang luar biasa menyiapkan sesuatu untuk kita sebelum kita tiba.  I Kade Erik Handika menyambut kami, Ms. Ni Putu Lely melayani kami,…",5
1, Puri Dajuma Cottages,"Resor ini berada di lokasi yang indah, jauh dari keramaian wisata massal. Saat berkeliaran di sekitar desa setempat, Anda cenderung menjadi satu-satunya wisatawan.  Ruangan itu besar, dilengkapi dengan baik. Meskipun itu adalah salah satu kamar 'yang lebih tua' (beberapa sudah direhabilitasi atau diperbaharui) itu dalam kondisi yang sangat baik.  Staf fantastis, sangat baik dan ramah.  Satu saran: jika penerbangan Anda tiba larut malam, Anda mungkin ingin mempertimbangkan untuk menghabiskan malam pertama di dekat bandara, karena cukup berkendara.",5
2, Puri Dajuma Cottages,"Kami hanya menghabiskan 3 hari perjalanan Bali kami di Puri Dajuma. Pemandangan indah dan kolam renang luar biasa memungkinkan kami untuk lebih santai. Layanan hebat, ramah, dan kamar yang menakjubkan. Tidak jauh dari Pantai Medewi dan layak untuk menginap.",5
3, Puri Dajuma Cottages,"Hanya tinggal di sini bersama ketiga anak kami. Kami tinggal di pondok VIP, kami memiliki dua pondok dengan pintu yang berdampingan. Luar biasa! Mandi udara terbuka di kamar mandi sangat populer dengan anak-anak.  Kolam renang besar dan kurang dimanfaatkan oleh tamu lain, anak-anak kita menghabiskan berjam-jam di kolam renang.  Senang tidur dan bangun sampai gemuruh laut di pantai.  Punya pelajaran selancar yang bagus di pantai hotel dan melakukan perjalanan sehari untuk melakukan snorkeling.",5
4, Puri Dajuma Cottages,"Ini seharusnya menjadi ""tidak apa-apa resor kami di pantai"". Anak laki-laki itu saya salah. Seluruh tempat itu adalah taman. Sangat cantik. Kolam renangnya bagus, ada yang punya SLIDE! Makanannya sangat lezat dan harganya terjangkau. Semua orang ramah dan membantu. Pijatan itu begitu santai sehingga saya tertidur. Kamar mandi luar adalah bagian favorit saya dari ruangan. Pantai itu mempesona. Saat air surut, saya menggambarkannya sebagai snorkeling di atas air dengan kolam pasang dan bulu babi. Suamiku bilang itu setiap sinonim dengan luar biasa / cantik. Lokasi itu sempurna bagi kami, tetapi tidak dekat banyak.",5
5, Puri Dajuma Cottages,"Kami tinggal di resor ini selama seminggu dengan anak-anak kita (3 & 5), dan absolutly menyukainya. Sangat tenang dan tenang, agak jauh dari kebanyakan hal di bali tetapi menawarkan pemandangan spektakuler dari laut, kemungkinan untuk berjalan-jalan di pantai serta taman paling indah yang pernah saya lihat di bali. Area kolam sama-sama menakjubkan dan bahkan memiliki seluncuran air kecil untuk anak-anak. Restoran memiliki makanan, kamar memiliki standar dan kebersihan yang baik dan staf sangat ramah dan membantu. Tempat yang sempurna untuk bersantai!",5
6, Puri Dajuma Cottages,"Ini adalah kunjungan pertama kami, dan kami tidak akan pernah menyesalinya. Apa tempat yang indah dan tenang. Hanya mendengarkan samudera dan burung-burung. Tidak ada sepeda. Bungalo itu sangat bagus dan sangat bersih. Kursi duduk baik di dalam maupun di luar. Kamar mandinya sedikit di dalam dan di luar. Begitu indah dan semua yang Anda butuhkan. Setiap malam staf datang untuk membuat tempat tidur dan kamar Anda siap untuk tidur. Sarapannya sangat enak. Anda dapat memiliki segalanya. Rekomendasi terbaik dan terhangat kami. Kami akan kembali.",5
7, Puri Dajuma Cottages,"Jika Anda mencari waktu senggang, relaksasi, melarikan diri dari keramaian dan kecekatan belaka Kuta dan sekilas Bali tua, inilah hotel Anda. Dari saat kami tiba (pukul 230 pagi) tempat itu tidak kekurangan menakjubkan. Staf sangat ramah dan membantu. Dan maksud saya semua orang - mulai dari tukang kebun, kru restoran, resepsionis, pengemudi, manajer. Tidak ada yang terlalu banyak kesulitan. Alasan dan Villa kami luar biasa. Tampilan - hati. Makanannya enak. Tempat tidurnya super nyaman. Bersih. Sangat mudah untuk menghabiskan 10 hari tanpa melakukan apa pun. Dan kita melakukannya? Saya akan merekomendasikan Puri Dajuma kepada pasangan dan pelancong. Kami pasti akan kembali ????",5
8, Puri Dajuma Cottages,"Dibutuhkan dua setengah jam dari bandara Denpasar ke arah Barat dan jauh dari kota besar, menuju Jawa. Jadi pergilah ke sana untuk tinggal santai dan mungkin selancar ringan dan tidak berencana untuk pergi ke tempat-tempat wisata. Dengan rencana itu, itu adalah kebahagiaan dengan gelombang laut di tiga sisi. Dan lingkungan yang kaya dibuat dengan cermat. Minuman selamat datang dengan dasar air kelapa menyegarkan setelah perjalanan panjang.  Cottage yang sangat baik, kami tinggal dan akan merekomendasikan cottage di atas villa. Terbuka besar ke langit mandi dan kamar mandi adalah pengalaman yang luar biasa. Anggota staf sangat sopan dan tersenyum. Karena cottage adalah total tamu terbatas, perhatian dan layanan pribadi diberikan. Restoran memiliki makanan terbatas tetapi sangat…",4
9, Puri Dajuma Cottages,"Kami tiba di Bali dan memesan 3 malam di La Cabane, kami hanya menginap satu malam dan check out dan benar-benar menyesal mengunjungi Bali karena seluruh bagian tenggara pulau ini sangat kotor (plastik dibuang dan ditumpuk di mana-mana plus benar-benar amatir buruk) grafiti di hampir setiap dinding). Jadi setelah beberapa penelitian cepat dan lokal yang sangat membantu kami memutuskan Bali Barat menawarkan kedamaian dan ketenangan yang kami inginkan. Puri Dajuma benar-benar adalah resor damai sangat indah yang indah. Kami menyukainya di sana dan tidak ingin pergi, pemandangan matahari terbenam luar biasa dan makanan yang sangat menyenangkan (Goreng Nasi mereka mindblowing) Saya pergi memancing lokal dan menangkap beberapa ikan yang indah dan saya dan pasangan saya menghabiskan…",5
10, Puri Dajuma Cottages,"Ini adalah kunjungan keempat saya ke Bali tapi pertama kalinya saya di Barat dan saya yakin saya akan kembali ke Puri Dajuma. Saya sangat senang dengan semua aspek dari kunjungan saya. Lokasinya sangat memukau. Restorannya memadai - kadang-kadang baik, benar-benar bagus. Spa-nya sangat fantastis. Saya memiliki beberapa perawatan yang bagus di sana termasuk menonjol 4 pijat tangan. Saya melakukan satu hari perjalanan yang baik - saya pergi ke dekat proyek konservasi kura-kura yang sangat baik. Kamarnya bagus dengan kamar mandi yang indah. Matahari terbenam yang menakjubkan. Ada pantai yang bagus untuk berenang.",5
11, Puri Dajuma Cottages,"Kami menginap di salah satu vila baru selama sembilan malam, Soka - rasa memiliki pemandangan terbaik. Resor ini bersih, memiliki dua kolam renang yang berukuran baik dan staf sangat baik. Sangat ramah dan terlatih - baik HR manager! Saya juga memiliki enam pelajaran yoga yang bagus di area Yoga mereka dengan pemandangan laut. Sore hari adalah yang terbaik dengan angin laut. Makanan yang kebarat-baratan tapi anda bisa mendapatkannya jika anda meminta dibumbui. Jangan pergi ke Bali Barat jika anda ingin kehidupan malam - seperti Bali. Akan kembali lagi.",5
12, Puri Dajuma Cottages,"Kami menghabiskan 5 malam di Puri Dajuma dan benar-benar menikmatinya. Ini adalah hotel yang indah. Kamar-kamarnya ditata dengan baik dan indah. Kamar mandi luar ruangan yang besar. Kami sangat menyukai bagaimana tenang. Lingkungannya indah. Staf yang selalu ramah dan membantu. Antar-jemput ke berselancar bekerja dengan baik. Aktifitas harian (tarian, craft, dll) yang luar biasa. Saya pasti akan merekomendasikan hotel ini.  Mengapa tidak mendapatkan bintang lima: terutama pelayanannya tidak memuaskan. Ada jauh terlalu banyak kesalahan dengan mengambil pesanan. Ada terlalu banyak keterlambatan, khususnya sekitar kolam renang, dek atas di mana tampak untuk mengambil selamanya untuk mendapatkan sebuah menu atau minum (bahkan saat orang-orang di belakang bar) . Makanannya luar biasa…",4
13, Puri Dajuma Cottages,"Kami menginap di Puri DAJUMA Cottage selama 6 malam. Tempat ini sangat bagus: kamar yang bagus dan besar dengan kamar mandi yang bagus, taman yang indah, kolam renang yang bagus, 60 m menarik sekitarnya dengan laut dan Medewi (bagus untuk makan malam) dekat dengan dan kesempatan untuk menjelajahi selatan dan barat bagian tengah Bali. Pelayanan di restoran cukup ok, tidak lebih, tidak mudah untuk mendapatkan real baik dilakukan ketakutan telur. . . Malam itu sebagian berisik karena laut dan ombak. Layanan yang benar-benar perjalanan yang menarik selama memesan melalui hotel ini sangat bagus. Jadi, saya bisa sepenuhnya merekomendasikan bahwa tujuan dan akan senang untuk kembali lagi!",5
14, Puri Dajuma Cottages,"Puri Dajuma Resort adalah tempat yang sempurna untuk menginap untuk dua keluarga. Ini adalah lingkungan yang aman untuk anak-anak yang indah. Staf yang selalu ramah, tanpa terkecuali, dan sangat membantu. Resor ini sangat bersih dan terawat dengan baik, sekali lagi tanpa kecuali. Makanan yang disajikan secara konsisten dari kualitasnya bagus. Jika anda mencari tempat yang jauh dari keramaian dan hiruk pikuk Kuta, ini adalah tempatnya. Bonus ini adalah hanya hop dan melompat dari titik selancar, dan Medawi stafnya selalu bersedia mengantar Anda secara gratis.",5
15, Puri Dajuma Cottages,"Menginap di hotel ini benar-benar luar biasa dari awal hingga akhir. Saya memesan sebelumnya dan dalam melakukan hal ini menawarkan tarif kamar di setengah harga. Manajemen yang disediakan transportasi dari hotel kami sebelumnya dan ke bandara di akhir kunjungan juga FOC. Lokasinya luar biasa indah, kamar bintang 5 dan staf senantiasa membantu dan selalu tersenyum. Kami memiliki pengalaman yang disayangkan di hotel kami sebelumnya (Bambu Indah, Ubud) , jadi tiba di sini seperti datang ke langit. Satu-satunya komentar adalah bahwa, seperti kolam renang tidak ada lifeguard, orang tua bisa dengan tempat untuk duduk sementara anak-anak di atas kolam renang. Kami mengambil kursi kami sendiri di sana. Kami menyebutkan hal ini kepada manajer, Paul, dan ia tampak untuk mengambil tempat…",5
16, Puri Dajuma Cottages,"Puri Dajuma adalah di Pantai Barat Bali, sangat terpencil dan sangat sedikit turis, sehingga tidak ada toko-toko dan infrastruktur seperti calo menganiaya anda, sangat indah. Kami upgrade ke salah satu villa dua lantai yang bulat berada di sebelah lama, berkelok, kolam renang. Pemandangan yang lama, Bersih, pantai yang kosong. Stafnya luar biasa, sangat ramah dan membantu. Kami awalnya memesan untuk 3 malam tetapi diperpanjang untuk 3 malam karena kami yang lain menyukai Puri Dajuma begitu banyak. (Tidak ingin meninggalkan) . Tiga Restoran memiliki makanan luar biasa dan semuanya berbeda. Kolam renang di BENDEGA restoran terletak di bawah kolam renang besar dan menyajikan makanan ringan di kolam renang dan makanan yang fantastis. (kami tidak menemukan tahu itu di sana selama…",5
17, Puri Dajuma Cottages,"Saya dan suami saya sangat menyukai segala sesuatu tentang Puri Dajuma. Ini adalah sebuah resor, tapi eco - tidak kompromi pada style, keramahan atau kualitas. Kami sangat terkesan dengan taman, area kolam renang, makanan, Menginformasikan dan staf yang ramah serta bagaimana membantu semua orang dalam pertemuan kebutuhan kami. Kami menginap selama empat hari di sini sebagai bagian dari acara pernikahan, dan semuanya grup diperuntukkan untuk besar-besaran. Kami akan kembali! Terima kasih! ! !",5
18, Puri Dajuma Cottages,"Kunjungan kami di resor ini sangat bagus, pelayanannya luar biasa anda tidak hanya tamu, tapi merasa lebih seperti anggota keluarga yang bagus, makanan khas Bali yang dimasak sesuai selera anda, staf dari seluruh resort berhenti dan mengenyangkan anda dalam hal apapun pada anda ingin tahu tentang pulau ini, dan sangat bangga. Tempat yang bagus untuk bersantai dan pastikan untuk menggunakan Spa, yang merupakan salah satu dari mereka specialty, kami ingin berterima kasih kepada semua staf yang membuat pengalaman menginap kami sangat istimewa. Janice & Ben. Kanada.",5
19, Puri Dajuma Cottages,"Resor ini tidak ada duanya! Kami dijemput dari bandara oleh sopir ramah dan bertemu dengan handuk dingin dan lezat minuman kelapa dingin air pada saat kedatangan.  Kamar sangat bersih dan indah dihiasi. Staf yang sangat ramah dan membantu. Menu luas mulai dan termasuk hidangan khas lokal yang lezat. Lokasi adalah menakjubkan. Resor ini adalah, menurut pendapat saya, sempurna. Pengalaman saya akan selalu ingat!",5
20, Puri Dajuma Cottages,"Saya menghabiskan 5 malam di sini di awal Juli. Saya sangat menyukai ketenangan dari resor, dan itu jadi santai. Tepat di pantai terpencil, penduduk setempat mandi di kolam pasang rendah, terbang layang-layang. Matahari Terbenam. Restoran menyediakan variasi makanan yang baik, harga yang baik. Sarapan adalah pilihan yang tepat, dan jus segar dan lezat buah-buahan dan telur dll. 9 kamar yang memiliki pemandangan laut dan. (Yang terbaik? ). Properti memiliki sebuah kuil di taman dan selama saya tinggal yang diadakan upacara nelayan. Semua staf yang sangat ramah dan layanan berpikiran dan laporan memiliki kebijakan sosial untuk staf, semua dari desa dan banyak dari mereka sejak hari pertama ketika resor dibuka.",5
21, Puri Dajuma Cottages,"Terletak dekat pantai di Pekutatan ini Kota Kecil adalah tempat yang indah untuk tinggal. Pemandangan indah, pondok yang sangat baik dengan dapur dan staf yang ramah. Resor ini memiliki tiga restoran, dua kolam renang dan akses ke pantai. Juga dapat mengatur tur yang berbeda. Sangat direkomendasikan.",5
22, Puri Dajuma Cottages,Kami menghabiskan 6 hari di sini di bulan Juli di hotel ini sangat baik staf yang sangat ramah dan membantu dan lokasi di Teluk sangat indah. Membaca beberapa ulasan tentang makanan tapi kami tidak punya keluhan dan bahkan ada satu kesalahan mereka mengambil tanggung jawab penuh dan kami lebih dari cukup terobati. Hanya peringatan yang saya akan mengatakan bahwa orang-orang di pantai. Hotel perlu lebih banyak untuk memastikan bahwa sampah plastik dan dihapus dari pantai. Sangat disayangkan bahwa saat surfing ada kantong plastik di dalam air yang tidak membuat kita berpikir dua kali tentang kolam renang. Seperti yang saya katakan kami memiliki waktu yang hebat. : - ),4
23, Puri Dajuma Cottages,"Puri Dajuma adalah tempat yang sangat bagus untuk tinggal jika Anda ingin lingkungan yang tenang dengan hanya beberapa wisatawan. Kamarnya luas, AC dan biasanya menawarkan pemandangan yang sangat bagus. Staf adalah sangat ramah, dan restoran yang menyajikan makanan yang lezat. Saya pasti akan merekomendasikan tempat ini jika Anda di daerah ini!",5
24, Puri Dajuma Cottages,"Harapan kami menginap kami mau kalah. Staf yang penuh perhatian dan suasana alami yang eksklusif yang ajaib. Ada sesuatu untuk semua orang dan staf membuat yakin semua perhatian terhadap detail selalu menghadiri untuk. Anak-anak kami sangat menyukai kolam renang dan privasi yang menakjubkan dari villa kami tinggal di, kami bisa tersembunyi dalam kemewahan. Makanan yang sangat baik, banyak untuk memilih dari pada menu yang luas. Puri Dajuma adalah sebuah permata tersembunyi dan kami akan kembali lagi secepatnya!",5
25, Puri Dajuma Cottages,"Salah satu yang paling indah tempat kami menemukan di Bali. Tidak ada di sekitar resor ini, tapi ada tidak perlu. Tempat ini memiliki semuanya. Akomodasi yang menakjubkan, kolam renang yang luar biasa (bahkan air slide). Ombak yang sempurna untuk berselancar. Tempat yang bagus untuk berjalan di pantai dan mengumpulkan kerang. Staf yang fantastis dan makanan yang hebat. Apa lagi yang bisa saya katakan. Sangat merekomendasikan tempat ini. ",5
26, Puri Dajuma Cottages,"OK jika anda seperti saya dan Anda ingin berselancar di Medewi istirahat, tapi mungkin sahabat anda tidak berselancar. Puri Dajuma adalah tempat yang tepat! Ini adalah sedikit surga di titik. Satu dapat berjalan kaki sejauh timur dari resor, atau Anda dapat naik bus ke surfing Medewi. Saya memiliki 6 - 7 kaki ombak selama dua hari saya! lefts panjang yang sempurna, tidak terlalu menuntut, tetapi ini adalah besar dan menyenangkan! Staf resor yang menakjubkan yang terdiri dari orang-orang Bali yang tidak bisa lebih baik. Makanan yang sangat baik dan tinggal selama 5 hari itu! Pondok kami adalah di tempat yang sempurna dan tenang dan pemandangan yang bagus! Berjalan kaki singkat ke kolam renang. Berjalan kaki singkat untuk pijat, dan berjalan kaki singkat ke berjalan kaki! Jika…",5
27, Puri Dajuma Cottages,"Saya pikir ini adalah salah satu tempat favorit saya di semua kali! Puri Dajuma adalah layak dikunjungi jika Anda mencari tempat untuk bersantai, tetapi masih dapat melakukan berbagai macam hal - jika Anda ingin. Ada ombak yang luar biasa hanya beberapa menit jauhnya (Hotel menyediakan antar jemput gratis termasuk jemputan ke surfing Medewi istirahat).  Hotel dan stafnya luar biasa! Kami upgrade ke salah satu villa dan itu layak! Anda memiliki semua yang anda butuhkan di dalam, jadi jika Anda tidak ingin, ada tidak perlu keluar dari resor.  Semuanya sangat bersih dan Anda hanya merasa di rumah. Kami pasti akan kembali dan sudah melihat ke depan untuk ini!",5
28, Puri Dajuma Cottages,"Aku ada di sana dengan keluarga saya (istri dan dua anak-anak 3 dan 1 tahun) dan kami hanya menyukainya.  Kamar sangat bersih dan luas, kolam renang yang baik dari hotel ini adalah hanya menakjubkan dan taman dan restoran yang benar-benar luar biasa. Juga staf sangat ramah dan membantu. Hanya kata yang baik untuk hotel ini. Saya merekomendasikan hal ini kepada siapa pun dan pasti akan datang kembali.",5
29, Puri Dajuma Cottages,"Surga tropis di Bali yang sesungguhnya semangat dan sekitarnya. Pilihan akomodasi ini menarik, dari bunga bungalo, vila eksotis dan Kayu Bali Villa Depan Pantai yang intim. Kami telah tinggal di sini banyak kali dan kami tidak pernah kecewa. Ada 3 restoran dan menu melayani untuk semua orang, mulai dari Bali, Western, jepang dll, dan selalu lezat.  Dua kolam renang, keduanya menakjubkan dan cukup besar untuk melakukan 1 putaran lap! Berharap kami berada di sana sekarang!  Anda tidak akan kecewa. Ini adalah salah satu tempat di Bali di mana tidak ada pedagang kaki lima - Saya sangat menyukai tempat ini! ",5
30, Puri Dajuma Cottages,"Hotel ini terdiri dari vila dan bungalo. Bungalo dibagi dua pihak dengan pintu masuk yang terpisah, Villa untuk penggunaan tunggal. Kami tinggal di sebuah bungalow. Bukannya TV kami memiliki jendela panorama Ke Laut - yang mengejutkan - tidak selalu terlihat terang pada malam hari, jadi kami bisa menatap dalam gelap - baik dari atau di depan dari kamar kami. Jendela ini ada metalized untuk hanya pemandangan di dalam tetapi tidak terbalik - aneh. Jalan setapak di antara Bungalow, kolam renang dan restoran (s) sempit, berkelok dan dihiasi oleh modern - tembok yang tinggi. Semua Bungalows telah sama dan di malam hari penerangan yang buruk (untuk menghemat energi? ) yang kami ketinggalan bungalow menurut signposting miskin yang jumlahnya juga.   Satu-satunya restoran yang terbuka…",2
31, Puri Dajuma Cottages,"Kami datang ke Puri Dajuma dengan anak-anak kami dan tinggal di Villa segara, tepat oleh laut. Kamar sangat nyaman dan dihias dengan baik. Ruang tamu adalah amazibg. Hotel ini memiliki tidak ada jendela dan dengan pemandangan laut dan suara ombak yang sangat santai.  Anak-anak menikmati dua kolam renang, satu dengan slide, berselancar pelajaran dengan Mr Jiopri dan body boarding.  Makanan yang luar biasa juga.  Kami akan kembali dan merekomendasikan untuk menjadi teman-teman kami.",5
32, Puri Dajuma Cottages,"Puri Dajuma adalah luar biasa. Karena Bali yang berubah di terakhir 20 - 30 tahun, banyak yang telah menjadi komersial dan penuh dengan orang-orang yang menghargai dan tangan di saku Anda. West Bali secara umum, dan Puri Dajuma khusus membawa Anda kembali untuk perjalanan seluruh Bali di masa lalu.   Kami menghabiskan 3 minggu di sana September 2016 benar-benar mengenal tempat ini dengan baik.   Kamar Kamar yang fantastis - tempat tidur nyaman, kelambu nyamuk mana yang dibutuhkan, sangat bersih. Kamar yang berbeda * banyak * di Puri Dajuma jadi tergantung banyak pada apa yang Anda inginkan. Ada kamar yang merasa lebih seperti kamar hotel di bangunan utama: pondok yang lebih tua, yang menarik dan sangat baik terletak; vila yang baru di samping kolam renang baru - sentuhan lebih…",5
33, Puri Dajuma Cottages,"Resor ini di lokasi terpencil yang memberikan ketenangan dan kedamaian. Tepat di pantai. Pantai tidak baik.  Kami mendapat VIP Cottage yang bagus dan luas kamar di resor, tetapi telah bergabung ke kamar lain.  Halamannya indah dan terawat dengan baik.  AC, tempat tidur dan kamar mandi yang sangat bagus. Kami memilih untuk menggunakan kamar mandi di luar hanya, dengan air dingin.   2/3 kolam renang. Keindahan mewah spa tapi yang mahal.  Makanan yang baik.",4
34, Puri Dajuma Cottages,"Kami pertama kali makan di restoran ini karena ada Galuh, makanan yang sangat baik. Mereka membantu kami mendapatkan kontak dengan bank kami kartu diblokir. Kami menyukai tempat ini bisa menemukan kesalahan, tidak semua kolam renang yang indah dan Villa. jadi kami tinggal untuk satu malam di Sari Villa sangat romantis. Matahari terbenam yang menakjubkan melihat dari bawah kolam renang, minum koktail. Beli 2 mendapatkan 1 GRATIS! Antar-jemput gratis kapan saja untuk lokal desa dan pasar. Staf memiliki kemampuan bahasa Inggris yang baik dan sangat membantu dan terlatih. Kami akan tinggal di sana ketika kami memenangkan undian. Pantai Barat masih merupakan Bali yang sebenarnya sangat santai dan ramah dan penduduk setempat E",5
35, Puri Dajuma Cottages,"Terletak lebih dari 2 jam dari bandara. Tinggal di tepi pantai di Bali barat. Anda dapat menikmati ombak yang besar, berjalan, 2 kolam renang atau hanya menonton pemandangan yang bagus dari garis pantai. Pondok baik dihiasi detail kecil dan restoran dengan banyak pilihan makanan lokal",5
36, Puri Dajuma Cottages,"Kami memiliki pengalaman menginap yang menakjubkan di Puri Dajuma, satu-satunya penyesalan adalah bahwa itu tidak cukup lama. Kami tinggal selama 6 malam dan memiliki sangat menyenangkan!   Lokasi dan lingkungan yang keluar dari dunia ini! Ini adalah murni alam ini adalah indah pemilik dan staf terpelihara. Mereka mulai menghormati alam dalam segala hal yang mereka lakukan.   Ya, di awal bagian ini tidak baru tapi sangat terawat dengan baik dan ada tambahan baru di belakang dengan kolam renang lain.   Makanan yang sangat baik dan layanan layak menyebutkan terpisah - tempat ini luar biasa! Staf tidak bisa melakukan cukup bagi anda! Apa pun yang Anda meminta untuk dilakukan, tidak ada yang terlalu banyak masalah! Untuk menambahkan bahwa, ada sentuhan rasa Anda selamat datang!  …",5
37, Puri Dajuma Cottages,"Ini adalah kunjungan kami yang kedua di Puri Dajuma. Kami tinggal di salah satu villa di Puri Dajuma. Pilihan yang sangat bagus! Villa Indah dirancang dan dibuat. Layanan sempurna di seluruh resor. Yang paling ramah dan staf yang terlatih dengan baik yang pernah kami alami: dari lobi, tukang kebun, staf pembersihan, restoran dan Spa! Pasti kami akan kembali lagi!",5
38, Puri Dajuma Cottages,"besar akomodasi, makanan yang sangat baik dan staf yang sangat ramah! Ada tidak satu satu hal untuk mengeluh tentang. Semua sesuai dengan harapan kami. Yang membuat sulit untuk memilih dari menu dan bahkan setelah 2 minggu, Anda makan dua kali sehari dengan hidangan yang berbeda dan masih akan kehilangan beberapa. Luar Biasa! ",5
39, Puri Dajuma Cottages,"Menemukan tempat ini oleh kecelakaan dan memiliki resor yang bagus untuk mengambil istirahat dan kopi.   Kopi standar namun, tapi taman dan pemandangan cukup mengesankan.   Staf adalah sangat ramah dan membantu.   Resor tampaknya menjadi sekitar sedikit lebih tua, tapi terawat dengan baik, tetapi saya tidak punya kesempatan untuk melihat kamar.   Aku bisa membayangkan tempat ini akan menjadi tempat yang bagus untuk keluarga dengan anak-anak.",4
40, Puri Dajuma Cottages,"Kami menginap di Vila 6 Soka yang salah satu villa baru dan memesan semua 3 kamar, semua sangat luas dan indah. Kamar utama terletak di lantai atas di atas ruang duduk dan memiliki pemandangan laut. Kolam renang adalah besar dan saluran yang membawa turun antara semua vila. Anak-anak kami sangat menyukai kolam renang seluncur dan menghabiskan jam bermain di tempat ini.   Hotel ini sangat cocok untuk menghilangkan stres - mengurangi liburan suara ombak akan bersantai anda dan berjalan-jalan di taman yang indah atau di pantai akan mengisi ulang baterai Anda. Makanan yang sangat baik dan staf sangat ramah, semua dari daerah di sekitarnya sehingga hotel ini benar-benar membantu perekonomian lokal yang banyak dengan cara yang positif.    Ada mengatur perjalanan ke kuil, air terjun,…",5
41, Puri Dajuma Cottages,Kami tinggal di Puri Dajuma untuk dua malam tapi kami telah memesan tiga malam. Hotel Anggun diberikan kami ketiga malam di kredit karena hujan non stop dan kegiatan kami terbatas.   Staf hotel yang indah dan meskipun ini adalah sebuah area yang sepi staf apa-apa tapi tenang.   Saya akan tinggal di sini lagi dan lagi itu sangat bagus.,5
