,hotel,review,stars
42, Puri Dajuma Cottages,"Lokasi dan resor yang sangat damai dan tempat yang sempurna untuk bersantai. Kolam renang besar dan staf sangat membantu. Kami mencintai tempat ini dan akan menilai ini tempat terbaik di perjalanan kami. Namun ada beberapa hal yang perlu diganti/fokus.    1. Alasan aku memberikan tempat ini 4 bintang dan tidak 5 adalah karena fakta bahwa bahkan selama kami email percakapan dengan manajemen resor. Saya memilih kamar dengan pemandangan laut. Awalnya saya diberi kamar di mana ada tidak ada pemandangan laut. Saat ini saya mengalami reaksi alergi. Saya segera pindah ke ruangan dengan pemandangan laut. Namun hal ini tidak apa yang saya harapkan setelah perjalanan panjang ke resor ini.    2. restoran utama di resor yang sangat baik, tetapi tidak memiliki suasana. Tidak ada kipas angin,…",4
43, Puri Dajuma Cottages,"Mereka baru saja selesai beberapa vila baru dengan kolam renang & kolam renang dengan perosotan 60 meter. Pemandangan yang luar biasa, tenang & bersih pantai, dilarang mengganggu penduduk setempat, makanan ok. Ingatlah bahwa tidak ada apa pun di dekatnya, tetapi mereka memiliki angkutan ke Medewi. Jika Anda mencari untuk bersantai, tenang, bersih & tempat yang modern, ini adalah itu.",5
44, Puri Dajuma Cottages,"Kami tinggal selama 9 malam dan memiliki waktu yang fantastis di sini. Staf adalah yang terbaik yang kami temui di enam kunjungan ke Bali. Pemandangan yang luar biasa duduk di dua kolam renang besar, menonton penduduk setempat Memancing di terumbu karang, berenang atau hanya dan menikmati hidup.  Wisata yang ditawarkan adalah luar biasa dan nilai yang sangat baik.  Saya akan sangat menyarankan resor ini untuk siapa pun yang ingin berada di keramaian dan hiruk pikuk untuk berhenti. Suara hanya Anda di Puri, adalah suara laut dan burung. Surga, kami pasti akan kembali.",5
45, Puri Dajuma Cottages,Besar kamar dan kamar mandi di dalam dan di luar. Mandi air dingin di luar ruangan. Terletak tepat di pantai berbatu di pantai Medewi. Taman yang indah dan 2 kolam renang besar. Makanan dari restoran yang sangat baik dan kami makan di sana karena tidak ada tempat lain untuk makan di daerah terpencil ini. Kami memiliki salah satu cottage yang bagus dan tempat tidur gantung depan untuk bersantai. Saya mengharapkan sesuatu yang lebih untuk harga yang luar biasa dan hanya tidak memukul tempat untuk saya.,3
46, Puri Dajuma Cottages,"Kami memutuskan untuk menginap di Puri Dajuma setelah membaca banyak ulasan yang baik di TripAdvisor dan kami tidak kecewa. Kami membuat reservasi kami melalui situs pemesanan hotel dan memutuskan untuk menghubungi langsung hotel untuk transfer bandara. Respon yang sangat cepat dari resor dan tarif yang ditawarkan sangat masuk akal untuk penjemputan di bandara. Handuk dingin dan air yang ditawarkan di hari penjemputan dan perjalanan ke resor indah 2. 5 jam perjalanan menggunakan mobil. Saya akan menyarankan bahwa Anda mendapatkan resor untuk menjemput Anda di bandara dan setelah Anda mendapatkan ke daerah Pekutatan, perjalanan ke resor ini tidak terlalu lurus ke depan jika pengemudi tidak akrab dengan daerah.   Kami diizinkan untuk memeriksa ke dalam kamar kami meskipun kami…",4
47, Puri Dajuma Cottages,"Saya sangat senang dengan taman yang sangat indah di sini, dan hijau yang menyejukkan mata. Dari dalam kamar, taman yang indah juga dapat dinikmati. Dan saya bisa melihat pemandangan indah pantai dari restoran. Ini adalah benar-benar tempat yang bagus untuk liburan.",5
48, Puri Dajuma Cottages,"Kami tinggal untuk 4 malam di awal bulan madu kami. Karena lalu lintas itu memakan waktu hampir 4 jam untuk sampai ke sana dari bandara, itu seharusnya 2.5. supir kami menawarkan kami air dan coca cola dari kotak dingin di bagasi. Kami menginap di vila dengan 1 kamar tidur yang Bendega mandi di luar ruangan. Kamar sangat bagus, cukup baru (dibuka mei 2016), banyak ruang. Itu tidak memiliki ac dan kipas angin namun itu cukup hangat cukup cepat setelah ac dimatikan. Kamar mandi luar ruangan terlihat bagus dan produk perlengkapan mandi yang disediakan juga sangat baik. Hujan di malam hari beberapa kali dan ini menyebabkan barang untuk jatuh dari pohon ke lantai kamar mandi yang tidak ideal, tapi tidak terlalu buruk benar-benar. Kamar kami adalah di sungai, dengan kolam renang yang…",4
49, Puri Dajuma Cottages,"Terletak di bagian sangat terpencil Pekutatan, resor ini adalah tempat yang tepat jika anda mencari tempat yang tenang dan keluar dari dunia ini. Aku berjalan setiap pagi selama satu jam di sepanjang pantai pasir hitam vulkanik dan tidak melihat orang lain. Surga! Tinggal di ruangan untuk 5 malam 6B. Kamar yang indah dengan pemandangan kolam renang dan laut. Staf yang sangat ramah terutama yang lebih muda. Satu-satunya negatif adalah makanan yang kami makan untuk sarapan dan makan malam. Pasangan saya (koki/pemilik restoran) dan saya telah mencoba sebagian besar hidangan barat dan asia pada menu dan semua sangat mengecewakan. Pasti kebutuhan untuk meningkatkan kualitas makanan. Secara keseluruhan, itu tinggal yang menyenangkan.",4
50, Puri Dajuma Cottages,"Tempat ini adalah surga. Lokasi yang eksotis - tidak terlalu jauh dari dunia gila kuta tapi cukup jauh untuk merasa seperti anda berada di surga. Fasilitas yang indah, baik untuk berselancar di pantai sekitar sudut, berlatih yoga di tempat yang luar biasa tinggi atau berenang di dua kolam renang indah. Makanan lokal yang luar biasa dan staf yang sangat membantu dan selalu tersenyum",5
51, Puri Dajuma Cottages,"Kami tinggal di sini selama 5 malam dan memiliki waktu yang sangat santai. Cottage yang bagus dan luas dan dilengkapi dengan baik, dan makanan yang sangat baik. Anda dapat berjalan di sepanjang pantai untuk jam dan alasan sangat menyebar keluar, sehingga mudah untuk menemukan sudut yang tenang. Saya menyukai bagaimana ramah dan santai dari staf, tidak ada terlalu formal kesopanan yang anda kadang-kadang.   Satu-satunya hal yang membingungkan mereka menyebutnya sebuah resor eko dan aku tidak benar-benar melihat banyak bukti ini, terlepas dari fakta bahwa mereka tidak mencuci handuk setiap hari, yang sebagian besar tetap tidak bisa. Tidak ada disaring air isi ulang stasiun, yang kami telah di beberapa tempat lain kami tinggal, jadi kami harus membeli air minum, yang adalah jelas…",4
52, Puri Dajuma Cottages,"Kami tinggal 3 malam di puri dajuma, yang kami sangat menikmati. Ini adalah yang terbaik hotel kami tinggal di di bali. Staf sangat ramah, taman luar biasa dan kolam renang adalah menyenangkan. Banyak kegiatan lainnya seperti ping pong juga, perpustakaan, permainan, ... Kami juga melakukan body boarding dan selancar pelajaran anak-anak kami. Setiap pagi kami berjalan di pantai.  Satu-satunya kekurangan adalah hotel ini agak jauh dari mana-mana. jadi anda perlu transportasi untuk pergi ke suatu tempat. Karena kami hanya menginap 2 malam/3 hari kami hanya senang untuk menikmati diri kita sendiri di hotel. ",5
53, Puri Dajuma Cottages,Semuanya adalah standar tertinggi (saya terutama menyukai ukiran pintu) dan anda merasa begitu banyak perawatan telah diambil alih menciptakan resort. Ini adalah tempat yang sempurna untuk bersantai tapi mereka juga menyediakan shuttle bus untuk dekat pantai surfing resort. jadi anda dapat melarikan diri jika anda merasa anda diperlukan tapi itu begitu baik untuk kembali. Staf yang luar biasa dan kami berbicara dengan seseorang di keluar malam terakhir yang telah bekerja sejak penciptaan dan itu membuat kami merasa seperti bagian dari keluarga mereka.  Makanan yang sangat baik terutama ikan tuna.  Pemandu wisata kami menggambarkan hotel ini sebagai medium - Tidak ada yang mewah  Mengapa tidak ada bahasa inggris di sini ketika kami berada di sana? - sebagian besar perancis,5
54, Puri Dajuma Cottages,"Kami sedang mencari tempat untuk bersantai, jauh dari keramaian kuta. Menemukan tempat ini secara online (memiliki website yang bagus). Perjalanan dari bandara makan waktu 2,5 - 3 jam tergantung pada waktu hari, tapi itu sepadan! Kami mengatur sopir untuk menjemput kami dari resort ke -- sangat nyaman.  Keluarga 4 termasuk 13 tahun dan 15 tahun tinggal di salah satu kamar baru yang indah 3 br villa Bandega. Kita tidak menyadari ketika kami memesan bahwa saat di dalam kamar, mereka tidak dapat terhubung ke satu sama lain. Kami tidak merasa ini adalah masalah -- anak-anak benar-benar menyukai memiliki ruang mereka sendiri untuk bersantai. Mereka memiliki beberapa penyesuaian untuk ke kamar mandi luar ruangan meskipun! Tempat tidur dengan indah dihiasi dengan bunga ketika kami tiba…",5
55, Puri Dajuma Cottages,"Kami tinggal 3 malam. Kamar/tempat tidur yang nyaman, makanan yang sangat baik dan staf sangat ramah dan penuh perhatian. Udi khususnya mengambil baik mengurus kami. Kami sangat merekomendasikan puri dajuma untuk pengalaman menginap yang menenangkan jauh dari hiruk pikuk kuta/seminyak /. ",5
56, Puri Dajuma Cottages,"Kami telah tinggal di banyak hotel/resort pantai lebih dari 30 tahun, dan ini adalah yang terbaik untuk nilai dan suasana. Lokasi yang besar, besar makanan dan staf yang sangat baik. Hampir semua berbicara bahasa inggris dan sangat ramah. Ini mungkin adalah satu-satunya hotel yang kami pernah tinggal di di mana kami tidak benar-benar ingin mencoba makanan di tempat lain. Aku akan 100% merekomendasikan tempat ini dan berharap untuk kembali lagi dalam waktu dekat.",5
57, Puri Dajuma Cottages,"Jika anda berangkat dari kuta, legian, dan di pantai barat pulau bali ini adalah sebuah resor yang indah untuk menginap di untuk benar-benar bersantai dan menikmati liburan anda. Bungalow yang luar biasa luas dan berada di tengah-tengah taman bunga, pohon dan kolam renang tepat di tepi laut. Ada berjalan-jalan sepanjang pantai, berdiri up dayung asrama, titik selancar di medewi di dekatnya (hotel menyediakan antar-jemput gratis sana dan kembali) dan hanya secara keseluruhan jenis suasana taman eden. Liburan yang sangat bagus pilihan jika ingin tetap dan tenang.",4
58, Puri Dajuma Cottages,"Tinggal 7 malam di oasis ini di pantai. Tua tapi rapi kamar dengan pemandangan laut, luar biasa! Staf yang semua sangat ramah dan makanan di restoran adalah harga yang wajar, dan nilai yang sangat baik mengingat harga yang kami dibayar untuk tinggal di sini. Tempatnya sangat luas dan terawat dengan baik di depan pantai sangat bersih, tapi tidak cocok untuk berenang. Medewi surfing istirahat 15 menit dengan berjalan kaki di sepanjang pantai, tapi cukup, terutama di antara kami berselancar di medewi resrt dan titik, dan memberikan ini untuk diri kita sendiri untuk 6 hari langsung. Lefts dan hak. Tidak bagus ketika itu kecil. Dajuma adalah tempat yang sempurna untuk mendapatkan jauh diminta semua keramaian dan hiruk pikuk kota resor kembali di sepanjang pantai. Tenang dan bersih.…",4
59, Puri Dajuma Cottages,"Staf yang sopan, makanan yang baik, lokasi yang sangat baik. Para petualang dapat menikmati berselancar, bodyboarding. Taman rumput yang menghadap ke laut. Hotel ini memiliki tur yang membawa anda di sekitar desa. Anak-anak ramah. 04 malam menginap dan ingin untuk kembali lagi.",5
60, Puri Dajuma Cottages,Itu sulit untuk menemukan tempat yang tumbuh seperti puri dajuma cottages yang menyediakan pengalaman liburan di bali yang sebenarnya. Kami tinggal tujuh malam di salah satu kamar dengan pemandangan kolam renang dan laut. Semua staf yang sangat ramah dan sangat membantu dan makanan di restoran yang sangat baik terutama hidangan bali. Yang harus dilakukan adalah untuk mengambil tur di sekitar pondok sawah dan desa sekitar. Panduan kami mengambil banyak bangga di menunjukkan kami di sekitar desa dan sekitarnya. Puri dajuma bali mengingatkan kita ketika kita pertama kali mulai mengunjungi 27 tahun yang lalu.,5
61, Puri Dajuma Cottages,"Apa permata kecil! Pertama kalinya kami memiliki biasa kami memberanikan diri keluar dari area yang kita tinggal di, puri dajuma adalah menemukan indah! Ramah, membantu staf, bersih, kamar yang luas dan pantai 100m dari kamar kami! Pantai yang indah untuk berjalan dan spa yang sangat bagus! Pastikan untuk menambahkan hotel ini ke tempat untuk pergi!",5
62, Puri Dajuma Cottages,"Tinggal di lokasi yang indah ini untuk seminggu! Aku tidak bisa mengatakan cukup hal-hal baik tentang tempat ini! Kami berada sangat sedih untuk meninggalkan. Hotel ini di tersembunyi di bali barat - sangat tenang dan hijau.   Kamarnya luas dan bersih. Tempat tidur yang sangat nyaman. Kolam renang bersih dan memiliki pemandangan memukau! Ketika air pasang sedang keluar kami punya begitu banyak bersenang-senang mencari kolam pasang surut.  Tempat yang sempurna untuk bersantai dan menyegarkan.    Staf - dari meja depan untuk sarapan - tapi layanan yang ramah, sopan dan mengundang. Aku punya hanya tergantung pada akhir kami tinggal dan mereka keluar dan hanya punya saya turun. Dan penduduk setempat super ramah.   Secara keseluruhan mengagumkan waktu di surga. ",5
63, Puri Dajuma Cottages,"Terima kasih kepada yang menakjubkan staf dan puri dajuma untuk membuat anda selamat resort seperti surga. Ada makna yang sesungguhnya ternyata menjadi orangtua dengan 2 anak-anak kecil, kadang-kadang bisa menjadi suatu tantangan baru untuk tuan rumah kami... Segala sesuatu yang anda dapat membaca tentang keindahan alam, staf yang luar biasa, dan layanan superior adalah benar.  Berikut adalah beberapa pengamatan anda mungkin bermanfaat:  - jangan lupa kolam batu karang alami tepat di depan hotel - anak-anak saya telah menyenangkan dengan anak-anak setempat. gadis-gadis lokal - kami datang hampir setiap hari dan melakukan tarian lokal di jantung hotel - putri saya masih berbicara tentang hal itu segelas chardonnay - menghadap ke matahari terbenam di balik cakrawala merupakan -…",5
64, Puri Dajuma Cottages,"Puri dajuma cottages sebuah perjalanan! Staf bali yang sangat, sangat, sangat ramah dengan perhatian terhadap detail. (Mereka berbicara bahasa inggris dan manajemen perancis). Ikan segar dari nelayan di sebelah! Kami adalah sekelompok 9 hari ini dan telah makan siang di bali yang memiliki meja bagus di keteduhan, 50 m dari pantai, kami telah tur di kamar, sangat ramah dan bersih! Kami akan pasti buku ada di sana pada kunjungan berikutnya. Mereka juga memiliki berbagai wisata ramah lingkungan dan mereka memiliki liburan yang benar-benar profesional dan ramah lingkungan operasi ",5
65, Puri Dajuma Cottages,"Terletak tepat di pantai benar-benar tenang di bali, masih cukup untuk benar-benar dingin. Terdapat 20 kamar yang dilengkapi dengan fasilitas dan kamar mandi yang dilengkapi dengan shower di luar. Kami tinggal di 6a yang menghadap ke arah kolam, taman tropis dan panorama sepanjang perjalanan ke pantai. Sekitar sepertiga semua memiliki pemandangan laut sebagian dibangun kembali, tetapi masih hanya beberapa meter dari kolam renang. 9a 9 b dan ini sedikit lebih tenang dan ada juga sebuah 2 kamar tidur vila dengan pemandangan hebat dan dipisahkan dari sisanya. Makanan adalah segar dan dapat disajikan baik di restoran atau meter dari pantai. Staf di sini fantastis dan tidak bisa membantu lebih banyak, karena ada hanya beberapa tamu seperti 20 orang di sini selama kami menginap,…",5
66, Puri Dajuma Cottages,"Kami tidak dapat terima Rondy, bayu dan semua anggota staf lain yang cukup untuk memberikan kita yang terbaik. Kami diberi penghargaan untuk mereka mengurusnya. Kami memiliki yang indah setelanmu emasnyal. Dekorasi adalah begitu indah di kebun mereka (tradisional bali) bahwa inilah yang melakukan berbagai acara pernikahan tersebut kata dia belum pernah melihat tempat ini indah. Mereka membuat besar jantung fiowers di pantai dengan api unggun di depan hotel ini dan kami memiliki makan malam kami yang lezat. Itu sangat ditampung di situ dan semua orang benar-benar peduli tentang pernikahan kami. Juga jika anda tidak menikah itu sebuah tempat yang hebat untuk bersantai dan mendapatkan jauh dari itu semua. Terima kasih banyak untuk puri dajuma. Kami akan kembali! Anda dapat…",5
67, Puri Dajuma Cottages,"Sanggraloka yang terbuka ke arah taman indah sepanjang tepi samudra hindia yang, langsung ke sebuah gunung berapi aktif yang dapat dimasuki dengan mengandakkan iife saat air laut sedang surut, dan yang menarik adalah campuran antara inter-arah ombak saat ini keluar. Saya telah menulis halaman di terus-menerus keaktivitetan yang dihasilkan oleh laut, itu begitu menarik; karena itu yang datang juga b y kenyamanan dan layanan di resor ini.  Kami tinggal di kamar untuk 7 malam di gold. Itu segala sesuatu yang kita bisa berharap untuk - lapang, bersih, nyaman tempat tidur, kamar mandi yang indah dengan shower luar ruangan (seperti hujan abu sangat tinggi dan besar), kamar mandi besar/jacuzzi, balkon dengan pandangan laut yang sangat indah, ramah layanan penuh perhatian, dan bunga…",5
68, Puri Dajuma Cottages,"Tenang (terlepas dari ombak yang memecah ojore, di ""mengintip"" sunbirds, dan sesekali sambalewa gecko). Makanan di restoran dengan sangat baik. Ini adalah tempat yang damai untuk bersantai. Cocok untuk anak-anak yang lebih kecil, tapi mungkin terlalu tenang bagi remaja dan pesta kelimun. Banyak yang harus dilakukan di daerah ini dan harga tampaknya sangat masuk akal untuk berbagai paket wisata yang ditawarkan. Staf yang ramah. ",5
69, Puri Dajuma Cottages,"Hotel ini menawarkan segala sesuatu yang lain di bali kepariwisatawan tidak! Tenang dan damai - hotel ini disampaikan dalam setiap cara. Jika anda ingin mendapatkan jauh dari keramaian di pesisir barat lanjutkan. Pariwisata rendah kunci di sini dan anda benar-benar merasa seperti anda jauh dari hiruk-pikuk keramaian. Kami memesan dua kamar, satu di depan pantai bagi putra dan putrinya dalam hukum dan sebuah taman yang indah untuk diri kita sendiri, tapi kami tidak pergi ke tepi pantai yang di sebelah anak-anak kita satu kamar! Bersih, nyaman dengan dua kamar mandi - di dalam satu dan satu di luar! Sarapan dan makan malam memiliki pilihan tempat yang bagus dengan tarif yang terjangkau dan pilihan. Mereka menjalankan perjalanan dari hotel jika anda tidak merasa perlu untuk…",5
70, Puri Dajuma Cottages,"Kami hanya menghabiskan satu malam di sini, dan dari apa yang kita dapat mengatakan itu adalah salah satu yang terbaik di Medewai. Stafnya sangat ramah dan lokasinya bagus, tetapi sedikit berjalan kaki ke pantai utama untuk berselancar (mereka memiliki antar-jemput gratis, tapi lalu lintas begitu buruk ketika kami berada di sana itu mengambil 45 menit untuk mendapatkan ke pantai, jadi berjalan sangat cepat). Kamar mandi besar dan kamar mandi juga cukup besar. Kami merasa ini diperlukan makeover sebagai sedikit lelah dan untuk harga yang layak di kecil sisi, tapi itu adalah tempat yang bagus untuk bersantai jauh dari keramaian. Staf adalah benar-benar bermanfaat sebagai hal-hal yang baik dalam penerimaan dan restoran. Kolam renang yang besar, akan kembali jika kita punya harga…",4
71, Puri Dajuma Cottages,"Ini adalah hotel yang indah di wilayah bali iess kaial. Kami tinggal di ruangan emas yang didekorasi dengan indah dan sangat nyaman. Makanan di restoran yang sangat baik dan ada banyak pilihan. Staf yang ramah dan membantu. Baik ukuran kolam renang yang menghadap ke pantai yang berbatu. Anda tidak dapat berenang di pantai di depan hotel tapi itu adalah kenikmatan untuk duduk dan menatap pemandangan. Taman cantik, bersih dan tenang untuk berjalan-jalan sepanjang pantai. Kami hanya menghabiskan dua hari di hotel dan itu tidak cukup lama. Sangat besar terima kasih kepada staf untuk membuat kami tinggal begitu menyenangkan.",5
72, Puri Dajuma Cottages,Pondok memesona di lokasi terpencil dan cukup. kamar yang sangat nyaman dan santai di taman hotel. Staf sangat bagus dan menampung. Mereka akan membawa anda ke ombak renjis di jalan dan menjemput anda tanpa biaya. Tempat menginap yang hebat dengan sangat baik pantai berjalan tepat di depan pintu anda.,5
73, Puri Dajuma Cottages,Meskipun puri dajuma impiana tidak mengecewakan. Akomodasi ini yang sangat bersih dan didekorasi dengan penuh cita rasa. Hotel ini bersih dan staf adalah orang-orang yang paling manis. Makanan di restoran yang sangat baik dalam pendapat saya. Tinggal selama 4 malam dan memiliki waktu yang menakjubkan. Sepotong kecil surga yang akan selamanyajadi di hatiku.,5
74, Puri Dajuma Cottages,"sangat nyaman. Layanan luar biasa: memungkinkan kita untuk mengubah kamar, restoran staf tidak bisa melakukan cukup bagi kita. Terima kasih khusus kepada bayu di restoran. Menu menawarkan berbagai jenis makanan. Hanya kerugian - mendapatkan digunakan untuk suara ombak tepat di depan hotel! (Oh, dan awal pasir yang terus sepanjang hari.)",4
75, Puri Dajuma Cottages,"Setelah mengarungi kelembung tarif kamar, cukup besar, bus perjalanan dan hal yang umum selfie-kopi dalam ubud dan kepulauan gili, kita tersandung pada puri Dejuma. Ini adalah permata yang benar di pantai yang sepi, tanpa melihat hotel lainnya. Hotel baru dengan karyawan yang baik dan memberikan kembali kepada masyarakat. Staf adalah ramah dan tulus, dan tarif kamar adalah mengejutkan rendah untuk seperti properti yang sangat bagus. Ini adalah kedua kalinya di tur di sawah (dan ilmu pelayaran dua ekor sapi yang menggarap sawah) tidak boleh dilewatkan. Apa yang lebih, komunitas di sekitarnya adalah bagus.",5
76, Puri Dajuma Cottages,"Saya bepergian dengan 4 y tua dan berusia 2y. Dari awal anak-anak saya merasa di rumah, bersih gubrisan dari semua orang dan kita bisa benar-benar merasa seperti mereka senang bekerja di sana.  Di australia mereka mengatakan langsar istri hidup bahagia. Saya katakan staf bahagia, bahagia tamu! Hotel ini terletak di tempat yang ideal, pemandangan di laut adalah luar biasa dan kami menikmati pantai penduduk setempat banyak yang menciptakan suasana yang benar-benar baik.  begitu sering. Aku merasa tertekan, hanya melihat menyedihka penduduk setempat yang mencoba untuk menjual mereka cukup! Tidak apa-apa seperti itu di puri dajuma: anak-anak saya bermain setiap hari di pantai, menemukan kegembiraan berlar dengan uktab dll. Apa yang saya sangat menikmati adalah komitmen dari properti…",5
77, Puri Dajuma Cottages,"Sanggraloka ini berjarak sekitar 2.5hrs dari bandara dan berada tepat di depan laut, sehingga hotel ini ideal untuk mereka yang ingin liburan yang tenang dan santai. Aku terutama suka bahwa ini adalah sanggraloka kecil dengan jumlah terbatas pondok agar anda tidak kewalahan oleh kelompok besar tamu.  Aku tinggal di vip cottage yang langsung menghadap ke laut dan menghadap ke kolam renang di laguna. Pondok sangat luas dan terawat dengan baik. Kolam renang adalah laguna yang besar dengan halaman rumput ukuran dan ada banyak ruang untuk berjemur. Pasir di pantai pribadi sangat baik tetapi tidak akan terkejut bahwa hotel ini di gemerlap warna hitam. Air adalah agak dangkal sehingga jika anda ingin berenang, anda perlu berjalan 10 - 15 menit ke sisi lain dari pantai.   Tidak ada…",5
78, Puri Dajuma Cottages,"Saya baru-baru ini menghabiskan empat malam di ini eko-wisata yang tenang dan terletak jauh dari pusat wisata utama. Kamar-kamarnya yang bergaya bali, dua suite untuk sebuah gubuk, cukup tapi pilihan perabot, kamar mandi dengan shower luar ruangan yang dingin ditambah amenties. Penekanan di sini adalah pada lingkungan, misalnya kamar-kamar tersebut dilengkapi dengan lampu pijar yang hemat enery dan gubuk memiliki budaya jendela untuk menjaga matahari keluar. Karena itu kamar dapat sedikit gelap. Hotel menawarkan wifi gratis, tapi itu tidak stabil ketika cuaca buruk.  Kolam renang adalah terpelihara dengan baik, air panas yang menyegarkan. Hotel ini memiliki spa yang saya tidak menggunakan, tapi yang lain di partai saya telah pijat kami yang puas. Dengan harga yang jauh lebih…",5
79, Puri Dajuma Cottages,"Tempat ini luar biasa! Nilai besar, lokasi yang sempurna dan cottage sangat luas dan romantis. Kami makan semua makanan kami di sana. Sarapan yang disertakan adalah hebat dan semua makanan yang lezat! Tempat yang sempurna untuk liburan romantis tanpa hambatan. Perjalanan panjang dari bandara tapi itu layak.",5
80, Puri Dajuma Cottages,"Mereka mengatakan bahwa ini adalah tempat mimpi-mimpi anda, well, untuk saya yang telah terjadi. Terima kasih untuk ini lokasi yang menakjubkan, pegawai yang kami telah memiliki pengalaman hebat di sana. Ingin kembali ke sana untuk mengambil pelajaran surfing dengan mereka dan menikmati salah satu pemandangan menakjubkan di sarapan yang luar biasa.",5
81, Puri Dajuma Cottages,"Indah lokasi indah, jauh dari kebisingan tak tertahankan dari denpasar dan nusa dua. Bangunan yang indah, dikelilingi oleh kebun bunga di mana-mana di pantai. Untuk resor kecil ini memang sangat lengkap - hotel ini memiliki segala sesuatu yang kita inginkan dan banyak lagi. Satu-satunya negatif adalah perjalanan ke/dari bandara - anda harus berhati-hati dengan penuh perhatian untuk menghindari apa yang dapat cukup murah di denpasar.",5
82, Puri Dajuma Cottages,"Kami pergi ke puri dajuma's restoran untuk makan malam dengan teman-teman kita yang tinggal sangat dekat oleh. Setelah memesan anggur (yang adalah benar-benar salah satu hanya baik aspek dari malam ini, staff juga cukup ramah), kami memutuskan untuk memesan bebek renyah dan ikan lokal yang dimasak dalam daun pisang (kedua diberi label sebagai dajuma februari). Itu membawa kami beberapa waktu untuk memutuskan apa yang kita inginkan untuk memesan karena me adalah ridiculously besar. Bagaimana dapat mereka menjamin bahwa setiap hidangan dimasak dengan bahan-bahan segar yang banyak me? Sayangnya, makanan yang benar-benar termakan. Bebek goreng punya unappetizingly warna abu-abu, adalah matang dan sangat kenyal. Ikan juga matang dan terasa sangat ""mencurigakan"", yang tidak pernah…",1
