,hotel,review,stars
120, Puri Dajuma Cottages,"Kami ingin mengucapkan terima kasih hotel untuk itu-....... cleaninest, taman yang indah, makanan besar dan harga yang benar-benar baik bersama dengan minuman.kamar kami menakjubkan begitu besar dan dengan 2 kamar mandi, di satu sisi dan mandi keluar sisi dalam sebuah taman yang indah. Kami memiliki ruangan vip yang begitu dekat laut. Bunga-bunga yang diletakkan di kamar kami yang indah, tidak satu pengaturan tapi 4 jenis... semua kamar memiliki tempat tidur gantung keluar sisi yang besar, mereka juga lama depan pantai bagi orang-orang...Ada kolam renang adalah berkilau bersih. yang sementara Anda berenang Anda dingin melihat laut...Mereka menyediakan tubuh papan bagi orang untuk menggunakan tanpa biaya. Memiliki pantai pasir hitam dan ada sebuah desa nelayan kecil ada, Anda…",5
121, Puri Dajuma Cottages,"Terpikat ke daerah ini Bali dengan ombak dan menemukan hari-hari kami di Puri Dajuma santai dan sangat menyenangkan. .Selamat datang di es handuk jus segera diproduksi untuk kami dan kami onarrival sopir dan upgrade room untuk melihat langsung di pantai yang ditunggu. Manajemen benar-benar peduli dengan tayangan kami dan resor disimpan dalam kondisi sangat baik dengan taman-taman tropis yang terawat, renang indah dan kamar yang sangat menarik. Restoran sayang kecil, tapi kami itu terisolasi sehingga melakukan berharap bahwa akan terjadi.  Taksi kembali ke daerah Legian biaya sekitar 400.000 rupiah. Melihat Balian di jalan.",5
122, Puri Dajuma Cottages,"Pacarku dan aku tinggal beberapa minggu di Puri Dajuma. Sebelum ini, kami melakukan perjalanan di seluruh Indonesia (Jawa, Bali dan Lombok) dan lokasi ini adalah salah satu tempat paling favorit kami di negara.   Apa yang membawa kita ke daerah ini adalah berselancar. Puri Dajuma adalah tentang 15-menit berjalan kaki ke istirahat panjang kiri Medewi. Daerah ini sangat baik untuk pemula peselancar mencari gelombang kasual.   Puri Dajuma sangat rendah dan sempurna jika Anda ingin mendapatkan jauh dari keramaian & hiruk-pikuk daerah turis Bali. Terletak tepat di pantai pasir hitam, kami menikmati berjalan di sepanjang pantai dan mengambil foto dari semua sapi dan ayam yang hidup oleh hotel. Setelah hari yang panjang berselancar, kita mencintai datang kembali ke besar kolam renang…",5
123, Puri Dajuma Cottages,"Kami baru-baru ini tinggal selama seminggu di Puri Dajuma Cottages dan melebihi harapan. Hotel terselip jauh dari jalan utama di semenanjung, jadi itu tenang dan semua Anda dapat mendengar suara laut, terutama pada malam hari. Dajuma hits tanda di semua bidang. Tidak ada yang terlalu banyak kesulitan untuk staf. Mereka ramah dan membantu, dan akan membuat Anda mana pun Anda ingin pergi. Medewi titik drop off dan memilih untuk surfing setiap hari adalah tidak ada masalah. Cottage besar, bersih dan mencakup pribadi outdoor mandi air dingin. Kebun Cottages sangat baik dilakukan. Restoran memiliki besar makanan, dan adalah duduk dengan baik untuk menikmati pemandangan di kedua arah sepanjang pantai. Kolam itu sempurna untuk membuang-buang jauh hari-hari, dan pantai adalah tempat…",5
124, Puri Dajuma Cottages,"tempat yang sangat bagus untuk tinggal! ramah orang, bungalow bagus dan bersih. Taman adalah pantai indah, baik, makanan yang sangat baik dan banyak hal yang harus dilakukan. apa yang bisa saya katakan lebih?? Anda harus pergi ke sana dan melihatnya!",5
125, Puri Dajuma Cottages,"Kami baru-baru ini tinggal satu malam di Puri Dajuma Cottages dan menikmati kami tinggal sangat banyak. Hotel terletak di Tanjung Medewi pada mengitari tanah berbatu di antara 2 pantai. Ini adalah daerah yang besar untuk berjalan tenang di pantai. Taman-taman indah dipelihara sebagai Cottage dan restoran. Pondok kami yang sangat bagus dengan tempat tidur yang sangat nyaman. Satu-satunya hal yang hilang adalah beberapa kamar mandi mandi - ada hanya satu kue yang sangat kecil sabun dan topi mandi akan dihargai. Untungnya aku mengambil beberapa nyamuk kamar semprot dengan saya karena tidak ada nyamuk kumparan atau setara di ruang. Namun, ada beberapa Losion Anti nyamuk disediakan. Aku selalu tertarik untuk mengapa hotel di Bali biasanya menyediakan seperti handuk mandi kecil. Makan…",4
