,hotel,review,stars
83, Puri Dajuma Cottages,"Sebuah hotel yang indah untuk menemukan. Unik di tempat ini indah dan pelayanan dan makanannya sangat bagus.  Pertama kami datang di malam hari dan kami mengambil villa karena dari khusus kayu terasa. Kami kemudian berubah ke gold ruang karena itu sedikit lebih tenang. Keduanya adalah menakjubkan.  Dan apa kejutan yang indah di pagi hari ketika kami melihat sekitar dan rincian bahwa puri dajuma ""permata"" hotel. Ini seharusnya menjadi sebuah 7-star untuk kecantikan. begitu banyak rincian, berkebun untuk menemukan dan di total harmoni dengan alam. Semua itu tetapi dalam kemewahan adalah pasti langka saat ini.  Pelayanannya tanpa cela dan makanannya (meskipun besar dan sulit untuk memilih kadang-kadang karena ada begitu banyak pilihan di menu; ) adalah hanya sempurna.  Campuran jus…",5
84, Puri Dajuma Cottages,"Kami memesan lokasi ini selama kami bali pulang pergi setelah membaca tentang di tripadvisor melalui telepon. Reservasi adalah mudah dan ramah. Hotel ini memiliki mereka mengirim driver untuk menjemput kami di tulamben, apa yang bagus 4 jam Bustrip dengan beberapa istirahat untuk mengambil gambar dan memiliki kopi bersama dengan kami driver yang ramah dengan sempurna.  Kami menginap selama 6 malam yang diatur di vip cottage. Itu bersih, cukup dan sangat nyaman tempat. Kami memiliki enjoied sana setiap menit.  Restoran yang menawarkan baik makanan dan minuman. Staf adalah sangat ramah dan membantu. Kolam renang adalah sangat besar dan dari di mana-mana di lantai anda memiliki pemandangan yang sangat bagus ke laut.  Jika kami kembali ke Westbali lagi, puri dajuma akan menjadi…",5
85, Puri Dajuma Cottages,"Kami terbang ke Depensar dan pada saat kedatangan tidak memiliki transportasi karena diatur sebelumnya dengan hotel dan harus membayar untuk tiga jam perjalanan taksi ke hotel, yang tidak awal yang baik untuk kami tinggal. Kami memiliki perjalanan memelihara rambut di bali jalan, tapi tiba dengan selamat. Kami tidak memiliki transportasi gratis kembali ke bandara di akhir persinggahan kami dan itu rupanya karena masalah komputer, yang mengakibatkan mereka tidak menerima konfirmasi kami rincian penerbangan dll. Pada saat kedatangan kami disambut oleh penerima tamu yang ramah dan ditampilkan ke pondok kami.  Taman yang indah dengan jalur berbatu, dan pohon-pohon, semak-semak dan bunga di mana-mana. Akomodasi adalah bersih dan baik dilengkapi kamar besar, dengan poster empat tempat…",5
86, Puri Dajuma Cottages,"Kami telah hanya kembali dari liburan 10 hari (2 pasangan) di bali dan mulai pertama kami 3 hari di puri dajuma eco resort. Luar biasa! Staf, cottages, view dan kolam renang membuat kami berharap kami tinggal selama 10 hari! Lokasinya terpencil dan bersih sementara pondok ini hanya cantik! Staf adalah beberapa dari orang-orang paling ramah yang pernah kami temui! Tempat ini sudah pasti merupakan harta karun. Terima kasih untuk bagian terbaik dari perjalanan kami di bali (dan lezat air kelapa :) !",5
87, Puri Dajuma Cottages,"Hanya menakjubkan. Putri saya yang berusia 10 tahun dan saya tinggal selama enam malam di sini dan mereka enam hari terbaik yang pernah ada! Butuh waktu tiga jam untuk mendapatkan dari bandara ke sini, tapi segera setelah kami tiba kami diperlakukan secara pribadi oleh setiap anggota staf. Oleh hari kedua staf tahu nama kami dan tidak mungkin lebih perhatian dan ramah. Tidak ada terlalu banyak masalah bagi mereka untuk membuat perjalanan kami khusus.  Kami menginap di the gold suite yang sangat mulia - kamar yang besar dengan kamar mandi yang terpisah, termasuk jacuzzi dan mandi luar. Fasilitas yang sangat baik dan juga memiliki balkon yang indah dengan kursi untuk duduk di luar.  Kegiatan yang disponsori oleh hotel ini sangat baik - kami melakukan kelas memasak dua kali karena…",5
88, Puri Dajuma Cottages,"Kami telah mengambil mobil di kuta dan kami berkeliling bali. Saya melihat di trip advisor untuk hotel di medewi daerah. Puri dajuma datang ke nomor satu rated hotel, tapi itu sedikit lebih dari harga biasa untuk keluarga kami dari empat, bahkan dengan 55% off seperti yang ditunjukkan dalam pemesanan. com tapi karena kami melewati hotel kami memutuskan untuk melihat di sekitar.  Ini adalah benar-benar hotel yang indah dengan alasan yang indah, staf dan lokasi. Kami diperlihatkan terkemuka vila dua kamar tidur yang tidur 6. Segala sesuatu tentang hotel ini adalah kelas pertama. Hotel ini memiliki segala yang anda inginkan. Sayangnya di musim tinggi harga $600 aud per malam itu sedikit terlalu banyak untuk disertakan dalam kami 3 minggu liburan. Untungnya karena pembatalan itu…",5
89, Puri Dajuma Cottages,"Menghadap ke laut, dan teluk yang indah. Puri dajuma memiliki lokasi sempurna bagi mereka yang ingin untuk menjauh dari semua itu dan merasakan cara bali harus. Staf hotel sangat hangat dan ramah. Kamar bergaya bungalow tradisional bali. Lantai dasarnya terjaga dengan indah. Menonton perahu nelayan datang dan pergi dari pandangan anda dari restoran santai. Tidak jauh dari restoran makanan laut yang sangat baik dan berselancar di medewi. Semua sama pengalaman yang indah ",4
90, Puri Dajuma Cottages,"Hotel sangat bagus. Karena taman yang rimbun, cottage sangat tenang dan memberikan privasi besar. Menu makanan besar, adil harga makanan dan minuman. Semua staf sangat bagus. Pantai adalah luar biasa, seperti yang anda bisa berjalan untuk mil di setiap arah dan hanya satu orang lain di pantai itu beberapa anak-anak lokal dan nelayan. Ini adalah tempat yang sempurna untuk pergi jika anda ingin r&r di indah, tenang, santai lokasi.  Saya menemukan ini benar-benar aneh bahwa hotel harga semua aktivitas di euro - ini sangat mengganggu karena tagihan akhir adalah tetap dikenakan biaya dalam rupiah. Hanya sebagai fyi, kami diberitahu di bandara oleh sopir taksi itu adalah 4 jam perjalanan ke hotel dan beberapa dari mereka ingin biaya hingga 900 000. Kami mengatur collection langsung…",5
91, Puri Dajuma Cottages,"Saya dan saya tinggal untuk 1night keluarga yang indah. Kami memesan 1 jam sebelum kedatangan kami kami memesan cottage 2. Ketika kami tiba kami memiliki minuman selamat datang dan mereka bahkan tidak tahu kami telah memesan dengan mereka, bukannya 2 cottage kami memiliki 1 dengan 2 kamar tidur tetapi semuanya baik, sopan staf di semua. ",4
92, Puri Dajuma Cottages,"hotel yang sangat bagus! Wilayah indah, staf yang ramah, dalam suara dari laut. Makanan yang baik. Sempurna untuk orang-orang yang ingin bersantai. Terlalu jauh dari pusat kota (3hours). Tapi! Jika u perlu - anda dapat mengambil mobil dengan sopir dari hotel. Best cocok untuk tempat ini! Maria & vladimir",5
93, Puri Dajuma Cottages,"Telah hanya menghabiskan 10 hari yang menyenangkan di hotel ini indah. Lokasinya luar biasa, berjalan-jalan di sepanjang pantai, pemandangan matahari terbenam dan layanan tingkat pertama. Staf tidak bisa disalahkan, semua sangat bangga hotel mereka dan desa mereka. Saya menemukan makanan untuk menjadi bervariasi dan sangat wajar. Jujur. Saya tidak bisa menemukan kekurangan-puncak hari, bersama dengan matahari terbenam adalah tontonan dari nelayan lokal untuk malam keempat tempat memancing. Aku akan kembali secepat mungkin.",5
94, Puri Dajuma Cottages,"Tanpa banyak berpikir, kami memesan cottage di puri dajuma 1 hotel di bali, 3 bulan sebelum perjalanan kami. Kami tidak melakukan penelitian yang besar, semua kami tahu bahwa kami tidak ingin mal besar dengan ribuan kamar di lantai 50, tetapi tempat yang tenang, dengan pemandangan laut. Kami tidak bisa berharap untuk lebih baik. Setelah penerbangan panjang 2, dan 3 jam berjalan untuk hotel di taksi, kami akhirnya mencapai tujuan kami - dan kami menyukainya! Itu indah, indah dan berkesan. Dengan 2 minuman semangka selamat datang dengan bangga kami pergi ke pondok kami, dibantu oleh pegawai yang tersenyum dan membantu. The cottage enak dengan berbagai tarrace, kursi, tempat tidur gantung, ranjang berukuran king, kamar mandi, pancuran luar pribadi, ketel listrik, teh dan kopi dan…",5
95, Puri Dajuma Cottages,"Kami tinggal 4 malam di salah satu pondok 18 yang dibangun di taman tropis yang menggoda yang menghadap ke laut. Lokasi tenang dengan panjang sepi pantai berjalan ketika belok kiri atau kanan dari hotel. Renang di depan hotel tidak disarankan tapi kami tepat memberikan akses ke surf dicuci pantai berpasir yang hotel ini merekomendasikan untuk berenang. Kolam renang hotel adalah terpelihara dengan baik tetapi dalam dan sangat mengundang untuk berenang. Makanan adalah sedikit mengecewakan dengan lebih dari 90 hidangan yang membingungkan yang ditawarkan di menu, menu kecil yang mungkin telah membantu dalam meningkatkan kualitas makanan yang ditawarkan. Restoran jepang yang diharapkan dan itu lebih dekat untuk makanan cina dari jepang. Semua stafnya sangat baik, termasuk yang masih…",4
96, Puri Dajuma Cottages,Hotel yang bagus di pinggir laut di medewi. Staf sangat baik. Tempat yang bagus untuk bersantai dan mengambil beberapa matahari di sekitar kolam renang yang bersih yang bagus. Makanan hanya rata-rata dengan sarapan adalah terbaik. Ada benar-benar tidak ada kegiatan di resor jadi bersiaplah untuk bersantai. Saya suka telepon yang terpasang untuk kelapa pohon di sekitar kolam renang di mana anda bisa memesan makanan dan minuman. Akan tinggal di sini lagi. ,4
97, Puri Dajuma Cottages,"sangat charming house untuk dua pasangan, atau beberapa dengan anak-anak. Semua adalah hangat besar bahan-bahan alami seperti kayu, kerikil, marmer dll. baik nilai untuk uang. Great view, laut hampir di kaki anda ketika anda berbaring di tempat tidur! Kami mencintai duduk di balkon dan mendengarkan breakers di ruang ke rocks Kami tidak sangat terkesan dengan restoran ini tapi itu tidak benar-benar buruk.",4
98, Puri Dajuma Cottages,"Ini hanya 20 kamar hotel besar, terletak di provinsi negara, menawarkan kemungkinan yang sangat baik untuk bersantai, meskipun panjang program aktivitas, juga dapat membuat anda sibuk setiap hari dengan snorkeling, menyelam, tur budaya dan sehat, menjelajahi berapi di jawa atau bahkan farm beberapa nasi bali cara. Hotel ini memiliki kolam yang indah dengan pemandangan ke laut. Semua apartemen baik dilengkapi. Jangan berharap tv kabel, meskipun wifi bekerja baik. Hotel ini juga menawarkan spa dan kelas yoga di pencil rumah, dan seperti biasa berselancar, bodyboard dan dayung kesempatan. Restoran bekerja fm 7am untuk 11pm dengan pilihan yang bagus dari hidangan lokal dan internasional. Ada juga alternatif lain untuk makanan jepang berdasarkan permintaan. Namun yang paling penting…",5
99, Puri Dajuma Cottages,"Kami awalnya berjalan ke bawah untuk dajuma untuk makanan yang baik, tapi kemudian menanyakan di kamar. Chris menunjukkan kepada kita di sekitar dan kami pindah di. Memiliki 2 malam di the gold suite, kemudian 5 malam di salah satu pondok biasa.   The cottages, apapun dari mereka, akan memuaskan anda. Mereka luas, nyaman dan memiliki segala sesuatu yang anda inginkan. Meja dan kursi (di dalam dan di luar), four-poster dengan kelambu terbang, ac, kipas angin, kamar mandi di dalam dengan pancuran taman, lemari pakaian, aman kecil, tempat tidur gantung di beranda. Beberapa memiliki pemandangan samudera, beberapa memiliki pemandangan ke arah taman. Semuanya relatif pribadi.   Gold suite adalah fantastis. Pancuran mandi luar ruangan yang indah melihat east sepanjang pantai, jacuzzi,…",5
100, Puri Dajuma Cottages,"tertidur dengan suara ombak, bangun dengan suara gelombang, setelah sarapan di bawah palm tree, setelah makan malam di depan cahaya lilin, ini adalah kehidupan dajuma. Pertama timet untuk west bali, jatuh cinta dengan itu segera, meskipun ini adalah jauh dari semua tempat terkenal di bali, hotel ini memiliki segala sesuatu yang anda inginkan dari bali, resor tenang yang nyaman, orang-orang yang menyenangkan dengan layanan sempurna, tenang desa dengan ikan sawah padi yang indah, pantai pasir hitam dengan matahari terbenam yang luar biasa, yang misterius, taman nasional bali, yang terbaik di bawah taman air dekat menjagan pulau... apa lagi yang anda bisa melihat untuk dari pulau indah ini? Datang ke dajuma, anda akan tahu mengapa begitu banyak orang mencintai di sini, sama seperti…",5
101, Puri Dajuma Cottages,"Kami menghabiskan minggu pertama kami di dajuma ketika kami tiba di bali. Itu cukup perjalanan panjang setelah penerbangan yang sangat panjang, tapi sangat layak. Ada tidak ada yang lain dekat dengan resor, hanya pasir tak berujung dengan ombak yang menyenangkan untuk body boarding, dan anak kami menangkap beberapa yang juga papan selancar. Taman-taman yang rimbun dengan banyak pohon dan bunga-bunga cantik, semuanya adalah indah dipelihara. Staf sangat ramah dan mendorong untuk berbincang dengan tamu. Kamarnya sangat luas, sangat bersih dan nyaman dengan teras pribadi. Restoran menyediakan makanan lezat, anda bisa memesan minuman di kolam renang, salah satu highlights kami adalah duduk di kursi di kolam renang, minum-minum kami kelapa. Yang 20 menit berjalan kaki di sepanjang…",5
102, Puri Dajuma Cottages,"Jika anda mencari suatu tempat khusus untuk benar-benar beristirahat saya dapat merekomendasikan tempat ini. Tidak banyak untuk melakukan, tetapi ada transportasi ke kota jika anda ingin pergi keluar dan melihat-lihat. Mencintai kamar kami... bersih, nice dekorasi dan pemandangan laut. Lokasi ini indah... tepat di pantai. Kami makan semua makanan kami di resort dan menikmati semua orang dari mereka.",5
103, Puri Dajuma Cottages,"Kami tinggal 3 malam di villa, kami tinggal tidak cukup meskipun, pasangan lain malam akan menjadi sempurna! Apa cara yang indah untuk mengakhiri 3 minggu liburan, melakukan apa-apa! Villa adalah hanya menakjubkan, indah dihiasi dan pemandangan yang paling menakjubkan dari awseome beach. The villa akan harus menjadi tempat terbaik di seluruh resor. Staf di puri dajuma adalah yang terbaik, sangat membantu, ramah, pelayanan yang terbaik dari seluruh hari libur dan kami memiliki beberapa besar staf di mana-mana kami bepergian liburan ini. Pantai sangat bagus, sangat bersih dan bagus untuk berenang di. Kami makan di restuarant sarapan, makan siang dan teh. Makanan yang tidak yang terbaik yang kami punya tapi ada pasti ada yang salah dengan itu baik. Saya akan sangat merekomendasikan…",5
104, Puri Dajuma Cottages,"Lokasi adalah sempurna, tepat di pantai. Menonton nelayan setempat pergi keluar di malam hari hanya sebelum matahari terbenam dan kemudian datang kembali keesokan paginya adalah jujur yang paling menarik dari tempat ini. Akomodasi adalah bersih dan luas, namun tidak ada yang banyak yang harus dilakukan di malam hari selain membaca dan bermain kartu karena tidak ada televisi di kamar dan kami menemukan tidak ada restoran atau hiburan lainnya berada dalam jarak berjalan kaki dari resort. Saya punya laptop saya meskipun dan kami diizinkan untuk meminjam video dari hotel untuk istirahat kebosanan. Tetapi kekecewaan terbesar adalah makanan. Itu mengerikan dan ketika tidak ada pilihan lain di tempat. Saya benar-benar berpikir mereka bisa membuat makanan yang prioritas. Saya menemukan…",3
105, Puri Dajuma Cottages,"Saya menginap di puri dajuma untuk kedua kalinya pada bulan mei dengan pasangan saya. Lagi, itu adalah sorotan dari perjalanan ini. Lokasi yang indah dan tenang dengan layanan yang sangat baik dari semua staf yang selalu lebih dari senang untuk membantu dalam bagaimanapun mereka bisa. Kamar kami yang sangat nyaman dan makanan yang lezat dengan banyak pilihan untuk dipilih termasuk teppanyaki restoran sanggraloka yang terpisah. Banyak terima kasih kepada semua staf hotel dan terutama Jufri, kode, bayu dan yudi. Kami akan melihat anda segera.",5
106, Puri Dajuma Cottages,"Wow, Puri Dajuma! Apa yang luar biasa terpelihara dengan baik dan staf layanan yang sangat baik tempat untuk tinggal, sementara di barat bali. Kamar besar, laut sangat indah, halamannya terjaga dengan sempurna. Service ada 10 keluar 10, apa pun yang anda butuhkan mereka akan mengurus. Saya menginap adalah 20 hari. Itu waktu yang lama berada di satu tempat, tapi saya dapat memberitahu anda segala sesuatu di sana adalah yang terbaik yang bisa. Saya sangat merekomendasikan tempat ini untuk setiap keperluan anda memiliki dekat daerah negara. Terima kasih Rondi, bayu, eddie dan staf yang lain. Craig Martinkus/As",5
107, Puri Dajuma Cottages,"Resor ini terletak di bagian pulau yang terpencil. Suasananya tenang, taman adalah diurus dengan sangat baik dan staf super ramah. Kami pergi di sini beberapa kali untuk makan siang dan meskipun harga untuk makanan lebih mahal daripada di tempat lain, ini adalah benar-benar layak untuk menghabiskan beberapa santai dan romantis kami di sana.",4
108, Puri Dajuma Cottages,"Kami menemukan di luar sana Suite Silver baru dengan 2 kamar tidur di hotel ini, memesan lama yang lalu, dan mendapat diskon khusus. Datang dari Mengwi oleh mobil sewaan, dan tempat ini mudah untuk menemukan, banyak tanda-tanda sepanjang jalan. Indah ruang tunggu, staf yang ramah, nikmat koktail Selamat datang. Suite Silver kami adalah benar-benar mengagumkan, baru, luas ruang dengan dapur, 2 kamar tidur, kamar mandi besar dengan banyak baru handuk dan sabun, bathfoam dll. Di bagian atas atap ada adalah balkon yang luas dengan pemandangan laut yang indah. Kamar lain yang semua dengan menghubungkan pintu, begitu juga ideal untuk keluarga. Kami pergi langsung ke pantai, bersih dan sepi, dan ada upacara yang berlangsung, yang kami diundang. Begitu istimewa...Setelah kembali di…",5
109, Puri Dajuma Cottages,"Tinggal selama 8 hari di pertengahan Juni. Kami mengambil di Seminyak dan didorong untuk resor sepanjang jalan sangat sibuk dan sempit - sekitar 2 jam. Resor ini cukup terisolasi tetapi jika Anda ingin kedamaian dan ketenangan ini adalah tempat untuk pergi. Kami memiliki dua sebelah cottage, satu untuk kami dan satu untuk anak kami dan istri dan bayi. Cottage yang tenang dan diabaikan kolam renang dan laut melalui pohon-pohon dan semak-semak. Itu adalah salah satu paling santai liburan kami telah. Putera dan menantunya kami menikmati surfing pagi di Medewi dan Balian sementara kami menikmati menjaga putri kami grand. Cuaca adalah menyenangkan, duduk di tepi kolam renang atau berjalan di sepanjang pantai. Kami hanya melakukan satu hari tour ke Ubud. Staf semua sangat ramah dan…",5
110, Puri Dajuma Cottages,"Tempat ini itu indah. Staf penuh perhatian, sopan dan pengaturan yang benar-benar baik. Mereka memakai hiasan bunga indah bulan madu kami tidur untuk kedatangan kami yang sentuhan yang hebat.  Kami memesan tempat ini karena kami ingin berselancar di Medewi di dekatnya. Sempurna itu berhasil karena mereka memiliki layanan antar-jemput gratis yang akan membawa Anda gratis dari pantai dan setiap kali Anda sukai (untuk berselancar di pagi hari).  Ruangan itu jauh lebih baik daripada yang saya harapkan untuk harga.  Makanan yang ok, tapi tidak ada yang istimewa. Saya pikir jika mereka ditingkatkan itu sedikit, mungkin dibuat lebih banyak menggunakan pengaturan Teriyaki restoran dan hanya digunakan yang lain untuk sarapan/makan malam, maka mereka mungkin bisa mengenakan tingkat yang…",5
111, Puri Dajuma Cottages,"Ruangan itu benar-benar bagus dan bersih. Kami mencintai semua hal ekstra kecil seperti bunga kecil seluruh ruangan, fruitplatter ketika Anda tiba. Kursi yang baik di dalam maupun di luar ruangan. Taman disimpan dengan baik dan bagus longchairs sekitar renang luar ruangan dengan pemandangan laut. Makanan yang baik dan bagus layanan. Sangat baik untuk memiliki beberapa santai hari karena tidak ada banyak yang harus dilakukan di lingkungan. Mereka menawarkan baik kunjungan.",5
112, Puri Dajuma Cottages,"Ini adalah sebuah tempat untuk tinggal, bahkan sulit kita tidak berada di bulan madu. Sangat baik tempat untuk bersantai, menikmati lingkungan dan merasa apa liburan. Sangat ramah dan membantu staf! Makanan yang baik dan baik koktail:) Jika Anda ingin berselancar, di dekatnya adalah tempat Medewi-pantai; baik gelombang (dan banyak batu). Bagi kami itu adalah awal yang baik untuk liburan kami!  Roland dan Nora",5
113, Puri Dajuma Cottages,"Ini adalah waktu kita kedua di Puri dajuma, tiba malam Natal dan kiri tahun baru hari, menikmati liburan lagi.Kamar besar dan sangat bersih, makanan yang besar dan kami pikir harga benar-benar baik. Staf yang indah, sangat ramah dan membantu dari tukang kebun untuk manajemen. Tidak ada masalah dengan mereka. Kami pergi dengan putri kami dan dia agak berumur 6 tahun anak laki-laki dan mereka menyukainya juga dan staf yang sangat baik untuk cucu kami sedikit. Taman-taman indah dan baik terus. Salah satu hal terbaik yang ada ada pijat medis, yang kami telah sehari-hari dan terima kasih kepada mereka aku bisa tahu berjalan tumpukan lebih baik.Kami suka berjalan di sepanjang pantai menonton perahu nelayan akan dan datang dan orang-orang yang sangat ramah.Kami berharap bahwa kita…",5
114, Puri Dajuma Cottages,Kami mencintai kami tinggal di Puri Dajuma could'nt staf telah lebih membantu dan ramah. Kami tidak benar-benar terkesan dengan Cottage yang benar-benar luas dan bersih. Aku suka mandi luar hutan hujan!  Resor ini adalah cara yang dan dan Anda benar-benar merasa seolah-olah Anda melihat Bali nyata. Orang-orang lokal benar-benar ramah dan dan lebih dari senang untuk berhenti dan chatting.  Karena Anda begitu keluar dari jalan ada tidak ada penjaja dan itu indah untuk berjalan-jalan sepanjang pantai dan melihat dunia pergi dalam damai. Hotel menyediakan surfing papan dan papan tubuh dan kami bersenang-senang mencoba untuk berselancar! Mereka juga menyediakan Lift ke lokal kota dan surfing pantai setiap kali kami fanced perubahan pemandangan. Makanan yang benar-benar baik. Dan kami…,4
115, Puri Dajuma Cottages,"Kami tinggal di ruangan Seaview selama 3 malam. Nice ruangan besar, besar tempat tidur nyaman dengan kelambu jika diperlukan., aman, frig, A/C, penggemar, tidak ada TV. Taman indah yang mengarah ke pantai depan. Kami berdua memiliki pijat gratis dengan Yuni yang baik. Staf dalam penerimaan yang sangat ramah tetapi kami menemukan beberapa restoran staf sangat ramah dan hampir tidak ingin melayani kita. Harga berada di sisi yang tinggi dan ukuran porsi di sisi kecil. Bahkan makanan Bali yang agak hambar dan semua hidangan mencicipi sama. Aku punya botol air dengan es blok dari restoran dan ketika mereka meleleh ada bit dari plastik yang mengambang di kaca, yang tidak mengisi saya penuh dengan keyakinan. Kucing berjalan sepanjang restoran dan kadang-kadang terlihat duduk di meja.…",3
116, Puri Dajuma Cottages,"Indah, sangat terawat resor jauh dari peradaban. Alasan subur, indah tepat di pantai. Hal ini tidak tempat untuk datang jika Anda mencari untuk toko dan nongkrong di kota.  Satu negatif bagi kita, adalah jumlah anak-anak muda di resort selama kami tinggal. Sayangnya, itu membuat duduk kolam-sisi kurang santai. Kolam renang sangat baik tapi tidak besar begitu keras untuk melarikan diri dive-bombing anak-anak dengan orang tua yang membiarkan mereka melakukan apa yang mereka harap.   Spa pengalaman itu sangat bagus dan profesional.   Layanan ini sangat baik - ramah dan penuh perhatian. Kamar yang sangat bersih - outdoor shower dan mendengar gelombang saat Anda tidur yang pasti plus. Jangan berharap TV di sini.   Penyewaan sepeda tampak merek. Sarankan mengambil tumpangan melalui…",4
117, Puri Dajuma Cottages,"Ini adalah tempat yang sangat damai dan indah. Staf ramah dan pelayanan yang baik. Saya suka musik tradisional mereka dalam penerimaan dan jus Selamat datang. Ini adalah tempat terbaik untuk pasangan untuk menghabiskan waktu yang berkualitas bersama-sama. Kami tinggal di sana selama empat malam di bulan madu kami & itu kami kenangan indah. Cottage sangat bersih, besar dan nyaman. Kami merasa seperti kami dari stres dan kebisingan kota. Kita seperti suara gelombang laut di malam hari dan itu adalah tempat terbaik untuk pecinta alam.",5
118, Puri Dajuma Cottages,"Tempat yang indah dan damai...  Indah dan ramah staf...  Pernah di situs tersebut. Kami merasa seperti hilang di alam dan bahwa kami jauh dari kebisingan akhir stres... Hidup adalah manis di Puri Dajuma. Indah kolam renang di depan dari laut, warna yang mengagumkan dan bunga.Surga di bumi untuk mereka yang ingin melihat traditionnal bali... Hotel ini telah membawa kita sisanya kami membutuhkan setelah menjadi sangat lelah karena pernikahan organisasi. Khusus dan hangat berkat indra, juliartha, yudi, bayoo, yuni dan rudy... Terima kasih guys untuk senyum Anda dan kami lama malam di sekitar beachfire...;-) Terima kasih kepada Anda semua untuk memiliki terbuat dari bulan madu kami mimpi indah. Tarik dan saya tidak akan pernah melupakan Anda dan akan kembali secepat mungkin oping…",5
119, Puri Dajuma Cottages,"Ini adalah salah satu tempat langka di mana semua pribadi ramah, bermanfaat dan sangat terlatih. Nice tenang kamar dengan AC sangat baik. Dapur sangat baik di Bali makanan, ke titik di mana kita ingin memberikannya Michelin bintang jika itu tersedia. Tempat yang tepat di tempat yang bagus di mana Bali lama dan orang-orang itu masih bisa dinikmati; jalan pagi untuk desa nelayan tetangga adalah sebuah pengalaman! Kami senang di sini dan setelah ini kedua kalinya kami akan kembali tahun depan pasti. Frits dan Kitty Schmidt",5
