,hotel,review,stars
0, Room & Vespa 4,"Villa indah di lokasi yang strategis, dekat dengan pasar, pengalaman berbelanja dan bersantap. Kami memiliki seorang pria baik yang menjaga kami, membantu dengan pemesanan dan memastikan kami memiliki semua yang ada di villa. Hal-hal yang sangat kecil yang akan kami tingkatkan: tekanan kepala pancuran, dan bau di koridor bisa sedikit kuat. Kami akan merekomendasikan tempat ini untuk teman-teman kita untuk tetap. Terima kasih atas keramahan Anda!",4
1, Room & Vespa 4,"Kami memiliki ruang lantai dasar yang juga bagus dan bagus dan tenang. Dekorasi cantik dan semuanya sangat bersih. Lokasi bagus, sangat dekat dengan Eat Street. Kolam itu sempurna! Kami menemukan kafe kecil yang hebat untuk sarapan murah yang tepat di depan rumah kami - yang sangat bagus karena kamar dengan vespa 4 tidak menyediakan makanan sama sekali",5
2, Room & Vespa 4,"Jika Anda berencana untuk liburan di Bali, memilih akomodasi dengan kolam renang luar ruangan sepertinya merupakan hal wajib yang harus dilakukan. Di Kamar & Vespa, ini persis apa yang akan Anda dapatkan. Saya suka fakta kolam renang baik fungsional untuk tujuan mencelupkan dan berenang (jika Anda perlu membakar kalori dari makanan lezat lokal yang mengagumkan). Kamarnya nyaman dan luas, dengan desain yang apik tanpa harga yang dapat merusak rekening bank Anda. Dan mereka memiliki jubah yang paling nyaman! Aku bersumpah aku tidur di dalamnya, bahan katunnya terlalu nyaman!  Lokasi sangat strategis, 10/15 menit berjalan kaki dari Seminyak square, ada pasar loak terdekat, 5 menit berjalan kaki dari Kudeta Beach Club, ton kafe lokal dan restoran terdekat.  Staf penuh perhatian dan…",5
3, Room & Vespa 4,"Mencintai kami menginap di kamar dan vespa 4!  Kami tiba pukul 10 pagi dan diizinkan untuk check-in lebih awal. Ukuran kamar tepat untuk 2 orang, interior yang dihias dengan baik, indah. Tempat tidur adalah benar-benar nyaman - seprai tebal yang lembut dan bantal berbulu!  Beberapa hal untuk diperbaiki:  - ubin kamar mandi agak usang dan kotor - perlu diganti  - kepala pancuran kotor dan bernoda - perlu beberapa scrubbing  - Pintu kamar mandi tidak menutup sepenuhnya  Kolam itu indah tetapi membutuhkan sedikit pembersihan juga.  Fitur terbaik dari tempat ini adalah lokasinya! Sekitar 3 menit berjalan kaki dari keramaian dan hiruk pikuk Seminyak di mana Anda dapat menemukan satu ton resto dan melakukan semua belanja Anda. Banyak toko-toko dan tempat pertukaran uang juga. Tempat…",4
4, Room & Vespa 4,"Staf yang baik dan nyaman, kamar yang besar (nomor 6 ) . Kolam renang butuh perbaikan dan genteng jatuh di dekat kolam renang lounge pisang. Tempat yang tenang, dekat dengan restoran-restoran, pusat perbelanjaan, pasar loak dan sekitar 500 m dari Pantai Petitenget. Saat ini adalah ok untuk uang yang sama atau kurang ada pilihan yang lebih baik lebih dekat ke Seminyak Square dengan kolam renang dan fasilitas yang lebih baik.",3
5, Room & Vespa 4,"Properti yang bagus dengan kamar yang luas dan area luar ruangan yang ramai dengan kolam renang. Tenang tapi dekat dengan Kudeta, Seminyak Square dan menit di taksi dari Potato Head, Ibu Sippy, Bodyworx. Barang-barang yang indah, selalu bersih. Sangat direkomendasikan.",5
6, Room & Vespa 4,"Kami menginap di kamar dan Vespa 4 untuk 6 malam dan merekomendasikan tempat ini untuk siapapun yang mencari akomodasi murah di Seminyak moderat. Hotel ini di lokasi yang baik: kurang dari 5 menit berjalan kaki ke Ku De Ta/ pantai, sekitar 5 menit berjalan kaki ke Seminyak Square. Ada restoran dengan harga wajar dalam jarak berjalan kaki, termasuk 4 di 'pasar loak' di seberang jalan kecil di mana Vespa terletak. Tempat ini cukup tenang dengan kebisingan jalan. minimal  Kami berada di kamar 1 di lantai dasar. Kamar terbuka ke kolam - semua tiga lantai kamar yang sama. Saya pasti merekomendasikan kamar tingkat dasar, jauh lebih suasana. Kamarnya cukup luas dengan AC dan kipas di langit-langit. Area kamar mandi yang lama dan relatif sempit dengan shower yang besar lubangnya di…",5
7, Room & Vespa 4,"Sangat menyukai tempat ini.  Kamar yang luas dengan perabot yang indah, sekitar $8 - 10 kamar, di lantai bawah dan langkah langsung ke kolam renang. Saya lebih suka lantai atas seperti itu lebih pribadi ketika tirai terbuka, tidak ada balkon tapi jendela yang terbuka ke atap bangunan dari pohon kelapa. Lokasi yang baik untuk berjalan ke Ku De Ta Seminyak Square, tinggal untuk beberapa hari di Seminyak sibuk.",5
8, Room & Vespa 4,"Kami tinggal di sini selama beberapa malam dan itu sangat menyenangkan. Kamarnya besar dan kolam renangnya bagus. Tepat di seberang pasar loak jadi turun sedikit dari pusat utama tetapi ini adalah keuntungan karena sangat murah dan itu benar-benar tenang. Mengambil saya di jalan (belok kanan keluar dari jalan) adalah tempat yang bagus untuk sarapan di Square dengan pasar loak adalah Mai Mai yang makanan dan pelayanan yang luar biasa! Benar-benar merekomendasikan tempat ini, tidak ada negatif.",5
9, Room & Vespa 4,"Berjalan kaki untuk hampir semua fasilitas yang Anda butuhkan, tempat ini sangat tenang dan terpencil. Hotel ini turun gang kecil sebelah pasar loak di Seminyak Dengan Banyak parkir untuk sepeda motor. Banyak restoran dan toko, tetapi harga dapat naik di daerah ini.   Jl. Kayu aya adalah jalan yang sangat sibuk dan kami menemukan itu cukup mudah untuk mendapatkan melalui jalan sempit bahkan di motor, jadi memungkinkan waktu tambahan atau belajar untuk menggunakan banyak jalan-jalan kecil di sekitar wilayah.   Staf yang bagus, sangat ramah dan membantu.",4
10, Room & Vespa 4,"Ketika kami tiba di sana kami terkejut menemukan apa yang tampak seperti sebuah hotel. Kamar kecil gelap berdiri sebagai ruang tamu - tidak ada meja, tidak ada tanda di pintu yang mengatakan bahwa Anda berada di Vespa berharap untuk menemukan staf 4 ., ketika kami tiba untuk check in - di dalam, di salah satu kamar yang membersihkan dan pembersihan.   Ini adalah sebuah villa yang kecil dengan 6 kamar, 3 kamar di lantai dasar, di lantai 3, namun tempat ini adalah sempurna dan staf tidak bisa melakukan lagi untuk anda!   Kamar dan toilet berkilau, handuk lembut & bau indah dan mereka berubah setiap hari. Indah tempat tidur & mandi kuat. Seperti vila tidak memiliki jendela di sisi jalan yang sibuk anda dapat mengharapkan untuk mendapatkan kualitas tidur yang baik.   Tempat ini…",4
11, Room & Vespa 4,"Saya memilih akomodasi ini didasarkan pada ulasan luar biasa. Saya dapat dengan jujur mengatakan hotel ini hidup sampai ke harapan saya. sangat bersih, modern kamar. Kamar dibersihkan setiap hari. AC bekerja sangat baik, tidak ada masalah dengan wifi.   Hotel ini adalah 2 menit berjalan kaki dari Seminyak Square, sebuah lokasi yang ramai dengan gerai retail, restoran & bar.   Namun lokasi tidak mengambil itu merasa tenang, seperti itu adalah terselip jauh dan sangat tenang.   Staf yang luar biasa. Mereka sangat ramah, sangat membantu. Mereka pergi keluar dari jalan mereka untuk membantu Anda.   Saya sangat merekomendasikan ini selain/Hotel. Saya pasti akan tinggal di sini lagi. Itu sangat santai untuk kembali ke setelah hari yang panjang. ",5
12, Room & Vespa 4,Kamar yang sempurna untuk tinggal setelah tiba dari bandara. Ada kolam renang yang bagus dan staf yang sangat ramah dan membantu. Ada tidak ada sarapan tapi ada banyak coffeebars dan tempat lainnya. Pantai adalah 3 - 4 menit berjalan kaki.,5
13, Room & Vespa 4,"Bila Anda ingin menghabiskan malam di akomodasi yang kecil di middel dari kota, ini adalah tempat untuk memilih. Hotel ini memiliki bagus dan dihias dengan baik kamar dan kolam renang yang bagus untuk menyelam setelah hari yang panas di pantai atau di kota. Satu hal yang mereka tidak menawarkan sarapan di pagi hari. ",5
14, Room & Vespa 4,Saya disebut hotel ini oleh seorang teman dan saya sangat senang dia berbagi ini. Ini adalah pengalaman menginap yang sangat bagus! Lokasi kecil tapi layanan hebat dan kamar yang sangat bersih dan nyaman. Staf adalah sangat membantu dalam sempurna dengan berjalan kaki ke beberapa restoran besar dan tempat di Seminyak. Saya pasti akan tinggal di sini lagi.,5
15, Room & Vespa 4,"Saya agak ragu untuk menulis ulasan ini. Hanya karena saya tidak ingin semua orang untuk tinggal di sana dan saya tidak bisa memesan kamar karena dari popularitas dari hotel. Di mana untuk memulai? Hanya enam kamar double, tidak ada anak-anak yang tinggal di sana, kolam renang untuk diri kita sendiri, layanan besar, santai, suasana tenang, perabot yang indah dan dekat ke semua tempat belanja dan besar restoran dan bar. Bepergian pada bulan Februari berarti tidak ada keramaian dan meskipun hujan terkadang udaranya sejuk dan cerah. Harga adalah sangat wajar di hanya $90 AUD per kamar per malam.   Jika Anda akan menjadi sangat pemilih dengan beberapa goresan di dinding dan tekanan air di kamar mandi tidak yang terbaik kadang-kadang kemudian tidak tinggal di sini.",5
16, Room & Vespa 4,"Kami tinggal di ruangan 4, vespa dan dua kali di perjalanan kami ke Bali. Kamarnya didekorasi dengan indah dan sangat besar. Area kolam renangnya sangat indah dan seluruh tempat yang bagus sedikit Oasis jauh dari keramaian dan hiruk pikuk Seminyak. Lokasi yang fantastis, berjalan kaki untuk semua yang Anda butuhkan. Staf yang sangat ramah dan membantu.",5
17, Room & Vespa 4,"Kami segera check out dari hotel kami awalnya memesan dari Perth (mimpi buruk, dinding kertas tipis dan kamar mandi yang bau! ) dan ingin menemukan lokasi yang kami pikir akan menjadi dekat dengan pantai dan tempat perbelanjaan. Temuan yang bagus! Kamar adalah tentang 5 Menit 4, Vespa ke Seminyak Square dan desa seminyak, kopi dan Sisterfields pistol. Kami punya kamar di lantai atas dan terlihat luar biasa - langit-langit yang tinggi, dekorasi yang menawan, Pantai belum tinggi. Kamar mandi bisa menjadi masalah bagi saya dan kamar mandi yang besar dan bagus! Bersih dan ubin marmer # nomould seperti. Saya mencoba untuk berenang setelah hari dan kolam renang adalah menyambut baik di malam hari dan pagi hari sebelum menu. Tidak akan ragu untuk merekomendasikan hotel boutique ini…",5
18, Room & Vespa 4,"Apa yang indah, tenang dan tempat yang bagus untuk tinggal. Hotel ini terletak di tengah Seminyak tapi sangat tenang. Kamarnya luas dan sangat nyaman di pedalaman. Semuanya adalah super bersih. Staf adalah sangat ramah dan membantu - mereka juga menawarkan layanan antar jemput bandara untuk skuter dan harga yang terjangkau. Saya tentu saja akan kembali lagi!",5
19, Room & Vespa 4,"Lokasi yang baik hanya berjalan kaki singkat dari jalan utama Seminyak. Orang yang menjalankan bisnis. Cukup sulit untuk menemukan di tengah dari malam, tetapi sopir taksi sangat membantu dan ketika kami akhirnya menemukan itu, manajer malam bangun dan menunjukkan kepada kita ke kamar. Bagus dan tenang",5
20, Room & Vespa 4,"Mencintai segala sesuatu tentang Kamar dan Vespa 4 kamar besar, sangat bagus kolam renang dengan Sun lounge kami bagaimana gelap dan tidak di bawah sinar matahari, jadi Anda dapat bermalas-malasan selama berjam-jam. Posisi yang bagus mudah berjalan kaki ke toko-toko, dan restoran. Saya terutama menyukai restoran lokal tersembunyi di belakang pasar loak Sate Bali, mereka melakukan kelas memasak juga bagus,  Kamar 4, vespa dan staf yang sangat membantu dan ramah. Ini adalah 1 saya kunjungan ke bali jalan dan saya pasti akan kembali.",5
21, Room & Vespa 4,"Membantu staf yang ramah, besar kamar yang nyaman, dekat dengan segala sesuatu. Menemukan yang hebat di jantung Seminyak. Saya sangat merekomendasikan tempat ini, total nilai untuk uang dalam suasana akrab. Ditambah + + + + + pengalaman",5
22, Room & Vespa 4,"Kami tinggal selama 3 malam dan kami tidak kecewa dengan kamar yang indah dan cerah sempurna dan AC bekerja dengan indah kamar mandi dan kolam renang yang menyegarkan, staf Indah dan Damai dan lokasi yang besar, dekat dengan pantai untuk Pagi berjalan. tidak bisa menunggu sampai kunjungan berikutnya,, suka 4 kamar dan Vespa",5
23, Room & Vespa 4,"Pertama penjemputan di bandara dapat diandalkan dan cepat. Semua email yang ditangani kami di sangat tepat waktu. Untuk harga. Saya tidak kecewa sama sekali, lokasi fantastis, kurang dari 5 menit untuk ke pantai dan restoran Anda akan seperti. Mereka diatur bagi kita untuk memiliki sepeda dalam beberapa menit. Staf di sini yang sangat ramah dan ramah. Kamarnya didekorasi dengan baik dan AC yang dingin. Satu-satunya kekurangan yang saya dapat menyebutkan adalah bahwa kadang-kadang kami tidak punya air panas di mandi kami, hanya hangat-hangat kuku, tapi itu begitu panas di luar sangat baik. Saya akan tinggal di sini lagi. Paling pasti!",4
24, Room & Vespa 4,"Kelebihan: lokasi yang baik untuk pantai, ku de ta dan toko-toko dan restoran di Seminyak, sangat tenang, sangat baik dihiasi kamar dan kolam renang yang bagus, membantu staf, pelayanan yang baik  Kekurangan: dinding kamar mandi di kamar #2 perlu diperbaiki   Untuk uang, nilai yang tidak dapat mengalahkan (4 hari, 5 malam untuk $271/US). Kami akan pasti tinggal di sini lagi",5
25, Room & Vespa 4,"Saya memesan beberapa malam di sini ketika bepergian sendirian dan sama sekali tidak kecewa. Pada kenyataannya, itu lebih baik daripada yang saya harapkan! Kamar dan kamar mandi adalah jauh lebih besar daripada yang saya pikir itu akan, dan dihias dengan baik. Lokasi yang sempurna, karena tidak ada makanan yang tersedia dan dalam jarak berjalan kaki dari restoran dan kafe. Saya tidak dapat menggunakan kolam renang, tapi lain kali saya berencana untuk tinggal di sini!",4
26, Room & Vespa 4,"Ini adalah kedua kami tinggal dengan kamar dan tempat ini sesuai dengan Vespa kami dengan sempurna 4.. Sebagai pengunjung biasa ke Bali, kami tidak memerlukan sebuah hotel dengan concierge, restoran atau bar fasilitas. Harga adalah berpikir hal ini dan kami pikir itu nilai yang baik. Kamar memiliki kulkas kecil dan teh dan kopi membuat fasilitas tapi lokasinya dekat ke banyak tempat dan kami sangat senang untuk berjalan ke pistol untuk kopi di pagi hari, berjalan-jalan ke kudeta, atau hanya keluar dari pintu depan untuk koktail dan makanan murah. Dengan hanya 6 kamar, kolam renang cukup sering anda sendiri. Kamar yang besar dan indah d Allahumma. Staf yang ramah, sangat membantu dan senang untuk membantu.",5
27, Room & Vespa 4,"Kamar-kamar dan Vespa adalah salah satu yang terbaik dan nyaman. Tidak ada barang tambahan, ruangan tampak bersih, modern dan luas. Saya sangat suka dari semuanya. Bagi saya kebersihan adalah sangat penting dan saya memberi mereka poin penuh untuk itu. Tempat ini begitu luar biasa bahwa Anda berada di jalan yang paling luar biasa dalam beberapa menit berjalan kaki. Oberoi, ku de ta, Potato Head, Seminyak Square Mall dan jalan yang berjalan kaki. Bahkan pantai yang sangat dekat. Saya akan sangat merekomendasikan tempat ini.",4
28, Room & Vespa 4,"Kamar & Vespa 4 terletak dengan baik, hanya berjalan kaki sebentar ke Ku De Ta, Seminyak Square dan pasar. Kamar yang indah, sangat baik dilengkapi dengan tempat tidur yang nyaman. Area kolam bagus dan Staf yang menyenangkan.   Saya hanya negatif akan menjadi pengalaman;   tidak ada dapur - sehingga Anda harus meninggalkan ruangan untuk pergi makan. Yang tentu saja anda juga, tapi akan lebih baik untuk makan di kadang-kadang ketika Anda bersantai hari di antara kegilaan liburan.",4
29, Room & Vespa 4,"Hotel kecil yang bagus terselip kembali dari hambatan utama di seminyak. Sekitar 2 - 3 menit berjalan kaki ke kanan adalah pantai dengan akses melalui pintu masuk yang ku da ta (tinggal ke kiri dan dengan melewati beach club). Belok kiri ke jalan lain 2 - 3 menit berjalan kaki membawa anda ke seminyak square dan jalan utama dengan restoran dan tempat belanja. Di seberang jalan ada pasar loak untuk tawar-menawar.  Halaman hotel sangat indah dengan kolam renang umum, tempat duduk, area tempat duduk, dan akses langsung ke air mancur zen di 3 kamar yang di bawah tangga. Di atas tangga ada 3 kamar dengan pemandangan halaman.  Pelayanan yang sangat bagus - apa pun yang anda butuhkan, handuk, tangan dengan aman (yang sangat mudah untuk digunakan jika anda jet tertinggal bodoh seperti…",4
30, Room & Vespa 4,"Vila ini didekorasi dengan penuh cita rasa dan kamar besar. Kolam renang sangat mengundang dan bersih (sayangnya saya tidak mendapatkan untuk berenang!), dan lokasi yang sempurna. Anda dapat dengan mudah berjalan kaki ke pusat seminyak (dekat seminyak square), dan anda memiliki pasar kecil yang menjual pakaian di depan. Kudeta ini juga mudah berjalan kaki. Sangat merekomendasikan ini villa :) ",5
31, Room & Vespa 4,"Tempat kecil yang bagus! Itu agak sulit untuk menemukan, tapi lokasi sangat bagus 2 menit berjalan kaki ke itu. pantai dan ku de ta. Banyak restoran dan perbelanjaan di dekatnya. Kamar sangat lucu dan bersih, staf sangat ramah dan membantu! Saya bepergian sendirian dan saya merasa aman di semua kali. ",5
32, Room & Vespa 4,"Pertama, hotel ini disebut ""kamar & vespa"" jadi saya tidak mengharapkan fasilitas hotel yang umum. Itu agak sulit untuk taksi untuk menemukan tempat ini karena mereka tidak akrab dengan hotel butik kecil ini. jadi mencetak konfirmasi pemesanan dan menunjukkan alamat untuk sopir taksi. Taksi dari bandara biaya kami setelah tawar menawar IDR150, 000. Segera setelah kami tiba, staf telah menunggu di depan pintu masuk dan membawa tas kami. Ada tidak ada concierge/resepsionis, area lounge kecil yang imut dengan kolam renang di mana semua proses check in selesai. Ketika kami memasuki kamar kami (terletak di lantai dasar) dan kami sangat senang dengan cara yang didekorasi dengan indah ini dan ac sudah beralih pada. Saya suka bagaimana tersembunyi dari jalan yang sibuk dari kayu aya…",5
33, Room & Vespa 4,"Kami tinggal di sini selama akhir pekan dan kami sangat terkesan dengan kamar yang indah (6) - tempat tidur yang sangat nyaman dan selera ditunjuk. Kami tidak mendengar suara sama sekali di dalam, dan segala sesuatu di ruangan bekerja dengan baik! Nilai yang besar di lokasi yang sempurna dekat dengan semua tempat populer di seminyak!",5
34, Room & Vespa 4,"Aku solo traveler dan telah tinggal di banyak hotel dan vila di bali. Tempat ini adalah di bagian atas daftar saya! Menakjubkan lokasi, staf yang ramah, dan kamarnya luar biasa! Bersih, indah dihiasi dan tempat tidur adalah besar dan nyaman. Aku akan pasti akan kembali. ",5
35, Room & Vespa 4,Hotel kecil yang nyaman ini adalah sebuah permata tersembunyi di bali. Kami disambut hangat saat check in tidak pernah pudar dan keramahtamahan selama kami tinggal. Kamar kami membuka ke area kolam renang di mana anda dapat bersantai dan mencuci jauh kekhawatiran anda. Staf hotel dapat membantu mengatur tur dan transportasi ke bandara dan mereka sangat cepat email balasan.,5
36, Room & Vespa 4,"Lokasinya bagus; dalam jarak berjalan kaki dari seminyak square dan sangat populer tempat makan seperti sisterfields. Desain kamar yang indah dan kamar yang sangat luas. Ada tanda-tanda penuaan (bercak/noda) tapi bukan masalah besar bagi saya, mengingat harga. ",4
37, Room & Vespa 4,"Memiliki yang indah tinggal di sini, staf yang luar biasa dan kamar yang benar-benar sempurna, tempat yang indah dan romantis. Tempat tidur besar dan sangat nyaman... Benar-benar mencintai hotel ini terutama di ruang kolam renang. ",5
38, Room & Vespa 4,"Hotel kecil yang indah di tengah dari sibuk seminyak. Kamar yang sangat bersih, dan kolam renang adalah sempurna untuk berenang di bali yang panas - banyak sinar matahari dan payung yang tersedia sepanjang hari.  Staf semua ramah dan sangat membantu. Saya akan sangat merekomendasikan vespa 4 kamar dan saya akan menginap di sini lagi dan lagi ",5
39, Room & Vespa 4,"Saya dan mitra saya tinggal di sini di juni 2016, ini adalah pertama kami berhenti ketika tiba di bali. Kamar yang indah, nyaman dan sangat tenang dan pribadi. Staf sangat membantu dan penuh perhatian, dan memastikan kamar kami sangat bersih dan rapi setiap hari, mereka senang untuk membantu kami dengan arah dan pertanyaan yang kami punya. Area kolam adalah santai dan dengan hanya 5 kamar di properti lain seperti villa pribadi. Satu-satunya cara kami tinggal bisa lebih baik jika sarapan termasuk.",5
40, Room & Vespa 4,"Tiba malam terakhir - terlihat sedikit untuk menemukan kami memindahkan barang dari kapal dari gili, tapi itu adalah sangat baik terletak dan sempurna! Tata letak yang indah - kolam renang sangat cantik dan ruangan - sempurna! Kamar mandi kecil dan fungsional dengan mandi besar dan tempat tidur yang luar biasa! Terbaik malam tidur dalam beberapa saat! langit-langit yang sangat tinggi dengan kipas angin dan ac - jubah yang bagus - yang kurang hanya tidak ada keluar tirai jika itu adalah sesuatu yang anda butuhkan. ",5
41, Room & Vespa 4,"Kami tinggal 3 malam. Kamar kami adalah besar, dihias dengan baik, dan pendingin udara bekerja 110%. Manajer sangat ramah dan membantu mengatur taksi's dan skuter untuk kami.   Lokasinya benar-benar di sudut dari pantai  ",4
42, Room & Vespa 4,"Saya memiliki 2 malam pendek tinggal di kamar dan vespa 4, yang saya pikir itu nilai yang sangat baik untuk uang. Tempat ini terang dan terbuka dengan sentuhan modern, sangat dekat dengan pusat perbelanjaan, pantai, restoran, dan tempat minum yang dingin. Kamarnya luas dan dengan semua fasilitas, tapi tidak ada sarapan tersedia di hotel. Tempat yang benar-benar meninggalkan anda untuk melakukan bisnis sendiri, - tidak ada perhatian atau bertanya staf (bahkan staf beberapa...) - seperti yang saya inginkan ini misalnya.. kamar yang indah dan terletak di pusat tanpa kembang...",4
43, Room & Vespa 4,"Pasti nilai untuk uang. Kamar luas, bersih dan nyaman. Meskipun tv yang lebih besar yang akan menjadi sempurna. Tekanan air yang terasa sedikit rendah di toilet. Kata ""kamar vespa"" di jalan masuk harus lebih besar... kami mengalami kesulitan mencari tempat meskipun menggunakan peta google. Selain itu kami menyukai ini hotel kecil yang bagus. Pasti akan kembali lagi! Terima kasih kepada staf yang ramah dan membantu dan temui shinta untuk selalu bius cepat dalam menjawab email saya! ",5
44, Room & Vespa 4,"Di luar kota wisata, hotel ini adalah tempat yang bagus. Kamar-kamar cukup indah dan sangat bersih. Kolam renang indah (tapi terlalu banyak klorin). Meminta salah satu dari tiga kamar di lantai bawah jika anda ingin berjalan langsung ke kolam renang. Tiga kamar di lantai atas memiliki sedikit lebih banyak ruang. Ada tidak ada restoran atau resepsionis di hotel, tapi kulkas kecil di setiap kamar dan banyak restoran di sekitar. Staf adalah sangat ramah.",4
45, Room & Vespa 4,"Kami benar-benar mencintai kami menginap di kamar & vespa 4! Ini adalah tempat yang kecil dan sangat ramah. Kamar berada dalam kondisi yang sangat bagus (mungkin ini baru dibangun, segala sesuatu yang sangat segar!) Pembersihan kamar adalah super! (dilakukan setiap hari dan segar setiap saat!). Staf adalah super bagus dan ramah dan membuat kami merasa seperti di rumah selama seluruh tinggal. Tidak dapat merekomendasikan tempat ini cukup, itu pasti 5 dari 5 yang kuat dengan harga! ",5
46, Room & Vespa 4,"Lokasi strategis, konsep bagus, layanan yang ramah. Tapi kebersihan dapat ditingkatkan - linen tempat tidur dan handuk tidak cukup bersih dan shower juga tidak bagus. Secara keseluruhan, pengalaman positif untuk tinggal pendek. Kamar sangat besar dan bagus kolam renang.",4
47, Room & Vespa 4,"Hanya sedikit turun rel di seberang pasar adalah vespa dan itu tenang dan pribadi 4. dengan dekorasi dan staf yang ramah dan. Kami tinggal di kamar 2 yang hanya beberapa langkah dari kolam renang di lantai yang lebih rendah. Kamar itu besar, bersih, dengan tempat tidur yang nyaman, lounge, dan baik ukuran kamar mandi. Kami akan pasti tinggal di sini lagi tahun depan. Khusus terima kasih kepada hardy yang mencoba nya terbaik untuk membantu suami saya menemukan bahwa ia meninggalkan dompet di dalam taksi.",5
48, Room & Vespa 4,"Tempat ini adalah hanya apa yang kita cari di seminyak. New, menawan, nyaman ranjang, sangat tenang namun pusat. Para staf sangat membantu - bahkan ketika kita tidak dapat datang tepat waktu untuk check-out - mereka membantu dalam bagaimanapun mereka bisa. ",5
49, Room & Vespa 4,"Kami tinggal di 4 kamar untuk 2 malam & vespa di bulan januari dan menikmati kami tinggal di sana. Properti ini adalah tidak benar-benar sebuah villa yang kecil tapi lebih baik daripada hotel. Properti ini memiliki 6 kamar dengan kamar mandi pribadi dan didekorasi dengan penuh cita rasa, juga tersedia di lokasi hotel. Kami tidak 2 orang dewasa dan 1 anak, dan kami tinggal di ruangan 6 yang terbesar di properti ini dan hari tempat tidur yang nyaman. Properti ini memiliki lokasi strategis untuk segala sesuatu, aman dan sangat baik harga untuk standar. Ini adalah biaya rendah pilihan untuk seminyak dan kami akan pasti tinggal lagi. ",5
50, Room & Vespa 4,"Rasanya seperti sebuah sanctuary tenang, terletak di jalan kecil. Tapi ketika aku memasuki ruangan. Aku jatuh cinta dengan kamar yang harum. Ruangan itu bagus dan bersih, dengan desain yang baik. Mereka juga memiliki staf yang humble siap melayani anda kapan saja. Pasti akan datang kembali ke sana!  Super '!",4
51, Room & Vespa 4,"Kami telah di sini selama 5 malam minggu lalu.  Kami ingin mengatakan terima kasih khusus untuk Timus Hardi dan, 2 orang-orang yang bekerja di sana.  Mereka telah benar-benar membantu dengan kami sementara kami tinggal di sana.  Benar-benar bersih, tenang dan lokasi menakjubkan.  Terima kasih teman-teman Francesca, Miki, Manu",4
52, Room & Vespa 4,"Kamar adalah 4 dan vespa di lokasi yang menakjubkan! sangat tengah dan mudah untuk berkeliling ke dan dari, tepat di belakang seminyak square dan berlawanan pasar loak! Perlengkapan di kamar yang indah, fantastis ac dan kolam renang yang indah - sebuah oase pribadi. Semua staf tersenyum, ramah dan sangat membantu! Panduan wisata dan akan kembali!",5
