,hotel,review,stars
53, Room & Vespa 4,"Lokasi besar, hanya beberapa blok dari pantai (3' oleh berjalan) dan kudeta bar, di 2015 baru (dibuka pada bulan oktober), didekorasi dengan indah, tempat tidur yang baik, kamar yang bagus bersih 6, sudah di pendobrak memapani memiliki akses langsung ke kolam renang, staf yang ramah yang sangat membantu (terima kasih yogi!)",5
54, Room & Vespa 4,"Kamar sangat bagus, besar, baik dekorasi, tempat tidur yang nyaman. Kolam renang besar. Staf sangat baik dan bermanfaat. Lokasi adalah yang terbaik. 5 menit berjalan kaki ke restoran dan klub. Wisma yang indah. Pasti akan kembali.",5
55, Room & Vespa 4,"Jika anda ingin tempat yang tenang, nyaman, dan bersih lightful, anda harus mengikuti dan dibuka tahun 2015 vespa no. 4. kamar dan kolam renang adalah barang baru, modern dan bergaya. Ini merupakan pusat dekat dengan besar makanan-street, sehingga tidak masalah untuk menemukan tempat yang bagus untuk sarapan. Coba 'memipis dan sayur' yang hanya sepanjang sudut - mereka memiliki makanan yang mengagumkan. Untuk sampai ke pantai anda perlu skuter. Bersenang-senang dan terima kasih untuk Shinta dan timnya yang benar untuk menginap di kamar dan vespa! Uli dari jerman milikm",5
56, Room & Vespa 4,"Yang terbaik yang dapat anda temukan di area ini untuk mendapatkan uang. Aku ingin tinggal di sana selamanya! Jika aku kembali aku akan tinggal di Room & Vespa4. Nyaman, bergaya, tenang, pusat, ocean 3 min oleh berjalan. Saya merekomendasikan untuk semua! ",5
57, Room & Vespa 4,Teman saya dan saya telah baru saja kembali dari seminggu di bali & vespa 4 menginap di kamar... Wow tapi kami sangat terkesan! Ada 6 kamar berdekorasi indah dan satu - jelas dirancang oleh seseorang yang dengan banyak bakat kreatif (sesuatu yang saya dapat menghargai sebagai desainer interior sendiri!). Kami berada di kamar di lantai atas yang sangat besar dengan langit-langit tinggi yang mengagumkan - saya akan merekomendasikan tinggal di salah satu kamar mereka lebih besar daripada mereka yang sangat menarik dan anda tidak punya tamu lain berjalan melewati pintu anda. Lokasi adalah fantastis dan merasa sangat aman. Hotel ini hanya sekitar sudut dari ku de ta dan ada 'circle k' tepat di sebelah toko yang nyaman - sangat berguna! Perhatikan bahwa tidak ada tempat resepsionis…,5
58, Room & Vespa 4,Ini adalah sebuah permata dari menemukan. Terletak sekitar 3 menit berjalan kaki ke ku de ta seminyak square dan sekitar 5 dari lokasi ini adalah sempurna bagi kami. Kamarnya sangat bersih dan didekorasi dengan penuh cita rasa. Stafnya ramah dan sangat membantu (terutama Timus). Kolam renang sangat bersih dan menyegarkan dan kami cukup banyak memiliki tempat untuk diri kita sendiri sebagian besar waktu. Aku akan terkejut jika siapa pun bisa menemukan negatif dengan 4 kamar dan vespa!,5
59, Room & Vespa 4,"Aku tinggal 6 malam di kamar & vespa 4 dan aku benar-benar menikmati masa menginap saya. Kamar-kamarnya didekorasi dengan baik, tempat tidur adalah benar-benar confy dan lokasi fenomenal. Orang-orang yang bekerja mereka mencoba yang terbaik untuk membantu anda dengan cara apapun. Sangat direkomendasikan! ",5
60, Room & Vespa 4,"Kami tinggal selama 3 malam kami. Itu sempurna! Lokasi ideal, kamar sangat bersih dan kami akan merekomendasikan hotel ini ke semua teman-teman dan keluarga.  Sementara Semyniak kami berada di, kami menemukan restoran wnt ke laut, di ku de ta, potato head... Kami pergi untuk pijat dan pedikur. ",5
61, Room & Vespa 4,"Mudah untuk menemukan, google earth dan galeri Masa iook untuk seminyak dan itu akan membawa anda langsung ke menemukan ini hebat. Tidak lebih dari 50 meter dari jalan utama ke pintu masuk yang indah di gang yang dipenuhi pohon kelapa. Geng di malam hari memiliki lampu dan tidak ada anjing yang berkeliaran. Segala sesuatu di check-in menjelaskan & menunggu kesepakatan yang sama penuh dengan cocok jus kelapa dari pohon-pohon yang berbaris di properti. Kamarnya sangat menyenangkan. Saya dan suami saya tinggal di lantai dasar dengan akses langsung ke kolam renang, namun kamar di tingkat satu memiliki pintu yang terbuka yang mengarah ke kolam renang dan taman. Tidak mengauskan di kamar mana anda akan diberikan sebagai menurut pendapat kami mereka semua benar-benar baik, termasuk…",5
62, Room & Vespa 4,"Kamar dan vespa 4 adalah hotel baru. itu kecil dengan hanya 6 kamar yang tersedia dengan kolam renang kecil. Kamarnya bagus dan besar dan sangat bersih. Saya akan mempertimbangkan hotel ini karena budget hotel di total, dan fakta bahwa tempat ini tidak menawarkan sarapan apapun. Namun beberapa tempat makan berjalan kaki termasuk starbucks.  Daerah untuk perbaikan adalah kualitas air di kolam renang dan pancuran.  Bagian terbaik dari tempat ini adalah bagaimana dekat dengan berjalan kaki jaraknya dari pantai. Anda dapat berjalan di sana dalam 5 - 6 seperti ku de ta dan menggunakan gerbang untuk memasuki pantai. Anda juga dapat berjalan kaki ke seminyak square (6 - 7 min) dan kentang kepala beach club (10 min berjalan di pantai).",4
63, Room & Vespa 4,"Aku tiba di 2 setelah konfirmasi melalui email dan tampak bagus. Saya tidak berpikir orang-orang muda yang sedang menunggu saya. Aku diberi minuman selamat datang yang hangat seperti minum air dengan kapas bola di hotel ini. (yeh) mereka membawa saya ke kamar, setelah melihat sesuatu di lantai bawah oleh kolam mereka membawa saya menaiki tangga curam dan di ujung aula cara. Lorong itu seperti oven, semua tabel ventilatio dan tanpa saya meminta untuk dipindahkan ke sebuah kamar di lantai bawah, namun permintaan itu diabaikan atau disalahartikan. Ketika saya pergi ke kamarku ac itu tidak pada. Pemuda yang adalah membiarkan saya di dini ac pada saat aku ada di sana. Itu panas di kamar daripada di luar. Saya telah melihat sekeliling dan melihat nyamuk yang mati di kamar mandi dan…",3
64, Room & Vespa 4,"sangat dekat ke pusat perbelanjaan dan pantai. Menyenangkan dan bersih. Tempat tidur yang nyaman. Staf yang ramah dan rendah yang kita suka. Tenang. Makanan yang sangat baik dengan agen pemesanan, yang diatur bagi kita untuk Shinta anak vespa dan 3 untuk 4 untuk bisa lebih dekat dengan square.     ",4
65, Room & Vespa 4,"Baiklah, tidak bisa menyalahkan Vespa4, kamar, tempat tidur, lounge dan kolam renang. 10 menit berjalan kaki ke pantai sekitar, dengan sarapan sangat baik. Lokasi, Lokasi. Staf sangat membantu dan mudah untuk menangani.  sangat baik menjalankan semua kamar & vespa acomadation. Katedral Yang Indah         ",4
66, Room & Vespa 4,"berjalan kaki ke terdekat 1min toko kelontong (circle k) untuk mendapatkan persediaan anda setiap hari, 3 menit berjalan kaki ke terkenal seperti ku de ta, 5 - 7 menuju seminyak square. lokasi terbaik, sangat tepat untuk menjelajahi seminyak. Kamar & vespa ini didesain sarat cita rasa. meskipun mudah diakses ke kawasan utama, itu adalah tetap tenang dan damai. Ini adalah villa untuk disewa terpisah 6 kamar dengan berbagi kolam renang. nyaman & pribadi. untuk dicatat bahwa kamar & vespa bukan layanan penuh misalnya tidak banyak akomodasi & layanan kamar. tapi bukan sebuah isu bcos di hotel ini yang dekat dengan f&b outlet (banyak tempat untuk lihat di sekitar untuk sarapan & makan siang). juga terdapat pasar lokal 2min dari vila ini. kamar dirancang dengan baik, baik ukuran dan…",4
