,hotel,review,stars
123, Sapodilla Ubud,"Hotel ini dekat dengan hutan monyet dan banyak restoran, mini mart adalah hanya sebelah kanan pintu. Semua anggota staf yang sangat membantu dan indah, hotel kecil tapi tenang, kolam renang bersih dan indah, menikmati 2 malam di sini dengan pasangan saya dan teman-teman. Hal terbaik adalah sawo menawarkan transportasi gratis kemana-mana di Ubud yang menyelamatkan banyak uang dari dompet kami, staf hotel direkomendasikan tempat pijat yang bagus & spa dan restoran, Jaens spa yang menawarkan pijat yang luar biasa dengan harga yang masuk akal! Sawo yang direkomendasikan oleh :) Kami pasti akan kembali lagi segera sawo, terima kasih sekali lagi untuk keluarga di sawo setelah kami untuk kami tinggal yang bagus x  P. S hanya satu hal yang saya tidak suka adalah bantal dan kasur adalah…",5
124, Sapodilla Ubud,"Hotel kecil yang bagus, tempat ini dekat dengan Monkey Forest dan ke restoran.  Staf yang sangat ramah dan baik  Mereka menurunkan kami dan menjemput kami setiap tempat yang kami memilih untuk pergi ke Restoran di hotel ini perlu ditingkatkan namun saya tinggi raccomand ini  Saya akan tinggal di sana lagi",4
125, Sapodilla Ubud,"Saya pikir Anda dapat membaca semua ulasan dan dapat memberitahu betapa besar hotel ini. Kami sangat menikmati masa menginap kami! Beberapa highlights: sangat fokus pelanggan, dan area kolam renang yang indah, tempat yang bagus untuk sarapan di balkon, layanan antar-jemput gratis yang akan mengantar Anda kemanapun yang anda inginkan di kota, kamar modern, air panas yang bagus.   Satu-satunya daerah di mana hotel ini dapat memperbaiki hal ini di internet. Koneksi juga buruk. Saya tidak bisa mendapatkan Wifi di kamar - hanya di balkon. Namun. Saya baik-baik saja dengan itu karena segala sesuatu yang lain sangat bagus.",5
126, Sapodilla Ubud,"Kamar baik ditunjuk, bantal yang keras seperti batu. AC sangat bagus dan dingin dan air panas di kamar mandi. Kamar mandi tidak memiliki pintu, jadi jika Anda tidak begitu beberapa, ada tidak ada privasi. Makanan yang mengerikan. Kolam renang yang bagus dan bersih. Staf yang sangat membantu. Kamar tidak memiliki banyak cahaya alami, terutama di lantai dasar, karena pintu masuk pintu kaca, semua kaki lalu lintas yang lewat pintu Anda, jika Anda ingin privasi, Anda harus menarik tirai. Banyak restoran dekat oleh, tetapi jika Anda ingin melihat pemandangan, Anda harus menggunakan taksi atau menyewa skuter, yang kami lakukan. tempat ini murah, tanpa embel-embel, bersih dan tenang hotel.",3
127, Sapodilla Ubud,Wow saya berarti Wow - ini tempat yang unik yang berlokasi di jalan yang jauh dari keramaian dan hiruk pikuk Ubud adalah sebuah pengalaman ajaib. Dimiliki dan dikelola oleh sebuah keluarga yang benar-benar memperlakukan Anda seperti salah satu anggota keluarga lama hilang. Kami tiba sekitar tengah malam dan disambut dengan sangat hangat. Istri saya dan saya datang ke sini untuk merayakan ulang tahun pernikahan kami dan menemukan kue di kulkas kami yang indah dengan tempat tidur yang nyaman dan mandi dengan sentuhan khusus.  Tidak dapat merekomendasikan juga tidak ada pujian yang cukup untuk bagaimana mereka telah ditambahkan ke pengalaman kami di Ubud!   Akan kembali berikutnya tahun prestasi,5
128, Sapodilla Ubud,"Saya menginap di awal Februari sawo untuk 3 malam  Kamar yang sangat bersih, kolam renang yang sangat bagus untuk bersantai, ini adalah hotel yang cukup sangat dekat dengan pusat Ubud, hanya 8 menit oleh kaki tetapi jika Anda tidak ingin berjalan mereka memiliki layanan antar-jemput gratis ke Ubud juga Staf adalah staf hotel terbaik yang pernah saya lihat, mereka sangat membantu di sepanjang waktu.  Aku berharap aku bisa tinggal lebih lama. Saya menyarankan hotel ini untuk semua orang yang mengunjungi Ubud.  Terima kasih untuk tim Sawo ",5
129, Sapodilla Ubud,"Kami tinggal selama 3 malam di sawo. Ini adalah tempat yang indah; tenang, bersih, baru, ramah dan fokus pelanggan; hanya beberapa menit berjalan kaki dari jalan yang sibuk di Ubud.  Kamar yang sangat bagus. Pancuran yang besar dan kamar mandi cukup luas; ada banyak ruang untuk pakaian dan barang-barang lain.  Kolam renang adalah bersih dan terletak di lingkungan yang subur.  Restoran/sarapan area ini sangat fungsional dan memadai fasilitas.",5
130, Sapodilla Ubud,Saya suka hotel ini. Akan 100% tinggal di sana lagi. Layanan yang luar biasa. Staf adalah sangat membantu. Ada antar-jemput gratis yang sangat bagus di Ubud. Kamar sangat luas dan bersih. Kolam renang yang sangat baik. Lokasi yang baik.,5
131, Sapodilla Ubud,"Kami menghabiskan bulan madu kami di Bali minggu lalu dan menghabiskan 2 malam di hotel ini di Ubud. Hotel ini tidak terletak di bagian sibuk Ubud tetapi sebaliknya, di pintu masuk kota, tempat ini mudah untuk menemukan dan menyewa skuter untuk menjelajahi restoran pasar, taman primata dan sisa pulau. Staf menyambut kami dengan minuman jahe yang lezat, menunjukkan kepada kita kamar, yang indah dan dilengkapi dengan bak mandi dan balkon. Anda mendapatkan buah segar di meja resepsionis untuk membantu diri Anda sendiri, gratis teh sore dengan kue-kue dan minuman. Sarapan adalah lezat dan sangat mengenyangkan! Anda bisa makan di tepi kolam renang atau di teras. Kolam renang yang indah di terpanjang yang pernah kami miliki selama perjalanan kami dan air hangat. Ketika kami pergi ke…",5
132, Sapodilla Ubud,"Yang kecil, hotel yang indah dengan keramahan yang besar. Saya sangat skeptis ketika sopir saya menurunkan saya. Saya biasanya lebih memilih jaringan hotel atau Resort. Kekhawatiran saya ini beralasan untuk. Sambutan yang sangat hangat di meja resepsionis. proses check in yang cepat. Kamar sederhana yang bersih dan luas. Saya agak rewel ketika datang ke tingkat kenyamanan tempat tidur. Dan aku suka tempat tidur di sini.   Kamar mandi dengan bathtub serta shower terpisah kios. Namun untuk meminta sebuah kamar di lantai kedua jika Anda tidak nyaman untuk mandi/mandi dengan pemandangan siapapun di kamar tidur. Ya, ada tidak ada pintu antara kamar tidur dan kamar mandi. Sempurna untuk pasangan dan pelancong yang bepergian sendirian tetapi tidak untuk teman-teman. Kamar di lantai 2…",5
133, Sapodilla Ubud,"Staf hotel benar-benar bagus.  Kecil dan terawat dengan baik properti.  Kami menyukai kamar.  Mereka mengatur layanan antar jemput ke area di sekitar Pasar Ubud dan. Mereka juga mengatur untuk taksi jika Anda tidak memesan salah satu.  Terletak di jalan yang sibuk di Ubud. Tapi karena ada jalan kecil ke hotel, itu memberikan penyangga yang bagus dari kebisingan dan lalu lintas.  Makanan yang sangat baik.",5
134, Sapodilla Ubud,"Ini kecil dan sangat menyenangkan hotel ini hanya dari Jalan utama yang sibuk, tetapi Anda tidak akan pernah tahu itu. Ada tidak ada suara, dan tampak kolam renang, taman, dan pohon-pohon yang rindang dan tinggi yang luar biasa. Anda akan menemukan sambutan yang hangat, minuman yang menyegarkan dan luas dan nyaman dan kamar tenang. Beberapa kamar membuka ke kolam renang di teras, yang lain adalah sebuah penerbangan tangga, dan memiliki balkon. Kami lebih suka balkon. Kolam renang adalah besar, di suhu yang baik dan bagus untuk berenang atau hanya berkubang. Berbagai pilihan sarapan, Bali, Indonesia, Western, vegetarian dan Perekat - gratis, dll, dengan jus segar yang lezat, yang disajikan di restoran yang menghadap ke kolam renang, atau balkon atau patio Anda. Kami tidak…",5
135, Sapodilla Ubud,"Saya jarang menulis ulasan. Namun. Saya hanya ingin menulis ulasan tentang Sapodilla. Istri saya memilih tempat ini untuk diri kita sendiri dan teman-teman kami. Oh, betapa aku senang bahwa ia lakukan. Inilah mengapa: indah kamar dengan balkon (teras) yang luas dan kamar mandi, bak mandi yang diukir indah, terpisah mandi dan toilet doored doored. Restoran kecil yang sangat baik, makanan yang dibuat untuk memesan, segar dan lezat. Tempat ini buka sampai dengan layanan kamar dan teh di sore hari. Kamar tenang dan dilengkapi dengan baik. Tapi apa yang benar-benar berdiri keluar tentang hotel kecil ini adalah tingkat layanan. Jujur saja, saya telah tinggal di hotel bintang 5 yang Tingkat Layanan tidak cocok dengan hotel kecil ini. Setiap pertemuan kami telah dengan staf adalah salah…",5
136, Sapodilla Ubud,"Sawo yang sangat tenang dan indah. Walaupun hotel ini terletak di jalan utama, kami mendapati di keramaian dan hiruk pikuk di luar. Akomodasi adalah tetap rapi bersih. Staf yang ramah dan sangat membantu.",5
137, Sapodilla Ubud,"Saya tidak sering menulis ulasan di TripAdvisor. Namun Wilsnawa dan timnya sangat sempurna. Saya belum pernah ke sebuah hotel di mana staf sangat penuh perhatian dan kepedulian.   Jika Anda tinggal di Ubud dan ingin bersantai, tinggal di sini.   Terima kasih untuk pengalaman menginap yang sawo. Saya akan kembali lagi suatu hari nanti!",5
138, Sapodilla Ubud,"Sawo yang besar hotel kecil. Jika Anda ingin sebuah hotel yang pergi di atas dan di luar maka ini adalah hotel untuk Anda. Kamarnya besar, bersih dan dilengkapi dengan baik. Ada sebuah kolam renang kecil (namun, cukup lama untuk jarak) terletak di taman yang indah. Ada banyak pilihan di menu sarapan dan makanan di makan malam sangat baik juga. Apa yang membuat hotel ini staf, kami terbiasa dengan tingkat pelayanan yang biasanya diberikan di hotel Asia, namun. Saya tidak bisa mengatakan satu hal buruk tentang staf di sawo. Bila Anda telepon adalah sentuhan yang indah karena Anda dapat menghubungi meja depan di mana pun Anda (orang yang mengeluh bahwa mereka harus pergi ke penerimaan setiap kali mereka ingin berbicara dengan anggota staf, harus menggunakan telepon yang disediakan…",5
139, Sapodilla Ubud,"Sangat direkomendasikan bagi mereka yang mencari untuk tenang dan aman hotel, lokasi yang baik untuk atraksi dan toko-toko, dengan kamar yang sangat fungsional seperti yang ditemukan di hotel modern lainnya, inilah tempatnya! Kami tinggal hanya satu malam, benar-benar hanya beberapa jam sebelum berangkat untuk mendaki di Gunung Batur di larut pagi, tapi staf membuat kami tinggal menyenangkan dan nyaman.   Kamar sederhana dan fungsional (dikunci, tidak geser kayu atau kunci! ), lantai marmer, 4 poster tempat tidur, tekanan air yang kuat untuk mandi hujan, yang lengkap dengan toilet, tidak ada bau musky dari unit AC Split - pendingin. Brankas pribadi, meja tulis, balkon dengan meja makan, dan ruang untuk roll - tempat tidur hanya 2 lantai jika diperlukan ., tidak ada lift, tapi…",4
140, Sapodilla Ubud,"Kami memilih hotel ini untuk kami pertama 3 malam di Bali. Layanan dari semua staf sangat luar biasa. Hotel cukup nyaman dan tidak terlalu ramai. Mudah untuk mendapatkan sekitar dan akses ke jalan utama di Ubud. Saya akan sangat menyarankan hotel ini untuk semua orang. Layanan laundry dan buah di meja lobi sangat bagus.   Satu-satunya hal adalah bahwa layanan transfer bandara menjemput kami dari hotel. Setelah dia menjemput kami di bandara terminal, kami berharap supir membawa kami langsung ke mobil dan tidak meninggalkan kami menunggu dia dan van dengan 3 pria di bandara dan mereka memaksa kita untuk memberikan tips untuk menyeret bagasi kami untuk 1 menit bahwa kami tidak meminta. (Kami tidak keberatan untuk memberikan tips untuk pelayanan yang baik tapi tidak ada cara ini…",4
141, Sapodilla Ubud,"Tinggal di sini selama 9 malam, dan sangat senang dengan semua yang ditawarkan. Kamar yang sangat bagus: kamar yang luas, tempat tidur besar yang nyaman, kamar mandi dengan toilet terpisah dan kamar mandi, balkon dengan tempat duduk, dan banyak lagi. Staf di sini adalah luar biasa dan kredit karena setiap manajer, jenius.   Ada transportasi gratis tersedia AL di sekitar Ubud. Anda telpon tiba sehingga Anda dapat menelepon ketika anda ingin dijemput.   Sarapan adalah indah dan berlimpah dengan buah segar, jus buah, Barat dan tradisional atau tradisional Indonesia.   Kolam renang cukup besar untuk berenang di Bali dan menyenangkan di antara tanaman hijau di sekitar.   Ini adalah dalam jarak berjalan kaki dari pusat utama dan supermarket.   Benar-benar menikmati waktu kami di sini,…",5
142, Sapodilla Ubud,"Melihat ulasan di perjalanan penasihat sebelum pemesanan yang agak oversold tempat ini.  Tinggal satu malam dan menemukan bahwa tempat ini adalah pilihan yang baik jika tidak biasa.  Tempat kecil, baik taman dan kolam renang. Kamar sederhana, tetapi bersih. Tidak ada interkom di kamar. Jika Anda ingin sesuatu, Anda harus pergi ke bawah ke meja untuk berbicara dengan mereka.  Staf sangat sopan dan ramah. Rashmini sangat manis! Kami meninggalkan awal di pagi hari dan mereka menawarkan untuk memberikan kami beberapa dikemas sandwich untuk sarapan bersama dengan air kemasan. Terima kasih untuk usahanya.  Di INTI, ini kecil, bersih, nyaman Hotel. Baik dasar kamar. Nilai untuk uang. Tidak ada yang tak terduga",3
143, Sapodilla Ubud,"Ini luar biasa, hotel yang cukup baru di Ubud akan menjadi #1 lama jika mereka terus dengan layanan yang mereka berikan. Kami tinggal untuk hanya 3 hari di Ubud dan unik ini Hotel adalah tempat yang sempurna untuk menjelajahi Ubud. Lokasi yang besar dan mereka bahkan menyediakan layanan antar-jemput gratis di sekitar pusat kota Ubud!  Staf melakukan semuanya dalam kekuasaan mereka untuk memastikan Anda memiliki yang terbaik tinggal di hotel, tapi juga waktu terbaik di Ubud. Mereka membantu kami dalam merekomendasikan tur, restoran dan SPA dan menelepon untuk pemesanan ramah semua ini untuk kami.  Kamar menakjubkan, sangat luas kamar mandi besar dengan bak mandi besar dan indah. Tempat tidur yang datang dengan kelambu dan membantu memastikan kami mendapat tidak ada gigitan selama…",5
144, Sapodilla Ubud,"Kami menyukai kami menginap di ubud sawo. Keramahan mereka adalah sempurna dan staf yang hangat, membantu dan menawan. Mereka memiliki layanan antar jemput yang berguna yang membawa Anda ke pasar dan mereka juga menjemput anda kembali. Mereka juga menyediakan nomor telepon lokal dengan staf di speed dial outo ketika Anda pergi di sekitar. Saya menemukan ini sangat berguna. Secara keseluruhan kami tinggal itu bagus dan dipelihara dengan baik dan saya pasti akan merekomendasikan hotel ini kepada orang lain.",5
145, Sapodilla Ubud,Mudah berjalan kaki ke pusat Ubud. Menu sarapan yang enak dan teh sore gratis. Staf yang sangat penuh perhatian untuk kebutuhan klien. Boutique Hotel kecil dengan baik kolam renang yang bersih. Kamarnya modern dan bersih dan dilengkapi dengan baik. Kamar mandi besar dan kamar mandi yang sangat bagus. Mereka menawarkan gratis naik ke kota dan mereka memberi Anda telepon untuk menggunakan untuk beberapa waktu di kenyamanan Anda. layak tinggal di sini. sangat tenang di malam hari. Akan kembali lagi,5
146, Sapodilla Ubud,"Hotel butik ini pergi dengan keengganan sekarang juga! Kami menikmati setiap saat (4 malam) karena kami tampak setelah begitu baik dari awal sampai akhir kami tinggal dengan tersenyum, membantu staf. Kamar kami adalah nyaman dan, berada di lantai pertama, kami menikmati privasi teras kami sendiri. Sarapan adalah selalu menyenangkan dan teh sore oleh kolam renang, dilayani dengan 'memperlakukan' Bali kecil yang tak terduga ditambahkan tambahan - sentuhan khusus. Lokasi yang tenang - begitu baik untuk kembali ke setelah hari yang sibuk - tapi mudah berjalan kaki ke semua atraksi besar dan layanan antar-jemput gratis jika Anda tidak ingin berjalan. Terima kasih kepada Anda dan tim Anda seandainya - kami pasti akan merekomendasikan Anda kepada teman-teman kami sangat!",5
147, Sapodilla Ubud,"Indah, baik - terus kamar. Kolam renang yang indah dan taman. Mereka menyediakan antar jemput gratis ke pusat Ubud sangat membantu terutama karena taksi di Ubud bisa jadi sangat mahal. Staf sangat ramah dan hangat. Mereka mengantisipasi kebutuhan anda secara intuitif. Detil kecil seperti teh sore dan pakaian tidur yang sangat dihargai.   Mengingat semua ini, tarif hotel adalah nilai untuk uang.",5
148, Sapodilla Ubud,"kami menghabiskan 6 malam di hotel ini pada bulan Januari dan saya tidak bisa merekomendasikan ini sangat cukup. Ini bukan resor besar dengan semua fasilitas tetapi jika Anda ingin sesuatu yang kecil tapi khusus maka ini adalah taruhan terbaik Anda. Saya telah tinggal di berbagai hotel di Bali selama beberapa tahun dan ini adalah menonjol favorit saya. Seandainya ia dan staf melakukan pekerjaan mereka dengan baik. Berjalan kaki singkat ke Monkey Forest Road dan Jalan Hanoman, banyak makanan di sekitarnya, yang dalam 5 menit berjalan kaki dan toko anggur, dan 3 atau 4 supermarket di sekitar hotel. Saya tidak sabar untuk mengunjungi lagi.",5
149, Sapodilla Ubud,"Menginap selama 2 malam. Staf membuat saya merasa sangat welcome. Semua orang sangat baik. Secara keseluruhan menunjukkan di sekitar halaman dan kamar. Di halaman supernice dan pepohonan hijau yang rindang dengan pohon buah, dan kolam renang yang indah dan terawat dengan baik. Kamar merasa seperti bulan madu Suite meskipun saya berada di sana sendirian. Mereka menawarkan untuk melayani saya sarapan meskipun itu tidak seharusnya sudah termasuk dalam harga kamar. Anda dapat memilih dari berbagai pilihan sarapan yang segar dan disajikan untuk teras anda sendiri. Transportasi Gratis di daerah Ubud sangat mudah meskipun hotel ini berada dalam jarak berjalan kaki dari sebagian besar tempat di pusat Ubud. Pasti akan tinggal di sini lagi, sangat merekomendasikan!",5
150, Sapodilla Ubud,"Ketika Anda tiba Anda akan diampuni untuk berpikir di mana saya hanya setuju untuk menginap?   Namun, setelah Anda telah melihat kamar dan mengalami kehangatan dan layanan staf (semua untuk manajer) menawarkan Anda akan menyadari bahwa ini adalah tempat anda pasti akan datang kembali.   Staf menyapa anda setiap kali Anda meninggalkan dan kembali dengan tulus bahwa anda memiliki waktu yang besar. Dapat berjalan kaki ke Yoga barn dan jika Anda lebih memilih untuk mendapatkan tumpangan di hotel akan menyediakan layanan antar jemput dan memberi Anda telepon menjemput anda kembali.   Kami makan keluar banyak - favorit kami dekat oleh Taco Casa dan Moksa (perlu untuk mendapatkan mereka untuk mengantar dan menjemput).   Semua dalam semua jika Anda tidak setelah ""Resort merasa"" dan…",5
151, Sapodilla Ubud,"Saya benar-benar terkejut karena dengan pelayanan di Ubud sawo. Mereka anggun membantu kami mengatur transfer bandara. Ketika kami tiba, mereka memberi kami minuman gratis dengan handuk dingin wajah kami lelah. Wanita di meja depan bagus dan memberi kami sangat rinci kami tur hotel dan kamar, dan bahkan membawa lotion nyamuk ketika ia melihat istri saya memiliki gigitan. Kamar sangat bagus dan bersih dan kamar mandi besar dengan overhead Hujan Salah Satu nozel. Tempat tidur yang sangat nyaman dan balkon besar dengan pemandangan kolam renang. Hari berikutnya kami memiliki sarapan gratis dan itu luar biasa! Kami diizinkan untuk memesan apa pun yang kita inginkan, layanan hebat dan sangat lezat. Saat check out, staf bahkan memberi kami naik antar-jemput gratis kami ke hotel lain.…",5
152, Sapodilla Ubud,"Hotel butik yang luar biasa jauh dari hiruk pikuk pusat kota Ubud. Besar, kamar modern yang menghadap ke halaman bersama. Sarapan dan tinggi teh disajikan setiap hari di restoran atau di teras/balkon Anda. Staf yang ramah di seluruh Bali. Penjemputan dan pengantaran oleh staf hotel dalam Ubud sangat nyaman dan dihargai. daerah sangat walkable. Dekat dengan restoran dan layanan binatu. Hotel bintang empat!",4
153, Sapodilla Ubud,"Ini adalah kecil dan ramah hotel di jantung kota Ubud. Ada antar-jemput gratis akan membawa Anda ke sebagian besar tempat di sekitar kota dan juga mereka menyediakan Anda dengan ponsel sehingga Anda bisa menelepon kapan saja gratis. Sarapan adalah sederhana dan disajikan dengan baik dan fasilitas berada di urutan teratas.   Setelah kedatangan kami disambut oleh nama dan diberi tur (mungkin terlalu banyak) untuk kamar kami. Ini sedikit mengganggu setelah sekitar 10 menit, tapi semua itu adalah semen staf perhatian kepada kami. Saya akan merekomendasikan hotel ini untuk itu lokasi dan fasilitasnya.",4
154, Sapodilla Ubud,"Ulasan yang layak. Sawo di staf benar-benar yang terbaik - - hangat, ramah tapi tidak di atas bantalan peluru, membantu dan ceria. Mereka menemukan kami sopir pick up yang sempurna untuk tur di sekitar dan kota. Dan ya, gratis naik yang terkenal di Bali adalah pasti plus besar karena operator taksi di sekitar Ubud ini obnoxiously mahal. Sawo yang disediakan gratis rides, baik mobil atau motor di hotel dan membawa kami untuk memesan makan malam kami, ke pasar atau hanya di pusat kota.  Kamar baru, tenang dan terawat dengan baik. Tempat tidur yang sangat nyaman dan bantal. Wifi bekerja dengan baik. Sangat baik untuk berenang dan kolam renang nyaman dan hangat bahkan di malam hari.  Sarapan segar dan membuat pilihan yang baik. Dan pilihan untuk melayani di balkon Anda adalah…",5
155, Sapodilla Ubud,"Dengan hanya beberapa lusin kamar, hotel ini menyediakan telepon seluler lokal dan transportasi lokal gratis ke objek wisata dan pasar. Kami menikmati sarapan dan makan malam menu yang ditawarkan juga sangat kompetitif (tidak harga resor). Mereka adalah hanya dari jalan utama di kota, sekitar 20 menit berjalan kaki walaupun dari pusat aktivitas. sangat ramah dan efisien. Wifi gratis di dalam kamar dan botol air gratis. Sangat direkomendasikan,",5
156, Sapodilla Ubud,"Hotel ini sangat nyaman untuk semuanya kota Ubud menawarkan. Dekat dengan toko-toko, restoran, pijat dan Monkey Forest. Kamar modern dan luas (kurangnya pintu dari kamar mandi yang sedikit aneh) dan bersih. Semua kamar menghadap ke kolam renang dan taman. Staf di meja depan sangat membantu dan itu jelas mereka telah menerima pelatihan baik layanan dan bahasa Inggris. Ada antar-jemput gratis pada permintaan untuk di mana saja di kota dan kami tidak pernah menunggu lebih dari 10 menit. Ini. Hotel mewah ini dengan bel dan peluit tetapi adalah nilai yang sangat baik untuk uang di lokasi yang sangat nyaman.",5
157, Sapodilla Ubud,"Hotel ini menawarkan keseimbangan harga/kualitas sempurna, pada anggaran dengan 5 dimulai calon!  Desain hotel yang sangat nyaman dengan pemandangan yang indah dan cerah dan luas kamar dengan perabotan yang lengkap. Baik terletak jauh dari kebisingan dan Shuttle gratis dan telepon seluler ini berada di tepian, Hotel adalah 2 menit berkendara dari segala sesuatu.  Area pembangunan: -   - Kolam renang adalah terlalu hangat untuk selera kita dan itu tidak dibersihkan sering.   - Staf adalah ramah tetapi membutuhkan pelatihan profesional.   - Shower dan keran air kadang berbau seperti kotoran.",4
158, Sapodilla Ubud,"Setelah tiba di hotel setelah hari yang melelahkan tamasya, kami disambut hangat oleh staf yang ramah dan sangat penuh perhatian staf dengan minuman yang menyegarkan dan beberapa buah. Check - di berjalan lancar dan kami menemukan kamar yang bahkan lebih indah daripada yang di foto. Segala sesuatu yang sangat bersih. Interior adalah berselera dan menyediakan ruang penyimpanan yang tepat yang kami butuhkan. Kolam renang, juga, adalah Juara!  Setiap pertanyaan dijawab dengan segera kami - kami memiliki sedikit untuk mengambil telepon sekitar sehingga kami bisa menghubungi staf setiap saat, yang sangat berguna untuk layanan penjemputan gratis di sekitar Ubud.  Staf sangat ramah dan kami merasa disambut dan tampak setelah secara pribadi.  Sarapan Gratis (kami dapat memilih antara 2…",5
159, Sapodilla Ubud,"Kami tinggal 8 malam dari 19 Desember hingga 27 Desember 2016. Staf yang luar biasa, selalu siap membantu anda di setiap kesempatan. Layanan antar-jemput membawa anda ke semua tempat di Ubud dan jika Anda seperti ini. Tenang, tempat yang rapi. sarapan a la carte yang sangat baik & teh sore: - ). Saya ingin mengucapkan terima kasih kepada semua staf yang hangat, ramah & indah ini membuat kami tinggal sangat nyaman! Saya berharap untuk bertemu mereka lagi.  James (Dzeimss), Andari & Marta dari Latvia",5
160, Sapodilla Ubud,"Kami memiliki waktu yang sangat baik di sawo. Kamar adalah ukuran yang sempurna dengan tempat tidur dan kamar mandi yang besar. Alasan dan kolam renang adalah sangat cantik. Namun, hal yang sangat luar biasa tentang tempat ini adalah staf. Mereka sangat ramah dan membantu kami keluar dengan semua masalah kami. Mereka juga menawarkan layanan antar-jemput gratis untuk membawa Anda di mana pun Anda perlu untuk pergi di Ubud - sangat berguna! Kami sangat menikmati waktu kami di sini dan pasti akan kembali lagi.",5
161, Sapodilla Ubud,"Sawo menyelamatkan kita. Kami tiba lelah dan lelah. Saya memesan Villa pribadi tetapi tidak apa yang kami harapkan atau memesan kami check out setelah 10 menit. Kami berdering dan berhasil mendapatkan ruang terakhir di tentang 7 . 30 jam di malam hari. Staf luar biasa, ramah dan akan melakukan apa pun untuk anda.   Kamar yang sangat bersih, luas dan nyaman. Staf luar biasa, tidak ada yang terlalu banyak kesulitan. Dari lift untuk di mana saja di Ubud untuk disesuaikan dengan telinga dan obat nyamuk. Mereka memberi Anda telepon jadi jika anda ingin dijemput Anda menghubungi mereka.   Sudah termasuk sarapan & teh di sore hari. Pesan sekarang Anda akan menyukai tempat ini.",5
162, Sapodilla Ubud,Ini adalah akomodasi utama kami untuk beberapa hari pada bulan September berdasarkan rekomendasi. Kolam renang adalah sempurna. Kamar mandi dingin dan setelah dilaporkan tetapi diabaikan beberapa mengikuti Up untuk memperbaiki. Seperti ini tidak serius dan mengambil beberapa meyakinkan. Yang sangat mengganggu.,3
