,hotel,review,stars
163, Sapodilla Ubud,"Saya menginap selama 7 malam Di sawo Desember 2016. Rumah kami di Ubud yang sangat nyaman, tenang dan rapi.   Setiap pagi anda memiliki kesempatan untuk memilih jenis sarapan yang Anda pilihan. Saya suka terutama buah segar, pancake pisang dan nasi goreng.   Area kolam adalah sangat bagus dan air suhu cukup hangat. Tanaman di mana-mana dan Anda dapat merasa bahwa Anda berada di tengah-tengah hutan rimba.   Dalam jarak berjalan kaki (10 menit untuk 5) Anda dapat menemukan restoran bagus seperti mangkuk Buddha (masakan Thai), Taco Casa (Meksiko) (Masakan Jepang) dan Terasi. Jangan lupa untuk mencicipi masakan khas Bali! Makanan yang sangat lezat dan jika Anda ingin untuk menyiapkan makanan untuk diri Anda sendiri, Sawo juga dapat memesan Anda untuk kelas memasak (saya akan…",5
164, Sapodilla Ubud,Kami memiliki waktu yang besar tinggal di sini. Keramahan yang luar biasa. Mereka membantu saya untuk menyewa skuter untuk seluruh perjalanan. Sangat mudah untuk cepat sekitar dari hotel ini. Dalam jarak berjalan kaki dari beberapa restoran yang bagus dan Yoga. Saya merekomendasikan sebuah kamar di lantai kedua untuk lebih privasi. Di lantai pertama teras yang menghadap ke kolam renang sehingga Anda harus menarik tirai untuk privasi. Bak mandi yang sangat bagus. Membawa bom yang subur dengan Anda untuk menikmati kamar mandi.,5
165, Sapodilla Ubud,"Ini harus menjadi hotel terbaik dan layanan yang kami pernah tinggal di.   Kami adalah keluarga dengan 4. segera setelah kami tiba kami disambut dengan hangat oleh para staf. Staf semua sangat penuh perhatian dan sabar untuk permintaan kami dan yang terpenting adalah mereka menyambut dan menjelaskan dengan senyum.   Ruangan itu bersih dan kamar mandi dan mandi yang dirancang dengan sangat elok. Seluruh ruangan merasa begitu tenang dan santai dan suasana yang membuat saya merasa seperti spa. Saya segera jatuh cinta dengan hotel ini.   Apa yang lebih, sarapan sangat murah hati jumlah makanan, dengan campuran sereal + buah + teh/kopi + utama. Dan itu gratis untuk anak kami.   Saya benar-benar melewatkan pengalaman dengan hotel ini dan akan sangat merekomendasikan hal ini.  …",5
166, Sapodilla Ubud,"Saya diunduh hanya untuk menulis ulasan di TripAdvisor tentang Sapodillra!  Suami saya dan saya menginap selama 4 hari untuk Sapodillra 4 th ulang tahun! Dan kami sangat sedih untuk pergi di sini pada hari terakhir!   Semua staf yang sangat ramah dan bersedia membantu dengan setiap permintaan kami.  Sarapan disajikan ke kamar kami dan mereka menyediakan teh sore juga.  Setiap kali kami ingin untuk pergi ke pusat kota Ubud drived kita ke sana dan mereka bahkan piuck kami juga!  Layanan ini tidak mungkin!  Bandara terkulai layanan sangat meyakinkan dan harganya masuk akal!  Hanya segala sesuatu sempurna!   Semua staf dari Sapodillra yang terhormat,  Saya jamin anda akan mengunjungi di sini lagi!  Mohon mengurus sendiri terbaik!  Gembira Natal dan selamat tahun baru!",5
167, Sapodilla Ubud,"itu pasti sepadan dengan harganya! Anda mendapatkan gratis sarapan (tidak prasmanan gaya tetapi a la carte, makanan yang cukup baik) dan layanan transportasi gratis di daerah Ubud yang terbaik tak dilengkapi dengan hotel.   Layanan transportasi di sekitar Ubud: ingat untuk telepon genggam Anda (satu kamar memiliki satu HP untuk membawa Anda di sekitar) sehingga Anda dapat memanggil staf hotel untuk menjemput anda dan menurunkan Anda di mana saja di area Ubud. Ini tidak hanya menghemat uang tetapi itu adalah sangat nyaman, terutama jika Anda bepergian dengan keluarga Anda dan R orang-orang Anda tidak dapat terlalu banyak.   Staf layanan: layanan staf adalah benar-benar luar biasa! Dari email ke kami tinggal mereka benar-benar memastikan bahwa kami diberi layanan terbaik yang…",4
168, Sapodilla Ubud,"Agak jauh dari area utama Monkey Forest, tapi pick up dan menurunkan layanan ke pusat Ubud disediakan oleh hotel staf membuat untuk itu. Mereka juga memberi Anda telepon lokal untuk kontak mereka di Ubud selama Anda tinggal. Staf sangat sopan dan selalu menyambut. Kami hanya memiliki sarapan di sini yang gratis karena kami ingin menjelajahi pusat Ubud. Kamar dan kamar mandi yang rapi. Namun, double tempat tidur di kamar kami adalah benar-benar 2 tempat tidur terjebak bersama-sama yang sangat menjengkelkan dan tidak nyaman. Berharap manajemen perubahan yang baik di dalam kamar. Secara keseluruhan hotel ini bagus.",4
169, Sapodilla Ubud,Saya memiliki waktu yang indah di hotel ini. Itu tenang dan kecil tapi sangat tenang dan indah. Hotel ini memiliki tema hutan hujan dan balkon yang menghadap ke kolam renang. Itu sangat tenang.  Staf adalah orang yang paling menakjubkan saya bertemu di Bali. Ketika saya tiba saya mengatakan bahwa saya ingin pergi ke apotek untuk krim yang dingin menyejukkan. Tanpa ragu-ragu atau stres bagi saya staf yang pergi sendiri dan membeli krim untuk saya dan saya hanya membayar $7 untuk itu. Saya sangat senang. Kami ditunjukkan kamar kami dengan antusiasme dan kehangatan seperti. Taman Budaya sangat ramah. Tas kami dibawa ke atas dan kami diberi minuman dingin untuk selamat datang. Kami pergi keluar untuk sedikit dan kembali untuk menemukan kamar kami sudah siap untuk tidur dengan nyamuk…,5
170, Sapodilla Ubud,"Sangat senang kami memesan untuk tinggal di rumah tamu sawo. Kami tinggal selama lima malam di Ubud dan menikmati makanan, layanan, keramahan, dan mendapatkan untuk mengetahui seluruh keluarga sawo. Kami tiba di akhir malam, kami disambut di lobi dengan minuman teh yang menyegarkan. Kami kemudian dibawa ke kamar kami. Kami diberitahu tentang layanan sarapan, sebuah ponsel untuk menelepon dan berkomunikasi kapanpun dengan anggota keluarga yang sawo, dan diberi tahu tentang layanan antar-jemput gratis ke tempat manapun di Ubud. Fasilitas yang luar biasa seperti menginap di sawo. Secara keseluruhan, layanan yang fantastis dari seluruh anggota keluarga sawo, sangat lezat sarapan, rumah ini terletak di tengah kota, dan kamar bersih. Saya ingin mengucapkan terima kasih kepada semua…",5
171, Sapodilla Ubud,Lokasi hotel ini cukup strategis. Seluruh bangunan yang terawat dengan baik.   Ada yang sangat bagus dan kamar yang bersih. Memiliki salah satu yang terbaik di toilet dan kamar mandi yang baik untuk harga. Satu hal adalah AC yang sedikit bising.   Staf sangat membantu dan ramah. Antar-jemput gratis yang tentunya sangat membantu dan brilian! (Kami menggunakan Antar Jemput di 05 . 30 Jam). Sarapan yang baik.   Satu hal yang kami agak sedikit kecewa dengan kolam renangnya. Tempat ini agak kotor menurut kami.   Saya pasti akan merekomendasikan hotel ini kepada teman dan saudara saya.,5
172, Sapodilla Ubud,"Kami memiliki dua kamar, 1 untuk saya dan suami saya dan 1 untuk anak kami dan teman temannya. Satu-satunya, benar-benar hanya mungkin untuk perbaikan hotel ini akan menjadi cahaya - tirai yang menghalangi. Di sisi baiknya, namun, itu adalah tempat yang bagus untuk bangun lebih awal untuk menikmati kolam renang sebelum sarapan yang luar biasa. Teh sore disajikan setiap hari (termasuk dalam tarif kamar) selalu dengan 1 1 hidangan manis dan gurih. Staf tampak benar-benar tertarik untuk mendengar tentang penemuan kami dari Ubud, bersedia untuk membantu dalam cara apapun atau menyarankan (namun tidak ada gangguan apapun). Itu benar-benar sulit untuk mengucapkan selamat tinggal setelah 4 malam! ",5
173, Sapodilla Ubud,"Mungkin yang terbaik hotel saya telah tinggal di! Staf sangat menyenangkan, kamar dan kolam renang yang indah, lezat sarapan dan antar-jemput gratis berguna.   Pada hari ulang tahun saya dan semua staf cinta untuk saya dan membawa saya kue oleh kolam renang!",5
174, Sapodilla Ubud,"Saya menginap selama dua malam di sawo tapi benar-benar mencintai tempat ini dan staf!  Terjebak di Ubud untuk sedikit lebih lama karena untuk kehilangan kartu ATM saya, mereka memberi kami lift ke bank, mereka menemukan saya akomodasi lain ketika mereka penuh dipesan, mengatakan saya masih bisa menggunakan kolam renang mereka, menyewa saya sepeda sementara tinggal di hotel lain, dan sederet daftar pujian lainnya!  Kolam renang bagus, pelayanan, besar makanan, kamar bersih, staf yang luar biasa! ",5
175, Sapodilla Ubud,"Sawo adalah salah satu resor kecil yang saya tinggal di selama waktu saya di Bali, tapi ini adalah salah satu favorit saya. hotel ini terletak tepat di jalan utama tetapi sangat tenang. Staf adalah sangat ramah, membantu dan layanan mereka. Setelah kedatangan saya disambut dengan handuk dingin dan teh, mereka memperkenalkan diri mereka sendiri untuk saya dan dari saat itu untuk keberangkatan saya. Saya ditangani oleh nama saya seperti teman lama.   Lokasi sangat bagus, ada banyak restoran dan toko-toko dalam jarak berjalan kaki, dan juga Arma Museum seni yang indah dan harus melihat Sacred Monkey Forest.   Kamarnya terawat dengan baik, besar, bersih, dan memiliki unit AC dengan kontrol suhu yang menjaga kamar bagus dan keren hari sangat panas lembab tersebut. Makan paginya juga…",5
176, Sapodilla Ubud,"Tempat ini luar biasa! Kolam renang, layanan, kamar. Ada begitu banyak perhatian terhadap detail dan pengalaman kami secara keseluruhan adalah luar biasa. Staf sangat menyenangkan dan semua orang tahu nama Anda! Elemen yang sangat luar biasa dari hotel ini adalah layanan antar-jemput gratis. Meskipun saya menemukan lokasi hotel ini besar (yang begitu dekat dengan kelezatan algojo jalan! ), mereka menawarkan sopir untuk membawa Anda di manapun Anda ingin pergi ke Ubud, dan memilih Anda bangun dengan baik! Mereka bahkan menurunkan kami di hotel kami berikutnya setelah check out, yang adalah utara dari Ubud - fantastis! Satu-satunya downside adalah tempat tidur cukup keras dan tidak nyaman. Tapi sayangnya yang cukup umum di negara Asia Tenggara!",5
177, Sapodilla Ubud,"Waktu saya di sini di sawo ini berakhir setelah 4 malam yang menyenangkan. Seperti orang lain telah mengatakan, tempat ini adalah tempat yang benar-benar indah Oasis tepat di sebuah jalan yang sibuk. Tapi menurut saya yang paling adalah staf yang membuat waktu saya di sini merasa sayang. Dari awal staf yang menyambut saya dengan hangat dan dengan ketulusan, belajar nama saya dan mengatakan ""selamat datang kembali"" setiap kali saya kembali dari kota. Keramahan mereka tulus hati saya dan teman. Ini adalah benar-benar sebuah tempat khusus.",5
178, Sapodilla Ubud,"Hotel ini luar biasa. Dari saat pertama saya tiba sampai keberangkatan terakhir kedua, sangat penuh perhatian, layanan pribadi dan di atas dan di luar.   Dimulai dengan kedatangan - tidak hanya tamu disambut dengan dingin kain basah (banyak diperlukan) - tapi dalam kasus saya. Sopir taksi saya tidak memiliki kembalian, jadi Wisna (salah satu manajer) memberikan 20, 000 30000 diperlukan. (Jangan khawatir, membayar dia kembali).   Sawo juga menyediakan gratis ""teh"" setiap sore, sentuhan yang indah bahwa anda merasa anda benar-benar merasa dimanjakan.   Tempat itu sendiri adalah luar biasa. Tidak ada kehadiran Jalan - hanya agak sedikit tanda menunjuk ke gang yg tdk merusak - tapi setelah Anda pergi ke lorong itu, hotel dan alasan yang indah. Taman adalah sangat indah dan sangat…",5
179, Sapodilla Ubud,"Secara keseluruhan pengalaman yang sangat menyenangkan. Ini adalah sebuah hotel baru dan staf benar-benar mencoba terbaik mereka dan ingin membuat tinggal sebagai menyenangkan sebagai mungkin.   Kelebihan:   - sebelum memulai perjalanan, staf menanggapi dengan cepat oleh email untuk pertanyaan  - transportasi bandara berjalan lancar  - kamar besar, bersih, nyaman, ada kamar mandi dan bak mandi yang besar, baik teras  - gratis antar jemput ke Ubud dan mereka memberi Anda telepon  - sedikit jauh dari pusat kota jadi lebih tenang dan kurang sibuk  - staf yang ramah dan bagus  - kolam renang adalah bertubuh kecil, tapi lingkungan bagus dan bersih  - mereka memberi Anda botol air yang banyak  - dilengkapi oleh staf di malam hari untuk melihat jika Anda butuh sesuatu  - pisang goreng…",4
180, Sapodilla Ubud,"Tinggal dengan istri saya selama 3 malam di hotel bagus ini. Staf sangat ramah dan tidak bisa melakukan cukup untuk membantu. Kamar yang sangat baik dengan 4 poster tempat tidur besar dan kelambu. Anda dapat memilih untuk sarapan di restoran udara terbuka yang menghadap ke kolam renang atau memiliki itu dikirim ke kamar Anda untuk makan di balkon. Ada empat jenis sarapan berbeda, Indonesia, orang Bali, Amerika dan satu disebut sawo. Kami mencoba tiga kamar yang berbeda dan semua sangat baik. Hotel ini tentang 20 - 25 menit berjalan kaki ke pusat Ubud tapi itu tidak masalah jika anda berjalan meskipun Anda harus melihat langkah anda di trotoar yang baik, tidak rata, banyak lubang, terhalang oleh tumpukan bahan bangunan, baik oleh sepeda motor atau mobil semua di atas. Hotel ini…",5
181, Sapodilla Ubud,"Yang kami suka:  Transportasi bandara adalah mudah: kami mengatur mereka untuk menjemput kami dari bandara, (untuk biaya tambahan.) ada komunikasi yang baik: mereka meminta kami untuk info penerbangan dan mengkonfirmasikan mengambil waktu. Pada saat kedatangan kami menemukan sopir kami yang memegang tanda dengan nama Hotel dan nama kami di atasnya. Sopir kami memberi kami sebotol air dan sangat ramah.   Hotel ini di lokasi yang baik: berjalan kaki ke beberapa restoran yang luar biasa, spa dan Yoga Studio. Jika Anda tidak ingin berjalan, mereka memiliki antar-jemput gratis untuk membawa Anda di mana saja di Ubud. Mereka memberi kami ponsel sehingga kami bisa memanggil mereka untuk menjemput kami untuk membawa kami kembali ke hotel. Satu kali mereka menurunkan kami di sawah jalan…",5
182, Sapodilla Ubud,"Segala sesuatu tentang sawo yang sangat baik. Bersih, kamar yang indah, tempat tidur besar, kamar mandi kelas atas, staf yang sangat ramah dan membantu. Hotel ini hanya dari jalan utama, sangat tenang dan tersembunyi dari kebisingan Ubud jadi retret yang bagus dari keramaian dan hiruk pikuk. Cukup dekat untuk berjalan ke toko-toko dan restoran. Jika Anda tidak ingin berjalan di staf akan mengantarkan anda kemana saja dan kapan saja. Mereka sangat luar biasa! Juga. Kolam Renang Yang Fantastis. Terlihat hijau tapi lantai itu bersih, segar dan yang diatur dalam pengaturan taman yang indah. jadi jika Anda mencari untuk bersantai tempat untuk tinggal kemudian memilih sawo. Kami pasti akan kembali.  Terima Kasih Sawo. ",5
183, Sapodilla Ubud,"suami saya menghabiskan 3 malam & di sawo dan kami berdua benar-benar terkesan.   Kami memesan sawo hanya setelah membaca ulasan di TripAdvisor & dapat mendukung tamu lain ' ulasan sama sekali.   Seandainya dia & staf sangat ramah & membantu, berbicara bahasa Inggris baik & selalu menyapa anda di pagi hari & ketika Anda kembali dari kegiatan, mereka tahu Anda dengan nama pertama setiap setelah 1 hari!   Kami tiba di 2 . 30 jam dengan supir yang seandainya harus teratur, seandainya terima kasih!   Ruangan itu sangat bersih, luas & nyaman, semua peralatan mandi disediakan & botol air adalah menyerahkan oleh staf setiap hari & atas permintaan.   Kami menemukan lokasi yang sempurna untuk kita, tidak terlalu jauh dari pusat kota Ubud, (15 - 20 menit berjalan kaki atau 10 jam tersedia…",5
184, Sapodilla Ubud,"sangat bagus. Nilai yang baik. Lokasi yang bagus dengan banyak restoran (Taco Casa semuanya bagus dan makanan yang baik) dan Monkey Forest dan museum di dekatnya. Selain itu, bus antar-jemput gratis di mana-mana adalah luar biasa dengan telepon yang disediakan untuk penjemputan. Bagus, kecil, staf bahagia bekerja keras untuk membuat anda bahagia. Kamar mandi besar yang indah. Bagus, sederhana kamar dengan lampu baca di atas tempat tidur. Sarapan memiliki beberapa pilihan dan mereka akan mengantarkannya ke kamar Anda. Taman hutan kecil yang indah hanya jauh dari jalan yang sibuk. Kolam renang yang bagus. Penjemputan di bandara yang bagus dan mudah untuk 350 ribu rupiah. AC bekerja dengan baik.  Kekurangan - 1) kamar mandi memiliki sangat funky, bau selokan. Saya pernah mendengar…",5
185, Sapodilla Ubud,"sangat senang kami menemukan permata kecil ini! Hotel ini baru, dan mereka benar-benar berusaha untuk turun di kaki kanan oleh hanya di atas dan di luar di daerah.  Pacar saya dan saya setuju bahwa nilai sawo yang terbaik di mana saja kami telah pernah tinggal di.   Sebagian besar ulasan pada di staf yang luar biasa (yang saya 100% setuju dengan). Mereka menyambut Anda dengan nama, mengatakan ""selamat datang kembali"" setiap hari ketika Anda kembali ke hotel, menawarkan untuk membantu Anda menjalankan tugas, transportasi gratis, mengambil Anda semangat buah anggur yang tumbuh di atas kamar yang terlalu tinggi untuk dijangkau (haha), dan benar-benar peduli tentang kenyamanan dan kebahagiaan Anda.   Saya pikir hal favorit saya adalah sawo yang indah lingkungan taman yang indah. Itu…",5
186, Sapodilla Ubud,"Super nilai untuk uang! Sulit untuk menemukan kesalahan di sini. Para stafnya luar biasa jenius & & gratis drop off & pick up kapan saja di mana saja di area Ubud sangat nyaman & anda akan menghemat banyak uang tunai. Bersih dan besar kamar tidur & kamar mandi, besar kolam renang yang menyegarkan, sederhana namun cukup sarapan, gratis botol air setiap kali Anda memerlukan, lokasi yang tenang tapi sangat berguna dengan mudah berjalan kaki ke ATM, tempat penukaran uang, toko kopi, spa, restoran & supermarket.  Jika Anda ingin nilai yang besar, memesan tempat ini karena mereka ingin untuk menyenangkan Anda.",5
187, Sapodilla Ubud,Kami hanya tinggal selama 2 hari di hotel ini 14 kamar tidur dan berharap kami telah tinggal lebih lama. Terletak di selatan Ubud tapi tersembunyi jalan yang sempit dari jalan utama dan sangat tenang. Tampak baru dan sangat bersih dengan kamar tidur besar dan kamar mandi dan kolam renang yang sangat baik. Baik Staf dan mereka semua sangat ramah dan efisien. Sawo yang kebijakan untuk membuat dan menyediakan beberapa sangat baik tanpa biaya tambahan karena disorot oleh pengulas lain. Dan staf berusaha keras untuk memberikan tambahan tersebut. Transportasi Gratis dalam kawasan Ubud di siang hari yang sangat bagus untuk mulai berjalan seperti jembatan berjalan (2 jam) dan sawah yang berjalan kaki (3 - 4 jam). Mereka menyediakan ponsel sehingga Anda dapat menelepon hotel dan…,4
188, Sapodilla Ubud,"Ini adalah rumah yang jauh dari rumah!  kami menyukai minuman selamat datang dan dingin dengan serbet untuk menyegarkan diri yang sangat kami butuhkan setelah perjalanan panjang.  Kami menyukai staf yang sopan, sangat kooperatif, selalu siap untuk melayani.  Sarapan sangat baik, dengan banyak pilihan, segar memotong buah dan bagian yang terbaik adalah jus segar dengan kombinasi yang berbeda. Selain gratis teh dan kue di sore hari. saya apriciate mereka untuk menyediakan air minum yang cukup.  Walaupun hotel ini kecil tapi saya lebih suka kolam yang bagus dan kolam renang untuk menikmati. Kamar sangat luas dengan balkon dan seperti yang ditunjukkan dalam gambar.   Pelayanan terbaik di hotel ini adalah mereka menyediakan telepon seluler dan layanan antar-jemput gratis ke Ubud.…",5
189, Sapodilla Ubud,"Kami baru saja meninggalkan sawo kemarin, setelah 3 malam menginap. Saya adalah ibu hamil, mengunjungi dengan suami saya dan anak kami yang berumur 3.5. sangat dianjurkan untuk keluarga.  Staf yang ramah dan tanggapan cepat.  Kamarnya luas dengan balkon. Lokasi ini juga baik. Itu cukup tapi masih dekat dengan tempat wisata di Ubud.  Restoran, warung dan toko sangat mudah untuk menemukan.  Mereka menyediakan layanan antar jemput gratis untuk daerah Ubud dan teh di sore hari yang merupakan plus untuk saya.  Mereka tidak memiliki banyak kamar, hanya 14. Itu membuat saya merasa seperti di villa pribadi.  Pasti akan kembali nanti.  Pekerjaan baik tim sawo.",5
190, Sapodilla Ubud,Hotel ini menempatkan 5 bintang Layanan dan desain ke sebuah hotel kecil di lokasi yang sangat strategis. Aku tidak bisa memikirkan apa pun yang mereka bisa memperbaiki. Antar-jemput gratis di mana saja di pusat Ubud sepanjang hari. Kolam renang yang bagus. Sarapan yang lezat. Staf sangat ramah dan penuh perhatian. Itu langka untuk melihat sebuah hotel kecil yang melakukan segala sesuatu yang sangat baik. Ada sesuatu yang spesial yang ada di sini.,5
191, Sapodilla Ubud,"Saya dan istri saya mengunjungi Ubud beberapa kali sebelumnya tapi kali ini kami dilakukan dengan teliti ulasan sebelum memesan akomodasi yang terus terang tidak seperti kami!  Sawo adalah pilihan kami dan kami benar-benar tidak ada penyesalan dan akan kembali ke sana lagi tanpa ragu-ragu. Manajer dikumpulkan kami dari Denpasar sesuai perjanjian dan membawa kami ke hotel di mana ia memperkenalkan kami kepada staf yang bertugas, selama kami tinggal kami merasa telah menjadi ""teman dan keluarga"", tidak hanya para tamu. Kamar di lantai pertama bersih dan dilengkapi dengan baik termasuk AC dan kelambu. Dari balkon kita melihat ke bawah pada kolam renang yang staf cenderung secara teratur.  Sarapan dimasak untuk memesan dan standar yang tinggi. Ubud adalah Awash dengan restoran tapi…",5
192, Sapodilla Ubud,Kamar yang bersih dan sangat besar. Lokasi agak jauh dari pusat kota Ubud tapi sopir gratis yang menjemput (di mana saja) untuk layanan ganda. Tersedia sebuah ponsel khusus untuk memanggil resepsionis mereka. Hanya menelepon dan Anda bisa mendapatkan taksi untuk menjemput Anda di mana saja ke mana saja Anda inginkan. Staf yang sangat ramah dan baik. Sangat direkomendasikan.,5
193, Sapodilla Ubud,Saya suka hotel ini kecil dan tidak banyak orang-orang yang mengakomodasi mereka. Itu merasa lebih seperti berada di rumah sendiri. Saya menghargai bahwa mereka menyediakan layanan antar jemput ke pusat Ubud dan membawa kami kembali ke hotel! Layanan mereka memberi Anda telepon sehingga Anda dapat menelepon mereka untuk layanan antar jemput dan permintaan lainnya. Kolam renang juga bagus. Kamar yang kami dapatkan adalah untuk pasangan tapi anda dapat menjelaskan bahwa dengan mereka. Ada tidak ada pintu antara kamar tidur dan kamar mandi. Kecuali Anda dengan itu. Tapi secara keseluruhan itu adalah pengalaman yang indah. Mereka membantu saya membawa lukisan saya untuk check - in dan gratis. Saya sangat menyukai tempat ini!,4
194, Sapodilla Ubud,"Saya menginap dengan seorang teman selama 3 malam di sawo dan hotel ini sangat bagus, terutama untuk harga. Staf adalah luar biasa ramah, kolam renang dan kamar sangat bagus. Sarapan juga bagus. Mereka memiliki seorang sopir yang membawa kami di sekitar di luar Ubud - dia sangat ramah dan dengan harga yang wajar. Memberikan tempat ini 5 bintang sangat mudah.",5
195, Sapodilla Ubud,"Suami saya dan saya menginap selama 7 malam Di sawo dan menemukan ini untuk menjadi hotel yang menyenangkan. Staf yang sangat penuh perhatian dan ramah. Mereka punya layanan antar jemput yang akan membawa Anda ke pusat Ubud sebagai Hotel adalah sekitar 30 menit berjalan kaki. Hutan Monyet hanya berjarak 15 menit berjalan kaki tetapi Anda dapat meminta untuk lift. Anda diberi ponsel untuk selama Anda tinggal sehingga Anda dapat memanggil lift ke atau dari makan malam, Pasar dll staf akan juga membantu dengan tur atau lapangan yang ingin Anda lakukan. Kamarnya luar biasa! Persis seperti gambar. Kolam renang besar, 18 meter dan sangat bersih (terlihat hijau karena keramik hijau untuk cocok dengan taman). Anda mendapatkan berbagai pilihan sarapan yang baik yang disajikan kepada Anda…",5
196, Sapodilla Ubud,Senang saya menginap di sawo. Ini adalah hotel kecil. Hanya 14 kamar tapi bersih. Kamar mandinya luas dengan fasilitas yang disediakan. Tempat tidur adalah nyaman dan aku tidur dengan baik. Hotel ini memiliki sebuah restoran yang menyajikan makanan yang lezat. Saya suka sarapan yang anda bisa meminta untuk memiliki di balkon dari kamar yang menghadap ke kolam renang. Hotel ini juga memiliki antar-jemput gratis ke & sekitar daerah ubud. Ada banyak kafe & warung dalam jarak berjalan kaki dari hotel. Saya tidak bisa berterima kasih staf cukup sawo. Mereka adalah sangat ramah & sopan. Saya tidak akan ragu untuk menginap di ketika saya mengunjungi ubud sawo di masa depan.,5
197, Sapodilla Ubud,"Hotel kecil yang indah dengan hanya enam belas atau jadi kamar. Berukuran kecil yang memungkinkan mereka memberikan layanan pribadi yang fantastis. Selalu tersenyum dan sopan staf belajar nama Anda dan selalu bersemangat untuk membantu. Itu benar-benar membuat perbedaan seperti. Hotel ini sangat baru yang besar dan kamar yang luas dilengkapi dengan baik dan mewah. Kolam renang sangat panjang dan ramping, dan dipenuhi dengan tanaman tropis yang rimbun. Area kolam baik terlindung dari adalah jalan yang sibuk di luar dan Anda cenderung untuk mendengar musik tradisional dari tari teater sebelah. Anda dapat memperoleh Amerika, Indonesia atau bali sarapan dikirim ke kamar Anda setiap pagi untuk makan di teras, yang termasuk dalam tarif kamar (bahkan ketika di Agoda mengatakan bahwa…",5
198, Sapodilla Ubud,"Hotel yang sangat bagus, staf sangat membantu, kolam renang yang indah. Kamar besar, dengan balkon dan kamar mandi juga besar, terbuat dari batu putih, yang sangat bagus. Bahkan ada sebuah bak mandi. Layanan antar jemput gratis",5
199, Sapodilla Ubud,"Hotel di Ubud ada yang sawo salah satu tempat di mana anda tahu anda sendiri "" yang saya butuhkan untuk membiarkan orang lain tahu tentang tempat ini. "" Ini adalah hotel kecil yang terletak dari jalan sedikit (sehingga berteduh anda dari jalan lalu lintas). Semua kamar menghadap ke kolam renang yang panjang dan ramah - sangat tenang dan menenangkan. Sebagian besar tamu adalah pasangan muda atau teman, sehingga menambah suasana ketenangan. Ruangan itu luas dan penuh cita rasa yang dilengkapi dengan kamar mandi yang besar dan elegan; kamar mandi besar dengan banyak air panas dan bak mandi granit yang dituangkan dalam -.   Sarapan disajikan di kamar kami yang indah dan luas (Anda memiliki empat pilihan berbeda sarapan; yang sawo, Bali, Barat dan Asia). Layanan lebih penuh…",5
