,hotel,review,stars
0, Sapodilla Ubud,"Sapodilla Ubud adalah sebuah oase kecil yang indah, dekat dengan hiruk pikuk Ubud, tetapi damai, hijau dan sangat nyaman. Staf yang fantastis dan membuat kami merasa sangat welcome. Jauh lebih banyak daripada yang saya harapkan untuk harga.",5
1, Sapodilla Ubud,"Kami benar-benar menikmati kami menginap di hotel kecil ini. Kamar besar, tempat tidur nyaman, balkon bagus, kami punya kamar di lantai atas yang kami sukai. Kamar mandi besar dengan bak rendam terpisah. Staf tahu nama kami pada hari pertama dan seperti cara orang Bali, selalu bertanya tentang hari kami, makan dll setiap kali kami melewati lobi. Kolam renangnya sempurna. . . hangat dan mengundang. . . kami berenang setiap hari. Mereka menawarkan teh di sore hari sehingga kami biasanya menikmatinya di tepi kolam renang. Makanan di restoran White Ginger sangat baik. . sarapan sangat besar! ! ! Terima kasih untuk pengalaman menginap yang luar biasa! ! !",5
2, Sapodilla Ubud,"Kami baru saja selesai menginap 3 malam di hotel ini, dan benar-benar tidak bisa kesalahan sama sekali. Staf benar-benar bermanfaat dan ramah. Kami menyukai kenyataan bahwa kami bisa sarapan di restoran atau di kamar kami. Pilihan sarapan lebih dari cukup untuk kita. Kamar kami 108 luas dan mengakomodasi kami bertiga dengan mudah. Teh sore adalah bonus. Sedikit berjalan kaki ke pusat kota Ubud (30 menit berjalan kaki), tetapi hotel ini memiliki layanan pengantaran dan penjemputan yang efisien ke kota. Senang dengan kunjungan kami!",5
3, Sapodilla Ubud,"Hotel yang menyenangkan dengan staf yang sangat menyenangkan, menjadikan masa menginap yang sangat pribadi. Saya dibuat merasa diterima langsung dari kontak email pertama saya hingga perpisahan staf ketika saya pergi. Segera setelah Anda menuruni jalan masuk dari jalan Ubud yang sibuk, Anda langsung berada di lingkungan yang damai & ramah. Ada prob 16 atau lebih kamar, jadi itu tidak terlalu besar atau sangat Anda butuhkan.  Luar biasa juga bagaimana mereka memberi Anda ponsel lokal. Anda dapat menggunakan ini untuk meminta transfer gratis kembali ke hotel setelah makan malam, atau gunakan ketika keluar dan akan mengatur kegiatan Anda sendiri, dll (& tentu saja hotel juga lebih senang melakukannya atas nama Anda).  Lokasi ini juga sangat bagus dan sentral, dekat dengan banyak…",5
4, Sapodilla Ubud,"Jika Anda pergi ke Ubud, jangan ragu satu detik, pergi dan tinggal di Sapodilla. Hotel dengan jumlah kamar yang terbatas ini adalah tempat menginap.  - PERTAMA: staf super, seperti keluarga. Ramah, profesional, dan Anda merasa mereka menyukai apa yang mereka lakukan.  - KEDUA: kamar yang indah, baru, modern, dan dengan sentuhan Bali.  - KETIGA: kolam yang sangat santai.  - EMPAT: semua layanan yang Anda butuhkan.  Saya menghabiskan 5 hari di Ubud bersama keluarga saya (2 anak: 8 dan 1, 5) dan kami semua sangat menikmati.  Sekali lagi terima kasih Yuli untuk Anda dan semua staf Sapodilla. Berharap untuk melihat Anda segera.  Nicolas",5
5, Sapodilla Ubud,Kami memesan dia karena ulasan bagus. Kami tiba dan menemukan buku itu dengan mudah dibawa ke kamar atas kami. Dalam satu jam kami melihat suara gerinda di luar kamar kami. Di sebelahnya ada bengkel sejenis yang membuat suara menggiling dan menggedor sangat keras. Ini berlanjut keesokan paginya dan sebagian besar hari kami mengeluh dan diberi kamar lain di lantai bawah. Segera setelah saya memasuki kamar memiliki bau yang sangat apak. Itu menjadi tak tertahankan. Kami diberitahu tidak ada ruangan lain. Manajer berusaha untuk membantu kami menemukan hotel lain. Kami akhirnya di rumah tamu dari peringkat yang jauh lebih rendah untuk sisa 3 malam kami tetapi menghabiskan satu hari liburan kami. Saya akan mengkonfirmasi bahwa tidak ada konstruksi di sebelah atau bahwa kamar adalah…,1
6, Sapodilla Ubud,"Saya adalah pelanggan yang relatif pemilih. Saya percaya jika saya membayar sesuatu itu harus sesuai dengan standar saya. Karena itu, saya dapat dengan jujur mengatakan bahwa Sapodilla menawarkan layanan pelanggan yang sangat baik serta akomodasi. Teman saya dan saya hanya menghabiskan 7 hari di sana dan jika saya bisa, saya akan tinggal di seluruh perjalanan saya di sana. Saya baru saja pergi ke tempat baru saya di Jimbaran (Sapodilla belum memiliki hotel di luar Ubud) dan saya sudah kehilangan segalanya tentang Sapodilla. Mereka menawarkan antar-jemput gratis (dengan van atau sepeda motor) ke daerah mereka dan mereka bersedia untuk membuat akomodasi untuk perjalanan lebih jauh dengan pengemudi dalam pekerjaan mereka. Kami memiliki hambatan kecil dengan mengambil pada hari…",5
7, Sapodilla Ubud,"Hotel butik yang indah, tenteram, dibangun di sekitar kolam renang yang indah di taman yang menawan. Kamar kami yang ditata apik itu nyaman dan penuh gaya, dengan kamar mandi luas lengkap dengan bak mandi panjang dan dalam dan pancuran terpisah. Layanannya luar biasa, dan pemiliknya, Yuli, dan stafnya sangat ramah dan membantu (antara lain, pada jam 7:00 malam pada hari terakhir kami di Ubud, meskipun kami sudah check out, mereka membiarkan kami menggunakan shower sebelum menempuh 2 + jam perjalanan ke tujuan berikutnya). Kami tidak pernah berhasil ke layanan teh sore gratis, tetapi menikmati makan siang yang enak di restoran hotel terlampir, White Ginger. Hotel ini terletak di belakang restoran, jadi meskipun terletak tidak jauh dari jalan utama, hotel ini tenang dan terasa…",5
8, Sapodilla Ubud,"Kami tinggal di hotel ini selama 5 malam dan sangat menikmati kami tinggal. Staf yang luar biasa dan bermanfaat. Saya berharap untuk sarapan setiap hari karena makanannya sangat lezat! Ada buah-buahan segar, pisang goreng, dan pilihan sarapan Indonesia / Bali atau Barat. Bubur Bali adalah favorit saya! Antar-jemput gratis hebat karena mereka menurunkan kami di tempat yang kami inginkan dan mengambil adalah proses yang mudah. Hotel ini juga dalam jarak berjalan kaki ke hutan monyet, gudang yoga, dll. Sapodilla adalah tempat yang tepat untuk menginap dan saya akan kembali lagi!",5
9, Sapodilla Ubud,"Kami tinggal dua malam dan berharap kami tinggal lebih lama. Stafnya luar biasa, pacar saya sakit ketika kami tiba (virus) dan mereka tidak bisa berbuat cukup untuk membantu bahkan memberinya mangkuk buah dan kartu kesehatan. Kolam renang adalah memperlakukan dan sangat santai. Kamar-kamarnya sangat bersih dan memiliki shower besar serta bathtub dengan toilet terpisah. Mereka menawarkan pengiriman gratis dan menjemput di Ubud, Anda cukup menelepon mereka dari telepon yang mereka berikan untuk Anda menginap. Mereka juga mengatur sopir bagi kami untuk membawa kami ke Kuta tetapi semua pemandangan di sepanjang jalan. Benar-benar tidak bisa merekomendasikan tempat ini dengan cukup.",5
10, Sapodilla Ubud,Tempat terbaik untuk memesan akomodasi Anda di Ubud. Yang paling saya sukai adalah desain kamar. Itu nyaman dan tetap bagus. Sarapan juga bagus. Mereka berkonsentrasi pada semua detail kecil dan staf sangat ramah. Kami merekomendasikan hotel ini kepada semua orang.,5
11, Sapodilla Ubud,"Ini adalah hotel yang luar biasa. Indah, ramah, membantu staf. Fasilitas hebat seperti layanan kamar, sarapan gratis, antar-jemput gratis. Saya telah tinggal di hotel terbaik, staf membuat tempat ini. Akan tinggal di sini lagi dan pasti akan merekomendasikan kepada orang lain. Tempat yang indah untuk menghabiskan bulan madu kami. Saya sangat menyukai setiap menitnya dan tidak ingin pulang.",5
12, Sapodilla Ubud,Kami menginap di Ubud ketika kami di biji sawo di mana di Bali beberapa minggu yang lalu. Kamar-kamarnya benar-benar indah dan kolam renang dan taman yang terawat dengan baik. Manajer Yuli dan staf yang luar biasa dan tidak bisa lebih membantu. Mereka menyediakan kami dengan nomor telepon yang digunakan untuk menjemput dengan ada layanan antar jemput gratis di area Ubud. Sangat merekomendasikan tinggal di sini jika anda berada di area Ubud. Dan Alan Liesa,5
13, Sapodilla Ubud,"Saya pergi ke Bali minggu lalu bersama istri dan bayi berumur 6 bulan, dan memiliki 3 hari menginap di biji sawo Ubud. Pertama, di sini ada beberapa detail tentang hotel itu sendiri: - Fasilitas: kamar seperti kamar hotel bintang 5. . Indah dan luas.. Mereka menyediakan sarapan di kamar anda, yang cukup bagus. Hotel ini memiliki kolam renang kecil, yang sebagian besar, karena orang-orang cenderung kosong untuk berjalan keluar sepanjang hari di Ubud. Tidak ada pusat kebugaran atau spa, tetapi mereka terpisah juga menawarkan pijat di kamar sendiri. Secara keseluruhan, hotel ini dihiasi dengan baik dari segi estetika dan memiliki Ubud yang sempurna. Untuk jumlah mereka mengenakan biaya, hotel ini menawarkan nilai yang luar biasa untuk yakin  - Lokasi: terletak 10 menit dari istana…",5
14, Sapodilla Ubud,"Kami mendapatkan kamar yang luas & yang indah di Ubud, biji sawo bersih tanpa noda dengan lantainya dari marmer -. Di lantai 2, kamar kami memiliki balkon yang menghadap ke kolam renang dengan banyak tanaman hijau. Ini adalah bonus karena hotel langsung medan salah satu dari Ubud sangat jalan yang sibuk, yang nampaknya ramai dan berisik sepanjang hari. Biji sawo yang menyenangkan di oasis kontras. Stafnya lebih dari membantu dan kami sangat puas dengan pelayanan mereka. Wifi, tidak seperti kebanyakan yang kami temui di Indonesia, sangat luar biasa. Hint: Kamar kami di 202 dan router di luar beranda kamar kami. Menu sarapan yang baik, sebagai pilihan adalah makanan. -biji sawo ini merupakan pilihan yang sangat baik jika anda ingin tinggal di jantung Ubud. Kami akan pergi ke sana…",5
15, Sapodilla Ubud,"Kami awalnya telah memesan untuk 2 malam tetapi setelah kami ingin memutuskan untuk menginap selama 3 . Ketika kami tiba, kami disambut dengan handuk dingin dan minuman selamat datang dan setelah bertanya tentang menginap 3 malam, mereka menemukan rd kami kamar di hotel saudara perempuan mereka, dan mendapat villa Motama harga diskon di sana untuk membantu kami! Mereka sangat cepat untuk membersihkan kamar dan membantu kami dengan masalah apapun. Semua orang sangat baik dan sangat ramah dan bahkan Yuli berjalan ke kami di Villa Motama bagus ketika kami check in di sana. Saya sangat merekomendasikan hotel ini untuk siapa saja yang melakukan perjalanan ke Ubud!",5
16, Sapodilla Ubud,"Hotel Ubud adalah biji sawo, sebuah hotel kuno dengan kamar yang menyenangkan dan sangat ramah dan membantu. Sarapan sudah termasuk dalam harga kamar dengan berbagai pilihan dan sangat luar biasa. Hotel ini adalah lokasi yang bagus dan sangat bagus untuk pasangan, keluarga, dan teman-teman. Sedangkan area kolam renang yang indah, tidak melihat banyak sinar matahari yang berarti adalah benar-benar cukup dingin. Meskipun sangat kecil, titik ini saya akan sangat merekomendasikan hotel ini untuk siapapun biji sawo Ubud mengunjungi Ubud.",5
17, Sapodilla Ubud,"Tenang, kecil, hotel yang ramah dengan kolam renang & taman yang indah. Semua staf sangat ramah dan membantu, termasuk kue ulang tahun yang tidak terduga. Beberapa baik masakan Indonesia di restoran mereka tapi kopi jahe putih agak rata-rata. Kamar yang luas dengan besar dapat diandalkan wifi. Saya akan kembali!",5
18, Sapodilla Ubud,"Selama kami tinggal di Bali, kami menginap di hotel-hotel di sekitar tiga semua 60 malam dan senilai € biji sawo yang tanpa ragu yang terbaik. Pada saat kedatangan, suasana keseluruhan sangat santai, dan pribadi berorientasi pelanggan. Kamarnya sangat luas, bersih dan tenang. Tempat ini memiliki rasa yang mewah. Total Staf-stafnya sangat bagus, misalnya mereka mengambil waktu untuk lear nama kami dan memanggil kita oleh mereka. Sarapan disajikan di balkon tanpa biaya tambahan dan secara keseluruhan makanan dan minuman yang kami pesan dari layanan kamar ke kolam renang yang lebih murah daripada di restoran yang kami kunjungi. Satu hal kecil yang saya ingin lihat adalah bahwa akan ada handuk di kolam renang di sepanjang waktu. Secara keseluruhan merupakan pengalaman yang sangat…",5
19, Sapodilla Ubud,"Kami menginap di 5 - 6 biji sawo untuk malam dan ini adalah pengalaman paling luar biasa kami. Cukup berjalan kaki ke banyak restoran yang bagus dan beberapa super market. Biji sawo restoran sendiri juga cukup bagus.  Apa yang bersinar adalah layanan yang luar biasa. Transportasi gratis dan telepon seluler sangat dan bahkan mono rel costlier hotel tidak memiliki fasilitas ini. Malam hari kue dengan teh Bali adalah di atas apa yang sakura sudah merupakan pengalaman yang sangat bagus.  Kami bersenang-senang, direkomendasikan untuk teman yang sama dan mereka sangat senang dengan pengalaman juga.",5
20, Sapodilla Ubud,"Saya berharap saya bisa tinggal lebih lama di biji sawo! Hotel ini adalah sebuah nilai yang sangat baik untuk harga. Akomodasi yang indah dan mewah. Staf sangat ramah, perhatian, dan membantu. Satu hal yang unik tentang Hotel ini adalah bahwa mereka menawarkan waktu minum teh di sore hari di mana anda dapat mendapatkan teh pilihan anda dan makanan ringan. Mereka juga menawarkan layanan antar jemput ke Ubud dan memberikan anda sebuah ponsel untuk mengatur menjemput penumpang. Restoran yang berdekatan dengan Hotel ini tenang dan lezat dan juga ada banyak pilihan restoran di dekatnya. Lainnya",5
21, Sapodilla Ubud,"Kami sangat menikmati kunjungan kami di biji sawo Inn! Di bawah ini adalah sebagian dari banyak alasan untuk tinggal di sini:  - Yuli, manajer, indah dan benar-benar peduli dengan tamu. Sayangnya saya berhasil menangkap cukup buruk dingin di pesawat jadi saya menghabiskan beberapa hari pertama dari liburan kami di tempat tidur. Yuli memiliki teh jahe sebagai pelengkap yang dikirim ke kamar kami dan bersikeras bahwa saya meminta lebih banyak waktu untuk mempercepat pemulihan saya. Dia menyapa kami setiap pagi, menanyakan bagaimana cara kami lakukan, dan menawarkan saran dan rekomendasi membantu kapanpun kami ada pertanyaan. Staf yang lain juga benar-benar luar biasa. Saya tidak bisa memuji staf cukup.  Tamannya indah dan kamarnya. Kamar kami sangat bersih dan modern, dengan kamar…",5
22, Sapodilla Ubud,"Kami memiliki pengalaman hotel terbaik di biji sawo! Para staf sangat baik dan membantu, sarapan yang lezat dengan banyak pilihan, layanan mobil yang luar biasa dan hostel ini bisa ditempuh dengan berjalan kaki dari Monkey Forest. Kami diperlakukan dengan sangat baik, dengan segala kebaikan. Peralatan yang sempurna, kolam renangnya juga bagus dan pendingin udara pasti akan menjadi nilai tambah. Kami juga memiliki koktail yang satu malam di restoran dan mereka benar-benar bagus.  Tempat yang luar biasa, dengan kualitas terbaik/rasio harga! Terima kasih banyak kepada biji sawo keluarga dan kami berharap untuk menginap lagi di hotel anda :)",5
23, Sapodilla Ubud,"Staf di biji sawo super ramah dan menyenangkan dengan kemampuan bahasa Inggris, anda akan disambut dengan minuman selamat datang ketika anda tiba. Juga jika anda memiliki pertanyaan sebelum anda menginap, anda bisa whatsapp mereka dan mereka akan membalas dengan cepat.  Hotel ini menawarkan transportasi gratis di mana anda dapat memanggil shuttle untuk membawa anda di sekitar pusat kota Ubud dengan telepon seluler mereka memberikan anda selama ini sebelum jam 10 malam.  Sarapan sudah termasuk dan bisa disajikan dari balkon kamar.  Kamar untuk perbaikan - harap menambahkan lebih banyak lampu ke kamar sangat redup yang kami hampir tidak bisa melihat apa pun di dalam dengan nyaman. Juga wifi yang sangat buruk di seluruh hotel, jadi harap meningkatkan itu.  Selain sangat redup lampu…",4
24, Sapodilla Ubud,"Apa yang indah. Tempat ini adalah menyenangkan! Realively baru, dan butik yang menyenangkan! Saya baru saja menghabiskan dua minggu dan tidak bisa lebih bahagia dengan pengalaman saya. Kamarnya segar dan menyenangkan dan terawat dengan baik. Taman yang asri dan kolam renang yang mengundang dan tempat yang mengagumkan untuk mendinginkan tubuh dan bersantai. Kafe jahe memiliki putih beragam menu dan cukup jujur sesuatu fir semua orang. Ikan-ikan n chios (oleh kolam renang) dan iga babi yang favorit saya.. Staf yang menyenangkan, banyak yang baru dan belajar dan mereka bersedia untuk hanya itu. Beberapa mungkin diperlukan kesabaran tapi hey itulah bagian yang terbaik! Semua dalam semua saya mengalami waktu yang terbaik dan saya sangat merekomendasikan untuk beristirahat dan…",5
25, Sapodilla Ubud,"Kami menginap selama 2 malam di biji sawo setelah membaca ulasan positif online.  Cukuplah untuk mengatakan bahwa kami tidak kecewa. Kamarnya rapi dan bersih, dan setiap permintaan dan query adalah dengan segera dan efisien ditangani.  Seluruh staf dan manajer Yuli terutama sangat membantu dan ramah.  Turun dan fasilitas penjemputan untuk daerah sekitar Ubud sangat membantu.  Secara keseluruhan benar-benar senang dengan properti yang terawat dengan baik dan bergaya homestay keprihatinan para staf untuk kesejahteraan kita.",4
26, Sapodilla Ubud,"Saya dan istri saya menginap di Sapodila Ubud selama 2 malam untuk mengunjungi pantai Lovina, dan atraksi lainnya di dekat area Ubud. Hotel ini terletak di sepanjang jalan utama, tetapi sangat tenang. Ada restoran dan toko-toko di dekat hotel. Staf sangat ramah dan membantu. Kami disambut dengan hangat dan disajikan dengan minuman selamat datang ketika kami tiba. Proses check in - mudah di dan cepat. Mereka membawa kami ke kamar dan memberikan kami untuk beberapa informasi briefing singkat tentang hotel dan layanan mereka. Hotel ini sangat bagus dan berguna bagi kami. Kamar kami besar dan bersih. Ada banyak steker listrik bagi kami untuk mengisi daya ponsel dan bank. Pemesanan kami termasuk sarapan dan kami telah menawarkan untuk menikmati sarapan di balkon kami sendiri atau di…",5
27, Sapodilla Ubud,"Kami memesan hotel ini di menit-menit terakhir setelah menginap di bagian lain dari ubud dan saya harus mengatakan bahwa tempat ini luar biasa! Staf yang sangat ramah, hotel ini sangat bersih dan sangat nyaman. Mereka menawarkan layanan shuttle bus di sekitar ubud yang sangat bagus juga. Kolam renangnya sangat bagus dan meskipun sangat padat namun tetap merupakan suasana santai yang bagus! Kami benar-benar menikmati waktu kami menginap di sini dan pasti akan kembali :)",5
28, Sapodilla Ubud,"Saya menginap di sini dengan pasangan saya selama 4 hari dan yang dapat saya katakan adalah saya berharap kami tinggal lebih lama! Dari awal sampai akhir, tempat ini sempurna.  Kami tiba setelah 24 jam untuk wajah yang ramah, minuman selamat datang dan teliti pendahuluan untuk hotel. Kami kemudian diantar ke kamar kami yang berada di lantai dasar. Kamarnya luas dengan tempat tidur yang nyaman dan indah dengan kamar mandi yang besar dengan shower freestanding ditambah dan toilet terpisah, dan selalu bersih tanpa noda. Pintu dibuka keluar teras kecil di mana saya sarapan (yang fantastis) diantar setiap pagi, dan kemudian kami hanya bisa langsung ke kolam renang langkah. Kolam renangnya sempurna dan sangat santai.  Kami juga diberi telepon seluler pada saat kedatangan yang untuk…",5
29, Sapodilla Ubud,"Resor ini menawarkan suasana yang damai. Staf dan pelayanan yang luar biasa! Tidak ada keluhan dengan resor ini! Restoran memiliki baik Jahe Putih cappuccino, menghadap ke jalan utama yang tidak terlalu buruk! Benar-benar tempat yang bagus!",5
30, Sapodilla Ubud,"Selamat datang di rumah adalah bagaimana mereka menyambut Anda di biji sawo dan merupakan perwujudan segala sesuatu tentang kebaikan dan kualitas pelayanan hotel butik yang nyaman. Saya tidak bisa cukup mengatakan tentang berapa banyak orang di biji sawo keluar dari jalan mereka untuk membuat anda merasa seperti di rumah sendiri. Pertama, anda mendapatkan telepon seluler yang sangat berguna. Hotel ini cukup berjalan kaki ke toko-toko dan restoran serta pusat ubud tetapi hotel juga akan membawa anda dan menjemput anda. Sarapannya lezat dan enak, bahkan dengan telur saya alergi. Kamar kami sangat nyaman dan bersih, dengan mini bar diisi ulang dengan harga terjangkau, minuman dan makanan ringan. Anda mendapatkan banyak botol air seperti yang anda inginkan! Salah satu layanan yang…",5
31, Sapodilla Ubud,"Saya memutuskan untuk menghabiskan 6 malam di biji sawo, membuat liburan saya di Bali homebase bukannya bergerak dari kota ke kota. Saya senang saya membuat pilihan tersebut, dan biji sawo adalah tempat yang sempurna untuk tinggal lama jika anda merasa seperti dimanjakan. Anda memulai hari dengan begitu banyak pilihan dari menu sarapan yang disajikan di balkon. Kolam renang tepat di depan kamar, selalu bersih dan tidak berisik. Ada teh gratis di sore hari. Mereka menyediakan anda dengan telepon lokal kecil yang dapat membawa anda berkeliling, dan meminta untuk antar-jemput gratis penjemputan mana saja di Ubud. Restoran, "" "" adalah jahe putih juga cukup bagus.  Lokasi - tidak di sangat pusat Ubud tetapi itu cukup mudah untuk berjalan kaki ke Jalan Hanoman atau Monkey Forest.…",5
32, Sapodilla Ubud,"Saya dan suami saya menginap di sini selama 3 malam sebagai bagian dari perjalanan pertama kami ke Bali yang pernah. Benar-benar menikmati kunjungan kami. Kamarnya luas dan terang penuh, bersih dan tenang. Kami memiliki kamar di lantai atas dengan balkon yang lebih pribadi daripada kamar tepi kolam renang di lantai dasar.  Semua staf sangat ramah dan membantu. Sukma, Dina, Ramini dan beberapa orang-Seandainya saya ingat nama, semua begitu baik. Teh sore gratis yang disajikan antara pukul 3 dan 6 sore adalah sentuhan yang bagus.  Hal lain yang luar biasa tentang hotel ini adalah layanan antar jemput gratis untuk bepergian di sekitar pusat Ubud. Anda akan diberikan untuk menggunakan telepon seluler Anda selama menginap, jadi jika anda membutuhkan menjemput anda hanya memanggil…",5
33, Sapodilla Ubud,"Saya menginap selama 6 malam di Ubud dan biji sawo akan merekomendasikan hotel ini paling tinggi. Sebagai orang yang bepergian sendirian, saya tidak ragu mengatakan saya akan kembali untuk menginap di biji sawo saat saya kembali ke Bali. Ini merupakan salah satu tempat favorit saya untuk menginap, saya merasa santai, nyaman dan aman. Kamar-kamarnya modern dan bersih, tempat tidur yang sangat nyaman. Kamar mandi sangat besar, bersih dan terawat dengan baik, mereka memeriksa semuanya di kamar mandi beberapa kali dalam sehari. Kolam renang sangat bagus dan santai dan tampaknya memiliki lounge yang cukup, mungkin ada beberapa handuk untuk kolam renang akan lebih baik. Staf yang luar biasa dan selalu bersedia membantu dan mereka menyapa anda ketika anda kembali, menyambut anda. Tidak…",5
34, Sapodilla Ubud,"Saya pernah menginap di hotel ini dua kali dan keduanya sekarang biji sawo kali kunjungan saya telah luar biasa. Setelah kunjungan pertama saya menemukan diri saya sendiri sering berpikir tentang bagaimana saya menginap dan kerinduan untuk kembali: perjalanan & 2 tidak mengecewakan! Tempatnya kecil dan akrab, dengan banyak staf yang bekerja, semua orang yang keluar dari jalan mereka untuk membantu dan menyenangkan. Saya sangat menyukai bagaimana semua orang memanggil saya dengan nama saya, bagaimana mereka berkata "" selamat datang di rumah "" ketika saya kembali setelah seharian, bagaimana ketika saya menyebutkan saya suka pisang yang saya dapatkan di sarapan ekstra pisang setiap pagi (! Benar-benar layanan yang bagus ) , dengan kehangatan dan keramahan khas Bali. Istimewa…",5
35, Sapodilla Ubud,"Menginap di hotel ini adalah jujur favorit saya. Saya sudah menginap dua kali sejauh ini, setiap kali untuk rentang waktu yang lama. Pertama-tama, kamarnya bersih dan luas - banyak air panas, ac yang dingin, dll. lingkungannya tenang dan damai, semuanya terawat dengan baik. Anda juga akan mendapatkan banyak keuntungan: cukup banyak karena banyak sarapan karena anda akan seperti, diantar ke kamar, layanan antar-jemput gratis (mereka cepat dan akan mengantarkan anda ke sekitar beberapa kali sehari) , teh/kopi + permen Bali (kami menginap 9 hari dan tidak pernah mengulangi) . permen Saya benar-benar bisa makan dan makan lagi. . . Namun, seperti yang orang lain telah sebutkan, staf benar-benar apa yang menonjol tentang tempat ini. Ada 12 kamar dan mungkin 15 anggota staf. Semua…",5
36, Sapodilla Ubud,Saya mendapat pengalaman 9 malam menginap di sini dan saya benar-benar senang telah memutuskan untuk menginap di sini selama hari-hari terakhir saya menginap di Bali. Para staf sangat luar biasa. Kamar saya menghadap kolam renang yang bagus dan kolam renang yang terawat dengan indah. Saya sudah tidak ada kata untuk sarapan. Mereka memiliki banyak pilihan untuk memilih dari dan anda juga dapat menyesuaikan mereka lebih jauh. Anda dapat memiliki di restoran mereka atau di beranda kamar anda. Saya mendapatkan pijat Bali dan pelengkap saya akan mengatakan ini pijat telah terbaik pijat ala Bali yang pernah saya rasakan. Terapisnya menggunakan Juni tampaknya memiliki pengetahuan tentang pijat yang sempurna. Layanan antar-jemput adalah yang terbaik. Jika anda perlu untuk pergi ke mana…,5
37, Sapodilla Ubud,"Saya menginap di sini hanya satu malam di bulan November 2017 . Saya berharap saya saya memesan seluruh menginap 5 malam disini ketika saya pergi ke Bali. Staf yang luar biasa adalah yang paling berkesan. Ada seorang anak muda, menawan perempuan bernama Rasmini yang sangat ramah dan penuh perhatian. Dia membawa saya sarapan. Sangat lezat dan segar. Dia juga membantu saya dalam apa pun yang saya butuhkan termasuk transportasi dan saran yang lain untuk melihat-lihat. Secara keseluruhan, tempat ini benar-benar menyenangkan. Saya merasa kehangatan di rumah ketika saya di sini. Layanan antar jemput yang nyaman dan telepon seluler Anda sendiri untuk memanggil staf ketika siap untuk dijemput sangat membantu juga. Saya menyukai nuansa hotel butik. Dan kamarnya, luas dan indah dengan…",5
