,hotel,review,stars
37, Stone House - a boutique b&b,"Kami membutuhkan tempat untuk malam terakhir bulan madu kami terlambat. Saya tidak dapat memilih yang lebih baik. Serius, kami telah sekitar, namun tidak satu pun dari kami yang bisa ingat pernah tinggal di lingkungan yang lebih indah. Segala sesuatunya sempurna. Kami tinggal di longhouse, salah satu dari dua villa yang tersedia di properti ini. Gambar tidak melakukan keadilan tempat ini sama sekali! Kamar menghadap ke sawah dan dikelilingi oleh banyak hutan seperti dedaunan. Villa ini adalah kebahagiaan murni. Suami saya favorit adalah di bagian belakang teras yang terasa seperti mengapung. Desain dari seluruh properti termasuk bangunan terbuka yang besar untuk tempat untuk sarapan atau hanya bersantai adalah sebuah karya seni. Pemilik jelas memiliki gairah untuk estetika…",5
38, Stone House - a boutique b&b,Layanan ini baik seperti setiap hotel bintang 5 tetapi dengan pelayanan dan sambutan yang anda harapkan dari kualitas tinggi b dan b. tempat ini benar-benar sempurna dan pasti sesuatu yang unik untuk segala sesuatu yang lain yang kami telah melihat di bali. Saya tidak dapat merekomendasikan sangat cukup rumah batu.  Pemilik telah jelas menghabiskan waktu yang lama berpikir tentang setiap aspek dan detail yang masuk dalam desain dan tata letak yang indah di seluruh properti. Kami tidak ingin meninggalkan tempat!  20 menit dari pusat kota ubud ini berhasil menangkap indah di daerah yang tenang di ubud sibuk dan terlalu turis tanpa alam kota.  Di rumah batu memiliki sopir taksi untuk pergi ke kota dan bahkan memberikan ponsel sehingga anda dapat memanggil untuk pick up ketika anda…,5
39, Stone House - a boutique b&b,"Rumah batu ini sangat indah, dirancang penuh gaya dengan fitur yang luar biasa. Kamar cantik dan rasanya seperti surga sedikit uang. Staf di batu yang kami menyewa skuter adalah cara terbaik untuk berkeliling. Staf yang indah dan sangat membantu. Sangat direkomendasikan!",5
40, Stone House - a boutique b&b,"Kami tidak cukup beruntung untuk menghabiskan akhir pekan di stone house baru-baru ini, dan aku tidak bisa lebih terkesan. Walker & wendy adalah tuan rumah yang sempurna, seperti perusahaan yang baik dan menyenangkan berada di sekitar.  Hotel ini adalah seperti sebuah permata tersembunyi, rapi dan sangat baik dibangun. Setiap sudut properti yang penuh dengan artefak yang luar biasa dari walker & wendy ekstensifnya anak, dan merupakan tempat yang memukau untuk semua indera. Kepada koki kami, rosie, si juru masak dan anak kami kepada sopir. Rosie dan interior membuat makanan lezat. Yum. Sedikit tambahan yang disediakan adalah sentuhan yang bagus seperti; jubah, sandal dan telepon seluler. Kami sedang sedih untuk pergi, dan sangat banyak melihat ke depan untuk mengunjungi lagi.…",5
41, Stone House - a boutique b&b,"Saya dan pacar saya antara kunjungan kami; 4 malam di stonehouse bed di ubud tidak cukup. Tempat ini bersih, dengan kolam renang tanpa batas yang menghadap ke properti dan sawah yang indah. Kamar kami adalah luar biasa. Kami tinggal di rumah panjang, yang memiliki dua serambi yang terpisah, yang sempurna untuk sarapan atau santai yang akrab dengan makanan buku hebat.   Selama kami tinggal kami memiliki kenikmatan yang berjalan melalui kamar lain di properti, masing-masing unik dan ramah, dengan perabot asli dan inspirasi dari semua sudut jalan lecat di dunia.   Lokasi ideal stonehouse bed, 7 menit skuter naik ke pusat kota, 5 menit ke yoga barn.   Staf adalah luar biasa; penuh perhatian dan ramah. Kami kita diberkati dengan indah drogun mangkukmangkuknya keponakannya, kelapa…",5
42, Stone House - a boutique b&b,"Tempat ini adalah hanya unvelievable. Saya mengatakan bahwa karena itu adalah di antara hutan dan sawah dan itu benar-benar sempurna. Kolam renang yang sempurna, sempurna kamar bertema yang berbeda dan itu benar-benar bekerja bersama-sama dengan perabotan kerajinan tangan dari kayu yang khusus. Saya seorang penggemar. ",5
43, Stone House - a boutique b&b,"Kedua saya kunjungi untuk stonehouse bed, kali ini dengan suami dan anak-anak - harus. Pada kenyataannya itu adalah sangat menyenangkan bahwa kita hampir tidak pergi ke ubud - kadang-kadang untuk menikmati hidangan makanan atau mengunjungi toko, tapi sebagian besar kami pergi di longhouse, makan makanan indah yang disiapkan oleh interior, tetapi memiliki pijat dari, berenang di kolam yang indah dan bermain dengan anjing! Saya berusia 11 bulan adalah penjilat dan itu baik-baik saja untuk menetapkan longhouse adalah gratis di lantai. Aku benar-benar dissapointed dan membawa semprotan serangga dan indah dan liar tapi untuk beristirahat - sangat mewah! Jika anda memerlukan tempat bayi atau kursi, menulis untuk tuan rumah di muka sehingga mereka dapat mengatur satu. Saya akan…",5
44, Stone House - a boutique b&b,"Ini adalah tempat pertama kami tinggal di indonesia selama petualangan kami. Kami berada sedikit gugup tentang tinggal di suatu tempat bahwa tampak relatif jauh dari bandara, tapi itu sangat baik terorganisasi perpindahanmu dan berkendara pergi dengan cepat. Sopir kami bahkan datang dengan air dan handuk basah wangi dengan minyak esensial.  Properti ini benar-benar luar biasa. Pemandangan menakjubkan dan sebuah oase ketenangan. Arsitektur yang cantik. Rasanya sangat pribadi tetapi seseorang selalu ada untuk membantu kami ketika kami perlu saran atau informasi. Makanan yang lezat, juga! Kami sangat nyaman dan sedih untuk pergi. Kami akan kembali!",5
45, Stone House - a boutique b&b,"Hotel ini indah foto di situs, tetapi mereka tidak melakukan keadilan tempat ini. Stone house adalah sebuah oase keindahan alam dan tenang di tengah-tengah sibuk bali. Benar-benar pribadi, namun hanya 10 - 15 berjalan kaki/5 menit bersepeda dari pusat kota ubud. Saya menginap di kamar mewah di rumah panjang, ada pijat yang sempurna dari rini, teman-teman saya yang dilalui oleh rosie dan interior, dan terima kasih untuk saran dan kebetulan waktu sarapan dan staf yang sangat baik. Aku harus menghadiri upacara pernikahan yang berbeda dan kremasi. Rumah batu ini berbeda dari tempat lain yang ada di bali. Perhatian terhadap detail dalam setiap aspek vila, tulus pada orang yang saya merasa hampir seperti bagian dari keluarga dan tidak seperti tamu. Ketika aku kembali ke bali. Aku akan…",5
46, Stone House - a boutique b&b,"Benar-benar menakjubkan pengalaman. Lokasi indah. Wendy adalah tuan rumah yang fantastis dan walker. Makanan sudah besar, staf menakjubkan, dll. Ada beberapa restoran yang baik dekat dan hanya menit berjalan kaki ke pusat kota dalam 15 ubud. tempat yang sangat istimewa - tidak bisa menunggu untuk kembali. ",5
47, Stone House - a boutique b&b,"Di mana saya harus memulai? Sulit, luar biasa staf, layanan baik, taman yang indah atau detail? Rumah Stonde adalah tempat ideal hanya 5 menit dari pusat ubud di skuter - dan anda merasa seperti anda sendiri pulau dengan ""suara dan musik"" dari alam... semua bangunan ini bahkan didekorasi dengan banyak cinta dan dedikasi untuk rinciannya! Rosie dan persiapan yang sangat baik kepada kami sarapan setiap pagi, staf sebagian besar dari taman indah, dan sarapan yang baik, adalah sinar matahari! Dan jangan lupa yang tipe mempersediakan! Jangan lewatkan aislinn soto ayam, sate dan green salad pepaya, sangat bagus! Dan jauh lebih baik membandingkan ke sebagian besar restoran! Kami telah beruntung untuk tinggal dua kali dan kami telah kembali lagi untuk yakin. Tempat ini adalah tempat…",5
48, Stone House - a boutique b&b,"Aku tersandung batu rumah selama pencarian online untuk tempat tinggal di ubud ketika kami menghadiri festival penulis. Gambar dan keterangan di internet tampak hebat, tapi tunggu sampai anda benar-benar mendapatkan di sana! Properti ini adalah semua yang anda lihat dan kemudian berkata dan banyak lagi - cozy (4 kamar) dan belum dibangun untuk menjadi begitu sangat pribadi, di jalan dusunan berkelas, mewah tanpa terlalu di atas. Ada begitu banyak detail kecil di seluruh properti dan tiap kamar, yang membuat semua itu jadi sangat unik dan khusus. Aku tidak menghabiskan banyak waktu mengagumi dan menghargai ini pengalaman yang telah pergi ke menciptakan tempat.  Dari pemesanan kamar untuk memandu kami sementara kami berada di sana (kami bahkan memberi kami telepon lokal untuk…",5
49, Stone House - a boutique b&b,"Kami telah seperti waktu yang mengagumkan! Kami menginap di stone house adalah surga di surga. Properti ini adalah benar-benar indah; ini adalah hotel yang indah dan teduh, kamar memiliki pesona tradisional bali dengan beranda dan pemandangan yang menakjubkan di sawah. Kami terutama menyukai kayu raksasa bath tub. Sebagai baik sebagai properti ini, yang sebenarnya adalah objek wisata yang dikelola keluarga yang baik. Ketika saya menyebutkan bahwa saya adalah seorang seniman dan tertarik untuk melihat beberapa ukiran kayu, wendy ditekti dan pelayanan terbaik dengan master pengukir di kota. Saya ingin kembali cukup awal setiap malam untuk menghabiskan waktu selama dengan wendy, walker dan sedikit Kyan. Kami mampu untuk menyewa rumah, sopir, Wayun, membawa kami di mana pun kita…",5
50, Stone House - a boutique b&b,"Aku mendengar tentang stone house melalui teman dan diberitahu itu adalah puncak perjalanan mereka di perjalanan ke bali baru-baru ini. Aku benar-benar tidak tahu apa yang diharapkan - mereka hanya memiliki 2 ulasan di perjalanan penasihat. Tapi cukup besar dalam situs foto dan saya segera dikembalikan voicemailnya tentang reservasi. Aku suka itu. Ada hanya empat kamar di ini ""butik"" hotel. Masing-masing sama sekali berbeda, tapi semua makanan (aku diberi lebih dalam setiap satu oleh salah satu staf yang sangat ramah). Aku memilih sky villa. Benar-benar luar biasa. Rupanya, pemilik menghabiskan waktu bertahun-tahun untuk merancang hotel - lihat peninggalan dari tangan mereka merancang wisata dan semua perabotan untuk proyek impian ini. Ini menunjukkan. Ketika saya pertama kali…",5
51, Stone House - a boutique b&b,"Stone house adalah benar-benar tempat yang menakjubkan. Rumah di properti sangat ditunjuk, dekorasi menawan, dan benar-benar salah satu dari jenis. Properti ini tidak nyata - yang memandang ke arah kolam renang tanpa batas hutan dan sawah, kolam/luar ruangan di mana menakjubkan interior dapur memasak makanan anda akan dimasak, dan pemandangan indah. Juga kamar tipe, koki, adalah luar biasa. Dia adalah begitu manis dan membuat makanan tradisional bali yang paling menakjubkan. Juga, jika anda bertanya, dia akan membawa anda pada pagi hari petualangan ke pasar ubud, yang benar-benar keren.  Aku pasti akan datang kembali dan tinggal di sini selamanya. Tempat ini luar biasa.",5
52, Stone House - a boutique b&b,"Stone house adalah tersembunyi di balik pintu kayu/pintu dan setelah anda memasukkan, anda tidak dapat mendengar, hanya yang tenang, tetapi merasa itu juga 2 kolam renang tanpa batas kami ., dapur luar ruangan, tempat tidur yang menakjubkan dan pemandangan, tapi sangat pribadi, pancuran luar ruangan, dan staf yang paling ramah. Putri saya dan saya tinggal di sini selama 5 malam dan kemudian pergi untuk mengulas hotel yang sangat baik untuk kami 2 malam terakhir. Selain itu, tempat itu sebagai baik seperti itu, kita semua ingin kembali ke stone house. Ada beberapa restoran besar dalam jarak berjalan kaki, salah satu dari tempat, jalan menuju ke persawahan yang indah untuk berjalan-jalan melalui... bebek, ayam, burung-burung liar... dan meskipun itu adalah berjalan kaki yang…",5
53, Stone House - a boutique b&b,"Stone house di ubud ini benar-benar mimpi. Aku pergi ke sana dengan kakak saya, ibu dan bibi - stone house dan menyewa seluruh rumah panjang - dan kita tidak bisa telah lebih bahagia atau merasa lebih diperhatikan. Kolam renangnya, pemandangan sawah, tidur, dapur, dan pancuran luar ruangan itu benar-benar luar biasa! Masing-masing vila didekorasi dengan cantik dan dibuat - anda merasa seperti anda tinggal di live Condé nast traveller editorial. Koki mereka, interior, membuat beberapa yang paling lezat saya sudah pernah makan dalam hidupku - begitu banyak sehingga kami memilih untuk tinggal di dan memiliki aislinn mempersediakan daripada pergi keluar (yang mengatakan banyak, seperti makanan di ubud di luar biasa!) Interior hotel ini juga besar untuk villa membungai - dia…",5
54, Stone House - a boutique b&b,"Kami telah mengunjungi bali dan ubud beberapa kali, namun kali ini adalah yang terbaik oleh jauh! Rumah di batu bulan yang terlalu pendek.  Kami menyukai setiap hal tentang stonehouse bed - staf lembut yang indah dan orang-orang, makanan, suasana santai seperti di rumah, bangunan dan taman indah curated dan kebanyakan dari semua kolam renang yang indah! Anda hanya tidak ingin meninggalkan ruang. Apa sebuah spektakuler untuk merayakan ulang tahun kami dengan cara - itu besar membasikan dari awal hingga akhir. Kita tidak bisa menunggu untuk kembali tahun depan!  Jika anda mencari pengalaman yang sangat khusus karena inilah tempatnya!",5
