,hotel,review,stars
0, Stone House - a boutique b&b,"Tempat ini adalah permata! ! Saya menginap 3 malam di javasuite pada awal Juli, sebagai perhentian pertama di Bali. Tim berjalan terus menerus untuk mengakomodasi semua kebutuhan saya. Saya memiliki begitu banyak acara menyenangkan yang diselenggarakan oleh Erna, makanan yang indah (masih melamun hidangan telur pedas untuk sarapan), dengan alasan luar biasa dan kamar semua dieksekusi dengan indah. Saya bepergian sendirian untuk bagian pertama dari perjalanan saya, dan itu benar-benar membuat saya merasa di rumah. Wendy, pemilik, adalah kekasih sejati juga, membuat tempat menjadi hidup dan membuat saya merasa seperti tamu yang tinggal di rumah teman daripada di hotel. Semua dalam semua, sangat direkomendasikan!",5
1, Stone House - a boutique b&b,"Stone House hanyalah salah satu tempat paling indah dan unik yang pernah Anda tinggal. Saya telah melakukan perjalanan secara luas ke seluruh dunia dan tinggal di banyak tempat yang menakjubkan; permata ini menonjol dari yang lain. Dari saat Anda melangkahi ambang pintu saat Anda tiba, hingga melangkah mundur ketika Anda pergi, Anda terikat untuk pengalaman yang tak terlupakan. Dari staf sensasional yang hangat, tersenyum dan ramah yang pergi ke atas dan ke luar untuk membuat Anda merasa diterima dan menjadi bagian dari keluarga (terima kasih banyak untuk Erna dan semua orang!), Hingga makanan - - - OMG THE MAKANAN - - - Saya tidak punya satu pun makanan lain di Bali yang melampaui yang di Stone House, ke kamar, tempat tidur, kolam renang, anjing-anjing menakjubkan Bella dan…",5
2, Stone House - a boutique b&b,"Rumah batu pasti merupakan hal terbaik tentang Ubud. Benar-benar terpesona betapa indahnya tempat ini. Kami tinggal di banyak properti hebat di dunia tetapi ini adalah tempat favorit kami dan tidak ada yang seperti itu. Itu indah, dihiasi selera jauh dari rumah, itu adalah oasis, menyegarkan, bergizi, peduli. Semua orang di Stone House mengurus semua yang Anda butuhkan. Saya bahkan tidak akan menulis rencana perjalanan jika Anda tinggal di sana - cukup ikuti Wendy dan Erna dan rekomendasi - Anda akan memiliki pengalaman terbaik yang pernah ada! Makanan terbaik juga ada di Stone House! Begitu segar dan sangat siap. Dapur terbuka itu akan menjadi impian saya untuk waktu yang lama, sampai saya kembali lagi:) bayangkan bangun di tempat tropis yang hangat, berjalan ke latihan yoga…",5
3, Stone House - a boutique b&b,"Saya tinggal bersama seorang teman di Stonehouse selama lima malam. Alasannya benar-benar indah dan ruang-ruangnya didekorasi dengan sempurna. Semuanya gambar sempurna. Staf yang luar biasa membuat semuanya mudah dan hangat, dari transportasi ke makanan luar biasa yang mereka layani (coba pancake pisang dan buah saat sarapan). Anda dapat mengetahui saat Anda berjalan dalam berapa banyak perawatan yang dimasukkan ke dalam setiap aspek operasi. Saya akan merekomendasikan tinggal di sini untuk siapa pun yang mencari permata yang damai di Ubud.",5
4, Stone House - a boutique b&b,"Saya dan istri saya menghabiskan satu bulan di sini pada tahun 2017 dan sangat menikmati layanan, makanan, dan ketenangan tempat kami kembali setahun kemudian untuk kunjungan 5 minggu yang diperpanjang. Pada saat kami berangkat, kami telah cukup terikat pada kamar kami di Longhouse dan kepada anggota staf individu, yang kehangatan dan perhatiannya membuat mereka semakin merasa seperti keluarga, bahwa kami dengan tak tertahankan dibujuk kembali tahun ini untuk tinggal enam minggu lagi. Singkatnya, Stonehouse, telah menjadi rumah kami yang jauh dari rumah.",5
5, Stone House - a boutique b&b,"Kami memiliki tinggal yang luar biasa di The Stonehouse. Staf, terutama Erna tidak mungkin lebih patuh dan ramah tanpa mengganggu. Kamarnya menakjubkan - unik, sangat luas dan tak bernoda. Makanannya lezat dan segar, banyak yang berasal dari kebun mereka sendiri yang bisa Anda jelajahi. Sarapan sangat baik - pilihlah Telur Pedas! Kami tidak bisa cukup berterima kasih kepada semua orang atas kunjungan kami yang menyenangkan. Dari dua minggu kami jauh dari rumah, itu adalah favorit kami tiga malam! Kami tidak sabar untuk kembali. Anda tidak akan menyesali keputusan Anda untuk tinggal di sini.",5
6, Stone House - a boutique b&b,"oke, kita semua tahu Ubud itu indah. Sangat cantik. Tapi Stonehouse membuatnya jauh lebih baik. Dari saat Anda disambut ke saat Anda mengucapkan selamat tinggal - itu sempurna. Makanan, akomodasi unik, kolam renang, kedamaian dan ketenangan. . . semuanya begitu indah.",5
7, Stone House - a boutique b&b,"Kami memiliki waktu paling ajaib di rumah Batu. Tempat ini diatur kembali di bagian yang tenang dari Ubud, hal yang indah. Cinta dan perhatian yang masuk ke dalam menciptakan pekarangan sangat mengherankan. Kami merasa senang tinggal di dua kamar yang berbeda! Mereka berdua luar biasa dengan caranya sendiri, dibuat dengan cinta dan kualitas tertinggi. Kami merasa bagian dari sesuatu yang sangat istimewa berada di sana. Kolam itu seperti mata air pegunungan, dengan air terjun mini dan dikelilingi oleh tanaman hijau. Setiap orang yang bekerja di Stone House luar biasa dan sangat memperhatikan kami. Kami benar-benar merasa istimewa! Ketika hujan mereka memastikan kami memiliki unbrella dan kami di tangan untuk merekomendasikan restoran-restoran terbaik. Menginap di sini membuat…",5
8, Stone House - a boutique b&b,"Saya sangat senang kami menemukan Stone House sambil merencanakan perjalanan Bali kami. Surga sungguhan. Dari saat kami melangkah ke tempat yang indah ini kami tahu kami telah mencapai jackpot. Dekorasi yang memukau, hosting yang luar biasa, makanan untuk mati bagi (saya masih memimpikan pancake pisang!) Dan anjing setiap hari meringkuk - apa lagi yang bisa Anda inginkan. Sebuah teriakan khusus untuk Wayan karena mengantar kami ke seluruh Bali untuk menjelajahi tempat-tempat yang kurang turis dan bagi Erna untuk meyakinkan kami untuk memiliki pijat - yang terbaik! Saya belum berhenti berbicara tentang Stone House dan berharap kami bisa tinggal lebih lama - jika kami kembali ke Bali kami akan kembali, pasti - sementara itu kami akan merekomendasikan hotel ini kepada semua orang!…",5
9, Stone House - a boutique b&b,"Lokasi yang luar biasa Ubud, homestay luar biasa hotel ini. Super ramah staf, lebih seperti onwners sendiri kemudian hanya ""staf"",, availabe setiap saat, memberi kami telepon lokal untuk setiap kebutuhan, layanan taksi untuk perjalanan pulau, juga dapat mengatur pemberitahuan singkat untuk makanan lokal. Saran bagus untuk restoran terbaik di kota. Healty dan sarapan lokal serta internasional. Benar-benar layak homestay kami, lebih baik daripada hotel",5
10, Stone House - a boutique b&b,"Rumah Batu benar-benar adalah sebuah surga di dalam surga di jantung Ubud, Bali. Kami cukup beruntung untuk tersandung di seberang permata ini di blog travel, dan tidak bisa meminta lebih banyak tempat yang ajaib untuk menginap selama perjalanan pertama kami ke Bali. Semuanya dikoordinasikan - dari serasi dipandang pedesaan yang luar biasa, dengan dekorasi sarapan, pemandangan buatan sendiri hutan hujan, dan staf yang luar biasa, tempat ini benar-benar mengurus semuanya. Kami memesan pijat selama kami menginap, staf yang ramah yang diselenggarakan untuk datang ke rumah melalui kontak mereka dengan penduduk lokal, dan juga tukang pijat bisa mengkoordinasikan perjalanan ke sawah dan candi melalui supir mereka layanan. Kami merasa di rumah sendiri di sini. Saya tidak…",5
11, Stone House - a boutique b&b,"Suami saya dan saya mendapat pengalaman menginap yang menyenangkan di Rumah Batu, stafnya super ramah dan kami menyukai memiliki anjing peliharaan untuk bermain dengan! Dengan hanya 4 kamar, tidak pernah ada terlalu banyak orang di sekitar yang membuatnya sangat tenang dan santai. Tempat ini juga bagus untuk bertemu dengan tamu-tamu yang lain. Erna, manajer bahkan membiarkan suami saya meminjam laptop itu selama beberapa hari ketika salah satu mati!  Kami ingin datang kembali dan menginap di villa : ) standalone",5
12, Stone House - a boutique b&b,"Semua ulasan yang sangat akurat. Pemilik dan staf di tempat persembunyian yang indah, akrab membayar perhatian terhadap detil. Kami menginap di Longhouse untuk 4 malam - desain, detail dan secara keseluruhan estetika kamar, kamar mandi dan ruang luar ruangan yang indah. Semuanya tentang properti sangat indah dari kamar ke lantai dasar, dengan kolam renang untuk penyajian makanan desain.  Properti ini hanya beberapa menit berkendara di luar pusat kota - jauh dari keributan. Ada beberapa tempat makan yang bisa dijangkau dengan berjalan kaki (kurang dari 5 menit). Kami tidak menyewa sepeda motor tapi staf mereka mengantar kami berkeliling yang diperlukan dan mereka selalu membantu dan tepat waktu. Rumah Batu juga menyediakan telepon seluler lokal jika kami keluar dan pertanyaan…",5
13, Stone House - a boutique b&b,"Tidak perlu ke echo superlatif ulasan yang disediakan oleh tamu sebelumnya. Fakta bahwa kami tinggal selama satu bulan di tahun 2017 dan kembali untuk 5 minggu di tahun 2018 harus amanat cukup. Rumah batu rumah yang jauh dari rumah. Terima kasih Wendy, Pejalan Kaki, Kayan dan semua staf yang luar biasa untuk merawat kami dengan baik.",5
14, Stone House - a boutique b&b,"Dari penyambutan yang hangat seperti anda melangkah di dalam harta karun tersembunyi ini sangat dekat dengan pusat keramaian Ubud dan namun di Oasis bergaya dan sophisticed tenang, anda merasa anda memiliki pulang ke rumah.  Berkurangnya perlahan suite kami sangat senang saya dan saya hanya merasa heran girlfirend di cita rasa seni yang setiap item dengan furnitur dan karya seni yang telah berkumpul untuk membuat rasa damai dan sejarah dalam arsitektur ini menjadi heran.  Dan pohon kayu, panel kayu bersejarah membekukan tidak kelihatan di tepi kolam renang di hutan tanaman tropis yang diselenggarakan oleh anggota keluarga yang menawan dengan apapun yang anda inginkan dari sarapan yang lezat untuk menit terakhir dan rumah makan malam cukup eksotik dimasak sebelum kami pergi,…",5
15, Stone House - a boutique b&b,"Pacar saya dan saya tinggal di sini selama dua malam dan ini adalah puncak dari perjalanan kami ke Bali!   Staf dan layanan yang luar biasa dan kami merasa sangat baik diurus, setiap kali kita memerlukan sesuatu dan mereka akan membantu.   Lokasi, kolam renang, dan semuanya sangat indah! Terasa damai dan tampak seperti sesuatu dari mimpi.   Jika aku pernah kembali ke Ubud saya pasti akan tinggal di rumah batu, ini akan menjadi tempat yang saya selalu bermimpi untuk kembali ke.  Terima kasih untuk salah satu terbaik kami tetap hidup ",5
16, Stone House - a boutique b&b,"Kami memiliki hanya sayangnya meninggalkan Stone House - sebuah oasis mewah di tengah-tengah sibuk Ubud Kami tinggal di keluarga suite yang benar-benar indah Wendy dan dia memastikan bahwa tim khusus kami setiap keinginan adalah bertemu 6 pagi Pasar Tri P yang kami memasak, arung jeram dan bersepeda dan mengendarai sepeda motor.  Jika Anda memiliki kesempatan untuk mengambil Anda tidak akan menyesal! ",5
17, Stone House - a boutique b&b,"Kami menginap 2 malam di rumah batu untuk pada akhir perjalanan Bali Manik, dan itu benar-benar indah.   Saya telah merencanakan untuk mengusulkan untuk tunangan saya sekarang saat kami di Bali bersama, dan kami secara khusus memilih rumah batu sebagai tempat untuk melakukannya karena di sana sangat indah dan ulasan positif - mencari villa. Foto-foto tidak melakukannya keadilan - villa indah dihiasi dan kolam renang yang luar biasa. Dan makanan - oh Tuhan! Semua staf pergi di atas dan di luar untuk membuat ini spesial karena mungkin, dan saya akan selalu memiliki kenangan terindah dari (semua terlalu singkat) tinggal di sana!    * PS: tempat ini layak dikunjungi untuk anjing sendiri, Lulu dan Bella adalah yang terbaik!",5
18, Stone House - a boutique b&b,"Adalah di sini selama akhir pekan di mana saya tidak bisa di sampai 2 pagi karena untuk kedatangan penerbangan larut malam. Suka Bangun di rumah panjang yang indah benar-benar dikelilingi oleh pohon dan sawah dengan suara air mengalir di luar. Kamar mandi memiliki wastafel batu dan kayu mahoni yang terbaik melihat bak mandi, kamar tidur & ruang luar yang membuat saya merasa seperti saya adalah di rumah paman yang pintar aneh yang ditemukan Ubud Explorer abad yang lalu. sangat nostalgia dan tenang (kecuali untuk Aneh Ayam yang memutuskan untuk berkokok di 3:45 AM), sedikit berbatu, terasa agak alam liar.  Itu pasti tidak akan menjadi pengalaman yang biasa Anda &, dekorasi sangat eklektik dan penuh dengan bit dan potongan-potongan dari pemilik ' wisata, staf yang ramah & pemilik…",5
19, Stone House - a boutique b&b,Kami tinggal di rumah batu di liburan terakhir kami ke Ubud dan benar-benar menyukainya kemudian. Kali ini itu bahkan lebih ajaib. Anak-anak saya dan saya mengambil villa dengan pemandangan langit yang indah dua lantai dengan dua kamar tidur suite. Saya cukup yakin Anda bisa menyewa satu dari dua kamar tidur dengan baik. Itu sebenarnya menyiksa untuk properti dan kami hanya meninggalkan sekali untuk pergi ke kota dan melakukan beberapa berbelanja untuk hadiah untuk anggota keluarga. Kami makan makan malam di hotel malam kedua dan makanan adalah yang terbaik yang kami punya di perjalanan kami. Tunangan saya adalah awalnya dari El Paso dan penggemar makanan Meksiko yang besar - ia tidak bisa mendapatkan cukup pedas hidangan telur saat sarapan dan berulang kali berbicara tentang…,5
20, Stone House - a boutique b&b,"Friendship membawa saya ke Bali - sudah lama sekali gadis yang ' minggu dengan teman perjalanan saya yang bergaya mewah penulis akhirnya menyadari, dan kami memilih rumah villlas pada batu sebagai tujuan. Kami tinggal di Longhouse Villa, dengan mudah berbagi tempat tidur yang besar, teras kami memutar kembali ke salon untuk vodka tonik (tugas - gratis, dengan es dari dapur utama), tugas kantor dan nyaman ke tempat tidur yang subur Sighs sungai dan sawah di luar.  Kami memiliki keduanya tinggal di akomodasi mewah, namun rumah batu di dalam kelas yang berbeda - ini adalah kombinasi dari bahan bangunan dan benda, privasi dan persahabatan, kesederhanaan dan keanggunan - yang membuat sesuatu yang benar-benar unik. Anda merasa seperti Anda berada di sebuah tempat yang tak lekang oleh…",5
21, Stone House - a boutique b&b,"Ini adalah tempat yang indah, daerah yang tertutup di luar gila bunyi hiruk-pikuk Ubud yang dijalankan oleh indah, tersenyum, membantu staf dan pemilik. Kami tinggal pertama di rumah panjang dan kemudian di Skyview (atas dan bawah) dan mencintai kedua - keduanya memiliki daerah luar ruangan tempat duduk untuk bersantai, besar tempat tidur dan kamar mandi yang luar biasa. Segala sesuatu tentang tempat ini adalah tempat yang indah dengan sangat baik. Dari Red geranium kelopak bunga yang membuang langkah untuk akomodasi Anda ketika Anda tiba, ke kamar mandi yang manis dan malam menu yang benar-benar lezat. Kolam Renang terletak di tengah-tengah taman tropis yang cukup kecil. Ada satu di ruang makan utama sehingga Anda dapat memenuhi tamu lain tapi karena hanya ada tiga 'kamar'…",5
22, Stone House - a boutique b&b,"Saya telah mengunjungi Ubud beberapa kali, namun kali ini saya memutuskan untuk berbelanja secara royal sedikit dan pergi untuk sesuatu yang lebih intim dengan banyak karakter. Baik, kali ini saya punya persis apa yang saya berharap untuk di rumah batu. Segera setelah Anda memasuki properti, itu sangat jelas bahwa ada begitu banyak detail di setiap sudut.   Saya menginap di kamar di lantai atas dengan pemandangan langit yang indah. Sebenarnya, itu menyerupai sebuah rumah pohon di luar jendela yang semua terbuka ke treetops di luar. Saya tidak terlalu menaruh kaos di tirai dan mencintai pemandangan dari saat aku terbangun. Dikelilingi oleh subur, pohon hijau pepohonan di sekitar saya! Di mana-mana aku melihat ada sesuatu yang menarik; tidak buku, artefak dari pemilik perjalanan…",5
23, Stone House - a boutique b&b,"Sebuah tempat khusus untuk tinggal! Kamar, alasan, dan staf yang luar biasa. Setiap detail berpikir dari obat nyamuk untuk telepon genggam untuk membantu dengan pinjaman yg jelek ini sesi pijat di kamar. Kami benar-benar menikmati surga kecil ini di Bali. Murni relaksasi! Sangat direkomendasikan! ",5
24, Stone House - a boutique b&b,"Rumah Batu Villa adalah yang terbaik dari perjalanan kami di Bali. Properti itu sendiri adalah luar biasa dan arsitektur. Ini adalah jelas pemilik memberikan perhatian untuk setiap detail yang luar biasa. Kamarnya yang mewah dan luas, dirancang dengan indah dan pengaruh Bali. Tinggal di Stone House adalah pengalaman yang intim, karena hanya ada tiga rumah yang tersedia untuk memesan, tidak termasuk pemilik.   Selain akomodasi yang sebenarnya, itu adalah pemilik dan staf yang membuat kami merasa di rumah: melakukan perjalanan sebagai keluarga empat, pemilik duduk dengan kami untuk menyarankan/memesan restoran rekomendasi, sepeda tur pribadi, Yoga dan menjelajahi. Ini membantu memudahkan perencanaan dan keputusan kami - membuat setiap hari, sementara juga memastikan bahwa kami…",5
25, Stone House - a boutique b&b,"Jika Anda pergi ke Ubud, ini adalah harus tinggal! Jadi saya menemukan batu thankfulI rumah sementara mencari akomodasi di Ubud - itu lebih baik dari yang diharapkan! Saya menghabiskan banyak jam yang menantang mencari tempat untuk menginap dengan suasana dan gaya khas Bali. Saya hanya siap untuk menyerah, saat saya terjadi pada ulasan di Stone House di Inggris telegram. Setelah membaca ulasan dan melihat situs web. Saya tahu ini adalah hotel ini! Untungnya, ada 2 kamar yang tersedia untuk tanggal yang saya butuhkan. Pada saat kedatangan. Aku bahkan lebih terkesan daripada yang saya telah di orang oleh situs web foto dan yang tidak pernah terjadi! Ini adalah indah, dan dekorasi yang indah. Kami tinggal di rumah panjang yang luar biasa. Hotel ini memiliki dek pribadi di luar…",5
26, Stone House - a boutique b&b,"Bali adalah salah satu tempat terbaik di Timur Jauh dan batu rumah dan Ubud adalah hanya yang terbaik tempat di Bali. Alasan, akomodasi dan kolam renang yang indah dan wanita yang menjalankan itu sangat bagus dan sangat membantu karena membawa senyum hanya berpikir tentang hal itu. Koki wanita yang tidak bisa lebih baik atau lebih orang yang memasak makanan lokal. Kami makan dua kali dan menyesal harus; makanan dan suasana yang diproduksi oleh Kadek sangat jauh lebih baik. Saya menyarankan mendapatkan di sana secepat Anda dapat menyadari seberapa baik sebelum Wendy dan dia akan membuat tempat ini harga di atas.",5
27, Stone House - a boutique b&b,"Tunangan saya menemukan tempat ini di Instagram dan kami menyukainya. Segala sesuatu dari pemesanan, transfer bandara, sewa sepeda motor, makan larut malam pada kedatangan dan tinggal itu sendiri adalah baik berjalan mulus dan sempurna. Kami tinggal di longhouse yang sempurna, besar kamar dengan balkon 2... Salah satu dari mereka besar, dengan sofa dan meja dan kursi yang menghadap hutan dan sawah. Terletak di luar wilayah utama di ubud yang bagus karena bagus dan tenang, tapi masih hanya 5 menit ke kota jadi sangat nyaman. Tempat yang anda bisa dengan mudah menghabiskan seminggu atau dua... dan mungkin akan waktu berikutnya.",5
28, Stone House - a boutique b&b,"Anda tahu ketika anda melihat gambar pasangan yang menakjubkan yang eksotis di rumah liburan atau resort mewah dan berpikir, "" yang bisa kami!"" dan kemudian anda melihat bahwa harga jauh melebihi anggaran yang anda hanya akan memiliki untuk membayar untuk bermimpi tentang tempat ini? Nah, batu di rumah saya dan istri saya benar-benar tinggal mimpi itu. Dan tidak hanya itu tidak melanggar bank, ini adalah jauh nilai terbaik kami telah menemukan pada perjalanan kami di seluruh dunia. Mengapa? Tingkat tinggi layanan dari staf concierge. Suasana alam yang luar biasa. Perhatian besar untuk detail dalam setiap aspek dari desain dan kenyamanan. Ramah, penuh perhatian staf. Makanan yang hebat. Kami memiliki privasi kami ketika kami ingin itu, serta kesempatan untuk berinteraksi dengan…",5
29, Stone House - a boutique b&b,Saya baru saja menginap di guesthouse yang luar biasa ini. Luar biasa foto di situs menunjukkan properti megah persis seperti yang anda akan menemukan. Kamar yang sangat artistik dan yakin untuk segera bersantai anda dan membuat anda merasa seperti anda berada di surga. Properti ini terletak di panggung terbuka dan jadi jika anda mencari sebuah ketenangan yang memesan rumah panjang. Sekarang ke permata di mahkota Kadeck. Kadeck adalah koki yang luar biasa dan makanan yang brilian. Pastikan anda makan di meja dia pada awal masa tinggal anda. Anda dapat kemudian membatalkan semua pemesanan restoran anda telah dibuat. Ini adalah properti yang sangat istimewa dan saya harus pernah wisata ke bali lagi saya akan menginap di tempat ini. Besar terima kasih kepada semua staf rumah batu…,5
30, Stone House - a boutique b&b,"Saya mencari di sekitar cukup banyak untuk sesuatu yang khusus untuk suami saya dan saya tinggal di ubud dan tempat ini dipicu saya. jadi saya sangat senang kami memutuskan untuk pergi untuk yang satu ini. Kami benar-benar menyukai tinggal di villa indah dan menawan - Rumah batu villa. Tidak hanya adalah villa dan seluruh situs (dengan kolam renang, taman, rumah makan dll) yang sangat indah dan trendi dirancang, itu adalah sangat terawat dengan baik dan terawat dengan baik, dan juga sangat bersih. Staf adalah sangat menyenangkan - sangat membantu dan ramah. Sayangnya kami tidak bertemu dengan pemilik wendy, tapi dia mengirim beberapa email ketika kami mengunjungi untuk memastikan semuanya baik-baik saja dengan kami. jadi dari keterangan di situs web villa ini sangat akurat, dan…",5
31, Stone House - a boutique b&b,"Secara tidak sengaja saya menemukan permata ini ketika mencari melalui halaman dan halaman dari semua jenis akomodasi di bali. Melihat foto-foto, kami langsung yakin untuk menghabiskan setidaknya beberapa hari di rumah batu.  Pertama, staf di sini adalah yang terbaik, tangan ke bawah! Selalu menyapa anda dengan senyum dan siap untuk membantu merencanakan perjalanan wisata. Mereka memberi kami beberapa nasihat besar di mana harus pergi untuk tamasya, serta saran untuk makan malam dan makan siang yang luar biasa.  Banyak orang telah mengatakan sudah, tapi itu benar-benar merasa seperti anda sedang mengunjungi teman lama, daripada tinggal di b & b. Rumah batu yang mampu menangkap suasana unik yang membuat anda merasa berada di rumah sendiri.  Semua kamarnya memiliki desain yang…",5
32, Stone House - a boutique b&b,"Salah satu tempat terbaik yang pernah saya tinggal di, direkomendasikan tempat untuk tinggal. Tidak hanya keindahan tempat tapi keramahan dari tuan rumah dan pembantu yang luar biasa!  Tinggal di sini adalah keputusan yang baik untuk saya sebagai orang yang insomnia. Saya dapat tidur nyenyak di sini! :) ",4
33, Stone House - a boutique b&b,"Saya dan keluarga saya tinggal di sini beberapa kali. Kami terus datang kembali. Ini bukan sebuah hotel, ini adalah rumah. Pemilik dan staf pasti akan mengurus semua kebutuhan anda. Ini adalah pribadi, intim, bersahaja mewah. Kami pasti akan kembali lagi segera ketika kami mengunjungi bali",5
34, Stone House - a boutique b&b,"Saya dan istri saya mengunjungi baru ini sedikit banyak surga ketenangan dan terakhir kami berhenti dari bulan madu kami. Sejauh ini pada bulan madu kami dan kami berhasil untuk bersantai dengan cukup baik, tapi yang datang melalui pintu rumah batu ke tingkat yang baru. Anda dapat berpikir bahwa ini telah dimasukkan ke dalam desain tempat.   Kami tinggal di longhouse, yang memiliki sebuah teras keluar ke sawah. Bir dan buku dan surga  Area dapur adalah besar tempat untuk makan yang alami untuk percakapan dengan tamu lain dan orang-orang yang bekerja di sana jika anda ingin, yang tampaknya sangat alami di lingkungan ini. Tapi ketika kita ingin privasi rumah batu disediakan dalam kelimpahan. Lingkungan memiliki cara yang luar biasa untuk memberikan sebuah pengalaman sosial yang…",5
35, Stone House - a boutique b&b,"Aku tidak bisa merekomendasikan properti ini cukup! Tidak hanya indah, menakjubkan tempat yang mengagumkan untuk tinggal, ini karena jika anda ke yang paling biasa, keluarga yang lezat!   Aku tinggal di properti ini untuk wendy dan pejalan kaki selama dua minggu dan pengalaman itu sempurna.   Kamar yang menyenangkan, staf tidak 'staf', mereka adalah keluarga. Memancarkan kehangatan dan semua orang sangat mengagumkan, ini ditambahkan begitu banyak untuk kami tinggal di ubud. Aku benar-benar tidak ingat kapan terakhir kali aku merasa sangat peduli untuk.   Itu sangat menakjubkan. - Elissa Kravetz, los angeles, amerika serikat",5
36, Stone House - a boutique b&b,"Kami memesan ""rumah panjang"" untuk tengah berhenti di bulan madu kami dan kami benar-benar senang dengan pengalaman kami di setiap lantai di rumah batu. Lokasi, lingkungan, staf dan makanan yang semua luar biasa... belum lagi pemandangan dari tempat tidur kami atau bak mandi kayu yang luar biasa. Setiap inci properti bangunan dan terasa seperti itu telah saya tip untuk memamerkan keindahan sejarah dan budaya bali. Kami sangat merekomendasikan melakukan kelas memasak dan berkeliling ke pasar di pagi hari dengan koki kadek.   Kami akan menentukan masa depan dan menemukan hotel untuk pengalaman kami dengan rumah batu dan staf mereka. Kami tinggal itu indah dan kami pasti akan kembali lagi!",5
