,hotel,review,stars
0, Sun Suko Hotel,"Sebuah oasis di pedesaan barat! Sambutan hangat dari semua personel. Mereka akan membantu Anda menemukan dan mengatur wisata yang bagus di daerah tersebut. Saya sarankan Anda spa yang sangat bagus. Anda akan menyukai masakan lezat dengan barang-barang segar dan ketenangan tempat ini. Tiba lelah dari Bromo dan Ijen, pergi dengan baterai terisi penuh! Oh, dan luangkan waktu untuk mengobrol dengan pemiliknya dan mendengar ceritanya dan bagaimana dia merancang tempat yang indah ini sendiri?  (Aur lie & St phane, dari Perancis, 2 hari - 1 malam, 1 spa, 1 tur snorkeling)",5
1, Sun Suko Hotel,"Kami menghabiskan 3 hari di Sun Suko Retreat. Properti ini benar-benar sebuah oasis kedamaian dan ketenangan. Ini adalah hotel kecil yang lucu dengan 10 kamar, setiap kamar didekorasi dengan cinta dan perawatan yang ekstrim oleh pemiliknya sendiri. Kami juga senang bertemu dengannya dan dia menunjukkan kami berkeliling. Stafnya ramah dan selalu bersedia memenuhi permintaan apa pun. Kami sangat menyukainya di sana sehingga kami bahkan tidak repot-repot pergi ke pantai dan hanya bersantai di bawah sinar matahari suko. Kami sangat merekomendasikannya jika Anda mencari tempat liburan yang damai di tengah-tengah budaya bali sejati.",5
2, Sun Suko Hotel,"Terletak di kaki bukit hijau yang indah, Anda menemukan oasis yang damai dan indah ini dengan suasana yang indah.  Menginap di sini adalah pengalaman estetika yang unik; Rumah-rumah dan kamar-kamar semuanya dengan hati-hati dikerjakan melalui setiap detail kecil menggunakan bahan asli dan keahlian. Setiap kamar memiliki tema sendiri yang ditekankan oleh detail unik dalam pilihan furnitur, bahan, warna, dan dekorasi. Taman ini juga luar biasa indahnya dengan banyak pohon dan tanaman indah yang berbeda.  Staf ramah dan selalu membantu dan siap untuk menginformasikan tentang perjalanan dipandu di daerah serta rincian tentang makanan segar yang dibuat di restoran. Kami memiliki pijat yang sangat baik yang diberikan oleh anggota staf yang terampil termasuk dalam kami tinggal. Kami…",5
3, Sun Suko Hotel,"Ruang indah di pegunungan dengan detail indah di setiap kamar. Suasana luar biasa dan tempat yang sempurna untuk bersantai. Menikmati pijatan, sarapan yang luar biasa, dan taman yang indah dengan banyak pohon. Staf yang ramah Pasti akan merekomendasikan!",5
4, Sun Suko Hotel,"WOW pengalaman yang luar biasa! ! ! ! Dari saat kami dijemput di bandara oleh Wayan yang tersenyum dan sangat profesional, hingga sambutan yang sangat hangat di resor. Sarapan indah a la carte, untuk pengalaman dinning yang luar biasa dan perjalanan sehari yang luar biasa terorganisir. Dari arsitektur yang luar biasa dan vila yang dirancang dengan sempurna oleh pemilik Anja sendiri dengan faktor wow yang luar biasa hingga spa dan pijat tubuh yang menakjubkan!  Semua ini dan masih banyak lagi membuat kami kagum dan membuat kami tidak pernah meninggalkan tempat ini lagi!  Terima kasih, Anja dan tim Anda yang luar biasa karena telah memberi kami rumah yang indah, jauh dari rumah! Felix, Lenny dan Aleks ??",5
5, Sun Suko Hotel,"Saya dan suami saya menghabiskan beberapa malam di sini selama bulan madu kami. Saya pikir kami tahu kami telah memilih tempat yang bagus ketika Kathrin bangkit dari hotel dengan senyum lebar untuk menyambut kami segera setelah mobil kami berhenti. Hotel itu sendiri indah dengan taman yang rimbun, kolam bagus dan decomations gurih. Kamar cantik (berpikir kamar mandi kami lebih besar dari kamar tidur kami di rumah) dan semua staf indah! Ada banyak sentuhan yang sangat saya sukai, seperti upaya meminimalkan limbah dengan menyediakan air minum dalam dispenser air besar dan sarapan yang dipesan sebelumnya (yang enak!). Kathrin memberi kami daftar rekomendasi untuk restoran dan saya pikir kami makan melalui hampir seluruh daftar: -) Staf sangat ramah dan sangat membantu dan senang…",5
6, Sun Suko Hotel,"Benar-benar dapat merekomendasikan tempat, rumah-rumah yang indah dan kolam renang, dan 10 menit berjalan kaki dari pantai. . . orang yang sangat ramah dan membantu orang. Seni yang bagus di mana-mana. Ini cukup mahal namun layak.",5
7, Sun Suko Hotel,"Kami memesan ini dengan cepat setelah ingin pergi dari Nusa Lembongan. Kami awalnya memesan 2 malam tetapi tinggal 5, itu sangat baik.  Sun Soku berjarak 10 menit berjalan kaki dari jalan utama yang sibuk dan dikelilingi oleh peternakan. Semua penduduk setempat menyapa ketika Anda berjalan ke sana kemari ke kota.  Vila-vila di sekitar kolam renang yang indah dan sangat nyaman dengan selesai berkualitas tinggi, perlengkapan dan perlengkapan. Saya menyukai kamar mandi luar dengan pemandangan gunung.  Staf fantastis - dari pembersih untuk co - pemilik (wanita Swiss yang cantik yang telah mengajarkan dapur untuk membuat selai tayberry dan roti gandum hitam).  Sarapan murah hati dan sangat lezat.  Kami mengatur snorkeling dan transportasi melalui hotel dan mereka juga bisa…",5
8, Sun Suko Hotel,"Resor damai ini sangat menawan! Setiap unit menawarkan tema yang berbeda & dekorasi masing-masing, yang disediakan oleh pemilik berbakat & menawan, hanya luhur. Staf sangat penuh perhatian & ramah. Yakinlah Anda akan makan makanan lezat jika memesan dari menu. Pastikan saja untuk memberi saran ketika Anda berencana untuk makan makanan Anda karena makanan tidak dipersiapkan sebelumnya. Air minum gratis tersedia 24 jam sehari & Anda dapat menyimpan botol anggur Anda segar & dingin di lemari es mereka. Tempat ini sangat bersih & staf pergi keluar dari jalan mereka untuk mengakomodasi setiap kebutuhan kami. Pemesanan wisata hiking kami ke Taman Nasional melalui hotel membuat usaha yang sangat rumit sangat sederhana. Terima kasih atas keramahan Anda, Sun Suko! Kami tidak akan pernah…",5
9, Sun Suko Hotel,"Kami tinggal di Sun Suko Retreat di akhir Juli 2018. Bird Suite sempurna untuk keluarga kami empat. Sangat berselera dan bergaya! Restoran dan makanannya sempurna. Penyewaan skuter tersedia. Kami juga cukup beruntung untuk bertemu Anja pemilik dan keluarganya yang indah selama kami tinggal. Kami mengharapkan banyak, dan harapan dengan mudah dipenuhi dan dilampaui. Terima kasih Kathrin dan tim untuk membuat kunjungan kami sangat mengesankan!",5
10, Sun Suko Hotel,"Luar biasa dan menakjubkan Hotel dengan kamar yang masing-masing. Tidak seperti apa pun yang Anda dapat menemukan di Bali. Mata untuk rincian dan layanan besar. Mereka juga memiliki sebuah restoran yang sangat bagus, spa dan Yoga challa.",5
11, Sun Suko Hotel,"Luar biasa dalam setiap cara. Gaya, tenang, indah, pemandangan dan keramahan yang indah dan sangat membantu pemilik dan Staf - kami tidak akan tinggal di tempat lain! Mungkin tempat paling menyenangkan kami telah pernah tinggal di, dan kami perjalanan cukup sedikit.  Kamar Kami. Naga di kamar. Sangat rapi dan indah dihiasi, sangat penuh pesona. Akan seperti apartemen saya di rumah untuk dihiasi seperti ini!  Segar dan segar dikelilingi oleh dek kolam renang untuk bersantai, bersantai dan menikmati sinar matahari.  Makanan yang luar biasa, semua sangat segar dan sehat dan mencicipi menakjubkan! Koki yang sangat baik dan semua permintaan terpenuhi.  Hotel ini juga tempat yang bagus untuk menjelajahi daerah utara Bali S Coast dan daerah pegunungan yang indah.  Berharap untuk…",5
12, Sun Suko Hotel,"Seperti tempat yang indah dengan banyak cinta untuk detail. Sangat sulit untuk memutuskan di mana kamar yang unik kami ingin tidur karena kami menyukai mereka semua begitu banyak. Desain yang luar biasa, suasana yang sangat akrab dan staf benar-benar ramah. Seluruh tempat ini sangat bagus dan bersih dan kolam renang sangat bagus dan menyegarkan yang cukup besar untuk berenang tepat. Saya memiliki dua pijat di spa baru yang bagus. Yoga Shala memiliki pemandangan yang menakjubkan dengan angin baik - hanya sempurna. Energi yang luar biasa! Makanan adalah segar, sehat dan lezat! Itu mudah 10 - 15 menit berjalan kaki ke pantai Pemuteran dan saya sangat menyukai tempat itu. Berharap untuk kembali lagi segera.",5
13, Sun Suko Hotel,"Kami menemukan segala sesuatu yang kita cari dan banyak lagi! Ini adalah benar-benar sebuah surga kecil yang dirancang dengan indah dengan kamar yang nyaman dan bersih, kolam renang yang indah dan makanan yang enak.  Kami memesan beberapa Yoga di maju dan kami sangat senang dengan sesi kami setiap pagi. Permintaan kami untuk makanan vegan dan mereka segera menjawab dengan besar ya - makanan yang sangat lezat!  Anja pemilik dan staf melakukan segalanya untuk membuat kami tinggal pengalaman yang indah!  Jika Anda berencana untuk berhenti di Pemuteran pastikan untuk menginap di Sun Suko :)",5
14, Sun Suko Hotel,"Kami tinggal 5 malam di San Suko tempat dan ini adalah salah satu yang terbaik yang kami tinggal selama liburan kami 6 bulan di Asia.  Ini adalah nilai yang besar untuk uang dan anda akan menemukan akomodasi yang sempurna untuk anggaran Anda.  Juru masak menyiapkan setiap hidangan dengan perhatian yang anda suka dan kompetensi. Kami hanya makan tumbuhan dan seluruh makanan dan piring saya selesai lebih cepat kemudian yang.   Ini adalah tempat kecil sehingga Anda tidak takut untuk pergi kadang-kadang di dapur dan berkomunikasi dengan koki yang Anda makan, karena tidak ada menu.   Hari kami mulai dengan 80 menit yoga setiap hari - sesuai dengan kebutuhan kami. Diikuti oleh sarapan lezat, berenang dan membaca, sehat makan siang dan kadang-kadang bahkan merasa sulit untuk…",5
15, Sun Suko Hotel,"Saya baru-baru ini tinggal beberapa malam di sini dengan pasangan saya dan saya pasti akan merekomendasikan tempat ini. Semua kamar bertema yang saya tip yang luar biasa. Kami tinggal di 'kamar di pecinta'. Hotel ini bersih, terawat dengan baik resor berkualitas tinggi dengan pemandangan yang indah dari perbukitan. Makanan sangat sehat dan sangat lezat. Kami selalu memiliki kolam renang untuk diri kita sendiri. Staf dan layanan yang baik. Kami menggunakan hotel ini sebagai rumah nyaman - tempat untuk kembali ke setelah hari berpetualang untuk snorkeling/wisata dll.  Kami akan datang kembali lagi satu hari untuk yakin.",5
16, Sun Suko Hotel,Anja br Ndli dari Swiss yang dibuat indah butik resor yang saya telah dalam beberapa saat. Tersembunyi dari turis yang ramai sepanjang tempat dia menawarkan oase yang tenang dengan penuh cinta dan ketenangan. Semua kamar bertema khusus dan dihiasi dengan begitu banyak detail kecil untuk cocok dengan tema kamar ini. Kami tinggal di suite besar. sangat indah. Kami sangat senang dengan saat kami masuk. Bahkan gantungan baju di kamar mandi yang berbentuk hati. Dan itu tidak di semua tapi kitschy stylefully diatur. Energi di seluruh tempat sangat bagus yang anda merasa di rumah langsung. Tidak heran karena dia harus bekerja dengan dia ahli Feng Shui untuk meletakkan keluar rumah dan kamar sempurna untuk memenuhi seluruh tempat. Lingkungan hanya menakjubkan. Anda memiliki pemandangan…,5
17, Sun Suko Hotel,"Tempat yang menakjubkan! Energi yang besar dan dibangun dengan cinta dan detail yang indah.  Kamar sangat luas dan nyaman, sebagian besar memiliki kamar mandi luar ruangan yang indah dan furnitur adalah memilih dengan hati-hati dan sesuai dengan topik di setiap kamar. Kolam renang adalah pusat dari semua bangunan dan adalah tempat yang indah untuk bersantai. Yoga Shala terbuka di lantai pertama di atas spa dan pemandangan menakjubkan ke alam hijau.  Saya suka semuanya tentang Sun Suko Boutique retreat. Terutama suasana tenang dan makanan yang sangat lezat. Anda benar-benar merasa bahwa dia tidak menempatkan Anja jantung dalam proyek ini. Ia menciptakan tempat yang benar-benar menakjubkan dengan staf yang ramah dan makanan sehat yang saya dapat merekomendasikan. Saya pasti akan…",5
18, Sun Suko Hotel,"Tempat yang fantastis, indah dibangun dengan banyak perhatian untuk rincian. suasana yang sangat tenang dan masih dalam jarak berjalan kaki ke laut. Palungan dan staf yang super ramah, melakukan segala sesuatu untuk membuat Anda senang. Sangat direkomendasikan! Sakit kembali!",5
19, Sun Suko Hotel,"kami menghabiskan Natal terakhir kami di Sun suko dan itu benar-benar tempat yang luar biasa. Kami telah tinggal di Bali selama 4 tahun sudah sekarang jadi kami tahu tempat yang baik. Tapi yang satu ini memiliki suasana yang khusus dan memiliki suasana yang Anda tidak dapat dibandingkan dengan apapun atau lupa. Kami mendapatkan kamar batik. itu adalah pemandangan speachless dan memberikan perasaan ini di real kontak dengan alam di sini. Perbukitan hijau yang sangat dalam. Kasur yang sangat nyaman di semua kamar adalah seperti di rumah, luas tapi nyaman, yang sangat bagus dengan terasse untuk bersantai, kamar mandi yang baik dan dekorasi yang sempurna, tempat yang sangat tenang dan damai. Makanan sangat sehat  pemilik yang sangat terlibat di Shes Ania dari proyek itu sendiri,…",5
20, Sun Suko Hotel,"Makanan yang sangat baik, staf yang ramah dan sangat membantu tidak ada terlalu banyak untuk mereka, tempat ini sangat bersih, kamar yang luas dan sangat cukup. Apa yang kita suka yang paling adalah pemandangan!",5
21, Sun Suko Hotel,ini adalah yang paling romantis malam untuk ulang tahun pernikahan saya. kami tidur di kamar besar dan merasa suasana cinta di udara. makanan yang sangat baik dengan staf yang ramah dan chef komang. terbangun dan melihat gunung yang indah dan dekat dengan berjalan kaki ke pantai. saya suka ini tempat suko matahari. saya akan kembali lagi untuk yakin... dan aku akan melewatkan tempat ini.,5
