,hotel,review,stars
0, The Seiryu Villas,"Saya dan istri sangat menikmati kenyamanan yang di berikan the seiryu villas,seminyak.. mulai dari pelayanan yang sangat baik dan ramah sampai fasilitas yang di berikan sangat memuaskan saya dan istri selama menginap di the seiryu villas, seminyak.. next time saya ingin menginap lagi disana bersama keluarga..  Makasih the seiryu villas, travelanda dan jewelleryanda atas semua nya..",5
1, The Seiryu Villas,"Setelah beberapa hari mencari pilihan tempat menginap untuk perjalanan ke Bali untuk 4 hari 3 malam, saya memutuskan untuk mencoba Seiryu Villas setelah mendapatkan cukup banyak rekomendasi yang baik. Terbukti ini adalah pilihan yang tepat dan saya merekomendasikannya pada semua teman dan pasangan yang hendak menginap di Seminyak.  Para karyawan menerima kami dengan baik, tulus dan dengan sabar menjawab berbagai pertanyaan kami yang agak konyol mengenai reservasi kami. Mereka membantu kami dalam segala hal, mulai dari menyempatkan 20-30 menit untuk membantu menyusun rencana harian kami, menghubungi restoran dan tur pilihan kami untuk membuat reservasi, hingga beragam tips dan trik yang diberikan agar kami benar-benar menikmati perjalanan kami. Seperti pengakuan para tamu yang…",5
2, The Seiryu Villas,Kami menetap di sini untuk berbulan madu. Serasa di surga. Tempatnya sungguh syahdu dan mengesankan. Para karyawan tidak menarik perhatian namun sangat proaktif. Semua begitu sempurna. Kami mendapatkan makan malam di pinggir kolam renang dengan diterangi cahaya ratusan lilin. Dunia serasa milik berdua namun dengan kenyamanan memiliki pelayan pribadi. Mereka juga menyediakan layanan kendaraan lengkap dengan supir yang sangat ramah dan membantu. Kami mencintai sarapan gaya Jepang yang disajikan dalam kamar kami. Kami menikmati pengalaman kami menetap di hotel ini. Saya merekomendasikan hotel ini untuk bulan madu anda.,5
3, The Seiryu Villas,"kami pergi ke bali pada bulan feb 2011 dan menginap di seiryu selama 3hari 2malam. kami dijemput di bandara dengan ontime dan pelayanan yang baik selama perjalanan menuju villa. kami diberitahu lokasi yang bagus untuk dikunjungi.seperti guide tour singkat.  review saya untuk villa ini: -private pool yang sangat bagus. terdapat gazebo disisi kiri pool untuk bersantai -bathroom dengan bathtub yang dilengkapi jacuzzi dan pintu tembus ke pool -kamar yang luas dengan lcd tv dan dvd player - ruang dapur yang bersih dan nyaman dilengkapi microwave dan coffee maker, serta kulkas dan kompor beserta peralatan masak -meja makan yang simple -living room dilengkapi lcd tv 42"" dan dvd player. -suasana villa yang teduh dan menyenangkan kami juga mendapatkan fasilitas pinjaman sepeda motor…",4
4, The Seiryu Villas,"Tempat yang sangat indah, terletak di pusat dan di atas semua, staf yang sangat ramah. Ideal untuk pasangan yang hanya ingin waktu santai untuk diri mereka sendiri. Pasti akan merekomendasikan kepada orang lain. Satu saran kecil: Akan lebih baik jika mereka bisa menyediakan peta area untuk membantu orang-orang yang baru pertama kali ke Bali",5
5, The Seiryu Villas,"Menginap selama 2 malam. Staf yang sangat ramah dan membantu membuat kami merasa diterima. Sarapan yang baik, kamar yang bersih, tenang & nyaman. Dekat dengan restoran & kafe yang bagus, 7 menit berjalan kaki ke pantai. Saya pasti akan tinggal di sini lagi.",5
6, The Seiryu Villas,"Saya tinggal di The Seiryu dalam perjalanan kerja - dan saya benar-benar terpesona! Suasana villa adalah keseimbangan kerja / kehidupan yang sempurna yang saya butuhkan. Saya menikmati semua fasilitas yang ditawarkan villa beserta layanan transportasi yang nyaman dan aman (yang pasti saya manfaatkan!) Favorit saya mungkin The Seiryu Spa karena saya tidak harus meninggalkan kenyamanan kamar saya - mereka datang ke saya! Bicara tentang kenyamanan total dan perlakukan tamu Anda dengan pengalaman terbaik! Secara keseluruhan, The Seiryu Villas mendapatkan 10/10 di buku saya! Dari akomodasi kamar, makanan, dan fasilitas, pengalaman saya di sini adalah salah satu alasan mengapa saya akan kembali ke Bali!",5
7, The Seiryu Villas,"Staf yang ramah, lokasi yang baik, desain interior dan eksterior yang luar biasa dari properti, kolam renang yang indah dan jacuzzi, sangat merekomendasikan vila ini, makanan yang baik, sangat dekat dengan pantai La Plancha, hanya lima menit berjalan kaki, banyak restoran di sekitar.",5
8, The Seiryu Villas,"Tempat yang hebat semua orang sangat ramah dan baik dan sangat membantu ketika mencoba memutuskan apa yang harus dilakukan di Bali dan bagaimana cara berkeliling. Ketika kami meninggalkan hotel, semua orang berdiri di luar dan melambaikan tangan kepada kami. . . itu yang pertama dan saya menyukainya!",5
9, The Seiryu Villas,Saya menginap di salah satu villa mereka selama satu malam. Ruang luar biasa dan privasi luar biasa. Yang paling saya sukai adalah bagaimana pintu kamar kecil terbuka ke kolam renang. Kamarnya luas. Staf sangat ramah dengan saran mereka. Satu-satunya permintaan saya adalah menambahkan beberapa item vegetarian / vegan ke sarapan. Saya pasti akan kembali!,5
10, The Seiryu Villas,"Kami baru-baru ini tinggal 6 malam di salah satu villa mewah. Vila-vila sangat luas dan termasuk semua yang Anda butuhkan. Banyak toko, restoran, dan pantai yang dapat dicapai dengan berjalan kaki. Staf sangat ramah dan membuat tinggal lebih nyaman. Nantikan tinggal bersama mereka lagi.",5
11, The Seiryu Villas,"Saya baru saja kembali dari The Seiryu Villas dan benar-benar menyukainya! !  Ini adalah sekitar 5 menit berjalan kaki ke Pantai Double Six meminta Butler mereka akan lebih senang memberi Anda petunjuk!  Dekorasi terinspirasi oleh Jepang, lobi sangat menyenangkan dan ramah!  Vila ini sangat nyaman dan luas untuk 2 orang. Tidak pernah memiliki masalah dengan nyamuk untuk pertama kalinya dalam 4 perjalanan ke Bali.  Mangkuk smoothie sarapan dengan selai kacang sangat menyenangkan!  Tempat tidurnya nyaman dan mereka memiliki kotak film di ruang tamu dengan pilihan film yang memadai. Kolam renang cukup untuk bersantai di bawah sinar matahari.  Luar biasa, saya pasti akan merekomendasikan teman!",5
12, The Seiryu Villas,"Memberi bintang kedua karena staf dan sarapan yang enak. Check in di sini di tengah malam dan berjalan ke sebuah flat yang 30 derajat C. Mengingat luasnya villa dan di mana seseorang tidak dapat menutup kamar, langit-langit tinggi dan AC mini split sudah tua, mendinginkan tempat adalah hal utama proses. 2 jam post check di temp telah turun ke 28 C. Tak perlu dikatakan, saya mendapat sangat sedikit jika ada cara tidur, ini selama sekitar 9, 600 PHP. Manajer merespons dengan menyatakan 23 hingga 25 adalah standar namun saya mengambil foto yang menunjukkan 83 (28. 3 C) dan mengirimkannya kepadanya. Jangkrik. Jika Anda akan menjual kamar, terutama di tingkat itu, bawalah mereka sesuai standar saat check-in.",2
13, The Seiryu Villas,"Villa Seiryu selalu luar biasa, bagus untuk harga dan lokasi bagus. Ini adalah ketiga kalinya saya tinggal di sini. Staf pergi di atas dan di luar untuk kami dan selalu membantu. Villa persis seperti foto. Saya akan sangat merekomendasikan tinggal di sini & akan tinggal lagi! !",5
14, The Seiryu Villas,"Ada BANYAK tempat untuk dipilih di Bali. Saya suka Seiryu ini karena kecil, jarak jalan kaki ke toko-toko, bar, dan restoran, dan dari jalan utama - jadi itu sangat tenang dan damai! Kolam renang pribadi PRIVATE dan kamar besar dan sangat nyaman. Staf sangat ramah, yang membuat tinggal lebih baik. Saya ingin mengenali Ira, yang paling sering bekerja selama saya tinggal sebentar. Dia merekomendasikan tempat yang bagus untuk makan, La Favela, dan juga banyak tempat lain yang tidak kami kunjungi, jadi kurasa aku harus kembali! Ira juga ""kepala pelayan"" untuk makan malam di kamar, dan dia luar biasa. Senang juga berbicara dengannya tentang Bali dan perjalanannya ke seluruh dunia. Segala yang kami butuhkan hanya satu panggilan telepon, layanan dan ruangan yang sangat baik. Terima…",5
15, The Seiryu Villas,"Layanan yang fantastis, kamar besar 5/5 rating tidak perlu khawatir. Pacarku dan aku punya waktu yang indah di villa mewah dengan ruang biliar. Staf benar-benar pergi di atas dan di luar untuk membuat kita tetap diingat. Akan 100% tinggal di sana lagi.",5
16, The Seiryu Villas,Menginap dua kali sangat santai di sebuah hotel di mana setiap kamar apartemen sendiri dengan kolam renang dan semua fasilitas. Sarapan yang disajikan di kamar anda dan setelah itu tidak ada mengusik Anda. Berjalan kaki sebentar dari pantai dan keramaian Bali. Akan kembali lagi.,5
17, The Seiryu Villas,"Villa yang luar biasa, layanan hebat, staf yang indah dan lokasi yang indah. Sangat merekomendasikan dan akan senang untuk kembali. Kami punya Villa A 2 yang ajaib. Sangat pribadi dan sempurna untuk liburan romantis. Anda tidak akan kecewa.",5
18, The Seiryu Villas,"Kamarnya sangat luar biasa, sangat besar dan luas. Lokasi strategis, mudah berjalan kaki ke pantai dan kota. Staf sangat membantu dan pergi keluar dari jalan mereka untuk membantu kita. Perawatan spa dapat diantar ke kamar yang sangat bagus.",4
19, The Seiryu Villas,"Tempat ini adalah villa, Jepang fusion dengan selera yang dirancang dan vila. Yang paling penting staf kedai kopinya memiliki atap yang bekerja di sekitar jam, sangat membantu dan ramah dan saya senang karena saya tahu beberapa dari mereka. 7 menit berjalan kaki ke pantai dan beberapa menit dari semnyak strip yang membuat tempat ini berada di lokasi yang sempurna. Privasi adalah dipelihara dengan baik dan pelayanannya cukup bagus. Saya akan mengunjungi tempat ini lagi karena dua alasan villa, ramah dan sangat sopan dan nilai untuk uang vila kolam pribadi!",4
20, The Seiryu Villas,"Baru saja kembali dari perjalanan pertama kami ke Bali. Kami memesan villa ini berdasarkan rekomendasi dan kami tidak kecewa. Anda dapat mempercayai semua ulasan yang sangat baik tentang Seiryu.  Properti ini sangat intim dengan hanya 8 vila dan terletak di pusat Seminyak, hanya 5 menit berjalan kaki ke pantai dan akses mudah ke semua.  Villanya indah, luas, nyaman, sangat privat dan memiliki semua yang kami butuhkan. Kami memiliki paket yang termasuk beberapa makanan dan pijat yang luar biasa! Sarapan Indonesia yang lezat untuk memulai setiap hari, tetapi ada pilihan lain juga. Makan malam yang indah serta makanan.  Staf di Seiryu benar-benar kelas satu. Sangat penuh perhatian, melibatkan, ramah, profesional, dan responsif terhadap setiap kebutuhan atau permintaan. Mereka…",5
21, The Seiryu Villas,"Saya dan istri saya benar-benar menikmati villa yang sangat indah dan staf yang sangat membantu. Ulangi pengunjung ke Bali akan mengerti bagaimana daerah ramai seperti Seminyak dapat. Di Seiryu Villas menyediakan sangat tenang dan menghargai melarikan diri dari semua hiruk-pikuk. Kami menginap di Royal Villa dan sangat menikmatinya dan kami benar-benar benci untuk pergi. Istri saya adalah masakan Bali dan kami benar-benar menikmati kamar untuk menghibur beberapa keluarga di vila kami luas. Saya akan benar-benar berterima kasih Ira, tempat yang indah, seorang wanita muda dari resepsionis yang mengatakan kepada kami untuk membuat karena seolah kami berada di rumah sendiri. Ira dan gadis lain yang selalu tersedia untuk membantu kami dengan apa yang kami minta. Makanan yang sangat…",5
22, The Seiryu Villas,"Saya dan pasangan saya menginap di sini selama 7 malam. Vila yang fantastis di dekat dengan segala sesuatu yang bagus yang ditawarkan Seminyak - belanja, pantai, kehidupan malam, transportasi. Aset yang terbesar dari Seiryu adalah luar biasa dan layanan pelanggan yang penuh perhatian dari semua anggota staf. Setiap pagi kami disambut dengan senyum di wajah. indah, Semua permintaan kami bertemu secara tepat waktu dan tur diatur untuk kami stres gratis. Pasti akan merekomendasikan villa ini kepada siapapun yang mencari tempat yang tenang dan bersih dengan pengalaman pelayanan pelanggan yang luar biasa! Terima kasih untuk membuat mitra saya Seiryu pertama kali di Bali menjadi pengalaman yang tak terlupakan!  Stephanie dan Nicholas",5
23, The Seiryu Villas,"Kami benar-benar menikmati kembali ke kedamaian dan ketenangan di Seiryu Villas setelah hari menjelajahi banyak atraksi di Bali. Vila ini luas, nyaman, dengan kolam renang sendiri adalah mengenakkan untuk menginap di. Stafnya sangat membantu dan efisien diikuti melalui setiap permintaan.",5
24, The Seiryu Villas,"Pasangan saya dan saya menginap di The Seiryu di awal September untuk beristirahat dari tur Vietnam yang menantang tapi luar biasa.  Dari saat kami berjalan di kami terkejut dan taman bergaya jepang. Rasa Zen mulai mengisi Anda dengan seni visual dan perlengkapan bangunan.  Kami disambut oleh staf yang terbaik yang pernah kami temui (bepergian di seluruh dunia dan tinggal di Bali 9 x kali di banyak vila, w resort dll)  Tim di sini adalah keluarga baru kami sekarang! Semua orang adalah hangat dan ramah seperti Keluarga Bali tetapi Seiryu adalah apa yang membuat perjalanan ini lebih tak terlupakan.  Misalnya saya bertanya pelayan kami tentang Turah sewa sepeda motor yang ia direkomendasikan beberapa harga dan kemudian melaju di sekitar Seminyak ide saya menemukan sepeda dengan…",5
25, The Seiryu Villas,"Ini adalah kedua kalinya kami di Seiryu, Bali. Kami pergi 10 tahun yang lalu dan jatuh cinta. Kami memutuskan untuk memesan lagi untuk suami saya 40 th!  Itu tidak mengecewakan. Villa, staf, makanan dan lokasi yang sempurna untuk siapa pun yang ingin bersantai.",5
26, The Seiryu Villas,"Kesan pertama adalah saat kami harus meneruskan perjalanan kami! Pelayan yang menjawab panggilan saya (di akhir pekan) segera memberikan permintaan kami untuk pemesanan di hari kerja berikutnya tim tanpa saya harus menelepon mereka lagi.  Tujuan perjalanan adalah untuk beristirahat & bersantai hanya. sehingga kami memutuskan untuk mengunci diri di sebuah villa dan Seiryu Villa sangat tepat! Kami menginap di Royal Villa.  sangat luas, hampir terlalu besar untuk dua orang. Kolam renang pribadi adalah hanya ukuran yang tepat. Tempat tidur yang nyaman, tempat tidur/sofa yang nyaman untuk bersantai di dan menonton di - film yang disediakan. Gazebo di tepi kolam renang sangat nyaman. Mengejutkan berangin meskipun kami ditutup dari jalan raya. Anda mendapatkan privasi penuh.  Sarapan…",4
27, The Seiryu Villas,"Kami tinggal di villa selama 6 malam; ini adalah salah satu liburan terbaik saya belum memiliki pengalaman untuk waktu yang lama. Lokasi villa ini juga sangat bagus; mudah berjalan kaki ke pantai dan restoran. Secara khusus, kepala pelayan - Mr Turah memenuhi semua permintaan saya meminta layanan. Pasti, kami akan tinggal di sini lagi ketika kembali ke Bali.",5
28, The Seiryu Villas,"Kami tinggal di sana selama dua minggu dan dari awal yang sangat Layanan yang 100 persen. Pekerja adalah semua sangat baik dan selalu sangat senang untuk membantu Anda dengan apa pun yang Anda butuhkan. Mereka memiliki Gratis BBQ yang setengah jalan melalui Bali yang kami tinggal. Villa adalah menakjubkan. sangat bersih dan  sarapan setiap pagi adalah bonus. Kolam renang adalah besar dan tempat tidur dan lounge yang sangat bagus juga. Lokasi adalah sempurna, tidak terlalu ramai dan sangat pribadi. Semuanya adalah berjalan kaki dari villa ini. Kami mencintai tempat ini dan akan benar-benar tinggal di sana lagi.",5
29, The Seiryu Villas,"Kami menginap di vila ini selama hampir satu minggu baru-baru ini dan benar-benar menikmati nuansa butik kecil hotel - hanya ada 8 unit dan sebagai hasilnya, staf benar-benar mendapatkan untuk mengetahui Anda dan membayar perhatian untuk Anda. Mereka sangat bagus - sangat ramah - layanan yang sangat baik. Mereka sangat membantu dengan mengatur sopir dan tur untuk kami.   Villa adalah ukuran besar - lengkap dengan dapur dan ruang tamu, baik luar ruangan tempat duduk area, kolam renang. Mereka membawa sarapan di pagi hari, yang kami memilih pada malam (namun, kami membuat titik untuk ingat untuk berhenti oleh meja depan untuk memesan, yang kami akan lupa, saya tidak yakin mengapa mereka tidak hanya meninggalkan sprei di kamar Anda memesan). Bagian terbaik tentang tempat ini…",4
30, The Seiryu Villas,Kami tinggal di Villa untuk 2 malam 3 akan. Villa adalah sangat luas. Kolam renang pribadi sangat bagus dengan privasi menjadi hal terbaik di villa. Itu adalah pengalaman yang menyenangkan tinggal di Seiryu. Saya akan menginap lagi di sini.,5
31, The Seiryu Villas,Kami memiliki menakjubkan 2 minggu tinggal di Seiryu Villas di Juni 2017. Vila itu sendiri adalah luar biasa dengan kolam renang pribadi dan dapur. Staf yang sangat ramah dan membantu. Koneksi Wifi sangat bagus jika Anda membutuhkannya. Sarapan dibawa ke kami setiap pagi pada waktu yang kami pilih sendiri (order makanan yang diletakkan di malam sebelumnya) dan sangat lezat. Sekitar 10 menit kami berjalan kaki dari pantai Seminyak yang indah dan 20 - 30 menit berjalan kaki ke Seminyak Square dengan banyak toko-toko dan restoran. Pasti akan merekomendasikan di sini.,5
32, The Seiryu Villas,"Vila itu sendiri adalah bahkan jauh lebih besar daripada foto yang muncul untuk menjadi. Staf dan layanan adalah hanya yang terbaik - kelas. Vila terletak di pusat Seminyak, di bawah - kota dan kota - hanya satu pusat batu - dekat. Kami menyukai villa dengan hangat seluded ini - staf yang terbaik, pasti akan kembali lagi!",5
33, The Seiryu Villas,Seiryu Villas menyediakan sangat nyaman tinggal. Villa adalah rapi dan bersih dengan semua fasilitas. Nyaman pengaturan vila yang dipadu dengan luar biasa staf yang membuat kami tinggal kenangan. Wanita di penerimaan yang perlu disebutkan secara khusus karena ia sangat cepat dalam melayani kami. Villa sangat baik dilengkapi dapur. Lokasi adalah luar biasa dengan banyak tempat makan di dekat properti. SANGAT DIREKOMENDASIKAN! ,5
34, The Seiryu Villas,"Hanya belajar tentang Villa tapi saya percaya Harapan saya tinggi setelah tinggal di sini. sangat luas, sangat aman, dan sarapan yang lezat setiap pagi. Saya sarankan koki rekomendasi. Nilai yang baik untuk hidup mewah! Saya akan kembali!",5
35, The Seiryu Villas,"Itu adalah ulang tahun pasangan saya selama satu hari dan saya menginap di villa. Sebelum kedatangan saya. Saya menurunkan email yang meminta untuk bunga dan sepotong kue yang dikirim ke Villa pada hari ulang tahunnya. Semua hal ini dimaksudkan untuk menjadi sebuah kejutan untuknya.  Pada hari yang sebenarnya, tidak hanya apakah saya mendapatkan bunga di bak mandi, sebuah tangkai mawar dengan menggunakan Swan dilipat handuk yang ditempatkan di tempat tidur kami. Di atas semuanya, Villa mengirim tim 5 staf yang membawa gitar dan kue untuk memberikan persembahan mereka.  Mereka menyanyi dengan benar-benar baik dan itu benar-benar membuat hari nya.  Besar terima kasih kepada staf di Seiryu Villas, pertahankan pelayanan yang baik dan Tuhan memberkati. (Tepuk Tangan)",5
36, The Seiryu Villas,"Kami memiliki pengalaman menginap yang menakjubkan di Seiryu Villas. Sarapan disajikan setiap pagi di kamar kami dan itu lezat setiap kali. Staf semua sangat ramah, ramah dan penuh perhatian untuk setiap kebutuhan Anda. Villa kami adalah sangat pribadi dan memiliki kolam renang pribadi dan dek matahari terasa sangat mewah. Tempat tidur sangat nyaman dan AC bekerja dengan baik. Lokasi adalah sempurna. Anda tidak bisa mendengar jalan yang sibuk dari villa. Ini adalah 5 menit berjalan kaki ke pantai di satu arah dan pasar, restoran dan SPA semua jalan ke arah lain. Terima kasih banyak untuk waktu yang indah.",5
37, The Seiryu Villas,"Vila-vila sangat tenang dan santai, staf yang indah dan akomodatif. Meminta untuk Villa menjadi 1 ini sangat luas dan dekorasi indah.   Area kolam adalah tenang dan luas, kami menikmati kami tinggal dan pasti akan kembali lagi ke The Seiryu Villas.",4
38, The Seiryu Villas,"Pengalaman kami di Seiryu Villas adalah tempat yang sempurna. Mereka mendapatkan dijemput dari bandara dan dibawa kami ke sepotong kecil surga di Bali. Ketika kami memasuki properti kami yang dengan mata menyala, itu lebih indah daripada yang di foto. Vila yang terinspirasi dari Jepang dan dekorasi adalah benar-benar indah. Kolam renang pribadi kami yang fantastis untuk bersantai di Dan Kru membuat kolam renang yang sejernih kristal.  Semua staf yang luar biasa, dari resepsionis hingga supir pribadi yang luar biasa, keamanan dan housekeeping kru yang umum. setiap hari akan mulai dengan panggilan telepon menyarankan kami sarapan di tempat ini dalam perjalanan ke villa kami. Kemudian mengetuk di pintu belakang dan lezat sarapan akan disiapkan di meja makan kami. Ada banyak pilihan…",5
39, The Seiryu Villas,Konsep yang bagus dan layanan premium Sarapan disajikan pada waktu yang tepat. Pelayan sangat bagus dan daerah Seminyak dan Kuta beachbis tempat pasar yang bagus di dekatnya.  Vila dan kolam renang menyediakan banyak dibutuhkan mewah pribadi. ,5
40, The Seiryu Villas,Ini adalah yang menyenangkan dan menyenangkan. Meskipun hotel tidak bisa lebih baik di kamar dan kolam renang yang menjaga. Pilihan sarapannya sangat enak dan lezat. Staf sangat bagus dan selalu menyambut/membantu anda dengan senyum,5
41, The Seiryu Villas,"Dari saat kedatangan sampai keberangkatan layanan adalah benar-benar sempurna!  Tempat yang indah untuk menghabiskan seminggu!  Aku tidak bisa memikirkan satu hal untuk meningkatkan Villa ini sempurna! Dari desain vila itu sendiri dan lokasi, untuk kebersihan dan presentasi di tempat yang sempurna, vila ini jauh lebih layak pengakuan dan pujian. Aku tidak bisa membayangkan sesuatu yang lebih indah dalam setiap aspek!  Terima kasih lagi untuk tim di Seiryu Anda pribadi dan profesional.",5
42, The Seiryu Villas,"Saya tinggal di Villa untuk 4 hari dan langsung dari pemesanan (yang saya tidak perlu) untuk checkout saya pengalaman itu sempurna.    4 Hal-hal besar untuk tinggal di Villa  1. yang luar biasa dan staf yang luar biasa: di menunjukkan kami Villa dan makna dari arsitektur Villa, sangat proaktif dan ramah setiap saat sepanjang hari  2. vila luar biasa: dari jacuzzi bak mandi ke kolam renang di lokasi yang sempurna di Royal Villa  3. Lokasi sangat dekat dengan pantai dan pasar tapi terletak di tempat yang tenang dan damai  4. Di Villa pelayanan lebih (mesin kopi, oven, tidak terbatas pasokan air, peralatan masak dan gas/kompor, TV dengan pilihan lebih dari 100 film)   Saya memiliki sedikit cegukan dengan atap bocor namun yang terlalu remeh merusak pengalaman saya secara keseluruhan…",5
43, The Seiryu Villas,"Kami tinggal untuk 4 malam.  Pelayanan: staf di sini luar biasa, Minnie serta dua pria di meja depan (saya lupa nama mereka) & Penjaga sangat hangat dan ramah. Saat itu hujan sepanjang hari tapi mereka menawarkan untuk mengantar kami ke tempat yang bagus untuk makan malam ketika kami meminta saran. Sarapan disajikan setiap pagi ke dalam villa kami. Hal ini lezat dan Anda dapat memilih menu pada hari sebelumnya.   Villa: Villa adalah indah dan bersih. Saya ingin mengucapkan terima kasih kepada staf layanan kamar untuk pekerjaan luar biasa. Vila yang indah dengan besar, kolam renang yang cukup besar dan anda dapat merasa banyak privasi di villa. (Luar biasa bau di seluruh Villa)   Lokasinya bagus, hanya 5 - 10 menit berjalan kaki ke pantai dan terjadi tempat (bar, klub, pusat…",5
44, The Seiryu Villas,"1 kali jalan di sini jadi suasana yang menyenangkan akan membuat setiap gaya Jepang, memiliki staf yang baik, kamar yang luar biasa untuk bulan madu dan layanan terbaik seperti transportasi dari airport ke villa dan villa untuk airpot, menyewa sepeda motor yang mudah. Sory untuk Inggris yang buruk.",5
45, The Seiryu Villas,"The Seiryu yang memiliki semua yang anda bisa meminta di sebuah villa, dan banyak lagi! Kamar yang besar, kolam renang luar biasa, spa mandi, tempat tidur yang indah, lounge yang terpisah, ruang makan dan area dapur. Semua ini dan 5 menit berjalan kaki ke pantai dan pusat belanja. Saya telah tinggal di Seminyak beberapa kali, dan ini adalah oleh jauh yang terbaik dan lokasi Vila. Makanan yang sangat baik, dengan banyak pilihan.  Staf sangat ramah dan membantu, khususnya di meja resepsionis, Mimi. Tidak ada yang terlalu banyak kesulitan untuk Mimi, ia punya tips untuk berbelanja, mengatur perjalanan ke Jimbaran dan jujur membuat saya merasa seperti saya memiliki teman. Mimi benar-benar membuat saya tinggal sempurna.  Saya akan kembali ke Seiryu, dan saya tidak dapat menunggu!",5
46, The Seiryu Villas,"Selama enam malam kami benar-benar menikmati kami menginap di villa yang menyenangkan pertemuan 1. Widi dan dengan staf yang tampak setelah kami selama kami tinggal. Terima kasih khusus kepada mini dan semua staf yang menempatkan bersama-sama yang mengesankan untuk sebuah pesta ulang tahun 30 th dan kue adalah sentuhan yang indah. Semua staf termasuk petugas keamanan yang layak mendapat pujian untuk layanan hangat dan penuh perhatian. Karena hanya ada 8 Villa, kami selalu merasa disambut dan menyambut.   Villa ini adalah jalan di mana terletak ini penuh dengan hotel baru, restoran dan kafe. Pantai Seminyak dapat dijangkau dengan 10 menit berjalan kaki untuk yang indah berjalan di pagi hari atau pada saat matahari terbenam.   Vila yang disediakan untuk kami adalah persis apa yang…",5
47, The Seiryu Villas,"Tinggal selama tujuh hari tidak bisa lebih bahagia dengan Layanan atau villa. Staf adalah sangat penuh perhatian dan membantu, layanan kamar sangat cepat, dan makanan segar dan lezat dan koktail. Villa sendiri luar biasa - kami tinggal di kamar kerajaan yang luas dan mewah seperti ini. Juga sangat pribadi. The Seiryu Villas membuat kami seluruh pengalaman Bali yang ini dan itu sulit untuk kesalahan mereka dengan cara apapun.",5
