,hotel,review,stars
94, The Seiryu Villas,Tinggal di sana selama 3 hari dan 2 malam dan sangat senang! Staf adalah besar dan penuh perhatian. Makanan yang sangat baik (selain lebuh kentang sup memerintahkan parmesan) kamar adalah dalam hal apapun. Di seberang kolam renang agak kecil dan sedikit kotor dan di lokasi yang cukup tersembunyi jika orang-orang tidak tahu jalan. Tapi secara keseluruhan memiliki waktu yang besar di sini dan akan merekomendasikan untuk semua orang untuk memiliki liburan anda di sana.,4
95, The Seiryu Villas,"Saya harus memberikan kredit untuk pengembang terutama arsitek! Desain dari villa ini boleh dibilang sempurna dengan setiap aspek dari proses berpikir diri sedang terperinei. Hotel indah, lokasi dan pengaturan, secara internal dan eksternal.   Ini adalah keempat saya kunjungi di bali dan yang pertama dengan istri saya. Tujuan disajikan di villa ini. Saya pribadi, romantis dan manis dan kami menghabiskan lebih banyak waktu di villa daripada di luar di pantai seminyak.  Kami memiliki akses ke spa (sebelah), perbelanjaan, sekitar 5 menit berjalan kaki dari pantai seminyak yang penuh sesak dengan dan benar-benar tidak ada masalah seperti yang mencolok di kuta.  Hotel ini benar-benar layanan yang disediakan adalah luar biasa dan kami tidak bisa memikirkan apa pun yang buruk adalah…",4
96, The Seiryu Villas,"Karena untuk rencana kami, kami hanya tinggal di villa untuk satu malam, dan kita benar-benar tidak bisa menikmati cukup!   Hotel ini sangat tenang dan pribadi, interior dan perabotan yang membuat kami merasa di rumah dan santai. Kami berharap kita bisa memiliki di rumah sebenarnya tidak!   Kamarnya tidak terlihat - mereka hampir tidak pernah terlihat kecuali jika anda membutuhkan mereka, tetapi ketika anda menyadari, mereka mendapatkan semuanya siap, luar biasa!   Sarapan juga sangat lezat!  Vila ini terletak 10 menit berjalan kaki dari pantai, yang kami menikmati pemandangan matahari terbenam sangat banyak!  Benar-benar direkomendasikan untuk pasangan!",5
97, The Seiryu Villas,Villa sangat pribadi dan terpelihara dengan baik. Staf adalah sangat membantu. Kamar besar dan selera yang benar-benar benar-benar hebat - anda harus mencoba sarapan jepang (ikan adalah pukta). Mereka memiliki aroma yang agak unik frangipanio dan mereka menjual sebotol minyak yang kita belum - sangat menyenangkan. Lokasi vila ini juga sengap central - akses mudah ke berbagai restoran bagus dan direkomendasikan (salah satu dapat dengan mudah berjalan kaki ke itu) pantai depan dari villa. Kami sangat merekomendasikan ini akomodasi untuk setiap pasangan - nyaman dan nyaman.,4
98, The Seiryu Villas,"Aku tinggal beberapa malam di hotel ini. Vila yang bagus, pelayanan yang sangat baik. Saya merekomendasikan hotel ini jika anda akan tinggal di sibuk, ramai kuta. Tetapi jika anda ingin tempat yang lebih baik anda harus pergi ke area lain...",5
99, The Seiryu Villas,"Semuanya sempurna. Ini adalah pribadi, kecil dan mewah. Staf sangat membantu dan ramah. Besar terima kasih kepada kami butler minnie, dia sungguh luar biasa. Saya dan pasangan saya pernah ke bali beberapa kali dan ini adalah yang terbaik. Kami akan sangat menyarankan ini untuk pasangan yang ingin dimanjakan. Romantis makan malam bbq di villa anda harus. Makanan yang luar biasa dan sangat romantis. Semoga ulasan ini bermanfaat dan anda memiliki tinggal yang nyaman.",5
100, The Seiryu Villas,"Pada saat kedatangan kami duduk di ruang tunggu dan bisa mendengar bangunan bekerja sangat keras yang bagus. Saya menghargai ada sedikit hotel dapat lakukan tentang hal ini tetapi itu tidak apa yang kita harapkan mengingat harga dari villa. Setelah kami mendapat di dalam villa, itu adalah jauh lebih baik tetapi kebisingan dari lain membangun kerja masih bisa didengar.   Villa adalah indah dan dirancang dengan indah dan di pagi hari kami (seperti jacuzzi bak mandi).   Kamar mandi memiliki sedikit bau basi jadi kami harus menjaga ventilasi itu. Sekali lagi, tidak apa yang anda harapkan dari hotel ini kaliber akomodasi.   Sarapan adalah miskin, hal ini sering dingin dan croissant terasa seperti mereka telah chowder.   Vila itu sendiri adalah baik dan layanan sangat ramah dan…",2
101, The Seiryu Villas,"Kami tinggal di sana selama empat hari. Karena itu merupakan sebagian besar waktu sekitar 26, itu sedikit dingin bagi kita untuk berendam di kolam renang, sayang sekali.   Kamar sangat luas A4 yang kami telah. Tidak bisa membayangkan untuk B2 B1 dan yang cukup beberapa direkomendasikannya, cara ini akan lebih besar. Staf sangat ramah dan membantu dalam semua permintaan kami termasuk membantu untuk memesan mobil otomatis (sebagian besar agen perjalanan menawarkan mobil manual).  Kamar kecil sangat bersih namun saya yang berusia tujuh tahun kami yang banyak tanda-tanda yang menunjukkan usia. Cap air kuning di bak mandi tidak akan dimanjakan suasana. Banjarmasin, bahkan setelah berubah menjadi bersih, itu sudah menguning. Sangat dianjurkan jika pemilik akan melakukan beberapa…",4
102, The Seiryu Villas,Tidak B3 & royal villa B4. Keduanya sama-sama baik dan luas. Masing-masing memiliki kolam renang pribadi mereka sendiri dengan tambahan fitur air.  Staf sangat ramah dan hangat. Hotel menyediakan layanan antar-jemput gratis ke mana saja di seminyak atau legian 10am dan di area 5pm. Bahkan menawarkan untuk membantu kami memesan taksi bluebird ketika kami bepergian ke tempat-tempat lain untuk menyelamatkan kami dan tidak menunggu untuk pergi di luar hotel yang mengelola untuk bendera taksi bluebird.  Sarapan adalah unik dan disajikan di vila anda. Makanan adalah luar biasa.,5
103, The Seiryu Villas,"Aku berada di sini di bulan maret dan menikmati tinggal di seiryu. Vila ini juga terletak dekat pantai seminyak, kira-kira $400 mts, sehingga anda dapat berjalan kaki ke pantai dan menikmati keindahan pantai itu. Layanan dan kebersihan juga tanpa cela.",4
104, The Seiryu Villas,"Ini adalah ketiga saya kunjungi untuk mendapatkan. Sekali lagi, staf dan layanan yang sangat baik. Hotel menetalkan vila pribadi dan nyaman dan sarapan yang ditawarkan adalah sangat baik. Saya tidak memiliki masalah saat ini bahwa villa l berada di membutuhkan makeover. Linen sudah tua dan sering kotor dan dengan lubang yang saya duga adalah harga yang sama di vila ini. Yang di villa-cat akan membuat perbedaan besar.",4
105, The Seiryu Villas,"Kami memiliki hanya kembali dari yang Seriyu. Ini adalah kami menginap di 2nd (rm B2) dan menyukainya. Dari membantu staf pernah tersenyum dan bermanfaat, sarapan yang indah hanya untuk kami villa, villa besar dengan ke kolam renang ukuran yang bagus. Kamar itu besar, dengan mandi, tv dengan banyak inggris stasiun, untuk banyak kekuatan poin - bahkan, satu di luar di samping gedung. Ini adalah salah satu yang terbaik yang kita telah tinggal di. Itu sangat santai. Akan kembali lagi.",5
106, The Seiryu Villas,"Fasilitas hotel umumnya baik. Kamar nyaman dengan penerangan yang baik dan tata letak. Perabotan adalah praktis dan zen. Lokasi adalah baik serta cenderung relatif dekat ke pantai.  Beberapa perbaikan yang diperlukan antara lain: 1. kualitas layanan kamar makanan yang baik terutama makan malam (sarapan juga) 2. beberapa pemugaran dan mungkin karena renovasi di dekat seperti yang dapat dilihat dari cat dan sentuhan usang lantai menggaruki.  3. Kebersihan dapat ditingkatkan dalam membersihkan di sekitar area kolam renang besar, dll.  4. Tempat tidur adalah kasur terlalu lunak untuk selera pribadi 5. Staf perlu meningkatkan pengetahuan mereka tentang di tempat dan/atau menyediakan peta untuk memudahkan berjalan.",4
107, The Seiryu Villas,"Kami menyukai layanan dan villa. Kita cintai bahwa renang pribadi direkatin dan di pakai 24hrs. Layanan kami yang penuh perhatian dan tahu nama kami.   Menu sarapan bisa diperbaiki. Omelet itu putih kering. Akan menyenangkan untuk memiliki buah segar, jus, bukannya berkonsen.   Secara keseluruhan, kami menyukai ruang duduk besar, besar kamar tidur, lemari es dan toilet bergaya lengkap.  Pasti akan mempertimbangkan datang ke sini lagi jika tidak membawa apapun untuk anak-anak.",5
108, The Seiryu Villas,"aku saty di seiryu villa untuk 5 malam di mei 2015 royal Villab B2 adalah waktu terbaik aku menghabiskan di bali, terima kasih untuk semua barang-barang di seiryu  Luas kawasan villa Merekomendasikan untuk mencoba makan malam romantis di villa dengan koordinasi sama kru kapal (makan malam hidangan laut) itu adalah ulang tahun pernikahan kami 3 ingin, disertai oleh putra kami 3 tua mencabiknya dan pengalaman adalah sangat indah  Jangan ragu-ragu untuk memilih mereka",5
109, The Seiryu Villas,"Tinggal di sini selama 4 malam. Vila ini cukup luas dan kami tinggal di royal pool villa. Kolam renang terlalu kecil, tapi masih ok. Dapur adalah baik-baik saja tapi aku berharap mereka memiliki lebih banyak peralatan, tetapi memadan ke vila lainnya tetapi mereka dianggap sebagai thay 7-8 di skala 10. Kamar mandi memiliki bau buruk di kamar mandi (orang jangan buang air kecil di kamar mandi! ), tetapi setelah kita mengeluh mereka pergi untuk memperbaikinya. Sarapan adalah baik-baik saja, tapi aku berharap mereka bisa lebih fleksibel di atas apa yang kita dapat mengatakan karena kita dengan anak-anak kita dan memiliki lebih banyak pilihan ini selalu lebih baik. Lokasi baik seperti anda dapat dengan mudah mendapatkan makanan yang baik dan toko-toko berada di dekatnya. Saat ini di…",4
110, The Seiryu Villas,"Tempat tidur yang paling nyaman di dunia di kamar dengan tata letak yang luar biasa termasuk kolam di luar pintu kamar mandi! Staf sangat membantu, berpengetahuan dan ramah. Tidak ingin meninggalkan setelah 3 hari besar. ",5
111, The Seiryu Villas,Di sebuah jalan yang tenang di seminyak. Anda tidak akan pernah tahu itu dari luar tetapi kamar adalah menakjubkan. Banyak ruang. Indah teras pribadi dan kolam renang. Sempurna untuk romantis yang tenang. Akses mudah untuk keramaian dan hiruk pikuk seminyak jika anda ingin. Sangat sangat sangat merekomendasikan ,5
112, The Seiryu Villas,"The seiryu villa's menawarkan beberapa tempat yang sempurna untuk bersantai setelah sibuk di hidup anda. Kamar menawarkan jumlah yang tepat dari ruang dengan dapur kecil, ruang makan yang indah, area lounge yang luas, dan sebuah ranjang anda harus roll lebih dari 4 kali untuk benar-benar menyentuh pasangan anda :)   Fasilitas yang bersih dan luas dengan mandi besar, mandi spa dan kolam renang luar ruangan dengan air yang indah dinding!  Ada 2 area untuk bersantai di luar ruangan dan pohon frangipani indah di sudut.   Manajemen dan staf yang ramah, profesional dan sangat senang untuk membantu dengan apa-apa!   Makanan diantarkan ke villa dan semua stafnya sopan dan menyenangkan, tempat makanan, membersihkan piring dan tidak membiarkan anda lift yang jari!   Saya merekomendasikan…",4
113, The Seiryu Villas,"Segera setelah kami tiba di sana, kami disambut hangat oleh semua staf di kapal. Mereka mengambil waktu untuk menunjukkan kami berkeliling villa dan bagaimana untuk menggunakan segala sesuatu di sana. Villa ini benar-benar menakjubkan, sangat baik dirancang, itu hanya memiliki semua yang anda butuhkan. Staf sangat ramah dan sangat profesional dalam cara mereka menjaga villas dan usaha yang mereka pergi melalui, untuk memastikan tamu selalu senang dan puas. Hanya satu kritik kecil adalah bahwa sarapan adalah portioned kecil, jika anda tidak makan banyak, tempat ini cocok untuk anda. Tapi selain dari itu, ada benar-benar tidak ada yang lain yang akan menyebabkan dis comfort. Saya sangat senang tinggal di sini.",5
114, The Seiryu Villas,"Kami dipindahkan ke vila ini karena pemesanan kami memang penuh. Villa adalah indah dan luas. Mini (atau mimi) yang bekerja di sana adalah tuan rumah yang menakjubkan dan pelayan, dan melakukan segalanya dalam kekuatan untuk memastikan bahwa kami memiliki pengalaman menginap yang menyenangkan.   Satu-satunya kritik yang saya miliki, adalah bahwa kamar mandi dan kolam renang bisa telah sedikit lebih bersih.",5
115, The Seiryu Villas,"Saat saya tiba di lobi kecil, merasa seperti di rumah sendiri. Ketika saya mendapatkan ke villa B4, wow sangat besar ruang dan ruang keluarga dengan dapur terbuka hanya luar biasa. Kolam renang adalah terhubung ke kamar mandi. Bayangkan renang dan kemudian mandi... wow jadi nyaman. Tempat sempurna untuk menghabiskan liburan di bali. Seri adalah dalam jarak berjalan kaki ke restoran dan pijat dan spa. Sarapan disajikan setiap pagi dalam gaya. Jangan ragu-ragu... anda akan mendapatkan villa lain di bali dan yakin aku akan kembali beberapa hari.",5
116, The Seiryu Villas,"Villa ini dirancang dengan indah, di lokasi yang nyaman untuk pantai, belanja, dan restoran. Tinggal di sini selama satu minggu selama tahun baru bulan madu - yang gila waktu di seminyak. Villa kami memungkinkan kita untuk melarikan diri dari kegilaan di luar dan bersantai dalam kemewahan dan gaya. Saya mencintai renang pribadi khususnya, menghabiskan banyak waktu di hotel ini! Vila-vila sangat pribadi dan terpencil, anda dapat dengan mudah lupa bahwa ada orang lain di dekat oleh! Staf sangat ramah dan membantu - mereka tidak bisa melakukan cukup bagi anda. Makanannya enak - sarapan yang baik disajikan untuk anda setiap pagi di villa anda - dan kami akhirnya makan malam melalui layanan kamar 3 malam karena makanan sangat baik. Cobalah barbekyu di bali, villa anda - seafood…",5
117, The Seiryu Villas,"Kami memiliki hanya menghabiskan 3 menakjubkan minggu di seiryu villas, (kami yang terlambat bulan madu). Ini adalah kami 5 th waktu ke bali dan pertama kalinya di the seiryu... Vila-vila yang menakjubkan, serius bagian kecil dari bali surga untuk melarikan diri dari kegilaan surrouding jalanan yang indah ini. Liburan kami dibuat sangat khusus oleh semua staf indah di sini di vila, tidak ada masalah, semuanya disampaikan di benar bergaya bali. Kami akan melewatkan ini biasa indah orang-orang sangat banyak. Terima kasih semua, tidak sabar untuk melihat anda lain kali.",5
118, The Seiryu Villas,"Jika anda seperti saya, anda kewalahan sekarang dengan pilihan penginapan di bali dan bahkan yang destinasi yang tepat bagi anda. Ada aneh jumlah hotel, dan anda tidak ingin memilih salah satu! Hotel atau villa, kolam renang pribadi atau menghemat uang? Kami memutuskan untuk pergi semua keluar dengan kami tinggal di seminyak dan kemudian memiliki pengalaman yang sedikit berbeda di ubud yang ternyata menjadi sempurna. Ini adalah pertama kami pernah pengalaman vila. Setelah sedikit oasis pribadi di seminyak sangat bagus untuk mendapatkan jauh dari kerumitan di pantai. Apalagi, anda sendiri kolam renang pribadi karena kami tidak bahkan pergi di malah sangat besar dan sedikit kotor air laut. Staf ramah dan membantu dan vilanya fantastis. Ada begitu banyak ruang untuk hanya dua dari…",5
119, The Seiryu Villas,"Kami pergi sebagai pasangan untuk natal selama seminggu. Kami menginap di royal villa B2 dan itu benar-benar indah.  Staf yang sangat baik dari menit bahwa kami mendapat dijemput di bandara. Sarapan harian sangat bagus dan anda dapat menyesuaikan ini setiap hari. Staf pergi di atas dan beyond terus dan selalu sangat ramah dan membantu. Setiap hari villa dibersihkan atas ke bawah.  Lokasinya bagus, dekat dengan bar dan restoran dan juga dekat dengan pantai. Ini adalah naik taksi sangat pendek (atau antar jemput) ke strip utama di seminyak, tetapi adalah di lokasi yang tenang. Setiap kali kami memasuki villa, kami merasa sangat santai - itu seperti sanctuary kami sendiri!  Pasti akan merekomendasikan dan kembali lagi! Itu benar-benar adalah liburan yang sempurna untuk pasangan.…",4
120, The Seiryu Villas,"Benar keramahan jepang... tempat yang sempurna untuk pasangan yang mencari pengalaman villa pribadi.   Seiryu speakes sejati keramahan jepang. itu sempurna terletak, 7 menit berjalan kaki dari pantai dan aplty positioined ciyt untuk menghindari kebisingan. Vila grand dan baik equppied. Jacuzzi, kolam renang pribadi, sarapan di dalam kamar, bar pribadi... hotel ini memiliki segala sesuatu yang pasangan bisa melihat keluar untuk berlibur. Staf layanan adalah prompt dan sopan. Kami menginap di royal pool villa B2 untuk dua malam dan benar-benar menikmati kami tinggal. Itu adalah perjalanan pertama kali ke bali dan seiryu adalah pilihan yang sempurna untuk kunjungan kami di Seminiyak",5
121, The Seiryu Villas,Staf layanan sangat baik. sangat profesional dan membantu. Ini adalah perjalanan pertama saya ke bali dan pengalaman ini tidak akan terlupakan. Benar-benar tempat liburan yang sempurna untuk pasangan atau melegakan dari kehidupan kota yang sibuk!  Kudos kepada tim! Kerja bagus!,5
122, The Seiryu Villas,"Datang ke tempat ini pada mei 2012. Menghabiskan tiga hari di sini dan mempunyai waktu yang menakjubkan. Layanan dan sarapan adalah yang terbaik. Kolam renang adalah yang terbesar yang pernah saya miliki di sebuah hotel. Mencintai privasi dan tidak bisa mendengar apa-apa dari jalan. Pantai adalah tentang sepuluh menit berjalan kaki, dan ada restoran dan toko-toko yang bagus di mana-mana di sekitar properti ini. Menyukai pengalaman dan akan buku lagi jika saya pernah cukup beruntung untuk datang ke bali lagi.",5
123, The Seiryu Villas,"sangat mengesankan menghabiskan 5 hari di villa! Pertama kalinya kami di bali dan kami pertama berhenti terlalu.  Stafnya mudah pergi dan selalu penuh senyum - sentuhan personal dan perhatian membuat kami merasa selamat datang dan di rumah. Layanan besar untuk semua!  sangat terkesan oleh villa bergaya zen dekorasi dan desain - kami mendapat untuk bersantai dan melepas lelah di ruang kehidupan yang berlimpah dan minimalis.  Dapur sangat baik dilengkapi dan dispenser air minum memang kejutan yang menyenangkan. Tempat tidur adalah luas (super-king) dan nyaman. Hair dryer yang lebih kuat daripada yang ditemukan di hotel khas.  Banyak film judul untuk menghibur diri kita sendiri dengan anda di sofa. The 1, 2 meter kolam renang adalah hanya tepat untuk berenang dan keren diri di…",5
124, The Seiryu Villas,"Memesan melalui hotel, the correspondance itu bagus dan cepat. Mengambil sebuah paket sehingga membuat pengaturan bagi mereka untuk menjemput kami karena sanur bukannya bandara.   Vila ini sangat bagus, dengan tempat tidur yang baik dan kolam bagus untuk berenang di. Ruang keluarga adalah attaction utama bagi saya dan mereka memiliki film fasilitas yang kami benar-benar menikmati.  Para staf yang sangat membantu, padahal ada cegukan kecil.",4
125, The Seiryu Villas,"Untuk tim seiryu,  Kami adalah tamu yang menginap di seiryu antara 22 september 2014 untuk 26 september 2014. Kami menghargai bahwa tim anda disediakan layanan hangat untuk kami! Kami ingin mengatakan terima kasih untuk semua! Mereka membuat perjalanan kami yang tak terlupakan. Kami akan memilih seiryu lagi pastinya! Ini ada beberapa detail yang membuat kami terkesan.  1. Kami mengatur penjemputan di bandara layanan di 22/9, karena ketakutan penundaan, kami terlambat lebih dari satu jam, namun, hotel anda sopir masih menunggu kami dengan senyum ceria. Ini adalah sangat profesional. Ini adalah awal yang baik untuk perjalanan kami.  2. Ketika kami tiba di seiryu sekitar 20:30, sudah larut malam tapi anda staf meja depan terus memberikan keramahan yang hangat. Dia membantu kami…",5
126, The Seiryu Villas,"Kami tinggal di sini selama 5 malam sebelum kami menikah di bali. Staf yang sangat baik dan pada hari pernikahan kami/hari kami pergi, staf membawa seikat mawar untuk pintu kami dan mereka menurunkan kami di hotel kami berikutnya. Mereka membuat kami tinggal sangat mengesankan.   Vila ini menakjubkan - luas, bersih dan sangat santai. Sarapan juga menakjubkan (terutama sarapan jepang). Layanan yang hebat dan tidak bisa kesalahan hal!   Pasti akan kembali karena itu adalah tempat favorit kami untuk tinggal di bali.",5
127, The Seiryu Villas,"Kami menginap selama 12 malam di bulan oktober. Memiliki waktu yang tepat. Vilanya sangat luas dan kolam renang adalah ukuran besar untuk pasangan. Lokasinya sangat di pusat juga. Staf sangat ramah dan membantu. Mereka sangat membantu kami dengan rekomendasi dan membuat pemesanan untuk makan. Kris, adi, dharma dan beristirahat dari kru yang sangat membantu. Hanya hal adalah menu sarapan adalah agak terbatas jika anda tinggal untuk periode yang diperpanjang. Hotel ini tidak super sehat, dan bisa melakukan dengan sedikit variasi. Properti itu sendiri adalah sedikit tua dan hal-hal kecil seperti handuk dll. harus segar. Wifi tidak sangat bagus karena kelp menjatuhkan keluar.",4
128, The Seiryu Villas,Kami menghabiskan 9 malam di the seiryu villas dan itu sempurna. Staf sangat profesional dan ramah dan selalu pergi keluar dari jalan mereka untuk membantu. Villa adalah besar dan memiliki semua yang anda butuhkan untuk anda menginap. Kolam renang pribadi adalah ukuran yang sempurna untuk pasangan. Ada banyak sun antara 9am dan 4pm di lounge dan kamar mandi luar adalah berguna juga. Tempat tidurnya sangat nyaman! Kami tidur begitu baik kami seluruh holiday! Sarapan adalah besar juga. Banyak pilihan dan dimasak dengan sempurna setiap pagi. Kami menyukai bahwa mereka membawa sarapan melalui pintu belakang dan mengkonfigurasinya di dapur di waktu yang diinginkan. Toast perancis yang menakjubkan! Kami juga menikmati malam lilin dan mengatur makan siang selama kami tinggal dan…,5
129, The Seiryu Villas,"Fasilitas yang sangat baik dengan sangat baik terus dengan lebih banyak ruang daripada yang anda akan pernah butuhkan.  Lokasi yang besar, 5 menit berjalan kaki dari pantai dan anda dapat berjalan atau mengambil mobil ke kudeta atau potato head. Banyak klub, restoran dan toko-toko di berjalan kaki  Staf adalah super ramah dan profesional.   Sarapan disajikan di kamar, yang cukup bagus.  Kami punya masalah kecil yang diselesaikan di memuaskan fashion oleh pengawas di biaya.  Catatan: Sebagai per oktober 2013, ada situs konstruksi di seberang jalan dan itu cukup berisik ketika di patio, terutama di pagi hari, tetapi kamar sangat tenang.",4
130, The Seiryu Villas,"Terakhir saya berhenti di bali adalah seminyak dan saya senang saya memilih villa ini.  Menit saya berjalan di. Saya merasa serenity, kontras dengan hiruk pikuk seminyak.  Jepang gaya adalah sangat menenangkan dan anda tidak melihat terlalu banyak staf berjalan di sekitar, yang saya suka. Dari semua tempat yang saya tinggal, staf adalah benar-benar ramah di sini.   Villa adalah menakjubkan. Renang ukuran yang bagus, sangat pribadi dan luas. Ada dapur lengkap yang saya pikir kebanyakan orang mungkin mungkin tidak menggunakan.  The lay out dari villa adalah dipikirkan dengan baik. Itu bagus untuk hanya duduk di taman, berenang dan hanya bersantai di kursi atau gazebo.  Staf adalah benar-benar bijaksana. Sarapan dibawa melalui pintu kembali di dapur.   Kontra Mungkin itu hanya…",4
131, The Seiryu Villas,"Kami memiliki ruang pertama dari penerimaan. Vila itu sendiri sangat besar. Empat dari kami bepergian bersama-sama dan memiliki empat tempat tidur dan masih memiliki banyak ruang untuk manuver. Ada dapur yang kita tidak menggunakan. Sarapan adalah begitu begitu. sedikit membosankan dalam hal pilihan dan di mana ini disajikan (di meja makan bukan kolam). kami pergi setengah dari waktu untuk mendapatkan sesuatu yang lebih baik.  Kolam renang adalah ukuran yang baik, kami menikmati itu sangat banyak! Hotel ini dapat diakses dari kamar mandi yang dirancang cerdik. Kamar mandi nya terlalu gelap meskipun. Tempat ini tidak memberikan kesan yang bersih; handuk terlihat abu-abu, dan tempat ini agak tua.   Kami menginap selama empat malam dan tampaknya bahwa hanya kami tamu sampai kami…",3
132, The Seiryu Villas,"Vila yang luas, tempat tidur yang sempurna dan fasilitas besar dengan banyak tambahan ekstra. Privasi dengan taman anda sendiri dan kolam renang di tengah-tengah seminyak dan kurang dari 500meters dari pantai paling sempurna. Perlu saya berkata lebih? stafnya luar biasa dan mereka akan melihat untuk setiap kebutuhan anda.  Kami pasti akan kembali... dan segera.",5
133, The Seiryu Villas,"Apa yang dapat saya katakan tentang villa ini? Sangat fantastis!... Villa adalah sangat pribadi, fasilitas yang sangat bersih, dekat ke pantai, layanan yang baik, makanan yang baik, dan tempat tidur adalah begitu nyaman. Saya akan sangat merekomendasikan vila ini!... :) ",5
134, The Seiryu Villas,"Kami menginap untuk 4 malam dan hanya sebelum kami meninggalkan singapura. Istri saya patah kaki. Ketika kami tiba, petugas di Seiyru teratur tongkat, pindah kami ke lebih dekat villa, dan memastikan kami selalu memiliki sopir.  Mereka membuat upaya khusus, yang dihargai, diberikan istri saya kesulitan.  Villa adalah standar tinggi yang anda harapkan. Sarapan adalah berbeda, di bahwa jepang adalah sebuah pilihan, yang adalah perubahan yang menyenangkan dari amerika atau kontinental.  Kami makan dalam satu malam dan makanan adalah cukup padat juga.",4
135, The Seiryu Villas,"Kami menghabiskan 3 malam di villa kolam renang dan kami benar-benar menikmati diri kita sendiri. Tempat tidurnya menakjubkan, area kolam itu bagus dan batu selesai dengan lantai kayu berwarna gelap yang estetis. Sayangnya, makanan pilihan benar-benar cukup buruk dan sarapan adalah di bawah standar. Benar-benar tidak konsisten dengan seluruh pengalaman seiryu. Keseluruhan meskipun, itu adalah di atas rata-rata tinggal, yang ditetapkan oleh kualitas tinggi perhatian dari staf.",4
136, The Seiryu Villas,"Menakjubkan dan sempurna villas tapi makanan mengecewakan, sarapan disajikan setiap hari tapi tidak bintang 5 standar akomodasi itu sendiri. Juga menemukan vila ini tidak dalam jarak berjalan kaki ke pusat strip (potato head, ku de ta, dll) karena kami awalnya berpikir. Jika ada lebih baik restoran dalam jarak berjalan kaki, kami tidak keberatan tapi ini tampaknya tidak menjadi masalah. Namun wifi gratis dan layanan sangat bagus!",3
