,hotel,review,stars
137, The Seiryu Villas,"Villa yang besar, staf yang ramah, baik berjalan kaki ke pantai (5 menit), itu adalah, yang pendek namun, sangat murah taksi ke restoran dan kafe. Kolam renang pribadi adalah bonus nyata. sangat tenang dan damai tinggal.",4
138, The Seiryu Villas,"Kami menyukai keluar 6 malam di the seiryu. Bepergian pada bulan juli adalah waktu yang sibuk tahun dan vila pribadi kami merasa seperti pelarian yang tentram dari keramaian dan hiruk pikuk. Vila ini terletak di lokasi yang strategis - dekat ke pantai, dan kami merasa sangat aman dan aman. Kamar yang menakjubkan dengan vila kolam renang pribadi dan fasilitas kamar melebihi harapan. Dekorasi sangat modern namun merasa sangat bali dan kamar yang sangat bersih, ringan dan terawat dengan baik. Staf sangat ramah dan meskipun beberapa berjuang sedikit dengan bahasa inggris selalu ada orang lain untuk bertanya. Satu-satunya perubahan yang saya akan merekomendasikan lebih kepandaian yg beraneka ragam dengan pilihan sarapan. Secara keseluruhan pengalaman yang indah dan akan sangat…",5
139, The Seiryu Villas,"Kami memiliki seminggu yang luar biasa di the seiryu villas. Cuaca tidak bahwa besar tetapi itu tidak meredam liburan kami. Kami tinggal di B4 - yang saya pikir adalah sedikit lebih kecil dari vila dengan kolam renang tapi masih benar-benar luas. Sangat menyenangkan untuk terbangun setiap pagi untuk sarapan diantarkan ke dapur anda sendiri. Matahari bersinar dari 9, 30 - 4.30. Terletak sekitar sepuluh menit berjalan kaki dari toko-toko. Taksi cukup murah untuk mendapatkan sekitar kota. Staf yang fantastis - sangat membantu dan selalu tersenyum. Pasti akan kembali! ",5
140, The Seiryu Villas,"The villas di properti ini benar-benar menakjubkan! Villa kami adalah di atas yang luar biasa di setiap cara. Itu besar, bersih, nyaman - memiliki semua yang kami bisa mendapatkan di rumah dan bahkan lebih. Semua fasilitas yang bekerja dengan fantastis - terutama menyukai bagaimana dingin kolam villa adalah dengan ac - great escape dari kelembaban. Tempat tidur adalah jadi nyaman - kami tidak pernah memiliki malam yang buruk tidur di delapan malam di sana! Tempatnya tenang dan istirahat yang sangat damai, jauh dari kegilaan di daerah seminyak. Tata letak vila dengan kolam renang tepat di luar kamar mandi anda (secara harfiah anda melangkah di dalam air di luar pintu anda) sangatlah menyenangkan. Anda bisa mandi di bak pusaran air besar dan kemudian melompat di kolam renang air…",5
141, The Seiryu Villas,Kami memiliki hanya menghabiskan 10 hari di the seiryu dan menyukainya. Staf hotel yang sangat membantu dan menampung dan mereka membuat perjalanan kami apa itu! Kami akan benar-benar tinggal di sini lagi ketika kami kembali ke bali!,5
142, The Seiryu Villas,Suami saya dan saya hanya menghabiskan 10 hari di ini indah dan santai villa. Kami sangat senang telah memesan liburan kami di sini. Villa sangat nyaman dan kami menyukai memiliki sebuah ruang yang indah untuk menikmati tinggal kami. Staf sangat luar biasa dan kami benar-benar menyukai lokasi. Kami sudah ke bali banyak kali dan akan menginap di the seiryu lagi.,4
143, The Seiryu Villas,"Kami telah menghabiskan sepuluh malam di the seiryu villas yang luar biasa   Semua saya dapat katakan adalah menakjubkan villa, kolam renang pribadi yang indah dan staf yang paling indah   Saya akan dengan senang menginap di sini lagi, lokasi yang besar juga   Kami menginap di royal villa, dan itu sangat luas dan persis apa yang kita cari, damai!  ",5
144, The Seiryu Villas,"Menginap di the seiryu villas di maret 2014, adalah fantastis istirahat pergi ketika anda memasukkan villa anda seperti anda berada di dunia anda sendiri. Layanannya fantastis. Sempurna untuk bulan madu, cukup jauh, atau untuk memiliki liburan yang romantis. Anda tidak melihat atau mendengar siapa pun, kamar-kamarnya indah dan bersih. Villa adalah fantastis. Saya tidak bisa kesalahan staf di semua. Saya akan sangat merekomendasikan tinggal di villa ini, tempat ini adalah berjalan kaki singkat ke pantai, sarapan dan makanan fantastis. Kami akan pergi lagi. Seperti komentar lain mengatakan itu adalah seperti surga di bumi di bali.",5
145, The Seiryu Villas,"Kami sangat terkesan dengan akomodasi kami, itu sangat luas dan sangat bersih dan tenang dengan staf yang sangat ramah. Dekat dengan pantai dan toko-toko/restoran. Sangat menyarankan untuk berbulan madu sebagai vila-vila sangat tenang dan pribadi.",5
146, The Seiryu Villas,"Staf di sini indah dan membantu dan bersemangat untuk menyenangkan. Mereka adalah sangat membantu dan ramah. Villa hanyalah indah dan tampak seperti yang mereka lakukan di situs. Wifi bekerja baik meskipun ada beberapa putus sekolah. Makanan (layanan kamar dan sarapan) yang mengejutkan baik. Saya biasanya tidak berharap terlalu banyak dari layanan kamar atau sarapan termasuk, tapi itu benar-benar sangat lezat. Memiliki Anda sendiri kolam renang dan hari tempat tidur dan dek adalah plus mutlak. Meskipun vila-vila yang berdampingan, Anda tidak akan tahu ada orang yang tepat sebelah. Saya hampir tidak bertemu dengan orang lain tinggal di sana. Ada juga beach club di Seminyak pantai yang hanya indah. Vila terletak di lokasi yang baik di mana Anda dapat dengan mudah berjalan untuk…",5
147, The Seiryu Villas,Villa Seiryu 狩 野 bukanlah pilihan kami ketika kami memesan liburan kami selama akhir pekan panjang istirahat di Singapura namun karena pemesanan penuh kita upgrade ke Seiryu 狩 野 Deluxe kolam renang villa. Meskipun awalnya didasarkan pada review sebagian besar 4-peringkat kami tidak sedikit skeptis tetapi jelas tidak kecewa setelah kami tinggal di sana. Staf yang ramah dan kami butler penuh perhatian tapi cukup bijaksana untuk memberikan privasi kami. Meskipun kami tinggal di salah satu villa lebih kecil tapi itu masih tampak luas dengan langit-langit yang tinggi. Sarapan sangat baik seperti itu dimasak di dapur kami villa dan kita diperbolehkan untuk memiliki porsi tambahan jika kita ingin. Meskipun properti tidak memiliki setiap restoran tetapi ada banyak F & B outlet di luar -…,5
148, The Seiryu Villas,"Kami tinggal di Seiryu 狩 野 telah membuat Bali semua lebih terlupakan pengalaman.  Hotel terletak di pusat,, kamar bersih dan suasana fantastis.ketenangan dalam meskipun villa yang cukup dekat dengan panas-spot kuta dan seminyak adalah besar.  Menu makanan bisa melakukan dengan beberapa pilihan, pilihan bersantap di villa cukup bernilai uang biaya.",4
149, The Seiryu Villas,"Villa sangat baik dan nyaman. Villa dilengkapi dengan dapur, ruang tamu, tempat tidur ukuran Raja nyaman, kolam renang dan JACUZZI untuk bersantai. Pengaturan tempat membuat Anda tidak ingin meninggalkan villa. Jadi, pastikan Anda tidak memiliki jadwal berat sementara tinggal di sana. Mereka memiliki 2 TV LCD, 1 di ruang tamu dan 1 depan dari tempat tidur. WiFi disediakan di Villa. Butler adalah sangat prompt pada layanan mereka atas permintaan. Secara keseluruhan tempat ini ideal untuk pasangan yang ingin memiliki liburan romantis.  Ada beberapa daerah yang dapat diperbaiki. Seperti kebersihan matahari tidur daerah tapi karena ini luar mungkin tidak di bawah kendali mereka. Villa yang memiliki segala sesuatu yang lain, rasa makanan yang perlu ditingkatkan.   Secara keseluruhan…",4
150, The Seiryu Villas,"Saya dan suami saya tinggal di Villa Seiryu 狩 野 (catatan untuk Seiryu 狩 野 pemilik: mengubah nama, tidak ada yang bisa mengucapkannya) sementara di Seminyak, Bali. Villa ini memiliki cheesy, mencolok terinspirasi Jepang tema untuk mereka yang jelek palsu anggrek di mana-mana dan lukisan dari bunga. Itu indah perubahan dari adegan hotel, seperti vila-vila pribadi dengan sebuah kolam kecil (tidak sangat fungsional meskipun), dan dapur dan kamar mandi sendiri dengan daerah besar utama kamar/ruang. Aku menikmati ini atas setiap hotel di Bali, hanya karena itu adalah jauh lebih nyaman untuk dapat merasa seperti Anda berada di rumah Anda sendiri sedikit. Anda merasa damai dan tenang. Internet adalah besar yang penting bagi kami, dan lokasi yang layak meskipun tidak besar. Dapur bagus,…",4
151, The Seiryu Villas,"Setelah tinggal di tiga hotel yang berbeda selama kami tinggal di Bali, Seiryu 狩 野 adalah memperlakukan. Vila-vila luar biasa, seperti foto jika tidak lebih baik. Sementara vila-vila yang sangat pribadi dan Anda bisa easilly diampuni untuk menghabiskan liburan Anda seluruh, pantai yang ada di ujung jalan bersama dengan beberapa tempat yang murah dan sangat baik untuk makan dan mendapatkan pijat. Sarapan disajikan ke villa pada waktu apa pun yang Anda mencalonkan, dengan staf yang meninggalkan Anda di seluruh privasi. Bahkan ada sebuah dapur jika Anda cenderung untuk memasak untuk diri sendiri. Sangat mewah, kami merasa sangat bahagia dengan tinggal kami.",5
152, The Seiryu Villas,"Saya membaca ulasan seperti besar vila ini dan berharap untuk kami tinggal di sini selama Natal. Aku masih agak kecewa. Villa itu sendiri adalah besar, tetapi tidak bersih. Bantal telah cerdik noda pada mereka. Sunbed bantal yang kotor. Lagi aku berharap hal-hal besar dari sarapan, setelah membaca bahwa ini adalah puncak dari Villa. Dan lagi, aku kecewa. Aku mencoba sarapan setiap satu mereka harus menawarkan, dan tidak ada yang baik. Biasa-biasa saja. Layanan ini cukup baik - ini adalah Bali setelah semua. Lokasi besar - 8 menit berjalan kaki ke pantai. A short naik ke kota. Tapi benar-benar, sangat mahal untuk apa adalah - villa biasa, dengan biasa-biasa saja makanan dan layanan biasa.",3
153, The Seiryu Villas,"Villa bersih dan rapi, dengan tingkat maksimum memastikan privasi.  Ini adalah tempat yang sempurna untuk liburan bulan madu dan pasangan. Kami mencintai renang dengan ruang yang cukup untuk berenang dan sunbed yang sempurna untuk beristirahat setelah berenang melelahkan atau untuk memandang bintang di malam hari. Kerudung juga dipasang untuk mencegah gigitan serangga.   Aula dilengkapi dengan besar TV dan DVD player. Kami berhasil membeli beberapa DVD yang murah dan menghabiskan waktu menonton film. Bagi mereka yang suka memasak, dapur memiliki set lengkap peralatan dan cultery. Yang Anda butuhkan adalah untuk melakukan beberapa belanja untuk membuat makanan Anda sendiri.   Setiap bagian dari villa membangkitkan aura Zen dan telah merticulously dirancang dengan memperhatikan…",4
154, The Seiryu Villas,"Kami telah tinggal di sini selama 2 malam dan hanya akan meninggalkan Villa Seiryu 狩 野. Kami telah tinggal di banyak Villa di Bali dan Villa Seiryu 狩 野 besar. Kami tinggal di ruangan A3, yang adalah indah. Villa itu sendiri sangat besar. Kami memiliki 2 TV dan 2 dvd player. dan indah rendah meletakkan sofa. Daybed di luar adalah devine, dan langkah-langkah ke dalam kolam. Kami punya matahari untuk sebagian besar hari di kolam renang dan sunbaking daerah, yang besar. mereka menyediakan payung untuk jenis non sunbaking. Harga villa ini cukup murah dibandingkan dengan vila lain di daerah. (kita dibayar tentang AUS $250 pada wotif.com). Lokasi baik-baik saja. tidak mengagumkan tapi benar-benar baik-baik saja. Yang terletak di ujung sedikit jalan jalan utama. 10 Menit berjalan...…",5
155, The Seiryu Villas,"Saya baru-baru ini memiliki 3 malam di villa indah ini...... villa yang sangat berkualitas dan menyediakan a great escape.  Ruang luar biasa diangkat dengan semua fasilitas satu wouuld kebutuhan.... ruang dibersihkan dan dilayani lebih dari sekali setiap hari.... sarapan disajikan di ruang adalah di atas standar.  Hal terbaik tentang hotel adalah tanpa diragukan lagi layanan staf, mini dan kadek terutama besar. Mereka membuat Anda tetap bahkan lebih menyenangkan. Manajer dan Kadek pergi keluar dari jalan mereka ketika saya pertama kali tiba untuk melacak kartu kredit saya yang saya telah meninggalkan di atm. Mereka menemukan itu bagi saya juga!  Aku menegosiasikan langsung dengan villa untuk tingkat terbaik yang saya akan sangat menyarankan siapa saja yang menggunakan ini Villa…",5
156, The Seiryu Villas,"Tidak percaya ulasan lain – tempat ini sudah menurun buruk. Layanan mengerikan. Tikus dan besar bug di mana-mana. Kebijakan penagihan yang mengerikan. Makanan yang mengerikan. Bising, bau lingkungan. Saya tidak ada yang baik untuk mengatakan tentang tempat ini.",1
157, The Seiryu Villas,"Bahkan sebelum kami meninggalkan Bali, kita sudah tahu kita ingin menginap di The Seiryu 狩 野 lagi selama perjalanan kami berikutnya!   Dari hotel menakjubkan desain layanan tingkat 1, The Seiryu 狩 野 adalah apa yang Anda sebut serba nyata. Kita cintai soooo banyak hal tentang hotel tapi kami terutama diambil oleh panjang, gelap koridor yang akan membawa Anda dari kawasan penerimaan vila. Apa konsep desain yang hebat!  Desain cerdik pikir-out hotel tentu saja diperluas Vila itu sendiri. Villa adalah mewah, luas... belum fungsional. Tempat tidur nyaman dan fasilitas dapur mencengangkan - lengkap dengan pembuat kopi, pemanggang roti, blender, peralatan, dll! Kamar mandi dilengkapi dengan baik berukuran jacuzzi bak mandi dan bahkan memiliki sebuah pintu yang mengarah langsung ke…",5
158, The Seiryu Villas,"Itu adalah tempat yang indah. Kami menyukai segala sesuatu tentang desain dari saat kita melangkah di pintu masuk. Ada banyak desain bertema Jepang yang benar-benar menyegarkan dan indah. Kami tinggal di Villa A, dan interior adalah seperti gambar. Itu adalah luas, bersih dan memiliki desain modern. Ada dua TV! Salah satu di ruang tamu dan salah di depan tempat tidur yang hanya beberapa langkah lagi.   Kami mencintai sarapan. Dan itu disajikan kepada kami di dapur. Kami juga memerintahkan Layanan kamar dan makanan lezat dan nilai untuk uang. Layanan yang baik. Staf yang ramah dan membantu, dan mereka memastikan mereka memberi kami privasi yang kami inginkan.   Kota ini terletak di jalan kecil. Awalnya itu agak mengkhawatirkan, tapi setelah familiaring diri kita sendiri dengan…",4
159, The Seiryu Villas,"Kami selalu melakukan perjalanan ke Bali setidaknya sekali setahun. Tidak pernah menemukan sebuah villa sebagai unik sebagai Seiryu 狩 野. Tinggal di Seiryu 狩 野 untuk 2 malam dan itu besar. Kami memiliki sebuah villa dengan Jepang ""musim gugur tema"" (Seiryu 狩 野 memiliki 4 jenis Villa yaitu musim semi, musim panas, musim gugur dan musim dingin). Para staf yang sangat ramah dan membantu. Kami tiba di Seiryu 狩 野 pada 1 am di pagi hari (kami memiliki penerbangan terakhir dari Jakarta). Namun, para staf masih membantu kami untuk check-in dan menyampaikan barang-barang kami ke villa dengan senyum di wajah mereka (melihat cukup mengantuk meskipun). Kami memiliki foto menembak pada 5 am di pagi hari (4 jam setelah kami check in) dan bertanya apakah itu akan mungkin untuk melayani sarapan…",5
160, The Seiryu Villas,"Dengan banyak review bagus tentang hotel ini, saya telah memutuskan untuk membuat reservasi dengan mereka untuk berbulan madu pada Oktober 2009. Yah, yang muncul masalah, saya telah mengirim email 2 kepada mereka. Pertama, meminta bout lebih banyak informasi, transaksi dan pembayaran. Tidak ada balasan setelah seminggu. Meskipun aku tidak mendapatkan jawaban, aku masih percaya bahwa liburan mendatang saya akan menjadi satu buruk karena banyak menyenangkan Review di sini. Jadi aku mengirimkan email saya kedua, menyatakan pemesanan dan lebih banyak pertanyaan mengenai pembayaran bijaksana. Setelah 3 minggu, masih tidak ada jawaban.   Aku sedang sangat kecewa. Saya menggunakan sistem reservasi di email mereka website dan reservasi. Sama seperti aku akan senang untuk mencoba hotel…",1
161, The Seiryu Villas,"Setelah memiliki meneliti sedikit adil di net, saya memutuskan untuk tinggal di Seiryu 狩 野 untuk berbulan madu untuk 4 malam. Segera setelah kami melangkah keluar dari bandara dan bertemu dengan sopir kami, aku tahu itu ada dan kemudian bahwa Seiryu 狩 野 adalah pilihan yang cocok. Kami disambut dengan handuk dingin dan air dan didorong langsung ke Vila, yang tersimpan di sudut yang tenang di Seminyak. Lokasi sangat sesuai; 5 menit berjalan kaki dari peregangan Seminyak sibuk dan 3 menit ke pantai. Villa (B2) adalah spotlessly bersih dan suasana Jepang adalah menyenangkan. Sentuhan-sentuhan kecil adalah apa yang membuat tinggal kenangan. Seperti minyak wangi terbakar di mana-mana, musik lembut di koridor, hiasan bulan madu di vila, jus segar pada saat kedatangan, semua orang yang…",5
162, The Seiryu Villas,Kami tinggal di vila-vila selama 8 malam fab pada akhir April-Mei. Kami sedang mencari villa pribadi untuk bersantai di tetapi juga ingin menjadi mampu berjalan sekitar Seiryu 狩 Bali daerah-野 pasti bertemu semua ini. Dari menit kami dijemput dari bandara ke waktu kami meninggalkan semua kebutuhan kita bertemu. Staf yang besar dan pengalaman kami ini berkesan. Seiryu 狩 野 adalah santai tempat untuk menginap - segala sesuatu yang tersedia di villa dan belanja & restoran adalah semua dalam berjalan jarak. Villa & kolam renang yang tanpa cela dipelihara & 10 keluar 10 untuk kebersihan. Terima kasih Seiryu 狩 野 - kita akan kembali.,5
163, The Seiryu Villas,"Tempat ini sangat mengagumkan, aku tinggal di hotel bintang 5 di seluruh dunia dan ini adalah di bagian atas daftar. Villa kami adalah indah, kita tidak bisa percaya bagaimana sempurna segala sesuatu dengan sangat perhatian terhadap detail. Di vila kolam itu begitu indah untuk pulang ke rumah untuk dan kamar mandi menakjubkan dengan besar jacuzzi bak mandi. Kita lakukan mendapatkan tingkat menit terakhir khusus oleh bekerjasama dengan manajer, yang termasuk pajak, sarapan dan bandara transfer. (150 US$). Staf benar-benar indah dan tidak cukup untuk membantu Anda. Dari segi lokasi, it's about 5 menit berjalan kaki ke pantai di mana Anda dapat menyewa loungers matahari dan payung untuk sekitar 3 US $ per hari. Belanja baik di Seminyak dan it's about lain 5 menit berjalan kaki…",5
164, The Seiryu Villas,"Dari memeriksa Villa Anda berangkat dan mengucapkan selamat tinggal, kami tinggal di sini adalah paket lengkap. Kami telah pernah tinggal di Villa sebelum tapi selalu berhasil tinggal di minimal 4 bintang akomodasi di seluruh dunia. Harga kami membayar adalah besar menilai melihat seperti rendah musim di Bali pada saat ini, tingkat juga termasuk koktail dan penyegaran handuk pada kedatangan, airport transfer dan sarapan gratis harian yang sudah diatur untuk Anda setiap pagi oleh butler. Vila itu indah! Kami telah mencari banyak Villa Bali dan terutama kawasan Seminyak tapi satu ini tampak untuk menangkap mata kita seperti it didn't look like setiap Villa di sekitar. Sangat pribadi dan terpencil di lokasi yang besar dekat ke pantai dan sourrounding restoran. Kami benar-benar…",5
165, The Seiryu Villas,"Tinggal di tipe Villa (no. B3): sangat luas! Merasa jelek dengan dekorasi modern yang menawan, pencahayaan yang hangat di kamar tidur dan Jepang desain yang unik mempengaruhi. Besar sofa nyaman dan tempat tidur. LCD TV dan DVD player di ruang tamu dan juga kamar tidur. Dapur yang dilengkapi dengan baik dengan air mineral panas dan-dingin dispenser. Anda dapat melompat ke dalam kolam langsung dari kamar mandi.  Sarapan: Baik menyebar, disiapkan di dapur dan disajikan di villa. Pilihan menu Amerika, Jepang, dan Bali/Indonesia.  Lokasi: Terletak di daerah yang lebih terpencil, tetapi tengah yang cukup sehingga hanya cepat dan murah taksi naik ke tempat-tempat yang paling seperti ""makan-jalan"".  Layanan: Ini adalah pembentukan baru, jadi mungkin ada beberapa masalah gigi dengan…",4
166, The Seiryu Villas,"Kami tinggal di Seiryu 狩 野 dari 15/2/09 untuk 2/3/09 di B2. Kami bertemu di bandara dengan handuk dan air, yang adalah sentuhan yang bagus dan mengatur suasana hati untuk Seiryu 狩 野 experiance. Villa sendiri yang spotlessly bersih, aku sedang sangat terkesan dengan layanan pembersih yang disediakan, villa dibersihkan setiap hari seperti yang diharapkan, tapi itu indah untuk datang pulang dari makan malam untuk menemukan oil burners menyalakan tidur yang ditolak dan kimonas disediakan berubah juga. Posisi vila-vila bukanlah suatu masalah, dalam jarak berjalan kaki dari restoran yang baik seperti gado gado. Experiance kami adalah sempurna pada Seiryu 狩 野 dan tidak ragu-ragu merekomendasikan sebagai yang benar-benar indah dan romantis tempat untuk tinggal.",5
167, The Seiryu Villas,"Kami tinggal di Villa Seiryu 狩 野 The dari 4/03/09 untuk 13/03/09 di vila B3. Akomodasi dan pengalaman di Seiryu 狩 野 adalah menakjubkan. Kami dijemput dari bandara dan menawarkan minuman dingin dan handuk dingin di dalam mobil dan setibanya di vila-vila. Cek di itu cepat dan ramah. Staf ada selalu untuk membantu dengan kantong dll. Villa mewah, bersih dan baru. Itu adalah sanctury Anda sendiri sibuk sibuk Bali. Ada swasta masuk untuk tamu dan satu untuk butler/staf. Kolam renang tak bernoda. Tempat tidur adalah HUGE!!. Semuanya adalah sempurna. Terletak baik-baik saja. Hanya 3 menit berjalan kaki ke pantai-itu adalah hanya sekitar sudut dari Sofitel. Restoran besar di dekatnya seperti Gado Gado, Zanzibar (di Legian), Made's Warung dll dll. Tidak di strip utama Seminyak, tapi itu…",5
