,hotel,review,stars
48, The Seiryu Villas,"Ini adalah 4 saya waktu sampai ke bali, selalu menginap di vila, anda dapat kembali ke hotel normal setelah anda menginap di vila di bali karena privasi dan ruang yang tinggi.  Memesan hotel ini oleh agen perjalanan saya, menginap 5 malam di sini, harga kamar yang kurang dari usd 200 per malam, jika anda ingin mendapatkan harga yang lebih murah, saya pikir anda benar-benar perlu untuk memesan beberapa bulan di muka.  Vila ini terletak di belakang halaman bali, hanya 2~3 menit berjalan kaki, anda dapat menemukan banyak restoran. Restoran yang menyajikan makanan barat yang sebagian besar dengan banyak pilihan dan harga yang sangat wajar.   24 jam toko hanya sebelah villa ini. Toko bahan makanan dan beberapa menit berjalan kaki.  Villa ini besar, kami menginap di royal villa,…",5
49, The Seiryu Villas,"Saat kami mencari hotel kami di Seminyak dan melihat Seiryu Villas - itu memutuskan bahwa kami akan tinggal di sini lagi.  Proses check in sangat lancar dan staf datang dengan kami untuk memperkenalkan Villa dan fungsi.  Taman dan kolam renang adalah begitu indah bahwa aku hampir tidak bisa percaya mata saya. Kami menghabiskan begitu banyak waktu di sana dan santai kolam renang!  Dan itu bahkan lebih menakjubkan daripada vila yang di gambar, saya bilang beberapa kali selama liburan kami yang saya tidak ingin pernah pergi dan hanya tinggal tinggal di sini!  Staf hotel sangat baik dan penuh perhatian, mereka bahkan membantu kami untuk menemukan suvenir khusus yang kami telah melihat di tempat lain, tetapi tidak dapat menemukan lagi. Dan mereka juga mengatur sopir untuk kami, jadi…",4
50, The Seiryu Villas,Tinggal sangat menyenangkan dan staf sangat membantu. Para pegawai muda berbicara bahasa inggris dengan sangat baik dan orang-orang muda di meja resepsionis yang sangat membantu memberikan kita tips dan petunjuk.   Singkat berjalan kaki ke pantai sepanjang jalan dengan lampu sehingga anda merasa aman bahkan berjalan di malam hari.   Dekat dengan jalan utama dan pusat perbelanjaan. Jika anda ingin pergi ke suvenir terbaik meskipun orang berikutnya ke aussie pub harga terbaik dan tidak memaksa lain sepanjang jalan.   Meskipun ada beberapa hal dengan kamar kami A3 yang sedikit dari meletakkan. Ada noda di dinding toilet kecil dan ada bau aneh di seluruh. Handuk dan seprainya juga bernoda. Ini bisa dilakukan dengan sedikit cat dan pemeliharaan di sekitar tema umum. Tidak yakin…,3
51, The Seiryu Villas,"Selama 6 hari saya menginap di the seiryu villas, dan itu adalah saat yang indah untuk saya dan istri saya, villa ini sangat cukup, bersih, pribadi dan aku tidak bisa mulai pada bagaimana indah staf, anda benar-benar merasa tak bersyarat membantu tapi di bagian atas daftar saya adalah sarapan di ruang makan tanpa mengganggu mereka menempatkan anda di kamar anda setelah mereka memanggil anda dan meninggalkan tidak ada perlu pergi ke lobi seperti hotel lainnya, hanya turun adalah beberapa hal agak tua seperti pancuran luar ruangan dan makanan yang tidak besar, tetapi makanan di bali pada umumnya tidak baik setidaknya untuk selera saya. Saya akan tinggal di sana lagi tidak ada pertanyaan bertanya.",5
52, The Seiryu Villas,"Kami menikmati 7 hari di seiryu villas. Villa adalah luas, sangat bersih, dan kami memiliki bonus memiliki kolam renang pribadi. Setiap pagi staf mengantarkan sarapan kami. Staf di seiryu sangat luar biasa. Mereka sangat ramah dan membantu dan bahkan setelah kami cek out, mereka diatur bagi kita untuk memiliki mandi pada malam hari sebelum kami penerbangan pulang larut malam. Ini adalah tempat yang bagus dan layak dikunjungi.",4
53, The Seiryu Villas,"Kami tinggal di seiryu villas adalah sedikit mengecewakan.  Villa cukup tua dan tidak diurus dengan baik. Beberapa pintu di villa tidak menutup dengan benar, dan butuh waktu lama untuk mendapatkannya tetap. Yang tidak dekat dengan kerai dan area kolam sangat panas karena tidak ada sirkulasi udara karena dinding yang tinggi di sekitar.  Sarapan adalah ok, tapi tidak luar biasa, dan kami mengharapkan lebih beragam.  Juga ada tidak ada fasilitas spa, tapi itu bukan masalah besar karena sejumlah besar spa tersedia di seminyak. Saya telah menghabiskan bulan madu. Saya akan memiliki telah kecewa dengan tinggal secara keseluruhan.  Di sisi positifnya, layanan ini sangat ramah.  Untuk harga yang mereka minta jika tidak memesan sebelumnya harus ada pilihan yang lebih baik. Pelajaran…",2
54, The Seiryu Villas,"villa yang sangat bagus untuk bersantai di tempat yang privat di bali, tetapi anda masih dapat berjalan ke kota untuk berbelanja atau ke pantai. sangat direkomendasikan  Bagian terbaik dari villa adalah: menyukai cara bathtub memiliki akses ke kolam renang pribadi...  Terima kasih seiryu villa, jadi menikmati kami tinggal di sana! ",5
55, The Seiryu Villas,"Total lelucon. Villa kami adalah ganda memesan. Kami memesan untuk 20 malam di hari keempat kami diberitahu untuk meninggalkan. Kedua manajer villa dan agen kami meminta maaf dan sangat konfrontatif. Aku tidak bisa merekomendasikan tempat ini kepada siapa pun. Setelah banyak diskusi hangat kami berhasil mendapatkan pengembalian dana pada apa yang kita dibayar, tapi itu bukanlah hal yang mudah. Jika anda pergi ke bali memberikan tempat ini sebuah kehilangan",1
56, The Seiryu Villas,"Kami tidak kecewa, dari saat kami tiba kami dibuat merasa sangat nyaman dan disambut oleh semua staf. Villa adalah sangat bagus dan sangat baik staf di depan sangat sopan terutama, baik dan membantu (seperti staf keamanan di depan). Sarapan pilihan sangat luas dan aku mencoba sebagian besar barang di sana dan mereka semua sangat bagus memang. Akan sangat menyarankan dan akan pasti tinggal di sini lagi jika kami kembali ke bali lagi.",5
57, The Seiryu Villas,"Saya rasa tanda hotel yang bagus adalah bagaimana mereka (akomodasi) menangani masalah. Mari kita wajah itu hal-hal yang terjadi di luar kendali mereka. jadi ketika saya diberitahu kamar saya tidak akan siap sampai 10pm (di 18:30) anda dapat membayangkan aku tidak senang. Namun staf jujur, sopan meminta maaf dan apa yang saya rasakan adalah kompensasi yang sesuai. jadi saya sangat senang! Itu pekerjaan yang baik.  Vila itu sendiri adalah indah dan saya sedih untuk mengatakan lebih besar daripada apartemen saya di hong kong. sangat bergaya bali jadi mudah terbuka, banyak cahaya dan bayangan dan organik (kayu).  Satu-satunya negatif (dan saya sedang pemilih) adalah teknologi perlu memperbarui (tv baru, bluetooth sistem suara, stasiun docking untuk iphone 5/6) dan ac langsung di…",5
58, The Seiryu Villas,"Saya dan suami saya menyukai tempat ini. Staf adalah sangat ramah, ramah dan membantu. Villa adalah luas dan selalu bersih. Penyejuk bekerja sangat baik. Mereka juga memiliki banyak pilihan untuk sarapan. Benar-benar merekomendasikan.",5
59, The Seiryu Villas,"Vila luar biasa di lokasi yang baik dengan staf yang ramah dan membantu. Kolam renang adalah bersih dan sangat santai, dan berjalan langsung keluar dari kolam renang ke kamar mandi adalah sentuhan yang bagus. Kami akan pasti tinggal lagi, tapi waktu berikutnya kita akan buku langsung melalui villa.",5
60, The Seiryu Villas,"The Seiryu Villas Cinta. Kami telah tinggal di sejumlah properti di bali vila, tapi tempat ini terasa seperti rumah. Properti memiliki banyak ruang di luar, tapi kami menemukan ini sangat nyaman di malam hari nyamuk keluar. Semua vila di sini (besar dan kecil - kami telah tinggal di kedua) memiliki ruang tamu dalam ruangan yang sangat bagus untuk bersantai di malam hari. Tempat tidur daerah memiliki tv yang baik. Kelebihan lain adalah area lounge di sebelah kolam renang dan villa yang masuk dari kamar mandi ke kolam renang - menyenangkan! Mereka baru saja dihentikan mereka pantai kursi di pantai (5 menit berjalan kaki) yang adalah seorang gelandangan, tapi murah untuk menyewa kursi pantai untuk hari. Kami menyukai surfing (atau mencoba untuk berselancar) di sekitar pantai. Di…",5
61, The Seiryu Villas,"Villa kami adalah luar biasa. Staf yang sangat akomodatif dan penuh perhatian. Sarapan selalu tepat waktu, dan villa kami dan kolam renang yang dibersihkan setiap hari dengan sempurna. Tidak ada yang terlalu banyak kesulitan. Baik pick-up dan drop off ke bandara berjalan mulus. Lokasi yang besar dan layak 5 bintang. Kami akan kembali lagi ",5
62, The Seiryu Villas,"Awalnya saya agak skeptis ketika saya tiba di depan villa. Tapi setelah 3 hari stayinng akan mengatakan ini adalah salah satu yang terbaik yang saya telah tinggal di villa bali. Staf sangat bagus, mereka memberikan banyak privasi untuk tamu. Mereka mengatur sebuah spa di tempat lain ketika mereka spa adalah sepenuhnya memesan satu malam. Mereka juga mengatur transportasi untuk mengantar saya dan menjemput saya setelah spa. Kolam renang bagus, seluruh villa sangat bersih. Vila itu sendiri sangat luas. Saya akan merekomendasikan villa ini kepada teman-teman saya dan saya pasti akan datang kembali jika saya mengunjungi bali lagi!",5
63, The Seiryu Villas,"Tidak ada hal yang aku akan berubah tentang tempat. Ini adalah benar-benar sempurna. Vila yang sangat luas, tenang dan indah dibuat. Kami tidak ingin meninggalkan villa kami untuk melakukan sesuatu yang lain. Staf sangat manis dan membantu. Saya pasti akan merekomendasikan tempat ini untuk siapa saja yang bepergian ke seminyak tanpa anak-anak! ini adalah tempat yang fantastis! ",5
64, The Seiryu Villas,"Saya dan mitra saya tinggal di sini selama 4 malam dan kami benar-benar suka menginap di sini! Selama kami tinggal itu juga ulang tahun saya dan mereka melakukan segala yang mereka bisa untuk membantu pasangan saya membuat hari istimewa karena bisa untuk kami.   Saat check in kami disambut sangat ramah/negara kemudian ditampilkan untuk villa kami. Anda berjalan di bawah ini berkarat yang cukup gelap dan misterius, di mana ada beberapa pintu, dan kemudian ketika anda membuka pintu villa anda anda berjalan ke halaman/kolam renang yang luar biasa ini. Ketika anda berjalan ke villa itu sendiri sebenarnya itu jauh lebih besar dari apa yang saya bayangkan. Hotel ini bersih, terawat dengan baik, staf akan datang di setiap hari dan mengambil semua bunga yang telah jatuh di tanah, mereka…",5
65, The Seiryu Villas,"Saya menginap di vila ini selama 3 malam. Suami saya dan saya mengunjungi bali sekali setahun, dan dari segi akomodasi dan makanan (sarapan dan layanan kamar), villa tidak mengecewakan. Villa adalah luas dan bersih, dan staf sangat sopan dan efisien. Ini akan menjadi review bintang 4,5, jika tidak untuk satu hal.  Setelah meninggalkan bali, dan setelah kedatangan kami di negara sendiri. Suami saya menerima email dari villa, menyatakan bahwa mereka telah melewatkan dikenakan biaya dan menurunkan biaya untuk kartu kredit kami. Kami telah memiliki rincian kartu kredit kami melalui biaya formulir sebelum tiba di bali untuk memastikan villa.  Kami diakui yang menurunkan biaya, namun kami tidak begitu senang dengan villa pengisian kartu kredit sebelum meminta kami untuk…",3
66, The Seiryu Villas,Saya memutuskan untuk memesan kamar di sini karena putri saya sebelumnya dan menikmatinya begitu banyak. Aku suka privasi memiliki kolam renang sendiri dengan tidak ada pembatasan waktu. Vila itu indah dan semua staf yang ramah dan sopan. Akan tinggal di sini lagi,5
67, The Seiryu Villas,"Ini adalah kedua kalinya kami telah tinggal di seiryu villa dan sekali lagi itu tidak mengecewakan. Dari saat kami diperlakukan di bandara tidak ada terlalu banyak kesulitan. Lokasi adalah kedua tidak ada, yang 100m berjalan kaki ke bar, supermarket dan restoran dan sekitar 10 menit berjalan kaki ke pantai. Dekorasi, tempat tidur besar dan di luar lingkungan yang indah di mana kita bisa duduk sepanjang hari!",5
68, The Seiryu Villas,Vila yang indah dan luas. Staf yang ramah. Kami menyukai kolam renang pribadi dan hari tempat tidur di luar. Cukup bersih walaupun ada beberapa noda di seprai. Memutuskan untuk tidak menyertakan sarapan di kamar kami sehingga kami tidak dapat berkomentar tentang itu (banyak sarapan tempat di seminyak sehingga tidak kerugian besar). Downside adalah bau mengerikan di kamar mandi! seperti bau pembuangan yang buruk ketika anda mendapatkan di kamar mandi dan itu akan membuat anda dari pergi ke sana. Kamar mandi juga terlihat sangat menarik dan dosent kamar mandi umum yang perlu diperbarui (lubang pembuangan kamar mandi tidak bekerja dengan benar terlepas dari pengembangan menggunakan penyelam di atasnya). Lokasi 5min ke pantai dan berjalan kaki ke seminyak square 20min (atau $2AUD…,4
69, The Seiryu Villas,"Tinggal di sini selama 4 malam dan kami mencintai segala sesuatu tentang itu, dari makanan, kamar, privasi, lokasi, lingkungan, bau (ya, mereka memiliki bau), semuanya! Saya perhatikan bahwa mereka hanya mengecat kamar karena jika saya bandingkan dengan kondisi beberapa barang di kamar mandi, yang mereka terlihat tua dan sedikit usang, namun mereka masih berfungsi dengan baik, sehingga kami tidak memiliki masalah dengan itu.  Kamar saya sangat luas 1, 5 tahun putri mencintai untuk berjalan dari pintu masuk ke area makan kembali dan seterusnya. Di akhir kunjungan, saya dan suami saya setuju bahwa kami akan menginap lagi di tempat ini ketika kami kembali ke bali.",5
70, The Seiryu Villas,"Saya sangat merekomendasikan tinggal di villa ini karena ini cukup luas villa sangat dekat dengan pantai dan area perbelanjaan. Staf adalah sangat membantu dalam mengatur taksi atau layanan lainnya yang anda butuhkan. Manajer mr widi dan staf ms maria, mini telah membuat pengalaman menginap kami & kami perayaan ulang tahun yang tak terlupakan.   Kami akan kembali dan tinggal lagi di masa depan.",4
71, The Seiryu Villas,"Kami baru saja kembali dari kunjungan pertama kami ke bali. Kami memiliki waktu yang menakjubkan dan seiryu villas sehingga mengesankan! Villa menakjubkan, bersih, dan sangat luas. Ac bekerja sangat baik dan layanan dari semua staf adalah luar biasa. Sarapan disajikan setiap hari oleh pelayan di villa dan itu selalu lezat! Pantai adalah sekitar $6 menit berjalan kaki dari toko-toko dan berjalan kaki singkat ke arah berlawanan. Kami menyukai tinggal di seiryu dan pasti akan menginap lagi",5
72, The Seiryu Villas,"Villa yang luar biasa dengan desain besar, kolam renang pribadi, dapur, dan tempat tidur besar yang nyaman. Tempat ini sangat tenang, damai dan pribadi, cocok untuk bulan madu. Dekat ke pantai seminyak. Setiap vila memiliki pintu belakang yang tersembunyi sehingga pelayan tidak akan mengganggu anda ketika mereka menyiapkan sarapan di ruang makan yang memiliki pintu dikunci dari kamar tidur. Saya A1 selama dua malam, layanan yang sangat baik, terima kasih sangat banyak untuk semua orang di seiryu. 10/10 akan kembali lagi.",5
73, The Seiryu Villas,"Menakjubkan vila dengan kolam renang pribadi, dapur dan tempat tidur besar yang nyaman. Orang dewasa yang mudah membuat suasana romantis. Dekat dengan pantai dan restoran dan toko-toko. Staf yang sangat baik. Vila yang sangat pribadi, jika anda ingin liburan yang tenang dengan kekasih anda dan tidak ada yang lain ini adalah tempat untuk tinggal. Mencintai kami menginap di villa ini dan stafnya akan melakukan apa pun untuk membantu anda menikmati masa tinggal anda. Daerah outdoor besar di sekitar kolam renang pribadi untuk bersantai dan membaca buku. Sarapan luar biasa yang dikirim dari pintu belakang yang tersembunyi dan tidak mengganggu anda, dan mengatur di ruang makan/dapur anda sendiri yang memiliki pintu dikunci dari kamar tidur.",5
74, The Seiryu Villas,Saya hanya umpan balik yang luar biasa untuk villa resort dapat ditempuh dengan berjalan kaki ke pantai seminyak. Saya B2 selama dua malam dan villa memiliki desain yang fantastis. Dari saat anda memasuki kompleks anda merasa energi yang luar biasa. Saya ditunjukkan vila dengan kolam renang pribadi dan saya sangat puas dengan ukuran dan desain.   Vila ini memiliki lantai kayu dan kayu langit-langit yang tinggi dengan lampu gantung. Semua turun ke pencahayaan sempurna dan villa sangat tenang.  Tempat tidur yang sangat nyaman dan bagi saya dari kamar mandi untuk bisa melompat ke dalam kolam renang sebuah pintu di kamar mandi yang sangat mengesankan.   Aku memeriksa banyak villa dan ini adalah salah satu favorit saya di daerah seminyak. Cukup berjalan kaki untuk segalanya -…,5
75, The Seiryu Villas,"Desain vila ini sangat bagus, dengan dekorasi-ed, gaya jepang pada malam pertama saya di sana saya menemukan jacuzzi tidak bekerja, air tidak akan pergi, tidak terlalu bersih dan tampaknya... saat suasana di jacuzzi, terdapat sesuatu yang kuambili dari udara luar... mengatakan staf tentang hal itu, dan hari kedua, ketika saya datang kembali, itu masih ada air dan menelepon saya kembali, kali ini mereka membantu kami dengan mengubah kamar. aku mencintai villa ini, dan itu kawinku di bali, jadi saya m di suasana yang benar-benar baik itu terbuka ini tak memengaruhi saya banyak. saya menemukan staf yang sangat ramah dan membantu... gaya jepang sangat bagus dan sarapan adalah sesuatu yang anda tidak melihat di bali. Secara keseluruhan, lokasi ini cukup bagus, bersebelahan dengan the…",4
76, The Seiryu Villas,Kami pergi dengan pasangan lain dan tinggal di B4 A4 (dipesan untuk 9 malam) kami meninggalkan setelah dua malam di kami tidak mendapatkan apa yang kami harapkan! Aku tidak salah satu untuk pergi tapi... Aku akan mengatakan! Untuk uang yang sama anda dapat tinggal di seminyak dengan fasilitas yang jauh lebih baik... Hanya positif adalah staf yang luar biasa...,2
77, The Seiryu Villas,"Tinggal 4 malam di villa ini pada juli 2015. Cuaca hangat di sekitar 29 c pada siang hari dan sekitar 24C di malam hari. sangat luas dan memiliki kolam renang pribadi. Kami menemukan staf sangat membantu. Kami disajikan dengan sarapan vegetarian berdasarkan permintaan. Vila ini cukup dan banyak privasi. Terdapat spa dan pesan ligas di samping villa. Hanya 10 - 15 menit berjalan kaki ke kota di mana terdapat banyak toko-toko kerajinan, kain, sportswear dan kafe. Bahkan ada sebuah supermarket besar di dekatnya di mana kita mendapatkan bahan makanan dan buah-buahan. Pantai adalah 10 menit berjalan kaki dari villa yang berlawanan dan kami melihat matahari terbenam di cakrawala.",4
78, The Seiryu Villas,"Tinggal di sini minggu lalu di villa b3 dengan suami saya, berusia tua dan suster dalam hukum. Tempat tidur yang besar, lebih besar daripada raja. Sil tidur di sofa meja bulsak dan merasa sangat nyaman. Layanan yang luar biasa dan staf melakukan segalanya untuk kami menginap pria bahkan lebih baik. Mencari taksi juga tidak masalah, staf yang memastikan kami memiliki taksi blue bird yang siap untuk ketika kita ingin meninggalkan. Kamar memiliki layanan di ruang pijat yang besar jika anda tidak ingin meninggalkan kenyamanan vila anda. Villa adalah sangat luas dan memiliki dua tv yang bagus. Terletak 5 menit berjalan kaki dari pantai seminyak. Akan tinggal lagi, pengalaman deff",5
79, The Seiryu Villas,"Aku menikmati saya tinggal sangat banyak. Layanan ini ramah dan responsif dan sarapan kami yang sangat perlu diperhatikan. Namun, sayangnya kami sedikit tua. Air datang keluar dari bak mandi bau dan beberapa kunci di pintu sudah tua dan tidak dapat digunakan. Vila ini berada di membutuhkan beberapa perbaikan.",4
80, The Seiryu Villas,"Nice villas di seminyak klintir di, kamar yang luas, interior yang terpelihara dengan baik. Memiliki beberapa masalah dengan nunia dari seprai dan selimut penutup. Secara keseluruhan masih bagus, lokasi yang nyaman. Staf ramah dan mencoba untuk membantu. Akan merekomendasikan untuk mencoba tempat ini 10",4
81, The Seiryu Villas,"Lokasi yang nyaman, staf yang ramah. Desain modern melalui keluar dari rumah yang indah, banyak ruang untuk 4 - 6 10 untuk hang out di tempat ini. Berjalan ke dalam kolam dari kamar mandi adalah sentuhan yang bagus. Harus meminta beberapa kali untuk mendapatkan seprai bersih. Jumlah yang adil untuk sarapan. ",3
82, The Seiryu Villas,"Kamar besar - kamar yang bersih dan nyaman. Lokasi yang nyaman. Terisolasi dari restoran bbq bagus juga. Dan kemudian aku seperti kolam renang pribadi juga. Semuanya baik, rumah ketika aku tinggal. Aku akan tinggal lagi.",5
83, The Seiryu Villas,"Kami tinggal di b2, mencintai tempat, pengalaman yang indah dan tempat yang indah untuk tinggal. Seiryu staf selalu tersenyum dan membantu Dekorasi yang sangat bagus, sangat rapi dan bersih, makanan yang baik  Menakjubkan pengalaman dengan kenangan indah dengan seiryu villas",4
84, The Seiryu Villas,"Segala sesuatu tentang villa ini fantastis. Kamar yang bersih dan nyaman dan fakta bahwa sarapan disajikan pada waktu yang diminta uang untuk merasakan liburan yang santai. Kolam renang juga bersih, dan hanya apa yang anda dibutuhkan karena cuaca panas.  Tapi ini adalah kehangatan dan keramahan staf yang hanya menambah kenyamanan menginap di the seiryu. Ayu dan dharma dan semua yang lain hanya pergi keluar dari jalan mereka untuk memastikan kami memiliki tinggal yang sangat menyenangkan. Benar-benar merekomendasikan hotel ini dan akan tinggal di sana lagi jika pernah di bali.",4
85, The Seiryu Villas,"Kami benar-benar mencintai villa ini. Tata letak, dekorasi dan suasana yang luar biasa, sangat direkomendasikan untuk akhir pekan bulan madu atau anda satu iove gateaway. Ini adalah perjalanan pertama kami, dan villa adalah teman-teman lokal.  Lokasi ini sangat nyaman ke pantai atau pusat kota.   Saya akan merekomendasikan mereka untuk mengubah sabun/sampo dispenser dari gelas plastik, atau membuatnya magun sehingga tidak dapat diangkat.",5
86, The Seiryu Villas,Ini adalah kedua kami menginap di the seiryu villa dan itu fantastis. Vila ini sangat terpelihara dengan baik dan layanan juga luar biasa. Kami akan pasti mendapatkan lagi memilih ketika kita kembali ke bali! Dan kali ini terima kasih untuk semua staf the seiryu! Tim yang luar biasa!   Penerima Pearlie,5
87, The Seiryu Villas,"Mencintai segala sesuatu tentang tempat ini. Villa ini sangat mengagumkan, (. B3), Tempat tidur itu begitu nyaman, tapi ketika itu nyaman untuk anda, dan sarapan dan semua hidangan lainnya disajikan pada waktu yang anda minta. Kolam renang sangat bersih dan persis apa yang anda butuhkan di halaman belakang anda dengan jenis memperhangat. Mini dan seluruh staf membuat kami tinggal liburan terbaik yang pernah. Kali ini (manajer) dan seluruh staf sangat membantu dan menampung, ketika penerbangan kami telah dibatalkan karena abu vulkanik. Seperti orang-orang yang indah dan ramah. Kami sangat berterima kasih untuk semua yang mereka lakukan untuk kita. Saya sangat merekomendasikan vila ini Sieryu.",5
88, The Seiryu Villas,"Kami memiliki liburan yang indah di hotel ini selama dua hari. Ketika kami memeriksa di, staf sangat baik untuk membimbing kita untuk villa kami, dan membiarkan kami memilih sarapan kami hari berikutnya.  Tiba di hotel mereka sangat baik dan dalam kondisi yang baik. Hal terbaik adalah sinyal wifi sangat bagus, dan setiap vila memiliki sinyal wifi mereka sendiri!   Aku akan datang kembali dan menikmati lebih banyak hari di seiryu villas!   ",5
89, The Seiryu Villas,"Aku tinggal di the seiryu villa dengan adik saya dan memiliki waktu yang fantastis. Vila ini sangat mewah dan layanan yang sangat baik. Lokasi adalah tidak di mana kami berjalan ke pantai atau berbelanja dengan mudah. Ayu di meja depan menawari kami sangat membantu, terima kasih! ",5
90, The Seiryu Villas,"Ini adalah salah satu tetap paling menyenangkan. Staf yang besar, ramah dan sangat membantu. Vila ini (dalam kasus kami A4) adalah di luar saya. Kolam renang adalah menakjubkan. Lokasi adalah sempurna, dekat dengan segala sesuatu dan sangat baik pada waktu yang sama. Itu sempurna. Hanya tiga komentar:   1 - air terjun berisik dan harus hanya berubah di atas permintaan.   2 - kamar tidak boleh padam. Terutama jika anda lelah furnitur. Segera setelah matahari terbit, itu adalah sebagai terang sebagai di luar.   3 - pelayan memberikan sarapan anda di dapur villa anda (yang memiliki pintu belakang) setiap pagi, tapi mereka bersikeras untuk membangunkan anda.  Daripada orang lain komentar, kami tinggal adalah menyenangkan dan staf sangat penuh perhatian.",4
91, The Seiryu Villas,"Pacar saya dan saya tinggal di the seiryu villas untuk 5 malam. Kami telah benar-benar besar waktu di sana. Villa adalah luas, ranjangnya sangat nyaman, wifi sangat cepat, tetapi selalu bersih dan ac juga sangat baik. Staf di villa telah melampaui fantastis, sangat membantu dan ramah sepanjang waktu. Aku punya apa-apa yang buruk untuk mengatakan tentang tempat ini, hanya memiliki 8 vila yang ramah dan merasa seperti anda benar-benar mendapatkan di sana dan staf selalu mengenali anda pada wanita di rumah jauh dari rumah. Pasti akan tinggal di sini lagi pada kunjungan berikutnya ke bali.",5
92, The Seiryu Villas,"Kami tinggal di seiryu villas di akhir bulan juni. Villa adalah ukuran yang tepat dan memiliki semua yang diperlukan untuk membuat perjalanan ini tak terlupakan. Kami tidak memiliki sarapan untuk perjalanan ketika kami meninggalkan sangat awal untuk kegiatan kami dan mereka dikemas kotak sarapan untuk kami! Kami akhirnya mendapat untuk mencoba sarapan pada pagi ketiga dan yang panjang! Memerintahkan bbq di kamar kami dan ketika kami datang kembali di malam hari, tetapi dekorasi yang sangat romantis dan makanan yang sangat bagus juga! Kolam itu juga besar setelah hari yang panas keluar. Staf sangat ramah. Vila ini berada di dekat pantai, dalam jarak berjalan kaki dan dekat dengan semua toko-toko dan restoran-restoran juga! Sudah pasti akan menginap di sini lagi!",5
93, The Seiryu Villas,"Villa indah, sangat menyenangkan, membantu staf. Lokasi yang baik, berjalan kaki ke pantai dengan banyak kafe untuk memilih dari di pantai. Dekat dengan jalan utama dengan restoran dan toko-toko. Harga yang baik, pertengahan rentang. Kami telah tinggal di menggambar tetapi memiliki dibayar lebih banyak bagi mereka. ",4
