,hotel,review,stars
37, Twin Island Villas & Dive Resort,"""Datang sebagai tamu, meninggalkan sebagai teman"" moto yang sempurna untuk ini bagian dari surga. Kami tinggal untuk 4 malam dan kami tidak memesan akomodasi kami, kita pasti akan tinggal lebih lama. Tempat ini luar biasa! Vila yang indah, pemandangan yang menakjubkan, makanan enak, snorkeling dan menjelajah pulau! Semua staf berusaha untuk memenuhi keinginan kami dan tidak bisa membuat kita merasa lebih selamat datang! Kami sekarang merencanakan perjalanan kami berikutnya di sana dengan semua keluarga kami.  Terima kasih banyak, sarah, kacang kapri, darren, g ' hari dan menyelam scuba untuk membantu kami menciptakan kenangan terbaik! Kami menyukainya! Glen & Majan nicholls, Normanville s.a. ",5
38, Twin Island Villas & Dive Resort,Itu sangat keras dan bumby naik ke sana. Sedikit jauh dari segala sesuatu. Kamar yang sangat bagus. Tidak ada deposit aman dan ada lubang jendela yang besar dengan akses yang mudah. Saya hampir pingsan saat akan tenggelam saat malam hari. Masalah karena kehilangan sepotong kayu di langkah pertama. Manajemen tampaknya hilang semua waktu ketika kita membutuhkan mereka dan sebagian besar dari mereka kesulitan untuk berbicara bahasa inggris. Tidak ada restoran dan bar adalah rata-rata untuk miskin. Sarapan yang baik dan disampaikan ke kamar. Agak mahal untuk apa yang kita punya. ,3
39, Twin Island Villas & Dive Resort,"Tidak banyak waktu yang harus saya menikmati tinggal di hotel. Orang-orang hebat, layanan besar, pemandangan luar biasa. Itu membuat perjalanan kami ke lembongan mucht jadi lebih baik sudah cukup. Kami akan pasti kembali ke lembongan dan ketika kami lakukan, kami akan pasti buku di twin island villas lagi!",5
40, Twin Island Villas & Dive Resort,"Tinggal di sini pada rekomendasi dari teman. Manajer, p dan darren bersama dengan staf mereka yang membuat kami tinggal pengalaman yang luar biasa dan lebih dari senang untuk membantu dalam mengatur transportasi dan makan malam di lokasi yang berbeda di pulau dan yang lain permintaan yang kami punya. Ini adalah jauh dari keramaian dan hiruk pikuk dari desa dan pantai, jadi bersiaplah untuk menyewa sepeda untuk mendapatkan sekitar jika anda ingin melakukan hal wisata. Jika anda mencari untuk menyelam atau snorkeling di sekitar pulau, pulau kembar juga menjalankan perusahaan selam dan menyediakan layanan pribadi yang besar dan pengalaman. ",5
41, Twin Island Villas & Dive Resort,"Hotel ini tidak di pantai tapi mereka memiliki beatifull pemandangan laut, tenang dan tempat yang bagus untuk pasangan, lokasi hotel sekitar 5 mnt jauh dari jalan utama tergantung dari seberapa cepat Anda berkendara. kamar yang nyaman, sarapan sangat baik, dan staf sangat membantu.  Saya sangat senang menginap di sini.",5
42, Twin Island Villas & Dive Resort,"Twin island villas adalah tempat yang indah jika anda ingin tinggal sedikit di luar keramaian dan hiruk pikuk tempat wisata di nusa lembongan. Namun, karena pulau ini begitu kecil, anda bisa mendapatkan di mana pun anda ingin pergi dengan cepat dengan sepeda motor, anda dapat menyewa di sana (ya, jalan bergelombang, tapi itu menyenangkan untuk berkendara sepeda). Staf sangat ramah dan akan membantu anda dengan kebutuhan anda wathever. Sarapan mereka melayani - di kamar anda, jika anda mau! - sangat lezat. Jika anda memiliki kesempatan, coba untuk memesan salah satu dari dua pondok di mana anda dapat menikmati kolam renang anda sendiri (""cinta"" atau ""kecil""), itu pasti layak.",4
43, Twin Island Villas & Dive Resort,"Kami tinggal di sana selama 2 malam. Tempat yang indah, sangat damai. Staf sangat bagus. Pemandangan yang luar biasa, sangat tenang. Jangan ragu untuk menyewa skuter dan pergi mengunjungi.  Jika anda ingin, anda dapat makan di restoran hanya di depan hotel.  Hanya 30' dari bali.",5
44, Twin Island Villas & Dive Resort,"Vila ini memiliki merasa besar, sangat santai dan menyenangkan suasana. Bagian yang terbaik adalah sarapan di mana anda duduk di balkon dengan pemandangan yang menakjubkan, makan makanan enak. Staf semua sangat ramah dan senang - tempat yang menyenangkan untuk berada di sekitar. Villa adalah luas, tempat tidur nyaman dan kamar mandi sangat dingin. Cinta bar juga. Sedikit tips jika anda bangun lebih pagi, kesempatan yang baik untuk melihat matahari terbit. Ada juga sebuah restoran yang layak di dekatnya. ",5
45, Twin Island Villas & Dive Resort,"Kami memiliki pengalaman menginap yang luar biasa di sini di twin island villas! 6 hari kebahagiaan dan kami bisa tinggal lebih lama! Staf sangat membantu dan sangat ramah! Pemandangan indah dan kami punya vila dengan kolam pribadi, yang bisa tinggal dengan semua hari! Kami merasa begitu santai dan pasti menginap di sini, dan akan menyarankan siapa pun untuk merasakan petualangan kembar villa! Tempat terbaik!  Terima kasih untuk liburan yang fantastis pulau kembar! Xx",5
46, Twin Island Villas & Dive Resort,"Twin villa adalah tempat terbaik aku tinggal di pulau lembongan. Kru yang sangat ramah dan membantu, manajer adalah luar biasa dan resor ini begitu indah. Hotel ini besar dan damai. Anda memiliki begitu banyak ruang pribadi dan ini akan memberikan anda pengalaman liburan. Sarapan adalah lezat dan pemandangan pulau yang sangat bagus. Sangat direkomendasikan! ",5
47, Twin Island Villas & Dive Resort,"Lokasi yang menakjubkan, kolam renang yang fantastis yang menghadap ke air, dikelilingi oleh pepohonan hijau yang rindang. Kami memiliki beberapa malam di sini dan sangat damai. Hotel ini terletak jauh dari keramaian dan hiruk pikuk yang kami sukai. Sangat mudah untuk menyewa motor dari pulau kembar untuk tur pulau. Staf yang fantastis - sangat ramah dan pergi keluar dari jalan mereka untuk menjaga kita. Saya pasti akan merekomendasikan tempat ini!",5
48, Twin Island Villas & Dive Resort,"Dua pulau ini benar-benar indah. Setiap kamar unik dan dirancang untuk membuat anda merasa di rumah. Aku tinggal di dua kamar yang berbeda selama tiga malam dan keduanya sangat luar biasa. Pemandangan dari kamar twin menghadap ke pulau nusa ceningan dan mengagumkan dan jembatan kuning. Properti bergaya dan di antara pepohonan, sehingga anda akan merasa satu dengan alam ketika anda berenang di kolam renang indah atau ayunan tergantung di salah satu kursi berbentuk telur. Manajer sangat ramah dan darren Prashanti, dan profesional, dan bj adalah fenomenal dan membantu, dan pergi keluar dari jalan untuk memberikan saya tangan setiap hari. Seluruh staf itu indah. Aku punya waktu terbaik di pulau kembar, dan aku akan kembali dalam sekejap. Satu hal yang perlu diperhatikan adalah bahwa…",5
49, Twin Island Villas & Dive Resort,"Loooooooooooove tempat ini :) Pemilik sangat ramah dan membantu mengatur liburan saya adalah pelayanan yang sangat mudah, termasuk transport dari bandara, memiliki fasilitas yang indah dan staf yang luar biasa di situs web. Kamar saya memiliki pemandangan yang indah di pulau dan itu adalah indah untuk bangun dengan matahari datang dari balkon :) Kolam renang yang dingin, sehingga memberikan bantuan dari panas. Kembar terletak jauh dari jalan utama, yang aku suka karena itu tenang dan santai. Itu masih mudah untuk mendapatkan sekitar dengan sepeda atau mengatur transportasi. Sebagai glutard dan lactard (celiac dan susu tidak toleran; )) itu luar biasa untuk memiliki fasilitas dapur ketika aku tidak merasa seperti keluar untuk makan dan bar untuk malam cap atau dua. Pemilik tahu…",5
50, Twin Island Villas & Dive Resort,"Apa ada kemungkinan untuk menemukan ini diamond di kasar? Segera setelah kami berjalan di tangga di twin island villas, kami tahu kami telah membuat pilihan yang tepat!   Vila-vila yang tersebar beberapa taman yang indah, bahwa seseorang yang jelas bangga dengan di, di sebuah bukit yang menghadap ke laut dan pulau tetangga. Terasa benar-benar terpencil, seperti tempat rahasia kecil anda sendiri... dan dengan pemandangan yang cantik!  Kami awalnya memesan ke villa kecil, dengan kecil kolam renang, selama tiga malam tapi memutuskan untuk memperpanjang waktu menginap kami selama empat hari! jadi kami pindah ke kamar atas. Villa sangat baik, kamar mandi gaya bali dengan batu. Ada balkon/dek luar ruangan di mana kami makan sarapan setiap pagi dan juga sebuah dek di sekitar kolam…",5
51, Twin Island Villas & Dive Resort,"Benar-benar luar biasa tinggal di surga. Pemilik dan staf yang sangat ramah, ramah dan senang untuk mengatur tur dan restoran. Putri saya dan saya tinggal di sebuah ruangan dengan kolam renang pribadi dan memiliki segala yang kami butuhkan. Kamar mandi adalah gaya luar ruangan yang indah dan tempat tidur yang sangat nyaman. Mekar di taman yang sangat terawat dengan baik dan seluruh daerah sangat bersih. Pada saat kedatangan kami diberi pilihan untuk minum minuman saat memeriksa di dan mengambil dalam pemandangan. Lakukan kebaikan untuk diri anda dan tinggal di sini ketika mengunjungi nusa lembongan",5
52, Twin Island Villas & Dive Resort,"Namun masuk ke kolam renang yang luar biasa, dengan bintang dan mengambil di beberapa pemandangan yang luar biasa. Pasti tempat saya.   Staf sangat ramah dan membuat anda merasa seperti tamu khusus. Resor ini adalah jauh dari jalan utama tetapi masih hanya 10 menit dengan skuter atau taksi. Saya sangat merekomendasikan tempat ini untuk siapapun yang ingin sesuatu yang sedikit berbeda untuk liburan mereka. Benar-benar hebat! ",5
53, Twin Island Villas & Dive Resort,"Setelah berkendara motor di sekitar dan memeriksa kami di seluruh pulau, ini adalah pilihan terbaik kami! Taman yang indah mengelilingi bungalow yang indah, kolam renang pribadi dan lounge untuk minum bir bintang di kursi matahari yang cantik, dan pemandangan dari kamar. Meskipun sedikit bergelombang untuk pantai dan istirahat di kota, ini adalah benar-benar layak untuk kembali ke oasis ini. Kami tinggal selama 4 hari dan dapat dengan mudah telah menghabiskan lebih. Makanan yang menakjubkan di restoran di hotel dan staf yang sangat ramah. Pasti ingin kembali suatu hari! ",5
54, Twin Island Villas & Dive Resort,"Kami membantu banyak hal di pulau ini selama kami tinggal, tapi selalu sangat senang pergi ke 'rumah' untuk kami menuju villa tempat kami yang indah. Pasti akan kembali, kami sudah merencanakan perjalanan kami berikutnya. Terima kasih untuk indah & membantu staf yang memiliki pengetahuan lokal yang sangat baik dalam menunjukkan kita ke arah pulau aset terbaik. ",5
55, Twin Island Villas & Dive Resort,"Manajer yang datang dan memiliki bir dan tertawa dengan kami dan membuat kami merasa di rumah. Pemandangan dari kolamnya, kamar semua unik dan indah dan makanan di seberang dari vila sangat luar biasa! Akan kembali 100%",5
56, Twin Island Villas & Dive Resort,"Tempat ini fantastis, staf sangat bagus, makanan cukup enak. Saya hanya masalah adalah bahwa kolam renang terjun kami adalah bisa dilihat dari cara berjalan, sehingga kami kehilangan beberapa privasi. Benar-benar tidak memiliki keluhan yang sebenarnya. Kami memiliki pengalaman menginap yang menyenangkan dan saya akan merekomendasikan hal ini kepada siapa pun yang mencari sesuatu yang romantis tapi murah. ",4
57, Twin Island Villas & Dive Resort,"Twin island villas, dan waktu kami di lembongan adalah bagian terbaik dari kami 2 minggu di bali. suami saya dan saya berencana untuk 3 hari, tetapi akhirnya tinggal 6 hari di lembongan.   Dua pulau ini benar-benar adalah sebuah permata. Hanya ada 3 vila, dengan kolam renang pribadi, dan pemandangan yang luar biasa, kami merasa seperti kami memiliki tempat untuk diri kita sendiri yang fantastis ini sedikit. Villa adalah bersih, indah, dan nyaman. Kami menghabiskan 3 malam di rumah kecil, dan 3 di Ancak. Pemandangan dari tempat ini selalu luar biasa. Kami menghabiskan banyak waktu bersantai di kolam renang, menonton kapal pesiar melalui saluran, dan mendengarkan suara pulau (burung, ayam, sapi, musik/nyanyian dari kuil, motor menyeberang jembatan, itu semua). Pilihan sarapannya…",5
58, Twin Island Villas & Dive Resort,"Kami memiliki empat malam di sini dan mereka sangat luar biasa! Kami memiliki seluruh tempat untuk diri kita sendiri! Staf yang di tangan/telepon setiap kali kami membutuhkan sesuatu yang sangat ramah dan kami berharap untuk bertemu setiap hari untuk mengobrol! Villa kami adalah nyaman, bersih dan memiliki pemandangan yang luar biasa. Villa adalah menyenangkan tapi bergelombang perjalanan melalui desa-desa kecil ke atas dengan pemandangan lepas ke pulau nusa Lembognan laguna. Dengan kolam renang yang bagus, kami menikmati bersantai di siang hari di sini dan di kolam renang terjun pribadi kita sendiri! Saya akan merekomendasikan tempat ini untuk orang yang mencari pengalaman jauh dari bagian sibuk pulau dan untuk damai dan tenang dalam pengaturan yang paling tenang. Kami menyewa…",5
59, Twin Island Villas & Dive Resort,"Ti vila yang persis seperti yang kami harapkan! Foto dan ulasan mereka benar untuk membentuk dan berada di sana hanya membuatnya lebih sihir. Tempatnya sangat menarik dan menyenangkan untuk menjelajahi, dan vila ini benar-benar indah dengan pemandangan luar biasa di seluruh, dimulai tepat dari menit anda membuka mata anda (sehingga anda dapat meninggalkan tirai terbuka). Saya menghabiskan banyak waktu di dek pribadi kami, mengambil itu semua di - pemandangan, bau, suara... ini ah-syik!  Staf yang sangat ramah dan menyambut, terutama bj - dia adalah selalu ada untuk membantu dengan senyum yang indah dan aku berbagi banyak yang dalam dan bermakna percakapan dengan dia, bertukar cerita budaya yang berbeda. Darren dan Prashanti (manajer) sering muncul dalam untuk menyapa dan…",4
60, Twin Island Villas & Dive Resort,"Ok jika anda naik sepeda motor di kambing yang track dan ingin pengalaman yang menakjubkan tempat ini wajib dikunjungi! Ada kolam rendam, tapi di kolam renang sanggraloka ini hanya sebagai kamarku sehingga tidak diperlukan.   Akomodasi kami, itu sangat pribadi dan terpencil, indah dan sangat baik, manajemen dan staf layanan sangat otentik dan siap.   Di sebelah restoran ada duanya, makanan yang luar biasa dan sangat terjangkau. Saya tidak cenderung untuk datang kembali ke tempat-tempat tapi aku tahu aku akan kembali ke sini suatu hari nanti! ",5
61, Twin Island Villas & Dive Resort,"ramah pemilik, menyenangkan staf, pemandangan indah. Secara keseluruhan bagus. Twin island villas akumencintai :)  bar memiliki pandangan yang sangat baik dan kolam renang adalah besar swimmijg! Aku suka tinggal di kamar saya, di pagi hari anda dapat melihat matahari terbenam dari kamar anda dan juga sangat bagus dan perjalanan untuk bulan madu kami",5
62, Twin Island Villas & Dive Resort,"Setelah jalan beberapa benua di beberapa tahun terakhir itu besar untuk menemukan tempat yang sempurna jauh dari hiruk-pikuk sebagai wisatawan. sering merasa seperti tidak berjalan, staf menyambut kami seperti keluarga di sini! Mereka memiliki cara Prashanti untuk memastikan makanan kami yang memuaskan dan sangat membantu dengan informasi tentang daerah dan berjalan-jalan di sekitar. Pemandangan yang menakjubkan, jadi kami tidak ingin pergi ke tempat lain! 3 hari di sini di kamar kami sangat diperlukan istirahat dan kami berencana untuk kembali lagi pada bulan maret untuk masa tinggal lebih lama dan melihat lebih banyak wilayah. Terima kasih kepada awak di vila juga untuk memberikan keramahan khulki - yang langka!",5
63, Twin Island Villas & Dive Resort,"Kami memesan langsung melalui email. Melihat situs web dengan beberapa vila yang mengagumkan. Malam pertama sangat USD 110/harga khusus dan tanpa meminta tarif yang lebih baik saya percaya itu akan menjadi sebuah vila untuk bersantai. check-in sangat dibantu oleh wanita asing yang kami pikir manajer, segelas air tidak hanya untuk menyambut kita yang hanya baik-baik saja karena itu sangat panas dan membawa kami ke vila.  Pertama, membuka pintu, tampak cantik, daripada menyentuh kaki saya menjadi sangat berdebu lantai kayu kamar... pada kaki terakhir, tampaknya seperti itu tidak pernah bersih untuk 1 tahun... Tempat ini tampak baik-baik saja dengan hampir kering frangipanio di atasnya, kamar mandi adalah sangat miskin, dapat mengerti jika vila ini semakin lelah tetapi tidak benar,…",1
64, Twin Island Villas & Dive Resort,"Twin island villas adalah semua kami berharap untuk. Hotel ini terpencil, tapi itulah apa yang kami sedang mencari. Vila ini sederhana, namun dilengkapi dengan semua yang anda butuhkan. Kolam renang yang kita tidak menggunakan, tapi menikmati resor dengan pemandangan kolam renang. Terdapat warung yang sangat dekat dengan hotel yang saya akan merekomendasikan, tetapi jika anda ingin makan di luar membuat penggunaan terbaik hotel/restoran yang akan penjemputan/pengantaran saat anda sedang makan makan malam di sana dan ingin memiliki beberapa minuman tanpa memberi kami rumah dalam gelap. Lembongan kehidupan yang mudah, khususnya di twin island villas. Tombol utama lampunya tidak, pergi dan memiliki bir atau dua, bermain permainan kolam renang satu sore! Kipp (dan yang lainnya aku…",4
65, Twin Island Villas & Dive Resort,"Wisatawan yang terhormat, jika anda memutuskan untuk mengunjungi nusa lembongan anda hanya harus menginap di hotel tersebut. Ini adalah hotel besar, lokasi adalah besar, sangat sangat queit. Villa adalah besar, menarik desain, kolam renang besar, balkon, bar. Tim yang hebat bekerja di sini, benar-benar baik orang-orang yang fantastis dan mereka memiliki baik))))  jika anda akan bangun di pagi hari benar-benar awal anda dapat melihat yang paling indah matahari terbenam hidup anda.",5
66, Twin Island Villas & Dive Resort,"Kami tinggal di sini karena kami memesan hotel terbakar. Meskipun benar-benar berbeda untuk apa yang telah kami memesan... hutan pantai v, kami benar-benar menikmati kami tinggal di sini. Pemandangan penida dan ceningan adalah fantastis dan begitu nyata.  Pondok adalah dasar tapi bagus, kamar mandi dengan batu besar, dek dan kolam renang ""pribadi"". Sarapan baik, seperti makanan. Lokasi terpencil dan kelemahannya tidak secangkir teh, tapi kami memiliki mandi dan memiliki sebuah bola yang menjelajahi pulau.  Pernyataan privasi dapat ditingkatkan sedikit, yang akan membuatnya lebih menyenangkan. Secara keseluruhan itu adalah tempat yang bagus untuk tinggal jika anda tidak perlu pantai di kaki anda.",4
67, Twin Island Villas & Dive Resort,Tempat kecil ini benar-benar telah baru-baru ini telah diambil alih oleh beberapa inggris indah tentang teman-teman yang membawa tempat ini ke mantan kemuliaan itu. Mereka telah melakukan pekerjaan yang indah rinci dengan rencana untuk membuat pengalaman bahkan lebih baik.  Berharap kami telah mampu tinggal lebih lama dari. Pasti akan kembali untuk tinggal lagi. ,5
68, Twin Island Villas & Dive Resort,"Tiba dengan saya lebih baik setengah, tepat di tengah-tengah musim kemarau, tapi resor ini baik terletak di sebuah bukit, sehingga angin yang fantastis dan pemandangan luar biasa dari selat sejernih kristal yang utama antara pulau lembongan dan itu ""twin"".   Staf sangat membantu dan ramah. Fasilitas yang besar. Ini adalah benar-benar jumlah yang benar dan juga disini sobat.  Pasti... mungkin sedikit terlalu mahal... tapi aku suka seperti ini. Twin island adalah sanggraloka yang optimal bagi mereka yang ingin mereka tenang dan damai. Saya akan sangat merekomendasikan, terutama bagi pasangan yang hanya ingin mendapatkan jauh dari hiruk-pikuk panggeng. ",5
69, Twin Island Villas & Dive Resort,"Mereka menawarkan kolam renang villa dengan harga yang terjangkau. Ya, pulau twin villas adalah favorit kami akomodasi di nusa lembongan. Dari saat pertama kami menghubungi mereka, ada tarif terbaik. Resor ini akan menjemput anda dari dermaga dengan senyum, dan membawa anda ke pemandangan terbaik di pulau ini. Bersantai dan bersantai. Anda dapat menyewa sepeda motor dari hotel dan menjelajahi area ini dengan mudah. Plus ini menempatkan anda dekat dengan jembatan ke nusa ceningan. Kami akan kembali ke twin island villas. Sangat Direkomendasikan!",5
70, Twin Island Villas & Dive Resort,"Banyak pilihan yang menyediakan tempat impian ini, dari kedua anda berjalan di anda akan disambut oleh staf yang ramah dan kelompok. Hotel yang dibangun dengan elok dan memiliki segala sesuatu yang anda bisa meminta untuk-termasuk meja biliar dan bar yang tampak magis dari pemandangan paling menakjubkan. Saya minta kipp, ia belum keluar dalam setiap cara yang mungkin dari sarapan, makan siang, dan makan malam, dia memesan restoran yang mengagumkan untuk kita dan penjemputan dan antar-jemput juga termasuk! Hotel ini tenang dan terpencil! Kamar indah dan modern dengan semua yang anda butuhkan, ditambah lagi!   2 vila dengan kolam renang pribadi dan besar. Sinar matahari jatuh tepat di atas anda seperti yang anda inginkan! Di villa ini juga menampilkan 3rd dan semua vila memiliki…",5
71, Twin Island Villas & Dive Resort,"Pacar saya dan saya telah senang menghabiskan tiga hari di twin island villas masa lalu ini mungkin. Pulau itu berada di perbukitan di nusa lembongan. Pemandangan luar biasa tidak hanya kamar, tetapi dari sisa villa membuat setiap pagi mereka benar-benar menakjubkan. Kamar-kamarnya luas dan mewah, staf di lokasi ini adalah penuh perhatian dan ramah, dan makanan adalah layanan laundry yang tersedia untuk biaya yang kecil. Manajer membungkuk ke belakang untuk memastikan bahwa kami telah memadai untuk transportasi dan di sekeliling pulau, dan membuat keseluruhan pengalaman yang lengkap. Kita tidak bisa berterima kasih staf cukup permata ini dari sebuah hotel, dan melihat ke depan untuk kembali ke twin island villas di masa mendatang!",5
72, Twin Island Villas & Dive Resort,"Kami punya kamar twin sangat memuaskan menginap di pulau villa. Kami tinggal di rumah mengganti kamar, dengan satu tempat tidur queen dan satu tempat tidur tambahan yang kita diminta untuk kami 9 tahun putri berusia. Hotel ini di sisi lain (timur) sisi pulau, yang lebih jauh dari resor dan restoran ""downtown"", tetapi kami benar-benar menikmati keheningan dan pemandangan nusa ceningan dikendurkannya, mengingat bagaimana kecil pulau ini, bepergian dari satu tempat ke yang lain adalah tidak terlalu jauh. Jalan-jalan kasar, tetapi begitu berharga perjalanan. Mungkin harga di mini kolam renang dekat kamar kami. Mereka membuat reservasi untuk kita (tempat makan, taksi pick-up dan drop off), semuanya jadi mudah. Jika anda mencari tempat menginap yang tenang dan menenangkan, dengan…",5
73, Twin Island Villas & Dive Resort,"Jika anda pernah menemukan diri di nusa lembongan pastikan anda meluangkan waktu untuk menginap di twin island villas. Saya hanya menyesal adalah bahwa kita tidak bisa tinggal di sini lagi!  Tersembunyi di perbukitan di nusa lembongan kami menemukan surga kecil ini - hotel ini memiliki semua yang anda bisa butuhkan dan banyak lagi!  Kami tinggal di ""shack cinta"" & tidak bisa lebih bahagia dengan akomodasi yang telah - pemandangan menakjubkan, tempat tidur yang nyaman, super bersih, kolam renang pribadi & shower yang menakjubkan... Aku akan dengan senang hati pindah secara permanen. Walau akomodasi/fasilitas itu mengagumkan, hal yang benar-benar membuat pengalaman menginap kami tak terlupakan adalah staf yang luar biasa.  Awak pergi di atas dan melampaui setiap hari & aku tidak…",5
74, Twin Island Villas & Dive Resort,"Kami menghabiskan 4 malam di sini di bulan juli. Dengan kudakan di goyang sedikit truk membawa anda ke lokasi relatif terpencil, yang memberikan pemandangan indah sekitarnya nusa Cenengan. Kami punya vila dengan kolam renang kecil. Beberapa pohon telah menggunting yang berarti itu bukan sebagai pribadi sebagai diharapkan, kami berdiri menjulang di area resepsionis dan sekitarnya benar-benar indah. Pemandangannya yang menakjubkan. Persewaan skuter wajib untuk menjelajahi pulau dan kita mengambil keuntungan penuh. Sarapan adalah benar-benar mahal untuk apa yang kita alami di tempat lain, akhirnya kami membayar sarapan lengkap setiap pagi di warung di seberang jalan (yang juga menyediakan hotel sarapan!). Kami makan beberapa makanan di warung yang bagus. Manajer dan staf sangat…",4
75, Twin Island Villas & Dive Resort,"Suami saya dan saya beruntung untuk tersandung di permata kecil ini secara online. Ketika anda pertama kali tiba anda tidak dapat melihat apa-apa tapi sedikit agak kemudian mengarah ke taman tempat peristirahatan! Atap jerami tradisional dan balkon kecil tampak ke pemandangan paling luar biasa di muara (? sungai kecil di sekitar pulau). Warna menakjubkan. P dan darren host menyambut kami dan melihat mempergunjing pulau dan memberikan perasaan yang sangat nyaman yang benar dari awal. Kamar nyaman dan memiliki segala sesuatu yang anda inginkan. Di kamar mandi, benar-benar luar biasa! Paduan view ini, kamar, layanan dan makanan di pulau tropis bar ideallic!  Berada di seberang pulau ini cocok kita dengan sempurna, tempat itu tenang tapi masih memiliki akses ke beberapa makanan,…",5
76, Twin Island Villas & Dive Resort,"Cari yang luar biasa jauh dari gila sibuk dan berisik. Vila ini bersih dan indah dilengkapi dengan perabotan bergaya bali dengan tempat tidur nyaman dan bantal. Membuka pintu-pintu dan jendela-jendela besar yang memungkinkan banyak pemandangan pantai dan laut untuk angin segar udara. Udara con besar jika diperlukan dan lemari es untuk menjaga hal-hal yang benar-benar benar-benar indah. Staf lokal dan barat yang menakjubkan dan membantu semua kebutuhan anda dari luar dan sepeda perjalanan di sekitar pulau. Untuk tamu bisnis disediakan pukta padi scuba diving dan benar-benar unik pengalaman bawah laut dengan menyelam yang tak tertandingi. Dekat dengan desa setempat menyediakan makanan besar dengan harga yang bagus, staf dan lokasi yang benar-benar membuat ini tempat harta itu.…",5
