,hotel,review,stars
0, Twin Island Villas & Dive Resort,"Itu terlalu pendek, hanya waktu 1 malam, tapi waktu berikutnya saya tahu bahwa saya harus tinggal lebih lama! Kamar sangat bagus dengan ketenangan yang diperlukan. Staf adalah sangat baik dan membantu dan ditambah. Saya memiliki kesempatan untuk bisa diundang untuk BBQ. Benar-benar menghargai Layanan dan hangat menyambut perasaan. Akan melihat Anda lagi!",5
1, Twin Island Villas & Dive Resort,"Kami memilih hotel ini sebagian karena itu adalah anak gratis, tetapi juga untuk pemandangan yang menakjubkan yang kami lihat di foto. Kami tidak kecewa karena ada pemandangan luar biasa di manapun Anda menemukan diri Anda berdiri.   Saat check in, dengan minuman selamat datang yang nikmat, kami ditunjukkan ke kamar kami yang menghadap ke kolam renang saluran dan Ceningan, itu benar-benar merasa seperti Anda sendirian di Surga Kecil Anda sendiri karena anda tidak menghadap ke mana saja.   Saya tidak bisa kesalahan apa pun staf di semua aspek, staf lokal sangat ramah dan manajer (KIPP & Sarah) benar-benar menempatkan diri mereka untuk membuat semua orang tetap sempurna, dari mengatur untuk memanggil restoran setempat untuk pemesanan tempat untuk makan malam untuk menawarkan saran…",4
2, Twin Island Villas & Dive Resort,"Ini adalah pertama kami perjalanan ke Nusa Lembongan dan kami ingin menghabiskan uang di kamar pribadi yang indah dan kolam renang kecil untuk bulan madu kami.  Kamar baik dan nyaman, kamar mandi besar dengan air panas. Pandangan benar-benar menakjubkan Ceningan saluran!   Staf yang sangat membantu dalam mengatur petualangan untuk kami, makan malam reservasi, skuter, dan tips bermanfaat! Para wanita di dapur membuat makanan ringan yang lezat dan sarapan yang luar biasa.   Hal yang harus Anda ketahui sebelum pemesanan:  Villa ini terletak di atas bukit, 15 menit naik skuter yang untuk sebagian besar restoran dan pantai.   Kami benar-benar menyukainya dan tidak bisa menunggu untuk kembali!",5
3, Twin Island Villas & Dive Resort,Resor ini adalah bukan apa yang saya harapkan! Hotel ini diiklankan sebagai sesuatu yang tidak. Saya tinggal di sini dengan suami saya dan layanan sangat buruk. Keselamatan adalah masalah bagi kami karena itu saya tidak akan merekomendasikan tinggal di sini terutama jika Anda memiliki anak-anak. Tidak heran jika sarapan termasuk karena itu hanya mengerikan.,1
4, Twin Island Villas & Dive Resort,"Terselip di sisi tenang pulau dengan pemandangan yang sangat indah dari chennigan dan Penida saluran kecil ini benar-benar sesuatu yang istimewa Dive Resort. Terletak di sisi bukit di atas beberapa tingkatan ini menyediakan suasana sempurna untuk menyelam dan tersembunyi.  Staf yang indah, dan tamannya sempurna dijalankan oleh instruktur Menyelam yang Baik bepergian memiliki menyelam di seluruh dunia.  Terima kasih lagi untuk keramahan Anda hangat dan ramah.  Phil dan Jules.",5
5, Twin Island Villas & Dive Resort,"Kami tinggal di Pulau Kembar di juli 2016 dan saya menulis ulasan ini tahun karena kami hanya melihat meskipun foto-foto kami dari liburan kami di Bali. Kami pergi ke beberapa tempat di Bali dan Lembongan adalah favorit kami dan itu sebagian karena untuk Pulau Kembar.  Kami ingin akomodasi yang memberi kami sebuah tempat pengasingan mewah tapi dengan akses yang mudah ke objek wisata dan kegiatan. Kami tidak kecewa. Akomodasi yang indah, sedikit kecil dari pondok, sebuah bar kecil, sarapan disajikan ke pondok kami untuk makan di balkon dan tuan rumah yang ramah. Kami menyukai lokasi tenang, sangat santai! Anda akan membutuhkan sebuah skuter untuk berkeliling, tetapi dalam semua kejujuran ini adalah satu-satunya cara untuk mendapatkan sekitar Pulau juga, jadi jika Anda ingin…",5
6, Twin Island Villas & Dive Resort,"Saat ini saya sedang melakukan perjalanan Asia tenggara dengan setengah lainnya pada sedikit lebih dari anggaran tali sepatu, jadi tempat ini memenuhi syarat sebagai tempat mewah, tapi itu adalah lebih dari layak. Sebelum tiba KIPP dan Sarah (pemilik) sangat sempurna dengan telepon dan email korespondensi menjadi sebagai membantu karena mereka dapat, yang membuat segalanya lebih mudah di dunia, dan menciptakan lebih banyak merasa pribadi. Bungalo itu sendiri adalah segala sesuatu yang Anda inginkan dan lebih, dengan mini lengkap - bar dengan udara - aC yang hampir terlalu bagus. Kecelakaan kecil yang terjadi selama kami tinggal di pulau (tidak ada hubungannya dengan Pulau Kembar meskipun) dan Sarah membantu kami jumlah yang luar biasa. Dapur yang sangat bagus, bagus dan bersih,…",5
7, Twin Island Villas & Dive Resort,"Saudara perempuan saya dan saya tinggal di Twin Island Villas untuk akhir pekan. Kami memiliki waktu yang menakjubkan dan pasti akan datang kembali ke tempat ini! Staf yang sangat ramah, kamar yang bersih dan luas dengan kasur yang bagus, masalah Anda sendiri tangki air, kamar mandi yang indah dengan mandi dan mandi dan pemandangan di Nusa Ceningan. Sarapan yang dilayani setelah permintaan, tepat di depan kamar Anda sendiri. Kolam renang yang akan memberikan anda benar 'di tengah hutan' merasa. Mereka memiliki hanya mulai yang kecil (Seperti Seharusnya) menu makanan ringan; lumpia atau yang menyediakan sate untuk menemani bintang.   Kami pergi menyelam dengan toko menyelam terletak di Villa; Twin Island Dive. Mereka memang lebih dari semua pengalaman saya sebelumnya; sangat…",5
8, Twin Island Villas & Dive Resort,"Pacar saya dan saya baru-baru ini tinggal di Twin Island Villas di mana kami memiliki tidak kurang dari luar biasa. Hotel ini terletak di Pulau Lembongan, namun terlihat dari jembatan kuning dan Nusa Ceningan, yang berarti Anda memiliki akses yang mudah untuk menjelajahi pulau seperti yang Anda masukkan.   Ini harus mengatakan bahwa keduanya sangat cocok untuk menjelajahi pulau dengan skuter, jadi jika Anda tidak menjadi naik skuter supir atau tidak ingin membayar seseorang untuk membawa Anda di sekitar satu, kemudian tidak Lembongan Ceningan adalah destinasi tidak untuk Anda. Tempat yang paling indah dan mereka biasanya dapat diakses oleh berantakan, jalan - inilah keindahan alam ini sebagian besar belum tersentuh. Twin Island Villas adalah tidak berbeda. Anda akan pergi ke…",5
9, Twin Island Villas & Dive Resort,"Saya di Nusa Lembongan di perjalanan liburan minggu lalu dengan pacar saya selama empat hari. Saya berharap saya punya lebih banyak waktu menikmati surga ini. Kamar kami tinggal menghadap ke pemandangan indah di Lembongan dan Kepulauan Ceningan. Kami juga memiliki balkon yang fantastis di mana kami memiliki pilihan sarapan setiap pagi yang beberapa langkah dari kolam renang, ramah layanan disampaikan dengan khas pulau.  Keramahan adalah di atas harapan kami dan membuat kami merasa sangat aman dan percaya diri untuk mengeksplorasi lingkungan.  Saya tidak sabar untuk kembali!  PS: . Mereka memiliki toko menyelam yang fantastis dengan Villa, mereka adalah lebih dari dan di luar semua pengalaman saya sebelumnya dengan berbagai toko-toko menyelam di seluruh dunia.",5
10, Twin Island Villas & Dive Resort,"Sebelum memesan villa ini, sebenarnya saya tahu Villa ini jauh dari wilayah utama. Tetapi ketika saya membaca rekomendasi di TripAdvisor. Saya hanya ingin telah mencoba villa ini.   Untungnya, staf, ayu, antusias menyambut kami. Dia membantu kita untuk mengatur kamar dan sarapan. Ia juga membantu kami menemukan sopir, membawa kami di sekitar Lembongan. Dia adalah gadis yang ceria dan menyenangkan, yang membuat perjalanan kami lebih lucu.   Kami memesan Villa di atas pohon. Bali tidak sangat besar tapi itu sudah cukup untuk tiga orang. Kamar dengan melihat pemandangan Ceningan. Akan sangat bagus jika Anda duduk di depan pemandangan untuk menikmati sarapan. Dan jangan lewatkan menarik kolam renang!   Saya memesan villa dan melalui Agoda dengan tempat tidur tambahan. Sayangnya,…",4
11, Twin Island Villas & Dive Resort,"Resor ini tidak hidup sampai dengan harapan ini. Teman saya dan saya selalu memiliki masalah dengan tidak ada solusi yang disediakan.   Ketika kami pertama kali tiba pemilik sangat menyenangkan, mereka menunjukkan kepada kita peta pulau dengan menawarkan kami minuman gratis yang kami percaya, tapi saat kami check out kami dikenakan biaya tidak terduga untuk minuman.   Sebagian besar kamar kami yang bersih tapi besar jendela yang terbuka di kamar mandi, ini membuat kami tidak nyaman karena bisa berbahaya di malam hari. Kamar adalah cukup besar untuk orang dewasa untuk masuk dengan mudah dan nyaman. Saat ini masalah beli dengan pemilik mereka bermain ini seperti itu bukan masalah besar. Jika ada dekat dengan keamanan atau staf yang menghabiskan malam kami akan mengerti tetapi oleh…",1
12, Twin Island Villas & Dive Resort,"Suami saya dan saya yang sangat kecewa ketika kami tinggal di sini di Mei. Kami seharusnya menginap tiga malam tapi setelah malam pertama kami tidak bisa tinggal lebih lama dan kami sangat senang untuk meninggalkan pagi berikutnya.   Satu-satunya hal yang bagus tentang tempat ini adalah manajer. Kami disambut hangat dan ditampilkan adalah segala sesuatu yang ada di peta. Ini adalah pertama kalinya saya di sini di Nusa Lembongan jadi itu sangat membantu.   Namun setelah kami mendapat ke bungalo kami hal pertama yang kita lihat adalah lubang di kamar mandi, dengan hanya seprai dan menutupi ini. Ini sangat aman dan di malam hari sangat laku seperti itu di lantai dasar dan dapat dengan mudah diakses dari jalan raya. Kami tidak membiarkan Manajer tahu tetapi tidak ada yang dilakukan…",1
13, Twin Island Villas & Dive Resort,"Jika Anda ingin mendapatkan jauh dari keramaian, dan menikmati yang tenang/tenang ini adalah tempat yang tepat! Kami tinggal di 2 berbeda kamar (menghadap ke kolam renang yang langsung dan bungalow cinta) karena itenarary berubah, tapi kedua KIPP Sara dan melakukan yang terbaik untuk mengakomodasi kami. Lokasi tidak dapat mengalahkan dan pemandangan jembatan Ceningan (kuning). Seluruh staf adalah luar biasa dan pergi di atas harapan untuk menyenangkan Anda. Saya hanya ketukan itu AC di bungalow cinta tidak kuat, dan dapat menurunkan Anda di bocor. Selain itu, toilet en Suite di bungalow adalah turun dan memiliki kesenjangan yang besar di belakang langkah. Istri saya adalah sedikit terkejut karena mungkin makhluk merangkak melalui. Tapi ini kecil dibandingkan dengan keseluruhan…",4
14, Twin Island Villas & Dive Resort,"Jika Anda mencari tempat pelarian yang sempurna dari dunia ini adalah itu. Kami sudah pernah ke Lembongan 3 kali sebelum dan tidak ada yang kami pernah tinggal di bahkan datang dekat dengan ini sedikit permata tersembunyi.  Lokasi adalah segalanya!  Pemandangan dari kamar kami adalah napas mengambil pemandangan dari kolam renang indah terpelihara ini cukup sulit untuk menemukan satu yang buruk di Pulau Kembar.  Staf luar biasa tidur & Sarah mengaitkan kami dengan beberapa tips menjaga dalam pikiran kami telah ke pulau beberapa kali dan tidak tertarik pada ""normal"" pergi untuk itu.  Tips bagi yang baru melihat kami menikmati tempat dan menghindari orang banyak seperti kami menyukai liburan.  Sarapan adalah besar dan mereka juga memiliki bar kecil yang lucu di situs juga.  Saya…",5
15, Twin Island Villas & Dive Resort,"Kim dan saya kembali dari 5 malam menginap di villa puncak pohon. tempat tidur yang sangat nyaman, bantal dan membuka jendela dapat dibuka menawarkan luar biasa mudah di mana Ac bahkan tidak diperlukan. Berharap untuk sarapan di villa. Sarah di meja resepsionis yang sangat ramah. Saya tidak akan tinggal di tempat lain di pulau. bagus dan tenang dan jauh dari keramaian. Menyewa sepeda dari Villa dan bersikap kedua pulau tersebut. terima kasih lagi untuk waktu santai.",5
16, Twin Island Villas & Dive Resort,"Saya menghabiskan 6 malam di Twin Island Villas dan memiliki waktu yang paling luar biasa. Staf & manajemen yang sangat ramah & membantu, kamar yang bersih, tempat tidur adalah sangat nyaman dan pemandangan dari villa saya adalah menakjubkan. Saya menyukai fakta bahwa itu adalah terpencil dan sangat damai dan jauh seperti itu adalah apa yang saya adalah setelah. Banyak tempat di pulau yang menawarkan gratis mengambil & drop off dan untuk menyewa skuter adalah lebih terjangkau dan staf itu sangat membantu dan memberi saya Tips ke mana harus pergi dan apa yang harus dilakukan. Pasti akan kembali lagi!",5
17, Twin Island Villas & Dive Resort,"Kami menghabiskan beberapa hari di Twin Island Villas. hotel ini tenang dan tempat yang indah dengan orang-orang yang indah dan layanan yang luar biasa. Semua kamar yang indah dilengkapi dengan pemandangan yang indah ke teluk dan Nusa Cenningan. Pusat menyelam yang berafiliasi yang terorganisir dengan baik dan dilengkapi dan kami memiliki beberapa menyelam besar dengan mereka. Tim adalah luar biasa di Layanan dan didukung dengan semua masalah kami (kehilangan bagasi, sewa sepeda). Terima kasih banyak untuk semua dan kami akan kembali setiap saat.",5
18, Twin Island Villas & Dive Resort,"Kami awalnya memesan 4 malam, setelah kami tiba ada kami menginap 3 malam lebih untuk mendapatkan sertifikasi Open Water menyelam di. Indah villa yang terletak di lereng bukit tenang yang menghadap ke kanal dengan angin yang bagus, banyak burung dan cukup senang dengan dedaunan. Ada kolam renang yang cantik dan dapur di hotel yang menawarkan sarapan gratis dan makanan ringan yang lezat - kami menyukai Spring Rolls! Villa kami memiliki balkon besar di mana kami menikmati kopi di pagi hari dan sarapan dan kemudian bersantai di malam hari. Semua staf yang luar biasa - sangat hangat dan ramah, membuat kami merasa seperti di rumah. P dan Darren mengatur transportasi kami dari hotel kami di Bali untuk feri ke Lembongan kemudian Twin Villa, sehingga sangat mudah! Setelah kami tiba,…",5
19, Twin Island Villas & Dive Resort,"Dua pulau ini surga yang nyata dan sekolah menyelam adalah luar biasa! Tim yang luar biasa dan sangat ramah. Kamar indah, tempat tidur yang sangat nyaman dan kolam renang adalah Surga dengan Pemandangan.  Dan mereka ramah lingkungan - ramah! Saya sangat menyukai Plastik - kebijakan gratis (mereka tidak membeli atau menjual botol minuman ringan di mountain resort dan menyediakan air panas gratis di setiap kamar! ).  Tempat ini sangat menyenangkan! :)",5
20, Twin Island Villas & Dive Resort,"Hotel ini fantastis dengan lingkungan yang damai dan tenang dengan pemandangan yang hanya lima menit perjalanan dari kota skuter harganya layak. Lokasi dan hotel yang cukup indah dan menakjubkan dan staf yang hangat, ramah dan ramah, memberikan saran dan bantuan yang tulus dengan segala sesuatu yang mereka bisa, bahkan mengatur transportasi atau menyewa skuter jika Anda membutuhkan. Sarapan dibawa ke kamar Anda, dengan pemandangan yang indah, profesional menyelam dan snorkeling perjalanan yang direncanakan untuk Anda jika diinginkan dan harga yang besar untuk mewah dan sangat bersih. Saya akan tinggal di sini banyak kali dan saya benar-benar sedih untuk meninggalkan tempat ini dan pasti akan berkunjung lagi! Cantik! ",5
21, Twin Island Villas & Dive Resort,"jadi tahun lalu saya dan saudara saya memutuskan untuk memesan liburan menit terakhir. Kami tidak tahu di mana kami akan, kami hanya tahu kami akan pergi ke suatu tempat dan harus terdiri dari matahari, pantai, snorkeling!   Setelah datang di Villa Kembar secara online dan berurusan dengan P langsung di email. Saya tahu bahwa ini adalah tempat di mana kita menuju ke.  Kami tinggal di Bali daratan yang merupakan pengalaman kami tapi itu tidak ada definisi dari ""liburan"" untuk kami.   Saya sangat senang bahwa kami memperpanjang kami tinggal di Villa Kembar karena ini adalah persis apa yang kami visioned! Kami tinggal di villa dengan kolam renang pribadi, meskipun area kolam renang utama yang cukup dan tidak banyak orang di sekitar untuk mengganggu Anda.   Tempat Tidur Villa…",4
22, Twin Island Villas & Dive Resort,"saya bepergian dengan istri saya dan 1 tahun putra Nusa Lemborgan. Menurut pendapat saya ini adalah pengalaman yang luar biasa yang disorot dalam perjalanan kami. Saya ingin mendapatkan lingkungan yang lebih tenang di mana saya bisa menikmati resor.   Pengalaman saya adalah tidak pendek dari luar biasa! Kami memiliki pengalaman yang luar biasa kamar yang luas dengan jendela pada 3 sisi dan balkon yang menghadap ke kolam renang dan persamaan antara lain Selat Nusa di kepulauan. Kamar mandi adalah di seberang jalan yang adalah 0.5 meter yang sebagian terbuka tapi sangat luas dengan permukaan granit dan tetap memiliki sentuhan. Selama seluruh waktu, kami merasa seperti kami bisa menjadi satu-satunya orang di resor ini sangat kecil dan memiliki 5 kamar saat ini walaupun ada…",5
23, Twin Island Villas & Dive Resort,"Kami adalah pasangan muda.  Menikmati suasana indah dan pemandangan yang menakjubkan.  Kami tinggal di Gubuk Cinta dan ini adalah sempurna. Kamar mandi adalah luar biasa dan semua linen berbau seperti mutlak surga. Saya terus berbau handuk ketika kami sampai di sana.  Hotel ini memiliki pribadi merasa dengan keseimbangan yang tepat dari cruisy, staf yang ramah.  Kolam renang adalah indah dan bersih.  Kami berkendara motor kita sendiri dan itu sempurna. Kami menikmati pergi untuk menjelajahi kita sendiri dan hotel mengatakan bahwa mereka dapat mengatur semua aktivitas yang kami sukai tapi tidak ada tekanan.  sangat menyedihkan untuk meninggalkan keesokan harinya. Terima kasih.",5
24, Twin Island Villas & Dive Resort,"Di mana untuk memulai?   Pro  - Staf sangat ramah, kami disambut dengan senyum dan banyak informasi tentang daerah dan layanan antar jemput, kegiatan dll.   - Pemandangan adalah napas mengambil  - Kamar dibersihkan setiap hari, tempat tidur yang dibuat dll  - AC di kamar sangat dingin atau sangat hangat akan bagaimana pernah anda seperti ini  - Jenis vegetasi alami alam menyediakan AC, itu tampak dingin di sini daripada di bagian lain dari Pulau  - Staf membantu kami dalam mendapatkan perahu kembali ke Bali dan transportasi ke bandara  Con  - Kami berada di bawah keluarga, dari apa yang terdengar seperti gajah. Sekarang yang tidak begitu buruk. Tetapi papan lantai kayu yang memungkinkan setiap suara bergema melalui ke kamar kami. Tidak sampai pagi aku menyadari bahwa suara…",2
25, Twin Island Villas & Dive Resort,"Kami telah tinggal beberapa kali di Nusa Lembongan dan kembali karena kita mencintai pulau dan orang-orang.  Kali ini kami merasa adalah yang terbaik Kunjungi belum.  Twin Island Villas memiliki begitu banyak untuk menawarkan. Segala yang kami butuhkan.  Staf yang ramah dan membuat kami merasa Selamat datang. Bahkan beberapa lelucon yang dibagi oleh Darren. Kamar yang bersih dengan pemandangan luar biasa ke arah ke cabang pulau Cennigan dan Nusa Penida. Matahari terbenam yang indah.  Sarapan yang menyenangkan untuk memulai hari petualangan baik menyelam, snorkeling atau menjelajahi pulau.  Anda dapat memesan untuk pergi menyelam atau snorkeling di sekitar pulau/megah untuk melihat ikan pari dan banyak kehidupan laut. Jika Anda pergi instruktur menyelam Anda banyak pengalaman dan…",4
26, Twin Island Villas & Dive Resort,menyukai segala sesuatu di tempat ini dan menyukai seorang gadis cantik yang bernama ayux :)  Dan tidak ada dari apa yang saya katakan akan cukup untuk menggambarkan kecintaan saya ke tempat ini.  Staf yang sangat ramah. Kamar saya memiliki pemandangan yang luar biasa.  Semoga di lain waktu dan menemukan kamar mandi toilet duduk :),5
27, Twin Island Villas & Dive Resort,"Apa tempat yang luar biasa! Pemandangan yang luar biasa dari Ceningan dan hutan bakau, serta hanya berjarak beberapa menit dengan skuter untuk sampai ke mana pun di Lembongan. Sarapan diantarkan ke kamar setiap pagi (di saat Anda memilih) adalah sentuhan yang bagus, dan pemandangan dari kamar mandi; ) Darren dan P sangat menakjubkan host! Mereka merasa seperti teman-teman lama :)",5
28, Twin Island Villas & Dive Resort,"Ini perjalanan kedua saya keluar pulau surga yang indah dan indah pulau Kembar. Saya sangat senang untuk melihat bahwa sejak saya terakhir mengunjungi Jalan ini biasa! Hal ini membuat pergi ke dan dari resor jauh lebih mudah.   Sekali lagi ruangan itu sempurna, staf hangat dan ramah dan bir es dingin. Darren dan P pergi keluar dari jalan mereka untuk membuat saya merasa diterima. Saya berharap untuk datang kembali lagi segera!",5
29, Twin Island Villas & Dive Resort,"Kami memiliki hanya tiba di rumah setelah 2 minggu kami menginap di bali... menghabiskan 4 malam terakhir kami di lembongan. Awalnya hanya berencana menghabiskan 2 malam, setelah tiba kami memutuskan untuk tinggal sampai kami terbang kembali ke australia setelah 4 malam.   Sayangnya kami tidak menginap di twin island villas tapi kami cukup beruntung untuk tersandung ketika mencari sebuah pusat menyelam padi. Menjelajahi area di motor kami yakin kami tersesat... tapi tidak bisa lebih bahagia ketika kita melihat bendera padi.   Kami awalnya memesan 2 hari menyelam dengan tim, tapi setelah menyelam pertama kami membuat keputusan untuk menjejalkan sebagai banyak menyelam sebanyak mungkin di... setelah 6 kali penyelaman dengan darren, tidur & p, kami merasa seperti kami memiliki tim…",5
30, Twin Island Villas & Dive Resort,"Teman saya dan saya tinggal di Twin Island Villas untuk 4 hari di akhir bulan September dan menyelam dengan mereka selama 2. Ketika kami pertama kali tiba di Nusa Lembongan, semua taksi kami mengatakan 'ah twin, satu dengan pemandangan' jadi terdengar sangat menjanjikan dan ketika kami tiba saya benar-benar terpesona dengan pemandangan. Infinity kolam adalah luar biasa, dan kami tinggal di kamar 1 yang memiliki pemandangan indah dari kamar pantai Nusa Cenigan, kamar mandi dan balkon. Kami tidak bisa telah diperlakukan lebih baik, staf super ramah dan pergi semua keluar untuk memastikan kami memiliki waktu yang baik. Kami menyewa skuter dari mereka selama 2 hari yang adalah cara yang bagus untuk mendapatkan di sekitar pulau dan mereka membuat rekomendasi terbaik untuk tempat…",5
31, Twin Island Villas & Dive Resort,"Ketika kami pertama kali tiba di pulau kembar kami pikir kami berada di tempat yang baik, satu mil jauh dari segala sesuatu. Tapi itu adalah sebuah petualangan. Tetap harus ada, mereka sangat menyenangkan dan memberikan anda lebih banyak kebebasan.  Pemandangan yang luar biasa dan sarapan yang luar biasa. Staf yang sangat ramah dan membantu. Kami sangat menyukai pulau kembar kami memutuskan untuk tinggal beberapa tambahan malam. Sangat direkomendasikan! Terima kasih untuk waktu yang luar biasa dan perjalanan yang santai.",5
32, Twin Island Villas & Dive Resort,Tempat yang indah di atas bukit tapi mimpi buruk untuk mendapatkan naik dan turun jika anda tidak digunakan untuk berkendara di jalan yang benar-benar buruk  Saya harapkan baik jika jalan yang buruk tapi ini adalah sedikit konyol. Titik dari hari adalah kembali ke kamar dan menikmati pemandangan.,4
33, Twin Island Villas & Dive Resort,"Sekarang, biarkan saya mengatakan pertama bahwa opini saya didasarkan pada harapan yang datang dengan harga 88 euro per malam untuk kamar kami - yang standar eropa...  Pada pandangan pertama tempat ini adalah surga - pemandangan ke jembatan kuning ke nusa Cinigan, subur hijau dll - ini adalah hal yang tidak dapat anda lihat pada pandangan pertama yang membuat tempat ini tidak begitu bagus dan kemudian beberapa.  Tidak begitu baik: - ada situs bangunan besar di sekitar hotel dengan palu, penggergajian listrik, penyamarataan, dan sebagainya. Hampir menit tenang sepanjang hari. Staf ditawarkan untuk pergi yang berbicara sangat dari itu terlalu berisik, tapi pada dasarnya itu akan berarti bagi mereka untuk menghentikan semuanya - ada banyak hal-hal kecil yang hilang di kamar - tv…",2
34, Twin Island Villas & Dive Resort,Di twin island villas menyatakan suka - kolam renang yang sangat bagus dan memiliki sebuah bar untuk duduk dan bersantai. Pasti akan merekomendasikan untuk tinggal di sini! Satu hal yang perlu diperhatikan adalah lokasi adalah sedikit terpencil - tapi yang benar-benar santai dan lokasi yang indah. Tempat yang bagus untuk makan di seberang hotel - layak dikunjungi! ,5
35, Twin Island Villas & Dive Resort,"Benar-benar hotel yang indah di lokasi yang indah! Itu adalah di sisi yang lebih tenang dari pulau, sehingga anda perlu untuk mendapatkan di lift ketika anda tiba dengan feri. Kami punya kamar yang sangat bagus dengan pemandangan indah & dekat kolam renang. sarapan sangat bagus yang disajikan ke kamar anda setiap hari. Staf yang sangat ramah & membantu. Hanya kekurangannya adalah bahwa itu agak jauh lebih ramai dari pulau, tapi bagus jika anda ingin santai liburan. Itu cukup mudah untuk menyewa skuter jika anda. Pasti akan merekomendasikan.",4
36, Twin Island Villas & Dive Resort,"Kami tinggal untuk ulang tahun pernikahan kami 20th di tree top yang sangat kecil dan panas dengan sangat curam tangga yang anda harus memanjat ke atas toilet di malam hari karena anda tidak bisa bergerak itu begitu kecil. Mereka sedang membangun baru villa di waktu jadi kebisingan di pagi hari dari 7 ke 8 di malam hari. Ada tidak ada privasi karena di mana pun anda melihat orang berjalan dan staf. Kami akhirnya memotong kami tinggal 5 malam hari 2 karena kita tidak bisa berdiri tempat ini lagi. Manajer sangat bagus tapi pemilik yang tidak bisa peduli kurang kami tentang kami karena yang sangat dalam kerangka waktu. Selain itu tempat ini untuk terisolasi, perjalanan yang mengerikan untuk sampai ke sana. Satu hal, restoran terbaik di pulau sebelah. Oh, dan ketika saya menulis…",1
