,hotel,review,stars
77, Twin Island Villas & Dive Resort,"Tidak bisa memilih tempat yang lebih baik untuk tinggal! Terima kasih banyak untuk Prashanti, darren dan kip untuk membuat kami tinggal begitu menyenangkan. Twin island villas adalah jauh dari strip utama, sehingga anda dapat mengharapkan di lembongan iolos yang tenang dengan pemandangan yang indah. Hotel ini tentang 15mins dari pantai utama, beberapa pusat utama (semua jalan-jalan di pulau bertonjol) yang iklan untuk petualangan. Kamar yang besar, sangat nyaman dengan air minum, kulkas, teh dan kopi di kamar. Segala sesuatu yang bersih dan tempat tidur yang sangat nyaman. Kamar-kamarnya memiliki jendela besar sehingga anda bisa mendapatkan angin laut yang baik sementara anda tidur.   Staf sangat ramah dan membantu kami dengan segala sesuatu. Gratis sepeda untuk kami tinggal.…",5
78, Twin Island Villas & Dive Resort,"Tempat ini merupakan tambahan. Mereka memiliki indah vila pribadi yang dengan kolam renang. Anda menghadap ke laut nusa lembongan dan nusa ceningan antara, pemandangannya menakjubkan. Ini adalah tempat yang ideal untuk liburan yang tenang, bersantai dan menikmati. Ada staf yang ramah untuk membantu setiap kebutuhan anda. Sarapan disertakan dan restoran dekat untuk makanan lain. Menyelam adalah harus dengan new mencempung itu telah mengatur di sini. Saya sangat merekomendasikan resor ini dan akan kembali.",5
79, Twin Island Villas & Dive Resort,"Segera setelah anda berjalan menuruni tangga anda perlahan-lahan memasuki surga kecil ini dengan pemandangan menakjubkan. Setiap kabin memiliki sendiri kolam renang yang romantis dan nyaman. Interior hotel adalah campuran gaya tradisional dan barat. sangat rapi dan bersih. Staf adalah indah, ramah dan sangat membantu. Staf benar-benar Kipp adalah yang dapat memberitahu anda semua tentang kita yang baru dibangun. Belum lagi Darran di paling indah yang kita di tempat menyelam di kawasan ini. P dan sarah adalah makanan terbaik untuk makanan yang baik, dan ikan terbaik salats cevichenya (hidangan laut dengan mengapuri dan cabai). Seluruh tempat telah membuat masa menginap kami sangat istimewa, hanya seperti sebuah dongeng.",5
80, Twin Island Villas & Dive Resort,"Kami memiliki waktu yang besar seperti itu perjalanan ke nusa lembongan dan mengunjungi twin island villas. Tuan rumah dan staf yang luar biasa dan hanya akan pergi keluar dari jalan mereka untuk membuat anda tetap satu yang menyenangkan.  Kami dibawa di lokasi menyelam di area dekat lembongan sasionil. Hotel ini sangat indah dan baik kecil dan karang serta sesinting makhluk air besar. Hari itu diakhiri dengan lokasi-di barbeque di taman beton yang baru membangun bbq - Daya bergaya afrika. Anda akan tahu apa yang kita maksud dengan itu setelah manejernya Kipp mulai dari bbq di rahasia. Ini adalah sanggraloka kecil dengan hanya beberapa vila, yang dalam pengalaman kami, memberi kami lebih banyak rasa keramahan dan dirawat. Nikmati!",5
81, Twin Island Villas & Dive Resort,"Aku tinggal di sini dengan keluarga saya dan kami semua mencintai liburan kami. Stafnya mengagumkan - hampir seperti keluarga, mereka selalu bahagia untuk menyarankan hal yang harus dilakukan dan tempat-tempat untuk pergi. Villa ini benar-benar keren dan sangat nyaman dan pemandangan itu menakjubkan.   Mereka juga membawa saya keluar menyelam yang saya cintai. Aku bahkan punya untuk melihat pari manta raksasa!  Jika anda datang ke nusa lembongan pastikan untuk tinggal di sini dan juga pastikan untuk pergi menyelam dengan twin island villas. ",5
82, Twin Island Villas & Dive Resort,"Kami tinggal 3 hari/2 malam di twin island villas, di mana kami telah salah satu yang paling santai dan menyenangkan perjalanan kami di bali. Staf yang ramah membuat kami merasa selamat datang, dan itu sangat membantu untuk kami dan kebutuhan atentionate serta mengenai kebutuhan privasi. Aku sedang sangat terkesan oleh kamar dan lokasi resor ini (lihat adalah hanya luar biasa!). Jika anda mencari yang sepi dan diajak terletak di resort di mana anda dapat menikmati pemandangan dan beberapa waktu tenang, twin island villas adalah semua yang anda butuhkan.  Terima kasih lagi untuk tinggal yang indah, dan bertemu beberapa keistimewaan yang ramah dan orang-orang yang menarik.",5
83, Twin Island Villas & Dive Resort,"Aku hanya menghabiskan akhir pekan di twin island villas, dan aku mencintai tempat ini.  Lokasi adalah keluar dari jalan dari keramaian dan hiruk pikuk jalan utama di sisi lain dari lembongan dan semua yang lebih baik untuk itu, pemandangan dari lereng bukit dan itu adalah tempat yang sempurna untuk bersantai. Aku menyewa vespa untuk menjelajahi pulau dan bahkan meskipun jalan yang agak dasar, itu mudah untuk mendapatkan sekitar, bahkan untuk seorang pemula disajikan seperti diriku. Mudah untuk mendapatkan dari tengah ke sisi lain atau lebih dari jembatan ke hadapan iess ceningan. Staf adalah super ramah dan tidak ada yang terlalu banyak kesulitan.  Waktu berikutnya saya di lembongan, aku pasti akan pemesanan di sini!  ",5
84, Twin Island Villas & Dive Resort,"Aku datang kembali ke villa ini karena komentar yang diberikan oleh wisatawan. Namun. Saya menemukan bahwa komentar ini entah bagaimana tidak mencerminkan kebenaran. Karena Itu. Saya cukup kecewa selama kami tinggal 3 malam.  Vila ini terletak sekitar 20 menit dengan berkendara dari perahu penggugup bertonjol titik penjemputan. Kondisi jalan buruk tapi tempat makan di mana-mana. Karena Itu. Aku memutuskan untuk tidak menyewa sepeda motor. Pastikan mempersandangkan pada sesuatu selama berkendara & akan ekstra hati-hati jika anda menyewa sepeda motor. Hal yang baik adalah layanan antar-jemput vila air untuk mengirim dan menjemput anda dari tempat tujuan anda.  Vila ini berlokasi di bukit nusa lembongan, pulau nusa ceningan dan anda dapat melihat pulau di seberang bukit. Hotel ini…",3
85, Twin Island Villas & Dive Resort,"Saya dan mitra saya memilih twin island villas terutama karena lokasi. Pada kedatangan, napas mengambil pemandangan dan imacculate kamar telah saya jatuh cinta dengan tempat ini. Banyak indah sedikit ekstra untuk memastikan masa menginap yang nyaman, kolam berpapan-terjun pribadi banyak gratis air segar, dan kamar mandi terbaik dan pipa yang pernah saya rasakan di banyak perjalanan ke bali. Pasir antara jari-jari kaki di bar, lengkap dengan kolam renang meja dan pemandangan menakjubkan pizza menghubungkan lembongan untuk Cenigan dan kembali keluar ke laut sangat mudah untuk naik. Manajer dan staf yang mengagumkan. Kami akan kembali untuk lebih lama waktu berikutnya, 2 malam hanya tidak cukup. Jules",5
86, Twin Island Villas & Dive Resort,"Kami adalah partai 4, jadi setiap pasangan memiliki 1 bedroomed villa dengan kolam renang terjun. Bukan hanya kamarnya yang rapi dengan seprai baru dan kasur tebal ' ada juga banyak bagus sedikit tambahan's seperti teropong, semprotan nyamuk pun, buku, mandi dll. Lokasinya menakjubkan dan kami tidak pernah lelah di melihat pemandangan dari villa kami atau bar yang adalah hanya di bawah ini. Staf sangat ramah dan membantu dan makanan yang sangat baik kualitas. Kami akan kembali!",5
87, Twin Island Villas & Dive Resort,"Suami saya dan saya memutuskan menit terakhir bahwa kami ingin kepala ke bali lebih dari paris untuk bulan madu kami dan sangat senang kami lakukan! Saya kota gadis yang butuh keriuhan dan kesibukan, lampu, suara, dan orang-orang. Suami saya lebih suka ketenangan yang tenang untuk relaksasi pamungkas. Bali yang ditawarkan baik. Twin island adalah ""rumah"" di kegiatan apa pun yang kami telah merencanakan, kami bisa kembali ke tempat yang tenang dan damai. Kami memiliki ""love shack"" untuk seluruh minggu dan melakukan perjalanan sehari ke bali (seminyak dan ubud). Sebagai indah seperti pemandangan, staf adalah bahkan lebih menakjubkan dan menjadi sorotan dari liburan kami. Saya tidak tahu bagaimana mengeja nama mereka tapi Bejay dan Nyorman sangat fantastis dan besar untuk chatting…",5
88, Twin Island Villas & Dive Resort,"Menginap untuk 2 malam dan tambahkan di 1 malam karena laut tenang hari adalah hanya pilihan yang baik. Kami dapat mendengar suara berkata dua sepanjang waktu dari nusa ceningan, damai...  Kami pikir kami mendapat kolam pribadi, tapi berubah pemesanan adalah dengan kolam renang terjun, tapi malam kedua dan ketiga malam, kami pindah ke kamar kolam renang pribadi... yeayy...  Terima kasih untuk pak nyoman membiarkan kita menggunakan sepeda motor untuk pergi di sekitar pulau, kami bahkan pergi ke nusa ceningan.   Sarapan adalah sederhana, tapi itu hanya cukup untuk kita, mendapat sarapan kami dengan pemandangan indah adalah lebih dari cukup dan juga plus kicau burung...  Ruangan itu baik, dengan ac dan kipas, dan plus gecko voice... :) balkon adalah bagus untuk melamun, tidak ada…",4
89, Twin Island Villas & Dive Resort,Itu 1 kami membuat pilihan terbaik. Twin villa terletak tepat di atas bukit. Ini adalah sempurna bagi kami karena ini adalah jauh dari keramaian. Kami menginap di the LoveShack. Pemandangan yang menakjubkan dengan kolam renang pribadi. Bangun untuk matahari terbit & burung chirpping pasti membawa kita kembali ke alam. Hal ini juga perjalanan jauh dari semua atraksi lokal. Para staf melayani kami dengan sangat baik. Sangat Menyukainya!,5
90, Twin Island Villas & Dive Resort,"Saya dan suami saya memutuskan untuk tinggal di twin island untuk bulan madu kami. Kami benar-benar senang dengan pemandangan yang memukau. Properti ini cukup cara dari pusat kota, jadi perhatikan bahwa ketika memesan. Jika anda ingin cukup kunjungi dan tidak keberatan berkendara. Saya sangat merekomendasikan mengunjungi lokasi ini. Staf adalah sangat membantu, menawarkan untuk buku kami wisata dan membantu kami dengan setiap kebutuhan kami memiliki. Kami akan lebih menyukai untuk memiliki lebih banyak sayuran ramah pilihan pada menu, namun, apa yang kami makan sangat lezat. Ada benar-benar keren getaran ke tempat.",4
91, Twin Island Villas & Dive Resort,"Kami tinggal di sini selama beberapa hari. Tempat ini indah, itu hanya 3 vila/bungalow, sangat nyaman dan pribadi. BJ ada di sana untuk menyambut ketika kami tiba dan ada di sana untuk kami tidak peduli apa yang kami butuhkan (termasuk datang menyelamatkan kami ketika kami mengalami kesulitan dengan sepeda). Makanan adalah sedikit mengecewakan, tidak banyak pilihan asli indonesia, dan sedikit terlalu mahal untuk apa itu.  Keluhan utama kami adalah generator! Saya pikir kami terutama beruntung meskipun karena pulau ini memiliki tidak melihat begitu banyak pemadaman listrik di sementara. Tapi karena tempat ini kecil, anda dapat benar-benar merasakan getaran generator di kamar anda (sepanjang malam dalam kasus kami!). Ini bukan kesalahan dari twin island meskipun. Jika anda tidak…",4
92, Twin Island Villas & Dive Resort,"Kami mendapatkan di sana mendapatkan oleh staf yang ramah yang bernama lisa. Kami tinggal di villa untuk 4 hari cinta shack, dengan pemandangan yang indah. Tapi kamarnya kecil dengan kamar mandi besar. Tidak cukup ruang untuk meletakkan pakaian kami, tv sangat tua dan pemutar dvd. Kami pikir itu agak mahal. Anda harus menyewa sepeda motor untuk pergi sekitar pulau (anda harus bahkan jika anda tidak tinggal di sini) kami memiliki banyak menyenangkan di pulau ini.  Nyoman adalah sangat ramah, ia adalah orang yang membantu kita untuk menyewa sepeda motor.  Nusa lembongan adalah pulau yang sangat indah. Kami akan kembali ke pulau ini tetapi akan tinggal di tempat lain.  Ps: makanan di villa adalah cukup baik dan murah. Kami selalu makan di saat kami menginap di sana.",3
93, Twin Island Villas & Dive Resort,Kami tinggal di twin island villas di malam tahun baru dan tidak bisa lebih bahagia. Kami dibuat merasa seperti keluarga dan merasa disambut dan di rumah. Kami benar-benar pergi tertarik malam kami tiba dan semua orang adalah benar-benar bersemangat untuk kami dan hanya membuat acara akan kami ingat untuk selamanya. Ini adalah hanya seperti tempat yang indah untuk tinggal dan dijalankan oleh orang-orang yang menyenangkan yang tulus. Kami akan selalu ingat waktu kami di sana karena tempat kami bertunangan dan mungkin memiliki liburan terbaik dalam hidup. Terima kasih untuk semua orang di twin island villas untuk membuat liburan kami begitu istimewa. Andrew dan eloise,5
94, Twin Island Villas & Dive Resort,"Setelah dua kunjungan ke twin island saya harus memberitahu orang lain, tempat ini adalah salah satu tempat favorit saya di dunia. Akomodasi unik dan ketika kami meninggalkan kami merasa staf telah menjadi teman mereka yang hangat dan membantu. Desa sekitarnya adalah indah dan restoran lokal besar. Kami berharap kunjungan kami berikutnya",5
95, Twin Island Villas & Dive Resort,Kami memiliki hanya memiliki lima malam di indah pulau kembar dan menikmati kami tinggal sangat. Kami menginap di vila keluarga dan itu mudah dilengkapi lima orang. Stafnya menyenangkan dan selalu siap untuk membantu dengan apa pun yang kami butuhkan. Vila ini di sisi tenang pulau jadi terbaik untuk menyewa motor untuk berkeliling. Pulau kembar juga memiliki antar-jemput terlalu. Kami pasti akan merekomendasikan ini villa indah se.,5
96, Twin Island Villas & Dive Resort,"Kami tinggal di sini selama 2 malam dan berharap kami tinggal selama 2 minggu. Villa yang sangat indah dengan kolam renang terjun pribadi anda sendiri. Makanan adalah besar dan staf yang fantastis. Tidak ada yang dalam bahasa terlalu banyak kesulitan. Mereka mengatur pijat, sepeda motor snd banyak tertawa. Ini adalah sedikit plsce peice dari surga dan kami tidak dapat menunggu untuk kembali",5
97, Twin Island Villas & Dive Resort,"Kami tinggal di twin islands untuk dua malam dan menyukainya! Kami adalah satu-satunya orang yang tinggal di sana waktu dan staf yang ramah dan sangat membantu! Pemandangan yang indah, kamar kami ""the love shack"" itu bagus dan itu damai. Akan merekomendasikan tinggal di sini untuk teman-teman!",4
98, Twin Island Villas & Dive Resort,"Kami hanya mendapat kembali dari perjalanan kami ke bali dan twin island adalah pemberhentian pertama kami. Itu sempurna untuk liburan. Kamar bagus dan pemandangannya menakjubkan. Lokasinya sedikit di luar area utama, tapi anda bisa menyewa skuter sangat murah. Jika anda tidak merasa nyaman, maka anda bisa mendapatkan antar-jemput gratis hotel ke kota dan restoran biasanya senang untuk berkendara pulang hanya double check sebelum tangan. Emma salah satu staf di sana sangat membantu dan memberi kami banyak saran bagus untuk membuat masa menginap kami menyenangkan. Semua dan semua waktu yang fantastis. Kami pasti akan kembali!",4
99, Twin Island Villas & Dive Resort,"kami hanya menikmati menginap di pulau kembar untuk dua malam (kami berharap kami tinggal lebih lama). BJ dan staf yang fantastis, mereka tidak bisa melakukan cukup bagi kita. kami telah ke Lembongon di berbagai kesempatan selama bertahun-tahun, kami berharap kami baru tentang tempat ini sebelumnya. Jalan utama adalah sedikit kambing track, namun ini adalah dan adalah bagian dari petualangan. Untuk kim dan steve pekerjaan besar di tempat ini untuk kami tempat ini, kalian telah memikirkan segalanya.",5
100, Twin Island Villas & Dive Resort,"Manajer adalah di lokasi hotel untuk setengah tinggal kami dan ini pasti membuat perbedaan dalam layanan. Kami tinggal di' love shack 'tapi sangat kecewa oleh kurangnya privasi. Anda cukup dekat dengan dapur dan sebuah jalan yang berjalan melewati kolam renang pribadi anda. Kami meminta staf untuk mengatur pijat dan perjalanan snorkeling namun, harus meminta beberapa kali untuk hal ini memesan dan dikonfirmasi. Saya tidak akan merekomendasikan mendapatkan pijat ada karena fasilitasnya tidak disiapkan dengan baik atau pribadi (lumut tertutup meja pijat di sudut dengan nyamuk). Hal-hal kecil lain yang mengecewakan tempat ini seperti ketika kami lembar diganti, handuk tidak. Tidak ada banyak penyimpanan untuk pakaian anda dan kamar cukup kecil. Ada pipa perbaikan sementara kami…",3
