,hotel,review,stars
40, Ubud Dedari Villas,"Kami memilih hotel ini berdasarkan tinjauan lain dan harga x faktor keuntungan. Pilihan yang terbukti di bawah rata-rata. Pertama beberapa informasi: Vila ini berada 5 km dari jalan raya ubud. Anda dapat pergi dengan jadwal transportasi dari hotel (4 kali sehari), menyewa skuter untuk rp. 70k (tidak termasuk asuransi atau tersedia) atau meminta hotel untuk membawa anda pada waktu yang anda pilih, yang akan menghabiskan 50k rupiah setiap jalan.  Informasi penting lainnya: Mencoba untuk melihat di sekitar hotel pada google street view. Kami tidak peduli, tapi mungkin anda. Informasi penting lain adalah bahwa hotel ini di samping sebuah keluarga villa. Lebih lanjut nanti. Staf adalah sangat bagus. Mereka adalah selalu bersedia untuk membantu. Mereka mengerti bahasa inggris…",3
41, Ubud Dedari Villas,"Sedikit jauh dari pusat kota (sekitar $10 menit), tapi itu tidak mengganggu kami karena hotel ini luar biasa! Hanya beberapa villa dengan pemandangan yang menakjubkan (hutan), pelayanan yang baik dan staf yang ramah, sarapan yang ok.",5
42, Ubud Dedari Villas,"Ini adalah kedua kalinya saya di sana dan akan selalu kembali. Itu tenang dan damai. Tempat berlibur yang menenangkan. Staf yang ramah dan bersahabat. Terasa seperti di rumah. Lokasi hotel adalah jauh di dalam ubud, dengan mobil hotel yang cepat untuk mendapatkan sekitar. Tentu saja ini adalah pengalaman hebat jauh dari hutan beton.",5
43, Ubud Dedari Villas,"Kelebihan: Properti yang menakjubkan. Kolam renang adalah hanya seperti yang anda lihat di foto - bersih dan taman-taman indah. Staf yang ramah. Pancuran mandi luar ruangan di villa yang sangat bagus. Transportasi berjalan secara teratur untuk pusat ubud tetapi jika anda pergi di luar waktu yang ditetapkan maka anda akan dikenakan biaya - bahkan jika anda hanya tamu mereka!   Kekurangan: - Villa tua dan lelah, retak ubin, perabotan tua dll.  - vila mendapatkan sangat panas dan unit pendingin udara tidak keren di bawah 25 derajat celcius ini banyak. Kami harus mengubah ke sebuah hotel yang bergaya di 3rd malam, hanya karena kita tidak bisa tidur dengan panas. Kami bahkan mencoba memiliki kipas tambahan!  - setelah kami pindah ke kamar baru kami diberitahu bahwa wifi tidak…",3
44, Ubud Dedari Villas,Kami memiliki tinggal yang indah di ubud dedari villas pemandangan dari hutan hujan dari daerah pusat kota utama tetapi menyukainya karena vilanya indah dan bersih selain itu mereka menyediakan layanan antar jemput ke kota yang hanya menarik kembali adalah bahwa ac adalah sedikit kecil (tidak cukup kuat) mungkin kecil mempertimbangkan ukuran kamar tapi staf beres itu dengan memberikan kami sebuah kipas angin. Mencintai kolam renang.,4
45, Ubud Dedari Villas,"Saya dan pacar saya tinggal di sini selama 3 malam dan memiliki segala yang kami butuhkan. Kami bahkan mendapat upgrade ke kamar deluxe tanpa biaya tambahan dan ini sangat bagus! Kamar yang bersih, sarapan yang enak, pemandangan yang indah dan lingkungan dan layanan yang luar biasa. Damai dan tenang dan kolam renang yang sempurna. Mereka memiliki antar-jemput gratis ke dan dari kota dan mereka bahkan mengantarkan kami ke kota gratis restaurang ofta biaya, dan menjemput kami setelah makan malam. Satu-satunya hal adalah sinyal wifi yang tidak kuat di kamar kami tapi itu tidak mengganggu kita. Terima kasih banyak untuk tinggal yang indah dan mengesankan!",5
46, Ubud Dedari Villas,"Saya merekomendasikan vila ini dengan semua hati saya ini begitu indah dan tenang, dekat dengan candi, di tengah dari alam. Luar Biasa! Staf yang sangat ramah dan pelayanan yang sangat baik! Juga disediakan gratis transportasi ke bandara dan ke pusat kota yang saya temukan sangat membantu!",5
47, Ubud Dedari Villas,"Saya tinggal di sana selama beberapa malam dan pengalaman itu menakjubkan. Semua staf yang sangat baik, merawat anda dan membantu dengan segala sesuatu. Berenang dalam kolam renang mereka adalah pengalaman yang unik dan villa adalah bersih, luas dan sangat indah. Sangat dianjurkan jika anda tinggal di sekitar ubud.",5
48, Ubud Dedari Villas,"Saya mendapat pengalaman menginap yang menyenangkan di vila ini! Staf yang sangat membantu dan ramah! Aku benar-benar kehilangan kartu bank saya pada liburan saya di bali dan tidak memiliki akses ke uang untuk beberapa hari. Manajer villa yang mengantar saya kemana dan membantu saya sepanjang jalan! Bahkan menurunkan saya di bandara dan menunjukkan kepada saya di sekitar kuta. sangat baik dan membantu, mereka benar-benar membuat liburan saya lebih bermakna dan keramahan di atas dan di luar. Terima kasih atas semuanya dan saya akan menantang tinggal di sini lagi! Sangat merekomendasikan vila ini. Semuanya sempurna :) Terima kasih terima kasih terima kasih! ",5
49, Ubud Dedari Villas,"Telah memperkenalkan ke tempat ini oleh teman saya, itu sangat mengesankan hari dan malam, memiliki kamar khusus no. 9 dengan alam hutan hujan pemandangan dari balkon. Juga bisa melihat pemandangan dari kamar mandi. Suasana yang menyenangkan. Nyamuk di daerah terbuka? Tidak dengan pengalaman kami.  Kami meminta beberapa lain untuk bergabung dengan kami dan kami punya kamar sebelah untuk kita (tidak ada. 8) dengan balkon bisa digabung jadi kami bahkan lebih senang malam bersama.  Layak untuk tinggal lagi lain kali! Akan kembali lagi... Terima kasih ",5
50, Ubud Dedari Villas,"Saya sangat merekomendasikan tempat ini. Ini adalah salah satu yang menyenangkan tempat untuk bersantai dan menikmati liburan anda. Aku tinggal di ubud dedari villas di kamar deluxe. Kembali ke alam adalah nama yang tepat untuk menggambarkan suasana di sini, jadi saya sangat nyaman untuk meluangkan waktu untuk bersantai. Terima kasih ubud villa anda membuat saya holidaay dedariii :) ",5
51, Ubud Dedari Villas,"Aku tinggal di ubud dedari villas untuk 2 malam di kamar deluxe dan mereka yang indah. Tempat tidur yang nyaman, air gratis aman di setiap kamar, kamar mandi yang luas dan bersih dan apa yang saya suka yang paling adalah suasana tenang di sini. Saya telah dengan pemandangan hutan dari balkon pribadi saya dan aku bisa mendengar suara aliran sungai petanu. Aku suka mereka infinity pool terlalu banyak! Anda dapat berenang atau membaca di tepi kolam renang dan menikmati pemandangan hutan di sekitar. Tempat ini akan sangat cocok untuk mereka yang senang menjadi dekat dengan alam. Akan kembali pada kunjungan berikutnya ke bali :) ",5
52, Ubud Dedari Villas,"Jika anda sedang mencari tempat untuk bersantai ini tempat di ubud bisa menjadi satu yang direkomendasikan untuk dicoba, dan tempat ini juga dekat dengan tempat-tempat wisata yang ada di ubud. Semua layanan yang sangat baik.",5
53, Ubud Dedari Villas,"sangat miskin untuk hotel USD90.  fakta buruk: kotor dan bau gtrbong - (mungkin orang-orang marah di dalamnya); - pintu tidak mengunci dengan benar; - dinding yang tidak dapat memenuhi atap sehingga cukup ruang untuk iizards dan binatang lainnya untuk berbagi kamar bersama anda; - restoran bagus (kami memiliki besar satu di beranda, lalu dia bersahabat dengan kucing) - sampah dimasukkan di the villa's mendinding (memikirkan bau di kamar semi-terbuka); - staf tidak mengerti bahasa inggris, ketika awal anda punya masalah; setelah negosiasi harga - di usd, mereka ingin kita untuk membayar baterainya, untungnya kami memiliki cetak e-mail; - hotel ini sangat jauh dari kota; ada hanya satu restoran - anda dapat makan di area hotel, namun masih jauh dan di malam hari ada banyak anjing…",1
54, Ubud Dedari Villas,"sangat direkomendasikan untuk bulan madu anda, atau hanya untuk membuat kaki sejenak dari hiruk & hiruk pikuk metropolitan. Layanan luar biasa, suka bau alam, makanan yang mengagumkan, ini sangat baik & renang adalah favorit saya. ",5
55, Ubud Dedari Villas,"Saya & keluarga saya pertama tinggal di vila ini. Kami masih menikmati malam pertama kami di sini, dan merasa sangat nyaman & nyaman kamar. Terasa seperti rumah dengan suasana yang benar-benar santai dan memberi kita perasaan yang membuat kita tidak ingin pergi keluar, dan hanya tinggal di villa sepanjang hari dan malam. Vila ini hanya begitu sempurna untuk melupakan semua keramaian kota di belakang kami kembali di jakarta. Yang benar-benar baik tempat untuk tinggal yang santai untuk liburan yang benar-benar baik. Dan waktu yang kami menikmati di sini adalah mengapa semua staf di sini adalah sangat bermanfaat dan menyenangkan untuk para tamu. Tentunya kami akan kembalilahkemari ",5
56, Ubud Dedari Villas,"Saya dan suami saya tinggal di ubud dedari villas untuk bulan madu kami dan itu benar-benar tak terlupakan dan menakjubkan! Kami menikmati tinggal sangat banyak. Kami menghabiskan hari yang panjang hanya menginap di hotel, berenang di kolam renang yang indah, melihat matahari terbenam dari sana. Vila ini dikelilingi oleh alam yang damai. Baik melihat dan suara alam terlalu sempurna untuk menghabiskan waktu dengan orang yang anda cintai.  Saya dan suami saya tinggal satu malam di villa tidak 5 dan satu malam lagi di villa 10. Keduanya luar biasa! Villa 5 terletak di sudut, jadi itu lebih pribadi daripada 10 vila lainnya, sementara villa adalah satu terbaru yang memiliki teras yang besar. Semua vila memiliki balkon cantik dengan pemandangan alam dari hotel ini. Kamar-kamarnya…",5
57, Ubud Dedari Villas,"Aku jatuh cinta dengan tempat ini. Itu membuat saya merasa lebih indah bulan madu. Tempat yang sangat tenang, sangat dekat dengan alam. Aku dapat melihat matahari terbenam yang indah dari tempat ini dan sungguh menakjubkan. Suara alam juga dapat membuat saya merasa begitu nyaman.  Staf sangat ramah dan layanan yang sangat baik! Jangan lupa untuk minta mr. Poer membawa anda ke kerajinan dan kuliner tradisional dari kayu lokal di sana. Semuanya sangat istimewa bagi saya. ooo... coba pisang panekuk untuk sarapan mereka, rasanya sangat enak. Coba juga pijat tradisional bali, sehingga membuat tubuh anda terasa luar biasa setelah anda keaktivitetan di ubud. Bagi saya, semua menu di sana.",5
58, Ubud Dedari Villas,"Kami tiba di ubud dedari villa setelah 2 minggu perjalanan di indonesia, menantang, dan bisa tidak lebih bahagia. Ini adalah properti yang benar-benar menakjubkan. Terletak di pusat ubud, ada layanan antar-jemput gratis untuk drop off dan menjemput tamu, sehingga hotel ini sangat nyaman. Lokasi itu tempat yang sangat tenang, dan benar-benar dikelilingi oleh alam. Semua kamar memiliki beranda atau balkon yang menghadap ke hutan yang indah dan dihuni oleh bernyanyi di pagi yang chicadas - itu, dan suara dari sungai yang mengalir di bawahnya adalah satu-satunya yang dapat didengar. Kamarnya terang, bersih dan dilengkapi dengan sempurna. Taman adalah subur. Kecil, tapi indah kolam renang yang sempurna untuk bersantai. Ini adalah tempat yang sempurna seperti itu!",5
59, Ubud Dedari Villas,"Saya dan istri saya tinggal di ubud dedari villas selama kunjungan kami ke bali, dan itu luar biasa. Kami menyukai alam terbuka, jadi ini adalah persis jenis tempat kami mencari; rumput beratap tradisional villa di tepi sebuah hutan. Ada jalur lintas alam berada tepat di luar vila yang dapat digunakan untuk memperoleh ke sungai atau di sekitar kompleks candi yang masih menggunakan iocals (seorang pria di luar kuil akan meminta sumbangan untuk memasukkan uang kecil). Pada malam hari, bersantai di kolam renang dan ke hutan hujan indah di pemandangan tidak pernah menjadi tua. Itu benar-benar terasa seperti surga yang tersembunyi. Jika anda ingin pergi untuk sedikit, hotel ini menawarkan layanan antar-jemput sangat baik untuk lokasi. Selama kami tinggal, staf yang sangat ramah dan…",5
60, Ubud Dedari Villas,"Tempat ini luar biasa!  Indah lokasi tenang, staf sangat ramah, layanan yang anda bisa mendapatkan  sangat bagus! Jika anda sedang mencari liburan surga tersembunyi ini adalah tempat. Tidak jauh dari pusat ubud dan  anda bisa mendapatkan antar-jemput gratis dari vila di waktu tertentu Atau membayar untuk satu. Tempat ini bernilai setiap sen.  ",5
61, Ubud Dedari Villas,"Hotel ini jauh dari pusat kota, dan kami menemukan itu sebagai keuntungan karena sangat cukup dan damai. Hanya beberapa orang dari staf dan beberapa lebih banyak tamu.  Staf sangat membantu dan ramah.  Gratis layanan antar-jemput ke pusat kota dan kembali 4 atau 5 kali sehari, jadi ini adalah sangat menuntut untuk mengunjungi tempat-tempat lain di pusat ubud.  Di dekatnya ada sungai, di bawah hotel, dan itu layak mendaki ke sana dan kembali.  Kami juga berjalan ke kuil di samping dan belakang hotel. Sarapan adalah baik dan dengan beberapa pilihan yang tersedia. Pancuran luar ruangan ini menarik. sangat senang kami tinggal di sana.",5
62, Ubud Dedari Villas,kami sangat menikmati menginap di sini. Kamar yang cantik menghadap ke lembah dengan suara sungai. Dilengkapi. Bagus dan bersih. Staf sangat ramah dan menampung. Layanan antar-jemput nyaman ke pusat kota ubud (itu sedikit keluar dari kota). Sarapan yang beragam dan disajikan di kamar anda. ,4
63, Ubud Dedari Villas,"Setelah kami memasuki villa, kami melihat langsung suasana hutan hujan tropis yang menawan: . burung-burung kecil sedang bermain di rambut panjang, kehijau-hijauan view dari balkon, teras, dan kolam renang, dengan suara dari sungai yang datang di bawah villa.   Kamar kami adalah besar. Layanan dari staf adalah sempurna.   Itu adalah pengalaman yang menakjubkan bahwa kita telah selama kami tinggal di ubud dedari. Untuk memastikan, akomodasi ini sangat direkomendasikan di bali.",5
64, Ubud Dedari Villas,"Jika tidak baik dan ramah. Kami kamar yang luas dan segala sesuatu yang kita diperlukan dan disediakan tempat mungkin dianggap. Sarapan disediakan di luar masih tiga kali. Kami tinggal selama di bali marathon. Telah terbit berlar satu pagi dan kembali disajikan dengan sarapan. Ini baik diperlukan setelah hari yang melelahkan. Hotel ini adalah pribadi, sangat cocok untuk sebuah malam yang jauh dari kota.",5
65, Ubud Dedari Villas,"Saya telah mengunjungi di ubud dedari villas untuk 19 hari selama liburan saya di bali. Saya telah bepergian dengan saya girlfried.  Kamar yang sangat bersih, juga kamar mandi, sangat bagus dan pemandangan luar biasa, sangat baik pekerja.  Saya benar-benar menyarankan hotel ini untuk seseorang yang ingin benar-benar bersantai untuk selama holyday.  Ini adalah benar-benar dimasak mulai hari dengan pemandangan yang indah dan dengan sarapan di kamar anda. Ini adalah tempat yang sempurna untuk memulai hari.  Hanya 2 hal yang sangat dekat dengan ubud (15 menit dengan mobil) dan tidak makan malam di ubud, kedua untuk diimplementasikan sebagai WiFy (gratis tidak membutuhkan beberapa penyesuaian denyud).  Anastasios Vergani",5
66, Ubud Dedari Villas,Vila butik yang indah di jantung hutan hujan. Dengan staf yang fantastis. Dedari adalah keluar dari kawasan utama jika ubud sehingga anda akan perlu transportasi ke dan dari villa tetapi mereka memiliki layanan antar-jemput reguler di dalam dan di luar kota. Karena terletak di daerah pedesaan yang anda dapat mendengar dari benar-benar awal di pagi hari tapi mereka menyediakan telinga busi jika anda lampu tidur. Tempat ini berlokasi di hutan hujan dan ada beberapa nyamuk tetapi mereka menyediakan mrt.,5
67, Ubud Dedari Villas,"Kamar-kamarnya bersih dan lapang, jika bagus, makanannya lezat dan memiliki harga yang adil (coba tulang rusuk), ini bukan hotel, suasana sangat bagus. Anda harus mencoba kamar deluxe, dan anda tidak akan menyesal. Keluarga saya setuju bahwa mereka memiliki terbaik tinggal di sini di perjalanan terakhir kami. Akan tinggal di sini lagi setiap kali aku pergi ke bali. ",5
68, Ubud Dedari Villas,"Empat pasangan saya selama tiga malam. Vila tidur kamar mandi yang luas dan ber-ac dengan tv wi-fi dll semua yang bisa anda butuhkan. Kolam adalah luar biasa dan menghadap ke hutan. Sarapan adalah hebat dengan besar pilihan yang diantar ke balkon anda makan dan itu termasuk dalam harga.  Sekitar sepuluh menit dari ubud center dan oasis yang tenang di ubud setelah dirinya sendiri dan keramaian. Makan siang di kolam renang yang sangat baik dan harga terjangkau.  Staf fantastis, dari check-in hingga check-out apa-apa adalah terlalu banyak kesulitan. Layanan antar-jemput mobil ke dan dari kota restoran dll membuat berkeliling tempat wisata lokal mudah dan gratis!  Kami ingin menginap di dedari ini layak peringkat yang lebih tinggi pada tripadvisor! ",5
69, Ubud Dedari Villas,Kami tinggal untuk 2 malam di villa dedari. Hotel ini terletak kira-kira $10 - 15 min dengan mobil dari pusat ubud (taksi biaya sekitar 5 USD/50' rupiah) dan sekitar $15 - 20 min berjalan kaki dari kuil mormydae. Tapi hotel menawarkan antar-jemput dari dan ke ubud pada waad. Hotel ini tidak baru tapi sangat diperhatikan. Staf adalah ramah dan menawarkan layanan yang sangat baik. Pemilik hotel adalah sangat baik host yang baik. Menakjubkan pemandangan hutan dari vila dan kolam renang. Tidak ada restoran tetapi mendapat layanan kamar!,4
70, Ubud Dedari Villas,"Kami 2 malam di dedari stayd untuk staf. Lokasi indah dengan pemandangan yang indah melalui ngarai di dalam hutan. Tidak ada restoran, jadi u menggunakan pembersihan untuk semuanya. Staf sangat ramah dan vilanya sangat besar. Pasti akan kembali lagi!",5
71, Ubud Dedari Villas,"Tinggal selama 2 malam sebelum menuju ke sore 2 minggu yang lalu. Kami mengambil taksi dari seminyak ke tempat dan sopir taksi tersesat. Rasanya seperti jika anda datang dari bandara/area seminyak maka bersiaplah dengan gps anda untuk memberikan arah. Ini adalah apa yang saya dan mitra saya yang penting kami sudah menyelamatkan bayangka tentang waktu karena itu. Tetapi sekali anda berada di dalam vila saya, pergi ke kawasan pusat tidak masalah karena mereka memiliki layanan antar-jemput yang membawa anda ke sana atau jika anda mengambil taksi hanya sekitar IDR50, 000.00 Jika taksi biaya anda lebih kemudian memberitahu mereka bahwa anda hanya bersedia untuk membayar jumlah. Mereka akan mencoba untuk mencomel juga enak.  Kamar di mana kita tinggal di sangat baik nilai untuk uang.…",4
72, Ubud Dedari Villas,"mencintai hotel ini. Ini memiliki sebuah butik yang merasa karena ada hanya beberapa kamar/suite/bungalow di situs. Saya melihat ke kanopi hutan. Kamar mandi adalah besar dan kamar-kamarnya dirancang dengan gaya modern minimalis/bali. Bak mandi kecil dan melihat ke dalam hutan! Staf adalah sangat membantu dan sopan. Lokasi adalah agak jauh dari pusat ubud, tetapi mereka menawarkan layanan antar-jemput gratis. Tidak pilihan yang paling luas di menu layanan kamar mereka, tapi mereka hanya baik-baik saja.",5
73, Ubud Dedari Villas,"Baru saja kembali dari indah menginap di dedari 17night. Akan kembali dalam sekejap!   View dari kamar itu luar biasa kamar deluxe... kembali ke lembah/jurang, tidak perlu bahkan mendapatkan keluar dari tempat tidur. Staf adalah ramah & membantu. resor sangat tenang, memiliki kolam renang untuk diri sendiri sebagian besar waktu. Sarapan disajikan di balkon - kreatif & lezat. Kamar sempurna untuk menginap jangka - sudut kamar, kamar mandi, brankas dalam kamar, dispenser air panas/dingin. Aku akan mengharapkan sesuatu yang lebih surukan ruang sebagai kami berada di sana sementara. Dedari terletak 15mins berkendara dari ubud - ada antar-jemput gratis yang berjalan ke/dari ubud dedari /, berjalan ke kota tidak ideal sepanjang utama jalan-tidak ada trotoar/lampu, kami menyewa moped…",5
74, Ubud Dedari Villas,"Kami memiliki 5 malam menginap kami menginap di dedari dan jujur aku tidak bisa merekomendasikan tempat ini cukup. Dari beberapa pagi untuk staf yang luar biasa, tempat ini adalah tempat yang sempurna.   Ada beberapa hal yang saya ingin menyorot yang membuat tempat ini begitu besar:   Air: Alih-alih menawarkan 50cl botol air, mereka memiliki dispenser air di kamar. Ini adalah plus besar karena kami akan tetap nyaman sepanjang hari dan botol kami membunting sebelum meluncur di trek.   Antar-jemput gratis ke ubud: mereka memiliki antar-jemput gratis ke ubud yang berjalan secara teratur sepanjang hari dan mengambil. Saat kami tamu hanya menggunakannya kadang-kadang, mereka bahkan menurunkan kami di tempat-tempat tertentu di luar dan mengambil kita ketika kita ingin. Hanya…",5
75, Ubud Dedari Villas,"Pacar saya dan saya tinggal di ubud dedari villas untuk 2 malam di mei 2015 dan terkesima oleh keindahan. Apa yang kita sukai paling: Benar-benar indah -, besar dan kamar bersih dengan semua yang anda butuhkan: tempat tidur yang sangat nyaman, dan kamar mandi yang besar dan bersih - Lingkungan yang menakjubkan: pemandangan dan suara dari kamar dan balkon yang membuat anda merasa benar-benar tenggelam dalam hutan hujan yang damai - Kolam renang yang indah dengan pemandangan yang luar biasa - Berjalan kaki melintasi hutan hujan yang besar di samping gua gajah - Makanan dan staf yang sangat membantu, dan terutama Gustu Poernomo Layanan antar-jemput ke ubud - (10min) - Lokasinya, banana pancake yang lezat!   Kamar hotel bagi kami adalah staf yang menampung permintaan kami dan…",5
76, Ubud Dedari Villas,"Staf adalah menakjubkan dan bersedia melakukan apa pun untuk anda. Vilanya indah mandi pagi, membawa anda tepat kembali ke alam. Hanya 10 min ke ubud center dengan layanan antar-jemput gratis. Sarapan yang disajikan di villa anda bagus. Mudah 10/15 min berjalan melalui hutan untuk atraksi gajah temple. Kami punya penawaran khusus melalui expedia dan percaya kami mendapat tawar-menawar mutlak. Akan menantang tinggal lagi satu malam itu tidak cukup.",5
77, Ubud Dedari Villas,"Kami tinggal di sini selama beberapa hari pada bulan mei dan menemukan itu adalah pilihan yang sangat baik. Tidak ada banyak tamu lain dan suasana damai dan santai. Mencintai sarapan di balkon di waktu apa pun yang anda ingin, benar-benar menikmati pijat di kamar pribadi anda dan staf hanya fantastis. Mereka memberi kami lift ke kota setiap kali kita ingin pergi dan ketika mereka tidak menemukan itu ulang tahun saya, mereka bahkan memberi saya kue ulang tahun! bilangan begitu manis! Pasti akan merekomendasikan hotel ini!",4
78, Ubud Dedari Villas,"Kami tinggal untuk 4 malam di dedari.  Staf adalah sangat ramah. Terutama Dweka yang membantu kami menemukan beberapa produk lokal di sekitar hotel.  Sarapan sangat baik juga. Pisang pancake dan keju telur dadar bar adalah favorit kami.  Kolam renang adalah menakjubkan, dan karena hanya ada beberapa villa tidak baik di semua.  Satu-satunya hal yang tidak besar adalah bahwa ruangan itu agak kecil.  Saya merekomendasikan. ",4
79, Ubud Dedari Villas,"Menakjubkan tempat untuk tinggal di bali. Dekat dengan pusat ubud, tempat yang tenang dengan layanan berkualitas tinggi. Tidak begitu jauh dari semua aktivitas di sekitar ubud. Antar-jemput gratis ke pusat... dll... bagus sekali tempat untuk tinggal. Terima kasih untuk menyambut anda. Aku akan datang kembali segera.",5
80, Ubud Dedari Villas,"Sempurna tinggal di sebuah tempat magis... Aku hanya ingin tinggal di sana selamanya!  Taman indah, sangat luas, pemandangan yang menakjubkan, makanan yang hebat dan layanan yang terbaik, paling ramah yang pernah saya lihat!  Terima kasih untuk segalanya! ",5
81, Ubud Dedari Villas,"Ini adalah hotel pertama kami memutuskan untuk tinggal selama lebih dari 5 hari di bali. Kami bepergian dan melihat banyak tempat-tempat yang berbeda dan hotel tapi yang satu ini adalah yang terbaik! Dikelilingi oleh hutan dengan burung dan suara dari sungai yang menarik! Kolam renang yang sempurna! Sarapan lezat! Staf yang ramah! Bus antar-jemput gratis ke pusat ubud dan kembali ke hotel. Semuanya adalah sempurna. Jika anda perlu untuk bersantai dan menikmati pemandangan, ini adalah pilihan yang baik! Sangat direkomendasikan.",5
82, Ubud Dedari Villas,"Mewah, luas dan dengan tempat tidur yang besar. Lingkungan ini juga sangat bagus, berlokasi di area yang tenang di pinggiran ubud. Kolam renang adalah fantastis, menghadap ke sungai & hutan. Benar-benar nilai untuk uang, lokasi! Mengingat lokasi, meskipun; Dedari ini cukup jauh dari ubud dan anda akan selalu perlu mobil + sopir untuk membawa anda ke kota.",4
83, Ubud Dedari Villas,"Bagi mereka yang mencari tenang, tenang, baik indah untuk menginap di ubud, bali, kami merekomendasikan anda untuk menginap di villa dedari ubud. Benar-benar menikmati hari-hari saya di dedari. Menyukainya seperti surga!  Staf yang sangat ramah dan membantu. Terutama untuk fasilitas dan transportasi ke beberapa tempat yang menarik yang disediakan oleh dedari membuat kami menikmati selama kami tinggal untuk bulan madu di ubud.   banyak terima kasih untuk malam yang indah. Melihat anda segera.  bagus & andinna - depok, jawa barat",5
84, Ubud Dedari Villas,"Villa ini adalah begitu bagus! Anda dapat merasa sifat sangat dalam. Udara, makanan, layanan, dan kamar itu sendiri benar-benar baik. Oh, catatan khusus. Saya benar-benar menyukai kamar mandi! Haha menikmati liburan anda dan merasa beberapa hari di ubud dedari villas surga!",5
85, Ubud Dedari Villas,"Saudara perempuan saya dan saya tinggal di ubud dedari villas untuk 3 malam di maret 2015. Meskipun kami datang selama musim hujan kami memiliki waktu yang menakjubkan di ubud, terima kasih untuk akomodasi indah.   Staf adalah super ramah dan membantu dan manajer selalu punya telinga untuk semua barang-barang kami dan semua dari mereka membantu kami di mana pun mereka bisa.  The villas terletak di Bedulu, yang adalah 10 menit berkendara ke pusat ubud. Hotel menyediakan antar jemput, yang adalah sangat membantu. Karena kami tiba di musim rendah, mereka membuatnya bahkan lebih nyaman bagi kita dengan menawarkan jadwal fleksibel kali ke pusat.  Ubud dedari villas memiliki kolam renang infinity yang luar biasa yang kami menikmati banyak. Kamarnya sangat luas, baru direnovasi dan…",5
