,hotel,review,stars
86, Ubud Dedari Villas,"Jika damai dan tenang adalah apa yang anda cari, ini adalah tempat untuk menjadi!  Suami saya dan saya telah pergi ke bali 3 kali, dan tinggal di banyak tempat-tempat lain di bali (seminyak, kuta, legian, ubud), dan tempat ini adalah pasti salah satu favorit kami. Kami menyukai bagaimana terjangkau, damai dan indah tempat ini. Dan itu tidak terlalu jauh dari pusat ubud, terutama ketika transportasi disediakan oleh villa.   Kami tinggal di villa 3, dan itu bersih, luas, dan nyaman. Ada outdoor shower, bak mandi, dan toilet, yang sangat mengagumkan! Saya suka fakta bahwa kami bisa mendengar suara jangkrik di malam hari, dan ayam di pagi hari dari kamar kami. sangat damai!  Pemandangan kolam renang dan hutan adalah yang terbaik! Pergi untuk berenang di pagi hari atau di sore hari,…",5
87, Ubud Dedari Villas,"Dari saat kami tiba hari kami meninggalkan staf yang selalu tersedia, sopan dan sedang menunggu untuk membantu. Kami didorong ke ubud pada saat kedatangan, turun di pintu untuk menyewa skuter. Vilanya sedikit keluar dari kota jadi ini baik untuk menyewa skuter untuk satu hari atau $6 vila ini menawarkan layanan antar jemput ke kota dan layanan antar jemput yang beberapa kali sehari. Villas sangat bersih, kolam renang dan pemandangan yang menakjubkan! Pernah saya menikmati tinggal begitu banyak, sangat direkomendasikan.",4
88, Ubud Dedari Villas,"tempat yang sangat bagus untuk tinggal selama liburan. Kenyamanan, santai lingkungan dan segar. tempat yang sangat direkomendasikan untuk liburan anda dan melarikan diri dari stres anda. Saya datang dengan keluarga saya dan kami ""re sangat puas dengan layanan. Tidak bisa untuk kembali...",5
89, Ubud Dedari Villas,"sangat damai, sangat santai. Ini adalah tempat yang sempurna di ubud jika anda mencari tempat untuk melarikan diri dari stres anda. Hanya membawa teman anda atau keluarga anda datang di sini, kualitas dijamin waktu! Layanan besar juga. Def akan kembali satu hari. :) ",5
90, Ubud Dedari Villas,tempat yang sangat bagus... cukup... bersih... dan anda akan bernapas dengan udara segar di pagi hari... kamar saya adalah besar dan nyaman... sarapan adalah bagus... dan staf hotel sangat ramah... mereka akan menjemput anda dari bandara.,5
91, Ubud Dedari Villas,"Dedari villas adalah tanpa diragukan lagi tempat terbaik kami tinggal di selama kunjungan kami di bali. Kami tinggal di lima hotel lain semua (di seminyak, kuta, legian) semua untuk harga yang sama, tidak satu hotel adalah bahkan dekat dengan menjadi sebagai pribadi, indah, bersih dan menakjubkan sebagai dedari. Stafnya luar biasa. Saya dan pasangan saya adalah satu-satunya tamu di hotel, yang kecil sudah - kami benar-benar memiliki tempat untuk diri kita sendiri. Berjalan-jalan menuju candi juga luar biasa, staf ramah dan di berjalan kita melalui hujan, memberi kami untuk memakai sarung (karena kami tidak tahu ini tradisional) semua di pemberitahuan singkat - segera setelah kami memasuki lobi dan bertanya. Kolam renang adalah benar-benar di satu sisinya cukup yang kami sukai,…",5
92, Ubud Dedari Villas,"Dari beberapa tempat yang saya telah tinggal di dan sekitar ubud, dedari villas adalah oleh jauh favorit saya. Fakta bahwa mereka setengah harga dari banyak hotel di ubud membuat tinggal di sana tidak sulit. Vilanya sendiri terletak beberapa mil dari ubud, tetapi mereka menyediakan angkutan gratis ke pusat kota ubud dan kembali beberapa kali sehari. Salah satu aspek favorit saya tentang villa adalah bahwa mereka adalah agak terisolasi, sehingga anda merasa seolah-olah anda berada di tengah-tengah hutan. Suasananya tenang, pribadi dan tenang.  Staf adalah sopan dan akomodatif dan sarapan gratis juga lebih daripada saya akan berpikir. Pasti jauh lebih baik daripada sarapan kontinental yang anda dapatkan di sebagian besar hotel. Gambar ditampilkan di profil sangat akurat…",5
93, Ubud Dedari Villas,"Saat ini saya masih di hotel. Setelah melihat keluhan di posting sebelumnya tentang kebisingan dari renovasi kami ragu-ragu. Tapi tata letak yang menakjubkan dan pemandangan dan nilai untuk uang yang layak dan dibayar di penuh. Renovasi yang hampir selesai. Kami tidak memiliki suara apapun sama sekali benar-benar. Hanya sentuhan kecil pergi di sini dan di sana di tempat lain di hotel. Pemandangan bintang 5, staf mengagumkan, kamar villa sangat luas dan dilengkapi dengan semua yang diperlukan. The valley berjalan kaki ke kuil gajah juga sangat bagus. On call layanan makanan dan layanan antar jemput gratis ke pusat dan kembali. Atau hanya aud $5 taksi naik pokoknya. Sangat direkomendasikan untuk orang-orang yang ingin yang natural retreat untuk tidak jauh dari pusat.",4
94, Ubud Dedari Villas,"Kami tinggal di villa untuk 4 malam dan dedari adalah pilihan yang hebat. Dari saat kami tiba kami disambut dengan keramahan yang besar dan hangat senyum dari semua staf yang indah.   Vila deluxe kami sangat menikmati aspek dari hujan dan ngarai, melihat ke bawah ke kuil di bawah dari balkon besar kami. Ruangan itu sangat baik ditunjuk dengan kamar mandi yang besar, sendiri mendidih, dingin, dan normal dispenser air, ukuran penuh bak mandi dan shower terbuka. Kolamnya bersih dan sangat menyegarkan. Satu-satunya ketidaknyamanan kecil adalah kadang-kadang cerdik koneksi wifi, tapi ini bukan jenis tempat anda akan atau harus menghabiskan berjam-jam di internet. Sarapan disajikan di kamar sangat baik portioned, beragam baik dan sangat lezat. Lokasi adalah tentang 10 mknutes…",5
95, Ubud Dedari Villas,"Villa ini bagus sekali. Para staf yang sangat ramah dan penuh dengan informasi yang terbaik museum seni dan tempat yang indah untuk mengunjungi di sekitar villa. Makanannya luar biasa! Rasa benar-benar baik dengan porsi yang baik. Pemandangan dan nuansa dari villa adalah benar-benar romantis, menenangkan dan damai.",5
96, Ubud Dedari Villas,"Resor kecil ini memiliki 5 vila dan kolam renang tak berbatasnya yang kecil yang menghadap hutan di atas sungai.  Apa yang membuat kamar terang adalah penggunaan warna ringan furnitur yang merupakan perubahan dari biasa perabot kayu berwarna gelap di kebanyakan vila-vila di ubud. Ini menarik sedikit nyamuk dan   A harus lakukan adalah 10 menit berjalan melalui hutan ke goa gajah dari villa, anda akan disuguhi oleh pemandangan dan suasana yang besar; melewati tree vines, pandangan dan suara sungai di bawah ini dan pendinginan dari menyegarkan air dari sungai kecil di bukit di atas.   Staf meja depan menawarkan layanan terbaik dan saran tentang lingkungan sekitar. Hotel menyediakan layanan antar-jemput gratis ke ubud yang berjarak sekitar 15 menit. Tidak ada restoran di hotel tapi…",5
97, Ubud Dedari Villas,"Saya pergi ke dedari setelah suami saya tinggal di sini selama hampir satu minggu untuk bisnis barang. Dia mengatakan kepada staf bahwa saya akan datang di akhir pekan. Kami hanya datang ke bali hanya untuk liburan tetapi ketika kami kembali ke hotel setelah suami saya menjemput saya di bandara, kami mengejutkan menemukan beberapa bulan madu barang di kamar kami. Bunga di mana-mana... di tempat tidur dan bak mandi saya benar-benar menyukainya tapi sayangnya kami tiba di hotel pada tengah malam jadi suami saya bersihkan  Saya menginap di kamar deluxe. Kamar ini bersih dan yang terbaik adalah ketika kami sarapan hari berikutnya, kami dapat menikmati pemandangan hutan... tempat ini menakjubkan...  Semua staf di hotel ini adalah benar-benar membantu terutama manajer hotel pak Poer.…",5
98, Ubud Dedari Villas,"Menghabiskan 2 malam pertama dan mencintai tempat ini. Kami memilih tempat untuk keseimbangan anggaran total untuk kami 3 hari terakhir kami telah memesan four seasons jimbaran bay yang cukup mahal bagi kami. Dan kami menyukainya! Dedari villas adalah lucu, menyenangkan dan terjangkau tempat persembunyian hutan hujan anda akan bangun untuk menikmati nyanyian burung dan angin baik dari hutan. Semua staf sangat baik dan ramah, terutama manajer pak. Poernomo. Dia telah menanggapi pertanyaan saya sebelum keberangkatan kami, jadi dengan cepat dan secara cermat, dan sangat penuh perhatian untuk keluarga kami selama kami tinggal di bali, termasuk mengambil kami untuk tur dengan harga terjangkau, memperkenalkan supir yang bisa diandalkan ketika kami pindah ke jimbaran dan mengurus saya…",5
99, Ubud Dedari Villas,Kami memiliki empat hari tinggal di sini di mei dan itu adalah tempat yang bagus untuk angin turun dan mulai liburan anda. Stafnya luar biasa dan membawa kue ulang tahun untuk villa kami untuk merayakan ulang tahun suami saya. Sarapan di balkon setiap pagi sangat bagus seperti pemandangan hutan. Kami terutama seperti kolam renang dan kami biasanya satu-satunya orang di dalamnya. Sangat menikmati berjalan ke elephant temple meskipun kakiku yang sakit untuk hari setelah! Vila ini bersih dan luas dan tidak ada terlalu banyak kesulitan untuk staf di sana. Pasti akan datang kembali lagi tahun ini dan berharap untuk mencoba kamar baru yang berada di bawah konstruksi selama kunjungan kami.,5
100, Ubud Dedari Villas,"Kami telah tinggal di sini tiga kali sudah... dan masih menyukainya! Kami terus datang kembali untuk lebih banyak!  Staf selalu menyenangkan dan sangat membantu. Mr. Poernomo adalah yang terbaik dan pergi keluar ke jalan untuk memenuhi setiap kebutuhan anda sebagai tamu. Dia sekali membawa kami ke utara dan kami memiliki hari yang indah, yang menunjukkan kami berkeliling dan memastikan kami mengambil waktu kita di situs bagus dan restoran.   Kamar sangat luas, bersih dan nyaman! Tempat tidur adalah besar dan terasa seperti lima bintang, tidur seperti bayi!  Kolam renang adalah menakjubkan dan sangat santai.   Pemandangan dan lingkungan luar biasa! begitu banyak hijau yang indah. Tempat ini menenangkan anda turun langsung... berjalan kaki untuk yeh Puluh di pagi atau…",4
101, Ubud Dedari Villas,"Besar permata tersembunyi hanya di luar pusat kota ubud (yang terasa seperti itu akan terlalu sibuk untuk tinggal di). Hotel menawarkan antar-jemput gratis ke kota setiap hari, nasihat besar dan secara keseluruhan tempat ini adalah nilai yang fantastis untuk uang. Kami menikmati lezat sarapan di balkon kami setiap pagi, yang menghadap ke hutan hujan :)  100% merekomendasikan tempat ini!",5
102, Ubud Dedari Villas,"Kami datang ke sini untuk bulan madu kami dan itu menakjubkan, mereka pergi semua keluar untuk membantu kami, jika ada sesuatu yang salah dan anda memberitahu mereka mereka akan berada di sisi anda dalam hitungan detik, mereka membantu kami mendapatkan sekitar untuk melihat semua objek wisata yang berbeda dan mengatakan kepada kita semua tentang budaya, sarapan dan layanan kamar itu indah, jika anda beruntung ketika anda pergi dan ada pelayan bernama sandi dia indah, menakjubkan dan tertawa, semua staf lain yang semua tersenyum dan membantu. Saya tidak bisa mengatakan betapa aku mencintai tempat ini, mereka semua membuat bulan madu kami menakjubkan banyak kenangan besar ",5
103, Ubud Dedari Villas,"Villas terletak di sebuah area yang indah menghadap parit, sangat hijau dan subur. Vila agak keluar dari ubud tapi di sana ada transportasi yang dapat digunakan selama siang/malam. Kamar bersih & luas dan sarapannya baik. Saya pikir ada 5 vila, namun masing-masing memiliki ruang sendiri sehingga anda merasa seperti anda sendirian. Villa adalah pilihan yang baik jika anda ingin menghabiskan beberapa waktu hanya bersantai dan mendapatkan jauh dari keramaian. Kolam renangnya bagus dan bersih. Ada sedikit konstruksi yang terjadi ketika kami berada di sana (lobi baru) tetapi ini tidak masalah dan akan selesai oleh sekarang. Manajer & staf sangat ramah & membantu. Akan merekomendasikan kepada orang lain dan tinggal lagi",4
104, Ubud Dedari Villas,"Saya & suami saya tinggal di sini selama 2 malam di awal mei.  Villa masih di bawah konstruksi dan itu adalah kekecewaan kami bahwa pemandangan dari kamar kami diblokir karena situs konstruksi.  Alasan mengapa kami memilih untuk tinggal di sana karena dari diblokir pemandangan hijau. Jika kami telah diberitahu tentang hal ini sebelum untuk kunjungan kami, itu akan lebih dihargai.  Lokasi itu sendiri cukup indah & tenang. Manajer & staf yang ramah & informatif.  Kamar bersih & luas.  Dan sarapan adalah luar biasa.  Kami menemukan katak hidup, melompat dari lapangan ke kamar mandi kami. HAHAHA .  Mungkin manajemen dapat juga berpartisipasi dalam daur ulang yang mengacak-acak? Sejak saat kami berjalan jalan dari villa sisi gerbang menuju ke sungai,  kami menemukan banyak…",4
105, Ubud Dedari Villas,"Kami tinggal di sana selama 2 malam. Pada awalnya lokasinya cukup sulit untuk menemukan oleh sopir taksi dan pintu masuk karena sedikit kecewa karena tidak ada penerimaan. Namun, vilanya sendiri sangat bagus, pemandangan indah dan fasilitas yang baik. Staf hotel dan manajer sangat membantu. Mereka membantu memanggil taksi dan tawar-menawar untuk harga, juga desain tur untuk perjalanan singkat kami dan sibuk.",4
