,hotel,review,stars
0, Ubud Dedari Villas,"sebagai warga Jakarta yg hiruk pikuk,,berlibur di Dedari villa Ubud yg asri, mempunyai pengalaman baru yang menyenangkan, kita bisa mendengar suara2 binatang, misalnya kicauan burung, kokok ayam dipagi hari, dan dikelilingi pohon2 yang rindang, Suasananya tenang, asri , nyaman. Makan paginya jg enak. dan yg unik..ranjangnya berkelambu...romantis deh..",4
1, Ubud Dedari Villas,"Ubud semakin lama menjadi semakin komersial sehingga kemacetan lalu lintas sehari-hari menjadi hal yang lumrah. Oleh karena itu, hotel kecil yang unik ini seperti menjadi sebuah oasis di tengah kekacauan dan keributan. Hotel ini hanya memiliki 7 kamar dan kami tinggal di kamar 1, yang terdekat dengan bagian penerimaan. Staf di hotel ini ramah dan selalu tersenyum. Karena hotel ini kecil, kolam renang tidak pernah penuh dan terkadang hanya saya seorang diri di sana. Kami memesan layanan kamar 3 kali, meskipun pilihan makanan terbatas namun harganya sesuai dengan ukuran porsi yang pas. Mereka juga membantu kami memesan tur dan transportasi. Jika Anda ingin berada di tengah keramaian dan hiruk pikuk Ubud, maka tempat ini bukan pilihan terbaik karena jaraknya dari pusat kota. Tetapi…",5
2, Ubud Dedari Villas,"Tempat yang luar biasa untuk menginap. Lokasinya bukan berada di Ubud, tetapi di Dedari. Jadi, pusat Ubud tidak dapat dicapai dengan berjalan kaki bagi semua orang. Namun di sisi lain, Anda dapat menikmati suara alam sekitar termasuk air yang jatuh di tepi kolam saat Anda berada di sana. Goa Gajah berada sangat dekat. Anda dapat berjalan melewati jalan setapak menuju sungai langsung dari vila Anda. Dari tiga kali waktu sarapan, makanan kami terlambat datang sekitar 5 sampai 20 menit jadi lebih baik Anda bersiap-siap jika memiliki jadwal yang padat.",5
3, Ubud Dedari Villas,"Ini hotel yang indah. Lokasinya sangat baik, sekitar 10 menit dari pusat Ubud dengan menggunakan mobil. Mereka menyediakan antar jemput gratis yang pergi ke kota pada pagi hari dan membawa Anda kembali pada sore hari. Mereka juga dapat membawa Anda kembali kapan saja hanya dengan Rp 50.000, sekitar 5 USD pada saat kunjungan kami di sana. Restoran lokal dapat memanggilkan mereka untuk Anda dan mereka akan datang cukup cepat. Atau bisa juga panggil taksi dari jalan, tetapi bersiaplah untuk menawar hingga Rp 50.000.  Lokasinya dekat dengan Pura Goa Gajah yang kuno dan indah, hanya cukup berjalan sebentar melalui hutan hujan dari lapangan hotel. Hotel ini berada di tengah sebuah hutan kecil yang indah sehingga memberikan pemandangan yang tenteram dan menarik. Pelayanannya ramah dan…",5
4, Ubud Dedari Villas,"Itu adalah tempat yang sangat indah untuk beristirahat, kamarnya cukup besar untuk merasa nyaman dan nyaman. Layanan sangat baik, petugas hotel ramah dan penuh perhatian. "": Teh tinggi"" adalah kejutan, teh dan kopi dan tradisional Indonesia lezat. Impresif! .",4
5, Ubud Dedari Villas,"Kami memiliki pengalaman TERBAIK di Ubud Dedari Villas. Kami datang ke Bali untuk merayakan bulan madu kami. Itu cara yang sempurna untuk memulainya. Kami tinggal 7 hari. Sarapan gratis dan sangat lezat. Kolam renang / pemandangannya indah! Staf lebih dari menampung, menjadwalkan mengambil dan mengantar kami. Jika Anda tidak memilih salah satu dari waktu antar-jemput yang dijadwalkan, ada biaya tetapi lebih murah daripada memanggil taksi. Staf sangat baik dan ramah! Mereka pergi ke atas dan ke luar, suamiku melukai dirinya sendiri saat berada di Bali dan itu menyenangkan untuk melihat staf prihatin dengan memeriksa lukanya. Vila itu sangat luas dan bersih. Kami benar-benar tidak memiliki hal buruk untuk dikatakan tentang pengalaman kami. Kami pasti akan merekomendasikan tinggal…",5
6, Ubud Dedari Villas,"Itu di luar harapan kami. Dari akomodasi ke layanan, semuanya sangat baik. Kami telah menikmati sarapan terapung kami, suasana villa ini dan sikap yang baik dari staf dengan ini. Jika ditanya, poin apa yang paling berharga dari perjalanan ini, saya pasti berbagi bahwa villa ubud dedari adalah salah satunya.",5
7, Ubud Dedari Villas,"Saya tidak tahu harus mulai dari mana, tapi jelas bukan pilihan untuk menginap saat berlibur di Ubud. Pertama, ketika kami tiba staf terutama asisten manajer tidak ramah sama sekali. Mereka mencari untuk mendapatkan uang dari Anda dengan satu atau lain cara dalam hal apa pun yang ingin Anda lakukan atau kesalahan terjadi, Anda harus membayar mereka. Juga, staf nyaris tidak berbicara bahasa inggris. Pada malam pertama, saya menemukan kalajengking kecil di kamar saya dan saya segera mengalamatkannya kepada asisten manajer yang biasanya memiliki shift malam. Awalnya, tanggapannya adalah mengubah kami ke kamar yang persis sama, tetapi ia mengatakan bahwa pada umumnya kami mungkin akan melawan binatang kecil atau serangga di kamar karena hotel ini terletak di hutan. Saya mengatakan…",1
8, Ubud Dedari Villas,"Ini adalah kedua kalinya saya tinggal di Dedari (pertama kali adalah 4 tahun yang lalu) dan masih indah, damai dan ramah seperti yang saya ingat! !  Dua hal yang benar-benar membuat Dedari menonjol adalah pandangan dan staf.  Staf fantastis - sangat ramah dan membantu. Kami secara teratur melewatkan waktu antar-jemput gratis dan mereka selalu dapat membawa kami ke Ubud, dan menjemput kami ketika dibutuhkan yang membuat semuanya sangat nyaman.  Lapangan dan kamar-kamar di Dedari benar-benar spektakuler. Anda berada di sepotong surga. Semuanya ditempatkan dengan sangat indah untuk menurunkan Anda di alam. Kamar-kamar baru yang telah dibangun memiliki balkon yang menakjubkan yang menghadap ke sungai. Anda bisa menghabiskan waktu berjam-jam mengagumi pemandangan dan menikmati suara…",5
9, Ubud Dedari Villas,"Ini adalah perhentian pertama di perjalanan kami dan pasangan saya telah di sini sebelumnya, dan itu tidak mengecewakan, hanya tempat terbaik, lingkungan yang indah dan santai dengan layanan luar biasa, tidak ada permintaan yang terlalu banyak. Saya akan merekomendasikan tempat ini kepada siapa pun! Mungkin sedikit keluar dari Ubud, tetapi antar-jemput gratis selalu membantu. Kolam renang adalah puncaknya, dan saya akan menyarankan berjalan kaki singkat di hutan selama 10 menit dari hotel ke gua gajah.",5
10, Ubud Dedari Villas,"Kami tinggal di Dedari Viallas pada bulan Februari. 2019  Lokasi: + di tempat yang sangat sepi dan jauh dari pusat sibuk ubud + mereka memang memiliki layanan antar-jemput, tetapi melihat kenyataan, bahwa kita di mana kadang-kadang satu-satunya tamu yang menggunakannya, mereka mungkin mungkin sedikit lebih fleksibel dengan kita + langsung di hutan dengan pemandangan indah  Layanan  - Saya punya perasaan, bahwa hanya manajer yang benar-benar peduli tentang kita  - kami ingin memesan transportasi dengan mereka, tetapi mereka mencoba untuk membebankan biaya tripple kami kemudian apa biaya di Ubud (kondisi yang sama)  Kamar + kami tinggal di villa superior yang sangat bagus + pemandangan indah dari teras  - beberapa bagian agak tua dan terlihat sangat digunakan  - Banyak serangga di…",4
11, Ubud Dedari Villas,"Kami tinggal di kamar # 1 selama 3 malam. Pro: Lingkungan yang indah, pohon, air, kolam renang yang bagus, ketenangan Kamar-kamarnya besar, dengan kelambu dan mesin penyaring air menyediakan air panas dan dingin Sarapan disajikan di depan pintu Anda Stafnya ramah dan sangat membantu Harga terjangkau  Kekurangan: Kami melihat kecoak dan kadal di dalam ruangan, ada celah di atap dan pintu villa Air panas tidak terlalu stabil Jauh dari pusat kota, tidak ada restoran dll., Saya perlu sekali antar-jemput tetapi mereka mengatakan kepada saya bahwa mereka tidak punya mobil hari itu Kolam renang kecil, maksimal 2 ppl, dan cukup dalam, 1. 4 - 1. 9 m seperti yang saya ingat",4
12, Ubud Dedari Villas,Persembunyian rahasia yang indah sekitar 10 - 15 menit berkendara dari Ubud. Bisa lebih lama jika sibuk. Membawa kami sekitar 1 setengah jam dari bandara. Kami memiliki vila yang menghadap ke kolam renang dan sangat menikmatinya. Sangat tenang dan santai - pemandangan indah di atas hutan. Kecewa saya tidak bisa berjalan ke sungai - itu sangat jauh ke bawah dan tidak ada jalan. Menikmati berjalan-jalan di sekitar desa setempat dan ke Yeh Pulu serta gua Gajah. Sarapan baik dan makan siang / makan malam baik-baik saja - cukup dasar tapi bagus bahwa Anda makan di teras depan Anda. Staf juga sangat ramah dan membantu.,4
13, Ubud Dedari Villas,Staf yang indah dan tempat ???? kita cinta hotel ini. Semuanya sangat bagus. Kamar kami sangat besar dan segar. Kamar bersih. Tapi Sarapan tidak bagus dan tidak buruk. Kami merekomendasikan setiap pasangan. Kami mencintai ubud?,5
14, Ubud Dedari Villas,"Semua staf sangat baik, orang-orang yang menyenangkan. Kami sarapan setiap hari di vila kami. Sarapan yang baik n lezat. Villa yang luar biasa di sekitarnya n, etnis dan tradisional.  Kami pasti akan datang kembali.",5
15, Ubud Dedari Villas,"Kelebihan: Staf yang ramah, pemandangan yang bagus ke hutan hujan dari setiap kamar single, nilai yang bagus untuk uang, pengalaman menginap yang santai damai; infinity pool dengan pemandangan yang indah, tempat tidur king size di mana semua tiga dari kami tidur dengan nyaman oleh karena itu tidak perlu membayar untuk tempat tidur tambahan untuk putri kami yang berusia 7 tahun, antar jemput gratis ke dan dari pusat Ubud, tempat yang bagus untuk kembali dan bersantai setelah menghabiskan beberapa jam di Ubud yang sibuk dan ramai, kamar yang bersih dan area kolam renang. Kami memiliki beberapa masalah kecil staf yang ditangani dengan sangat profesional dan efisien. Saya akan mengatakan vila dan sekitarnya dalam kehidupan nyata terlihat jauh lebih baik daripada di dalam foto. …",5
16, Ubud Dedari Villas,"Pengalaman menginap yang fantastis di Dedari villas. Pemandangan hutan dari kamar dan kolam renang yang bagus, dengan diambil oleh staf care untuk menjaga tempat yang bersih dan efisien. Naik taksi sebentar dari jalan-jalan yang ramai di Ubud, tapi layak di setiap jalan.",5
17, Ubud Dedari Villas,"Kami menginap di Villa Ubud selama seminggu, sementara kami mencari sebuah rumah untuk tinggal lama. Yang luar biasa, keramahan staf, supir, manajer dapur dan keramahan staf membuat anda merasa di rumah, saya couldstay di sini untuk bulan, saya akan senang untuk menyelesaikan saudara saya ketika mereka mengunjungi saya di Ubud di hotel ini, sangat puas dengan pengalaman secara keseluruhan, pemandangan yang bagus ke arah hutan, banyak burung, kami sangat menyukai tempat ini.",5
18, Ubud Dedari Villas,"Tempat ini sangat santai dan indah. Kami merasa jadi satu dengan alam dengan pemandangan, pancuran luar ruangan, dll. Kami menginap di villa dengan 1 tempat tidur dan akan sangat merekomendasikan tempat ini. Benar-benar tenang. Staf yang menyenangkan. Sarapan yang sudah termasuk. Antar jemput itu nyaman dan mereka sangat membantu kami, bahkan ketika kami melewatinya. Satu-satunya hal yang akan saya katakan memerlukan peningkatan adalah menu. Tidak ada restoran, jadi makanan yang membawa anda ke kamar tapi tidak fantastis.  Kami menginap di 3 tempat di Bali dan yang satu ini sudah menjadi salah satu favorit saya.",5
19, Ubud Dedari Villas,"Vila ini pasti Dedari tempat untuk pergi ketika menginap di Bali. Kamarnya sangat luas dengan dekorasi yang indah, makanan terbatas tapi sangat lezat, staf yang sangat membantu dan ramah dan secara abnormal dekorasi taman mereka&kolam renangnya cukup ajaib dengan pemandangan hutan hujan tropis yang indah. Sejujurnya, selama 2 minggu kami menginap di Dedari Villa, semuanya sempurna. Mereka akan melakukan segala sesuatu untuk memenuhi kepuasan anda. Salah satu yang terbaik yang pernah saya terima. Layanan Terima kasih banyak Dedari Villas!",5
20, Ubud Dedari Villas,"Ubud Dedari Villas staf berusaha untuk kami. Mereka sangat baik, membantu, komunikator yang hebat, dan makanan yang disediakan oleh layanan kamar yang sangat konsisten baik. Saya suka pisang pancake untuk sarapan. Orang-orang luar biasa ini bahkan saya terkejut dengan kue ulang tahun ketika mendengar seorang sopir Shuttle saya menyebutkan bahwa itu adalah hari ulang tahun saya. Saya tidak bisa mengatakan cukup tentang layanan pelanggan mereka. Jangan berpikir, hanya buku kamar. Anda akan senang Anda lakukan.",5
21, Ubud Dedari Villas,"Apa tempat yang luar biasa! Ketika kami pertama kali tiba di Villa, kami tidak tahu apa yang diharapkan. Pintu masuk hotel mungkin terlihat kecil, tetapi ketika Anda masuk untuk melihat villa yang luar biasa. Kami punya kamar dengan balkon dan tempat tidur ukuran raja dan pemandangan spektakuler. Saya tidak mengharapkan pemandangan yang sangat menakjubkan. Shower, bak mandi, dan toilet terletak di dalam kamar hotel dan Anda dapat mendengar suara alam. Ruangan itu sangat bersih dan sangat luas. Meskipun kami tidak menggunakan internet atau kabel karena banyak, kami tidak pernah memiliki masalah dengan koneksi. Kamar hotel ini juga memiliki sebuah brankas, payung, dan jubah mandi. Jika Anda memesan sarapan di tempat tidur, Anda berada dalam untuk mengobati karena sarapan dibawa ke…",5
22, Ubud Dedari Villas,Ansoluelty luar biasa!  Pastikan Anda memiliki nomor telepon dan alamat sebagai taksi tidak tahu di mana tempat dan memanggil.  Kami tiba sangat terlambat tetapi staf masih bersedia untuk mempersiapkan makanan untuk anak saya.   Staf tidak bisa melakukan cukup bagi Anda.  Sarapan diantar ke kamar karena tidak ada restoran - yang baik yang diberikan di napas mengambil pemandangan hutan tropis.  Kamar yang besar. Kamar mandi yang besar. Tetapi kamar mandi yang bertautan di atas dinding luar ruangan terbuka untuk di luar sehingga suhu - jadi jika Anda seperti AC tetap menutup pintu kamar mandi.  Wifi di dalam kamar.  Air dingin di kamar adalah keuntungan yang besar.  Suatu hari kami satu-satunya orang di sana.  Dapat mengatur pijat dengan pemberitahuan yang sangat singkat.  Taksi…,5
23, Ubud Dedari Villas,"Tempat ini adalah tempat yang sempurna di tengah hutan!   Kamar Tidur: Kami tinggal di 1 tempat tidur vila dan itu sangat bersih, luas, tempat tidur sangat besar dan termasuk pendingin air dan kelambu. Ada begitu banyak jendela untuk membiarkan cahaya dan pemandangan menghadap ke hutan. Satu-satunya hal yang saya tidak sangat baik dengan kami di kadal yang semakin dalam - satu malam besar di langit-langit - terima kasih Tuhan untuk jaring nyamuk!   Fasilitas: Kami cukup banyak mengambil keuntungan dari semua yang ditawarkan; kolam renang, layanan pijat, layanan kamar, layanan antar jemput Ubud, layanan transportasi bandara. Semua bagus dan membuat kami tinggal yang menyenangkan. Satu hal lagi adalah bahwa Hotel tampaknya sangat besar dalam gambar, tapi ada hanya 12 kamar yang…",5
24, Ubud Dedari Villas,"Tinggal di sini selama 8 malam dan kami menyukainya. Seperti yang damai dengan pemandangan hutan dan suara air dan burung dan serangga di sekitar Anda. Kami tinggal di Villa 10 yang terlihat seperti villa baru dan sangat nyaman, tempat tidur besar, mesin air di kamar dengan air panas dan dingin air yang disaring sehingga kami bisa mengisi botol kami setiap hari. Kamar mandi yang bagus, kolam renang handuk disediakan, adaptor di dalam kamar, buah pada saat kedatangan. Baik ukuran kolam renang. Taman sangat terawat dengan baik. Sarapan yang lezat diantarkan ke kamar Anda setiap pagi, juga pilihan bervariasi. Sebagian besar dari semua staf yang sangat ramah, sopan, ramah, selalu tersenyum. Shuttle bus gratis dari dan ke Ubud. Kami menyewa mobil selama kami tinggal dan mereka…",5
25, Ubud Dedari Villas,"Bayangkan: malam hari, pohon raksasa yang hanya beberapa langkah menjauh dari Anda. Dan Anda melihat suara, suara alam liar, Anda melihat bintang-bintang yang jatuh ke dalam kolam renang. Anda terlihat begitu saja dan hidup dikelilingi oleh pulau yang fantastis. Ini adalah bagian terkecil saya merasa tentang hotel ini. Saya sangat bersyukur.",5
26, Ubud Dedari Villas,"Saya dan teman saya tinggal di hotel ini di kamar superior ganda. 60 per malam (total) untuk tiga hari untuk minggu ini dan karena itu musim rendah, kami memiliki seluruh tempat untuk diri kita sendiri! Tak Bertepi - kolam renang luar biasa dan gaya yang santai tempat untuk mengambil beberapa waktu untuk diri sendiri, terutama setelah tinggal di hostel ini sebelumnya. Itu sangat Instagrammable! Staf pergi ke setiap upaya untuk membantu dan membantu kami, menyewa taksi, membuat rekomendasi dan memberi kami gratis menurunkan dan menjemput dari kota yang membuat perbedaan besar karena Ubud adalah membingungkan untuk berkendara di sekitar dan tersesat di sepeda motor yang banyak! Sarapan sudah termasuk dan sangat lezat; kami memilih dari daftar pilihan dan diantarkan ke kamar kami…",5
27, Ubud Dedari Villas,"Apa yang Anda lihat dalam gambar adalah apa yang Anda dapatkan. Kolam renang yang indah pengaturan menghadap ke hutan. Minuman pada saat kedatangan, staf yang sangat ramah. Kami memiliki kamar yang menghadap hutan, sarapan yang dikirim ke teras kami. Makanan yang indah. Kamar yang bersih dengan air filter (bagus tidak harus membeli botol) adaptor listrik juga. Tempat tidur paling nyaman yang kami tinggal di di Bali. Antar-jemput gratis ke pusat kota juga sebagai untuk bandara menjadi pilihan, atau destinasi lain untuk harga yang sangat baik. Berjalan kaki singkat ke Goa Gajah. Kami akan kembali, benar-benar suka menginap di sini! 10/10 benar-benar ajaib. Tidak bisa menunggu untuk kembali lagi.",5
28, Ubud Dedari Villas,"Kami baru saja tiba malam terakhir di sini dan kami menyukainya! Layanan ini luar biasa. Minuman pada saat kedatangan, membantu kami dengan kantong kami, baik layanan kamar & makanan yang baik (dan murah). Hotel ini tidak terlalu ramai sehingga kami telah diupgrade ke salah satu villa. Hotel ini bersih dan mereka menyediakan dispenser air di kamar sehingga tidak perlu membeli banyak air botol. Mereka juga menyediakan adaptor colokan listrik yang sangat berguna bagi kami karena kami tidak punya. Mereka memiliki layanan antar-jemput gratis ke pusat Ubud dan antar-jemput ke bandara ($40) dan tempat lain seperti Kuta, Seminyak dan yang lain hanya untuk (30) yang berdarah BAIK. selama satu jam dan setengah drive! Mereka juga memiliki wanita yang berjalan di sekitar dengan insence di…",5
29, Ubud Dedari Villas,"Layanan benar-benar hebat, ideal untuk kebersihan kamar, sarapan sangat baik, wilayah yang sempurna dan pemandangan dari ruangan teras dan kolam renang.   Lokasi yang baik, meskipun lebih baik jika Anda memiliki sepeda - semua tempat-tempat utama di Ubud banyak kuda. Meskipun jika Anda tidak memiliki sepeda, Hotel menawarkan layanan antar jemput gratis ke pusat kota.",5
30, Ubud Dedari Villas,"Mengunjungi hotel ini pada 9 Oktober th - 10 th, 2016. Kami tiba agak terlambat di sore hari dan kami disambut dengan senyum hangat dari resepsionis. Mereka menyambut Anda dengan minuman selamat datang dan handuk dingin sehingga Anda akan merasa lebih segar. Saya memesan kamar Deluxe tapi saya terkejut ketika mereka upgrade saya ke salah satu villa (s) jenis menarik yang mereka punya (villa 3), menempatkan saya tepat di tengah dengan pemandangan ke kolam renang dan hutan di belakang hotel.   Villa indah, mereka menempatkan mawar di bantal (yang sangat manis), itu sangat bersih dan mereka bahkan memberikan buah segar. Kamar sangat luas, ruang cukup besar dengan sangat nyaman sofa besar. Pemandangannya sangat indah dan bagi mereka yang ingin menghabiskan waktu jauh dari kehidupan…",4
31, Ubud Dedari Villas,"Aku tinggal di sini selama 3 hari. Dan mencintai setiap bit dari kami tinggal. Di tengah hutan yang sangat hijau, tempat ini adalah definisi damai.   Sambutan yang sangat hangat dari staf ketika kami pertama kali tiba. Mereka menawarkan jus jeruk dan dingin handuk basah. Kami mengambil koper dan mengantar kami ke villa kami untuk menjelaskan apa itu.   Staf berbicara bahasa inggris dan mereka belajar sendiri yang sangat bagus. Selalu ada senyuman besar di wajah mereka, yang menunjukkan bahwa mereka siap untuk membantu anda dalam setiap cara yang mungkin.   Kebetulan kami menginap di villa 10, dan itu adalah yang terbesar yang mereka katakan. Kamar memiliki teras besar dengan meja dan dua kursi, dipan untuk dua dan satu kursi lain. Penerangan yang cukup gelap malam di ubud. Kamar…",5
32, Ubud Dedari Villas,"Kami tinggal hampir 3 minggu di villa dedari. Lokasinya bagus, hanya 15 '-20' dari pusat ubud. Lokasi yang tenang dengan pemandangan yang menakjubkan, juga dari kolam renang, dekat ke hutan dan lembah yang berdekatan dengan goa gajah.  Shuttle ke/dari ubud beberapa kali per hari. Villa yang bersih. Bottlefountains dengan air minum di setiap villa. sangat baik staf dipandu oleh manajer umum yang sangat terlatih. Kami benar-benar menikmati dan pasti akan kembali lagi! ",5
33, Ubud Dedari Villas,"Meskipun ulasan ini datang sedikit terlambat, tapi aku menulis itu turun karena tempat ini pasti sepadan!  Staf yang luar biasa - sangat sopan & efisien, makanan yang baik, sangat selera dilakukan atas villa, kolam renang yang luar biasa, sangat dekat dengan pusat kota namun jauh dari keramaian-ini membuat liburan yang sempurna untuk tinggal. Saya sangat menyukai tempat ini, dan saya merekomendasikan untuk semua orang yang mencari tempat yang tenang di ubud. ",4
34, Ubud Dedari Villas,"Staf besar, hotel bagus, tepat di samping hutan hujan, beberapa angkutan gratis ke ubud (dan kembali ke) per hari. sangat fleksibel (meminta untuk satu hari sebelum transfer bandara dan mengatur sendiri perjalanan di hari yang sama. Tidak dapat merekomendasikan sangat cukup!",5
35, Ubud Dedari Villas,"Ini adalah pertama kalinya saya mengunjungi pedesaan Bali - Ubud. Saya menemukan tempat ini berdasarkan rekomendasi dari teman-teman dan keluarga. Saat tiba di Bandara DPS, saya dijemput oleh awak Hotel. Perjalanan memakan waktu sekitar satu setengah jam dengan lalu lintas lokal. Segera setelah saya tiba di Ubud Dedari Villas, selamat datang minuman yang disajikan. Proses check - in yang sangat cepat dan lancar.   Vila yang penuh pada waktu itu, jadi saya diakomodasi di kamar deluxe, yang cukup bagus. Yang paling favorit adalah kamar memiliki balkon pribadi yang menghadap ke hutan hujan dan desain kamar mandi yang besar dengan aksen khas Bali.   Di luar kamar, kolam renang luar biasa - pemandangan menakjubkan. Coba juga perhatikan bahwa Hotel menyediakan layanan bus antar jemput…",5
36, Ubud Dedari Villas,"Halo! Saya menginap di dedari 3 agustus lalu dengan teman saya. Layak di setiap penny. Staf sangat ramah, mereka membuat anda merasa di rumah. Aku suka daerah ini juga dikelilingi dengan pohon-pohon. Sangat tenang dan damai. Saya menginap di vila #2 sangat luas termasuk kamar mandi. Saya akan mengunjungi ubud dedari dan akan tinggal di lagi. Terima kasih untuk semangat dan semua rekan kerja untuk menyambut saya dan teman-teman saya.",5
37, Ubud Dedari Villas,"Jika anda ingin tempat yang tenang untuk bersantai, anda akan menemukan tempat yang sempurna di ubud dedari villa. Aku menghabiskan 3 hari di sana. Saya mendapat villa, kamar besar, bersih dan indah. Bunga segar menyambut anda ketika anda masuk. Teras besar di mana kita memiliki sarapan yang dikirim dan jika anda datang dengan keluarga lain yang anda dapat meminta staf hotel untuk menetapkan sarapan di beranda. Hotel staf sangat bahagia untuk membantu dan bahkan menunjukkan jalan ke gua. Jika saya di kesehatan yang lebih baik, aku akan menyukai untuk melihat air terjun juga. Ini adalah tempat yang anda akan senang untuk datang kembali lagi againa nd.",5
38, Ubud Dedari Villas,"Kami memiliki pengalaman menginap yang menakjubkan di dedari villa! Kamarnya bersih dengan bunga-bunga segar di mana-mana. Sarapan adalah disertakan dan benar-benar sempurna. Anda memiliki sejumlah pilihan, tapi kami menyukai pisang pancake dan jus segar. Pemandangan indah hutan. Karena penginapan ini tidak terletak di pusat kota yang kami tidak punya masalah jatuh tertidur. Semuanya ini mudah dicapai dengan sepeda motor, yang dapat disewa di meja resepsionis. Tetapi hal terbaik tentang akomodasi adalah staf. Tidak pernah memiliki aku pernah bertemu seperti baik, manis dan membantu orang! Mereka akan melakukan apa pun untuk membuat pengalaman menginap anda senyaman mungkin. Kami memesan transfer dari bandara ke hotel dan anggota staf yang menunggu untuk kami dengan botol air dan…",5
39, Ubud Dedari Villas,"Kami hanya tinggal di ubud dedari villas untuk 5 hari/4 malam, dan kami memiliki tinggal yang menyenangkan. Hotel ini tidak penuh selama kami tinggal dan kami sangat senang bermain di kolam renang dan bersantai di balkon kami.  Hotel menyediakan pelayanan yang sangat memuaskan, dari penjemputan di bandara, ke layanan, mereka membantu kami merencanakan perjalanan (dan memesan) pada situs web dan layanan pijat. Kami dapat memesan pijat dengan pemberitahuan yang sangat singkat, dan ahli pijat yang baik dan harga yang adil.   Kamar kami adalah besar dan bersih, dan menyediakan banyak pilihan tempat duduk di luar. Tempat tidur yang tidak terlalu empuk, dan mereka menyediakan tempat tidur tambahan untuk putri kami yang bisa juga di kamar. Dispenser air, kopi/teh membuat fasilitas,…",5
