,hotel,review,stars
43, Udhiana Resort Ubud,"10/10 merekomendasikan tinggal di sini jika anda setelah sesuatu yang terpencil, tenang, indah dan santai. Seperti cara yang bagus untuk mengakhiri hari yang sibuk di 7 di Seminyak. Layanan luar biasa, staf yang sangat menyenangkan & secara keseluruhan tempat yang indah untuk tinggal. Akan datang kembali untuk mengunjungi ketika di sini lain.",5
44, Udhiana Resort Ubud,"Saya menginap beberapa malam di Udhiana Resort Ubud baru-baru ini dan benar-benar menyukainya.   Pada kedatangan saya bertemu dengan staf yang ramah dan tas kami dibawa ke saya dari saat saya check in.   Minuman selamat datang disajikan yang lezat, dan setelah check in yang cepat. Saya diantar ke kamar saya dengan Buggy (Resor ini cukup curam).   Villa saya adalah luas, sangat bersih dan memiliki kamar mandi yang bagus.   Kolam Renang (lebih dari memadai), melihat hutan yang rimbun adalah tempat yang sempurna untuk bersantai setelah hari yang sibuk.   Besar tempat tidur, banyak bantal, wifi yang cepat, dan ada banyak ketenangan!   Sarapan sangat baik - Saya rasa tanda koki yang bagus adalah mereka telur Benediktus dan itu sempurna.   Saya juga punya makan siang dan makan malam…",5
45, Udhiana Resort Ubud,"Saya dan mitra saya tinggal di sini selama 5 malam (kamar 104). Vila-vila indah, nyaman king size bed, menakjubkan pemandangan hutan, kolam air terjun pribadi. Apa yang bisa tidak disukai? Layanan ini juga sempurna. Mengecilkan Layanan setiap malam, staf menyiapkan obat nyamuk dan merapikan kamar, dan di pagi hari ketika kami turun untuk sarapan kami akan kembali ke kamar kami sudah dibersihkan dengan handuk segar! Satu-satunya keluhan yang saya punya adalah bahwa beberapa Handuk Bernoda dan butuh pemutihan. Selain itu, semuanya sempurna. Saya sangat menyukai teh sore gratis. Layanan antar-jemput gratis ke pusat kota juga sangat bagus. Kami akan kembali lagi secepatnya! Jika Anda mencari untuk liburan tenang dan damai di lokasi yang menakjubkan. Anda tidak akan kecewa!  Terima…",5
46, Udhiana Resort Ubud,"Menghabiskan 3 malam di sini dan saya berharap ini bisa menjadi Minggu! Berikut adalah highlights:   - Villa: tampak sangat baru, baik - dilengkapi dan dilengkapi dengan besar, tempat tidur yang nyaman. Benar-benar menyukai kolam renang dengan dapur di Villa~saya sudah pernah ke beberapa kolam renang tapi satu ini mengalahkan mereka semua. Selain itu, pemandangan di setiap sudut di Villa/resort sangat mengagumkan! Tidak bisa berhenti mengambil foto selama waktu kami di sini.   - Pelayanan: Staf dari penerimaan, restoran dan layanan antar jemput ke keamanan yang benar-benar ramah dan mencoba terbaik mereka untuk mengakomodasi permintaan kami.   - Lokasi: tidak dalam jarak berjalan kaki ke pusat kota, tapi ada layanan antar-jemput gratis yang berjalan setiap jam dari pukul 8…",5
47, Udhiana Resort Ubud,"Kami menghabiskan seminggu. Sebagian besar waktu itu merasa seperti resor pribadi. Hampir tidak melihat siapa pun. Kolam renang sangat bagus. Kolam renang pribadi adalah sempurna. Makanan terbatas tapi bagus. Sarapan adalah berlimpah dan termasuk dalam harga. sangat pribadi. tempat tidur yang nyaman. Pancuran air yang bagus. Gratis mobil ke kota. Layanan kamar yang sangat baik, apa pun yang Anda inginkan setiap kali Anda ingin. Jika Anda ingin beberapa tenang waktu itu sempurna. Layanan laundry murah dan baik. Pergi ke hotel untuk pijat di sebelah. Dua jam karena beberapa 2, 400, 000 RPS. Ini adalah fantastis dan pribadi.",5
48, Udhiana Resort Ubud,"Udhiana menawarkan kesepakatan yang luar biasa tidak hanya dalam layanan pelanggan tetapi dengan pemandangan.   Staf sangat ramah, sopan dan ramah. Tidak ada tugas adalah terlalu keras dan meskipun di beberapa kali hal-hal yang bisa telah tersesat dalam terjemahan kami tiba di sana di ujung jalan.   Hotel itu sendiri: -   Tempat ini terkenal di sisi samping. Perjalanan ke hotel adalah melalui jalan-jalan kembali. Ini adalah sesuatu yang Anda akan berharap bahwa Anda mencoba untuk mendapatkan ke atas bukit dan hutan. Saat tiba di staf mereka untuk menyambut Anda. Justru yang membuat Anda merasa seperti Anda sendiri tempat dan hanya kembali dari perjalanan jauh. Ada beberapa langkah untuk mendapatkan antara tingkat jadi jika Anda memiliki masalah dengan berjalan kaki maka…",5
49, Udhiana Resort Ubud,"Tempat yang menakjubkan dengan pemandangan yang menakjubkan. Villa adalah segala sesuatu yang kita bisa bertanya untuk staf juga. Mereka melakukan apa pun yang mungkin untuk bertemu dengan harapan kami, bahkan menyiapkan potongan kecil pisang, yang tidak pada menu, hanya karena saya benar-benar merasa seperti tempat ini untuk makanan penutup. Fakta menarik: itu adalah yang terbaik yang kami punya di pisang sisa kami seluruh 3 minggu di Indonesia! Jadi tolong, tolong, termasuk dalam menu restoran!",5
50, Udhiana Resort Ubud,"Kami punya waktu yang indah di resor ini, berada di luar hutan membawa Anda ke surga. Kolam renang pribadi di kamar juga luar biasa di mana Anda dapat bersantai. pasti yang paling indah yang pernah saya alami di resor",5
51, Udhiana Resort Ubud,"Tempat ini sangat indah! ! ! Bahkan lebih baik daripada gambar di internet. Tempat yang sangat tenang, sangat tenang, terletak di bukit (? ) menghadap ke bukit lain dengan banyak pepohonan palem yang memberikan pemandangan yang menakjubkan dimana kamar mandinya sangat Anda berada di resor. Seluruh staf sangat ramah dan efisien - dari meja depan (jana sangat baik), untuk orang-orang di restoran, staf kebersihan dan supir yang membawa Anda ke pusat kota Ubud (gratis! ). Villa dengan kolam renang pribadi dan balkon yang menakjubkan, dari lantai ke langit-langit jendela di ruang memberikan Anda pemandangan spektakuler setiap pagi. Kamar mandi sangat luas dengan pencahayaan yang alami. Akan memesan tempat ini lagi ketika saya di Bali.",5
52, Udhiana Resort Ubud,"Ini adalah tersembunyi dari jalan raya utama ubud, dan oleh karena itu sangat tenang. Hotel ini masih sedang dibangun, dan hanya sekitar 9 unit terbuka, merasa sangat pribadi. Kamar dilengkapi dengan baik, dan benar-benar menikmati pemandangan dari kolam renang dan balkon. Membuka tirai elektronik di tempat tidur di pagi hari untuk melihat pemandangan yang menakjubkan.  Shuttle bus ke kota bekerja dengan baik, meskipun aku merasa lebih mungkin diperlukan karena kamar yang tersedia.  Layanan dan staf yang membuat kunjungan kami menjadi sangat pribadi dan ramah. Mereka membantu mengatur taksi untuk perjalanan ke area persawahan dan juga transportasi ke bandara. Makanan yang sangat baik di restoran. Menikmati teh di sore hari juga ditawarkan. Akan sangat merekomendasikan tempat ini…",5
53, Udhiana Resort Ubud,"Pemandangan yang menakjubkan dari kolam renang pribadi. Staf, makanan & kamar yang sangat sempurna. Kolam renang privat, dekorasi, pemandangan. staf yang peduli. Kamar bersih, watter setiap hari. Restoran sangat baik. Mobil antar jemput setiap hari, gratis ke pusat ubud. Banyak layanan... pijat, menyewa skuter... dll",5
54, Udhiana Resort Ubud,"Sebelum aku pergi ke ubud. Saya tidak bisa memutuskan apakah akan tinggal di jantung pusat ubud atau sedikit jauh dari keriuhan turis. Ternyata tinggal sedikit jauh, negara, pengaturan yang sempurna. Anda akan mendapatkan momen pemandangan yang tenang tidak terganggu, dan anda tidak akan mendapatkan di pusat ubud, dan singkat, nyaman hotel shuttle ke kota setiap kali anda ingin sedikit aksi. Saya juga menemukan shuttle pendek naik ke kesempatan yang bagus untuk menanyakan beberapa pertanyaan tentang kota, dan mendapatkan semacam berbaring dari tanah, tanpa harus menyewa pemandu wisata.   jadi ini adalah apa yang saya pikir adalah yang terjadi dengan Udhiana. Mereka adalah sebuah resor yang sangat baru (hanya membuka beberapa bulan), dan belum dibangun. Tapi jangan khawatir -…",5
55, Udhiana Resort Ubud,"Saya dan pacar saya pergi ke Udhiana resort hanya untuk mendapatkan jauh dari keramaian jalan dan daerah turis yang dapat melelahkan. Dan kita tidak bisa lebih bahagia dengan pilihan kami untuk tinggal di Udhiana. Tersembunyi di tengah-tengah bukit hutan di ubud, ini adalah liburan yang sempurna. Ketika kami berada di sana, hanya 9 unit yang tersedia. jadi, tempat ini benar-benar damai. Karena jumlah unit yang rendah (jadi sedikit jumlah tamu) layanan ini sangat baik dan pribadi. Setiap pertanyaan kami atau anda ingin membuat pemesanan di restoran yang mereka akan lakukan untuk anda.   Kamar sangat bagus dengan tempat tidur yang sangat besar dan nyaman. Kamar datang dengan sebuah teras kecil yang bagus dan sebuah kolam renang tanpa batas yang memiliki pemandangan yang luar…",5
56, Udhiana Resort Ubud,"Kami tiba di ubud, benar-benar tidak tahu apa yang diharapkan. Setelah sedikit kesulitan menemukan tempat (sopir taksi kami tidak dari ubud), kami disambut dengan minuman selamat datang dan staf yang ramah. Pemandangan dari semua aspek dari hotel ini luar biasa, lembah yang berhutan lebat. Kamar dirancang dengan indah dengan beberapa pandangan yang sama, kolam, dipikirkan dengan baik dilengkapi.  Kami memiliki teh sore dan sarapan, keduanya sangat lezat.  Karena hotel ini tidak di pusat ubud (hal yang bagus), hotel mengatur transportasi reguler dari dan ke pusat kota, yang membuat hal-hal jauh lebih mudah.  Kami hanya tinggal satu malam. Saya berharap kami bisa tinggal lebih.  Satu-satunya hal negatif yang kecil adalah nyamuk dapat masuk ke kamar karena ada celah kecil di pintu,…",5
57, Udhiana Resort Ubud,"Setelah mencoba dua hotel lain di ubud dan menjadi sangat kecewa kami akhirnya memesan vila di resor Udhiana menit terakhir dan tidak bisa lebih bahagia. Hotel indah ini terletak sangat dekat dengan daerah utama ubud dan belum merasa terpencil dengan pemandangan sawah. Kolam renang di area umum yang fantastis - itu kecil kolam renang di setiap vila. Kamar luas, bersih dan dirancang dengan baik dengan teras untuk lounge di dan kopi/teh kecil daerah. Sarapan juga lezat. Staf adalah sangat ramah dan membantu. Kami meminta untuk kelas memasak dengan koki dan menikmati itu sangat banyak dengan suami saya. Koki kami menyiapkan beberapa dingin dan makanan yang lezat. Kelas memasak dipasang tepat di tepi kolam renang dengan meja makan yang romantis. Pasti akan ingin kembali lagi!",5
58, Udhiana Resort Ubud,"Kadang-kadang hidup anda lemon, terkadang 100sqm suite dengan tempat berjemur & kolam renang anda sendiri. Pemandangan dari kamar adalah hanya luar biasa, layanan adalah sempurna, tempat ini adalah surga. 10 menit ke istana ubud, gratis shuttle berlari kembali dan keempat setiap jam. Jika anda berada di ubud tidak perlu melihat lebih lanjut, ini adalah tempat yang akan. Hotel ini masih sangat baru, beberapa suite masih selesai, sabun dispenser di mandi saya mengambil 5 alat pertama yang mendorong untuk mendapatkan sabun keluar, yang berarti saya sangat banyak kemungkinan yang pertama untuk menggunakan ini. Luar Biasa! ",5
59, Udhiana Resort Ubud,Resor ini terletak di hutan dan memiliki pemandangan yang sangat bagus. Kamarnya besar dengan kolam renang pribadi dan balkon. Staf adalah sangat ramah dan membantu. Makanan di restoran yang lezat. Satu-satunya kekurangan tentang resor ini adalah bahwa kita punya masalah dengan kadal besar ruang tamu di dalam kamar. Dinding kamar mandi memiliki lubang besar di mana untuk mendapatkan setiap makhluk di kamar dengan mudah. Mereka pindah kami ke ruangan lain tapi kami masih memiliki masalah yang sama. itu adalah sebuah resor baru dan mereka masih memiliki cara untuk pergi di sebuah hotel bintang 5.,3
60, Udhiana Resort Ubud,Teman saya dan saya tinggal di resor ini dan di mana benar-benar senang dengan pengalaman. Vila kami dilengkapi dengan kolam renang yang indah dan kamar yang menghadap ke arah hutan tropis yang subur. Staf yang sangat menyenangkan dan menghadiri untuk setiap kebutuhan kami. Kita di mana senang dengan sarapan gratis dan gratis teh sore setiap hari. Makanan lezat tapi tidak untuk menu yang luas. Vila itu indah dan kami kewalahan dengan pengalaman menginap kami dan akan sangat merekomendasikan Udhiana resort. ,5
61, Udhiana Resort Ubud,"Pemandangan dari resor ini luar biasa, itu sangat tenang, staf sangat membantu, dan penduduk setempat sangat bagus juga. Villa kami adalah luar biasa. Salah satu daerah untuk perbaikan akan menjadi makanan di restoran. Kami menemukan makanan untuk menjadi baik, tapi tidak luar biasa yang anda harapkan dari jenis akomodasi/resort. Kami akan pasti datang kembali. Terima kasih untuk semua staf. Kami memiliki besar tinggal di sini dan sangat merekomendasikan resor ini untuk orang lain.",5
62, Udhiana Resort Ubud,"Yah... apa yang bisa saya katakan. Resor ini adalah surga di bumi. Pasangan saya dan saya yang bepergian ke bali, dan memutuskan kami ingin menghabiskan sedikit waktu di awal di ubud untuk benar-benar bersantai. Pada titik ini dalam waktu tetapi kita telah tidak ada ulasan Udhiana berpikir bahwa tentu saja gambar tidak berbohong bahwa banyak! jadi kami mengambil kesempatan dan itu dengan tidak melunasi.   Resor ini adalah benar-benar mewah di jantung hutan ubud. Hanya 5 - 10 menit naik taksi yang pendek dari pusat ubud (dan gratis shuttle layanan yang disediakan oleh resor). Pertama kali tiba kami yang sedikit skeptis - kami menolak kembali setelah kembali jalan dan kami tampak mengular sepanjang jalan perumahan tapi kemudian anda datang untuk membersihkan dan ini - SURGA DI…",5
63, Udhiana Resort Ubud,"Pemandangan yang menakjubkan dan layanan yang luar biasa. Kamar ini indah - mereka telah memikirkan semua yang anda butuhkan (pengusir nyamuk, sabun, pisau cukur dll). Kamar memiliki dapur kecil dan kolam renang luar ruangan dengan pemandangan luar biasa dari pedesaan ubud. Kami memiliki makan malam di restoran, yang merupakan pengalaman yang luar biasa dengan makanan lain. Sebuah resor yang luar biasa! ",5
