,hotel,review,stars
0, Udhiana Resort Ubud,"Wow tempat memulai tempat ini hanyalah dunia lain. Staf hotel adalah manusia yang paling menakjubkan dan sopan. Setibanya kami di mana disambut dengan mock - tail dan buah dan tusuk sate cokelat. Tersedia teh sore gratis antara 3 - 5. Kamar itu tidak nyata. Begitu luas dengan tempat tidur dan kamar mandi besar dan tentu saja kolam renang pribadi sangat cantik. Kami memilih untuk sarapan terapung yang hanya IDR 75000 untuk ruangan jadi sangat murah karena sarapan sudah termasuk dalam tarif kamar. Dari awal hingga akhir, pengalaman itu luar biasa. Hotel dan kolam renangnya sangat memukau dan pemandangannya luar biasa. 100% akan kembali. Terima kasih banyak.",5
1, Udhiana Resort Ubud,Resor yang luar biasa. Kamarnya bersih dan sangat romantis. Saya suka memiliki kolam di kamar kami. Saya tidak bisa mengatakan cukup tentang staf. Mereka sangat akomodatif dan baik. Saya pasti akan kembali.  Kolam infinity utama itu indah. Pemandangan hutan sangat menakjubkan.,5
2, Udhiana Resort Ubud,Kamar yang indah dengan kolam renang pribadi dan teras. Kamar mandi yang sangat bagus. Staf benar-benar baik. Mereka selalu tersenyum dan memperhatikan tamu. Anda benar-benar merasakan kebaikan dan energi positif mereka. Lokasi tidak terlalu jauh dari pusat Ubud dan ada layanan antar-jemput untuk menurunkan Anda di dalam atau di luar pusat kota. Tapi sayangnya tidak setelah jam 10. 00:00 Hutan di depan resor sangat indah. Tempat yang indah. Saya benar-benar merekomendasikan resor ini.,5
3, Udhiana Resort Ubud,"Saya dan istri saya tinggal di Udhiana selama 4 hari.  Kesan pertama adalah ketenangan langsung. Sebuah ""lobi"" fantastis yang menghadap ke lembah sungai, diliputi vegetasi hutan lebat, adalah tempat Anda check-in, dan mengikuti ke kamar Anda, yang terletak di teras, sehingga Anda memiliki pemandangan sendiri ke lembah.  Kamar-kamar tidak menyisakan apa pun yang diinginkan, dengan pemandangan fantastis, standar kebersihan yang sangat tinggi, dan dek yang indah, tempat Anda dapat menikmati matahari, kolam renang, dan suara hutan.  Resturentnya patut dipuji, menyajikan hidangan reguler internasional, dan hidangan lokal Bali. Sarapannya fantastis, disiapkan dengan baik, dan lezat. Bervariasi cukup untuk tinggal lebih lama. Makanannya sangat memuaskan, dan keseluruhan pengalamannya…",5
4, Udhiana Resort Ubud,"Ketika kami membuka tirai tanpa turun dari tempat tidur pada pagi pertama kami dan melihat pemandangan yang kami tahu kami telah membuat pilihan hotel yang tepat. Segala sesuatu tentang itu sangat indah. Pengaturan hanya mengambil napas. Staf sangat ramah dan membantu. Kamar luas dengan tempat tidur yang sangat nyaman dan sprei, dan kolam renang yang luar biasa. Makanan dari restoran lezat dan ada sentuhan indah teh sore gratis yang lezat setiap hari. Semuanya luar biasa.",5
5, Udhiana Resort Ubud,"Udhiana Resort jelas merupakan salah satu dari jenis! Resor ini menakjubkan! Kami merasa seperti berada di hutan, dan saya hanya bisa menggambarkannya sebagai sihir. Resor ini sangat baik untuk pasangan karena jauh dari pusat Ubud dan Anda benar-benar merasa seperti berada di tengah-tengah hutan dalam petualangan tetapi dengan semua kenyamanan yang menyenangkan! Shuttle bus sangat berguna dan kami menggunakannya setiap hari untuk masuk ke pusat Ubud. Staf sangat ramah dan membantu. Resor ini sangat bersih dan terlihat indah di seluruh. Kami tidak punya keluhan dan tidak dapat menemukan kesalahan! Kami berada di sini untuk ulang tahun saya dan mereka membuat ini benar-benar istimewa. Terima kasih untuk semuanya di Udhiana Resort.",5
6, Udhiana Resort Ubud,Tempat yang sangat bagus dan santai untuk menjadi. Kolam renang tanpa batas luar biasa menakjubkan. Pemandangannya menakjubkan. Staf sangat ramah dan penuh perhatian. Makanan di restoran bagus. Mereka menawarkan layanan antar-jemput gratis ke pusat Ubud yang sangat bagus.,5
7, Udhiana Resort Ubud,Menginap 2 malam di sini untuk bulan madu kami. Setiap menit dari luar biasa! Kamar yang bersih dan tempat tidur yang sangat nyaman. Kolam renangnya bagus dan dek dengan pemandangan yang menakjubkan dari lembah. Makanannya luar biasa dan staf yang lucu dan ramah! Tidak ingin meninggalkan tempat ini dan kami pasti akan datang kembali!,5
8, Udhiana Resort Ubud,Pelayanan yang ramah dan makanan yang enak di resort ini. Akomodasi yang nyaman dan berjalan kaki sebentar ke pusat Ubud. Resort ini menawarkan layanan antar-jemput gratis sepanjang hari. Kami membutuhkan istirahat dan mencapai di tempat ini sangat tenang.,5
9, Udhiana Resort Ubud,"Kami menginap di Udhiana resort selama 3 malam. Kami sangat kecewa bahwa pada saat kedatangan bahwa akan ada pekerjaan konstruksi yang sedang berlangsung di antara jam 10 pagi - 6 sore, baik itu dimulai sekitar 8 : 30 pagi dengan suara palu - daya alat bantu dan tidak ideal ketika anda mencoba untuk bersantai menikmati sarapan sambil hutan. Jika kami tahu bahwa ada pekerjaan konstruksi yang sedang berlangsung di mungkin kami tidak akan menginap sejujurnya - mengapa mereka tidak melakukannya di low season saya tidak akan pernah tahu. Kebersihan kamar bisa untuk standar yang lebih tinggi juga. Stafnya sangat ramah dan membantu dan makanan sangat baik.",4
10, Udhiana Resort Ubud,Kami menginap satu malam di Udhiana resort. Kolam renangnya luar biasa dan pemandangan amat layak. Kamarnya bersih dan bagus. Sorot pada hari berikutnya adalah pemandangan pagi hari dari tempat tidur kami. Staf hotel sangat ramah dan setiap hari transfer ke pusat kota juga ditawarkan.,4
11, Udhiana Resort Ubud,"Hotel ini merupakan bagian dari bulan madu kami dan sampai akhir - ini tetap hotel terbaik, dengan pelayanan terbaik dan kenangan yang terbaik dari Ubud! - hotel ini memiliki antar-jemput gratis ke pusat Ubud - para karyawan yang sangat baik - makanan (sarapan) sangat lezat  sangat direkomendasikan untuk liburan romantis! Yang ingin semua yang terbaik untuk hotel dan manajemen!",5
12, Udhiana Resort Ubud,"Pertama kali di Udhiana, lokasi yang luar biasa di sisi jurang di antara lembah hutan lingkungan yang luar biasa dari kelapa dan pohon kelapa, dll . Anda harus fit karena villa ini pada tiga tingkat dan langkah-langkah untuk kolam renang dan area restoran, namun tempat ini memang layak . Staf yang sangat ramah pilihan makanan yang tersedia dan tidak jauh dari pusat Ubud, dan transportasi yang tersedia jika anda tidak menyewa atau hanya berjalan kaki, tetapi akan memakan waktu. Saya berharap untuk menginap di sana lagi di masa depan.",5
13, Udhiana Resort Ubud,"Apa pengalaman menginap yang luar biasa untuk harga yang tidak terkalahkan. Semuanya dari pemandangan, dan staf yang dibuat untuk akomodasi liburan yang bagus. Sayangnya kami hanya menginap satu malam tapi lain kali akan menghabiskan lebih malam di sini. Staf mengatur penyewaan skuter untuk kami ($ 70 k) serta transportasi untuk $ 75 k untuk tujuan kami selanjutnya. Staf restoran sangat ramah dan sarapan gratis yang enak dan dibuat untuk yang tepat untuk memulai hari. Kamar kami memiliki pemandangan yang menakjubkan dari tempat tidur dan kolam renang pribadi yang terhubung ke kamar. Resor ini membuatnya jadi anda tidak ingin meninggalkan tempat ini. Harga yang cukup murah. Kami tidak sabar untuk kembali.",5
14, Udhiana Resort Ubud,"Saya dan suami saya ar Udhuana untuk bulan madu kami! Jika anda ingin menginap di tempat yang tenang dan santai, hotel ini adalah pilihan terbaik! Jelas, tidak terlalu dekat dengan pusat kota, tapi mereka mengatur bus antar jemput gratis dari/ke pusat kota. Kami lebih suka mendengarkan hutan, bukannya atau suara berisik dari pusat kota. Di dalam, kamar dan kamar mandi luas, nyaman dan pencahayaan yang baik. Di luar setiap kamar memiliki kolam renang sendiri, dan ini fantastis karena anda memiliki pemandangan indah dari kolam renang/teras tetapi juga banyak privasi! ! Staf yang sangat ramah dan baik, mereka juga membuat saya terkejut ketika saya berulang tahun, membawa saya kue di kamar.",5
15, Udhiana Resort Ubud,Menginap di ubud selama 2 malam dan menyukainya. Pemandangan dari villa kami luar biasa dan kolam renang yang sangat bagus untuk bersantai. Agak sedikit jauh dari pusat ubud (10 - 15 menit) namun udhiana menawarkan layanan antar jemput ke dan dari untuk 75 k yang membuatnya lebih mudah. Sarapannya juga sangat bagus. Staf sangat membantu dan ramah. Akan menginap di sini lagi.,5
16, Udhiana Resort Ubud,"Poolvilla terburuk yang pernah saya. . 돈이 아깝다. Dari langit-langit, kotoran cicak jatuh. Internet nirkabel sangat lambat dan saya hanya dapat menggunakan sedikit air panas. Staf hotel menangani semua masalah yang tidak memadai. 문제에 대한 리조트의 대응은 싸구려 호텔의 수준에 불과했다. . 이곳은 절대 어떠한 조치도 진심어린 사과도 없다.",1
17, Udhiana Resort Ubud,"Berkunjung dengan suami saya selama 3 malam sebelum menuju ke pantai. Lokasinya benar-benar memberikan faktor wow, pemandangan spektakuler dan hutan hotel adalah perpanjangan dari itu. Kamarnya luas terutama kamar mandi yang memiliki bak mandi besar dan shower yang besar. Kamarnya sangat terawat dengan baik dan dibersihkan secara teratur. Teras luar memiliki kolam, 2 kursi berjemur dan area makan, sehingga ada banyak ruang. Kami tidak memiliki 'bug' teman bergabung di kamar kami seperti yang orang lain telah dilaporkan tapi saya rasa mengingat lokasi dan kamar style mungkin diharapkan dari waktu ke waktu. Sarapannya enak dan termasuk pilihan untuk memilih dari. Untuk minum teh sore di teras adalah sentuhan yang bagus dan cukup terang untuk tidak merusak makan malam! Kolam…",5
18, Udhiana Resort Ubud,"Dari langit-langit, cacing mati jatuh. Internet nirkabel sangat lambat dan saya hanya dapat menggunakan sedikit air panas. Staf hotel menangani semua masalah yang tidak memadai. 돈과 소중한 시간을 헛되게 쓰지 않기바랍니다 경치가 아름다운 숙소는 많다. 서비스와 청결. 직원들의 해결능력이 중요하다.",1
19, Udhiana Resort Ubud,"Kami menginap selama 2 malam di sini baru-baru ini dan kami sangat menikmati setiap detik!  Resort - seluruh menyetel sangat indah, dan sangat damai. Pemandangan yang menakjubkan, hanya mengubah dengan lampu melalui hari. Sebagai resor ini cukup kecil, sangat mudah untuk merasa seperti memiliki seluruh tempat untuk dirimu sendiri! Sambutan yang sangat damai setelah hari yang kami habiskan di keramaian Ubud.  Kamar - kamar (lebih seperti apartemen kecil) sangat elegan, tempat tidur yang sangat besar, dekorasi kamar mandi besar dan kolam renang infinity pribadi. Apa yang anda inginkan lagi? Sebuah kejutan yang menyenangkan, kami juga menemukan bahwa anda benar-benar tenggelam di alam, yang saya sangat suka duduk-duduk dan di malam kelelawar yang terbang di atas pintar kepala kita,…",5
20, Udhiana Resort Ubud,"Kami menginap di hotel ini selama 4 malam sebagai bagian dari bulan madu kami dan kami menyukainya. Lokasinya sangat tenang, kolam renang yang benar-benar luar biasa, dan sangat diperlukan setelah menjelajah sepanjang hari, dan kamar-kamarnya luas dan bagus, tempat tidur yang sangat nyaman.  Sarapannya bagus, a la carte, dan kami juga menikmati teh di sore hari dan angkutan. Kami juga menikmati kolam renang utama, yang sangat indah.  Satu-satunya catatan saya untuk hotel ini adalah bahwa anda staf anda perlu sedikit lebih banyak pelatihan. Ada kurangnya komunikasi antara F&akan dan Tim resepsionisnya (hal ini terjadi pada kami beberapa kali, kami menerima informasi yang berbeda di meja depan dan kemudian dari restoran). Dan walaupun staf sangat ramah dan manis, dan mereka…",4
21, Udhiana Resort Ubud,Saya menginap di sini selama 5 malam Natal 2017 dengan rekan saya yang juga merayakan ulang tahun ke-30-nya selama kami menginap! Hal pertama yang anda lihat ketika anda tiba di untuk check in - di adalah pemandangan kolam renang dan hutan - wow! Anda bisa melihat di tempat ini selama berjam-jam.  Hal utama yang saya akan ingat dari resor ini indah kami Udhiana kamar dengan kolam renang pribadi. Hanya ada sekitar 15 kamar di sini bahwa semua memiliki kolam renang pribadi yang menghadap hutan yang indah. Kamar kami memiliki tempat tidur besar yang menakjubkan dengan bantal comfiest pernah saya tiduri! Kamarnya sangat bagus dan anda bisa dengan mudah dapat tergoda untuk menginap di sana sepanjang waktu jika anda ingin dan hanya memesan dari layanan kamar. Ada juga kolam renang…,5
22, Udhiana Resort Ubud,Resort baru yang fantastis dengan pemandangan yang memukau! Tempat menginap terbaik di Ubud untuk bulan madu kami.  Sarapan fantastis dan pelayanan yang bagus dari staf! Pijatnya juga murah dan lokasi sangat dekat dengan pusat kota Ubud.  Terima kasih banyak Manjinder Singh dan Lena Kaur,5
23, Udhiana Resort Ubud,"Duduk-duduk di dek dan menikmati teh sore gratis saat di pemandangan spektakuler lembah di bawah ini adalah cara yang sempurna untuk bersantai dan menikmati keindahan alam Ubuds. Kamarnya sangat nyaman dan didekorasi dengan selera yang tinggi. Sarapan yang termasuk enak, dan stafnya sangat ramah. Saya pasti akan menginap lagi. . . tidak benar-benar ingin meninggalkan sejujurnya.",5
24, Udhiana Resort Ubud,"Saya mengunjungi tempat ini untuk 2 malam. Staf sangat ramah. Hanya 13 kamar di sini. Kelebihan: Kamar yang bersih . Pemandangan yang bagus, dan kolam renang pribadi yang cukup OK - Sarapan memiliki 3 pilihan makanan Barat, Indonesia , (Benua) Kontra: bus antar jemput di hotel membuat saya jadi bingung. Saya pergi ke restoran sekitar 2 km tapi mereka mengenakan biaya 75 . 000 rupiah, mereka bilang tidak di Ubud. . Membuat saya sedikit . ...membingungkan.",4
25, Udhiana Resort Ubud,"Menginap di sini untuk 4 malam di awal Januari.  Apa yang saya sukai:  Lokasi - terpencil dan cukup kecil, jadi tidak banyak orang properti di sekitar  kolam renang infinity - pemandangan yang luar biasa baik dari dalam villa dan hotel  staf yang ramah  yang saya yang tidak disukai:  Seprai tidak bersih, noda di sprei dan handuk, sarung bantal.  Kuku berkarat di lantai kamar mandi setelah layanan kamar. Datang pada teman-teman.  Serangga di mana-mana terutama di malam hari, sulit untuk mengejar malam beristirahat dengan sesekali bug yang jatuh di tempat tidur. Charlottes sekali lagi. web  Makanan terutama saat sarapan tidak konsisten, kehabisan jus, meskipun properti kecil.  Sementara staf yang ramah, mereka tidak memiliki pemimpin yang kompeten untuk membiarkan mereka tahu…",3
26, Udhiana Resort Ubud,Saya pergi ke Ubud dengan pasangan saya dan menginap di Udhiana! ! ! Pengalaman luar biasa di harga yang sangat masuk akal! ! ! Sarapan dan teh sudah termasuk dengan kamar dan itu sangat bagus! Kami memiliki kolam renang pribadi yang menghadap hutan! Tempat yang keluar dari sebuah mimpi! ! !,5
27, Udhiana Resort Ubud,"Hanya menginap untuk satu malam sebagai hari ulang tahun, tapi kamar memperlakukan adalah benar-benar fantastis. Akan yang bekerja ekstra dengan dekorasi dan kelopak bunga mawar di bak mandi. Layanan yang sempurna dan semua orang sangat membantu. Balkon pribadi anda sendiri dan tidak ada kolam renang - benar-benar salah satu dapat melihat di. Saya pasti akan merekomendasikan!",5
28, Udhiana Resort Ubud,"Kami menginap di sini selama tiga malam, dan akan menginap di sini lagi waktu berikutnya kami datang ke bali. Kami diperlakukan dengan sangat baik dan terlihat setelah oleh staf. Tidak pernah menginap di tempat yang lebih indah, bahkan ada monkey kunjungi kami satu pagi kami di kolam renang pribadi. Saya akan merekomendasikan hotel ini ke siapapun.",5
29, Udhiana Resort Ubud,"Resor ini menyediakan sebuah pemandangan yang menakjubkan dan lingkungan yang damai untuk orang-orang yang melarikan diri dari kesibukan,.  Namun, resor harus check in kamar sebelum untuk memastikan semuanya sudah siap sebelum memperbolehkan kami untuk check-in. Pada saat kami tiba di kamar, saya mencatat beberapa lampu ini dirusak terutama untuk lampu, kolam renang. Dan ketika saya menelepon untuk perbaikan, ia mengambil selamanya untuk datang, pekerja, dan, lakukan, memperbaiki. Yang paling buruk adalah, pekerja yang perlu untuk melompat ke dalam kolam renang saya dan mengubah cahaya dan memakan waktu lebih dari satu jam untuk memperbaikinya. Waktu yang terbuang dan saya tidak saya mengelola untuk menikmati kolam renang pribadi saya sama sekali sebelum saya pergi untuk makan…",2
30, Udhiana Resort Ubud,"Dari kedua kami tiba di hotel ini kami terkejut! Lokasi yang luar biasa, layanan kelas satu, pilihan menu yang sangat baik.  Vila-vila indah dengan kolam renang pribadi yang fantastis dan sentuhan ekstra untuk bulan madu kami (bunga, kelopak mawar di bak mandi). Bus antar-jemput gratis ke dan dari pusat Ubud. Sarapan fantastis dengan ukuran porsi yang besar - pilihan yang sangat bagus dan terbaik yang kami telah di Bali.  Kami memiliki masalah dengan penerbangan kami berubah menit terakhir kali dan staf tidak bisa lebih membantu memungkinkan kita untuk menggunakan telepon gratis dan menawarkan untuk membuat kami hanya - kami memesan makan siang untuk mengambil taksi. Sangat baik!  Satu-satunya kejutan adalah bahwa restoran, bar dan kolam renang utama sangat tenang di sepanjang…",5
31, Udhiana Resort Ubud,Saya telah ke Ubud beberapa kali dan telah mencoba banyak vila pribadi tapi yang satu ini benar-benar bernilai uang. Baru dan setiap villa dilengkapi dengan kolam renang pribadi dan sebuah kolam renang di dekat restoran. Saya suka kolam renang di Ubud dengan air pegunungan yang segar. Layanan yang sangat baik dan sarapan sangat baik. Akan kembali lagi!,4
32, Udhiana Resort Ubud,Bali merupakan pengalaman yang luar biasa bagi saya. Saya tinggal di sana selama 1 bulan. Itu adalah pengalaman yang terbaik dalam hidup saya. Bali adalah sebuah tempat untuk mengunjungi Amazon. Hotel ini luar biasa. Saya menginap di sana dengan teman saya dan enyojed sangat banyak. Itu adalah di tengah-tengah alam. Kamar yang sangat bersih. Kolam renang luar biasa. Bali sangat murah dibandingkan dengan tempat-tempat touristical. Saya berencana untuk mengunjungi Bali lagi sesegera mungkin. Bahkan 1 bulan tidak cukup. Dan saya dapat merekomendasikan hotel ini untuk semua orang.,5
33, Udhiana Resort Ubud,"Kami memiliki yang indah 4 malam tinggal selama bagian atau bulan madu. Pemandangan yang luar biasa indah dan bangunan utama. Sarapan luar biasa, selalu panas dan segar dan sangat lezat! Teh sore gratis adalah sentuhan yang bagus di mana kami menikmati kami beberapa hari. Namun rata-rata makan siang dan makan malam dengan sarapan. Kamar yang indah, kamar mandi dan kolam renang pribadi. Jelas berada di hutan yang Anda harapkan untuk sekitar serangga namun ada sangat banyak di kamar kami ketika kami tiba - banyak semut - untungnya kami membawa semprotan sendiri untuk menyingkirkan mereka. Ini adalah sangat dekat dengan mendapatkan rating bintang 5 tetapi ada beberapa hal yang mengecewakan. Keluhan utama adalah bahwa handuk dan tempat tidur (termasuk sarung bantal) bernoda!…",4
34, Udhiana Resort Ubud,"Kami memiliki tinggal yang menyenangkan di Udhiana secara keseluruhan. Resor ini adalah sekitar 15 menit berkendara dari pusat Ubud dan ada antar-jemput gratis. Namun ini tidak cukup sering meninggalkan sama sekali. Tempat ini indah dan memiliki potensi untuk menjadi luar biasa jika beberapa rincian yang mati Pro; Pemandangan dari hotel sangat mengagumkan. Kamarnya ditata dengan baik dan dilengkapi dengan semua fasilitas yang satu akan berharap. Tempat tidur adalah nyaman. Kolam renang pribadi yang indah. Harga kami membayar saya memesan melalui Agoda untuk diskon yang cukup bagus. Resor ini sangat tenang dan ada jarang orang lain di kolam renang utama.  Kekurangan; ada celah besar di jendela, yang berarti banyak serangga dapat masuk ke kamar. Sarapan meskipun itu cukup hambar.…",4
35, Udhiana Resort Ubud,"Dimulai dengan lokasi, hotel adalah sepuluh hingga lima belas menit dengan mobil dari daerah wisata Ubud. Hotel ini dikelilingi oleh tempat kumuh, secara harfiah, Jadi jika anda takut anjing liar, pastikan Anda menyewa supir dari hotel dan kembali.   Sekali di dalam hotel, pemandangan berubah. Anda dikelilingi oleh tanaman hijau dan lanskap yang sangat indah.   Staf yang ramah tetapi bahasa Inggris mereka tidak terlalu bagus. Anda mungkin harus mengulangi diri anda beberapa kali untuk dimengerti.   Kamar tidak sangat bersih. Saya menurunkan charger telepon saya di tempat tidur sehingga saya harus pindah dan jumlah kotoran dan debu yang mengerikan. Anda juga akan menemukan banyak serangga di dalam kamar.  Kondisi udara adalah sangat keras dan ditempatkan di atas kepala saya.  …",3
36, Udhiana Resort Ubud,"Besar menginap di Udhiana, staf semua sangat ramah dan membantu. Ruangan itu indah dengan pemandangan yang menakjubkan dan kolam renang pribadi yang bagus dan bersih. Sarapan sangat bagus dan bersedia untuk mengakomodasi chef pilihan diet. Mereka menawarkan bus shuttle gratis masuk dan keluar dari pusat Ubud yang sangat membantu. Hotel ini di lokasi yang cukup namun di daerah itu di luar hotel ini tidak terlalu bagus. Dengan sepeda ini 5 atau jadi menit untuk sampai ke pusat. Mereka membersihkan kamar setiap hari namun di saluran pembuangan shower di kamar kami tidak bekerja dengan baik sehingga mudah untuk air yang tumpah keluar ke lantai kamar mandi tapi itu keluhan kecil. Mereka sangat besar kolam renang yang indah dan bersih.",5
37, Udhiana Resort Ubud,"Pemandangan dari kamar dan area kolam adalah luar biasa. Setiap bit sebagai menakjubkan seperti di foto. Kamar luas dan bersih, tempat tidur nyaman, pribadi dan umum kolam renang bersih dan suhu yang baik. Staf yang semua sangat ramah dan membantu (porter sangat manis) dan memiliki sangat santai, suasana tenang dan ramah. Satu-satunya kekecewaan adalah makanan; sarapan sangat rata-rata, roti & kue kecil dan selalu enak. Kami makan sekali di restoran dan itu sangat baik. Kami juga mencoba memesan minuman di bar tetapi diberitahu bahwa semua botol sangat semangat untuk tampilan dan mereka hanya memiliki bir! Dengan beberapa perbaikan, seperti kaus kaki bar dan meningkatkan kualitas sarapan mereka, itu akan menjadi sempurna. Tapi ini adalah hotel bintang 4 yang sangat bagus dengan…",4
38, Udhiana Resort Ubud,"KELEBIHAN: lokasi adalah benar-benar 5 bintang. Pemandangan yang menakjubkan, memiliki kolam renang kecil. Alasan yang indah dan bunga. Staf yang sopan. Botol air yang disediakan di kamar. Shuttle ke/dari Ubud tersedia gratis pada waktu tertentu hari.   KEKURANGAN: sudah termasuk sarapan yang tidak yang menarik untuk tarif kamar - - standar buah, granola, croissant/roti, telur - - hanya tidak besar kualitas. Wifi di kamar sangat lambat dan tidak konsisten. Pilih - dari Ubud dengan Antar Jemput di malam hari hanya 8:30 dan 10:30. jadi jika anda lewatkan di 8:30 - - kami selalu melakukan untuk satu alasan atau lain - - anda juga bisa berjalan-jalan atau membayar 75, 000 untuk memilih - tidak sesuai jadwal.",4
39, Udhiana Resort Ubud,"Di Udhiana Resort adalah lokasi yang sangat baik, di jantung hutan yang rimbun. Namun pusat Ubud mudah dijangkau terima kasih untuk shuttle bus gratis yang berangkat dari hotel setiap jam.  Kamarnya bersih, luas dan dihias dengan baik. Bonus: kolam renang pribadi di teras kamar.  Restoran ini menyajikan hidangan yang sederhana namun bagus dan staf sangat menawan.   Akomodasi yang sempurna untuk liburan romantis!",5
40, Udhiana Resort Ubud,"Saya bangun di pagi hari dengan kabut pagi yang indah di sekitar Sungai Petanu. Nama yang berarti bunga yang indah UDHIANA taman di surga.  Saya telah salah satu yang terbaik yang pernah liburan di Ubud. Saya ingin melihat rinci dan bagaimana menempatkan semua bersama ini. salah satu cara untuk melihat seni kedamaian di Bali karena masih tempat yang sangat indah untuk liburan saya dengan salah satu pacar saya untuk memiliki Manis tempat liburan setelah semua stres dari kota. Tapi tempat ini sangat rekomendasi untuk bulan madu "" S. terakhir kali saya di sana saya melihat mereka membangun sebuah resor untuk keluarga akan datang segera. Terima kasih untuk keramahan dan hangat selamat datang. Pasti akan kembali lagi! Tips saya menikmati santai Udhiana kodrat keindahan yang…",5
41, Udhiana Resort Ubud,"Secara keseluruhan kami memiliki tinggal yang luar biasa di Ubud untuk Udhiana Resort di 2 malam. Kami akan sangat merekomendasikan properti ini kepada siapa pun yang mencari untuk sebuah hotel di Ubud.  KELEBIHAN  - Pemandangan, dari setiap sudut properti, sangat fantastis, dan jelas dari tempat ini. Mereka memiliki bagian luar biasa dari real estate dan itu hanya benar-benar indah di sini - check out foto saya.   - Layanan ini luar biasa, dari kru selamat datang, untuk staf restoran, semua orang di sana ada untuk membantu membuat pengalaman Anda luar biasa.   - Tamannya indah dan secara keseluruhan ini adalah sorot lain  - Layanan shuttle bus ke dan dari Ubud setiap 2 jam gratis - sangat cepat  - Pemandangan yang luar biasa dan layanan di restoran - kami memiliki ""makan malam…",5
42, Udhiana Resort Ubud,"Jika Anda ingin tinggal di suatu tempat yang tenang, damai, indah, indah, dan daftar hanya berjalan di, maka Anda harus datang dan memeriksa tempat ini! Anda tidak akan menyesal!   Saya dan mitra saya tinggal di sini 5 malam dan kami berdua sepakat bahwa itu tidak cukup lama.   Layanan ini luar biasa. Kami terutama menyukai gratis dan layanan antar-jemput reguler yang akan membawa Anda ke pusat Ubud dan kembali lagi.   Selain pemandangan spektakuler, hal favorit kami adalah kolam renang pribadi. Itu cukup layak dalam ukuran dan menghadap hutan!   Fasilitas lain termasuk gratis teh sore yang sangat lezat, banyak air gratis disediakan setiap hari dan kamar dibersihkan cukup segera setelah Anda meninggalkan kamar.   Selain itu, staf yang sangat ramah!   Apa sebuah resor! Pastinya…",5
