,hotel,review,stars
83, Villa Kayu Lama,"Aku memesan satu malam untuk anakku dan aku di tengah sibuk liburan keluarga untuk memiliki beberapa waktu tenang, yang kita pasti mendapat, vila ini indah, di lingkungan yang indah. Ketika kami tiba, aku bertanya-tanya jika ada pengunjung lain yang ke vila, salah satu villa lainnya dikuasai. Aku bertanya untuk bir untuk dibeli ke villa, itu tiba setengah jam kemudian, hangat dapat! Ketika saya bertanya untuk bir dingin. Aku membeli segelas es... anakku memerintahkan mengambil 40 menit yang sakit untuk mempersiapkan dan itu hangat ketika saya tiba, ketika saya mengatakan staf itu hangat dan ia akan menjadi sakit jika ia minum mereka membawanya pergi tetapi masih di bill ketika kami memeriksa, tidak banyak orang yang minum itu hangat tapi masih diharapkan kita untuk membayar…",1
84, Villa Kayu Lama,"Kami menyukai hotel ini. Lokasi adalah sempurna. Cukup jauh dari ubud berarti kedamaian yang total. Sekelompok kecil kecil di vila sawa. Dikemas penuh cahaya, bersih dan salah satu tempat tidur terbaik aku pernah tidur di jauh dari rumah. Staf yang ramah dan pemandangan yang bagus, kolam renang kecil. Saya telah tinggal di daerah selama 10 tahun dan tempat ini adalah di atas saya 2.  ",4
85, Villa Kayu Lama,"Baik ukuran villa dengan kolam renang pribadi. Dua (satu dengan kolam renang) dan satu kamar mandi. Baik untuk keanekaragaman makanan makan di kota dan harga murah. Benar-benar ramah! Sudah pasti akan menginap lagi! Wi-fi bekerja benar-benar baik, beberapa saluran tv kami bantut, tetapi masih berhasil menemukan banyak untuk melihat dalam bahasa inggris. Villa adalah di luar ubud, tapi mereka menjalankan antar-jemput gratis bus dan taksi tidak terlalu mahal. ",5
86, Villa Kayu Lama,"Kayu lama adalah kesempurnaan.  Indah dalam segala hal!  Vila, kolam pribadi, serenity... Semua ini benar-benar memukau. Negatif - jika anda ingin menjadi dekat dengan hiruk pikuk ubud, maka ini mungkin bukan tempat untuk anda seperti itu adalah sekitar 20 min berkendara dari kota & ada adalah apa-apa tapi sawah untuk perusahaan (yang bagi kami adalah surga). Vila ini hanya antar-jemput cukup awal di pagi hari dan kemudian lagi di sore hari jadi agak sulit untuk merencanakan hari anda strategis kecuali jika anda ingin membayar sekitar $10 (amerika serikat) masing-masing cara taksi untuk saya.  Saya satu kritik adalah makanan di villa... Cukup mengerikan, benar-benar benar-benar mengerikan. jadi sulit untuk merencanakan hari di tepi kolam renang ketika tidak ada makanan di…",5
87, Villa Kayu Lama,"Penerbangan kami terlambat dan kami tiba di bali ballkkannya sedang menunggu kami di 2:30, bahagia dan tersenyum. Kami tinggal empat hari dan mereka menakjubkan! Sangat pribadi dan tenang dengan pemandangan dari villa raksasa di seberang sawah. Staf tidak mungkin lebih bermanfaat dan menampung di setiap sudut. Sarapan adalah standar dan itu sangat bagus. Kamar kami adalah indah, sangat bersih dan luas. Satu-satunya hal yang kami lebih suka mandi jadi sedikit panas!   Tempat ini telah membuat perjalanan kami sangat mengesankan. ",4
88, Villa Kayu Lama,Tinggal untuk 3days. Terasa seperti rumah... Makanan yang baik. Staf adalah bagus. Kondisi adalah baik. Semua n semua adalah baik. Baik untuk pasangan. Hanya itu jauh dari kota n pantai namun antar-jemput gratis dengan driver. sangat informatif,4
89, Villa Kayu Lama,"Tahun lalu kami mengunjungi villa yang menakjubkan ini:  - dari manajer keramahanmu iove  - gratis pijat 60 menit berkendara baik untuk dapat tidur - kamar mandi dari kolam renang pribadi adalah luar biasa  sekitarnya tenang - sempurna untuk pasangan  setiap pagi - buah segar, bahkan manajer memberi kami satu malam gratis di   Sangat direkomendasikan!",5
90, Villa Kayu Lama,"sangat bagus villa di ubud bali, u dapat merasa seperti tinggal di rumah sendiri di sini. Orang-orang yang menyenangkan dengan senyum hangat. Namun lokasi tidak begitu baik, sulit untuk menemukan, namun di sini mendapatkan bus antar-jemput gratis ke pusat kota dalam waktu tertentu. Bahkan tidak banyak pilihan untuk makanan, tetapi mereka adalah lezat dan segar (kecuali jus). Kopi bali yang menarik, layak untuk mencoba.       ",4
91, Villa Kayu Lama,Hal-hal yang membuat kita ingin datang kembali ke sini: 1. Lingkungan yang tenang dan damai 2. Kolam renang pribadi 3. Super nyaman ranjang 4. Udara terbuka kamar mandi. 5. Bak mandi besar 6. Staf yang selalu tersenyum dan sangat membantu. 7. Dekat dengan alam  Kami pasti akan datang kembali ke sini untuk tinggal lagi di masa depan. Sebuah tempat yang sempurna untuk bersantai dan beristirahat.   Terima kasih untuk akhir yang sempurna untuk perjalanan bali kami!,5
92, Villa Kayu Lama,"aku menghabiskan 2night di sana, semua fasilitas kamar membuat saya nyaman dan merasa baik, aku akan pasti datang kembali ke oasis eksklusif ini sebelum ubud village. Pelancong memerlukan sebuah mobil atau sopir karena villa terpencil di sawah, dan benar-benar santai dan sangat pieceful vila pribadi. Ideal untuk keluarga. Kami adalah pasangan dan diduduki di satu kamar tidur di villa dengan kolam renang pribadi. Juga ada sarapan di villa pribadi - benar-benar sempurna!",5
93, Villa Kayu Lama,"Bagus lokasi tenang, staf yang ramah, layanan bis ke ubud Fasilitas besar dengan fasilitas yang sangat baik mulai sangat Untuk menginap di sini. Kolam renang pribadi adalah bonus yang besar untuk larut malam. staf tidak bisa membantu lebih banyak.     ",5
94, Villa Kayu Lama,"tentang 15mins berkendara dari ubud untuk villa kayu lama, di sini as tempat yang tenang dan damai, kamar yang luas dan dengan kolam renang pribadi. Anak-anak saya menikmatinya. staf sangat ramah dan membantu. Mereka bahkan meminjam sepeda motor untuk suami saya. Satu-satunya hal yang saya takut anak-anak ada banyak menyisipkan. HAHAHA .",4
95, Villa Kayu Lama,"Kami tinggal di villa kayu lama untuk 9 hari di akhir februari 2015. Kami mengambil airport transit dari villa dan itu adalah pilihan yang baik karena lokasinya sedikit terpencil dan saya pikir bahwa tidak banyak pengemudi taksi yang mengetahui tempat ini. Seluruh tempat ini sangat damai dan indah dan staf yang sangat ramah! Villa kami sangat luas dan rapi. Dan tentu saja memiliki kolam renang anda sendiri adalah besar plus! Anda dapat memesan makanan dari layanan kamar dan makan di villa anda. Mereka melayani sebagian besar spaghetti dan sandwich, tapi tidak ada makanan lokal, yang adalah sedikit aneh. Tapi ada bus antar-jemput gratis ke ubud dan kami makan paling makan malam kita di sana. Semua bersama-sama, kami menikmati kami tinggal sangat jauh dan kami bisa pasti kembali…",4
96, Villa Kayu Lama,"Kita tidak bisa mungkin merekomendasikan villa kayu lama lagi. Kami berharap kami telah menghabiskan liburan kami di sini dan melewatkan legian semua bersama-sama. Siapa pun yang ingin damai dan tenang sementara masih memiliki akses yang mudah ke ubud (sekitar 15 menit) harus menginap di sini. Vila itu bersih setiap hari, kami benar-benar menikmati kolam renang pribadi dan staf yang fantastis. Saya telah sehat (bali perut, tetapi tidak makanan dari sini!) dan staf sangat akomodatif dan indah saya khusus dengan memasak makanan hambar. Terlepas dari saya sebelum waktunya sakit, yang tinggal di sini telah sangat romantis.   Sarapan (terutama pancake nya) adalah sangat baik, tetapi makan siang dan makan malam (terutama burger dan yang anehnya pedas bolognaise) dapat ditingkatkan.…",5
97, Villa Kayu Lama,"Villa kecil yang nyaman ini juga dilengkapi dengan kolam renang pribadi di setiap unit. Ini adalah pasti layak harga dan layanan sangat menakjubkan. Para staf yang hangat dan ramah. Anda juga dapat mendapatkan di rumah pijat untuk harga yang murah. Terletak di ubud, di mana ada banyak budaya dan kerajinan toko. Kamar mandi terbuka dan pancuran yang membuat kami merasa sangat dekat dengan alam. Pasti akan menginap lagi untuk perjalanan berikutnya.",5
98, Villa Kayu Lama,"Kami berada di sini pada 26 januari 2015 untuk bulan madu, dan kami benar-benar direkomendasikan untuk semua pasangan yang mencari untuk tenang dan romantis tempat wisata di bali untuk bulan madu. Silakan memilih tempat ini untuk tinggal lebih lama. Masing-masing pasangan dapat menikmati kolam renang pribadi, kamar pribadi dengan kamar mandi terbuka.",5
99, Villa Kayu Lama,"Ramah dan membantu staf membuat anda merasa di rumah sendiri.  Tempat sempurna untuk melepas lelah dan menikmati kedamaian terbaik di sekeliling hotel ini.  Bersih dan benar-benar nyaman. ini adalah sedikit jauh dari kota ubud - tapi dengan motor atau mobil layanan yang disediakan di rumah, ini adalah baik-baik saja.",5
100, Villa Kayu Lama,Pemandangan ladang sawah yang indah di belakang. privasi. Staf yang ramah. sarapan besar dikirim di kamar. kolam renang yang besar. tenang. Terbaik jika anda memiliki sopir pribadi anda sendiri. toilet luar ruangan besar dengan bak mandi besar. romantis villa.,5
101, Villa Kayu Lama,"Pergi ke villa kayu lama dengan istri saya beberapa bulan yang lalu, hanya setelah resepsi pernikahan kami. Tempatnya cukup bagus, dengan kolam renang pribadi di dalam villa. Terletak tepat di tengah-tengah mana-mana, tempat ini sempurna untuk pasangan yang lelah dengan semua lalu lintas dan suara. Dengan kolam renang pribadi dan indah bak mandi mereka memiliki, anda hampir dapat melakukan apapun, tanpa mengkhawatirkan bagi beberapa orang asing mengintip pada anda.  Mereka juga melayani makanan yang baik dan terjangkau (saya hanya membayar sekitar US $8 untuk makanan, saya dan istri saya), dan mereka akan membuat baik makan pribadi-waktu.  Namun, karena hotel ini terletak secara harfiah di antah berantah, anda harus mempersiapkan untuk anda sendiri kendaraan untuk pergi di luar.…",4
102, Villa Kayu Lama,"Tinggal selama 2 malam dan itu merupakan pengalaman yang indah. Villa dilengkapi dengan baik termasuk kolam pribadi dan pondok pijat. Para tamu dapat memilih jenis sarapan yang mereka ingin dan hotel akan disajikan di pagi berikutnya di luar meja makan. Staf sangat ramah dan membantu. Walau hotel ini terletak agak jauh dari ubud kota, lingkungannya sangat tenang dengan persawahan yang hijau. Direkomendasikan untuk menginap.",4
103, Villa Kayu Lama,"Menginap di sini selama 3 malam, yang indah, villa, sangat luas dan bersih, anda memiliki anda sendiri kolam renang pribadi, yang di dalamnya di luar kamar mandi dengan mandi cukup besar untuk dua! Oh, dan shower. Villa adalah sederhana namun sempurna jika anda ingin sepotong dan cukup. Itu adalah sedikit jalan keluar dari ubud tapi saya harus mengatakan bahwa adalah bonus karena setelah mengalahkan jalan di ubud villa adalah surga. Mereka menjalankan antar-jemput gratis ke kota dan kembali dan jika anda tidak menggunakan itu kemudian taksi sangat murah. Saya akan dengan senang hati merekomendasikan kunjungan. ",5
104, Villa Kayu Lama,"Kami baru saja selesai bulan madu kami, dengan 3 malam menginap di villa kayu lama. Ini sangat indah. Vilanya mewah tapi sederhana. Kami memiliki kolam renang pribadi, dan sarapan diantar setiap pagi. Staf yang sangat penuh perhatian dan sangat ramah. Vila ini terletak di luar dari ubub, tapi ada antar jemput setiap hari ditawarkan di tanpa biaya. Atau anda bisa melakukan yang kami lakukan dan siklus ke ubud, cara itu anda mendapatkan untuk melihat banyak daerah sekitarnya yang indah. Jika anda ingin sepotong dan tenang maka ini adalah tempat untuk anda.",5
105, Villa Kayu Lama,"Saya tahu tentang tempat ini dari krisna, pemilik krisna wisata bali. Dia membawa tamu ke vila ini sebelum dan mengatakan itu baik. Yang membawa saya untuk memesan 2 malam di sini dan saya harus mengatakan pada awalnya saya sedikit kecewa dengan lokasinya. Namun kamar itu indah, besar dan luas, bersih dan staf di sana begitu indah dan pernah siap untuk menjadi di layanan kami. Pilihan makanan namun sangat terbatas. Berdasarkan lokasi villa berada. Saya akan menyarankan bahwa mereka memperbaiki dan menambah variasi untuk daftar makanan karena ada tempat lain di dekatnya untuk pergi untuk makan malam. Villa ini adalah pasti tempat yang bagus untuk bersantai dan memiliki beberapa teman. Itu adalah pengalaman hebat, namun saya tidak terlalu senang tentang melihat katak keluar dari…",4
106, Villa Kayu Lama,"Sulit untuk meninjau villa ini karena itu memiliki poin yang baik (staf bagus, cukup fasilitas) tapi itu sangat jauh dari ubud dan hotel hanya menawarkan sekali-a-hari penjemputan gratis dari ubud di 16:30, lain kali anda harus membayar.   Stafnya sangat ramah tetapi makanan yang tidak baik dan itu terlalu jauh dari mana-mana untuk bisa atau di tikungan untuk makan di tempat lain. Vila itu sendiri tampak indah dan sangat bersih tapi mengingat itu di sawah itu semut merayap di, seluruh tempat jadi kami tidak bisa menempatkan hal-hal di kamar mandi counter, ada sarang mereka hanya dekat pintu di dalam juga. Di malam yang tanah ditutupi di katak... yang benar-benar lucu tapi jika anda tidak menyukai serangga dll itu tidak pilihan yang bagus. Kolam renang pribadinya sangat bagus…",2
107, Villa Kayu Lama,"Setelah pernah ke ubud sebelum dan untuk memeriksa ke dalam sebuah properti besar, modern dan sangat bersih dan sangat pribadi. Kami disambut seperti teman lama pada kedatangan oleh putu dan disambut oleh pemilik selama sarapan di hari berikutnya. Kami tidur di tempat tidur kanopi yang indah dengan luar biasa kualitas tinggi seprai dan bantal sementara pemandangan kolam renang pribadi kami. Satu-satunya daerah perbaikan yang diperlukan adalah kualitas dan berbagai pilihan yang tersedia untuk sarapan tapi kami yakin ini adalah saat ini sedang ditangani. Kami sangat merekomendasikan properti ini jika anda ingin damai dan lingkungan pribadi di tengah georgous pematang sawah. Berlokasi 15 menit dari pusat kota ubud, tapi mereka menawarkan gratis shuutles. Anda akan senang dari kaki…",5
108, Villa Kayu Lama,"Kami menghabiskan tiga malam di villa kayu lama. Setelah pernah ke bali sebelumnya kami tidak melihat untuk berbelanja dan petualangan... hanya beberapa tenang 'chill out' hari. Meskipun tiba di tengah malam, kami disambut oleh supir yang sopan mengantarkan kami ke villa. Saya merekomendasikan mendapatkan transportasi bandara melalui villa, karena itu cukup jauh dan karena relatif baru, sebagian besar supir taksi tidak akan tahu itu. Ada hanya 4 atau 5 villas sehingga tidak cukup untuk mendukung restoran yang besar. Yang mengatakan, menu adalah sepenuhnya memadai dan makanannya cukup enak. Seperti selalu di bali, harga yang sangat murah.  Kami ditempatkan di villa ganda. Ada area umum dan kolam renang dengan dua identik kamar pribadi yang berdampingan. Kami akan sangat senang…",5
109, Villa Kayu Lama,"Untuk tiga malam pertama dari perjalanan kami ke bali, kami memutuskan untuk tinggal di ubud. Kami tiba cukup terlambat, dan langsung menuju ke ubud. Terutama karena vila di ubud karena lebih murah dibandingkan dengan seminyak (yang adalah di mana kami pergi ke berikutnya). Untuk harga yang kami dibayar untuk tiga malam menginap di ubud (melalui agoda, yang kami biaya sekitar US $260 untuk tiga malam setelah pajak), ini adalah mencuri nyata.  Vila-vila sangat baru, namun sudah ada tanda-tanda usang dan aus. Lantainya sedikit bernoda, tapi secara keseluruhan, tempat ini sangat bersih. Sekitarnya sangat tenang. Ini adalah 15 menit berkendara ke pusat kota ubud, dan dengan taksi, kami membayar sekitar US $8 salah satu cara. Tidak terlalu lusuh. Itu pasti masih menawar.  Tapi saya…",4
110, Villa Kayu Lama,"Pada awalnya saya sedikit khawatir karena villa ini tidak terletak sangat dekat dengan ubud tapi kenyataannya kami sangat senang untuk menjadi lebih jauh, sunyi dan tenang di persawahan. Vila itu indah, sangat modern, fasilitas yang sangat baik. Kami menyukai kolam renang pribadi dan pemandangan sawah. Staf yang sangat baik dan mampu untuk mengasuh untuk kami. Sarapan yang sangat baik. Saya hanya kritik adalah bahwa karena kami memiliki bayi muda sulit bagi kami untuk pergi keluar untuk makan malam. Kami berhasil menemukan beberapa restoran untuk memberikan atau kami pergi keluar di pencarian diri kita sendiri, tetapi akan lebih baik untuk mempunyai daftar tempat-tempat yang bisa memberikan atau menawarkan untuk mengirim seseorang di sebuah sepeda motor untuk mengambil makanan.…",5
