,hotel,review,stars
0, Villa Chocolat,Keluarga dan teman-teman saya semua tinggal di Villa Chocolat 6 dan itu fantastis. Komara dan timnya luar biasa dan terus maju untuk membuat kami tetap menjadi prefek. Sarapannya enak. Vila dan kamar tidurnya sangat bersih. Handuk segar setiap hari. Tidak ada masalah. Akan kembali,5
1, Villa Chocolat,"Komara dan timnya di Villa Chocolat melampaui semua harapan. Mereka merawat kami, mengatur pengemudi ketika dibutuhkan dan tersedia 24/7. Ruang tamu dan kamar luas, bersih, dan 2 kolam renang.",5
2, Villa Chocolat,Waktu yang indah dimiliki oleh kelompok kami ketika kami mengunjungi Villa Chocolate. Staf sangat membantu setiap saat. Vila terletak dengan baik dan memiliki akomodasi yang sangat baik. Kolam renangnya sempurna. Handuk segar disediakan setiap hari. Ini sangat ideal untuk kelompok orang dewasa. Staf menyediakan makanan yang baru dimasak untuk pesta ulang tahun. Mereka bahkan membersihkan kekacauan di hari berikutnya. Mereka menyemprot kamar setiap malam dengan obat nyamuk. Satu-satunya negatif adalah satu kamar tidak memiliki air panas.,5
3, Villa Chocolat,"Itu yang saya sebut surga! Villa itu sendiri menakjubkan tetapi itu tidak semua. . . tim adalah alasan mengapa masa tinggal kami selalu diingat dalam semua aspek, selalu siap untuk membantu dan mengisi semua keinginan kami. 2 kolam renang selalu bersih serta 5 kamar yang indah, dihias dengan elegan dan selalu rapi. Saya sangat merekomendasikan villa cantik ini untuk semua wisatawan yang mencari kemewahan, lokasi yang bagus dan staf yang sempurna yang benar-benar akan mengurus Anda. Nilai uang yang fantastis!",5
4, Villa Chocolat,"Ini adalah kedua kalinya saya di sebuah vila dan saya harus mengatakan bahwa ini memiliki tata letak yang fantastis untuk 16 orang / 8 pasangan. Great lokasi - hanya berjalan kaki singkat untuk semuanya! Kami berjalan ke La Plancha, ku de ta, kentang kepala dan semua makan malam kami yang luar biasa. Staf yang luar biasa - meninggalkan kami sendiri tetapi dibersihkan dan pergi dan membeli barang-barang untuk kami ketika diminta.",5
5, Villa Chocolat,"Kami memiliki vill 6 kamar tidur untuk 4 malam untuk akhir perjalanan sepak bola musim. Lokasi itu sempurna. Tepat di perpaduan Seminyak, hanya 4 - 5 menit berjalan kaki untuk makan jalanan. Komara dan stafnya sempurna! Dari menjemput Anda dari bandara, hingga kamar-kamarnya bersih setiap hari dan memasak sarapan prasmanan yang luar biasa setiap pagi. Selalu bertanya apakah ada sesuatu yang bisa mereka atur atau bantu. Mereka fantastis. Villa itu sendiri benar-benar sempurna. 6 kamar tidur yang fantastis dengan masing-masing memiliki kamar mandi outdoor pribadi sendiri. Tidak punya masalah dengan bug atau apa pun karena staf mengubah tab serangga setiap hari di dinding yang membuat keajaiban. Kolam sangat besar dan sempurna untuk kelompok besar.  Secara keseluruhan kami memberi…",5
6, Villa Chocolat,"Kami tinggal di villa 5 kamar selama 10 malam. Villa di posisi yang sempurna, mudah berjalan kaki dari toko-toko, restoran dan pantai (melalui Ku De Ta), itu terselip kembali dari jalan utama begitu baik & tenang.  Staf benar-benar hebat, membuat kami merasa diterima benar dari awal dan selalu tersedia untuk apa pun yang kami butuhkan. Sarapan yang besar, kami memilih untuk sebagian besar pagi (pancake cukup epik!). Selalu ada seseorang di sana antara jam 7 pagi - 9 malam, dengan keamanan di depan setelah jam 9 malam, yang membuat kami merasa sangat aman. Kami memiliki BBQ satu malam - OMG itu sangat luar biasa, benar-benar layak dilakukan setidaknya sekali, berharap kami punya waktu untuk melakukan yang lain!  Villa itu sendiri luar biasa, kamar tidur utama kembali indah…",5
7, Villa Chocolat,"Villa Chocolate adalah properti yang indah dalam 5 menit berjalan kaki dari pusat perbelanjaan, layanan binatu, dan restoran di wilayah Seminyak. Luar Ruang dapur dan ruang tamu sangat spektakuler, bahkan merasa agak besar untuk anggota keluarga saya yang keempat. Kamar tidur juga luas, dan tempat tidur yang sangat nyaman. Vila ini memiliki saluran berbahasa Inggris pada kabel, dan Staf menyediakan kami dengan adaptor jadi kami bisa mengisi daya perangkat elektronik. Kami Staf juga memberi kami telepon seluler sehingga kita bisa mencapai mereka jika kita memerlukan sesuatu. Setelah hari yang panjang di Waterbaum, keluarga kami kembali larut malam. Anak-anak kami terlalu lelah untuk pergi keluar untuk makan, jadi staf direkomendasikan dan membantu kami memesan pizza dan pasta di…",4
8, Villa Chocolat,"Saya menulis ulasan ini dari bandara karena baru saja meninggalkan vila 6 dan 2 di mana keluarga saya dari australia dan Inggris bertemu dan menghabiskan 4 malam terakhir. Akomodasi tanpa noda, semua fasilitas tetapi sejauh ini, Kumara dan timnya tidak bisa berbuat lebih banyak untuk kami. Dengan usia dalam kelompok kami dari 23 hingga 86, tim kumaras mengorganisir McDonald's, transportasi, es, binatu, dan bahkan pesta pencarian untuk salah satu kelompok kami yang tersesat. Vila-vila menuruni jalur dari ultimos, bulan jahe dan banyak toko-toko utama, bar dan tempat-tempat pijat. Kami akan kembali dan tidak dapat menemukan satu komentar negatif untuk dibuat dalam ulasan ini. 11 dari 10 skor untuk saya",5
9, Villa Chocolat,"Layanan fantastis dari Kumara dan timnya, kami tinggal di villa 5 kamar tidur untuk 9 malam, 2 kolam renang, area kolam kedua membuat tempat yang bagus untuk mereka yang ingin hanya membaca di tepi kolam renang atau pijat, staf tidak bisa melakukan cukup untuk kami, mereka hebat dalam menangani pemesanan, atau mengambil kami takeaway dari banyak restoran terdekat, membawa ibu mertua dengan kami (69) dan dia menyukainya. Villa bersih dan dihadiri oleh staf yang ramah",5
10, Villa Chocolat,"Great escape dengan teman-teman - lokasi bagus dan akomodasi super. Sarapan disediakan dan dimasak untuk kami baik tradisional Indonesia atau dimasak Barat. Kolam renang ukurannya bagus. Kami semua memiliki kamar sendiri, tetapi akan bekerja dengan baik untuk pasangan (atau kelompok keluarga besar) - kamar tambahan tersedia untuk membuat akomodasi lebih jika diperlukan.",5
11, Villa Chocolat,"Kami menghabiskan dua minggu di Villa Chocolat di sebuah vila 2 kamar tidur dengan keluarga. Lokasi yang luar biasa! Berjalan kaki singkat ke pusat perbelanjaan dan makan jalanan di seminyak! Villa itu sendiri luar biasa! Luas, cerah, nyaman, santai! Staf luar biasa! Sangat ramah dan membantu! Dari sarapan yang dimasak untuk Anda di villa Anda, untuk menurunkan malam hari, staf hanya luar biasa, membuat Anda merasa seperti rumah yang jauh dari rumah!",5
12, Villa Chocolat,"Terletak hanya berjalan kaki singkat dari jalan makan, vila 2 kamar tidur yang fantastis ini sesuai dengan kebutuhan kami, dengan berjalan pagi melalui labirin geng ke pantai sampai larut malam berjalan ke restoran yang mengundang dan lantai dansa di Laflavla nightspot.",5
13, Villa Chocolat,"Kami memiliki tinggal yang menyenangkan di 5 - kamar tidur vila.  Saya menginap dengan keluarga dengan 3 orang Dewasa + 2 anak muda lainnya, tata letak yang bagus, bangunan terpisah dan kamar tidur utama di lantai atas 4 Kamar bersama-sama bagian Villa. Menakjubkan di malam hari - sedikit usang di siang hari. Kamar mandi dan kamar sederhana, bersih tetapi perlu dirapikan. Kolam renang luar biasa, 2 x kolam renang. Menikmati BBQ yang sangat baik. Lokasi yang luar biasa.  Stafnya luar biasa, sangat penuh perhatian, membantu dengan penitipan anak, Laundry dll.  Villa ini akan menjadi 5 - bintang beberapa tahun yang lalu, tempat yang bagus untuk pasangan yang bepergian dan ingin membiarkan rambut mereka turun/pesta. Jika sedang pemilih perlu menyegarkan diri di tempat. Akan…",4
14, Villa Chocolat,"Kami memiliki sekelompok teman-teman 10 tinggal di Villa Chocolate tiba pada waktu yang berbeda, dan staf hotel yang sangat akomodatif. Fasilitas yang luar biasa dan staf yang bahkan lebih baik. Kepala pelayan Komara adalah selalu di tangan untuk memberikan saran untuk memberikan kami sehingga kami bisa mendapatkan keluar tinggal, apakah itu adalah tentang pilihan restoran atau merencanakan perjalanan (bahkan pada hari libur).   Secara keseluruhan sangat merekomendasikan tinggal di villa ini yang terletak di jantung Seminyak, namun karena di desain seperti tempat.",5
15, Villa Chocolat,"Saat pertama kali tiba di villa, itu indah seperti gambar. Ukuran kolam renang yang fantastis dan kamar merasa bersih dan segar pada pandangan pertama.   Kamar mandi semua di luar, yang ketika anda pertama kali mendapatkan melihat, mereka tampak luar biasa dan asli. Namun Bali adalah panas, Anda tidak bisa keluar dari kamar mandi dan merasa segar karena panas matahari akan datang langsung pada Anda. Ini juga berarti bahwa itu tidak selalu yang bersih dari hal-hal yang luar biasa. Selama minggu kami tinggal, kami harus ular di kamar mandi, dan ratusan tokek. Ini membuat kami sangat berhati-hati tentang memastikan pintu selalu ditutup dengan benar. Juga kamar mandi adalah hanya kepala pancuran datang keluar dari dinding bata. Aku merasa seperti ini tidak akan pernah benar-benar…",3
16, Villa Chocolat,"Merayakan ulang tahun teman di sini dengan semua orang terbang dari wilayah. Apa yang dijual kami ke vila ini adalah fakta bahwa Anda dapat menggabungkan 2 - dengan 6 kamar dengan - kamar dengan (ada 5 - tempat tidur di Villa Chocolate merek yang tidak dapat terhubung ke dua) melalui pintu keluar masuk ke dalam membuat 8 Besar - kamar dan kompleks yang dapat menampung 16 orang. sangat dekat dengan jalan utama dengan restoran, kafe dan toko-toko - - sekitar 5 - menit berjalan kaki - - namun itu adalah cukup jauh untuk privasi. Kamar tidak super mewah tapi sangat baik ditunjuk. Semua kamar yang sama di sekitar delapan, kecuali di 6 kamar tidur utama - kamar dengan Villa, yang dilengkapi dengan dek pribadi. Hati-hati meskipun bahwa kamar tidur utama yang menderita dari udara yang…",4
17, Villa Chocolat,Tidak bisa kesalahan Villa chocolat. Kami menginap di Vila 6 kamar dan semua kamar cukup adil dan baik dan semua termasuk dalam. Staf indah dan pergi keluar dari jalan mereka untuk Anda jika diperlukan. Begitu dekat dengan jalan yang adalah lokasi yang baik dan kolam renang yang luar biasa,5
18, Villa Chocolat,"Kami baru saja kembali dari 4 hari menginap di 5 kamar tidur untuk suami saya 50 th. Staf yang semua sangat menyenangkan dan sangat membantu, mengatur transportasi pribadi, minuman dan es untuk villa kami, dan menempatkan semua di esky. Villa ini besar - dan kami merasa sedikit hilang kadang... dapur adalah dilengkapi dengan baik tetapi jauh dari area kolam renang! Satu hal yang agak mengganggu adalah 2 kamar mandi di lantai atas yang memiliki kamar mandi dan bak mandi yang besar yang merupakan bangunan ada tidak ada rel kereta api, jadi anda harus memegang kepala pancuran di satu tangan dan mencoba untuk mencuci dengan yang lain, yang sangat sulit!  Villa terawat dan bersih!  Kami memiliki masalah menemukan seperti itu adalah tidak di bawah nama villa chocolat, itu di bawah…",3
19, Villa Chocolat,"Jika anda mencari kombinasi sempurna antara gaya, kenyamanan dan lokasi, ini adalah pasti tempat untuk pergi. Dari saat pintu dibuka kami merasa seperti taman untuk anak-anak di toko permen. Kolam renang (ya kolam renang, tidak kolam renang) yang memperlakukan nyata, dan staf yang sangat profesional namun hangat dan ramah. Dekorasi bergaya dan sempurna. Dan di kamar tidur utama, yah, itu adalah permata kecil di itu sendiri. Jika kami akan kembali lagi ke bali, kami akan senang untuk tinggal di villa chocolate lagi.",5
20, Villa Chocolat,"Vila ini terletak di bagian terbaik di seminyak - dekat dengan segala sesuatu yang anda inginkan. Hotel ini memiliki kolam renang yang besar, besar ruang, kamar tidur yang bersih dan nyaman dan staf yang luar biasa... Pasti akan kembali lagi. Tidak bisa menunggu!",5
21, Villa Chocolat,"Sangat baik villa t... sangat dekat dengan makan street, di jalan yang berlawanan restoran ultimo. Staf yang hebat dan sangat membantu manajer villa Koumar.   Villa memiliki semua fasilitas yang anda bisa meminta termasuk raja tempat tidur dan terpisah kamar dengan kolam renang pribadi. ",5
22, Villa Chocolat,"Kami tinggal selama 5 malam perjalanan seorang gadis dan mencintai villa ini. Telah sebelumnya tinggal di villa ditemukan yang merupakan bagian dari perusahaan yang sama. Layanan yang luar biasa oleh staf. Mereka diatur untuk penukaran uang untuk datang ke vila, kue ulang tahun untuk salah satu wanita dan mengurus semua pemesanan restoran kami.  Kami memiliki 6 kamar tidur lengkap, tapi ada sebuah pintu yang dapat membuka untuk dua kamar tidur dan satu lagi kolam renang jika anda membutuhkan lebih banyak kamar.  Kolam renang berada di sinar matahari langsung sehingga tidak pernah dingin dan setiap hari selalu memastikan itu selalu bersih.  Sarapannya sangat bagus. Kami tidak meminta untuk tamu indonesia yang akan disajikan sebagai makan siang di beberapa hari sehingga kami bisa…",5
23, Villa Chocolat,"Aku tinggal di sana di 2 kamar tidur dengan pasangan lain. Komentar pertama mereka saat kami berjalan melalui pintu masuk besar ""adalah semua malam ini?"" Itu jauh lebih baik daripada kita harapkan setelah memilih di internet. Kamar yang luas, fasilitas yang sangat bagus dan sangat besar kolam renang yang benar-benar membuat ini tempat yang bagus untuk menjadi. Sarapan adalah yang baik, sedikit lebih beragam baik tapi tidak akan telah sangat baik, staf benar-benar fantastis, ramah dan siap membantu benar dari pertama penjemputa di bandara. Meskipun kami bepergian di panas dan lembab di lantai 36 yang sangat bebas periode lambat.  Lokasi yang besar, sangat dekat dengan kawasan perbelanjaan utama, dekat dengan semua restoran besar di eat street dan 10 menit berjalan kaki ke ku de…",4
24, Villa Chocolat,"Apa yang bisa saya katakan, tempat ini sempurna. 5 kamar tidur, 2 kolam renang, masing-masing kamar memiliki kamar mandi pribadi dan sangat pribadi dan hanya sangat singkat berjalan kaki ke pertokoan, restoran, apa lagi yang bisa anda inginkan. Seperti untuk staf wow mereka pergi di atas dan di luar untuk anda. Anda sarapan termasuk juga. Saya akan tinggal di sini lagi ketika aku kembali ke bali.",5
25, Villa Chocolat,"Villa (5 bed) itu benar-benar cantik. Semua kamar di hotel ukuran yang besar dengan kamar mandi luar ruangan besar. Selamat ber-ac dan dilengkapi untuk standar yang baik. Banyak hiburan - mereka membantu dalam setiap cara yang mereka bisa dan tidak ada yang terlalu banyak kesulitan. Lokasi adalah besar, tepat di dekat jalan utama. ",5
26, Villa Chocolat,"Kami tinggal dengan keluarga dan teman-teman saya di villa 5 kamar tidur selama seminggu pada akhir bulan november. Ini adalah pilihan terbaik kami dibuat, vila ini dirancang dengan indah dengan dua kolam renang, layanan luar biasa dan benar-benar bermanfaat dan pelayan discret. Komara, manajer mengatakan pembangunan hotel sebelah berhenti, jadi sekarang ini quiete dan damai karena selalu!  Saya merekomendasikan tempat ini jika anda mencari ketenangan dan lima bintang akomodasi di jantung seminyak.",5
27, Villa Chocolat,5 akomodasi bintang. Dengan indah. Staf yang luar biasa. Sarapan berkualitas tinggi.  Kami tinggal di kamar tidur enam tetapi hanya digunakan lima. Sangat dekat dengan 'eat street' dan pantai. Pasti akan tinggal lagi.,5
28, Villa Chocolat,"Aku memesan 2 kamar tidur untuk suami saya 40th dan hotel tidak mengecewakan! Dirancang dengan indah, sangat bersih, besar layanan dan makanan! Lokasinya strategis karena yang anda berjalan ke strip utama 5min tetapi anda tidak mendengar suara hiruk-pikuk keramaian dan kesibukan. Kami akan pasti datang ke sini lagi.",5
29, Villa Chocolat,Kami memesan villa untuk 12 orang di pesta ulang tahun untuk 50th berdefile. Aku tahu bali dengan baik setelah tinggal di indonesia selama bertahun-tahun. Saya memilih ini villa karena itu adalah lokasi.  Villa indah seperti yang diharapkan dan staf tidak bisa melakukan cukup untuk membantu. Namun pembangunan sebuah hotel besar tepat di sebelah adalah mimpi buruk dan terbaik untuk menghindari villa sampai itu dibangun di tahun!,4
30, Villa Chocolat,"Vila ini luas dan lapang dengan 2 kolam renang, satu di sampingnya dan satu honeymoon suite di taman utama. Area launs adalah pukta adalahdiperoleh tempat duduk yang luas dan dapur yang besar, sangat modern dengan semua yang bali memperselukkan. Semua 4 kamar yang memiliki kamar mandi luar ruangan dengan bak mandi di beberapa kamar dan mereka adalah sangat rapi dan bersih.   Aku akan pasti tinggal di sini lagi seperti itu sangat bagus dan di lokasi yang besar. Villa Komara manajer dan stafnya sangat menakjubkan, mereka membantu anda begitu banyak mereka merencanakan transportasi, makanan, minuman, apa-apa untuk membantu dan mereka begitu asli dan ramah, mereka benar-benar tampak setelah kami seperti kami memiliki ayam malam dan dolar malam untuk mengatur dan mereka hanya membuat…",4
31, Villa Chocolat,"Kami memiliki waktu yang fantastis di villa chocolat seminyak, bali. Ada 12 dari kami sehingga kita semua bisa tinggal bersama-sama. Fasilitas ini benar-benar hebat - kamar, kolam renang, dapur, area bersantai. Sarapan adalah lezat. Staf yang fantastis - selalu bersedia untuk membantu dengan apa pun permintaan. Kami pasti akan tinggal di sini lagi jika kita kembali ke bali. Layanan yang luar biasa yang disediakan untuk kita semua, dari menjemput di bandara untuk drop off di bandara. Terima kasih untuk pengalaman menginap yang menyenangkan & mengesankan. Ini villa rocks! Kami pasti akan merekomendasikan hotel ini.",5
32, Villa Chocolat,Aku tinggal di sini baru-baru ini dengan teman-teman dan keluarga. Dari bandara untuk keberangkatan kami aku tidak bisa menyalahkan villa chocolat. Kami menikmati waktu yang dihabiskan bersama-sama sarapan di penghujung hari. Saya sangat menikmati kolam renang sebagai sebagian besar tamu mengambil manfaat penuh kehangatan dan mampu berenang selama musim dingin nz. Terima kasih kepada staf untuk sarapan lezat dan layanan pelayan. Saya pasti akan menginap di villa chocolat lagi jika aku pernah cukup beruntung untuk perjalanan ke bali lagi.,5
33, Villa Chocolat,Kami tidak menginap di villa chocolat. Kamar yang indah - kami memandang ke kolam renang dan ruang tamu bersama. Stafnya mengagumkan dan ada di sana untuk apa pun dan segala sesuatu yang kita diperlukan. Ada 12 dari kami dalam kelompok kami dan tidak ada masalah. Berjalan kaki singkat ke jalan utama dan pasar yang Semanyak. Akan sangat merekomendasikan akomodasi ini. Terima kasih untuk pengalaman lima hari - dari bandara mengambil menuju hingga ke ubud.,5
34, Villa Chocolat,"Ini adalah kedua kalinya saya telah tinggal di villa chocolat di seminyak.  Tetapi hanya sebagai mengesankan seperti yang pertama kali aku tinggal tiga tahun lalu - tidak terdapat banyak villa tersedia untuk kelompok besar, sehingga tinggal tersedia untuk 12 orang adalah persis apa yang diperlukan. Semua fasilitas yang besar dan staf selalu bersedia untuk pergi di atas dan di luar.  Sangat direkomendasikan bagi siapa pun yang bepergian ke bali!",5
35, Villa Chocolat,"Untuk sebuah keluarga 14, 8 orang dewasa dan anak-anak 6... 6 kamar tidur di villa tampak tepat bagi kami. Tinggal di sini selama 7 malam dan itu benar-benar indah dari saat kami berjalan di. Tanpa membuang-buang waktu, anak-anak melompat ke dalam kolam renang begitu mereka masuk ke villa untuk bersantai setelah 14 jam penerbangan.   Semua kamar yang indah... hanya satu masalah adalah sinar matahari sementara menggunakan toilet di hotel untuk air atau hanya shower. Shade yang sama akan menjadi sangat menyambut perubahan sebagai matahari khatulistiwa adalah sama sekali tidak ramah. Itu begitu buruk bahwa itu bisa menjadi salah satu alasan saya tidak akan tinggal di sini lagi. Selain itu. Aku tidak melihat apapun di hotel villa di.   Telah melihat beberapa ulasan, yang mengeluhkan…",4
36, Villa Chocolat,"Menginap di sini selama 8 malam awal maret untuk merayakan ulang tahun saudara di hukum 50th. Kami memiliki 5 kamar tidur, dengan 2 kolam renang, fasilitas dalam kamar dengan kamar kecil, sarapan besar dimasak setiap pagi di vila kami oleh staf yang ramah. Banyak kamar. Komara bahkan mengatur bbq makanan laut besar menyebar untuk 50th. Terima kasih khusus untuk staf Lilak, ayu, wayan dan tentu saja Komara.",5
37, Villa Chocolat,"Kami menginap di villas chocolat yang waking dream! Saya menghabiskan 2 minggu dengan semua keluarga saya di villa indah ini selama kami terakhir liburan. Ketika kami tiba kami terkejut oleh keindahan tempat ini! Kami digunakan untuk menghabiskan sore kami di taman tropis yang menawan dengan indah pohon frangipani. Setelah berjemur di bawah matahari bali, itu adalah kenikmatan nyata untuk berenang di kolam renang besar dengan istri saya.  Di akhir hari, pantai dekat dengan villa adalah tempat yang sempurna untuk mengagumi mewah terbenam bali. Untuk makan malam, itu adalah mudah untuk akses ke berbagai restoran, yang berjalan kaki ke villa. Selain itu, tepat sebelum tidur, itu sangat menyenangkan untuk mandi dan menatap bintang di waktu yang sama di kamar mandi besar dan terbuka.…",5
38, Villa Chocolat,"Saya menginap 10 hari di villa chocolat 6 kamar tidur dengan semua teman-teman saya dan itu sangat menakjubkan!  Villa ini adalah tempat yang bagus. Kolam renang adalah mungkin yang terbesar yang pernah saya lihat, ada juga banyak tempat untuk bersantai dengan teman di ruang tamu, atau di taman. Hal yang saya suka yang paling adalah mungkin kamar mandi luar ruangan. Bak mandi adalah begitu besar, anda dapat hanya bangun di pagi hari dan menikmati matahari sambil menikmati mandi... Bagaimana menakjubkan adalah bahwa?   Juga, kami menikmati pengalaman sejati dari keramahan bali. Staf sangat ramah, murah senyum dan akan selalu senang untuk membantu anda. Setiap pagi, kami makan rumah-membuat sarapan yang benar-benar benar-benar baik.   Akhirnya, lokasi adalah plus nyata bagi kami.…",5
39, Villa Chocolat,"Kami memiliki 10 orang di 6 kamar tidur vila, di villa chocolat dan itu indah. Kamarnya hebat & semua orang menyukai shower luar. Villa adalah luas, dibersihkan secara teratur oleh staf yang indah, sarapan yang lezat, (kami mencoba kedua amerika dan indonesia), kolam renang adalah hit besar dengan anak-anak dan orang dewasa dan lokasi adalah benar-benar nyaman dan tenang. Akan merekomendasikan kepada siapa pun yang akan. Hanya saran saya mungkin telah sedikit lebih informasi wisata di villa peta dan informasi wisata untuk tur yang ditawarkan. Kami di mana diberikan folder untuk melihat tapi itu hanya sesaat saya pikir jika kami bisa terus tempat ini untuk review selama kami tinggal kami akan telah super dilakukan beberapa hal dengan sopir/panduan. ",5
40, Villa Chocolat,"Kami lima pasangan yang mencari yang bagus villa dengan kolam renang yang besar dan banyak ruang untuk dijelajahi.  Villa chocolat berdetak kotak. Villa adalah 6 kamar tidur. Semua kamar tidur telah mereka sendiri kamar mandi ensuite (luar ruangan). Semua kamar ber-ac. Kamarnya bagus. Tv layar datar (bukan bahwa kita menggunakannya) peralatan mandi di kamar mandi, pengering rambut, bahkan cukup banyak segala sesuatu kecuali sabun (hanya cair disediakan). Sarapan adalah salah satu yang terbaik saya telah di sebuah villa. Dimasak dengan sempurna dan cepat. Rebus lembut, lembut rebus, tetap anda seperti goreng. Buah dan kue-kue yang juga termasuk, serta teh kopi dan jus. Kamar-kamar dibersihkan segera di pagi hari. Selalu banyak handuk. Saya suka keranjang handuk magid, setiap kali…",4
41, Villa Chocolat,"Saya menginap di dua kamar tidur vila dengan seorang teman dan itu menakjubkan. Kolam renangnya fantastis untuk melompat di dan bersantai setelah hari belanja. Stafnya fantastis dan memiliki perhatian terhadap detail dan tidak ada terlalu banyak untuk mereka. Kami tinggal selama dua minggu dan tempat tidur berubah setiap 4 hari dan handuk setiap hari. Kolam renang adalah membersihkan dan memeriksa setiap 2nd hari. Staf datang dan dimasak sarapan setiap hari dan kemudian meninggalkan kami sendirian untuk sisa hari sampai 6pm ketika mereka kembali untuk mengecilkan tempat tidur dan menyemprot kamar untuk nyamuk. Staf yang selalu di tangan jika kami membutuhkan mereka dan ada pelayan bertugas 24/7. itu hanya berjalan kaki singkat ke jalan untuk restoran, bar dan toko. Sangat…",5
42, Villa Chocolat,"Satu-satunya negatif adalah ayam keras di depan pintu yang terus mendapatkan kali kacau, beberapa pagi dia mulai ritual pagi nya pada 2 am, lain itu 4 am, kita semua terbiasa untuk itu meskipun dan itu adalah harga kecil untuk membayar indah Villa experience.",4
