,hotel,review,stars
71, Zen Resort Bali,"Saya menghabiskan seminggu yang luar biasa di Zen resort dan sangat tenang. Ini benar-benar alamat pikiran, tubuh dan jiwa. Pelayanan yang luar biasa, makanan yang indah dan staf luar biasa. Saya 66 tahun dengan tekanan darah yang tinggi dan wanita telah dapat menurunkan berat badan selama beberapa tahun. Saya sekarang seorang wanita muda yang 66 tahun tekanan darah turun ke lebih 114 72. Saya menjadi lebih fleksibel dan kehilangan 2 kg sementara di resort yang lain dan telah kehilangan 2 kg dalam 1 dan setengah minggu sejak saya kembali ke rumah. Saya akan kembali lagi.",5
72, Zen Resort Bali,"Selama sepuluh tahun saya bekerja di industri perhotelan. Saya harus mengatakan bahwa Zen Resort adalah kelas atas dan cukup tak tertandingi!  Lokasi dan lingkungan sudah menakjubkan, tapi cinta, peduli, kecermatan dan gairah setiap dan semua orang yang bekerja di resor Zen membuat pengalaman menginap Anda tak terlupakan. Tidak peduli mengapa Anda memilih untuk pergi ke Zen - ini akan mengubah hidup Anda pasti di berbagai aspek Jika anda memungkinkan keajaiban terjadi!",5
73, Zen Resort Bali,"Saya menghabiskan satu minggu di Zen Resort di bali dan telah mengubah cara saya biasa! Spiritual penyembuhan dan penuh kasih sayang dan penuh perhatian staf membuat pengalaman benar-benar salah satu yang baik. Tempatnya sangat indah dan belum tumbuh liar di waktu yang sama. Makanan yang disiapkan dan disajikan oleh bahagia, ramah dan bersedia orang yang pernah saya temui. Pemilik resor sendiri adalah berbaur dengan tamu dan membimbing kita melalui kesadaran spiritual yang paling dalam hidup. Dia adalah orang yang asli dan yang tersedia untuk kita di semua kali. Ada energi yang kuat yang suci dan sekitarnya kami di semua kali. Bumi itu sendiri merasa ajaib. Itu mudah untuk bangun setiap pagi di 5:30 untuk menyaksikan matahari terbit seperti kami duduk di tenang meditasi. Saya…",5
74, Zen Resort Bali,"Tempat Yang Paling Indah dan penyembuhan saya telah terlalu. Semua staf resor indah, baik dan penuh perhatian orang. Mereka memastikan setiap kebutuhan Anda bertemu dan Anda merasa peduli untuk cara yang holistik. Upacara api yang diletakkan di di malam hari, makanan dimasak untuk setiap keinginan Anda dan terapi yang sangat enak. Saya telah menyelam Zen paket dan pengalaman adalah salah satu yang saya tidak akan pernah lupa. Perasaan 'Zen' selama penyelaman yang luar biasa, suasana yang penuh kedamaian. Pemilik, Dr. Mahendra di resort selama saya tinggal dan itu baik cukup untuk menawarkan untuk duduk dengan dia makan malam tamu. Dia mengambil waktu untuk mengenal saya dan mendorong saya untuk merenungkan cerita di 'tempat ajaib'. Saya tidak yakin tentang bagaimana ini akan…",5
75, Zen Resort Bali,"Kolega saya dan saya tinggal di sini selama 5 hari karena kami membutuhkan tempat yang sempurna untuk melakukan beberapa strategi perencanaan untuk bisnis saya. Kami membagi waktu antara duduk di teras depan dari villa kami bekerja pada laptop kami santai dan menikmati banyak kegiatan yang tersedia di resor ini. Kami memiliki perawatan spa setiap hari, bergabung dengan yoga dan meditasi sesi yang dan juga melihat lumba-lumba di saat matahari terbit yang sangat spektakuler! Staf sangat ramah, kamar dan fasilitas yang luar biasa dan di atas semua ini adalah salah satu tempat paling tenang yang pernah saya tinggal. Bagian terbaik dari perjalanan saya adalah untuk duduk sebelum matahari terbit setiap pagi di teras villa dan saya melakukan meditasi pribadi. Saya telah setiap hari…",5
76, Zen Resort Bali,"Tempat yang indah dan spiritual di tengah-tengah alam. Saya tinggal di Zen Resort untuk 4 malam dan saya merasa sangat istimewa. Ini adalah tempat terbaik untuk pergi jika Anda mencari untuk bersantai, untuk menjadi diri sendiri, menemukan energi positif dan dimanjakan oleh paling ramah dan tersenyum orang yang kita bisa menemukan. Ini bukan tempat yang paling murah di Bali, tapi pasti layak.",5
77, Zen Resort Bali,"Keindahan taman yang luar biasa, vila yang indah, perawatan spa, menyelam, di sekitar sawah dan laut, adalah hanya melebihi oleh keindahan dan keanggunan dari host dan staf. Mahendra dan Budiani adalah permata, penangkal untuk beberapa dari kegilaan di dunia, dan staf mereka adalah luar biasa. Zen program menyelam luar biasa; tidak hanya melakukan pranayama/pernafasan saya membuat saya lebih baik penyelam, hal ini membantu untuk meningkatkan keterhubungan saya ke laut dan kehidupan yang indah. Jangan lewatkan meniru gurita dengan Muck Diving... terima kasih gede, dive master yang luar biasa! Jika anda baru ke dan/atau meditasi yoga, memberikan tempat ini mencoba. Di sesi di sini ramah dan beberapa yang terbaik yang pernah saya alami di mana saja. (Jangan biarkan harga menunda…",5
78, Zen Resort Bali,"Saya tinggal di zen resort bali yang lebih luar biasa. Tempat ini adalah off grafik secara keseluruhan layanan terdiri dari makanan enak (sehat), pelayanan luar biasa, lingkungan yang indah, dan yang paling fantastis dan orang-orang yang ramah. Semua bersama-sama membuat ini tempat yang terbaik yang pernah saya lihat.  Ini adalah di mana anda perlu untuk pergi jika anda sedang mencari tempat untuk bersantai, menyegarkan diri dan dimanjakan oleh orang-orang paling ramah yang pernah anda temui. Yang pasti harus pergi jika anda mencari untuk liburan di bali dan akan merekomendasikan hotel ini untuk",5
79, Zen Resort Bali,"Kami tinggal 5 malam di zen resort. Pacar saya memesan paket spa kesehatan saya dan menyelam.   Untuk memulai dengan hal-hal positif.  Menyelam dan perawatan spa yang sangat baik, terutama karena untuk orang-orang yang bekerja di sana seperti gede.  Layanan terutama di restoran yang sangat baik komang!   Tapi alasan tempat ini hanya mendapatkan penilaian dari 3 adalah karena terlalu mahal dibandingkan dengan standar kamar dan terutama kualitas makanan di restoran, yang benar-benar buruk!   Itu harus setidaknya akan USD 100 lebih per malam untuk spa dan paket menyelam!",3
80, Zen Resort Bali,"Baru 5 hari menginap di Oktober dengan suami saya. Zen resor terlihat seperti surga dan menegaskan bahwa Anda adalah dengan cepat. Semua staf sangat menyenangkan dan bahagia, makanan yang sehat dan lezat. Perawatan spa yang disesuaikan untuk setiap orang setelah kunjungan anda untuk bertemu dengan Dokter Ayurvedic di situs web. Dia adalah pria yang indah, yang juga sangat meditasi dan yoga. Saya telah menginap selama bulan dingin dan berniat untuk kembali lagi. Tempat ini adalah pengalaman yang paling indah untuk kami, dalam pikiran, tubuh, jiwa dan roh.  Namaste untuk semua di Zen Leanne dan Doug.",5
81, Zen Resort Bali,"Sebagai seorang wanita muda yang bepergian sendiri saya menemukan semua yang saya butuhkan untuk saya 8 hari liburan di Zen Resort Bali.  Saya merasa sangat aman dan senang dan dikelilingi oleh sebuah tim yang luar biasa. Tim disambut saya dengan nama dan selalu tersenyum, ramah dan senang selama saya tinggal. Mereka sangat membantu dan fleksibel dengan permintaan.   Saya menginap di vila dengan pemandangan taman dengan privasi dan interior Bali.  Terbuka mandi dan bak mandi yang memberi Anda pemandangan yang indah ke pohon tropis dan langit cerah.  Mereka mengejutkan anda dengan bunga dekorasi dan handuk dan membersihkan kamar Anda setiap hari dan lantai, yang memberikan kesegaran untuk apartemen yang indah.  Di dalam kamar Anda dan Anda dapat menikmati bersih air minum, buah…",5
82, Zen Resort Bali,"Ini adalah tempat yang santai, sangat damai dan tempat yang besar dengan staf yang ramah.  Di perawatan Ayurveda, Yoga dan Meditasi matahari terbit (khusus terima kasih kepada Ni Luh dan Subhash) sangat mengagumkan dan saya sangat menikmatinya. Dan seluruh tempat seperti restoran, taman, spa, kamar (yang baru), kolam renang dan pemandangan yang sempurna. Saya benar-benar menyukai tempat ini!  Satu hal yang saya tidak menghargai sangat banyak pada kedatangan saya, selamat datang sangat ramah tetapi sedikit stres. Setelah kami 18 di pesawat, 3 jam berkendara ke resort dan jet kaki saya sangat lelah. Dan hanya 1 jam pertama perawatan dimulai setelah kedatangan saya... jadi saya tidak siap mental jet sama sekali, terlalu banyak stres. Hanya akan perlu saya tubuh dan jiwa memiliki…",4
83, Zen Resort Bali,"Suami saya dan saya tahu bahwa dalam waktu satu jam untuk tiba di zen resort yang kami telah membuat kesalahan yang mengerikan.   Kami menghabiskan satu bulan di bali untuk bulan madu kami dan memesan 6 malam menginap di zen resort sebagai perhentian kedua. Kami harapkan ini bisa menjadi sehat dan santai tempat dan kami akan selalu ingat untuk lebih dari $di 3k usd kami menghabiskan minggu ini.   Jika zen resort setengah harga, kita akan bisa menikmati diri kita sendiri. Tapi itu segera jelas bahwa ini adalah lari ke bawah, 3 hotel bintang dengan staf yang kurang terlatih, makanan biasa-biasa saja dan tidak ada hiasan tambahan kamar.   Aku hampir tidak bisa menikmati pijat saya jadi di samping saya sendiri bahwa saya terkejut begitu banyak uang pada pengalaman yang biasa. Setiap…",1
84, Zen Resort Bali,"Aku masih tidak mengerti semua ulasan yang baik. Saya pikir saya akan tiba ke surga, tapi itu benar-benar tidak bagi saya. Kamar kolam renang sangat tua dan sangat gelap. Makanan yang baik tetapi tidak sesuai untuk anda dan doshas ada tidak banyak pilihan. Mereka akan meminta anda untuk membayar untuk kantung teh di antara makanan yang menurut saya sangat murah. Pijat sangat baik untuk yakin. Itu adalah hal terbaik yang ada. Pemiliknya yang ternyata seorang pemandu spiritual mendengarkan dirinya sendiri daripada mendengarkan anda - terakhir ini bisa 1 jam! Untuk Bali. Aku akan mengatakan nilai untuk uang miskin dan untuk harga ini anda bisa mendapatkan sebuah hotel bintang 5 di ubud dan mengambil kelas yoga/pijat/mendapatkan bimbingan spiritual oleh diri sendiri. Saya kenal…",1
85, Zen Resort Bali,"Zen resort adalah yang paling indah dan damai dikelola resort yang pernah saya tinggal.  Anda akan disambut di meja depan oleh nama pertama anda dan sebuah karangan bunga segar. Anda dikawal ke kamar yang indah dihiasi dalam cara yang tenang dan harmonis yang memperkuat tidur. Apakah di ruang makan, spa, yoga hall, atau jalan, semua anggota staf yang menyapa anda dengan nama dengan senyum. Makanan yang lezat dan sehat dengan vegetarian dan vegan pilihan gaya hidup yang mengoptimalkan ayurvedic. Tanahnya dirawat secara cermat dan bunga segar yang ditata dalam desain yang luar biasa di sebagian besar entri cara. Kolam renang menghadap ke lembah menuju laut dan pemandangan adalah luar biasa. Pemilik yang sangat ramah dan tersedia untuk memberikan petunjuk dan layanan.  Keseluruhan…",5
86, Zen Resort Bali,"Resort yang terletak di atas tebing kecil yang dirancang dengan indah dan terawat dengan baik taman dengan sebuah keajaiban pemandangan matahari terbit dan matahari terbenam di seberang sawah menuju laut. Menawarkan akomodasi berkelas yang nyaman, layanan yang sangat baik, selalu tersenyum dan mengantisipasi setiap keinginan.",5
87, Zen Resort Bali,"Kamar saya sangat bagus dan luas; di lantai keramik membuat kamar dingin, dan kelambu nyamuk adalah perubahan yang menyenangkan. Aku menikmati kesenangan baru mandi ""luar"" (masih dalam suite saya, tapi tidak di kamar standar kamar mandi). Tidak bisa benar-benar mendengar apa-apa dari kamar lain/tamu, jadi kudos di kedap suara di dindingnya. (SAYA * bisa * mendengar sedikit saat ada tamu di luar menikmati serambi belakang, tapi itu adalah untuk diharapkan.)  Pemilik dan staf semua ramah dan cemas. Jika yang anda butuhkan, hanya bertanya. (Tentu saja, anda juga akan membayar untuk setiap tambahan yang di atas dan melampaui harapan apapun paket itu, tapi itu adalah untuk diharapkan.) Di kesunyian yang agak ke saya setelah beberapa hari, dan saya diminta untuk pergi pada beberapa…",5
88, Zen Resort Bali,"Zen resort bali adalah benar-benar tempat yang luar biasa. Ini adalah tempat, di mana anda dapat menemukan kedamaian batin, jika anda terbuka untuk itu. Ini adalah tempat untuk pergi dan menangis, menyambut dan tersenyum, tempat untuk datang dan merasa di rumah. Ada banyak solo wisatawan dan sangat mudah untuk mendapatkan kontak dengan. Ada meja komunitas untuk makan, di mana kami memiliki banyak diskusi.   Ulasan lain telah tertutup dengan lingkungan alam yang luar biasa, akomodasi (villa premium baru yang sangat baik), layanan, meditasi dan yoga, dan tentu saja perawatan ayurvedic.   Aku tidak memesan paket karena saya ingin beberapa ""saya waktu"" tanpa kalender, tetapi kebanyakan tamu memilih paket. Seperti banyak orang lain. Aku merasa sangat baik setelah satu atau dua hari.…",5
89, Zen Resort Bali,"WOW! Sebuah tempat yang mengagumkan untuk menghabiskan seminggu. Staf menjadi seperti keluarga setelah beberapa hari dan anda tidak dapat membantu tapi rileks menjadi dan bersyukur dalam lingkungan yang menyenangkan. Pijat yang memanjakan dengan keindahan dan budaya yang peduli. Terima kasih satu juta kali untuk kebaikan, cinta & zen resort bali memberikan kebebasan &. Saya akan merindukan anda semua x",5
90, Zen Resort Bali,"Aku pergi ke zen resort di maret 2016. Mulai dari penjemputan di bandara untuk check in, dan drop off adalah luar biasa. Setiap anggota staf tahu nama anda dan menyambut anda dengan nama anda selama menginap. Itu sangat pribadi dan melampaui setiap harapan saya. Pagi hari dimulai dengan meditasi yoga yang kemudian diikuti oleh bisa dilanjutkan dengan perawatan ayurvedic yang berbeda sepanjang hari. Ketika saya pergi ke sana saat mengalami masalah pribadi. Aku datang kembali lagi sebagai orang yang telah berubah. Aku akan mengatakan bahwa tempat terbaik untuk pergi ke solo, dan itu adalah 100% aman! Aku akan pasti kembali ke resor zen segera! Dr. Mahendra - pemilik adalah orang yang sangat khusus yang membuat saya merasa seperti bagian dari keluarga dan mengajari saya teknik yang…",5
91, Zen Resort Bali,"Sebagai pasangan dari swedia yang ingin menyelam dan melakukan yoga, ini adalah benar-benar sempurna. Manajer mrs. Budiani berada di atas segala sesuatu. Pijatnya yang terbaik. Konsep Zentsu di benar-benar keren. Arnaud, prancis adalah instruktur menyelam sangat santai dan kami merasa benar-benar diurus selama kami menyelam. Ruangan itu sempurna dan besar. Makanan di restoran yang nyaman yang fantastis. Akhirnya, desain dari tempat ini sangat indah.",5
92, Zen Resort Bali,"Ini kedua kalinya saya telah di bali dan aku tidak bisa pergi tanpa membayar kunjungan ke keluarga di zen resort bali. Semua staf menyambut anda dengan cara khusus, seperti semua dari kami! Mereka mencerminkan ketenangan dan keterhubungan. Lokasi yang sempurna untuk liburan yang tenang dan damai. Pijat adalah luar biasa. Makanan yang sehat dan khas bali.   Zen selalu akan menjadi tempat khusus untuk keluarga saya dan saya sendiri. 100% direkomendasikan   ",5
93, Zen Resort Bali,"Ini adalah perjalanan ketiga saya ke zen, tapi pertama saya melakukan hal seluruh tempat. Saya telah dua kali sebelum untuk menghadiri kursus yang difasilitasi kecermatan eksternal - tempat paling menakjubkan untuk melakukan sesuatu seperti itu.  Tapi itu tidak seperti tempat untuk mendapatkan pengalaman penuh. Teman perjalanan saya dan saya memilih untuk 8 hari 7 malam paket melepas stres yang memiliki 13 ayurvedic pijat dan perawatan lainnya, ditambah beberapa wisata.  Kami bertukar wisata biasa, yang kami lakukan sebelum, selama satu hari snorkeling/menyelam - dan mereka dengan senang hati menampung, bahkan meskipun itu berarti yang cukup besar yang mendesain ulang jadwal kami saat mereka baru memesan di spa.  Sebenarnya tidak ada yang terlalu banyak kesulitan. Layanan yang…",5
94, Zen Resort Bali,"Ini adalah kedua kalinya saya di zen, meskipun ini adalah sangat singkat 3 paket malam, itu adalah masih layak perjalanan panjang dari bandara ke resor. Meditasi di pagi hari karena terbangun dengan matahari terbit yang diikuti oleh yoga akan membuat anda stres pekerjaan dan kehidupan juta mil jauhnya. Makanan yang luar biasa, staf akan memenuhi kebutuhan kuliner anda ke tee. Perawatan ayurveda yang benar-benar luar biasa! Aku tidak bisa merekomendasikan tempat ini cukup, mereka memperlakukan semua orang harus setidaknya sekali dalam hidup ini mewah kelas pertama. Resor ini sangat nyaman, bersih, dan ketenangan yang adalah apa yang membuat ini tempat yang anda dapat mematikan dari dunia luar ruangan segera setelah anda tiba. Aku akan memastikan aku kembali lagi, tapi waktu…",5
95, Zen Resort Bali,"Jika anda ingin merasa baik tampak setelah, nikmati makanan sehat, meditasi, yoga, dan perawatan ayurvedic, ini adalah tempat untuk pergi. Pemilik, yang digunakan untuk bekerja untuk pbb, telah membuat dia datang melalui visi dan melihat suasana tenang dengan pemandangan laut. Ini adalah orang-orang yang bekerja di sini, yang membuat pengalaman yang sangat spesial, semua orang hebat anda dengan nama anda dan senyum ramah genuinly dari hari pertama di, setiap perawatan dan yoga dimulai dengan doa. Ini membuat anda menjadi menyadari dan menghargai hal baik dalam hidup. ",5
96, Zen Resort Bali,"Zen merupakan tempat yang indah untuk memperlambat, membangkitkan indera anda dan menikmati berada di saat lagi. Semua orang di sini pergi keluar dari jalan mereka untuk membuat suasana tenang dan ramah. Taman dan pemandangan yang menakjubkan, makanan sehat, perawatan spa yang... namun, apa yang membuat tempat ini begitu istimewa adalah orang-orang, terutama jantung zen mr shah, yang adalah orang yang sangat penuh perhatian dan benar-benar khawatir tentang menjadi tamu yang baik - yang dapat terasa di setiap aspek dari tempat ini dan dalam menyentuh saya.  Terima kasih untuk pengalaman yang indah ini! Alice",5
97, Zen Resort Bali,"Kami baru saja kembali ke amerika setelah tiga minggu di luar negeri, dan selesai liburan kami dengan 4 hari, 3 malam menginap di zen resort bali. Pengalaman kami adalah luar biasa. Lokasi adalah sekitar 4 jam berkendara dari bandara denpasar, yang adalah cara yang indah untuk melihat kehidupan sehari-hari di bali. Resor mengatur transportasi kami dari ubud dan kembali ke Semanyak ketika kami selesai. Makanan yang sangat baik, sehat dan lezat. Kami menginap di vila deluxe premium, yang luar biasa. Pemandangan menghadap ke sawah, dan kami menyaksikan matahari terbit dan terbenam di atas samudera hindia. Perawatan spa adalah beberapa yang terbaik yang kami tinggal. Saya seorang pemula yoga, tapi staf sangat sabar dan edukatif. Matahari terbit meditasi untuk menenangkan jiwa. Ini…",5
98, Zen Resort Bali,"Ini adalah kedua kalinya suami saya dan saya menghabiskan satu minggu di resor zen. Kali ini kami merasa seperti kembali ke teman-teman lama, kembali ke tempat ini ramah, bergizi, santai dan menyenangkan pada saat yang sama. Kami sangat menikmati semua waktu kami di sana: pertama dan terutama ini adalah orang-orang yang memastikan anda tampak setelah dalam cara terbaik, maka itu lingkungan yang sangat santai dan indah, dan terakhir tetapi tidak paling tidak dengan makanan, meditasi dan yoga dan perawatan ayurvedic disesuaikan untuk memenuhi kebutuhan anda.  Kami merasa segar, penjahit dan jauh lebih bahagia. Kami akan kembali lagi tahun depan!",5
99, Zen Resort Bali,"Aku pergi ke zen resort untuk beberapa tempat untuk mencerminkan, mengeksplorasi dan pemulihan. Saya sangat sedikit cemas pada awalnya karena saya telah membaca ulasan yang sangat baik jadi saya tidak ingin menjadi orang yang kecewa. Saya tidak khawatir karena hotel ini melebihi harapan saya. Saya memilih kamar matahari terbenam, dengan fitur besar kamar mandi udara terbuka, kamar tidur luas dan teras berjemur yang luas dengan fitur air dan bertingkat. Tempat tidur adalah besar dan nyaman. Jika anda ingin pergi ke suatu tempat di mana anda merasa istimewa, aman dan peduli untuk, maka saya akan sangat menyarankan resor zen. Berada di anggaran yang ketat ini adalah tempat yang cukup memuaskan bagi saya. Namun, ketika anda mempertimbangkan apa yang anda dapatkan di kembali dan anda…",5
100, Zen Resort Bali,"Aku punya satu minggu untuk menghabiskan di wilayah setelah bisnis di china. Diperlukan untuk bersantai tapi juga ingin menyelam. Menemukan kedua dan lebih di zen. Perjalanan yang agak panjang dari bandara, tapi sopir itu indah dan begitu juga pemandangan. Setelah tiba, mereka melakukan banyak untuk membuat anda merasa zen dari getgo.  Jadwal mereka sangat menghargai untuk tinggal - kami membuat beberapa perubahan setelah berbicara dan itu menyenangkan. Semua layanan spa yang sangat baik. Makanan yang luar biasa. Kami tinggal adalah sangat baik untuk membantu anda merasa disambut. Aku ada di sana ketika hanya ada sekitar 8 tamu - semua wanita bepergian sendirian. Memiliki waktu yang menyenangkan untuk mendapatkan untuk mengetahui tamu lain.   Yoga adalah baik, tetapi sangat…",5
101, Zen Resort Bali,"Saya baru-baru ini menghabiskan 6 malam di retret zen di kecermatan yang sudah ada selama bertahun-tahun.  Pengalaman saya adalah segalanya dan lebih yang saya diberitahu itu akan dan aku merasa seperti saya telah mengambil sepotong zen dan tetap di hati saya.  Seluruh pengalaman itu luar biasa dari saat saya tiba. Objek purnama upacara pembersihan, perhatian terhadap detail dan villa yang indah, dengan staf yang selalu tersenyum dan benar-benar bertanya bagaimana saya dan pengalaman.  Saya akan kembali ke sini lagi dan benar-benar dapat merekomendasikan tempat untuk pergi ke zen karena terhubung dengan diri anda sendiri.",5
102, Zen Resort Bali,"Zen itu...   Anda akan diperlakukan untuk hutan/lingkungan tenang menakjubkan pemandangan laut dan gunung. Sebuah kolam renang yang indah dan tempat yang bagus untuk bersantai di seluruh taman.   Aku pergi pada 5 hari paket kebugaran dan menambahkan satu hari ekstra untuk akhir. (layak dikunjungi). Pagi itu termasuk meditasi, yoga pagi, sarapan, perawatan spa 3 kursus makan siang dan makan malam.   Kamar sangat dasar dengan hal biasa, pancuran luar ruangan dan bak mandi, lemari dan aman * tidak besar pencahayaan di kamar mandi, tapi karena anda di sini untuk bersantai dengan kenyataan bahwa anda tidak dapat melihat apa yang anda lakukan untuk membuatnya lebih baik. Saya di sunset kamar yang berarti saya memiliki luar ruangan tempat duduk dengan tempat tidur santai untuk…",5
103, Zen Resort Bali,"Surga di bumi!  Staf sangat pribadi, ramah dan membantu. Benar-benar tempat yang bagus untuk bersantai dengan fantastis kolam renang yang luas, taman yang indah dan tidak ada massa wisata. Jika anda ingin dihibur ini mungkin bukan tempat untuk anda. ",5
104, Zen Resort Bali,"Tangan ke bawah terbaik di 10 hari perjalanan saya ke bali adalah paket relaksasi zen 4 hari dan 3 malam di zen resort di bali - singaraja sekitar 3 jam di utara ubud. Ini akan menjadi cukup lama posting jadi untuk kesimpulannya - hanya pergi ke sana dan memilih sebuah paket yang mencakup perawatan spa - sangat baik dalam segala hal. Pikiran, tubuh dan jiwa ada lebih baik untuk setelah menemukan tempat suci ini!  Aku pergi di awal mei 2016 dengan pasangan saya untuk merayakan ulang tahun pernikahan kami. Untuk memulai, saya harus menyebutkan bahwa saya tidak menyadari ketika pemesanan resor yang terletak jauh di utara, bahkan saya senang saya tidak menyadari ini oleh karena mungkin akan saya pemesanan yang akan menjadi kesalahan besar! Saya juga agak ragu-ragu pada harga (~$1900…",5
105, Zen Resort Bali,"Zen bali tampak begitu indah di situs web mereka, tetapi ketika aku ada di sana itu benar-benar melebihi harapan saya. Semua orang yang bekerja di sana dari penerimaan, untuk restoran, untuk wanita di spa, bahkan tukang kebun yang sangat ramah, membantu dan pergi keluar dari jalan mereka untuk membuat saya tinggal kenangan. Saya mencari tempat di mana aku bisa mengisi kembali tenaga kesehatan yang menyeluruh, secara fisik dan mental dan zen bali yang sempurna. Ada baik pagi hari meditasi, yoga dan spa kelas dunia. Ini adalah campuran yang sempurna ayurvedic givien dress dengan sentuhan bali. Makanan sehat dan lezat dan kolam renang adalah ilahi. Staf dan anak-anak mereka bahkan mengadakan pertunjukan tari untuk semua tamu dan kami mengakhiri malam semua menari bersama. Tidak…",5
106, Zen Resort Bali,"Kombinasi pemandangan yang menakjubkan, pengalaman spa keluar dari dunia ini, meditasi dan yoga harian, salam hangat dan sedikit sentuhan pribadi membuat ini pengalaman yang tak terlupakan. jadi bersyukur, terima kasih!",4
107, Zen Resort Bali,"Saya telah tinggal di penginapan zen beberapa kali selama beberapa tahun terakhir, dan aku terus kembali. Resor ini sangat indah, subur dan terawat dengan baik menghadap ke lembah dengan sawah dan laut bali. Kamar luas dengan kamar mandi luar dan kamar deluxe baru juga memiliki kolam berendam pribadi.  Staf adalah baik dan penuh perhatian pada apa yang mereka lakukan. Para wanita di spa memiliki tangan ajaib dan perawatan yang bagus. Favorit pribadi saya adalah selamat datang dan perawatan mandi Lulur tapi saya juga merekomendasikan mencoba berbagai perawatan ayurvedic.  Jika anda mencari untuk santai dan penyembuhan pengalaman, zen adalah tempat anda.",5
