,hotel,review,stars
0, Zen Resort Bali,"Butuh beberapa minggu untuk sepenuhnya menyerap pengalaman yang saya miliki di resor Zen. Selain akomodasi yang luar biasa, makanan, dan layanan, orang-orang Zen dan fokus pada kesehatan dan kasih sayang menyentuh saya pada tingkat yang sangat spiritual.",5
1, Zen Resort Bali,"Retret hebat untuk memulihkan diri Anda secara fisik, mental dan emosional. Sementara yoga 2 x / hari itu lembut, latihan dan fleksibilitas yoga saya meningkat secara dramatis. Makanannya sangat lezat, Anda tidak merasa seperti makan sehat (tetapi Anda - - semua orang mengatakan bahwa saya kehilangan berat badan setelah saya tinggal). Staf, dipimpin oleh Ibu Budhiani yang luar biasa, sangat perhatian, begitu baik dan positif, mereka benar-benar membuat tempat. Shah, sambil mengelola banyak proyek dan usaha, sangat berkomitmen untuk Zen dan mengingat semua orang yang tinggal di resor. Dia juga akan mendorong Anda untuk memperlambat, dan fokus pada perhatian dan pertumbuhan pribadi. Bonus tak terduga - - Saya bertemu orang-orang hebat dan membuat beberapa teman luar biasa.…",5
2, Zen Resort Bali,"Itu adalah waktu yang luar biasa yang diizinkan untuk saya alami di resor Zen. Ketenangan, atmosfer, keramahan stafnya menenangkan. Dan makanannya luar biasa. Kami telah memesan seluruh paket ""retret pelepasan stres"". Itu adalah pengalaman spiritual yang luar biasa bagi saya. Saya hanya dapat merekomendasikan resor ini kepada siapa pun.",5
3, Zen Resort Bali,"Suami saya dan saya cukup beruntung untuk menghabiskan waktu di Zen awal tahun ini. Resor ini indah dan staf luar biasa. Kami memesan paket Wellness, jadi menikmati setidaknya dua perawatan di Spa setiap hari. Mereka benar-benar fantastis. Kerikil punggung dan leher dan seringai yang telah ada selama bertahun-tahun hilang pada akhir waktu kami di sana. . . . tentu saja dibantu oleh yoga harian. Suami saya belum pernah melakukan yoga sebelumnya (dan kami bukan ayam musim semi) tetapi Ilu mampu menyesuaikan semua latihan agar sesuai dengan semua tingkat kemampuan untuk memastikan semua orang mendapat manfaat terbaik dari latihan mereka. Di antaranya, kami makan makanan yang paling indah, disiapkan segar, dan dengan banyak bahan tumbuh di properti. Kami tidak sabar untuk kembali! !",5
4, Zen Resort Bali,"Menghadiri Zen sebagai bagian dari kelompok retret yang berbasis di Melbourne, yang terbukti benar-benar transformasional. Staf retret, yang cakap dipimpin oleh Budiani, semuanya luar biasa dan tidak bisa melakukan cukup bagi kami - selalu tersenyum dan bersedia bekerja ekstra untuk membuat para tamu merasa diterima dan nyaman.  Spanya luar biasa, dengan terapis dan praktisi yang luar biasa yang mampu melakukan beberapa terapi luar biasa tergantung pada kebutuhan individu - saya tidak bisa berterima kasih cukup atas perhatian mereka yang sungguh-sungguh. Saya memiliki empat atau lima perawatan terpisah selama enam hari saya di sana, dan hanya pada satu kesempatan, saya merasa sedikit kecewa karena perawatan merasa agak terburu-buru dan tidak terkoordinasi. Saya tidak yakin…",5
5, Zen Resort Bali,"Saya pergi zo Zen resort untuk bersantai dan mendapatkan inspirasi tetapi pada akhirnya saya mendapatkan jauh lebih banyak dari tempat saya datang. Ini karena lingkungan yang indah, orang-orang cantik di Zen yang membuatku merasa di rumah, yoga dan meditasi, makanan enak dan yang terakhir, pijat yang merupakan pijat paling spesial yang saya terima dalam hidup saya. Terima kasih khusus saya sampaikan kepada staf. Anda benar-benar dapat merasakan cinta sejati yang mereka miliki untuk para tamu dan pekerjaan yang mereka lakukan. Saya akan merekomendasikan kepada siapa pun untuk bermeditasi di pohon karena itu adalah tempat yang sangat spiritual dan saya menyadari di sana apa alasan sebenarnya untuk datang ke Zen: Untuk melakukan penyembuhan agar saya dapat mengikuti jalan saya.…",5
6, Zen Resort Bali,"Surga di Bumi hadir dengan sangat jelas di Zen Resort Spa dan lima elemen kehidupan menari dengan bahagia di sini sebagai satu. Saya tiba lelah setelah seminggu yang panjang dengan perencanaan bisnis dengan kolega dan sangat membutuhkan istirahat, perbaikan dan ruang hanya untuk menjadi. Saya menemukan diri saya di lokasi yang sempurna untuk ini. Tempatnya spektakuler, dipelihara dengan indah, penuh warna dan liar, dengan banyak tempat peristirahatan untuk duduk bersama dengan diri sendiri dan memulihkan kedamaian batin dan cinta yang kita semua cari.  Staf di Zen hidup dalam harmoni yang tak terpisahkan dengan kehidupan di sekitar mereka yang memodelkan dengan sempurna kedamaian dan koneksi batin dan luar yang merupakan etos sentral Zen Resort Spa. Didirikan dan dipimpin oleh…",5
7, Zen Resort Bali,"Sebagai traveler wanita solo, saya memutuskan untuk memesan ZEN Resort akhir tahun lalu! Itu adalah salah satu keputusan terbaik saya! Saya membaca ulasan yang bagus tentang resor dan saya hanya bisa setuju: Ini adalah tempat yang indah! Sempurna untuk bersantai dan staf hotel dan terapis memang sangat penuh perhatian, ramah dan membantu. Rasanya seperti keluarga. Di athmosphere sederhana ini, sangat mudah untuk berhubungan dengan tamu lain dan bertemu orang-orang hebat! Sungguh menakjubkan betapa cepatnya waktu berlalu. Tempat hotelnya indah, sangat alami! Dan perawatan Ayurvedic luar biasa! Terima kasih banyak atas pengalaman luar biasa ini, ZEN Resort sayang! Saya menyimpan kenangan hangat tentang masa tinggal saya!",5
8, Zen Resort Bali,"Kata-kata tidak dapat benar-benar menggambarkan waktu kita di Zen Resort - tetapi saya akan mencobanya. Kami benar-benar menemukan tempat yang luar biasa dari ketenangan, penyembuhan, pengisian ulang dan kesejahteraan murni dari hati, tubuh dan jiwa ini. Itu tanpa diragukan lagi adalah salah satu highlights kami selama bulan madu kami di Bali dan kami tidak akan pernah melupakan waktu yang kami habiskan di sana.  Setelah kedatangan kami disambut dengan koktail selamat datang yang lezat dan sehat. Kami diperkenalkan kepada direktur retret yang menghabiskan waktu bersama kami untuk mencari tahu apa yang kami butuhkan untuk menemukan kedamaian batin kami lagi. Luar biasa seberapa dalam kami bisa melangkah. Menurut sesi ini, kami menyetujui perawatan, meditasi, dan praktik tertentu.…",5
9, Zen Resort Bali,"Kami menghabiskan 4 malam di luar biasa ini sebagai bagian dari bulan madu kami. Kata yang dapat menggambarkan pengalaman kami tidak! Ini melebihi harapan kami! Lokasinya indah: sangat terawat dengan taman yang rimbun, pemandangan laut, kebun dan sawah. . . dari saat anda memasuki tempat magis ini anda akan merasa santai dan di rumah. Kamarnya sangat luas dan nyaman dan makanannya lezat. Selalu Apa yang membuat tempat peristirahatan ini benar-benar menonjol adalah orang-orang yang bekerja di sini: Kami telah melakukan banyak perjalanan selama bertahun-tahun dan telah menginap di segala macam tempat, tapi kami tidak pernah menemukan staf yang sangat profesional, yang dikhususkan, baik, dan peduli. Seperti yang sedang berbulan madu, kami diberi banyak perhatian ekstra, seperti…",5
10, Zen Resort Bali,"Saya dan keluarga saya sangat senang untuk menginap di sangat mempesona, Zen Resort Bali yang ajaib. Butuh waktu sekitar satu hari bagi saya untuk mendapatkan digunakan untuk positif - energi frekuensi tinggi Zen atau sampai saya mengerti. Efek setelah itu semua lebih memuaskan.  Presiden dan pemiliknya Dr. Mehendra Shah sangat hangat dan tim nya merupakan tuan rumah yang sempurna. Saya dan istri saya menghormati secara pribadi diperkenalkan kepada pusaran sejarah dan penyembuhan pohon-Zen melalui Mahendra. Dari pahlawan ini mengalami guncangan ada koneksi ke tempat-tempat yang ajaib yang berbeda Bali dan khususnya untuk penyembuhan pohon-Zen. Saya dan istri saya cerita secara mandiri di depan Pohon penyembuhan. Pengalaman kami selama meditations sulit untuk menjelaskan dalam…",5
11, Zen Resort Bali,Setelah melakukan beberapa penelitian saya memutuskan untuk menginap di Zen dan saya sangat senang karena tidak! Dari saat saya tiba keramahan dari staf yang fantastis dan yang awal. Seluruh resor ini tenang dan perawatan yang sangat fantastis. Pengaturan bunga dan buah-buahan segar yang diantar ke kamar saya setiap hari yang merupakan sentuhan yang manis. Seluruh resor selalu sepi dan tenang dengan perasaan instan untuk relaksasi. Makanannya juga standar yang bagus setiap hari. Sunrise meditasi yoga dan dipandu oleh tenaga profesional yang patut bangun lebih awal! Saya akan kembali!,5
12, Zen Resort Bali,"Pertama-tama mari saya mengatakan bahwa staf yang luar biasa adalah apa yang membuat tempat ini begitu unik. . . . mereka semuanya sangat bersahabat, perhatian dan profesional dan pergi keluar dari jalan mereka untuk membuat anda di rumah dari saat anda masuk ke dalam.  Lokasinya sempurna - seperti jauh dari Kuta karena anda bisa mendapatkan. Saya tidak keberatan tentang berbelanja dll tapi resor ini memiliki driver yang tersedia jadi anda dapat keluar dan tentang jika anda perlu atau ingin. Akomodasi yang luar biasa - kamar yang besar, kamar mandi luar ruangan yang indah dan tempat tidur yang nyaman. Sangat bersih dan tidak ada kesalahan.  Saya memiliki sebuah paket dengan beberapa perawatan termasuk - Saya senang untuk mencoba apapun dan semuanya dan saya senang karena tidak.…",5
13, Zen Resort Bali,"Saya tidak dapat mulai menjelaskan bagaimana resor ini. Indah Zen Kami memiliki waktu dan mencerahkan mengangkat di Zen dan saya akan senang untuk kembali lagi. Kami disambut di bandara dan diantar ke resort dan pada saat kedatangan sangat menyenangkan minum dan disajikan dengan baik. bunga leis Kami dibawa ke kamar yang luar biasa dan kami diperlakukan untuk makanan yang fantastis, walaupun kami tiba larut malam. Di pagi hari kami bertemu dengan dokter dan mulai rencana kami untuk perawatan dan penyembuhan. Ia sungguh luar biasa, dan memperlakukan kami dengan empati dan kasih sayang. Sepanjang minggu kami di sana, staf tahu kami secara pribadi, memperlakukan kami seperti keluarga, dan menawarkan perawatan yang luar biasa untuk kesejahteraan kita. Rapi, makanan yang luar biasa…",5
14, Zen Resort Bali,"Zen Resort adalah tempat yang ajaib dan unik. Saya baru untuk perawatan Ayuverdic dan menemukan di sini luar biasa. Perawatan Pemijat saya, Artini, luar biasa dan menyentuh semua tempat yang tepat untuk bersantai dengan bantuan tubuh dan pikiran. Saya tidak bisa terima kasih dia cukup untuk kerja keras, care dan kasih yang dia masuk ke dalam perawatan. Juga, empat tangan (oleh dua orang terapi pijat di waktu yang sama) adalah keluar dari dunia ini. Terapisnya yang dan semua staf di Resort (tukang, terapi, staf restoran, staf di resepsionis, manager, dll) sangat membantu dan ramah, dan menyapa anda dengan senyuman tidak peduli apa yang waktu itu adalah hari. Anda tidak dapat membantu tapi tersenyum kembali. Makanan di restoran sangat lezat dan bervariasi, dan sehat, dan koki akan…",5
15, Zen Resort Bali,"Saya benar-benar tidak tahu harus memulai dari mana. . . mungkin di awal! Teman dekat meminta saya untuk bertemu dengannya di Bali, untuk mengambil waktu jauh dari apa yang telah cukup sibuk dengan gerakan internasional, memulai pekerjaan baru dan bekerja, saya semester pertama MBA. Saya Ini adalah keputusan terbaik yang saya untuk pergi dari semua.  Saya menemukan diri saya di sebuah tempat di mana waktu masih berdiri, di mana saya di tempat yang paling tenang dan suasana tenteram yang bisa saya bayangkan. Staf di sini luar biasa adalah pengiriman indah dan tulus, tuan di dapur, menu setiap hari yang luar biasa layanan dan kualitas akomodasi yang lebih dari nyaman, bersih, dan salah satu yang terbaik saya tidur nyenyak di malam hari.  Selain itu, de la; creme, perawatan; creme…",5
16, Zen Resort Bali,"Resor ini memiliki sebuah Zen wellness program yang unik, saya tidak melihat di manapun di dunia. Ini menggabungkan meditations, yoga, perawatan Ayurvedic, rohani penyembuhan emosi, kelahiran kembali, kerukunan, menyelam, sesi makanan luar biasa dan pembicaraan dengan pemilik Mahendra dan Ayurvedic Deepu dokter. Keindahan dan energi dari tanah membuat anda untuk sepenuhnya bersantai dan ada beberapa tempat yang khusus dengan rahasia memberikan wawasan yang mendalam tamu. Akomodasi yang sangat bagus. Saya pertama kali kamar yang saya anggap sempurna tapi kemudian saya pindah ke salah satu villa dengan kolam renang kecil yang sangat luar biasa. Saya tidak pernah ingin meninggalkan tempat ini.  Perawatan spa juga luar biasa dan ada begitu banyak variasi yang berbeda. Salah satu…",5
17, Zen Resort Bali,"Ini adalah jauh lebih banyak dari hanya sebuah resor atau retret yoga. Ini adalah pengalaman hidup yang luar biasa. Semuanya dari properti, akomodasinya, yoga, dan pelajaran mediasi untuk perawatan spa dan makanan yang sempurna. Saya tidak sabar untuk datang kembali!",5
18, Zen Resort Bali,"Kami sangat terkesan dengan resor dan tingkat excellence pemilik telah pergi untuk memastikan tidak ada yang ketinggalan untuk kenyamanan dan kenikmatan para tamu. Vila yang luar biasa dan perhatian terhadap detail sangat mengesankan. Makanannya pasti akan memberikan 5 bintang dan restoran lain di Bali kompetisi tingkat tinggi. Posisi yang ideal dan melakukan meditasi pagi untuk petunjuk personel terlatih Ayurevedic sambil menonton matahari terbit sangat khas. Jika anda mencari sebuah resor dengan kredensial Wellness dengan harga terjangkau dan kemudian trow dalam menyelam dan Yoga, dan ini benar-benar tempat yang sangat unik dan tempat yang menarik.",5
19, Zen Resort Bali,"Tempat ini ajaib. . . Perjalanan saya telah benar-benar lebih dari yang saya harapkan. Dari makanan yang luar biasa, semuanya pijat/perawatan yang menakjubkan tapi bagian yang terbaik adalah orang-orang yang bekerja di sini, semua orang sangat ramah, perhatian, dan cinta. Perjalanan ini tidak hanya telah santai tetapi sudah sangat ciptaan rohani dan mengubah hidup untuk saya. Terima kasih khusus kepada Dr Shah, dia adalah manusia yang luar biasa dan juga orang-orang yang indah yang bekerja di sini yang tempat ini tidak akan menjadi spesial ini tanpa kerja keras dan jiwa yang indah. Harap manjakan diri anda dan pengalaman magis ini, Anda akan menerima lebih dari yang anda harapkan. Saya tidak sabar untuk datang kembali! ! !",5
20, Zen Resort Bali,"Saya datang ke Zen sebagai pelancong solo yang mencari untuk menyelam dan belajar akan bersertifikat yoga, dan saya tidak kecewa!  Sebelum perjalanan ini saya memiliki pengalaman nol dengan yoga, meditasi, dan menyelam. Saya benar-benar menikmati matahari terbit, meditasi yoga diikuti oleh setiap pagi, dan matahari terbenam adalah yoga cara yang sempurna untuk mengakhiri hari. Saya berencana untuk melanjutkan rezim yoga ketika saya pulang ke rumah.  Pengalaman menyelam yang juga luar biasa. Arnaud membuat proses mudah dan menyenangkan, mengambil lambat untuk membuat saya merasa nyaman dan percaya diri. Begitu banyak sehingga saya terus menyelam di resor lain di utara Zen, dan kini memiliki 10 penyelaman di bawah sabuk. Bali adalah tempat yang ideal untuk belajar. Tenang, jelas,…",5
21, Zen Resort Bali,"Tempat ini adalah tempat yang paling indah untuk menyembuhkan dan santai. Dari matahari terbit di sepanjang hari, selalu ada cara untuk membuat diri anda sibuk. Para staf yang luar biasa dan pemilik Mahendra dicampur dengan semua orang setiap hari. Dari meditasi yoga untuk pijat atau untuk berada di laut untuk melihat lumba-lumba, terapi terbaik untuk relaksasi dan menyedihkan.  Merekomendasikan 110 %",5
22, Zen Resort Bali,"Wow, apa yang bisa saya katakan tentang resor ini. Ini benar-benar tempat terbaik yang pernah saya tinggali di Bali. Ini adalah perjalanan saya yang ke 5 & sangat merekomendasikan menginap di Zen. Tidak hanya staf semua orang yang luar biasa, anda menjadi bagian dari keluarga mereka. Tidak bisa merekomendasikan tempat ini cukup, manjakan diri anda dan menginap di tempat yang indah ini dengan orang-orang yang paling peduli yang pernah ada. Menyukainya & Miss Zen begitu banyak. Ini seperti rumah kedua saya.",5
23, Zen Resort Bali,"Zen Resort Bali dikirimkan persis apa yang dijanjikan dan kemudian beberapa. Staf dan Mahendra sangat luar biasa, pelayanan yang menyembuhkan bagi tubuh dan pikiran, meditasi yoga pagi dan memberikan saya perasaan yang dalam ketenangan dan kesehatan, dan pengalaman menyelam yang merupakan bonus tambahan. Akomodasi yang sangat nyaman saya di kamar suite standar lebih yang menghadap ke kolam renang dan itu sangat bagus tapi saya juga mengunjungi premium suites yang berarti kamar yang lebih besar, menghadap ke taman yang terawat rapi, hari tempat tidur dan jubah sutra! Zen sangat detail oriented jadi bersiap-siap untuk kejutan kecil di sana-sini. Saya benar-benar menikmati keindahan taman dan tamannya sangat fleksibel dan bagaimana staf yang harus anda ingin diubah atau tur.…",5
24, Zen Resort Bali,"Saya memiliki pengalaman yang luar biasa di Zen Bali. Tempat ini benar-benar indah, bunga-bunga, bau, suara alam, semua benar-benar menarik. Vila ini membuka sejuk dan sangat bersih. Perawatan spa semua memiliki juga merasa bulat. Semua sentuhan spesial benar-benar pergi di sepanjang jalan. Begitu banyak perawatan yang unik dan bagus. menyediakan perawatan terapis Staf sangat sopan dan melakukan segala sesuatu untuk membuat pengalaman tinggal saya sangat spesial. Tempat ini adalah sebuah permata yang nyata. Sangat baik dan penuh energi lingkungan yang santai. Saya akan kembali!",5
25, Zen Resort Bali,"Saya dengan sepenuh hati merekomendasikan untuk tinggal di Resort Bali. Zen Ini adalah tempat yang sangat damai dan lingkungan yang membuat relaks didukung oleh staf yang sangat hangat dan menawan. Semua staf, admin, tukang kebun, keamanan, sang pramupijat, dapur/ staf restoran dan para dokter dan guru semua bebas mengekspresikan Lafal salam hangat karena anda menjelajahi properti yang sangat baik dan sangat membantu dan fleksibel ketika ia datang untuk mengatasi kebutuhan individu dan keinginan anda.  Kamar saya bersih, luas, sangat nyaman dan sangat terpelihara dengan baik oleh petugas kebersihan.  Properti dan sekelilingnya sangat indah.  Saya benar-benar, benar-benar sangat banyak, menikmati perawatan dan merasa aman dan nyaman di tangan para staf yang sangat profesional,…",5
26, Zen Resort Bali,"Kami memutuskan untuk melakukan sesuatu yang kami telah pernah dilakukan sebelumnya dan pergi ke ""kesehatan"" tempat. Setelah beberapa pencarian kami menemukan Zen Resort di bali.   Tempat ini adalah fantastis. sangat murah, tapi nyaman. Kami pergi selama 14 hari  Dan saya akan kembali lagi tahun depan, tapi selama 7 hari. 14 hari itu baik, tapi masa kecil yang cocok dengan saya. Istri saya tidak akan pergi, tapi ia menikmati liburan terutama pijat.   Ada pilihan yang berbeda dan ini adalah terbaik yang ditinjau di situs web mereka. Hari kami mulai dengan meditasi di 6 jam dengan yoga, sebuah jalan untuk kami 1, di 645. Sarapan untuk 2 jam pijat untuk 1.5. Saya tidak pernah mengalami begitu banyak gaya yang berbeda. Kami bagus, tetapi beberapa lebih baik daripada yang lain.  …",5
27, Zen Resort Bali,"Jauh dari hiruk-pikuk keramaian, sepotong surga untuk diri sendiri - atau jadi sepertinya. Perdamaian, ketenangan, waktu untuk diri Anda sendiri dan belum ada orang lain untuk berbicara, dan berbagi pengalaman dengan tertawa dengan. Kebun-kebunnya luar biasa indah, matahari terbit meditasi dan yoga yang bagus untuk memulai hari, pijat yang melampaui kata-kata; kaki anda dicuci di mandi bunga, berdoa adalah yang Anda katakan dan gunakan mabukan. Saya tidak tahu berapa banyak kali aku menangkap diri saya jatuh tertidur. Jika Anda dapat bersantai terlalu banyak, ini adalah di mana itu terjadi. Para stafnya luar biasa, tidak ada yang terlalu sulit, semua dilakukan dengan senyum. Makanan yang bervariasi, makanan sarapan pasti favorit saya; bubur, madu dan buah segar adalah awal yang…",5
28, Zen Resort Bali,"Saya sedang mencari sebuah retret yoga dan meditasi Zen dan direkomendasikan oleh seorang teman. Saya tidak ingat waktu itu saya merasa lebih baik dan damai. Pekarangan resor luar biasa sekali dan walaupun saya memiliki foto yang saya dapat tentang banyak ketika saya menutup mata saya. Saya menemukan sesuatu yang baru setiap hari. Aku bisa terus dan pada tentang yoga yang hebat, perawatan, makanan, staf (seperti orang-orang yang benar-benar luar biasa), menyenangkan dan ramah tamu. Kebaikan yang memancarkan dari semua staf yang sangat menyenangkan. Anda pasti bisa mendapatkan manfaat dari dunia efek Zen. Perjalanan yang sangat bagus dan menarik. Matahari terbit Dolphin Cruise adalah sangat sangat luar biasa. Chakra terbuka pijat yang luar biasa dan besar berbicara poin. Ini…",5
29, Zen Resort Bali,"Saya dan istri saya baru saja kembali dari yang menyenangkan minggu di Zen.  Ini adalah oleh jauh yang paling santai liburan yang pernah kita miliki, staf yang sangat penuh perhatian, tidak ada terlalu banyak masalah dan perawatan dan pijat di kelas sendiri.  Setiap pagi kami akan mulai hari kami dengan meditasi pagi dengan pemandangan yang menakjubkan. Saya mencoba yoga untuk pertama kalinya dan benar-benar menikmatinya.  Kami berharap untuk sebuah kunjungan kembali ke Zen",5
30, Zen Resort Bali,"Saya tidak bisa lebih bahagia bahwa saya memilih Zen Resort untuk perjalanan solo pertama saya. Saya merasa baik tampak setelah dan sangat aman sebagai seorang wanita yang sendirian. Semua staf benar-benar luar biasa. Terus saya mengatasi dengan nama saya, konyol dan menghibur semua permintaan saya memastikan bahwa saya senang dan santai. Senang sangat sosial dengan tamu lain dan makanan yang lezat setiap kali. MS Budiani adalah selalu sekitar untuk memeriksa jika saya senang dengan saya tinggal. Rumah Tangga staf yang pergi mil ekstra untuk memastikan saya tidak senang dan terkejut tentang gecko. Perawatan spa yang menakjubkan. Saya telah melakukan perjalanan secara ekstensif dan ini adalah satu tempat aku akan senang untuk datang kembali karena dari hotel saya menginap. Terima…",5
31, Zen Resort Bali,"Saya tidak dapat menjelaskan dalam kata-kata bagaimana saya merasa setelah meninggalkan resor Zen - mungkin yang terbaik yang pernah saya rasakan dalam hidup saya. Alasan yang indah, perhatian dan keramahan staf, SpA (! ), alat dan waktu untuk bercengkrama dengan diri sendiri - ada sesuatu yang terasa ajaib yang terjadi di sini.",5
32, Zen Resort Bali,"Ini adalah perjalanan pertama saya sendiri dan saya benar-benar akan mengambil sedikit cemas untuk memulai dengan tetapi saya tak perlu khawatir. Saya memiliki waktu yang paling luar biasa. Saya memesan 6 hari, 5 malam paket dan Ayuvedic di hari pertama. Aku merasa seperti aku berada di sana selama seminggu.   Kamar saya adalah indah. Saya tinggal di salah satu villa matahari terbit yang menghadap area kolam renang dan saya suka pancuran mandi luar ruangan :) perawatan spa di lantai dan itu seperti pengalaman yang indah untuk memiliki indah Spa praktisi mengatakan Bali berdoa sebelum setiap perawatan. Saya menyukai tempat ini! Saya sakit dari pengalaman hidup yang menantang dan pergi mencari tempat untuk penyembuhan dan pada rekomendasi dari seorang teman, kami menemukan segala…",5
33, Zen Resort Bali,"Saya ingin memulai dengan mengatakan bahwa ini adalah perjalanan pertama saya pernah saya sendiri. Saya cemas dan sedikit khawatir tentang bagaimana itu semua terjadi. Saya melakukan semua pekerjaan sebelum pergi dan saya memberitahu staf Zen keprihatinan saya. Mereka menjawab semua pertanyaan saya dengan cepat dan dengan perhatian yang nyata. Saya dapat mengatakan bahwa saya tidak perlu telah khawatir. Dari penjemputan di bandara, pikiran Anda lalu lintas di Denpasar cukup mengejutkan untuk sistem saya, untuk perjalanan kembali 8 hari kemudian, segala sesuatu adalah di atas dan melampaui harapan saya.  Staf semua sangat penuh perhatian dan selalu tulus dan disebut saya sebagai saya menemukan Mr brad yang sangat menawan. Yang luar biasa staf spa sangat menakjubkan dan malu…",5
34, Zen Resort Bali,"Zen Resort melebihi harapan saya mungkin. Resor ini terletak di alam yang tidak mencolok di antara Laut Bali di Utara adalah surga di banyak lantai dan saya diberikan kemampuan untuk connect lagi dengan apa yang benar-benar penting. Dari saat Anda langkah kaki di resor ada kedamaian dan tenang, taman tropis yang indah, kolam renang yang indah, kamar kami yang termasuk tempat tidur 4 poster yang indah, teras dan kamar mandi terbuka yang menakjubkan langit memungkinkan kita untuk duduk di luar dan menikmati pemandangan yang mengelilingi taman, kolam renang, sawah dan luar sempurna.  Zen butuh pendekatan holistik untuk kesejahteraan, meditasi harian, pranayama, yoga, perawatan spa (dengan 4 buah tempat pijat adalah suatu keharusan) semua makanan yang indah dan bagian dari kehidupan…",5
35, Zen Resort Bali,"Ini adalah kedua saya tinggal di Zen dan merasa seperti pulang ke rumah. Meskipun lokasinya luar biasa, terletak di utara yang relatif tenang, dan lingkungan sekitar yang asri dan spiritual, itu staf yang membuat resor ini begitu istimewa. Semua orang dari staf SpA, dari tukang kebun, juru masak, staf, siapa pun dan resepsionis, mengambil waktu untuk mengenal Nama Anda, berhenti dan mengatakan halo, dan menghadiri untuk setiap kebutuhan dan - kadang-kadang sebelum anda tahu anda membutuhkannya! Di hotel spa adalah surga, dengan berbagai pijat dan perawatan untuk menyembuhkan, memanjakan diri, bersantai dan terinspirasi. Makanan yang segar, dimasak dan disajikan dengan beragam dan dress code, jadi saya datang kembali lagi beberapa pound lebih terang dan merasa dipelihara.…",5
