,hotel,review,stars
185, Zen Resort Bali,Aku cukup beruntung untuk menghabiskan 15 hari di zen resort bali ini mungkin. Dari matahari terbit sampai matahari terbenam masing-masing dan setiap hari saya mengalami pengalaman yang mendalam. Orang yang mengambil saya di zen dan mencintai saya dengan cara yang diizinkan untuk sepenuhnya bersantai dan aku destress. Aku menikmati suite lengkap dengan perawatan pijat dari spa dengan terapis yang kemudian saya bekerja di luar semua yang ada di tubuh saya stres. Staf sanggraloka yang memenuhi syarat saya setiap permintaan dengan banyak perawatan dan perhatian ketika jika mereka merawat anggota keluarga. Koki yang membuat makanan terbaik yang aku sudah dalam waktu yang lama. Kreativitas dan keindahan di dalam dan di sekitar selunih resort adalah sesuatu yang aku benar-benar…,5
186, Zen Resort Bali,"Ini adalah salah satu dari beberapa tempat di mana anda tidak dapat benar-benar benar-benar membantu dengan menjadi teman dengan manajer ms lokal. Disini Budiani. Di mana layanan pribadi dan sepenuh hati. Di mana anda menikmati ketenangan dan hanya beberapa tamu sehingga ketenteramam. Lalu ada ruang untuk semua tamu. Seperti kita di mana tidak yakin anak-anak bisa bergabung dengan spa dan yoga selama mereka tidak mengganggu orang lain. Para penyelam, sebagai dasar René dan jessica dan membeli kauajarkan anak-anak kita untuk menyelam. Pesta pernikahan yang ajaib almisser. Pasangan yang sedang berbulan madu. Satu iadies di yoga, meditasi, humas detoksin kecermatan yang lama. Makanan yang baik, tidak menakjubkan taman så.",5
187, Zen Resort Bali,"Aku pergi ke sana untuk beberapa hari untuk bersantai dan menemukan cara untuk bergerak di... Apa yang saya diharapkan dan apa yang saya temukan adalah dua hal yang berbeda. Aku diharapkan tempat untuk bersantai dan beristirahat apa yang saya temukan adalah tempat untuk menenangkan sakit dan kenangan yang menyakitkan... bisa membiarkan pergi dan saya dibawa oleh malaikat-malaikat selama perawatan ayurvedic spa adalah sesuatu yang tak terduga.  Ini bermula dengan musik yang indah, bersih dan merasa getaran itu, berikan di atas apa yang menghalangi anda dan pergi dengan aliran musik dan suasana yang anda akan terjaga perawatan dan kekuatan batin dan anda merasa bebas dan santai  Saya sangat merekomendasikan tempat ini Staf adalah sangat membantu dan selalu tersenyum makanan yang…",5
188, Zen Resort Bali,"Kami menghabiskan 5 hari di dan zen, dramatis. Aku datang dengan informasi wisatawan segera setelah kedatangan (aku yakin itu bukanlah sesuatu yang aku makan di zen). Indah lokasi, staf yang ramah, dan perhatian personal -- terutama -- makanan: punya saya kembali ke kesehatan. Beberapa telah menyebutkan bahwa ini adalah ""fan"" dan aku tidak bisa lebih senang: itu segar -- porsinya cukup besar -- dan setiap makan adalah baru dengan perhatian terhadap detail yang menunjukkan perhatian yang telah pergi ke tempat ini. Itu tidak menyenangkan liburan makanan berat (yang akan membuat anda merasa bangga) - - itu adalah hidangan lezat yang akan membuat anda merasa lebih baik daripada ketika anda tiba. Sementara mereka memiliki beberapa spesial dari yang satu dapat memilih, mereka berada…",5
189, Zen Resort Bali,"Saya baru-baru ini punya pengalaman waktu pertama ke bali, salah satu yang saya memesan 8 hari 7 malam paket di zen resort. Staf benar-benar membuat perjalanan saya, para wanita di spa adalah benar-benar indah, hangat, ramah dan sangat perhatian. Aku mencintai matahari terbit meditasi, yoga dan makanan yang luar biasa. Kolam renang dan tamannya sangat cantik dan sangat nyaman ranjang. Tidak ada tv dan wifi terbatas dan ini benar-benar india perjalanan bagi saya. Pengalaman yang benar-benar, dan aku akan kembali. : Catatan untuk pengunjung australia, jangan membeli buku tulis/album foto yang indah di meja resepsionis, mereka memiliki daun palem dan budaya akan menyita!",5
190, Zen Resort Bali,"Zen resort adalah tempat yang menakjubkan dan indah di utara bali. Saya lakukan saya padi dan guru besar di sini. aku tidak ingin pergi!  Taman yang indah, kolam renang menakjubkan menghadap ke laut, vila-vila ini luas, nyaman dan bersih dan menghadap ke taman dan laut, menjelaskan di mana aku bisa menangkap pagi matahari terbit dan matahari terbenam.  Pusat perawatan ayurveda adalah luar biasa, makanannya lezat dan staf di sini selalu tersenyum, menampung, ramah dan membantu! Ini adalah tempat di mana anda dapat benar-benar bersantai, dan mengetahui semangat orang-orang di resor ini. Salah satu tidak dapat melupakan masa menginap tak terlupakan dengan mudah.",5
191, Zen Resort Bali,"Baru-baru ini saya mengunjungi resort di zen Seririt. Hotel ini indah dan tenang, itu jelas ditujukan untuk meditasi dan relaksasi. Di kamar yang sangat kecil tapi memadai ukuran, apa yang membuat hotel ini benar-benar luar biasa adalah di taman, ada pohon dan bunga di mana-mana.  Layanan yang luar biasa! Semua orang ingat nama anda, dan aku tidak berbicara iast nama orang-orang ini di dasar nama pertama!    Kami juga tinggal di perjalanan kami ke properti nibbana resort, cari yang reuiew.",4
192, Zen Resort Bali,"Saya baru-baru ini tinggal di zen resort dan saya paket pemulihan (6 hari/5 malam). Setiap anggota staf yang membuat saya merasa sangat selamat datang, makanan yang sehat dan lezat, perawatan yang dilakukan - setelah terapi tersebut, tetapi masih, tempat ini menakjubkan dan aku mencintai kolam renang. Hotel mediaion dan yoga setiap pagi adalah cara yang hebat untuk memulai hari. Aku benar-benar tidak ingin pergi!  Terima kasih semua orang di zen resort untuk membuat pengalaman berharga.  Berharap untuk segera kembali",5
193, Zen Resort Bali,"Pengalaman yang luar biasa. tempat yang sangat baik di lingkungan yang indah dengan orang-orang yang indah. Aku tidak punya harapan pada saat kedatangan, itu sangat pemesanan menit terakhir. Zen resort menetapkan patokan sangat tinggi untuk liburan masa depan persantaian dan kesehatan. Aku akan pastikan untuk kembali dengan keluarga saya lagi.",5
194, Zen Resort Bali,"Aku tinggal di zen resort selama seminggu dan melakukan 'yg melangsingkan paket'. Ayah saya juga datang untuk 3 hari untuk beberapa relaksasi. Pertama-tama, hotel ini indah. sangat subur dan hijau. Staf yang sangat ramah dan semua tamu yang saya temui selama saya tinggal saya terpesona bahwa mereka semua tahu nama kami! Aku khawatir tentang makanan, karena aku tidak sangat besar, tapi guru itu begitu ramah dan suportif, dalam kenyataannya seluruh tempat memiliki merasa sangat hangat dan membantu. Tamu lainnya juga tampak begitu damai menginap di zen juga, yang adalah benar-benar hebat untuk berada di sekitar. Makanan sudah besar plus bagi saya. Aku selalu mendapatkan sakit ketika saya mengunjungi bali, dan ini adalah pertama kalinya aku tidak! Itu benar-benar baik, dan kreatif.…",5
195, Zen Resort Bali,"Sedikit terlambat untuk menulis ulasan ini! Zen resort adalah menakjubkan dan layak perjalanan dari bandara. Kami selesai dari paket 'kesejahteraan'... Saya tidak pernah berpikir saya akan pernah merasa sebagai santai seperti yang saya lakukan ketika aku meninggalkan. Akomodasi adalah hebat karena dengan menekan tombol pancuran luar ruangan yang indah (jangan khawatir anda tidak akan dingin!). Makanan yang termasuk dalam paket cukup, beberapa hidangan lainnya tidak begitu tinggi. Kebanyakan hotel digunakan melalui menakjubkan, spa menakjubkan! Aku tidak bisa merekomendasikan cukup perawatan. Setiap perawatan yang saya punya itu sempurna, individual dan memiliki unsur spiritual untuk itu. Ini adalah sangat berbakat terapis dan ketika anda berbaring di mandi bunga puncak gunung…",5
196, Zen Resort Bali,"Ruang yang indah yang telah dibuat oleh orang-orang di zen. Saya memesan 3 malam untuk, tinggal untuk 6, dan akan tinggal lagi jika aku bisa! Ini adalah ruang yang memungkinkan saya dan refleksi kepencilan ketika saya membutuhkannya, dikelilingi oleh flora indah, langit, lampu, air. Dan juga dibolehkan untuk koneksi tak terlupakan, percakapan, tawa, dan air mata dengan orang lain yang aku diberkati untuk berbagi resor dengan minggu ini. Aku merasa di tangan warga dan aman dengan staf. Pemilik, dr. Mahendra, diberkati saya dan banyak orang lain dengan bijak, pengacara sejeli, kehangatan, dan semangat untuk bekerja dengan zen. Dan sisanya Budiani dari tim - kue segar, buatan sendiri, dengan semua staf layanan staf yang sangat membantu, hangat dan ramah. Di perawatan ayurvedic…",5
197, Zen Resort Bali,"Seperti pengulas lain telah mengatakan, ini adalah pengalaman yang benar-benar bagus di zen. Saya telah melakukan perjalanan secara ekstensif, dan tidak pernah memiliki aku merasa begitu kaurawat, memupuk, dan menambah semangat seperti yang saya lakukan ketika saya tinggal di zen resort. Aku akan mengatakan ini adalah meremehkan; untuk satu orang, mereka selalu siap untuk menyapa setiap pengunjung dengan senyum tulus dan alamat kami dengan nama. Saya juga menyukai sedikit kejutan-kejutan kecil di kamar saya setiap hari. Suatu sore, aku datang kembali untuk menemukan bak mandi saya dipenuhi dengan kembali ke sini!   Makanan sehat, lezat dan berlimpah; spa juga luar biasa staf dan efek dari perawatan yang telah cukup mendalam; lingkungan adalah menyenangkan; dan kamarnya indah,…",5
198, Zen Resort Bali,"Dari memilih hingga drop off segalanya sempurna. Aku merasa berulas di zen yang penuh energi pada saat aku sampai di sana. Hotel yang indah dan ada staf yang orang lain yang saya bertemu di sana. Tidak ada terlalu banyak masalah untuk membuat saya tetap lebih nyaman dan semuanya dilakukan dengan senyum. Ada juga banyak sentuhan khusus & kejutan setiap hari yang telah ditambahkan ke pengalaman luar biasa. Perawatan yang dilakukan & staf, profesional dan asli. Terima kasih untuk pengalaman yang benar-benar ajaib zen untuk minggu. Saya berharap untuk kembali dan waktu berikutnya juga cobalah menyelam: )",5
199, Zen Resort Bali,"Paling indah dan santai resort dengan layanan pelanggan kelas dunia, sebenarnya saya tidak pernah mendapatkan layanan pelanggan pada tingkat ini di mana saja di dunia. Memanjakan diri di spa adalah di luar, anda benar-benar diperlakukan dengan perawatan dan pemeliharaan selama masa perawatan yang diawali dengan foot bath di bunga-bunga. Harus siapa pun yang ingin memperhidup, menyingkir dari kehidupan yang sibuk di dunia barat dan menemukan apa yang benar-benar penting dalam hidup, yoga dan meditasi harian, kolam renang yang indah dan mengelilingi, luar biasa! Terima kasih zen resort",5
200, Zen Resort Bali,"Setelah penelitian yang menyeluruh dari retret di bali, aku memutuskan untuk pergi ke zen resort karena mereka menawarkan fleksibilitas maksimal dalam paket dan tanggal untuk perjalanan saya.   Dan saya sangat senang saya memilih untuk zen resort pengalaman pertama saya sebagai tempat anda berwisata sendiri.  Itu adalah pengalaman yang unik dan mengubah hidup bagi saya. Sempurna jika anda perlu untuk menjauh dari stres sehari-hari, dan bisa buat ulang.  Zen resort berada di utara bali, di area yang kurang tinggal dan berakhir di pulau ini. Saya tidak perlu khawatir tentang transportasi ke dan dari resort (kira-kira $yang dapat dilakukan. , .5/3 jam dari selatan pulau) seperti itu termasuk dalam paket.  Lokasi zen resort adalah sangat indah, anda dapat melihat pegunungan di satu…",5
201, Zen Resort Bali,"Mungkin itu adalah saat yang tepat untuk kita atau mungkin semua waktu adalah waktu yang tepat untuk berada di zen resort, tetapi kami menemukan kebahagiaan dan banyak lagi ada. Kamar (kami memiliki kamar matahari terbenam) adalah apa-apa pendek dari luar biasa. Dari 'luar' kamar mandi dan kamar mandi, sempurna lokasi dan besar tidur, tapi semuanya bekerja. Sebagai baik sebagai fasilitas, apa yang membuat ini pengalaman yang mengubah hidup zen adalah orang-orang. Semua orang tahu siapa anda, dan mereka selalu memanggil anda dengan nama, tidak ada yang terlalu banyak kesulitan. Layanannya sempurna. Kami memesan beberapa wisata, ditambah meja diatur untuk sebuah mobil dan sopir untuk membawa kami ke ubud untuk perjalanan sehari, semua nilai yang baik.  Makanan di zen sehat, segar…",5
202, Zen Resort Bali,"Minggu mencari untuk resort yang sempurna menawarkan nutrisi dan perawatan ayurveda, pijat, yoga, dan sun mediaion, zen muncul di google sepanjang waktu.  Saya telah menghabiskan 4 minggu terakhir di zen dan saya menulis ulasan ini tentang untuk pergi.  Zen resort telah mengubah hidup saya. Saya telah bepergian cukup jauh dan luas untuk mencari kedamaian dan saya telah menemukan itu di sini.  Sangat sulit untuk dimasukkan ke dalam kata-kata bagaimana mereka menciptakan tempat ini sebagai hotel ini benar-benar ajaib.  Banyak keajaiban datang dari pemilik Mahendra dan dia mencintai tim dari orang-orang yang paling indah anda dapat pernah berharap untuk bertemu.   Hari saya telah menghabiskan berlati mediaion, kecermatan, yoga, pijat dan perawatan yang sangat terbaik, berenang,…",5
203, Zen Resort Bali,"Jika anda ingin merasa benar-benar dimanjakan, di damai adhored, indah, lingkungan yang subur di tempat ini. Paling luar biasa pengalaman, bangun pagi untuk mediaion dan yoga, membuat hari anda dimulai dengan santai. Perjalanan ke sana adalah sangat panjang dan berkelok-kelok, tetapi mengambil panggeng berhenti dan mencoba untuk tidak perjalanan di sana pada hari sabtu karena jalannya bisa penuh perayaan!",5
204, Zen Resort Bali,"Zen pendapatlah:   Perjalanan di sana - itu sangat panjang dan pada saat kami tiba di sana. Aku merasa sakit. Jalan yang berkelok-kelok, jadi jika anda sedang menurun, mengambil sesuatu yang jelek. Ini adalah indah pedesaan. Resor ini benar-benar adalah sebuah oase di tengah-tengah dari mana.   Poolside room - kamar saya tidak siap sehingga mereka menempatkan saya di kamar ini untuk satu malam. Aku tidak menyadari parkir itu begitu baik. Ruangan merasa seperti sel penjara. Tidak berwarna, tanpa jendela yang sangat kecil tanaman dan memiliki lubang besar menghubungkan (tidak akan berhenti terlalu ke dalam. Ada polongnya untuk setiap bagian dan masing-masing pintu harus menutup ketika anda pergi melalui untuk orang jahat di luar. Tidak ada tempat untuk membongkar pakaian laci atau…",4
205, Zen Resort Bali,"Jika anda mencari yang benar-benar pada liburan ini bisa untuk anda. Pagi kemenungan diikuti oleh satu jam dari membersihkan di aula yoga, berbagai pilihan pilihan sehat untuk sarapan kemudian yang pijat ayuvedic dimulai. Aku punya tujuh hari ini dan bisa tinggal lebih lama akan uni emirat arab dan hal yang baik adalah aku masih berlatih meditasi dan yoga setiap pagi sebelum saya memulai hari saya jadi itu mungkin untuk mengubah hidup saya setiap hal baik seimbang dan lezat. Terima kasih kepada semua staf yang luar biasa penuh perhatian dan tentu saja mahundra direktur zen.",5
206, Zen Resort Bali,"Stres dan mati otak. Saya memanggil saya kekuatan dan sisa peninggalan yang tersisa untuk meng-google health retreat. Zen datang skill - ini menawarkan semua aku tahu aku diperlukan - dengan lokasinya, lingkungan tenang untuk pemulihan dan kesempatan untuk"" matikan "" sana melarikan diri dari kebisingan dan keributan.  Makanan di restoran yang luar biasa - Aku diperlukan untuk mendapatkan beberapa berat.   Zen melampaui harapan saya. Sopir saya punya saya ke resepsionis dan aku ditunjukkan ke apartemen mini yang indah. Itu adalah indah dengan besar 4 poster tempat tidur di kayu alami, dengan pencahayaan lembut dan musik. Itu begitu menarik dengan teras yang menghadap taman pribadi yang melewati air mancur dalam berbagai nuansa hijau di bawah ini. Aku punya terbaik tidur aku sudah…",5
207, Zen Resort Bali,"Ini benar-benar luar biasa di zen. Taman, kolam renang, restoran, dan kamar-kamar di hotel menyenangkan tapi saya pikir itu staf yang membuat tempat ini menonjol dibanding hotel lainnya. Di perawatan ayurvedic di tangan terampil dan lokasinya luar biasa staf dan makanan... Saya akan merekomendasikan makanannya! Itu selalu membuatku takjub bahwa aku makan tiga kursus lezat makanan sehat dan tiga hari dan entah bagaimana masih ieave masing beratnya tidak kurang. Bagaimana mereka melakukannya? Atmosfer adalah sangat santai dan saya selalu meninggalkan perasaan diremajakan. Saya pasti akan kembali!  Saya akan merekomendasikan paket yang baik. Anda akan selalu meninggalkan menginginkan lebih jadi tinggal selama yang anda bisa! Anda dapat berjalan kaki ke pantai pasir hitam di sekitar…",5
208, Zen Resort Bali,"Apa menakjubkan 3 malam di zen resort. Dari saat anda mendapatkan dijemput untuk akhir anda dibuat untuk merasa seperti satu juta dolar. Butuh waktu sekitar 3 1/2 jam dari bandara ke bali utara. Kamarnya cantik mempesona. Favorit saya adalah kamar mandi luar ruangan. Anda menerima minuman selamat datang, lei pada saat kedatangan dan diberi jadwal perjalanan anda selama anda tinggal dan kemudian ditampilkan melalui taman kamar.  Ada musik yang bermain di kamar (anda dapat menyesuaikan panas), keranjang buah, dupa pembakaran dan makanan adalah keluar dari dunia ini. Sarapan adalah 2 kursus dan makan siang dan makan malam adalah 3 kursus yang tentu saja pilih dari menu. Segala sesuatu yang indah menakjubkan.  Perawatan dan terapi yang dilakukan dan meninggalkan anda merasa…",5
209, Zen Resort Bali,"Aku tinggal di bali untuk malam 6, dan zen itu hanya menakjubkan, aku punya salah satu paket. ini biasanya akan membawa saya satu minggu untuk bersantai tapi aku santai dalam 24 jam pertama.  Kamar itu hanya indah, dan makanan adalah segar dan lezat. Staf yang indah dan sangat sederhana.  Aku akan senang untuk kembali lagi dan menghabiskan waktu lama di sana.",4
210, Zen Resort Bali,"Kami tiba di hotel dan ingin mendekatkan diri lagi di zen dengan diri kita sendiri. Tidak hanya itu, perawatan, lingkungan, perusahaan dan perhatian untuk kebutuhan individu yang mencapai, ini juga membuat kami merasa berada di, kita adalah bagian dari keluarga zen. Terima kasih semua untuk mengubah hidup. Kami akan kembali!",5
211, Zen Resort Bali,"Pengalaman saya dimulai setelah memesan paket secara online. Saya terkejut untuk menerima, dalam beberapa jam, yang hangat dan ramah dari manajer voicemailnya di zen, Budiani, bertanya tentang jadwal penerbangan saya. Ia mengikuti-up dengan cepat dan memastikan aku punya beberapa rincian transportasi.  Walaupun saya telah bepergian sendiri ke negara lain, selalu ada sedikit ragu-ragu ketika tiba di tanah asing. Di bandara. Saya disambut oleh senyum dan juga souvenir handuk tebal, yang segera menempatkan saya nyaman.  Tiba di zen, dan sisanya Budiani dari staf, sangat ramah dan membuat saya merasa seperti di rumah. Malam yang sama. Saya diundang oleh pendiri dan presiden di zen, dr. Mahendra shah, untuk bergabung dengan mereka untuk sedikit pengakuan perayaan tahunan mereka. Aku…",5
212, Zen Resort Bali,"Dari saat kami tiba di zen kami di dunia lain. Tempat ini begitu indah - di mana-mana anda melihat adalah hijau, subur, dan subway line untuk. Sebuah oase ketenangan. Kamarnya indah dan retret yoga hall, fasilitas spa, kamar dan restoran yang sempurna. Kebanyakan dari semua, hotel ini benar-benar di pantai, orang-orang yang menakjubkan. Mereka semua tahu nama kami dan menyambut kami dengan kebaikan dan cinta setiap hari. Aku bisa sangat merekomendasikan jika anda ingin pergi ke zen untuk beralih dari dunia, belajar beberapa perilaku dan menjelajahi new selanjutnyadalam tentang cara yang berbeda.",5
213, Zen Resort Bali,Aku tinggal di sini selama 8 hari dan sanggraloka ini menjanjikan dilalimkan di kota ini. Staf dan manajemen yang sangat ramah dan bersedia membantu tanpa kelihatan pemburuku - tidak ada tampaknya terlalu banyak kesulitan dan tamu kami benar-benar menikmati sebagai individu. Sebanyak saya menikmati semua perawatan. Saya sarankan mereka sampai lebih dari 10 hari lebih dari 8. Puncak bagi saya adalah tur lumba-lumba di saat matahari terbit.,4
214, Zen Resort Bali,"Anda tahu makanan baik ulasan yang sangat positif atau negatif, ulasan ini adalah milik yodogimi kelimun. 8 hari di zen resort pengalaman yang aku tidak akan pernah melupakan dan saya masih berpikir setiap hari (sudah 4 minggu sekarang).   Semua perawatan, fasilitas dan makanan lebih dari saya, tapi apa benar-benar berdiri dengan orang-orang, thats apa yang membuat tempat ini begitu istimewa. Saya meninggalkan resor ini dengan sadar, perasaan memperseni tamansarinya yang aku masih merasa seperti hari ini. Saya sangat berterima kasih untuk memiliki seperti sebuah tempat magis dan jika anda memiliki kemungkinan untuk pergi. Saya akan merekomendasikan itu.",5
215, Zen Resort Bali,"Apa tempat yang menakjubkan, indah orang-orang yang selalu tersenyum dan tidak bisa melakukan cukup bagi anda. Perawatan untuk mati bagi. Saya tidak berpikir yang baik pijat di rumah untuk lebih cocok dengan tes. Pemandangan dan taman, bunga dan pohon tropis dan tanaman di mana-mana. Makanan lezat, tidak satu jahat makanan di 7 hari. Meditasi dan yoga yang sangat menyenangkan. Ayurvedic dokter nutrisi informatif dan menarik. Perjalanan luar biasa. Anda harus mengunjungi taman surga yang tenang langka ini.",5
216, Zen Resort Bali,"Setelah baru saja kembali dari seminggu yang sangat santai di zen resort indah, aku bisa sangat merekomendasikan hotel ini sebagai hotel dan sebagai pusat perawatan.   Layanan kelas satu yang dikirim dari jantung. Aku tiba sebagai orang asing dan meninggalkan sebagai teman. Terima kasih kepada semua orang yang membuat saya merasa sangat dihargai, anda menawarkan sesuatu bahwa uang tidak bisa membeli.",5
217, Zen Resort Bali,"Saya dan istri saya hanya menghabiskan 3 hari di resor indah ini kecil. Kami berdua memiliki tubuh yang banyak pekerjaan dan ini adalah yang terbaik. Ini mungkin tampak sedikit mahal, tapi s bagus yang kita punya 3 hari paket untuk tamu hotel yang ini. 3 hari dengan beberapa jam perawatan seperti 4 besar susu beras pijat, mandi uap, pemandian herbal, facial, pagi naik perahu untuk melihat lumba-lumba bermain, sarana transportasi, dan semua makanan kami. Kami meninggalkan perasaan seperti kami kehilangan protesmu puluhan tahun usia kita. Diberi kesempatan, kami berharap untuk kembali tahun depan!",5
218, Zen Resort Bali,"Saya memiliki pengalaman yang paling indah di zen. Staf adalah selalu membantu dan toko anggur. Semua perawatan yang sangat santai dan saya memiliki waktu yang sulit meninggalkan. Saya tiba sekitar 10pm dan disambut oleh ms Budiani, pemilik lokasi. Dia hangat dan ramah spirit membuat saya merasa di rumah. Resor ini rapi bersih dan saya hanya merasa keluarga suasana seluruh waktu. Makanan yang lezat dan sebagai solo traveler itu menghibur untuk memiliki transportasi ke dan dari bandara. Jika anda mencari tempat yang aman, santai, kenangan perjalanan, zen adalah tempatnya. Saya sangat merekomendasikan hotel ini dan pasti akan mengunjungi lagi.",5
219, Zen Resort Bali,"Ini adalah pertama kalinya bepergian ke negara lain oleh saya sendiri. Aku mulai perjalanan saya di zen untuk 7 hari. Tempat ini indah, bersih, tenang, dan hanya apa yang saya butuhkan. Staf yang sangat penuh perhatian dan semua kebutuhan saya temui! Perawatan yang sangat baik dilakukan dan semua hidangan yang sangat istimewa dan lezat. Saya terutama menyukai teh jahe dan bau dari bunga segar yang indah! Terima kasih atas pengalaman yang luar biasa. Saya akan merekomendasikan untuk satu pelancong zen, dengan teman-teman atau pasangan!",5
220, Zen Resort Bali,"Tempat yang indah dan taman, dan terapis staf yang indah, makanan yang indah, perawatan yang indah... Saya memilih 10 malam wellness paket tapi mahendra (ini dokter ayurvedic) disesuaikan itu untuk menyertakan beberapa hari jus dan ringan diet. Beberapa perawatan juga diganti - tidak ada terlalu banyak masalah dan tidak ada tambahan biaya. Hari's menyelam (2 kali menyelam). Saya tambahkan untuk 135 euro termasuk, adalah tak terlupakan - selain karang yang mengagumkan, ikan, bintang ikan dll, kami melihat hiu paus 3m (itu hampir cukup dekat untuk menyentuh), gurita dan belut moray. Deepa dan rene sangat baik instruktur dan perusahaan besar juga. Paket datang dengan 21 perawatan yang meninggalkan saya melayang di udara. Pijatnya benar-benar sangat baik diikuti oleh indah bunga…",5
221, Zen Resort Bali,"Aku melakukan 7 hari de-stres paket dan mereka tidak dissappoint. Dari saat saya dijemput dari bandara untuk saat mereka menurunkan saya saya tampak setelah seperti saya adalah tamu hanya di sana. Dari angels di spa kamar untuk menyambut staf di restoran siapa yang tahu bagaimana anda menyukai kopi anda dll. dan staf penerimaan ramah serta staf pemelihara. Terima kasih untuk saya Luh untuk memulai setiap hari dengan saya yang paling menakjubkan meditasi dan kelas yoga. Terima kasih Budiani untuk sepotong indah surga untuk menyegarkan pikiran, tubuh dan jiwa anda.",4
222, Zen Resort Bali,"Suami saya dan saya menghabiskan seminggu di zen resort dan dapat yakin mengatakan ini semua itu claiims untuk menjadi dan bahkan lebih. Kombinasi indah pengaturan, makanan yang indah, dan di atas semua blisful perawatan, staf yang ramah dan membantu, membuat kunjungan kami tidak terlupakan. Sangat direkomendasikan!",5
