,hotel,review,stars
149, Zen Resort Bali,"Tempat ini adalah terang-terangan tamasyawan jebaka. Mereka telah anda di tengah dari mana-mana, dan mereka akan nikel dan sepeser pun -- 10 $20 $dan itu benar-benar membuat -- anda sebelum anda pergi.  15 USD untuk yoga. Saya pikir itu 12 USD untuk meditasi (sekitar satu jam). 6 USD untuk piring kecil buah dengan tambahan pawpaw dan pisang. 20 USD untuk setiap makan buruk, tidak ada minuman, yang seperti yang kami dibayar untuk piring dan hidangan penutup yang gemal Cuca di, shi shi #1 yang terbaik restoran di jimbaran, di mana makanan yang benar-benar luar biasa.  Hal ini juga tempat yang paling mahal kita tinggal di, walaupun kita ada di tempat yang jauh lebih baik dan memiliki kolam renang pribadi, dan bagus lainnya untitled. Juga, kamar kami yang sangat mahal itu pecah…",2
150, Zen Resort Bali,"Aku hanya kembali ke rumah setelah menghabiskan 2 minggu di tropi zen resort. Aku sedang sangat membutuhkan untuk beristirahat dan relaksasi dan apa yang saya benar-benar melampaui harapan saya!  Saya menginap 5 hari dan stres yang detoksin meloskan paket dan itu luar biasa! Aku merasa seperti aku adalah bagian dari keluarga segera dan zen tidak ada terlalu banyak kesulitan. Semua tim zen dari resepsionis, spa, pusat menyelam, dan restoran sangat ramah garders, ramah dan tidak ada yang terlalu banyak kesulitan. Tim ini memastikan anda inginkan untuk apa-apa!  Aku bisa jujur mengatakan bahwa perawatan Ayuredic baru. Setelah 2 hari perawatan yang memastikan semua stres dan kelelahan saya merasa cepat menghilang dan para wanita di spa hanya indah. Suatu hari saya mendapat sorotan…",5
151, Zen Resort Bali,"Saya dan istri saya baru saja kembali dari waktu yang menakjubkan di zen resort bali! Dari saat pertama kita melangkah kaki di tempat yang indah, kami besaratau dari serba cepat-cepat meleleh iives. Staf adalah benar-benar menakjubkan dan akomodatif. Sunrise villa itu sempurna bagi kami, dengan teras yang indah dengan perabotan yang nyaman untuk duduk-duduk, pintu kayu berukir indah dan romantis di pintu masuk dengan shower luar ruangan. Ketika kami memasuki kamar, kami disambut dengan bunga segar di tempat tidur kami desain. Spa adalah benar-benar fantastis! Kami melakukan perawatan di juli setiap hari. Kami sangat merekomendasikan 90 menit pijat ayurvedic dan pijat minyak marma. Keduanya fantastis! Ada banyak makanan sehat, lezat makanan pilihan dari menu a la carte yang kami…",5
152, Zen Resort Bali,"Aku baru saja meninggalkan zen resort setelah seminggu besar di 8 hari/7 malam paket ayurvedic. Aku memesan menit terakhir perjalanan ke bali setelah satu pekerjaan dan memulai bisnis baru. Aku sedang mencari sebuah resort di mana aku bisa ketidakterkaitan dan memulihkan energi. Zen melampaui harapan saya dalam setiap cara.  Staf: Staf adalah benar-benar fantastis. Mereka sangat ramah, baik dan murah hati. Tempat ini merupakan sanggraloka kecil (12 kamar saat ini, meskipun ukurannya menduakalikan hadir berdefile) sehingga anda benar-benar mendapatkan untuk mengetahui staf. Mereka memanggil anda dengan nama dari makanan dan benar-benar peduli tentang anda - dari staf memasak, hingga dr. dan mr. Vijay Mehindra, pengemudi dll. Staf membuat anda merasa terpisah dari keluarga dan…",5
153, Zen Resort Bali,"Saya ringkai di tubuh dan pikiran. Aku butuh tempat untuk beristirahat dan memulihkan diri... Aku benar-benar berharap untuk menemukan itu. Ya aku benar-benar mengerti, dan masih banyak lagi. Aku tidak pernah bisa bermimpi pengalaman yang aku punya. Aku kehilangan kata-kata... magic!  Meditasi dan yoga di matahari terbit setelah itu sangat baik, makanan yang baik. Stafnya sangat ramah dan siap membantu. Spa ini... Lagi kehilangan kata-kata, mereka sangat profesional, baik dan bagus! Manajer adalah orang yang luar biasa, dengan banyak perhatian, humor dan cinta. Zen adalah tempat di mana anda benar-benar diurus dan mereka membuat anda merasa benar-benar istimewa! Aku benar-benar punya lebih dari aku bisa berharap. Aku meninggalkan dengan energi dan harapan. Zen backe kehidupan…",5
154, Zen Resort Bali,"Kami memesan tempat ini didasarkan pada banyak ulasan yang menakjubkan, tetapi memilih untuk hanya tinggal beberapa malam a la carte dan tidak melakukan sebuah paket lengkap. Saya akan sangat merekomendasikan melawan itu. Tidak ada harga pada makanan, dll. dan anda berada jauh dari kota, sehingga anda benar-benar tidak punya banyak pilihan. Kami terkejut ketika kami sampai di sana dan melihat biaya seperti $7USD untuk piring buah-buahan (yang telah seperti 2 pisang dan beberapa potong. pawpaw) Dan untuk biaya untuk kemenungan adalah menghina dan terasa sangat un-zen. Lingkungan yang indah, sebagian besar orang-orang yang bekerja di sana sangat bagus (walaupun aku menemukan resepsionis agak sikap) dan perawatan spa adalah menakjubkan. jadi saya membayangkan jika anda pergi dengan…",2
155, Zen Resort Bali,"Penemuan yang luar biasa! Resor indah dengan taman yang luar biasa, namun makanan sehat yang lezat - dan spa menawarkan perawatan terbaik yang aku sudah di mana saja di dunia. Saya melakukan menyelam/paket spa yang hebat - dan benar-benar menikmati hari perjalanan kami. Menonton lumba-lumba saat matahari terbit itu tak terlupakan. Dan akhirnya staf hanya menakjubkan dan membuat tempat ini begitu istimewa. Pergi! ",5
156, Zen Resort Bali,Cedera olahraga dan stres penyebab sakit kepala dan kepenatan. Solusinya adalah tinggal di zen resort dan perawatan ayurvedic yang luar biasa. Mencintai setiap menit. Stafnya menyenangkan dan bersemangat untuk menyenangkan. Aku pergi dengan perasaan yang luar biasa dan pasti akan datang kembali. Tidak bisa menunggu! ,5
157, Zen Resort Bali,"Aku datang ke zen resort sebagai pertama kali anda berwisata sendiri dan untuk pertama kalinya saya berkunjung ke bali dan segera setelah saya tiba saya dibuat untuk merasa seperti di rumah sendiri. Aku meninggalkan mengetahui bahwa ini adalah tempat aku akan selalu kembali ke. Saya menginap di zen penglarasan mencempung paket dan di koridor. Instruktur menyelam saya, jessica membuat seluruh pengalaman pertama kali menyelam menyenangkan dan santai. Ini dikombinasikan dengan perawatan ayurvedic dan nutrisi, yoga dan meditasi dan hari perjalanan untuk mengunjungi desa dan daerah sekitarnya, adalah benar-benar sempurna. Makanannya juga sangat enak dan menyehatkan! Sepanjang pengalaman saya di zen adalah sesuatu yang istimewa dan unik dan pengalaman saya akan membawa dengan saya…",5
158, Zen Resort Bali,"Ya, dewa tinggal di zen resort bali. Bersama dengan putri saya (tidak istimewa) kami menghabiskan 5 hari di surga! Tidak yakin apakah aku bisa menaruh perasaan-perasaan ini dalam kata-kata. Perhatian pribadi, lingkungan taman yang rimbun, bunga dll, harian kemenungan dan mengawasi matahari terbit. Setiap hari perawatan (pijat tidak akan pernah sama lagi!). Lezat, segar dan tertata apik. Ke mana pun anda melangkah, dikelilingi oleh privasi dan suasana khusus ini yang saya sebut zen... Dan sebagian besar dari semua staf, tidak ada terlalu banyak. Semua kehendakk dapat menjadi kenyataan di zen. Terima kasih untuk membuat ini pengalaman yang sekali seumur hidup.",5
159, Zen Resort Bali,"Saya dan istri saya baru mulai bulan madu kami di sini di minggu kedua di bulan oktober. Kami tidak bisa memilih tempat yang lebih baik untuk bersantai setelah semua kegiatan pengantenannya. Setelah beberapa hari di sini kami berdua merasa dilahirkan kembali.  Kami mendaftar untuk paket menyelam yang terdiri dari total 5 penyelaman dan beberapa pijat. Ini adalah benar-benar luar biasa diving di tulamben; kura-kura leher, kepala bagur mendampak parrot fish, great visibilitas dan driver yang indah. Hari berikutnya, kami mendatangi sebuah pulau kecil di lepas dari pengawasan yang baik saat ini, tapi kalau anda menyelam di paket mereka akan membawa anda di sana. Menyelam di sini juga cukup bagus, perahu itu sendiri membuatnya layak perjalanan. Di atas karang sebagian besar hal-hal…",5
160, Zen Resort Bali,Makanan - Benar-benar gourmet. Para staf... apa yang bisa saya katakan... mereka semua berbicara bahasa inggris yang sempurna dan memperlakukan anda seperti tamu bangsawan. Cukup dan sangat tenang. Pelanggan adalah raja atau ratu dalam pengalaman saya... ribuan orang telah hsve untuk resor ini... tidak ada satu pun kelas yang di bawah ini yang adalah 4. mendekati kesempurnaan yang bisa anda dapatkan. Sertifikat excellenceWiinner 2015 service... anak laki-laki... mereka benar! ,5
161, Zen Resort Bali,"Zen resort merupakan tempat sempurna untuk memperbarui semua energi anda. Orang-orang (karyawan dan manajer/pemilik) adalah merawat anda dan memenuhi setiap keinginan yang mungkin anda selama anda menginap dari kedua pertama anda menyentuh tanah jogja dari sanggraloka ini. Apa pun yang anda butuhkan, anda akan dapatkan di sana. Kamarnya sangat bersih dan dalam kondisi sempurna. Makanan lezat dan anda bisa mendapatkan sebanyak yang anda inginkan. Sunrise kemenungan adalah salah satu yang paling indah yang anda akan melihat di sana. Orang-orang datang dari seluruh penjuru dunia. Anda dapat menemukan orang-orang untuk bergabung dengan anda selama anda menginap. Karyawan spa adalah benar-benar baik di medical bersih, sehat dan baik santai. Mereka tahu persis apa yang harus…",5
162, Zen Resort Bali,Aku menghabiskan 3 - 4 hari di bulan februari... benar-benar bisa saya katakan wowww... tempat terbaik untuk bulan madu... sangat santai dan tempat yang tenang... kamar dan meja kami di restoran dihiasi setiap malam... aktivitas menyelam hanya luar biasa (terutama untuk saya... karena fobia air)... terima kasih kepada instruktur menyelam kami semua Deepa... dia adalah benar-benar... dan aku banyak enjyoed...,5
163, Zen Resort Bali,"Aku diperlukan liburan cepat dari tuntutan kehidupan kota yang ramai, dan saya beruntung saya menemukan zen resort bali, tersembunyi di utara bali. Resor ini memiliki pemandangan yang luar biasa yang saya pikir untuk apa pun, baik itu di siang hari atau di malam hari. Kamar kami berperabot penuh cita rasa dalam masakan adalah cara sederhana dan tak terlupakan.   Di atas ini, perawatan spa yang meninggalkan aku merasa seperti bangsawan.   Tidak ada apa-apa yang aku bisa bertanya dari zen resort bali. Ini adalah perjalanan yang benar-benar bersantai dan meremajakan diri. Aku akan pasti datang lagi.   Dengan cinta, Stella",4
164, Zen Resort Bali,"Aku menghabiskan 7 hari di zen resort sebagai anda berwisata sendiri. Aku pergi untuk liburan dan apa yang saya mengalami begitu banyak lebih dari hanya liburan.   Ada tidak cukup kata-kata untuk menggambarkan zen family, mereka begitu penuh kasih dan ramah orang yang akan melakukan apa pun untuk membuat waktu anda khusus seperti yang mungkin.  The villa's terletak indah, lingkungan yang sangat tenang dan damai. Zen spa perawatan penyembuhan yang ada dan aku meninggalkan perasaan yang sangat santai. Makanan yang luar biasa, hidangan utama, utama dan gurun untuk setiap makan, agar sehat dan segar.  aku hanya menghabiskan 7 hari tetapi merasa seperti satu bulan, setiap hari itu penuh dengan pengalaman yang menakjubkan, namun begitu santai.   Hanya ada 14 kamar dan tempatnya tidak…",5
165, Zen Resort Bali,"Suasana yang tenang dan rileks akan membantu menyegarkan tubuh dan pikiran. Akomodasi ini sangat nyaman dengan kamar yang luas, beranda, kolam mandi dan berjalan-jalan di robe. Perawatan di spa yang disiapkan dan penuh perhatian untuk semua kebutuhan anda. Makanan ringan, sehat dan lezat. Meditasi dan yoga yang tercakup dalam paket serta beberapa perjalanan sehari. Kolam renang adalah sangat cantik. Terima kasih untuk pengalaman menginap yang luar biasa",5
166, Zen Resort Bali,"Segala sesuatu di zen adalah kehidupan sehari-hari melalui kaujalankan dan cemerlang dengan makanan di lingkungan bagi masyarakat pariwisata. Seluruh tempat memiliki suasana yang damai dan tenang, dan kami dibuat untuk merasa jadi selamat datang kami merasa seperti bagian dari sebuah keluarga besar. Kami berada dipesan di untuk paket 6 hari. Bahkan sebelum kami tiba, staf sangat membantu dalam menjawab pertanyaan kami dengan cepat. Kami dijemput dari bandara dan menjatuhkan kita di tujuan berikutnya. Kami masing-masing diberi sebuah spa dan wellness jadwal dibuat khusus yang termasuk pijat yang paling santai saya pernah telah. Karena setiap tamu memiliki jadwal kegiatan mereka sendiri, kolam renang dan area taman tidak pernah merasa sibuk dan kita sering merasa seperti tamu…",5
167, Zen Resort Bali,"Kami biasanya melakukan perjalanan beberapa ""membersihkan"". Setelah beberapa hari di ubud yang ramai, kami ingin melihat sekilas dari bali reknown ""suasana zen"" tapi merewang. di zen resort satu hari di muka. Bahkan dengan persiapan singkat. Saat itu, semua sudah siap untuk kita. Siap Plannings, perawatan dan kamar. Suasananya tenang, santai, jauh dari suara kota atau stres. Kamarnya bersih, bagus, kami sangat menikmati udara terbuka kamar mandi. Kami bisa melihat kolam dan laut dari teras di luar. Staf, dari manajer untuk tukang kebun, semuanya ramah, membantu dan selalu tersenyum. Di zen resort dan kami punya waktu yang indah. Makanan sudah besar, perawatan yang santai; menemukan lstriku persantaian dan tenang dia mencari melalui meditasi dan yoga matahari terbit. Sebagai bagi…",5
168, Zen Resort Bali,"Kami menginap di zen resort adalah damai dan santai akhir untuk perjalanan kami di sekitar lombok (dan bali). Kami tinggal selama tiga malam dan menikmati yoga setiap pagi dikelilingi oleh pemandangan yang indah. Spa tidak mengecewakan, menawarkan menakjubkan pijat dan perawatan dengan terapis profesional. Makanan yang baik untuk sarapan dan makan malam menawarkan pilihan yang sehat dan lezat. Bungalow kami adalah sederhana, bersih, dan rapi ludas; dan handuk-handuk itu dilipat ke dalam berbagai hewan yang menyentuh setiap pagi. Sanggraloka ini ideal bagi mereka yang mencari tenang dan beberapa 'waktu yang baik'.",4
169, Zen Resort Bali,"Kami memesan untuk kursus. Kamar yang sangat bagus. Kami berada di kamar matahari terbenam. Ac adalah besar. Pemandangan dari beranda kami adalah menakjubkan, turun ke pantai. Luar mandi dan kamar mandi sangat mengagumkan. Kolam itu indah.  Spa adalah menakjubkan. Aku sangat terkesan dengan perjalanan mereka. Aku punya mengeji punggung dengan beberapa melotpt piringan. Setelah saya menjelaskan masalah saya. Aku punya pijat dan ketika itu selesai. Aku tidak punya makan! Namun, setelah 2 minggu menghilang. Saya tahu! Staf di resor ini semua ingat nama kami. Itu benar-benar membuat saya merasa penting. Saya akan tinggal di sini lagi dalam sekejap!",4
170, Zen Resort Bali,"Kami menginap di kamar tempat ini adalah bagian dari paket menyelam yang lebih besar dan mari saya mulai dengan mengatakan bahwa saya pasti akan pernah dalam sejuta tahun memilih ini sebagai tempat untuk tinggal di saya sendiri. Ini dikatakan, tempat ini adalah besar.   Makanan yang fantastis, semua lokal dan sempurna siap. Layanannya luar biasa! Sejak saat anda check in hingga check out, anda merasa seperti anda sedang rumah,   Spa perawatan adalah keluar dari dunia ini!   Sanggraloka ini dirancang untuk anda yang ingin mencari lebih ""zen"" dalam hidup mereka baik itu melalui yoga atau perawatan yang mereka menawarkan. Kami berada di sana pada paket menyelam dan melakukan tidak lebih dari perawatan di spa.   Tempat ini bersih dan kolam renang yang sangat bagus.   Satu-satunya…",5
171, Zen Resort Bali,"Dari saat anda tiba, anda tahu bahwa zen resort adalah istimena. Staf semua indah, mereka memperlakukan anda seperti keluarga.  Resor ini terletak di daerah yang kurang turis pulau bali dan itu selalu di buku-buku saya.   Kamarnya bagus, sangat luas. Hanya berpikir saya akan lebih suka untuk memiliki layar di jendela sehingga kita bisa lebih mudah meninggalkan jendela terbuka di malam hari.  Restoran di hotel ini menyajikan makanan lezat, siap untuk kesempurnaan, ukuran porsi yang tepat. Kami bahkan punya kursus memasak dengan staf di salah satu hari dan itu luar biasa untuk melihat bagaimana makanan disiapkan dan dikemas untuk mendapatkan beberapa resep mereka, pemilik.  Lalu ada perawatan ayurveda, luar biasa, membuat sanggraloka ini bahkan lebih istimewa.  Aku bisa pergi pada…",5
172, Zen Resort Bali,"Aku menghabiskan seluruh minggu di april 2015. Mungkin paling santai minggu di hidup saya. Perawatan pijat ayurvedic yang ramah, jadi adalah meditasi dan yoga sesi pagi. Stafnya sangat ramah. Ini adalah tempat untuk benar-benar berkomunikasi dengan diri anda dan datang kembali kepada siapa kau sebenarnya. Jika anda merasa seperti anda perlu istirahat, ini adalah tempat untuk pergi.",5
173, Zen Resort Bali,"Ini adalah oleh jauh, yang terbaik liburan belum. Kami memesan 2 minggu sebelum untuk kami 25th ayurvedic paket ulang tahun pernikahan di zen. Meskipun penerbangan kami tertunda 6 jam di taiwan, sopir kami dari resort kami, untuk menunggu berjam-jam tidak tahu ketika kita akan datang. Kami tidak terkejut untuk melihat dia yang memegang tanda untuk kami ketika kami akhirnya membuat ke bandara Despar. Dia sangat ramah untuk 3 jam perjalanan ke resor ini, kami menjawab pertanyaan konyol di 2 di pagi hari setelah. Kami memiliki pilihan untuk kembali ke bandara juga. Dia juga menjelaskan, untuk gambar-gambar sugun di sini dan di sana, dan membawa kami ke perkebunan kopi untuk tur dan mencicipi mereka indah. Ketika kami tiba sekitar 5 jam di resor, kami disambut dengan kalung karangan…",5
174, Zen Resort Bali,"Aku sedang mencari tempat di bali di mana aku bisa istirahat tubuh dan pikiran saya, berlatih yoga dan memiliki beberapa perawatan. Zen resort adalah persis jenis tempat yang saya diperlukan. Ini adalah sebuah resor kecil di lokasi puncak bukit dari di mana anda dapat melihat sawah dan laut, terletak di taman yang indah. Satu-satunya suara yang anda dapat mendengar burung menyanyi dan sekitar adalah air yang datang dari air mancur yang tersebar di sekitar. Ada bau di mana-mana frangipane dan lantai ditutupi dengan bunga putih kecil yang... Bungalonya sederhana, tapi sangat bersih dan nyaman, sarapan yang sehat dan lezat dan semua pelayan adalah benar-benar baik. Aku melakukan meditasi setiap pagi, dan bergabung dengan kelas yoga yang sangat baik master. Di ayurvedic spa adalah…",4
175, Zen Resort Bali,"Aku tinggal di zen resort di tempat peristirahatan dengan kecermatan, yang dikelola oleh sebuah konsultan eksternal. Pergi di atas dan di luar di zen menghadiri untuk kebutuhan masing-masing dari peserta beristirahat. Membosankan dan mencintai berbicara melalui tindakan mereka, hingga indah, kaena musikan dari staf. Resor ini tidak paling mencolok atau resort yang terbaik dari yang terbaik dalam hal fasilitas, tapi tinggal di sini adalah pengalaman yang benar-benar indah. Saya tidak akan ragu-ragu dalam merekomendasikan resor ini untuk orang lain, staf yang menyenangkan!",5
176, Zen Resort Bali,"Kami mulai bulan madu kami di sini selama 3 malam dan itu fantastis. Ini adalah tempat yang sempurna untuk beristirahat dari pernikahan, bersantai dan beristirahatlah dari semua itu. Kolam renang indah dan kami selalu memiliki untuk diri kita sendiri sebagian besar ini. Saya akan merekomendasikan kamar di depan kolam renang dan pemandangan akan mengambil napas anda pergi setiap pagi. Pagi pertama kami pernah makan sedikit dan menikmati tenggelamnya bulan dan matahari terbit dari teras kami. Itu adalah salah satu hal-hal paling keren yang pernah saya lihat.  Kami mengambil salah satu wisata ke mata air panas di pagi hari dan itu luar biasa. Mereka mengatakan kepada kita untuk pergi lebih awal di pagi hari, yang kami tidak dan bahwa tempat sebagian besar untuk diri kita sendiri…",5
177, Zen Resort Bali,"2nd kali mengunjungi zen. Satu minggu tahun lalu tidak cukup, jadi saya memesan di untuk dua minggu paket de-stres. Ini adalah yang terbaik.  Hal yang menetapkan hotel ini terpisah dari orang lain adalah staf. Mereka adalah seperti keluarga. Dari tukang kebun, spa terapis, house keeping, reception, restaurant... Semua orang tahu nama anda, dan apakah temanm lebih ngobrollah, semua sambil menyediakan layanan besar.  Lokasi ini tenang, damai dan jauh dari semua hiruk-pikuk. Kamarnya luas, ber-ac dan memiliki perabotan yang berkualitas yang sederhana. Makanan yang sangat baik dengan banyak pilihan. Spa adalah keluar dari dunia ini. Yoga, meditasi, menyelam, bersantai di tepi kolam renang, berjalan ke pantai.  Terima kasih dan melihat anda segera zen",5
178, Zen Resort Bali,"Zen resort adalah salah satu tempat paling khusus yang pernah saya alami, terorganisir, dan spiritual yang tenang.   Kamar, kolam renang, taman-taman ini semuanya cantik, dan pemandangan yang benar-benar tak terlupakan.   Perawatan spa yang hebat. Ramah, penuh perhatian dan staf yang menampung. Pengemudi yang sopan dan tepat waktu transfer. Dari selamat datang di menit awal keberangkatan Budiani dan stafnya, benar-benar membuat anda merasa seperti bagian dari keluarga.   Hotel yang spesialis ayurvedic, Vijay, adalah sangat berpengetahuan, penuh perhatian dan bermanfaat.   Aku berada di kamar matahari terbenam dan itu sangat luas, bersih, dan mewah. Saya suka sentuhan-sentuhan kecil di kamar seperti mendupai, cukup alami, dan bunga segar setiap hari.   Tidak ada udara con, tapi…",5
179, Zen Resort Bali,"Jika anda sedang mencari liburan pulau fantasi dimana semua kebutuhan anda tersedia lebih dari bertemu dan tempat untuk berlibur dari kesibukan dan kebisingan dunia, ini adalah tempat untuk anda.   Aku bahkan tidak bisa mulai untuk menggambarkan tempat ini. Benar-benar zen, sepi, alami, tempat untuk merenung. Baik staf dan tamu luar biasa - mereka tidak hanya membawa lebih dari perhatian baik dari anda, mereka menghormati anda ruang, waktu, dan kebutuhan anda.   Bagian yang benar-benar unik di zen sesi perawatan adalah bahwa mereka menyediakan anda dengan dua terapis pijat yang sangat anda pada waktu yang sama. Mereka harus membayar banyak, karena entah bagaimana, mereka bekerja begitu baik sedarun tentang tekanan dan penuh perhatian ini akhirnya mulai merasa seperti hanya 1…",5
180, Zen Resort Bali,"Aku pergi ke zen resort pada bulan juni dengan seorang teman. Aku tidak punya banyak harapan atau tujuan dalam pikiran lain daripada untuk bersantai, namun, apa yang saya dapat mengatakan sekarang, adalah bahwa ketika aku meninggalkan zen saya merasa seolah-olah aku meninggalkan orang yang berbeda. Ini adalah benar-benar, dengan kuat, pengalaman positif. Jika anda bisa, atau jumplang menggebukkan di dalam hidup anda, akan membantu anda untuk kemudian zen kembali menemukan keseimbangan.  Dari saat anda tiba di zen resort, anda diperlakukan dengan penuh perhatian, kasih sayang dan hormat dan ini tidak masalah bila anda tiba di atau 1am 1pm - staf pergi keluar dari jalan mereka untuk merawat anda. Kamar-kamarnya bersih dan bergaya tradisional. Taman yang sangat indah, dengan indah…",5
181, Zen Resort Bali,"Apa tempat yang magis! Zen benar-benar mengubah hidup saya. Lokasi, staf yang luar biasa & luar biasa perawatan penuh (seperti tidak ada yang pernah saya rasakan) dari spa adalah semua luar biasa. Jika anda mencari ketenangan dan kedamaian di tempat ini. Aku tidak bisa merekomendasikan tempat ini cukup. Aku pasti akan datang kembali. Saya yoga, meditasi dan peningkatan pemapasan memiliki sepuluh melepit. Oh dan apakah saya menyebutkan makanan lezat!",5
182, Zen Resort Bali,"Kami pergi hanya untuk dua hari untuk resor ini karena kami memiliki dua hari program discover scuba diving dengan dive master René Huisman. Bagi kami, itu adalah pengalaman yang luar biasa. Indah resort di lokasi yang indah dengan pemandangan dari taman indah spectaculair. Staf besar yang menyediakan semua tamu dengan setiap kesempatan yang mereka bisa untuk membuat indah karya seni di teras daun bunga di vila mereka. Di sana, kita telah menikmati tiga diffferent 'pengaturan'. Jika anda mencari ketenangan dan kedamaian, ini adalah tempat yang tepat untuk anda! Pengalaman menyelam yang sempurna. Untuk air terbuka pertama kami, kami pergi ke pulau menjangan menyelam. Untuk kami - sebagai pemula saya - air adalah indah. Jika anda berada di bali (punya beberapa murah) dan mencari…",5
183, Zen Resort Bali,"Tinggal di zen resort menjadikan masa menginap anda pengalaman yang benar-benar dikenang. Miss Budiani adalah inspirasi dan sangat baik, penuh perhatian manajer. Anda merasakan kehangatan, perawatan dan kebaikan dari semua staf - staf resepsionis untuk gadis-gadis di luar pusat pijat yang indah staf di dapur ke tempat yang layak. Mereka tidak bisa melakukan cukup bagi anda dan kami benar-benar bahagia untuk membantu - selalu dengan senyum lebar. Makanan lezat dan anda langsung merasa lebih sehat dan lebih ringan meskipun makan 3 makanan untuk makan siang dan makan malam. 6am 7am mediaion dan yoga adalah cara yang indah untuk memulai hari. Saya juga menghadiri kecermatan di klinik, membantu bimbitan course yang ditahan di sana beberapa kali/tahun. Aku benar-benar santai dan…",5
184, Zen Resort Bali,"Aku hanya bisa bergabung di dalam pujian dari lokasi, kualitas masakan dan spa, umum suasana zen. Apa tempat yang indah. Bahkan lebih indah meskipun adalah orang di zen. Layanan luar biasa dan pribadi dan menarik tamu dengan kehangatan dan tersenyum. Anda merasa selamat datang dan memikat.  Aku hanya bisa mengucapkan terima kasih kepada semua orang-orang, baik itu manajemen (ms. Budiani), yang lades di spa, semua orang di restoran atau di dalam, teknis dan berkendara memberungut di semua tempat. Terima kasih khusus untuk orang-orang yang luar biasa di zen mencempung: Gedè, rene... dan (ruang pasien) jessica... yang benar-benar luar biasa dan membuat saya - cedera rawan gendeman - masuk ke dunia menyelam besar satu.  Saya hanya dapat merekomendasikan tempat ini dan akan senang…",5
