,hotel,review,stars
42,Andari Legian,"Hotel ini sangat baik dan bersih, staf begitu baik dan ramah, selalu membantu dengan tur begitu banyak kegiatan dengan cukup singkat waktu kami di sana. makanannya yummie defnitly akan tinggal di sana lagi. Mereka mengatur seorang supir pribadi bagi kita untuk mendapatkan sekitar sangat murah juga. staf pergi keluar ada cara untuk memastikan anda senang. Mereka memiliki keamanan di gerbang di malam hari jadi kami merasa sangat aman tinggal di sana. dan ada bahasa inggris sangat baik juga :) ",5
43,Andari Legian,"Saya biasanya perjalanan ke bali dengan keluarga saya dan tinggal di villa tapi kali ini saya bepergian solo dan memilih legian guest house selama 8 hari saya tinggal dan saya tidak bisa lebih bahagia. Apa tempat yang sangat bagus; suka semuanya tentang hal ini. Mungkin hal terbaik meskipun adalah benar-benar fantastis staf yang sangat membantu dan baik, dan bagus untuk memiliki sebuah lelucon dengan. Terima kasih banyak untuk membuat saya tinggal begitu menyenangkan anda indah, ramah, orang-orang yang tidak bisa melakukan cukup bagi saya.   Untuk budget guest house ini telah benar-benar segala sesuatu yang anda bisa mungkin ingin. Restoran dengan makanan penuh cinta disiapkan oleh wanita yang indah, kamar yang sangat bersih (kolam renang luar pintu), baik pasokan peralatan…",5
44,Andari Legian,"Saya menghabiskan 8 malam di legian guest house pada bulan november tahun ini dan sangat senang dengan saya tinggal. Wayan dan rigi yang sangat ramah dan staf lain yang ramah. Hanya ada 13 kamar sehingga sangat kecil dan intim. Saya memiliki kolam renang dan tempat tidur adalah menakjubkan, sangat nyaman dengan indah seprai dan empat bantal yang menakjubkan! Kamar mandi adalah marmer dan baru. sangat bagus. Kolam renang adalah hanya di luar pintu anda dan bersih dan segar. Ini adalah sedikit dari hambatan utama tapi bagi saya ini adalah baik karena itu berarti itu sangat tenang. Ini hanya $2 aud dengan taksi ke jalan legian dan cnr double six atau anda dapat mengambil bus antar-jemput setiap hari di 10am. Saya tidak akan ragu untuk merekomendasikan legian guest house dan akan…",4
45,Andari Legian,"Apa yang bisa saya katakan. Tempatnya sangat tenang dan damai dan layanan adalah A1. Saya di sana selama 1 bulan dan semua personil sangat baik dan serviable, selalu tersenyum. Kamar bersih dan kolam renang sangat bersih. Pemilik selalu ada untuk kebutuhan anda dan memiliki mobil untuk berkendara anda di mana anda inginkan.",5
46,Andari Legian,"Harga murah, tapi sangat baik terus dengan sangat ramah dan penuh perhatian staf. Sarapan baik tapi sedikit terbatas. Fasilitas lebih daripada kebanyakan hotel murah, termasuk kulkas dan pengering rambut. Tekanan air yang baik dan air panas. sangat pribadi dan tenang. Kolam renang kecil. Sekitar 125 meter yang kasar bintang tinggal dari jalan utama, tapi itu tidak jarang di bali. Sedikit lebih jauh ke tempat-tempat menarik dari situs web mereka akan menunjukkan. Hampir tidak ada dalam jarak berjalan kaki, tetapi mereka memiliki antar jemput gratis ke sering pantai yang populer dengan banyak restoran. Karena menulis ini, pemesanan. com memiliki hotel ini tidak pada tempatnya di nakula, jadi memeriksa lokasi di situs web hotel. Tidak sangat dekat ke bandara, tapi sangat akses…",4
47,Andari Legian,"Ini adalah tempat pertama kami tinggal di di bali. Ketika taksi membawa kami turun jalan tanah yang gelap di tengah malam. Saya pikir dia pasti bercanda. Tidak ada yang baik bisa di sana. Baik itu memang mengatakan legian guest house. Saya disambut oleh staf hangat tapi juga darah nyamuk lapar. Tinggal adalah ok. Tidak ada yang istimewa, tapi pastinya bukan yang terburuk. Hal yang membuat tinggal adalah hanya lokasi dan nyamuk. Makanannya cukup baik dan murah. Staf ramah dan bersedia untuk melayani",3
48,Andari Legian,"Tempat pertama saya tinggal di bali dan semua saya dapat katakan adalah saya telah manja! Akomodasi lain untuk harga yang sama hanya tidak membandingkan. Staf sangat menyenangkan dan membantu anda setiap kali mereka bisa, sangat sopan, ramah dan penuh perhatian. Kamar memiliki semua yang anda butuhkan-ac bagus, bersih besar tempat tidur yang nyaman, lemari es/mini bar, ketel, pengering rambut, tv dengan saluran film, 2 botol air untuk membersihkan gigi anda setiap hari, yang baik wi fi, kamar dibersihkan untuk kesempurnaan setiap hari, layanan laundry. Sarapan adalah juga besar amerika-pilihan daging dan telur, roti panggang, selai, buah, Pembuat teh/kopi dan jus buah. Indonesia juga tersedia. Layanan kamar/kolam renang bar juga makanan yang baik pada harga yang murah. Lokasinya…",5
49,Andari Legian,"Sebagai timer pertama di bali. Saya sedikit gugup tentang apa yang diharapkan. Kegilaan di bandara, orang-orang, lalu lintas saya agak overwelmed untuk sedikitnya. Tiba di legian guest house paling indah balsem untuk indra. Sebuah oase kecil tenang kecil yang kami sangat senang untuk kembali ke. Stafnya hangat dan ramah, dan membuat kami tinggal sesuatu yang menyenangkan untuk ingat. Saya tidak pernah mendapatkan layanan yang luar biasa di tempat lain seperti yang kami punya di sana. Tempat ini adalah seperti rumah kecil yang jauh dari rumah. Saya akan tinggal lagi tanpa berpikir dua kali. Bersih dan nyaman tetapi kebanyakan dari semua tempat peristirahatan yang tenang jauh dari keributan. Sempurna! Kami melewatkan Tiarna dan krunya dan berterima kasih kepada mereka sangat…",5
50,Andari Legian,"Kami menikmati kami tinggal di sini selama satu minggu, superior room adalah besar dan staf yang sangat ramah. Itu bagus untuk kami sarapan disajikan kepada kita dalam kamar kami setiap pagi. Kami menyewa sepeda motor melalui mereka juga. Satu-satunya sisi adalah guest house ini yang agak jauh dari pantai.... meskipun memiliki sepeda motor beres masalah itu bagi kita. Oh...dan tempat tidur nyaman... tapi bantal yang sangat sulit... jadi aku pergi dan membeli saya sendiri dan diselesaikan masalah juga.",4
51,Andari Legian," Saya dan suami saya telah tinggal dalam hal ini kecil tapi indah tamu rumah di Agustus 2010 ketika kita baru saja tiba di Bali. Sangat menyambut dengan minuman dingin, indah senyum di wajah setiap kali saya bertemu dengan staf. Membersihkan kamar, fasilitas cukup bahkan termasuk rambut kering di dalam ruangan. Pelayanan yang baik, meskipun sedikit jauh dari utama jalan, sepeda motor layanan tersedia jika diperlukan, saya mengalami satu kali. Cool!   Sarapan mungkin diperbarui dengan lebih banyak pilihan, yang adalah saran saya.  Dalam satu kata, saya sarankan Anda untuk mencoba guest house asri jika Anda lebih suka suasana perdamaian dan ketenangan dan bergaya Bali nyata lokal dengan anggaran yang terbatas. Mencobanya. Saya ingin mencoba lagi.",4
52,Andari Legian,"Menghabiskan dua malam di sini sementara teman saya dan saya mengunjungi Bali kembali pada Agustus. Ini layak. Apa yang Anda lihat di situs web mereka adalah apa yang Anda dapatkan. Staf yang ramah dan membantu. Sarapan disajikan di ruang atau di luar. AC works great dan TV telah banyak saluran internasional (hanya sumber hiburan). Kamar luas; Queen-size tidur dan sofa ditetapkan di ruang. Tempat tidur adalah nyaman bagi kita (berbeda untuk setiap orang meskipun). Jika Anda mencari kesenangan dan hiburan, ini bukanlah tempat bagi Anda untuk yakin. Kita hanya menggunakan tempat ini sebagai dasar untuk kami bepergian siang hari tidak ada banyak yang harus dilakukan di dan di sekitar wilayah.  Satu-satunya kepedulian bagi saya adalah bahwa itu sedikit terpencil. Tenang besar tetapi…",4
53,Andari Legian,"Hai, aku tinggal di sini ketika aku datang ke Bali dan kembali pada akhir saya tinggal, karena saya benar-benar dihargai perjalanan saya di sini. Hotel kecil dengan sangat ramah pemilik. Hotel adalah nilai terbaik untuk uang yang saya punya untuk waktu yang lama. Staf sangat ramah dan senang untuk membantu Anda, di mana pun mereka bisa.  Layanan secara keseluruhan, sangat baik, sangat bersih dan baik kamar dan sepeda motor untuk menyewa. apa yang Anda butuhkan. Sarapan yang disajikan di ruang yang sangat baik. Lokasi adalah sekitar 10 menit dengan skuter dari kuta. tapi masih sekitar 2 menit untuk pantai legian. Mungkin terutama cocok untuk pasangan.",4
54,Andari Legian,"Pada awalnya, aku agak khawatir tentang tempat cos cukup jauh dari jalan utama dan dikelilingi oleh sawah, pitch gelap juga. Tapi kemudian saya menemukan semua para staf sangat membantu dan baik. Ruang kecil tapi begitu bersih dan rapi dengan fasilitas yang lengkap. Aku hanya merasa nyaman di sana meskipun ada hanya 9 kamar mereka miliki dan begitu dekat dengan masing-masing ruang tetapi tidak apa-apa. Tempat yang hebat untuk jauh diri Anda dan sangat murah! Menyukainya!",4
