,hotel,review,stars
46,Artini 3 Cottages,"Saya pikir kita harus memiliki dibutakan oleh alasan menakjubkan ketika kami berjalan melalui properti, karena meskipun kami melihat ruang sebelum untuk check-in, tidak sampai kita mendapatkan menetap bahwa aku melihat bagaimana mengerikan itu! Kami juga telah mencari akomodasi selama beberapa jam dan siap untuk mendapatkan menetap, sehingga mungkin memainkan sebagian juga.  Properti ini indah indah indah tapi sayangnya memiliki cerita yang berbeda yang terjadi di dalam kamar. Saat ia mulai gelap, kami melihat dua berbeda terbakar bola lampu, bersama dengan penutup lampu suram dan fraying. Suami saya pergi untuk menarik tirai ditutup tentang turun di tangannya dan kamar mandi adalah benar-benar mengerikan. Windows tidak, ventilasi tidak ada, basis toilet yang rusak dan noda yang…",1
47,Artini 3 Cottages,"Kami tinggal di Artini III selama tiga malam dan sementara aku suka lokasi, dan luar tampaknya terawat dengan baik dan estetis menyenangkan, saya menemukan kamar kotor dan tidak menyenangkan. Saya berpikir bahwa harapan saya masuk akal - bersih seprai dan handuk, mengosongkan sampah, bug yang disimpan di Teluk jika mungkin dan kamar dibersihkan setelah memeriksa setiap tamu. Namun seprai kotor, handuk tipis dan rapuh, lemari kamar mandi kami telah menggunakan kapas pembersih telinga dan sampah di dalamnya dan tempat tidur kami memiliki tempat tidur bug!! Dengan beberapa TLC hotel bisa membeli hingga awal, itu adalah tempat yang bagus, baik ukuran kamar dan adalah sebuah bangunan yang cantik, tapi harus lebih higienis dan kamar mandi bisa menggunakan baik sekali selama atau…",2
48,Artini 3 Cottages,"Kami punya referensi untuk tempat ini dari sopir kami. Pintu itu indah dengan subur sawah ke kanan kami. Check-in staf namun tampak sedikit hilang dan kami butuh selamanya untuk mendapatkan barang-barang kami dari penerimaan ke kamar. Ruang luas dan memiliki pandangan yang menakjubkan tenang hotel kolam renang dan sawah luar senyawa yang. Namun kami menemukan bahwa kesehatan adalah masalah, seprai yang tampak sedikit kotor dan kotor dan kamar mandi adalah bocor. Tampak seperti tempat yang membutuhkan renovasi.",2
49,Artini 3 Cottages,"Kami tinggal di sini 3 malam untuk mengunjungi UBUD. Kota ini terletak dekat pusat Ubud, sawah dengan vieuw bagus. Ada sebuah bus shuttle gratis untuk membawa Anda arounf Ubud. Staf sangat ramah. Yang menyatakan bahwa kita telah: kami diminta untuk ke binatu, yang disampaikan kemudian dari yang diharapkan, pengemudi yang mencoba untuk menjual sebagai overexpensive spa, kami memiliki beberapa suara dari televisi ruangan di atas. Yang semua komentar-komentar kecil; pernyataan utama adalah bahwa kamar mandi sangat usang dan tidak sangat bersih. Itu ok, dan kami menikmati kami tinggal, tapi kurasa ada nilai yang lebih baik untuk ditemukan.   Ketika di Ubud; mengambil bycicle wisata dengan ECO, yang luar biasa!",4
50,Artini 3 Cottages,"Hotel kecil yang sangat bagus di tengah dari sawah di Ubud. Semua kamar memiliki pandangan baik di alam sekitarnya. Kamar luas, mungkin kurang sedikit dari atmosfer. Sangat tenang, bagus kolam renang, baik arsitektur. Staf sangat membantu - mereka dapat mengatur apa pun yang Anda inginkan! Sarapan: tastefull sangat bananapancakes... surgawi! Tinggal di sini selama 4 hari dan akan tinggal di sini lagi tanpa diragukan lagi!",4
51,Artini 3 Cottages,"Kami menyukai Artini 3 tahun lalu begitu banyak bahwa kita kembali dan tinggal di sana lagi tahun ini. Staf dan layanan yang sangat baik, ruang cukup bersih, tapi toilet harus dibersihkan dengan benar. Kami mencintai kolam renang dan pembentukan tata letak. Lansekap adalah rapi dan membuat seluruh tempat tampak terorganisir dan diurus dengan baik. Sarapan di rumah dasar dan sederhana, tetapi cukup baik untuk membuat Anda pergi untuk hari. Ratu Bali Spa dalam pembentukan tampak sangat eksklusif dan memikat, tapi harga min USD60, kita agak melangkah keluar dan berjalan ke banyak indah (dan lebih murah!) spa di Ubud. My fav pribadi adalah Nur Salon. Staf terutama sangat membantu, lima-bintang mereka!",4
52,Artini 3 Cottages,"Ini adalah sebuah hotel yang besar dengan staf yang fantastis. Mereka yang sangat ramah dan sangat sopan. Mereka tidak memiliki kulkas di dalam ruangan, tapi mereka tidak menawarkan restoran kulkas sehingga saya bisa menyimpan makanan bayi saya. Jika Anda sedang mencari sesuatu yang mewah, hal ini tidak itu. Kamar hotel kecil dan kamar mandi sangat bau. Dan tidak kereta dorong ramah, membuatnya sulit bagi kita untuk membawa kereta dorong atas dan ke bawah langkah tapi sekali lagi Ubud adalah tidak benar-benar kota ramah bayi. Kami menikmati kami tinggal. Setiap pagi Anda dihadapkan dengan staf yang ramah yang tahu nama anak saya dan akan membawanya untuk melihat burung sementara kami makan sarapan kami.  Saya akan tinggal di sini lagi, setelah anak saya sedikit lebih tua dan…",4
53,Artini 3 Cottages,"Kami tinggal di Artini setelah memeriksa ke dalam hotel lain bahwa kami tidak puas dengan. Letaknya beberapa ratus meter dari jalan utama, jadi itu sangat tenang, dan sebelah indah sawah, meskipun beberapa kamar lebih rendah tidak memiliki pandangan itu. Dekorasi bagus dan suasana di mana-mana menawan. Kamar AC adalah indah (kami memiliki salah satu yang terbaik, menghadap sawah). Kamar mandi adalah biasa-biasa saja, tetapi segala sesuatu hanya biaya $45, jadi kami sangat bahagia. Ketika saya datang untuk melihat untuk melihat jika kita ingin tinggal di sana aku berlari ke dalam kelompok orang-orang yang sudah tinggal sana. Aku bertanya kepada mereka tentang hal itu dan mereka senang dengan itu.",4
54,Artini 3 Cottages,"Saya tinggal di sini selama 6 malam dan itu indah. Saya tiba larut malam dan telah mengatur transportasi dan tiba setelah tengah malam dan staf di sana untuk menyambut saya. Kamar itu besar dan bersih, dengan kamar mandi yang besar dan 2 Ratu ukuran tempat tidur. Ini diabaikan teras kolam renang dan nasi dan begitu tenang. Staf yang sangat ramah dan membantu, tidak ada bar atau hiburan tetapi dijual bir dan minuman ringan dan tidak makan. Tidak ada TV di kamar tetapi jika Anda ingin mendapatkan jauh dari itu semua tempat ini sempurna. Banyak restoran dan toko-toko di dekatnya. Waspadalah terhadap monyet di Bait Suci, dapat cukup aggresive! ",4
