,hotel,review,stars
0,Bali Alizee Villas,"Thourourly menikmati masa menginap kami di Alizee. Untuk berjalan di dan melihat area terbuka yang luas dengan kolam yang jauh lebih besar dari yang diharapkan, taman yang indah dan dapur yang luas dan bersih dan tempat duduk yang menyenangkan. Untuk disambut dengan bunga yang indah untuk ulang tahun ke-60 saya sangat tidak terduga, tetapi sangat dihargai. Kamar tidur dan kamar mandi bersih dan nyaman dan banyak ruang. Satu-satunya masalah yang kami miliki adalah kulkas tidak menjadi dingin. Bukan karena kesalahan Oni yang luar biasa yang mencoba sebaik mungkin untuk memperbaiki masalah ini, itu tidak tetap pada waktu kami di sana. Kami beruntung memiliki saudara perempuan saya di vila berikutnya dan berbagi di sana. Berharap ada yang baru di sana sekarang? Lokasi luar biasa…",5
1,Bali Alizee Villas,"Kami memiliki pengalaman menginap yang luar biasa di Alizee Villas, kami menyukai vila yang kami miliki, terutama kolam renang pribadi. Villa indah dan selalu bersih, ada juga dapur di mana Anda dapat memasak apa pun yang Anda inginkan, kami benar-benar merasa seperti di rumah sendiri. Vila-vila tenang dan Anda dekat dari segala sesuatu di Seminyak.  Terima kasih semuanya dan sampai ketemu lagi!",5
2,Bali Alizee Villas,"Kami baru saja kembali dari 10 hari menginap di Villa. Alizee Suami saya dan saya telah bepergian ke Bali untuk menginap di hotel dan villa selama bertahun-tahun, ini adalah waktu kami merasa ony terdorong untuk menulis ulasan tentang akomodasi kami. Beberapa hal yang kami jatuh perlu diperhatikan: area outdoor/ruang tamu sangat tidak nyaman, dengan kursi semen pada dasarnya tidak ada bantal. Tua/kotor, kursi bean bag di kolam renang, hanya dua Villa yang mengakomodasi empat! Bahkan masih kami harus kami di area ini hidup daripada duduk di kursi semen. . . Tua, handuk kotor. Sangat perlu memasang kembali. Kamar mandi tidak mengalir dengan baik dan meninggalkan air seluruh lantai kamar mandi. Secara umum, cukup kamar mandi yang kotor. Air panas tidak tersedia secara acak. Pintu…",2
3,Bali Alizee Villas,"Saya sedikit kecewa dengan villa di Alizee. Foto-fotonya terlihat sangat bagus tetapi dalam kulitnya terlihat usang & lelah dan memberi kesan bahwa manajemen benar-benar tidak peduli. Saya benar-benar mencoba untuk fokus pada hal positif di sini & tidak membiarkannya merusak perjalanan kami tetapi saya menentang banyak hal yang menurut saya tidak baik dalam akomodasi apa pun. Tata letak vila bagus & lokasi sempurna - cukup tenang untuk bersantai tetapi hanya 10 menit berjalan kaki ke jalan utama restoran & bar. Staf juga membantu, memberi kami terlambat memeriksa tanpa ribut-ribut, adaptor & selalu sangat ramah. Itu bagus untuk tiba buah & air tersedia. Seperti yang saya sebutkan banyak dasar-dasar di villa tidak sampai ke standar yang baik. Handuk & seprai sudah tua, lelah &…",3
4,Bali Alizee Villas,"Villa yang fantastis, fasilitas hebat dan staf yang luar biasa. Kami mengadakan pesta orang-orang yang tidak biasa - 21 orang dengan separuh dari China dan setengah dari Inggris - tetapi kami semua memiliki pengalaman menginap yang sangat baik.  Vila-vila yang sangat baik - luas, pribadi dan dilengkapi dengan baik. Layanan luar biasa dan mudah bagi kita semua untuk mendapatkan perjalanan terorganisir ke mana pun kita inginkan.  Kolam sangat bagus untuk anak-anak kita, dan area dapur dan ruang tamu yang sempurna untuk makan malam, minuman terlambat dll  Kami menantikan untuk kembali lagi dan akan sangat merekomendasikan Villa Alizee kepada siapa saja yang mencari pilihan vila dengan harga terjangkau dan dilengkapi dengan baik di Seminyak.",5
5,Bali Alizee Villas,"Kami dengan senang hati dijemput dari bandara melalui transfer pribadi yang diselenggarakan oleh vila yang sangat brilian setelah perjalanan yang begitu panjang.  Saat tiba di villa staf sangat menyambut. Kami terkejut senang mengetahui bahwa kami telah ditingkatkan dari vila bersama ke pribadi pada saat kedatangan.  Setelah ditunjukkan villa kita tidak percaya betapa menyenangkannya itu. Itu sangat bersih, rapi dan disajikan dengan baik. Setiap kamar memiliki kamar mandi sendiri, AC dan tempat tidur yang sangat nyaman. Dapur terbuka, makan / hidup dan kolam renang sangat baik.  Vila dibersihkan setiap hari, tempat tidur dibuat, pendingin air diisi ulang dan lantai dibersihkan.  Sangat merekomendasikan tinggal di sini.  Terima kasih.",5
6,Bali Alizee Villas,Wow jelas manajemen ini tidak dapat menerima umpan balik. Sebagai teman perjalanan dari resensi sebelumnya saya perlu mengklarifikasi beberapa ketidakbenaran mutlak yang dibuat oleh manajemen villa ini. Ini adalah review yang adil dari seseorang yang merupakan pengulas reguler di TripAdvisor dia memberi tiga bintang yang menurut pengalaman saya setelah tinggal di banyak vila yang berbeda di Bali sangat murah hati diberikan pengalaman kami di villa ini selama kami tinggal. Dan manajemen melanjutkan untuk menelepon dia meninjau kebohongan dan bahwa mereka menerima peninjauan karena tidak menerima upgrade ke vila kolam karena tidak ada ketersediaan. Bagaimana ini mungkin ketika KAMI DIBAYAR UNTUK DAN TINGGAL DI POOL VILLA! ! ! Kami tidak pernah meminta atau mengharapkan peningkatan…,1
7,Bali Alizee Villas,Lokasi yang baik tetapi kebersihan daun banyak yang diinginkan. Kamar mandi membutuhkan scrub yang sangat bagus dengan pemutih. Saya tidak yakin apa yang sebenarnya dibersihkan oleh pembersih. . . . . . mereka bahkan tidak pernah mengganti gulungan toilet mereka hanya duduk yang baru di samping yang kosong setiap hari dan botol kosong duduk di kamar mandi kami sepanjang minggu. Mereka meninggalkan sampah yang kami simpan di dapur. Kain pembersih mereka benar-benar busuk yang kami temukan ketika mereka meninggalkan satu di belakang di meja makan. Pembersih juga tidak masuk sampai larut sore sangat tidak nyaman ketika Anda keluar sebagian besar pagi hari kemudian keluar untuk makan siang dan ingin bersantai di panas hari untuk dibangunkan oleh petugas kebersihan pada jam 3 - 4…,3
8,Bali Alizee Villas,"Villa adalah persis seperti gambar. Aku berjalan dalam dan berkata ""wow"", kolam renang adalah ukuran yang layak (sekitar 8 kaki panjang dan 5 meter). Memiliki segala yang kami butuhkan. Air dingin adalah bonus. Tempat tidur yang nyaman, kamar mandi besar. Bagus jika dua pasangan meskipun kedua kamar mandi hanya memiliki mandi di dalam bak mandi yang besar. Satu hal di kursi plastik dan dara bikin dan terlalu tipis dan tidak nyaman. Kami berbaring di kacang tas saja.   Staf yang benar-benar indah. Lokasi sangat baik. sangat tenang yang luar biasa.",4
9,Bali Alizee Villas,"Tinggal di dua tempat tidur villa dengan dua pacar.  Tidak bisa memuji tempat ini cukup.  sangat bersih, AC yang bagus, tidak begitu banyak nyamuk, air gratis dan antar jemput bandara.  Sekitar 5 menit ke jalan dan 15 ke pantai. Pantai tidak bagus untuk berenang namun menyenangkan untuk berjalan kaki.",5
10,Bali Alizee Villas,"Villa yang besar untuk dua pasangan muda. Dinding yang sangat tinggi jadi itu bagus dan pribadi. Kamar tidur dan kamar mandi ukuran yang bagus. Di kolam renang adalah besar dan selalu memiliki perpaduan antara matahari dan bayangan. Berjalan jarak ke banyak kafe dan restoran yang trendi di Seminyak. Berteriak kepala jika Anda ingin burger yang diantarkan ke villa. Staf resepsionis sangat menyenangkan, mudah ditemui, dapat diandalkan dan fleksibel.   Hanya masalah kecil adalah nyamuk tapi kami hanya memastikan pintu tertutup sehingga mereka tidak dapat masuk ke kamar tidur. Penyemprotan Nyamuk juga membantu dan tempat tidur memiliki kelambu jadi ini bukan masalah besar.",4
11,Bali Alizee Villas,"Kami tinggal di sini selama tujuh malam dan memiliki waktu yang benar-benar indah. Ini adalah rumah dari rumah dan kami satu-satunya kekecewaan adalah kami berharap kami bisa tinggal lebih lama! Saya telah membaca beberapa komentar yang mengatakan Villa tidak sangat modern tapi ini kehilangan titik bahwa mereka memiliki semua yang Anda butuhkan dan sangat, sangat nyaman.   Lokasi Strategis  Luar Biasa.   Ini adalah tentang satu menit berjalan kaki ke minimarket terdekat dan kurang dari Lima ke jalan utama dengan semua bar dan restoran. Sopir taksi kami tidak tahu di mana letak villa sangat layak membuat catatan dari alamat untuk memberikan kepada mereka. Dalam bahasa lokal jika ini dilakukan karena akan sangat membantu.   Meskipun berada di pusat kota, itu adalah sangat pribadi…",5
12,Bali Alizee Villas,"tempat yang sangat tenang, lokasi yang baik. Anak-anak kami sangat menyukai kolam renangnya. Area luar ruangan sangat bagus. Staf yang sangat ramah. Lokasi yang sangat baik. Berjalan kaki singkat ke jalan Oberoi. Kultur adalah tempat yang bagus untuk makan jika Anda ingin makan makanan lokal.",5
13,Bali Alizee Villas,"Lokasi yang strategis dekat dengan jalan utama, tetapi sangat tenang. Area kolam renang yang indah dan lokasi, rasa bali klasik dan layanan yang sangat baik. Kamar mandi yang indah dan luas kamar tidur ber-ac. Villa itu dibersihkan setiap hari dan terjaga dengan baik. Nilai yang baik dan akan tinggal lagi.",5
14,Bali Alizee Villas,"Teman saya dan saya memesan villa untuk 5 hari dari 13 - 17 mei Alizee bulan ini. Villa tidak mengecewakan. Kami memiliki beberapa masalah dengan pemesanan. com mengenai pembayaran ketika pemilik meminta kami untuk uang muka dan kami menyadari bahwa pemesanan tidak mengurangi dari kartu kredit yang saya gunakan. Pemilik, seorang wanita perancis yang sangat manis wanita dan memungkinkan saya untuk membuat beberapa panggilan untuk pemesanan kembali untuk menyelesaikan miskomunikasi. Dia tidak mengambil pembayaran sampai hari ketiga, meminta kami untuk beristirahat dan bersantai yang pertama. =) the villa dekat dengan jalan utama, di mana sekitar sudut dari cina dim sum, anda bisa menemukan warung makan (makan) dan 4 dan pijat yang murah di daerah sekitar. (hanya sin $14 untuk 2…",4
15,Bali Alizee Villas,"vila-vila yang agak tua tapi kolam renang adalah bagus. memiliki dapur terbuka dan ruang tamu umum, tidak panas. ada tidak ada tv di kamar tidur utama adalah ada tidak ada melarikan diri panas untuk dvd atau footy. di A/C tidak bekerja di kamar saya semakin memburuk. saya meminta manajer untuk memperbaikinya tapi itu tidak pernah terjadi. itu sampai ke titik di mana aku tidur di selimut dan hanya mencoba untuk tidur.  masalah terbesar adalah ketika kita mengalami sedikit kesulitan membayar karena mereka tidak menerima kartu kredit, ketika meminta uang saya mengatakan bahwa saya akan mengatasinya dengan teman, tapi tidak terlalu mengganggu dia karena dia punya. saya akan kembali dalam 30 menit. aku kembali untuk melihat teman saya di luar villa yang cukup jauh ini dan manajer…",1
16,Bali Alizee Villas,"Harga masuk akal tapi Alizee villa di lokasi yang baik. Staf yang ramah dan lebih dari membantu dan Salamat mewajibkan. Ia juga berbicara bahasa inggris dengan baik. Vila-vila sangat tenang dan luas, tetapi mereka bersih dan saya tidak menemukan masalah nyamuk. Selama minggu kami tinggal di sampah itu melewatkan beberapa kali. Juga, ac di kamar saya tidak dingin sangat baik sehingga aku merasa cukup hangat di malam hari. Handuknya juga perlu diganti karena mereka cukup digunakan. Kami tinggal di sebuah 2 kamar tidur vila dengan kamar kedua toilet. Gaya terbuka yang menyediakan privasi memungkinkan 2 pasangan tinggal di sini cukup mudah. Kolam renang pribadi adalah indah untuk bersantai di akhir hari. Tempat pijat, spa chiara, tentang 100 meter jauhnya juga sangat baik, sangat…",3
17,Bali Alizee Villas,"Kami tinggal di villa Alizee untuk satu minggu akhir februari, awal maret, dan bukan tempat untuk tinggal. Kami dijemput di bandara oleh Salamat, yang sangat ramah dan siap membantu. Kami tiba di villa dan kami semua terkejut dengan betapa indah semua itu. Menunjukkan kepada kita bulat Salamat, lalu Mammie, pemilik yang indah, datang untuk memperkenalkan diri. Ketika mereka meninggalkan kami segera di kolam renang berkilau. Vila yang terbuka ke area kolam renang, dan kami menghabiskan banyak bahagia hari dan malam hari duduk-duduk di sekitar. Negatif utama tentang ruang adalah bahwa l berbentuk sofa terbuat dari beton dengan hanya bantalan busa tipis, jadi satu-satunya tempat untuk duduk adalah kursi makan, tapi karena kami menghabiskan banyak waktu duduk di kolam renang…",5
18,Bali Alizee Villas,"Ruangan ini indah, tapi dua tempat tidur matahari robek dan kotor. Jika anda pergi, kami tinggal itu bisa sulit. Tidak ada kursi yang nyaman untuk duduk-duduk di sofa dengan bantalan beton untuk dua inci. Saya hanya ingin bersantai tapi tidak ada kenyamanan. Hotel lainnya di tempat duduk kursi kayu di meja makan. Lalu di lemari dapur, lemari es yang baik. Aku senang di sana hanya untuk dua hari. Villa IThis adalah mahal untuk apa yang anda punya. 4, 300, 000IDR",3
19,Bali Alizee Villas,"Pemilik adalah indah dan membantu. Kolam renang bersama dan villa yang bersih dan luas. Di ruang tamu terbuka dan berkeliling dan tidak mendengarkan beberapa memperhangat. Satu kamar adalah sebuah tangga yang akan sulit bagi anak-anak di bawah 10. Dekat pusat perbelanjaan, untuk sedikit berjalan kaki ke pantai.",4
20,Bali Alizee Villas,"Kami secara pribadi memeriksa beberapa sebelum memilih vila ini, terutama karena dekat dengan strip belanja/restoran/hiburan tapi juga karena itu bersih, nilai yang baik dan hanya terasa tepat. Di lokasi ini terdapat beberapa vila dengan dua atau tiga kali harga villa yang berkualitas dan jadi untuk biaya yang sangat wajar.   Pada pemeriksaan pertama kami disambut oleh manajer Salamat, dan saya sangat terkesan oleh staf profesional, ramah dan baik. Vila ini milik pribadi keluarga oleh prancis ""mammie"" (villa grandmamma) yang tinggal di situs dan sangat mudah pergi dan membuat kami merasa sangat menyambut dan siap untuk menawarkan bantuan dan nasihat jika diperlukan dan tersedia juga berbagai pilihan buah-buahan dan jus freidge di sebelum kedatangan. Kalau Mammie menyediakan saya…",5
21,Bali Alizee Villas,"Bersih, terjangkau dan di lokasi yang bagus, sangat tenang, dengan semua restoran yang menakjubkan semua dalam jarak berjalan kaki. Gaya lama bali villa namun berfasilitas lengkap dan terawat. Ibu dan saya tidak Sammut. Akan benar-benar merekomendasikan vila Alizzee.",5
22,Bali Alizee Villas,"Indah vila yang bergaya. Kamar yang bersih, kolam renang besar, sangat baik. Lokasi bagus untuk beberapa restoran yang baik (seperti cafe bali - top spot).   Kami benar-benar menyewa sebuah vila dengan kolam bersama dan datang kembali untuk kolam renang pribadi setelah seminggu menginap di lembongan.   Mereka sangat ramah untuk anak-anak, dan bayi ketika pindah.   Ibu, pemilik, adalah perancis, tetapi bahasa inggris adalah baik. Dia memiliki semua jenis restoran rekomendasi.   Anda dapat membayar dengan euro jika anda inginkan, tidak ada kartu kredit.   Sangat direkomendasikan!",5
23,Bali Alizee Villas,"Saya baru-baru ini teman saya dan mendapatkan kembali dari bali dan telah benar-benar menyenangkan pengalaman di daerah kami makan di vila Alizee. Manajer dan pemilik Selmat Mammie dan semua staf, kita benar-benar menyenangkan dan kami merasa benar-benar selamat datang dan bagian dari keluarga setelah 10 hari tinggal. Kami punya 2 kamar tidur vila yang indah dengan kolam renang pribadi. Villa indah, benar-benar luas bersih dan super nyaman. Lokasi Alizee adalah sempurna, berjalan kaki singkat dari semua tindakan di seminyak tapi benar-benar tenang dan damai. Yang terbaik dari kedua dunia. Tidak ada permintaan terlalu banyak dan mereka bahkan diselenggarakan sopir besar untuk kami yang kami juga berwisata ke ubud. Aku sudah merencanakan perjalanan berikutnya ke tentang bali dan…",5
24,Bali Alizee Villas,"Kami tinggal selama 10 hari di villa Alizee pada bulan oktober. Lokasi ini adalah sangat bagus - tepat di samping jalan utama Semyniak dan berlimpah. Meskipun itu dekat dengan jalan paling ramai dengan pertokoan dan restoran yang ada di villa ini sangat sunyi dan nyaman dengan tidak ada suara sama sekali.  Layanan ini cukup bagus - handuk pantai complentary, sepiring friut pada kedatangan, dan sangat membersihkan kamar bycicles membuat kami benar-benar menikmati tinggal di hotel Alizee. Terima kasih, tim untuk Alizee vila yang kami liburan!  Kolam renang yang sangat bagus memang.  Satu-satunya hal yang anda harus menyadari - siap untuk berjalan atau berkendara ke pantai (tidak mengambil 10 - 15 yang bycicle memperkuda ke laut)   Secara umum. Aku benar-benar akan merekomendasikan…",5
25,Bali Alizee Villas,"Ulasan untuk tempat ini menakjubkan, setelah perjalanan panjang dari inggris kami disambut oleh manajer dari bandara saat kami begitu lelah dia menunjukkan kepada kita langsung ke villa kami dan kemudian kami pergi ke check-in saya keesokan harinya.  Menyewa moped dari yang sangat alizee. Mereka tidak bisa melakukan cukup untuk membantu kami, bahkan memberitahu kami ke mana harus pergi dan apa yang ada di menu.   Akan tetapi bagi mereka yang ingin makan keluar, pergi ke pantai atau hanya untuk bersantai di sekitar kolam renang. Kami menghabiskan 3 hari di pantai dan satu di sekitar kolam bersama yang begitu tenang anda tidak akan tahu anda berada di pusat kota seminyak.   Banyak tempat untuk makan sarapan, makan siang dan makan malam dengan harga terjangkau. Merekomendasikan la…",5
26,Bali Alizee Villas,Terselip di balik hiruk-pikuk jalan utama di seminyak. Itu sangat tenang dan kami menikmati kami 6 malam menginap. Manajer itu sangat membantu dan dipesan untuk kami di salon yang sangat lokal. Mamie selalu membantu dan bahkan mari kita tinggal tambahan setengah hari di sebagai penerbangan kami kiri di tengah malam.,4
27,Bali Alizee Villas,"Kami (2 adelst, 2 anak-anak dengan 4 tahun dan 7) tinggal di benar-benar villa hanya minggu ini. Vila ini luas dekorasi, tata letak terbuka sangat nyaman. Semuanya adalah tetap sangat baik dan bersih. Anak-anak mencintai kolam renang dan area duduk-duduk terbuka dan makan. Vila ini berada di seminyak yang ramai yang tenang di surga, meskipun hanya 5 menit berjalan kaki dari jalan utama, tidak ada suara melalui penyaring. Sempurna dan sangat bersemangat.",5
28,Bali Alizee Villas,"Manajer villa adalah benar-benar menyenangkan. Dia sangat ramah dan baik, ketika kita pertama kali tiba dan selalu senang untuk membantu kami. Villa indah dan sangat pribadi dan meskipun itu sangat dekat dengan pusat kota seminyak ini masih sangat tenang. Pada kenyataannya itu adalah cantik dan tenang istirahat dari sibuk pusat, khususnya bersantai dengan membaca buku di samping kolam renang. Saya pasti akan merekomendasikan properti ini untuk orang lain.",4
29,Bali Alizee Villas,"Kami, 4 orang dewasa, bayi berumur 6 bulan yang ditemukan di vila dan kolam renang pribadi yang sangat bersih dan segala sesuatu di urutan kerja. Dispenser air minum untuk mengisi botol-botol kecil, dan staf selalu sangat membantu dan ramah. Pantai yang indah dengan sedikit berjalan kaki. Vila yang cukup dekat untuk berjalan kaki ke pertokoan utama dan restoran tapi menetapkan kembali jauh cukup untuk menikmati sore yang tenang dan nilai yang luar biasa! Pemilik membuat anda merasa seperti bagian dari keluarga mereka.",5
30,Bali Alizee Villas,"Menghabiskan 5 hari di sini di 2 kamar tidur vila dengan kolam renang. Mencintai tempat ini. Itu super nyaman. Saya pikir kamar mandi sangat bagus juga. Kolam renang indah. Saya setuju, tidak terlalu nyaman sofa, tapi apa-apa untuk mengeluh tentang. Untuk harga, vila ini luar biasa dan begitu dekat dengan jalan utama di seminyak serta supermarket. Pasti akan tinggal di sini lagi.",4
31,Bali Alizee Villas,Terima kasih untuk pengalaman menginap yang menakjubkan! Villa yang indah dan damai. Staf yang luar biasa dan itu benar-benar menyenangkan mamie! Dengan senang hati merekomendasikan sangat dan aku tidak berencana untuk kembali. Di pijat adalah memperlakukan untuk tidak makan di tempat. sangat dekat dengan semua yang ditawarkan di seminyak.,5
32,Bali Alizee Villas,"Kelompok kami tinggal di villa di penghujung mei dan kami sangat senang. Mereka sangat fleksibel yang menampung dan ramah. Ada Selmat Mammie dan, ramah, dan benar-benar yang terbaik. Ia direkomendasikan putu sebagai sopir kami dan ia adalah luar biasa. Meskipun kita tidak menghabiskan banyak waktu di villa daripada tidur, tinggal di sini membuat pengalaman bali kami yang jauh lebih menyenangkan. Lokasi luar biasa juga.",5
33,Bali Alizee Villas,"Kami tinggal di sebuah 2 kamar tidur vila untuk 8 hari yang tidak cukup lama. Kamar yang bersih, kolam renang ukuran baik. Wi-fi adalah besar. Seluruh villa memiliki suasana yang terbuka dan kamar mandi untuk setiap kamar. Lokasi itu sempurna. Segala sesuatu adalah lebih baik maka diharapkan dan staf yang fantastis. Pasti akan tinggal di sini lagi.",5
34,Bali Alizee Villas,"Kami tinggal di villa untuk 6 malam di maret 2015 Alizee. Kami benar-benar mencintai hotel ini! Hotel ini tepat di jantung seminyak dan hanya berjalan kaki singkat ke semua kafe terbaik, toko-toko dan restoran-restoran. Kendati demikian pusat, itu begitu damai, tenang dan pribadi yang baik. Staf adalah sangat ramah dan membantu dan hanya host Mammie prancis yang indah. Itu adalah nilai untuk uang yang fantastis dan kami selalu merasa aman dan aman. Kami akan pasti tinggal di sana lagi pada kunjungan berikutnya ke bali dan kami juga sangat merekomendasikan sebagai menginap yang sempurna di seminyak yang indah!   Tinggal maret 2015, bepergian dengan keluarga",5
35,Bali Alizee Villas,"Kami telah tinggal di villa Alizee untuk 9 tahun sekarang dan menyukai tempat ini, j' memperdewa! Ini adalah sebuah permata tersembunyi. Hotel ini tepat di jantung seminyak dan anda dapat berjalan kaki ke semua toko-toko dan restoran di jalan-jalan. Stafnya sangat ramah dan merupakan Mammie! Terdapat brankas di kamar anda, jika anda khawatir tentang apa pun anda taroin di aman, yang adalah apa itu ada untuk. Tidak ada nyata kabel tv tapi kita di sini untuk bersenang-senang dan matahari tidak ada tv, tidak ada dvd player sehingga anda dapat menonton dvd, jadi langsung beli di jalan. Di mana pun anda pergi di bali sayangnya anda akan mendapatkan masalah dengan drainase di kamar mandi, ini adalah bali, bahkan di hotel bintang 5! Kami selalu bayar dengan tunai ini adalah benar-benar…",5
36,Bali Alizee Villas,"Kami adalah dua pasangan yang mengunjungi indonesia pada 2015 februari, dan menemukan sally's bungalows sengaja, di kami berhenti di seminyak. Menginap hanya 2 malam, (terakhir dua perjalanan kami). Keluarga menjalankan bungalow-apartment adalah tempat yang sempurna untuk kami, dengan ruang tamu terbuka, dapur dan dua kamar tidur-satu upstrairs. Staf sangat ramah, dan membantu kami dalam apa pun yang kami meminta untuk, seperti persewaan sepeda motor, terlambat check out, dan mereka bahkan diposting kartu pos kami setelah kami meninggalkan, karena kami tidak memiliki waktu untuk akhirnya... :)  Tempat yang indah, lokasi yang bagus, akan tinggal di sini lagi! ",5
37,Bali Alizee Villas,Tempat ini adalah benar-benar a great menemukan. Itu tipikal bali di bahwa itu terbuka dengan merasa santai. itu hanya sekitar 6 villas. Kamar sangat bersih dan taman sangat bagus dengan kolam renang yang bersih. Staf sangat ramah seperti pemilik. Daerah ini terletak di cukup jalan dengan besar restoran lokal kecil di sebelah. Belanja strip adalah sekitar lima menit berjalan kaki. Saya merekomendasikan the library cafe jika anda sombong kopi; - )   Saya akan merekomendasikan tempat ini ke siapapun yang tahu bali dan tidak ingin resor besar gaya pendirian.,4
38,Bali Alizee Villas,"Kami punya waktu yang indah (keluarga 5) tinggal untuk 7 malam. Kami melakukan berharap untuk tinggal untuk 13 tapi villa dipesan keluar untuk tanggal kami. Komunikasi di pemesanan adalah sangat jelas dan cepat. Salamat dan tim tampak setelah kami sangat baik tepat dari mengumpulkan kami dari bandara. Tidak ada terlalu banyak masalah dan mereka adalah orang-orang yang menyenangkan. Terdapat mesin air yang disaring yang adalah sangat berguna dan selalu keren, plus jaring nyamuk di tempat tidur, saat perawatan harian dan banyak fasilitas di villa anda. Kolam renang adalah selamat datang tangguh (ukuran yang baik) dan terus sangat bersih dengan bahan kimia seimbang dan furnitur luar yang bagus. The cat adalah juga ramah mengobrol dan senang untuk dijemput oleh anak-anak. Lokasinya…",4
39,Bali Alizee Villas,"Saya sudah ke bali 8 kali dan akomodasi ini adalah yang terbaik oleh jauh. Vila ini hanya menakjubkan, indah dekorasi, sangat bersih, besar tempat tidur dan kamar mandi. Kolam renangnya sangat bersih dan taman yang terawat dengan baik. Staf begitu indah dan semua orang bekerja sama untuk anda untuk memiliki waktu yang hebat. Lokasi adalah yang terbaik, sangat sentral namun sangat tenang. Ini tepat di belakang ""makan street"", dekat untuk semua terbaik restoran seperti ultimo, kafe bali (favorit saya), la trattoria, bar sampanye (karpet merah)... terlalu banyak untuk nama! Terima kasih untuk Mamy, cathy, slamet dan seluruh staf untuk masa menginap yang tak terlupakan, melihat anda semua lagi di juni! ",5
