,hotel,review,stars
40,Bali Alizee Villas,"Kolam renang pribadi villa no. 5 untuk 4   Pro 1. Dilengkapi dapur pribadi dengan air yang disaring tangki diisi ulang setiap hari 2. Toilet luas, ruang tamu & ruang makan 3. Tv dengan saluran internasional 4. Pendingin ruangan dengan kondisi bekerja yang bagus di kamar tidur 5. Layanan kamar setiap hari adalah tip top. Penjaga keamanan adalah ramah dan membantu   Kontra 1. Banyak semut di toilet 2. Hanya 1 kipas angin berdiri bersama antara ruang makan dan ruang tamu, karena itu sangat panas dan membuat kami di kamar tidur dengan ac sebaliknya 3. Setelah hujan, air terkumpul di depan pintu masuk kamar tidur (kamar tidur di belakang hall). Harus berhati-hati untuk tidak terpeleset 4. Banyak nyamuk dan bersih/obat nyamuk bakar disediakan tidak membantu. Ini adalah perbandingan…",3
41,Bali Alizee Villas,"Kami mulai bulan madu kami perjalanan ke bali di sini dan kami tidak kecewa. Dari saat kami dijemput oleh mobil vila, sampai kami meninggalkan, kami menikmati masa menginap kami di sini. Lokasi yang sempurna untuk semua yang seminyak yang ditawarkan, tanpa kebisingan dan kegilaan yang anda harapkan di malam hari. Vey tenang. The villa dengan kolam yang fantastis, dengan taman pribadi dan ruang udara terbuka. Kamar mandi adalah satu-satunya hal yang sedikit mengecewakan. Itu bisa melakukan dengan upgrade, tapi itu selalu sangat bersih. Sangat baik staf yang ramah selalu siap untuk membantu jika diperlukan dan saya pasti akan menginap lagi di sana, meskipun tidak terlalu yakin tentang tinggal lagi di seminyak itu sendiri. Ada begitu banyak lebih banyak ke bali, daripada di sini.",4
42,Bali Alizee Villas,"Kami menyewa villa untuk 2 malam terakhir kami di indonesia dan kami bisa ' nt telah memilih tempat yang lebih baik. Rumah makan mami dan staf sangat ramah dan villa sangat mengagumkan dengan privatepool, dapur yang lengkap dan kamar mandi yang indah. Vila ini terletak di dekat pantai dan pusat kota tapi tempat ini adalah tetap tenang. Saya akan benar-benar merekomendasikan tempat ini!",5
43,Bali Alizee Villas,"Villa indah, lengkap dengan kolam renang pribadi. Daerah besar, pribadi namun dekat dengan toko dan restoran, meskipun sopir mengalami sedikit kesulitan menemukan tempat.  Saya tinggal di villa 2bdrm sendirian karena teman saya harus membatalkan pada menit terakhir. Itu sangat besar. Masing-masing kamar tidur memiliki kamar mandi dalam, dengan akses untuk salah satu dari mereka secara langsung dari kolam/area dapur sehingga anda tidak harus pengeluyur melalui kamar tidur di-siaplah untuk berenang. perlengkapan mandi sangat terbatas, jadi membawa anda sendiri. Staf/manajer yang sangat ramah dan membantu.  Area luar ruangan sangat besar - memiliki sebuah kolam renang, gazebo, ruang tamu dan dapur (dengan tv). Dapur adalah ukuran yang baik, meskipun tidak ada microwave.…",4
44,Bali Alizee Villas,"Pendekatan profesional dan ramah oleh staf, lokasi yang sangat baik, bersih dan baru perlengkapan dan peralatan, bagus kolam renang, tidak ada yang keberatan single - itulah mengapa saya dediced untuk memesan villa yang sama dalam beberapa minggu waktu...",5
45,Bali Alizee Villas,"Ini adalah salah satu tempat terbaik saya pernah ke di asia tenggara! Villa indah, staf yang ramah, kolam renang yang menyenangkan, lokasi yang sangat baik, harga mengejutkan rendah... semua di sekitar itu cukup sempurna.  Kipas angin besar dari pemilik juga, karena salah satu dari mereka adalah seorang dokter yang membantu saya dengan darurat medis yang kecil!",5
46,Bali Alizee Villas,"Saya telah ke bali sekitar sepuluh kali sekarang dan sejauh ini adalah tempat terbaik yang pernah saya tinggal di. Ada antar-jemput gratis dari bandara. Staf yang hangat dan ramah. Vila itu sendiri adalah indah dan nyaman, dan kolam renang adalah benar-benar ukuran yang baik. Sinyal wifi sangat baik (yang unik pengalaman saya di vila di seminyak!). Kamar tidur yang sangat nyaman. Ada pendingin air besar daripada setelah beberapa botol kecil, jadi ada secara efektif umlimited air minum gratis. Lokasinya bagus, hanya 5 menit berjalan kaki dari jalan utama dengan toko-toko dan restoran - sangat dekat dengan restoran yang bagus seperti rumours, ultimo. Secara keseluruhan, tempat yang bagus untuk tinggal. Saya akan memesan di sini lagi, dan saya akan merekomendasikan hal ini sangat. …",5
47,Bali Alizee Villas,"Kami memesan 2 vila dari 5th-9 mei. Seluruh villa sangat indah dan bersih, kolam renang adalah ukuran yang sempurna. Dari saat kami tiba sampai kedua kami meninggalkan layanan pelanggan sangat sempurna! Dekat ke seminyak jalan utama perbelanjaan dan restoran.  Salamat, mamie dan indah orang yang mereka membuat kami merasa begitu nyaman, kami sangat menyukai dan menikmati kami tinggal begitu banyak karena semua staf. Pastikan untuk mengatakan hi ke malam menonton (charles) dia sangat mengagumkan dan bahkan mengajarkan kita beberapa bahasa. :) Pastikan untuk mencoba restoran bbq yang secara langsung melintasi jalan dari the villas adalah sebuah keharusan.  Satu-satunya kekurangan adalah mereka tidak menawarkan sarapan.",5
48,Bali Alizee Villas,"Seluruh pengalaman saya di pemesanan Alizee villa's dari waktu saya membuat pemesanan saya, hingga saya check out adalah indah. Saya dihubungi segera dan mereka mengatur untuk menjemput saya dari bandara. Penerbangan saya ditunda 1, 5 jam tapi supirnya masih ada. Saya terkejut ketika mereka menunjukkan untuk villa saya dan membawa saya untuk tur dan menghabiskan waktu menunjukkan kepada saya semua di kamar (meskipun itu dekat dengan 9pm!) Saya bertemu mamie yang adalah hanya indah. Saya merasa benar-benar disambut oleh dia dan dia staf menakjubkan. Saya juga diberikan jus segar pada saat kedatangan.  Vila itu sendiri adalah benar-benar pemandangan. Gambar tidak melakukannya keadilan, dan saya tidak bisa percaya bahwa saya benar-benar akan tinggal di seperti surga! Villa ini…",5
49,Bali Alizee Villas,"Menginap lagi selama 3 minggu tahun ini dan kami sekali lagi sangat senang. Ada banyak konstruksi baru di sekitar dan kompetisi, tapi juga sangat penting bagi kami untuk tahu bahwa Alizee villas memiliki izin dan anda mendapatkan nilai untuk uang. Hotel ini juga baik untuk tahu bahwa selalu ada seseorang di sekitar untuk membantu dan itu sangat tenang, siang dan malam.",5
50,Bali Alizee Villas,"Vila ini luas dan indah dengan kolam renang privat anda sendiri - gambar tidak melakukannya keadilan, itu adalah benar-benar elegan. Tapi sebagai ibu itu adalah hal kecil seperti air dingin, kelambu di atas masing-masing ranjang dan plug di obat nyamuk yang benar-benar dihargai! Anda dapat menyewa sepeda untuk 3, 5 $sehari yang membuat mendapatkan sekitar sangat mudah dan murah. Pantai adalah dalam jarak berjalan kaki dan jalan utama adalah sekitar 200m jauhnya tapi ada grocer kurang dari 50m jauh. Bersenang sangat baik dan selalu membantu. Kami bahkan meninggalkan satu tas dan lukisan kami membeli di sini ketika kami pindah utara untuk menyelam kami, akan menjemput di perjalanan kami ke bandara. Awal yang indah untuk liburan kami! Kami pasti akan tinggal di sini lagi, terima…",5
51,Bali Alizee Villas,"Kami tinggal di sally's bungalows untuk beberapa hari pada bulan juni. Kami dijemput dari bandara oleh karyawan yang sangat ramah dan kompeten. Ketika kami tiba di bungalow yang kami disambut hangat oleh mami, yang mengelola guest inquieries dan membuat anda merasa di rumah segera. Bungalownya sangat luas dan indah dibangun dengan sebuah dapur terbuka dan area makan. Semuanya sangat bersih dan rapi. Ada juga kolam renang yang sangat bagus dengan loungers. Kami benar-benar mencintai tempat ini, terutama karena mami dan staf yang indah. Mereka benar-benar membantu anda dengan segala sesuatu. Teman saya jatuh sakit dan mereka benar-benar peduli dan memberi kami beberapa obat. Mereka juga memberi kami tambahan untuk jemputan bandara bebas karena salah satu teman kami tiba beberapa…",5
52,Bali Alizee Villas,Vila ini memiliki banyak ruang dan menciptakan lingkungan pribadi dekat dengan area utama di seminyak. Terawat dengan baik dan staf yang ramah yang selalu di tangan untuk menjawab pertanyaan dan membantu. Akan merekomendasikan untuk keluarga atau beberapa pasangan yang bepergian bersama-sama.,5
53,Bali Alizee Villas,"Kami memiliki pengalaman menginap yang menakjubkan di villa Alizee! Staf sangat bagus dan mamie menyambut kami dengan senyum yang besar. Saya akan sangat merekomendasikan vila ini karena itu adalah baik terletak, berjalan kaki ke seminyak. Villa adalah besar dan itu bagus untuk memiliki kita sendiri kolam renang pribadi!",5
54,Bali Alizee Villas,"Kami menginap di bulan april untuk teman pernikahan. Kami memiliki dua kamar tidur vila yang indah dengan kolam renang pribadi. Tempat yang fantastis, nilai yang sangat baik dan staf yang sangat baik. Lokasi sempurna tepat di jantung seminyak. Kami pasti akan tinggal di sini lagi.",5
55,Bali Alizee Villas,"Tempat yang fantastis untuk tinggal di jantung seminyak. Kami membutuhkan beberapa serius r dan r dan villa Alizee disampaikan. Itu sangat tenang dan layanan yang fantastis dan semua staf sangat membantu. Villa ini berada di pusat kota, dekat dengan toko-toko, restoran dan hari spa, pasti akan datang kembali! ",4
