,hotel,review,stars
0,Cempaka Belimbing Villas,"Menginap 2 malam pada perjalanan pertama, dan 6 malam minggu lalu. Keduanya memberi pengalaman yang sangat baik. Stafnya sangat membantu, mendapat pijat yang sangat enak dari salah satu satpam yang merupakan penyembuh keseleo lokal.  Makanan hanya sejauh beberapa meter di kafe lokal yang menghadap teras padi, warung Made. Porsi besar nasi goreng atau mie goreng seharga < US$1.. coba kelapa mudanya ..disajikan dengan kulitnya. Menyegarkan...  Banyak interaksi dengan warga lokal dan pemandangan teras sawahnya luar biasa.. Cuaca sejuk sepanjang tahun itu surgawi bagi saya..",4
1,Cempaka Belimbing Villas,"Kami punya kamar di vila-vila di seberang jalan. Dari komentar di trip advisor, sepertinya semua kamar tidak persis sama. Anda harus memilih dengan hati-hati saat memesan. Pemandangan dari kamar menakjubkan, kamar tidur dan kamar mandi yang sangat luas. Ini adalah suasana tropis dengan ruang terbuka antara atap dan dinding untuk ventilasi. Karena itu Anda mungkin menemukan tokek di dalam ruangan. Tidak ada salahnya. Pokoknya ada moustiquaires untuk melindungi tempat tidur. Makanannya sangat enak. Kolam renang tidak dipanaskan dan ini berada di ketinggian sehingga air dapat menjadi marah. . . .  Tempat menarik di mana kami akan kembali secara definitif tetapi Anda perlu menyadari bahwa ini adalah pengalaman, bukan ruang anonim",5
2,Cempaka Belimbing Villas,"Saya telah tinggal di sini beberapa kali dan selalu menikmatinya. Bagian terbaik adalah kedamaian dan ketenangan, kolam renang adalah berkah. Kamarnya luas dan bersih, sarapan sangat baik. Wifi ok bisa mengirim teks dan email tidak ada masalah. Secara keseluruhan senang tinggal di sini lagi. Nikmati",5
3,Cempaka Belimbing Villas,"Kamar ok - sedikit lembab tapi kemudian hujan banyak! Namun pemandangan yang nyaman dan indah di atas sawah. Tidak ada kamar yang saling terhubung sehingga kami menekan 4 ke dalam 1 kamar - 3 dengan ukuran king dan 1 tempat tidur lipat. Bepergian dengan anak-anak berusia 8 dan 10 tahun. Melakukan tur berjalan kaki yang indah dari sini dan tur kuil. Mungkin terlalu lama untuk anak-anak dan tidak cukup untuk membuat mereka bahagia, namun karena itu adalah 2 hari hujan perjalanan kami, itu berhasil baik kami bepergian di van banyak! Staf sangat ramah dan membantu. Restoran makanan yang indah.",4
4,Cempaka Belimbing Villas,"Hotel yang bagus di tengah alam yang dikelilingi oleh desa, sawah, dan hutan hujan. Vila-vila baik dan bersih dengan kamar mandi besar. Anda dapat memesan tur dan pergi berjalan-jalan melalui desa dan alam di sekitar hotel dengan panduan. Kolam renang luar ruangan, jacuzzi, teras di tepi kolam renang dengan kursi dan pemandangan yang indah yang dapat Anda berbaring di sana untuk berjemur. Ini adalah tempat yang tenang dan damai untuk bersantai untuk sementara waktu.",4
5,Cempaka Belimbing Villas,"Aku tinggal di sini sebagai bagian dari retret Yoga Bali Suci selama seminggu. Itu adalah tempat yang sempurna untuk retret seperti ini, dan dari kedatangan ke keberangkatan, Made dan stafnya memperhatikan kebutuhan kami dan merawat kami dengan sangat baik. Pengaturannya tidak bisa lebih indah, terletak di sisi bukit menghadap sawah yang subur. Ada yang indah kolam / bak mandi air panas dengan tanaman berbunga pot, patung batu dan tempat berjemur keramik di mana kami berlatih yoga setiap pagi. Makanan di restoran lezat dan segar, dan kami juga memiliki kelas memasak di mana kami belajar bagaimana menyiapkan masakan Indonesia. Kamar yang bersih dan nyaman dengan beranda yang bagus untuk mengambil dalam keindahan lapangan. Daerah sekitarnya dan desa-desa yang indah untuk…",5
6,Cempaka Belimbing Villas,"Saya baru saja menyelesaikan retret yoga enam hari saya di Bali Barat. Keluarga yang menciptakan tempat indah ini sangat terkait dengan asal-usul mereka. Dari saat pertama Anda merasakan kedamaian dan kesendirian yang mendalam. Setiap anggota tim mereka datang dari desa memberi pekerjaan dan kesempatan untuk semua orang. Untuk menjadi bagian dari perubahan ini, siapa diri Anda yang di dalamnya adalah hadiah yang berharga. Saya sangat tersentuh oleh pengalaman saya dan akan kembali lagi. Makna dari Bali adalah ritual kami dikelilingi dalam esensi ini.",5
7,Cempaka Belimbing Villas,Saya dan suami saya tinggal di sini satu malam selama perjalanan di sekitar pulau. Kamar bersih dan nyaman dan fasilitas dasar tapi bagus. Pemandangan sawah dan sangat damai di sini.  Makan malam dan minuman sangat terjangkau. WiFi tersedia di seluruh. Kolam renang dan area jacuzzi sedang direnovasi jadi kami tidak menggunakannya tetapi pengaturan sangat bagus.  Staf sangat ramah. Layanan dengan senyuman setiap saat.,5
8,Cempaka Belimbing Villas,"Kami tinggal selama 2 malam dan menyukai suasana damai hotel. Kamar luas dan sangat nyaman, kamar mandi direnovasi. Kami tiba di malam hari sehingga kami menemukan sawah. Lihat keesokan paginya dan itu menakjubkan. Hotel ini sangat tenang, kami tinggal sore di tepi kolam renang dan melihat tidak ada orang lain. Restoran baik tetapi sedikit lebih mahal daripada di tempat lain. Tur kecil dari lingkungan yang disediakan oleh hotel adalah suatu keharusan! Jangan sampai ketinggalan, itu sangat berharga. Kami juga mencoba pijatan, itu sangat bagus. Hanya titik negatif adalah bahwa mereka tidak memberi Anda 5 menit istirahat setelah pijat. Ketika selesai, Anda harus bangun dan pergi.",4
9,Cempaka Belimbing Villas,"Jika Anda mencari tempat yang terpencil di antara sawah dengan restoran yang bagus di daerah tropis, ini adalah tempat untuk Anda. Bagi kami dengan 2 anak remaja itu tidak benar-benar cocok. Kamar dasar tapi oke dan bagus + ada teras di luar.",3
10,Cempaka Belimbing Villas,"Tinggal di sini selama 2 malam. Selain pemandangan yang bagus dari riceterraces tidak ada banyak untuk melihat dan melakukan.  Selama kami tinggal banyak hujan yang turun dari langit. Untungnya ada sedikit/tidak ada periode hujan. jadi kami melakukan beberapa berjalan dengan seorang pemandu dari hotel. Apa yang kami dapatkan dari dia adalah sangat berguna karena licin.  Butuh waktu 1, 5-2h untuk menyelesaikan berjalan. Ini sudah termasuk jadi secara gratis. Kami melakukan cyclingtour (pribadi). Selama perjalanan pemandu kami menjelaskan tentang sayuran dan buah dari alam, memiliki coffeebreak lokal tempat dan berakhir di laut dengan sebuah gua rubah terbang. Tempat yang harus dikunjungi. Kamar di villa sangat bersih, tidak ada yang istimewa. Makanan di restoran sangat baik. Nasi…",3
11,Cempaka Belimbing Villas,"Hotel yang sangat bagus dengan arsitektur bali klasik tradisional set di taman yang indah. Hotel itu sendiri dibangun di sebuah desa kecil dengan pemandangan yang luar biasa dengan sawah yang bisa berjalan dan berjalan. Anda harus menghabiskan setidaknya satu atau dua hari untuk menjelajahi daerah ini menakjubkan. Pada musim buah dari bulan oktober sampai maret, kawasan ini juga surga bagi para pecinta durian dan manggis, murah dan sangat lezat nasi!",4
12,Cempaka Belimbing Villas,"Kami tinggal dua malam di villa Cembaka Blimbing (atau belimbing). Hotel ini terletak dengan baik tapi menjanjikan pemandangan persawahan yang dapat dilihat dari kolam renang dan dari beberapa kamar. Hotel bernafas suasana yang kehilangan kemuliaan yang memiliki sesuatu yang baik, tetapi anda harus mengambil perawatan di akun yang tidak optimal, misalnya untuk kolam renang di mana gigi keramik yang menunjukkan waktu. Jalan dan tangga bisa licin di beberapa tempat. Restoran adalah terbuka dan menyajikan makanan yang lezat. Sarapan adalah hanya gaya amerika, tidak ada di indonesia, yang sayang sekali. Kami mendapat kamar di bangunan baru, kamar normal hotel, tidak ada yang istimewa, tapi cukup dan baik, mandi besar dan selain itu ac (tidak hadir di bagian yang lebih tua dari…",3
13,Cempaka Belimbing Villas,"Menginap hanya untuk satu malam dan itu adalah akhir sempurna, villa cukup dan damai. Kami memiliki makan malam di restoran pemegangan oleh ari, yang sangat bagus dan ramah, ayam kari  itu lezat. Waktu makan siang mencoba warung tepi sawah, hanya lima menit dari villa, dengan pemandangan persawahan yang bagus dan baik geyuk Betutu.",4
14,Cempaka Belimbing Villas,old fashion yang sangat enak di tabanan villa. sangat tenang dan bagus villa bersembuny untuk sementara dari rutinitas sehari-hari. Kami hanya datang kembali dari akhir pekan yang pendek. Kami mendengar apa-apa tapi duduk dan gecko mempersertakan malam kami. sangat menyegarkan dengan layanan luar biasa. Terima kasih untuk server kami terlihat di restoran yang melayani kita makan malam dan sarapan. Dilakukan dengan baik.,5
15,Cempaka Belimbing Villas,"Pemandangan indah dan itu. Kamar yang luas tapi tidak ada pesonanya sedikit pun. Restoran adalah apa-apa tapi panggeng. Selamat datang di catatan terjun melampaui apa yang ditawarkan. Dan air di kolam renang adalah... Hijau! Daerah sekitarnya dengan sawah sangat ramai, tapi anda bisa tinggal di tempat lain dan bisa memiliki & kembali. Ada begitu banyak pilihan yang lebih baik di bali...",2
16,Cempaka Belimbing Villas,"Aku tinggal di sini selama tiga minggu. Ini adalah kedua saya tinggal. Kamar yang luas, dan bersih. Kamar mandi adalah besar dan paling baru-baru ini direnovasi. Pemandangan pegunungan dari belakang vila spektakuler. Wifi di kamar adalah pengunjung. Namun, wifi di restoran adalah memadai untuk email. Cempaka, melakukan tur jalan kaki berpemandu di sekitar desa yang dekat dengan hotel. Kolam renang cukup besar untuk berenang, airnya sebening kristal dan hanya suhu yang tepat. Makanan yang sangat baik, pizza dan pasta di ruangannya, membuat perubahan yang menyenangkan dari ayam dan nasi. Ini adalah khas bali, sangat ramah dan membantu. Selalu senyum hangat yang bagus untuk menyambut anda. Dibuat, manajer hotel yang super ramah, tidak ada yang terlalu banyak kesulitan. Aku akan…",4
17,Cempaka Belimbing Villas,"Lokasi unik di tengah-tengah sawah. Restoran adalah baik-baik saja, tapi itu terutama pemandangan yang istimewa. Kami menikmati jalan pagi dengan pengebun yang menjelaskan banyak tanaman yang berbeda tumbuh di perkebunan. Cukup baik!",4
18,Cempaka Belimbing Villas,"Sebelas malam yang damai. Ini adalah khas bali, sangat membantu selalu tersenyum dan ramah.  Kamar kami adalah modern dan bersih KutuKutu di tempat tidur adalah sangat nyaman. Tv layar datar besar; resepsionis yang bagus. Bar lemari es ini memiliki pilihan yang baik minuman. Kamar mandi adalah luas, mandi besar daerah adalah kegembiraan untuk menggunakan. Balkon yang bagus dengan pemandangan pemandangan kolam. Kamar kami adalah tenang, dengan banyak sinar matahari. Wi-fi: ini karena pengunjung dan mengirim email adalah baik-baik saja. Sarapan adalah benar-benar baik; roti panggang, kopi, telur, pancake dan buah-buahan. Tidak ada gym. Menu makan malam adalah harus mencakup, ""pizza, dan hot dog Hamburgas"" selamat datang perubahan dari beras dan nasi. Kolam renang adalah yang…",5
19,Cempaka Belimbing Villas,"Di hotel ini anda akan menikmati hotel ini tenang terisolasi daerah bali, jauh dari pantai ramai. Aku harus dicatat bahwa anda berada di pedesaan. jadi ada beberapa anjing dan ayam jantan... Anda akan mengagumi iandscape: sawah, tentu saja, tetapi juga gunung batukaru. Selain itu terdapat beberapa kegiatan. Tapi hotel yang gratis dan sangat menarik kuusulkan lintas alam di sawah dengan panduan.",4
20,Cempaka Belimbing Villas,"Aku tinggal di sini 1 malam sementara kepariwisatawan melewati kawasan ini. Tempat itu mati tenang, tapi aku punya kamar dengan tidak ada pemandangan yang rata-rata. Anggota staf di resepsionis tidak ramah, dan makan malam (di restoran hotel) adalah mengerikan. Di sisi positifnya, tempat ini sangat tenang dan kamar mandi adalah besar.",3
21,Cempaka Belimbing Villas,"kami terkejut pada bagaimana lelah & tua yang sayangnya kami. Villa cempaka adalah di seberang restoran & karena tidak ada kaca di jendela di kamar (tampaknya sangat aneh) kita bisa mendengar setiap percakapan di ruang makan. Keuntungan adalah bahwa hotel ini tidak pergi pukul 21:30 Kamar mandi adalah luas & mandi & tekanan besar tapi lantai miring aneh & jauh dari kita langsung di bawah shower yang sengaja kelonggarna untuk menurunkan anda. Anda harus sangat berhati-hati untuk tidak jatuh. Pencahayaan di kamar sangat miskin. Aku bahkan tidak bisa melihat ke dalam koper saya. Tirai tipis & membiarkan semua lampu di taman di malam hari. Nikmati tidur yang indah. Vila ini sangat bersih & memiliki 4 saluran tv satelit, pemutar dvd, tapi tidak. Kulkas kecil itu bagus tapi tidak ada…",3
22,Cempaka Belimbing Villas,"tempat yang bagus untuk membuat jalan di sekitar sawah yang menakjubkan. Hotel yang bagus, yang anda butuhkan untuk makan malam di karena tidak ada apa-apa di sekitar, tapi ini murah dan bagus. Ada berbagai macam pemandangan alam di sekeliling. Wi-fi adalah sangat sangat lambat, dan untuk membayar kami memiliki banyak masalah dengan kartu kredit kami. Akhirnya, panduan kami membayar secara tunai untuk kemudian membawanya kembali.",4
23,Cempaka Belimbing Villas,"Aku menyesal bahwa aku hanya punya satu malam di sini. Aku merasa seperti seorang putri, kamar-kamarnya benar-benar besar, seperti kamar mandi dan suasana yang sangat mengagumkan - sangat tenang dan damai (terlepas dari berisik tokayselalu pada langit-langit, hei ho). Dari area kolam renang anda memiliki indah pemandangan sawah yang menakjubkan. Di seberang jalan di bagian lain di kompleks terdapat gunung yang tempat yang luas. Kamar saya tepat di sebelah hutan sehingga aku bangun untuk orkestra burung lagu. Ini benar-benar adalah sepotong surga.",5
24,Cempaka Belimbing Villas,"Hotel ini adalah bagian dari saya 2 hari amazing petualangan wisata sepeda dengan bali hutan belantara dan sementara itu hanya satu malam, kamar aku tinggal di adalah luar biasa.   Sebagian besar fasilitasnya termasuk ekstra besar mandi, tekanan yang kuat, jendela besar dengan pemandangan ke arah hutan sebelah dan itu adalah tepat kelembutan.  Sarapan adalah menyenangkan (telur, bacon, roti panggang, selai, dll) dan yang mengejutkan adalah roti itu sebagai baik sebagai apapun di australia.   Hotel ini memiliki kolam renang besar dan spa untuk menikmati campuran makanan setelah hari hiking atau naik sepeda gunung.",4
25,Cempaka Belimbing Villas,"Cukup bagus untuk saya oleh beberapa tur dengan sepeda alam bali  Kamar dasar tapi sangat bersih dengan segala sesuatu yang anda akan perlu, menempel di starter dengan kualitas atas restoran makanan segar berkualitas dengan harga bagus Sangat direkomendasikan bagi siapapun yang ingin lokasi yang tenang yang bagus untuk menginap ",5
26,Cempaka Belimbing Villas,"Cempaka belimbing adalah tempat yang bagus untuk tinggal, ketika anda berada di Terpencil bagian dari bali. Restoran sangat baik; kolam renang menyegarkan, pemandangannya bagus. Kamar yang sangat nyaman.  Staf sangat ramah, dan membantu. Penting adalah wifi cukup baik. Ada tempat dekat oleh disebut mirip, ""kebun"", yang merupakan Juga cukup bagus, tapi saya memilih adalah, ""cempaka"", itu hanya tentang sempurna. Cheers nikmati.",5
27,Cempaka Belimbing Villas,"Kami tinggal di salah satu kamar yang menghadap lembah dengan pemandangan yang fantastis ke gunung batukaru. Mereka memiliki 4-poster tempat tidur yang nyaman dengan kelambu dan balkon anda sendiri. Kamar mandi adalah besar dan sebagian lagi di udara terbuka. Kamar-kamar ini tidak memiliki ac tetapi kipas angin di langit-langit. Ada wifi di kamar. Staf sangat ramah adalah manajer mr. membuat Sepel. Ada kamar baru dengan ac, tetapi saya tidak tinggal di sana lagi. Taman dan kolam renang indah dan saya akan merekomendasikan membuat berjalan kaki melalui desa dan sawah, anda tidak perlu panduan untuk 1 5 jam jalan kaki. Area ini memiliki tidak banyak berubah di masa lalu 10 tahun, yang ditambah besar. Anda melihat ""old"" bali di sini.",4
28,Cempaka Belimbing Villas,"Hotel ini benar-benar memiliki pemandangan indah di sawah lokal dan semuanya tampak mengagumkan. Makanan dan layanan ini juga besar. Biasanya sebuah hotel layak 5 stars di sini, tapi sayangnya itu ditempatkan untuk dekat dengan... Mana-Mana. jadi bagus untuk tetap pendek dan orang-orang yang ingin berada sendirian - lain tidak tinggal untuk panjang. Thats satu-satunya con.",4
29,Cempaka Belimbing Villas,"Lokasi sangat damai dan rimbun dan hijau. Cuaca indah, dingin di pagi dan sore hari, dan tidak lembab. Tidak ada banyak lalu lintas atau turis. Tidak ada pedagang asongan dan norak toko-toko. Saya merasa ini adalah nyata bali, alasan saya ingin holiday di bali, untuk alam, budaya, adat istiadat, makanan dan orang-orang. Stafnya selalu senang, ramah dan membantu. The tur sepeda adalah cara terbaik untuk melihat banyak hal di daerah ini, cara yang bagus untuk bertemu penduduk setempat dan melihat cara hidup mereka dan kesempatan foto yang baik. Saya juga menikmati berjalan tur yang diatur oleh sarah-jayne, ini adalah tur gratis untuk para tamu dari vila, anda dapat memilih berapa lama, dan apa yang anda ingin untuk melihat dan melakukan, anda juga dapat memilih untuk pergi sendiri…",5
