,hotel,review,stars
133,Grand Balisani Suites,"Properti lebih tua tapi refurbed dan dalam kondisi baik. Great lokasi di pantai, tetapi bagian terbaik dari kami tinggal adalah engkau, staf luar biasa. Keramahtamahan bali yang sesungguhnya dan akan menyambut kami untuk memastikan liburan kami sangat berkesan dan tak terlupakan. Tidak bisa mengatakan cukup tentang seberapa baik mereka semua.  Kami akan pasti tinggal di sini lagi",5
134,Grand Balisani Suites,"Stafnya ramah dan area kolam renang sangat bagus dan pijat sangat baik. Hotel ini tertanggal dan tidak ada wifi kecuali di lobi atau di area kolam renang dan lambat di terbaik kali. Bus antar-jemput yang kadang tidak sangat ramah dengan antar-jemput ke liburan pertama saya di makan di resort 10am membuat untuk sarapan di resor dan tidak antar-jemput ijtu retirn kembali ke resort? Staf kami bertemu yang mendorong penggunaan pengemudi yang akan memanfaatkan liburan anda dan akan biaya anda 5 - 10 menit untuk double super makan, layanan penyewaan skuter ke belakang hotel tetapi melengangkan di bahan bakar dan memberitahu anda untuk menemukan servo dan bahan bakar ini, setelah berdiskusi dengan mereka dan memberitahu mereka kami menemukan untuk menjadi uber-1/5 harga yang mereka…",2
135,Grand Balisani Suites,"Kami tinggal di grand balisani sebagai sebuah keluarga empat orang dewasa, setelah beberapa resor lainnya di bali. Kami sangat kecewa dengan apa yang ditawarkan sanggraloka. Kami memahami bahwa anda membayar untuk apa yang anda dapatkan, tapi di hotel ini kami memesan hampir tidak apa-apa. Semua resor di sini sebelumnya untuk harga yang sama, tapi kami diharapkan untuk membayar $16 untuk sarapan kami di kepala, penyakit ini lebih banyak pilihan untuk makan siang, dan makan malam. Kami sangat kecewa dengan pandangan yang indah, dan ada hanya satu bar di seluruh sanggraloka - di kolam renang yang adalah terselam? Tidak ideal jika anda tidak di kolam renang pada waktu itu. Kita tidak bisa kesalahan staf untuk bersikap ramah tetapi tidak, mereka semua orang-orang yang indah - hanya…",2
136,Grand Balisani Suites,"Tempat yang bagus untuk liburan santai. Dibangun bergaya bali, tidak terlalu jauh dari kuta dan seminyak, daerah di bali yang sibuk. Meskipun hotel ini sedikit kuno dalam arti bahwa mereka masih memiliki sinar katoda tv tapi kita tidak benar-benar punya waktu atau kecenderungan untuk menonton tv :) . Makanannya luar biasa dan sangat baik harga. Sama berlaku untuk spa. Aku akan pasti tinggal di sini lagi di liburan saya berikutnya di bali",4
137,Grand Balisani Suites,"Kami telah seperti waktu yang bagus di sini yang kita benar-benar merindukan itu setelah bergerak sepanjang perjalanan kami! Staf sangat ramah dan tidak bisa melakukan cukup bagi anda. Makanan di kolam renang bar, koktail dan musik besar, suasana santai. Pilihan yang baik untuk sarapan. Spa juga bagus, harga wajar - kami punya pijat bali. Hanya kejatuhan adalah bahwa wifi tidak bekerja di kamar. Tapi selain bahwa kami memiliki pengalaman tinggal yang menyenangkan. ",4
138,Grand Balisani Suites,"Kamar-kamarnya sangat besar dan membutuhkan renovasi serius.  Tidak ada wifi di kamar kecuali anda membayar untuk itu. Ini adalah kecil tv lama tabung sinar katoda jenis dengan kekelir taferil.   Semua handuk tua dan usang, tidak putih tetapi abu-abu besar, meskipun melihat kembali di tempat tidur.  Tidak ada layanan kamar setelah 11pm bahkan menawarkan dari sandwich.  Di sisi positifnya staf sangat ramah dan membantu. Penyejuk bekerja.  Dan ada sebuah kafe seberang hotel.  Aku punya makanan yang buruk pada harga, tapi aku sudah tinggal di bali untuk setengah harga yang termasuk wifi dan hotel yang lebih baik.  Tempat ini mungkin yang telah ada 20 tahun yang lalu tapi sekarang hari adalah benar-benar mahal. ",2
139,Grand Balisani Suites,Suami saya dan saya mengunjungi di november 2014. Sebuah tempat yang luar biasa. Semua staf yang indah dan sangat membantu. Akomodasi ini adalah suasananya. Aku tidak bisa menilai tempat ini cukup tinggi. Kami memesan untuk kembali bulan november tahun ini tetapi harus berubah karena abu awan. Yang begitu malu karena kita benar-benar mencintai tempat ini. Makanan yang sangat baik dan harga terjangkau. Kolam renang sisi layanan penuh. ,5
140,Grand Balisani Suites,"Staf di sini adalah kredit untuk resor ini, mereka sangat membantu dan selalu tersenyum! Koktail yang menakjubkan dan happy hour adalah nilai untuk uang. Makanannya lezat, kolam itu bagus dan bersih setelah memperapikan musik di restoran setelah keduanya nilai yang besar untuk uang. Menjadi pertama kalinya kami di bali dan ini adalah tempat terbaik untuk memulai dan jauh dari kesibukan dan dengan staf yang sangat baik dalam memandu anda untuk hal-hal tertentu yang biayanya di dan sekitar seminyak. Kami memiliki pemandangan laut dan kota ini memiliki segala sesuatu yang anda butuhkan, kami memiliki malam yang terbaik tidur di tempat tidur mereka sangat nyaman! Pasti akan merekomendasikan dan kami akan kembali! ",5
141,Grand Balisani Suites,"Properti ini adalah sedikit di luar dari keramaian dan keriuhan yang kami menikmati. hotel ini terletak di sisi jalan yang tepat di pantai dan hanya 10 min jalan kaki di sepanjang pantai untuk kentang kepala restoran yang terkenal. Layanan yang sangat ramah, kamar luas, semuanya bersih. Kolam renang ukuran baik dengan berenang-up bar dan spa dan pijat tempat. Resor ini tampak sangat tua dari luar, tetapi itu adalah harus terlihat seperti ini. Ini mengingatkan kami di angkor wat di kamboja. Semuanya sangat modern dalam gaya khas bali. Minuman selamat datang, sarapan prasmanan dan beragam diskon voucher pijat sangat membantu. ini adalah hotel yang indah dan kami akan kembali. Pada catatan ini setelah membaca ulasan dan komentar bahwa ini adalah sebuah hotel tua dan besar,…",5
142,Grand Balisani Suites,"Kami mengunjungi pada bulan september dan itu indah dan tenang di sini. Kamar yang indah dan dekorasi. Staf yang sangat ramah. Sarapan prasmanan adalah baik-baik saja, kolam renang baik juga. Tidak banyak pantai, tapi ada sebuah bar pantai yang benar-benar tepat di luar resort untuk bersantai di sementara menonton matahari terbenam. Secara keseluruhan, senang dengan resor ini.",4
143,Grand Balisani Suites,Pertama-tama hotel ini indah dan sangat ramah dan ramah. Ini adalah pertama kalinya saya menginap di seminyak dan aku menikmati menjauh dari sibuk ligas di sebuah tempat peristirahatan yang tenang untuk istirahat setelah hari yang sibuk belanja sekaligus dekat dengan berbagai gerai perbelanjaan utama!  Aku punya kamar seaview 4th memapani - layak uang tambahan untuk menikmati matahari terbenam yang indah setiap hari dan bersantai di balkon dengan bintang dingin atau dua. Kamarnya sangat bagus dan semua fasilitas bekerja dengan baik.  Sarapan adalah yang terburuk yang pernah saya telah di bali - itu adalah pengalaman yang sangat miskin standar dan itu dingin setiap hari - merasa seperti meminta microwave! Dan memperhatikan tamu lainnya adalah bentuk memerintahkangaris di restoran…,4
144,Grand Balisani Suites,Besar tepi pantai properti. Kamar yang besar. Tidak ada internet di kamar. Kamar dan bangunan yang tinggi dan agak besar. Staf memberikan pelayanan yang baik. Sarapan hampir tidak... Kami tinggal 2 malam dan kemudian pindah ke sebuah properti lebih bagus.,3
145,Grand Balisani Suites,"Hotel ini terletak di daerah yang tenang tepat di pantai. Di satu sisi, hal ini membuat peluang untuk memiliki anak kami dan dapatkan di pantai kapan pun anda inginkan. Di lain sisi, satu kebutuhan untuk pergi ke pusat kota dengan bus antar jemput (jam tertentu) atau dengan taksi. Butuh waktu sekitar 15 menit untuk pusat dengan semua kafe dan bar dan 25 - 30 min ke kuta. Hotel ini sangat besar dan dibangun dengan sedikit aneh labirynth maka akan ada beberapa cara untuk pergi ke kamar, misalnya.  Wilayah itu sendiri benar-benar indah, dengan kolam, ikan dan bunga di sekitar. Di kolam renang daerah adalah tempat yang indah, menghadap pantai dan laut. Makanan selalu sangat lezat: pilihan yang baik untuk sarapan, juga perkir yang bagus di kolam renang dan di waktu makan malam. Aku…",5
146,Grand Balisani Suites,"Kami tinggal satu malam di hotel yang bagus. Ini adalah sebuah hotel tua dengan merasa bali di kuil ini. Keuntungan adalah bahwa itu adalah di dekat pantai, hotel ini memiliki kolam renang yang bagus, cukup, sarapan yang luar biasa, hotel ini dekat dengan pusat seminyak dan bandara, matahari terbenam adalah luar biasa dan staf adalah luar biasa. Bagian yang tidak begitu baik adalah bahwa tempat ini adalah tempat kumuh. Ada jalan umum yang berdebu antara hotel dan pantai adalah bagus meskipun cukup sampah dan itu tidak seperti pasir keemasan di depan hotel seminyak. Detail kecil, tapi yang masuk dari apa yang ini adalah tentang adalah bahwa dek di sekitar kolam renang, pohon di sini dan di sana telah jatuh terpisah. Ketika kami datang di sini kondisi udara di kamar kami tidak…",3
147,Grand Balisani Suites,"jadi, ini adalah kunjungan kedua saya ke hotel ini dan aku benar-benar menikmati hotel dan staf yang indah. Namun saya hanya datang ke ruangan untuk menemukan banyak tempat kosong dengan handuk dan topi berkaparan di sini dan di sana! Ya itu benar jerman berada di sini! Sejak saat itu baik-baik saja bagi mereka untuk memiliki hanya 14 kursi untuk mereka? Ya ini adalah keluarga dari 7 dan rupanya itu hak mereka untuk memiliki kursi di tepi kolam renang yang teduh serta kursi yang menghadap pantai... Setelah diskusi panas dengan melihat anjing yang saya diberitahu bahwa ini adalah yang dilakukan di seluruh dunia, itu sangat disayangkan bahwa mereka bisa lolos dengan itu. Aku ingin melihat staf menghapus handuk, tapi aku tahu bahwa mereka tidak suka peramokan... Namun saya juga…",1
148,Grand Balisani Suites,"Ini harus menjadi tempat yang baik kembali pada hari, tetapi tampaknya sedikit diabaikan oleh pemilik. Kami tinggal di taman suite, yang merupakan ruangan yang unik dan tempat tipologi empat unit berbagi sebuah bangunan kecil. Hotel ini cukup banyak merasa seperti anda memiliki anda sendiri villa, kamar sangat besar, kamar mandi itu sendiri seukuran kamar hotel kecil dan mandi ukuran seluruh kamar mandi! Hotel dibangun di bak mudah merendamkannya dua. Suite itu indah dengan batu tradisional dan bahan kayu. Kami menghabiskan banyak waktu di tepi kolam kami dengan 4 tahun anak ada yang dangkal di mana dia bisa bermain. Keuntungan yang sebenarnya dari hotel ini adalah lokasi dekat pantai dan berjalan kaki ke beberapa restoran besar. Pilihan makanan di hotel ini hanya begitu-begitu.…",3
149,Grand Balisani Suites,"Ini adalah kedua kalinya saya menginap di sini. Semua dalam semua, ini adalah hotel yang bagus, staf yang baik dan makanan cukup baik, tapi sedikit membosankan setelah beberapa hari.  My beef terbesar saya adalah besar kecuali untuk wifi di lobi yang sangat nyaman untuk kebanyakan orang hari ini.  Hal ini tidak 5 bintang dan ada satu atau dua tempat untuk perbaikan tapi itu di tempat yang tenang yang bagus, jauh dari hiruk pikuk seminyak &.  Ini adalah tempat yang bagus untuk liburan keluarga, dan saya pasti akan menginap lagi untuk harga yang kami dibayar. Jika itu lebih mahal. Mungkin saya akan mencari di tempat lain.",4
150,Grand Balisani Suites,Hotel ini tepat di pantai di seminyak. Aku benar-benar menikmati masa menginap saya. Staf hotel ramah dan layanan yang sangat baik. Mudah untuk mendapatkan ke kota atau pantai kuta yang terkenal dan pusat perbelanjaan. Aku akan pasti kembali ke hotel ini ketika saya mengunjungi bali... segera.,4
151,Grand Balisani Suites,"Bali tradisional, dengan nuansa olde pesona dunia, kita tidak bisa kesalahan hotel ini dan pasti akan kembali, ketika kami liburan di pulau ajaib ini. Sarapan yang sangat baik, sangat air hangat untuk kolam renang, di depan hotel ini, plus kolam renang ukuran yang baik dan bar kolam renang dan bar/kafe bagus/dekat=makanan enak! ",5
152,Grand Balisani Suites,"Tinggal di sini selama tiga malam, kamar yang bersih staf sangat membantu mereka sangat kolam renang tepi pantai adalah begitu indah, makanan di restoran yang benar-benar indah berharap kita bisa tinggal lebih lama dengan beberapa pijat yang luar biasa. Kami pasti akan pergi ke sana lagi teman-teman saya bahwa kita bertemu di sana aku telah ada sebelum dan apa yang mereka memberitahu kami adalah benar-benar brilian.",5
153,Grand Balisani Suites,"Properti adalah sangat baik diambil perawatan dan staf sangat membantu dan ramah. Bagus dan luas kamar, restoran yang luar biasa dan minuman yang lezat! Hanya negatif akan menjadi tidak ada wifi di kamar - anda harus pergi ke lobi untuk mendapatkan wifi area.",3
154,Grand Balisani Suites,Kamar kami adalah benar-benar besar seperti kamar mandi. Itu bersih & sangat bagus. Mereka tidak selalu mengganti semua peralatan tapi kami tidak menemukan ini untuk menjadi yang terbaik. Staf di hotel ini sangat sangat ramah & tidak bisa melakukan cukup bagi kita. Kolam renang staf juga benar-benar indah & kami menikmati mengobrol dengan mereka di sekitar kolam renang & di bar area.,4
155,Grand Balisani Suites,"Tinggal selama 4 malam, memesan kamar standar. Kamar itu bersih, sangat baik, balkon kecil, dengan besar kamar, jadi tidak ada pemandangan, tapi aku bahagia dengan itu. Kamar mandi bersih, mandi, mandi, toilet, baskom dua gratis botol kecil air yang diberikan. Mungkin salah satu tempat paling nyaman tidur aku sudah di bali, sangat nyaman. Ruangan itu fantastis, kamar hanya terdiri atas setiap hari.  Aku punya masalah dengan beberapa ruang yang satu malam kamar, makanan lezat kita memaki-maki, membanting, musik keras, kasar dalam dan keluar kamar, membanting pintu, bir seluruh lorong dll dll. Ini memang pergi di sepanjang malam untuk 10pm 4am dari, jika aku punya cukup. jadi, saya sendiri yang berpakaian dan pergi ke meja resepsionis untuk meminta ruangan lain dan aku agak kecewa…",3
156,Grand Balisani Suites,"beberapa kali aku pergi ke hotel ini. Aku selalu suka kamarnya dan sekitarnya... tenang dan tenang, jauh dari berisik buzzling dan kota... pantai hanya di depan hotel. kamar mandi juga bagus... hotel ini memiliki nuansa tradisional bali. harga juga cocok untuk layanan. sarapan baik, dan salah satu yang aku suka yang paling, makan malam di taman terbuka... benar-benar romantis dan anda dapat bersantai dan menikmati musik live... seafood benar-benar baik... sehingga anda dapat memiliki waktu pribadi, tidak perlu untuk memiliki masalah kecil seperti hidangan laut di jimbaran.",4
157,Grand Balisani Suites,"Kami menginap di vila pribadi setelah kenanga 2. ini merupakan jaminan ""kamar"" di kompleks. Suite ini adalah sekitar 80 meter persegi sehingga luas adalah meremehkan. Kenanga 1 hingga 3 berada di lantai dasar yang baik karena ada tidak ada lift dalam kompleks ini. Staf adalah luar ramah, membantu dan ceria. Sebagian besar dari mereka mengerti bahasa inggris cukup baik, meskipun mereka tidak berbicara yang baik. Secara keseluruhan kami mampu mengerti satu sama lain. Akomodasi kami termasuk sarapan dan makan malam. Bagus, buah yang segar dan anda dapat memesan telur dadar yang membuat khusus untuk anda. Untuk makan malam anda juga dapat memesan a la carte di restoran hotel ini, atau anda dapat mengambil kesempatan bahwa hidup memperapikan masake di rumput di sebelah pantai/kolam…",5
158,Grand Balisani Suites,"Kami bepergian dengan putri kami berumur 19 bulan. Perjalanan yang sangat ambisius harus dilakukan dengan begitu kecil dan cukup yakin dia sakit di pesawat dan sakit fir yang paling menyenangkan. Stafnya mengagumkan, ramah dan membantu di sepanjang waktu, bahkan saat harus mengubah sepra di 3am karena si kecil sedang sakit.  Saya tidak ingat nama orang, tapi ben adalah tuan rumah yang hebat.   Kolam renang dan bar adalah di seberang jalan dari pantai dan memiliki suasana yang baik. Datang selalu tampak bahagia dan bersemangat untuk membantu. Area kolam bagus.  Ada kami sebuah bar pantai tepat di luar properti yang benar-benar keren juga. Layanan antar-jemput gratis ke kota, yang membantu.  Kamar saya luas, bersih, rapi dan baik.  Pasti akan tinggal lagi jika perjalanan kami…",5
159,Grand Balisani Suites,"Hotel yang luar biasa di gaya Balianese asli tepat di tepi pantai, beach front suite adalah luar biasa dan staf yang ramah. Berlokasi dekat dengan tepi pantai dan kentang kepala besar bar dengan dj pada hari minggu malam.",4
160,Grand Balisani Suites,"Grand balisani adalah indah tradisional bali, sebagian orang akan mengatakan sedikit lelah tapi aku suka gaya dan tradisi tua. hotel ini, Taman ini indah, staf sangat ramah, bahagia dan membantu. Hotel ini bersih dan sangat terawat dengan baik dan selalu ada keamanan di pintu masuk untuk memeriksa mobil ketika mereka datang. Kamar kami adalah baik-baik saja, dengan kamar mandi yang besar, tempat tidur yang nyaman dan tenang dan balkon pribadi dengan pemandangan laut langsung. Kamar sedikit lebih tua dan tidak membuat es, tetapi tidak benar-benar keluhan. Kami menggunakan layanan kamar beberapa kali, makanan panas dan menyenangkan dan ini disampaikan sangat cepat setiap kali. Area kolam renang indah dengan bar kolam renang, selalu minuman dingin dan koktail. Kolam renang adalah…",4
161,Grand Balisani Suites,"Setelah menghabiskan 5 malam di hotel yang brilian, yang menghadap non-pantai, kami pindah ke properti ini karena itu adalah sebelah pantai. Desain hotel ini sangat bagus dan anda bisa mendapatkan dengan 'bali' itu. Anda percaya anda akan memiliki liburan yang luar biasa. Tapi itu hanya berakhir.  Kantor depan staf - dua wanita pada khususnya, adalah benar-benar semua orang di daerah bali, dengan tidak ada waktu klecem, welcomeness, atau geleser. Seperti pengalaman buruk apa menonjol terutama di tempat di mana semua orang tersenyum dan menyambut tapi tidak di hotel ini.   Wifi tidak bekerja di kamar. Wifi di lobi sangat lamban. Mengerikan mencicipi koktail. Restoran menolak untuk mengubah koktail. Tv di ruang adalah tv kotak kuno. Travel lodge di usia ini, esp setelah properti…",2
162,Grand Balisani Suites,pertama positif: taman yang megah tempat tidur dan bantal yang nyaman kolam renang indah dan pemandangan ke laut great lokasi dekat ke restoran terbaik di daerah la laguna beberapa staf yang menyenangkan - selain itu rita dan sri  sekarang negatif: wifi sangat buruk menu agak kumuh tidak menggantikan melangiri atau sabun setiap hari tidak selamat datang atau biasa-biasa saja makanan saat check-in pernah menyinggung gendeman musik keras dan di kolam renang-tetapi sendirikatakan ataupun saat meminta  ,3
163,Grand Balisani Suites,Grand balisani hotel adalah tempat yang sangat kecil. Sempurna jika anda ingin menjadi jauh dari hiruk-pikuk keramaian dan kesibukan dan tidak mencari hotel bintang lima menyingkiri taksi jika anda ingin pergi ke pusat seminyak. Berjalan kaki melalui pantai. Belajar bahwa cara yang sulit setelah 30 menit naik taksi. Mojitos adalah membungai. Kamar baik-baik saja tapi sedikit tertanggal. Staf adalah menakjubkan.,3
164,Grand Balisani Suites,sangat baik hotel kecil tapi sangat bersih kolam renang dengan layanan makanan dan minuman  sangat bersih kamar dan itu adalah sanggraloka bintang 4 yang solid. Tidak mengharapkan mereka untuk berbeda dompet dll tidak akan bekerja   Hal pertama yang datang ke pikiran saya tentang hotel ini adalah luar biasa santapan di pantai publik di depan resor ini  Itu luar biasa untuk mengambil foto tapi mungkin berbahaya untuk anak-anak atau menunjukkan kepada kita ,4
165,Grand Balisani Suites,"Ini adalah hotel yang indah, tepat di pantai dengan kolam renang indah. Kamar luas, baik dilengkapi dan staf benar-benar ramah. Makanan yang disajikan di sini juga cukup bagus.   Udara con adalah agak miskin di kamar dan itu cukup panas sehingga makna yang bisa lakukan dengan diperbarui. ",4
166,Grand Balisani Suites,"Tempat ini telah di sini sejak aku masih 9 bulan dan saya masih mimpi dari akan kembali! Aku pergi dengan ibuku untuk 7 hari dan bisa tinggal lebih lama. Melihat banyak ibu dan putri kami australia! Bali adalah tempat yang murah untuk australia yang datang dari inggris dan kami adalah satu-satunya orang di sana selama keluar menginap di inggris. Aku mencintai fakta tidak ada seluruh dinding hotel dan kompleks yang besar! Tentu saja ini berjalan keluar dari hotel pada malam hari - BAHAYA! Untuk bagur lihatlihat gratis yang tidak punya dan tidak ada jalan pencahayaan memperkurus ditambalnya di trek. (dan semua sudah terlanjur!) Tapi tempat ini benar-benar membuat pengalaman menginap kami dan indonesia adalah yang paling ramah, paling bahagia dan paling membantu orang-orang di…",5
167,Grand Balisani Suites,"Ini akan menjadi sangat panjang tapi di sini pergi...  Tinggal di sebuah villa di arena kamar 140 (agung) untuk 8 hari 7 malam. - Karena saya rasa kamar terbaik. Menakjubkan, pemandangan laut dari villa. Anda bangun setiap hari untuk pemandangan dan suara debur ombak. Menakjubkan!  - Kamar bersih, kami mengharapkan yang lebih baik dari furnitur kayu namun tidak ada sama sekali. Kamar mandi - mereka! Staff adalah aset tradisional merasa di tempat lain di villa, toilet memiliki modern merasa untuk itu. Bak mandi besar, datang untuk shower (rain shower, hanya), tidak ada ac, toilet memiliki canggih, fungsi (ini memiliki air jet di pantat anda, dengan teknologi serupa itu yang selalu saya cari saat aku di seoul atau jepang) mendapatkan ruang - bagus, kolam renang pribadi yang luas…",5
168,Grand Balisani Suites,"Kamar-kamarnya sangat 90-an. Tapi baik 90-an  Aku punya kamar besar untuk harga yang saya dibayar dan kamar mandi dengan bak mandi dan shower yang kuat Balkon adalah besar  Tv layar datar tetapi tidak benar-benar mahal jika anda berada di bali untuk bekerja, anda benar-benar tidak punya waktu untuk tv Lemari pakaian berukuran besar dan meja rias  Jika aku harus mengeluh tentang masa menginap saya akan bahwa sarapan itu tidak benar-benar hebat dan jarak dari kamar ke lobby tidak begitu besar seperti resort  Tidak banyak pilihan untuk layanan kamar tapi semua baik restoran hanya dengan berjalan kaki melalui pantai  Kolam renangnya juga sangat besar Internet cepat pemandangan dari balkon matahari terbenam yang bagus  tetapi kebanyakan dari semua staf sangat baik.",4
169,Grand Balisani Suites,Judul saya cukup banyak jumlah yang lebih senang tapi mari saya rumit. Ketika kami tiba di hotel ini dari saat kami digulungnya di taksi layanan dan staf yang luar biasa - sangat ramah di semua kali - selalu bertanya bagaimana kami/situs kami yang membuat kami merasa seperti teman-teman /. Hotel taman dan resepsionis sangat luar biasa! Kami merasa seperti selebriti di sekitar area kolam renang yang cukup nyaman namun tempat yang mengagumkan di dalam kolam renang dan langsung menghadap ke pantai dan laut. Pada saat kedatangan kami ditunjukkan ke kamar kami yang benar-benar indah - hotel ini sangat besar dengan daerah kantor/meja dan tempat tidur ganda yang besar. Kamar mandi adalah menakjubkan dengan besar bathtub dan shower cukup besar untuk tim sepak bola untuk masuk pada waktu…,4
170,Grand Balisani Suites,"Kami tinggal di hotel untuk 6 malam yang indah ini. Ya mereka tidak memesan hotel jauh dari seminyak pusat tapi itu max 20k dengan taksi. jadi, namun suasana alam yang indah dan damai. Staf adalah bermanfaat dan sangat baik lajat. Setiap malam mereka memiliki baik makanan dan aktivitas berbeda dan harga tidak sangat mahal di hotel. Kami sangat merekomendasikan tempat ini untuk orang yang mencari santai liburan di bali.",5
171,Grand Balisani Suites,"Staf yang ramah dan tamannya yang sangat rapi. Beberapa masalah dengan kamar - aman tidak bekerja, udara con adalah berisik, tempat tidur yang tidak berderit, kamar berbau funky. Nice kolam renang dengan berenang bar yang menghadap ke arah pantai, lokasi tidak buruk. ",3
172,Grand Balisani Suites,"Hotel ini cukup jauh dari setiap empat musim, tetapi itu adalah tepat di pantai dan memiliki kolam renang yang fantastis. Kami tinggal di sana selama tiga malam dan menghabiskan dua hari penuh di kolam renang - mereka memiliki berbagai pilihan kreatif koktail dengan 2 - jam happy hour di mana anda mendapatkan dua untuk satu. Itu sedikit luar biasa dibandingkan dengan beberapa pondok pantai tapi tidak ada banyak tempat di kota ini. Makanan yang disajikan di tepi kolam renang adalah lezat dan dengan banyak pilihan tapi oh saya, porsinya - mereka begitu kecil bahwa anda benar-benar harus memesan makanan lain. Aku belum pernah mengalami harus memesan tambahan kentang goreng dengan burger - sepatu tenis hanya ada 10 kepingankepingan keyek dengan hidangan asli.  Taman umum dan area…",3
173,Grand Balisani Suites,"Telah tinggal di sini yang mengagumkan. Kamarnya luas dengan fasilitas en-suite.  Kompleks ini tepat di pantai dan anda dapat berjalan kaki ke kepala kentang yang adalah sangat keren untuk malam besar keluar.  Staf adalah begitu indah dan ramah, restoran ke kolam renang ke laut yang indah. Sarapan yang disertakan adalah indah dengan buah segar, sereal, stasiun telur dadar yang segar dan menarik. Kami juga digunakan spa dan memiliki salah satu pijat terbaik yang pernah kami alami! Saya juga punya manikur tapi aku tidak menilai itu sebagai sangat bagus.  Kami tidak punya masalah dengan toilet di satu panggung ngalingin, tetapi selain itu luar biasa!",4
174,Grand Balisani Suites,"Sanggraloka bintang 5 yang ramah, cukup pribadi, namun cukup dekat untuk tindakan jika anda suka. Banyak hiburan di resor ini. Makanan, staf, kamar dan layanan yang sangat baik. Sangat direkomendasikan. Ini adalah kedua kalinya saya tinggal di sana dan akan tinggal di sana lagi di perjalanan berikutnya kami.",5
