,hotel,review,stars
0,Grand Balisani Suites,"Hotel ini hotel tua dan cukup besar, lokasi sangat strategis karena memiliki private beach. Pantai di batubeliq ini sangat indah. Kamar dan furniture sudah tua tp masih oke utk ditempati.  Tidak ada lift utk mencapai kamar di lantai atas.",3
1,Grand Balisani Suites,"Hotel tua tp memiliki private beach dan kolam renang yg cukup bagus.  Kamar kurang bersih dan tidak ada lift. Private beach nya bagus utk foto dan ada cafe yg cocok utk menunggu sunset.  Sarapan dgn menu yg cukup beragam tp kebersihan ruangan kurang,  ada semut di meja tempat juice. Pelayanan cukup baik,  lokasi hotel dekat dgn naughty nuri's seminyak",3
2,Grand Balisani Suites,"Berada disini selama 3 malam, lokasi bagus, bukan di area sibuk, artinya tempat tenang jauh dari area bising seperti kuta atau legian atau Seminyak, tapi tak jauh dari Seminyak yang populer dengan toko dan restorannya. Makanannya oke tapi aku sedih sebab 3 kali sarapan disana tidak ada ayam kecuali sosis ayam. Makanan saat sarapan tampaknya tidak berorientasi Asia. Kolam renangnya bagus tapi bar kolam renangnya sempit dan kotor atau kacau,tidak pada tempatnya khususnya instalasi kabel. Partnerku melakukan facial di spa dan katanya bagus. Kalau kau berorientasi pada pantai dan ingin menginap di hotel ini, kamar berpemandangan kolam renang dan pantai serta vila-vila pribadi punya pemandangan yang bagus. Hal bagus dari hotel ini adalah mereka punya bis antar jemput 5 kali sehari.",3
3,Grand Balisani Suites,"Kami 11 orang menginap disini tahun 2011 dan kami 6 orang pada bulan Juli 2012 dan kami benar-benar menyukainya, kamarnya selalu bersih dan besar, pertunjukan saat makan malam sangat menghibur, makanannya sangat menakjubkan dan murah, kolam renangnya bagus dengan area rumput yang luas untuk berjemur dan rileks, servis pijatannya memuaskan, sarapannya selalu terasa lezat dengan banyak pilihan untuk dicoba, Staffnya sangat ramah dan perhatian, untunglah mereka punya shuttle bus sehingga setelahnya anda hanya cukup naik taksi dan itu pun hanya berkisar beberapa dolar Australia, terletak di daerah yang cukup baik dan anda bisa berbelanja di Kuta dan Seminyak dengan segala keramaian yang ada lalu kembali ke resort untuk beristirahat.. Berjemur di pinggir kolam renang dengan melihat…",5
4,Grand Balisani Suites,"pengalaman sangat menyenangkan, pelayanannya ramah, lokasinya sangat bagus, hanya selangkah dari pantai yang indah, sangat cocok bagi saya yangg menginginkan private time. dan saya sangat dimanjakan dengan upgrade room yang lebih baik, sedikit kecewa karena kamar mandi perlu sedikit pperbaikan supaya tidak masuk serangga. but overall two thums up. sangat menantikan untuk kembali lagi.",4
5,Grand Balisani Suites,"Kami menginap 8 malam karena teman saya pergi ke hotel di Bali. Staf sangat ramah dan menyambut hotel terletak di ujung canggu Seminyak sementara ada beberapa toko di dekatnya tidak dalam jarak berjalan kaki ke pusat Seminyak utama tetapi hanya max 30, 000 IDR perjalanan. Hotel di pantai bagus jika Anda suka berenang di ombak. Banyak bersenang-senang. Hotel ini memiliki kolam resor besar yang bagus dengan bar berenang. Secara keseluruhan hotel yang bagus juga memiliki pusat bisinsss yang bagus untuk pencetakan darurat jika perlu.",5
6,Grand Balisani Suites,"Kami tinggal selama 9 malam yang indah di hotel yang indah ini terletak tepat di pantai. Kami memiliki ruang lantai dasar yang sangat besar & memiliki pemandangan taman. Tempat tidurnya tegas tapi nyaman. Semua staf sangat ramah. Terima kasih banyak untuk Sri, Rusty, Rita & Yo - yo. Apa aset Anda di hotel ini. Saya menyesal tidak dapat mengingat lebih banyak nama karena semua staf lebih dari membantu. Ada mini mart di ujung jalan dari hotel. Juga antar-jemput gratis ke Kuta yang beroperasi beberapa kali sehari. Anda harus memiliki uang tunai $ 100 untuk setoran saat Anda tiba. Mudah check-in & out, tidak ada masalah dengan tagihan. Pijat yang luar biasa juga",5
7,Grand Balisani Suites,"Hotel yang bagus dengan staf yang sangat ramah dan kooperatif. Sarapan sangat baik dengan berbagai pilihan. Menu makan siangnya enak. BBQ Diner di taman sangat bagus! Kamarnya bagus, kamar mandi bagus dengan bathtub dan shower.",4
8,Grand Balisani Suites,Menginap 4 malam dan kamar sangat bersih dan nyaman. Makanan itu tidak mengecewakan sangat bagus. Bagian terbaik dari tinggal di Balisani adalah menonton matahari terbenam. Luar biasa. Pemandangan laut dari area resor sangat spektakuler.,4
9,Grand Balisani Suites,"Kami memesan kamar deluxe laut yang sangat mahal jadi kami pikir kami akan mendapatkan sesuatu yang luar biasa. Kami sangat kecewa. Pemandangannya tidak jelas karena sebagian besar samudera tertutup oleh bangunan di depan. Ruangan itu sendiri sangat kecil beruntung menjadi 4 mx 4 m sama sekali tidak seperti foto yang ditampilkan di situs web mana pun. Lapangan, taman, dan kolam renang tampak luar biasa, tetapi pada akhirnya Anda masih tinggal di kotak sepatu begitu kehabisan panas untuk pergi ke kamar Anda. Itu memang memiliki balkon tetapi sekali lagi sangat sedikit. Mereka harus memberi tahu Anda bahwa Anda TIDAK dapat check-in hingga pukul 14:00 meskipun mereka memberi Anda pilihan jam berapa. Mereka membuat kami duduk di panas hari selama 2 jam meskipun kamar kami sudah siap…",2
10,Grand Balisani Suites,Mungkin resor besar 20 tahun yang lalu tetapi tampaknya nol dolar telah dihabiskan untuk itu selama bertahun-tahun. Kami tiba untuk tidak menyambut dan setelah kami menyeret bagasi kami ke atas tangga disambut oleh penerimaan yang kurang tertarik. Kami dibawa ke kamar standar yang berbau seperti urin. Untungnya kami mendapat upgrade ke setelan yang lebih baik namun dengan biaya tambahan $ 50 aus per malam dan masih memiliki bau yang funky dengan toilet yang rusak. Sarapan prasmanan terbatas dan sangat tua dengan potongan daging dingin tanpa pendingin selama berjam-jam. Anda tidak dapat berenang di pantai karena polusi dan robekan liar sehingga tidak begitu yakin apa daya tariknya. . . . . . Maaf,3
11,Grand Balisani Suites,"Pacar saya dan saya bersepeda, dengan sekelompok kolega Exodus, di seluruh Bali dan Jawa. Di akhir perjalanan, kami menginap 4 malam di Grand Balisani.  Itu adalah keputusan yang bagus - kompleks tepat di pantai, di sebelah bar yang ramai, sekolah selancar dll sehingga Anda dapat bergabung dengan orang banyak - atau menghabiskan hari di tepi kolam renang dan bar tenggelam ke dalamnya.  Kamarnya luas; tempat tidur besar (tempat kami terlihat 4 m 2!); berjalan - di kamar mandi ukuran kamar mandi kami kembali di London. Dan kami, sejauh yang kami tahu, kamar double standar.  Sulit dan agak tidak adil untuk memuji staf individu, karena mereka semua sopan, membantu dan penuh perhatian (kadang-kadang terlalu banyak - menanyakan apakah semuanya baik-baik saja ketika kita datang ke…",5
12,Grand Balisani Suites,"Lokasi sangat bagus, hotel tua namun terawat dengan gaya vintage, pantai di muka dengan kolam renang yang bagus. Kamar besar dan teras dengan pemandangan taman. Makanan enak dan suka kopi. . . Permata pada mahkota adalah staf dengan senyum, kebaikan, dan kebaikan mereka sepanjang waktu.",5
13,Grand Balisani Suites,"Kamarnya besar dan bersih. Makanan adalah layanan yang luar biasa. Kami menghabiskan 10 hari yang indah di sana. Pastikan untuk memasukkan sarapan dalam pemesanan, variasi dan kualitas yang luar biasa seperti presentasi dan layanan. Setiap pagi kami merasa seperti kami dihadiri oleh server pribadi kami sendiri.",5
14,Grand Balisani Suites,"Saya dan suami saya tinggal di Grand Balisani Suites selama 7 hari. Hotel itu sendiri tidak ada flash tetapi masih bagus dan bagus nilai untuk uang. Staf sangat penuh perhatian dan menyenangkan. Kolam itu ok. Lokasi sangat bagus, 15 menit berjalan kaki di sepanjang pantai akan membawa Anda ke deretan utama toko dan klub-klub populer.",4
15,Grand Balisani Suites,Saya tinggal di sana dengan pacar saya dan 2 teman kami yang lain. Staf sangat ramah dan membantu. Lokasinya sangat bagus sehingga kami bisa mencapai kemana-mana. Itu juga bersih. Kami memiliki pengalaman spa juga. Jadi kami benar-benar menikmati 2 hari.,5
16,Grand Balisani Suites,Kami telah tinggal di sini selama 12 malam di kamar deluxe dengan pemandangan taman dan kami bisa sangat merekomendasikan tempat ini! Tempat tidur yang nyaman Staf yang membantu Lokasi sempurna (dengan pantai benar di luar!) Makanan yang enak Area kolam renang yang indah SPA sangat bagus Silahkan lihat sendiri! : -),5
17,Grand Balisani Suites,"Saya tinggal di sana selama Natal, itu terutama ditempati oleh pasangan dan banyak peselancar Australia. Saya sangat menyukai area kolam renang. Sangat bersih dan damai. Ruangan itu sangat luas dan memiliki kamar mandi yang besar. Desainnya kurang modern tetapi lebih bergaya Bali, suite dikelilingi oleh kolam taman kecil. Sarapan yang baik. Staf yang sangat ramah. Orang-orang Bali adalah yang terbaik! ! .",4
18,Grand Balisani Suites,"Digolongkan sebagai bintang 5 adalah overrating kotor. Memiliki 5 bintang pemandangan, 5 bintang kolam renang dan 5 bintang karyawan. Namun suite sekarang sangat membutuhkan perbaikan dan resor empat tingkat harus memiliki lift / s. Sarapan berulang setiap hari dan piring-piring secara teratur terkelupas. Tempatnya terpencil dan satu jam atau lebih dengan taksi atau pesawat ulang-alik ke dalam jalur belanja utama karena kemacetan sepeda, mobil, dan taksi di jalan-jalan sempit. Kami melakukan perjalanan setiap tahun dan dibandingkan dengan akomodasi bintang 5 di Ho Chi Minh, Hong Kong dan tempat-tempat lain di seluruh Asia, Balisani jatuh pendek dari 5 bintang, lebih seperti pembentukan bintang 3. Salam Dennis Davie",3
19,Grand Balisani Suites,"Kamar yang besar, taman yang rimbun, dengan bangunan bergaya Bali. Kami tidak dapat menemukan supir mereka menyuruh untuk transfer bandara dan untuk mendapatkan taksi. Mereka meminta pembayaran penuh pada check in, yang kami menolak. Mereka memanggil meminta pembayaran tambahan pertengahan menginap. Staf resepsionis, tapi pelayanan yang galak stafnya sangat luar biasa. Kolam renang dan area rumput yang bagus, tapi tidak cukup tempat duduk selama masa sibuk. Sama untuk sarapan.  Beberapa suara konstruksi tapi tidak terlalu buruk. Banyak daerah yang normal untuk di Bali, terutama yang berkembang seperti ini. Ada banyak yang kosong yang berbatasan besar kedua belah pihak, salah satu sedang mempersiapkan konstruksi. Jadi mata keluar jika pemesanan di sana atau dua tahun mendatang,…",3
20,Grand Balisani Suites,Kami menikmati menginap di sini saat itu hanya kami berdua tapi mungkin akan menjadi terlalu tenang dengan anak remaja kami. Sarapannya sangat enak. Banyak tempat makan di dekat hotel untuk makan siang dan makan malam. Kami berjalan ke Karmel Spa dan memiliki jam pijat setiap hari untuk $ 7 . 50 . Kamar yang bagus bergaya Bali yang lebih tua dan kamar mandi yang luas dengan kamar mandi yang penuh yang tepat. Kami menginap di 109 pada malam pertama tapi sangat berisik di sana sehingga mereka dengan senang hati kami dipindahkan ke kamar yang lebih tenang. Semua yang kami tidak ada adalah sebuah pembuka botol di kamar kami!,3
21,Grand Balisani Suites,"Kami telah menginap di vila dua kali dan sangat menyukai tempat ini, lokasi dan stafnya. Untuk sebuah villa tepat di pantai tidak ada perbandingan harga. Vila lain biaya 2 sampai 3 kali lebih. Ada ruang tambahan untuk tamu atau jika anda hanya ingin tempat dengan tambahan tisu toilet. 3 bisa menginap di sana karena ada yang kedua vila. hampir di luar.",5
22,Grand Balisani Suites,Hotel ini sangat khas bali dan kamar-kamarnya memiliki ukuran yang baik. Kami tidak meminta untuk 2 kamar dan 2 remaja - kami tidak menyadari bahwa kamar twin bed sangat terbatas dan mereka harus berbagi tempat tidur ganda ( tidak ideal) . Sarapan prasmanan yang baik tetapi sangat mahal dan tidak makan malam yang bagus. Staf yang sangat membantu ketika kami memiliki masalah dengan akan ditipu dan dikirim pihak keamanan hotel dengan suami saya - mereka berhasil mendapatkan uang kami kembali. Pijat yang ditawarkan oleh hotel ini sangat bagus dan sang pramupijat sangat bagus.,4
23,Grand Balisani Suites,"Kami pikir kami akan pergi murah dan ceria minggu pertama kami. Tidak murah dan tidak menyenangkan. Linen yang buruk. Harus meminta untuk menghadapi secara konsisten kain. Lokasi yang bagus, tapi itu tentang hal itu. Setelah seminggu kami tidak sabar untuk pergi dan sekarang di super hotel bintang lima untuk tidak lebih. Tidak akan merekomendasikan. Sarapannya ok. Stafnya ok. Ok, tidak cukup baik untuk harganya.",2
24,Grand Balisani Suites,"Baik itu tidak bintang 5. . . mungkin hanya bintang 4 tapi mendorong lokasinya luar biasa. Pemandangan yang sama seperti yang mahal W Resort dengan sebagian kecil dari harga. Tidak hanya dengan tarif kamar. . Rasa dari minuman. di bar, makanan ringan di sisi kolam renang dan pijat, semua baik dan harga yang masuk akal. Ini adalah sebuah resor bergaya Bali lama dengan kamar-kamar yang besar yang bersih dan cukup lelah. Banyak kamar yang memiliki balkon dengan pemandangan laut. Seprai, handuk dan tempat tidur dapat melakukannya dengan mengganti. Sarapannya biasa saja, jadi jangan membayar lebih untuk itu. Stafnya cukup baik, terutama handuk yang luar biasa! pria Dia akan menemukan anda berjemur dan meletakkannya di mana anda ingin tidak peduli seberapa ramai tempatnya.  Alasan…",4
25,Grand Balisani Suites,"Saya benar-benar menikmati menginap di hotel ini, harganya sangat terjangkau dan memiliki kolam renang yang cantik, juga dekat ke pantai - Bonus! ! ! Kamar saya sangat luas & bersih, yang saya suka! Saya makan Pad Thai untuk makan malam yang sangat enak dan sangat murah! Saya tidak terlalu terkesan dengan pilihan sarapannya, jadi setelah pagi hari pertama saya pergi ke Botanik di jalan sebagai gantinya. Lokasi yang sangat bagus dengan sekolah selancar turun pantai & banyak restoran & bar di sekitarnya untuk malam hari jika anda memutuskan untuk bepergian ke luar hotel",5
26,Grand Balisani Suites,"Menginap selama 4 malam bersama keluarga. Lokasinya luar biasa, lemparan batu dari pantai. Kamar yang luas dan bersih, dengan kamar mandi yang besar dan balkon. Sarapan cukup bagus dengan campuran masakan lokal dan barat. Hotel ini juga menyelenggarakan sebuah makan malam di luar ruangan di akhir pekan dengan para seniman setempat. Hotel ini juga berdiri untuk arsitektur yang unik dan gaya. Satu-satunya ketidakpuasan yang dengan kualitas pendingin udara. Mereka benar-benar perlu meletakkan lebih baik di atau setidaknya memiliki kipas angin di kamar. Secara keseluruhan, pengalaman yang sangat baik.",4
27,Grand Balisani Suites,"Saya dan istri saya menginap di sana selama seminggu, tempat ini sangat bersih dan staf sangat bagus. . resepsionis Paulina sangat membantu dan mengatur semua dari tur kami. . Sarapan prasmanannya juga sangat baik dan mereka selalu kolam renang sangat bersih.",4
28,Grand Balisani Suites,"Saya menginap di Grand Balisani Suite untuk 3 malam dan saya memiliki waktu yang besar. Hotel ini adalah pilihan yang sangat bagus untuk orang-orang yang mencari tempat bersantai - suite yang menghadap ke taman internal, yang benar-benar indah - pohon, danau dengan barunya mengambil teratai. Anda akan terbangun oleh burung-burung di pagi hari penandatanganan :) kamarnya luas dengan kamar mandi yang besar, dan balkon. Satu-satunya kekurangan dari hotel ini adalah kamar perlu sedikit renovasi. Staf hotel sangat luar biasa. Dari hotel anda bisa pergi ke W hotel, Potato Head Beach dengan 10 menit berjalan kaki di pantai.",4
29,Grand Balisani Suites,Saya dan teman saya menginap di hotel ini selama 5 malam. Hotel ini sangat indah dan berada di tepi laut dengan akses mudah ke pantai. Staf di hotel sangat ramah dan membantu. Hotel ini terletak sedikit di luar pusat kota tapi Seminyak hotel menyediakan layanan antar jemput gratis ke Seminyak yang sangat membantu. Sangat disayangkan mereka tidak memiliki layanan yang kembali ke hotel tapi taksi sangat murah jadi kami kembali tidak keberatan terlalu banyak. Hotel ini memiliki kolam renang yang bagus dan kami pasti akan merekomendasikan menikmati minuman di bar. Satu-satunya yang mengecewakan dari hotel ini adalah koneksi internet di kamar hotel kami. Hotel ini sangat buruk dan berarti kami harus pergi ke resepsionis setiap kali kami ingin terhubung ke WiFi. Kamarnya bagus dan…,4
30,Grand Balisani Suites,"Hotel ini sangat usang dan perlu renovasi. Tidak ada suasana sekitar sama sekali, tidak ada apa-apa. tidak ada dekorasi bunga Kami menghabiskan waktu di banyak hotel di Bali semua sudah bagus, Bali terkenal untuk dekorasi hotel ini, mereka tidak mempunyai apa-apa.  Tempat tidurnya tidak memiliki selimut, bahkan yang yang tua seperti di dalam selimut 70 th. Sarapan hambar.  Tidak akan kembali dan tidak merekomendasikan hotel ini ke siapapun sebelum mereka telah direnovasi dan upgrade kamar, suasana.  Kami tidak menikmati pengalaman menginap kami di sini. Tempat ini seharusnya tidak lebih dari 2 bintang.",4
31,Grand Balisani Suites,"Ini adalah kunjungan kedua kami ke Grand Balisani dan saya senang untuk mengatakan bahwa kami memiliki pengalaman yang konsisten. Stafnya sangat ramah, tempat ini bersih dan matahari terbenam yang cemerlang.  Ini adalah salah satu hotel tertua di area ini namun yang juga apa yang memberikan daya tarik (merasa) Bali lama . Makanannya juga sangat enak dan tidak mahal.  Saya pribadi percaya bahwa anda akan mendapatkan kualitas yang sangat baik untuk uang di Balisani.",4
32,Grand Balisani Suites,"Tris adalah hotel terbaik yang pernah saya! Staf sangat membantu, anda dapat memiliki vieu yang indah dengan pantai dan matahari terbenam. Restoran yang luar biasa, everithing super teasty dan tidak mahal sama sekali! Untuk berbelanja anda memiliki pusat kota dalam waktu 15 menit dengan mobil, namun Kuta adalah 1 jam perjalanan karena lalu lintas jarm. Natalia & Mariano, Argentina.",4
33,Grand Balisani Suites,"Kami menginap di sini di sebuah kamar dengan pemandangan laut. Tidak ada lift tapi cukup muat sedang tidak masalah.  Sarapannya sangat bagus dan staf yang fantastis di semua area hotel. Mereka tidak bisa melakukan cukup bagi kami. Ini adalah harga yang sangat bagus untuk kualitas hotel.  Hotel ini berada di lokasi yang fantastis tepat di pantai Batu Belig tapi waspadalah tidak air jernih  , sangat dekat dengan banyak restoran dan warung pantai  wifi bisa ditingkatkan lagi, tapi mereka memberi kami modem untuk memperbaiki masalah kamar  -kamarnya sedikit usang, bahwa mereka tidak gaya modern tapi itu lebih seperti bali tua tradisional. Kamarnya bersih dengan pendingin udara yang bagus dan tv dan air hangat untuk mandi. Mereka juga disajikan dengan baik dan sangat luas,  kami…",5
34,Grand Balisani Suites,"Menginap untuk beberapa malam di bulan april, hotel ini di lokasi yang bagus, di depan pantai dengan kolam renang yang indah. hotel ini memiliki semua fasilitas dan bersih dan nyaman. Kamarnya besar dan luas . tapi hotel ini agak tua dan usang. mereka nampaknya memperbarui beberapa vila dan saya telah mendengar ulasan yang sangat-tapi tidak tersedia di waktu kami. wifi yang buruk di sekitar hotel dan tidak bekerja di restoran ketika saya mencoba untuk email untuk bekerja.",3
35,Grand Balisani Suites,"Hotel itu sendiri adalah baik, kami memiliki kamar suite taman yang sangat bagus bergaya Bali dan dekat dengan kolam renang. Kamar besar dan bersih.  Kolam renangnya bagus, layak minuman. Pelayan kami sedikit kurang informasi dari beberapa standar minuman lain (bir, koktail minggu) karena jika mereka tidak pernah memesan seperti ketika saya mencoba untuk memesan wiski di bebatuan.  Pantai adalah di seberang jalan dari hotel adalah taman/kolam renang yang berguna dan ombak yang ramah cocok hanya untuk membuat peselancar tapi pantai yang menyenangkan tidak kurang.  Makanan yang lezat di pantai Shack (1 di masing-masing ujung dari pantai tepat di luar hotel, sangat menyarankan mencoba di sana).   Kekurangan terbesar hotel ini adalah bahwa itu terletak di ujung jalan yang sibuk yang…",3
36,Grand Balisani Suites,Lokasi adalah besar tepat di pantai. Namun ini adalah hanya untuk melihat pantai dan surfing tetapi tidak untuk berenang. Hotel Taman yang indah namun kamar perlu renovasi. Handuk tampak terlalu tua! Sarapan sangat bagus di Spa. Dgn mengingat harga sangat bagus,3
37,Grand Balisani Suites,Kamar yang indah dan mebel bergaya Bali. Hotel dekat ke pertokoan yang kehidupan malam.  Matahari terbenam yang paling indah. Sarapan yang baik tetapi mereka dapat meningkatkan. Tidak sampai ke standar seperti hotel lain. Staf yang ramah. Kolam renang dengan Sunken Bar sangat bagus setelah hari yang panjang. ,4
38,Grand Balisani Suites,"Kamar yang bersih dan nyaman, staf hotel yang sangat ramah dan bersemangat untuk menyenangkan. Makanan di hotel yang sangat baik, mencoba Sandwich di malam hari di tepi kolam renang dengan koktail untuk mencuci itu turun.  Terletak di sebelah pantai dengan banyak kesempatan foto matahari terbenam yang menakjubkan.",5
39,Grand Balisani Suites,Memesan di untuk pijat dan manikur. Mereka membuat Anda membayar sebelum dan aku mengerti mengapa setelah perawatan.   Saya meminta bahwa sedikit tekanan dan wanita mereka melanjutkan untuk memaksa karena keras dan sempit mungkin karena terbatas. Saya harus meminta dia untuk bersantai sedikit. Saya pergi dengan memar di hari berikutnya.    Hal ini diikuti oleh sebuah usaha untuk melakukan manikur dalam gelap dengan hanya lampu sebagai penerangan. Di nailpolish semua tua dan berlumpur dan pergi di itu. Saya meminta untuk dihapus dan berwarna jernih kembali. Butuh 3 orang untuk menyelesaikan manikur. Di nailpolish mulai mengelupas off hari berikutnya.   Pengalaman spa terburuk di semua kunjungan saya ke Bali. Saya sedikit pemeliharaan dari salon di Jl. Balu Belig (yang biaya 1/2…,2
40,Grand Balisani Suites,"Kami tinggal di hotel ini dua kali, pertama kalinya 5 malam dan kedua kalinya hanya satu di antara perjalanan. Kami dengan tiga dari kami untuk tinggal lebih lama dan kami kamar yang bersih dan luas dengan balkon dan tempat tidur ekstra. Kamar mandi yang baik dan semuanya berfungsi, yang tidak selalu jelas di Indonesia. Wifi sangat buruk karena kamar kami terletak di belakang hotel. Namun, kami mendapat wifi router dan setelah itu baik. Kedua kalinya kami mendapat kamar yang lebih kecil dan hanya baik untuk satu malam menginap. Kolam renang cukup besar dan koktail disajikan di bar kolam renang yang bagus. Pantai adalah hanya seberang jalan yang kecil dan sangat bagus untuk berjalan di pagi hari. Sarapan yang baik, tetapi makan malam rata-rata. Hotel ini masih nyaman untuk makan…",4
41,Grand Balisani Suites,Hal pertama yang Anda lihat saat memeriksa - di lautan luas menyambut Anda di resor indah ini. Hotel ini terletak di sudut yang nyaman jauh dari keramaian dan kegilaan kehidupan kota. Harga sangat wajar dan keramahan staf duanya. Kami pasti akan merekomendasikan resor ini untuk wisatawan yang mencari liburan yang tenang dan damai.,5
42,Grand Balisani Suites,"Kami menghabiskan 2 minggu santai di kolam renang, menonton laut tidur di pantai, makan, minum, membaca, tidur. Semua di lokasi yang luar biasa dan tentram. Staf yang indah, lingkungan yang indah, luar biasa nilai untuk uang. Tidak bisa mengatakan cukup tentang bagaimana indah tempat ini!",5
43,Grand Balisani Suites,"Kami tiba di Grand Balisani Suites dan disambut sangat hangat. Kamar kami adalah persis apa yang kita telah meminta untuk. Hotel sempurna terletak di pantai dan ke kanan sekitar setengah km adalah klub Pantai Finns dan 1/2 km ke kiri yang adalah Potato Head Beach Club dengan banyak bar dan restoran yang terletak di tepi pantai.   Perjalanan taksi ke Seminyak Square akan biaya sekitar 20000 - 30000 yang baik. Hotel ini memiliki fasilitas yang bagus, baik kolam renang dan spa yang bagus dan seperti yang saya katakan terletak strategis di pantai jadi jika Anda seperti saya yang lebih suka laut dan kolam renang yang Anda dapat pergi berenang dan bersenang-senang di ombak yang besar. Layanan di hotel sangat baik dan ada sangat sedikit keluhan dari kami.   Ada beberapa hal kecil yang…",4
44,Grand Balisani Suites,Properti indah tetapi jauh dari pusat kota Seminyak. Angkutan gratis terbatas. Sarapan yang luar biasa! Kamar yang sangat bagus dengan merasa lelah. kamar mandi adalah kecil. Ada loker dan minibar. Kolam renang besar dengan berenang up bar. Ada mini barbekyu prasmanan untuk makan malam setiap malam dengan hidangan laut yang segar! Dan live band setiap malam. Pantai adalah tepat di seberang jalan kecil. Indah!,5
45,Grand Balisani Suites,"Hotel ini bergaya Bali tradisional.  Kamar kami adalah besar, dengan tempat tidur yang nyaman yang menghadap ke taman, itu sangat menyenangkan untuk bangun di pagi hari untuk suara air mancur di kolam ikan koi.  Hotel ini sangat tua, kami punya masalah dengan kamar yang aman setelah beberapa hari tapi itu adalah dengan cepat oleh manajer.  Kolam renangnya bagus tetapi sedikit di sisi kecil tetapi jika Anda tidak ingin menjejalkan di sekitar kolam renang di sana adalah banyak ruang di taman untuk berbaring di kursi.  Staf yang sangat ramah, ramah, menyenangkan dan sangat efisien tim rumah tangga. Petugas keamanan di semua pintu gerbang.  Sarapan sangat memuaskan, pijat gratis di spa adalah luar biasa.  Kami berjalan di pantai setiap hari yang mendapat sangat sibuk di sore hari…",4
46,Grand Balisani Suites,"Kedua waktu tinggal di sini dan akan terus juga. Layanan besar, kamar bagus dan bersih dan properti sangat indah terutama di sekitar kolam renang. Hanya kekurangannya adalah WiFi tidak di kamar dan harus pergi ke lobi atau kolam renang.",5
