,hotel,review,stars
175,Grand Balisani Suites,"Kami tinggal di hotel untuk 5 malam grand balisani. Membaca banyak ulasan di sini dengan harapan tinggi dan ulasan yang tepat memutusnya. Ini adalah ulasan kami.   Staf Semua staf yang sangat ramah dan membantu di sepanjang waktu. Kami memiliki beberapa semut di kamar kami tapi itu tidak larem saya. Saat iizards atau makhluk kecil mati mereka kadang-kadang membiusi disemutin. Aku menelepon layanan kamar dan 5 menit seseorang datang di, memeriksa keluar benar-benar berteriak pada satu sama lain. Tidak ada tempat untuk sisa perjalanan. Juga, itu adalah pacar saya ulang tahun pada hari ketiga dan saya meminta kue kejutan untuk diatur. Mereka adalah fantastis. Kami punya meja yang indah diatur untuk kami khusus selama sarapan dan mereka membuatnya terkejut setengah jalan selama…",4
176,Grand Balisani Suites,"Tinggal di sini selama 3 malam ketika kami pertama kali tiba ke bali. Hotel ini indah dengan dekorasi bali, ini membuat anda merasa bahwa anda tidak sejumlah pabrik di bali dan gaya hotel yang semua terlihat sama. Hotel ini memiliki taman yang indah dengan kolam yang dipenuhi air bunga lili dan ikan koi dan banyak tanaman hijau. Hotel ini terletak tepat di pantai dan memiliki kolam renang yang bagus untuk sore malas. Layanannya luar biasa dan semua orang begitu manis dan halo.  Tips dan hal-hal untuk memeka: Kamar-kamarnya sangat sederhana tapi tempat tidur yang nyaman. Tempat ini didekorasi dengan sangat baik dengan kamar yang sebenarnya. Hotel ini bersih tapi menunjukkan tanda-tanda penuaan. Beberapa tempat tua di sini dan di sana. Sarapan daun banyak yang harus diinginkan.…",4
177,Grand Balisani Suites,"Kami menyukai penginapan itu merasa seperti kami merasakan budaya lokal. Grand balisani telah pilihan kita di seminyak untuk 5 perjalanan terakhir kami sudah ke bali. Mereka memiliki berbagai harga kamar, tapi favorit kami adalah salah satu dari 3 vila yang memiliki kolam renang kecil mereka sendiri dan juga dengan pemandangan laut. Staf mereka adalah luar biasa. Selalu mengantisipasi kebutuhan kita. jadi ramah dan membantu. Sarapan prasmanan adalah pilihan yang bagus dan makanan yang besar.",5
178,Grand Balisani Suites,"Kami tinggal di sini untuk 2 - hari konferensi yang terletak tepat di sebelahnya. Kamar standar dua tempat tidur kembar di juni 2015. Dibayar sesuatu seperti US $75 malam tanpa sarapan.  Aku akan echo sentimen orang lain tentang properti ini sejauh ini mengakui bahwa kami akan kembali ke properti ini. Wifi juga tidak konsisten di kamar (di pinggir kolam renang dan lobi yang baik) - tapi mudah-mudahan anda tidak di sebuah pulau resort untuk memeriksa email/Instagram pengalaman anda sepanjang waktu. Dengan itu dikatakan, berikut adalah beberapa alasan mengapa ini adalah lumayan keselumhan:  1. Kota ini terletak di pantai. Secara harfiah, anda berjalan keluar dari gerbang belakang, ikuti 5 langkah, dan anda berada di pasir.   2. Terdapat rockin ' iocal tentang bar pantai 20 meter…",5
179,Grand Balisani Suites,"Ini adalah indah, gaya lama resort di seminyak hanya di luar atau hiruk pikuk kuta dan legian. Kamarnya nyaman tapi lain kali aku akan membayar ekstra untuk meng-upgrade ke sebuah villa.  Stafnya luar biasa. Tidak ada terlalu banyak dan mereka sangat bersemangat tentang bali. Saya hanya kritik adalah sanggraloka ini sedikit mempergunjing di tempat dan kadang-kadang ada kurangnya perhatian terhadap detail seperti kamar mandi lebih tua dan menggaruk sehingga mereka tampak kotor. Secara keseluruhan pengalaman menginap yang luar biasa. Fasilitas yang baik, bersih dan cukup besar untuk melakukan dan melihat. Makanan dan minuman yang terjangkau dan mengunjungi spa merupakan tempat yang harus dikunjungi! ",4
180,Grand Balisani Suites,"Tinggal di sini selama tiga hari dan meskipun sedikit tanggal, tapi sangat lapang. Tempat tidur yang nyaman, staf yang ramah dan membantu. Sarapan prasmanan adalah standar dasar jebaka. Mereka telah disaring kopi sudah mengerikan! Tidak yakin apa yang mereka membuat mereka dari tapi rasa dan bau yang lucu. Dadar itu baik. Area kolam indah dan berada di ujung tenang kota rasanya tidak perlu banyak lalu lintas. Saya hanya penggenggaman akan bahwa untuk mendapatkan di mana saja dengan taksi adalah keluarga dari lokasi ini tapi saya rasa itu merupakan kaukorbankan untuk kembali. Menemukan bahwa berjalan sepanjang pantai dan itu adalah sangat cepat untuk mendapatkan ke tempat-tempat seperti w resort, kentang kepala dan ku de ta, bahkan hanya mengambil berjalan 20min sepanjang tepi…",4
181,Grand Balisani Suites,"Ini adalah hotel gaya lama.   Beberapa lokasi yang baik di pantai bagus, kami tinggal di suite taman yang sangat besar sarapan, makan malam yang luar biasa pada yang kita punya adalah bahwa kamar mandi bau lembab yang kita tidak dapat menyingkirkan saya. Kami akan merekomendasikan resor ini untuk orang lain, stafnya luar biasa dan tidak bisa melakukan cukup bagi kita ",4
182,Grand Balisani Suites,"Lokasi di pantai di ujung jl. Batubelig. Area kolam renang adalah besar, pantai di depan hotel tidak terlalu hebat, ideal untuk berolahraga di pagi hari. Telah ada beberapa kali, biasanya saya ambil kamar standar yang cukup baik tapi jangan berharap mewah. Sarapan adalah minimal yang diusulkan untuk harga. Saya biasanya tidak mengambil hotel ini dan memilih untuk pergi ke di batubelig Watercrest... Awas, ada juga 2, satu di legian & satu ini di batubelig, taksi kadang-kadang bingung...",4
183,Grand Balisani Suites,"Kami mengatur pesta pertunangan untuk teman-teman di hotel ini. Kami memiliki indah bunga dekorasi untuk menjadikan upacara pada waktu matahari terbenam memperdirikan di taman tepi pantai. Meja makan didirikan di taman di depan laut dengan live music (benar-benar baik dan ramah dan penyanyi!). Makan malam yang sangat istimewa dengan makanan bali yang benar-benar lezat dan baik-baik saja. Pribadi adalah benar-benar ramah, baik dan pro dan membuat seluruh malam seperti kami berada di rumah! Kami memiliki setelah bahwa tarian bali. Semuanya sempurna! Villa adalah indah kamar, sangat luas dengan kamar mandi yang besar! Kolam renang pribadi untuk terakhir minuman dengan teman-teman yang sempurna juga. Ini adalah menakjubkan dan tak terlupakan malam dan teman-teman kita hanya ingin…",5
184,Grand Balisani Suites,Kami memesan melalui pusat penerbangan. Kamar itu besar dan bersih. Orang-orang sangat ramah. Makanan yang baik dengan variasi terbatas. Aku benar-benar tinggal di sana sebagian besar wisatawan. Ada beberapa kekecewaan dan satu minuman selamat datang dan yang lain adalah keranjang buah. Minuman selamat datang adalah apa-apa tapi ramah dan disebut dengan keranjang buah hanya memiliki 3-4 buah piring kecil sedikit. Ketika kita membawa ini perhatian restoran palungan bertugas ia adalah sangat menyesal dan mencoba segala sesuatu yang mungkin untuk membuat benar dengan menawarkan beberapa bir dan staf lain sebagai gantinya.  Lokasi yang bagus dekat dengan pantai. Koneksi internet di kamar yang tidak bekerja. Tapi itu baik-baik saja di lobi. Anda dapat menghemat uang dengan tidak…,4
185,Grand Balisani Suites,itu benar-benar tenang ketika kami pergi tapi kami selalu menyambut dan gadis-gadis berusia 5 dan punya saya 3 mendapat perhatian pribadi terutama ketika mereka memiliki bali menari. Itu seolah-olah itu adalah pertunjukan hanya untuk kami (itu adalah sengap) akan membuat masa tinggal benar-benar menyenangkan. Ketika kami memeriksa itu bday anak saya sehingga mereka diatur sedikit kue coklat gratis. Pantai tidak boleh tebersih tapi thats baik-baik saja. Kolam renang adalah besar dan lokasi bijaksana sulit untuk berjalan di mana pun seperti tidak ada jalur jalan kaki tapi itu menyenangkan.,4
186,Grand Balisani Suites,"Kami tinggal padanya untuk bulan madu kami dan kami tidak kecewa! Kami tinggal di kamar 310, yang tidak memiliki seaview, namun restoran utama dan kolam renang tidak, dan anda bisa mendengar ombak dari balkon anda. Sarapan adalah campuran yang baik lokal dan barat yang lezat dan lezat. Kami juga makan siang dan makan malam di restoran, tapi ada tempat-tempat lain di sekitar, kami pergi ke nuri's Wareng Mozaic dan nakal, yang keduanya luar biasa. Anda tidak bisa berenang di laut di depan hotel benar-benar sebagai arus kuat, namun sebingkah kecuali ada kehidupan penjaga. Kami memiliki pasangan pijat di spa dan itu besar, baik nilai untuk uang. Hotel ini merupakan hotel bagus kesembunyian - indah lokasi dan staf yang luar biasa, terutama mengingat harga!",5
187,Grand Balisani Suites,"Kami hanya tinggal satu malam di grand balisani suites iaying tapi menikmati sore di kolam renang dan berjalan-jalan di pantai. Kami berjalan di jalan utama untuk mendapatkan makan malam dan meskipun jalan tidak ramah pejalan kaki, hanya berjalan kaki untuk restoran dan baik 10min menakjubkan pijat. Kami satu malam menginap berdasarkan yang saya pasti akan merekomendasikan hotel ini untuk orang-orang yang ingin mendapatkan sedikit jauh dari tempat wisata utama bali tetapi masih memiliki hal-hal itu dapat diakses!",4
188,Grand Balisani Suites,"Kami tinggal selama seminggu di sebuah villa kolam renang tepi pantai (agung - kamar 140). Villa kami adalah benar-benar indah dengan pemandangan langsung ke arah pantai, dengan kolam pribadi berkilauan, kita sendiri dek kursi, hari tempat tidur dan pondok kolam renang bergaya bali. Kamarnya luas dan berperabotan gaya tradisional. The king size bed adalah perusahaan dan nyaman. Kamar mandi itu besar dan indah. Ac sangat efektif, tetapi baik-baik saja dengan pilihan yang baik dari lokal ditambah beberapa saluran internasional. Ini adalah yang menawan hotel - taman cantik, kolam, kolam renang sanggraloka, area bersama dan area yang teduh. Jika anda ingin terlihat ramping, modern, generik hotel ini bukanlah tempat untuk anda. Jika anda ingin pengalaman yang lebih otentik, menawan…",5
189,Grand Balisani Suites,"Aku tidak tahu apa semua ulasan negatif tentang hotel ini, (mungkin hanya tinggi hati orang-orang yang ingin menginap di mega hotel dengan banyak orang lain). Kami memiliki waktu yang luar biasa di grand balisani suites! Saya suka fakta bahwa ini bukan sebuah mega resor, kecil dan tenang, hanya jauh cukup dari kuta tapi wifi dengan benar memperkuda untuk legian dan kuta jika anda inginkan).   Tidak pernah saya dapatkan setelah dicela di pantai. Hotel ini sangat bersih dan terus bersih, restoran sangat bersih dan bersih. Tidak pernah sekali pun kami sakit dari makanan. Mereka memiliki sarapan, makan siang, dan makan malam akomodasi. (Saya sarankan mendapatkan sarapan yang disertakan dengan kamar anda, kami tidak dan menyesalinya. Wifi bekerja baik bagi saya, di kolam renang dan…",5
190,Grand Balisani Suites,"Kami berada di bali untuk pernikahan, tinggal 2 minggu di total - kami tinggal di grand Balinsani untuk 5nights di awal liburan kami, kemudian kembali di terakhir beberapa waktu setelah 3nights di nusa lembongan. Dari saat kami tiba untuk saat ini kami meninggalkan, staf di grand balisani suites adalah luar biasa... tidak ada terlalu banyak masalah bagi mereka - ini berlaku untuk orang-orang di meja resepsionis, di bar apung (koktail besar!), taman besar, kolam renang besar samping, penjaga keamanan... orang-orang yang telah kami kenikmatan pertemuan yang sangat menyenangkan & ramah.   Pertama kami berada di suite taman 5nights (rm 233)... tepat di depan, jadi kami harus taman, kolam renang dan pemandangan laut - suite adalah indah, besar mandi, balkon (di kamar di lantai 2nd),…",5
191,Grand Balisani Suites,"Kamarnya luas dan semuanya bekerja dengan baik, air panas, toilet, ber-ac. Tempat tidur nyaman dan besar. Hotel itu sendiri, sangat bagus dari luar dan tidak ada lift, jadi jika tangga tidak hal anda, pastikan anda mendapatkan kamar di lantai dasar. Wifi hanya tersedia di area resepsi/tunggu, tapi ada ada kursi malas dan berbagai sangat baik. Kolam renang indah, meskipun, ada apa-apa yang ditambahkan ke pajak kaubeli ini bagus! Hotel ini terletak di tepi pantai, walaupun, itu benar-benar kotor keluar di pantai di depan hotel. Sedikit bar beberapa meter jauhnya dari hotel di tepi pantai cukup populer sebagai tempat untuk berkumpul di malam hari untuk menonton matahari terbenam. Saya tidak akan merekomendasikan tempat ini untuk anak-anak yang berjalan kaki sepanjang jalan tetapi…",4
192,Grand Balisani Suites,"Kami memiliki hanya kembali dari yang fantastis 6 hari di grand balisani suites. Ini adalah lokasi depan pantai yang sempurna hanya cukup jauh keluar dari kota untuk menikmati tenang tapi hanya $4 taksi naik kembali ke seminyak. Kamar yang indah. Tidak bisa berbicara lebih tinggi dari staf yang fantastis. Staf yang sangat penuh perhatian dan menahan kami yang berusia 3 tahun dengan banyak perhatian. Kami benar-benar menikmati kelas memasak, akan sangat merekomendasikan! Taman dan kolam renang daerah indah terus dengan kolam ikan dan banyak area untuk duduk dan menikmati lingkungan. Saya dan suami saya kedua memiliki pijat di hotel spa - juga sangat merekomendasikan! Kami akan menginap di grand balisani suites ketika kami kunjungi berikutnya. Jika dalam anggaran anda akan…",5
193,Grand Balisani Suites,"Tidak ada masalah dengan kamar kami, oh menunggu... kecuali toilet kadang-kadang dibutuhkan beberapa siraman... selain itu, ac bekerja dengan baik, tempat tidur nyaman, tidak ada masalah dengan seprai dan handuk, tv kecil tapi memadai dengan beberapa pilihan saluran inggris (dan pemutar dvd), aman di kamar, pencahayaan yang baik dan bahkan ada dua tempat untuk koper. Secara keseluruhan kamarnya berukuran bagus, tidak ada yang miring untuk bergerak di sekitar menandakan.   Kamar mandi, terlalu, sangat luas, dengan mandi besar dan terpisah mandi dan kesombongan cukup ruang untuk tempat perlengkapan mandi. Ada tidak ada apak bau. Saya biasanya menemukan pencahayaan sangat miskin di bali, tapi itu sedikit lebih baik di sini, tidak sempurna tapi memadai. Keran, air tekanan dan…",4
194,Grand Balisani Suites,"Kami tinggal di sini dua kali sekarang. Ini indah tua batu tradisional hotel yang berdiri tepat di tepi pantai. Bangunan, taman dan kolam adalah rapi (menyimpan beberapa roti dari sarapan untuk memberi makan ikan besar!), stafnya selalu ramah dan berbahasa inggris sangat baik, dan anda dapat menyewa mobil, moped atau ekskursi (untuk yang berani) dari sana juga. Sarapan prasmanan yang lezat dan berlimpah. Kamar sangat tenang, besar dan modern dan memiliki pemandangan yang bagus, udara con dan air panas bekerja (di bali! Kejutan!) dan ada wifi gratis dari lobi. Spa adalah luar biasa dan benar-benar murah, sangat merekomendasikan pijat thai dan semak belukar. Kolam renang kecil tapi baik dirancang meskipun anak-anak mungkin bosan sampai anda pergi keluar sering. Hotel yang bagus!…",4
195,Grand Balisani Suites,"Terletak dekat dengan w hotel dan potatohead, mengapa akan anda membayar $500US malam ketika anda bisa tinggal di hotel yang bagus ini, di pantai, bar kolam renang dan staf mengagumkan untuk sebagian kecil dari biaya...  Staf sangat membantu, ramah dan penuh perhatian. Mereka selalu ada untuk berbicara dan membuat upaya untuk mengingat nama anda.   Kolam renang adalah ukuran yang baik, sangat bersih dengan pemandangan laut dan berenang up bar kolam renang. Banyak matahari loungers.  Kamarnya besar, bersih dan memiliki kamar mandi besar yang indah juga. Kami juga menikmati balkon untuk beberapa bir sore hari.  Dapat merekomendasikan hari spa, perawatan yang sangat santai, terjangkau, dan fasilitas bersih.  Ada banyak restoran dan kafe di daerah ini atau anda dapat berjalan…",5
196,Grand Balisani Suites,"Baru pertama kali ke grande balisani. Setelah membaca ulasan saya pergi dengan pikiran terbuka.  Fantastis. Saya akan akan kembali.  Lokasi yang besar jika anda mencari bersih kolam renang yang menghadap ke pantai, berenang up bar sebagai bonus. Kamar sangat cukup, bersih dan nyaman. Mereka menawarkan antar-jemput gratis ke seminyak - legian-kuta di 10, 12 siang, 3, 8 dan 10, anda membuat anda sendiri cara kembali. Taksi dari rp 50-70, 000. Semua staf tertarik dan ramah. Mr Bill - tur sepeda yang tersedia untuk pasar, dan canggu beach adalah menyenangkan menyenangkan dan harga baik. Banyak tempat yang bagus untuk makan di dengan berjalan kaki seperti adalah mini mart.",4
197,Grand Balisani Suites,"Hotel ini adalah di lokasi yang sempurna, tepat di pantai dan tidak jauh dari kuta.  Saya akan tinggal disini lagi pastinya, mungkin bahkan membawa keluarga ke hotel. Semua layanan itu indah dan mereka mengijinkan kita untuk menggunakan semua fasilitas sementara kami menunggu untuk penerbangan kami terlambat keluar. Tersedia wifi di area makanan dan resepsionis jadi tidak ada masalah di sana. Kamar memadai dan memiliki ""bali"" terlihat, perabot yang indah dan tempat tidur adalah begitu nyaman.",4
198,Grand Balisani Suites,"Kami memiliki pengalaman hebat di grand balisani. Staf yang semua indah dan sangat membantu. Masih ada sedikit hambatan bahasa dengan beberapa tapi orang lain akan segera melangkah di dan membantu. Resor ini adalah tentang 30 tahun memiliki sangat bali klasik merasa ke tempat. Meskipun sedang direnovasi itu tidak mengganggu dengan kami tinggal di semua.  Semua menunggu staf yang besar dari sarapan prasmanan untuk restoran dan bar staf.  Salah satu orang kolam renang adalah sedikit terlalu berpikir dari handuk dan bertanya di mana kita dari hari sebelumnya. Rupanya kami harus tangan mereka kembali ke dia bukannya meninggalkan mereka di kamar, jadi setelah itu, kami kembali ke kamar kami basah. Kami menyarankan anda membeli murah handuk untuk menyelimuti diri di atau membawa anda…",4
199,Grand Balisani Suites,"Menginap di sini selama 3 malam pada liburan akhir pekan panjang. The resort, seperti yang dikatakan poster sebelumnya, adalah gaya lama yang saya lebih suka, jika saya ingin menginap di ultra modern beton blok apartemen saya akan liburan di ibu kota saya sendiri. Harga sangat baik dan termasuk sarapan, minuman selamat datang dan diskon di pijat bali. Kamar sangat nyaman dan bersih.  Resor itu sendiri adalah tidak dekat dengan banyak toko-toko dan bar dll tapi anda dapat berjalan kaki menuju pantai dan menemukan bar pantai sederhana yang matahari malam saja atau anda dapat berjalan menuju jalan dan menemukan beberapa baik kafe, mini market dan toko-toko. Taksi ke pusat seminyak biaya $3-4 aud dan ada antar-jemput gratis di set kali beberapa kali sehari yang kita dimanfaatkan…",4
200,Grand Balisani Suites,"Terutama karena ulasan buruk bahwa saya saya tidak menerima $100 bond kembali yang saya tidak terkesan dengan dan saya telah diemail 3 minggu yang lalu masih dengan tidak ada jawaban. Semuanya adalah pajak setelah itu jadi menambah dengan pesat juga jika anda memiliki sarapan prasmanan $17 dan beberapa gelas bir di malam hari mungkin juga berada di australia.    Tempat ini berada di lokasi yang bagus jika anda hanya ingin menginap di hotel sepanjang waktu atau bersantai di pantai. Pilihan lainnya adalah untuk menyewa skuter, atau itu taksi di mana-mana untuk 15 menit ke kota.  Hotel itu sendiri adalah sedikit usang hari ini, itu dan lama bali hotel yang baik-baik saja namun, kamar besar, kamar mandi besar dengan balkon dan semua staf ramah.",2
201,Grand Balisani Suites,"The balisani adalah sekolah tua hotel - dan sedikit lusuh. Saya membayangkan itu menakjubkan di siang hari. Hotel ini perlu beberapa perbaikan karena ini adalah sedikit lelah secara keseluruhan. Yang mengatakan itu memiliki prospek yang bagus dan tepat di pantai di lokasi yang baik. Kamar-kamarnya baik, bersih dan dihiasi di gaya tradisional. Para stafnya luar biasa: membantu, efisien dan ramah. Kolam renang yang sangat bagus, kecil tapi dengan suara menerjang ombak - tapi banyak kursi untuk memilih dari. Makanan adalah baik-baik saja, sarapan yang agak jarang dalam hal sarapan prasmanan dan minuman tidak seperti beberapa lebih mahal hotel kelas atas. Secara Keseluruhan. Saya senang saya menginap di grand balisani. Saya akan merekomendasikan hal ini untuk seseorang yang tidak…",3
202,Grand Balisani Suites,"Ini adalah perjalanan pertama kami ke bali kami dengan gadis berusia 8 bulan dan itu fantastis. Staf yang semua indah, menampung, membantu dan semua sangat mencintai putri kami seperti sedang mereka. Kami mencintai kami menginap di grand balisani suites, hotel ini benar-benar indah dengan pohon kamboja wangi di mana-mana. Hotel ini tenang dan tradisional dan jauh dari semua keramaian dan hiruk pikuk, yang adalah persis apa yang kami inginkan. Saya mencintai berenang up bar dan happy hour dari 5-7 pm. Saya pikir penutup band itu indah, mereka bahkan memainkan lagu brasil untuk kami setelah mereka belajar suami saya dari brasil. Saya benar-benar tidak dapat kesalahan apa-apa dengan hotel ini, kamar kami bersih, pendingin ruangannya dingin, sarapan prasmanan berlimpah dan steak…",5
203,Grand Balisani Suites,"Kami memesan villa pribadi di grand bali suite untuk lima malam di natal.  Kami berpengalaman pelancong bali dan kami ingin beberapa hari dekat ke restoran favorit kami dan bar. Kami telah melakukan yang menginap lama di sana sekali sebelum jadi kami tahu apa yang kami berada di untuk, tetapi kali ini upgrade ke suite pribadi. Alasan utama kami memilih ini adalah jadi kami bisa berjalan ke restoran favorit kami di seminyak dan itu adalah tepat di sebelah mosaic beach club, kami semua waktu favorit. Echo pantai juga hanya 30 menit berjalan ke pantai...  Resor ini pasti melebihi terbaik. Saya berharap ini adalah puncak adalah sekitar 30 tahun yang lalu. Kamar kami berada di jauh sudut, kamar mandi telah jelas telah baru-baru ini direnovasi dan cukup schmick. Kolam pribadi kami…",3
204,Grand Balisani Suites,"Akomodasi tepi pantai dengan kolam renang yang indah dan bar kolam renang. Dekat dengan beberapa bar besar (10 menit taksi). Garden suite kamar bersih, dan kamar mandi mewah, wow. Staf tidak mungkin lebih ramah dan membantu. Pasti akan datang kembali.",5
205,Grand Balisani Suites,"Untuk 4 malam untuk liburan dengan pacar saya, kami memiliki 2 pasangan lain (sekelompok teman-teman 6) tinggal di kamar sebelah kami. Pertama-tama harus mengatakan pintu masuk ke hotel adalah di jalan yang kotor, hanya off jalan utama. Hotel punggung ke beach, yang adalah bagus tapi pantai adalah kotor & memiliki orang-orang yang mencoba untuk menjual barang-barang untuk anda lebih dari pagar ketika mencoba untuk bersantai di kolam renang. Lokasi adalah keluar dari pusat seminyak, 5 menit berkendara ke toko-toko & restoran. Kami memiliki pemandangan laut kamar, yang kami pikir akan menghadap ke laut tapi itu kamar di lantai atas furtherest dari laut. Kami adalah ""ocean view"" atap & bangunan di hotel dengan horizon sebagai ""ocean"". Masuk hotel tampak grand, tapi kamar 406 berada…",3
206,Grand Balisani Suites,"Saya mengunjungi teman-teman yang di mana tinggal di grand balisani, dan menghabiskan jumlah yang baik waktu di sana. Staf kami sangat membantu dalam menemukan teman-teman saya. Mereka membuat ini di sana pergi ke hotel untuk 2 minggu tinggal di bali yang bagus karena saya tinggal agak dekat. saya terkejut oleh bagaimana kamar yang bagus untuk harga dan pantai depan lokasi tidak dapat dikalahkan. Ada kolam yang bagus dan rumput daerah dengan akses langsung ke laut. Kolam renang telah berenang up bar yang adalah cara yang bagus untuk menikmati sunset bintang. saya akan memesan keluarga saya menginap di sana untuk berkunjung lagi.",4
207,Grand Balisani Suites,"Kami menginap di grand balisani suites selama dua minggu baru-baru ini. Itu adalah pengalaman menginap yang sangat menyenangkan. Hotel ini memiliki baik kamar dan suite - dan kamar kami sangat luas dan sejuk. Hotel dengan desain dan interior memiliki pengaruh tradisional bali dan taman seluruh hotel adalah sangat terawat dengan baik, sebagai adalah area kolam renang. Manajemen dan staf yang sangat ramah dan membantu dan kamar sangat terawat dengan baik. Sarapan termasuk dalam tarif dan adalah campuran lokal dan barat pilihan. Itu sangat lezat dan pilihan yang bervariasi setiap beberapa hari.  Termasuk wifi dan seharusnya tersedia di kamar tapi sangat lemah atau tidak ada. Layanan wifi yang baik tersedia di lobby hotel. Lokasi hotel ini agak terisolasi tetapi adalah tepat di…",4
208,Grand Balisani Suites,"Seperti dengan kebanyakan bali hotel, staf di sini yang brilian: selalu membantu dan ramah. Itu mengatakan sesuatu karena saya menyatakan bahwa ada lebih dari beberapa tamu yang tampaknya meninggalkan perilaku mereka di rumah saya menyadari. Grand balisani suite adalah baik, bersih dan nyaman. Sarapan, yang termasuk dalam paket saya, sangat baik secara umum. Situasi hotel juga bagus untuk mereka yang mencari tenang liburan bali, ini adalah adil naik taksi dari daerah perbelanjaan utama, tapi hotel drop off-jemput adalah nyaman. Beberapa area kecil yang bisa dilakukan dengan perbaikan yang kecil. Grand balisani menggunakan campuran jus jeruk yang sama bahwa banyak tempat-tempat lain yang digunakan: tidak benar-benar benar-benar tidak, dan orange jus. Jika anda seorang peminum…",4
209,Grand Balisani Suites,"Saya baru-baru ini tinggal di sini dengan keluarga saya. Saya agak kecewa karena saya memesan 4 kamar dan hanya 2 dari mereka yang bersama-sama. Kamarnya bagus dan rapi. Staf hotel ramah. Kolam renangnya bagus, tetapi itu bisa sulit untuk mendapatkan sun lounge. Makanan adalah benar-benar bagus. Hotel ini agak tua tapi tidak ada kesalahan yang bersifat fatal. Hotel ini adalah tepat di pantai dan itu menakjubkan duduk di kolam yang menonton matahari terbenam di atas pantai.",4
