,hotel,review,stars
89,Grand Balisani Suites,"Kami mendapatkan kamar yang menghadap ke laut india. Untuk itu anda harus diletakkan di lantai 4th. Banyak langkah-langkah, dan tidak ada lift. Sarapan prasmanan adalah termasuk setiap pagi yang menghadap ke kolam renang. Hal yang paling kami sukai adalah berenang up bar dan tagihan minuman ke kamar kami. Suite di bawah ini terlihat seperti candi kecil dan bagus tapi tidak memiliki pemandangan laut. Suasana hotel dengan ikan koi, air dan terawat dengan baik taman tropis yang besar. Mereka memiliki bali penari beberapa malam dan bbq oleh kolam renang, yang tidak diiklankan, jadi kami tidak dapat untuk mengambil keuntungan dari itu. Staf adalah ramah dan membantu di mana-mana #1 di hotel dan restoran. Kami menikmati pengalaman kami memesan sebotol anggur dan duduk di tepi kolam…",4
90,Grand Balisani Suites,"Kami ingin menghabiskan hari di kota malam sebelum kami terbang keluar. Kali ini di ubud dan candidasa adalah pilihan yang baik. Kamar yang ukuran yang baik, tempat tidur yang besar dan nyaman. Ac adalah sedikit bising tapi s saya begitu lelah aku tidur juga. Makan malam yang fantastis - Tom yum goong dan pad thai. Enak dan harga terjangkau. Meskipun tempat ini adalah tempat yang besar ini memiliki banyak pesona. Ada banyak tempat untuk bersantai. Kolam renang sangat bagus. Staf yang luar biasa. Kami mampu untuk berenang dan makan sebelum penerbangan malam kami walaupun kami check out lebih awal. Juga bisa menyimpan koper kami di sini sementara kami menghabiskan hari menjelajahi seminyak. Hanya menarik kembali adalah bahwa wifi adalah tidak menentu. Kami akan pasti tinggal di…",4
91,Grand Balisani Suites,"Hotel ini terletak tepat di ujung Seminak. Jauh dari sebagian besar aktivitas di tempat lain di daerah. Kamar yang sangat bersih dan nyaman. Staf yang indah dan tampak sangat senang. Pantai pasir hitam pantai selancar yang baik dan tidak, tapi baik naik kuda. Ada sebuah bar di depan pantai itu banyak menyenangkan di matahari terbenam, musik yang bagus di malam hari dan sangat populer dengan penduduk sekitar, tapi tidak mengganggu dengan suasana hotel. Saran saya hanya untuk manajemen balisani adalah mereka untuk meningkatkan layanan wifi, itu adalah sangat lambat. Hotel ini adalah harga yang baik dan nilai yang baik.",4
92,Grand Balisani Suites,"Secara keseluruhan kami tinggal itu bagus, tapi tidak ada yang istimewa. Saya sedikit kecewa dengan kami menginap karena saya tidak merasa itu nilai yang sangat baik untuk uang. Seminyak sangat mahal dan ada jauh lebih baik tempat wisata dapat anda kunjungi di asia untuk mendapatkan nilai yang lebih baik.  Lobi masuk adalah luar biasa dan membuat kesan yang baik. Ruangan itu luas dan bersih. Staf yang ramah. Tinggal di kamar standar yang memiliki balkon yang luas dan pemandangan laut sedikit, yang adalah sangat bagus. Penolakan layanan disediakan setiap hari.   Makanan di restoran cukup baik, tapi tidak ada yang luar biasa. Campuran yang baik makanan barat dan makanan indonesia plus - sebagian besar makanan cukup berat. Koktail sangat baik, tidak terlalu mewah, sekitar 100…",3
93,Grand Balisani Suites,"Aku berada di sebuah taman suite, dan kamar deluxe dengan pemandangan laut. The garden suite adalah kamar yang besar, dengan kamar mandi hampir sebagai besar sebagai kamar tidur. Mungkin kamar mandi terbesar yang pernah saya lihat di sebuah hotel. Area terpisah dengan wastafel, toilet, kamar mandi, dan kamar mandi. Tapi tidak ada pemandangan - ada dinding di sekitar teras yang menghalangi pun kecuali di daerah teras. Sarapan prasmanan sangat baik. Makan siang dan makan malam yang besar di kota, terutama pilihan barat, tidak begitu bagus. Tapi harga yang baik untuk sebuah hotel mewah. Kami membawa sebotol anggur, tetapi mereka tidak membolehkan kami buka di manapun kecuali kamar kami tanpa 250 000 (tentang $20 as) tanpa biaya. Aku bisa mengerti di area makan, tapi ada besar…",4
94,Grand Balisani Suites,"Properti luar biasa, orang-orang yang fantastis, tidak bisa meminta lebih dari liburan saya di bali! Pasti ada yang selesai direnovasi baru-baru ini karena ada tidak ada yang rusak atau pudar tentang properti... itu indah dan semua!  Semuanya adalah sempurna. Jika anda berpikir anda akan mendapatkan sarapan prasmanan, pasti buku di muka... harga sangat, sangat tinggi jika anda akan membayar untuk itu setelah fakta. Tapi harga restoran untuk makan siang dan makan malam (bahkan layanan kamar) dan itu sangat terjangkau.  Semua orang yang bekerja di sana sangat baik, ramah, membantu, baik. Kamar pertama kami yang berisik dan bau jika rokok sehingga mereka pindah kami langsung keesokan harinya. Pria yang baik mengingat di mana kita ingin duduk dan mengatur kursi kami sebelum kami…",5
95,Grand Balisani Suites,"Jika anda mencari untuk yang sangat baik, nyaman dan santai tempat untuk tinggal di liburan bali ini adalah itu. Di seminyak pantai yang jauh dari keramaian dan hiruk pikuk kuta, ini adalah tempat yang bagus untuk tinggal selama liburan santai. Staf yang indah, sangat ramah dan menyambut.",5
96,Grand Balisani Suites,"Baik semuanya sempurna di grand balisani, kamar yang nyaman, makanan dan minuman yang sangat baik, kolam renang dan area umum rapi dan terawat dengan baik, sedikit jauh dari pasar kuta sibuk dan bahkan Seminiyak, jadi pantai ini juga tidak kotor dan ramai. Hotel ini sangat membantu dalam mengatur sepeda motor di pasar. Toko serba ada di sekitar satu menit dari hotel. secara keseluruhan tempat yang bagus untuk tinggal.",4
97,Grand Balisani Suites,"Bangunan tua yang indah dengan pesona tradisional bali.  Staf hotel ini sangat ramah, kamar bersih dan bagus, dan kolam renang dengan pool bar dan makanan harga yang cukup santai.  Kami menikmati satu minggu di hotel ini dan menyukai tempat yang sempurna untuk segera kembali lagi. ",4
98,Grand Balisani Suites,"Staf yang sangat baik. Lokasi adalah luar biasa. Hanya membiarkan turun adalah cocok sangat cukup kuno, nyaman dan bersih. Bagus dan tenang. Tidak ada yang negatif. Seluruh tempat ini sangat khas dan bagus di bar adalah anggota staf mereka.",4
99,Grand Balisani Suites,Tempat yang bagus untuk tinggal dengan baik kolam renang dan akses langsung ke pantai. Pantai adalah sedikit kotor dan hotel di sini dan perlu sedikit sentuhan. Pilihan makanan adalah baik hanya tidak ada layanan kamar untuk sarapan. Staf yang sangat ramah dan membantu. Aktivitas makan yang bagus di malam hari dengan mengubah tema setiap malam.,3
100,Grand Balisani Suites,"Grand balisani suites ini secara keseluruhan hotel yang sangat bagus, dan kami menikmati kami tinggal di sana 4 hari. Saat kami datang ada mayor masalah dengan wifi, dan kami harus mengubah kamar dua kali sebelum wifi benar-benar bekerja seperti yang diinginkan. Aku benar-benar harus pujian terutama manajer hotel untuk menjadi sangat baik dan membantu setiap kali saya memiliki sebuah diskusi yang menarik tentang memecahkan masalah di tangan. :-) Jadi, kami sangat senang dan puas dengan akomodasi kami terakhir di grand balisani suites - untuk mengatakan paling tidak.   Saya juga berpikir, bahwa kemanapun sangat sopan dan koperasi di semua hal penting.   Area kolam renangnya juga luar biasa, dengan kolam renang yang besar (dengan sempurna sedang air), kursi lounge, dan kolam…",4
101,Grand Balisani Suites,"Di akhir mei 2016, kami tinggal di sini selama satu malam dalam perjalanan ke bali utara. Kami menikmati taman suite di lantai dua yang sangat banyak (dengan memotong pemandangan laut atas atap). Kamar dan kamar mandi yang sangat besar. Kedua lantai kamar memiliki balkon kecil. Tarif hotel sudah termasuk sarapan yang indah yang menghadap ke kolam renang.   Hotel dengan arsitektur bali yang elegan yang memancarkan tenang dan tenang yang kita suka. Ini adalah bali yang merasa bahwa kami datang untuk. Tidak seperti beberapa ulasan sebelumnya yang disebutkan hotel yang sibuk di pinggir kolam renang, kami memiliki kolam renang untuk diri kita sendiri. Tapi kemudian lagi, kami berenang di sekitar 8AM.   Di luar hotel, di sebuah jalan kecil, adalah pantai di potato head beach club, w…",5
102,Grand Balisani Suites,"Saya menginap di sini untuk menjemput seseorang, dan akhirnya kami memutuskan untuk makan di sini. Makanan yang sangat baik!  Layanan sangat baik, cerita lucu karena saya masih menyesuaikan diri dengan cuaca panas (dan dingin ac) saya mendapat sedikit dingin dan sesekali batuk sedikit. Mereka mengira saya batuk saya adalah perokok dan segera mereka menempatkan asbak di sebelah saya :) ",4
103,Grand Balisani Suites,"Lokasi yang bagus karena memiliki akses ke pantai.  Staf hotel sangat ramah, mereka disajikan kurang variasi makanan di sarapan pagi. Saya menginap di alamanda 3rd, kamar yang sangat bagus tapi banyak nyamuk (titik yang sangat buruk). Saya suka bahwa kamar mandi memiliki bak mandi besar.  ",3
104,Grand Balisani Suites,"Poin yang baik:  •bar di sekitar kolam renang yang terlihat keren, anda dapat berendam di kolam renang dan memesan minuman di meja.  •lokasinya mudah ditemukan  •besar dan luas hotel  •sangat dekat pantai untuk pecinta pantai  •pelayanannya sangat bagus, resepsionis sangat membantu dan responsif. Mereka selalu tersenyum dan menyapa tamu dan saya merasa sangat welcome.  buruk poin:  •interior kamar terlihat tua dan kurang terawat, furniture tua, terutama tv set lama  •kamar berbau berdebu, membuat saya bertanya-tanya jika ac adalah bahkan bersih  •saya memesan salah satu kamar deluxe ganda dengan pemandangan taman, di situs web mereka yang sebenarnya, ada bak mandi tapi ternyata bahwa ada tidak ada bak mandi>reaksi: Merasa ditipu  •di malam hari, anda dapat mendengar suara orang…",2
105,Grand Balisani Suites,"Kami tinggal di sini selama 4 malam, staf yang sangat membantu yang berusaha untuk memenuhi semua permintaan kami. Lebih tua gaya bali hotel yang pasti grand. Pemandangan yang indah, banyak untuk mengagumi taman yang cantik dekat restoran dan kolam renang. Kami menginap di kamar dengan pemandangan taman. Hotel ini adalah sedikit dihapus dari keramaian dan hiruk pikuk, yang tersedia. Kami akan dengan senang hati kembali.",5
106,Grand Balisani Suites,"Ini adalah sebuah hotel yang dirancang secara tradisional dengan fasilitas modern, dan menggabungkan arsitektur bali lama dicampur dengan fasilitas modern, membuat hotel ini menjadi pilihan ideal bagi mereka yang menginginkan liburan santai yang tenang tepat di pantai. Kamar bersih dan praktis - ada beberapa masalah pemeliharaan tidak ada tapi ini adalah untuk diharapkan di sebuah hotel zaman ini. Ini adalah keempat kami tinggal di hotel ini dan kualitas layanan telah di tingkat tinggi untuk setiap kunjungan.  Taman indah dan menyenangkan untuk berjalan melalui. Kekurangannya adalah bahwa sementara hiburan yang telah ditingkatkan, hidangan pilihan terbatas dan biasa saja. Jika anda ingin ultra modern, kemudian pergi ke tempat lain. Kami menemukan hotel ini menyediakan semua satu…",4
107,Grand Balisani Suites,"Menghabiskan satu minggu di sebuah ruangan dengan pemandangan laut. Itu bersih, tenang, dan berfungsi baik. Staf adalah sangat membantu dan ramah sepanjang minggu. Restoran itu menyenangkan dan makanan yang rata-rata sejauh makanan pergi hotel. Alasan dan fasilitas yang sangat tua dan kuno, tapi sangat terawat dengan baik. Hotel wi fi adalah mimpi buruk. Terus menonaktifkan dan keluar menuju kamar hotel. Ini benar-benar perlu untuk diperbaiki oleh hotel. Hiburan malam sangat tak terduga dan bagus. Tempat ini adalah nilai yang besar untuk harga dibandingkan dengan hotel-hotel di bali yang terletak di tepi pantai. Pantai ini tidak dapat berenang karena ombak dan riptides yang sangat berat. Pantai dan jalan di depan hotel dipenuhi sampah dicuci up dari laut. Pemandangan pantai…",4
108,Grand Balisani Suites,Aku punya pengalaman yang indah di grand balisani suites. Lokasi yang luar biasa - 10 menit berjalan kaki ke pantai dengan potato head di satu arah dan LaLaguna lain. Kolam renang dan lounge yang sangat bagus - Aku menghabiskan sebagian besar waktu bersantai di lounge yang rusak setelah berenang di kolam renang dengan. Pijat besar di $12 - yang berarti anda dapat memanjakan diri di hotel daripada pergi untuk perawatan.   Di daerah lebih tenang daripada seminyak - namun hal utama yang baik berjalan kaki - lebih cepat dengan pantai tetapi dapat dimanfaatkan oleh jalan ketika air pasang di. Baru sedang dibangun trotoar dan jalan utama yang akan membuat berjalan sedikit kurang menakutkan! Kafe yang bagus di dekatnya (kentang) yang bagus untuk brekky.   Makanan di hotel sangat baik -…,5
109,Grand Balisani Suites,"Kami memesan hotel ini karena kami ingin berada di pantai dan tempat lain yang sangat mahal. Saya rasa anda mendapatkan apa yang anda bayar untuk... hotel ini cukup lari ke bawah, yang merupakan rasa malu... ini bisa menjadi luar biasa. Lokasi yang baik di pantai... sangat dekat dengan restoran yang bagus, sedikit naik skuter ke seminyak dan canggu. Layanan pijat yang kami terima dari lokasi spa sangat rata-rata. Aku harus meminta 2 wanita berhenti tertawa dan berbisik satu sama lain... sangat tidak sopan ketika anda berbaring telanjang di sana. Selain itu staf sangat bagus dan kamar yang besar dan bersih.  Sarapan prasmanan rata-rata juga. Kami makan keluar setiap pagi karena ada terlalu banyak kafe untuk menikmati. ",3
110,Grand Balisani Suites,Cukup rata-rata meskipun lokasinya bagus dan kolam renang yang bagus. Sangat luar tanggal dan membutuhkan dari yang baik bersih. Ada tikus di dalam spa yang cukup kotor. Makanan yang sangat rata-rata dan kamar tua. Hanya satu handuk dan salah satu bantal masing-masing di kamar dan handuk kolam renang yang terbatas. Terbangun di malam hari oleh bising staf dan anggota staf lain yang bergerak tentang membangunkan kami sengaja di 6:30 untuk memperbaiki tv - itu tidak rusak. Saya hanya merasa seperti hotel telah di bawah didanai dan tidak terawat. Itu dijual kepada kita sebagai bintang empat... Tidak! ,2
111,Grand Balisani Suites,"Kami memesan hotel ini melalui agoda, itu sebagai 4star hotel tertentu jadi kami terkejut melihat betapa itu tampak kumuh pada saat kedatangan. Ingin melihat hal ini jika semuanya sangat memuaskan, tapi sayangnya kami punya kamar dengan ac sangat bising di lantai dengan tidak ada lift 4th, yang tidak besar jika anda memiliki perut bali. Kami akhirnya pindah",2
112,Grand Balisani Suites,"Lokasi hotel ini hanya berjalan kaki dari pantai, dengan arsitektur bali, ini terlihat sangat hangat dan santai, staf sangat membantu, hangat dan ramah. Kami menginap di @ kamar termurah (kamar di lantai dua dengan pemandangan taman yang hanya) tetapi memiliki akomodasi yang baik, kamar yang luas, balkon, wifi dan tempat tidur yang besar. Memiliki banyak kolam dengan ikan emas. Hotel ini memiliki kolam renang yang bagus dan anak-anak kolam renang yang menghadap ke pantai. Secara keseluruhan, kami memiliki pengalaman hebat yang tinggal di sini dan harus datang kembali ke sini lagi untuk tinggal lebih lama. sangat dianjurkan untuk berbulan madu yang ingin bersantai dengan keluarga dan ingin tempat yang tenang. Kami sangat menyukai hotel ini",4
113,Grand Balisani Suites,"pelayanan yang sangat ramah dan membantu. Di lokasi yang sangat berguna. Berjalan kaki ke mozaic beach club, hotel w dan potato head beach club. Tempat ini berada di depan jalan utama seminyak. Berjalan di sepanjang pantai untuk tempat ini dan dapat dicapai dengan berjalan kaki dan anda memiliki bit terbaik seminyak.  Hotel ini memiliki kolam renang yang paling luar biasa adalah di tepi pantai. Banyak sinar matahari dan kolam renang sempurna matahari berada di area bar. Suhu air adalah surgawi. sangat bersih!  sangat terawat dengan baik hotel. Jika anda tidak ingin sebuah hotel yang modern dan elegan, dan malah ingin tradisi gaya bali hotel ini akan menjadi pilihan yang baik. Hotel ini juga terjangkau untuk minggu atau lebih lama. Kami cukup beruntung untuk mendapatkan sebuah…",4
114,Grand Balisani Suites," Tempat yang bagus untuk tinggal di harga yang tepat.  Keramahtamahan staf luar biasa tidak bisa melakukan cukup bagi anda begitu menyenangkan dan sangat ramah. Depan rumah ada banyak ruang untuk perbaikan.  tempat tidur yang sangat nyaman dan sangat bersih, lokasi yang tepat, baik meletakkan keluar, sangat mudah untuk mendapatkan untuk dan sekitar 15 menit berjalan kaki di pantai ke potato head.  Kami beruntung untuk memiliki kelas memasak pribadi pada harga yang sama selama tiga hari pada makanan yang dimasak.  Sangat modern dan memiliki merasa lokal tentang tempat ini dan benar-benar baik",4
115,Grand Balisani Suites,"Kami tinggal 16 malam di balisani suite dan menyukainya sangat banyak. Hotel ini salah satu lagu lama, yang berarti itu jauh lebih luas daripada hotel yang baru dibangun. Ini di bali, dengan tata letak yang baik dari kolam dengan ikan (dan katak di malam hari), taman kecil, kolam renang menghadap ke annd beacht. Restoran terletak di lantai pertama, melayani sarapan yang luar biasa, dan memiliki pemandangan indah di atas kolam renang dan laut; restoran staf sangat penuh perhatian. Kami memesan kamar dengan pemandangan kebun dan meminta lantai yang lebih tinggi, yang kami dapatkan. Saya pikir ada kamar yang telah direnovasi (kami memiliki) dan kamar tidak direnovasi karena kamar kami memiliki tempat tidur yang nyaman, tv layar datar, mandi & mandi, minibar, dan wifi kualitas yang…",4
116,Grand Balisani Suites,"Terletak di antara pohon kelapa dan kemboja di, grand balisani suites adalah tempat peristirahatan yang tenang yang sempurna untuk bersantai. Tidak terlalu jauh dari keramaian kuta, legian, dan seminyak, kunjungi toko kemudian kembali untuk bir di tepi kolam renang. Atau keluar dari dinding bata pantai selancar. Staf tidak bisa lebih ramah, tidak ada terlalu banyak kesulitan. Rita dan julie terlihat setelah kami dan menjadi teman baik. Ben membawa kami di tur bersepeda di sekitar area, yang harus anda lakukan. Seluruh pengalaman hebat untuk pertama kali ke bali.",4
117,Grand Balisani Suites,"Lokasi yang besar, sebelah utara seminyak. Bagus malam di pinggir pantai di mana pun anda suka. Dua warung yang bagus dalam jarak berjalan kaki dari hotel di pantai. Bagus kolam renang dan taman. Beberapa kamar tidak angin sore.",4
118,Grand Balisani Suites,"Saya dan mitra saya tinggal di grand balisani suites 22 - 26 april setelah seorang teman direkomendasikan kepada kami. Secara keseluruhan, kami sangat menyukai hotel ini. Staf yang sangat ramah, kamar sangat bagus, kolam renang (terutama sunken bar kolam renang) yang fantastis. Hotel yang bagus, suasana santai yang adalah persis apa yang kami butuhkan. Hotel ini terletak tepat di pantai di seminyak. Itu adalah indah untuk dapat berjalan keluar ke kolam renang dan pantai. Namun, sebenarnya lokasi hotel adalah sedikit keluar dari jalan dari segala sesuatu yang lain seperti restoran utama/belanja daerah, yang kami tidak seperti begitu banyak. Setiap kali kita ingin pergi keluar untuk makan siang/makan malam atau belanja kami naik taksi yang hanya $5 naik ke seminyak square. Selain…",4
119,Grand Balisani Suites,"Aku tidak akan kelas sebagai 4 bintang tempat ini, hampir 3.  Tempat ini tua dan usang dan wifi ini sangat bisa diandalkan. Kami mampu untuk mendapatkan sebuah router yang diletakkan di kamar kami yang ditingkatkan masalah di kamar kami, tetapi tetap menyerang terus di sekitar area kolam renang.  Hal yang paling menjengkelkan adalah bahwa mereka memungkinkan orang untuk memesan kolam renang lounge sepanjang hari dengan handuk mereka.  Hotel ini perlu perbaikan.  Lokasi adalah fitur terbaik",2
120,Grand Balisani Suites,Terletak di pusat kota yang sangat baik dan layanan yang luar biasa dengan staf yang indah. Nilai yang sangat baik untuk kualitas dari kamar. Resor tenang tapi dekat dengan menyenangkan bar dan toko-toko. Minuman di bar kolam renang sangat mahal dan banyak kolam renang lounge untuk menikmati mereka. ,5
121,Grand Balisani Suites,"Staf sangat ramah, kamar dan hotel sangat bersih, restoran setiap malam dan acara, harga sangat baik untuk sebuah hotel bintang 4, sarapan memiliki pilihan makanan yang banyak. Terbaik dari semua: Lokasi. Hanya beberapa keluhan: gym. Hotel ini kebutuhan gym dan transportasi bandara. Wifi di kamar tidak bekerja sebagian besar waktu.",5
122,Grand Balisani Suites,Kami tinggal 3 malam di grand balisani untuk. Mereka sangat baik dan memberi kami check in lebih awal (jam 10). Kamar bersih dan luas (kamar standar dengan pemandangan taman). Hotel ini memiliki kolam renang yang bagus dan pantai besar. Mudah berjalan kaki ke pusat seminyak sepanjang pantai dan anda tidak merasa kepanasan karena dekat dengan air. Butuh waktu sekitar 10 menit untuk berjalan kaki ke potato head di sepanjang pantai. Restoran juga sangat baik (besar cumi dan pizza yang baik). Untuk harga hotel ini sangat bagus dan saya akan menginap di sini lagi! ,5
123,Grand Balisani Suites,"Hotel yang terletak tepat di tepi pantai - lokasi yang sempurna untuk melihat matahari terbenam di bali. Kolam renang adalah ukuran yang baik & sangat bersih dengan bar kolam renang terlampir. Dulunya bangunan ini memiliki beberapa indah dan sedikit perbaikan, hotel ini akan jauh lebih baik. Kami memiliki sarapan prasmanan setiap pagi - makanan adalah rata-rata, saya suka es teh siap minum! Juga memiliki beberapa makan malam di sana - cukup murah untuk makanan yang layak. Patut dicoba. Secara keseluruhan, ini adalah tempat yang bagus, tapi agak terlalu jauh keluar dari semua restoran, belanja dll. Kita mungkin tidak akan tinggal lagi hanya untuk alasan itu.",4
124,Grand Balisani Suites,"Hotel itu sendiri adalah cukup rata-rata -- kamar, makanan, dll tapi lokasi tepi pantai yang luar biasa dan kolam renang yang sangat bagus. Bangunan itu sendiri membutuhkan beberapa perhatian tapi memiliki udara yang segar, lapang merasa. layanan pijat sangat amatir, tapi jika tidak baik-baik saja.",4
125,Grand Balisani Suites,"Hotel ini memiliki sebuah kolam renang dan akses ke pantai. Area kolam renang memiliki sebuah bar untuk memesan minuman sementara kami di kolam renang. Ada juga jacuzzi di samping kolam renang.  Lokasinya tidak terlalu jauh dari kuta, dan di sekitar toko-toko dan restoran-restoran. Orang-orang di hotel sangat ramah dan siap membantu. Namun, kamar yang ber-ac tidak dingin dari check-in, kami mengubah kamar untuk check out.",4
126,Grand Balisani Suites,"Kamar yang fantastis, kita sopan dan ramah staf, besar kolam renang dan bar, pemandangan matahari terbenam di atas air, pijat gratis, dekat dengan kuta tetapi tidak terlalu dekat. Saya akan sangat menyarankan tempat ini untuk pasangan dan keluarga. Lobi staf sangat membantu dan mengatur transportasi bagi kita, dan penghargaan. Staf akan mendapatkan untuk mengetahui anda secara pribadi dan membuat anda merasa sangat menyambut. ",5
127,Grand Balisani Suites,"Ini sekolah tua bali hotel adalah nilai yang besar pilihan tepat di pantai. Bangunan ini telah melihat hari dan membutuhkan tapi area umum masih bagus, tempat tidur nyaman dan staf membuat setiap usaha untuk membuat anda tetap satu yang menyenangkan. Nice sarapan prasmanan dengan es teh siap minum!",3
128,Grand Balisani Suites,"kamar hotel ini sangat tua... ini adalah masih kotak tv dengan layar cembung. resepsionis yang buruk. Staf hotel (sementara tidak kasar) benar-benar tidak ramah. Spa pengalaman tidak menyenangkan, ada 10 menit berjalan masuk dan keluar selama hari. TIDAK KEREN!   bartender itu mengagumkan! Penanda tangan di dekat kolam renang keluarga dan yang sangat ramah dan baik... memiliki malam besar di tepi kolam...   Semua dalam semua, itu patut dikunjungi untuk pemandangan, dan lokasi.",3
129,Grand Balisani Suites,"Dari sudut pandang saya baik... jangan datang ke bali pada musim hujan hahaha Berat hujan datang untuk semua pintu dan jendela... kamar kami di 4th memapani menjadi sangat basah. Sarapan adalah tidak banyak pilihan... Aku akan mengatakan hotel ekonomis yang melayani lebih banyak makanan daripada di hotel bintang empat ini, dan rasa makanan mereka tidak sangat baik baik. Saya rasa tarif adalah terlalu mahal. Saya tidak berpikir saya akan kembali ke hotel ini lagi. Hotel ini cukup tua dengan interior yang tua, kami bahkan tidak bisa menutup pintu kamar mandi karena pintu sulit untuk dorong... kita perlu merebuntukan JALANAN . Hotel itu sendiri tidak sangat terawat dengan baik Hal terbaik tentang hotel ini hanya karena ini adalah hotel tepi pantai, dan sangat dekat ke kepala…",3
130,Grand Balisani Suites,"Datang untuk teman-teman pernikahan dan sangat senang dengan hotel ini. sangat ramah dan menyambut. Kami melewatkan layanan kamar karena penundaan iast di bandara dan mereka dibuka kembali bagi kita di dapur sehingga kami bisa memiliki makan malam 23:30. Koktail yang menakjubkan, tempat tidur yang sangat nyaman walaupun sedikit sulit. Makanan adalah bagus. Kamar selalu bersih dan staf sangat ramah.",4
131,Grand Balisani Suites,Staf yang ramah dan baik nilai untuk berada di tepi pantai. Bersantailah di tepi kolam renang yang menghadap ke laut. Bisa berjalan ke dalam kota sepanjang pantai dan jika tidak mahal!   Restoran sederhana dan koktail dari bar. Banyak pilihan lain dekat dengan kafe yang menyediakan beragam.   Kami sering sendirian rasanya karena mempergontai di pusat wisata dan perdagangan.   Akan kembali lagi. ,4
132,Grand Balisani Suites,Selamat datang di ini indah gaya lama hotel di depan pantai. Staf yang ramah dan kamar yang bersih. Nilai yang besar untuk lokasi dan hanya berjalan kaki singkat ke pantai untuk kentang kepala beach club. Mereka juga menawarkan antar-jemput gratis ke kuta!,4
