,hotel,review,stars
0,Penida Dive Resort,"Saya mengunjungi Pulau Nusa Penida selama satu hari dan jatuh cinta dengan ikan pari manta yang jadi saya memutuskan untuk pergi kembali dan snorkeling dengan mereka sebelum meninggalkan Bali. Saya tidak mendaftar untuk perjalanan dan berpikir orang lokal dengan perahu dan bersedia untuk mengambil saya. Bukannya ini yang orang lokal membawa saya ke Penida Dive Resort di mana beberapa orang tentang untuk pergi untuk menyelam/snorkeling. Saya bisa bergabung dengan grup untuk 300 K Rp (murah) yang berlangsung sekitar 4, 5 jam dan 2 anggota tim lokal. 1 orang Perancis (instruktur menyelam) bergabung dengan grup. Berenang dengan ikan pari yang M Z yang saya dan G dan layak semua uang namun tempat Sangat ramai. Setidaknya ada 4 lain sekitar 15 kapal di sana dengan snorkeling di Manta…",5
1,Penida Dive Resort,"sangat dekat dengan feri, yang Anda tidak perlu transportasi ekstra.  Kamar sederhana tapi bersih.  Menyelam sangat baik.  Andrea (Manajer Hotel) yang menunjukkan tempat yang bagus di pulau itu, tempat yang bagus untuk makan juga.  Penyewaan Moto 3 menit dengan berjalan kaki dari hotel 80 . 000, - /hari",5
2,Penida Dive Resort,"Kami bermaksud untuk tinggal selama tiga malam dan berakhir di sini selama seminggu penuh. Kamarnya bagus dan bersih dan staf yang sangat ramah! Kami merasa familiar dengan cepat, itu mudah untuk memenuhi tamu lain dan makanannya sangat enak!  Saya juga pergi menyelam dengan Mattia dan Erika. Kedua hangat - hati, mudah - orang-orang di sekitar dan pergi menyelam di Nusa Penida sangat luar biasa. Saya membuat saya open water course dengan Mattia, instruktur menyelam yang sangat baik, dan selalu merasa aman dan nyaman dengan mereka! Besar terima kasih untuk waktu yang luar biasa! Saya pasti ingin untuk kembali untuk lebih banyak menyelam! :)",5
3,Penida Dive Resort,"Saya menginap di kamar privat di Penida Dive Resort dan itu sangat menyebalkan! Pertama dari semua wanita dari Republik Ceko yang ternyata adalah manajer atau sesuatu, dia sangat ramah. Dia adalah sangat kasar/tidak tertarik/tidak pernah tersenyum/bosan. Saya bertanya jika kami bisa membayar dengan cepat karena perahu kami di 15 menit pergi. Jawaban: "" tidak ada itu masalah anda. "" Saya rasa itu bukan segala hal bekerja jika anda bekerja di hospitality. Lebih lanjut ada banyak semut di tempat tidur saya. Kelambu memiliki banyak lubang. Kamar mandi adalah kotor. Tidak ada check-out waktu, itu mungkin mengapa itu begitu kotor, mereka tidak membersihkannya. Hanya sarapan pagi yang oke.",1
4,Penida Dive Resort,"Resor ini sangat tenang dan bagus dan mereka memasak makanan yang luar biasa.  Menyelam instruktur sangat profesional, mereka tahu apa yang mereka lakukan, dan secara keseluruhan, sangat menyenangkan!  Mereka mengambil peduli dari pelajar dalam cara yang sangat pribadi.  sangat direkomendasikan!   Sol dan joaquin",5
5,Penida Dive Resort,"Tinggal selama satu malam selama kunjungan ke Nusa Penida, benar-benar menikmati tempat ini. sangat dekat dengan pusat kota dan dekat dengan feri untuk fasilitas lain di Nusa Penida termasuk pasar, pantai dan pusat menyelam. Sebagian besar klien dari Republik Ceko dan Slovakia. pemilik yang sangat membantu.",5
6,Penida Dive Resort,"Saya melakukan perjalanan dengan kakak saya dan kami tidak memesan akomodasi apapun sebelumnya. Kami terkejut ada tidak banyak pilihan untuk menginap di Nusa Penida. Kami menemukan tempat ini secara online dan memutuskan untuk berjalan di dan memeriksa apakah ada kamar yang tersedia di sana. Beruntung ada. Ruangan itu adil untuk harga murah yang dibayar. Kami menyadari bahwa mereka menawarkan layanan dan pergi snorkeling dan menyelam untuk hari berikutnya. Seluruh hal yang sangat terorganisasi dengan baik. Sayangnya mereka ombaknya terlalu kuat dan kami harus melewati titik Manta. Namun demikian, kami masih melihat banyak ikan dan terumbu karang yang bagus di 2 tempat yang berbeda. Terima kasih khusus kepada pemilik resor. Tidak mendapatkan nama mereka tapi suami dan istri…",5
7,Penida Dive Resort,"Kami menghabiskan hampir 2 minggu di Penida menyelam. Mereka memiliki bagus Guesthouse dengan pilihan untuk kamar dengan kipas angin atau AC dan mereka juga memiliki toko menyelam yang sangat baik didirikan dan pertama toko menyelam di pulau. Staf adalah baik dan dive master yang sangat ramah. Kami melakukan penyelaman satu, manta 66 dan ada banyak ikan pari, sangat indah!  Kami menyukai penginapan karena mereka memiliki makan utama dilengkapi dengan meja di mana Anda dapat bersantai atau bekerja jika anda perlu.",5
8,Penida Dive Resort,"Saya bepergian sendirian di Nusa Penida tidak ada di mana banyak toko-toko menyelam, wanita yang membantu saya dengan reservasi yang sangat baik, dia mengatur 3 penyelaman saya bahkan mereka belum berencana ini. Instruktur menyelam dari Italia sangat bagus juga.  Saya 66 manta titik dan saya mampu untuk menyelam dengan banyak ikan pari yang besar, visibilitas yang sangat tidak bagus karena rainning di nigth sebelum tapi itu tidak masalah.   Pari manta yang penting!",5
9,Penida Dive Resort,Saya pergi dengan teman baik. Ini adalah pertama kalinya dia dan pemandu kami sangat luar biasa. Teman saya dan istrinya dan Erika adalah hanya luar biasa. Saya merasa aman dan kolam nyaman! Terumbu karang hanya di depan dari resor yang indah ini! Saya dapat merekomendasikan higly Matthia dan Erika juga makanan yang sangat baik dan manajemen yang indah. Terima kasih!,5
10,Penida Dive Resort,"Seperti semua lain pengulas terakhir. Saya sangat senang dengan David dan Julie, penduduk dive master. Mereka melakukan pekerjaan yang sangat baik dan membantu setiap orang mendapatkan dilengkapi dan tinggal aman sementara menunjukkan keindahan Pulau Nusa Penida. Kami memiliki besar 4 kali menyelam (menyelam menyelam=lebih murah! ) bersama melihat belut, gurita, dan favorit semua, pari manta! Mereka mempromosikan yang sangat ramah, suasana hampir turun-menurun. Ada banyak tempat nongkrong di wilayah umum, makan siang adalah disertakan dengan menyelam dan kami akhirnya pergi untuk makan malam bersama juga. Mereka bahkan cukup baik untuk memberikan kami akses gratis ke foto mereka di GoPro kamera. Hotel ini terletak hanya beberapa ratus meter dari feri dermaga dan hanya beberapa…",4
11,Penida Dive Resort,"Terima kasih kepada David dan Julie, dive master extraordinaires, Penida Dive Resort menawarkan tidak hanya akses yang mudah ke tempat menyelam yang luar biasa, tapi juga sebuah pengalaman yang sangat ramah di seluruh. Semua situs menyelam menawarkan sesuatu untuk setiap penyelam; pandangan yang luar biasa, penyelaman arus, penyelaman santai, hidup dalam skala makro, pari manta raksasa, banyak sekali spesies ikan termasuk ikan hiu yang sesekali, Cephalopods, krustasea, keras dan lembut karang. Staf di resort di Indonesia, serta perahu kapten dan kru, adalah sangat ramah dan membantu. Resor ini terletak dalam dua menit berjalan kaki dari Maruti Express, sehingga mudah diakses dari Sanur. Nusa Penida adalah pulau yang indah itu, dengan jauh lebih sedikit daripada bali atau turis…",5
12,Penida Dive Resort,"Saya memiliki waktu yang indah menyelam dengan kelompok ini. Sebelum mereka - staf yang sangat baik dan meyakinkan saya bahwa saya adalah di tangan yang baik dengan kepala penyelam. Mereka sangat fleksibel dan memastikan pengalaman menyelam saya dengan baik. Selain itu, mereka menunjukkan rasa hormat untuk alam dan tidak pergi pada menyelam di - pro. Saya sangat menyukai tempat ini karena sebelumnya saya telah menyelam dengan perusahaan yang menggunakan pergi - berdasarkan sifat dan kemudian menyelam Anda menjadi tontonan bagi Facebook. Saya memiliki waktu yang menyenangkan bersama mereka! Saya hanya saran adalah jangan lupa membawa sendal jepit! ",4
13,Penida Dive Resort,"Memiliki waktu yang menakjubkan! David adalah salah satu instruktur menyelam terbaik yang pernah saya miliki. Tempat menyelam yang indah. hotel ini sangat santai, elok dan tempat ini adalah seperti sebuah keluarga kecil. Pasti akan merekomendasikan tinggal di sini untuk beberapa hari.",5
14,Penida Dive Resort,"Saya menginap di Penida Dive Resort dengan beberapa teman untuk pergi menyelam selama akhir pekan. Mengambil perjalanan menyelam dengan David dan Julie yang sangat brilian! Saya sangat gugup tentang menyelam untuk pertama kalinya setelah mendapatkan padi ow, saya dan teman-teman yang tidak pernah menyelam sebelum, mereka menempatkan kita di kemudahan dan Anda benar-benar sangat baik panduan.  Akomodasi itu sendiri sangat baik, murah dan ceria dengan sarapan termasuk. Kamarnya bersih dan memiliki AC dan kelambu. Sempurna untuk liburan akhir pekan menyelam dan menjelajahi pulau.  Terima kasih sangat banyak, kami akan kembali lagi!",5
15,Penida Dive Resort,"David dan Julia's gairah untuk menyelam yang menakjubkan. Pengetahuan mereka diatasi. Di atas itu, mereka hanya orang yang luar biasa. Saya tidak tiga kali menyelam dengan mereka dan terpesona dengan kesenangan dan David dan Julie memiliki profesionalisme. Kami disambut dengan senyum dan percakapan ramah. Saya memiliki pengalaman menginap yang luar biasa dengan orang-orang baik, percakapan yang baik, dan saya selalu merasa Selamat datang. Saya tidak bisa menunggu untuk kembali. Resor ini sangat bersih, kamar yang cukup menarik. Makanan yang sangat baik, sedikit lebih mahal jika Anda makan di warang kecil, tapi itulah harga toko. Transportasi, penyewaan skuter, dan wisata pulau dapat dilakukan dari bagian penerima tamu. Saya tidak tahu apa tempat ini adalah seperti beberapa bulan…",5
16,Penida Dive Resort,"Instruktur menyelam yang baru (Julie dan David) tiba hanya beberapa hari sebelum kami melakukan dan sangat menakjubkan dari awal. Keduanya memiliki keseimbangan yang baik antara berada profesional tentang keamanan dan bersenang-senang, dan kami benar-benar menikmati waktu kita dengan mereka.   Saya lakukan saya padi ow dengan David dan merasa yakin bahwa saya dapat meninggalkan Bali yang aman dan bertanggung jawab penyelam, terima kasih ke kedalaman pengetahuan dan kesabaran.   Terumbu karang alami sendiri - pada penyelaman pertama saya melihat kura-kura dan hiu bambu, serta banyak ikan karang dan bahkan beberapa nudibranch.   Jika Anda sudah mencintai menyelam atau ingin belajar. Saya 100% Merekomendasikan Nusa Penida Dive Resort karena lokasinya yang luar biasa, luar biasa…",5
17,Penida Dive Resort,"Saya dan teman saya hanya menyelam dengan David dan Julie. Mereka sangat indah dengan suasana yang hebat yang bekerja bersama-sama. Cerdas dan teliti tapi ramah dan menarik juga. Saya tidak akan pernah menyelam sebelum dan sangat gugup tetapi merasa aman dan didukung dan, meskipun saya awalnya takut. Saya benar-benar menikmatinya. Terima kasih untuk memandu perampokan pertama saya masuk ke dunia bawah laut yang spektakuler!   Akomodasi sederhana namun nyaman, nilai yang sangat baik, dengan suasana yang santai dan sangat cocok dengan kebutuhan kami. Saya akan pasti seperti untuk datang kembali dan akan merekomendasikan.",5
18,Penida Dive Resort,"Tempat ini adalah tempat yang baik untuk menghabiskan malam dan makan, tapi pasti tidak untuk tinggal di sana sepanjang hari atau menyelam dengan orang-orang yang tidak ramah. Kami merasa tidak nyaman selama kami menginap di sana, rasanya seperti Anda berada di tengah-tengah rumah mereka. Kami merasa tak diinginkan sejak hari 1.   Di sisi lain, Staf Indonesia sangat ramah dan membantu, terutama dari resepsionis, Siti.   Tidak direkomendasikan.",2
19,Penida Dive Resort,"Kami tinggal di sana selama 5 hari dan kembali lagi untuk beberapa hari terakhir liburan kami, karena suasana yang sangat santai dan tenang. Kamar cukup dasar dan mungkin agak terlalu mahal. Di antara tiga dari kami, kami memiliki empat kursus menyelam, yang kami sangat menikmati, berkat yang luar biasa indah tempat menyelam dan mendorong, berbelit dan membantu instruktur Barbora. Seperti yang lainnya, ia dapat berkomunikasi dalam bahasa inggris yang sangat baik. Saya akan selalu kembali ke sana lagi.",4
20,Penida Dive Resort,"Halo wisatawan, kami berada di pulau ini untuk bulan madu kami dan kami memutuskan untuk menyelam cerification. Kami tidak pernah menyelam sebelum dan kami melihat amezing whar itu. Kami diajarkan oleh barbara dan memiliki banyak menyenangkan. Kami melihat ikan pari, kura-kura dan belajar menyelam. Kami kemudian di lombok dan sekarang di gili meno tapi kemungkinan adalah yang terbaik menyelam di nusa penida. Barbara adalah gadis muda yang suka untuk menyelam dan penuh energi. Saya merekomendasikan tempat ini untuk orang-orang muda yang sebagian besar. Akomodasi tidak sangat bagus tapi kami tidak ada untuk hotel bintang 5. Semua tentang divig sangat bagus dan saya tidak pernah melihat lebih baik di salah satu tempat yang kami kunjungi di indonesia sampai sekarang. ",5
21,Penida Dive Resort,"Saya bepergian dengan pacar saya di bali dan kami memutuskan untuk menghabiskan 5 hari di penida dive resort, yang pasti adalah keputusan terbaik yang kami buat selama perjalanan kami! Saya tidak akan menulis tentang nusa penida sendiri, karena pulau ini tak terlukiskan. Itu benar-benar adalah surga! Tak tersentuh alam, snorkeling yang menakjubkan, baik penduduk setempat dan hampir tidak ada turis (terutama jika dibandingkan dengan bali). itu pasti layak melihat :)   Kami memutuskan untuk menginap di penida dive resort karena pacar saya adalah seorang penyelam, dan ia ingin melihat mola mola. Resor yang sangat bagus dengan suasana yang baik: ) Letaknya yang dekat ke ""pelabuhan"" (hanya ada kapal cepat dari bali), sangat dekat dengan pantai - 5min dengan berjalan (lihat foto) dan…",5
22,Penida Dive Resort,"Kami tinggal di sini selama sebelas hari kerja sukarela di pulau. Ini adalah sedikit dari tempat. Sementara kami makan sebagian besar makanan kami di proyek sukarela, kami makan di sini dua kali. Makanan yang baik tetapi saya tidak akan merekomendasikan burger ceko itu dalam goreng lemak. Ada banyak makanan khas ceko yang kita tidak mencoba. Layanan yang benar-benar lambat -- hati-hati. Kami memiliki ruang ber-ac dan yang mewah setelah keluar sepanjang hari. Itu cukup bersih tapi kamar mandi perlengkapan yang cukup tua dan pintu kamar mandi tidak menutup dengan benar. Staf yang selalu menanggapi permintaan kami dan siti di meja depan sangat membantu. Ada sistem kehormatan untuk menulis di dalam botol minuman yang sangat bagus di malam hari. Wifi-nya putus-putus, tapi yang…",4
23,Penida Dive Resort,"Sangat baik tempat untuk tinggal, tidak hanya untuk penyelam. Anda dapat menyelam di sini dan anda dapat juga snorkeling dengan ikan pari dan dengan sunfish. Resor ini sangat dekat dengan pantai. Nusa penida adalah sebuah pulau yang menakjubkan, hampir tanpa turis dibandingkan dengan bali. Anda dapat menyewa sepeda motor dan menjelajahi di resor seluruh pulau, itu banyak menyenangkan. Bahkan tidak supir pengalaman akan benar benar menikmati naik, karena tidak ada banyak lalu lintas. Resor ini sangat bersih dan rapi. Staf sangat baik dan selalu membantu. Anda dapat memilih antara indonesia dan europen makanan. Kita dapat sangat merekomendasikan hal ini.",5
24,Penida Dive Resort,"Aku pergi menyelam dengan mereka di lima. Staf, ketika mereka tersedia, ramah dan profesional. Dive master, b, melakukan pekerjaan yang sangat baik, menyelam-pengarahan tidak solid, dan tahu banyak satwa liar. Ia juga sangat antusias dan menyenangkan untuk menyelam dengan. Saya pikir akan mendapatkan keuntungan dari hewan yang sedikit kurang interaksi langsung. Di pusat menyelam sangat baik peralatan yang sangat besar, dan mereka memiliki berbagai pilihan baju-baju yang basah, walaupun sedikit tua. Operasi yang bagus. Aku akan menyelam dengan mereka lagi. Oh, dan kami telah sangat baik menyelam dengan ikan pari manta, sekitar 8 dari mereka.",4
25,Penida Dive Resort,"Jika anda bukan seorang penyelam dari republik ceko, ini adalah tidak tempat untuk anda. Ada lebih baik hotel/resort di penida yang punya nilai lebih.  Kami hanya tinggal di sini selama 1 malam dan kami dengan cepat memutuskan untuk pergi ke tempat lain. Kamarnya lumayan (untuk turis indonesia standar) tapi sangat mahal. Itu tampak bersih tapi benar-benar tidak. Kami tidak memiliki ac jadi w mereka membawa kipas angin. Saat kami menggunakan kipas angin hanya ada 1 colokan listrik yang ada di sebuah tempat yang nyaman dan cukup berguna. Wifi gratis tidak tersedia.  Ketika kita bangun lebih awal untuk menjelajahi pulau. Pacar saya punya pancake dan jus untuk sarapan dan saya dapat tidak ada. Setelah 30 menit masih tidak terjadi apa-apa (ada banyak staf di sekitar, dan mereka pasti…",2
26,Penida Dive Resort,"Resort ini sangat direkomendasikan terutama (!) untuk penyelam dan wisatawan yang ingin menjelajahi pulau nusa penida. Itu adalah lokasi yang benar-benar masih asli dengan peradaban. Penyelaman yang sangat dipersiapkan dengan baik namun n.p. itu bukan untuk pemula (arus)! Jika anda ingin melihat pari manta, mereka benar-benar tidak ada! Ini adalah dasar akomodasi di resort dan hanya dingin air. Kelemahan utama adalah tidur karena dari nyanyian pagi (4AM) dari dekat masjid yang telah mengambil kadang-kadang 60 menit. Jika anda ingin berenang di laut, yang dapat anda gunakan di depan resor tetapi tempat terdekat di pantai crystal bay (dengan mobil, hanya sepeda). Kami meminta staf untuk menata resor membantu kami untuk 'taksi' di sana dan kembali. sehingga resort ini tidak cocok…",4
27,Penida Dive Resort,Kristina dan seluruh tim sangat profesional dan sangat berpengalaman. Sangat menyenangkan untuk menyelam dengan. Di manta menyelam di 66 itu benar-benar menakjubkan dengan 14 raksasa pari manta memang sangat istimewa. Makanan yang baik dan nilai yang sangat baik seperti kamar. Sangat Direkomendasikan.,5
28,Penida Dive Resort,"Terima kasih besar untuk menyenangkan hari di tempat favorit anda. Kami tiba hanya untuk menyelam dan tinggal 3 hari, karena tempatnya sangat tenang dan anda merasa seperti keluarga. Tidak 5 hotel bintang akomodasi tapi apa yang anda butuhkan ketika anda mencari untuk menyelam dan bersantai bagus? Hanya tempat ini dan kami akan kembali :-) )) Terima kasih, kristina sebagai dive master dan monika pemilik untuk tidak terlalu dekat dengan anda :-)   Joanna yang Zdenek",5
29,Penida Dive Resort,"Kami tidur di sana hanya 1 malam dan memutuskan untuk mencari sesuatu yang lain. Akomodasi ini sangat tidak nyaman. Kamar yang sangat gelap, kotor, dinding yang kotor. Aku akan mengatakan sangat buruk kualitas cleaning. Saya tidak keberatan untuk tidur dalam kondisi seperti itu tapi harga harus masuk akal. Kamar yang sangat mahal untuk apa yang mereka menawarkan. Jika itu lebih murah, aku tidak mengatakan apa-apa - perjalanan yang murah dan terjangkau. Tapi ini bukan di semua logislah. Kami dengan mudah menemukan akomodasi baru dan kualitas dan layanan mereka tikai - staf ramah, sikap baik kepada pelanggan, kamar bersih dll. Tersedia juga wi-fi tapi ini tidak bekerja sangat baik. Ada restoran, selain makanan thai mereka menawarkan beberapa hidangan khas ceko. ",2
30,Penida Dive Resort,"Great dive master di sini saat ini, kami sedang dalam perjalanan untuk menyelam dan sertifikasi di hari pertama. Profesional tapi santai dan stres gratis ketika harus menyelam tropis. Kami tidak menginap di kamar yang disediakan, jadi tidak bisa memberi komentar di sana, meskipun jika tujuan utama anda di penida adalah menyelam yang mungkin mempersediakan. Pulau ini menawarkan banyak lagi juga, meskipun. ",5
31,Penida Dive Resort,"Saya ke nusa penida dive resort sebulan yang lalu, ketika saya akan menginap di sini seperti instruktur padi yang baru. jadi, ulasan saya mungkin tidak akan rellevant untuk anda, tapi aku mencoba untuk memperbahasakan inpressions pertama saya.  Akomodasi di sini adalah sangat sederhana, tetapi memenuhi semua standar. Anda dapat memilih antara kamar dengan kipas angin dan ac rom yang sedikit lebih murah. Kamar kami sangat bersih dan sederhana, saya akan di sini setiap hari. Beberapa kamar lebih rekonstruksi, tetapi kebanyakan dari mereka sudah memiliki keramik dan baru dari bambu sangat bergaya. Makanan (sarapan termasuk dalam harga kamar) adalah terutama pedas khas indonesia dengan, terutama nasi dan mie, tapi anda dapat menemukan di sini juga khas eropa, dapur czechnya. Resor…",5
32,Penida Dive Resort,"Saya dapat menyarankan tempat ini banyak! Saya dan pacar saya, kami memiliki liburan yang sempurna di sana. Saya seorang penyelam yang berpengalaman, ia nondiver, sampai kami tiba untuk dive resort di nusa penida. Ada sangat profesional tim untuk menyelam, mereka mengambil peduli dari pacar saya dan dia juga sangat saya menyelam. Bahkan jika kita tidak berbahasa inggris yang terbaik, instruktur sangat pasien. Kita telah melihat mola mola, semua perlengkapan dikamar.   akomodasi khas indonesia, jika anda mencari untuk real asia, anda akan menemukannya di sana. Kamar hotel ini bersih dan staf sangat membantu.   Di pulau ini, anda akan menemukan tempat menakjubkan dengan pemandangan yang sempurna. Orang-orang di resor akan membantu anda mengatur perjalanan anda.   Terima kasih…",5
33,Penida Dive Resort,"Bangunan ini benar-benar tua. Bau kelembaban di dalam kamar. Toilet yang rusak serta ac. Ini tampak seperti sebuah kamp pengungsi perang kedua... Akomodasi yang baik-baik saja jika mereka setidaknya dive master akan menyenangkan dan profesional. Master menyelam yang diusulkan kami berdua untuk bergabung dengan grup yang telah 10 penyelam per dive master satu! Pemesanan kami tidak terdaftar. Dia bahkan tidak mencoba untuk mengurus situasi. Ini adalah menyelam saya mencoba membuat sebagai banyak keuntungan yang senyaman mungkin. Jangan pergi ke sana untuk menyelam. Berbahaya dan tidak ramah.  Namun, ini adalah benar-benar ramah dan staf di sana.   Pada akhirnya, kami meninggalkan untuk tempat lain baik untuk hotel dan menyelam. Untuk harga yang lebih murah, kami hanya 4 penyelam…",1
34,Penida Dive Resort,"Penida mencempung di resort kami menginap di 11 juni 2015 sebagai sekelompok 4 penyelam dan non-penyelam. Pada saat kedatangan, menyambut kami dan menyiapkan kami untuk makan malam yang menyenangkan. Hotel ini merupakan tempat di tengah-tengah kawasan restoran dan di sekitar dengan tamu. Ada sebuah tempat penyimpanan untuk perlengkapan menyelam dan menyelam besar. Masing-masing kamar memiliki kamar mandi dengan toilet. Kamar-kamarnya bersih dan didekorasi dengan kelompok-kelompok secara efektif. Ada kemungkinan wifi, tapi itu tidak diperlukan untuk berurusan dengan fakta bahwa itu tidak terlalu cepat. Staf sangat ramah dan siap membantu. Makanan di restoran sangat baik dan memiliki banyak pilihan makanan. Untuk memesan ikan panggang yang sangat baik. Dekat toserba dan beberapa…",4
35,Penida Dive Resort,"Kami menikmati waktu di penida dive resort. Kamar yang bagus dan bersih dengan makanan yang sangat baik. Menyelam sangat bagus. Staf yang sangat ramah dan membantu. Berkendara skuter ke crystal bay adalah sekitar 15 menit, tempat anda dapat melakukan snorkeling. Jika anda bukan seorang penyelam dan masih ingin untuk melihat manta ray, anda dapat naik ke manta point di skuter, ini akan membawa anda sekitar 1 jam karena road mendapatkan semakin buruk.",5
36,Penida Dive Resort,"Dive resort adalah berjalan kaki singkat dari Maruti express, yang datang dari dan ke sanur, bali. Kamar dasar, tetapi sangat bersih, hanya mandi air dingin. Makanan adalah terjangkau dan enak. Staf sangat ramah. Mereka memiliki bagus tempat duduk beratap, di mana anda dapat duduk dan mengobrol dengan tamu lain.",5
