,hotel,review,stars
82,TS Hut Lembongan,"Saya dan istri saya telah datang ke bali untuk lebih dari 30 tahun. Kami adalah kebanyakan ditarik ke bali karena orang-orang bali yang ramah dan mereka membantu dan ramah alam. Orang bali masih memiliki yang indah alam mistis, meskipun semua wisata kegiatan yang telah diambil alih pulau ini.  Di nusa lembongan yang sama kami menemukan membantu dan ramah alam di ts hut dengan Widia, loh dan 2 anak laki-laki, tapi tanpa semua aktivitas di bali. Kami tinggal selama 8 hari dan memiliki waktu yang fantastis. Sarapan baik, dengan ikan segar biasanya menangkap pagi itu oleh Widia di perahu dan dimasak di bbq untuk makan malam. Ada rentang yang baik dari makanan di menu. Widia dapat mengambil anda snorkeling atau berselancar di outrigger perahu, mendapatkan sebuah skuter yang…",5
83,TS Hut Lembongan,"Pasangan saya dan saya sendiri memiliki keduanya bepergian ke lembongan beberapa kali, telah tinggal di berbagai tempat yang berbeda di seluruh pulau, di tinggi dan rendah anggaran dan tempat ini adalah jauh favorit kami.   Whydia dan keluarganya sangat ramah dan akan melakukan benar-benar apa-apa untuk anda. Saya sendiri seorang peselancar dan ia lebih dari senang untuk saya untuk menggunakan pilihan papan surfing, dan memiliki penggunaan perahu untuk membawa saya ke semua tempat surfing untuk biaya yang kecil. Saya mengerti dia menggunakan hotel ini untuk perjalanan snorkeling dan semua keluarga kami telah bertemu di sepanjang jalan telah mengatakan perjalanan ini adalah fantastis. Mereka akan mengatur apa-apa di sini untuk anda, pijat, hari perjalanan, menyewa skuter dan…",5
84,TS Hut Lembongan,"Karena saya duduk oleh kolam mempertimbangkan kehidupan... Siapa aku bercanda... Saya berbaring di tepi kolam renang tidak melakukan banyak. Setelah pemesanan akomodasi yang dikelola keluarga ini oleh kesempatan kami lebih dari senang dengan hasilnya. Setelah sambutan yang bersahabat dari Widia, 2 teman yang akan tinggal dengan kami & 2 lebih banyak melakukan hari perjalanan kami bertanya apa kami telah merencanakan. Mengangkat bahu kami, kami diminta jika kami ingin pergi snorkeling oleh tuan rumah kami. Setelah setuju, ia berkata bahwa saya akan mendapatkan saya perahu dan melihat anda di pantai dalam 15 menit. Dan membawa kami untuk beberapa jam fantastis snorkeling.  Baik layanan dan keramahan memiliki hanya berlanjut. Makanan telah besar dari makan malam yang host saran…",4
85,TS Hut Lembongan,"""Partisipasi ts hut keluarga"" - apa pengalaman yang fantastis! Tempat ini benar-benar memiliki itu semua dan layanan dan keramahan yang kami terima melampaui semua harapan. Kami tiga orang yang berbagi sebuah bungalow untuk dua malam. Bungalo ini masih baru, luas, super bersih, dengan tempat tidur yang nyaman. Baik ac, wifi dan air panas. ""Udara terbuka"" kamar mandinya bagus! Handuk bersih. Sarapan padat. Kolam renang sangat bagus dan bersih. Lokasi adalah besar, ini adalah tentang dua menit berjalan kaki ke mushroom bay di mana kapal tetes anda off/akan menjemput anda. Anda juga dapat dengan mudah berjalan untuk dream beach dan devil's mengelupas dari sini. Kami memesan perjalanan snorkeling fantastis dengan pemilik dan perahu - pikiran bertiup kehidupan laut dan mengelilingi;…",5
86,TS Hut Lembongan,"Menginap di sini selama 5 malam dan aku agak sedih untuk menulis tinjauan ini karena saya akan sangat senang untuk memberikan sebuah ulasan mengoceh seperti yang orang lain telah. Mari kita mulai dengan hal yang bagus. Untuk harga, kamar dan fasilitas di ts hut sangat menyenangkan. Wifi cukup layak, yang merupakan poin penting secara pribadi seperti yang saya telah tinggal di hotel lain di perjalanan saya ke lembongan tahun lalu dan konektivitas internet, seperti di banyak hotel di pulau, adalah masalah parah. Ada beberapa poin yang terpengaruh dari pengalaman kunjungan, namun.   Untuk satu, kedua teman saya dan saya menemukan pelayanannya agak suam-suam kuku, jika bahkan yang. Ini adalah sedikit kekecewaan terutama setelah membaca banyak ulasan positif di tripadvisor. Kami…",4
87,TS Hut Lembongan,"Mencintai kami tinggal di ts huts. Tinggal 5 malam dengan kami 2 remaja di pondok. Kolam renang yang bagus dan makanan yang baik. Menyewa skuter dari pemilik dan pergi snorkeling perjalanan dengan pemilik. Saya suka nusa lembongan, pulau kecil dengan banyak untuk melakukan.",4
88,TS Hut Lembongan,"Benar-benar tempat yang bagus di pulau yang indah. Pondok sangat baik dihiasi, kamar mandi luar terlihat bagus dan kolam renangnya tepat sebelum anda bedroomdoor dan benar-benar bersih. Pemilik dan istrinya sangat ramah dan dapat mengatur perjalanan seperti snorkeling, memancing dll. Makanan begitu baik bahwa kami telah kami makan malam setiap malam di hotel. dekat dengan pantai. Pergi ke molamola house untuk santai beachday",5
89,TS Hut Lembongan,"Ts hut terletak sangat dekat mushroom bay. Hotel ini sangat kecil (5 kamar) tetapi memiliki kolam renang yang bagus. Villa ini sangat baik, tapi memiliki beberapa kelemahan. Terbukanya-mandi kami memiliki lapisan kapur dan watertemperature tidak konstan. Juga, kamar memiliki cahaya kurang.   Pemilik ts hut adalah ramah dan santai, dan selalu ada suasana yang santai di ts hut.  Lembongan secara umum adalah tranquile besar tempat untuk tinggal beberapa hari. Ada beberapa menarik dan snurkling divespots. Kekecewaan utama adalah bahwa pantainya tidak sekali karena coral, seaweedfarms dan perahu",4
90,TS Hut Lembongan,"Ts hut adalah tempat terbaik di nusa, dan lokasi yang tepat, hanya 50 meter ke pantai dan layanan adalah yang terbaik! Pemilik dan istrinya akan menyambut anda dan memperlakukan anda seperti keluarga.  Menyewa skuter untuk menjelajahi pulau atau pergi snorkeling, tuna memancing dll. dengan pemilik dan anda akan diambil peduli off. Pengalaman hidup yang menyenangkan di nusa di ts hut.  Best thomas dan keluarga.",5
91,TS Hut Lembongan,"Ts huts adalah di lokasi yang sempurna, berjalan kaki singkat dari mushroom bay yang indah. Pondok pribadi kami adalah dihiasi dengan baik, memiliki kamar mandi luar ruangan yang lucu dan tempat tidur yang sangat bagus! (Sedikit gelap di kamar, seperti lampu tidak terlalu kuat!) Widia dan istrinya sangat ramah mengatur untuk menyewa skuter, snorkeling, dan transportasi ke hotel kami yang lain. Sarapan termasuk dan lezat! Kami mencintai mencelupkan di kolam renang yang indah mereka dan mengobrol dengan tamu lain. Semua orang sangat nyaman dan merasa sedikit seperti keluarga!  Pastikan anda memiliki banyak uang tunai, dan mereka tidak memiliki mesin kartu kredit! ",5
92,TS Hut Lembongan,"Widia dan lo membuat tim yang hebat di Mushrooom beach di ts hut lembongan, berusaha untuk melayani tamu inginkan. Nilai dan lokasi yang bagus. Baik kamar, kolam renang, dan kebun. Bagus untuk surfers dan penggemar snorkeling, serta keluarga.",4
93,TS Hut Lembongan,Itu adalah tempat yang sangat bagus hanya untuk tidur dan makan sarapan pancake di mana YUMMMMMMM! Tempat tidurnya sangat baik saya hanya suka mendengar crokruls di pagi hari. Widia dan istrinya indah orang pernah dan ada anak-anak sangat lucu. Saya suka lokasi hotel ini adalah yang terbaik tidak untuk jauh dari pantai tapi tidak terlalu jauh di tanah itu hanya sempurna.,5
