,hotel,review,stars
0,TS Hut Lembongan,"Kami tidak tinggal di sini, kami telah dimakan di sini beberapa kali meskipun.  Makanan adalah untuk mati untuk!  Kami makan BBQ tuna gigi anjing yang dimasak di depan kami.  Ini adalah besar tuna steak yang terasa benar-benar luar biasa.  Banyak sayuran & nasi juga.  Staf mereka sangat ramah & sangat sopan.  Sangat direkomendasikan.",5
1,TS Hut Lembongan,"Saya menginap di Pondok Indah ini adalah hanya apa yang saya butuhkan. Staf ramah dan membantu, kolam renang yang menyegarkan, dan kamar saya sangat bagus, bersih, dan luas. P. S untuk sarapan pancake pisang mereka lezat! ",5
2,TS Hut Lembongan,"Secara keseluruhan, ini adalah tempat yang baik untuk tinggal dan nilai yang baik. Keluhan terbesar kami adalah suara yang datang dari bar di seberang jalan di malam hari. Juga, pilihan sarapan sangat kecil tapi masih ok. Ini adalah titik awal yang bagus untuk perjalanan dan melihat pulau dengan skuter, yang Anda dapat menyewa di situs web. Mushroom Bay yang berjalan kaki singkat ke banyak restoran yang bagus diberikan pilihan yang baik. Sementara di properti, itu sendiri kecil surga di tanah yang terawat dengan baik dan staf yang sangat membantu.",4
3,TS Hut Lembongan,"Apa tempat yang menarik! Kamar bersih, kamar mandi luar yang bersih dan baik - terawat dengan baik. Kolam renang yang biasanya tenang dan sangat bersih. Sarapan sangat baik, tidak bisa mengeluh karena itu cukup sulit untuk mendapatkan apa pun di Lembongan.   Beberapa jam setelah kami check in, kami berdua punya keracunan makanan dari Bali. Staf membawa saya ke apotek untuk mendapatkan obat dokter lokal/di sepeda motor dan saya berterima kasih untuk itu.   Tempat ini di seberang jalan (mungkin satu-satunya) keren bar. Kurang dari 5 menit berjalan kaki ke Mushroom Bay, dan 15 - 20 menit berjalan kaki ke pantai yang lain di sekitarnya. Tempat yang sempurna jika Anda tidak akan pergi di sekitar sepeda motor.   Saya pasti akan kembali lagi.",5
4,TS Hut Lembongan,"Kami tinggal di pondok di Februari 2017 TS untuk 6 malam.    Ketika Anda turun dari perahu di Teluk jamur itu adalah sekitar 100 meter dari pantai untuk sampai ke pondok TS (penduduk desa akan mengarahkan Anda dalam arah yang benar dengan senyum)  Ketika kami pertama kali tiba di meja depan kami disambut dengan senyum, dan smoothie yang menyegarkan towelette lembab yang sangat dihargai di Hari yang Panas! Pemilik mengambil waktu untuk menunjukkan Widia kami tempat objek wisata utama di pulau pada peta.    Mereka akan mengatur transportasi, penyewaan skuter, snorkeling tur atas permintaan, yang kami sangat merekomendasikan.  Ini adalah sebuah keluarga yang dimiliki bisnis dan mereka akan memastikan bahwa Anda tinggal adalah menyenangkan dan nyaman. Staf adalah ramah dan membantu.…",5
5,TS Hut Lembongan,Katut dan dia Tim pergi keluar jalan mereka untuk membuat saya merasa senang dan nyaman. Pondok yang indah dan luas. Kamar mandi juga. Sangat bersih dan area kolam renang di luar sangat menakjubkan. 2 menit dari pantai jamur di mana ada banyak bar pantai dan daerah pantai pribadi kecil di atas tebing. Terima kasih untuk keramahan Anda pasti akan kembali xx,5
6,TS Hut Lembongan,"Kami memesan pada ulasan sendirian dan mencintai segala sesuatu tentang tempat ini. Foto-foto yang akurat. Kami mengambil perahu dengan Marlin (lagi pilihan yang lain dan mendarat kami berjalan kaki ke TS pondok, mungkin kami beruntung! ) TS memiliki lokasi (mushroom Bay) staf, besar kamar, kamar mandi, kolam renang, daftar terus di skuter. Ts adalah salah satu favorit kami tinggal di tiga bulan liburan, sayangnya kami hanya memesan 1 hari untuk Lembongan (bisa dengan mudah menghabiskan satu minggu) tetapi ini adalah tempat yang tepat untuk menginap! Pesan TS Pondok anda akan tidak akan kecewa dan ini sangat terjangkau! Terima kasih ts pondok. Kami berharap kami masih ada dengan Anda dan staf Anda! ",5
7,TS Hut Lembongan,"Saya tidak dapat pujian cukup tentang tempat ini. Teman saya tinggal di sini karena kami telah memesan tempat lain, tapi waktu berikutnya saya berada di Lembongan saya pasti akan di sini sytaying. Kamar yang indah, kolam renang yang indah. Makanan yang sangat baik. Spa yang sangat baik. Ini adalah sebuah keluarga menjalankan bisnis lokal. Keluarga yang menjalankan hotel ini dan staf mereka luar biasa. Kami makan beberapa makanan kami di sini karena makanan yang lezat dan dengan harga yang masuk akal. Sebenarnya semuanya cukup harga kamar, perawatan spa. Memiliki pijat di spa mereka ketika salah satu teman-teman saya menikmati pijak refleksi dan wajah yang lain. Kami semua sangat senang dengan perawatan. Hari terakhir kami di pulau dan kami memiliki sarapan di pondok TS karena…",5
8,TS Hut Lembongan,Ts pondok yang dimiliki dan dijalankan oleh keluarga lokal yang tinggal di Lembongan Bailiense.  Properti dan kamar yang indah dan selalu bersih dan mereka memiliki besar kolam renang yang indah dan menyegarkan.  Seluruh keluarga pergi keluar dari jalan mereka untuk menjaga Anda dan Anda dapat merencanakan segala sesuatu yang Anda ingin lakukan atau lihat di sana dengan mereka.  Mereka membantu keluar dengan mengubah kembali perahu kali dan berharap ke teman saya taksi truk untuk memberikan teman saya tas dia lupa ketika kami meninggalkan pulau dan dia bahkan tidak menginap di TS pondok!  Mereka memiliki Bingtangs terdingin di pulau yang sangat bagus setelah hari yang panas keluar dan makanan yang selalu segar dimasak dengan cinta hanya selera yang baik.  Jika Anda ingin Otentik…,5
9,TS Hut Lembongan,"Kami tinggal di pondok untuk 2 malam TS. Ini adalah pertama kalinya kami di Lembongan jadi tidak yakin di mana untuk memesan. Menemukan pondok TS di sini dan kami sangat senang menginap di sana.  Proses check in sedikit keluar dari pusat kota dengan tidak ada meja resmi atau seseorang untuk menyambut kami.  Setelah check in, kami tidak tahu bagaimana untuk sampai ke pondok atau tempat itu, hanya diberikan kunci. Ini bukan masalah besar karena tidak ada banyak pondok di properti.  Pondok itu sendiri sangat baik, dengan tempat tidur yang besar dan sangat bersih.  Kamar mandi luar adalah sangat indah dan kembali ke alam. Satu-satunya keluhan akan kurangnya Pondok hangat/air panas di kamar mandi. Air adalah dingin tapi kami berada di sana ketika suhu cukup hangat sehingga air dingin…",4
10,TS Hut Lembongan,"Kami menemukan pondok dengan meminta penduduk setempat untuk TS makanan terbaik di pulau. Cukup aneh kita melihat hampir tidak ada yang memiliki makan malam ada dan makanan yang benar-benar adalah yang terbaik, dan tidak mahal! Permata tersembunyi! Mencoba tuna kari merah jahe, atau rahasia kari ikan yang tidak pada menu.  Kami berbicara kepada pemilik tentang snorkeling dan mereka sangat ramah dan layanan berpikiran, tidak mendorong dan sangat membantu. Kedua kalinya kami kembali ke Lembongan dari Nusa Penida kami memutuskan untuk tinggal di sana. Dan tidak ada kejutan, ini adalah yang terbaik yang kami tinggal di perjalanan kami dari sepuluh tempat yang berbeda! Taman hijau yang nyaman, kolam renang dan matahari kursi, dan sebuah pondok yang cantik dengan langit terbuka kamar…",5
11,TS Hut Lembongan,"Saya tinggal dengan istri saya selama tiga malam di kamar pondok 2. berukuran bagus dan dalam kondisi baik, tempat tidur, bantal dan linen yang nyaman dan AC bekerja dengan baik. Pemilik dan staf yang sangat ramah. Kolam kecil yang bagus jika tidak ada tamu lain yang menggunakan hotel ini dan di sana adalah selalu tersedia kursi. Kamar mandi di luar kamar kami yang sedikit saya attracked nyamuk dan istri saya mandi air panas kadang-kadang hanya sedikit berbahaya dan aneh untuk digunakan. Hotel ini tepat di sebelah jalan dan sepeda motor balap (kotoran sepeda) jalan di 6:00 pagi membangunkan kami. Botol air tidak termasuk dalam harga yang adalah pertama kalinya saya bepergian ke Asia. Sarapan adalah sederhana namun dimasak untuk memesan dan jus segar adalah yang terbaik. Hal yang…",4
12,TS Hut Lembongan,"Menginap selama 4 malam. sangat ramah keluarga yang dimiliki bisnis. Kamar sederhana tapi bagus, bersih dan nyaman.  Kolam renang indah, makanan Indonesia. Merekomendasikan melakukan semua skuter, snorkeling, dan - di melalui orang-orang.",4
13,TS Hut Lembongan,"Terletak hanya 100 m di jalan dari Mushroom Bay, terpencil ini bungalow di taman yang indah dan akomodasi yang sempurna untuk memulai liburan kami. Kamar menginap sangat keren dengan AC dan kipas angin, dan kamar mandi luar ruangan yang menyegarkan dan dirancang dengan indah. Makanan di TS HUT adalah setara jika tidak lebih baik dengan sekitarnya - di notl seperti Anda makan di hotel (yang saya akan tidak pernah melakukan cukup banyak), itu sama seperti warung lainnya di strip, tapi harga yang baik.   Staf dapat mengatur cukup banyak apa pun Anda dari skuter dan menyelam untuk transfer ke perahu. Menyukainya dan pasti akan kembali.",5
14,TS Hut Lembongan,"Harga yang baik, tenang, bergaya vila kecil tradisional dengan kamar mandi terbuka, dalam pengaturan taman yang menyenangkan. Menu makanan standar, tetapi baik. Hanya 50 - 100m berjalan kaki ke pantai jamur dengan pemandangan gunung agung di bali dari pantai dan kafe... Menurut pendapat saya pantai terbaik di pulau kecil, terutama ketika air pasang naik... ini juga berjalan jarak ke tamarind bay tapi 150-300m. Ada banyak tempat untuk makan sepanjang pantai jamur rd jika anda ingin mencoba sesuatu yang lain dan pondok memiliki sepeda motor untuk ts pemilik menyewa di AU $7 (sedikit lebih dari bali. Saya pikir), itu tarif standar di sini... Ini jauh lebih aman daripada kuda di bali karena jumlah pengguna secara drastis di bawah jalan... Lembongan sebelum kunjungan ini adalah…",4
15,TS Hut Lembongan,Tuan rumah yang sangat baik dan fasilitas. Kamar mandi pribadi di luar adalah ide yang brilian. Ac pribadi bungalow sangat nyaman. Tidak ada masalah dari surfing pelajaran untuk menyewa dari sepeda motor untuk tur. Saya akan sangat menyarankan. ,5
16,TS Hut Lembongan,"Bagus, tempat yang tenang. Pondok yang sangat bagus, bersih, segala sesuatu yang berubah setiap hari, kolam renang yang bagus, staf yang sangat baik, makanan yang sangat baik. sangat dekat dengan pelabuhan kecil, jadi kurang dari 1 menit berjalan kaki ketika anda tiba untuk mushroom bay - tidak perlu naik taksi. Juga karena tidak ada banyak pondok tempat ini tidak terlalu ramai, jadi anda dapat berenang sendirian di kolam renang. Secara keseluruhan sangat bagus!",5
17,TS Hut Lembongan,"Ini adalah benar-benar yang terbaik tinggal selama 2 minggu perjalanan kami ke bali. Lembongan yang tenang dan indah, dengan penduduk setempat yang lebih daripada wisatawan, yang membawa anda dengan suasana yang hebat. Hotel ini memiliki besar makanan, penyewaan skuter, dan murah, yang memberi anda kesempatan besar untuk menjelajahi pulau lembongan dan Cenangan. Staf juga benar-benar luar biasa!  Pesan sekarang!",5
18,TS Hut Lembongan,"Jauh dari hiruk pikuk bali, tempat ini dalam dosis valium! sangat santai, tenang, pondok kecil yang indah, kolam renang yang bagus, berjalan kaki singkat ke pantai. Tuan rumah adalah sangat ramah dan membantu. Tidak bisa lebih bahagia dengan pilihan kami untuk tinggal 1 minggu. Bit terbaik - tempat tidur yang sangat nyaman, ac dan kipas angin, kolam renang yang bersih, taman yang indah. Makanan yang baik juga. ",5
19,TS Hut Lembongan,Kami menikmati kami tinggal dan menghabiskan waktu bersantai di sekitar kolam renang dan mengobrol dengan tamu lain. Ada 7 tipe bali pondok di taman pengaturan dengan kamar mandi di luar dan area kecil duduk di depan. Ruangan itu nyaman tetapi kamar mandi tidak dibersihkan dengan baik dan kami harus meminta untuk mendapatkan handuk segar. Kami hanya bertemu dengan pemilik ketika kami tiba dan di pagi hari kami pergi. Restoran kecil di depan itu menyenangkan tapi kami terutama makan di tempat lain. Bar di seberang jalan yang sangat baik membuat omelettes.,4
20,TS Hut Lembongan,"Saya dan keluarga saya telah baru saja kembali dari 3 malam di gubuk ts. Lokasinya hanya 100m dari pantai. Pemilik dan staf yang sangat ramah dan senang untuk membantu. Kolam renang adalah indah melarikan diri dari panas. Menawarkan layanan skuter untuk 70, 000rp/hari menyelam dan perahu yang kami menikmati. Bungalow pondok sederhana tetapi memiliki semua yang anda butuhkan. Semua dalam semua, baik nilai untuk uang.",5
21,TS Hut Lembongan,"Kelebihan:  * Lokasi strategis, dekat dengan mushroom bay  * kamar dan tempat yang sangat tenang, hanya beberapa pondok  * Interior pondok indah  * Kolam renang yang menarik, walaupun kecil  * ide yang bagus dengan openbathroom  * Harga per malam  * Selain itu bisa memesan Activieties  * staf yang sangat membantu  * Indah, baik terus taman  Kekurangannya:  * Lingkungan yang bising di pagi hari, namun seharusnya tidak menjadi masalah untuk awal burung  * Kamar bisa menjadi lebih rapi  * Fasilitas yang tidak terlalu baru  * Tidak ada air gratis, yang agak standar di tempat lain di asia  * Handuk tidak terlalu rapi dan tidak berubah  * sarapan sangat sederhana, meskipun disajikan minuman (kopi dan jus) yang sangat bagus  Keuntungan dari tempat ini adalah indah dari lokasi. Kami…",4
22,TS Hut Lembongan,"Pemilik adalah luar biasa, tempat ini adalah tempat yang indah, lokasi yang besar, sangat dekat dengan pantai jamur - ini sangat indah. sangat lezat, segar makanan, untuk sarapan, makan siang & makan malam. Saya sangat merekomendasikan snorkeling perjalanan - ikan yang menakjubkan & terumbu karang. Hanya ada 1 atm di lembongan, kami kehabisan uang pada hari minggu, pemilik mengambil saya mitra di sana pada sepeda, tapi atm yang keluar dari uang. Pemilik kemudian ditawarkan untuk meminjamkan kami uang, bahkan meskipun kami orang asing, sikap yang besar, dia mengatakan bisa membayar kembali ketika kami kembali ke sanur, kami bukannya membayar dengan kartu kredit tetapi meninggalkan sikap ini membuat saya merasa senang & bagian dari komunitas - kepercayaan orang asing. Akan sangat…",5
23,TS Hut Lembongan,"Kami menginap untuk 2 malam, tidak jauh dari pantai jamur. Kamarnya sederhana, bersih dan manajer sangat ramah dan membantu. Kami pergi pada snorkeling tur dan manajer mereka tinggal di tempat yang aman, memberi kami banyak waktu dan ruang. Kami menyewa sepeda motor untuk $7 untuk satu hari untuk berkeliling di pulau ceningan dan di sebelah tempat ini adalah tempat yang sangat aman dan mudah pergi. ",4
24,TS Hut Lembongan,"Saya menginap 2 malam di pondok ts di lembongan. Saya disambut di masuk dengan jus segar dan handuk dingin, yang bagus. Setelah mengisi dokumen check in. Saya dibawa ke kamar saya.  Setiap kamar adalah sebuah pondok dengan pintu kaca geser dan kamar mandi luar ruangan. Ada gelap kayu langit-langit yang tinggi dengan ac dan kipas angin langit-langit. Kamar juga memiliki yang aman yang bekerja sangat baik. Ada kelambu nyamuk di sekitar setiap tempat tidur yang mereka datang dan mengatur untuk anda di malam hari.   Penting untuk dicatat, ini adalah sebuah pondok; ada celah besar di dinding di mana dinding dan langit-langit ""terhubung"" dan ada ruang yang anda dapat melihat cahaya melalui di dinding kayu. Saya mengatakan ini karena anda harus menjadi siap untuk beberapa ""liar"" di…",4
25,TS Hut Lembongan,"Kami pergi ke lembongan untuk ketiga kalinya. Pertama/kedua di indiana kenaga dan kedua di lembongan beach club. Kedua kelas pertama, sangat bagus.  Tapi... Apa yang tidak anda dapatkan adalah bahwa anda mendapatkan perasaan akrab dengan keluarga di ts pondok! Pemilik tidak bisa lebih ramah dan melakukan apapun untuk anda! Kami menyukai makanan sehingga kami meminta untuk kelas memasak pribadi! Sekali untuk nasi goreng dan kari ikan (ikan terjebak di pagi hari oleh widia... Memakan mahi mahi yummy!) tidak ada masalah.   Kamar pondok yang tentu saja, tapi bersih, nyaman dengan kamar mandi luar ruangan besar... Kolam renang dan taman yang indah juga.   Meskipun kami bisa tinggal di suatu tempat lebih mahal lain kali kami kembali, kami tidak akan. Tidak ada yang mengalahkan…",5
26,TS Hut Lembongan,"Jangan espect modern fasilitas di sini... !  Tidak ada tv, ac siap, pemandangan yang bagus, tempat yang bagus... !  Harga yang murah untuk makanan di pulau (dibandingkan dengan bali)  Banyak permainan air!  Pulau kecil jadi kurangnya transportasi! Hanya menyewa sepeda, dan transportasi umum dengan terbuka mengambil mobil untuk tur pulau!",4
27,TS Hut Lembongan,Kami datang ke sini untuk makan siang karena dekat ke resort kami. Makanan dimasak segar ketika kami tiba jadi anak-anak yang berenang di kolam renang sementara kami menunggu. Di dalam daun pisang snapper yang luar biasa. Staf di ts juga membantu mengatur perjalanan memancing. Mereka juga menyewa skuter dan mobil.,4
28,TS Hut Lembongan,"Tempat ini seperti suasana santai yang indah. Hanya ada 8 pondok dan masing-masing merasa cukup pribadi. Mereka adalah baik dan kamar mandi luar ruangan yang memanis keren. Kolam renang adalah cantik juga.   Hal yang besar bagi saya adalah kenyamanan sangat singkat berjalan kaki dari mushroom bay, di mana terdapat baik restoran dan bar. Hotel ini juga mudah untuk mendapatkan dengan menyewa skuter dari ts yang butuh lima menit untuk tua dan jauh.   Akan menginap lagi ",4
29,TS Hut Lembongan,"Saya dan mitra saya tinggal di pondok ts untuk dua malam dan memiliki waktu yang indah. Kami memesan tiket feri kami kembali dari tur di oberoi street bintang di seminyak dan itu termasuk penjemputan di agen wisata, perjalanan ke sanur untuk feri, dan transportasi dari pelabuhan di nusa lembongan untuk ts pondok (dan kembali dalam sehari). Kami memesan melalui pemesanan. com dan dibayar tunai pada saat kedatangan. Selama kami menginap, kami menyewa sebuah sepeda motor, pergi snorkeling dan perbelanjaan di lemari es mini dan bill adalah $170 aud biaya kami. Transportasi dan kegiatan yang dapat diatur melalui bagian penerima tamu. Kita tidak memesan sarapan, karena sarapan untuk memesan dari menu. Sarapan adalah baik dengan roti panggang, telur, nasi goreng atau mi goreng/(nasi…",4
30,TS Hut Lembongan,"Kami tinggal di pondok untuk 4 malam ts lembongan selama kami menginap di lembongan.  Mereka membantu kami dengan cara yang nyaman ketika kami tiba dan memberi kami peta, jus segar, handuk dingin dan saran apa yang harus dilakukan. Kemudian kami diperiksa di dan melihat kamar kami. Ini adalah hanya sangat indah tetapi itu adalah tenang kecil. Kami memiliki kipas angin dan ac. Kamar mandi adalah di luar yang adalah baik dan tenang. Kamar mandi tidak mendapatkan hangat dan aku cukup yakin itu air asin. Sama untuk tab air.  Kamar kami tidak memiliki kelambu sehingga kami mendapat dimakan hidup-hidup di malam hari - yang tidak benar-benar baik.  Ada juga tidak cukup lampu di dalam kamar.  Kami memiliki sarapan gratis termasuk dalam harga kami. Kita bisa pilih antara pancake berbeda,…",3
31,TS Hut Lembongan,"Saya akan mungkin salah tempat ini kepada siapa pun. Aku arrivded di pulau tanpa reservasi dan aku berhenti di sini karena kami datang di, dan lo Widia. Mereka adalah orang-orang besar dan staf bekerja di sini yang sangat bagus secara merata. Tempat ini berlokasi di dekat pantai strategicaly gratest di pulau ini. Fisher Widia adalah tradisional pria, memiliki kapal untuk memancing dan ia dapat menawarkan anda pengalaman yang hebat untuk snorkeling. Menawarkan Widia paling luas dan pengalaman snorkeling yang luar biasa. Saya telah sejauh ini dalam hidup saya. Mereka memiliki sebuah restoran yang bagus dengan terasse dan makanan! Super menyenangkan!",5
32,TS Hut Lembongan,"Saya dan istri saya memiliki nasib buruk dengan akomodasi kami sebelumnya di bali sebelum tiba di nusa lembongan jadi kami sangat senang untuk menemukan bahwa ts hut adalah persis bagaimana itu tampak online. Pondok adalah luas dan bersih dengan ac dan teras besar yang menghadap halaman rumput yang terpangkas rapi, yang menghubungkan semua bulat. Restoran adalah besar dan harga masuk akal dan staf sangat ramah dan siap membantu dengan menyewa skuter untuk hari. Kita kehilangan kamera kami selama kami menginap, dan mereka membantu kami menemukannya juga. Jika anda pergi ke nusa l, anda harus tinggal di setidaknya bay. Kami menjelajahi seluruh pulau dan sekitar nusa Cenida, dan mushroom bay memiliki pantai terbaik dan sejauh pilihan terbaik untuk tempat untuk makan dan minum di…",5
33,TS Hut Lembongan,"Tinggal 7 malam Memesan ruang keluarga namun pada saat kedatangan diberikan 2 pondok. Tidak ideal sebagai istri saya dan saya telah tinggal secara terpisah seperti anak kecil tidak bisa tinggal pada mereka sendiri.  Di luar kamar mandi dan keran dll adalah semua kotor dan membutuhkan perbaikan serius. Semprotan air panas hanya shower. Tim dukungan tripadvisor panggeng setiap hari selama hari itu sangat menjengkelkan, seperti kamar kami tidak memiliki cahaya alami dan tidak bekerja Tidak akan kembali ",3
34,TS Hut Lembongan,"Pemilik tempat ini adalah suami istri yang baik yang berbicara bahasa inggris.  Restoran/warung terlampir ke pondok yang fantastis dengan pukta di indonesia dan barat logislah  harga. Kolam itu hangat dan bersih dan taman yang indah. Itu adalah berjalan kaki dari mushroom bay. Kamarnya bersih dan kamar mandi adalah di luar ruangan.  Aku tidak akan tinggal di sini lagi meskipun untuk alasan berikut.  Aku memesan bulan di muka melalui agoda 8 diri yang dinyatakan sebagai $100 per malam dengan diskon 45%. Namun, jika saya telah memesan bulan di muka saya akan dibayar $70aud per malam.  Ini adalah benar-benar hanya tempat tidur ukuran tempat tidur. Terburuk makanan yang saya sepuluh tahun ini berlangsung lama tubuh.  Tidak ada jaring nyamuk di tempat tidur. Dengan kamar mandi luar…",3
35,TS Hut Lembongan,"Kami sedang mencari untuk makan ikan segar di sekitar mushroom bay area dan melewati tempat kecil ini lucu advertlsing memaki orang. Itu adalah apa yang telah saya, dan itu adalah sempurna panggang dan itu datang dengan saus manis bali, nasi dan sayur, persis apa aku diperlukan. Ini adalah khusus hari itu jadi saya tidak yakin seberapa sering mereka melakukan itu. Saya merekomendasikan hotel ini.",5
36,TS Hut Lembongan,"Ts hut di lembongan adalah sebuah permata tersembunyi. Pacar saya dan saya menghabiskan 9 malam di sana baru-baru ini, dan benar-benar mencintai tempat ini. Widia, istrinya, dan sisa staf yang ramah dan sangat menarik. Kamar yang sangat bersih dan indah, penyejuk bekerja dengan baik, dan kamar mandi adalah sejuk di luar ruangan itu. Area kolam renang benar-benar bagus dan santai juga. Sebagai payung pantai, dan makanannya luar biasa. Semua ini, dan dengan harga yang sangat kompetitif. Kami pasti akan tinggal di sana lagi ketika kita selanjutnya mengunjungi lembongan.",5
37,TS Hut Lembongan,"Untuk $60 malam - anda mendapatkan sebuah pondok oleh diri, queen size bed, aman, benar-benar baik, shower dan toilet luar dan anda dapat menatap bintang. Hotel dekat tempat. Terbaik untuk mencoba jus semangka dan pisang pancake. Pemilik Wadia loh dan keduanya sangat baik. Kolam renang santai dan hangat. Restoran terbaik di bali hai ada raja udang panggang dan dengan staf yang memiliki senyum yusnya dan layanan terbaik.",3
38,TS Hut Lembongan,"Orang-orang hebat dan tempat yang bagus untuk tinggal. Itu sangat cantik! Kamar bersih dengan besar dan lemari es. Sedikit gelap di kamar di malam hari, tapi tidak ada masalah untuk membaca buku. Nyonya rumah adalah sangat membantu jika anda ingin menjelajahi atau pesan sesuatu di pulau ini. Tempat ini dekat dengan pantai jamur. Tempat yang bussy selama siang hari, tapi enak untuk berenang atau memiliki baik makan siang. Terdapat mini mart tepat di sebelahnya. Ini adalah tempat keluarga jika anda pergi ke lembongan! ",4
39,TS Hut Lembongan,"Itu benar-benar tergantung apa yang anda ingin memiliki pengalaman. Pulau kecil lembongan adalah pengalaman dengan pantai utama dan sederetan pantai smaiier - masing-masing memiliki infrastruktur untuk mendukung setidaknya restoran atau hotel atau tiga. Mushroom bay (atau ts bay sebagai Widia akan memperbantahkan semenggah di dalam nama) adalah di jalur ke pantai utama dan berjalan kaki singkat ke pedalaman dari pantau ada ts hut. Kami sebagai keluarga dewasa empat malam adalah sekelompok tujuh. Sayangnya, ada beberapa keluarga lo Widia dan isu-isu yang berarti tidak ada banyak kontak dengan mereka - staf yang menyenangkan, kolam renang dan taman bagus. Lokasi yang nyaman, sarapan baik, kamar - remang-remang, menetes dari sistem alat menguap bercekah di toilet di pondok kami…",3
40,TS Hut Lembongan,"Teman-teman saya dan aku pergi ke lembongan selama beberapa hari sementara di bali. Ketika kami tiba ke ts hut kami menemukan saat pemesanan, tapi keluarga yang berjalan itu sangat tidak mungkin lebih ramah - mereka juga dimasak kami ikan segar dan sayuran kari, melayani kami jus mangga, dan mengurus koper kami. Kami menyukai kami seluruh menginap di sana - kolam renang adalah benar-benar baik, kamar bersih, dan lingkungan yang sangat santai.  Ini adalah berjalan kaki singkat ke pantai, sebuah toko serba ada, restoran, dan lainnya. Hotel ini berjarak sekitar 15 menit berjalan kaki ke pantai & setan mimpi yang baik. Keluarga akan membantu anda menemukan di mana pun anda perlu untuk pergi dan membantu anda mendapatkan lebih jauh dari transportasi jika anda dapat berjalan.   Kami…",5
41,TS Hut Lembongan,Kami memesan hotel ini sebagai tidak senang ketika kami telah memesan di tempat lain dan itu telah kecewa kami. Dan lo Wydia yang luar biasa. Putri kami dalam hukum punya sedikit bali belli dan mereka membuat bubur untukny dan yang benar-benar membantu. Kami pergi snorkeling dan memancing di 2 terpisah hari yang tersedia. Sangat pribadi kolam renang dan daerah di luar kamar. Staf yang ramah. Tempat tidur nyaman. Lemari es di kamar dan wifi. Dimiliki oleh keluarga yang kami cintai. Kita dimaksudkan untuk tinggal selama 3 hari di hotel ini saya menjadi 6..  ,4
