,hotel,review,stars
42,TS Hut Lembongan,"Kamar yang besar di villa yang ternyata menjadi 2 terpisah kamar sehingga benar-benar tidak berhubungan, tidak patut untuk pasangan dengan 2 anak-anak. Kami tidak bekerja di 1 kamar sehingga kita harus pindah ke ruangan lain dengan bekerja lagi. Kamar yang lain memiliki air menetes ke toilet yang menyediakan anda dengan shower baik anda ingin 1 atau tidak. Tidak ada tv atau kopi di kamar seperti yang diiklankan di situs web pemesanan. Pergi mencari tinggal tutup botol bayi dan menemukan g-string yang kotor di bawah lemari es di kamar 1, yang telah jelas tidak telah dibersihkan atau uang keluar. hmm nice. Telah terbukti, bahwa ke pemilik, b ' fast itu dibayar untuk pemesanan dengan ketika mereka mengklaim untuk tidak memiliki catatan/tidak ada informasi ini. Sangat dingin/kasar…",2
43,TS Hut Lembongan,Kami tinggal di pondok 6 malam untuk ts lembongan dan pasti akan datang kembali. Lo Widia dan istrinya yang cantik yang tampak setelah kami seperti keluarga. Tidak ada yang terlalu banyak kesulitan. Anda dapat mengatur semua Widia memancing dan kegiatan air dan apa pun yang anda mungkin memerlukan. Semua yang perlu anda lakukan adalah bertanya. Kamar mandi luar ruangan yang indah dengan kami. Benar-benar layak tinggal di. ,5
44,TS Hut Lembongan,"Tempat mengagumkan dan staf adalah benar-benar bermanfaat! Tiba di ""bali-perut"" sementara aku berada di lembongan dan aku punya beberapa saran yang sangat membantu dari staf dan mereka juga membuat saya nasi-polisi daripada makanan secara teratur. Pondok juga sangat cantik! Cinta yang membuat saya segera setelah aku melangkah di daerah mereka!",5
45,TS Hut Lembongan,"Minuman selamat datang dan handuk dingin pada saat kedatangan  Staf menyenangkan dan ramah - bahkan ingat nama anda  Wifi besar, lokasi baik, di bagian pulau yang lebih bagus  sangat bising - properti di jalan, kami dapat mendengar banyak suara dari tetangga properti hunian. Ada sebuah bar di seberang jalan yang australia sangat berisik dan terus til terlambat - Aku mendapat kesan bahwa daerah ini untuk backpacker Staf tidak berbicara bahasa inggris yang baik - pemilik dan istrinya berbicara sangat sedikit. Pemilik dan istrinya yang sangat ramah, kolam renang yang cukup menyenangkan juga diatur di sebuah kapal nelayan - hal ini! Dan kami akan benar-benar 200,000 IR yang sedang kami gantiny  Tidak ada, tidak ada tv (yang tidak repot-repot kami bahwa ini), tidak ada teh dan kopi…",3
46,TS Hut Lembongan,"Istri saya & tinggal di sini 11 dengan harga untuk minggu setelah hari natal 2014. Maaf untuk akhir review widya! Widya dan istrinya yang luar biasa besar. Ia dapat mengatur semua wisata anda, snorkelling, memancing dll dan harga adalah yang terbaik di pulau dan disediakan oleh diri sendiri, keluarga atau teman-teman. Widya sering memiliki seafood bbq di sore hari setelah perjalanan memancing yang spektakuler. Ia juga memiliki bir terdingin di nusa lembongan! Ts disini adalah kurang dari satu menit berjalan kaki ke pantai. Kamar hotel kami adalah ketika widya untuk mengundang kami untuk menghadiri upacara di kuningan di desa untuk menandai berakhirnya perayaan galungan. Ini adalah luar biasa dan sangat pribadi berkeistimewaan pengalaman budaya dan jika anda di antara hari natal…",5
47,TS Hut Lembongan,Tempat yang bagus untuk tinggal. Lou Widia dan orang-orang yang benar-benar bagus dan sangat healpful. Fakta-fakta sejarah Widia menjadi kari ikan. Sarapan adalah memadai tetapi membutuhkan sedikit membantu. Kolam renang adalah sangat menyenangkan dan santai.,3
48,TS Hut Lembongan,"Sekali lagi lu Widia dan memiliki tampak setelah kami dan staf indah. Kami menghabiskan waktu yang indah empat minggu dengan mereka di pulau dan memiliki waktu yang sangat santai. Bahkan pergi berjalan tahun ini ha ha. Perjalanan ke nusa penida sangat menarik dan saya bisa dari atas tebing yang fantastis di! Kami memiliki tidak ragu-ragu merekomendasikan pondok untuk siapa pun yang ingin ts mendapatkan jauh dari hiruk-pikuk bali, banyak restoran bagus, aktivitas air yang widia dapat mengatur untuk anda termasuk snorkelling, memancing dll. orang-orang akan melihat anda tahun depan jangan anda sampai kemudian, cheers, dave & kathy.",5
49,TS Hut Lembongan,"Kami mengunjungi 2 tahun yang lalu saya dan suami lembongan sekitar. Pada waktu itu, kami menjadi teman baik dengan nelayan setempat widia yang sedang dalam proses membangun bungalow-nya sendiri. Ketika kami meninggalkan kami berkata kami sudah pasti akan kembali satu hari karena kami menyukai begitu banyak pulau kecil! Kami kembali minggu lalu dan kami tidak kecewa. Berada di jalan. Sempurna dalam segala hal... 2 menit berjalan kaki ke pantai dan segala sesuatu yang u dapat perlu di dekatnya... dan istrinya widia pengelola terbaik dan itu adalah pengalaman yang indah, melihat mereka lagi! Makanan lezat dan sangat murah! makanan kecil 2 - 3... akan merekomendasikan siapa pun untuk menginap di lembongan ini benar-benar adalah rumah yang jauh dari rumah. Itu sedih untuk pergi…",5
50,TS Hut Lembongan,"Kami menikmati kami tinggal di sini selama 5 malam di bulan maret. Pondok adalah bersih dan nyaman. Kami hanya masalah adalah bantal yang kecil. Shower air dingin saja di lingkungan yang lembab, tapi itu tidak mengganggu kita. Pancake untuk sarapan sangat baik. Pemilik yang sangat ramah dan tempat ini begitu ramah dan semua staf mereka. Saya menginap dengan pemilik untuk aud 30. Dia membawa kami ke semua menginap di hotel utama. Kami melihat mantra pari, ikan selar sangkaanku raksasa dan ikan lainnya. Menyewa skuter dari mereka untuk 7aud per hari. Pantai hanya berjarak 200m ke jalan. Mini mart hanya 2 pintu turun. Kami benar-benar menikmati kami tinggal di sini dan akan mempertimbangkan tinggal di sini lagi kami kembali ke pulau.",5
51,TS Hut Lembongan,"Saya baru-baru ini memiliki kesenangan untuk menginap di dengan keluarga saya muda anak-anak 3. Tempat ini adalah besar, tuan rumah yang indah, kolam yang bagus, dekat dengan pantai. Eksekusi teroris bom yang dipandu membasahkuyupi Widia adalah bahwa setiap malam, indah suatu bagian terbaik dari ikan yang pernah. Sangat merekomendasikan t s pondok dan ya aku akan kembali.",5
52,TS Hut Lembongan,"Lupa psikolog, memesan diri selama seminggu di hut ts. Stres akan menguap. Akan ada sedikit stres mendapatkan di sana tapi pastikan anda memesan feri perjalanan dari sanur ke mushroom bay. Tidak ada perusahaan lain buku atau itu akan menjadi stres. Itu adalah benar-benar hebat saya! Makanan di restoran yang fantastis, ada sebuah bar olahraga di seberang, hotel ini tak jauh ke pantai. Kolam renang yang bagus di mana anda dapat disajikan bir dan kacang. Pemilik adalah orang-orang bali paling baik yang pernah kami temui dalam dua puluh tahun datang ke sini. Kamar bersih dan rapi dan hanya 9 bungalow yang saya pikir jadi tidak terlalu sibuk. Pemilik minimarket atau sepeda motor atau pijat. Anda tidak perlu untuk bergerak sesentipun. Bawa botol minuman keras atas dan duduk di balkon…",5
53,TS Hut Lembongan,"Anda tidak bisa meminta lebih cantik menjantani dibandingkan dengan Widia dan song yang mengelola properti ini. Mereka adalah super ramah dan akan mengakomodasi di mana mereka dapat. Anda dapat menikmati Widia di perahu snorkeling dan sebagai lokal dia tahu semua tempat yang terbaik. Kami dibawa ke tempat yang luar biasa di sekitar nusa penida dan hutan bakau. Taman dan kolam renang adalah terus baik dan kamar anda dibersihkan setiap hari. Saya tidak berpikir itu adalah masalah besar di semua lampu - ada cukup cahaya di ruangan untuk melihat. Meskipun anda tidak bisa mendapatkan air panas keluar dari pancuran - anda tidak perlu untuk bali cuacamu. Untuk harga - kamar yang nilai yang baik dan sangat nyaman. Sarapan adalah sederhana tapi bagus, coba jus segar. Anda dapat meminta…",4
54,TS Hut Lembongan,"Kami tidak kecewa dengan ts hut setelah membaca begitu banyak ulasan yang baik pada ta. Kami telah memesan di muka 3 malam di sini & datang dengan perahu dari bali tapi harus menunggu sampai 4pm untuk check-in. Hotel ini bagus meskipun dengan kolam kecil, sun lounger, street sesayat cafe & 2 kamar pondok kami tinggal di memiliki banyak kesalahan.  Aman tidak bekerja di tombol elektronik, jadi harus meminta kunci (aman tidak berfungsi), air panas adalah suam-suam kuku di terbaik, mari kita mengatakan kami dingin & cepat, pintu kamar mandi & buruk pencahayaan tidak menutup dengan benar. Makanan di restoran yang sangat baik & kualitas miskin. Makanannya sangat suram. Suami yang sering di sana tur & berbicara sangat terbatas inggris lstrinya.   Kalau kami tidak pra memesan & dibayar…",2
55,TS Hut Lembongan,"tempat yang hebat untuk tinggal lokasi dan saya hanya negatif akan kamar agak gelap, dan tekanan air di mandi bukan yang terbaik tapi hanya kembali setelah empat hari dan saya akan kembali pada bulan oktober dan kami akan tinggal di sini",4
56,TS Hut Lembongan,"Sebagai liburan tenang, anda tidak bisa meminta lebih baik. Kamarnya sedikit gelap (tidak kuat cahaya), tapi dibersihkan setiap hari, seperti taman. Benar-benar baik untuk kembali ke pada akhir hari itu atau setelah berenang di kolam renang. Widia, manajer, adalah tuan rumah yang hebat dan penuh dengan informasi. Ia membawa kami (di biaya) dan memancing mereka memasak ikan malam itu. Ia juga menyewa kami sepeda motor yang bagus untuk menjelajahi pulau, dan pergi untuk mendapatkan uang dari atm (10 menit di sepeda motor) Jungubatu di! Anda juga dapat menyewa buggy jika anda memiliki keluarga. Ts hanya 100m dari pondok pantai, yang besar untuk pagi berenang - anda bisa bangun lebih awal karena dari lingkungan luar biasa! Sarapan adalah dasar tetapi segar, jus buah campuran dan…",5
57,TS Hut Lembongan,"Kami tinggal 5 hari di ts hut. Keluarga yang indah yang memberikan suasana yang menyenangkan. Bungalo adalah bersih dan kami tidur berubah hampir setiap hari. Ada privet aman di kamar kami... kolam itu indah... Kami pergi memancing dengan manajer Widia dan dia dimasak kami ikan bagi kita untuk makan malam. Sarapan adalah dasar, tapi cukup baik. Mudah berjalan kaki ke pantai dan restoran.",4
58,TS Hut Lembongan,"Great huts dekat dengan pantai, dan suasana yang indah. Hanya menarik kembali adalah huts agak kecil, tidak sangat baik keamanan dan kami berbagi dinding dengan anak-anak kami dan dinding adalah kertas tipis. Poin yang baik adalah lokasi, layanan yang indah, pijat yang sempurna dan staf melakukan apa pun yang mereka bisa untuk membuat masa menginap kami menyenangkan. Kami pergi dalam tidak gila dengan pemilik dan mendapatkan untuk mengalami pemandangan bawah air yang menakjubkan. Kami juga tidak tahu bahwa mereka tidak mengambil kartu kredit dan hanya satu atm di pulau ini bisa menyebabkan masalah. Kami turun untuk 10000 terakhir kami.  ",4
59,TS Hut Lembongan,"Widia dan HAHAHA (tidak yakin ejaan yang benar) adalah tuan rumah yang sangat baik dengan besar humor dan akan melakukan apa saja untuk membuat masa menginap anda berkesan. Properti ini tenang, dan pondok yang sangat nyaman tapi sedikit gelap. Mudah berjalan kaki ke pantai dan beberapa restoran.",4
60,TS Hut Lembongan,"Pondoknya sederhana tapi indah, mungkin sedikit gelap, pemilik adalah orang-orang yang menyenangkan pemilik akan membawa anda snorkel (biaya yang terlibat) tetapi adalah hari besar. Tidak ada tv, tapi wifi baik. Satu menit berjalan kaki ke pantai dan restoran. Kami menyewa mobil golf",5
61,TS Hut Lembongan,"Pertama kali ke lembongan jadi saya melakukan cukup banyak penelitian untuk memastikan ini menandai semua kotak dan sebelumnya ta ulasan saya menetap di ts huts... Saya tidak disapointed. Terletak tentang 80m dari mushroom bay dan dengan hanya 6 pondok yang dikelola keluarga ini permata kecil yang sensasional. Kami menawarkan minuman selamat datang dan handuk dingin pada saat kedatangan kami kami kemudian ditampilkan ke pondok kami, yang adalah bersih dan sangat nyaman. Pondok kecil ini memiliki sistem split ac, kipas angin langit-langit, kamar aman, kulkas dingin, mini bar, launs sisi, pancuran air panas dari kamar mandi luar ruangan, dan kolam renang ukuran yang baik didukung oleh wifi terbaik untuk booting.  Dijalankan oleh Widia dan Luh yang sangat ramah dan lucu dan akan…",5
62,TS Hut Lembongan,"Saya baru-baru ini tinggal di ts hut dengan dua teman - kami menyewa dua bungalow dan mereka sangat bagus. Setiap bungalow memiliki tempat tidur berukuran ratu dan kemudian kembar ukuran ""membaca sudut"" bed. Anda memiliki beranda anda sendiri, dan area shower outdoor. Kolam renang adalah benar-benar bagus. Dekat berjalan kaki ke mushroom bay dan dream beach. Pemilik yang orang-orang yang benar-benar membuat pengalaman bintang lima - widia menangkap ikan segar di pagi hari dan akan untuk kami bbq di malam hari. Kami mengambil kelas memasak dengan istrinya dan pergi snorkeling perjalanan dengan pemilik... Makanannya luar biasa. Mudah pergi dan suasana santai - sorot dari perjalanan kami ke bali!",5
63,TS Hut Lembongan,"Menghabiskan beberapa hari di nusa lembongan's pantai jamur dan menginap di ts hut. Ts hut adalah tempat yang kecil (6 kamar) sedikit berjalan kaki dari pantai tapi masih di ""jalan utama"" ke pantai jamur. Kamar-kamarnya hampir semua di berdiri-tradisional-house-gaya dengan luar ruangan mandi (ya, shower di bawah bintang), set kembali beberapa meter dari jalan, jadi itu tidak akan mengganggu anda sama sekali.  Kecil kolam renang kecil yang bagus untuk berendam, tapi tidak berpikir tentang berlatih untuk olympic tercatat di sana.  Restoran tempat yang sederhana tapi bagus sarapan pilihan tersedia, memasak apa yang kami menemukan makanan terbaik di pulau (jika anda lupa tentang menu dan biarkan Widia membuat keputusan untuk anda). Dan ya, pasti menyajikan bir terdingin di mana saja…",5
64,TS Hut Lembongan,"Menginap di sini selama 4 malam. Kamar sangat bagus tapi pencahayaan membuatnya sulit untuk membaca. Tidak ada tv di kamar. Kolam renangnya bagus. Pemilik Weida, memiliki skuter untuk disewa dan juga wajar harga memancing dan snorkeling. Restorannya ok tapi terbatas. Ada restoran baik di dekatnya... terutama bali hai.",4
65,TS Hut Lembongan,"OK. Saya menginap di sini karena tripadvisor positif ulasan. Saya ingin merekomendasikan tempat ini untuk trippies lainnya. Widia adalah pemilik dan yang turun ke bumi dia adalah lokal. Saya benar-benar merekomendasikan tempat ini. Itu memiliki sedikit kolam renang dan 4 menit berjalan kaki ke the best lagoon di pulau kecil. Ok mungkin crystal bay adalah lebih baik sebagai ada terumbu karang yang indah lepas dari pantai, tapi tempat ini memulihkan iman saya di bali sebagai destinasi. Saya pasti akan tinggal di sini lagi. Aud $58 per malam untuk bungalo tersendiri di salah satu dunia teluk yang besar. Satu kata nasihat. Ada satu mesin atm di pulau dan itu tidak bekerja untuk saya. Widia mengambil saya ke ""private"" visa tempat dan sio saya bisa mendapatkan uang tunai tapi saya…",4
66,TS Hut Lembongan,"Bungalo bagus, renang indah, dekat ke pantai dan makanan yang indah. Suasana keluarga yang indah. Kami menyewa mobil golf untuk pergi di sekitar pulau yang sangat menyenangkan. Snorkeling sangat bagus dan menarik tur bakau. Berhati-hati dari tab, kami memesan hidangan sarapan dan susu kocok untuk sarapan dan tidak menyadari kami dikenakan biaya. Saya meminta tapi tidak mendapat jawaban. Juga snorkeling bagus tapi kami tidak diberitahu harga jadi terkejut ketika kami dikenakan untuk tab kami. Kami memiliki indah makan ikan dengan ikan menangkap di pagi hari. sangat lezat. Kami memiliki tidak ada air panas tapi itu ok karena iklim.",4
67,TS Hut Lembongan,Tempat ini adalah solusi menit terakhir karena kami reservasi lain tidak pergi melalui jadi ia telah manapun untuk pergi. Staf sangat ramah dan akan membantu anda banyak dan berbicara dengan anda sehingga anda merasa diterima. Kamarnya kecil yang memiliki banyak suasana dan nyaman mungkin. Ada bagus sedikit taman og dan sayang kolam renang. Internet adalah benar-benar baik dan kami hanya mencintai tempat dan ingin pergi back.m,5
68,TS Hut Lembongan,"Keluarga saya menginap selama 3 malam dan itu adalah brilian, kami memiliki 2 remaja laki-laki yang memiliki mereka sendiri bungalow di sebelah kita, kolam renang adalah tepat di depan pintu kami, taman yang luar biasa, makanan besar, Widian dan lo yang hanya indah, sangat membantu, Widian membuat awesome margarita's ini sangat dihargai sementara bermalas-malasan di kolam renang, dia sering pergi memancing dan membawa kembali segar snapper dan masaknya memasak bbq di malam itu - Enak! Akan tidak ragu-ragu merekomendasikan ts huts untuk orang muda atau tua, single, pasangan atau keluarga. Kita tidak bisa menunggu untuk pergi kembali ke sana lagi diri kita sendiri :) ",5
69,TS Hut Lembongan,"Kami menginap di ts huts karena sebuah rekomendasi dari seseorang kami bertemu saat bepergian. Setelah mengirim email kami memiliki respon yang cepat dari pemilik, Widia. Dia adalah pria yang sangat hangat dan membantu. Dia menjemput kami dari desa, karena kami tidak bisa tidur di tempat ini malam pertama. Pondok mencari bersih dan terawat dengan baik. Awalnya kami tidak memiliki air panas, tapi ia tetap itu segera. Tempat ini sangat tenang dan rasanya seperti sebuah keluarga besar ketika tinggal di sana. Makanan yang mereka melayani adalah menakjubkan! Kami mendapat fishcurry (tidak di menu) dan tuna steak dan keduanya terasa begitu baik!  Kami pasti akan kembali ke tempat ini. Kami melihat 3 tempat-tempat lain untuk tinggal yang dengan pantai dream huts, tapi ts adalah jauh…",5
70,TS Hut Lembongan,"Ts huts adalah tempat yang bagus untuk tinggal di nusa lembongan, keluarga menjalankan, sangat ramah dan membantu dan pondok sangat cantik!, pasti akan tinggal di sini lagi, kami memiliki 2 kamar karena kami bepergian dengan remaja laki-laki, kolam renang adalah tepat di luar kamar kami, sangat santai, coba salah satu Widian's margarita di tepi kolam renang.",5
71,TS Hut Lembongan,Kami menyukai nusa lembongan dan kami mencintai ts hut! Staf super super bagus dan makanan di pulau ini menakjubkan! Makanan terbaik yang saya makan selama perjalanan indonesia. Memesan perjalanan menyelam dan pergi berkendara skuter di sekitar pulau! Satu-satunya hal yang buruk adalah kami memiliki gecko di lemari dan itu membuat suara keras di malam hari. Pemilik datang untuk menghapus itu ketika kami menemukan itu. Wifi tidak begitu baik dianggap di seluruh pulau. Juga pastikan anda pergi ke atm sebelum pergi ke lembongan! Terima kasih untuk membuat kunjungan kami menyenangkan! :) ,5
72,TS Hut Lembongan,"Tinggal di sini dengan suami saya dan saudari saya dan suaminya untuk empat malam yang santai. tiba di marlin kapal cepat - akan merekomendasikan mereka juga, terutama karena mereka land di mushroom bay, secara harfiah 100m atau jadi dari ts hut - dan memutuskan untuk berjalan untuk ts hut. Widia kami bertemu di pantai dan menawarkan untuk membawa koper kami sehingga super berjalan-jalan pendek dari satu menit atau jadi dan kami berada di sana. Tidak rumit proses check in, hanya menunjukkan kami ke hut, yang menghadap ke kolam renang. Ahhhh, waktu liburan! Ts hut adalah indah - pasti tidak secara garis besar-dengan kolam renang, bar layanan, restoran dengan makanan lokal yang lezat (saya jatuh cinta dengan mereka Bakmi goreng tapi jika anda bertanya baik mungkin mereka juga…",5
73,TS Hut Lembongan,"Widia dan Luh sangat peduli dan ramah! Mereka telah menciptakan kecil (6 huts) santai dan nyaman haven yang melayani untuk semua jenis pelancong. Mereka terbuka untuk saran dan pergi keluar dari jalan mereka untuk membantu dengan semua permintaan. Pondok tidak besar dan juga tidak sangat mewah, meskipun nyaman... Tapi secara keseluruhan suasana dan besar makanan di restoran lebih dari mengkompensasi.",4
74,TS Hut Lembongan,Kami baru saja kembali untuk kedua kalinya kami menginap di ts hut lembongan tahun ini. Kami telah tinggal di pulau selama sekitar 20 tahun terakhir 10times. Kali ini kami membawa teman-teman lama yang telah pernah ke bali. Tinggal di sini dengan Widia & lou adalah seperti tinggal dengan keluarga. Kami juga snorkeling dengan pari manta dengan Widia dan melihat sekitar 10 di air dengan hanya lima dari kita yang tinggal di sini.  Dia pengetahuan lokal sebagai kapten kapal dan pengemudi sampan adalah yang terbaik. Tidak dapat merekomendasikan ini sangat cukup seperti surga!  ,5
75,TS Hut Lembongan,"Widia, lo immmediately dan semua staf membuat anda merasa di rumah dengan minuman selamat datang dan handuk dingin (cinta bahwa handuk). Kamar yang cara di atas standar yang anda harapkan untuk seperti rendah tarif! Indah dihiasi dengan bunga-bunga dan swan handuk mereka segera membuat anda merasa spesial. Saya pikir saya menghabiskan 5-6 jam di kolam renang infinity sangat hangat! Makanan besar (dan murah) dan ada banyak ruang di taman untuk bersantai! Terakhir tapi setidaknya untuk saya, bir bintang terdingin di pulau, bar tidak ada! Terima kasih untuk orang-orang satu lagi liburan yang mengagumkan, melihat anda di mei 2015 untuk bulan lain!  Suka dave, kathy & jake house hotel nanchong",5
76,TS Hut Lembongan,"TSHut berdetak semua kotak kami. Kami berharap untuk sebuah kunjungan kembali lagi.  Widia dan Luh, dengan dukungan tim kecil membantu mereka, telah menciptakan nyaman dan nyaman sedikit oasis terdiri dari enam huts terletak di kompleks bekas mereka, yang sangat menyenangkan, sepelemparan batu dari pantai jamur. Mereka menyediakan tamu mereka dengan santai lingkungan liburan didukung oleh keramahan mereka banyak tahun pengalaman dan pengetahuan lokal yang luas dari kepulauan, desa mereka dan komunitas.  Pondok masing-masing memiliki tempat duduk beranda, kamar tidur yang bersih dan murah hati, termasuk A/C, nook tempat tidur, lemari besar, aman dan bar kulkas. Ensuite termasuk pancuran mandi luar ruangan, yang kecil musisi lokal.  Pekarangannya, termasuk kolam renang dan area…",5
77,TS Hut Lembongan,"Kami memesan untuk dua malam di sini, dan kami tidak kecewa. Pemilik adalah fantastis. Dalam waktu 15 menit dari kami tiba ia telah kami atur dan di perahu untuk pergi menyelam. Sangat fantastis. Kami memiliki makan malam di hotel, yang pemilik menjemput dan dimasak untuk kami. Makanan adalah untuk mati untuk... sangat tenang, bersih dan sangat nyaman kamar. Teman kami yang sedang sakit dan dia tidak bisa telah lebih khawatir, mengirimkan makanan ringan ke kamarnya... jadi sangat bagus. Pasti akan merekomendasikan dan tinggal lagi!",5
78,TS Hut Lembongan,"Menghabiskan 3 malam dengan Widia dan lo dan mereka yang membuat kami tinggal kenangan. Tidak ada terlalu banyak masalah dari mengatur untuk kelompok kami 6, snorkeling, skuter, menyelam dan transfer semua berjalan lancar. Untuk anak-anak kami dan mitra yang belum pernah ke bali sebelum mereka memiliki waktu yang fantastis. Akomodasi sangat bagus, keramahan hebat. Akan sangat merekomendasikan tempat ini kepada orang lain.",4
79,TS Hut Lembongan,"Harga yang besar, makanan dan layanan. King tempat tidur di pondok pribadi dan brankas pribadi dengan A/C. Kamar mandi pribadi di luar dengan indah mandi dan taman. Berbagi kolam renang infinity sangat fantastis, dengan pencahayaan dan matahari tempat tidur dan handuk. Layanan kelas satu dengan harga yang besar untuk makanan dan minuman. Skuter dan kereta golf tersedia untuk menyewa, sangat direkomendasikan. Tidak jauh dari pantai dan bar olahraga di seberang jalan. Satu-satunya kekurangan adalah bloody ayam di belakang pagar villas berkokok di 4am! akomodasi harganya murah di $50 malam per villa. Pengalaman hebat, akan pasti tinggal di sana lagi. ",5
80,TS Hut Lembongan,"Saya dan istri saya, putri berusia 3 tahun, 4 bulan tua bayi dan teman saya menginap di vila dua kamar tidur untuk empat malam baru-baru ini. Loh Widia dan sangat bagus host, kamar yang semua yang kami butuhkan untuk kami (keluarga kami dari 4 dilengkapi di salah satu kamar nyaman) dan itu sangat mudah 2 menit berjalan kaki ke pantai. Stafnya ramah, tamannya sempurna, santai kolam renang dan makanan yang sangat lezat (kami tidak akan pernah melupakan ayam Widia dimasak untuk kami!). Widia dan loh punya skuter, sebuah kereta golf dan Widia membawa kami snorkeling di perahu. Saya merekomendasikan untuk siapa pun yang ingin beberapa kunci rendah (tapi dalam jarak berjalan kaki ke tempat tindakan olahraga air) istirahat. Kami adalah baik bepergian, dan ini adalah pasti tempat yang…",5
81,TS Hut Lembongan,"Ts hut adalah ekonomis dan tempat santai untuk tinggal, 2 menit berjalan kaki ke pantai jamur. Ada enam kamar di sekelompok lima gaya huts berada di antara taman-taman yang menyenangkan di seberang kecil mengundang kolam renang, dek kursi dan mandi. Ts terletak di antara beberapa warung dan restoran, mini mart toko dan toko-toko menyelam beberapa langkah dari air. Kamarnya bersih, kamar mandi besar di luar ruangan, ac dan kipas angin, tempat tidur yang luas dan baik keras, pondok masing-masing dengan sedikit dek untuk duduk di. Satu malam aku punya cukup tidur karena tidak nyaman atas keinginan ayam berkokok, tapi saya menjadi terbiasa oleh malam kedua saya. Saya menyukai fakta bahwa ini tidak ramai resort, dan itu mudah untuk bersosialisasi dengan sesama tamu jika anda jadi…",4
