,hotel,review,stars
0,Ubud Dream,"Tempat ini bagus dan benar-benar tidak mahal dengan lokasi yang baik. Pemilik dan keluarganya sangat baik dan akan senang membantu Anda untuk apa pun. Wifi baik, kamar bersih dll. Saya akan memberi rekomendasi untuk sedikit anggaran!",4
1,Ubud Dream,Dasar akomodasi di penginapan. Akan tinggal selama beberapa hari tapi akhirnya tinggal selama seminggu. Indah dan ramah keluarga. Hanya turun jalan Monkey Forest Road. Mereka juga memiliki beberapa ada yang mereka menyewakan skuter juga. Nilai yang baik.,4
2,Ubud Dream,"Kami telah tinggal di penginapan ini beberapa kali sekarang dan itu selalu menyenangkan. Titik dan keluarga yang sangat ramah dan membantu. Kamarnya sangat bersih dan nyaman dan terima kasih kepada Wayan. Sarapan yang luar biasa di pagi hari, tapi cukup sederhana, disajikan di balkon yang menghadap ke taman. Bagus tempat yang tenang untuk menginap, gang kecil tepat di tengah jalan hutan monyet, tepat di jantung kota Ubud, dengan toko, yang buka 24/7, di atas jalan. Kami akan kembali! Terima kasih untuk pengalaman menginap yang menyenangkan.",5
3,Ubud Dream,"Saya tinggal di Ubud mimpi selama 4 bulan tahun ini. Ini adalah indah homestay. Keluarga yang luar biasa - sangat ramah, ramah dan membantu. Sarapan pagi yang bervariasi dan lezat. Kamar yang dibersihkan setiap hari dan sangat bersih dan nyaman. Titik (nyonya rumah) mengajari saya banyak tentang budaya Bali dan Ubud. Saya menikmati setiap saat saya tinggal. Terima kasih Titik, Komang, Wayan dan keluarga lainnya. Saya sangat merekomendasikan Ubud Dream.",5
4,Ubud Dream,"Bersih. cukup tengah. layanan pelanggan yang luar biasa, penerbangan kami terlambat tiba Oleh 1 jam dan sopir menunggu kami (sekitar 1:30 pagi). Fasilitas selalu bersih. Sangat baik harga pasti akan merekomendasikan",5
5,Ubud Dream,"Kami menikmati kami tinggal dan akan kembali lagi jika kami datang ke ubud lagi. Keluarga yang menjalankan tempat yang sangat ramah untuk tinggal. Sarapan sangat baik, berbeda setiap hari. Itu sulit untuk menemukan dan sopir kami menelepon untuk mendapatkan petunjuk. Ketika kami mencoba untuk menemukan hari berikutnya kami kesulitan, tapi orang di toko gelato bertanya orang lain dan mereka mampu untuk memberitahu kami hotel kami yang besar di sebelah, komaneka. Penginapan yang bagus untuk harga.",4
6,Ubud Dream,"Tempat yang bagus untuk tinggal. sangat baik harga. Sarapan sangat baik, jatuh cinta dengan pisang panckes. Di pusat ubud, 200m dari jalan utama, 5 menit berjalan kaki ke monkey forest dan anda juga dapat menyewa scotter untuk harga sangat bagus. Mereka biaya 3% dengan membayar dengan kartu kredit.",4
7,Ubud Dream,"Aku hanya tinggal satu malam tapi itu sangat menyenangkan. Bersih, nyaman, dengan pemandangan taman yang bagus. Lokasi yang besar dan harga yang baik. Orang-orang yang ramah. Saya hanya masalah adalah bahwa jendela harus ditutup pada malam hari karena mereka rendah, jadi anda bergantung pada kipas untuk sirkulasi udara. ",4
8,Ubud Dream,Penginapan ini memang hanya dari jalan utama. Anda dapat berjalan kaki ke hutan monyet di ubud dan 15 menit berjalan kaki di sawah di 15 menit juga. Ini adalah rumah yang sangat tenang yang sangat ramah keluarga. Sarapan di balkon adalah benar-benar baik dan kamar yang sangat baik dilengkapi. Harga sangat bagus untuk apa yang ditawarkan!,4
9,Ubud Dream,"Ubud dream adalah tempat strategis di jl hutan monyet yang sibuk. Ada sebuah gang yang satu ini untuk berjalan melalui untuk sampai ke sana, sehingga membantu mengurangi kebisingan isu-isu di wilayah ini. Keluarga sangat ramah dan makanannya berbeda setiap pagi. Roti panggang dengan kari di itu favorit kami!   Akomodasi di kamar termasuk kipas angin besar di atas tempat tidur ganda, mini kulkas, meja rias dengan cermin, wifi, bersih, pribadi dan shower air panas di kamar mandi. Hotel lainnya menawarkan pijat dan jasa penyewaan skuter, tapi kami tidak menggunakan layanan tersebut.   Tidak ada air gratis dan tidak membuka jendela setelah membersihkan setiap hari; tindakan yang tidak aman meninggalkan barang-barang berharga saya hanya karena jendela-jendelanya yang besar. Kami…",4
10,Ubud Dream,"Lupa ulasan negatif sebelumnya - di sini ada terganggu dan semut yang berlibur di ubud sebelum kita jadi belajar untuk hidup dengan mereka di bali. Saya yakin, anda akan mengeluh jika pemilik pada tempat penyemprotan bahan kimia untuk memberantas serangga dengan semua tamu mereka untuk menenangkan! Ini adalah kedua saya tinggal di selama perjalanan saya dan itu adalah permata. Saya telah tinggal di kamar standar, dan sekarang di kamar deluxe pada akhir waktu saya di indonesia. Kedua kamar telah sangat bersih, dengan balkon yang indah untuk dekorasi. Ini Tiktik sangat bermanfaat dan mengutamakan italia keluarga rumah dengan hanya tiga kamar untuk pelancong untuk menikmati. Lokasi adalah sempurna, sarapan adalah menakjubkan dan pandangan adalah menyenangkan - dengan pemandangan…",5
11,Ubud Dream,"Orang-orang tampak benar-benar baik di sini, tapi ada banyak semut. Tidak yakin apakah itu hanya kamar tersebut pada saat itu. Lokasi benar-benar baik dan letaknya dekat hutan kera yang banyak restoran dan hanya umumnya berada di jantung ubud. Secara keseluruhan, hotel ini kecil dan kuno dan seprainya bersih, tempat tidur itu baik, sarapan adalah kecil tapi bagus juga. Ada ayam yang berkokok agak awal. Di internet bekerja tapi bisa sedikit spotchy tapi secara konsisten dengan internet di indonesia. Kamar ini cukup baru dan baik dengan keramik. Membawa anda sendiri sabun dan sampo. Secara keseluruhan di $30 usd, itu adalah nilai yang sangat baik. Tanpa nama ini akan menjadi memaling.",3
12,Ubud Dream,"Aku tinggal di sini selama seminggu dan sangat senang dengan tingkat tinggi layanan, akomodasi dan lokasi pusat. Hotel ini berlokasi di malam hari jalan hutan monyet jadi sangat mudah untuk berjalan kaki ke restoran, berbelanja dan objek wisata lokal termasuk hutan monyet. Keluarga menjalankan guesthouse selalu ramah dan siap membantu, membuat pengaturan untuk pengemudi, ketika diperlukan, dan memberikan rekomendasi yang baik. Tarif kamar adalah sangat wajar jadi ini benar-benar istimewa.",4
13,Ubud Dream,"Guesthouse kecil yang benar-benar ramah, dengan ibu dengan anak-anaknya pondokan yang akan selalu membantu anda untuk fnd penawaran terbaik yang anda inginkan. Kamarnya besar dan cantik :)  Kami dapat menggunakan kolam renang di hotel ini karena itu dekat keluarga yang sama; ) Baik sarapan di teras pribadi di depan ruang :)  [ada di juni 2013]",5
14,Ubud Dream,Kamar dengan kamar mandi besar dan kipas angin... sarapan di balkon yang menghadap ke taman tropis... menghabisi... dari jalan utama... sulit untuk menemukan di pertama... di samping rel mengganti memperapikan di monkey forest road (jalan),5
15,Ubud Dream,"Lokasi adalah besar karena dekat dengan bar dan restoran tetapi sedikit jauh dari jalan utama yang sibuk. Kamar sangat bersih dan keluarga yang menjalankan tempat ini sangat ramah dan berhati-hati. Setelah perjalanan jauh seharian di luar biasa dan adalah baik roomprice untuk apa yang anda dapatkan di kembali. Dalam kunjungan saya ke ubud, saya akan tinggal di sini lagi-lagi bertanya-tanya.",5
16,Ubud Dream,"Kami tinggal di sini di dua kamar, 300 000 rupee untuk kamar single dan double 350 000 untuk menginap.  Guesthouse kecil yang ramah di lokasi yang tenang baik. Keluarga adalah bermanfaat dan menyenangkan tetap. Kamar bersih, tempat tidur yang sangat baik. Kadang-kadang ada semut kecil berjalan di lantai atau dinding, tetapi mereka mendapatkan di mana-mana di indonesia, dan saat ini b & b, mereka melakukan membersihkan kamar yang sangat baik. Kami sukai kamar dengan's 'balkon, itu menyenangkan untuk memiliki sarapan di sana. Balkon menghadap ke pekarangan rumah benar-benar pribadi, dan anda harus berhati-hati karena keluarga yang ada akan melihat dengan jelas untuk balkon dan anda akan melihat apa yang mereka dapat, tapi itu masih benar-benar indah.  Wifi bekerja tapi agak…",4
17,Ubud Dream,"Tempat kecil yang nyaman dengan sangat membantu pemilik. Setiap pagi, anda mendapatkan segar dari sarapan untuk manjakan indra anda sebelum anda memulai hari anda menjelajahi ubud. Kamar-kamar deluxe yang sangat nyaman dan datang dengan sedikit balkon anda dapat bersantai dan menikmati makanan anda di. Satu-satunya keluhan adalah kamar mandinya. Ada banyak serangga kecil yang terbang di sekitar dan itu bisa menghalangi. The rocks di kamar mandi mungkin terlihat bagus estetis, tapi higienis adalah sedikit yang meragukan. Selain itu, tempat ini sangat bagus dan saya tinggi merekomendasikannya!",4
18,Ubud Dream,Pacar saya dan saya tinggal di sini selama tiga malam dan menyukainya. Kami memesan ruang penggemar ganda tetapi berharap kami akan telah memiliki sebuah ac. Ubud pada bulan maret adalah lembab dan panas (tapi kami tahu bahwa kami telah memesan ruang penggemar jadi saya tidak akan menyalahkan homestay). Titik (ibu/pemilik) sangat cepat untuk menanggapi email dan sangat membantu. Dia membantu kami mengatur transportasi bandara karena kami terbang ke bali dari ho chi minh.  Tempat tidur yang seperti tidur di awan dan sarapan sangat baik setiap pagi (dan termasuk). Wifi cukup ok tapi fungsional - tidak dapat mengharapkan wifi yang sempurna di pulau setelah semua. Kami akan kembali. Properti adalah off gang street dan tenang dan damai. Kami menyukainya. Terima kasih! ,5
19,Ubud Dream,"Saya telah ke beberapa guesthouses di ubud dan satu ini adalah terbersih yang pernah saya lihat (juga kamar mandi! ). Kamar besar, lemari es, tempat tidur besar yang nyaman, pemandangan bagus dari jendela. Sarapan adalah sederhana dan lezat disajikan di teras. Titik dan keluarganya yang sangat membantu dan ramah dengan kemampuan bahasa inggris yang baik. Saya benar-benar merekomendasikan tempat ini.",5
20,Ubud Dream,"Tempat yang indah untuk menginap di ubud. jalan yang tenang di lepas monkey forrest road, ini adalah indah, tempat yang damai untuk mengambil mudah dan dasar untuk wisata di sekitar. Keluarga tuan rumah ini sangat sangat manis dan baik. Sangat direkomendasikan!",5
21,Ubud Dream,"Ubud dream adalah sebuah bagus guesthouse di jantung ubud, dimiliki oleh keluarga yang indah. Kami punya kamar deluxe untuk 4 malam, dengan ac, balkon pribadi, dan kulkas kecil. Semuanya benar-benar bersih, dan tempat tidur benar-benar nyaman. Pemilik adalah indah dan benar-benar membantu untuk mengatur hari perjalanan, pengembaraan, airport pick-up/drop-off, dll. Sarapan berubah setiap hari, sehingga anda tidak mendapatkan bosan makan hal yang sama (dan dengan hati-hati mereka memberi anda dibawa pulang jika anda harus pergi lebih awal untuk trekking atau aktivitas lain).   Lokasinya sempurna (tenang dan pada waktu yang sama): terletak di monkey forest road di mana anda menemukan semua restoran, toko-toko, bar (secara harfiah 30 detik berjalan), 5 menit dari hutan monyet dan 5…",4
22,Ubud Dream,"Saya memesan kamar di sini setelah impulsif meninggalkan seminyak yang sore dan tiba di saya sendiri di ubud di sekitar 18:30; Saya bertemu dengan pemilik segera yang sangat sopan dan membantu. Saya ditunjukkan 3 kamar yang tersedia; kamar tanpa A/C, kamar ganda dengan ac dan kamar ketiga dengan A/C dan balkon. Saya mengambil kamar balkon seperti itu adalah sekitar harga yang sama.   Semuanya bersih, rapi, dan nyaman. Kulkas adalah bonus tambahan untuk botol air. Tekanan air sangat bagus dan air panasnya bagus!  Sebuah keluarga yang indah dan persembunyian kecil yang indah terselip di sisi jalan. Tidak terdengar suara tetangga menerima untuk fitur air yang santai! Ubud dream saya akan kembali lagi!",5
23,Ubud Dream,"Saya tinggal di ubud mimpi dengan ayah saya yang sudah tua dan kakak di 2012. Tuan rumah sangat hangat dan ramah dan kamar yang besar. Dan sarapannya lezat. Lokasinya tidak dapat ditingkatkan dengan segala sesuatu - dari restoran, toko-toko, utility toko-toko dalam jarak berjalan kaki.   Satu-satunya hal yang perlu anda perhatikan adalah bahwa voltase di ubud bisa naik turun dan jadi jika anda mendapatkan kamar tanpa ac, malam bisa sangat panas dan pengap. Tangga menuju kamar di lantai atas adalah tidak super ramah tetapi pengguna yang dapat menjadi masalah hanya jika anda memiliki orang-orang dengan masalah lutut.",4
24,Ubud Dream,"Kami tinggal di Ubud mimpi selama 3 malam dan secara keseluruhan itu tempat yang bagus untuk tinggal. Pemilik sangat bagus. Kamar adalah bagus dan bersih meskipun kamar mandi adalah agak dasar dan saya hilang wastafel. Kami telah memesan kamar dengan udara con, tapi seperti ini telah diambil, kita memiliki ruang dengan ceiling fan hanya yang baik-baik saja walaupun seperti itu dingin di malam hari dan ruang jauh lebih murah. Sarapan di balkon yang benar-benar baik.  Ubud mimpi terletak dekat jalan monyet Forrest sehingga Anda dapat easilly berjalan di mana-mana di pusat Ubud. Seperti pada sebuah sisi jalan kecil dari monyet Forrest jalan (tepat di sebelah Cinta Grill, yang baik untuk menemukannya) itu ada mungkin biasanya banyak kurang bising.   Namun, ketika kami tinggal sana…",4
25,Ubud Dream,"Kami tinggal di Ubud mimpi selama 3 malam menjelang akhir malam 15 perjalanan kami ke Bali. Itu terpilih pada dasar dari tinjauan dan tinjauan di sini, dan kami tidak kecewa. Ini sebagai tempat termurah kita tinggal di selama perjalanan kami, tetapi dibandingkan baik dalam hal layanan, ukuran ruang, kebersihan - dan tentu saja lokasi. Kamar memiliki penggemar tapi tanpa AC, yang tidak masalah. Ruangan itu besar, sederhana dan sangat bersih. Tempat tidur adalah nyaman. Kurangnya basin di kamar mandi adalah sedikit membingungkan, tetapi bukan masalah besar. Kamar mandi rasanya! Terbaik kami sudah di Bali. Lokasi ideal - hanya beberapa meter berjalan menyusuri jalan baik menyalakan dari tengah monyet hutan Rd, jadi sangat nyaman untuk belanja, restoran dan bar. Bahkan salah satu…",4
26,Ubud Dream,"Kami tinggal di April di Ubud mimpi. Ini adalah tempat yang indah, lezat sarapan, sangat bersih, sangat nyaman dan indah host. Sempurna terletak di pusat kota Ubud, tapi masih sepi. Kami pasti akan kembali jika kita pergi ke Ubud lagi.",5
27,Ubud Dream,"Aku punya apa-apa yang buruk untuk mengatakan aboud Ubud mimpi. Ruangan itu raksasa dan sangat bersih. Pemilik yang sangat membantu ketika mencoba untuk mengatur hari perjalanan dan bahkan untuk Kepulauan Gili. Lokasi hebat, di hutan monyet tapi belum tenang untuk tidur.  pasti datang kembali.",5
28,Ubud Dream,"Kami tinggal di homestay ini selama dua malam. Kami memiliki ruangan dengan Kingsize tempat tidur AC. Keramahan rasanya. Mereka yang benar-benar membantu & sarapan disajikan di teras itu indah. Ruangan itu besar, dan bersih. Kamar mandi sudah tidak basin, yang membuat menyikat gigi sedikit rumit!  Saat ini ada bangunan pekerjaan berlangsung sebelah, tetapi hal ini tidak mempengaruhi tinggal (di ruang ber-AC hanya).  Free wi-fi adalah sangat cepat.",4
29,Ubud Dream,"Kami adalah sebuah keluarga Amerika yang tinggal di Asia Tenggara selama 10 tahun dan telah ke Bali berkali-kali (bersama dengan Thailand, Vietnam, Singapura). Sementara kita telah tinggal di tempat-tempat mewah di sebagian besar Asia Tenggara, kita benar-benar suka pertemuan penduduk setempat. Tempat di Nusa Dua - contoh - mungkin memiliki semua fasilitasnya, namun mereka adalah sering dibikin, tidak untuk menyebutkan penghinaan mahal ketika Anda mempertimbangkan ekonomi lokal.  Kami mengambil kesempatan pada mimpi Ubud berdasarkan tanggapan mereka internet kita (sangat cepat), permintaan mereka bahwa kita menggunakan PayPal (cepat dan aman), dan fakta bahwa mereka bersedia untuk pergi keluar dari jalan mereka untuk membantu kami dengan kebutuhan transportasi lebih kompleks…",5
30,Ubud Dream,"Aku tiba di sini dengan pasangan saya untuk 2 malam menginap. Mereka mampu untuk mengatur kita pickup dari Kuta dan ruang tambahan di Mandia's Bungalow di dekatnya sejak ruang lain diambil. Hanya ada 2 kamar, meskipun 3 sedang dibangun. Ada wifi kecepatan tinggi dan toilet bersih.  Perasaan tinggal di lingkungan setempat dan bangun untuk ayam gagak unik menyegarkan. Anak-anak sangat baik berperilaku dan umumnya tinggal di lantai dasar, sedangkan kamar tamu lantai atas. Privasi Anda adalah dihormati. Kami pasti merasa seperti kita akan tetap luar kami 2 hari jika kita bisa. Akan senang untuk kembali.",5
31,Ubud Dream,"Aku tinggal di sana dengan saya putra berusia 12 tahun selama seminggu di Agustus 2010. Wonderfull dan cukup tempat, hanya off jalan monyet Forrest sibuk. Itu tujuan akhir di Bali dan salah satu yang paling mengesankan. Orang-orang yang sangat bagus dan anak-anak dan beautifull kamar, privasi jika Anda ingin dan interaksi dengan keluarga jika Anda ingin. Membaca semua sangat positif reaksi (sepenuhnya dibenarkan) à reservasi akan diperlukan. Jika Anda tidak ingin melakukannya dan Anda ingin melihat apa yang Anda dapatkan, Ubud mimpi adalah sepenuhnya layak mencoba untuk menyimpang dari prinsip Anda. Mereka untuk mengatur semua jenis hal-hal untuk Anda. Mereka mengatur perjalanan ke bandara untuk kita, sempurna. Mereka memberi kami kenangan pengalaman dan beautifull besar Bali…",5
32,Ubud Dream,"Whoaw, kita benar-benar menyukai kami tinggal di tempat ini sangat bagus. Pemilik adalah benar-benar orang-orang wonderfull, kesan pertama kita Bali tidak bisa lebih baik. Kami memiliki banyak menyenangkan, baik tertawa, bersih dan bagus kamar incluiding a lovely sarapan. Dengan hanya dua kamar dan ketiga sedang membangun, yang lebih baik untuk membuat reservasi. Lain kali kita mengunjungi Bali, kami benar-benar ingin mengunjungi tempat ini lagi.",5
33,Ubud Dream,"Aku tinggal di Ubud mimpi untuk dua malam dan tiga hari. Saya dijemput dari bandara kedua saya mendarat dengan SIM dan turun tas saya. Keluarga sangat bagus dan memberikan peta besar dengan petunjuk di mana untuk makan dan berjalan ke. Lokasi besar benar oleh pasar, hutan monyet, ubud istana, dan banyak tempat yang bagus untuk makan! Mereka bertugas dua makanan besar dan bekerja di sekitar jadwal saya dalam menyediakan makanan dan perjalanan ke tempat-tempat.",5
34,Ubud Dream,"Kami tinggal di Ubud mimpi untuk 4 malam dan kita cintai itu banyak. Lokasi adalah sempurna, tepat di tengah, tapi sangat tenang dan damai. Ruangan itu bersih dan nyaman dengan mandi kecil.Anda dapat memilih antara pendingin dan kipas. Wi-fi dan air panas yang disertakan. Ada juga balkon besar di mana sarapan disajikan. Sarapan yang lezat, khusus untuk homestay (pisang pancake, roti dengan pisang, fruitplate). Harga kamar juga sangat wajar. Keluarga baik dan bermanfaat, mereka juga mengatur perjalanan pendek dengan mobil, tapi harga yang lebih tinggi jika Anda menyewa seorang sopir sendirian. Kami mencintai tempat ini dan akan tentu saja buku itu lagi.",5
35,Ubud Dream,"Setelah dua jam berjalan berputar-putar, saya akhirnya menemukan Ubud mimpi, tidak terima kasih kepada para penjaja di jalan-jalan yang belum pernah mendengar tentang tempat ini. Informasi wisatawan mengirimi saya jalan yang salah. Sopir taksi yang belum pernah mendengar tentang itu. Anda harus menjaga mata Anda dikupas untuk tanda merah enam inci yang tergantung di bawah tanda Mandia Bungalow.  Selain itu, tempat ini sempurna dan masuk akal untuk orang solo atau keluarga. Sarapan sehari-hari yang baik dan berbeda dan rumah tenang dan damai. Aku membayar rp 200.000 per malam sendirian di ruang penggemar yang nilai yang baik.",5
36,Ubud Dream,"Sepupu saya dan saya tinggal di Ubud mimpi selama 4 hari lurus, dan kami bahkan tidak mencoba untuk mencari lain BB. Ubud mimpi dijalankan oleh Bali pasangan muda keluarga yang juga menjalankan beberapa hotel di dekatnya. Untuk mulai dengan, pemesanan segera diambil dari perawatan. Lokasi itu sendiri luar biasa. Kami menjelajahi bagian uptown Ubud, dari Pasar Ubud Antonio Blanco Renaissance Museum oleh kaki! Komang Suas, Tiki Wayan yang indah, sangat ramah dan selalu siap untuk membantu kami. Mereka tidak ragu-ragu untuk berbagi cerita tentang budaya Bali dan orang-orangnya. (Selama kami tinggal, ada ritual pembakaran keluarga hiasan di pura terdekat.) Komang juga menjemput kami dari bandara, dan cara tidak kurang memuaskan. Oh, dan tempat ini memiliki cukup handal koneksi…",4
37,Ubud Dream,"Kami memiliki tinggal yang menyenangkan di Ubud mimpi dikelola oleh putra dan putri-di - hukum Okawati pemilik hotel dengan nama yang sama. Anda akan memiliki salah satu dari 2 kamar di atas keluarga, satu a/C satu penggemar dengan balkon menghadap ke atap dan di antara pohon-pohon yang membuat tempat yang bagus untuk sarapan. Ruangan itu bersih dan lapang, kamar mandi adalah kamar basah yang memiliki mandi dan w/c tapi cekungan tidak hanya keran (Bali gaya rupanya) dan setelah Anda terbiasa dengan ide yang tidak ada masalah. Keluarga sangat hangat dan ramah dan tidak ada banyak masalah bagi mereka. Tepat terletak di tengah hutan monyet jalan tetapi kurang dari menit berjalan salah satu Gangs(alleyway/ lane) membuat baik jarak jauh dari kebisingan jalan mungkin.Free wi-fi dan…",3
38,Ubud Dream,Kedengarannya indah - dipesan untuk bulan madu kami - AC kamar untuk 2 malam - dibayar dan diemail untuk memberitahu kami telah membayar hari yang sama seperti mereka mengirim faktur - kemudian mendapat email 2 hari kemudian bahwa mereka telah memberikan ruang kepada orang lain dan harus pindah ke ruangan lain yang lebih kecil. Seperti kita sudah dibayar kita berpikir mereka akan mengatasinya tetapi mereka hanya mengatakan tidak perlu untuk AC seperti Ubud's cool. Mereka melakukan Namun memberi kita pengembalian dana,3
39,Ubud Dream,"Kami bersenang-senang di homestay ini. Sarapan adalah indah, dan pemilik (yang juga tinggal di rumah) adalah sangat freindly. Kami ruangan itu luas dan baik. Kipas angin tidak membantu mendinginkan ruangan jadi itu sangat panas. Kamar mandi tidak memiliki wastafel.",4
40,Ubud Dream,"Saya akan sangat menyarankan Ubud mimpi untuk pelancong! Ini hangat, ramah dan ramah keluarga tinggal di lantai bawah rumah dan baru dibuka lantai atas (dua kamar) untuk pelancong. Anggota keluarga juga menjalankan beberapa hotel dan homestays di wilayah (Ubud Bungalow, dll.).   Pemesanan adalah mudah - mereka segera menjawab melalui email. Kamarku itu besar dan bersih, pendingin udara dan penggemar, tempat tidur yang nyaman, bersih kamar mandi, WiFi gratis, dan saya juga punya akses ke kolam renang. Mereka bahkan membuat saya sarapan setiap pagi, dan membawanya ke saya di balkon yang menghadap ke lingkungan yang subur. Tenang, dan saya merasa sangat aman bahkan sebagai seorang gadis muda yang bepergian sendirian. Keluarga menjemputku, membawa saya pada tur dekat candi dan…",5
41,Ubud Dream,"Selama kami 4 hari di Ubud kami tinggal di ini bagus dan tenang homestay kecil. Keluarga adalah welcomming kami dengan tangan terbuka. Setelah hari wisata Bali tengah itu bagus untuk mendapatkan rumah pertemuan keluarga, yang mengambil waktu untuk ngobrol bercerita tentang negara dan budaya mereka. Anda tidak akan mendapatkan bahwa banyak tempat-tempat lain.  Homestay bahkan memiliki WIFI gratis, tetapi sebagai wa tidak membawa komputer kita sendiri dengan kita, kita tidak menggunakan fasilitas ini. Kami tinggal di ruangan itu luas dan bersih. Makan sarapan yang baik-baik saja di balkon tidak membuat pengalaman kurang mengesankan! Kita dapat sangat merekomendasikan homestay indah ini untuk masa depan visiters di Ubud, Bali!! -beberapa 30 tahun dari Denmark.",4
42,Ubud Dream,"Ubud mimpi itu benar-benar indah. Saya sudah mulai liburan saya di Ubud dengan teman-teman tapi ketika mereka kembali ke Australia, saya memutuskan untuk pindah keluar dari sebuah hotel dan ke tempat tinggal. Ubud mimpi direkomendasikan oleh pemilik hotel. Itu yang terbaik! Titik dan Kumong tidak mungkin lebih ramah dan menyambut. Mereka membuat saya yakin memiliki akses ke segala sesuatu dan apa-apa yang saya inginkan dalam Ubud, membuat saran yang indah, membantu dengan tiket dan transportasi. Rumah indah di gaya Bali yang sangat modern. Itu terletak cukup hanya jauh dari Monkey Forest Road untuk memberikan rasa kedamaian. Di malam hari Anda bisa mendengar musik gamalan dalam jarak dari Bait Suci lingkungan. Dan belum setelah berjalan-jalan pendek, aku tepat di tengah-tengah…",5
43,Ubud Dream,"Ubud mimpi adalah salah satu tempat terbaik yang kami tinggal di di Bali. Ini dikatakan, karena indah menyambut, bantuan dalam mengatur perjalanan dan wisata, dan hanya umumnya keramahan lokal dan wawasan yang Anda tidak bisa dari hotel besar. Itu memberi kami kesempatan yang baik untuk mendapatkan lebih dekat dengan penduduk setempat, dan bertukar cerita kehidupan di Bali. Keluarga ini sangat bicara dan menawan. Mereka menawarkan banyak informasi tentang budaya dan keyakinan agama.   Ruangan kami memiliki itu bersih, dan sangat nyaman. Ada tidak ada udara Con di ruang tapi pada malam itu mendapat cukup dingin bahwa kita tidak perlu satu cara apapun. Belum lagi tingkat yang baik untuk ruang.   Sarapan kami punya di pagi hari sangat baik, duduk di teras yang menghadap lapangan…",5
44,Ubud Dream,"Aku senang tinggal dengan Komang, Titik dan keluarga dan itu benar-benar membuat perjalanan saya. Homestay indah yang ditetapkan di jantung kota Ubud, aku merasa benar di rumah langsung dalam properti mereka bersih dan indah berangkat hanya cukup jauh kembali jalan utama untuk memberikan perasaan damai tetapi hanya beberapa menit dari restoran besar, belanja, dan kafe. Ruangan yang bersih, nyaman, dan sarapan (termasuk) bervariasi setiap hari dan selalu lezat. Dimaksudkan saya satu malam menginap berubah menjadi empat dengan ini menyambut keluarga. Layanan taksi Komang juga diselenggarakan dari Denpasar, perjalanan hiking di gunung berapi, dan saya sewa skuter, semua pada harga yang baik. It was great untuk perjalanan di tempat yang begitu budaya berbeda dan unik dan merasa…",5
